,date,cat,co,headline,text,url,week
19958,2006.07.30. 오후 9:27,부동산,파이낸셜뉴스,집걱정 없는 사회 만든다매입임대주택，도시빈민의 ‘주거대안’,“여기 아니면 어떻게 살았을까 아찔해요.” 폭우가 쏟아진 지난 27일 오후. 서울 강서구 화곡본동 임대 다가구 주택에 거주하는 주중일씨 43 가 기자를 마중 나와 안도의 표정을 지으면서 한 말이다. 기자와 함께 방문한 대한주택공사 김태근 주거복지팀 차장에게 “이전에 살던 집은 이미 이 정도 비가 왔으면 물난리가 났을 것”이라면서 “잘 살게 해줘서 감사하다”는 말을 연신 해댔다. 이 집은 주공이 기존 주택을 매입해 도시빈곤층들을 대상으로 임대한 다가구 임대주택이다. 지하철 5호선 화곡역에서 걸어서 10분 이내 거리로 저소득층이 현재의 직장 생활을 지속하면서 향후 일반 주거로 옮길 기반을 마련해 주기 위한 가장 현실적인 주거 형태라는 평가를 받는다. 주씨는 이 주택 9평짜리 반지하에 홀로 거주하고 있다. 임대조건은 보증금 147만원에 월 임대료 2만9000원이다. 이 주택에는 12가구가 거주하는 데 1가구만 제외하면 모두 주공으로부터 임차해 사용하고 있다. 방 셋에 여러 식구가 모여 사는 경우부터 주씨처럼 혼자 사는 경우 등 다양한 가구가 모여 산다. 보증금 143만원∼543만원에 월 임대료 2만9000원∼14만4000원만 내면 거주할 수 있으니 수입이 거의 없다시피 해도정부 지원금만으로도 비용을 댈 수 있을 정도다. 주씨는 이 임대 주택의 계단 청소 쓰레기 처리 등을 담당하는 관리인이다. 관리 일을 하는 대가로 월세 면제 혜택을 받는다. 소일거리 삼아 건물 청소를 하면 월세도 면제해 주니 보증금만으로 집 걱정 없이 살 수 있어 더없이 편하다. “전기 가스 수도 등 다른 비용도 2만원을 안 넘어요. 요즘 직장을 잃었는데 머물 집이 안정적이니까 이보다 행복할 수 없습니다.” 주씨가 이곳에서 머물 수 있게 된 것은 왼쪽 다리에 의족을 달았고 한쪽 귀도 잘 들리지 않는 1급 장애인이어서다. 기초생활수급자로서 어렵게 생활하다가 지난해 초 주공에서 주택을 매입해 도시빈곤층에게 제공하는 ‘주거복지사업’이 있다고 먼저 연락이 와 신청한 것이 이곳에 살게 된 계기가 됐다. “여기 살기 전엔 폭우가 내리면 물이 차서 고생이 심했어요. 습기가 많아지면 전열기구도 제대로 쓰지 못했어요. 그런데 지금은 그런 걱정이 없어서 너무 좋습니다. 이젠 다른 걱정은 없어요. 빨리 다시 취직해서 독립할 준비를 해야죠.” 주씨는 지난해 9월 이곳에 입주하기 전에는 500만원짜리 지하 전셋방에 살았다. 그곳의 생활은 정말 사는 게 사는 게 아니었다고 주씨는 회고한다. 비만 오면 물이 차고 위험해 전기도 못 켰다. 습기가 차서 곳곳에 곰팡이가 생겼고 수십 벌의 옷을 곰팡이 때문에 버려야 했다. 가스 전기도 제대로 사용하기 힘들었다. “500만원짜리 전셋집이었으니까요. 그래도 그런 집에서 13년간 살다가 여기 오니까 너무 좋아요. 전세 값 500만원으로 세탁기도 사고 냉장고도 사고 여기 보증금을 냈죠. 장판 벽지도 너무 깨끗하고 정말 사는 것 같습니다.” 이곳에서 주씨는 앞으로 6년간 살게 된다. 2005년 입주했으니까 2011년까지 거주할 수 있는 셈이다. 주씨는 희망이라면 지금의 임대주택 거주 기간이 6년인데 그 안에 기반을 마련하는 것이라고 말했다. 주씨는 일반 임차인들과 함께 사는 이런 매입임대 주택은 자녀들이 있는 가구들이 상당히 선호한다고 한다. 아이들이 정부 보조를 받는 임대주택이라고 소외감을 느끼면서 살지 않아도 되기 때문이다. 대부분 이곳에 머무는 6년 동안 독립할 기반을 마련해 나가는 희망을 품고 집 걱정없이 살아갈 수 있다는 것. 핸드백 기술자인 주씨도 최근 경기 침체로 일자리를 잃었지만 희망을 놓지 않는다. 살 집이 안정됐기 때문에 차분하게 새로운 직장을 알아보고 있는 중이다. 그는 가을이 되면 다시 문을 여는 핸드백 공장들이 많아지기 때문에 그때까지는 새 직장을 잡아 독립의 발판을 마련하겠다는 희망을 갖고 산다. 주씨는 이날 방문한 주공 김 차장에게 보여줄 곳이 있다며 화장실을 보여줬다. 한쪽 다리가 장애인 그로서는 화장실을 이용하면서 자꾸 세면대를 팔로 집어 세면대가 무너져 내리려고 한다는 것. 김 차장은 세면대 사진을 찍어 서둘러 수리해 주는 것은 물론 손잡이를 만들 수 있는 방안도 찾아보겠다고 답변했다. “어려움이 있으면 이렇게 주공에 이야기 하면 다 해결해 줍니다. 돈이 하나도 들지 않아요. 주공 직원들이 일주일에 한번씩 들러 싱크대 화장실 보일러 등 모두 점검하고 이것저것 이야기 하고 돌아갑니다.,https://news.naver.com/main/read.nhn?mode=LSD&mid=shm&sid1=260&oid=014&aid=0000236504,30
19959,2006.07.30. 오후 8:03,부동산,한겨레,내 청약점수에 맞는 전략과 점수 높이기,한겨레 만 40살 부양가족 4인 무주택 10년 청약통장 10년 500점 되면 당첨 1순위 나이와 부양 가족수가 많고 무주택 기간이 긴 사람이 아파트 당첨 우선권을 갖는 청약 가점제가 2008년부터 도입됨에 따라 청약통장 가입자들의 내집마련 전략에 수정이 불가피해졌다. 수요자들로서는 2008년 시점에 맞춰 자신의 청약 점수를 한번 계산해보고 점수에 따라 청약 전략을 새로 짜는 게 중요하다. 전문가들은 점수가 낮은 젊은 사람들의 경우 공공택지에 지어지는 중대형과 민간택지의 25.7평 이하 중소형에까지 가점제 적용이 확대되는 2010년 이후까지 내다보고 장기전략을 세워야 한다고 조언한다. 부양가족 많은 무주택자 전용면적 25.7평 이하 청약예금 및 청약부금 가입자로서 나이가 많고 부양 가족수가 많으면 절대 유리하다. 만일 2008년 이후 만 40살 부양가족 부모 포함 4인 무주택 기간 10년 청약통장 가입기간 10년 이상이 되는 사람이면 가점제 점수가 535점 만점에 500점을 따게 된다. 이 정도면 어떤 지역에서도 당첨 1순위권에 진입할 것으로 예상된다. 이들은 판교 새도시 이후 최고 인기지역으로 꼽히는 송파새도시 2009년 분양 를 비롯해 유망지역 위주로 청약하면 된다. 다만 송파 새도시만 기다리는 것은 다소 위험하다. 송파 새도시의 경우 중소형의 상당수가 공영개발에 포함될 가능성이 높아 25.7평 이하 예·부금 가입자에게 돌아올 몫이 적거나 아예 없을 공산이 크기 때문이다. 공영개발 대상 중소형 물량은 청약저축 가입자에게 공급된다. 1주택 소유자 주택을 갖고 있는 사람은 배점 비중이 높은 무주택기간 부문에서 0점을 받게 돼 점수가 크게 낮아진다. 인기지역에서 당첨될 확률은 ‘제로’에 가깝다. 이들은 2008년 이전에 분양예정인 파주 김포 수원 이의 새도시 등에 청약하는 것이 방법이다. 또 재개발·재건축 아파트 등 2010년 이전까지 가점제가 적용되지 않는 민간택지 중소형을 노리는 것도 방법이다. 집을 처분하고 무주택자가 돼 가점을 높이는 방법도 생각해볼 수 있다. 가구소득과 부동산 자산이 가점제 항목에 추가되는 2010년 이후에도 무주택 기간은 배점이 높다. 따라서 조금 길게 보면 실속없는 소형주택을 끌어안고 있기보다는 이를 팔아 점수를 높여서 원하는 주택에 청약을 하는 게 유리할 수 있다. 중대형 청약예금 가입자 전용 25.7평 초과 중대형 청약예금 가입자도 가점제가 중요해졌다. 인기 공공택지의 경우 중대형 청약자의 채권입찰금액이 같으면 무주택 기간이 길고 부양 가족수가 많은 사람이 당첨된다. 중대형 통장 가입자들은 집을 넓혀가려는 유주택자가 대부분이기 때문에 무주택자라면 2008년 이후 중대형을 분양받기가 한결 수월해질 전망이다. 반대로 1주택을 갖고 있는 중대형 수요자라면 2008년 전에 청약하는 게 유리하다. 다음달 경기 판교 새도시 중대형을 비롯해 인기지역 청약을 서두를 필요가 있다. 다만 재개발·재건축이나 민간택지 중대형은 가점제가 적용되지 않기 때문에 입지와 분양값을 따져 선별적으로 청약해도 된다. 사회 초년생과 독신자 새로 청약통장에 가입하려는 사회 초년생이라면 청약예금·부금보다는 청약저축이 유리하다. 청약저축은 공영개발로 지어지는 중소형 분양아파트 뿐만 아니라 국민임대나 민간임대 등 청약기회가 점차 넓어지고 있기 때문이다. 또 청약저축은 이미 무주택 기간과 납입액 등을 따져 당첨자를 가리고 있어 이번 청약제도 개편의 영향은 거의 받지 않는다. 나이가 어리고 부양 가족수가 적어도 가입기간이 3년 이상만 되면 웬만한 지역에서는 아파트를 분양받을 수 있다. 청약저축은 청약예금으로 전환할 수 있는 것도 장점이다. 따라서 사회 초년생이라면 집장만을 위해 청약저축은 필수적으로 가입하는 게 좋다. 가점제 도입으로 독신자나 자녀가 없는 젊은 부부 등이 가장 불리해졌다. 지금까지는 5년 이상 무주택 만 35살 이상이기만 하면 전용 25.7평 이하 주택을 우선공급받을 수 있지만 앞으로는 부양가족 점수로 인해 후순위로 밀려나기 때문이다. 이들의 경우 2008년 이전에 공공택지나 민간택지 25.7평 이하 아파트를 서둘러 분양받을 필요가 있다. 그렇다고 2008년 이후에는 청약을 포기해야 하는 것은 아니다. 이들의 경우 부양가족 점수는 낮지만 무주택 기간을 잘 관리하면 점수를 어느정도 높일 수 있다. 김혜현 부동산114 부장은 “입주할 목적이 아니라 당첨에 따른 투자수익을 노리고 청약통장에 가입했던 주택 소유자만 아니라면 당장 가점제 점수가 낮다고 청약통장을 해지할 필요는 없다”고 말했다. 최종훈 기자 cjhoon hani.co.kr 온라인미디어의 새로운 시작. 인터넷한겨레가 바꿔갑니다. ⓒ 한겨레 hp www.hani.co.kr 무단전재 및 재배포 금지 한겨레는 한국온라인신문협회 www.kona.or.kr 의 디지털뉴스이용규칙에 따른 저작권을 행사합니다.,https://news.naver.com/main/read.nhn?mode=LSD&mid=shm&sid1=260&oid=028&aid=0000165034,30
19960,2006.07.30. 오후 8:03,부동산,한겨레,7월 31일 부동산 갤린더,한겨레 온라인미디어의 새로운 시작. 인터넷한겨레가 바꿔갑니다. ⓒ 한겨레 hp www.hani.co.kr 무단전재 및 재배포 금지 한겨레는 한국온라인신문협회 www.kona.or.kr 의 디지털뉴스이용규칙에 따른 저작권을 행사합니다.,https://news.naver.com/main/read.nhn?mode=LSD&mid=shm&sid1=260&oid=028&aid=0000165033,30
19961,2006.07.30. 오후 8:03,부동산,한겨레,7월 31일 부동산 파일,한겨레 홍제동 45 56평형 잔여가구 금호건설은 서울 서대문구 홍제동에 ‘인왕산 금호 어울림’ 아파트 잔여 가구를 분양하고 있다. 45 56평형 123가구로 분양값은 평당 1120만 1180만원이다. 계약금을 1천만원만으로 낮춰 계약자의 초기 부담을 줄였으며 지난 6월 완공돼 바로 입주가 가능하다. 서울지하철 3호선 무악재역이 걸어서 3분 거리에 있고 내부순환로 진입도 쉽다. 02 720 1611. 군산 수송지구 1114가구 한라건설은 전북 군산시 수송지구에 짓는 ‘한라비발디’ 아파트를 분양한다. 34 97평형 1114가구의 대단지로 2008년 12월 입주예정이다. 전 가구를 남향으로 배치해 일조권과 조망권을 극대화했으며 97평형은 복층형 펜트하우스로 꾸몄다. 단지 안에 피트니스센터 빨래방과 실버룸 등이 설치되며 영어마을 프로그램도 운영할 계획이다. 모두 7천여가구가 들어설 예정인 수송지구는 전주 군산 고속화도로 서해안고속도로가 가깝다. 063 465 0066. 온라인미디어의 새로운 시작. 인터넷한겨레가 바꿔갑니다. ⓒ 한겨레 hp www.hani.co.kr 무단전재 및 재배포 금지 한겨레는 한국온라인신문협회 www.kona.or.kr 의 디지털뉴스이용규칙에 따른 저작권을 행사합니다.,https://news.naver.com/main/read.nhn?mode=LSD&mid=shm&sid1=260&oid=028&aid=0000165032,30
19962,2006.07.30. 오후 8:03,부동산,한겨레,인기택지 노리려면 집 처분도 고려,한겨레 주택 수요자라면 새로 도입되는 청약 가점 항목을 잘 알고 지금부터 자신의 점수를 관리해 나가는 게 중요하다. 청약 점수를 높이기 위해 반드시 알아두어야 할 것들을 문답으로 알아본다. 자녀를 입양해도 가점을 받나 입양한 자녀도 자녀수에 똑같이 포함된다. 다만 여기서 자녀는 민법상 미성년자 만 20살 미만 만 인정된다. 가구주 나이 기준은 만 나이가 기준이다. 주택의 입주자 모집공고일 현재 만으로 몇 살인지를 따지게 된다. 가구주 나이는 30살 미만 45살 이상까지 5개 등급으로 나눠진다. 주민등록상 부모와 합치면 가점을 받나 청약 가점제는 현행 주민등록제의 틀 안에서 움직일 수밖에 없다. 자녀와 부모 모두 주민등록상 동일 가구 또는 동거 배우자의 부모 형식을 취하고 있으면 부양가족으로 인정한다. 그러나 2010년부터는 가구소득과 부동산 자산이 가점제 항목에 추가된다는 점을 유의해야 한다. 부모 명의의 부동산 자산과 소득도 합산되므로 점수가 불리해질 수 있기 때문이다. 독신자인데 결혼하면 점수가 올라가나 결혼으로 생긴 배우자는 부양가족 수에 포함되지 않는다. 아이를 낳거나 부모 배우자 부모 포함 를 모셔야 점수가 올라간다. 집이 있으면 처분하는 것이 유리한가 인기있는 공공택지에서 아파트를 분양받기 위해서는 그렇다고 봐야 한다. 이는 전용 25.7평 이하 주택과 중대형 주택에 모두 해당한다. 25.7평 이하 주택의 무주택 기간 배점이 비교적 높은데다 중대형도 청약자의 채권입 금액이 같은 경우 무주택자가 절대 유리하기 때문이다. 2009년 분양예정인 송파새도시 25.7평 이하에 당첨되려면 몇 점 정도 돼야 하나 특정지역의 청약 가점 커트라인을 예측하기는 쉽지 않다. 그러나 지난 3월 경기 판교 새도시 무주택 우선공급 청약 결과 등으로 미뤄볼 때 송파새도시는 535점 만점에 대략 450점 이상이라야 당첨권에 들 것으로 예상된다. 최종훈 기자 온라인미디어의 새로운 시작. 인터넷한겨레가 바꿔갑니다. ⓒ 한겨레 hp www.hani.co.kr 무단전재 및 재배포 금지 한겨레는 한국온라인신문협회 www.kona.or.kr 의 디지털뉴스이용규칙에 따른 저작권을 행사합니다.,https://news.naver.com/main/read.nhn?mode=LSD&mid=shm&sid1=260&oid=028&aid=0000165031,30
19963,2006.07.30. 오후 7:27,부동산,파이낸셜뉴스,강남등 버블세븐 지역 8월 담합조사,정부가 서울 강남과 목동 경기 분당·용인·평촌 등 이른바 버블세븐 지역을 포함한 2차 담합조사를 8월에 전격 실시한다. 이는 1차 조사때 버블세븐 지역이 한 곳도 포함되지 않은데 대한 형평성 시비 해소차원에서 이뤄지는 것이다. 하지만 지난 1차 담합아파트 목록 발표 이후 부녀회의 담합활동이 수면 아래로 잠복 예전보다 더욱 교묘해져 실제 추가 적발에는 난항을 겪을 것으로 보인다. 30일 건설교통부에 따르면 지난 21일 서울과 경기권 일대 58개 아파트의 담합 아파트 목록과 실거래가 공개 이후 주무부처인 건교부 토지관리팀에는 22∼23일 이틀 동안 100건이 넘는 담합신고가 접수됐으며 시간이 지날수록 늘어 현재는 140건이 넘어서고 있는 것으로 알려졌다. 건교부는 이에 따라 신고된 담합의혹 아파트 단지를 조사하기 위한 분석작업에 들어간 상태다. 지난 1차 조사에서 총 96개 민원을 접수 58개 아파트를 대상으로 조사를 실시했던 것과 비교하면 2차 조사때는 대상지역이 폭이 훨씬 늘어날 것이라는 게 건교부측의 예상이다. 특히 주목할 점은 이번에는 지난 1차조사에는 담합신고가 한 건도 없어 조사를 실시하지 못했던 서울 강남·목동 경기 분당·용인 등 소위 버블세븐 지역의 아파트도 10곳 이상 신고가 접수돼 이들 지역에 대한 대대적인 담합조사가 불가피할 전망이다. 건교부 관계자는 강남지역에서 역삼동 송파 일대를 비롯해 양천구 목동 경기 분당과 평촌 용인 지역 등 버블세븐 지역에서 지역별로 2∼3건씩 신고사례가 접수돼 이번 2차 조사에서 이 아파트들을 포함시켜 담합여부를 가리게 될 이라고 말했다. 2차 담합조사는 신고 목록과 실제 담합가능성 등을 가려낸 후 단속인력을 구성하는 8월 초·중반께 이뤄질 전망이다. 담합아파트로 판명나면 1차때와 마찬가지로 실거래가가 공개되고 정보업체들 목록이 통보돼 4주간 시세제공이 중지된다. 하지만 부녀회 담합 원조로 일컬어지는 버블세븐 지역에서의 조사가 실효성을 거둘수 있는지는 의문이다. 1차 조사 이후 버블세븐 지역 담합의혹 단지들 중 상당수가 담합을 촉구하는 유인물과 현수막을 철거하는 등 증거를 없앴기 때문이다. 건교부측은 설사 물증을 확보하지 못했더라도 주변 중개업소와 지자체 담당자들과의 인터뷰를 통해 사실만 확인되면 실거래가를 공개할 수는 있다 며 하지만 1차조사 때보다 적발이 더 어려워진 것은 사실 이라고 밝혔다. newsleader fnnews.com 이지용기자 집값 담합단지 암암리 작전 계속 건설교통부의 집값 담합 단지 블랙리스트 발표 이후 해당 아파트 단지에서 담합을 부추기기 위한 플래카드나 전단은 사라졌다. 하지만 주민들은 정부가 버블세븐이라며 지목했던 지역은 한 곳도 포함되지 않는 등 표적조사 의혹을 제기하며 은밀한 담합행위는 여전한 상황이다. 담합 단지로 지목돼 시세정보 제공이 중단된 아파트 단지의 시세도 거의 움직이지 않고 보합세를 보이고 있다. 담합 은밀해지고 집주인 배짱 호가 여전 담합 단지가 많이 포함된 경기도 부천 상동 중동지역은 여전히 호가가 높다. 백송마을 LG·SK 48평형의 경우 6월에 거래된 실거래가 수준은 5억원대 초·중반이지만 현재 호가는 8억원 선에 형성돼 있다. 현지 S부동산 관계자는 비수기인 탓에 움직임은 작지만 예전 거래가격과 매도가격의 차가 커 매수자가 있다고 해도 쉽게 살 수 있는 수준이 아니다 면서 가을 이사철이 가까워봐야 매도 매수가격을 가늠해 볼 수 있을 것 같다 고 말했다. 상동 중동은 이번에 한아름마을 백송마을 라일락마을 보람마을 포도마을 무지개마을 등 많은 지역의 아파트가 집값 담합 리스트에 올랐고 실제 집주인들의 담합으로 상반기에만 40∼50평형대 아파트가 1억∼2억원가량 오르는 등 집값 변동폭이 컸던 곳이다. 경기 일산 덕양구 행신1·3동 화정1동 등 몇몇 아파트가 담합 아파트로 지목된 고양지역은 발표 이후 담합 작전이 암암리에 진행되고 있다. 행신동의 한 중개사는 실제 거래된 가격은 평당 1000만원 전후였는데 집주인들은 여전히 평당 1200만∼1400만원을 고수하고 있다 며 최근에는 한 주민이 전화를 해서 집값이 너무 낮은 것에 대해 불만을 터뜨리기도 했다 고 분위기를 전했다. 서울 동작구 사당동 GS자이 역시 42평형의 경우 최근 3개월 동안의 실거래가격이 4억7000만∼5억5000만원 수준이지만 호가는 6억원 이상에 형성돼 있다. 4주간 시세제공 중단 후 연장 여부 결정 건교부 토지관리팀 김홍기 사무관은 이미 발표한 58개 단지는 계획대로 4주간 시세 공개를 중단한 뒤 추가 연장 여부를 개별 아파트마다 최종 결정할 계획 이라고 설명했다. 그는 또 담합 단지들 발표 이후 일부 단지의 담합 움직임이 여전히 계속되고 있다는 신고가 들어오고 있다 고 덧붙였다. 건교부는 이를 바탕으로 다음달 강도높은 2차 담합조사를 실시할 예정이다. 한편 정부의 담합 결과 발표 후 국민은행과 한국감정원은 해당 단지들에 대해 매매가뿐만 아니라 전세금도 공개하지 않고 있는 상태다. 또 부동산114 등 부동산정보제공업체는 매매가를 제외한 전세금만 온라인에 표시해 놓고 있다. 부동산114 김규정 차장은 정부가 집값 담합실태조사를 1차에 이어 2차도 발표할 예정이어서 그동안 담합으로 시세에 영향을 주었던 불합리한 부분은 다소 해소될 것으로 보인다 고 분석했다. 전문가들은 그러나 정부의 이런 발표에도 해당지역 집주인들은 여전히 높은 집값을 고수하고 있고 집주인이 제시한 가격에 거래가 이뤄지면 곧바로 실거래가로 이어지는 악순환이 계속될 수 있다고 우려했다. bada fnnews.com 김승호기자 계속되는 논란… 버블세븐은 왜 빠졌나 정부의 집값 담합아파트 발표에서 버블세븐 지역 아파트는 왜 빠졌을까. 정부가 집값에 상당한 거품이 끼었다며 지목했던 지역 아파트가 빠진 것에 대해 실수요자들이 여전해 궁금해 하고 있다. 결론부터 말하자면 담합방식의 차이 때문이었다. 지난번 담합발표때 포함됐던 경기도 부천 중동이나 산본 등은 플래카드를 내걸고 전단지를 붙이는 방식을 택했다. 담합을 했다는 것을 만천하에 알린 것이다. 하지만 서울 강남과 송파·목동 경기도 용인·분당 등 이른바 버블세븐 지역 아파트는 달랐다. 반상회나 부녀회 모임을 중심으로 입을 맞춰가며 은밀하게 담합을 주도했다. 일부 단지는 플래카드나 전단지를 내붙이기도 했지만 정부가 조사할 것이라는 소문이 돌면서 재빨리 회수하는 등 발빠르게 대응해 적발되지 않았다. 대표적인 버블세븐 지역인 양천구 목동의 B부동산 관계자는 담합을 해서 올렸다는 얘기가 여기저기서 흘러나오고 있다 면서 주변에 새 아파트들이 들어서니 한 달 전에 소형아파트 단지 주민들이 담합을 해 가격 인하를 인위적으로 막았다 고 전했다. 익명을 요구한 강남의 한 업소측은 사실 강남 집주인들은 별로 팔 생각도 없으면서 물건을 거뒀다가 다시 내놓을 때마다 수천만원씩 올렸다 면서 하지만 이러한 경우는 정부 규제가 불가능해 그냥 넘어갔고 최근 소외지역에서 눈에 보이게 행한 담합만 단속을 받고 있다 고 했다. 특히 정부의 1차 담합아파트 조사 이후 버블세븐 지역은 담합이 지화하 되고 있어 단속이 쉽지 않은 상황이다. 경기도 분당 야탑동에 있는 D공인측은 인근 몇몇 단지가 평당 1400만원을 받자 는 플래카드를 붙였다가 급히 거둬들이고 담합가격 이하로는 팔지 말자고 암묵적으로 합의했다 고 귀띔했다. 송파 방이동의 G공인측은 솔직하게 담합은 오래 전부터 계속 있어 왔다. 다만 최근처럼 내놓고 하지 않을 뿐이다 면서 반상회나 부녀회 모임에서 주변보다 저평가돼 있다는 얘기가 나오면 자연스레 담합이 이뤄진다 고 말했다. 내집마련정보사 함영진 팀장은 기존에 적발된 지역 아파트 단지의 경우 단지 내 실거주자 중 상당수가 서민층 세입자가 많아 신고가 활발히 이뤄졌지만 버블세븐 지역 아파트는 세입자 비율이 상대적으로 낮고 집주인들도 대부분 중산층 이상이어서 담합에 무감각한 것 같다 고 지적했다.,https://news.naver.com/main/read.nhn?mode=LSD&mid=shm&sid1=260&oid=014&aid=0000236596,30
