,date,cat,co,headline,text,url,week
118239,2009.01.07. 오후 6:05,부동산,파이낸셜뉴스,청약문턱 낮추고，분양금 나중에..주택시장 새 풍속도,주택시장이 장기 침체 국면을 걸으면서 아파트 분양 시장의 풍속도도 빠르게 변하고 있다. 상대적으로 분양가가 저렴하고 안정성이 높아 그동안 높은 인기를 구가했던 신도시 등 공공택지지구에서도 지방공기업 등 공급주체들이 미분양을 우려해 청약자격을 분양 초기부터 대폭 완화하는가 하면 선분양제도에서 보기 힘든 분양가 후불제가 자리를 잡고 있다. 이에 비해 자금난에 몰린 민간건설사들은 분양 판촉을 위해 과거 자주 활용하던 원금보장제 분양 분양가 리콜제 등의 마케팅은 자취를 감췄다. 공공부문도 분양 마케팅 본격화 7일 건설부동산업계에 따르면 이날까지 이틀간 청약저축가입자를 대상으로 1순위 청약을 받은 용인지방공사의 광교신도시 ‘이던하우스’는 1순위 모집에서 납입인정금액을 청약통장 가입기간별로 구분하지 않고 신청을 받고 있다. 청약저축에 가입해 월납입금을 24회 이상 낸 무주택가구주라면 날짜 구분 없이 1순위 청약을 모두 받아주고 있다. 주택경기가 좋을 때는 청약자가 몰릴 것에 대비해 청약저축 1순위라도 납입인정금액을 1300만원 800만원 480만원 등으로 구분해 날짜별로 따로 신청접수를 받았던 종전과 완전히 달라진 모습이다. 이런 추세는 다른 유망 공공택지에도 확산될 전망이다. 위례 송파 신도시와 경기 성남 판교신도시 서울 은평뉴타운 보금자리 주택 등 공공택지 간에도 청약경쟁이 치열하다 보니 모두 납입인정금액을 나눠 청약자를 선별하기보다 1순위 자격만 갖췄다면 모두 청약을 허용하는 쪽으로 가닥이 잡힐 전망이다. 후불제 시스템으로 변화 분양대금을 미리 받는 ‘선분양제도’에서는 보기 힘든 분양대금 후불제가 조금씩 자리 잡는 것도 최근 분양시장의 새 풍속도다. 중도금 마련에 어려움을 겪고 있는 청약자들을 위해 초기 계약금을 10% 정도만 내고 입주 때 한꺼번에 90%를 내도록 하는 사업장이 늘어나고 있는 것. 살던 집이 팔리지 않아 신규 분양을 통한 갈아타기에 애로를 겪고 있거나 장기적으로 자금여력은 있지만 당장 유동성이 막힌 청약예정자를 잡기 위해 건설사들이 도입하고 있는 고육지책이다. 공사비용을 계약자의 분양대금으로 충당하던 선분양 형태가 사실상 후분양 사업으로 전환되고 있는 셈이다. 서울 동작구 사당동 이수자이 입주 2010년 12월 은평구 불광동 북한산래미안2단지 151㎡ 입주 2010년 8월 등이 이런 조건이다. 서초구 반포동 래미안퍼스티지 입주시기 2009년 7월 경기 부천시 중동 팰리스카운티 2008년 12월 등 재건축 후분양 단지도 중도금을 아예 받지 않고 분양대금의 90%를 모두 입주 때 잔금으로 내면 된다. 미계약·계약 취소분 건설사 홈페이지서 직접분양 최근 건설사들은 계약 해지 가구를 수시로 자사 홈페이지를 통해 팔고 있다. 미분양·미계약뿐만 아니라 이미 계약이 100% 마감된 사업장에서의 계약해지가 많다 보니 수시로 홈페이지를 통해 청약신청과 공개추첨이 진행된다. 경기 용인 흥덕지구 용인지방공사 이던하우스는 지난해 12월 계약취소분 9가구에 대한 청약신청을 받았다. 포스코건설은 인천 송도국제도시에서 2005년 분양했던 더샵퍼스트월드의 외국인 특별공급 잔여분 74가구 155∼421㎡ 를 이달 일반분양한다. 공공택지에서도 지난해 7월 서울 은평뉴타운에서 주인을 찾지 못한 124가구의 재분양이 12월 SH공사를 통해 실시됐고 대한주택공사도 경기 용인 구성지구 미계약가구에 대한 선착순 계약 분양을 새해 벽두부터 시작했다. 원금보장형·분양가 리콜제 등 자취 감춰 주택업체는 청약률을 끌어올리기 위해 그동안 금융혜택과 경품 옵션 등을 제공하고 원금보장 및 프리미엄보장 그리고 분양가 리콜 등의 마케팅 기법도 도입했었다. 분양가리콜제는 입주할 때의 시세와 분양가와의 차익을 보상해주는 제도이며 프리미엄보장제는 웃돈을 보장해 주는 것이다. P사는 지난해 10월 전북 전주 중화산동의 분양에 분양가 리콜제를 D사와 S사는 강원 원주시 흥업면과 전북 군산 수송동에서 원금 보장제를 실시했다. 하지만 향후에는 건설사가 이 같은 파격적인 분양혜택을 내놓기 힘들 전망이다. 주택가격 하락폭이 커 건설사의 재무위험이 커질 가능성이 높아져서다. 부동산써브 함영진 부동산연구실장은 “단기적으로 부동산시장 회생에 대한 신호가 명확하지 않은 상황에서 분쟁의 소지가 있는 파격 분양혜택은 기대하기 어려운 상황”이라면서 “그런 사업장이 있더라도 청약자는 그 회사의 자금사정부터 살펴보고 계약에 응해야 할 것”이라고 조언했다.,https://news.naver.com/main/read.nhn?mode=LSD&mid=shm&sid1=260&oid=014&aid=0002076888,157
118240,2009.01.07. 오후 6:03,부동산,한국경제TV,건설사 구조조정 ‘좌불안석’,앵커 부실 건설사 퇴출 시한이 당초 예상보다 크게 앞당겨지면서 긴장감이 고조되고 있습니다. 정부가내놓은 구조조정 방안이 반드시 불리하지 않다는 반응 속에 채권 은행의 눈치보기가 극에 달하고 있습니다. 박준식 기자의 보도입니다. 기자 이르면 다음주 퇴출 건설사의 윤곽이 드러납니다. 금융당국이 은행들에게 퇴출 대상을 17일까지 늦어도 23일까지 확정하라고 통보했습니다. 구조조정 시기를 앞당긴 것은 부실 기업을 서둘러 정리해 경기 침체에서 벗어나는 분위기를 연초부터 조성하자는 판단입니다. 대상 업체는 금융권의 신용공여액이 500억원 이상이거나 주채권은행의 신용공여액이 50억원 이상인 300여개 건설사. 전문가들은 20개 안팎의 건설사를 구조조정 대상으로 점치고 있습니다. 그리고 이 중 2 3개 업체는 당장 퇴출될 것으로 내다봤습니다. 채무 비중이 높아 재무 항목에서 낮은 점수가 예상되는 중소형 업체들의 불안감은 더욱 큽니다. 전화인터뷰 A건설사 관계자 “증권사가 재무항목을 가지고 평가한 내용을 가지고 조합원들 항의전화 하는 등 어려움이 많다” 중대형 건설사들도 안심할 상황은 아닙니다. 비재무 평가 항목 비중이 60%에 달해 채권 은행 평가에 따라 최악의 경우 생사가 갈릴 수도 있습니다. 일부에서는 퇴출이 불가피하다면 하루라도 빨리 결정나 업계 전반의 불확실성이 해소돼야 한다고 주장합니다. 전화인터뷰 B건설사 관계자 “더 미루면 논란만 커져 16일 결정이 나서 재개발 등의 사업도 진행되고조합원이 안정을 찾아야 한다” 한편 부실 업체의 퇴출은 어쩔 수 없지만 가시적인 성과를 위해 지나치게 속도에 집착하거나 무리하게 메스를 가한다면 오히려 시장 불안만 키울 수 있다는 우려도 제기되고 있습니다. WOW TV NEWS 박준식입니다.,https://news.naver.com/main/read.nhn?mode=LSD&mid=shm&sid1=260&oid=215&aid=0000009321,157
118241,2009.01.07. 오후 6:01,부동산,한국경제TV,시프트 임대료 인하되나,앵커 오세훈 아파트 로 불리는 장기전세주택에 대한 실효성 논란이 꾸준히 제기되고 있습니다. 서울시 역시 부랴부랴 대책마련에 나서는 모습입니다. 최서우 기자의 보도입니다. 기자 서울시가 공급하는 장기전세주택 시프트 청약이 이뤄지고 있는 SH공사. 왕십리주상복합 등 163가구에 대한 청약이 진행 중입니다. 접수 첫날 3천명 이상이 몰리면서 20대 1의 경쟁률을 나타내고 있습니다. 신청자 대부분은 주변 전셋값보다 저렴한 가격에 오랜 기간 거주할 수 있다는 점을 믿고 신청에 나섰습니다. 인터뷰 장기전세주택 신청자 신청은 일단 해놓고 주변전세가격을 확인하려고 한다. 싸다고 하니깐 싸겠거니 믿고 신청을 하는거죠. 문제는 최근 집값 하락현상이 지속되면서 전셋값 역시 하락세를 면치 못하고 있다는 점입니다. 이러다 보니 주변 전셋값보다 저렴하게 공급하겠다는 서울시의 당초 취지는 점점 무색해지고 있는 상황입니다. 성북구 정릉동 라온유아파트 공급된 시프트 84㎡ 가격은 1억 4천 5백만원. 최근 이 아파트 일반 전세시세는 1억 5천만원 가량으로 시프트와 별반 차이가 없습니다. 다른 곳 역시 상황은 비슷합니다. 은평뉴타운 1지구에 공급된 84㎡ 시프트 가격은 일반 전세가격은 1억 2630만원. 인근 지역의 전세시세가 1억 3천만원선인 것을 감안하면 별다른 차이가 없는 셈입니다. 상황이 이렇다 보니 시민들의 불만도 높아지고 있습니다. 인터뷰 김명옥 48 만약에 앞으로 부동산가격이 추가적으로 하락하면 시프트 공급가격을 조정할 필요가 있을 것 같아요. 지금 현재가격은 적당하지만 부동산 가격이 좀 더 조정을 받을 경우에는 비싸질 수 있지않냐라는 생각이 들어요. 시프트공급을 맡고 있는 SH공사 역시 이 부분에 공감하는 분위기입니다. 인터뷰 문영수 SH공사 장기전세팀장 기존에 공급한 시프트의 경우 인근 전세가의 80%이하로 공급을 했다. 그동안 전셋값이 내렸다고 하면 서울시와 협의해서 조정해줄 필요가 있다고 봅니다. 서울시는 부랴부랴 대책마련에 나선 상태입니다. 녹취 서울시 주택국 관계자 집값이 자꾸 내려가는데 우리만 모른척하고 있을 순 없잖아요. 그건 잘못된 거잖아요. 계속 전세값이 낮아지면 우리도 대안을 가지고 있습니다. 서울시 관계자에 따르면 부동산 경기 하락이 장기화 될 경우 인근 전세값 기준에 대한 재조정이 불가피하다는 반응입니다. 오세훈 아파트로 불리는 장기전세주택 시프트. 본래 취지를 살리기 위해선 인근 전세가변동에 좀 더 탄력적으로 대응할 수 있는 근본대책이 필요하다는 지적입니다. wowtv news 최서우입니다.,https://news.naver.com/main/read.nhn?mode=LSD&mid=shm&sid1=260&oid=215&aid=0000009320,157
118242,2009.01.07. 오후 6:00,부동산,파이낸셜뉴스,군사보호구역내 건축물 신축 쉬워진다,앞으로 군사보호구역안에서 토지형질 변경과 건축물 신축이 한층 수월해질 전망이다. 법제처는 7일 국방부가 군사보호구역내에서 농지와 임야 등 토지의 형질을 바꾸는 소규모 건축의 경우에도 행정기관이 군과 협의하도록 한 것과 관련해 제기된 민원에 대해 법령해석을 의뢰한 결과 토지형질 변경과 건축신고 사항을 군과 협의할 필요가 없는 것으로 결정됐다고 밝혔다. 현행 ‘군사기지 및 군사시설 보호법 시행령’에는 ‘건축법’상 신고대상인 행위와 신고 대상 건축물의 용도변경 등의 경우 행정기관의 장은 국방부 장관 또는 관할부대장 등과 협의를 하지 않아도 된다고 규정돼 있다. 하지만 기존 대지 외에 농지나 임야 등의 형질을 변경해 건축하는 소규모 건축물의 경우 종전처럼 계속 군과 협의하도록 하는데 대해 민원이 제기돼 왔다. 법제처측은 “군 협의가 면제되는 건축행위를 형질 변경이 없는 토지에서의 건축으로만 한정하는 것은 규제 완화를 통해 국민의 재산권을 보장하고 토지 이용의 불편을 해소하겠다는 군사기지 및 군사시설 보호법의 입법 취지에 반한다”고 밝혔다. 법제처는 또 “건축법상 적법한 요건을 갖춰 건축신고를 하면 토지의 형질변경과 관련된 인·허가도 받은 것으로 간주된다”며 “행정기관장은 군사보호구역 내에서 토지의 형질변경을 포함하는 건축신고를 접수할 경우 국방부 장관 또는 관할 부대장과 협의를 하지 않아도 된다”고 말했다.,https://news.naver.com/main/read.nhn?mode=LSD&mid=shm&sid1=260&oid=014&aid=0002076880,157
118243,2009.01.07. 오후 5:57,부동산,한국경제TV,견본주택 문화공간으로 재탄생,앵커 분양시장이 침체기를 겪으면서 그동안 아파트를 분양하기 위해 만들어졌던 견본주택의 모습이 바뀌고 있습니다. 각 종 문화공연과 지역주민들을 위한 커뮤니티 공간으로 새롭게 태어났습니다. 보도에 박영우 기자입니다. 기자 국내외 유명 작가들의 예술작품이 눈길을 끕니다. 음악을 들으며 향긋한 차를 마시고 조용한 공간에서 독서도 할 수 있습니다. 얼핏 보면 현대미술관과 같은 이곳은 강남의 한 견본주택 전시관입니다. 그동안 단순히 수익창출을 위한 공간으로만 사용되던 견본주택의 모습이 바뀌고 있습니다. 브릿지 박영우 기자 “요즘 같은 분양시장 비수기에는 주택전시관이 아닌 지역 주민들을 위한 복합 문화 공간으로 활용하고 있습니다.“ 아파트 분양을 위해서만 견본주택을 찾았던 예전 모습과는 달리 이제는 지역 주민들의 사랑방 역할을 톡톡히 해내고 있습니다. 인터뷰 박현숙 두산건설 주택문화관 차장 “기존의 모델하우스는 아파트의 평면공간을 보여주는데 그쳤습니다. 두산건설의 아트스퀘어는 카페와 갤러리 아트홀 등 갖춘 복합문화공간이라고 할 수 있습니다. 현재 유명 작가들의 작품을 전시해 아트스퀘어를 방문하는 고객들에게 좋은 호응을 받고 있습니다.” 두산건설을 비롯한 국내 주요 건설사 견본주택관에서는 지역주민들을 위한 문화행사가 풍성합니다. 현대건설은 양재동 힐스테이트갤러리를 이용해 오페라 공연 제작발표회와 자산운용 강의 등 다양한 문화이벤트를 펼치고 있습니다. GS건설은 서교동 자이갤러리에서 쿠킹클래스와 와인클래스 등 다양한 이벤트를 통해 지역 주민들에게 다채로운 경험을 제공합니다. 이밖에 대우건설과 삼성건설도 견본주택 전시관을 통해 상설 공연 등을 지속적으로 개최해 복합 문화공간으로 거듭났습니다. 견본주택이 아파트 평면도를 전시하는 단순한 공간에서 벗어나 인근 지역 주민들에게 문화 전도사 역할을 하고 있습니다. WOWTV NEWS 박영우입니다.,https://news.naver.com/main/read.nhn?mode=LSD&mid=shm&sid1=260&oid=215&aid=0000009319,157
118244,2009.01.07. 오후 5:57,부동산,파이낸셜뉴스,위례신도시 토지보상금 1조5000억원 풀린다,서울 송파구와 경기 성남·하남시 등에 걸쳐 개발되는 위례 송파 신도시에서 1조5000억원의 보상금이 본격 풀린다. 위례신도시 사업시행자인 한국토지공사는 신도시 편입지역에 대해 7일부터 보상금 지급을 개시했다고 밝혔다. 토공은 보상금 중 3억원 이하는 현금으로 3억원 초과하는 금액에 대해서는 현금과 채권으로 50%씩을 지급한다. 다만 오는 7월 1일부터는 전액 현금으로 보상한다. 위례신도시의 보상금액은 총 1조5000억원에 달한다고 토공측은 설명했다. 토지보상금에 대해서는 세금 감면혜택이 주어진다. 8년 이상 자경농지 소유자에 대해서는 양도세 감면한도가 1억원에서 2억원으로 확대된다. 또 ‘공익사업 수용시 양도세 감면율 확대’ 및 ‘5년 이상 보유토지 수용시 비사업용토지 중과 배제’ 등 다양한 세제 감면 혜택이 적용된다. 여기에 채권보상자에게는 양도소득세를 최고 30%까지 깎아준다. 개발사업 후 조성된 토지로 보상받는 대토보상을 신청할 경우에는 현금보상자에 비해 토지공급 우선권을 부여한다. 토공은 이번 토지보상을 시작으로 위례신도시 개발이 본 궤도에 오른다고 덧붙였다. 위례신도시는 오는 2014년까지 역사와 문화가 살아있는 첨단 생태도시로 개발되며 주택 4만6000가구가 건설돼 인구 11만5000명을 수용하게 된다. 토공 관계자는 “이번 위례신도시 보상은 경제위기 극복을 위해 최대한 앞당겨 실시하는 것”이라고 강조했다.,https://news.naver.com/main/read.nhn?mode=LSD&mid=shm&sid1=260&oid=014&aid=0002076876,157
118245,2009.01.07. 오후 5:57,부동산,서울경제,수원 권선지구 올 분양시장 다크호스,아이파크 시티 상반기 분양 시선집중 호매실지구·세류동 등 공공개발도 활발 경기도 수원 남서부 지역인 권선구가 올해부터 수도권 분양시장의 ‘다크호스’로 떠오를 것으로 전망된다. 광교ㆍ김포신도시 등 2기 신도시에 이어 서울 근교에서는 최대 규모의 분양이 잇따라 계획돼 있기 때문이다. 7일 수원시와 업계에 따르면 수원 권선구에서는 현재 2곳의 민간도시개발사업을 비롯해 호매실 택지개발지구 세류동 주거환경개선사업 등 공공개발사업까지 대형 개발사업들이 곳곳에서 진행되고 있다. 이 가운데 올해 상반기 분양을 앞둔 대표적인 개발사업으로는 현대산업개발이 진행하고 있는 ‘수원 아이파크 시티 권선지구 ’를 꼽을 수 있다. 이는 현대산업개발이 단독으로 실시하는 대규모 민간도시개발사업으로 총 100만여㎡ 부지에 주거시설과 테마쇼핑몰ㆍ복합상업시설ㆍ공공시설 등이 들어서는 ‘아이파크 미니 신도시’다. 공동주택 6 815가구 단독주택 283가구 등 총 7 000여가구의 주거시설 가운데 아파트는 총 4 389가구 규모다. 현대산업개발은 오는 4월 1ㆍ3블록에 위치한 1 336가구 113 279㎡형 의 분양을 시작으로 하반기까지 순차적으로 분양을 실시할 계획이다. 분양가는 아직 미정이다. 그러나 지난 2000년 이후 권선구 일대에서 분양한 아파트들의 분양가가 3.3㎡당 900만 1 100만원선에 결정됐고 현재 분양시장 상황이 좋지 않기 때문에 ‘수원 아이파크 시티’의 분양가 역시 기존 수준과 큰 차이는 나지 않을 것으로 예측된다. 이밖에 권선구에서는 또 다른 민간도시개발사업이 진행되고 있다. 벽산건설은 수원시 권선구 입북동 일대에서 9만1 258㎡ 규모의 민간도시개발사업을 벌이고 있다. 이 사업으로는 총 1 168가구가 조성돼 3 000여명을 수용한다. 벽산건설의 한 관계자는 “지난해 사업승인을 받았으며 현재 시장상황을 지켜보며 분양시기를 조율하고 있다”고 설명했다. 이와 더불어 수원시와 대한주택공사는 권선구 호매실 택지개발지구와 세류동 주거환경개선사업 등 대규모 공공개발도 활발히 진행하고 있다. 호매실 택지개발지구에서는 313만㎡ 부지에 2012년까지 공동주택 1만5 744가구를 조성하며 내년부터 국민임대주택과 일반분양 아파트를 단계적으로 공급한다. 세류동 주거환경개선사업을 통해서도 임대 510가구 분양 1 849가구 등 총 2 359가구 규모의 아파트가 공급된다.,https://news.naver.com/main/read.nhn?mode=LSD&mid=shm&sid1=260&oid=011&aid=0001987139,157
118246,2009.01.07. 오후 5:56,부동산,파이낸셜뉴스,강남 주택시장 규제완화전 실태조사,정부는 최근 투기규제 해제 예고로 호가가 급등하고 있는 서울 강남권의 주택시장에 대해 실태조사에 들어간다. 정부는 이를 토대로 설 연휴 이전에 서울 강남권 3구 강남·서초·송파 에 대한 투기규제 해제와 민간아파트의 분양가 상한제 폐지 전매제한기간 단축 등 추가 규제해제 협의에 나설 방침이다. 국토해양부 고위 관계자는 7일 “최근 서울 강남권 재건축 단지를 중심으로 최근 급매물이 소진되고 호가가 급등하고 있다는 지적에 따라 조만간 이들 지역에 대한 실태조사를 벌일 계획”이라고 말했다. 국토부가 강남권 주택시장에 대한 실태조사에 나서기로 한 것은 강남 3구에 대한 투기규제 해제에 앞서 주택시장을 진단하기 위한 것이다. 서울 강남권 집값은 전국의 주택시장을 주도하는 바로미터 역할을 한다는 점에서 이번 실태조사 결과가 주목된다. 강남 집값은 지난해 12월 중순부터 재건축 예정 단지를 중심으로 매수문의가 늘고 급매물이 빠지면서 호가가 오르고 있다. 지난해 11월 8억원까지 떨어졌던 송파구 잠실주공5단지 119㎡는 이달 현재 11억원에 호가가 형성돼 있고 강남구 역삼동 아이파크 105㎡도 10억원에서 11억원으로 올랐다. 강남구 도곡동 도곡렉슬 109㎡도 급매물이 소진되면서 호가 위주로 2000만∼3000만원 올랐다. 국토부와 기획재정부는 강남권 주택시장 동향을 파악한 뒤 강남·서초·송파구 등 강남 3구에 대한 투기과열지구 및 투기지역의 해제 여부를 결정할 계획이다. 또 이달 중 민영택지에 대한 분양가 상한제 폐지와 공공택지 내 분양가 상한제 대상 아파트에 대한 전매제한 기간 단축을 위해 당정협의와 부처간 협의에 착수할 예정이다. 다만 강남 3구에 대한 투기과열지구 및 투기지역 해제는 주택시장 상황에 따라 존속될 가능성도 배제할 수 없다. 국토부 관계자는 “규제를 풀기로 보고했지만 무조건 풀 수는 없다”며 “강남 집값을 파악한 뒤 가격 상승세로 이어질 조짐이 보이면 해제하지 않을 수도 있다”고 말했다. 투기과열지구 및 투기지역은 관련 위원회 심의 후 곧바로 해제할 수 있기 때문에 이달 중 해제가 결정되면 내달부터 적용될 수 있다.,https://news.naver.com/main/read.nhn?mode=LSD&mid=shm&sid1=260&oid=014&aid=0002076874,157
