,date,cat,co,headline,text,url,week
144902,2009.07.08. 오후 5:29,부동산,한국경제TV,부동산뷰 경제자유구역 배후도시 관심,앵커 부동산 시장의 관심사를 살펴보는 부동산뷰 시간입니다. 오늘은 요즘 주목받고 있는 경제자유구역 배후도시에 대해 알아보는 시간 마련했습니다. 최서우 기자 나왔습니다. 앵커 상반기 분양시장 최대 이슈라고 하면 인천 청라지구와 송도인데요 특별히 수요자들의 관심을 끌수 있었던 이유가 뭘까요 기자 상반기 인천지역에서 분양한 신규단지의 경우 대부분 순위내에서 마감되면서 분양시장 분위기를 이끌었습니다. 일부 단지에선 300대 1에 달하는 청약 경쟁률을 나타내고 계약률도 90% 이상 이뤄지면서 수요자들의 높은 관심을 받았습니다. 이들 지역은 높은 프리미엄 형성은 물론 떴다방까지 등장하는 과열 양상까지 빚을 정도로 인기를 모았습니다. 이같은 인기는 상대적으로 낮은 분양가와 규제완화라는 부분도 있었지만 근본적으로 인천지역이 가진 발전가능성이 높게 평가됐다는 분석입니다. 청라지구와 송도지구 모두 인천경제자유구역내에서 개발되는 지역이다 보니 향후 이 부분에 대한 기대감이 높았던 거죠. 앵커 수도권 뿐 아니라 지방에서도 경제자유구역에 대한 관심이 높아지고 있다고 하는데요. 어떻습니까 기자 전국 3대 경제자유구역으로 꼽히는 곳이 방금 말씀드린 인천 그리고 광양만권 경제자유구역 그리고 부산·진해 경제자유구역입니다. 그 가운데 최근 관심을 끌고 있는 곳이 광양만권 경제자유구역입니다. 광양만권 경제자유구역은 총 16조원이 투자돼 전라남도 여수와 순천 광양시 그리고 경남 하동군에 이르는 95제곱킬로미터를 2020년까지 개발하는 사업입니다. 사실 인천 등 수도권에 위치한 경제자유구역에 비해 상대적으로 덜 알려졌던 것이 사실이지만 중심 배후도시로 조성되는 순천 신대지구의 택지공급이 이번달 본격화되면서 주목을 받고 있습니다. 앵커 광양만권 경제자유구역의 구체적인 개발현황은 어떻습니까 기자 광양만권 경제자유구역은 모두 5개지구로 나뉘어 개발이 추진되고 있습니다. 광양지구의 경우 복합물류단지로 개발되며 면적이 가장 넓은 율촌지구의 경우 신소재부품과 에너지 관련 산업이 들어섭니다. 신덕지구의 경우 학교와 병원 주거시설이 들어서는 배후주거단지로 개발되며 화양지구는 관광과 레저 하동지구는 조선산업 육성에 주안점을 두고 개발됩니다. 특히 3년뒤 열리게 될 여수엑스포 유치는 광양만권 개발에 적지 않은 호재로 작용하고 있습니다. 엑스포 개최를 위한 시설확충에 투입될 예상 금액은 7조 7천억원에 이를 전망입니다. 이같은 인프라 확충은 고스란히 광양만권 경제자유구역의 경쟁력 강화로 이어질 것이라는 것이 관계자의 설명입니다. 인터뷰 백옥인 광양만권 경제자유구역청장 여수엑스포와 맞물려 구축되는 여러 사회적 인프라시설이 갖춰질 경우 국내 어느 도시보다 살기 좋은 도시로 변할 가능성이 있다고 봅니다. 앵커 경제자유구역의 경우 가장 중요한 것이 투자유치일텐데요. 현재까지 투지유치 현황은 어떻습니까 기자 경제자유구역의 성공 여부는 결국 투자유치에 달렸습니다. 금융위기이후 투자환경이 급격히 악화됐지만 투자유치 행보는 꾸준히 이어지고 있는 상황입니다. 지난해 광양만 경제자유구역내에 입주한 기업은 모두 30개사로 현재까지 전체 투자유치실적의 절반을 차지하고 있습니다. 현재까지 60억 달러의 국내외 자본이 투자 의향을 밝힌 상태입니다. 앵커 광양만권 경제자유구역의 핵심배후도시 개발에 대한 관심도 높은데요 어떤 식으로 개발되나요 기자 인천 청라와 송도에 해당되는 광양만권의 배후도시는 순천 신대지구입니다. 광양만권 경제자유구역내 첫번째로 조성되는 배후도시라 할 수 있습니다. 전라남도 순천시 해룡면 신대리 일대 3백만제곱미터에 걸쳐 개발중이며 현재 토지조성공사가 25% 가량 이뤄진 상태입니다. 2011년말까지 민간자본 5300억원이 투입돼 1단계 개발을 완료한다는 계획입니다. 아파트 1만 1천여가구와 18홀 규모의 골프장이 들어서 인구 3만명 규모의 도시로 거듭나게 됩니다. 인터뷰 권종문 순천에코밸리 사장 모든 건강과 레포츠를 타운내에서 해결할 수 있다는 점입니다. 골프장과 녹지를 합치면 전체개발 면적의 60%입니다. 나머지 40% 부지에만 공동주택을 분양하게 됩니다. 광양만권 경제자유구역 개발에 따른 예상 유입인구는 총 12만명 이 가운데 4분의 1에 해당하는 3만명이 순천 신대지구에 자리잡게 되는 셈입니다. 특히 본격적인 개발이 이뤄지는 첫번째 배후도시인만큼 상징적인 의미도 큽니다. 해당 지자체 역시 기대감이 클 수밖에 없습니다. 인터뷰 노관규 순천시장 신대지구는 단순히 지방자치단체에 속해 있는 행정구역의 일부로 이해해선 안됩니다. 광양만권 경제자유구역 전체를 아우르는 배후도시로서 역할을 하게된다는 점을 투자기업들이 고려하셔야 될 겁니다. 앵커 수도권이 조금씩 활기를 보이고 있는 반면 지방 부동산 시장은 여전히 침체를 보이고 있는데 인근 부동산 시장은 어떻습니까 기자 전라남도 집값은 2007년말과 비교해 지난해 3.4% 오른 것으로 조사됐습니다. 최근 5년동안 가장 높은 상승률을 기록한 셈인데요. 특히 순천과 광양지역 아파트 강세가 이어지고 있습니다. 광양만 경제자유구역의 경우 기존의 광양만 제철소와 여수화학단지 근로자 여기에 최근 국내외 기업의 입주가 이어지고 있는 상황입니다. 꾸준한 인구유입으로 인근 부동산시장은 상대적으로 호조세를 보이고 있으며 배후단지조성에 대한 필요성도 급증하고 있는 상황입니다. 인터뷰 신석철 순천시 공인중개사 순천의 경우 근로자들이 들어와서 거주할 수 있는 소형아파트가 부족한 상황이다. 그러다보니 광양쪽으로 이동을 많이 했다. 그러다보니 아파트값이 오르고 전세물건이 딸리면서 주택가격이나 토지시장에도 영향을 미치죠. 앵커 순천 신대지구의 택지공급 구체적으로 어떻게 진행되고 있나요 기자 순대지구 조성사업을 이끌고 있는 순천에코밸리는 오는 7월 2일 분양공고를 내고 공동주택용지와 상업용지 등 258필지 44만 9천㎡를 경쟁입찰 방식으로 공급합니다. 최소입찰금액은 공동주택용지가 3.3제곱미터당 2백만원선이며 상업용지의 경우 5백만원 단독주택용지 1백만원선입니다. 오는 7월 14일부터 16일까지 신청접수 17일 낙찰자 발표를 거쳐 23일부터 계약체결이 이뤄집니다. 경제자유구역이란 개발호재를 뒤에 엎고 청약훈풍을 이끈 인천 청라의 투자열기가 순천 신대지구 택지공급으로 이어질 지 관심이 모아지는 대목입니다. 앵커 클로징 오늘 부동산뷰 시간에는 최근 주목받고 있는 경제자유구역의 배후도시 중 하나 순천 신대지구에 대해 알아봤습니다. 최 기자 수고했습니다.,https://news.naver.com/main/read.nhn?mode=LSD&mid=shm&sid1=260&oid=004&aid=0001979920,183
144903,2009.07.08. 오후 5:27,부동산,한국경제TV,대림산업 사우디 8.2억달러 플랜트공사 수주,대림산업이 사우디아라비아에서 8억2천만달러 규모의 플랜트 공사를 따냈습니다. 대림산업은 사우디 국영회사인 아람코와 프랑스 토탈사가 공동 추진중인 프로젝트에서 주요 공정 5개 패키지 가운데 산성가스와 황 회수설비 를 건설하는 패키지 2B 공정을 단독 수주했다고 밝혔습니다. 이번 프로젝트는 주베일 공단내 하루 40만 배럴의 정제유를 생산할 수 있는 신규 정유공장을 건설하는 것으로 전체 사업규모는 100억 달러를 웃돕니다. 대림산업은 현재 사우디 주베일 산업공단에서 폴리머 콤플렉스를 비롯 폴리카보네이트 공장 고밀도폴리에틸렌 공장 건설공사 등을 진행하고 있습니다.,https://news.naver.com/main/read.nhn?mode=LSD&mid=shm&sid1=260&oid=215&aid=0000011628,183
144904,2009.07.08. 오후 5:27,부동산,머니투데이,톡톡 튀는 관광열차 돈 되네,머니투데이 김수홍 MTN 기자 앵커멘트 기차가 단순한 교통수단을 넘어 새로운 관광수요를 창출하는 여행수단으로 떠오르고 있습니다. 올해로 3번째 열린 철도관광상품 경진대회엔 지역 곳곳을 누비는 대학생과 일반인의 다양한 아이디어가 쏟아졌습니다. 아마추어의 신선함에 프로 못지않은 경제적 효과까지 갖춘 신상품들 김수홍 기자가 소개합니다. 리포트 옛날 교복을 입고 양철도시락을 까먹으며 추억에 잠기고. 여행지에선 제기 차고 딱지 치며 수학여행 분위기에 취해봅니다. 4 50대 중장년층 여행객을 대상 고객으로 삼은 대학생들의 기차여행 상품 아이디업니다. 외국인 관광객에는 영어를 배우고자 하는 한국인 대학생을 친구로 붙여주는 서비스. 열차에서 내려 천년고도 경주를 자전거로 여행하는 상품 등 철도공사가 개최한 철도관광 신상품 경진대회 에는 이처럼 대학생과 일반인 공사 직원들의 다양한 아이디어가 쏟아졌습니다. 150개 출품작 가운데 7개 입상작들은 조금 다듬은 뒤 실제 관광상품으로 출시됩니다. 인터뷰 양운학 코레일 상품개발팀장 상품들을 조금 손 보고 고객들이 좋아하실만한 것들을 추가해서 출시하면 국민들에게 사랑받는 상품이 될 것이라고 보고 있습니다. 팔도 장터를 체험하는 열차 등 지난해 입상작들은 이미 상품화된 바 있습니다. 철도공사는 이 같은 아이디어 상품을 통해 지난해 2억 3천만 원의 신수입을 얻었습니다. 신규 관광수요 창출로 지역경제 활성화에도 톡톡히 도움이 되고 있습니다. 인터뷰 윤대순 경기대학교 관광경영학과 교수 관광객이 왔다 가면 그냥 돈이 떨어지는 거예요. 한명이 만원을 쓰고 가면 지역경제엔 실제 4만 원 4배에서 4.5배의 경제효과가 있습니다. 철도공사는 내년부턴 싱가포르와 홍콩 등 외국 대학생들도 신상품 경진대회에 참가해 더욱 다양한 아이디어 발굴의 장으로 만들 것이라고 밝혔습니다. 외국인 관광객 대부분이 서울에만 머물다 돌아가는 게 현 실정 이들을 전국 곳곳의 관광지로 실어나르는 데 철도가 힘을 보탤 수 있을지 주목됩니다. 머니투데이방송 김수홍입니다.,https://news.naver.com/main/read.nhn?mode=LSD&mid=shm&sid1=260&oid=008&aid=0002173390,183
144905,2009.07.08. 오후 5:26,부동산,한국경제TV,성동구 잇단 개발호재 열풍,앵커 성수지구를 중심으로 성동구에 개발 호재가 이어지고 있습니다. 여기에 오는 11월부터 국내에서는 처음으로 공공관리자 제도가 도입되면서 관심이 더해지고 있습니다. 박준식 기자가 전합니다. 기자 서울시 개발의 주변에만 머물렀던 성동구. ‘성수신도시’ 등 대형 개발 사업으로 발전 가능성이 높은 지역으로 손꼽히고 있습니다. 전화 인터뷰 함영진 부동산써브 실장 ”동북권 르네상스 개발의 시작점으로 한강변 초고층 아파트 중공업 단지의 아파트 개발 등 호재가 많은 지역이다” 삼표레미콘 부지에 2015년 들어설 110층짜리 ‘서울숲 글로벌 비즈니스센터’는 성동구 개발의 대표 사례입니다. 성수 준공업지역은 R D 신산업메카로의 변신을 앞두고 있으며 행당도시개발사업도 주목해야 할 이슈입니다. 최근 성동구에 쏠린 관심의 핵심은 공공관리 제도의 도입니다. 조합원 분담금이 크게 줄고 공사기간 단축이라는 이점이 부각되면서 관심이 높아지고 있습니다. 인터뷰 이호조 성동구청장 ”회계와 발주 업체 선정 등은 관에서 담당하고 민간의 이해가 얽힌 조정 문제는 조합이나 추진위원회가 맡는데 민관의 장점만을 조화시킬 수 있다” 성동구가 서울 동북권 개발을 중심으로 새롭게 주목받고 있습니다. WOW TV NEWS 박준식입니다.,https://news.naver.com/main/read.nhn?mode=LSD&mid=shm&sid1=260&oid=215&aid=0000011627,183
144906,2009.07.08. 오후 5:26,부동산,헤럴드POP,유엔알 컬설팅 9일 부동산 투자 세미나 개최,㈜유엔알 컨설팅이 오는 9일 오후 2시 여의도 금융투자협회에서 부동산 투자 세미나를 개최한다. 강사로는 유엔알 컨설팅 박상언 대표와 상가뉴스레이다 선종필 대표가 참여한다. 이번 부동산 재테크세미나에서는 현재 부동산 시장에 대한 진단과 전망에서부터 재테크 및 틈새 부동산투자 전략 등을 상세하게 다룰 예정이다. 장소는 여의도역 5번출구 한국금융투자협회이고 사전접수한 참가자에 한해 세미나 참가비는 무료다.,https://news.naver.com/main/read.nhn?mode=LSD&mid=shm&sid1=260&oid=112&aid=0002018910,183
144907,2009.07.08. 오후 5:24,부동산,한국경제TV,값싸고 질좋은 내집 마련,앵커 저렴한 가격으로 서울에 내집 마련을 원한다면 청약통장을 열어 볼만 합니다. 하반기 대형건설사들이 민간택지에 분양가 상한제가 적용되는 알짜물량을 연이어 내놓습니다. 앵커 리포트입니다. 기자 하반기 민간택지에 분양가 상한제 아파트 1천 3백가구가 선을 보입니다. 지금까지 분양가 상한제 아파트는 중소형 건설사가 소규모로 공급했지만 이번에는 대형사의 중대형물량도 포함돼 눈길을 끕니다. 엠코는 오는 10월 중랑구 상봉동에 주상복합아파트 473가구를 일반분양합니다. 상봉터미널이 개발 예정이며 중앙선 망우역과 지하철 7호선 망우역을 도보로 이용할 수 있습니다. 현대건설은 광진구 광장동 일대 옛 한국 화이자 부지에 455가구를 내놓습니다. 인근에 지하철 5호선 광나루역이 있고 테크노마트와 어린이대공원이 있습니다. 재개발과 뉴타운 지역에도 알짜 아파트가 분양을 앞두고 있습니다. 롯데건설이 영등포구 당산2동 재개발지역에 81가구를 동대문구 용두동 재개발 지역에 107가구를 선보입니다. 양천구 신정 뉴타운에도 롯데 우림건설이 총 783가구 중 32가구를 일반분양할 예정입니다. 신정동 일대가 주거중심형 뉴타운으로 개발될 예정이며 지하철 2호선 신정네거리 역을 도보로 이용할 수 있습니다. 인터뷰 윤지해 부동산 써브 연구원 “그동안 공급량 적었던 서울지역 민간택지. 입지가 우수한 재개발 재건축 뉴타운 지역에 상대적으로 저렴하게 제공. 수요자는 보유 청약통장 활용해서 적극적 청약에 나설필요” 한편 상한제 폐지법안은 현재 국회 계류중으로 통과되면 물량은 크게 줄어들 전망이어서 막바지 알짜 물량에 관심이 모아지고 있습니다. WOWTV NEWS 김효정입니다.,https://news.naver.com/main/read.nhn?mode=LSD&mid=shm&sid1=260&oid=215&aid=0000011626,183
144908,2009.07.08. 오후 5:24,부동산,한국경제TV,17회 건설기능경기대회 시상식 열려... 박종필씨 외 14명 장관상,열일곱번째 건설기능경기대회 시상식이 열렸습니다. 대한건설단체총연합회 회장 권홍사 는 오늘 8일 측량분야 박종필씨와 거푸집 이종찬 철근 최형기씨 등 직종별 1위 입상자 14명에게 국토해양부 장관상을 수여했다 고 밝혔습니다. 이들은 이와 함께 전국기능경기대회 본선참가 자격과 국가 기술자격법에 의한 기능사 자격시험 면제 국내외 산업연수 기회가 주어집니다. 이날 행사에는 권홍사 회장을 비롯해 송용찬 건설공제조합 이사장 강석대 대한설비건설협회 회장 최영집 대한건축사협회 회장 허복 한국건설기술인협회 회장 문헌일 한국엔지니어링진흥협회 회장 등 건설단체장과 수상자 가족 300여명이 참석했습니다.,https://news.naver.com/main/read.nhn?mode=LSD&mid=shm&sid1=260&oid=215&aid=0000011625,183
144909,2009.07.08. 오후 5:24,부동산,파이낸셜뉴스,플랜트 ‘수출 효자’로 뜬다,플랜트 사업이 전자 및 조선에 뒤이어 한국의 주력 수출 품목으로 떠올랐다. 중동 지역 발주가 금융위기 이후 1년 만에 재개돼 삼성엔지니어링을 필두로 대림산업 SK건설 등이 추진 중인 에너지 플랜트 분야가 최근 호황기를 맞고 있다. 또 현대중공업·삼성중공업·대우조선해양·STX조선해양 등 ‘빅4’ 조선사들은 올해 하반기부터 브라질 호주 유럽 등에서 본격화될 각종 해양플랜트 발주를 기다리고 있다. 뿐만 아니라 두산중공업이 추진 중인 담수화 및 발전 플랜트 분야의 대규모 수주도 최근 연이어 성공하고 있다. 8일 플랜트·건설업계에 따르면 삼성엔지니어링·대림산업·SK건설 등은 7일 현지시간 사우디아라비아 국영석유회사인 아람코와 프랑스 석유화학기업 토탈의 합작사인 ‘사토프’가 발주한 주베일 정유공장 프로젝트 중 핵심사업 4개를 싹쓸이 수주하는 쾌거를 달성했다. 삼성엔지니어링이 2건 핵심공정을 16억달러에 수주했고 대림산업과 SK건설도 각각 8억2000만달러와 4억2000만달러의 주베일 정유공장 건설프로젝트를 따냈다. 특히 삼성엔지니어링이 오는 2013년 6월에 완공할 ‘패키지 넘버4 딜레이드 코커 유닛’은 아스팔트 유분을 분해해 액화석유가스 LPG 나프타 등 고부가가치 경질유를 생산하는 공정으로 사우디아라비아에 최초로 건설된다. 이는 삼성엔지니어링이 세계적인 엔지니어링·시공업체인 일본의 지요다와 전략적 협업을 통해 수주에 성공한 첫번째 사례다. 삼성엔지니어링 정연주 사장은 “이번 수주는 최근 사우디아라비아에서 수행한 5개 프로젝트의 사업수행 성과를 바탕으로 이룩한 쾌거이며 주베일 콤플렉스의 핵심적인 2건 공정을 수주한 것은 그 동안의 프로젝트 수행을 통한 기술력을 입증받은 것”이라고 말했다. 그는 이어 “향후 중동 지역 엔지니어링·조달·시공 분야에서 시장 지배력을 한층 높일 계획”이라고 설명했다. 대림산업이 이번에 수주한 프로젝트는 사우디아라비아 주베일 산업공단에 신설되는 정유공장의 5단계 공정 중 ‘산성가스와 황 회수설비’를 갖추는 ‘패키지 2B’ 공정이다. 대림산업은 현재 주베일 산업공단에서 폴리머 콤플렉스 폴리카보네이트 공장 고밀도폴리에틸렌 공장 건설공사 등을 진행 중이다. 또 SK건설은 정유공장의 필수 시설인 용수와 스팀 및 전력 공급 가스 공급 등의 설비를 갖추는 ‘패키지 5B’ 공정을 담당하고 있다. SK건설 관계자는 “사우디아라비아를 비롯해 인근 아랍에미리트 UAE 아부다비 등에서 대규모 정유공장 신설 프로젝트가 추가로 발주될 예정”이어서 “국내 건설사들의 추가수주가 예상된다”고 말했다. 두산중공업은 이날 발주처인 독일 지멘스와 함께 베트남 호찌민에서 약 25㎞ 떨어진 동나이 신흥공단지역에 들어설 복합화력 발전소에 2기의 대형 배열회수보일러 HRGS 설비를 공급키로 하는 계약을 체결했다. 수주 금액은 700억원대다. 두산중공업은 지난달 14일 이란에서도 1200억원 규모의 HRSG를 수주한 데 이어 20일 만에 베트남에서도 2기를 추가해 총 10기의 HRSG를 수주하는 쾌거를 달성했다. 한국전력은 사우디아라비아 폴란드 UAE 등에서 대규모 발전사업 수주 가능성이 높다. 조선업계는 ‘수주 가뭄’으로 어려움을 겪는 일반 선박 건조 대신 하반기 대규모 발주가 대기 중인 해양플랜트 분야에 역량을 집중하고 있다. 브라질 에너지기업 페트로브라스는 최대 420억달러 수준의 해양플랜트 발주를 진행 중으로 한국 조선업체들의 싹쓸이 수주가 예상된다. 삼성중공업은 로열더치셸이 발주 예정인 50억달러 규모의 액화천연가스 부유식 생산·저장설비 LNG FPSO 한 척에 대한 수주계약을 늦어도 7월 중으로 확정할 것으로 기대된다.,https://news.naver.com/main/read.nhn?mode=LSD&mid=shm&sid1=260&oid=014&aid=0002164691,183
144910,2009.07.08. 오후 5:23,부동산,한국경제TV,우리 손으로 쌓아올린 세기의 건축물,앵커 쌍용건설이 짓고 있는 싱가포르 마리나 베이 샌즈 호텔 상량식이 열렸습니다. 피사의 사탑보다 10배 이상 기울어진 설계로 최고의 난이도를 보여주고 있습니다. 싱가포르 현지에서 박영우 기자의 보도입니다. 기자 싱가포르 마리나 해변에 우뚝 솟은 마리나 베이 샌즈 호텔. 기울어진 두 개의 건물이 23층 높이에서 하나로 연결되는 구조로 설계됐습니다. 총 3개동 2천6백 객실로 이뤄진 이 호텔은 63빌딩 2배에 이르는 면적과 총 공사비 9천억원이 투입되는 초대형 공사입니다. 이 역사적인 건물을 하나로 잇는 스카이파크 상량식이 오늘 8일 개최됐습니다. 김석준 쌍용건설 회장과 발주처인 샌즈 그룹 셀던 아델슨 회장 등이 참석해 공사에 대한 만족감을 나타냈습니다. 인터뷰 김석준 쌍용건설 회장 세계 최고난이도의 구조물 공사이기 때문에 시공 과정에서 긴장을 늦춘 기억이 없다. 현장직원들의 노고 덕분에 공사가 진행대로 이뤄지고 있다. 싱가포르 정부는 2020년까지 도심인프라 확충에 400억 달러를 투입할 계획입니다. 이 때문에 최근 우리나라 건설사들의 싱가포르 진출이 눈에 띄게 늘고 있습니다. 스탠딩 박영우 기자 싱가포르 쌍용건설은 앞으로 대규모 공사 발주가 예상되는 싱가포르를 집중적으로 공략한다는 계획입니다. 싱가포르에서 WOW TV NEWS 박영우입니다.,https://news.naver.com/main/read.nhn?mode=LSD&mid=shm&sid1=260&oid=215&aid=0000011624,183
144911,2009.07.08. 오후 5:19,부동산,매일경제,포스코건설 주부자문단 3기 출범,포스코건설은 지난 7일 서울 역삼동 사옥에서 주부자문단 더 샤피스트 the sharpist 3기 출범식을 가졌다. 2007년 7월부터 운영해온 더 샤피스트 는 포스코건설의 주택 브랜드인 더샾 에 사람을 뜻하는 ist 를 결합시킨 합성어로 주택을 논하는 주부 고객 그룹을 칭한다. 샤피스트 는 건축ㆍ인테리어ㆍ디자인 관련 경력이 있는 30 50대 주부로 구성됐다. 이들은 월 2회 정기모임과 온라인상 교류를 통해 최근 입주한 단지 답사 모델하우스 조사 분석 신 新 디자인에 대한 품평 신규 아이디어 제안 및 주제 토론 등 다양한 활동을 펼쳐 고객 욕구를 회사에 알리게 된다.,https://news.naver.com/main/read.nhn?mode=LSD&mid=shm&sid1=260&oid=009&aid=0002127763,183
