,date,cat,co,headline,text,url,week
104542,2008.09.29. 오전 10:56,부동산,머니투데이,서울역 대우빌딩 리모델링 중,머니투데이 송복규 기자 부동산X파일 기부채납 갈등 외벽·구조 교체 못하고 내부 보수공사만 아마도 모건스탠리가 골머리를 앓고 있을 겁니다. 건물 지은지 30년이 넘었는데 내장재 교체만으론 한계가 있죠. 리모델링으로 건물가치 높여서 비싸게 팔려고 건물 매입했을텐데…. 한 금융권 관계자가 혀를 끌끌 찬다. 지난해 7월 대우센터빌딩 대우빌딩 을 인수한 미국 투자회사인 모건스탠리가 서울 중구의 허가를 받지 못해 건물 리모델링을 추진하지 못하고 있다는 것이다. 모건스탠리는 지난해말 건물 골격을 그대로 둔 채 외관을 알루미늄 소재로 바꾸고 내부 구조를 고치는 내용의 리모델링 허가신청서를 중구에 제출했다. 하지만 중구는 허가를 내주지 않았다. 도시및주거환경정비법 에 따라 도시환경정비사업구역에 속해 있는 대우빌딩을 리모델링하려면 도로·공원 등 기반시설을 조성할 땅을 매입해 자치구에 기부해야 하는데 모건스탠리가 이를 받아들이지 않았기 때문이다. 건물을 새로 짓는 것도 아니고 기존 건물을 리모델링하는데 땅을 기부채납하라는 것은 과도한 조치라는게 모건스탠리의 입장. 중구는 대우빌딩을 리모델링하면 최소한 30년 이상 주변지역 개발이 불가능한 만큼 건물주는 당연히 기반시설용지를 매입해야 한다고 강조하고 있다. 대우빌딩은 최근 초대형 가림막을 설치하고 대대적인 공사에 들어갔다. 리모델링 공사를 하는 것으로 알려졌지만 사실 천장재 벽재 바닥재 등 내장재를 교체하는 내부 보수 공사다. 모건스탠리가 당초 계획했던 건물 외관 교체 공사는 진행할 수 없다. 외부 형태를 변경하거나 내부 구조를 크게 바꾸는 것은 리모델링 범주에 속하기 때문이다. 업계 한 관계자는 대우빌딩 입지가 아무리 좋아도 지은지 워낙 오래됐기 때문에 전면 리모델링을 하지 않으면 건물 가치를 끌어올리기 어려울 것 이라며 2∼3년뒤 서울 도심 곳곳에 대규모 신축 건물이 들어서면 대우빌딩은 임차인 확보 경쟁에서 밀릴 수밖에 없다 고 말했다.,https://news.naver.com/main/read.nhn?mode=LSD&mid=shm&sid1=260&oid=008&aid=0002039249,143
104543,2008.09.29. 오전 10:54,부동산,연합뉴스,서울 재개발지역 원주민 재정착률 44% 불과,서울 연합뉴스 박성진 기자 2002년 이후 지금까지 6년 동안 서울시내 재개발 지역 원주민의 재정착률이 경제적 이유과 교육문제 등으로 44%에 불과한 것으로 집계됐다. 또 재건축 지역 원주민의 재입주비율도 63%에 그쳐 재개발.재건축으로 원주민들이 살던 곳을 떠나는 경우가 많은 것으로 나타났다. 29일 서울시가 집계한 재개발.재건축 원주민 재정착률 현황에 따르면 2002년 7월 이후 재개발 사업이 완료된 시내 50개 재개발구역에서 조합설립 당시 원주민 총 2만8천385가구 중 44%인 1만2천479가구만 재입주한 것으로 조사됐다. 관악구 봉천9구역 주택재개발 구역의 경우 원주민 310가구 중 46가구만 입주해 재정착률은 15%에 그쳤으며 강북구 미아10구역도 262가구 중 15%인 39가구만이 입주했다. 동대문구 답십리13구역과 성북구 월곡 3구역 성북구 정릉 5구역 등 원주민 재정착률이 20%대인 곳도 11곳이나 됐다. 반면 성동구 마장제1구역은 91가구 모두 입주해 100%를 기록했고 마포구 신수주택재개발구역은 105가구 가운데 103가구가 입주해 98%로 나타나는 등 재정착 비율이 80% 이상인 곳도 8개 구역으로 집계됐다. 재건축 단지의 경우 총 62개 구역에서 4만5천625가구 중 63%인 2만8천601가구가 재입주했다. 중구 동화주택 재건축단지의 경우 원주민 284가구 중 25%인 70가구만 입주했으며 동작구 상도아파트 재건축 26% 과 동작구 신생아파트재건축 29% 도 재정착 비율이 20%대로 낮았다. 시 관계자는 원주민 재정착률은 구역내 거주 여부와 관계없이 조합 설립 당시 조합원을 대상으로 사업 완료후 해당 구역에 입주했는지 여부를 조사한 결과 라며 원주민 재정착률은 원주민의 개념과 재정착지 범위 등 조사 기준에 따라 큰 차이가 날 수 있다 고 말했다. 이 관계자는 또 원주민의 재정착에는 경제적 이유와 교육 문제 등 여러가지 요인이 복합적으로 작용한다 며 공공 차원에서 원주민 재정착률을 높이기 위한 여러 방안들을 시행 또는 강구중 이라고 덧붙였다.,https://news.naver.com/main/read.nhn?mode=LSD&mid=shm&sid1=260&oid=001&aid=0002287890,143
104544,2008.09.29. 오전 10:53,부동산,아시아경제,SOS 경제자유구역 인천·황해구역 수정법이 외자유치 발목,정부는 지난 2003년 인천 부산 진해 광양 등 3곳을 경제자유구역으로 지정했다. 이어 정부는 지난해 입법예고하고 지난 4월 황해 경기 평택·충남 전북 군산 새만금 대구·경북 등 3개 지역을 경제자유특구로 추가 지정해 발표했다. 이에 따라 현재 우리나라의 경제자유구역은 6곳이다. u3000 인천경제자유구역 개발속도가 가장 빠른 인천경제자유구역은 수도권에 인접해 있으면서 세계적인 인천공항을 활용할 수 있다는 이점을 활용하여 국제업무 및 금융중심지 항공물류 허브 그리고 R D 중심지로의 육성을 계획하고 있다.,https://news.naver.com/main/read.nhn?mode=LSD&mid=shm&sid1=260&oid=277&aid=0002035438,143
104545,2008.09.29. 오전 10:52,부동산,아시아경제,SOS 경제자유구역차별성 없고 지원은 쥐꼬리,정부가 ‘한반도를 동북아의 비즈니스 중심으로 육성한다’는 야심찬 계획 아래 추진중인 경제자유구역 개발사업이 각종 규제로 지지부진한 채 뒷걸음질을 하고 있다. 현재 자유구역은 2003년 지정된 인천 부산 진해 광양 3곳과 지난 4월 추가로 지정된 황해 경기 평택과 충남 전북 군산 새만금 대구·경북 3곳 등 모두 6곳이다.,https://news.naver.com/main/read.nhn?mode=LSD&mid=shm&sid1=260&oid=277&aid=0002035437,143
104546,2008.09.29. 오전 10:52,부동산,머니투데이,희림 2년 연속 국제건축대전 수상,머니투데이 김정태 기자 부산영상센터 에 이어 크레센트호텔 수상 희림종합건축사사무소 이하 희림 대표 정영균 가 국제건축대전에서 크레센트 호텔 사진 설계 디자인으로 수상했다고 29일 밝혔다. 지난해 부산영상센터 에 이은 두번째 수상이며 올해 1000여개의 출품작 중 114개가 수상작 중에 포함됐다. 시카고 문예 박물관이 매년 주최로 수여하는 이 상은 세계적으로 가장 권위 있고 공신력 있는 대표적인 상으로 세계 유명 건축작품들이 출품된다. 이번 건축대전에는 2005년부터 2008년 내 완공된 건축물이나 디자인을 가지고 유럽 아시아 아메리카 등 세계 각국의 디자인 회사들이 응모했다. 수상작은 10월 30일 이후 이탈리아와 그리스에서 전시된다. 희림 최은석 상무는 세계적 권위를 가진 상을 받아 다시 한번 희림의 설계능력을 인식시키는 계기를 만들었다 며 국내외 건축설계 경쟁력을 능력을 갖춘 글로벌 건축설계 전문회사로서 약진하고 있다 고 말했다.,https://news.naver.com/main/read.nhn?mode=LSD&mid=shm&sid1=260&oid=008&aid=0002039244,143
104547,2008.09.29. 오전 10:51,부동산,아시아경제,알고 있나요 하반기 달라지는 내집마련,머니앤머니 아파트 전매제한기간 1 7년으로재건축조합원 지위 양도제한폐지 정부가 올해 대대적인 부동산 규제완화 정책을 펴면서 하반기 변하는 제도들이 많다.,https://news.naver.com/main/read.nhn?mode=LSD&mid=shm&sid1=260&oid=277&aid=0002035435,143
104548,2008.09.29. 오전 10:49,부동산,이데일리,오일달러를 잡아라①해외건설수주 신기원 열다,중동지역 5년내 6000억달러 발주..총 2조 달러 예상 올해 중동지역 260억달러 수주..내년 300억달러 예상 이데일리 윤진섭기자 유가가 천정부지로 오르면서 중동엔 오일달러가 넘치고 있습니다. 올 상반기 우리나라가 원유수입에 쓴 돈만해도 44조원에 달합니다. 중동 오일달러의 상당부분은 우리가 지불한 돈입니다. 다행히 그 가운데 일부분은 플랜트·토목·건축 등 건설수주를 통해 되찾아오고 있습니다. 올 1 8월 동안 중동 수주금액은 235억 달러에 달합니다. 중동지역은 오일달러가 인프라에 투자되면서 일감이 쏟아지고 있습니다. 먹을거리가 충분한 시장인 셈입니다. 정부와 건설사가 힘을 합치고 국민들이 성원해 주면 ‘밥상’은 더 풍성해 질 것입니다. 이데일리는 이데일리TV 개국 1주년 을 맞아 국내 건설사들이 중동에서 더 큰 활약을 할 수 있도록 그동안의 활약상을 소개하고 앞으로의 전략과 비전을 함께 모색해 봅니다. 편집자 중동 산유국들이 고유가 시대를 맞아 오일달러의 위세를 과시하고 있다. 산유국은 오일달러를 발판으로 사회간접자본 SOC 투자를 대폭 확대 건설 및 플랜트 프로젝트를 쏟아내고 있다. 70년대 80년대에 이은 제3의 중동 붐 인 셈이다. 이런 분위기에 맞춰 국내 건설사들도 앞다퉈 열사의 땅으로 달려가고 있다. ◇ 중동지역 향후 5년 내 6000억달러 발주 건설업계는 사우디 이란 아랍에미리트 오만 리비아 카타르 바레인 등 중동에서 향후 5년간 쏟아낼 건설 플랜트 물량만 6000억 달러 이상이고 계획하고 있는 물량만 2조 달러를 넘을 것으로 보고 있다.,https://news.naver.com/main/read.nhn?mode=LSD&mid=shm&sid1=260&oid=018&aid=0002022390,143
104549,2008.09.29. 오전 10:45,부동산,뉴시스,진보연대 종부세 완화 한나라당은 강부자당,서울 뉴시스 한국진보연대는 29일 정부의 종합부동산세 완화 방침에 대해 강부자 강남의 땅부자 정권 이 자기들이끼리 세금을 대폭 깎으려는 것 이라고 비판했다. 이들은 이날 오전 여의도 한나라당 당사 앞에서 기자회견을 갖고 종부세 폐지의 혜택의 85%는 이른바 강남 3구에 집중 대통령을 포함한 청와대 고위인사 11명 가운데 9명과 정부와 여당의 절반 이상이 수혜자 라면서 이같이 밝혔다. 이들은 특히 정부의 종부세는 징벌적 세금이라 완화해야 한다 는 설명에 대해 부동산 투기 광풍을 타고 눈덩이처럼 커지는 불로소득세를 부분적으로 억제하고 집값 폭등을 막기 위한 최소한 사회적 장치 라고 반박했다. 이들은 또 기획재정부가 지난 25일 발표한 2009년 세입예산안을 거론하며 봉급생활자의 근로소득세는 7.5%가 오르고 자영업자의 종합소득세는 13.7% 부가가치세는 9.5%나 오른다 며 강부자 세금 감면의 부족분을 온 국민의 주머니를 털어 보충하려는 것 이라고 지적하기도 했다. 이들은 아울러 한나라당이 민심을 외면하고 정부의 거수기를 자처하고 있다 며 오늘부터 한나라당을 강부자당으로 고쳐 부르기로 했다 고 말한 뒤 한나라당에 강부자당 이라고 적힌 현판을 전달했다.,https://news.naver.com/main/read.nhn?mode=LSD&mid=shm&sid1=260&oid=003&aid=0002302378,143
104550,2008.09.29. 오전 10:38,부동산,아시아경제,크레센트 호텔...국제건축대전 설계 디자인 수상,희림종합건축사사무소가 2년 연속 국제건축대전에서 수상 글로벌 건축설계 능력을 인정받았다.희림은 올해 국제건축대전에서 ‘크레센트 호텔 Hotel Crescent 사진 ’ 설계 디자인으로 수상했다고 29일 밝혔다.,https://news.naver.com/main/read.nhn?mode=LSD&mid=shm&sid1=260&oid=277&aid=0002035415,143
104551,2008.09.29. 오전 10:33,부동산,파이낸셜뉴스,주택보증 아파트 190가구 등 공매,대한주택보증은 주택분양보증을 이행하는 과정에서 취득한 미분양아파트 190가구 및 상가 12실 토지 및 미완성건물 등 부동산을 29일부터 한국자산관리공사의 전자입찰 시스템인 ‘온비드 www.onbid.co.kr ’를 통해 매각한다고 밝혔다. 아파트는 속초시 금호동 보람레이크 더하임아파트 91가구 및 강원도 횡성군 횡성읍 교항리 보람더하임아파트 92가구 등이다. 상가는 수원시 권선구 고색동 거산아파트 단지내 상가 6개실 및 남양주시 진건읍 용정리 동성아파트 상가 3개실 등이다. 대구광역시 북구 칠성동2가 370 2번지 토지 1만3889㎡ 및 지상건축물과 부산시 부산진구 가야동 48 274번지외 12필지 토지 7096㎡ 및 지상건축물 등도 입찰된다. 일반경쟁입찰로 최저매매가격이상 최고가격 입찰자에 낙찰된다. 기타 공매대상물건 및 부동산공매에 관한 자세한 정보는 한국자산관리공사의 온비드 www.onbid.co.kr 와 대한주택보증 홈페이지 www.khgc.co.kr 에서 확인할 수 있다.,https://news.naver.com/main/read.nhn?mode=LSD&mid=shm&sid1=260&oid=014&aid=0002029545,143
104552,2008.09.29. 오전 10:27,부동산,한국경제TV,건설기술연·에너지공단 그린홈 건설 협약,한국건설기술연구원과 에너지관리공단은 오늘 29일 서울 삼성동 코엑스에서 저탄소 녹색성장 실현을 목표로 그린홈 건설을 위한 건물 에너지 기술·산업·정책협력 협약 을 맺었습니다. 두 기관은 앞으로 건축물 에너지 절약 설계기준과 건물 에너지 효율 등급 인증제도 등 상호 관심분야에 대해 공동으로 학술·연구활동을 수행해 나갈 방침입니다. 또 저탄소 녹색 성장을 위한 그린홈 보급 협력사업을 추진하고 에너지·건설 산업의 동향과 정책 관련 정보 등을 교류하며 각 기관의 보유시설을 활용하는데 협력하게 됩니다. 두 기관은 지난 2001년 건물 에너지 효율등급제를 제도화해 2백여개 공동주택 단지에 인증을 부여하고 태양열·지열 복합 이용 시스템을 개발하는 등 협력해온 바 있습니다.,https://news.naver.com/main/read.nhn?mode=LSD&mid=shm&sid1=260&oid=004&aid=0001957548,143
104553,2008.09.29. 오전 10:16,부동산,한국경제TV,서울시 국민임대주택 1084가구 공급,서울시가 국민임대주택 1084가구를 공급합니다. 서울시 SH공사는 28일 은평구 진관내·외동 강서구 발산동 송파구 장지동 마포구 상암동 성동구 마장동 성북구 장위동에서 국민임대주택 1084가구를 짓는다고 밝혔습니다. 이번에 공급하는 임대주택은 다음달 6일부터 신청자를 접수하고 632가구는 노부모 부양자와 신혼부부에게 나머지 452가구는 일반인에 공급하기로 했습니다. 오는 11월17일 주택공급 홈페이지를 통해 당첨자를 발표하고 12월에 입주할 수 있습니다. 자세한 사항은 SH공사 주택공급 홈페이지에서 확인하면 됩니다.,https://news.naver.com/main/read.nhn?mode=LSD&mid=shm&sid1=260&oid=004&aid=0001957545,143
104554,2008.09.29. 오전 10:14,부동산,세계일보,올해 신·증축 아파트 공시가격 살펴보니…,서울 강남구 삼성동 아펠바움 전용면적 268.3㎡형의 공시가격이 36억원으로 올 1∼5월 신축한 공동주택 중 최고를 기록했다. 국토해양부는 28일 올해 1월1일부터 5월31일 사이에 신축이나 용도변경 등으로 사용승인을 받은 11만3188가구의 공시가격 6월1일 을 29일 공시한다고 밝혔다. 이 공시가격은 10월29일까지 이의신청을 받고 11월28일 최종 확정되기에 올해 재산세나 종합부동산세의 과세표준으로는 활용되지 않으며 증여세·상속세를 산정할 때 활용된다. 보유세는 시장·군수·구청장이 조사한 ‘미공시가격’을 기준으로 한다. 추가 공시되는 공동주택은 아파트 9만9960가구 88.3% 연립 2070가구 1.8% 다세대 1만1158가구 9.9% 이며 지역별로는 수도권이 전체의 50.7%를 차지하고 있다. 면적은 전용 85㎡ 이하가 74.6%이며 가격대별로는 3억원 이하가 전체의 83.5%를 차지했다. 종부세 대상인 6억원 초과는 1.8% 1997가구 에 불과하며 이 중 6가구를 제외하고는 모두 수도권에 위치했다. 1월1일 기준으로 이미 공시된 주택 중 6억원 초과 주택을 포함하면 종부세 부과대상 주택 단독주택 포함 은 전부 28만8351가구가 된다. 이는 전체의 2.1%이며 지난해 30만6088가구였던 것과 비교하면 1만7737가구 줄어든 것이다. 추가 공시 주택 중 최고가는 서울 삼성동 아펠바움 전용 268.3㎡형으로 36억원이다. 이어 서울 장충1동 상지리츠빌 장충동카일룸 244.8㎡형이 19억5200만원 서울 여의도동 여의도자이 210.4㎡형이 19억2000만원으로 나타났다. 조현일 기자 ⓒ 세계일보＆세계닷컴 www.segye.com 저작자표시 비영리 변경금지 청정가평 서 가을을 달린다 가평마라톤대회 10월 12일 세계닷컴은 한국온라인신문협회 www.kona.or.kr 의 디지털뉴스이용규칙에 따른 저작권을 행사합니다.,https://news.naver.com/main/read.nhn?mode=LSD&mid=shm&sid1=260&oid=022&aid=0001990603,143
104555,2008.09.29. 오전 10:12,부동산,세계일보,수도권 전매제한 완화,오는 11월부터 주택거래신고지역에서는 전용면적 60㎡ 이하의 소형주택을 거래한 뒤에도 15일 이내에 신고해야 한다. 또 10월 중에는 주상복합아파트의 분양가가 3∼4% 오른다. 국토해양부는 지난달 21일 발표한 ‘주택공급 기반강화 및 건설경기 보완방안’의 후속조치로 ‘주택법 시행령’ 및 ‘공동주택 분양가격의 산정 등에 관한 규칙’을 개정해 29일 입법예고한다고 28일 밝혔다. 시행령 개정안은 우선 수도권의 전매제한을 완화했다. 지금은 공공택지 7∼10년 민간택지 5∼7년으로 돼 있지만 개정안은 공공택지는 3∼7년 민간택지는 1∼3년으로 낮췄다. 전매제한 완화는 8월21일 이후 분양승인 신청분부터 적용된다. 개정안은 또 주택거래신고지역 내에서는 전용 60㎡ 이하 주택도 신고대상에 포함시켜 모든 주택의 거래를 15일 이내에 신고하도록 했다. 시행령 개정안은 11월 중 규칙 개정안은 10월 중에 시행될 전망이다. 조현일 기자 ⓒ 세계일보＆세계닷컴 www.segye.com 저작자표시 비영리 변경금지 청정가평 서 가을을 달린다 가평마라톤대회 10월 12일 세계닷컴은 한국온라인신문협회 www.kona.or.kr 의 디지털뉴스이용규칙에 따른 저작권을 행사합니다.,https://news.naver.com/main/read.nhn?mode=LSD&mid=shm&sid1=260&oid=022&aid=0001990601,143
104556,2008.09.29. 오전 10:10,부동산,아시아경제,한달에 한번꼴 부동산대책.. 꿈쩍않는 시장,새 정부 들어 부동산대책이 평균 한달에 한번 꼴로 쏟아지고 있다. 지난 3월 출범한 국토해양부는 업무파악 및 1년 사업계획 등을 세운 뒤인 6월부터 새로운 부동산대책들을 계속 발표했다. 그러나 시장은 거의 움직임을 못느낄 정도로 냉각현상이 풀리지 않고 있다. 전문가들은 정부가 수요를 진작시킬 수 있는 핵심대책을 내놓지 않은 채 변죽만 울리고 있다고 지적한다.,https://news.naver.com/main/read.nhn?mode=LSD&mid=shm&sid1=260&oid=277&aid=0002035391,143
104557,2008.09.29. 오전 10:08,부동산,아시아경제,주공 지방 미분양주택 4차 매입,국토해양부와 대한주택공사는 지방 미분양주택 4차 매입에 들어간다. 주택공사는 미분양주택을 임대주택으로 활용하기 위해 4차 미분양 주택 매입 신청 접수를 받는다고 29일 밝혔다.,https://news.naver.com/main/read.nhn?mode=LSD&mid=shm&sid1=260&oid=277&aid=0002035389,143
104558,2008.09.29. 오전 10:00,부동산,이데일리,쏙쏙부동산보유세 과표 변천사,이데일리 박성호기자 부동산 보유세 과표가 또 바뀐다고 합니다. 2005년 이전까지 주택 재산세 과표는 건물과세시가표준액이 사용됐습니다. 건물신축가격기준액 에다 구조지수 용도지수 등을 적용하고 여기에 면적별로 가감산율을 곱해 산정하는 방식입니다. 건물신축가격기준액은 행정안전부 옛 행정자치부 가 매년 정했습니다. 2002년께 정부가 고시한 건물신축가격기준액은 17만원선이었습니다. 그런데 건물과세시가표준액은 주택가격을 반영하지 못하는 한계가 있었습니다. 가격은 강남 소형아파트가 강북 대형아파트보다 비싸지만 재산세는 강북 대형아파트가 더 많이 내 온 겁니다. 이런 문제를 고치기 위해 2004년부터는 가감산율 적용을 면적기준에서 국세청 기준시가 기준으로 변경했으며 2005년부터는 아예 주택공시가격을 과표로 활용하게 됩니다. 주택공시가격은 실제 주택가격을 바탕으로 감정평가사들이 해당 주택의 가격을 산정하는 것입니다. 주택공시가격제도 도입으로 주택 보유세 부과방식은 토지·건물 분리과세에서 통합과세로 바뀝니다. 주택공시가격은 매년 1월1일을 기준으로 국토해양부 옛 건설교통부 장관이 고시하고 있습니다. 예컨데 올해 재산세의 경우 주택공시가격의 55%로 적용비율이 정해져 재산세가 부과됐습니다. 올해 공시가격이 9억3600만원인 대치동 은마아파트 84㎡ 전용면적 기준 의 재산세는 231만4000원 공시가격×0.55 적용비율 ×0.005 단위구간별 세율 26만원 공제금액 으로 결정됐습니다. 내년부터는 보유세 과표가 공시가격에서 공정시장가액으로 바뀔 전망이다. 정부가 종합부동산세 개편방안 9월23일 에서 이같은 방침을 밝혔습니다. 종부세 공정시장가액은 공시가격의 60 100%선에서 매겨지는데 정부가 시장상황을 판단해 탄력적으로 과표를 정하겠다는 것입니다. 재산세의 경우는 이보다 낮은 수준에서 정해질 것으로 보입니다.,https://news.naver.com/main/read.nhn?mode=LSD&mid=shm&sid1=260&oid=018&aid=0002022357,143
104559,2008.09.29. 오전 9:58,부동산,아시아경제,바뀐 지번 찾아드립니다,동대문구가 주민들의 바뀐 지번 찾아주기에 팔 벗고 나섰다. 동대문구 구청장 홍사립 는 지난 11일부터 1910년 이후 등록전환 토지구획정리사업 행정구역변경 성북 종로 중랑등 사업 등으로 지번이 변경된 토지에 대해 바뀐 지번 찾기 서비스를 시작했다고 29일 밝혔다.,https://news.naver.com/main/read.nhn?mode=LSD&mid=shm&sid1=260&oid=277&aid=0002035372,143
