,date,cat,co,headline,text,url,week
144425,2009.07.05. 오후 10:54,부동산,경향신문,‘버블 부동산’ 투기 재연 우려,SUB TITLE START ㆍ정부 규제완화·저금리 맞물려 … 부동자금 쏠림 조짐 ㆍ“경기회복 없는 급등은 경제 전반에 부담” SUB TITLE END 시중 부동자금이 부동산시장으로 몰리는 조짐이 뚜렷해지면서 수도권 지역을 중심으로 부동산 투기가 재연될 것이라는 우려가 커지고 있다. 경제위기 극복을 위해 풀어놓은 대규모 시중자금이 마땅한 투자처를 찾지 못한 데다 정부의 부동산규제 완화 정책과 저금리 기조가 맞물리면서 부동산시장이 들썩이고 있는 것이다. 정부와 금융당국은 집값이 빠르게 오르거나 주택담보대출 수요가 급증하는 지역의 대출 규제를 강화할 방침이지만 서울 강남과 경기 과천 등의 집값은 이미 급등세를 보이고 있다. 5일 한국은행과 금융감독원에 따르면 은행 주택담보대출은 지난 2월 이후 매달 3조원 이상 늘고 있다. 이는 주택담보대출 규모가 사상 최대치에 이르렀던 2006년 월평균 증가액 2조5000억원 을 웃도는 수준이다. 주택담보대출 용도 중 주택구입 비중은 지난 1월 46%에서 5월 55%로 상승했다. 그만큼 시중자금이 부동산시장으로 유입됐다는 의미다. 주식시장이 부진한 흐름을 보이면서 시중자금이 부동산으로 쏠리는 현상은 갈수록 심해지고 있다. 주식시장의 대기성 투자자금인 고객예탁금은 지난 3월 이후 급감하면서 지난달에는 ‘마이너스’로 돌아섰다. 증시 전문가들은 증시자금 중 상당액이 부동산시장에 유입된 것으로 추정하고 있다. 올해 들어 수도권지역 집값은 가파른 상승세를 보이고 있다. 경기 과천의 주택 매매가격은 올 들어 10% 이상 서울 강동지역은 3% 올랐다. 서울 송파구와 강동구의 아파트 전세 가격도 4% 이상 급등했다. 아파트 거래량도 급증하고 있다. 국토해양부에 따르면 서울지역의 아파트 거래건수는 지난 1월 1778건에서 5월에는 6224건으로 늘었다. 국민은행 연구소가 집계하는 서울지역 ‘매매거래 활발지수’는 6월 마지막주 21.7로 지난해 4월 셋째주 25.4 이후 가장 높은 수준을 나타냈다. 국민은행 연구소 고혜진 연구원은 “지난해 4월 노원·도봉·강북구 등 강북 3구에서 아파트 거래가 늘어난 이후 가장 활발한 분위기”라고 말했다. 부동산시장이 과열될 조짐을 보이자 정부도 촉각을 곤두세우고 있다. 윤증현 기획재정부 장관은 이날 KTV 정책대담 에 나와 “주택담보대출 총량 규제를 검토하고 있다”고 말했다. HMC투자증권 이종우 리서치센터장은 “국내 경기가 뚜렷한 회복세를 보이지 못하는 상황에서 부동산 가격이 급등하면 경제 전반에 상당한 부담이 될 것”이라고 말했다. 오창민기자 riski kyunghyang.com 대한민국 희망언론 경향신문 구독신청 hp smile.khan.co.kr ⓒ 경향신문 경향닷컴 www.khan.co.kr 무단전재 및 재배포 금지 〈경향닷컴은 한국온라인신문협회 www.kona.or.kr 의 디지털뉴스이용규칙에 따른 저작권을 행사합니다.,https://news.naver.com/main/read.nhn?mode=LSD&mid=shm&sid1=260&oid=032&aid=0002018510,183
144426,2009.07.05. 오후 10:36,부동산,서울경제,강동·양천 주택대출 규제 강화,집값 급등 여의도·과천·용인등도… 강남 3구는 제외 강동구ㆍ양천구ㆍ여의도 등 서울 일부 지역과 인천 송도와 청라지구 경기도 분당ㆍ용인ㆍ과천 등 수도권 일부 지역에 대해 주택담보대출 규제가 강화될 것으로 전망된다. 정부가 집값이 급등하거나 주택담보대출 수요가 쏠리는 지역에 선별적으로 대출규제를 강화하는 방안을 추진하고 있기 때문이다. 금융감독원의 한 관계자는 5일 “주택담보대출을 일률적으로 규제하면 미분양이 많은 지방이나 서민이 피해를 볼 수 있다”며 “주택가격이 불안하고 대출수요가 몰리는 지역에 한해 대출규제를 강화하는 방안을 검토하고 있다”고 밝혔다. 부동산시장 불안이 서울ㆍ수도권 일부 지역에 국한된 상황에서 일괄적으로 대출을 옥죄면 부동산 경기 전반이 악화될 수 있기 때문이다. 금융당국은 우선 주택담보대출이 몰리는 지역에는 투기지역 지정 여부에 관계없이 은행들이 대출심사 강화 등을 통해 자율적으로 대출 취급액을 제한하도록 지도할 계획이다. ‘은행별 자율지침’이라는 형식을 거치겠지만 사실상 주택담보대출의 총량을 규제해 부동산대출을 줄이겠다는 것이다. 이를 위해 금감원은 최근 은행별로 올 하반기 주택담보대출 계획치를 제출 받았다. 다만 규제를 강화하더라도 서민들의 생계자금용 대출에 대해서는 예외를 두도록 할 계획이다. 금융당국은 이 같은 창구지도가 약발을 받지 않을 경우 감독규정을 고쳐 집값 불안지역에 선별적으로 주택담보인정비율 LTV 총부채상환비율 DIT 등 금융규제를 강화할 방침이다. 가령 투기지역이나 투기과열지구가 아니더라도 주택가격이 급등하고 대출이 많이 이뤄진 지역에는 LTV를 낮추거나 DTI를 적용하겠다는 것이다. 지금도 금감원은 ±10% 범위에서 이들 규제를 조정할 수 있는 권한을 갖고 있다. 이에 따라 최근 집값이 급등하고 있는 서울 강동ㆍ양천구 인천 송도와 청라 경기도 분당ㆍ용인ㆍ과천 등이 선별적인 규제대상에 포함될 가능성이 크다. 다만 강남ㆍ서초ㆍ송파구 등 강남3구는 규제대상에서 제외될 가능성이 높다. 금융위원회의 한 관계자는 “강남3구는 그동안 주택담보대출이 그다지 늘어나지 않은데다 이미 투기지역으로 묶여 있다”며 “부동산 관련 대출을 추가적으로 규제할 방법이 마땅치 않다”고 말했다. 국민은행연구소에 따르면 서울에서 아파트 매매가격이 지난해 말 대비 지난달 29일 기준 가장 많이 오른 지역은 강동구 6.4% 양천구 4.3% 강남구 3.8% 송파구 3.5% 마포구 2.0% 등의 순이었다. 박원갑 스피드뱅크 부사장은 “부동산시장의 양극화가 지금처럼 심했던 적은 없었다”며 “지방 규제는 더 풀고 수도권은 조금 강화하는 등 지역별 선별 규제가 필요하다”고 말했다.,https://news.naver.com/main/read.nhn?mode=LSD&mid=shm&sid1=260&oid=011&aid=0002014837,183
144427,2009.07.05. 오후 9:22,부동산,세계일보,위례신도시 ‘분양사기주의보’,토공 “불법 사기광고 기승” 최근 조성 중인 위례 송파 신도시의 특별분양권을 싸게 판다는 사기 광고가 기승을 부리고 있어 주의가 요망된다. 5일 한국토지공사에 따르면 최근 인터넷이나 전화상으로 ‘위례신도시 109㎡ 아파트 원가기준 특별분양권 8000만원’ ‘생활대책용지 27㎡ 원가기준 특별분양권 8000만원’ 등의 광고가 남발되고 있다. 특히 이들 광고는 “토공이 현지 실사 중이다” “남은 시간과 물량이 별로 없다” “특별분양권은 원가 분양이기에 최소 2억은 벌 수 있다”는 말로 투자자들을 현혹하고 있다. 하지만 이런 광고 대부분은 대상자가 아직 확정 안 된 ‘물딱지’일 가능성이 높아 주의가 요구된다는 게 토공 측 설명이다. 원래 택지개발지구 내에서는 일정 요건을 갖춘 가옥 소유 원주민에게 택지 또는 주택을 공급하거나 일정요건을 갖축 영업이나 영농·축산을 영위한 자에엔 20∼27㎡ 규모의 생활대책 용지를 특별공급하지만 위례신도시는 아직 대상자를 확정하지 않은 상태라는 것이다. 또 이런 거래는 통상 등기 없이 이뤄져 하나의 권리를 여러 사람에게 이중삼중으로 판매해도 검증할 방법이 없고 업자들이 돈만 건네받고 잠적할 수 있어 피해가 우려된다. 토공 관계자는 “사기 광고로 최근 투자자들의 문의와 피해 사례 신고가 늘고 있다”며 “현재 지상물건 보상을 준비하기 위한 기본조사를 하고 있지만 특별분양권 해당 여부는 이를 토대로 2010년 이후 심사를 통해 확정할 계획”이라고 밝혔다. 그는 이어 “택지개발예정지구 공람공고일 이후에 설치한 양봉이나 축산·비닐하우스와 영농행위에 대해선 절대 특별분양권을 부여하지 않는다”며 “따라서 이 같은 투자 권유가 있을 시 일단 의심을 하고 토공에 사실관계를 확인해 피해를 보지 말아야 한다”고 덧붙였다. 김준모 기자 jmkim segye.com Segye.com 인기뉴스 크레인 선로로 넘어져…경부·경의선 운행중단 박명수씨 입원 웃기네 연예가중계 항의 빗발 무명 이은정 LPGA 연장전 생애 첫 우승 8월 개장 이순신 장군 분수 물 뿜는다 휴가때 비키니입고 싶은데… 비만 치료제 먹어도 될까요 혁신도시 이전사업 삐걱 …유령도시로 전락할라 ⓒ 세계일보 Segye.com 무단 전재 및 재배포 금지 ☞공짜로 연극ㆍ뮤지컬보기 ☞세계일보 지면보기 세계닷컴은 한국온라인신문협회 www.kona.or.kr 의 디지털뉴스이용규칙에 따른 저작권을 행사합니다.,https://news.naver.com/main/read.nhn?mode=LSD&mid=shm&sid1=260&oid=022&aid=0002056612,183
144428,2009.07.05. 오후 7:39,부동산,국민일보,쪽방·비닐하우스 거주자，전세임대 최장 10년으로 연장,국토해양부는 쪽방·비닐하우스 거주자가 다가구 매입 및 전세임대주택에 입주할 경우 거주 기간을 현행 6년에서 최장 10년으로 연장할 계획이라고 5일 밝혔다. 지원 대상은 쪽방·비닐하우스 거주자 가운데 전년도 도시근로자 가구당 월평균 소득 50% 이하 보유토지 가액 5000만원 이하 2200만원 이하의 자동차 영업용·장애인용 제외 소유 등의 조건을 갖춘 무주택 세대주다. 임대 조건은 쪽방 거주자의 경우 보증금 100만원에 월 임대료 8만∼10만원이며 비닐하우스 거주자는 보증금 250만∼350만원에 월 임대료 8만∼10만원을 내면 임대주택 입주가 가능하다. 국토부는 또 지원대상 가구가 올해 안에 임대주책에 입주할 경우 임대 보증금의 50%를 무이자로 대출해 주기로 했다. 국토부 관계자는 쪽방이나 비닐하우스 거주자가 대부분 기초생활보장 수급자여서 단기간에 목돈을 마련해 다른 거주지를 마련하기 어려운 현실을 고려한 조치 라며 2012년까지 모두 5173가구를 지원할 예정 이라고 밝혔다.,https://news.naver.com/main/read.nhn?mode=LSD&mid=shm&sid1=260&oid=005&aid=0000368648,183
144429,2009.07.05. 오후 7:29,부동산,연합뉴스,집값 급등지역만 담보대출 조인다종합,그래픽 증시자금ㆍ주택담보대출 추이 서울 연합뉴스 장성구 기자 5일 증권ㆍ부동산업계 등에 따르면 지난달 25일 이후 3일까지 7거래일간 개인투자자는 유가증권시장에서 1조3천798억원을 순매도했다. 고객예탁금도 지난 4월15일 16조472억원까지 불었으나 3일 현재 12조8천424억원으로 12조원대로 감소하는 등 한때 펀드환매자금으로 직접투자에 나섰던 개인들이 단기적으로 돈을 빼고 있는 것으로 분석됐다. sunggu yna.co.kr 대출취급액.LTV.DTI 선별적 규제 강화 서울 연합뉴스 김문성 윤선희 조재영 김호준 기자 집값이 빠르게 오르거나 주택담보대출 수요가 급증하는 지역에 한해 대출 규제를 강화하는 방안이 추진된다. 이에 따라 지난해 투기지역 해제 이후 아파트 가격이 급등하는 서울을 포함한 수도권의 일부 지역이 적용 대상으로 떠오르고 있다. 다만 서민 피해를 막으려고 생계비 마련 목적의 주택담보대출은 규제 강화 대상에서 제외된다. 금융감독원 관계자는 5일 주택담보대출을 일률적으로 규제하면 미분양이 많은 지방이나 서민이 피해를 볼 수 있다 며 주택가격이 불안하고 대출 수요가 몰리는 지역에 대해 대출 규제를 강화하는 방안을 검토 중 이라고 밝혔다. 금융위원회 관계자는 강남지역을 비롯해 작년 11월 투기지역에서 풀린 수도권 일부 지역을 중심으로 대출이 크게 느는 것으로 파악되고 있다 며 선별적 대응을 할 계획 이라고 말했다. 금융당국은 우선 주택담보대출이 몰리는 지역에 대해선 투기지역 지정 여부에 관계없이 은행들이 자산 건전성 관리 차원에서 자율적으로 대출 취급액을 제한하도록 지도할 계획이다. 은행들이 특정 지역에 한해 주택담보인정비율 LTV 을 낮추거나 대출 심사를 강화하도록 하는 방안도 있다. 그러나 규제를 강화하더라도 서민들의 생계자금용 대출에 대해선 예외를 두도록 할 계획이다. 금융당국은 이런 창구지도만으론 한계가 있다고 판단되면 부동산 불안 지역에 대해 직접 규제를 할 방침이다. 현행 감독규정상 투기지역의 아파트 LTV 만기 10년 이하 은행.보험사 대출 기준 는 40% 투기과열지구는 50% 기타 지역은 60%로 제한돼 있다. 채무상환능력에 따라 대출금액을 결정하는 총부채상환비율 DTI 은 투기지역과 수도권 투기과열지구에 한해 40%이다. 이들 규제의 경우 투기지역과 비투기지역으로 나눠 획일적으로 적용하고 있으며 금감원이 ±10% 범위에서 조정할 수 있는 권한을 갖고 있다. 금융당국은 따라서 감독규정을 고쳐 집값이 불안한 특정 행정구역에 대해서만 대출 규제를 강화하는 방안을 검토하기로 했다. 예컨대 투기.비투기 지역에 관계없이 주택가격이 급등하고 대출이 많이 이뤄지는 A구나 B구에 한해 LTV를 지금보다 5 10%포인트 낮추거나 DTI를 적용해 대출을 억제하는 것이다. 이와 관련해 투기우려지역을 신설해 투기지역에 적용되는 양도소득세 중과를 배제하는 대신 LTV와 DTI 규제만 강화하는 방안도 거론되고 있다. 금융당국 관계자는 현 상황에서는 선별적 대응이 필요한 만큼 부동산시장 상황을 보면서 관련 부처.기관과 협의해 구체적인 방안과 시행 시기를 결정할 계획 이라고 말했다.,https://news.naver.com/main/read.nhn?mode=LSD&mid=shm&sid1=260&oid=001&aid=0002748613,183
144430,2009.07.05. 오후 6:59,부동산,경향신문,목동 1달새 1억2억 올라… 심상찮은 집값,SUB TITLE START ㆍ강남발 급등세 ‘버블세븐·강북권’ 확산 조짐 ㆍ수도권 외곽은 회복속도 늦어… 금리가 변수 SUB TITLE END 직장인 최모씨 45 는 주말인 4일 서울 양천구 목동 부동산중개업소를 찾았다. 집값이 오른다는 소식에 더 늦기 전에 집을 사둬야겠다는 생각 때문이었다. 최씨가 둘러 본 집은 목동신시가지 3단지 115㎡ 35평형 . 시세는 10억5000만원선이었다. 8억 9억원이던 몇달 전에 비하면 많이 올랐지만 최고점이었던 13억원에 비하면 아직 낮다. 최씨는 “집값이 더 오를 수 있을 것 같아 전세를 끼고 집을 사기로 했다”고 말했다. 전세금 3억5000만원을 제외하고 최씨가 마련해야 하는 돈은 7억원. 시중은행에서 5억원 정도를 담보 대출로 마련하고 부족한 돈은 2금융권인 저축은행에서 빌리기로 했다. 은행에 비해 금리는 2 3%포인트 높지만 집값만 올라주면 전혀 부담될 게 없다는 게 최씨의 판단이다. 집값 오름세가 심상치 않다. 서울 강남 집값은 이미 거품 소리가 나올 정도다. 한달여 전만 해도 8억원대이던 서초동 구반포 주공1단지 72㎡ 22평 는 요즘 11억원에도 매물이 없다. 한신 2차 72㎡ 역시 한달 전 6억원에서 지금은 7억5000만원으로 올랐다. 입주를 앞둔 서초 래미안도 불과 보름 사이에 집값이 2억원씩 올랐다. 지난달 중순 12억원대였던 114㎡ 34평형 가 지금은 14억원대다. 또 15억 16억원하던 44평형은 19억 20억원까지 치솟았다. 서초동 중개업소 관계자는 “금융위기로 주식과 펀드에서 쓴 맛을 본 자산가들이 부동산으로 다시 돌아온 것 같다”고 말했다. 강남에서 시작된 집값 오름세는 목동·과천·분당을 거쳐 최근에는 강북지역까지 번질 조짐을 보이고 있다. 최근 집값이 오르는 것은 저금리 기조가 대표적으로 꼽힌다. 경기침체로 소득은 줄었지만 대출금리가 4%대에 불과하기 때문에 이자 부담이 작다. 또 재건축 아파트 용적률 상향 재건축 연한 단축에 대한 기대감 다주택자 세금경감 등 각종 규제 완화도 집값을 끌어올리고 있다. 이영진 닥터아파트 리서치센터장은 “규제 완화가 시행되고 이명박 정부와 서울시가 각종 개발정책을 경쟁적으로 내놓다보니 집값이 상승하고 있다”면서 “최근에는 강북권에서도 실수요자들의 집값 불안심리가 나타나고 있다”고 말했다. 때문에 일각에서는 외환위기 때처럼 다시 대세상승기로 접어드는 게 아니냐는 예상도 나오고 있다. 당시처럼 저금리 기조 전매·양도세 완화 등 규제 완화 정책이 흡사하기 때문이다. 양도성 예금증서 CD 금리는 1998년 연 15%까지 뛰었지만 2001년 연 5.3%까지 떨어졌다. 풍부한 유동성이 부동산으로 흘러들면서 집값폭등을 가져온 셈이다. 당시에 비하면 현재의 금리는 훨씬 낮은 수준이다. 5일 현재 CD금리는 2.41%로 유동성은 800조원을 넘어섰다. 물론 다른 점도 존재한다. 당시에는 모든 집값이 회복세를 탔다. 그러나 지금은 서울 강남과 버블세븐 등 오르는 곳만 오르고 있다. 스피드뱅크 박원갑 소장은 “주택 가격 상승에 대한 기대감이 살아나고는 있지만 과거와 같은 급등장세가 재연되기는 힘들다”면서 “수요자들이 철저히 입지여건과 가격을 따져 인기상품에만 쏠리는 경향이 커질 것”이라고 내다봤다. 전문가들은 집값은 하반기 이후에는 혼조 혹은 소폭 상승세를 이어갈 것으로 내다봤다. 강남 등 버블세븐지역은 강보합세가 예상되지만 실수요자가 많은 수도권 외곽 등은 기업구조조정 물가상승 소득감소 등을 이유로 상대적으로 회복 속도가 늦어질 것이라는 진단에서다. 저금리 과잉 유동성으로 치솟은 일부 집값은 조정받을 가능성이 있다는 지적도 나오고 있다. 건설산업전략연구소 김선덕 소장은 “정부의 대출 규제가 현실화되면 상승률은 둔화되겠지만 투자수요가 밀집된 인기지역의 국지적인 상승세는 계속될 것으로 보인다”고 말했다. 정유미기자 youme kyunghyang.com 관련기사 정부 “집값·대출 급등지역 규제 강화” 증시서 자금 이탈…부동산 쏠림 우려 대한민국 희망언론 경향신문 구독신청 hp smile.khan.co.kr ⓒ 경향신문 경향닷컴 www.khan.co.kr 무단전재 및 재배포 금지 〈경향닷컴은 한국온라인신문협회 www.kona.or.kr 의 디지털뉴스이용규칙에 따른 저작권을 행사합니다.,https://news.naver.com/main/read.nhn?mode=LSD&mid=shm&sid1=260&oid=032&aid=0002018503,183
144431,2009.07.05. 오후 6:45,부동산,한겨레,16㎞ 물길 흐르는 ‘수로도시’ 다양하고 실속있는 공간 매력,한겨레 김포한강새도시 본보기집 가보니 경기 김포 한강새도시에서 올해 첫 합동 분양이 이뤄진다. 성우종합건설 케이씨씨 KCC 건설 화성산업 등 3개 건설사가 소형과 중대형 등 2200여가구를 한꺼번에 내놓아 수요자들의 선택을 기다리고 있다. 지난달 우미건설이 중대형 아파트를 분양하면서 관심을 모은 한강새도시는 수도권 서부지역을 대표하는 2기 새도시로 떠오르고 있다. 천혜의 자연환경을 활용해 인근 한강물을 끌어들임으로써 파주새도시와 함께 수도권의 대표적인 ‘수로도시’로 조성되는 곳이다. 이번에 출사표를 던진 3개 건설사의 본보기집은 김포시 장기동 새도시 들머리에 마련됐다. 성우·KCC·화성 등 2200여가구 합동분양 친환경 생태도시 조성…교통여건도 우수 넓어진 실속평면 눈길 케이씨씨건설의 ‘스위첸’은 공급면적 80㎡형 전용 59㎡ 중소형 1090가구로만 구성돼 있다. 평면은 다섯 가지를 선보여 실수요자의 선택폭을 넓혔다. 방은 2 3개의 소형이지만 발코니를 확장해 15㎡가량 면적을 늘릴 경우 3 4인 가족도 넉넉하게 거주할 수 있는 실속 있는 구조이다. B형은 대면형 주방을 채택해 거실이 넓고 D형은 현관 입구에 다용도실인 ‘알파룸’을 만들어 눈길을 끌었다. 단지에서 400ｍ거리에 경전철역이 들어설 예정이다. 화성산업이 짓는 ‘파크드림’은 수요층이 가장 많은 전용 84.9㎡형 648가구로 구성돼 있다. 평면은 A B C 세가지 주택형으로 꾸몄다. 방 3개와 거실이 나란히 배치된 ‘4베이’ 평면으로 돼 있어 눈길을 끈다. 1층을 모두 필로티 1층을 비우고 2층부터 아파트가 들어서는 설계 방식으로 짓는다. 성우종합건설은 전용 101 131㎡ 중대형으로 구성된 아파트 465가구를 공급한다. 전용 101㎡형은 안방에 대형 옷장을 설치한 공간 활용이 눈에 띈다. 122㎡형의 경우 넉넉한 거실과 2.6ｍ 1층과 최고층 로 높인 천장이 한결 시원한 느낌을 준다. 122 131㎡형은 김포대수로를 바로 옆에서 조망할 수 있다는 게 장점이다. 분양가는 9일께 확정될 예정이다. 업체들이 예상하는 가격은 3.3㎡당 1000만원 안팎이다. 소형인 스위첸은 3.3㎡당 895만 910만원 화성파크드림은 960만 970만원 중대형인 성우오스타는 1050만 1080만원으로 예상된다. 주거환경 쾌적할 듯 김포 한강새도시의 특징은 친환경성이다. 택지조성 사업자인 한국토지공사가 마련한 ‘생태환경 특화방안’에 따라 수로도시를 기본 개념으로 한 친환경 생태도시로 조성된다. 수로 길이는 총 16㎞이다. 새도시 구석구석을 연결하는 수로와 실개천은 도시에너지 소비로 인한 ‘열섬 현상’을 해소하는 물순환 네트워크를 형성하게 된다. 또 수로를 따라 꾸며지는 공원과 문화시설 상가는 입주민의 여가활동과 관광자원으로 활용된다. 새도시 중심부의 남북을 관통하는 너비 20 30ｍ 길이 3.1㎞의 수로가 건설되면 요트와 소형 유람선이 다닐 수 있을 것으로 보인다. 새도시 동쪽 한강변에는 60만㎡의 조류생태공원이 조성되고 어린이들의 환경 체험과 학습 공간으로 활용될 환경체험학습관 에코센터 이 들어선다. 교통 여건도 우수한 편이다. 한강새도시는 서울 도심에서 약 26㎞ 떨어져 있으며 인천국제공항 김포공항 서울외곽순환고속도로 등이 인접해 수도권 서부지역의 교통 요충지로 꼽힌다. 올림픽대로에서 새도시 입구를 잇는 고촌 운양나들목간 김포고속화도로가 내년 말 완공될 예정이며 지하철 9호선 김포공항역과 새도시를 잇는 경전철 건설이 2012년 완공 목표로 추진되고 있다. 인근 새도시에 접근하기도 쉽다. 서남쪽으로 인천 검단새도시 청라 경제자유구역 개발이 한창이며 북쪽으로는 일산 파주새도시 등이 가깝다. 일산대교를 건너면 바로 일산새도시에 닿는다. 토지공사는 이런 입지적 장점을 활용해 정보기술 반도체 등 첨단산업과 정보통신센터 등을 유치함으로써 디지털산업도시의 면모를 갖춘다는 계획이다. 규제 완화에 따른 혜택도 있다. 김포는 비과밀억제구역이어서 새 아파트 계약자는 5년간 양도세 100% 면제 혜택을 받는다. 공공택지 전매 제한 완화로 김포새도시 아파트 계약자가 분양권을 되팔 수 있는 기간도 짧아졌다. 전용면적 85㎡ 초과는 계약일로부터 1년 85㎡ 이하는 3년이 지나면 전매할 수 있다. 최종훈 기자 cjhoon hani.co.kr 세상을 보는 정직한 눈 한겨레 한겨레신문 구독 한겨레21 구독 ⓒ 한겨레신문사 무단전재 및 재배포 금지 한겨레는 한국온라인신문협회 www.kona.or.kr 의 디지털뉴스이용규칙에 따른 저작권을 행사합니다.,https://news.naver.com/main/read.nhn?mode=LSD&mid=shm&sid1=260&oid=028&aid=0002003337,183
