,date,cat,co,headline,text,url,week
6790,2006.03.16. 오전 11:38,부동산,헤럴드POP,청담동 동양파라곤 웃돈만 10억원…경기도는 마이너스 프리미엄,3월 입주하는 서울 및 수도권 아파트분양권 주상복합 포함 가운데 서울 강남구 청담동 동양파라곤이 가장 높은 프리미엄을 형성한 것으로 조사됐다. 16일 부동산정보업체 스피드뱅크 www.speedbank.co.kr 가 3월에 입주하는 서울과 수도권 아파트의 프리미엄을 조사한 결과 강남구 청담동 동양파라곤 88평형이 분양가 17억6450만원에 10억3550만원의 프리미엄이 붙어 3월 입주 단지 중 가장 많은 웃돈이 붙은 것으로 나타났다. 총 92가구로 소규모 아파트지만 재건축 규제에 따른 공급량 감소 전망 및 강남권 중대형 아파트에 대한 희소성이 커지면서 수요자들의 관심이 증폭된 가운데 높은 프리미엄을 형성한 것으로 풀이된다. 7호선 청담역이 도보로 5분 거리이며 봉은초 언북초 봉은중 청담중 청담고 경기고 등 학군이 뛰어나다. 88평형은 27억 29억원 71평형은 23억 25억원 선에 각각 시세가 형성됐다. 분양가 대비 매매가 상승률 면에서는 1000여 가구 이상 대단지인 서대문구 천연동 천연뜨란채 30A평형이 81.86% 올라 가장 높은 상승률을 기록했다. 1억7184만원의 분양가에 1억4066만원의 프리미엄이 붙어 현재 평균 매매가는 3억1250만원 선이다. 이밖에 마포구 중동 울트라참누리는 월드컵공원이 가까운데다 상암DMC센터 가좌ㆍ수색ㆍ증산뉴타운 개발 경의선 및 인천국제공항철도 전철 신설 등의 호재가 맞물리면서 24평 33평형의 중소평형대 구성에도 불구하고 비교적 높은 프리미엄을 형성했다. 33평형은 9720만원 24평형은 8893만원의 웃돈이 붙었다. 반면 경기지역은 분양가보다 시세가 낮은 이른바 ‘역프리미엄’ 현상을 빚었다.의정부시 신곡동 한일유앤아이 20평형은 8000만 9200만원 선으로 분양가보다 2000만원 가량 하락했다. 주변 시세보다 분양가가 다소 높게 책정되면서 프리미엄이 형성되지 못한 것으로 조사됐다.,https://news.naver.com/main/read.nhn?mode=LSD&mid=shm&sid1=260&oid=112&aid=0000033862,10
6791,2006.03.16. 오전 11:33,부동산,MBN,개발속도 빠른 가좌...뉴타운을 가다,뉴타운을 가다 네 번째 시간 오늘은 사업추진속도가 가장 빠른 곳 가운데 한 곳입니다. 서울 상암월드컵 경기장과 가깝고 향후 서울 서부권의 새로운 중심지로 떠오를 가좌뉴타운을 강호형 기자가 다녀왔습니다. 서울 상암월드컵 경기장과 인접해 있고 디지탈 미디어시티가 조성되는 지역과 인접해 있는 가좌 뉴타운. 830여 가구가 들어서는 1 2구역의 경우 다음달 이주를 시작하고 철거에 들어가는 등 사업 진행속도가 가장 빠른 곳 중의 한 곳 입니다. 모두 8천 900여가구가 들어가는 3 4구역도 연말까지 재개발 사업계획 승인을 마칠 예정이고 3년후에는 분양이 가능 할 것으로 전망되고 있습니다. 인터뷰 강호형 기자 가좌 뉴타운은 사업속도가 빠른 것에 비해 가격은 저평가 돼있어 많은 관심을 모으고 있습니다. 10평형의 소형 지분의 경우 평당 천 600 천 700만원에 거래돼 인근 아현 2차뉴타운 보다 평균 20% 정도 저렴합니다. 인터뷰 정미애 밝은미래 부동산 가좌 뉴타운은 꾸준하게 거래가 된다. 급매물은 바로바로 소화가 되고 작은 지분들도 3일 정도면 바로 거래가 된다. 인터뷰 전영진 예스하우스 대표 전체 사업건립규모에 비해 조합원수가 적고 상대적으로 일반분양 물량이 많아 조합원들의 분양수익이 클 것으로 예상된다. 특히 가좌 뉴타운은 내년말 홍제천 복원이 완료됨에 따라 생태공원 등이 들어선다는 호재도 안고 있습니다. 인터뷰 현동훈 서대문구청장 뉴타운과 홍제천 복원이 시너지 효과를 일으켜 지역경제나 주민들의 주거환경을 살리는데 큰 기여를 할 것이다. 가좌 뉴타운은 2008년 개통 예정인 문산선 가좌역이 인접해 앞으로 관심은 더욱 높아질 것으로 보입니다. mbn뉴스 강호형입니다.,https://news.naver.com/main/read.nhn?mode=LSD&mid=shm&sid1=260&oid=057&aid=0000034924,10
6792,2006.03.16. 오전 11:32,부동산,MBN,청담동 동양파라곤 88평형 웃돈만 10억원,이번달 입주하는 서울 강남구 청담동 동양 파라곤 아파트 88평형의 프리미엄이 10억원을 넘는 것으로 나타났습니다. 부동산정보업체 스피드뱅크에 따르면 이번달 입주하는 아파트의 프리미엄을 조사한 결과 분양가 17억6천여만원이었던 동양파라곤 88평형의 평균 매매가가 28억원으로 프리미엄은 평균 10억3천여만원인 것으로 조사됐습니다. 이 아파트는 총 92가구로 소규모지만 재건축 규제에 따라 강남권에 공급량이 감소할 것으로 전망되면서 높은 프리미엄이 형성된 것으로 스피드뱅크는 분석했습니다.,https://news.naver.com/main/read.nhn?mode=LSD&mid=shm&sid1=260&oid=019&aid=0000093973,10
6793,2006.03.16. 오전 11:27,부동산,이데일리,재경부차관 8.31 후속대책 조만간 발표할 것,이데일리 하수정기자 박병원 재정경제부 차관은 16일 정례브리핑에서 8.31 대책을 중심으로 한 부동산 가격안정 대책에 대한 후속대책은 지금 논의중이다 라며 정확하게 언제쯤이라고 말할 수 는 없지만 조만간 발표할 것 이라고 밝혔다.,https://news.naver.com/main/read.nhn?mode=LSD&mid=shm&sid1=260&oid=018&aid=0000364331,10
6794,2006.03.16. 오전 11:17,부동산,헤럴드POP,상가빌딩사무실도 보유세 통합과세,오는 2008년부터 상가ㆍ빌딩ㆍ사무실 등도 주택처럼 토지분과 건물분이 합해진 가격이 공시되고 관련 세금도 이 가격을 기준으로 부과된다. 16일 재정경제부와 건설교통부 행정자치부에 따르면 정부는 상가ㆍ빌딩ㆍ사무실에 대한 통합과세를 위해 내년에 관련법을 개정 2008년부터 시행할 예정이다. 정부 관계자는 “상가ㆍ빌딩ㆍ오피스텔 등에 대한 통합과세는 2008년부터 시작할 계획이지만 가격산정과 공시방법에 따라서는 2009년부터 시행할 가능성도 있다”고 말했다. 현재 상가ㆍ빌딩ㆍ오피스텔이 바닥에 깔고 있는 토지에 대해서는 개별공시지가로 건물분에 대해서는 지방세법상 시가표준액으로 가격을 각각 산정해 보유세를 부과하고 있다. 특히 건물분에 대한 시가표준액 방식의 가격 산정은 ㎡당 47만원에다 각 특성을 감안하는 것이어서 시가에 비해 저평가돼 있다는 지적을 받아왔다. 또 토지분에 대해서는 재산세와 종합부동산세가 부과되지만 건물은 종합부동산세가 없다. 이에 따라 2008년부터 상가ㆍ빌딩ㆍ오피스텔에 대한 보유세가 늘어날 가능성이 높다. 정부 관계자는 “가격산정과 공시방법은 내년 상반기에 가닥이 잡힐 것”이라며 “영업용 건물은 주택과 달리 형태가 다양하고 수익성도 감안해야 하기 때문에 가격 산정이 쉽지 않은 문제점이 있다”고 설명했다.,https://news.naver.com/main/read.nhn?mode=LSD&mid=shm&sid1=260&oid=112&aid=0000033845,10
6795,2006.03.16. 오전 11:15,부동산,머니투데이,단독주택공시 예정가격 인터넷통해 본다,머니투데이 김정태 기자 서울시는 내달 28일 공시예정인 단독주택 공시예정가격을 시민들의 편의제공을 위해 서울시 홈페이지를 통해 내일 17일 부터 열람할 수 있도록 했다고 16일 밝혔다. 단독주택 공시예정가격 열람방법은 서울시홈페이지 hp www.seoul.go.kr 에 접속해 주택공시 및 예정가격 열람 배너를 클릭한 후 주택의 지번을 입력하면 조회할 수 있다. 또 각 자치구의 홈페이지에서나 직접 해당구청 세무부서를 방문해도 확인이 가능하다. 공시예정가격에 대한 의견이 있는 주택소유자 등은 의견 제출기간 3월17일 4월6일 중에 의견 제출서를 작성해 해당구청 세무부서에 제출하면 된다. 주택공시가격은 주택의 건물과 토지를 합한 가격으로서 부동산가격공시 및 감정평가에 관한 법률 에 의해 공시해 취득세 등록세 재산세 등의 과세표준 등으로 활용되고 국세인 양도소득세증여세 및 종합부동산세의 과표의 기준이 된다. 다세대 아파트 등 공동주택공시예정가격의 경우도 건설교통부 홈페이지 hp www.moct.go.kr 를 통해 열람하거나 서울시 홈페이지에서 건설교통부 홈페이지를 링크시켜 열람할 수 있도록 했다. 의견이 있는 공동주택 소유자 및 이해관계인은 의견제출서를 작성해 인터넷을 통해 직접 건설교통부장관에게 제출하거나 해당구청 세무부서에 제출하면 된다. 서울시는 제출된 의견에 대해서도 평가심의를 거쳐 서울시 홈페이지 또는 건설교통부 홈페이지를 통해 동일한 방법으로 내달 28일 이후부터 열람할 수 있도록 할 예정이다.,https://news.naver.com/main/read.nhn?mode=LSD&mid=shm&sid1=260&oid=008&aid=0000640990,10
6796,2006.03.16. 오전 11:13,부동산,머니투데이,청담 동양파라곤 71평 웃돈 10억원,머니투데이 원정호 기자 서울 강남구 청담동 동양파라곤의 71평형 평균 매매 가격이 24억원으로 분양가 14억2000만원에 무려 9억8000만원의 웃돈이 형성된 것으로 조사됐다. 16일 부동산정보업체 스피드뱅크가 이달 입주하는 서울과 수도권 아파트의 매매가를 조사한 결과 청담동 동양파라곤이 가장 높은 프리미엄을 형성한 것으로 나타났다. 이 아파트 88평형 평균 매매가는 28억원으로 분양가 17억6450만원에 10억3550만원의 프리미엄이 붙었다. 이는 3월 입주 단지 중 가장 많은 웃돈이다. 또 71평형은 분양가 대비 상승률이 68.89%로 이 아파트 평형 중 가장 높은 상승률을 보였다. 스피드뱅크는 청담 동양파라곤이 92가구의 소규모 아파트이지만 재건축 규제에 따른 강남권 공급량 감소와 중대형 아파트에 대한 희소성이 커지면서 높은 프리미엄을 형성한 것으로 분석했다. 1000여 가구 이상 대단지인 서대문구 천연동 천연뜨란채 30A평형은 분양가에 비해 81.86% 올라 3월 입주 아파트 중 가장 높은 상승률을 보였다. 1억7184만원의 분양가에 1억4066만원의 프리미엄이 붙어 현재 평균 매매가는 3억1250만원 선이다. 반면 경기지역은 분양가보다 시세가 낮은 역프리미엄 현상을 빚었다. 의정부시 신곡동 한일유앤아이 20평형은 8000만 9200만원 선으로 분양가보다 2000만원 가량 하락했다. 주변 시세보다 분양가가 다소 높게 책정되면서 프리미엄이 형성되지 못한 것으로 풀이됐다.,https://news.naver.com/main/read.nhn?mode=LSD&mid=shm&sid1=260&oid=008&aid=0000640988,10
6797,2006.03.16. 오전 11:11,부동산,머니투데이,왕십리 뉴타운사업 본격화,머니투데이 김정태 기자 왕십리 뉴타운사업이 본격화된다. 서울시는 왕십리뉴타운 1구역 3만여평을 주택재개발정비구역으로 지정·고시했다고 밝혔다. 왕십리 1구역은 성동구 하왕십리동 339 67번지일대 총 33만7000㎡로 230%의 용적률을 적용해 최고 25층 이하의 공동주택 1842가구 임대 333세대 를 짓게된다. 서울시는 이 지역에 부족한 초등학교용지 1개소와 공원 왕십리뉴타운 3개구역을 연결하는 내부순환보행통로 등을 확보해 쾌적하고 살기좋은 주거여건을 조성할 예정이다. 정비구역으로 지정된 왕십리 1구역은 앞으로 환경영향평가와 토지등 소유자 5분의4 이상의 동의를 얻어 성동구청에 조합설립인가 신청서를 제출할 예정이다. 왕십리 1구역은 앞으로 재개발조합 설립과 세부건축설계 건축심의 등을 거쳐 올해 안으로 사업시행인가가 가능할 것으로 보인다. 총면적 33만7200㎡ 약10만평 규모의 왕십리뉴타운은 지난 2002년10월23일 시범사업 후보지로 선정됐으며 왕십리 2구역은 지난해 8월 4일에 정비구역 지정 고시한 바 있다.,https://news.naver.com/main/read.nhn?mode=LSD&mid=shm&sid1=260&oid=008&aid=0000640984,10
6798,2006.03.16. 오전 11:00,부동산,머니투데이,건교부 11000 수치 지형도제작 착수,머니투데이 문성일 기자 건설교통부 산하 국토지리정보원은 전기·가스와 같은 지하시설물을 체계적으로 관리하고 도시정보시스템 UIS 구축에 기반이 되는 1 1000 수치 지형도에 대한 올해 사업계획을 확정했다고 16일 밝혔다. 수치 지형도 사업은 측량에 관한 중장기 발전계획 과 국가지리정보체계구축 NGIS 기본계획 에 따라 전국 84개 시급 도시지역을 대상으로 지난 1995년부터 매년 대상도시를 선정하여 사업을 추진해 왔다. 올해 수요조사 결과 수치지형도 수정·제작을 국가에 위탁할 지자체를 대상으로 선정된 17개 도시에 대해서는 사업에 소요되는 비용의 50%를 국가에서 지원한다. 정보원은 사업을 일괄 추진한 후 최종 성과를 해당지자체에 제공할 계획이다. 지자체에서 자체 시행할 경우 국토지리정보원에서는 전문적인 기술 등을 지원할 예정이다. 올 사업을 위해 정보원은 105억9600만원을 투입 인천 등 17개시에 대해 2479도엽 620㎢ 을 신규로 제작하거나 수정해 최신의 지형정보가 활용될 수 있도록 할 방침이다. 특히 올해 추진하는 사업은 2007년부터 세계측지계가 전면적으로 사용하게 됨에 따라 모든 사업을 세계측지계를 적용 추진할 계획이다. 또 신장비인 GPS INS 범지구위치결정체계 관성측량시스템 등의 보급과 활용 촉진을 위해 일부사업을 시범 적용키로 했다. 정보원은 올 상반기 중 모든 사업을 발주 연말까지 사업을 완료하도록 추진할 예정이다. 정보원 관계자는 17개 지자체는 국가에서 예산을 50% 지원 받음으로써 저렴하게 고품질의 수치지형도를 제작할 수 있을 뿐 아니라 최신의 지형정보가 제공돼 각종 GIS업무와 유시티 U City 구축에 활력소가 될 것 이라며 대규모 사업이 발주됨에 따른 측량 산업과 경제 활성화에도 기여할 것으로 기대된다 고 말했다.,https://news.naver.com/main/read.nhn?mode=LSD&mid=shm&sid1=260&oid=008&aid=0000640963,10
6799,2006.03.16. 오전 10:43,부동산,머니투데이,다음 판교신도시 정보서비스 24일 오픈,머니투데이 백진엽 기자 판교 신도시 청약을 위한 다양한 정보가 포털 사이트를 통해 제공된다. 16일 다음커뮤니케이션은 판교 청약 정보 사이버 모델하우스 VOD스트리밍 서비스 등 판교 신도시 청약을 위한 부동산 정보 서비스를 오는 24일부터 시작한다고 밝혔다. 특히 이번 서비스는 국내 최초로 오프라인이 아닌 온라인에서만 모델하우스 정보를 공개해 관심을 끌고 있다. 다음커뮤니케이션은 이번 판교 청약 사업에 대한 정보제공 포털 사업자로 선정 판교 신도시 주택 2만9250세대 가운데 3월말에 첫 분양하는 9420세대에 대한 다양한 부동산 정보 서비스를 다음부동산 hp estate.daum.net 을 통해 선보인다. 다음부동산 은 판교특집 및 청약공고 등의 청약정보 VR파노라마를 이용한 3차원 형식의 콘텐츠 사이버모델하우스 케이블 방송에서 촬영한 모델하우스 특별방송 VOD 스트리밍 서비스 등을 제공한다. 특히 다음의 사이버 모델하우스는 가상현실을 이용해 청약 희망자가 안방에 앉아서도 실제 모델하우스에 간 것과 같은 정보를 얻을 수 있도록 했다. 마우스 조작을 통해 화면 확대 및 다시보기 서비스 등이 가능해 모델하우스 내부를 자세히 살펴볼 수 있다. 또 VOD 스트리밍 서비스에서는 케이블TV에서 제작한 판교신도시 개발계획 입지여건 및 주변 편의시설 등 기본적인 사항과 업체별 모델하우스 평형별로 내부를 자세히 소개하는 내용이 담기게 되어 오프라인 모델하우스 관람과 같은 생생한 정보가 제공된다. 다음은 청약 대상자들이 일시적으로 몰릴 경우 발생할 수 있는 인터넷 트래픽 문제를 해결하고 사이버모델하우스 및 VOD 스트리밍 서비스 등 고용량 파일 서비스를 안정적으로 제공하는 데 주력할 방침이다. 아울러 이번 판교 부동산 정보 서비스를 계기로 다음부동산뿐 아니라 검색 및 미디어다음 등 다양한 서비스와의 연계를 통해 시너지를 창출한다는 계획이다.,https://news.naver.com/main/read.nhn?mode=LSD&mid=shm&sid1=260&oid=008&aid=0000640949,10
6800,2006.03.16. 오전 10:42,부동산,연합뉴스,청담동 동양파라곤 88평형 웃돈만 10억원,서울 연합뉴스 박성제 기자 이달 입주하는 서울 강남구 청담동 동양파라곤 아파트 88평형의 프리미엄이 10억원을 넘는 것으로 나타났다. 16일 부동산정보업체 스피드뱅크에 따르면 이달 입주하는 서울과 수도권 아파트의 프리미엄을 조사한 결과 분양가 17억6천450만원이었던 동양파라곤 88평형의 평균매매가는 28억원으로 프리미엄은 평균 10억3천550만원이었다. 이 아파트는 총 92가구로 소규모지만 재건축 규제에 따라 강남권에 공급량이 감소할 것으로 전망되면서 높은 프리미엄이 형성된 것으로 스피드뱅크는 분석했다. 71평형 78평형 87평형 등도 8억6천 9억7천만원의 프리미엄에 거래되고 있다. 서대문구 천연동 천연뜨란채는 애초 분양가가 낮아 프리미엄이 높지는 않지만 분양가 대비 프리미엄의 상승률로는 이달 입주 아파트중 최고를 기록했다. 분양가 1억7천184만원이었던 30평 A형은 1억4천66만원 분양가대비 81.9% 분양가 1억6천452만원이었던 30평 B형은 1억2천500만원 76.0% 의 프리미엄이 각각 형성됐다. 그러나 일부 아파트는 분양가보다 시세가 낮은 역프리미엄 현상이 빚어지고 있어 양극화가 심각한 것으로 분석됐다. 의정부시 신곡동 한일유앤아이가 대표적으로 분양가 1억600만원이었던 20평형은 평균매매가가 8천600만원으로 분양가보다 2천만원 하락했으며 33평형도 분양가 1억7천900만원보다 1천900만원 낮게 거래되고 있다.,https://news.naver.com/main/read.nhn?mode=LSD&mid=shm&sid1=260&oid=001&aid=0001246309,10
6801,2006.03.16. 오전 10:41,부동산,헤럴드POP,상가 빌딩 사무실 통합과세…양극화 심화될듯,오는 2008년부터 상가ㆍ빌딩ㆍ사무실 등에도 주택처럼 토지분과 건물분이 합해진 가격이 공시되고 관련 세금도 이 가격을 기준으로 부과돼 8ㆍ31에 따른 주택ㆍ토지에 이어 제2의 세금폭탄이 예상된다. 특히 상가와 오피스텔 등에 통합과세가 시행될 경우 재산세와 종합부동산세 등 보유세 부담은 물론 상속ㆍ증여세 등 관련세 부담이 늘어나게 된다. 또 임대료 상승 등의 부작용도 뒤따를 것으로 전망된다. 현재 상가ㆍ빌딩ㆍ오피스텔이 바닥에 깔고 있는 토지에 대해서는 개별공시지가로 건물분에 대해서는 지방세법상 시가표준액으로 가격을 각각 산정해 보유세를 부과하고 있다. 또 건물분에 대한 시가표준액 방식의 가격 산정은 ㎡당 47만원에 불과하고 각 특성을 감안하는 것이어서 시가에 비해 저평가돼 있는 게 사실이다. 토지분에 대해서는 재산세와 종합부동산세가 부과되지만 건물은 종합부동산세가 없어 보유세 부담이 덜했다. 정부의 발표대로 이를 전면 통합과세할 경우 상가ㆍ빌딩ㆍ오피스텔에 대한 보유세가 2008년부터 크게 늘어날 가능성이 높다. 현행 사업용 토지의 경우 종부세 대상이 40억원 이상이지만 통합과세가 시행될 경우 그 대상이 대폭 늘어나 매물이 크게 증가할 것으로 보인다. 이로 인해 매매시장이 위축될 공산이 크다. 그러나 10억원대 미만 개별점포 위주인 분양시장의 경우 큰 영향은 없을 전망이다. 이에 따라 상가 분양시장의 쇼핑몰과 주상복합 등은 고전을 지속하는 반면 대규모 택지개발지구나 역세권 등 근린상가 분양시장은 선전하는 등 양극화가 지속될 전망이다. 또 세금 증가에 따른 부담을 임차인에게 전가해 임대료 상승 등의 부작용이 생길 것으로 전문가들은 보고 있다. 영업용 건물의 경우 일반 주택과 달리 형태가 다양하고 수익성도 감안해야 하기 때문에 가격 산정에 어려움이 커 논란이 제기될 가능성도 큰 것으로 지적되고 있다. 상가뉴스레이다 박대원 연구원은 “통합과세가 이뤄질 경우 종부세 대상은 대폭 늘어날 전망이지만 종부세 기준이 40억원 이상이기 때문에 개별투자자 중심의 분양시장에는 별영향이 없을 것”이라며 “다만 주상복합이나 대형 쇼핑몰 등의 경우 세부담 증가에 따른 임대료 전가 등으로 시장 분위기가 더욱 위축될 것”으로 전망했다. 한편 부동산시장에서는 정부의 이 같은 방침이 간헐적으로 나온데다 오는 2008년이 정권 변화시기인 만큼 시행 가능성 여부는 여전히 미지수라는 시각도 없지 않다.,https://news.naver.com/main/read.nhn?mode=LSD&mid=shm&sid1=260&oid=112&aid=0000033828,10
6802,2006.03.16. 오전 10:39,부동산,이데일리,판교 30평형대 계약금만 8000만원,계약금 20% 5월 하순까지 마련해야 중도금은 40%까지만 대출 가능 이데일리 남창균기자 판교신도시는 당첨도 어렵지만 입성도 어려울 전망이다. 보름만에 8000만원 정도의 계약금을 마련해야 하는데다 중도금대출도 40%에 불과하기 때문이다. 게다가 계약후 10년 동안은 전매를 할 수 없어 자금이 부족한 입주자는 자칫 흑자부도 를 낼 우려도 있다. 16일 관련업계에 따르면 건영은 32평형 기준층 분양가를 4억990만원에 책정했으며 계약금으로 분양가의 20%를 받기로 했다. 이 분양가가 그대로 결정될 경우 당첨자는 5월 하순까지 계약금 20% 8198만원을 마련해야 한다. 판교 분양업체들은 대부분 계약금을 분양가의 20%로 정했다. 최근 3 4년 동안 대부분의 아파트는 분양촉진책의 일환으로 계약금을 5 10%만 받아왔으나 판교는 분양성이 뛰어나기 때문에 계약금을 낮출 이유가 없다는 게 업체측의 설명이다. 이에 따라 판교 분양대금은 계약금 20% 중도금 60% 잔금 20%를 내야 한다. 건영 32평형의 경우 중도금 1억6396만원 40% 을 대출받는다고 해도 2억4594만원 60% 은 입주 때까지 스스로 마련해야 한다. 여기에 등기를 내려면 취득 등록세 1803만원 4.4% 25.7평 이하 을 내야 한다.,https://news.naver.com/main/read.nhn?mode=LSD&mid=shm&sid1=260&oid=018&aid=0000364294,10
