,date,cat,co,headline,text,url,week
56974,2007.06.21. 오후 3:22,부동산,머니투데이,건설면허 1호 삼부토건 첫 해외공사는 현대建,머니투데이 문성일 기자 숫자로 돌아 본 한국 건설산업 60년 태동 60년을 맞은 한국 건설산업은 그동안 격동의 시기를 보내며 건설 강국으로서의 위상을 갖추게 했다. 척박한 여건에서도 도로 철도 등 사회기반시설을 건설해 오는 동시에 국가 경제 발전의 견인차 역할을 수행해 왔다. 해외시장에선 연간 200억 달러라는 전무후무한 기록 달성이 예상되는 등 외화획득의 선봉자 역할도 하고 있다. 기록으로 한국 건설산업 60년을 되돌아본다. ◇60년 이상된 건설사는 설립 60년을 넘은 건설기업은 현대건설을 비롯해 남광토건 삼환기업 대림산업 HHI 중앙건설 극동건설 등 모두 7개사다. 이 가운데 대림산업이 1939년 10월 설립돼 가장 오래됐으며 HHI는 1940년 9월 설립됐다. 이와 함께 삼환기업과 중앙건설은 각각 1946년 3월과 7월 탄생했다. 극동건설 4월 현대건설 5월 남광토건 7월 등은 각각 1947년에 건설업을 시작했다. ◇건설업 면허 1호 업체는 토목공사와 건축사업을 주로 수행하고 있는 삼부토건이 국내 건설업 면허 1호 기업이다. 1955년 설립한 삼부토건은 1963년 12월1일 건설업 면허를 취득했다. 1976년 6월 기업공개를 했다. 2006년 기준 시공능력평가액 순위 26위를 달리고 있다. 해외건설업 면허 1호는 경남기업이다. 태국에 진출하면서 1965년 11월 해외건설업 면허를 낸 경남기업은 시평 순위 16위로 지난해 9544억원의 매출을 올렸다. ◇해외 첫 진출공사 자타가 공인하는 국내 대표 건설사인 현대건설이 1965년 12월 태국 파타니 나라타왓 고속도로공사를 수행한 것이 한국 건설기업의 해외 첫 사업이다. 이 공사는 태국 건설성 도로국이 발주한 IBRD 차관공사로 국제경쟁입찰에서 현대건설이 당시 서독 일본 등 16개국 29개 업체를 누르고 낙찰받았다. 태국 남단 말레이시아와의 국경 부근에 위치한 두 도시 파타니와 나라티왓을 잇는 2차선 연장 98㎞의 고속도로 공사로 1966년 1월 착공해 1968년 3월 완공했다. 당시 공사비는 522만 달러였다. 1965년 말 태국 파견 기술진과 노무자들이 김포공항 출국시 방송사가 실황 중계까지 했을 정도로 이 공사 수주는 국가적인 경사로 부각됐다. ◇건설수주액 1조원 첫 돌파업체는 삼성물산은 1991년 1조1236억원을 수주 국내 건설기업 중 사상 처음으로 1조원 기록을 돌파했다. 삼성물산 건설부문은 지난해 5조2014억원의 매출을 올리는 등 업계 2위를 달리고 있다. ◇현 최고령 건설CEO 건설기업 최고경영자 가운데 최고 연령자는 대륙건설의 조운태 회장이다. 1922년 6월16일생인 조 회장은 현재 86세다. 대륙건설은 전남 담양군 소재 중견기업으로 현재 시평 순위 435위다. ◇해외건설 총 외화획득 규모 올 5월 말 현재 국내 건설관련 기업이 해외에서 벌어들인 외화는 2251억 달러다. 앞서 지난해 4월 2000억 달러를 돌파했다. ◇최대 해외건설 수주 프로젝트 동아그룹의 모기업인 동아건설이 수주한 리비아 대수로공사가 역대 단일 공사 최대 규모의 프로젝트다. 1983년 11월 수주한 이 공사의 공사금액은 103억9000만 달러로 단일 공사 중 세계 최대 규모다. 세계 8대불가사의 라고 불릴 만큼 세계적으로도 관심을 모은 리비아 대수로는 남부 사하라사막의 지하수를 끌어올려 북부 지중해안 도시들에 공급하기 위해 건설된 수로다. 지름 4m 길이 7.5m 총길이 4264㎞에 이르는 거대한 송수관을 사막을 가로질러 지하에 매설하고 그 속으로 하루 650만톤의 물을 북부 지중해 연안에 공급하게 된다. 대수로 사업은 완공된 1단계 1874㎞와 1996년 통수식을 가진 2단계 1670㎞ 3·4단계 1720㎞ 등 5개 수로가 계획돼 있다. 투입인원이 연 2600만명에 달하며 공사기간도 30여년이나 된다. ◇국내 진출 1호 해외건설업체 1996년 10월14일 서울 지점을 낸 일본의 ㈜후지타가 해외건설기업으로는 처음으로 국내에 진출했다. 자본금은 2000억원이며 서울지점장은 이시이 토모히로 石井友博 다. ◇국내 최장 대교는 부산 수영구 남천동과 해운대구 우동을 잇는 총 길이 7310m의 광안대교가 국내에서 가장 긴 다리다. 2003년 1월6일 준공된 현수교로 2층 복층 구조의 왕복 8차로다. 이어 경기도 평택시와 충남 당진군을 잇는 총 길이 7310m의 서해대교가 국내에서 두 번째로 긴 다리다. 대림산업과 LG건설 현 GS건설 이 시공 2000년 11월 개통됐다. ◇국내 최고층 건물 서울 강남구 도곡동에 위치한 타워팰리스3차가 국내에서 가장 높은 건물이다. 2002년 10월 준공된 이 주상복합단지는 지하8 지상69층으로 높이는 262m다. 2위는 256m 지하6 지상69층 인 서울 양천구 목동 하이페리온이며 63빌딩은 249m 지하3 지상60층 로 3위에 랭크돼 있다.,https://news.naver.com/main/read.nhn?mode=LSD&mid=shm&sid1=260&oid=008&aid=0000798007,76
56975,2007.06.21. 오후 3:14,부동산,뉴시스,대한주택보증 아파트 223가구 등 공매,서울 뉴시스 대한주택보증은 주택분양보증 이행 과정에서 확보한 아파트와 상가 등을 25일부터 한국자산관리공사의 전자입찰 시스템인 ‘온비드 www.onbid.co.kr ’를 통해 매각한다고 21일 밝혔다. 매각되는 부동산은 아파트 223가구와 상가 4개 점포 등이다. 경기 안성시 대덕면 유안아파트는 총 476가구 중 221가구가 최초분양가에서 15% 할인된 가격으로 입찰에 붙여진다. 23평형 155가구 의 최저가격은 6000만원대 32평형 66가구 은 8700만원대이다. 또 경기 포천군 신북면 거산아파트 단지 내 상가 4개 점포 중 101 102 103호는 분양가의 30%인 900만원에 104호는 2500만원에 입찰에 부쳐진다.,https://news.naver.com/main/read.nhn?mode=LSD&mid=shm&sid1=260&oid=003&aid=0000462162,76
56976,2007.06.21. 오후 3:09,부동산,파이낸셜뉴스,쌈지 288만주 추가상장 결정,쌈지는 보통주 288만여주를 추가상장키로 결정했다고 21일 공시했다. 이로써 쌈지의 총 주식수는 2093만주가 되었으며 추가상장에 따른 보호예수 수량은 185만주로 2008년까지 5월 28일까지 거래가 불가능하다.,https://news.naver.com/main/read.nhn?mode=LSD&mid=shm&sid1=260&oid=014&aid=0000315349,76
56977,2007.06.21. 오후 2:41,부동산,이데일리,국민銀 통합본점 대우빌딩 대안은,대우빌딩 탈락..여의도 IFC 등 유력 이데일리 김현동기자 대우센터 빌딩의 인수 우선협상대상자로 외국계 회사가 선정되면서 국민은행의 통합본점 부지 대안이 어디로 정해질까에 관심이 모아지고 있다. 국민은행이 그 동안 검토해온 이전 후보지는 여의도 서울국제금융센터 IFC 신축부지 여의도 통일주차장 부지의 파크원 빌딩 상암동 디지털미디어시티 DMC 도심개발이 예정돼 있는 용산 명동 상업지구 등이다. 21일 금융권에 따르면 금호아시아나그룹이 추진 중인 서울역 앞 대우센터빌딩의 인수 우선협상대상자로 외국계인 모간스탠리가 선정된 것으로 알려졌다. 통합본점 이전 후보지로 대우빌딩을 낙점하고 공개적으로 인수 의지를 피력했던 국민은행 입장에서는 서둘러 대안을 마련해야 할 상황이다. 현재 여의도 IFC 신축부지와 통일주차장 부지의 파크원 PARC1 빌딩 상암동 DMC 등이 대우빌딩을 대신할 대안으로 거론되고 있다. IFC 신축부지와 파크원 빌딩은 상암동 디지털미디어시티 DMC 에 비해 도심에서 가깝다는 이점을 가지고 있다. 다만 가격 문제가 변수로 작용할 것으로 예상된다. 도심개발이 예정돼 있는 명동지역은 6000여명에 달하는 본점 인력이 입주할 만한 기존 건물이 없어 신축이 불가피하다. 이 경우 통합본점 마련까지 7 8년 이상의 시간이 소요된다는 점이 단점이다. 국민은행 관계자는 대우빌딩 최종입찰 결과가 나오면 빠른 시일 내에 차기 계획을 밝힐 것 이라며 현재 2 3곳의 대안을 추진 중인데 연내에는 부지를 최종 확정할 것 이라고 말했다. 국민은행은 다음달 초쯤 통합본점 이전 차기 후보지를 발표할 것으로 알려졌다. 강정원 국민은행장은 지난해 신년사부터 본점을 한곳에 모으기 위한 통합사옥에 대한 결정을 연내에 확정하겠다 고 밝혔지만 1년이 넘도록 부지확정을 못하고 있다. 국민은행 060000 은 현재 6000여명에 달하는 본점 근무 인력이 여의도 증권선물거래소 뒤편의 옛 주택은행 본점 국회 앞 옛 장기신용은행 본점 명동의 옛 국민은행 본점 종암동 전산센터 등 6곳에 분산돼 있어 통합사옥을 찾고 있다.,https://news.naver.com/main/read.nhn?mode=LSD&mid=shm&sid1=260&oid=018&aid=0000493983,76
56978,2007.06.21. 오후 2:38,부동산,머니투데이,檢 재개발 비리 삼성물산 압수수색2보,머니투데이 장시복 기자 재개발 사업 비리 를 수사 중인 서울중앙지검 형사8부는 서울 길음 뉴타운 재개발 사업과 관련해 삼성물산이 비리에 연루된 단서를 잡고 21일 오후 1시께 경기 성남시 분당에 있는 본사에 대해 압수수색을 실시했다. 검찰은 삼성물산 임원들이 길음지구 재개발 조합 측에 금품을 건넨 정황을 확보하고 압수수색에 들어간 것으로 알려졌다. 앞서 검찰은 지난 2월초 삼성물산 건설부문 성북사업소를 압수수색해 회사 측이 재개발 조합장 정모 씨에게 조합장 선거를 앞두고 억대의 금품을 건넸다는 단서를 확보했다.,https://news.naver.com/main/read.nhn?mode=LSD&mid=shm&sid1=260&oid=008&aid=0000797974,76
56979,2007.06.21. 오후 2:36,부동산,머니투데이,검찰 삼성물산 본사 압수수색1보,머니투데이 이승호 기자 검찰이 서울 길음 뉴타운 재개발사업 비리와 관련 삼성물산에 대해 전격 압수수색을 실시했다. 삼성물산은 21일 서울중앙지방검찰청 형사8부가 경기도 성남시 분당에 있는 본사에 대해 압수수색을 실시했다고 밝혔다. 업계는 검찰이 삼성물산 임원들이 재개발조합측에 금품을 건넨 정황을 확보하고 이날 압수수색에 들어간 것으로 보고 있다. 삼성물산 관계자는 검찰이 회사 본사에 대한 압수수색을 하고 있는 것은 맞다 며 현재 상황을 파악중에 있다 고 말했다. 한편 검찰은 올해 2월초 삼성물산 건설부문 성북사업소를 압수수색해 회사측이 재개발조합장 정모씨에게 조합장 선거를 앞두고 억대의 금품을 건넸다는 단서를 확보했다.,https://news.naver.com/main/read.nhn?mode=LSD&mid=shm&sid1=260&oid=008&aid=0000797972,76
56980,2007.06.21. 오후 2:32,부동산,문화일보,서울 아파트값 상승 작년의 110 수준,올 상반기동안 서울 아파트 값이 지난해 같은 기간의 10분의 1 수준인 1.43% 오른 것으로 조사됐다. 정부의 각종 부동산 대책의 영향으로 아파트 시장이 안정세를 보인 것이다. 전국 아파트 값도 이 기간 1.91%로 소폭 상승했다. 21일 부동산정보업체 부동산뱅크에 따르면 서울 아파트 값은 지난해 말 평당 평균 1584만원에서 20일 현재 평당 평균 1607만원으로 1.43% 상승한 것으로 나타났다. 지난해 같은 기간 12.15% 급등한 것과 비교하면 10분의1 수준으로 집값 오름세가 둔화된 셈이다. 특히 재건축 아파트 단지의 약세로 1.25% 하락한 강남권이 서울 아파트 값 약세를 주도한 것으로 조사됐다. 이 기간 비강남권은 3.16% 올랐다. 지난해 경기 성남시 판교신도시 분양 호재와 부녀회 집값 담합을 등에 업고 가격 상승세를 보였던 신도시 아파트 값도 올해 상반기에는 0.70%만 상승하는 데 그쳤다. 신도시 중에는 부천시 중동이 3.06% 올라 가장 높은 상승률을 보였다. 안양시 평촌 0.96% 성남시 분당 0.81% 고양시 일산 0.23% 순이었다. 경기지역은 지난해 말 평당 평균 808만원이던 매매가가 834만원으로 오르며 3.27%의 상승했다. 경원선 개통에 따른 호재로 의정부시 17.40% 양주시 8.85% 동두천시 8.62% 등 경기 북부지역이 상승장을 주도했다. 하지만 지난해 전국 아파트 값 상승률 1위에 올랐던 과천시는 재건축 아파트의 하락으로 6.31% 떨어졌다. 전국 아파트 값 평당 평균 매매가는 지난해 12월 말 평당 778만원에서 현재 793만원으로 1.91% 상승했다. 길진홍 부동산뱅크 팀장은 “올해 상반기 아파트 매매시장은 연초부터 쏟아낸 1·11대책과 1·31대책 등의 영향으로 지난해까지 계속된 집값 폭등을 마감하고 안정세로 접어들었다”며 “전국 전세시장도 2.38%의 변동률을 보이며 지난해 상반기보다 하락해 매매 전세시장이 모두 안정세를 보였다”고 말했다.,https://news.naver.com/main/read.nhn?mode=LSD&mid=shm&sid1=260&oid=021&aid=0000197144,76
56981,2007.06.21. 오후 2:30,부동산,파이낸셜뉴스,대한주택보증 아파트 등 227건 공매,대한주택보증은 주택분양보증 이행과정에서 확보한 아파트와 상가 등 부동산 227건을 오는 25일부터 한국자산관리공사의 전자입찰 시스템인 온비드 www.onbid.co.kr 를 통해 매각한다. 이번에 매각되는 부동산은 경기 안성시 대덕면 유안아파트 476가구중 221가구가 최초 분양가에서 15% 할인된 가격에 입찰에 부쳐지는 것을 비롯해 아파트 223가구와 상가 4개점포 등이다. 이번 공매대상 부동산에 관한 자세한 정보는 한국자산관리공사의 온비드와 대한주택보증 홈페이지를 통해 확인할 수 있다.,https://news.naver.com/main/read.nhn?mode=LSD&mid=shm&sid1=260&oid=014&aid=0000315330,76
56982,2007.06.21. 오후 2:29,부동산,이데일리,서울 랜드마크빌딩 외국계 독차지,대우센터빌딩 외국계 우선협상대상자 선정 팬택신사옥·스타타워 등도 외국계 소유 이데일리 윤진섭기자 서울 도심 랜드마크 빌딩이 미국 유럽 호주 등 외국계 투자자 손으로 속속 넘어가고 있어 국부유출 논란이 다시 불거질 전망이다. 외국 자본은 이미 외환위기 이후 국내 빌딩에 투자해 짭짤한 수익을 올린 바 있으며 거래세와 양도세 문제로 세무당국과 마찰을 빚기도 했다. 21일 업계에 따르면 금호아시아나그룹은 서울역 앞 대우센터빌딩의 우선협상대상자로 외국계 투자법인을 선정했다. 대우빌딩 인수전에 나선 외국계는 호주계 종합 금융회사인 맥쿼리은행의 부동산투자기관인 맥쿼리글로벌프로퍼티스와 모간스탠리로 이들 회사는 코람코 국민은행보다 높은 인수가격으로 제시한 것으로 알려졌다. 이중 모간스탠리가 우선협상대상자로 유력한 것으로 알려졌다. 서울 상암동 디지털미디어시티 내 팬택 신사옥도 외국계가 매입했다. 네달란드계 종합금융회사인 ING그룹는 최근 서울 상암동 디지털미디어시티 DMC 내 2만평 규모의 팬택 신사옥 빌딩을 공개입찰을 통해 2000억원 평당 1000만원 에 매입했다. 지난달 완공된 이 빌딩은 지하 5층 지상 22층 규모의 최첨단 인텔리전트 빌딩으로 공사대금만 660억원이 투입됐다. 또 미국계 투자은행인 모간스탠리는 애경 ARD홀딩스 소유의 경기 성남시 분당구 삼성플라자 빌딩 내 매장을 제외한 9 20층의 인수 우선협상대상자로 선정돼 가격 협상을 벌이고 있다. 여의도 일대 대표적 증권사 빌딩도 외국계 소유다. 독일계 운용사 DBRE는 최근 대우증권빌딩과 동양증권 빌딩을 매입했다. 매입가격은 대우증권빌딩 16층·연면적 3만8599평 1120억원 동양증권빌딩 21층·4만2346평 1300억원이다. 또 여의도 서울증권 빌딩과 명동 센트럴빌딩도 독일계 자본인 DEKA 소유다. 서울 옛 중소기업 전시장 부지에 들어서는 서울국제금융센터도 서울시와 미국의 종합금융회사 AIG가 공동으로 개발하는 사업이며 맞은편 통일주차장 부지에 들어서는 파크원도 모간스탠리 부동산 등이 공동으로 참여하고 있다. 이밖에 서울파이낸스센터 강남파이낸스센터 옛 스타타워 로담코타워 한솔빌딩 등도 외국계가 소유하고 있는 주요 빌딩이다.,https://news.naver.com/main/read.nhn?mode=LSD&mid=shm&sid1=260&oid=018&aid=0000493978,76
56983,2007.06.21. 오후 2:00,부동산,이데일리,파주신도시 9월 이후에나 분양,이데일리 남창균기자 파주신도시 아파트 분양이 다소 늦어질 전망이다. 주공은 이달 중에 21 34평형 1062가구를 분양할 예정이었으나 9월 이후에나 분양이 가능할 것으로 보인다. 건설교통부 관계자는 21일 문화재 발굴과 분양가상한제 시행 등으로 인해 파주신도시 분양 일정을 확정하지 못하고 있다 며 9월부터 분양가상한제와 청약가점제 등 새로운 제도가 시행되는 만큼 여기에 맞춰 분양하는 방안을 검토 중 이라고 밝혔다. 파주신도시 중소형 아파트 분양가는 평당 900만원 안팎에서 정해질 것으로 보인다. 중대형 아파트의 경우 일산신도시를 기준으로 채권입찰제가 적용되면 실분양가는 평당 1300만 1500만원선이 될 것으로 예상된다. 작년 9월 이 지역에서 처음으로 분양에 나선 한라 비발디 937가구 는 고분양가 논란 속에 평당 1257만 1499만원에 분양해 평균 4대1의 경쟁률을 기록했다. 파주신도시에서는 올해 안에 10여개 업체에서 분양물량을 내놓을 계획이다. 건교부에 따르면 이 지역 공급물량은 2007년 7857가구 2008년 6413가구 2009년 1만6485가구 2010년 1만5218가구 2011년이후 3만2291가구 등 총 8만여가구가 공급된다. 파주신도시는 운정1 2 3지구로 구성되어 있는데 1지구는 140만평 2지구는 133만평 3지구는 212만평 등이다. 교하지구까지 합치면 분당보다 더 크다.,https://news.naver.com/main/read.nhn?mode=LSD&mid=shm&sid1=260&oid=018&aid=0000493963,76
56984,2007.06.21. 오후 1:36,부동산,경향신문,OECD “한국 부동산 정책 집값 불안 요인”,경제협력개발기구 OECD 가 한국 정부의 종합부동산세와 분양가 상한제 등 부동산 대책들이 장기간 지속되면 공급감소로 인한 집값 상승 요인으로 작용할 가능성이 있다고 진단했다. 21일 OECD가 발표한 ‘2007 한국경제보고서’에 따르면 OECD는 “ 한국 정부의 부동산 정책들은 투기수요를 억제하고 단기적인 주택가격 변동을 제어하기 위한 정책”이라며 “가격 통제 정책보다 효율적인 부동산시장 조성에 초점을 맞춰야 한다”고 밝혔다. OECD는 이같은 정책으로 직접 수도권지역 주택담보인정비율 LTV 축소 종합부동산세 도입 2주택 이상 보유자 양도세 인상 분양원가 공개 및 분양가 상한제 등은 전체 주택공급과 주택가격에 부정적 영향을 초래할 가능성이 있다고 지적했다. 따라서 단기적 가격통제를 위한 정책 가운데 분양가 상한제와 분양원가 공개 정책을 폐지하는 대신 장기적 관점에서 건강한 부동산 시장을 만드는 데 주력하라고 OECD는 권고했다. 〈온라인뉴스센터〉 대한민국 희망언론 경향신문 구독신청 hp smile.khan.co.kr ⓒ 경향신문 미디어칸 www.khan.co.kr 무단전재 및 재배포 금지 〈미디어칸은 한국온라인신문협회 www.kona.or.kr 의 디지털뉴스이용규칙에 따른 저작권을 행사합니다.,https://news.naver.com/main/read.nhn?mode=LSD&mid=shm&sid1=260&oid=032&aid=0000230605,76
56985,2007.06.21. 오후 12:45,부동산,이데일리,재테크광고관리지역 평당13000원 홍천토지 최종마감,개발용이한 국도변 관리지역 이데일리 예전처럼 땅만 사 놓고 기다리면 알아서 올라주는 시대는 지났다. 단순한 토지투자 보다는 개발과 이용의 측면에서 접근하는 토지투자방법이 필요한 시대가 왔다고 전문가들은 말한다. 주 강원산림개발영농조합은 홍천군 내면 국도변에 접한 관리지역 토지를 평당13 000원에 선착순 분양한다. 이번 분양하는 관리지역 토지는 투자자들이 선호하는 2차선 도로와 방내천이 인접하고 조망권이 확보된 관리지역으로 1 000평 2 000평 단위로 소액투자가 가능하며 분양토지는 위탁관리를 통해 조합원이나 인근 현지 주민이 지속적으로 관리하는 등 농산물 소득도 동시에 얻을 수 있다. 서울 강일I.C에서 공사중인 동서고속도로 현대산업개발 가 2009년 개통되면 서울 강남기준 1시간대 접근이 가능하고 홍천과 평창을 연결하는 보래령터널 두산건설 이 개통되면 영동고속도로 I.C에서 10여분거리로 단축된다. 주변 도로여건이 좋아지고 있어 분양 토지의 지가상승이 기대된다. 공정한 분양을 위해 선착순 접수 방식으로 신청금 100만원을 농협 100086 55 000249 예금주 강원산림개발영농조합 으로 입금하면 필지 배정권을 부여 받아 답사 전 까지 분양토지를 확보 할 수 있다. 현장 답사 후 계약 결정이 가능하고 신청 철회시 전액 환불된다.,https://news.naver.com/main/read.nhn?mode=LSD&mid=shm&sid1=260&oid=018&aid=0000493938,76
56986,2007.06.21. 오후 12:20,부동산,이데일리,재테크광고호수앞 토지 17.800원 21필지 선착순분양,금일청약자 등기비용면제 혜택 제공 이데일리 파로호 호수 바로 앞 토지가 금일 최초로 분양되 투자자들의 관심이 집중되고 있다. 주 파로호랜드는 춘천과 화천 경계의 파로호 호수 바로 앞 토지 21필지를 선착순 분양한다고 밝혔다. 파로호는 춘천과 화천을 어우르는 우리나라의 명품 호수로 천혜의 자연환경을 가지고 있어 매년 관광객의 발길이 끊이질 않는 관광 명소이기도하다. 또한 서울 춘천 간 고속도로공사와 신북 북산을 관통하는 배후 령 터널이 한창 공사 중이어서 서울에서 1시간10분대 진입을 눈앞에 두고 있다. 주 파로호랜드는 호수 바로 앞 임야를 평당 17.800원 이라는 가히 파격적인 금액을 제시하고 있으며 분양 단위는 500평1000평 단위이로 큰 돈 들이지 않고 조망 좋은 토지를 구입 할 수 있는 좋은 기회를 제공해 투자자들에게 각광을 받을 것이 확실하다. 매각방식은 선착순 수의 계약방식으로 청약금 입금 후 필지를 배정받고 현장 답사 후 계약유무를 결정 하면 된다. 청약금은 100만원이며 농협 263 01 004194 법무사 김기완 현장 답사 후 청약 철회 시 청약금은 전액 환불되며 분양의 안전성을 더하기위해 자금관리 및 등기관련 모든 법률 행위는 법무사가 일괄 처리한다. 조기마감이 예상 되 빠른 결정이 필요하다.,https://news.naver.com/main/read.nhn?mode=LSD&mid=shm&sid1=260&oid=018&aid=0000493935,76
