,date,cat,co,headline,text,url,week
66999,2007.10.21. 오후 9:48,부동산,세계일보,분양가상한제 적용 피하려는 재건축·재개발 잰걸음,‘분양가 상한제를 피하자.’ 재건축·재개발 추진단지들이 분양가상한제 적용을 피하기 위해 잇따라 조합 총회를 열어 관리처분계획을 통과시키는 등 사업 추진에 속도를 내고 있다. 분양가상한제를 적용받으면 수익성이 크게 떨어지고 일부는 사업 자체가 힘들어지거나 불가능해지기 때문이다. 주택법 개정안에 따르면 재건축·재개발 단지는 지난 8월 말까지 사업시행인가를 신청했더라도 11월 말까지 관리처분인가를 신청하지 않으면 분양가 상한제를 적용받는다. 또 지방자치단체의 관리처분인가 전 30일 동안 공람공고를 해야 하기에 재건축 추진단지들은 이달 말까지 조합 총회를 열어 관리처분계획을 통과시켜야 한다. 21일 부동산정보업체 스피드뱅크에 따르면 전국의 재건축 추진 아파트 단지 가운데 이달 중 총회를 열어 관리처분계획을 통과시키면 분양가상한제를 피할 수 있는 곳은 모두 26개 단지 1만8000여가구로 나타났다. 이 가운데 지방 최대 재건축 단지인 부산 화명동 화명주공아파트 4146가구 조합은 지난 14일 부산 강서체육공원에서 총회를 열고 관리처분계획을 통과시켰다. 1997년 재건축 조합을 결성했던 화명주공은 올 초 시공사 불신임투표까지 벌이는 등 조합원 간 갈등이 심각한 수준이었으나 분양가 상한제 적용을 피하기 위해 한데 뭉쳤다. 이 단지는 15일부터 30일간 공람공고 이후 11월 15일 이후 관리처분인가를 신청 분양가 상한제 적용을 피한다는 방침이다. 주민 50%가 다른 지역으로 이주하는 등 재건축 사업 추진에 속도를 내는 서울 신림동 강남아파트 876가구 도 지난 15일 조합 총회를 열어 관리처분계획을 통과시키고 공람공고에 들어갔다. 지난해 지자체에 관리처분인가 신청을 냈지만 일부 주민들의 반대로 인가를 받지 못하는 잠원동 한신 5차 신반포·555가구 조합 역시 이달 중으로 반대 의견 조합원을 설득해 분양가 상한제를 피하겠다는 계획이다. 서울지역 재개발단지 조합도 분양가 상한제를 피하기 위해 막판 총력을 기울이고 있다. 사업시행인가를 받았던 강북구 미아 8구역은 지난 19일 총회를 열고 관리처분계획을 통과시켰으며 인근 미아 10 1구역도 이달 중으로 관리처분총회를 열 예정이다. 8월 말 사업시행인가를 신청했던 금호 15구역 조합은 관리처분계획 총회 통과를 위해 조합원 분양가 조절에 나선 상태이며 옥수 12구역도 총회를 이달 중 계획하고 있다. 스피드뱅크 김은경 팀장은 “일반분양이 없는 1대 1 재건축 단지는 상대적으로 바쁠 게 없지만 일반분양이 많은 저층 재건축 단지는 분양가 상한제가 적용되면 일반 분양가가 낮아지는 반면 조합원 추가부담금은 늘어날 확률이 높아 사업을 서두를 수밖에 없다”며 “조합원의 노력 여하에 따라 희비가 엇갈릴 것”이라고 말했다. 박세환 기자 greg segye.com 제17대 대선 특별 사이트 hp 17daesun.segye.com ⓒ 세계일보＆세계닷컴 www.segye.com 무단전재 및 재배포 금지 세계닷컴은 한국온라인신문협회 www.kona.or.kr 의 디지털뉴스이용규칙에 따른 저작권을 행사합니다.,https://news.naver.com/main/read.nhn?mode=LSD&mid=shm&sid1=260&oid=022&aid=0000254491,94
67000,2007.10.21. 오후 9:48,부동산,파이낸셜뉴스,LG그룹 용산개발사업 전격 참여,LG그룹이 프라임그룹과 손잡고 20조원대 초대형 개발프로젝트인 용산개발사업 수주전에 뛰어들었다. 21일 업계에 따르면 LG그룹은 150층짜리 초고층 빌딩을 인수해 그룹 사옥으로 사용하는 조건으로 현대건설 컨소시엄의 주간사인 프라임개발과 양해각서를 체결해 지분투자 방식으로 참여한다. 이에따라 오는 30일로 예정된 용산국제업무지구 사업자공모에는 삼성물산이 주도하는 삼성 GS컨소시엄 LG그룹이 참여하는 LG 프라임 컨소시엄 호주계 부동산펀드인 맥쿼리컨소시엄이 맞붙는 3파전으로 전개되게 됐다. LG 프라임 컨소시엄은 프라임 그룹이 디벨로퍼로 나서고 LG그룹이 재무적투자자 겸 주요임차인으로 참여하며 현대건설과 대림건설 등이 시공을 맡는 형태다. 그동안 용산국제업무지구 사업 수주전은 삼성물산 GS건설 포스코건설 현대산업개발 SK건설 금호산업 등 시공능력 10위권 업체가 대다수 포진한 삼성컨소시엄이 주도해왔으나 이번에 LG그룹이 프라임과 현대건설 대림건설컨소시엄에 참여하게 됨에따라 한치앞도 내다볼 수 없는 치열한 접전을 벌일 것으로 예상된다. LG 프라임그룹 컨소시엄 관계자는 “프라임 LG그룹 컨소시엄은 임차기업 및 부동산 투자자를 중심으로 출자자를 구성했다”면서 “이들이 용산국제업무지구에 들어서는 다양한 형태의 부동산을 사전 매입한다는 것이 큰 특징”이라고 말했다. 공모형 프로젝트파이낸싱 PF 형태로 진행되는 용산 국제업무지구 개발사업은 용산 코레일 부지와 서부이촌동을 포함 총 56만㎡의 사업부지에 주상복합과 업무·상업시설을 짓는 대규모 복합개발사업이다. 발주처인 코레일은 이달 30일 공모를 마감 다음달 2일 우선협상대상자를 선정한 후 2010년쯤 착공에 들어갈 방침이다.,https://news.naver.com/main/read.nhn?mode=LSD&mid=shm&sid1=260&oid=014&aid=0000351216,94
67001,2007.10.21. 오후 9:12,부동산,아시아경제,LG그룹 용산 랜드마크타워 인수 추진,LG그룹이 150층 안팎 높이의 용산 국제업무지구내 랜드마크타워 인수전에 뛰어든다. 21일 관련업계에 따르면 LG그룹은 랜드마크타워 인수를 위해 현대건설 컨소시엄에 참여했다. LG그룹은 랜드마크빌딩 인수를 조건으로 지분 투자를 하고 완공후 컨소시엄측으로부터 이를 사들이는 조건을 내건 것으로 알려졌다. LG그룹은 인수후 랜드마크타워를 사옥으로 사용할 계획인 것으로 전해졌다. 용산 국제업무지구 개발권을 두고 현대건설 컨소시엄과 경쟁중인 삼성건설 컨소시엄에는 삼성그룹이 참여할 것으로 보여 두 그룹의 경쟁도 치열할 전망이다. 랜드마크타워는 620m 높이에 150층 안팎으로 계획되고 있으며 현재 잠정가치가 5조원에 이를 것으로 전망되고 있다. 공모형 프로젝트파이낸싱 PF 형태로 진행되는 용산 국제업무지구 개발사업은 30일 공모를 끝내고 11월2일 우선협상대상자를 선정 2010년 착공에 들어갈 예정이다.,https://news.naver.com/main/read.nhn?mode=LSD&mid=shm&sid1=260&oid=277&aid=0000010353,94
67002,2007.10.21. 오후 8:46,부동산,이데일리,LG그룹 용산랜드마크타워 인수 추진,현대건설 컨소시엄 참여키로 삼성그룹과 랜드마크 타워 인수 경쟁 이데일리 윤진섭기자 LG 003550 그룹이 150층 안팎의 국내 최고층 빌딩인 서울 용산 국제업무지구 내 랜드마크타워 인수에 나선다. 21일 업계에 따르면 LG그룹은 올 봄 랜드마크타워 인수를 조건으로 프라임산업과 함께 현대건설 컨소시엄에 지분 투자로 참여했다. LG 003550 그룹은 완공 후 랜드마크타워를 매입 현재 사용 중인 여의도 쌍둥이빌딩 대신 본사 사옥으로 사용할 계획인 것으로 전해졌다. LG그룹이 현대건설 컨소시엄에 참여함에 따라 삼성그룹과의 경쟁이 불가피할 전망이다. 삼성그룹 역시 랜드마크타워 인수를 위해 삼성물산 건설부문 GS건설 포스코건설 등이 시공 참여키로 한 삼성건설 컨소시엄에 이미 참여하고 있는 것으로 알려졌다. 용산 국제업무지구 중심부에 들어설 예정인 랜드마크타워는 620m의 높이에 150층 안팎으로 계획돼 있다. 완공시 국내 최고층은 물론 세계에서 두 번째로 높은 건물이 된다. 현재 국제업무지구 공모에는 현대건설 컨소시엄과 삼성건설 컨소시엄 등이 수주전에 나서고 있다. 공모형 프로젝트파이낸싱 PF 형태로 진행되는 용산 국제업무지구 개발사업은 용산 코레일 부지와 서부이촌동을 포함 총 56만㎡의 사업부지에 주상복합과 업무·상업시설을 짓는 대규모 복합개발사업이다. 발주처인 코레일은 이달 30일 공모를 마감 다음달 2일 우선협상대상자를 선정한 후 2010년쯤 착공에 들어갈 방침이다.,https://news.naver.com/main/read.nhn?mode=LSD&mid=shm&sid1=260&oid=018&aid=0000529344,94
67003,2007.10.21. 오후 8:38,부동산,매일경제,고동현 동일하이빌 사장 중견 건설사 역량보여줘 뿌듯,image0 국내 건설업체로는 카자흐스탄에 처음 진출한 동일하이빌이 20일 첫 입주식을 가졌다. 고동현 사장은 카자흐스탄 대통령 중점사업에 외국 투자기업으로 참여한 것이고 한국식으로 마감한 아파트의 첫 입주식이어서 감격스럽다 면서 공사를 수행하면서 국내와 다른 환경ㆍ기후ㆍ인허가ㆍ시장 등으로 고생을 많이 했는데 그 모든 과정을 뚫고 입주식을 갖게 돼 뿌듯하다 고 말했다. 고 사장은 중견업체가 해외에 단순 도급이 아닌 개발사업으로 투자ㆍ인허가ㆍ분양ㆍ공사까지 자력으로 해냈다는 데 의미가 있다 면서 축적된 역량을 토대로 카자흐스탄을 비롯한 독립국가연합 CIS 시장에서 더 큰 힘을 발휘할 것 이라고 자신했다. －처음 입주하는 단지의 특징은. 건설사가 골조만 올려 팔던 카자흐스탄에서 처음으로 한국식 마감을 해 공급한다. 탁아소ㆍ유치원ㆍ학교 등이 단지 안에 갖춰진다. 대통령궁이나 대통령공원보다 조경이 더 좋다. 단지에서 300㎞ 떨어진 곳에서 20 30ｍ 크기 소나무를 가져와 심었다. －어려움은 없었나. 현지 협력업체 수준이 아직 미흡해 국내에서 많은 협력업체가 들어왔다. 그 과정에서 비자ㆍ국내 자재 운송 등의 어려움이 많았다. 현지업체 경험이 부족해 여러 업체를 붙였다. 특히 미장 분야에서는 15개 업체가 공동으로 참여했다. －시장 전망은. 1인당 국민소득이 지난해에 5000달러를 넘었다. 2 3년 안에 7000 8000달러까지 갈 것으로 예상된다. 매년 10% 이상 성장을 하고 있는 데다 아파트 값도 매우 높다. 서브프라임 모기지 부실 등으로 전 세계 부동산 가격 거품 우려도 있지만 일시적인 현상이라고 본다. －자금난에 대한 소문도 도는데. 들려오는 소문 때문에 마음고생을 많이 했다. 해외 사업에 처음 뛰어들면 수업료 지불이 불가피한 만큼 염려를 했다. 하지만 지금은 국내에서 조달한 자금을 거의 다 갚았고 현지에서 금융을 일으켜 사업을 하고 있다.,https://news.naver.com/main/read.nhn?mode=LSD&mid=shm&sid1=260&oid=009&aid=0000632676,94
67004,2007.10.21. 오후 6:51,부동산,한겨레,인천 송도 업무용 시설 뒷전 주상복합만 우뚝,한겨레 2003년 8월 송도·청라·영종지구 등 인천 3곳 부산 강서구와 경남 진해시 일대 광양만권이 경제자유구역으로 지정됐다. 이곳에 입주하는 첨단 외국 기업한테 기업활동 보장과 각종 규제를 완화하고 세제 혜택 등 인센티브를 줘 자본을 유치해 개발하기 위해서다. 그해 10월 본격적으로 사업을 시작했고 4년이 흘렀다. 하지만 진척이 빠른 인천조차 수익성이 높은 아파트 사업 위주로 진행되면서 부동산 시장 블루칩으로 떠올랐을 뿐 업무지역은 굼뜬 행진이 계속되고 있다. 부산·진해와 광양만권은 사실상 답보 상태다. ‘외자유치’ 유명무실 국내은행에서 자금 조달 개발권 독점 외국기업 ‘땅값 차익’만 수조원 치솟는 건물들 2003년 8월 송도 청라 영종지구 등 인천지역 3곳 209.4㎢ 6333만평·여의도 면적의 70배 가 처음으로 경제자유구역으로 지정됐다. 송도지구 5316만㎡는 국제비즈니스와 아이티·비티 등의 첨단산업도시로 영종지구 1억3807만㎡는 인천공항을 이용한 항공·물류 핵심도시로 청라지구 1775만㎡는 국제금융 및 레저단지로 특성을 갖춘 도시 개발을 추진해 왔다. 가장 빠른 송도국제도시는 11개 공구로 나눠 갯벌을 메워가며 도시를 조성 중이다. 1 4공구 12.67㎢는 이미 매립이 끝나 1·3공구 571만여㎡는 국제업무단지로 개발이 한창이고 나머지 2·4공구는 지식정보산업단지 첨단바이오단지 주거공간으로 개발돼 공동주택 6천여가구가 들어섰다. 국내 첨단기업과 외국인 투자기업 일부가 입주한 상태다. 매립 중인 5·7공구는 학술연구단지로 매립이 추진 중인 6·8공구는 세계에서 두 번째로 높은 151층 쌍둥이 빌딩 등 송도의 ‘랜드마크 시티’로 추진 중이다. 인천경제청은 “4년간 유치한 외국인 투자가 21건에 337억달러”라며 1 2년 내에 송도국제학교가 개교하고 인프라 사업이 마무리되면 외자유치가 본격화할 것이라고 확신했다. 과연 그럴까 돈 되는 아파트 주력 경제자유구역 지정 이후 첫 사업으로 선도사업 격인 송도국제도시내 국제업무단지 562만㎡ 173만평 의 경우를 보자. 인천시는 미국 게일사와 포스코건설 합작사인 송도국제도시개발유한회사 NSIC 에 2002년 3월 127억달러를 투자하기로 하고 토지매매계약을 맺고 개발권을 통째로 넘겼다. 그러나 유한회사는 국내 금융기관에서 프로젝트 파이낸싱 자금을 조달해 땅값을 지급하는 등 외자유치를 통한 자금조달은 거의 없다. 지난해 미국 투자은행인 모건스탠리가 1억5천만달러를 3년간 분할 투자하기로 했지만 아직 실행되지 않고 있다. 9월 말 현재 주상복합 아파트 등 공동주택이 11개 단지에 6801가구가 분양돼 주거시설은 전체 2만2460가구의 39.3%가 진행됐지만 상업·업무시설은 목표의 12.4%만이 착공됐다. 자금회수가 빠르고 경제성이 높은 주상복합빌딩 공동주택만 계획대로 진행되고 있다. 인천경제청은 수익성이 높은 공동주택 사업을 승인할 때마다 업무용 시설 등을 짓는 방법으로 개발을 독려하고 있지만 유한회사 쪽은 사업성이 떨어지는 업무 상업시설은 개발을 외면하고 주상복합건물의 사업승인을 먼저 내줄 것만을 요구하고 있다. “외국기업 배만 불려” 3.3㎡당 62만6천원에 매각된 국제업무단지는 땅값이 최고 20배까지 뛰어 차익만도 수조원에 달하고 있다. 151층의 쌍둥이 빌딩 건립을 추진 중인 6·8공구 330만㎡의 개발협약을 맺은 미국 포트먼 컨소시엄은 주거시설을 늘려 줄 것을 요구해 다른 지역에 짓기로 했던 주거시설 물량까지 가져다 주거시설 물량을 2만여가구로 늘린 것으로 알려졌다. 또 용유·무의관광단지 전체를 독일 켐핀스키그룹과 일괄 개발협약을 맺어 주민들이 ‘삶의 터전을 빼앗으려 한다’며 집단 반발하고 있다. 인천시 한 공무원은 “외국 기업이 시민 세금으로 매립한 땅을 헐값에 산 뒤 높은 가격으로 국내 아파트 건설사에 되팔아 엄청난 차익을 챙겨도 회수는 물론 지방세조차 추징하지 못하고 있다”며 “누구를 위한 개발인지 모르겠다”고 개탄했다. 인천 김영환 기자 ywkim hani.co.kr 광양·부산 ‘2020년 청사진’ 갈길 멀어 광양만 투자유치율 16% ‘주춤’ 부산·진해 용지 추가확보 ‘시급’ 광양경제자유구역 “청사진은 멋진데 아직 변화를 느끼지는 못하고 있어요.” 전남 광양상공회의소 이형석 진흥부장은 경제자유구역 지정 4돌의 성과를 이렇게 평가했다. 그는 “인천·부산과 달리 애초부터 기반시설과 입주기업이 적은 탓에 진척속도가 느리다”며 “67%가 분양된 율촌1산단을 빼고는 나머지 부분은 아직 개발도 되지 못한 게 현실”이라고 조바심을 전했다. 상공인들은 현재 광양항에 17선석의 부두시설이 갖춰졌고 땅값도 인천·부산에 견줘 10분의 1 수준인 3.3㎡당 40만 50만원에 불과한 만큼 투자유치나 도시개발에 탄력이 붙을 것이라고 내다봤다. 광양만권 경제자유구역은 전남 여수·순천·광양 경남 하동 일대 90.38㎢에 조성되고 있다. 동북아 물류중심 기지를 내세웠지만 정부의 ‘투 포트’ 정책에 이상기류가 감지되면서 약간 주춤한 상황이다. 애초 계획대로라면 2020년까지 11만1000명이 상주하고 8곳에 3만7000가구의 배후도시가 조성된다. 2020년까지 투자유치 목표는 200억달러인데 현재 32억달러에 그치고 있다. 부산·진해경제자유구역 광양만권보다는 투자유치와 도시개발의 여건이 좋은 편이다. 부산·진해 경제자유구역은 부산 강서구와 경남 진해시 일대 104.8㎢에 8조4406억원을 들여 건설되고 있다. 신항만은 물류·유통·해사 거점으로 명지지역은 국제업무지역으로 개발한다. 2020년에 인구가 23만5000명에 이르고 주택 8만4000가구를 공급한다. 외자유치는 9월 말 현재 확정된 19건 38억5000만달러 을 포함해 41건 45억달러 이 추진되고 있다. 그러나 경제자유구역 안 25.83㎢가 그린벨트로 묶여 실제 개발 면적은 80㎢를 넘지 않는다. 더욱이 생태적 가치가 높은 철새 도래지에 인접해 규제가 많고 부산과 경남의 이해관계가 엇갈려 마찰이 빚어진 탓에 현재 개발면적은 38.4㎢에 그치고 있다. 이 때문에 현재 개발 완료된 땅에는 기업유치가 거의 끝나 산업용지의 추가 확보가 시급한 상황이다. 광양 창원 안관옥 최상원 기자 csw hani.co.kr ⓒ 한겨레 hp www.hani.co.kr 무단전재 및 재배포 금지 신뢰도 1위 믿을 수 있는 언론 한겨레 구독신청 하기 한겨레는 한국온라인신문협회 www.kona.or.kr 의 디지털뉴스이용규칙에 따른 저작권을 행사합니다.,https://news.naver.com/main/read.nhn?mode=LSD&mid=shm&sid1=260&oid=028&aid=0000216822,94
67005,2007.10.21. 오후 6:21,부동산,서울경제,오피스 분양등 자산매각 계획 절반의 성공,삼성·LG그룹 용산 랜드마크 타워 인수전 컨소시엄 참여 기업들 빌딩 인수자 될 가능성 커 연면적 50만㎡오피스빌딩 가격 5兆원 달할듯 삼성ㆍLG그룹이 용산 국제업무지구 랜드마크 빌딩 매수전에 나선 것은 국내 최고층 빌딩을 과연 누가 차지하느냐 하는 것 외에도 이번 사업의 성패에 있어 상당히 중요한 의미를 갖는다. 공모형 프로젝트파이낸싱 PF 사업으로 진행되는 용산국제업무지구 개발사업은 코레일이 보유한 용산 철도창과 서부이촌동을 합쳐 총 56만6 000㎡의 부지에 주상복합과 오피스ㆍ호텔ㆍ백화점ㆍ쇼핑센터ㆍ문화공간 등 복합단지를 건설하는 것이다. 업계에서는 땅값만 10조 13조원 안팎 시공비와 금융비용 등을 합한 총사업비는 25조원 안팎이 될 것으로 추산하고 있다. 천문학적인 사업비가 투입되는 만큼 주상복합은 물론 오피스와 상업시설의 분양 또는 매각이 차질 없이 이뤄져야 이번 사업이 성공할 수 있는 것이다. 따라서 공모전에 참여하는 컨소시엄은 분양하는 주상복합을 뺀 오피스와 상업시설에 대한 매각 계획을 미리 짜놓게 마련이다. 예컨대 최근 롯데건설컨소시엄이 사업자로 선정된 판교 역세권 PF의 경우에도 사업계획서상에 오피스 39만㎡에 대한 매수자가 풍성건설ㆍ㈜신영 등으로 정해져 있었다. 이번 사업의 발주처인 코레일도 땅값뿐 아니라 이 같은 매각계획을 사업자 선정의 중요한 잣대로 삼고 있다. 현재 이번 공모전을 둘러싼 컨소시엄 경쟁구도는 삼성건설과 현대건설컨소시엄의 양강구도. 이 같은 상황에서 삼성그룹과 LG그룹이 각각 삼성건설컨소시엄ㆍ현대건설컨소시엄과 손을 잡음으로써 두 컨소시엄의 자산매각 계획이 ‘절반의 성공’은 보증받은 셈이 됐다. 아직 구체적인 사업계획이 공개되지는 않았지만 업계에서는 용산국제업무지구에 들어갈 오피스 빌딩과 상업시설의 연면적이 각각 130만㎡ 정도가 될 것으로 보고 있다. 이는 서울시내에서 한 해 공급되는 오피스 면적보다도 큰 규모다. 특히 랜드마크타워의 연면적은 대략 45만 50만㎡가 될 것으로 추산된다. 단순히 연면적으로만 계산해도 오피스 빌딩 전체의 절반에 육박한다. 더구나 국제업무지구 개발지의 중심이라는 입지와 랜드마크타워가 갖는 상징성을 생각할 때 액수로 환산한 랜드마크타워의 가치는 그 이상이다. 전문가들은 3.3㎡당 3 000만원을 기준으로 랜드마크타워가 5조원에 육박할 것으로 보고 있다. 두 컨소시엄은 다른 오피스에 대한 매각계획도 물론 잡아놓고 있다. 이와 관련해 두 컨소시엄의 구성을 주목할 필요가 있다. 삼성건설컨소시엄에는 GS건설과 포스코건설ㆍ롯데건설ㆍ현대산업개발ㆍSK건설ㆍ금호건설 등 시공능력순위 10위권 업체 중 대부분이 참여하고 있다. 이는 단순히 시공사의 구성을 넘어 관계사들의 잠재적인 구매력을 의미한다. GS그룹ㆍ롯데그룹ㆍ금호그룹 등이 잠재적인 빌딩 인수자가 될 가능성이 크다는 의미다. 삼성건설은 당초 안젤라 고든이라는 외국계 펀드에 오피스 부문을 일괄 매각하는 방안을 추진하다 최근 국내외 그룹 및 투자자를 상대로 빌딩별로 분리 매각하는 쪽으로 선회했다. 이에 따라 삼성건설은 실제 롯데그룹 등과 오피스 부문의 인수를 놓고 협상을 진행 중인 것으로 전해졌다. 시공사 구성에 있어서는 다소 열세지만 현대건설컨소시엄의 뒤에는 재계 2위인 현대차그룹이 버티고 있다. 현대차그룹 계열사인 엠코가 컨소시엄에 참여하고 있는 것. 현대차는 뚝섬과 판교 PF 용지 등에서 자동차박물관ㆍ호텔ㆍ컨벤션센터 등이 들어서는 대형 복합건물 건립을 추진하다 무산된 바 있어 최종적인 타깃이 용산이 아니냐는 관측을 낳고 있다. 연면적 65만㎡에 달하는 상가시설의 처리도 관건이다. COEX몰의 7 8배에 달하는 상가를 어떻게 채우느냐를 갖고 두 컨소시엄은 골머리를 앓고 있다. 이를 두고 업계에서는 “국내 유통사들이 다 들어와도 공간이 남을 것”이라는 얘기까지 나온다. 두 컨소시엄은 이와 관련 국내 대형 유통사 및 투자사들과 유치 협상을 벌이고 있다.,https://news.naver.com/main/read.nhn?mode=LSD&mid=shm&sid1=260&oid=011&aid=0000203640,94
