,date,cat,co,headline,text,url,week
26212,2006.10.02. 오후 5:06,부동산,파이낸셜뉴스,지방 부동산대출 ‘대란’,지방의 부동산 담보 집단대출이나 신규 대출 프로젝트파이낸싱 PF 대출이 사실상 중단됐다. 미분양 아파트가 속출하면서 금융당국이 고강도 창구 지도에 나섬에 따라 건설사의 여신 사업성 기준을 금융기관이 대폭 강화했기 때문이다. 또 지난달 25일 부활된 재건축 이익환수제 시행으로 재건축 시장이 리모델링 시장으로 전환 부동산 담보시장이 크게 위축되고 있다. 이에 따라 은행 투자제한→건설시장 위축→ 사업 포기→소비 감소→경기 위축 등 지방경제의 선순환 구조가 작동하지 않으면서 지방경기가 시계 제로에 빠져들고 있다. 2일 관련업계에 따르면 지방 경기 둔화와 함께 중소형 건설사의 자금 어려움이 가중되면서 사업을 포기하는 업체가 급증하고 있는 가운데 금융기관들도 집단대출이나 부동산 담보대출을 지양하고 새로운 대출수요 개척을 위한 여신정책으로 전환하고 있는 추세다. 이는 금융당국이 지방 부동산 담보대출에 대한 충당금 적립 비율을 높이는 한편 리스크 관리에 나서라는 창구 지시에 따른 것이다. 우리은행의 경우 지방의 집단대출 및 부동산 담보대출의 신규 기준을 만들어 운영에 들어갔다. 대구와 부산 등지에 건설한 대규모 아파트가 미 분양되면서 이 지역 부동산 관련 대출 기준을 강화하고 사업성 중심의 여신 기준을 만들어 각 점포에 시달했다. 또 100억원이 넘는 PF 대출은 취급하지 말도록 지시했으며 집단대출은 자금 회수가 가능한 중도금 대출에 치중하도록 했다. 이와관련 우리은행 관계자는 “최근 수도권을 제외한 지방 부동산 대출이 거의 전무한 실정이며 기준에 맞는 대출도 없다”면서 “당분간 이같은 기조가 지속될 것”이라고 말했다. 국민은행도 도급순위 100위 중 3분의 1에 해당되는 신용등급 BB 까지 적용하던 대출 기준을 BB 로 상향 조정했다. 다만 도급순위 60∼70위이더라도 수익성이 높은 사업에 대해서는 집단대출이나 PF 대출을 선별적으로 시행한다는 계획이다. 하나은행은 회사채 등급 BBB 건설사까지 제공하던 PF 대출을 최근 A등급으로 상향 조정했으며 BBB 이더라도 아파트 수요급증 지역 신도시 개발이나 재개발 등 사업성이 높은 사업에만 제한적으로 여신을 한다는 방향으로 내부 규정을 바꿨다. 그러나 집단대출은 금융기관간 금리 인하 경쟁을 맞출 수 없을 뿐 아니라 부동산 시장의 급락 우려에 사실상 여신을 포기한 것으로 알려지고 있다. 하나은행 관계자는 “지방경기의 위축 속도가 점차 빨라져 아파트 중도금이나 잔금 이주대금 등 집단대출의 부실 위험성이 커져 사실상 여신을 포기했다”고 말했다. 신한은행 여신 관계자도 “아파트 건설의 경우 초기 분양률이 적어도 30∼40%가량이 돼야만 사업성이 있다고 판단되는 만큼 전북 정읍 등 일부 지역을 제외하고는 대부분 미분양 상태여서 당분간 지방 대출을 자제하기로 했다”고 밝혔다. 이에 금감원 한 관계자는 “지방경기 하락 속도는 알려진 바와는 달리 더 심각한 수준”이라면서 “은행 스스로 리스크 관리에 나서겠지만 대출의 경우 충당금 비중을 높여야 할 것”이라고 말했다. 그러나 지방의 K 건설사는 “현재 변경된 은행 여신 기준으로는 대출을 받을 만한 건설사가 하나도 없고 여신 기준을 확대하고 있는 저축은행을 이용하자니 높은 금리에 수익성을 맞출 수 없어 엄두를 못내고 있다”면서 “지방경기의 연착륙을 유도하는 종합적인 대책이 나오지 않을 경우 지방 중소형 건설사의 연쇄 부도가 우려된다”고 지적했다.,https://news.naver.com/main/read.nhn?mode=LSD&mid=shm&sid1=260&oid=014&aid=0000248968,39
26213,2006.10.02. 오후 5:02,부동산,머니투데이,연립·다세대 경매 과열..고가낙찰 줄이어,머니투데이 문성일 기자 아파트와 연립 다세대 등을 중심으로 한 수도권 부동산 경매시장이 과열되고 있다. 부동산 경매시장은 아파트를 중심으로 강세가 이어져 왔으나 최근에는 연립과 다세대 경매물건에 감정가 이상을 써내는 고가낙찰자가 속출하는 등 인기가 훨씬 높다. 2일 경매업계에 따르면 지난달 25일 입찰을 실시한 서울 강서구 화곡동 화성빌라 15평은 9077만원에 낙찰 감정가 6000만원 대비 151.28%에 낙찰됐다. 이 물건 입찰에는 무려 44명이 참여한 것으로 집계됐다. 같은 날 입찰한 송파구 오금동 용수빌라 16평도 신건임에도 21명이 경합을 벌인 끝에 감정가 8000만원 의 154.73%인 1억2378만원에 낙찰자가 선정됐다. ◇연립·다세대 인기 짱 ..역대 최고치 잇따라 갱신 이처럼 최근 부동산 경매시장은 연립·다세대가 강세를 이끌고 있다는 점이 눈길을 끈다. 실제 지난 9월 중 수도권 연립·다세대 낙찰가율은 88.17%로 지난 2000년 이후 가장 높다. 서울의 경우 2002년 8월 94.60% 이후 최고인 92.63%를 기록했다. 낙찰률도 역대 최고치를 뛰어넘었다. 수도권 연립·다세대 평균 낙찰률은 46.15%로 역시 경매 통계가 본격 시작된 2000년 이후 최고다. 서울도 사상 최고인 51.96%를 나타냈다. 입찰경쟁률도 아파트 경쟁률을 위협하고 있다. 지난달 수도권 연립·다세대 물건의 경쟁률은 역대 최고치인 6.90대 1로 아파트 7.13대 1 경쟁률에 맞먹는 수준에 달했다. 서울은 같은 기간 6.50대 1을 기록하며 6.26대 1에 그친 아파트 경쟁률을 넘어섰다. 서울지역 9월 연립·다세대 경쟁률은 외환위기 이후 최고 수준이다. ◇개발 호재에 후분양·고분양가가 원인 이같은 과열 양상은 무엇보다 재개발 등 각 지역별 개발 호재가 가장 큰 원인으로 꼽힌다. 재개발사업지의 경우 대부분 연립이나 다세대가 주로 위치해 있어 이들 물건을 낙찰받아 앞으로 개발 이후에 시세차익을 노리겠다는 계산이 깔려 있다. 수도권에서는 부천이 가장 큰 관심이 이어지는 지역 가운데 한 곳이다. 이 곳은 재개발·재건축으로 추진되는 도시정비예정구역을 비롯 원미·소사·구강지구 등 총 190만평에 이르는 재정비촉진지구와 같은 호재도 전체적인 수요심리를 뒤흔들 정도다. 지난달 26일 실시한 부천 소사구 소사본동 오복빌라 12평형 경매에는 35명이 참여 9820만원에 낙찰됐다. 감정가 5500만원 대비 178.55%에 달한다. 역시 같은 날 입찰된 오정구 원종동 진주빌라 12평형도 최초 감정가 4200만원 의 150.90%인 6338만원에 낙찰자가 선정됐다. ◇시세보다 낮은 감정가 물건도 수두룩 경매 물건의 감정가격이 시세보다 낮은 것도 낙찰가율이 높아지는 원인 중 하나다. 상당수 물건이 지난해 하반기나 올 초 감정을 실시했기 때문에 이후의 가격 상승분이 반영되지 않았다는 것이다. 이는 아파트도 마찬가지다. 오는 9일 입찰을 실시할 예정인 서울 양천구 목동신시가지 11단지 27평형의 경우 최초 감정가격이 4억원이다. 시세가 5억1000만 5억8500만원인 점을 감안할 때 감정가로 낙찰받을 경우 적어도 30 40%의 시세차익을 얻을 수 있다. 이달 10일 입찰하는 강남구 일원동 우성7차 32평형의 감정가도 시세 7억9000만 8억9000만원 보다 최고 1억원 이상 낮은 7억5000만원에 불과하다. 같은 날 경매에 나오는 서초구 잠원동 반포한양 35평형도 시세 8억4250만 9억2000만원 에 비해 최고 20% 이상 싼 7억9000만원이다. 전문가들은 하지만 감정가격이 시세보다 낮더라도 지나치게 높은 가격에 낙찰받을 경우 등기비용 등을 감안할 때 오히려 손실이 날 수도 있다는 점에서 주변 가격 등을 꼼꼼히 따져본 후 경매에 나서야 한다고 지적했다.,https://news.naver.com/main/read.nhn?mode=LSD&mid=shm&sid1=260&oid=008&aid=0000706872,39
26214,2006.10.02. 오후 5:00,부동산,연합뉴스,경기도 저소득층 전세자금 신청하세요,수원 연합뉴스 안용수 기자 휠체어 타고 집 구하기가 어려워 서글픈 마음도 많이 들었는데...감사합니다 기초생활수급자이자 장애인인 김윤숙 34.여 씨는 2일 경기지방공사 사장 권재욱 에 감사의 편지와 함께 손수 깎아 만든 목각 천하대장군 지하여장군 한 쌍을 보내왔다. 김씨는 전셋집을 찾아 한 달을 넘게 헤매는 동안 번번이 거절만 당했다. 김씨가 장애인인 데다 모처럼 마음에 맞는 집이 나와도 전세자금이 부족했기 때문이다. 이때 김씨는 사회복지사를 통해 경기지방공사가 저소득층이나 장애인 차상위 계층 홀몸 노인 등을 상대로 기존 주택전세 임대사업 을 운영하고 있다는 사실을 알게 됐다. 경기지방공사의 도움으로 3천700만원짜리 전세를 얻게 된 김씨는 부모님이나 형제의 도움을 받지 않고 혼자 해결하는 게 쉽지 않았다 면서 여러모로 도움을 줘서 감사하다 고 말했다. 주택전세 임대사업은 지방공사가 입주자가 원하는 주택을 중개사무소에 의뢰해 집주인과 5천만원 한도에서 전세계약을 체결한 뒤 세입자와 재계약을 하는 맞춤형 주택 공급 방식이다. 세입자는 전세계약금이 5천만원일 경우 보증금 250만원에 월 임대료 12만원만 부담하면 된다. 도배나 장판도 60만원 내에서 무료로 지원해 준다. 이 제도는 도심 외곽에 국민임대주택을 건설해 지원하는 기존 방식과 달리 입주자가 거주하는 도심에 집을 구해줌으로써 실질적 도움을 줄 수 있다. 지방자치단체로서는 유일하게 지난 6월부터 이 제도를 운영하고 있는 경기지방공사는 올해 지원 목표를 300가구로 잡고 있으며 현재 고양.부천.성남에 160가구를 지원했다. 경기지방공사 관계자는 고객 성공경영이란 기치로 추진 중인 전세임대사업이 입주민들로부터 큰 호응을 받고 있다 면서 내년에는 사업을 더 확대하겠다 고 밝혔다.,https://news.naver.com/main/read.nhn?mode=LSD&mid=shm&sid1=260&oid=001&aid=0001427392,39
26215,2006.10.02. 오후 4:57,부동산,서울경제,SR개발 亞주택박람회서 건축등 2개부문 대상,㈜SR개발은 중국 부동산 포털사이트 소우펀 SOFUN 주최로 베이징에서 개최된 아시아 주택박람회 건축대상에서 중국 선양의 ‘SR국제신성’ 아파트가 아시아 건축대상 아시아 국제단지 대상 등 2개 부분에서 대상을 수상했다고 2일 밝혔다. SR국제신성은 지난해 중국 CCTV가 선정한 ‘2005년 가장 촉망되는 아파트’ 상하이 주택 박람회에서 ‘전 중국 10대 우수 단지’로도 각각 선정됐다. 또한 최근에는 2008년 베이징올림픽의 올림픽 선수촌 아파트로도 지정돼 중국인들의 주목을 받았다. 중국에서 한국 아파트의 위상을 높이고 있는 SR국제신성은 지난달부터 2기 2 200가구의 분양을 시작했고 2008년 6월 700실 규모의 특급호텔을 포함한 총 5 484가구를 완공할 예정이다.,https://news.naver.com/main/read.nhn?mode=LSD&mid=shm&sid1=260&oid=011&aid=0000151802,39
26216,2006.10.02. 오후 4:53,부동산,매일경제,전세금상승률 22개월만에 최고,지난달 소비자물가는 작년 같은 기간보다 2.4% 올라 안정된 모습을 보였다. 하지만 전세 대란으로 전세금 상승률은 1년10개월 만에 최고치를 기록했다. 통계청은 9월 소비자물가 동향 에서 지난달 소비자물가는 작년 같은 기간보다 2.4% 상승했고 지난달보다는 0.2% 하락했다고 2일 밝혔다. 계속된 장마와 폭염으로 작년 같은 기간보다 2.9%나 뛰었던 8월에 비하면 평년 수준을 되찾은 것이다. 올 들어 9월까지 소비자물가 상승률은 2.5%를 기록중이다. 도시가스 26.3% 와 택시요금 8.7% 상승 영향으로 지난달 공공서비스 물가는 5.6% 올랐다. 휘발유 가격은 1.1% 떨어졌지만 경유 7.9% 취사용LPG 15.0% 등유 2.9% 가격이 모두 올랐다. 특히 전세 구하기가 힘들어지면서 전세금이 1.0% 올랐다. 2004년 11월 1.1% 이후 1년10개월만에 가장 높은 수치다. 농산물 가운데 배추 35.2% 양파 35% 감자 34.8% 풋고추 27.2% 가격이 급등했다. 상추 20.9% 파 17.1% 쌀 3.8% 가격은 내렸다. 한성희 통계청 물가통계과장은 10월부터 농산물 가격이 안정을 되찾으면 연말까지 물가 하향 안정세가 유지될 것 으로 내다봤다.,https://news.naver.com/main/read.nhn?mode=LSD&mid=shm&sid1=260&oid=009&aid=0000534927,39
26217,2006.10.02. 오후 4:53,부동산,매일경제,아파트 분양원가 공개는 위헌,중견 주택건설업체들의 모임인 대한주택건설협회는 2일 노무현 대통령이 밝힌 분양원가 공개 결정은 헌법 위반 이라며 철회를 요구했다. 협회는 이날 서울 여의도 협회에서 고담일 회장 등이 참석한 가운데 열린 회장단 회의 끝에 아파트 분양원가 공개 확대 및 후분양제 조기시행에 대한 주택업계 입장 이라는 보도자료를 내고 이 같이 주장했다. 협회는 민간기업의 분양원가 공개는 기업의 영업상 비밀보장을 해치고 가격결정 권리를 본질적으로 침해한다는 점에서 자유주의 시장질서를 규정한 헌법 119조를 정면으로 위배할 소지가 있다 고 밝혔다. 협회는 또 분양원가 공개 의무화는 지나친 정부규제로 과잉규제를 금지한 헌법 37조 2항에도 반한다 며 분양원가의 산술적 계산은 무리인 만큼 부작용만 낳을 것 이라고 주장했다. 협회는 기부채납 비용 등은 분양 당시 원가 계산이 불가능하며 향후 원가가 높게 책정된 기업에는 여론몰이식 매도가 예상됨에 따라 주택사업의 정상적 추진이 불가능하다 고 말했다. 또 공개된 원가내역이 적정한지 검증하기가 어려워 원가공개제도의 실효성 자체가 의문시된다는 게 협회 주장이다. 이밖에 협회는 오세훈 서울시장이 밝힌 후분양제 조기 실시에도 반대 입장을 분명히 했다. 협회는 후분양제에서는 주택구입자금 전액을 단기간에 마련해야 하기 때문에 서민들의 주택마련이 더욱 힘들어지는데 금용비용 등을 가산해 주택을 분양하게 됨으로써 분양가격만 올라갈 것 이라고 서울시를 비판했다. 고 회장은 건설교통부 열린우리당 한나라당 국회 등에 원가공개 등의 문제점을 지적하고 철회를 요청할 계획 이라고 말했다. 한편 건교부 관계자는 세부적인 분양원가 공개 확대 방안이 결정되지도 않은 상황에서 위헌 가능성을 거론하는 것은 섣부르다 며 앞으로 구성될 분양가제도개선위원회 가칭 에서 위헌 소지가 없는 범위 내에서 방안을 마련할 것 이라고 말했다.,https://news.naver.com/main/read.nhn?mode=LSD&mid=shm&sid1=260&oid=009&aid=0000534925,39
26218,2006.10.02. 오후 4:51,부동산,YTN,토지 소유 집중 여전…1%가 57% 소유,앵커멘트 좀처럼 우리나라의 토지 소유 집중 현상이 해소되지 않고 있습니다. 토지 소유자 가운데 상위 1%가 전체 개인 소유 토지의 절반을 훨씬 웃도는 57%를 차지하고 있는 것으로 나타났습니다. 취재기자 연결합니다. 상수종 기자 토지 소유가 여전히 부익부 빈익빈 의 상태를 벗어나지 못하고 있다면서요 리포트 행정자치부가 지난해말 현재 우리나라 토지소유 현황을 집계한 결과를 발표했는데요. 상위 1% 그러니까 대략 50만 명이 전체 개인 소유 토지의 57%인 2만 7 821제곱킬로미터를 차지하고 있는 것으로 나타났습니다. 특히 이 가운데 상위 999명의 경우 여의도 면적의 179배 가까이 되는 천 501제곱킬로미터의 토지를 가지고 있는 것으로 집계됐습니다. 이를 1인당 평균 토지 소유 면적으로 환산하면 150만 제곱미터 대략 45만 평 정도가 되고 가격은 개별공시지가로 환산해 평균 207억 원 정도 됩니다. 개인별로는 전체 인구의 27.3%에 해당하는 천334만 명이 토지를 가지고 있고 세대별로는 주민등록 총세대수의 59.9%에 해당하는 천70만 세대가 토지를 소유하고 있는 것으로 나타났습니다. 지역별로는 서울 거주자의 전국 토지 보유 비율이 17.8%에서 17.6%로 약간 준 대신 경기도가 약간 늘었고 금액 비중에서도 서울이 34.1%로 2.2%p 준 반면 경기도는 25.5%로 4.3%p 늘었습니다. 연령별로는 60대 이상의 보유 토지가 줄면서 나머지 연령층의 토지가 늘었고 특히 40대가 보유 면적과 금액에서 모두 가장 많이 증가했습니다. 하지만 보유 규모에서는 50대가 전체의 26.5%로 가장 많았고 60대 25.3% 40대 21.6%의 순이었으며 30대와 20대 미만도 각각 8.4%와 1.9%의 토지를 가지고 있는 것으로 나타났습니다. 우리나라 전체 토지는 9만 9 646 제곱킬로미터로 1년 전보다 29제곱킬로미터 늘었지만 사유지는 200제곱킬로미터 넘게 줄었고 외국인 소유 토지는 38제곱킬로미터에서 55제곱킬로미터로 소폭 증가해 2000년 이후 140% 이상 늘었습니다. YTN 상수종 sjsang ytn.co.kr 입니다.,https://news.naver.com/main/read.nhn?mode=LSD&mid=shm&sid1=260&oid=052&aid=0000129826,39
26219,2006.10.02. 오후 4:51,부동산,서울경제,청약부금·소액 청약예금 추석후 청약기회 풍성,25.7평이하 민간분양 많아 추석 이후에는 전용면적 25.7평 이하 민영아파트가 많이 분양돼 그동안 분양시장에서 소외됐던 청약부금과 소액 청약예금 가입자들의 청약기회가 늘어날 전망이다. 2일 부동산 정보제공업체 스피드뱅크에 따르면 추석 연휴가 끝난 후부터 연말까지 수도권에서 민간 건설업체가 지어 일반분양하는 전용면적 25.7평 32 34평형 이하 중소형 아파트가 상대적으로 많은 것으로 조사됐다. 서울에서는 뉴타운 지역을 중심으로 중소형 아파트가 많이 공급된다. 우선 동부건설이 서내문구 남가좌동의 가좌뉴타운에서 중소형 아파트 471가구를 분양하는 데 이중 247가구가 일반분양된다. 동부건설은 북아현 뉴타운에 속해 있는 서대문구 냉천동 충정로 냉천구역에서도 179가구를 일반분양할 계획이다. 현대산업개발은 가좌뉴타운 내에서 200가구의 중소형 아파트를 일반분양하고 삼성물산 건설부문은 길음뉴타운 인근에 위치한 종암동에서 513가구를 일반분양한다. 롯데건설이 동대문구 용두동에서 공급하는 물량 중에서도 316가구는 청약통장 가입자들의 몫이다. 경기지역에서는 용인시 기흥구 구성동에서 대림산업이 404가구 기흥구 마북동에서 GS건설이 302가구에 대해 각각 청약을 받을 계획이다. 수원에서도 저밀도 주공아파트를 재건축해 공급하는 물량 중 일반에게 공급되는 중소형 평형이 많다. 삼성건설이 팔달구 인계동에서 392가구를 벽산건설이 팔달구 화서동에서 231가구를 각각 청약 가입자의 몫으로 공급한다. 권선구 입북동에서도 GS건설이 717가구를 일반분양한다. 안양시 동안구 비산동에서는 성원건설이 145가구를 안양시 만안구 석수동에서 대우자동차판매건설이 218가구를 각각 일반분양하기로 했다. 인천 송도 국제업무단지 인근에서는 포스코건설과 GS건설이 각각 729가구와 1 113가구를 공급하고 한화건설은 소래 논현지구에 짓는 미니신도시 한화 에코메트로 1차분 2 920가구를 이달 중 분양한다. 시흥시 능곡지구에서는 5개 업체가 이달 중 동시분양에 나설 계획이다. 이처럼 수도권에서 중소형 민영아파트 공급이 많아짐에 따라 그동안 청약통장을 사용할 기회가 적었던 청약부금이나 300만원짜리 청약예금 경기 거주자는 200만원 가입자들이 모처럼 청약 기회를 많이 잡게 됐다. 이들 통장은 전용 25.7평 이하 민영 아파트에만 청약할 수 있으나 최근 공영개발이 늘어난 반면 민간에서 공급하는 중소형 아파트는 줄어들어 청약 기회가 많지 않았다. 김광석 스피드뱅크 실장은 “공영개발 확대로 청약부금이나 소액 청약예금 가입자들은 불만이 많았다”며 “민간 건설업체들이 미뤄왔던 분양을 추석 이후에 대거 내놓을 것으로 보여 모처럼 통장을 사용할 기회가 많아질 전망”이라고 말했다.,https://news.naver.com/main/read.nhn?mode=LSD&mid=shm&sid1=260&oid=011&aid=0000151801,39
