,date,cat,co,headline,text,url,week
127274,2009.03.12. 오후 2:19,부동산,이데일리,주가 끌어올려라..건설사 고강도 처방,두산건설 자사주 907만주 소각..추가소각 가능성 GS건설 대외비 미분양·PF잔액 공개..불확실성 해소 이데일리 윤진섭기자 건설사들이 주가부양을 위해 자사주 무상소각 자산매각 등 고강도 처방을 내리고 있다. 두산건설 011160 은 재무구조와 자본 효율화를 위해 지난 10일 자사주 907만여 주 소각을 결정했다. 이번 감자로 보통주 11.02%가 줄어들며 자본금은 4117억원에서 3663억원으로 감소한다. 이 주식은 두산건설이 고려산업개발과 합병하는 과정에서 취득한 것이다. 자사주 소각은 보유 중인 주식을 태워버린다는 뜻으로 증권업계에선 주가 부양을 위한 극약처방으로 보고 있다. 주식 소각이 이뤄질 경우 유통량이 크게 줄어 주식의 가치가 올라갈 뿐만 아니라 배당에 대한 세금도 줄어든다. 두산건설의 주식 소각에 대한 증권시장 반응은 긍정적이다. 현대증권은 무상소각 실시는 주주가치를 제고하는 상징적 의미 라며 경쟁사 대비 과다했던 자본금을 줄여 재무 비효율성을 개선했다 고 평가했다. 두산건설은 남아 있는 자사주 317만주도 추가 소각을 고려 중인 것으로 알려졌다. 회사측은 주주가치를 위해서라면 추가 주식소각을 추진해야 할 부분으로 본다 고 밝혔다. 자사주 소각을 발표하면서 두산건설 주가는 지난 9일 4600원대에서 12일 오전 9시29분 현재 5540원으로 뛴 상태다. GS건설 006360 은 대외비로 취급되는 미분양아파트 현황 프로젝트 파이낸싱 잔액 등을 애널리스트 등에 전격 공개해 주식시장에 긍정적 효과를 이끌어냈다. 기사 참조 GS건설 5500억 자산 팔아 유동성 해소 현대증권 관계자는 미분양 물량이나 PF 대출 등은 대부분의 건설업체들이 대외비로 취급하는 부분임에도 불구하고 GS건설은 이를 과감히 공개해 시장의 이해를 구했다 고 평가했다. GS건설이 대외비를 공개한 데는 허명수 사장의 지시 때문이다. 허 사장은 미분양이나 PF 대출 규모를 감추면 감출수록 불신만 커지므로 공개하고 시장의 이해를 구하자는 쪽으로 입장을 정리하고 공개를 지시한 것으로 알려지고 있다. GS건설은 국제 신용평가사 무디스의 신용등급 하향 조정이란 악재에도 불구하고 신뢰성 회복이란 호재를 발판으로 지난달 24일 이후 처음으로 마감가 5만원선을 회복 12일 오전 9시47분 현재 5만2600원을 기록 중이다. 대우건설 047040 은 계열사의 유상감자로 자금난을 일부 해결해 주가가 상승한 케이스다. 대한통운은 지난 2월 전체 보통주 43.22%에 해당하는 1736만주를 대상으로 유상감자를 단행한 바 있다. 이에 따라 대한통운 주식 24%를 보유한 대우건설은 총 7113억원의 현금이 유입돼 자금 사정에 숨통이 트였고 이를 전후해 주가가 급등한 바 있다. 한편 현대건설 000720 과 삼성엔지니어링 028050 은 주식 배당을 늘려 주가에 긍정적 효과를 거두고 있다는 평가를 받고 있다. 현대건설은 작년 250원 배당보다 100% 늘려 올해 주당 500원을 배당키로 했다. 삼성엔지니어링도 작년 주당 1200원에서 올해는 주당 1500원으로 배당금을 높였다. 증권업계 관계자는 배당금을 올리는 것은 주주이익 배려 정책 중 하나이며 주가 부양에도 긍정적 이라고 말했다.,https://news.naver.com/main/read.nhn?mode=LSD&mid=shm&sid1=260&oid=018&aid=0002083212,166
127275,2009.03.12. 오후 2:15,부동산,파이낸셜뉴스,정부 공공건설사업 추진위해 5년간 40조원 민간자본 필요,정부가 녹색 뉴딜사업 등 공공건설사업을 효율적으로 추진하기 위해서는 알으로 5년간 약 40조원의 민간자본을 유치해야 한다는 의견이 제기됐다. 한국건설산업연구원이 최근 발간한 ‘공공건설사업 민간자본유치 활성화를 위한 제도개선 방향’ 보고서에서 박용석 연구위원은 “조세징수의 한계 및 국가재정 건전성 측면에서 모든 공공건설사업을 재정사업으로 추진하는 것은 현실적으로 매우 어렵다”며 “정부의 당초 계획을 예정대로 추진하기 위해서는 앞으로 5년간 약 40조원의 민간자본이 필요하다”고 밝혔다. 박 연구위원은 “실물경기 침체 금융경색 등으로 정부가 추진하고 있는 광역경제권 선도 프로젝트 녹색뉴딜 신성장동력 사업 등의 투자비용의 상당부문을 차지하는 민간자본의 효과적인 조달이 쉽지 않다”면서 “따라서 민간투자 활성화는 정부의 정책 성공에 중요한 변수로 작용하고 있다”고 주장했다. 박 연구위원은 민간투자 활성화 방안으로 ‘민간선투자 실효성 제고’와 ‘인프라펀드 활성화’를 제안했다. 하지만 민간선투자의 경우 인센티브 수준이 기대에 못미쳐 건설업체 부담이 늘어날 수 밖에 없어 활성화될 수 없다는 지적이다. 정부는 인센티브를 4% 건설업체 금융비용 이자율은 6%로 각각 가정했지만 실제로는 금융비용 이자율이 6%를 훨씬 상회하고 있어 인센티브를 더욱 높여야 한다는 게 박 연구위원의 주장이다. 또한 인프라펀드를 적극 활용해 공공건설사업에 필요한 자금을 원활하게 조달해야 한다는 것이다. 박 연구위원은 “인프라펀드 설립 운영을 활성화하기 위해 인프라펀드에 대한 과세 특례를 다시 환원하는 것을 포함한 다양한 지원 방안을 정부에서 검토해야 한다”고 지적했다.,https://news.naver.com/main/read.nhn?mode=LSD&mid=shm&sid1=260&oid=014&aid=0002108865,166
127276,2009.03.12. 오후 2:06,부동산,헤럴드경제,시장침체 속 SH공사 선전 ‘눈길’,장기전세 인기 여세 몰아 공공택지 분양도 늘려 서울시 산하 기관인 SH공사가 침체된 부동산 시장 분위기 속에서도 수요와 공급 양쪽에서 두 마리 토끼를 잡아 눈길을 끌고 있다. 지난 10일 청약을 시작한 강남권 재건축 장기전세주택 시프트ㆍ일반공급 물량 는 최고 18대 1의 경쟁률을 기록하는 등 뜨거운 반응을 얻었다. 첫날 하루만에 반포자이 84㎡가 131가구 모집에 299명이 몰려들어 2.3대 1 116㎡가 80가구에 930명이 신청해 11대 1을 기록했다. 서초두산위브트레지움도 105㎡는 18대 1 래미안서초스위트 80㎡는 16대 1을 각각 나타냈다. 이처럼 재건축 시프트가 인기를 끄는 이유는 전세 보증금이 주변 시세의 80% 수준으로 저렴한 데다 ‘강남’에 20년동안 장기간 거주할 수 있기 때문이다. 반포자이 보증금이 59㎡가 2억2400만 84㎡가 3억원 서초두산위브트레지움 105㎡가 2억3932만원 래미안서초스위트 80㎡가 1억7000만원 수준이다. 한편 SH공사는 올해 공공택지에서 5000가구 이상을 공급한다. 철거민과 원주민에게 할당되는 특별공급 2155가구 일반분양이 3252가구 등 총 5407가구로 지난 해보다 2000가구 이상 늘었다. 이중 관심을 끄는 곳은 일반분양만 공급되는 은평 2ㆍ3 지구로 각각 1349가구 1467가구다. 두 지구는 오는 6월과 12월 분양이 예정돼 있다. 분양가는 3.3㎡당 900만 1300만원 정도로 SH측은 예상하고 있다. 이밖에 상계장암지구도 오는 5월 436가구가 일반분양되고 강일지구 566가구 신내2지구 359가구 장지지구 175가구는 특별공급 된다. SH공사가 공급하는 일반분양을 신청하기 위해서는 전용면적 84㎡ 이하가 청약저축 가입자 101㎡는 600만원 134㎡는 1000만원 167㎡는 1500만원 이상 등 청약예금 통장 조건을 갖추고 있어야 한다.,https://news.naver.com/main/read.nhn?mode=LSD&mid=shm&sid1=260&oid=016&aid=0000298245,166
127277,2009.03.12. 오후 2:06,부동산,헤럴드경제,부동산 新규제완화시대 주목이단지청라 한라비발디,중앙호수공원 인접 조망권 탁월 한라건설은 인천청라지구 A6블록에 한라비발디아파트를 4월 분양한다. 청라 한라비발디는 지상 16 25층 12개동 총 992가구 규모. ▷130㎡형 138가구 ▷131㎡형 168가구 ▷145㎡형 390가구 ▷146㎡형 100가구 ▷171㎡형 196가구 등 중대형 중심으로 이뤄져 있다. 한라비발디가 들어서는 청라지구는 금융과 레저 문화가 결합된 국제도시로 개발되는 곳. 국제업무타운 화훼단지 테마형골프장 로봇랜드 국제과학복합연구단지 GM대우 R D센터 등의 시설이 들어설 예정이며 베니스와 같은 운하가 지구 내를 관통하는 등 중앙호수공원과 연계한 쾌적하고 환경친화적인 미래도시로 계획돼 있다. 특히 A6블록은 청라지구 내 중앙호수공원과 테마형 골프장과 동시에 접해있는 유일한 단지로 동쪽으로는 단독주택지역으로 계획돼 있어 3면이 확 트인 탁월한 조망을 확보하고 있다. 한라비발디는 무엇보다 단지 조성에 있어 특별한 장점을 지니고 있다. 한라건설은 세계적인 건축 디자인회사인 미국 TCA사와의 설계협력을 통한 입면특화설계 조화로운 타워형과 판상형으로 이뤄진 랜드마크적인 외관과 스카이라인을 선보일 예정이다. 또한 주차공간을 지하로 돌려 청라의 전체 모습과 조화를 이룰 수 있도록 공원같은 주거환경을 조성하고 단지를 순환하는 산책로와 자전거 도로를 만들어 입주민들이 쾌적한 여가생활을 누릴 수 있도록 했다. 이에 더해 3가지 테마로 구성된 테마조경공간 플라자ㆍ파크ㆍ가든 과 수경공간 과수원 등도 입주민들에게 자연의 편안함을 제공하게 된다. 또한 비과밀억제권역인 청라지구 성장권역 는 입주 후 5년 내 되팔 경우 양도세를 전액 면제받는 지역으로 향후 주택법시행령이 개정될 경우 분양권 전매제한이 1년으로 단축된다. 한라건설 관계자는 “전매제한 완화 및 양도세 면제 등 정부의 부동산 대책 발표 이후 분양시장이 차츰 살아나고 있고 자체 시장조사 결과 청라지구에서도 A6블록이 최고의 자리로 평가됐다”며 “외관을 더욱 선진화하고 가격과 위치 제품 등 모든 면에서 청라 최고의 경쟁력을 갖췄다고 판단했다”고 말했다.,https://news.naver.com/main/read.nhn?mode=LSD&mid=shm&sid1=260&oid=016&aid=0000298243,166
127278,2009.03.12. 오후 2:06,부동산,헤럴드경제,정릉4구역에 아파트 534가구 건립,재건축 정비안 통과 서울시는 11일 제8차 도시건축공동위원회를 열어 성북구 정릉2동 164 1번지 일대 ‘정릉4구역주택재건축 정비구역지정 안 ’을 조건부 가결했다고 12일 밝혔다. 이에 따라 총 면적 3만3410㎡의 재건축 정비구역에는 용적률 202.76% 건폐율 22.2%이 적용돼 최고 21층 평균 16층이하 9개동 총 534가구 임대포함 가 들어서게 됐다. 정릉4구역 일대는 노후 불량 건축물이 밀집해 있어 주거환경이 매우 열악하다는 평가를 받아왔다. 또한 주민들로부터 각종 안전사고가 발생할 위험성이 크다는 민원이 끊이지 않던 곳. 이에 성북구와 서울시는 기존정비기본계획 2006년 에 근거해 구역지정 안 을 추진해왔다. 이번 결정에 따라 이 지역은 부족한 정비기반시설을 확보하는 한편 인근 길음뉴타운 등 주변개발 추세에 부합하는 재건축 사업으로 쾌적한 주거 공간을 재탄생할 수 있게 됐다. 정릉4구역은 남측으로 통과하는 내부순환도로 및 정릉길 보국문길 아리랑고개길 등 간선도로망이 인접해 있으며 2012년 완료예정인 우이 신설간 경전철역 등 교통 접근성이 우수한 지역으로 평가받고 있다. 또한 서쪽으로 인접해 개발 중인 길음뉴타운지구과 정릉 일대를 중심으로 이뤄지고 있는 재개발 10구역 돈암ㆍ정릉 재건축 1ㆍ5구역 등과 연계해 향후 이 일대는 성북구의 신주거중심으로 변모하게 될 예정이다.,https://news.naver.com/main/read.nhn?mode=LSD&mid=shm&sid1=260&oid=016&aid=0000298241,166
127279,2009.03.12. 오후 2:06,부동산,헤럴드경제,용산 업무지구개발 시동,사업구역지정 내주 신청 국제현상공모 내달 매듭 첨단 명품도시로의 변신을 꾀하고 있는 서울 용산개발의 중심축인 용산국제업무지구 개발 사업이 사실상 시작됐다. 지난 8월 이 지역에 대한 국제 설계 공모에 들어간데 이어 다음주 초 도시개발구역 지정을 위한 첫번째 인ㆍ허가 행정절차에 들어갈 예정. 이에 따라 이르면 올해 말 사업을 위한 준비 단계를 마무리하고 예정대로 2011년 착공에 들어갈 수 있을 것으로 보인다. 용산역세권개발㈜는 오는 16일 용산구청에 용산국제업무지구 개발사업을 위한 사업구역지정을 신청한다고 12일 밝혔다. 대상지는 용산 제1종지구단위계획구역 내 용산국제업무지구 특별계획구역과 한강철교에서 원효대교 사이 서부이촌2동 일대 총 56만6800㎡ 약 17만평 . 일반적으로 사업구역지정 결론이 나기까지 구청과 서울시의 사업계획에 대한 검토와 심의가 7 8개월 가량 소요되는 점을 감안할 때 올해 말이면 사업을 위한 법적 인허가 절차는 완료되는 셈이다. 용산역세권개발㈜ 관계자는 “올해 안으로 서울시로부터의 사업 승인 절차를 마무리할 예정”이라며 “2011년 착공을 위해서는 더 늦출 수 없다는 판단에 구역지정 신청에 들어간다”고 말했다. 또한 용산역세권개발㈜는 지난해 8월 국제업무지구 조성안과 관련한 국제현상공모 절차를 이달 말 혹은 4월초까지 마무리한다는 방침이다. 이미 계획안으로 발표된 150층 620m 높이의 랜드마크 타워와 상업 주거 문화시설이 결합된 ‘금융ㆍITㆍ관광’의 복합개발 단지 건설의 구체적인 청사진이 결정되는 것. 용산역세권개발㈜는 이후 공모를 통한 구체적인 사업안으로 구역변경 신청에 들어간다는 계획이다. 일단 빠른 사업 진행을 위해 기존 사업안으로 사업구역지정 허가를 받은 후 공모를 통해 마련한 구체적 사업안으로 변경한다는 의도. 이 회사 관계자는 “구역 지정을 승인받는 인ㆍ허가 절차에 비해 변경 신청은 보다 용이하다”며 “2016년 완공을 위한 스케줄에 차질없이 맞춰나가겠다는 취지”라고 설명했다. 한편 국제업무지구 개발을 위한 행정절차가 속도를 내고 있는 반면 서부이촌동 편입 개발은 난항을 겪고 있다. 실제 아파트 주민을 중심으로 최근 헌법재판소에 ‘업무지구 개발에 따른 강제 수용으로 재산권과 평등권이 침해된다’는 내용의 헌법소원심판을 청구하는 등 집단 반발을 하고 있는중이다.,https://news.naver.com/main/read.nhn?mode=LSD&mid=shm&sid1=260&oid=016&aid=0000298240,166
127280,2009.03.12. 오후 2:06,부동산,헤럴드경제,서초 마천루경쟁 본격화,롯데칠성ㆍ터미널 부지 42층 복합건물 등 윤곽 강남의 ‘노른자위’ 땅으로 평가받는 서초동 롯데칠성 물류센터 부지 4만3000㎡ 에 42층짜리 국제비즈니스센터와 롯데백화점 레지던스호텔과 오피스 기능 등을 갖춘 복합시설이 들어선다. 또 인근 서초동 남부터미널부지 1만9245㎡ 도 46층짜리 오피스 시설로 개발이 추진돼 기존 삼성타운 43층 과 함께 서초동 일대가 초고층 오피스 타운으로 변모할 전망이다. 이 두 곳은 지금까지 역세권에 위치한 대규모 부지임에도 불구하고 3종 주거지역으로 사실상 개발이 막혀있던 곳이었지만 최근 서울시가 발표한 ‘신 新 도시계획 운영체계’에 따라 개발 계획이 급물살을 타고 있다. 12일 서초구청과 롯데칠성에 따르면 양측은 서초동 물류센터 부지에 국제비지니스센터를 조성하는 방안을 놓고 협의중이며 25일까지 이같은 내용을 담은 신청서를 서초구청에 접수할 계획이다. 다만 롯데칠성측은 현재 서초동 물류센터 부지와 경부고속도로 사이에 위치한 3개 필지 약 1만㎡ 를 통합해 개발한다는 계획을 세우고 토지 매입 여부를 지주들과 협의중인 것으로 알려졌다. 현재 롯데칠성 서초동 물류센터 옆 부지는 우성주택전시관과 뉴라이온미싱 동양강철알미늄새시 등 3개 필지로 나뉘어 있다. 이에 따라 롯데칠성측은 이들 지역을 통합 개발하게 될 경우 3 4개동으로 개발 규모를 확대한다는 계획이다. 롯데칠성 부지는 서초동 ‘삼성타운’ 부지와 약 200m 가량 떨어져 있고 부지면적도 삼성타운 2만5000㎡ 보다 두배 정도 크다. 당초 롯데칠성측은 이곳에 초고층 주상복합을 짓겠다는 계획이었지만 서울시의 반대로 개발 계획이 표류해왔으며 이번 서울시의 1만㎡ 이상 대규모 부지 개발 허용 계획에 따라 국제비즈니스센터를 짓는 것으로 선회한 것으로 알려졌다. 이와 함께 서초동 남부터미널부지 1만9245㎡ 도 현재 지하1층 지상 2층 건물을 46층 오피스 시설로 개발하는 방안이 추진된다. 신축되는 남부터미널은 지상 46층 규모로 지하는 터미널 시설을 유지하고 고층은 오피스 시설을 유치하는 방안을 구상하고 있는 것으로 알려졌다. 남부터미널은 한터D D가 사업시행자로 있으며 현재 지하1층과 지상 2층의 건물로 연면적은 5520㎡ 1673평 에 불과하며 나머지는 버스터미널 부지로 활용되고 있다.,https://news.naver.com/main/read.nhn?mode=LSD&mid=shm&sid1=260&oid=016&aid=0000298239,166
127281,2009.03.12. 오후 2:05,부동산,헤럴드경제,청주 지웰시티 분양 ‘봄바람’,지웰시티 공사현장 골조공사 마무리… 투자자 관심 고조 ㈜신영이 충북 청주시에 짓고 있는 ‘지웰시티’가 공정률 55%를 넘으면서 분양률도 70%를 웃도는 등 활기를 띠고 있다. 올 1월 말까지만 해도 주말 방문이 평균 50여 명에 그쳤으나 2월 들어 늘어나는 추세다. 최근에는 주말에 1일 평균 150여명이 다녀가기도 했다. 청주 지웰시티에 방문객이 늘고 있는 것은 양도소득세 완화에 따른 지방 알짜 미분양 아파트에 대해 투자자들의 관심이 고조되고 있는 데다 골조 공사를 마치는 등 급속한 공정 진행 차별화된 건축 디자인 등이 한 몫하고 있다. 청주 지웰시티는 총 사업비가 3조원에 달하는 사상 최대 규모의 민간 개발사업이다. 초고층으로 구성된 4300가구의 아파트와 백화점 복합쇼핑몰 6만6116㎡ 약 2만평 규모의 공공청사와 학교 전체 단지의 25%에 달하는 5개의 테마공원 등 다기능 복합단지 MXD Mixed Use Development 로 개발된다. 이 회사 나세찬 전무는 “지웰시티가 대한민국을 대표하는 미래형 복합단지의 모델로 자리매김할 수 있도록 할 것”이라며 “올 하반기에 2차 분양을 예정하고 있다”고 말했다. 현재 계약 중인 1차 분양분 규모는 37 45층 9개동 2164가구로 △128.722㎡ 688가구 △162.083㎡ 688가구 △198.230㎡ 688가구 △211.190㎡ 50가구 △255.796㎡ 50가구 등으로 구성된다. 중부고속도로 서청주IC와 경부고속도로 청주IC와 인접해 있으며 경부고속철도 오송분기역과 청주국제공항이 차량으로 15분내 거리에 위치해 있다. 동 호수지정 계약이 가능하고 계약금 5% 분납제와 중도금 무이자 등 분양조건도 양호하다. 견본주택은 서청주IC에서 5분 거리에 있다.,https://news.naver.com/main/read.nhn?mode=LSD&mid=shm&sid1=260&oid=016&aid=0000298238,166
127282,2009.03.12. 오후 2:02,부동산,매일경제,토지거래허가구역 해제 가속화,토지거래허가구역 해제가 가속화하고 있다. 12일 국토해양부에 따르면 현재 토지거래허가구역으로 묶여 있는 지역은 전국에서 8731㎢로 전 국토의 8.7%에 해당한다. 지난달 이후 토지거래허가구역에서 새로 해제된 면적은 405㎢ 1월에 국토부가 해제했던 면적 중 230㎢가 재지정돼 여의도 크기 8.5㎢ 의 20배에 해당하는 175㎢이 토지거래허가구역에서 해제됐다. 나주혁신도시 건설로 인해 토지거래허가구역으로 묶였던 나주시 남평읍 봉황면 등 218㎢는 2월 5일 해제됐다. 국가산업단지 및 지방산업단지 건설로 인해 지정됐던 전남 함평군 월야면 일대 16㎢ 도 자유로운 거래가 가능하게 됐고 혁신도시 및 기업도시가 건설중인 원주시 일대 101㎢도 해제됐다. 또 대구 달성군 현풍면 유가면 구지면 일대 69㎢도 지난달 28일부터 별도의 허가없이 땅을 사고 팔수 있게 됐다. 그러나 국토부가 1월에 침체된 부동산시장을 정상화시키기 위한 차원에서 대거 해제했던 지역중 일부는 해당 지방자치단체에 의해 다시 토지거래허가구역으로 묶었다. 지자체가 재지정한 지역은 무안 기업도시 예정지역 97㎢ 경북도청 이전예정지 56㎢ 부산.진해경제자유구역 76㎢ 등으로 이들 지역에서는 용도별로 일정규모 이상의 땅을 거래할 때에는 시.군.구청장의 허락을 받아야 하며 일정기간 허가받은 목적대로 이용해야 한다.,https://news.naver.com/main/read.nhn?mode=LSD&mid=shm&sid1=260&oid=009&aid=0002079069,166
127283,2009.03.12. 오후 1:59,부동산,매일경제,잠실 반포 등 아파트지구內 자투리땅 개발 쉬워진다,서울시내 아파트지구에 있는 개발잔여지에 슈퍼마켓 학원 음식점 등을 지을 수 있게 된다. 주택만 건설할 수 있었던 아파트지구내 개발잔여지 개발이 쉬워진다는 의미다. 서울시는 이 같은 내용의 아파트지구 개발기본계획 수립에 관한 조례 개정안을 마련해 13일부터 입법예고한다고 12일 밝혔다. 시는 개정안에서 아파트지구 개발잔여지에 단독주택이나 다가구를 지을 때 비주거 용도인 제 1.2종 근린생활시설 유해시설 제외 을 연면적 50% 범위에서 함께 건축할 수 있도록 하는 조항을 신설했다. 개발잔여지에 들어설 수 있는 근린생활시설은 슈퍼마켓 대중음식점 학원 세탁소 목욕탕 등이다. 노래방 비디오방 안마시술소 단란주점 등 유해시설은 제외된다. 서울시는 1970년대 후반부터 잠실 반포 서초 등 시내 18개 지구 11㎢ 15만여 가구 를 아파트지구로 지정해 관리해 왔다. 이 가운데 부득이한 사정으로 개발되지 못한 개발잔여지는 약 14만3000㎡ 358 필지 에 이른다. 현행 조례에서는 아파트지구 내 개발잔여지에는 인접한 토지와의 공동개발을 통해 아파트 연립주택 다세대주택 단독주택 등 주택 용도만으로 건물을 지을 수 있게 돼 있다. 이 때문에 개발잔여지 내 주민들은 아파트지구 개발이 이미 완료돼 인접 지역과 공동개발하는 것이 현실적으로 불가능하기 때문에 일반주거지역처럼 주거용 건물뿐 아니라 근린생활시설도 건축할 수 있도록 해달라고 지속적으로 요구해왔다. 서울시 관계자는 그동안 개발잔여지는 근린생활시설로 불법 사용되거나 장기간 나대지 상태로 방치돼 왔다 며 개정안이 통과되면 토지를 효율적으로 활용할 수 있을 것 이라고 설명했다.,https://news.naver.com/main/read.nhn?mode=LSD&mid=shm&sid1=260&oid=009&aid=0002079061,166
