,date,cat,co,headline,text,url,week
143154,2009.06.25. 오후 1:05,부동산,세계일보,3천만원 있다면 확실한 고수익 연일 북새통,요즘과 같은 불황기에는 은행에 돈 넣어두는 것도 불안하다는 투자자들이 많다. 그동안 가장 안전한 투자처로 불린 은행 상품중 주식시장의 붕괴로 펀드같은 일부 금융상품은 원금 대비 50%의 비참한 수익률을 보이는 경우도 허다하기 때문이다. 또한 일반 부동산 투자는 건설 불경기 여파로 건물이 올라가다가 마는 경우도 있고 건물이 완공되더라도 공실이 생기거나 입주자가 없는 경우는 투자를 안하느니만 못하다고 이야기 한다. 이러한 시기에 은평뉴타운 내에 위치한 2001아울렛 킴스클럽 상가가 투자자들로부터 불황기의 유일한 투자처로 각광받고 있다. 건물 지하2층에서 지상7층까지 10년동안 장기 임대계약이 완료된 선임대 후분양 상가로서 계약과 동시에 연14.95%의 확정 임대 수익을 받아갈수 있는 고수익의 확실한 투자처이기 때문이다. 이랜드 그룹에서 내점포를 확실하게 운영 관리까지 하기 때문에 투자후 신경쓸일이 전혀없고 은행에 맡겨놓은 돈 이상으로 안전하지만 수익률은 연15%에 육박하는 국내유일의 명품 투자처이다. 또한 지하철 3호선과 6호선 환승의 더블역세권 구성 및 지하철과 직접 연결된 연결통로를 통해 소비자 집객에 확실한 입지 조건을 갖추고 있으며 지상 11층에서 14층까지는 CJ그룹이 운영중인 멀티플렉스극장 CGV가 9개 상영관으로 성업중이고 대형 예식장과 유명 연예인이 운영중이 피트니스 센터등 각종 편의 시설이 구성되어 있어 주중 주말 할 것 없이 많은 소비자들이 찾고 있는 이지역 최고의 랜드마크 상가이다. 또한 안정적인 월세와 더불어서 은평 뉴타운 삼송 신도시 등 주변지역의 호재로 인한 폭발적인 프리미엄 또한 기대해도 좋다. 토지 건물 등기분양이며 선착순 층 호수 지정이므로 향후 점포위치에 따라 프리미엄 차이가 날수 있으므로 서둘러야 좋은 위치의 점포를 확보할 수 있을 것이다. 선착순 신청을 통해 분양 받게 되며 신청금 100만원을 입금하고 방문하는 것이 분양 받기에 용이하다. 홈페이지 바로가기 hp www.famsquare.kr 분양신청 방문상담 02 350 8161 신청방법 계좌번호 우체국 014506 01 006591 예금주 주 팜스산업 신청금 1점포 100만원 미계약시 신청금은 이자없이 전액 환불해 드립니다. 전화상담후 방문하시는 고객님들께 선착순으로 푸짐한 사은품을 드립니다. Segye.com 인기뉴스 최여진 신성록 열애설 조성민 故최진실 죽음 이후 자살까지 생각 네티즌 에로스는 처음 만난 이성과의 하룻밤 美 35경기 무패행진 스페인 격파 파란 영화 비밀애 유지태·윤진서 웨딩 사진 공개 故 장자연 소속사 전 대표 일본서 체포 ⓒ 세계일보 Segye.com 무단 전재 및 재배포 금지 ☞공짜로 연극ㆍ뮤지컬보기 ☞세계일보 지면보기 세계닷컴은 한국온라인신문협회 www.kona.or.kr 의 디지털뉴스이용규칙에 따른 저작권을 행사합니다.,https://news.naver.com/main/read.nhn?mode=LSD&mid=shm&sid1=260&oid=022&aid=0002054304,181
143155,2009.06.25. 오후 12:45,부동산,이데일리,재테크광고전원부지 1000만원 이하로 투자할까,개발촉진지구내 전원부지 펜션 제태크토지 파격가 매각 이데일리 아파트나 상가에 투자 하기에는 목돈이 들어가기 때문에 부담이 되어 망설여지는 경우가 많고 주식은 언제 떨어질지 몰라 불안감을 안고 있을 수 밖에 없는 요즘 1 000만원대 이하로 안정적인 투자를 원하는 사람은 소규모 땅에 투자하는 것이 바람직하다. 하지만 막상 투자하려고 마음을 먹으면 좋은 땅을 고르기 쉽지 않아 포기하는 경우가 많다. 제천시와 한국토지공사가 제안하고 국토해양부가 지정한 곳으로 저평가된 지역에 개발을 촉진하기 위해 관광산업개발 스키장 골프장 워터파크 및 지역특화사업 웰빙 약초 에코세라피 체험마을 을 민간회사에게 사업을 맡겨 개발하는 개발촉진지구에 투자하는 것도 좋을 듯 싶다. 주 청수전원개발은 서울에서 1시간 30분거리에 위치해 있는 스키장 6개 슬로프 골프장 63개홀 물류유통단지가 들어서게 되는 개발촉진지구내 재테크 전원부지를 3.3㎡당 65 000원 최소 975만원 496㎡ 에 파격 매각중이다. 문의 02 543 0616 현재 부지 초입에는 상업단지가 건설중에 있고 2010년에 개최되는 한방바이오엑스포와 대기업 연수원예정단지 청원군과 경쟁하고 있는 차이나타운 예정지가 초입에 위치하고 있으며 중앙고속도로와 5번국도 및 38번국도는 물론 중앙선 충북선 태백선 철도가 교차하는 교통 요충지이며 수도권 접근성이 좋아 투자 환경 조건이 우수하다. 이미 개발 되어 있는 계곡유원지와 그 주변으로 펜션 및 아름다운 전원주택이 들어서 있으므로 향후 노후에 전원생활도 즐길수 있다. 또한 2차선 도로와 접하며 맑은물이 흐르는 2개의 계곡이 합류되는 초입의 남향에 위치해 있다. 1차부지와 2차부지가 모두 매각되어 회사보유분을 마지막으로 한정 공급하므로 구매자는 서둘러야 할것으로 예상된다. ※ 접수문의 02 543 0616 분양절차는 신청금 50만원 신한은행 110 269 579767 예금주 조현묵 법무사 을 입금하고 회사에서 필지 배정후 현장답사를 통해 계약여부를 결정하면 된다. 계약시 신청금은 계약금으로 포함되며 미계약시 신청금은 100% 책임지고 법무사에서 환불된다.,https://news.naver.com/main/read.nhn?mode=LSD&mid=shm&sid1=260&oid=018&aid=0002123183,181
143156,2009.06.25. 오후 12:41,부동산,파이낸셜뉴스,강남 사모님도 놀란 4천만원 투자처 “연일 북새통”,노후를 행복하게 보내려면 재태크 노후준비가 꼭 필요하다. 다시말해 단기적으로 종자돈을 투자하여 안정적인 수익을 올려 필요한 노후자금을 마련하는 것이 노후를 위한 재무설계라고 할 수 있다. 최근처럼 경기가 불안할 경우 부동산이나 주식 펀드 한 곳에 전 재산을 투자하면 엄청난 손실을 볼 수 있다. 따라서 투자의 기본원칙은 여러 자산 즉 부동산 주식 예금 등 분산하여 투자하는 것이다. 분산투자에도 투자비율이 있는데 나이가 많을수록 주식 펀드처럼 위험이 높은 자산에 투자하는 비율을 줄이고 목 좋고 임대가 맞춰진 안정되고 수익이 꾸준히 나오는 수익형 대형상가 즉 매매가 쉽게 이루어지는 곳에 투자하여 투자비율을 높이는 것이 좋다. 서울 서남부 개발 프로젝트 중 1번지로 꼽히는 구로구 일대가 오는 2011년 9월 국내 첫 돔구장이 될 고척동 야구장이 들어서면서 주민들의 명소로 자리할 전망이며 그 주변 2 3km주변은 황금의 상권으로 탈바꿈 하므로 최대의 이슈지역을 살펴봐야한다. 여기에 신도림역과 구로역은 서울시 20조원 투자 개발지역의 하나로 꼽히고 있으며 서울시는 특히 이지역을 복합상업벨트로 육성 발전시킨다. 서울시의 개발과 더불어 구로역세권에 초대형아울렛백화점이 이 지역을 대표하는 아울렛백화점으로 서울 서남권을 대표할 명소로 우뚝서 인구밀도가 높은 이곳에 최고의 쇼핑명소로 자리매김 할 것이다. 이곳의 아울렛백화점은 이미 2년전에 일반분양 100%마감되었으며 현재 회사보유분 일부점포 만을 개발비 없이 각 층별로 특별분양 하므로 지금 분양받는다면 특혜를 받고 분양받는다. 투자는 미래 가치를 반드시 보아야 한다. 이러한 시기에 2009년 투자자들을 유혹하는 새로운 개념의 아울렛백화점이 있어 속을 들여 다 보았다. 아울렛백화점 매장은 고정적인 수입과 더불어 향후 대한민국을 대표로 하는 투자 상품으로 각광받을 수 있다는 게 부동산 전문 PB들의 추천이다. 상가투자는 우선 임대가 100% 완료된 상가를 고르는 것이 좋다. 또한 시행사에서 임대수익을 확정수익을 보장해주는 곳이라면 투자할 가치는 충분하다. 대부분 부동산 투자의 경우 수익이 발생하기까지 2∼3년의 기간이 소요되며 수익도 불확실한 예상수익을 제시하는 경우가 많다. 그러나 여기 아울렛백화점은 GS건설에서 책임준공하여 이미 오픈을 하였기 때문에 계약과 함께 월세가 바로 지급되며 회사에서 확정수익을 보장해주며 상가 관리단에서 직접 관리하고 있어 상가가 빨리 활성화되기에 대단히 유리하여 향후 높은 권리금과 높은 프리미엄을 받을 수 있는 커다란 장점을 가지고 있다. 최대규모 역세권에 위치한 초대형아울렛매장은 지하1층 대형할인마트와 할인면세점 로비층 패션잡화 지상1층 여성복 지상2층 남성복과 스포츠의류 지상3층 웨딩샵과 뷔페 지상4층 푸드코트 식당가로 구성되어 있다. 현재 서울 지역 중 인구가 많이 밀집된 이곳은 재개발로 인하여 땅값이 급가속으로 상승하고 있으며 2 3년 후 부동산 가격이 최고치로 치솟을 것이다. 시공은 GS건설에서 맡아 준공이 됐으며 오픈을 앞두고 마지막 회사보유분 특별분양으로 선착순 분양되며 자금에 맞춰 A급 자리를 분양받을 경우 2∼3배 시세차익과 권리금을 받을 수 있으며 오픈과 동시 등기가 되고 연15%씩 2년치 30%의 수익이 보장 되므로 투자비용이 작아 빨리 서둘러야 분양 받을 수 있다. 점포자리는 호수 지정방식으로 등기가 되고 위치에 따라 향후 권리금이 달라지기 때문에 투자 타이밍을 앞당기는 것도 현명한 투자의 방법이라 하겠다.,https://news.naver.com/main/read.nhn?mode=LSD&mid=shm&sid1=260&oid=014&aid=0002158606,181
143157,2009.06.25. 오후 12:40,부동산,아시아경제,인포머셜 아파트 계약금 2000만원,수원 망포동 일대가 수원의 신흥 거주지로 뜨고 있다. 생활기반 시설이 잘 갖춰진 영통지구와 가까우면서도 새 아파트에 살 수 있어서 이다. 현재 망포동에서 현진에버빌 임광토건 신창건설이 230여 가구에 달하는 대규모 브랜드아파트를 분양중이다. 망포동은 2011년이면 예정 분당선 연장선인 방죽역이 개토해 분당 및 서울 강남 접근이 쉬워진다. 여기에 삼성반도체 화성단지 개발 후광효과 까지 더해져 배후 주거지로도 인기를 끌 전망이다. 각종 개발 호재로 망포동의 가치를 높여준다. 우선 2011년 개통예저인 분당선 연장선 방죽영이 망포동 일대의 호재로 작용할 전망이다. 분당선 연장선은 수원일대 교통 혁명이 될 것이란 평가를 듣는다. 이 노선은 분당선 오리역에서 출발해 죽전 구성 구갈 상갈 영덕 영통 방죽 매탁 수원시청 매교 수원역을 잇는다. 용인 서울간 고속도로 2009년 개통될 예정이어서 서울 가남까지 30분이면 진입이 가능하다. 망포동의 부동산중개업소 관계자는 새 고속도로와 분당선 연장선이 개통되면 수원거주자들의 생활반경이 넓어지고 서울과 분당 접근성이 좋아져 주택수요가 늘어날 것 이라며 망포동 집값 상승의 큰 호재로 작용할 것이라고 말하고 있다. 한편 삼성반도체가 추가로 개발됨에 따라 주택수요 증가 등 개발후광효과도 기대해 볼 수 있다. 삼성전자는 62만7000㎡를 추가해 총 158만4000㎡ 규모의 반도체 생산기지를 2012년 까지 조성할 계획이다. 제2반도체 공장 증설로 인한 고용효과는 연구인력 5000여명을 포함해 1만4000여명에 이를것 이란 전망이 나오고 있다. 망포동의 생활편의시설뿐 아니라 영통지구의 기반 시설을 같이 이용할 수 있는것도 장점이다. 영통지구는 현재 수원 교육1번지로 각종학원 학교가 밀집해 있어 교육환경이 좋다. 갤러리아 백화점 E.MART등 쇼핑시설도 잘 갖춰져 있다. 망포동에는 2000년 이후 입주한 아파트가 대부분이어서 수원의 다른 지역의 배해 새 아파트비율이 높은편이다. 망포동에는 2000년 입주한 늘푸른벽산 1380가구 2001년 입주한 동수원 LG빌리지 1829가구 2002년입주한 현대아이파크 1 2차 1043가구 등 젊은 아파트가 몰려있다. 망포동의 아파트는 수원에서 가장 높은 시세를 형성하고 있다. 한국부동산정보협회 조사에 따르면 망포동의 시세는 수원의 인기 주거지인 여통동 천천동 매탄동 아파트 값 평균가격보다도 3.3㎡당 각각 67만원 101만원 120만원 정도 높게 형성돼 있다. 바로 옆 영통지구내 아파트 입주 10년 안팎의 아파트들이 만은 반면 망포동은 입주5년차 새 아파트가 많은게 매매가가 높은이유로 꼽힌다. 영통지구내 아파트는 132㎡대 구40평 이상 중대형 비율이 23%로 낮은 반면 망포동은 중대형 비율이 40%에 가깝다. 이로 인해 여통에 사는 사람들 중에서 새 아파트나 더 넓은 평형대로 갈아타려는 사람들의 관심이 높은편이다. 그리고 망포동 일대 4 5곳에서 아파트가 분양될 예정이어서 망포동의 아파트 몸값이 더 높아질 전망이다. 망포지구 주변에는 기흥호수공원과 2013년 완공예정 청명산이 있어 친환경 주거환경을 갖췄다. 주변에는 43000㎡의 영흥공원과 망포공원이 들어설 예정이다. 영통 방죽역 임광 그대家 602가구 1블럭 임광토건은 영통구 망포동 310번지에 임광 그대家 602가구를 선보인다. 망포동은 민간택지고 편의상 망포지구라불림 지하2층 지상16층 21층 아파트 10개동 규모이다. 이단지 2011년 예정개통인 분당선 방죽역 이용이 쉬운 역세권 단지다. 주변에는 태장초 잠원초 망포중 영통고 영덕중 영일중 경희대 등 학교 시설이 있다. 생활편의 시설로는 삼성홈플러스 그랜드백화점 갤러리아백화점 이마트 등이 있어 생활이 편리하다. 영통 방죽역 임광 그대家 270가구 2블럭 수원시 영통구 망포동 368 1번지에는 임광 그대家 270가구가 들어선다. 단지 옆에 조성될 예정인 공원과 연계한 단지 내 조경이 특징이다. 지상에는 차가없는 아파트 로 꾸며진다. 분당선 방죽역이 단지에서 가깝다. 방죽역에서 분당 오리역은 다섯 정거장 떨어져 있다. 방죽역에서 오리역까지 10분대면 갈 수 있다. 영통지구에서도 2블럭은 방죽역 이용이 수월한 입지를 자랑한다. 단지내 조경도 인근에 들어서는 공원과 조화를 이루도록 설계되 영통의 웰빙 주거지가 될 것이다. 망포동 임광 그대家 명품 아파트 특·장점 서울 용인간 고속도로 7월 개통 강남까지 30분대 진입이 가능하고 분당선 연장선 방죽역이 2011년 개통될 예정이다 망포동 임광 그대家 아파트를 선택해야 하는 10가지 이유 1. 계약 즉시 분양권 전매 가능 계약금 2000만원 2. 양도세 한시적 면제 3. 방죽역 초역세권 도보 5분이내 4. 융자 전액 무이자 일부 5. 단지앞 공원 약 21 000여㎡ 예정 망포공원 약48 000여㎡ 6. 녹지율 46% 100% 지하 주차장 7. 최고급 명품 인테리어 8. 발코니 확장 무료시공 9. 각종 옵션 무료제공 대리석 마각 빌트인 냉장고등 최고급 인테리어 대리석 상판등 최고급 주방가구 10. 수원의 강남 신영통 지금 신청하시면 영통에서 만나는 마지막 명품 대단지 그 기회를 잡을 수 있다. 신청금 입금 순으로 선착순 분양이며 지금 서울러야만 분양받을 수 있고 미계약시 신청금은 적액 환불조치 됩니다.,https://news.naver.com/main/read.nhn?mode=LSD&mid=shm&sid1=260&oid=277&aid=0002182578,181
143158,2009.06.25. 오후 12:21,부동산,헤럴드POP,수원 영통 임광그대가  찬란한 분양 2주안에 마감예상 프리미엄 형성,임광토건은 경기도 수원시 영통구 망포지구에 임광그대가 1 2블럭 각각 602세대 270세대총 872세대중 270세대를 분양중이다. 2블럭의 건축규모는 총 4개동 지하2 지상20 23층 공급면적은 142.75㎡ 179.07㎡이다. 공급면적별 세대수는 △142.75㎡ 89세대 마감입박 △160.67㎡ 89세대 마감임박 △179.07㎡ 92세대 마감입박 으로 구성된다. 지난주말 영통 임광그대가家 모델하우스를 찾은 입주희망자들이 아파트 조형물을 둘러보고 있다. 임광그대가 아파트는 3일만에 100여체나 팔려나갔다 각종 개발호재로 임광그대가 2블럭 가치 상승 각종 개발재료도 임광그대가 2블럭의 가치를 높여준다. 우선 2011년 개통예정인 분당선 연장선 방죽역이 망포동 일대에 호재로 작용할 전망이다. 분당선 연장선은 수원 일대에 교통 혁명이 될 것이란 평가를 듣는다. 이 노선은 분당선 오리역에서 출발해 죽전 구성 구갈 상갈 영덕 영통 방죽역 매탄 수원시청 매교 수원역을 잇는다. 구갈역에서 용인 경전철 2009년 예정 과 환승 가능하다. 2009년 7월 용인 서울간 고속도로의 개통으로 서울 접근성이 한층 쉬워진다. 망포동의 한 부동산중개업소 관계자는 새 고속도로와 분당선 연장선이 개통되면 수원 거주자들이 생활반경이 넓어지고 서울과 분당 접근성이 좋아져 주택수요가 늘어날 것 이라며 망포동 일대 집값 상승의 큰 호재로 작용할 가능성이 크다 고 말했다. 한편 대규모 산업단지가 밀집해 있다는 점도 방죽 역세권의 가치를 높인다. 현재 방죽 역세권 일대는 삼성 반도체 단지 배후 주거지로 인기가 높으며 판교 테크노 밸리 7만명이상 분당벤처 타운 용인 R D클러스터 광교 테크노밸리 20만명이상 삼성반도체2단지 1만4천명 화성 기업단지 60여 기업이 입주 할 것으로 보이며 을지대병원 개원 2012년예정 분당연장선과 용인 고속도로 완성으로 인해 많은 전세 수요가 망포동 일대로 이주 할 것으로 예상되어 이에 따라 망포동 일대의 APT 매매가 상승으로 이어질 것으로 예상된다. 망포동의 생활편의시설뿐 아니라 영통지구의 기반시설을 같이 이용할 수 있는 것도 장점이다. 영통지구는 현재 수원의 교육1번지로 각종 학원 학교가 밀집해 있어 교육환경이 좋다. 갤러리아 백화점 E마트 등 쇼핑시설도 잘 갖춰져 있다. 임광그대가 2블럭은 탁월한 조망과 공원이 앞마당과 같은 입지 여건을 갖추고 있으며 영통 유일의 타워형 구조로 평균 70m의 동간거리를 확보하고 있다. 인근에 그랜드 백화점 영화관 삼성홈플러스 멀티플렉스 스포츠센타 등 뛰어난 기반시설과 26개의 초 중 고와 외국인학교 경희대 등 학군을 자랑한다. 영통 망포동 신규 아파트가 분양권에 벌써부터 프리미엄이 붙기 시작했다 단지 옆으로 망포 중앙공원 가칭 이 1만6 000㎡가 조성돼 휴식 및 운동공간 등에 좋으며 입주 후 공원프리미엄을 볼 수 있다. 또 용인 서울 2009년 7월 개통 간 도로가 신설돼 서울 강남권 진입이 30분 내로 가능하다. 신영통 임광그대가 2블럭 의 혜택으로는 계약금 2000만원 정액제 중도금무이자혜택을 누릴 수 있으며 프리미엄보장제 실시 발코니확장 및 옵션이 무상 제공된다. 임광그대가 2블럭은 분당연장선 방죽역 2011년예정 에서 도보로 3분거리에 위치해있고 2010년 8월입주예정이다. 신영통 임광그대가 2블럭 투자 10대 POINT 1 분당선 연장선 방죽역 초역세권 단지앞을 나서면 방죽역 3분거리에 위치 2 16 000㎡의 망포중앙공원 가칭 과 함께하는 Well being Life 신영통 임광그대가 2블럭 3 영통의 빛나는 생활과 교육환경을 그대로 누리는 특급입지 신영통 임광그대가 2블럭 4 광교와 동탄을 잇는 명당주거지 신영통 임광그대가 2블럭 5 단지 지상에 주차장이 없는 친환경 주거환경 신영통 임광그대가 2블럭 6 2009년 7월 개통 용인 서울간 고속국도 2011년 개통예정인 방죽역 신영통 임광그대 7 계약금 2 000만원 계약 OK 신영통 임광그대가 2블럭 8 중도금 무이자 혜택 신영통 임광그대가 2블럭 9 수원지역 양도세 60%감면 신영통 임광그대가 2블럭 10 프리미엄보장제 실시 신영통 임광그대가 2블럭 분양 및 기타상담문의 031 280 3360 임광그대가 홈페이지참조 hp www.yongspa.kr 본 자료는 정보제공을 위한 보도자료입니다.,https://news.naver.com/main/read.nhn?mode=LSD&mid=shm&sid1=260&oid=112&aid=0002015692,181
143159,2009.06.25. 오전 11:56,부동산,헤럴드경제,GS건설 이란서 5억弗 LNG플랜트 수주,GS건설이 이란에서 10억달러 규모의 LNG 액화천연가스 플랜트 시설 단지를 수주했다. 특히 GS건설은 이번 사업에 국내 업계 최초로 설계에서 구매와 공사에 이르는 모든 과정을 독점 수행하는 ‘일괄도급 수행자’로 참여하게 된다. GS건설은 이란의 LNG사 社 가 추진하는 LNG 플랜트 핵심공정인 액화 패키지 공사를 이란 현지 공사업체인 PIDECO 사 社 와 컨소시엄으로 낙찰통보서 LOI 를 접수했다고 25일 밝혔다. 관행적으로 낙찰통보서는 최종 수주대상업체에 독점적으로 주는 것이며 정식 수주계약을 맺기 전 이미 설계 등 실질적인 작업을 진행하기 때문에 사실상 수주와 다름없다는 게 GS건설의 설명이다. 이번 공사는 총 10억 달러 규모 GS건설 5억 달러 로 사업지는 현재 GS건설이 공사 중인 20억 달러 규모의 사우스파스 9 10단계 현장인 아쌀루에에서 50㎞ 떨어져 있는 톰박에 위치하고 있다. 이 곳에서 GS건설은 연간 1080만 톤의 액화천연가스를 생산하는 플랜트 시설단지를 건설할 계획이다. 공사 기간은 올 7월부터 2012년 2월까지다. 이번 GS건설의 공사 수주에 대해 업계에서는 그 동안 유럽 미국 등의 일부 업체가 독점하고 있던 액화가스 액화 플랜트 분야에 국내 업체가 처음으로 주 시공사로 참여한 것에 의의를 두고 있다. 특히 국내 업계에서는 처음으로 설계 구매와 공사에 이르는 일괄도급 수행 계약자로 선정될 것으로 보인다는 점에도 방점이 찍히고 있다. GS건설 관계자는 “회사의 전략 사업인 이번 LNG 액화 플랜트 사업 수주를 통해 관련 분야의 경쟁력 강화는 물론이고 정유ㆍ석유화학 등과 함께 안정적인 사업 포트폴리오 구성이 가능하게 됐다”고 밝혔다.,https://news.naver.com/main/read.nhn?mode=LSD&mid=shm&sid1=260&oid=016&aid=0000309173,181
