,date,cat,co,headline,text,url,week
101724,2008.09.07. 오후 10:12,부동산,서울경제,강남구노원구 임대주택 건립 갈등,서울 강남구와 노원구가 임대주택 건립 문제를 놓고 갈등을 빚고 있어 귀추가 주목된다. 이노근 노원구청장은 7일 특별성명을 통해 “강남구가 수서2지구 임대건립에 반대입장을 표명한 것은 강남ㆍ북 간 부익부 빈익빈을 가속화시키는 것”이라며 “이는 강북 지역으로 임대아파트를 떠넘겨 강북의 슬럼화를 촉진시키려는 저의로밖에 해석되지 않는다”고 비판했다. 이에 맹정주 강남구청장은 즉각적인 반박 성명을 내고 “강남구는 정부의 국민임대주택 100만가구 건설계획에 따라 강남구에 배당된 약 6 000가구의 임대아파트를 고르게 소화할 것”이라며 “강북 대 강남의 양분법적 대결로 오도하지 말라”고 되받았다. 이 구청장은 성명을 통해 강남구가 임대아파트를 개발제한구역에 짓는 것에 대해 반대하며 역세권 등 지역 내 다른 곳에 임대아파트를 건립하겠다는 주장은 “강남 지역에 임대아파트를 아예 건립하지 않겠다는 것”이라고 지적했다. 이 구청장은 또 “서울시의 도시계획 및 주택정책에 따라 큰 혜택을 본 강남권은 이제는 ‘노블레스 오블리주’의 정신에 맞게 임대아파트를 받아들여야 한다”고 촉구했다. 이에 맹 구청장은 반박성명에서 “강남구 내 임대아파트는 서울 전체의 10%인 7 910가구로 자치구 가운데 세번째로 많다”며 “강남구는 ‘서민주거 안정을 위한 임대주택 건설’이라는 정부와 서울시 정책에 적극 부응하고 있으며 강남구 내 임대주택 건립 자체를 반대하는 것이 아니다”고 강조했다. 맹 구청장은 “수서2지구에는 임대주택이 몰려 있어 저소득층을 한 곳으로 몰지 말고 균형적 배치를 해야 한다는 게 바로 우리 강남구의 입장”이라며 “역세권과 재개발지역 임대아파트는 생활 인프라도 갖춰져 있고 교통접근성도 좋아 저소득층에게 오히려 편리하다”고 역설했다. 강남구와 노원구가 이처럼 임대아파트 건립을 둘러싸고 첨예하게 대립하고 있는 것은 그 이면에 ‘임대아파트가 자치구 발전을 저해한다’는 인식이 공통적으로 깔려 있기 때문으로 풀이된다.,https://news.naver.com/main/read.nhn?mode=LSD&mid=shm&sid1=260&oid=011&aid=0001969096,140
101725,2008.09.07. 오후 8:06,부동산,한겨레,양도세 비과세 거주요건 강화 수도권 주택거래 ‘뚝’ 끊겼다,한겨레 실거주 부담에 분양시장 찬바람…이사철 특수도 실종 강남 6억 넘는 아파트는 집값상승 기대로 매물 거둬들여 정부의 ‘9·1 세제개편안’ 발표 뒤 가뜩이나 위축됐던 수도권 주택시장의 거래가 더 얼어붙고 있다. 경기 김포한강새도시 첫분양 결과 대량 미달이 발생했고 예년 같으면 매매 거래가 늘어날 가을 이사철인데도 수도권의 주택 거래가 끊겼다. 이에 대해 부동산업계에선 이른바 ‘강부자’ 강남 부동산 부자 에게만 혜택을 몰아주고 내집을 장만하려는 실수요층은 배려하지 못한 세제개편의 후유증이라고 진단하고 있다. 7일 금융결제원 집계를 보면 김포한강새도시 첫 분양으로 화제를 모았던 ‘우남퍼스트빌’ 1193가구 ’의 1 3순위 청약에서 모집 가구수의 40%인 481가구가 미달됐다. 특히 6가구를 모집한 펜트하우스 250㎡ 주택형에는 청약자가 단 한 명도 없었다 이 단지는 ‘8·21대책’이 발표될 당시만 해도 전매제한 단축의 최대 수혜단지로 꼽혔다. 그러나 청약 직전에 거주요건이 추가된다는 세제개편안이 발표되면서 분위기가 확 바뀌었다. 우남건설 쪽은 “전매제한 기간이 7년에서 3년으로 짧아져 기대를 모았으나 갑자기 양도소득세 비과세 요건으로 ‘거주기간 3년’이 추가되면서 청약자들의 발목을 잡은 것으로 보인다”며 아쉬워했다. 김포한강새도시 청약을 고려했다가 포기했다는 정아무개씨 40 는 “반드시 거주를 해야한다는 부담이 생긴 데다 집값이 더 내릴 가능성도 높아지는 분위기라서 당분간 좀 더 지켜보기로 했다”고 말했다. 수도권 주택시장도 거주요건 강화에 따른 ‘거래 동결’ 현상이 곳곳에서 나타나고 있다. 경기 의정부와 양주시 일대 아파트는 최근 팔아달라는 매물은 많은데 살 사람이 없어 물건이 쌓이고 있다. 이들 지역은 올들어 서울 강북 집값이 큰 폭으로 오르자 불안감을 느낀 무주택자나 시세차익을 노린 투자자들이 전세를 끼고 사둔 경우가 많았다. 양주시 삼숭동의 한 공인중개사는 “거주기간 강화 방침이 발표된 후에는 매수자들의 문의가 뚝 끊겼다”며 “경기도는 실거주보다 서울 입성을 위한 발판으로 삼으려는 투자수요가 많은데 거주기간 강화가 치명적인 약점으로 작용하고 있다”고 말했다. 부동산업계에선 서울지역 거주자의 원정 투자가 많은 용인 의정부 양주 파주 김포 남양주 인천시 등 수도권 주요 지역의 매수세가 위축되며 거래 침체가 장기화할 것으로 보고 있다. 이번 세제개편의 최대 수혜처로 꼽히는 재건축과 고가 아파트 시장도 아직까지는 잠잠하다. 강남권에서는 양도세 비과세나 장기보유 특별공제에 따른 절세를 노린 6억원 초과 아파트 매물이 자취를 감췄다. 또 추가적인 규제 완화를 기대한 재건축 보유자 중 일부도 매물을 거둬들이는 등 기대감을 보이고 있다. 그러나 매수 예정자들도 시장 흐름을 좀더 지켜보겠다면서 관망하고 있어 거래는 끊어진 상태다. 박원갑 스피드뱅크 부사장은 “주택거래 활성화를 위해 전매제한을 완화한다더니 갑자기 거주기간을 강화해 매수 수요를 억제하는 등 정부의 ‘엇박자’ 정책으로 시장이 혼란을 겪고 있는 상황”이라고 말했다. 최종훈 기자 cjhoon hani.co.kr 세상을 보는 정직한 눈 한겨레 한겨레신문 구독 한겨레21 구독 ⓒ 한겨레신문사 무단전재 및 재배포 금지 한겨레는 한국온라인신문협회 www.kona.or.kr 의 디지털뉴스이용규칙에 따른 저작권을 행사합니다.,https://news.naver.com/main/read.nhn?mode=LSD&mid=shm&sid1=260&oid=028&aid=0001965679,140
101726,2008.09.07. 오후 7:56,부동산,한겨레,3년 거주·장기 보유만 지키면 세금 걱정 끝’,한겨레 바뀌는 양도세 절세 포인트 3년 거주 100% 비과세…장기보유 연간 8% 공제 1년안 매각땐 50% 중과…광역시 3억 이하도 포함 세법 개정안에 따라 내년부터 1가구 1주택자의 양도소득세가 크게 줄어든다. 고가주택 기준이 바뀌어 양도가액 9억원 이하까지는 비과세를 받을 수 있고 장기보유 특별공제가 확대돼 불가피하게 세금을 내야 하는 경우에도 보유기간이 길면 세액이 크게 줄어들게 된다. 특히 앞으로는 거주기간 요건을 채운 경우와 그렇지 못한 경우 세금 차이가 적지 않다는 게 종전과는 확연히 달라진 점이다. 또 세율과 과표구간이 조정됨에 따라 지금보다 세액도 줄어든다. 전문가들은 1가구 1주택자라면 요건을 갖춰 비과세를 받는 게 가장 확실한 방법이만 불가피하게 세금을 낼 경우에 대비해서라도 양도세 절세 포인트를 알아두는 것이 필요하다고 조언한다. 거주 여부 따라 세금 차이 김아무개씨는 지난 2002년 경기 분당새도시 아파트를 한 채 샀으나 사정상 입주하지 못한 채 전세를 주고 자신은 서울에서 전세로 살았다. 현재 분당 집값은 7억원 정도로 지금 팔 경우 양도차익은 3억원쯤 된다. 김씨는 그동안 양도세 때문에 집을 팔지 못했는데 이제는 팔아도 되는 것일까 이 경우 김씨로서는 두 가지 선택이 가능하다. 먼저 지금이라도 분당 아파트에 입주해 거주요건 2년을 채워 양도세를 100% 비과세 받는 길이 있다. 1세대 1주택 비과세 고가주택 기준이 6억원 이하에서 9억원까지로 올랐기 때문이다. 또 하나의 선택은 장기보유 특별공제가 확대된 것을 고려해 현재 7년 정도 보유한 집을 그대로 매각하는 것이다. 이 경우 양도차익 3억원에서 7년 보유에 따른 공제 56% 7년×8% 를 빼면 1억3200만원이 과표가 된다. 여기에 바뀌는 세율 6 33% 을 적용하면 양도세는 2천여만원 정도 나오게 된다. 어떤 선택을 할지는 김씨의 사정에 따라 달라지겠지만 그로서는 당장 매각하는 데 따른 세부담이 한결 줄어든 것만은 분명하다. 전문가들은 앞으로는 1가구 1주택자인 경우 거주요건을 갖추는지 여부가 집값에 관계없이 이후 양도세 절세의 관건이 된다고 지적한다. 주택 양도가액이 10억원 양도차익은 5억원인 사례 표 참조 로 보면 5년을 보유하고 팔 경우 거주요건까지 갖췄으면 양도세액이 300만원에 불과하지만 비거주 주택은 양도세가 7300만원 나온다. 만일 10년을 보유하고 팔 경우에는 거주자의 양도세가 40만원인데 비거주자는 1600만원이 부과된다. 9억 초과분 세액 계산법 앞서 예를 든 것처럼 거주요건이 보유기간보다 세액에 더 큰 영향을 주는 것은 고가주택에 대한 세금 부과 규정과 밀접히 관련돼 있다. 고가주택이라도 거주 및 보유요건을 갖춘 1가구 1주택인 경우는 9억원 초과분 양도차익에 대해서만 과세하지만 요건을 못채운다면 전체 양도차익에 대해서 과세를 하기 때문이다. 즉 장기보유 특별공제는 거주 요건에 관계없이 보유기간을 따져 똑같이 적용하지만 실제로는 거주자와 비거주자의 양도차익 크기 자체가 다르기 때문에 특별공제를 적용한 세액 차이도 커지는 것이다. 예를 들면 갑이라는 사람이 5억원에 산 주택을 10억원에 판다고 가정하면 이 주택의 양도차익은 얼마일까 1가구 1주택 요건을 갖추었다면 양도차익 계산법은 5억× 10억 9억 10억원 5천만원이 된다. 즉 전체 양도차익에서 9억원 초과분이 차지하는 비율만큼만 양도차익으로 간주한다. 반대로 거주 요건이 미달돼 1가구 1주택이 아니라면 양도차익은 5억원이 된다. 따라서 5천만원과 5억원에 대해 최대 80%의 장기보유 특별공제를 똑같이 적용하더라도 최종적인 과표는 각각 1천만원과 1억원으로 차이가 나는 것이다. 단기 양도는 여전히 중과세 집 한 채 소유자라면 거주요건을 갖추어 비과세를 받는 게 가장 좋겠지만 불가피하게 팔아야 할 경우가 있다면 그 때의 세금도 따져봐야 한다. 주의해야 할 점은 내년부터 양도세율이 내리지만 주택을 취득한 지 1년 이내에 매각할 때는 50% 1년 이상 2년 이내 팔 때는 40%로 중과하는 것은 변함이 없다는 것이다. 최소한 2년 이상은 보유해야 과표 구간에 따라 현행보다 2%포인트 2009년은 1%포인트 낮아진 세율이 적용된다. 이는 분양권을 양도하는 경우도 마찬가지다. 2주택 이상이라도 중과세를 하지 않는 지방의 저가주택 기준이 바뀐 점도 알아두면 유용하다. 지금까지는 수도권과 광역시 모두 1억원 이하 주택인 경우라야 중과세하지 않았는데 앞으로 지방 광역시에 있는 집은 3억원 이하인 경우 일반세율로 과세한다. 또 중과세 여부를 판정할 때 주택 수에서도 제외된다. 최종훈 기자 cjhoon hani.co.kr 사진 김정효 기자 hyopd hani.co.kr 세상을 보는 정직한 눈 한겨레 한겨레신문 구독 한겨레21 구독 ⓒ 한겨레신문사 무단전재 및 재배포 금지 한겨레는 한국온라인신문협회 www.kona.or.kr 의 디지털뉴스이용규칙에 따른 저작권을 행사합니다.,https://news.naver.com/main/read.nhn?mode=LSD&mid=shm&sid1=260&oid=028&aid=0001965667,140
101727,2008.09.07. 오후 7:56,부동산,한겨레,아파트 수도권 ‘부족’ 지방 ‘과잉’,한겨레 수도권 물량 전달보다 8천여 가구 줄어 지방은 되레 늘어 적체현상 심해질 듯 다음달 수도권에서 입주하는 새 아파트 물량은 9월의 절반 수준에 머물 전망이다. 반면 지방은 물량이 많아 물량 적체가 더욱 심해질 것으로 보인다. 부동산정보업체 스피드뱅크 조사를 보면 10월에 입주하는 전국의 새 아파트는 57개 단지에 2만8242가구로 9월 2만9716가구 에 비해 4.96% 줄어든다. 이 가운데 서울을 포함한 수도권의 입주 아파트는 1만1122가구로 9월 1만9263가구 보다 8141가구 감소할 것으로 예상된다. 수도권에서는 인천이 올해 하반기 들어 가장 많은 물량을 선보인다. 물량이 전무했던 9월과는 달리 여름 비수기를 피한 1355가구가 주인맞이에 나선다. 서울은 송파구 잠실 일대의 대규모 재건축 아파트 입주가 마무리 단계에 들어서면서 다음달에는 9월의 1만537가구보다 7708가구 줄어든 2829가구가 입주한다. 용산구 한강로5가 파크타워 주상복합아파트 888가구와 오피스텔 126실이 입주를 시작하고 성북구 길음뉴타운 10단지의 공사도 마무리된다. 송파구 장지지구 2단지 456가구의 입주도 눈에 띈다. 경기도는 6938가구가 새주인을 맞는데 이달 8726가구 에 비해 1788가구 감소한다. 시흥 능곡지구 남양주 가운지구 등에서도 집들이가 시작되고 화성 향남지구와 동탄새도시 안의 5개 단지에서 모두 3800가구도 입주한다. 지방은 모두 1만7120가구가 입주 예정인 가운데 대구에서 전체 지방 물량의 38%인 6544가구의 입주가 시작된다. 과잉 공급 등으로 이미 입주한 아파트도 거래가 없어 값이 떨어지고 있는 대구는 올해 들어서만 2만3590가구가 공급돼 앞으로 물량 적체가 더욱 심각해질 전망이다. 이 밖에 충남 2806가구 강원 1866가구 광주 1842가구 경북 642가구 경남 536가구 등이 입주한다. 스피드뱅크 김은경 리서치팀장은 “서울 근교에 전셋집 마련을 원하는 수요자라면 서울과 인접성이 높고 인근에 개발제한구역이 많아 환경이 쾌적한 시흥 능곡지구 등을 노려보는 것도 좋다”며 “다음달에 수도권은 입주물량이 감소하는 만큼 전세를 구하는 사람은 미리 움직이는 게 유리하다”고 말했다. 허종식 선임기자 jongs hani.co.kr 세상을 보는 정직한 눈 한겨레 한겨레신문 구독 한겨레21 구독 ⓒ 한겨레신문사 무단전재 및 재배포 금지 한겨레는 한국온라인신문협회 www.kona.or.kr 의 디지털뉴스이용규칙에 따른 저작권을 행사합니다.,https://news.naver.com/main/read.nhn?mode=LSD&mid=shm&sid1=260&oid=028&aid=0001965666,140
101728,2008.09.07. 오후 7:33,부동산,파이낸셜뉴스,시세 동향 9·1 세제개편 영향 ‘시장 위축’,지난주 아파트 시장은 정부의 9·1부동산 세제개편 방안 발표로 관망세가 더욱 짙어지면서 거래가 더 위축됐다. 매도자들은 세제 개편안이 시행되는 시점까지 기다리겠다는 입장이고 매수자들은 대출 규제가 지속되고 있는 데다 대출금리 상승에 따른 부담으로 매수를 꺼렸기 때문이다. 매매가 동향 부동산114에 따르면 지난주 8월 29일 대비 9월 5일 아파트 매매가격은 서울과 신도시가 각각 0.01% 0.04% 하락했다. 수도권은 0.02%올랐다. 서울은 서초 0.05% ·양천 0.04% ·강남 0.04% ·강동 0.03% ·송파 0.02% ·노원 0.01% 등이 하락했다. 노원구가 3주째 하락세를 보인 것이 특징이다. 중계동 온천청구 105㎡는 1000만원 정도 떨어졌다. 강남구는 개포동 주공1·3단지와 개포자이 중대형 등이 약세를 보였다. 서대문 0.06% ·강서 0.05% ·관악 0.03% ·금천 0.03% ·성동 0.03% ·중랑 0.03% 등은 올랐다. 신도시는 경기 분당 0.09% ·평촌 0.01% 이 하락했다. 분당은 66㎡ 이하를 제외하곤 모든 주택형이 하락했다. 평촌 호계동 목련우성7단지 188㎡와 평촌동 꿈현대 122㎡가 각각 500만원씩 하락했다. 일산은 0.01% 올랐다. 수도권은 경기 가평 0.17% 과 인천 0.14% 경기 양주 0.12% ·화성 0.11% ·평택 0.08% ·의정부 0.06% ·남양주 0.05% 등이 상승했다. 경기 안양 0.10% ·용인 0.09% ·연천 0.06% ·의왕 0.06% ·과천 0.05% 은 하락했다. 용인의 경우 상현·성복·보정동 일대가 아파트값 하락을 견인했다. 전세가 동향 전세가격은 서울이 0.01%내렸고 신도시와 수도권은 각각 0.03%·0.05% 올랐다. 서울은 동작 0.06% ·강남 0.06% ·송파 0.04% ·강동 0.04% ·관악 0.03% ·서초 0.02% ·양천 0.01% 등이 하락했다. 강남구 대치동 일대의 전세시장이 위축됐다. 송파구 잠실동 일대 재건축 아파트 입주 영향으로 학군과 무관한 노령층 수요가 보다 쾌적하고 저렴한 송파 등지로 빠져나가면서 약세를 보였다. 노원 0.09% ·금천 0.06% ·구로 0.04% ·성동 0.03% ·강서 0.02% ·서대문 0.02% 등은 소폭 상승했다. 신도시는 경기 산본 0.23% 과 일산 0.07% 이 올랐고 분당 0.03% 은 여전히 약세를 보였다. 수도권은 이사철 수요가 살아나면서 소폭 상승했다. 경기 의정부 0.23% 와 인천 0.20% 경기 광명 0.12% ·양주 0.07% ·파주 0.05% ·이천 0.05% 등이 상승했다. 의정부는 신곡·용현동 등지 매수세가 줄고 전세로 이동하면서 전세 물건 부족 현상을 빚고 있다. 경기 과천 0.20% ·하남 0.17% ·화성 0.03% ·수원 0.03% ·고양 0.03% 은 내렸다. 과천은 재건축단지 하남은 풍산지구 입주 영향으로 전세가격이 하락했다.,https://news.naver.com/main/read.nhn?mode=LSD&mid=shm&sid1=260&oid=014&aid=0002020723,140
101729,2008.09.07. 오후 7:30,부동산,파이낸셜뉴스,기고주택시장 안정 해법은 신도시 건설,정부가 8·21 부동산 안정대책에서 수도권에 2개 신도시를 확대 개발키로 하면서 신도시 정책을 둘러싼 논란이 가열되고 있다. 참여정부 들어 추진된 2기 신도시에서 오는 2012년까지 50만가구의 주택이 공급될 예정인 점을 감안하면 과잉공급이 우려된다는 것과 수도권 외곽의 주택시장이 슬럼화되고 난개발이 우려된다는 이유에서다. 특히 일시에 대규모로 개발하는 과정에서 땅값 상승을 부추겨 부동산 시장이 불안해질 수 있다는 지적도 나오고 있다. 더구나 이명박 정부는 대선 당시부터 신도시 개발을 지양하고 재개발과 재건축을 활성화시켜 적재 적소에 필요한 만큼의 주택을 공급하겠다고 누누이 강조해 왔다. 이 때문에 일각에서는 2기 신도시와 같이 대규모 신도시 건설이 앞으로도 더 필요한가에 대해 회의적인 시각도 있다. 그러나 앞으로도 당분간 수도권에만 연간 30만가구의 신규 주택이 공급돼야 주택시장의 안정을 꾀할 수 있는 점을 감안할 때 신도시 건설을 빼놓고는 이를 감당할 수 없다. 재개발과 재건축사업 등 도심 재생사업만으로는 수도권 주택 수요의 30%를 채우기도 어렵다. 향후 인구감소로 주택수요 증가세는 다소 둔화되겠지만 앞으로 10년에 걸쳐 신규 수요가 이어지기 때문에 수급문제를 풀기 위한 해법은 신도시 건설밖에 없다. 경기 성남 분당신도시의 입주 15년 정도가 지난 지금 신도시 거주자들의 서울 출퇴근 비율은 크게 줄었다. 신도시에도 공공기관이나 대형 유통시설 종합병원 기업이 들어서면서 일자리가 늘어났기 때문이다. 하지만 신도시를 건설하는 데 있어 고용대책의 중요성은 점점 더 커지고 있다. 경기 화성 동탄과 파주신도시의 경우 서울과 차로 1시간 정도 거리에 있지만 신도시 주변 지역의 경제활동의 중심지가 될 수 있도록 계획해야 한다. 일자리를 만들기 위해 기업이나 연구기관 등을 유치할 수 있도록 다양한 대책을 마련해 토지공급 가격을 낮춰야 한다. 입주민들의 구성 소득수준 직장위치 소비패턴 등에 따라 다양성을 수용할 수 있도록 신도시를 건설해야 한다. 특히 경기북부 접경 및 경기 동부의 자연보전권역과 같이 낙후지역은 신도시의 역할이 더욱 중요하다. 이런 관점에서 볼 때 현재 진행 중인 2기 신도시는 중간 점검을 통해 건설방향을 재설정해야 한다. 아울러 3기 신도시는 새로운 기준과 방식에 따라 자족적인 복합도시 지역적 특성을 반영하는 신도시 낙후지역 지원을 위한 기업신도시 등으로 특화시켜 나가야 한다.,https://news.naver.com/main/read.nhn?mode=LSD&mid=shm&sid1=260&oid=014&aid=0002020720,140
101730,2008.09.07. 오후 7:30,부동산,파이낸셜뉴스,김포한강신도시 우남퍼스트빌 1만명 몰려,경기 김포시 김포한강신도시 첫 분양단지인 우남퍼스트빌이 지난 6일부터 무순위청약을 시작한 가운데 현장 인근에 마련된 견본주택에 지난 주말과 휴일 이틀 동안 1만여명의 방문객이 몰려 북새통을 빚었다. 이 아파트는 지난 3일부터 5일까지 실시된 순위 내 청약에서 1193가구 128∼250㎡ 중 780명이 접수해 평균 0.65대 1의 경쟁률을 기록했으며 무순위 청약은 오는 16일까지 진행된다. 방문객들이 분양 관계자와 상담하고 있다.,https://news.naver.com/main/read.nhn?mode=LSD&mid=shm&sid1=260&oid=014&aid=0002020719,140
