,date,cat,co,headline,text,url,week
97840,2008.08.04. 오전 10:31,부동산,헤럴드POP,역시 오피스텔 깜깜이 분양도 ‘덥석’,오피스텔의 인기가 끝없이 치솟고 있다. 소규모 깜깜이 분양에도 불구하고 대규모 임대사업자가 10여 채를 계약하는 등 부동산시장 침체에도 아랑곳하지 않고 꾸준히 인기를 끌고 있는 것. ㈜한양은 최근 서울 성북구 동선동에 ‘한양 수자인’ 오피스텔을 분양했다. 37 45㎡ 총 21실 규모로 홍보를 전혀 하지 않았다. 그런데도 지난 달 31일부터 계약을 받은 결과 현재 예약분까지 포함해 대부분이 팔렸다. 특히 해외에 거주하는 임대사업자가 11실을 대거 매입하기로 해 눈길을 끌고 있다. 동선동 한양 수자인은 돈암동 성신여대 부근으로 인근에 오피스텔이 별로 없는데 비해 대학생 등 임대수요는 풍부해 투자 메리트가 있는 편이다. 실제로 인근 소규모 오피스텔은 현재 공실이 거의 없는 상태다. 동선동4가 에스타워 총 60실 2005년 6월 입주 33㎡의 경우 보증금 1000만원에 월세 70만원 선이다. 동선동 1차 동선아르텔은 36㎡ 기준 보증금 1000만원에 월세 65만원 선이다. 2002년 말 입주한 40실짜리 소규모 오피스텔이다. 이들 오피스텔의 매매가는 1억3000만원 선으로 분양가보다 약간 오른 시세를 형성하고 있다. 이에 비해 동선동 한양 수자인 분양가는 8500만원 37㎡ 1억2000만원 45㎡ 선으로 인근 시세보다 약간 저렴한 편이다. 올해 12월 입주를 앞두고 있다. ㈜한양 관계자는 “빌트인 시설이 완비돼있어 공실없이 고정적인 월 임대료를 받을 수 있는 데다 1억원 가량의 소액투자가 가능해 인근 부동산 중개업소에서도 물건을 달라는 문의가 이어지고 있다”고 말했다.,https://news.naver.com/main/read.nhn?mode=LSD&mid=shm&sid1=260&oid=112&aid=0001950639,135
97841,2008.08.04. 오전 10:31,부동산,헤럴드POP,신도시 분양 지연…청약전략 수정해야,신도시 공급이 개발계획 지연으로 잇따라 연기됨에 따라 청약 대기자들의 청약전략 수정도 불가피해졌다. 당장 위례 송파 신도시와 동탄2신도시의 개발계획이 지연되면서 당초 2010년까지 분양예정인 주택 가운데 무려 3만7000여 가구가 2011년 이후로 넘어갔다. 4일 국토해양부에 따르면 위례신도시는 2010년에 4200가구를 첫 분양에 이어 2011년 이후에 나머지 4만1800가구를 분양할 계획이다. 당초 위례신도시에서는 2009년에 4000가구 2010년에 6000가구 2011년 이후에 3만9000가구를 각각 분양할 계획이었다. 결국 2010년까지 1만 가구를 공급 계획 중 5800가구가 2011년 이후로 연기된 셈이다. 동탄2신도시에서도 2010년까지 분양할 물량이 대폭 줄었다. 당초 2010년 3만7330가구 2011년 이후 6만7670가구로 계획돼 있었으나 2010년에 5423가구 2011년 이후 10만7403가구로 변경됐다. 동탄2신도시에서는 2010년까지 분양 예정이었던 물량 중 3만2000가구가 이듬해 이후로 넘어갔다. 송파와 동탄2신도시에서 분양이 늦어진 것은 개발계획 수립이 지연된데 따른 것으로 송파는 지난해 9월 예정이었으나 지난 달에야 개발계획이 수립됐고 동탄2신도시도 올 2월에서 6월로 4개월 늦어졌다. 이에 따라 수도권 신도시에서의 연도별 주택 분양 물량도 크게 바뀌었다. 2009년 분양물량은 9만5851가구에서 9만1851가구로 4000가구 줄었으며 2010년도 16만2747가구에서 12만9040가구로 3만3707가구가 감소했다. 반면 2011년 이후 분양물량은 21만2376가구에서 25만4909가구로 4만2533가구 늘어나게 됐다. 올해는 김포 판교 양주 파주 광교 동탄1 등 6개 신도시에서 총 3만6468가구가 공급될 예정이다. 아직은 변동이 없으나 김포 한강신도시에서 6월로 예정된 분양이 지연되고 있어 일부 물량이 내년으로 넘어갈 가능성은 남아 있다. 올해 신도시 분양물량은 양주신도시 7554가구 판교신도시 7514가구 김포신도시 7027가구 파주신도시 6413가구 광교신도시 5100가구 동탄1신도시 2860가구 등이다. 한편 2기신도시 입주는 2007년 동탄을 시작으로 2008년 판교 2009년 파주 2010년 양주 광교 김포 2011년 송파 검단 2012년 동탄2신도시 등의 순으로 이뤄질 예정이다.,https://news.naver.com/main/read.nhn?mode=LSD&mid=shm&sid1=260&oid=112&aid=0001950638,135
97842,2008.08.04. 오전 10:31,부동산,헤럴드POP,대학가 상가도 임대료 高高,뉴타운 개발 여파가 주변 상권에까지 미치면서 뉴타운 인근 대학가 주변 상권의 임대료가 치솟고 있다. 본래 유동인구가 많고 장사가 잘되는 편이라 임대료가 높았던 대학가 상가의 임차인들은 최근 뉴타운 개발까지 겹치면서 임대료 상승을 견디다 못해 가게를 이전하는 등 혹독한 여름을 맞고 있다. 왕십리 뉴타운과 인접한 한양대 주변 상가 임차인들은 지난 1년 새 최고 200%까지 임대료 인상 압박을 받고 있다. 실제로 지난해 이 일대 1층 점포 99㎡안팎 기준으로 권리금 1억4000만 2억원 보증금은 6000만 1억1000만원 월 임대료는 250만 300만원선이였으나 최근 보증금은 1억 1억5000만원 월 임대료는 400만 500만원으로 뛰었다. 인근 N 공인중개업소 측은 “왕십리 뉴타운을 비롯해 민자역사 건립 등 각종 개발 호재 때문에 상가 임대료도 천정부지로 치솟고 있다”고 전했다. 흑석뉴타운과 맞붙어있는 중앙대 인근도 지난해부터 점포 임대료 상승세가 가파르다. 타 대학가에 비해 외부 수요가 상대적으로 적고 상도동 방향의 좁고 경사가 심한 고갯길로 크게 활성화되지 못했던 이곳 상가도 중앙대 앞 전용 20㎡를 기준으로 1년전 보증금 5000만원에 월 임대료 120만원 수준이었으나 최근 보증금 1억 1억2000만원에 월세 200만 250만원으로 뛰었다. 인근 상가의 한 점포주는 “타 대학상권보다 저렴한 편이었으나 뉴타운과 9호선 개통 등이 가시화되면서 상권 활성화에 비해 임대료가 빠르게 오르고 있다”고 말했다. 신촌 및 이화여대 일대도 아현뉴타운 호재로 들썩이고 있다. 서울 북서부 최대 상권으로 원래 임대료가 높은 편이라 오름세가 두드러지진 않지만 이 일대 중심상권인 현대백화점 연세대 방면으로 이어지는 번화가에 이어 신촌 민자역 이화여대로 이어지는 상권이 새롭게 주목받고 있다. 이 곳 대로변 점포는 1층 49.5㎡ 매장을 기준으로 대로변은 보증금 1억 3억원 임대료는 250만 550만원선. 이면 도로도 보증금 5000만 1억5000만원 월 임대료 120만 130만원선에 형성돼있다. 상가뉴스레이다 장경철 실장은 “최근 두 배까지 오르는 등 임대료 오름세가 가파르자 이를 견디지 못하고 점포를 아예 이전하는 뉴타운 인근 대학가 점포도 쉽게 볼 수 있다”며 “개발 호재에도 상권 활성화는 부진할 수 있기 때문에 최근 뉴타운 개발과 맞물린 임대료 오름세에 혹한 섣부른 투자는 경계해야 한다”고 충고했다.,https://news.naver.com/main/read.nhn?mode=LSD&mid=shm&sid1=260&oid=112&aid=0001950637,135
97843,2008.08.04. 오전 10:29,부동산,아시아경제,올해 장기임대산업용지 230만㎡ 공급,전국에 장기임대산업용지 총 230만㎡가 올해 공급된다. 한국토지공사는 8월말부터 기업들이 저가로 쉽게 부지를 확보해 경영할 수 있도록 전국 12개 산업단지 물류단지 택지지구 등에 총 230만㎡ 규모의 산업용지를 장기임대방식으로 공급한다고 4일 밝혔다.,https://news.naver.com/main/read.nhn?mode=LSD&mid=shm&sid1=260&oid=277&aid=0002011497,135
97844,2008.08.04. 오전 10:25,부동산,머니투데이,전국 230만㎡산업용지 장기임대 공급,머니투데이 원정호 기자 부천ㆍ오정 등 전국 12개 지구… 임대료 1 5%에 최장 50년 장기 저리로 부지를 임대해 쓸 수 있는 장기임대산업용지가 대량 공급될 예정이어서 중소기업들의 초기 토지비 부담이 줄어들 전망이다. 한국토지공사는 이달말부터 산업단지 물류단지 택지지구 등 전국 12개 지구에서 230만㎡ 규모의 산업용지를 장기임대방식으로 공급한다고 4일 밝혔다. 부천 오정지구 5만㎡를 포함해 △남양주 팔야 10만6000㎡ △오산 가장2 34만4000㎡ △용인 덕성 48만3000㎡ △충주첨단 45만1000㎡ △군장 군산 35만5000㎡ △전주 첨단 6만9000㎡ △밀양 사포 33만6000㎡ △충북 음성 3만3000㎡ △경북 안동 1만6000㎡ △전주 장동 4만2000㎡ △양주 고읍 2만9000㎡ 지구 등이다. 이 중 1차분 110만㎡는 8월말부터 2차분 120만㎡는 연말 공급된다. 장기임대산업용지는 연간 임대료가 조성원가의 1 5% 1㎡당 1500 7500원 수준이며 최장 50년까지 임대할 수 있다. 토공 관계자는 그동안 투자 자금 조기 회수를 위해 분양 일변도로 용지를 공급해 왔으나 앞으로는 장기 저리 임대로 토지를 공급할 계획 이라며 이 경우 기업들의 초기 토지 투자비는 종전의 분양방식에 비교 100분의 1 100분의 5 수준으로 크게 낮아진다 고 말했다.,https://news.naver.com/main/read.nhn?mode=LSD&mid=shm&sid1=260&oid=008&aid=0002017320,135
97845,2008.08.04. 오전 10:19,부동산,연합뉴스,임태희 주공.토공 통합할 것,서울 연합뉴스 안용수 기자 한나라당 임태희 정책위의장은 4일 대한주택공사와 한국토지공사는 통폐합으로 방향이 선 것으로 안다 고 말했다. 임 정책위의장은 이날 연합뉴스와 통화에서 이 같이 말한 뒤 통폐합을 위한 정밀한 작업은 주무 부처가 마련할 것 이라면서 통폐합의 중심이 어디로 가는 지는 모르지만 합하는 것은 맞다 고 밝혔다. 그는 양 기관이 합친 뒤 지방으로 이전할 것인 지에 대해서는 지방혁신도시를 하는 데 지장을 받지 않도록 방법을 강구할 것 이라고 말했다. 현재 주공은 진주 혁신도시로 토공은 전북 혁신도시로 각각 이전한다는 계획이 세워져 있다. 국회 공기업선진화 특위는 이달 중 공청회를 열고 주공과 토공 통합문제 등에 대해 의견수렴 절차를 밟은 뒤 공기업 개혁 일정 등을 논의할 예정인 것으로 전해졌다. 한편 임 정책위의장은 공기업 선진화에 대해 지금까지 각 정부 부처는 뒷짐지고 하다 보니 역대정권에서 안됐던 것 이라며 효율성과 경쟁력을 높이기 위한 선진화는 의지를 갖고 추진한다 고 강조했다. 다만 그는 한국가스공사의 경우 민영화한다면 누가 가스관 설치 작업 등을 하겠느냐 며 가스공사는 민영화 할 수 없다 고 민영화 불가 방침을 거듭 확인했다.,https://news.naver.com/main/read.nhn?mode=LSD&mid=shm&sid1=260&oid=001&aid=0002205141,135
97846,2008.08.04. 오전 10:11,부동산,아시아경제,강북집값 하락세 시작됐다,강북지역 집값이 떨어지기 시작했다. 6개월 연속 오름세를 지속하던 강북지역은 최근 매수세가 위축되면서 7월말부터 일부 지역 중심으로 집값이 하락했다. 4일 부동산업계에 따르면 7월 마지막주 수도권 아파트 가격이 올 들어 처음 하락세로 돌아선 가운데 가격 급등현상을 보여온 강북지역도 상승률이 0.1%를 못 넘어서며 저조한 상승세를 보였다.,https://news.naver.com/main/read.nhn?mode=LSD&mid=shm&sid1=260&oid=277&aid=0002011477,135
97847,2008.08.04. 오전 10:09,부동산,한국경제,거래세 등 세금 줄어들고 분양가격은 크게 오를듯,가을 부동산시장 틀 변화조짐 … 내집마련 전략 得失 따져야 올 가을 부동산 시장의 틀이 크게 변할 조짐이 엿보인다. 정부와 정치권이 침체에 빠진 주택 시장을 정상화하기 위한 방안을 다각적으로 내놓을 예정이기 때문이다. 종합부동산세 양도소득세와 거래세를 인하하려는 움직임은 이미 가시화됐다. 분양가 상한제도 수정될 예정이다. 노무현 정부의 부동산 정책이 전면적으로 손질되는 셈이다. 이로 인해 시장참여자들의 머릿속이 복잡해졌다. 세금이 완화돼 거래가 살아나고 집값이 내릴 수 있다는 전망이 있는가 하면 상한제가 유명무실해져 분양가와 집값이 동시에 오를 가능성도 있기 때문이다. 내집 마련 이라는 고차 방정식을 풀기에 앞서 주택 시장 정책과 시장 반응을 꼼꼼히 짚어 이해득실을 따져봐야 할 시점이다. 거래 활성화에 초점 정부와 여당인 한나라당은 지난달 23일 보유세를 내리겠다고 했다. 재산세 과세표준액 과표 현실화율을 바꾸겠다는 것이다. 지난해부터 집값이 하향 안정세를 찾고 있는 데다 집값은 오르지 않고 세금만 올라 납세자들의 원성이 높았던 탓이다. 우선 과표가 50%에서 매년 5%씩 올라 2017년에는 100%가 되는데 현 수준 50% 에서 동결할 예정이다. 집값에 따라 차이가 있지만 재산세는 최고 수십만원이 줄어든다. 더욱이 강만수 기획재정부 장관은 재산세의 누진 구조를 고치겠다는 뜻까지 비쳐 고가 주택 소유자들은 혜택이 기대된다. 여당은 고가 주택에 대해 재산세 부담 상한선을 낮추는 방안까지 검토하고 있다. 재산세가 전년보다 50% 이상 많아지지 못하게 돼 있는데 이것을 25%로 낮추겠다는 것이다. 거래세 인하는 여야가 한목소리를 내고 있다. 거래세 부담이 준 집주인들이 집을 팔려고 하면 공급량이 많아지는 효과가 있어 집값 안정에 도움을 줄 것이라는 판단에서다. 한나라당은 집값이 6억원을 넘더라도 집이 한 채만 있고 10년 이상 보유하면 양도세를 면제해 주는 방안을 추진 중이다. 민주당은 16년 보유하면 80% 감면해 주자고 주장했다. 지금은 20년 이상 보유할 때 80%를 줄여 준다. 민주당은 또 2%인 취득ㆍ등록세를 1%로 내리기로 당론을 모았다. 문제는 종부세다. 정부는 종부세 부과기준을 6억원 초과에서 9억원 초과로 늘리려고 하지만 민주당이 반대한다. 2%에 불과한 고가 주택 보유자를 위해 종부세의 근간을 흔들 수 없다는 논리다. 한나라당도 명확히 입장 정리가 안 됐다. 당내 일부에서 가구별 과세가 아니라 인별 과세로 바뀔 경우 이론적으로 18억원까지는 종부세를 내지 않아도 된다. 나이가 많은 집주인들은 집을 팔 때나 사망시까지 세금을 내지 않는 방안도 논의 중이다. 분양가 인상은 불가피 분양가는 확실하게 오를 전망이다. 정부는 9월부터 건축자재 인상분을 건축비에 반영해 주도록 했다. 이미 7월부터 기본형 건축비의 철근값을 올려 총 분양가가 2% 정도 오를 전망이다. 시멘트 PHC파일 등 다른 건축자재값도 많이 올라 건축비 추가 인상은 불가피하다. 소비자 만족도가 높은 업체가 분양하는 주택은 건축비가 1% 더 올라가고 주상복합아파트 역시 가산비를 더 인정해 주기로 했다. 분양가 인상을 더 부추기는 것은 아파트 땅값을 감정가보다 높게 인정하려 한다는 점이다. 아파트값은 땅값과 건축비 그리고 가산비로 이뤄져 있다. 땅값은 분양가의 절반 정도를 차지한다. 땅값이 오르면 분양가가 오를 수밖에 없다. 물론 건설업체들도 나름대로 사정이 있다. 땅주인들이 감정가로는 부지를 팔지 않기 때문에 돈을 더 내고 부지를 매입한다. 이럴 경우 분양가 상한제에서는 아파트를 지어도 수지타산이 맞지 않게 된다. 건설업체들이 주택 건설을 포기하는 이유다. 이 여파로 이달에는 8월 분양 물량으로는 역대 최소를 기록할 예정이다. 올해 전체적으로 볼 때도 수도권에 공급하기로 한 목표 30만가구 보다 4만 5만가구가 모자랄 것으로 보인다. 정부가 분양가 상한제를 제대로 시행하지도 못해 보고 후퇴한다는 비난을 무릅쓰고 땅값을 감정가보다 높게 책정할 수 있도록 해 주려는 것이다. 분양가 상한제로 싼 값의 아파트가 나오길 기대했던 청약대기자로서는 실망스러운 일이다. 서울 등 수도권에서는 아직 단 한 가구의 민간택지 상한제 아파트도 선보인 적이 없다. 업계 관계자는 당초 후분양제로 분양하려던 위례신도시 동탄2신도시를 선분양제로 바꾼 것을 감안할 때 내년부터 실실하기로 한 후분양제가 전면 보류될 가능성도 배제할 수 없다 며 후분양제가 폐지되면 지어진 집을 보고 산다는 취지는 퇴색할 수밖에 없다 고 풀이했다.,https://news.naver.com/main/read.nhn?mode=LSD&mid=shm&sid1=260&oid=015&aid=0001990689,135
97848,2008.08.04. 오전 10:07,부동산,한국경제TV,현대건설 태안서 신입사원 수련대회,현대건설이 7월 31일부터 8월 2일까지 2박 3일간의 일정으로 서산 연수원 등에서 모두 252명의 신입사원들이 참가한 가운데 2008 신입사원 하계 수련대회를 진행했습니다. 현대건설 이종수 사장은 이번 행사에서 미래 주역이 될 신입사원들이 현대건설의 전통과 역사가 숨 쉬는 서산에서 현대건설의 도전정신과 열정 등을 배우는 기회가 됐기를 바란다 고 당부했습니다. 현대건설은 고 정주영 명예회장의 창립정신이 깃든 서산 일대에서 매년 하계 수련대회를 열어 현대정신을 함양하도록 하고 있다 고 설명했습니다.,https://news.naver.com/main/read.nhn?mode=LSD&mid=shm&sid1=260&oid=004&aid=0001953299,135
97849,2008.08.04. 오전 10:07,부동산,한국경제TV,해외건설 수주 300억 달러 돌파,중동 건설 특수에 힘입어 국내 건설업체들의 해외 수주 실적이 역대 최단기간 300억 달러를 돌파했습니다. 국토해양부와 해외건설협회는 지난달 31일까지 해외건설수주액이 총 347억 달러로 집계됐다고 밝혔습니다. 이는 지난해 같은 기간에 비해 두배 이상 늘어난 수치입니다. 특히 올해 수주액이 500억 달러를 넘어설 경우 총 누계금액은 3천억 달러를 돌파하게 됩니다. 국내 건설사의 해외 수주 누계액은 2006년초 2천억 달러를 달성했으며 현재까지 2천870억 달러를 기록하고 있습니다.,https://news.naver.com/main/read.nhn?mode=LSD&mid=shm&sid1=260&oid=004&aid=0001953298,135
97850,2008.08.04. 오전 10:07,부동산,이데일리,수도권 장기임대산업용지 연말부터 공급,부천오정 남양주팔야 용인덕성 오산가정2 이달부터 충주첨단 군장군산 등 공급 이데일리 윤진섭기자 장기임대산업용지가 이달 말부터 본격 공급되며 수도권은 연말부터 공급될 것으로 보인다. 4일 한국토지공사는 이달 말에 충주첨단 45만1000㎡ 군장군산 35만5000㎡ 에서 장기임대산업용지가 공급된다고 밝혔다. 토공은 또 연말까지 총 230만㎡ 규모의 장기임대산업용지가 나온다고 덧붙였다. 기업들의 관심이 높은 수도권지역 장기임대산업단지는 올해 부천오정 5만㎡ 남양주 팔야 10만6000㎡ . 용인덕성 48만3000㎡ 오산가정2 34만4000㎡ 등에서 공급될 예정이다. 토지공사는 수도권 지역은 올해 말부터 공급될 것이라고 밝혔다. 또 오산가정 2와 용인 덕성은 동동탄신도시 예정지구 내에 소재하고 있는 기업들의 이전용지로 활용될 것이라고 토공은 덧붙였다. 장기임대산업용지는 임대기간은 50년 연 임대료는 조성원가의 1 5% 수준에 공급되는 공장부지다.,https://news.naver.com/main/read.nhn?mode=LSD&mid=shm&sid1=260&oid=018&aid=0002004388,135
97851,2008.08.04. 오전 9:54,부동산,한국경제,수도권 아파트값 작년 11월말 이후 첫 하락,지난주 수도권 전체 아파트 평균가격 이 작년 11월 말 이후 처음으로 하락세를 기록했다. 부동산정보업체인 부동산114는 수도권 아파트값이 0.02% 떨어진 것으로 조사됐다고 3일 밝혔다. 서울지역도 0.01%로 떨어져 한 달 내리 내림세를 이어갔다. 휴가철에 따른 비수기로 주택시장에 대한 관심이 줄어든 데다 주택시장 침체에 따른 매수세가 크게 감소했기 때문으로 풀이된다. 재건축 대상 아파트의 경우 정부의 부동산 세제완화에 대한 기대감으로 매매가 하락폭이 이전 주보다 소폭 줄어든 ―0.11%로 집계됐다. 하지만 재건축 대상 아파트 밀집지역인 강남권 약세는 여전했다. 잠실주공1ㆍ2단지 잠실시영 입주를 앞둔 송파구가 ―0.16% 떨어져 내림세가 가장 심했다. 이어 강남구 ―0.11% 와 서초구 ―0.09% 등이 뒤를 이었다. 강동구도 0.08%가 빠졌다. 도ㆍ노ㆍ강 도원ㆍ노원ㆍ강북구 을 위주로 한 강북권은 약세 분위기가 감지되는 가운데서도 소폭 상승세는 이어졌다. 도봉ㆍ중랑구가 0.06%씩 올랐다. 신도시는 분당 0.1% 과 일산 0.03% 이 떨어졌다. 수도권은 용인이 ―0.31%로 내림폭이 컸다. 반면 동두천은 0.39%가 올라 북고남저 현상이 지속됐다.,https://news.naver.com/main/read.nhn?mode=LSD&mid=shm&sid1=260&oid=015&aid=0001990682,135
97852,2008.08.04. 오전 9:43,부동산,노컷뉴스,토공 임대료 15% 수준 장기임대 산업용지 본격 공급,CBS경제부 박종환 기자 한국토지공사는 기업들이 저가로 쉽게 부지를 확보할 수 있도록 하기 위해 이달 말부터 전국 12개 산업단지 물류단지 택지지구 등에서 총 230만㎡ 규모의 산업용지를 장기임대방식으로 공급하기로 했다 고 4일 밝혔다. 토공은 올해안에 수도권의 부천 오정지구와 남양주 팔야지구를 포함한 전국 12개 단지에서 1차로 110만㎡ 2차로 120만㎡등 총 230만㎡을 공급하고 순차적으로 2017년까지 총 3 300만㎡ 1 000만평 의 장기임대 산업용지를 공급할 계획이다. 장기임대 산업용지의 연간 임대료는 조성원가의 1～5% 수준이며 임대기간은 최장 50년이다. 조성원가 지방권 기준 ㎡당 15만원인 경우 의 1%인 경우 연 임대료는 1㎡당 1 500원 3%일 경우 4 500원 5%일 경우 7 500원 수준으로 기업 초기 토지투자비는 종전의 분양방식에 비교하면 1 100～5 100 수준으로 크게 낮아진다. 토공은 그 동안 사업투자자금을 조기에 회수하기 위해 분양 일변도로 산업용지를 공급해 왔다.,https://news.naver.com/main/read.nhn?mode=LSD&mid=shm&sid1=260&oid=079&aid=0001982806,135
97853,2008.08.04. 오전 9:43,부동산,노컷뉴스,송파·동탄2신도시 3만7천가구 2011년 이후로 연기,CBS경제부 정영철 기자 송파신도시와 동탄2신도시 건설 사업이 지연되면서 애초 2010년까지 분양 예정이던 주택 중 3만7천여 가구가 2011년 이후로 연기됐다. 이에 따라 수도권 핵심 신도시인 두 곳에서 내 집 마련을 계획해 온 청약대기자들은 청약전략을 손질해야 할 것으로 보인다. 4일 국토해양부에 따르면 송파신도시는 2010년에 4천200 가구를 분양하고 2011년이후에 나머지 4만1천800 가구를 분양할 계획이다. 내년까지 분양하는 물량은 없다. 원래 송파신도시에서는 2009년에 4천 가구 2010년에 6천 가구 2011년 이후에 3만9천 가구를 각각 분양할 계획이었다. 결국 송파에서는 2010년까지 1만 가구를 분양할 예정이었으나 이중 절반이 넘는 5천800 가구가 2011년이후로 미뤄졌다. 동탄2신도시에서도 2010년까지 분양할 물량이 대폭 줄었다. 애초 2010년 3만7천330 가구 2011년이후 6만7천670 가구로 계획돼 있었으나 2010년에 5천423 가구 2011년 이후 10만7천403 가구로 변경됐다. 2010년까지 분양예정이던 물량 중 3만2천 가구가 그 다음해 이후로 넘겨졌다. 수도권 신도시에서의 연도별 주택 공급 로드맵도 크게 변경됐다. 2009년 분양 물량은 9만5천851 가구에서 9만1천851 가구로 4천 가구 줄었고 2010년도 16만2천747 가구에서 12만9천40 가구로 3만3천707 가구가 감소했다. 반면 2011년 이후 분양물량은 21만2천376 가구에서 25만4천909 가구로 4만2천533 가구 늘어나게 됐다.,https://news.naver.com/main/read.nhn?mode=LSD&mid=shm&sid1=260&oid=079&aid=0001982805,135
