,date,cat,co,headline,text,url,week
127020,2009.03.10. 오전 7:51,부동산,연합뉴스,주택건설목표 하향조정..수도권 25만가구,전국도 45만가구로 축소 서울 연합뉴스 박성제 기자 정부가 올해 주택건설 목표를 수도권 25만가구 전국 45만가구로 하향 조정했다. 그러나 민간주택건설업체의 투자의욕이 회복되지 않는다면 이 목표도 달성하기 어려울 전망이다. 10일 국토해양부에 따르면 정부는 올해 수도권에서 목표로 하고 있는 주택건설 인허가 기준 물량을 작년 목표 보다 5만가구 적은 25만가구로 잡고 있다. 또 전국적으로도 45만가구를 목표로 설정 작년 목표치보다 5만1천가구 적다. 올해 정부가 세운 목표치는 작년의 목표치보다는 낮은 것이지만 작년의 실적치보다는 많다. 작년에 수도권에서는 19만7천가구 전국 37만가구가 건설됐던 것을 고려하면 올해 목표는 수도권에서는 5만3천가구 전국적으로는 8만가구 많은 물량이다. 국토부 관계자는 국토연구원에서 분석한 결과 수도권에서 25만가구 전국에서 45만가구가 매년 공급되면 수요에 맞출 수 있을 것으로 나왔다 면서 하향 조정한 이유를 설명했다. 이는 작년까지 수도권 30만가구 전국 50만가구로 봤던 연간 수요 분석을 수정한 것이다. 국토부는 올해 주택건설 목표를 달성하기 위해서는 민간분야에서의 주택건설 활성화가 필수적이라고 보고 있다. 작년에 주택건설 목표를 달성하지 못한 것도 민간에서 주택건설이 급격하게 위축된 데 따른 것이었다. 국토부의 또 다른 관계자는 올해 주택건설 목표를 달성하기 위해서는 지금까지 발표했던 대책들이 효과를 발휘하고 민간주택에 대한 분양가 상한제 폐지도 이어져야 한다 면서 민간에서 많이 짓는 게 관건 이라고 말했다. 국토부는 민간에서 주택건설이 부진할 경우에 대비해 공공에서 많은 주택을 짓는다는 구상이다. 종전에는 민간주택과 공공주택의 비율이 6대 4정도로 민간 물량이 많았으나 올해에는 오히려 공공에서 더 많이 짓는 것으로 계획하고 있다. 국토부는 수도권의 경우 공공주택을 15만가구 민간주택을 10만가구 짓는 것으로 설정했다.,https://news.naver.com/main/read.nhn?mode=LSD&mid=shm&sid1=260&oid=001&aid=0002544436,166
127021,2009.03.10. 오전 7:10,부동산,아시아경제,미분양 양도세 혜택 얼마나 받나,지금 미분양주택을 사면 양도소득세가 얼마나 줄어들까. 미분양주택 해소를 위해 지난 2월 나온 세제개편안이 국회를 통과함에 따라 9일 정부는 이와 관련한 후속 조치 및 개정이 시급한 세법 시행령 개정을 추진했다. 이중에는 미분양주택 양도세 감면 관련 내용이 포함돼 있다. 1주택자인 홍모씨가 부천의 미분양아파트를 5억원에 매입했다가 5년 이내에 7000만원의 양도차익을 남기고 팔 경우 1670만원의 양도세를 내야한다. 하지만 여기서 60%를 감면받게 되면 668만원으로 양도세가 줄어든다. 정부의 이번 조치로 과밀억제권역은 양도세액의 60%까지 감면 받을 수 있기 때문이다. 해당 지역이 평택이나 용인 등 과밀억제권역이 아니라면 양도세를 한푼도 내지 않아도 된다. 취득 후 5년이 지나서 양도하는 경우에는 조금 다르다. 감면대상 양도소득금액은 먼저 실지거래가액에 따른 양도소득금액을 계산한 후 취득 당시와 5년이 되는 시점 양도당시 기준시가를 기준으로 안분해 계산한다. 김모씨가 홍씨와 같은 단지의 미분양아파트를 사서 5년 이후에 팔았다고 가정해보자. 김씨는 공시지가 4억원짜리 미분양아파트를 5억원에 샀다. 취득 후 5년이 지난 시점에서 시세가 8억원 공시지가 6억4000만원 까지 올랐고 그로부터 몇 년 후 매도시점에서 양도가액이 10억원 공시가격 8억원 이라면. 이렇게 되면 양도차익 5억원 중 감면대상 소득금액은 3억원이 된다. 양도차익 중 3억원을 감면받기 때문에 김씨의 과세표준은 기본공제금액 250만원을 제한 19억7500만원이다. 1가구 2주택자로 세율 25%를 적용할 경우 양도세로 4888만원을 납부하게 된다. 하지만 인천이나 경기도 부천 고양시 등 과밀억제권역에서 전용면적 149㎡ 45평 분양평형 60평형 내외 가 넘는 미분양주택을 샀다면 이 같은 양도세 계산법을 적용할 필요가 없다. 양도세 감면이 되지 않기 때문이다. 미분양주택 양도세 감면 관련 시행령 개정 내용에는 과밀억제권역 내에서는 전용 149㎡ 이하에 대해서만 5년간 발생한 양도세를 감면해주기로 정했다. 수도권과밀억제권역이 아닌 경우 면적에 상관없이 양도세를 감면 받을 수 있다. 한편 양도세 감면 대책이 발표된 지난 2월 12일 이전에 계약을 체결한 미분양주택이라면 세제 혜택을 받을 수 없다. 정부가 정한 미분양주택 범위는 지난 2월 12일부터 내년 2월11일까지 계약분에 한해서다.,https://news.naver.com/main/read.nhn?mode=LSD&mid=shm&sid1=260&oid=277&aid=0002116787,166
127022,2009.03.10. 오전 7:06,부동산,연합뉴스,행정도시 이주자택지 입주권도 폭락,행정도시 예정지 자료 보상 한창때의 25 33% 수준에서 팔려 대전.연기 연합뉴스 이은파 기자 대전시 서구에 사는 박 모 61 씨는 최근 행정중심복합도시 예정지인 충남 연기군 남면이 고향인 임 모 53 씨로부터 행정도시 예정지 원주민들에게 주어지는 이주자택지 입주권 일명 딱지 을 3천만원에 매입했다. 박씨는 충남 금산과 논산 공주 등으로 땅을 보러 다니던 중 한 행정도시 예정지 원주민이 이주자택지 입주권을 싸게 판다는 소식을 듣고 선뜻 매입하게 됐다 며 행정도시 예정지가 앞으로 어떤 형태로든 개발되지 않겠느냐 고 기대감을 표시했다. 행정도시 예정지에 살다 1983년 청주로 이사한 임 모 57 씨도 지난해 12월 고향친구로부터 이주자택지 입주권을 3천800만원에 구입했다. 은퇴 후 고향에 들어가 살기 위해서다. 행정도시의 정상추진 여부를 놓고 논란이 끊이지 않고 있는 가운데 행정도시 예정지 원주민들에게 주어지는 이주자택지 입주권이 3천만원에서 4천만원이라는 헐값에 거래되고 있다. 이는 한국토지공사와 행정도시 예정지 주민들 간 보상계약이 한창이던 2006년 초 1장당 1억2천만원의 25 33% 수준이다. 새 정부 들어 세종시특별법 제정과 정부기관의 행정도시 이전변경 내용 관보 고시 지연 등으로 행정도시의 정상추진에 대한 불안감이 확산되고 있는 데다 경제한파로 건설경기가 침체의 늪에 빠져 있기 때문이다. A부동산 연기군 조치원읍 관계자는 요즘 경제한파로 부동산시장이 침체되면서 행정도시 예정지에선 알게 모르게 적지 않은 이주자택지 입주권이 헐값에 거래되고 있다 고 말했다. 행정도시건설청 관계자는 아직 택지분양이 시작되지 않은 상황에서 이주자택지 입주권을 전매하는 것은 불법 이라며 원주민들은 입주권 전매로 피해를 볼 수 있는 만큼 전매를 자제해 달라 고 당부했다.,https://news.naver.com/main/read.nhn?mode=LSD&mid=shm&sid1=260&oid=001&aid=0002544415,166
127023,2009.03.10. 오전 7:00,부동산,아시아경제,국토부 등록기준 미달 건설사 2000여곳 정리,등록조건을 갖추지 않고 운영되는 건설사에 대한 대대적인 정리작업이 펼쳐진다. 정부는 이를 위해 건설업 등록기준 실태조사를 벌여 등록기준에 미달된 2000여곳의 종합건설사를 이달 말 이후 퇴출할 전망이다. 국토해양부는 지난해 9월부터 6개월간 1차 조사대상 3000곳을 대상으로 건설업 등록기준 실태조사를 벌여 이달 말 이후 등록기준에 미달되는 2000여곳의 종합건설사를 정리할 방침이라고 9일 밝혔다. 현행 건설산업기본법에 따르면 토공공사업은 기술자 6인 이상 자본금 법인 7억원이상 개인 14억원 이상을 갖추도록 규정하고 있다. 또 건축공사업은 기술자 5인 이상 자본금은 법인의 경우 5억원 이상 개인은 10억원 이상으로 돼 있다. 토목 건축공사업은 기술자 11인 이상 자본금 법인 12억원 개인 24억원 이상을 충족해야 한다. 아울러 각 업종별로 일정 규모의 사무실을 갖추고 있어야 한다. 정부는 건설사들이 이같은 조건을 갖추고 있는지 조사한 결과 대부분은 자본금 미달업체인 것으로 파악됐다. 또 기술 인력과 보증가능금액확인서 요건을 충족하지 못한 업체가 각각 600곳과 100곳으로 확인됐다. 특히 자본금 미달업체 중 상당수는 주로 사채업자로부터 국공채를 단기간 빌려 요건을 채운 후 돌려준 건설사였다. 국토부는 등록기준에 미달한 2000여곳의 명단을 이달 중 해당 지자체에 통보할 계획이며 적발된 건설사는 해당 지자체에 소명의 기회가 부여된다. 소명시 타당성 있는 해명이 이뤄지지 않을 경우 순차적으로 행정처분이 내려지게 된다. 정부는 이 건설사에 대해 영업정지 처분이나 3년 이내 동일 사유로 처분을 받은 건설사의 경우에는 등록 말소 처분이 내리게 된다. 국토부 관계자는 지속적으로 페이퍼컴퍼니 등 부실업체를 적발해 퇴출시킴으로써 수주 질서가 문란해지는 것을 막을 방침 이라고 말했다.,https://news.naver.com/main/read.nhn?mode=LSD&mid=shm&sid1=260&oid=277&aid=0002116780,166
127024,2009.03.10. 오전 6:37,부동산,동아일보,대전충남대전 내달까지 3000여가구 분양,동아일보 13일 계룡건설 학하지구 ‘학의 뜰’ 704채 선보여 규제완화 이후 첫 물량… “올해 분양시장 시금석” 올 대전지역 아파트 분양이 본격적으로 시작된다. 13일 계룡건설에 이어 제일건설 주택공사 등의 물량이 차례로 쏟아진다. 이 중 계룡건설이 학하지구 학하·계산·덕명·복용동 일대 4블록에 처음 선보이는 ‘리슈빌 학의 뜰’ 704가구 이 관심을 끌고 있다. 학하지구가 노은과 서남부를 잇는 대전의 마지막 신도시로 주변에 화산천과 수통골 복용도시공원 계룡산국립공원인 빈계산 등 천혜의 자연환경을 갖춘 데다 분양가 상한제 폐지 등 각종 부동산 규제가 완화된 가운데 처음 분양되는 것이라 향후 대전지역 부동산 시장의 판도를 가늠해 볼 수 있기 때문. 계룡 측은 풍수전문가들이 이곳을 ‘학이 노닐던 최고의 명당자리’로 꼽아왔다며 입지 환경에 걸맞게 벽지와 온돌마루 접착제까지 친환경 자재를 사용하고 첨단시스템을 접목한 참살이형 명품 아파트를 짓겠다고 밝혔다. 19∼25층 10개 동으로 △112m²형 34평 196가구 △115m²형 과거 34평 121가구 △132m²형 39평 194가구 △158m² 47평 193가구 등 모두 704가구. 채광 조망 환기가 뛰어난 3면 개방형이며 발코니 확장 시 평형별로 7∼12평이 늘어나도록 설계됐다. 다목적 피트니스센터 지상주차장을 없애고 보행로와 차도를 완전 분리한 설계도 눈에 띈다. 분양가는 3.3m²당 900만 원 안팎에서 책정된 것으로 알려졌다. 계룡건설 관계자는 “분양률을 높이기 위해 이익보다 손해가 나지 않는 범위에서 분양가를 책정했다”며 “수요자들에게 최고의 조건이 될 것”이라고 말했다. 모델하우스는 대전 서구 탄방동 로데오타운 옆. 042 471 5400 피데스개발도 4월경 서남부택지개발지구 14블록에서 ‘파렌하이트’ 885가구를 분양할 예정이며 제일건설도 학하지구에서 ‘오투그란데’ 1600가구를 선보인다. 건설업계 관계자는 “정부의 부동산 규제 완화가 분양시장에 다소 영향을 미칠 것으로 보인다”며 “계룡의 분양률은 올해 충청권에서 예상된 1만여 가구 아파트 분양시장의 바로미터가 될 것”이라고 말했다.,https://news.naver.com/main/read.nhn?mode=LSD&mid=shm&sid1=260&oid=020&aid=0002031737,166
127025,2009.03.10. 오전 6:25,부동산,아시아경제,대형건설사 주공 공사물량 따자 ...수주전 가열,대형건설사들의 대한주택공사 휴먼시아 건설 경쟁이 뜨겁다.예전에는 대형건설사들이 주공아파트를 거들떠도 보지 않았다. 공사를 하고도 남는 게 없다는 이유에서다. 그래서 중견 건설사들이 일감 확보 차원에서 참여하는 수준였다. 사정이 악화되자 대형업체들도 다급해졌다. 매출도 올리고 직원들 하나라도 덜 해고하자면 주공아파트 건축도 아쉬운 판이다. 롯데 대림 포스코 등 내로라하는 업체들이 다 참여했다. 대형업체들은 자체브랜드를 단 아파트 공급은 쉬는 대신 주공 아파트 도급공사 수주에 나선 것이다. 이들이 나서자 중견업체들은 죽을 맛이다. 경쟁이 심화된 탓이다. 9일 건설업계 등에 따르면 중견 건설업체들만 참여해오던 주공 아파트 도급공사에 대형 건설사들의 참여가 활기를 띠는 것으로 나타났다. 주공이 발주한 행복도시 첫마을 아파트 건설공사에서는 그동안 찾기 어렵던 대형 건설사들이 입찰참여 리스트에 대거 이름을 올렸다. 1단계 A 1블록아파트건설공사 4공구는 롯데건설이 저가심사 1순위로 지목돼 있는 가운데 10대 건설업체로만 GS건설과 대림산업 포스코건설 등이 참여했다. 두산건설과 한화건설 금호건설 한진중공업 쌍용건설 등도 이름을 올렸다. 롯데건설은 예정가격 대비 71.3%인 1351억원에 공사를 수행하겠다고 제안해놓은 상태다. A 2블록아파트건설공사 5공구에서도 롯데건설이 1396억원을 투찰 1순위에 올랐다. 이 공사도 GS건설과 대림산업 두산건설 한화건설 금호건설 쌍용건설 코오롱건설 등이 함께 경쟁에 나섰다. D블록아파트건설공사 6공구는 상대적으로 공사비 규모가 작아 대형사 참여가 소폭에 그쳤다. 511억원을 투찰한 금호건설이 1순위에 지명된 가운데 10위권인 두산건설 한진중공업 쌍용건설 코오롱건설 등이 뒤를 이었다. 이처럼 대형 건설사들이 앞다퉈 주공의 최저가낙찰 아파트건설공사 입찰 참여에 나선 것은 이례적이다. 그동안 대형사들은 턴키방식을 제외하고는 주공 등 공공 주택부문 건설공사가 수지를 맞추기 힘들다며 외면해왔다. 건설사 관계자는 시장침체 속에 주택분양은 계속 지연되고 완공현장은 늘어나 주택사업비중 유지를 위해 어쩔 수 없이 참여하게 됐다 면서 일단은 도급사업에 참여하기로 한만큼 수주를 위해 총력을 기울일 것 이라고 밝혔다. 한편 올해 주공의 공사 발주물량은 주공의 아파트 건설공사가 지난해보다 17% 6만9000가구 늘어난 8만1000가구이며 대지조성공사 11건 9359㎡ 도 별도로 발주된다. 주택유형별로는 △국민임대 5만3233가구 △공공분양 2만5063가구 △10년임대 2079가구 △5년임대 510가구 등이다.,https://news.naver.com/main/read.nhn?mode=LSD&mid=shm&sid1=260&oid=277&aid=0002116774,166
127026,2009.03.10. 오전 3:09,부동산,동아일보,타인 분양권 취득땐 양도세 감면 못받아,동아일보 미분양 해소 위한 세제개정안 내달 시행 서울 이외 지역의 미분양주택이나 신축주택을 구입한 뒤 5년 안에 되팔 때 양도소득세 감면 또는 면제 혜택을 보려면 해당 시장 군수 구청장 등으로부터 매매계약서에 확인을 받아야 한다. 건설업체는 자사 自社 가 보유한 미분양 주택 전체의 동·호수별 현황을 4월 30일까지 시장 군수 구청장 및 관할 세무서장에게 제출해야 한다. 기획재정부는 미분양주택 해소를 위한 세제 稅制 개편안이 최근 국회를 통과함에 따라 이렇게 세법 시행령을 개정하기로 했다고 9일 밝혔다. 개정안은 관계부처 협의와 입법예고 등을 거쳐 다음 달 초 시행된다. 한편 국세청은 통상 8월 말까지 지급하는 양도세 환급금을 올해는 4월 말까지 앞당겨 지급한다고 밝혔다. 이번 환급은 지난해 12월 세법을 고친 데 따른 것으로 2008년 1월 1일부터 소급 적용된다. 환급대상자는 2만 명 환급금은 총 1600억 원이다. 차지완 기자 cha donga.com 손효림 기자 aryssong donga.com ▼수도권 억제권내 149㎡이하만 혜택 지방 미분양 주택은 면적제한 없어▼ 바뀌는 세법 시행령 내용 등을 문답 Q A 으로 알아본다. Q 양도세 감면·면제 대상 미분양 주택의 범위는…. A 2009년 2월 12일 현재 건설회사가 소유한 미분양 주택을 구입하면 감면 또는 면제 혜택을 받을 수 있다. 또 2월 12일 이후 분양하는 신축주택을 내년 2월 11일까지 계약해도 같은 혜택을 받을 수 있다. 이런 주택을 5년 안에 팔면 이 기간 중 발생한 양도세를 감면·면제 받는다. Q 2월 11일 이전에 계약한 주택은 어떻게 되나. A 감면·면제의 대상이 아니다. 2월 12일 이전에 다른 사람이 건설회사에서 매입하기로 계약한 미분양 아파트의 계약을 해지한 뒤 이 집을 사들인 사람도 감면·면제 혜택을 볼 수 없다. 다른 사람이 구입했던 분양권을 취득해도 혜택을 받을 수 없다. Q 주택의 면적에 제한이 있나. A 서울을 제외한 수도권 과밀억제권역 내의 미분양 주택은 전용면적 기준 149m² 약 45평 이하일 경우에만 5년 안에 팔 때 양도세의 60%를 감면받을 수 있다. 공급면적 기준으로는 약 60평에 해당된다. 과밀억제권역 밖의 지방 미분양 주택을 5년 안에 팔 때는 면적제한 없이 양도세를 100% 면제받는다. 서울은 양도세 혜택이 없다. Q 5년이 지나서 이 집을 팔 때 양도세를 계산하는 방법은…. A 감면 대상 양도차익을 산출하려면 실거래가에 따른 양도소득금액 × 5년 시점의 기준시가―취득 당시 기준시가 ÷ 양도 당시 기준시가―취득 당시 기준시가 라는 복잡한 계산법을 이용해야 한다. 예컨대 취득가액 5억 원 공시가격 4억 원 인 주택이 5년 뒤 8억 원 6억4000만 원 으로 뛴 뒤 10억 원 8억 원 이 될 때 처분한다고 가정해 보자. 이 계산법에 따르면 감면 대상 양도차익은 3억 원이다. 즉 전체 양도차익 5억 원에서 감면 대상 양도차익 3억 원을 뺀 2억 원에 대해서만 일반세율 6∼33% 및 장기보유특별공제 연 3% 최대 30% 를 적용해 세금을 매긴다는 뜻이다. Q 미분양주택 구입을 위해 주택담보대출을 받으면 혜택이 있나. A 미분양주택 취득을 위해 장기주택담보대출을 받을 경우 이자에 대한 소득공제요건이 ‘상환기간 15년 이상’에서 ‘상환기간 5년 이상’으로 완화된다. Q 국세청이 환급해 주는 양도세를 받으려면 어떻게 해야 하나. A 주소지 관할 세무서가 4월 말까지 개별 통지할 예정이다. 세무서에 계좌를 신고한 사람은 계좌로 지급되며 계좌 신고를 하지 않은 사람은 주소지로 발송되는 ‘국세환급통지서’를 우체국에서 현금으로 바꾸면 된다. 국세청은 자동응답전화 ARS 나 금융회사의 현금자동입출금기 ATM 를 통해 환급하지 않으므로 주의해야 한다.,https://news.naver.com/main/read.nhn?mode=LSD&mid=shm&sid1=260&oid=020&aid=0002031592,166
127027,2009.03.10. 오전 3:09,부동산,동아일보,“한국 부동산 시장 하반기부터 개선”,동아일보 UBS증권은 이르면 올해 하반기 7∼12월 정부의 각종 대책이 효과를 발휘하면서 한국의 부동산 시장이 완만하게 개선될 것이라고 9일 전망했다. UBS증권은 이날 낸 보고서에서 “최근 부동산 시장의 반등은 대부분 서울 강남권의 재건축 지역에 국한된 것으로 가격이 추가 상승하거나 다른 지역으로 확산될 것으로 보이지는 않는다”며 “하지만 하반기부터는 정부 정책이 효과를 발휘하고 투자 심리가 호전되면서 완만하게 개선될 것으로 예상된다”고 밝혔다. 이 보고서는 또 서울의 부동산 시장은 앞으로 2 3년 안에 신규 공급이 기록적인 수준으로 낮아질 것이란 점에서 긍정적이라고 평가했다. 그러나 지방은 기존의 공급물량이 해소되지 않은 상태에서 추가로 1 2년간 공급이 늘어날 것으로 보여 가격 회복이 쉽지 않을 것으로 내다봤다.,https://news.naver.com/main/read.nhn?mode=LSD&mid=shm&sid1=260&oid=020&aid=0002031576,166
127028,2009.03.11. 오후 9:34,부동산,노컷뉴스,정몽구 회장 신형 에쿠스 많이 팔릴 것,소비자 반응 확신 못하지만 2 3년 내에 큰 성과 있을 것 CBS경제부 박종환 기자 정몽구 현대기아차 회장은 11일 신형 에쿠스 출시와 관련해 차량이 좋고 손색이 없어 많이 팔릴 것으로 기대한다 고 밝혔다. 정 회장은 이날 오후 서울 한남동 그랜드 하얏트호텔에서 열린 에쿠스 신차발표회가 끝난 뒤 기자들과 만나 에쿠스 판매를 통해 현대차 브랜드 이미지를 높일 수 있을 것 이라며 이같이 말했다. 정 회장은 에쿠스는 우리나라를 비롯해 중국과 미국 중동 쪽으로 판매될 것 이라며 소비자 반응이 어떨지 확신은 못하지만 2 3년 후에는 큰 성과를 거둘 수 있을 것으로 기대한다 고 자신감을 표했다. 에쿠스 판매 전략과 관련해서는 품질을 높이고 가격을 낮춘 것도 주요 판매 전략 중 하나 라며 일단 많이 파는 것이 가장 중요한 목표 라고 강조했다. 글로벌 자동차 시장 전망에 대해선 수요가 줄어 경쟁이 심화되고 있어 어려운 것이 사실 이라고 말했다. 한편 한승수 국무총리는 신차발표회 축사를 통해 자동차는 어느 분야보다 많은 부품업체와 연결돼 있어 협력업체와의 협조가 무엇보다 중요하다 며 현대차는 대표기업답게 협력업체의 동반자로서 상생의 모범을 보여줬으면 한다 고 강조했다. 홍준표 한나라당 원내대표는 한미FTA로 가장 큰 이득을 보는 업종이 자동차인데도 현대차 노조는 지난해 한미FTA 반대 파업을 하는 등 지난 22년동안 매년 파업을 했다 며 이제는 세계 굴지의 기업이 되도록 노사가 한마음이 돼야 한다 고 말했다. 이날 신차 발표회에는 정몽구 회장 한나라당 홍준표 원내대표 이상득 한나라당 의원 정장선 국회 지식경제위원장 김영선 국회 정무위원장 조석래 전경련 회장 등 정계와 재계 인사 등 1천여명이 참석했다.,https://news.naver.com/main/read.nhn?mode=LSD&mid=shm&sid1=260&oid=079&aid=0002039884,166
127029,2009.03.11. 오후 8:51,부동산,매일경제,롯데 리비아서 주택기반공사 수주,롯데건설은 리비아 주택기반시설청이 발주한 1120억원 규모 알아잘랏 지역 기반시설 인프라스트럭처 턴키 공사를 수주했다고 11일 밝혔다. 롯데건설이 외국에서 도로와 전기 등 기반시설 공사를 수주한 것은 이번이 처음이다. 알아잘랏시는 리비아 수도 트리폴리 서쪽 100㎞ 지점에 위치해 있으며 롯데건설은 총 415㏊ 용지에 도로 상하수도 전기 통신시설을 건설한다. 공사 기간은 총 48개월이다. 롯데건설은 2007년 리비아에 합작법인을 설립하고 예술학교공사를 하고 있다. 이번에 인프라스트럭처 공사까지 수주해 리비아 건설시장에 성공적으로 진입하게 됐다. 롯데건설 관계자는 지난해 요르단에서 4억달러 규모 발전소와 LPG 저장탱크 사업을 수주하고 호주에서 은퇴자 아파트 사업을 따내는 등 국외 부문 수주 금액이 11억달러를 돌파했다 며 플랜트 건축 주택공사에 이어 대규모 인프라스트럭처 공사까지 수주해 국외사업 포트폴리오를 다양화하게 됐다 고 말했다.,https://news.naver.com/main/read.nhn?mode=LSD&mid=shm&sid1=260&oid=009&aid=0002078899,166
