,date,cat,co,headline,text,url,week
58824,2007.07.12. 오후 12:17,부동산,헤럴드경제,현대산업개발99년 현대그룹서 독립…‘I PARK’ 브랜드로 명가 리모델링,건설한국 60년 미래 60년을 준비하자 현대산업개발이 걸어온 30년 현대산업개발은 과거 국내 주택 건설을 대표하는 기업에서 현재는 대표적인 디벨로퍼이자 종합건설기업으로 위상을 높여가고 있다. 지난해 창립 30주년을 맞은 현대산업개발은 99년 현대그룹으로부터 완전히 계열 분리해 독자경영체제를 구축한 이후 발전을 거듭해 오고 있다. 단순한 시공사가 아니라 세계 수준의 경쟁력을 갖춘 부동산 개발업체 및 인프라 건설기업으로 도약 중이다. 현대산업개발의 모태는 한국도시개발과 한라건설이었다. 한국도시개발은 압구정동 일대에 6000여가구의 현대아파트를 건설하며 국내에 ‘아파트’라는 주거 형태를 알린 대표적인 주택 건설 전문 기업이며 한라건설은 삼천포 화력발전소 등의 대형 플랜트 공사와 중부고속도로를 비롯한 도로공사 간척사업 도시 및 산업단지 조성 등 대형 토목 프로젝트를 수행했던 기업이다. 한국도시개발과 한라건설이 합병해 지금의 현대산업개발로 태어난 것은 86년으로 합병을 통해 현대산업개발은 한 국도시 개발의 아파트 자체사업 수행 능력과 국내외에서 터득한 한라건설의 집적된 기술들이 합쳐지면서 시너지 효과를 발휘 명실상부한 종합건설업체로 거듭나게 됐다. 이후 현대산업개발은 서울 압구정동 분당신도시 인천 부평 등 대단위 단지 건설을 비롯해 빌라 전원주택 주상복합에 이르기까지 1년에 평균 1만가구 이상을 건립하며 주택 건설 명가의 위상을 이어갔다. 건축 부문에서도 적극적으로 사업을 추진해 교육 의료 스포츠 분야뿐 아니라 전시 관람 및 유통 분야의 건물을 건립했다. 또 한라건설이 건립했던 삼천포 화력발전소 1 2호기에 이어 3 6호기 경부고속철도 시범구간 건설 고속도로 공사를 비롯해 교량 지하철 고속전철 노반공사 등 각종 사회간접자본 공사 화력발전소와 환경설비 등 플랜트 공사 한강바닥 준설 등 환경보존사업 유화사업 레저사업 등 모든 건설사업 분야에서 괄목할 만한 성과를 통해 발전을 거듭한 결과 91년까지 연 40 50%의 고속성장을 기록하는 등 시장가치 1위 건설업체로 우뚝 섰다. 특히 99년에는 정세영 현대자동차 명예 회장과 정몽규 회장이 현대산업개발로 취임하면서 현대그룹으로부터 완전히 계열 분리하는 등 독자경영체제를 구축해 기업 발전의 새로운 전기를 마련했다. 정몽규 회장은 취임 이후 지식경영시스템 KPS 전사적자원관리시스템 ERP 전자계약시스템 전자공사실적증명제와 e 러닝 Electronic Learning 등을 구축하는 등 혁신경영을 통해 건설업계에 새 바람을 일으켰다. 아울러 2001년 3월에는 기존의 ‘현대아파트’ 브랜드 대신 ‘I＇PARK’ 브랜드를 도입해 현대그룹에서의 완전한 독립을 달성한 것은 물론 아파트를 단순한 생활공간이 아닌 문화를 창출하는 새로운 주거 공간으로 만들겠다는 강력한 의지를 표명하기도 했다. 이와 같은 의지는 대한민국 최고의 아파트라는 명성의 삼성동 아이파크를 탄생시키며 ‘아파트의 명가’라는 명성을 굳건히 하고 주택 30만가구를 건설하는 성과의 바탕이 됐다. 현대산업개발은 현재 단순한 시공사가 아니라 세계 수준의 경쟁력을 갖춘 부동산 개발업체 및 인프라 건설기업으로 도약하기 위해 외형 성장이 아닌 철저한 수익 위주의 성장을 견지하고 있다. 아울러 타 건설사와의 차별성을 구축해 국내 최대의 오피스 빌딩인 강남 파이낸스센터 대전 월드컵경기장 초특급 호텔인 파크하얏트서울 국내 최대의 복합 문화공간인 용산민자역사 자체 사옥인 아이파크타워 등을 건설하며 기능과 건축미학을 동시에 만족시키고 있으며 토목 부문에서도 신대구 부산고속도로 서울 춘천고속도로를 비롯해 많은 SOC 민간투자사업을 수행하며 선택과 집중의 전략을 통해 신수익 모델을 구축하고 국내 민간투자사업의 방향을 제시하는 등 시장 흐름을 선도하고 있다.,https://news.naver.com/main/read.nhn?mode=LSD&mid=shm&sid1=260&oid=016&aid=0000247809,79
58825,2007.07.12. 오후 12:17,부동산,헤럴드경제,다가구ㆍ다세대 주택 건축허가 건수 급증,지난 1980년대 중반까지만 해도 서민들의 보금자리로 각광받았던 다가구.다세대주택이 아파트에 억눌려 맥을 못 추다가 최근 다시 옛 명성을 되찾을 조짐이다. 올들어 서울을 비롯한 수도권의 다가구 다세대주택의 건축허가 건수가 예년에 비해 크게 증가한 것. 이는 정부가 올들어 다가구 다세대 주택의 건축기준을 완화한데다 총부채상환비율 DTI 담보대출인정비율 LTV 등 주택대출 규제가 고가 아파트에 집중되면서 상대적으로 규제가 덜한 다가구 등의 건축 수요가 늘어난 때문으로 풀이된다. 12일 서울시와 경기도 인천시 등에 따르면 지난 1월부터 5월까지 다가구 주택의 건축허가 건수는 총 1916건 동 으로 지난해 같은 기간 1065건 에 비해 80%가량 증가했다. 다세대 주택도 올해 2883가구가 건축허가를 받아 지난해 1944 가구에 비해 48% 늘었다. 다가구 주택을 동 棟 당 5가구로 추산하면 약 9500가구가 지어져 1∼5월 다가구 다세대 건축허가 물량은 총 1만2000여가구에 이른다. 경기도는 다가구 주택의 경우 올해 5개월간 1316건 동 5966가구가 건축허가를 받았다. 지난해 같은 기간에 비해 동 수로는 69% 가구수로는 64% 정도 늘어난 것이다. 같은 기간 다세대 주택은 올해 2092가구로 지난해 대비 88%나 증가했다. 경기도에서는 특히 화성시가 지난해 15건에서 올해는 260건으로 무려 1633%나 증가했고 파주시도 지난해 24건에서 올해는 189건으로 688% 늘었다. 화성시는 동탄신도시 파주시는 교하택지지구내 단독주택 부지에 다가구 건축허가가 대폭 늘었다. 인천시도 지난 5월말 현재 다가구 주택은 194개동의 건축허가가 나 지난해 같은 기간 56개동에 비해 약 3.5배 246% 증가 로 늘었고 다세대는 올해 215가구로 작년의 126가구에 비해 70% 증가했다. 서울시는 다세대 주택은 지난해 708가구에서 올해 576가구로 다소 감소했으나 다가구 주택은 올해 406건으로 지난해 228건에 비해 87% 증가했다. 정부는 다세대와 다가구의 건축기준을 완화한 건축법 시행령 개정안이 최근 자치단체의 조례개정을 통해 본격적으로 시행됨에 따라 하반기에는 다가구 다세대 건축이 더욱 늘어날 것으로 보고 있다. 건교부 관계자는 “올해 수도권 서울 경기 인천 에서 다가구 다세대 주택은 지난해 1만3000여가구의 4배 가까운 5만여가구가 건축될 것으로 예상돼 주택시장 안정에 큰 영향을 미칠 것”이라고 전망했다.,https://news.naver.com/main/read.nhn?mode=LSD&mid=shm&sid1=260&oid=016&aid=0000247801,79
58826,2007.07.12. 오후 12:17,부동산,헤럴드경제,현진그룹 사옥 분당이전,현진그룹 회장 전상표 은 오는 13일부터 15일까지 성남시 분당구 미금역에 신축한 ‘에버빌타워’로 사옥을 이전한다고 12일 밝혔다. 에버빌타워는 연면적 9236㎡의 지하 2층 지상 8층 규모로 전층을 현진 임직원이 사용하게 된다. 기존 안양사옥은 지난 2003년도에 설립한 백우현진복지재단 자본금 120억원 에 출연돼 있어 사옥이전 후 발생하는 임대수익은 복지활동에 사용될 계획이다. 현진 관계자는 “연내 중동 두바이와 중국 상하이 등의 해외사업이 본격적으로 추진되고 리조트사업도 착공에 들어갈 예정”이라며 “임직원들의 업무 효율성을 극대화하고 서울로의 접근성이 좋은 쾌적하고 편리한 사무공간 형성을 위해 에버빌타워를 신축해 이전하게 됐다”고 말했다. 한편 현진은 사옥이전에 발맞추어 CI 개편 및 사가제작 홈페이지 주소 www.hyunjin.com 도 새롭게 변경했다.,https://news.naver.com/main/read.nhn?mode=LSD&mid=shm&sid1=260&oid=016&aid=0000247800,79
58827,2007.07.12. 오후 12:17,부동산,헤럴드경제,플러스옵션 고분양가 우회도로 역할 변질,아파트 옵션제는 이래도 저래도 문제....골치덩어리.정부는 분양가를 낮춘다는 명분 으로 오는 9월부터 마이너스옵션 아파트를 도입할 예정이지만 어느 품목까지 제한 할 것인지 등를 놓고 여전히 혼선을 빚고 있다. 이에 반해 플러스 옵션은 고분양가를 피해가는 우회도로 역할을 하고 있어 소비자들만 헛갈리고 골탕을 먹을 소지가 커지고 있다. 아파트 옵션제 소비자만 골탕 최근 분양을 마친 인천 엑슬루타워의 플러스옵션 가격은 풀 full 적용시 1190만 2620만원 선으로 평당 30 48만원에 달한다. 그러나 분양가는 분양가는 평당 870만 1800만원 선에 분양승인이 나고 그렇게 홍보되고 있다. 일반인들은 그저 분양가로만 인식하고 있는 셈이다. 플러스옵션의 품목도 복잡다단하다. 엑슬루타워의 경우 천정매립형 에어컨과 벽난로 대리석바닥재 홈시어터 붙박이장 5가지 품목으로 구성되어 있다. 선택사양비용을 보면 천정매립형 에어컨은 750만 1880만원 선 대리석바닥재 100만 280만원 붙박이장 140만 240만원선이다. 홈시어터는 280만 350만원 벽난로 280만원선이다. 한화건설이 분양 중인 인천 에코메트로도 마이너스옵션과 함께 플러스옵션이 적용된다. 플러스옵션 품목은 대리석바닥재 500만 990만원 전동커텐 100만원 에어컨 냉매배관 40만원 월풀욕족 210만원 등 4가지로 구성될 예정이다. 평당가는 910만 1300만원 선이지만 플러스옵션을 모두 선택하면 800만 1300만원이 추가된다. 마이너스옵션 풀 적용시 1000만 9000만원이 차감되지만 역시 효과는 미미할 전망이다. 한 업계 관계자는 “욕실의 경우 마이너스옵션 적용시 심지어 수도꼭지도 없어 이를 선택하는 사람은 대형평형 고가 수요층 일부에 국한된다”며 “플러스옵션 선호도가 높아 마이너스옵션의 실효성이 떨어지는 것이 사실”이라고 말했다.,https://news.naver.com/main/read.nhn?mode=LSD&mid=shm&sid1=260&oid=016&aid=0000247799,79
58828,2007.07.12. 오후 12:17,부동산,헤럴드경제,마이너스옵션 소비자 기피ㆍ저질주택 양산 우려,아파트 옵션제는 이래도 저래도 문제....골치덩어리.정부는 분양가를 낮춘다는 명분 으로 오는 9월부터 마이너스옵션 아파트를 도입할 예정이지만 어느 품목까지 제한 할 것인지 등를 놓고 여전히 혼선을 빚고 있다. 이에 반해 플러스 옵션은 고분양가를 피해가는 우회도로 역할을 하고 있어 소비자들만 헛갈리고 골탕을 먹을 소지가 커지고 있다. 아파트 옵션제 소비자만 골탕 오는 9월부터 벽지 바닥재 주방용구 조명기구 등 일부 품목을 계약자가 직접 선택 시공하는 마이너스옵션제가 시행되지만 실제 분양가 인하효과에 의문이 제기되고 있다. 따라서 자칫 소비자만 골탕을 먹을 소지가 크지고 있다. 먼저 소비자의 기피현상. 실제 지난 5월 마이너스 옵션을 시범적용한 풍림산업의 인천 엑슬루타워 아파트의 경우 600명이 넘는 계약자 가운데 고작 107가구 17%만이 이를 선택했다. 더욱이 107가구 가운데 43가구는 85㎡ 26평형 크기의 중소형 아파트 계약자들이었고 선택 목적도 분양가 절감을 위해서라기 보다는 가변형 벽체를 없애 방 2개를 하나로 넓히기 위해서였다. 마이너스 옵션 품목이 전체 분양가에서 차지하는 비중이 크지 않은 데다 마이너스 옵션 품목을 개인이 선택 시공할 경우에도 비용이 절감효과는 불활실하다. 건설업체 관계자는 “시공사는 대량 구매를 통해 품목 단가를 낮출 수 있기 때문에 마이너스 옵션이 오히려 품질이나 가격면에서 불리하다”고 지적했다. 이 때문에 건설교통부는 이달 중 마이너스 옵션 품목과 건축비를 따로 고시할 예정인데 이번에 도입하는 마이너스옵션제는 입주자가 마음에 들지 않는 품목 몇 개를 골라서 뺄 수 있는 일부 옵션제가 아니라 기본사양 전체를 선택하지 않는 방식이 될 것으로 알려졌다. 사실상 기본사양 주택과 마이너스 옵션 주택으로 나눠지는 셈이다. 마이너스 옵션 주택을 선택하는 입주자들을 같은 동에 배정하는 것도 논란거리다. 근래들어 동 향 과 층에 따라 분양가는 물론 프리미엄 차이가 갈수록 벌어지고 있는 상황에서 동을 조정하는 과정에서 마이너스 옵션 주택 선택자와 기본사양 주택 선택자 간 갈등을 불러일으킬 수 있다.,https://news.naver.com/main/read.nhn?mode=LSD&mid=shm&sid1=260&oid=016&aid=0000247798,79
58829,2007.07.12. 오후 12:17,부동산,헤럴드경제,성원 수도권 남부 주상복합 릴레이분양,안양 비산동 142가구ㆍ용인 신갈동 404가구 공급 성원건설이 수도권 남부의 인기 주거지인 안양과 용인에서 잇따라 주상복합 분양에 나선다. 성원건설은 지난 11일 안양 비산동 1차 주상복합 아파트 조감도 의 모델하우스를 열고 총 219가구 중 142가구를 일반분양한다고 12일 밝혔다. 지하4층 지상24층 총 3개 동 규모로 95㎡ 29평형 21가구 109㎡ 33평형 62가구 112㎡ 34평형 59가구로 구성되어 있다. 안양 비산동은 평촌 과천과 인접한 인기 주거지로 2만여가구의 주거타운을 형성하고 있는 곳이다. 국철 안양역을 이용할 수 있고 석수 평촌 산본IC 및 일직분기점도 인접해있다. 또한 천변공원과 자전거도로 등으로 생태공원조성이 완료된 안양천이 단지 바로 앞에 위치해 있다. 031 447 6006 성원건설은 이어 이달중 용인시 기흥구 신갈동에 중대형 주상복합 아파트 404가구를 분양한다. 112㎡ 34평형 128가구 148㎡ 45평형 128가구 188㎡ 57평형 128가구 204㎡ 62평형 12가구 214㎡ 65평형 6가구 297㎡ 90평형 2가구 등이다. 주변에 남부CC 수원CC 등의 골프장과 신갈천 80만평의 기흥호수 한국민속촌 등이 위치해 있어 조망권 및 주거환경이 양호하다. 수원IC와 신갈JC가 인접해 있고 42번국도 및 23번국도도 가깝다. 또한 서울 용인간 고속화도로 2008년 가 개통 예정이고 용인경전철 구갈역 2009년 분당연장선 기흥역 2010년 등이 개설될 계획이다.,https://news.naver.com/main/read.nhn?mode=LSD&mid=shm&sid1=260&oid=016&aid=0000247797,79
58830,2007.07.12. 오후 12:17,부동산,헤럴드경제,금호13구역 21층 아파트단지로,市 층고제한 덜받는 3종 일반주거지로 상향조정 서울 성동구 금호 제13 주택재개발 구역이 최고 21층 높이의 아파트 단지로 변모한다. 서울시는 11일 제15차 도시.건축공동위원회를 열고 금호 2가동 200 일대 5만8350㎡의 금호 제13 재개발구역에 대한 정비계획 변경안을 통과시켰다고 12일 밝혔다. 변경안에 따르면 구역 내 1종 일반주거지역 5만1336㎡가 용적률 층고 등이 덜 제한받는 3종 일반주거지역으로 크게 상향 조정됐다. 따라서 이 구역에는 용적률 219.38% 이하 층수 평균 18.3층 최고 21층 이하 범위에서 33㎡형 10평형 194가구 임대주택 59㎡형 18평형 590가구 85㎡ 25.7평형 301가구 115㎡ 35평형 52 가구 등 총 1137가구가 들어서게 된다. 공동위는 또 성북구 석관 제2 주택재개발 구역 석관동 58 56 일대 5만1522㎡ 도 정비구역으로 지정했다. 이 구역 가운데 4만8807㎡에 달하던 2종 일반주거지역 7층 은 12층까지 지을 수 있는 2종 일반주거지역으로 상향됐고 앞으로 용적률 235% 이하 최고 층수 22층 70ｍ 이하 범위에서 아파트를 지을 수 있다. 공동위는 아울러 은평구 역촌1 주택재건축 구역 역촌동 189 1 일대 3만2002㎡ 도 정비구역으로 지정하면서 1.2종 7층 일반주거지역이던 이 구역의 용도지역을 모두 2종 일반주거지역 12층 으로 올려줬다. 이곳에는 용적률 219% 이하 최고 높이 18층 60ｍ 이하 범위에서 임대주택 89 가구 등 535가구의 아파트가 들어선다. 공동위는 또 서대문구 연희 제1 주택재건축 구역 연희동 711 일대 1만9469㎡ 도 정비구역으로 지정했다. 이 구역의 용도지역은 2종 주거지역 7층 에서 2종 주거지역 12층 으로 상향됐고 앞으로 용적률 235% 이하 최고 층수 17층 이하 범위에서 아파트 402가구가 건립된다. 이 밖에 재건축을 둘러싼 주민 간 이견으로 재건축 협의대상구역으로 묶여있던 서대문구 북가좌동 330 6 일대 1만923㎡가 재건축 정비예정구역으로 지정됐다.,https://news.naver.com/main/read.nhn?mode=LSD&mid=shm&sid1=260&oid=016&aid=0000247796,79
58831,2007.07.12. 오후 12:17,부동산,헤럴드경제,3순위 청약 ‘제각각’ 이유있다,규칙 모호…인터넷ㆍ모델하우스 등 업체마다 달라 모델하우스를 찾아 청약 일정을 확인할 때 눈치 빠른 수요자라면 한번쯤 궁금증을 가졌을 법한 게 3순위 청약 접수 방법이다. 어느 사업지는 모델하우스 현장에서 접수를 한다고 공고를 내는가 하면 어느 사업지는 1 2순위 청약과 마찬가지로 인터넷에서 청약을 받는다. 이는 또 동일 지자체에서도 다르다. 예컨대 최근 남양주시 화도읍에서 분양에 나선 풍림아이원은 1 2순위까지는 인터넷에서 청약을 받았으나 전평형 미달된 뒤 3순위는 모델하우스에서 청약을 받았다. 동부건설과 대림산업 등 최근 남양주에서 분양한 대다수 단지들 역시 이처럼 모델하우스에서 3순위 청약을 받았다. 반면 비슷한 시기에 분양한 롯데건설의 남양주 진접 롯데캐슬은 3순위까지 모두 인터넷에서 청약을 받았다. 올해 상반기부터 수도권 투기과열지구 내에서 인터넷 청약이 의무화되면서 금융결제원 홈페이지를 통해 상세한 경쟁률이 공개되고 있으나 이처럼 대게 2순위까지만 인터넷 청약을 받고 극히 일부 사업지만 3순위까지 인터넷 청약을 받는 것으로 파악되고 있다. 이런 현상이 벌어지는 이유는 입주자의 모집절차를 규정한 주택공급규칙 8조 11항의 해석 때문이다. 8조 11항에서는 ‘건설교통부장관은 투기과열지구 안에서 청약 과열의 방지 등을 위하여 필요하다고 인정되는 경우에는 사업주체로 하여금 인터넷을 활용하여 입주자를 모집하게 할 수 있다’고 명시돼 있다. 즉 모든 사업지에 일괄적으로 강제할 수 있는 사안이 아니라 행정지도 수준의 절차라는 것이 건교부 관계자의 설명이다. 이로 인해 분양승인을 내주는 지자체가 판단의 주체가 된다. 앞서 거론된 남양주시의 경우 3순위 일반청약은 청약통장만 있다면 누구나 청약할 수 있는 것이라 굳이 인터넷 청약을 의무화할 필요가 없어 2순위까지만 인터넷 청약을 받고 있다고 설명했다. 하지만 일각에선 순위 내 마감의 자신감 여부라고 지적하기도 한다. 순위내 마감이 어려우면 굳이 경쟁률을 공개할 필요가 없다는 것. 인터넷 청약을 통해 굳이 3순위까지 미달된 결과가 공개돼 자존심을 구기는 일은 막아보자는 취지다. 실제 건설업체들은 3순위 내에서 마감이 이뤄지면 별도 자료를 통해 청약 결과를 밝히지만 미달일 경우 은근슬쩍 넘어가곤 한다.,https://news.naver.com/main/read.nhn?mode=LSD&mid=shm&sid1=260&oid=016&aid=0000247795,79
58832,2007.07.12. 오후 12:17,부동산,헤럴드경제,줌인규제해제 호재에 혹해 덜컥 계약땐 낭패볼수도,그린벨트 투자 어떻게 기존주택 증ㆍ개축만 허용…논ㆍ밭은 원칙적으로 신축 불허 정부가 2003년 10월 집단취락 등의 개발제한구역 그린벨트 우선해제지침을 마련한 뒤 전국의 대규모 300가구 이상 중규모 100가구 이상 소규모 20가구 이상 집단취락지의 개발제한구역 해제가 잇따르고 있다. 특히 최근에는 건교부와 서울시 경기도 인천시 등이 공동으로 지난 1999년부터 추진해 온 ‘2020 수도권 광역도시계획’이 4월 중앙도시계획위원회 심의를 받은 데 이어 지난 5일 중도위를 최종 통과 수도권에서만 125.8㎢의 그린벨트가 해제된다. 이처럼 그린벨트 해제 면적이 급증하면서 해제될 그린벨트 내 부동산이 관심을 끌고 있다. 30여년간 개발과는 거리가 멀어 주변을 에워싼 풍부한 녹지가 보전된 쾌적한 생활환경이 욕심나고 또 소유자들은 그동안 제약받았던 재산권을 행사하면서 매물이 늘어 부동산가격이 들썩이고 있다. 하지만 그린벨트에서 해제된다고 해서 모든 제약이 해소되는 것은 아닌 만큼 매입 시 신중을 기하지 않으면 큰 낭패를 볼 수 있다. 실제로 김동만 48 씨는 최근 경기도 구리시 집단취락지 내 밭 600여㎡를 사려다 큰 손해를 당할 뻔했다. 김씨는 그린벨트가 해제되면 전원주택을 지을 수 있다는 중개업소의 말만 믿고 계약을 서둘렀다. 김씨는 주변의 밭이 3.3㎡당 600만원을 호가했지만 이 토지는 450만원이어서 싸다는 생각에 매입키로 결심하고 지인들에게 전원주택에 살게 된다고 자랑했다. 그러나 지인들은 ‘잘 알아보라’는 충고를 했고 급기야 김씨는 계약 직전에 문의해 본 결과 집을 지을 수 없는 땅이라는 것을 알고 매입을 포기했다. 그린벨트에서 해제되면 모든 게 풀리는 것 같지만 실제로는 그렇지 않다. 그린벨트에서 해제된 집단취락지는 자연녹지로 남거나 제1종 일반주거지역 등으로 용도가 바뀌어 건축물 증.개축이 비교적 자유로워진다. 이때 지구단위계획을 수립하면 대부분 제1종 일반주거지역으로 변경돼 건폐율 40% 용적률 150% 범위 내에서 4층 이하의 공동주택을 지을 수 있다. 이때 전면 정비계획을 마련했다면 4층 이하 연립주택 신축이 가능해지고 부분정비 때는 3층 이하 다세대주택 정비가 되지 않았을 때는 단독주택 신축이 각각 허용된다. 자연녹지지역으로 남으면 건축한도는 건폐율 20% 용적률 150% 범위 내에서 3층 이하의 단독주택을 지을 수 있다. 그러나 그린벨트 내에서는 원칙적으로 집을 신축할 수 없고 1회에 한해 기존 건축물의 증.개축만 가능하다. 이태희 부동산컨설턴트는 “그린벨트에서 해제된 집단취락지라도 기존 주택의 증.개축은 가능하지만 논밭 등을 사 주택을 신축하는 것은 허용되지 않는다”고 설명했다.,https://news.naver.com/main/read.nhn?mode=LSD&mid=shm&sid1=260&oid=016&aid=0000247771,79
