,date,cat,co,headline,text,url,week
56090,2007.06.12. 오전 11:00,부동산,머니투데이,건교부 서울·전남도와 KOPSS 협약체결,머니투데이 문성일 기자 건설교통부는 국토공간계획지원체계 KOPSS 구축과 활용을 위해 오는 13일 서울 양재동 aT센터 제2전시장 비즈니스룸에서 서울시 전남도와 각각 업무협약식을 체결한다고 12일 밝혔다. KOPSS는 국토공간계획 및 정책의 수립·시행·평가와 관련된 과정에서 의사결정에 필요한 정보를 지원할 수 있는 시스템이다. 이 시스템은 토지관리 건축행정 토지이용규제 정보 등 다양하고 방대한 국토정보를 GIS와 결합해 개발·보전지 분석 3차원 경관 분석 사업비 분석 도시 방재분석 등을 할 수 있도록 함으로써 국토공간계획 업무를 과학적·합리적으로 수행할 수 있도록 지원해 준다. 이미 미국과 독일 일부 지자체에서 실험적으로 개발한 바 있으나 중앙정부 차원에서 전 국토를 대상으로 개발하는 것은 우리나라가 처음이다. 이는 그동안 정부가 정보화 사업을 꾸준히 추진 국토관리에 관한 정보DB가 충분히 구축됐기 때문이란 게 건교부의 설명이다. 건교부 관계자는 KOPSS는 국토공간을 지속가능한 친환경적 공간으로 개발하고 국토공간계획과 정책결정에 합리적인 대안을 도출하기 위해 지난해부터 5개년 사업으로 추진하고 있다 고 말했다. 이번 업무협약 체결로 지자체가 구축하고 있는 주민등록DB 지적DB 등을 활용할 수 있어 다양하고 완성도가 높은 시스템 개발이 가능해졌고 지자체는 도시계획 수립이나 재개발 등 각종 개발사업은 물론 도시공원 등 녹지관리업무에 첨단 공간계획 기법을 활용할 수 있게 될 것으로 건교부는 내다봤다.,https://news.naver.com/main/read.nhn?mode=LSD&mid=shm&sid1=260&oid=008&aid=0000794171,75
56091,2007.06.12. 오전 11:00,부동산,머니투데이,건교부 장마·수해대책 본격 가동,머니투데이 문성일 기자 건설교통부는 다음주부터 시작될 여름 장마철과 태풍에 대비 그동안 실시해 왔던 홍수대비 모의훈련 등 각종 수해방지대책을 마무리하고 지난달 15일부터 운영중인 홍수대책상황실 을 본격 가동한다고 12일 밝혔다. 이를 위해 건교부는 수자원기획관을 실장으로 한 상황실을 수자원반 도로반 철도반 항공반 등 4개 반으로 편성하고 국가시설물 점검 등 사전 예방활동과 수해대책 관리 및 복구활동 등을 지휘할 계획이다. 동시에 이달 말까지 총 426건의 국가시설물에 대한 수해복구공사 가운데 90%인 383건의 복구를 완료할 예정이다. 또 대형공사 등으로 6월 말까지 준공이 어려운 43건에 대해선 교량하부 및 절성토부 등 수해 취약구간을 우선 시행 수해예방에 만전을 기할 방침이다. 건교부는 이와 함께 수해복구 공정율이 부진하거나 우기전 준공이 어렵고 공사 건수가 많은 관련기관을 대상으로 오는 13일 관계관 회의를 통해 공정만회대책 등을 점검·독려할 예정이다. 한편 기상청 장기예보에 따르면 올 장마는 평년보다 다소 빠른 다음주부터 본격 시작돼 다음달 하순부터 차차 사라질 전망이다. 올 6 8월 강수량은 평년 451 894mm 과 비슷할 것으로 예측됐다.,https://news.naver.com/main/read.nhn?mode=LSD&mid=shm&sid1=260&oid=008&aid=0000794169,75
56092,2007.06.12. 오전 10:43,부동산,이데일리,건교부 산하기관 편법파견 직원 복귀조치,이데일리 남창균기자 건설교통부는 중앙인사위에 통보하지 않은 채 편법으로 데려다 일을 시킨 산하기관 직원들을 해당기관에 복귀시켰다고 밝혔다. 건교부 박명식 총무팀장은 12일 일부 부서에서 업무의 시급성 등을 감안해 산하기관 직원을 파견받아 활용하고 있으나 일부 파견자에 대한 중앙인사위 통보 등 내부절차가 누락됐다 며 내부절차가 누락된 직원에 대해서는 공직적인 절차를 거쳐 파견하도록 했으며 나머지 직원은 복귀조치했다 고 설명했다. 이에 앞서 이낙연 민주당 의원은 건교부가 산하기관 직원 93명을 정당한 절차를 거치지 않고 편법으로 일을 시켰다고 지적했다.,https://news.naver.com/main/read.nhn?mode=LSD&mid=shm&sid1=260&oid=018&aid=0000490880,75
56093,2007.06.12. 오전 10:37,부동산,헤럴드POP,콘도회원권 소비자 피해 3배 이상 급증…사기 주의보,해마다 여름 휴가철을 앞두고 기승을 부리고 있는 콘도회원권 관련 소비자 피해가 올해도 기승을 부리고 있어 소비자들의 주의가 요구된다. 12일 한국소비자원에 따르면 올해 1 4분기 소비자원에 접수된 콘도회원권 관련 소비자 상담은 964건으로 지난해 같은 기간 271건 에 비해 256% 693건 늘어났다. 피해 유형별로 보면 청약 철회 거부 과다 위약금 청구 등으로 인한 피해가 전체의 83% 800건 로 가장 많았다. 추가 대금을 청구하거나 계약 때 제공한 무료통화권의 사용이 불가능한 경우 경품 당첨이나 보험료 환급을 빙자해 계약을 체결한 경우가 각각 6.95% 67건 였다. 실제 사용할 수 있는 콘도가 계약 전 설명과 달리 제한돼 있는 경우도 0.7% 7건 로 집계됐다. 이들 사업자는 ‘리조트 무료이용권에 당첨됐다’ ‘회사 설립 10주년 기념 행사로 무료콘도 숙박권을 나눠주고 있다’ ‘소비자원의 시정 명령으로 무료 숙박권을 제공하고 있다’ ‘내비게이션 구매자는 무료콘도 회원권 혜택 대상이다’ 등의 말로 소비자를 현혹하고 있는 것으로 나타났다. 이들은 콘도회원권은 무료지만 제세 공과금과 콘도관리비 등의 명목으로 보통 70만 80만원 정도를 요구하고 있다. 소비자원은 “무료 이벤트 당첨 등을 통해 콘도회원권을 제공해 준다는 전화는 사기일 가능성이 높다”면서 “텔레마케터의 말에 현혹돼 자신의 인적사항이나 주소 신용카드 번호 등 개인정보를 알려주는 우를 범하지 말아야 한다”고 말했다. 이어 “방문판매 또는 텔레마케터를 통해 충동적으로 계약을 체결했어도 14일 이내에 신용카드사와 업체에 내용증명을 발송하면 청약철회가 가능하다”고 설명했다.,https://news.naver.com/main/read.nhn?mode=LSD&mid=shm&sid1=260&oid=112&aid=0000069034,75
56094,2007.06.12. 오전 10:37,부동산,헤럴드POP,봇물 터진 토지보상금 가계부담 가중 우려,예단을 불허하는 ‘저울추’ 같은 균형감각으로 정평이 나 있는 이성태 한국은행 총재가 요즘 금리인상을 강하게 시사하는 발언을 아끼지 않고 있다. 이 총재는 지난 8일 금융통화위원회 회의 직후 가진 기자간담회에서 “지난해에는 부동산 가격에 관심이 있었는데 올해는 빠른 유동성 증가 속도에 관심을 두고 있다”며 “높은 유동성 수준이 계속된다면 중장기적으로는 물가상승 압력으로 작용할 가능성이 있다”고 말했다. 지난 1년 동안 한은의 긴축정책에도 불구하고 과잉유동성이 줄어들지 않은 원인의 중심에 정부의 막대한 토지보상금 지출이 자리잡고 있다. 고삐 풀린 보상금이 부동산과 주식시장 등으로 몰려다니면서 자산가격의 버블을 부추기는 등 부작용이 심각하다. 최근 증시 활황도 우리 경제의 힘을 반영하기보다는 갈 곳 없는 토지 보상금이 주식시장으로 유입되면서 일으킨 ‘유동성 장세’라는 분석이 그래서 나온다. 이 총재는 12일 한은 창립 57주년 기념사에서도 유동성 증가세가 가파르게 지속될 경우 금리인상으로 유동성 흡수에 나설 수도 있음을 재차 시사했다. 과도한 유동성 증가세를 방치할 경우 실물경제의 균형과 안정에도 나쁜 영향을 줄 수 있다고 판단한 것이다. 그동안 ‘과잉 유동성 해소’와 ‘경기회복’ 사이에서 저울질을 하던 한국은행이 전자로 기울어질 가능성이 커지고 있다는 의미다. 토지보상금이 풀린 탓에 시중에 돈이 풀려 나간 정도를 알려주는 지표인 ‘광의 유동성 L ’의 경우 지난 2월 전년 동기 대비 19.3%에서 3월에는 17.5% 4월에는 12.7% 등 꾸준히 큰 폭으로 늘어났다. 한국은행이 시중에 나도는 돈줄이기에 나섰지만 그래도 10% 선 아래로 떨어지지 않고 있다. 이 때문에 소비자물가 2% 시대도 흔들릴 수 있다는 우려도 나온다. 통계청에 따르면 소비자물가는 지난 5월로 24개월째 2%대를 유지하고 있다. 김재천 한국은행 조사국장은 “최근 3년간 부동산 가격이 많이 오른 데다 증시에서도 가파른 상승세가 이어져 앞으로 집세를 포함한 소비자물가에 큰 영향을 줄 것”이라고 말했다. 게다가 지금 우리 경제는 가계부채 급증과 부동산 경기 둔화의 악재가 겹쳐 경제 연착륙이 어느 때보다도 필요한 시점인데 자칫 자영업자나 가계 부담을 가중시킬 우려도 크다. 한은이 콜금리 목표치를 인상하면 시장 금리도 다시 한 번 요동치며 대출금리 상승으로 이어지기 때문이다. 김정식 연세대 교수는 “과잉유동성을 줄이기 위해 한은이 콜금리를 올리면 주택담보대출을 받은 서민들에게 큰 부담이 될 것”이라며 “한편으로는 환율 하락을 촉발해 수출에도 좋지 않은 영향을 미치게 될 것”이라고 말했다. 한국은행이 과잉유동성 해법을 놓고 경제성장 물가안정 금융시장 안정이라는 3가지 경제정책 목표 중 어느 쪽에 무게를 둬야 할지 ‘트라일레마 Trilemmaㆍ3중의 딜레마 ’의 고민에 빠졌다.,https://news.naver.com/main/read.nhn?mode=LSD&mid=shm&sid1=260&oid=112&aid=0000069033,75
56095,2007.06.12. 오전 10:37,부동산,머니투데이,주공 양산물금 국민임대 1260가구 공급,머니투데이 김정태 기자 대한주택공사 사장 박세흠 는 경상남도 양산물금 신도시 택지개발사업지구 7블록에 국민임대아파트 1260가구를 공급한다고 12일 밝혔다. 이번에 공급하는 임대아파트는 전용면적 36㎡ 554가구 46㎡ 706가구다. 임대보증금 및 임대료는 전용 36㎡가 1200만원에 6만8000원 전용46㎡는 1900만원에 12만8000원이며 입주시기는 2008년 7월로 예정돼 있다. 신청자격은 가구당 월평균 소득 241만370원 4인 이상 가구는 263만6380원 이하 토지 5000만원 이하 자동차 2200만원 이하인 무주택 세대주다. 양산시 거주자 1순위 부산시 기장군·북구·금정구·울산시·밀양시·김해시 거주자 2순위 그 밖의 지역 거주자가 3순위다. 접수는 양산 실내체육관에서 받으며 우선공급 및 월평균소득 172만1690원 이하 1·2·3순위자 28일 월평균소득 172만1690원 이상 241만370원 이하 1·2·3순위자는 29일 접수받는다. 당첨자 발표는 오는 7월 12일 계약은 같은 달 25 27일 3일간이다.,https://news.naver.com/main/read.nhn?mode=LSD&mid=shm&sid1=260&oid=008&aid=0000794145,75
56096,2007.06.12. 오전 10:36,부동산,머니투데이,구로 고척 우방유쉘 초기 75% 계약,머니투데이 문성일 기자 C 우방은 서울 구로구 고척동에 들어서는 고척 우방유쉘 에 대해 지난 11일 당첨자를 대상으로 한 계약마감 결과 공급물량의 75%인 135가구가 계약이 완료됐다고 12일 밝혔다. 이 아파트는 지상14 20층 4개동으로 33평형 단일 평형 180가구로 구성된다. 사업지는 영등포 교정시설 이전이 확정된 인근으로 경인로·강서로·남부순환로에 인접해 있다. 주변에 대형할인점 롯데마트 이천일아울렛 이용이 가능하다. 목동생활권에 광역학군제 도입으로 교육여건과 재개발 진행으로 주거환경이 크게 개선될 것이란 게 C 우방의 설명이다.,https://news.naver.com/main/read.nhn?mode=LSD&mid=shm&sid1=260&oid=008&aid=0000794144,75
56097,2007.06.12. 오전 10:31,부동산,뉴시스,동탄 메타폴리스 분당 파크뷰 능가 할 듯,화성 뉴시스 경기 화성시 동탄신도시에서 지난 4일 마감된 초고층 고급주상복합아파트 메타폴리스 의 청약신청이 1266가구 모집에서 1순위에서만 2만4684명으로 2대1의 경쟁률을 기록 높은 관심을 보인 것으로 밝혀졌다. 초고층 고급주상복합아파트는 서울 강남 도곡동의 ‘타워팰리스’를 시작으로 분당 정자동 ‘파크뷰’ 등 지역을 대표하는 ‘랜드마크 주상복합 아파트’가 부동산시장의 시들지 않는 ‘블루칩’으로 각광을 받고 있다. 특히 이들은 지역 중심에 위치해 있으면서도 뛰어난 조망권과 높은 수준의 생활편의 시설·보안·고급스러운 인테리어를 갖춘 최고급 주거시설이라는 공통점을 갖고 있다. 수요층은 대부분 30·40층 이상의 초고층 아파트라는 점과 높은 인지도를 바탕으로 지역내 랜드마크 표지물 역할을 하며 부동산 시장에서 높은 프리미엄을 유지하고 있다. 고급주택의 대명사 ‘타워팰리스’ ‘타워팰리스’ 등 초고층 주상복합아파트는 이제 고급주택의 대명사로 지칭되고 있다. 지난 1999년 처음 분양을 시작해 2002년 10월부터 입주가 시작된 ‘타워팰리스’는 강남의 대표적인 랜드마크 아파트로 꼽히며 한국을 대표하는 최고급 주상복합이라는 상징성 때문에 부유층 수요자들에게 꾸준한 인기를 얻고 있다. 평균 3억2000만원에 분양된 35평형의 경우 현재 프리미엄만 분양가의 3배에 이르며 현시세 12 13억원 지난 4월말 건설교통부가 발표한 공시가격 기준 타워팰리스 102평형은 40억800만원을 기록 국내에서 4번째로 비싼 공동주택에 이름을 올렸다. 최근 보유세 여파와 부동산 하향안정세의 영향을 받긴 했지만 인근의 일반아파트에 비해 여전히 높은 시세를 형성하고 있다. 분당을 상징하는 정자동 ‘파크뷰’ 신도시의 대명사인 분당은 강남을 대체하기 위해 만든 도시답게 강남과 더불어 우리나라의 대표적 부촌으로 인식되고 있다. 이런 분당에서도 가장 핵심지역 정자동에 ‘파크뷰’가 자리하고 있다. 2001년 3월 분양을 시작해 2004년 6월부터 입주가 시작된 파크뷰는 33 95평형에 1829가구로 구성된 대규모 주상복합아파트다. 그러나 상가동이 아파트동과 분리돼 있어 기존 주상복합보다 훨씬 쾌적한 이점 등이 부각되면서 타워팰리스와 견줄만한 수준이다. 평당 871만원에 분양된 54평형은 분양가가 4억 7055만원이었으나 현재 20억원대로 약 4배 이상 올랐고 평당 905만원에 분양된 78평형의 경우 현시세가 33억원에 달해 평당가 4230만원으로 강남최고 아파트가격과 어깨를 나란이 하고 있다. 부동산114 6월 11일 기준 수도권 남부 지존으로 부상하는 ‘메타폴리스’ 메타폴리스는 입주시 분당 파크뷰를 능가하는 복합단지가 될 것으로 전망되고 있다. 우선 입지 면에서 기존 동탄신도시의 중심상업지구에 위치에 자리하고 있어 랜드마크 건물이 되기에 충분하다. 뿐만 아니라 40∼98평형의 중대형 평형에 층수도 55∼66층으로 구성된 1266가구로 규모면에서도 초대형을 자랑한다. 또한 제2 동탄신도시 계획 발표로 분당의 1.7배 규모임에도 낮은 인구밀도 높은 녹지율 최첨단 U 시티 친환경 도시로 개발되는 933만평의 초대형 동탄신도시의 대표적인 복합단지이기 때문이다. 더욱이 메타폴리스는 일반적인 주상복합아파트가 아니라 복합단지다. 기존 주상복합건물은 건물 지하나 저층에 상가시설 등을 배치했지만 메타폴리스는 전체 사업부지가 2만8887평이고 아파트건물 외에 판매ㆍ문화ㆍ레저시설 등이 별도로 만들어져 총 6만 3000여 평의 연면적을 자랑하는 초대형 복합단지가 조성된다. 주상복합 열기 수도권에서 지방 대도시로 확산 이처럼 한국의 주거문화를 대표하는 주상복합아파트는 좋은 입지조건 뛰어난 환경 등 조망권 등 초고층 고급 주거단지의 편의시설을 확보하고 있어 그 가치를 더욱 인정받고 있다. 이런 시장 분위기에 맞추어 건설업체들도 분양하는 주상복합아파트를 주요도시의 랜드마크 건물로 만들기 위해 심혈을 기울이고 있으며 송도 ‘더 퍼스트월드’ 창원의 ‘시티7’ 청주의 ‘지웰시티’ 등이 분양시장의 큰 관심을 받은바 있다. 일각에서는 분양가 상한제가 실시될 경우 최고급 주상복합을 건설하기 어려울 것이란 전망도 있지만 특별한 것을 선호하는 주택수요가 있는 한 앞으로도 이 열기는 당분간 지속될 것으로 전망되고 있다.,https://news.naver.com/main/read.nhn?mode=LSD&mid=shm&sid1=260&oid=003&aid=0000449910,75
56098,2007.06.12. 오전 10:23,부동산,머니투데이,리츠칼튼클럽 분양설명회 개최,머니투데이 문성일 기자 루티즈코리아 19·21일 양일간 해외부동산 포털사이트 업체인 루티즈코리아는 오는 19일과 21일 양일간 서울 강남교토타워 B동 23층 다목적홀과 외환은행 본점 해외고객센터 세미나실에서 미국 샌프란시스코에 위치한 리츠칼튼클럽 플랙셔널 오우너쉽 Fractional Ownership 분양설명회 를 개최한다고 12일 밝혔다. 리츠칼튼클럽은 개인소유 콘도미니엄 52유닛과 플랙셔널 오우너쉽 49유닛으로 올 11월 입주 예정이다. 개인소유 콘도미니엄은 이미 판매가 완료됐으며 이번에 소개하는 물건은 플랙셔널 오우너쉽이다. 플랙셔널 오우너쉽은 지분소유권 방식으로 구매자가 원하는 지분 만큼의 금액을 지불하고 구매자 본인의 이름으로 리츠칼튼클럽의 스위트룸이 등기되는 개인재산으로 언제든 매매 상속이 가능하다. 36 59평 규모로 고급 실내장식과 함께 리츠칼튼이 직접 관리와 서비스를 진행한다. 계약할 경우 본인과 가족 지인 모두 미국내 주요 도시는 물론 유럽 남미 호주 동남아 각지에 소재한 63개 호텔과 리조트 체인을 VIP 대우로 사용할 수 있다. 이번 설명회는 선착순 60명만 참석이 가능하며 참가비는 무료다.,https://news.naver.com/main/read.nhn?mode=LSD&mid=shm&sid1=260&oid=008&aid=0000794126,75
56099,2007.06.12. 오전 10:21,부동산,헤럴드POP,잘 팔리는 아파트 5대 특징은,대출규제와 세금폭탄 그리고 오는 9월 시행되는 분양가 상한제와 청약가점제 등 분양시장 환경이 불투명한 가운데서도 당초 예상을 깨고 잘 팔리는 아파트들이 속속 나타나고 있다. 특히 수도권에서는 3순위 청약마감에도 불구하고 실질적인 분양성패의 가늠자인 초기 계약률이 90 100%에 육박하는 단지들도 많다. 최근 분양호조를 보이는 인기 분양 아파트들의 특징을 알아본다. 대형호재가 있다 부동산 시장을 움직이는 최대 활력소는 뭐니뭐니 해도 개발호재다. 지난 1일 ‘분당급 신도시’인 동탄2신도시 개발 발표 이후 기존 동탄1지구와 인근 오산 등지의 분양시장 열기는 무더위를 무색케하고 있다. 동탄2신도시 확정 이후 가장 먼저 분양에 들어간 주상복합 메타폴리스는 평균 20대 1이 넘는 높은 청약 경쟁률을 기록하며 신도시 호재덕을 톡톡히 봤다. 풍성주택의 위버폴리스 오피스텔도 평균 77대1 최고 117대 1의 경쟁률을 보였다. 현대건설이 오산 원동에 선보인 힐스테이트 역시 동탄2신도시 발표 후 계약이 급증하면서 성공적으로 분양을 끝냈다. 서울에서는 미아뉴타운 내 삼성래미안 가재울뉴타운대 현대아이파크 등이 뉴타운 개발호재에 힘입어 불티나게 팔렸다. 상대적으로 자유로운 전매 부동산의 경우 환금성이 떨어지는 게 단점이다. 더구나 장기간 전매제한에 묶인 경우라면 더욱 그렇다. 이에 따라 아예 전매제한이 없는 주상복합 오피스텔이나 입주 후 바로 팔 수 있는 아파트가 인기를 끌고 있다. 지난달 말 분양한 남양주 진접읍 부평리 동부 센트레빌 1176가구 과 화도읍 마석우리 신도브래뉴 330가구 의 경우 입주 후 전매가 가능하고 분양가가 저렴하다는 장점이 부각되면서 거의 다 계약을 마쳤다. 신도종합건설 관계자는 “분양가 상한제 아파트와 달리 입주후면 바로 매매가 가능하다는 점 등이 수요자에게 어필한 것 같다”고 말했다. 앞서 지난4월 인천 송도신도시에서는 전매제한이 없는 코오롱건설의 주상복합 오피스텔 ‘더프라우’가 청약광풍을 불러일이킨 바 있다. 저렴한 분양가 건설업체가 아예 주변시세 보다 낮게 분양가를 책정하는 경우도 있지만 각 지자체의 분양가 규제에 따른 실질 분양가 인하도 분양열기에 한몫하고 있다. 9월 분양가 상한제 실시를 앞두고 있지만 이미 상당수 지자체에서는 분양가자문위원회 등을 통해 분양가를 통제하고 있다. 실수요자 입장에선 보다 저렴한 가격에 아파트를 장만할 수 있어 분양시장으로 몰리고 있다는 분석이다. 실제로 동탄 메타폴리스의 경우 시행사가 최초 평당 평균 1560만원을 제시했지만 화성시가 분양가 인하를 요청해 결국 최초 금액보다 평당 150만원 낮은 1410만원에 공급됐다. 또 용인에서 아파트를 분양할 계획인 현대건설 GS건설 삼성건설 등도 당초 책정했던 분양가에서 낮춰 분양승인을 신청할 것으로 알려졌다. 무이자 융자 등 유리한 계약조건 건설업체측이 제시한 중도금 무이자 융자 등의 유리한 계약조건도 계약률을 높이는 요인으로 작용하고 있다. 남양주에서 순차적으로 아파트를 분양한 동부건설과 대림산업은 계약금을 10% 5%는 계약 시 5%는 한달 후 납입 로 낮추고 중도금 60%를 전액 무이자로 융자해주는 조건으로 분양성공을 거뒀다. 입주 후 전매가 가능한 상황에서 사실상 계약금 가지고 집을 장만할 수 있어 실수요자 뿐 아니라 묻어두기식 투자자들까지 가세했다는 게 현지 중개업소들의 분석이다. 대기ㆍ교체수요가 있다 남양주의 경우 올 한해 분양물량만 1만7000여가구가 예정돼 당초 물량 충격이 우려됐으나 아직까지 분양결과는 호조세를 보이고 있다. 실제 최근 분양한 대림 e편한세상과 동부센트레빌 신도브래뉴 등은 높은 계약률을 기록한 것은 이같은 대기ㆍ교체수요가 뒷받침돼 가능했다는 분석이다. 지난해까지 남양주에선 공급이 뜸해 지역 내 교체수요가 있었고 또한 9월 청약가점제 시행에 앞서 가점이 낮은 대기 수요자들도 미리 움직였다는 것. 대림산업 관계자는 “청약가점제에서 불리한 신혼부부나 1주택 이상 보유자들이 많이 청약했으며 특히 청약자 중 남양주시 거주자가 30%를 넘어 교체수요도 많았다”고 설명했다.,https://news.naver.com/main/read.nhn?mode=LSD&mid=shm&sid1=260&oid=112&aid=0000069024,75
