,date,cat,co,headline,text,url,week
102358,2008.09.11. 오전 11:11,부동산,연합뉴스,분당아파트연합 리모델링 특위로 공동추진,성남 연합뉴스 김인유 기자 1991년 입주가 시작된 경기도 성남 분당 신도시 아파트들이 개별 단지별로 추진중인 노후 아파트 리모델링 사업을 공동으로 진행하기로 의견을 모았다. 11일 분당지역 130여 개 아파트 단지의 연합체인 분당아파트 회장단연합회 회장 허 철 에 따르면 연합회는 지난 8일 월례회의에서 리모델링 지구지정 특별대책위원회 를 구성했다. 연합회가 리모델링 특위를 구성한 것은 현재 10여 개 개별 아파트 단지별로 진행중인 리모델링 사업을 효율적으로 추진하기 위해서는 이해관계가 각기 다른 아파트들을 이끌어 갈 구심점이 필요하다는 판단에서다. 특위는 리모델링을 하면서 단지 내 환경개선사업 주민편의시설 설치 등에 대해 요구사항이 서로 다를 것으로 예상되는 각 아파트의 의견을 하나로 통일시켜 성남시와 협의할 계획이다. 또 조만간 리모델링이 진행중인 아파트 단지 관계자를 위원으로 선임한 뒤 리모델링 노하우를 갖고 있는 건설회사로부터 자문을 받거나 리모델링에 필요한 각종 법규 등 자료를 수집하는 일을 시작하기로 했다. 현재 분당에서는 서현동 매화마을 2단지 등 10여 개 미만의 아파트가 리모델링 지구지정을 받을 수 있는 연한 건축 15년 후 을 2 3년 앞두고 리모델링을 추진하고 있다. 이 밖에도 10여 개가 넘는 아파트가 리모델링을 추진한다는 현수막을 내걸고 있지만 대부분이 아파트가 가격상승을 유도하기 위한 선전행위에 그치고 있을 뿐 주민동의나 조합구성까지 이르지는 못하고 있다. 특위 위원장으로 선임된 김정락 66 씨는 분당 아파트가 지은 지 10년이 넘어가면서 노후화돼 리모델링이 필요한 시점이 됐다 며 분당 아파트 주민들이 원하는 대로 리모델링 지구로 지정받을 수 있게 역할을 다 하겠다 고 말했다.,https://news.naver.com/main/read.nhn?mode=LSD&mid=shm&sid1=260&oid=001&aid=0002263730,140
102359,2008.09.11. 오전 11:09,부동산,아시아경제,주공 추석맞이 외국인 근로자 초청행사,대한주택공사는 지난 10일 경기도 파주시 교하읍에 위치한 Ubi park에서 파주신도시 건설현장에서 일하는 외국인 근로자 150여명을 초청 추석명절맞이 외국인 근로자 초청 행사 를 가졌다.,https://news.naver.com/main/read.nhn?mode=LSD&mid=shm&sid1=260&oid=277&aid=0002028188,140
102360,2008.09.11. 오전 11:08,부동산,한국경제TV,부동산개발 허위·과장광고 막는다,부동산개발의 허위·과장광고가 줄어들 전망입니다. 국토해양부는 내일 12일 부동산개발의 표시와 광고 등에 관한 규정 을 제정해 시행한다고 밝혔습니다. 이 규정은 부동산개발업의 등록사업자가 부동산개발에 관한 표시와 광고를 하는 경우 상호와 명칭 등록번호 등 의무적으로 밝혀야 할 내용을 담고 있습니다. 부동산개발업은 7월말 현재 1천400여 개사가 등록했으며 등록사업자가 아닌 자가 등록사업자임을 표시·광고하거나 등록사업자로 오인될 우려가 있는 경우 3년 이하의 징역이나 5천만원 이하의 벌금에 처합니다. 또 등록사업자가 의무적으로 표시·광고에 포함해야 할 사항을 포함하지 않는 경우 1년 이내의 영업정지 3천만원 이하의 과태료가 부과됩니다. 국토해양부는 이번 규정을 고시함으로 인해 소비자가 등록사업자와 미등록사업자를 구별할 수 있고 부실개발업자의 허위·과장광고로부터 소비자를 실질적으로 보호할 수 있는 제도적 장치가 마련됐다 고 설명했습니다.,https://news.naver.com/main/read.nhn?mode=LSD&mid=shm&sid1=260&oid=004&aid=0001956256,140
102361,2008.09.11. 오전 11:08,부동산,한국경제TV,2011년까지 중앙분리대 102㎞ 설치,102㎞ 길이의 중앙분리대가 올해부터 2011년까지 일반국도에 설치됩니다. 국토해양부는 11일 638억원의 예산이 투입되는 이번 사업은 지난 10년간 국도에 1천200km의 중앙분리대를 설치한 결과 중앙선 침범사고가 크게 줄어 계속 추진한다 고 밝혔습니다. 실제 지난 96년 중앙선 침범으로 인한 사망자수가 2천387명이었던 것이 2007년에는 673명으로 68%가 줄었습니다. 국토부는 우선 올해에는 일반국도 17개 노선 47km구간에 중앙분리대를 설치중 이라고 설명했습니다.,https://news.naver.com/main/read.nhn?mode=LSD&mid=shm&sid1=260&oid=004&aid=0001956255,140
102362,2008.09.11. 오전 11:05,부동산,아시아경제,삼성건설 저탄소 친환경 건축물 사업 추진,삼성건설이 클린턴재단 과 손잡고 저탄소 친환경 건축물 사업에 본격 나선다. 삼성물산 건설부문은 11일 클린턴재단과 기후변화공동대응을 위한 협약을 체결하고 건축물의 에너지절감을 위한 건물에너지 합리화 사업을 공동으로 추진키로 했다고 밝혔다.,https://news.naver.com/main/read.nhn?mode=LSD&mid=shm&sid1=260&oid=277&aid=0002028181,140
102363,2008.09.11. 오전 11:05,부동산,노컷뉴스,현대건설 이종수 사장 추석 맞아 싱가포르 방문,CBS경제부 박종환 기자 현대건설 이종수 李鍾洙 사장이 이달 11일 13일 싱가포르 지역을 방문해 동남아 5개국 임직원들을 격려할 예정이다. 11일에는 싱가포르 지역 주요 발주처인 싱가포르 항만관리청을 찾아 향후 수주물량 증진을 위한 면담을 갖는다. 12일에는 싱가포르 주롱·투아스 준설매립 공사 현장을 찾아 동남아 지역 15개 지사장 및 현장소장들과 2008 하반기 사업목표 달성 점검회의 를 한다. 이날 오후에는 파시르 리스 콘도미니엄 현장 등 싱가포르 현장을 방문하고 저녁 만찬에 임직원 및 현지근로자 가족들을 초대해 임직원들을 격려한 뒤 13일에 귀국한다. 이종수 사장은 2006년 취임이후 약 3년간 총 40개국 현장 국내 포함 을 420차례나 방문하며 글로벌 경영을 펴고 있다.,https://news.naver.com/main/read.nhn?mode=LSD&mid=shm&sid1=260&oid=079&aid=0001992394,140
102364,2008.09.11. 오전 11:00,부동산,머니투데이,부동산개발 광고시 등록사업자 표시 의무화,머니투데이 장시복 기자 국토부 부동산개발의 표시·광고 등에 관한 규정 12일부터 시행 앞으로 부동산개발업 등록사업자가 관련 표시와 광고를 하는 경우 상호와 등록번호 소재지 등을 의무적으로 밝혀야 한다. 국토해양부는 이 같은 내용을 담은 부동산개발의 표시·광고 등에 관한 규정 을 제정 오는 12일 부터 고시·시행한다고 11일 밝혔다. 이 규정은 지난해 11월18일 부동산개발업 등록제 가 시행됨에 따라 허위·과장 광고로부터 소비자를 보호키 위해 도입된 제도다. 규정에 따르면 등록사업자가 부동산개발에 관한 광고시 상호·명칭과 등록번호 주된 영업소의 소재지를 표시해 소비자에게 등록사업자임을 알려야 한다. 등록사업자가 토지소유자와 공동으로 개발할 경우 공동사업주체 방식으로 추진됨을 표시해야 한다. 부동산개발 사업에 관한 인·허가 명칭과 기관 인·허가 번호와 시점 등도 기재해야 한다. 부동산개발업은 올 7월 말 기준으로 1441개사가 등록했으며 등록사업자가 아닌 사람이 등록사업자임을 표시·광고하거나 등록사업자로 오인될 우려가 있는 표시·광고를 할 경우 3년 이하의 징역 또는 5000만원 이하의 벌금에 처해진다. 특히 등록사업자가 의무적으로 표시·광고에 포함해야 할 사항을 누락할 경우에는 1년 이내의 영업정지 3000만원 이하의 과태료에 처해진다. 국토부는 이번 규정을 고시함으로써 소비자가 등록사업자와 미등록사업자를 구별할 수 있고 부실 개발업자의 허위·과장 광고로부터 소비자를 보호할 수 있는 제도적 장치가 마련됐다 고 설명했다.,https://news.naver.com/main/read.nhn?mode=LSD&mid=shm&sid1=260&oid=008&aid=0002032698,140
102365,2008.09.11. 오전 11:00,부동산,연합뉴스,부동산개발 광고때는 등록사업자 표시 의무화,서울 연합뉴스 박성제 기자 국토해양부는 부동산개발의 표시.광고 등에 관한 규정 이 12일부터 시행됨에 따라 부동산개발업자가 부동산개발을 광고할 경우에는 등록사업자임을 표시해야 한다고 11일 밝혔다. 또 등록사업자가 토지소유자와 공동으로 부동산개발을 하는 경우 공동사업주체 방식으로 추진됨을 표시해야 하며 부동산개발사업에 관한 인.허가의 명칭 인.허가 기관 등도 밝혀야 한다. 이 규정은 작년 11월18일부터 부동산개발업 등록제가 시행되면서 부동산개발의 허위.과장 광고로부터 소비자를 보호하기 위해 도입됐다. 한편 부동산개발업은 7월말 기준 1천441개사가 등록했으며 등록사업자가 아닌 자가 등록사업자라고 표시.광고하거나 등록사업자로 오인될 우려가 있게 표시.광고하는 경우에는 3년 이하의 징역이나 5천만원 이하의 벌금에 처해진다.,https://news.naver.com/main/read.nhn?mode=LSD&mid=shm&sid1=260&oid=001&aid=0002263699,140
102366,2008.09.11. 오전 11:00,부동산,아시아경제,부동산개발 등록사업자 표시 의무화,앞으로는 부동산개발 동록사업자가 광고를 하는 경우 의무적으로 등록번호 영업소의 소재지 등을 표시해야한다. 국토해양부는 12일자로 이같은 내용의 부동산개발의 표시.광고 등에 관한 규정 을 제정해 시행한다고 11일 밝혔다.,https://news.naver.com/main/read.nhn?mode=LSD&mid=shm&sid1=260&oid=277&aid=0002028172,140
102367,2008.09.11. 오전 10:55,부동산,머니투데이,시행사 빚 떠안는 건설사들,머니투데이 송복규 기자 KCC건설 대출 대신 갚고 지방 사업 인수 주택시장 침체가 이어지면서 시행사의 채무를 떠안는 건설사들이 늘고 있다. 자금 압박으로 사업 추진에 어려움을 겪는 시행사를 대신해 도급시공계약을 체결한 건설사가 금융권 대출 등을 갚고 해당 사업권을 넘겨받는 것이다. 하지만 이들 사업장은 대부분 분양률이 저조한 지방 악성 사업장이어서 건설사의 재무 부담으로 이어질 가능성이 크다는 지적이다. 10일 건설업계에 따르면 KCC건설은 경북 성주군 백전예산지구 57블록 아파트 시행사였던 ㈜삼진씨앤아이와 지난달 사업권 양수도 계약을 체결했다. 계약금액은 130억3600만원. 이 사업장은 99∼153㎡ 아파트 총 412가구 규모로 지난해 5월 분양을 시작했다. 하지만 계약률이 저조해 분양은 물론 공사도 잠정 중단된 상태다. 사업이 1년 넘게 진척되지 않자 당초 시공을 맡았던 KCC건설은 시행사에 현금 15억원을 지급하고 은행 대출을 갚는다는 조건으로 사업권을 인수했다. KCC건설 관계자는 지방 분양시장 분위기가 살아나지 않아 재분양 시기를 잡지 못한채 사업이 지연됐다 며 직접 재분양을 할 지 사업권을 다른 곳에 넘길 지 여부는 추후 시장 상황에 따라 결정할 것 이라고 말했다. 동부건설은 지난 6월 강원도 원주 단구지역 주택개발 사업권을 인수했다. 시행사인 ㈜보경종합건설이 부도나자 채무보증을 섰던 동부건설이 할 수 없이 금융권 대출 300억원을 대신 갚고 사업권을 확보한 것이다. 한일건설도 지난 3월 시행사인 한빛고을건설의 대출금 521억8000만원을 대신 상환하기로 하고 광주광역시 지석동 아파트 개발사업을 떠안았다. 이 단지는 114∼157㎡ 총 448가구 규모다. 지난해 11월 분양 당시 청약률 0%를 기록할 정도로 분양 성적이 좋지 않았다. 한 대형건설사 관계자는 수도권 등 입지가 좋은 사업이라면 몰라도 준공 후 미분양으로 남을 가능성이 큰 지방 사업을 떠안는 것은 문제가 있다 며 채무보증 등으로 얽혀 있어 어쩔 수 없이 사업권을 넘겨받지만 악성 자체사업은 경영상 부담으로 작용할 수밖에 없다 고 설명했다.,https://news.naver.com/main/read.nhn?mode=LSD&mid=shm&sid1=260&oid=008&aid=0002032684,140
102368,2008.09.11. 오전 10:45,부동산,파이낸셜뉴스,수도권 17만4천가구 양도세중과 제외,수도권 17만4000여가구가 1가구 2주택 양도소득세 중과 대상에서 제외되는 것으로 나타났다. 11일 부동산뱅크가 수도권 도농복합지역 내 아파트 공시가격 3억 원 과표적용률 80% 매매가 3억 7000만 원 기준 이하 아파트 가구수를 조사한 결과 모두 404개 단지 17만 4522가구인 것으로 조사됐다. 이들 아파트는 수도권 군·읍·면 지역 내 위치한 공시가격 3억원 이하 주택은 주택수로 산정하지 않는다는 법 규정에 의해 양도세 중과 대상에서 빠지게 된다. 따라서 도농복합지역 내 아파트를 포함해 2주택을 보유하고 있는 가구의 경우 둘 중 어느 주택을 먼저 팔더라도 중과세율이 아닌 일반세율 9∼36% 로 양도세가 매겨진다. 지역별로는 12개의 행정 구역 중 7개가 읍·면 지역으로 이뤄진 남양주시에 127개 단지 5만 7585가구 몰려 있는 것으로 집계됐다. 특히 한강변에 자리해 인기 주거지로 떠오르고 있는 와부읍과 진접지구 수혜지역으로 꼽히고 있는 진접읍에만 각각 9880가구 7944가구가 조사돼 눈길을 끌었다. 이어 교하읍 문산읍 등이 위치한 파주시에서 50개 단지 2만 2201가구가 확인됐으며 평택시 33개 단지 1만 5 019가구 화성시 27개 단지 1만 4044가구 광주시 33개 단지 1만 3752가구 안성시 15개 단지 1만 3 181가구 등의 지역에서 중과 배제 대상 아파트가 1만 가구를 넘었다. 부동산뱅크 박선옥 연구원은 “지난 8.21대책에 의해 지방광역시 내 공시가격 3억 원 이하 아파트가 주택수 산정에서 제외될 예정이지만 굳이 지방이 아닌 수도권 지역에서도 이러한 양도세 혜택을 누릴 수 있는 단지들이 많다”며 “이들 단지의 경우 양도시 읍·면 지역이 동으로 승격되지 않는한 양도세 중과 부담에서 자유로울 수 있다”고 말했다.,https://news.naver.com/main/read.nhn?mode=LSD&mid=shm&sid1=260&oid=014&aid=0002022809,140
102369,2008.09.11. 오전 10:42,부동산,세계일보,경기 성냥갑 아파트 안돼,앞으로 경기도 내 주택은 이른바 ‘붕어빵’이나 ‘성냥갑’ 아파트가 아닌 시·군별 특징과 이미지를 담아 디자인된 건축물로 지어진다. 이를 위해 ‘도시 디자인 총괄 코디네이터제’가 도입되고 우수 건축물 설계자에게는 해외연수 등 각종 혜택이 주어진다. 경기도는 10일 경기중소기업종합지원센터 국제회의장에서 도내 31개 지자체 등과 이 같은 내용을 골자로 한 ‘경관 및 디자인 개선 공동협약’을 체결했다. 이날 공동협약에는 대한주택공사 한국토지공사 경기도시공사 등 38개 단체 및 기관이 참여했다. 공동실천협약서에 따르면 이들은 도내에 우후죽순으로 들어선 ‘붕어빵’ 건축물 ‘성냥갑’ 아파트 등 단조롭고 획일적인 건축물을 퇴출하는 대신 아름다운 건축·경관 디자인을 통해 선진화된 도시를 건설하도록 공동으로 노력해 나가기로 했다. 우수 건축물 설계자에게는 해외연수 기회를 주는 방식으로 공공건축물 설계 공모를 활성화하며 시·군별로 고유한 특징과 이미지를 담은 랜드마크 건물을 건설하게 된다. 디자인이 우수한 공동주택을 건축할 경우 용적률을 완화하고 각 지자체에 단지와 공동주택 공공시설물 디자인 가이드라인이 마련된다. 도는 도시·건축위원회에 디자인 전문가를 충원해 개발사업지구단위계획 수립 단계부터 건축물의 형태나 디자인 요소를 사전에 검토한다. 도는 또 실무 경험이 풍부한 건축가가 기획·설계·감리를 총괄할 수 있도록 ‘도시 디자인 총괄 코디네이터제’를 도입한다. 김문수 경기지사는 “협약 체결로 경기도가 아름답고 멋있는 도시로 다시 태어나게 됐다”며 “우선 광교신도시부터 협약에 명시된 내용을 적용해 명품도시로 조성하겠다”고 밝혔다. 이날 행사에 참석한 권도엽 국토해양부 차관은 “오늘 협약 체결을 계기로 생명과 문화가 살아 숨쉬는 인간 중심의 공간으로 바뀔 것으로 기대한다”고 말했다. 수원 김영석 기자 lovekook segye.com ⓒ 세계일보＆세계닷컴 www.segye.com 저작자표시 비영리 변경금지 에코피아 가평마라톤대회 세계닷컴은 한국온라인신문협회 www.kona.or.kr 의 디지털뉴스이용규칙에 따른 저작권을 행사합니다.,https://news.naver.com/main/read.nhn?mode=LSD&mid=shm&sid1=260&oid=022&aid=0001986815,140
102370,2008.09.11. 오전 10:39,부동산,이데일리,수원시 광교 분양가 3.3㎡당 1280만원 권고,분양가심사위 금융비용등 70만원 인하해야 이데일리 윤도진기자 광교신도시의 첫 분양물량인 울트라건설 004320 참누리 아파트의 분양가격이 3.3㎡당 평균 1280만원선으로 낮아질 전망이다. 수원시 분양가심사위원회는 지난 10일 회의를 열고 이 아파트의 분양가를 3.3㎡당 평균 1280만원선으로 인하할 것을 울트라건설 측에 권고키로 했다. 울트라건설은 앞서 광교신도시 A 21블록에서 분양하는 112 230㎡ 33 69평 1188가구에 대해 분양가를 3.3㎡당 1317만 1398만원에 책정 지난 3일 수원시에 분양신청서를 접수했다. 수원시 관계자는 심사위원회에서 건축비 및 가산비 부분에 비용이 과다하게 책정돼 3.3㎡당 약 70만원의 인하 요인있다고 판단했다 고 설명했다. 위원회는 특히 가산비 부문에서 순수 토지매입비에 사용되지 않은 자금에 대한 금융비용 등이 분양가에 포함되어서는 안된다고 주문했다. 이에 따라 수원시는 울트라건설로부터 분양가를 조정한 분양승인신청을 받은 뒤 재차 분양가심사위원회를 열어 분양승인 여부를 결정할 방침이다. 시는 분양업체 측이 위원회 결정을 수용할 경우에만 분양승인을 내줄 계획이다. 한편 울트라건설 측은 수원시 측 결정에 대해 분양가 조정 여부를 아직 확정하지 못한 상태다.,https://news.naver.com/main/read.nhn?mode=LSD&mid=shm&sid1=260&oid=018&aid=0002016953,140
102371,2008.09.11. 오전 10:24,부동산,연합뉴스,인천 최대 재건축단지 12월 분양 예정,인천 연합뉴스 김명균 기자 인천지역 최대 규모의 재건축단지인 서구 신현주공재건축단지가 오는 12월 일반분양을 시작할 예정이다. 11일 신현주공재건축조합에 따르면 재건축 후분양제가 오는 10월 해제되더라도 신현주공재건축단지인 ‘신현 e 편한세상 하늘채’의 일반 분양을 후분양제 일정에 따라 오는 12월에 진행키로 했다. 이는 수도권내 다른 재건축단지들이 재건축 후분양제 폐지로 10월부터 공정률에 상관없이 일반분양이 가능해 일반분양 일정을 최대한 앞당기고 있는 것과는 대조적이다. 조합 측은 “현재 아파트 건축공사가 70%의 공정률을 보이고 있는데다 일반분양 시기를 조절하려면 준비과정을 변경해야 하는 번거로운 절차가 있어 당초 계획대로 공정률이 80%를 넘는 12월 중에 일반분양을 하기로 했다”고 말했다. 이에 따라 입주시기가 내년 9월로 예정된 신현주공재건축 아파트는 인천의 민간아파트 가운데 분양시기와 입주시기가 가장 짧은 단지가 될 전망이다. 한편 총 3천331가구가 재건축되는 이 단지는 조합원분을 제외한 일반분양분이 1천116가구로 공급면적은 61∼206㎡로 다양하다.,https://news.naver.com/main/read.nhn?mode=LSD&mid=shm&sid1=260&oid=001&aid=0002263603,140
102372,2008.09.11. 오전 10:20,부동산,머니투데이,올들어 4가구 중 1가구는 미분양아파트,머니투데이 김정태 기자 2005년 10가구 중 1가구...수도권 미분양률 2005년대비 6배 증가 지난 2005년부터 올해까지 분양된 아파트 가운데 4가구 중 1가구는 미분양인 것으로 나타났다. 11일 부동산정보업체 닥터아파트에 따르면 지난 2005년부터 2008년 현재까지 7월 기준 분양물량대비 미분양가구를 살펴본 결과 미분양률이 24.5%에 달했다. 이는 지난 2005년 미분양률 9.2%에 비해 15.3%p늘어난 것이다. 2005년에는 10가구 중 1가구가 미분양 됐지만 올해는 4가구 중 1가구가 미분양 아파트란 얘기다.. 2005년 전국에서 분양 아파트 주상복합 한 아파트는 총 29만2532가구였으며 이중 2만6975가구가 미분양 됐다. 이후 2006년과 2007년 꾸준히 증가추세를 보였으며 2008년 7월 기준 에는 총 11만933가구 분양 중 무려 2만7231가구가 미분양 물량으로 쌓였다. 지역별로는 수도권에서 2005년 12만6738가구가 분양했으며 이중 4021가구가 분양돼 3.3%의 미분양률을 기록했다. 2006년엔 7.9% 2007년엔 8.9%로 상승세를 보이다 2008년엔 분양물량 6만549가구 중에 17.5%인 1만604가구가가 미분양 됐다. 2005년 대비 무려 6배 가량 미분양률이 증가한 것이다. 최근 수도권 미분양률이 큰 폭으로 증가한 이유는 지방 분양시장에 어려움을 느낀 많은 건설사들이 수도권에 분양을 집중했으나 분양가에 부담을 가진 청약자들이 이들 물량을 회피했기 때문인 것으로 풀이된다. 지방광역시에서는 2005년 9만4280가구가 분양했으며 12.3%인 4211가구가 미분양 됐다. 지방광역시도 마찬가지로 계속 증가추세를 보였으며 2008년에는 2만2801가구가 분양돼 34.9%인 7948가구가 미분양 됐다. 2005년 대비 약 3배가량 증가했다. 지방중소도시는 △2005년 14.8% △2006년 21.6% △2007년 35.2% △2008년 31.5%의 미분양률을 보였다. 2005년 대비 2008년 미분양률은 약 2배가량 높아졌다. 닥터아파트 이영진 리서치연구소장은 2008년 들어서면서 수도권 미분양률 증가가 큰 폭으로 상승하면서 전국 미분양률도 높아졌다 며 미분양 해소를 위한 실효성 있는 대책과 업계 자구노력이 필요한 시점 이라고 말했다.,https://news.naver.com/main/read.nhn?mode=LSD&mid=shm&sid1=260&oid=008&aid=0002032644,140
102373,2008.09.11. 오전 10:17,부동산,아시아경제,용인·분당 급매물 찾는 발길 늘었다,“그나마 거래 분위기가 조금씩 나아지고 있다. 급매물 위주로 어느정도 매매가 이뤄지기 시작했다.”부동산 경기 침체로 거래가 끊겨 문 닫을 판이라던 용인 수지와 분당신도시 내 부동산 중개업소에 훈풍이 불기 시작했다.,https://news.naver.com/main/read.nhn?mode=LSD&mid=shm&sid1=260&oid=277&aid=0002028126,140
