,date,cat,co,headline,text,url,week
6610,2006.03.15. 오후 4:16,부동산,머니투데이,미리가 본 판교 모델하우스,머니투데이 원정호 기자 15일 건영 등 판교신도시 분양업체 7개사의 모델하우스가 둥지를 트는 성남시 분당주택전시관. 29일 청약까지 2주를 앞둔 상태여서 마무리공사에 한창이다. 분양업체는 실물 모델하우스를 15일까지 짓고 일반인을 대상으로 20일께 사이버 모델하우스를 개관한다. 시간이 촉박함에도 일부 모델하우스는 인테리어 공사를 마무리짓지 못해 여유가 없다. 사진1 건영 캐스빌 33평형 거실 주택전시관 각 층으로 모델하우스의 화려함을 더해줄 대형TV와 가전도구들이 쉴새없이 올라갔다. 공사 직원들은 점심시간도 모자라 배달 음식으로 끼니를 때웠다. 이미 인테리어 공사를 끝낸 모아건설 모델하우스에는 케이블방송 카메라들이 한켠을 차지했다. 카메라의 눈이 일반인을 대신해 구석구석을 살필 것이다. 현장 사무실에서 만난 최령 모아건설 상무는 케이블방송 인터뷰를 위해 광주 본사에서 급히 올라왔다. 그는 짧은 시간안에 회사의 장점을 설명해야 한다 며 예비 인터뷰 답변 작성에 여념이 없었다. 모아건설의 미래도아파트는 23평과 33평의 모델하우스 2동을 마련해 놓았다. 주부가 거실을 보면서 요리를 할 수 있도록 주방을 설계한 게 눈에 띈다. 임대에선 보기 드문 홈바 겸용 주방이다. 세탁공간과 보조주방 공간을 고려한 넓은 주방 발코니도 특징. 33평형은 모든 침실의 남향 배치와 3.5베이 설계로 쾌적한 실내 환경을 제공한다. 모아건설을 비롯해 광영토건 대방건설 진원이앤씨 등 민영 임대는 채광과 일조를 확보하기 위해 남향으로 배치하거나 주부 중심의 맞춤형 설계를 해 주요 고객층인 주부 고객 잡기에 나선다. 사진2 모아 미래도 33평형 거실 부영이 시공하는 광영토건의 경우 32평형은 침실 욕실 드레스룸 등 부부전용 공간을 고급화했으며 23평형은 3베이 구조와 거실 확장이 가능한 가변형 벽체를 채택했다. 24형 32평 266가구를 임대하는 대방건설은 전세대 3.8베이 설계에 주부 생활을 위해 넓은 주방공간을 제공한다. 23평 24평 32평 470가구를 선보이는 진원이앤씨는 전세대 남향 배치 등 채광과 일조권 확보에 신경썼다. 쾌적한 환경을 위해 판상형과 타워형을 적절하게 배합했다. 임대업계는 이번 기회에 브랜드 이미지를 내걸고 임대가 분양아파트에 비해 품질이 떨어지지 않는다는 것을 보여주겠다는 각오다. 최령 상무는 마스터플랜 심의를 거치면서 단지배치나 평형 구조 등 분양과 임대의 건축 차별요소를 없앴다 면서 임대라는 생각이 안들도록 품질에 최선을 다할 것 이라고 말했다. 전시관 1층의 건영 캐스빌 33평형 모델하우스는 3베이 구조가 기본이다. 거실과 주방이 넓게 설계된 것이 특징이며 참숯 도배지 등 친환경마감재를 사용했다. 사진3 모아 미래도 33평형 주방 23평형은 3베이를 33평형은 부부용 침실을 앞뒤로 터서 3.5베이를 적용했다. 두 평형 모두 가변형 벽체가 설계돼 방 1개를 거실과 확장할 수 있도록 했다. 23평형의 경우 다소 좁게 느껴질 거실 문제를 해결하는 데 유용할 전망이다. 대광건영의 로제비앙은 24A B형과 33평형 등 3개 평형이전시되어 있는데 화이트 컬러 톤 마감에 가변형 벽체를 적용했으며 방 1개에 붙박이장이 기본으로 제공돼 있다 판교 아파트는 모두 발코니 트기형 모델을 기본형으로 채택 33평형을 40평형대처럼 넓게 쓸 수 있는 게 특징이다. 또 고급 마감재와 차별화된 내부를 자랑했다. 하지만 발코니 확장이나 온돌마루 붙박이장 가구ㆍ가전제품 등은 모두 옵션품목이므로 유의해야 한다. 원정호기자 meetho 저작권자 ⓒ 돈이 보이는 리얼타임 뉴스 머니투데이 D .guide categorization title 내 링크가 클릭되면 .guide categorization ct display block 해주세요 이 기사는 언론사에서 경제 섹션으로 분류했습니다. 기사 섹션 분류 안내 기사의 섹션 정보는 해당 언론사의 분류를 따르고 있습니다. 언론사는 개별 기사를 2개 이상 섹션으로 중복 분류할 수 있습니다. 닫기 관련기사 관련기사 소셜플러그인 좋아요 u likeit module 좋아요 0 훈훈해요 0 슬퍼요 0 화나요 0 후속기사 원해요 0 좋아요 이 기사 추천 이 기사를 추천합니다 안내 이 기사 추천 D 공유 아이콘 보내기 p class tomain info phrase span class tomain info body span class tomain info text 이 기사는 span strong class tomain info point 사용자 추천 strong span class tomain info text 으로 모바일 메인 뉴스판에 노출된 이력이 있습니다. span span p p class tomain info phrase span class tomain info body span class tomain info text 이 기사는 span strong class tomain info point 모바일 메인 뉴스판 strong span class tomain info text 에 노출된 이력이 있습니다. span span p p class tomain info layer strong class tomain info head 모두에게 보여주고 싶은 기사라면 i i span class tomain info betaicon beta span strong span class tomain info body strong class tomain info point 이 기사를 추천합니다 strong span class tomain info text 버튼을 눌러주세요. 집계 기간 동안 추천을 많이 받은 기사는 네이버 자동 기사배열 영역에 추천 요소로 활용됩니다. span span a href class tomain info close 레이어 닫기 a p function var currentDate new Date yyyy currentDate.getFullYear mm currentDate.getMonth 1 dd currentDate.getDate var currentDateParam yyyy mm 10 0 mm mm dd 10 0 dd dd var id naver splugin sdk var s document.createElement script s.id id s.type text javascript s.charset utf 8 s.async false s.src hps ssl.pstatic.net spi js release ko KR splugin.js currentDateParam var d document.getElementsByTagName head 0 d.appendChild s d function oData var t new Date yyyy t.getFullYear mm t.getMonth 1 dd t.getDate var currentDate yyyy mm 10 0 mm mm dd 10 0 dd dd var s document.createElement script s.type text javascript s.charset utf 8 s.src hps news.like.naver.com js reaction dist reaction.min.js currentDate new Date .toDateString .replace s g document.head document.getElementsByTagName head 0 .appendChild s window.onload function if jindo. Element spiLayer .query . reactionModule null var toMainInfoLayerManager oCookieStorage null sCookieKey null sTemplateType null oTemplateType2TemplateMapping null welTomainInfoLayer null init function this.setCache this.setEvent if this.sTemplateType N this.renderLayer setCache function this.oCookieStorage jindo. Cookie true this.sCookieKey pcTomainDontShow this.sTemplateType N this.oTemplateType2TemplateMapping R TOMAIN DISPLAYED BY USER RECOMMEND TPL E TOMAIN DISPLAYED BY NEWS EDIT TPL N TOMAIN NOT DISPLAYED YET TPL this.welTomainInfoLayer jindo. Element tomain info setEvent function this.welTomainInfoLayer.delegate click .tomain info close jindo. Fn this.onCloseClick this .bind renderLayer function var sTemplate this.oTemplateType2TemplateMapping this.sTemplateType this.welTomainInfoLayer.html jindo. Template sTemplate .process this.welTomainInfoLayer.show onCloseClick function e e.stopDefault this.welTomainInfoLayer.hide this.oCookieStorage.set this.sCookieKey Y 365 var toMainManager welContainer null welCount null welBuon null init function this.welContainer jindo. Element toMainContainer this.welCount jindo. Element this.welContainer.query . count this.welBuon jindo. Element this.welContainer.query a 추천 수가 0인 경우 디자인이 달라서 is first 클래스 추가addIsFirstClassIfZeroCount function if this.welCount.text 0 this.welBuon.removeClass off .addClass is first removeIsFirstClass function this.welBuon.removeClass is first onRecommend function this.removeIsFirstClass onCancel function this.addIsFirstClassIfZeroCount onRecommendReady function element this.addIsFirstClassIfZeroCount toMainInfoLayerManager.init toMainManager.init reaction.init type multi domain hps news.like.naver.com dependentLibrary jquery cssId news isMobile false isHiddenLabel false isHiddenCount false isHiddenZeroCount false isUsedLabelAsZeroCount false isDebugMode false isHiddenLayerAfterSelection true callback clicked function param displayId 가 NEWS MAIN 이면 메인으로추천 NEWS 면 좋아요 if param param.content param.content.displayId param.content.displayId NEWS MAIN if param.content.isReacted toMainManager.onRecommend return toMainManager.onCancel updated function param if param jindo. A param.contents .filter function content if content.serviceId NEWS MAIN return true return false .forEach function content toMainManager.onRecommendReady var autoSummaryFeedbackData jindo. A param.contents .filter function contentsData return contentsData.serviceId NEWS SUMMARY . value 0 exportif autoSummaryFeedbackData.reactions window.autoSummary new AutoSummary .init apiUrl hps s.news.naver.com article 008 0000640683 summary feedbackDataList autoSummaryFeedbackData.reactions click function param var triggeredWrapper jindo. Element param.target .parent function wel return wel.hasClass reactionModule 0 var isAutoSummaryFeedback triggeredWrapper triggeredWrapper.ar data sid NEWS SUMMARY false if isAutoSummaryFeedback return window.autoSummary.confirmApplyFeedback for social pluginwindow. splugin SocialPlugIn Core nEvent Key evKey news 서비스명 serviceName 뉴스 sourceName 머니투데이 버튼 클릭후 호출되는 콜백함수 onClick function buon 공유하기 레이어 노출 후 호출되는 콜백함수 onShow function 공유하기 레이어 닫기 후 호출되는 콜백함수 onHide function function onSubscribe elTarget return htParameter 이기추 레이어 표시function doDisplayTomainInfo var welTomainInfoLayer jindo. Element tomain info new if welTomainInfoLayer.css display none welTomainInfoLayer.delegate click .tomain info close jindo. Fn onCloseClick this .bind welTomainInfoLayer.html jindo. Template TOMAIN NOT DISPLAYED YET TPL .process welTomainInfoLayer.show else welTomainInfoLayer.hide 이기추 레이어 닫기function onCloseClick e e.stopDefault var welTomainInfoLayer jindo. Element tomain info new welTomainInfoLayer.hide 소셜플러그인 function init socialplugin jindo. Fn function jindo. Fn function var oid 008 var aid 0000640683 new jindo. Ajax main ajax series list.nhn oid oid aid aid type xhr method get timeout 10 async true onload function res var oJson res.json if oJson.message null oJson.message.result null var result oJson.message.result var contents div class serialization news h3 class serialization news title span class serialization news ico 연재 span a href result.linkUrl class serialization news more nclicks ser.more id seriesTitle result.title a span class blind 더보기 span h3 ul class serialization news list jindo. A result.seriesItemList .forEach function value if value if aid value.articleId contents li div class serialization news item span class serialization news time value.articleDate span a href value.url class serialization news link is selected nclicks ser.art value.title a div li else contents li div class serialization news item span class serialization news time value.articleDate span a href value.url class serialization news link nclicks ser.art value.title a div li contents ul div jindo. Element spiLayer .afterHTML contents var elLinkNews jindo. .link news if elLinkNews.length 0 jindo. Element link news more .first .text result.title jindo. Element link news more .visible true block jindo. Element link news more .ar href result.linkUrl .request .delay 0.8 .aach window load 언론사 관련기사 언론사 관련기사 new FontSeingMenu 언론중재법 언론중재법 기능 버튼 영역 머니투데이 기사제공 신문 머니투데이 신문게재기사만 인쇄 스크랩 기능 버튼 영역 SNU 팩트체크 활성화 SNU 팩트체크 활성화 function doDisplay var element document.getElementById articleFactcheckInfo if element.classList.contains is hidden element.classList.remove is hidden else element.classList.add is hidden 신 관련기사 신 관련기사 스포츠 관련기사 스포츠 관련기사 본문 하단 광고 본문 하단 광고 try var isLogForComment false if jindo. Cookie .get NID SES null jindo. Cookie .get NID SES isLogForComment true var locationSearch location.search var commentOptions JSON.parse JSON.stringify sLanguage ko nPageSize 5 sSort new sTemplateId view economy aFormation count graph write notice list view sDomain hps ssl.pstatic.net static.cbox htErrorHandler 5010 댓글 답글은 60초 내에 한 개만 등록하실 수 있습니다. 5003 정상적으로 반영되지 않았습니다. 화면 새로고침 후 다시 시도해 주세요. 5026 공감 비공감은 최근 24시간내 50회까지 가능합니다. 5080 실명확인을 받지 않은 아이디는 가입 이후 7일이 지난 시점부터 댓글 활동이 가능합니다. 5091 본인 확인이 되지 않은 계정입니다. 본인 확인 후 다시 시도해주세요. 3006 고객님께서는 운영원칙에서 제한하고 있는 글을 작성하셨기 때문에 무기한 글쓰기를 포함한 일부 활동이 제한되었습니다. 3005 고객님의 IP는 운영원칙에서 제한하고 있는 글을 작성하셨기 때문에 글쓰기를 포함한 일부 활동이 제한되었습니다. 3004 고객님께서는 운영원칙에서 제한하고 있는 글을 다수 작성하셨기 때문에 글쓰기를 포함한 일부 활동이 일정 기간 제한되었습니다. 3003 고객님께서는 운영원칙에서 제한하고 있는 글을 작성하셨기 때문에 글쓰기를 포함한 일부 활동이 일정 기간 제한되었습니다. 동일 내용 댓글의 반복작성이 확인된 경우 제한기간은 1일이며 반복이 계속되면 기간이 연장될 수 있습니다. 4004 해당되는 댓글이 없습니다. 5027 공감 비공감은 10초 내에 한 번만 클릭하실 수 있습니다. 5006 자신의 글에 공감 할 수 없습니다. 5029 기사당 허용된 댓글 수 3개를 초과하였습니다. 기사에 작성한 댓글을 삭제 후 다시 작성하실 수 있습니다. 5008 자신의 글에 비공감 할 수 없습니다. sCountry KR nUserCommentPageSize 20 sDateFormat Y.m.d. H i sCommentNo bManager false sHelp down bSortCookie true sAuthType naver htMessage template duplicate caution link title 운영규정 자세히 알아보기 write long placeholder 저작권 등 다른 사람의 권리를 침해하거나 명예를 훼손하는 게시물은 이용약관 및 관련 법률에 의해 제재를 받을 수 있습니다. 건전한 토론문화와 양질의 댓글 문화를 위해 타인에게 불쾌감을 주는 욕설 또는 특정 계층 민족 종교 등을 비하하는 단어들은 표시가 제한됩니다. list empty 댓글이 없습니다. br 첫번째 댓글을 남겨주세요. view all 댓글 더보기 comment link 이 기사의 댓글 전체보기 sort favorite 순공감순 duplicate caution link address pc hps news.naver.com main principle.nhn reply close 답글 접기 help contents 작성자가 삭제한 댓글 작성자 삭제 운영자가 삭제한 댓글 규정 미준수 그리고 삭제되지 않은 현재 남은 댓글의 수와 이력을 투명하게 제공합니다. 순공감순은 공감수에서 비공감수를 뺀 수치가 많은 댓글입니다. 비정상적인 방법으로 공감수가 증가하는 경우 제외될 수 있습니다. br 정치기사의 댓글은 최신순만 제공됩니다. duplicate caution title 동일 내용 댓글의 반복 등록이 br 확인되었습니다. write placeholder 댓글을 입력해주세요 duplicate caution link address mobile hps m.news.naver.com ombudsman index.nhn mode rule open comment help titles 댓글이력공개안내 댓글노출정책 user profile help last help desc 최근 30일간 작성한 댓글의 정보를 요약해 보여줍니다. 작성대비 본인의 삭제비율 em 본인삭제율 em 과 작성글이 받은 피드백 중 공감비율 em 받은공감률 em 을 표기합니다. br 이때 받은공감률은 댓글 삭제로 변동된 정보를 반영하지 않습니다. title 뉴스 댓글모음 header help title 뉴스댓글 도움말 content 댓글목록을 공개한 사용자의 댓글모음이 제공됩니다. 나의 댓글 모음에서 다른 사람에게 공개 또는 비공개 설정을 할 수 있습니다. 제공되는 목록에 삭제댓글 답글은 포함하지 않습니다. duplicate caution cont 반복 등록이 계속될 경우 운영규정에 따라 br 서비스 이용이 정지될 수 있습니다. social login message 계정을 선택하시면 span class u cbox msg point 로그인 middot 계정인증 span 을 통해 br 댓글을 남기실 수 있습니다. br 뉴스서비스에서는 소셜 계정 사용이 불가하며 br 댓글모음만 확인하실 수 있습니다. alert min length 내용을 최소 0 자 이상 입력해주세요. login require 로그인을 하신 후 이용해 주시기 바랍니다. max length 0 자까지 입력할 수 있습니다. stats fold 접기 view 통계 user env title 어디에서 댓글을 썼을까요 title 누가 댓글을 썼을까요 sApiDomain hps apis.naver.com commentBox cbox5 bIncludeAllComments true sTicket news nUserCommentReplyPageSize 10 sCssId news w sPageType more sObjectId news008 0000640683 sCountType comment bShowReply bUseAgo false bMobile false nReplyPageSize 20 bByCountry false sLikeItId ne 008 0000640683 function key value if value typeof value string value.indexOf function 0 var jsFunc new Function return value return jsFunc return value var sNoticeMessage try var oNewsOptions JSON.parse JSON.stringify message default block 언론사가 정치섹션으로 분류한 기사의 댓글은 댓글 보기 페이지로 이동해 확인가능하며 언론사 홈페이지에 작성된 댓글은 언론사 댓글로 이동 을 클릭해 볼 수 있습니다. pc default block 언론사가 정치섹션으로 분류한 기사의 댓글은 댓글 보기 페이지로 이동해 확인가능하며 br 언론사 홈페이지에 작성된 댓글은 언론사 댓글로 이동 을 클릭해 볼 수 있습니다. custom block 머니투데이 댓글 정책에 따라 머니투데이에서 제공하는 경제섹션 기사의 br 본문 하단에는 댓글 서비스를 제공하지 않습니다. sort em %s em 댓글 정책에 따라 %s기사 본문 하단에서는 br %s을 먼저 보여주고 아래 정렬 옵션이 추가 제공됩니다. off em 머니투데이 em 의 댓글 정책에 따라 em 머니투데이 em 에서 제공하는 br 경제섹션 기사에는 댓글 서비스를 제공하지 않습니다. notice layerTitle 댓글 정책 언론사별 선택제 layerBody 섹션별로 기사의 댓글 제공여부와 정렬방식을 br 언론사가 직접 결정합니다. 기사 섹션 정보가 br 정치를 포함해 중복 분류된 경우 정치섹션 정책이 적용됩니다. 단 운영규정에 따른 br 삭제나 이용제한 조치는 네이버가 직접 br 수행합니다. title 이 기사의 댓글 정책은 em 머니투데이 em 가 결정합니다. custom block 머니투데이 댓글 정책에 따라 머니투데이에서 제공하는 경제섹션 기사의 본문 하단에는 댓글 서비스를 제공하지 않습니다. sort em %s em 댓글 정책에 따라 %s기사 본문 하단에서는 %s을 먼저 보여주고 아래 정렬 옵션이 추가 제공됩니다. off em 머니투데이 em 의 댓글 정책에 따라 em 머니투데이 em 에서 제공하는 경제섹션 기사에는 댓글 서비스를 제공하지 않습니다. notice layerTitle 댓글 정책 언론사별 선택제 layerBody 섹션별로 기사의 댓글 제공여부와 정렬방식을 br 언론사가 직접 결정합니다. 기사 섹션 정보가 br 정치를 포함해 중복 분류된 경우 정치섹션 정책이 적용됩니다. 단 운영규정에 따른 br 삭제나 이용제한 조치는 네이버가 직접 br 수행합니다. title 이 기사의 댓글 정책은 em 머니투데이 em 가 결정합니다.,https://news.naver.com/main/read.nhn?mode=LSD&mid=shm&sid1=260&oid=008&aid=0000640683,10
6611,2006.03.15. 오후 3:48,부동산,머니투데이,강남아파트 경매시장도 후끈,머니투데이 문성일 기자 강남아파트 값이 최근들어 급등세를 보이면서 경매 평균 경쟁률도 21개월만에 최고치인 9.1대 1을 넘어서는 등 강세를 나타내고 있다. 15일 경매정보업체 지지옥션 www.ggi.co.kr 이 이달 1일부터 14일까지 강남구 서초구 송파구 등 강남 3구 의 아파트 낙찰가와 응찰자를 분석한 결과 낙찰가율 감정가대비 낙찰가 이 85.1%를 기록 전달 72.9% 보다 12.2% 포인트 높아졌다. 평균 응찰자수도 같은 기간 5.2명에서 9.1명으로 크게 늘었다. 이는 지난 2003년 5월 12.57명을 기록한 이후 21개월만에 최고치다. 강남 뿐만 아니라 최근 아파트값 상승세를 타고 서울·수도권 아파트 경매가 달아오르고 있다. 서울지역의 경우 낙찰가율 86.6%로 79%대였던 올 1·2월보다 높다. 평균 응찰자수 역시 6.7명으로 지난해 2월 6.78명 이후 1년만에 가장 높은 수치를 기록하며 2005년 봄철 뜨거웠던 분위기가 다시 나타났다. 수도권도 낙찰가율 83% 평균 응찰자수 6.2명으로 전달 79.4% 5.8명보다 높아졌다. 지지옥션 강은 팀장은 최근 인기지역을 중심으로 서울 곳곳에 아파트값이 급등하고 있는데다 판교 지방선거 전세값 상승 등으로 부동산시장이 전반적으로 들썩이는 가운데 8.31대책 이후 숨죽이던 투자자들이 향후 추가 상승을 예상 경매로 싼 물건을 선점하려고 바삐 움직이는 것으로 보인다 고 말했다.,https://news.naver.com/main/read.nhn?mode=LSD&mid=shm&sid1=260&oid=008&aid=0000640668,10
6612,2006.03.15. 오후 3:26,부동산,이데일리,강남아파트 법원 입찰경쟁률 뜨겁다,이데일리 윤진섭기자 경매 시장에 강남 아파트의 평균 경쟁률이 21개월만에 최고치를 기록했다. 15일 경매정보업체 지지옥션 www.ggi.co.kr 에 따르면 이달 강남 아파트 경매의 평균 경쟁률이 9.1대 1를 기록 21개월만에 최고치를 나타냈다. 지지옥션에 따르면 강남구 서초구 송파구 강남 빅3지역의 3월 1일부터 3월 14일까지 아파트 낙찰가와 응찰자를 분석한 결과 전달대비 낙찰가율과 평균 응찰자수가 크게 상승했다. 낙찰가율 감정가대비 낙찰가 은 지난달 72.9%에서 85.1%으로 12.2% 높아졌고 평균 응찰자수도 5.2명에서 9.1명으로 치솟았다. 이 수치는 2003년 5월 12.57명을 기록한 이후 21개월만에 최고치를 기록한 것이다. 강남 뿐만 아니라 최근 아파트값 상승세를 타고 서울과 수도권의 아파트 경매가 달아오르고 있다. 서울지역의 경우 낙찰가율 86.6%로 1 2월에 79%대를 기록한 것과 큰 차이를 보이고 있으며 평균 응찰자수도 6.7명으로 2005년 2월 6.78명 이후 1년만에 최고치를 나타냈다. 수도권도 낙찰가율 83% 평균 응찰자수 6.2명으로 전달 79.4% 5.8명보다 높아졌다. 지지옥션 강은 팀장은 “판교 지방선거 전셋값 상승 등으로 부동산시장이 들썩이고 있는 가운데 투자자들이 향후 추가 상승을 예상하고 싼 물건을 선점할 수 있는 경매 시장으로 몰리고 있다 고 말했다.,https://news.naver.com/main/read.nhn?mode=LSD&mid=shm&sid1=260&oid=018&aid=0000364058,10
6613,2006.03.15. 오후 3:26,부동산,MBN,잠실5단지 개발권리 제한 소송,잠실 주공5단지 아파트 주민들이 재건축에 따른 과밀 개발을 막으려고 이 지역 개발계획을 변경한 서울시를 상대로 계획 변경을 취소하라는 소송을 냈습니다. 입주자들과 상가 소유자들은 서울행정법원에 낸 소장에서 서울시의 변경안은 주민의 재산인 토지 5천369평을 기부채납 형식으로 강제로 빼앗으려는 것이라며 이는 토지 등 소유자의 권리나 법률상 이익을 규제하는 결과를 가져오는 처분 이라고 주장했습니다. 서울시는 당초 재건축 추진이 가능하도록 정비계획 변경안을 확정했다가 주거용지 비율을 낮추는 방향으로 바꿨습니다.,https://news.naver.com/main/read.nhn?mode=LSD&mid=shm&sid1=260&oid=019&aid=0000133714,10
6614,2006.03.15. 오후 3:26,부동산,MBN,강남아파트 경매 경쟁률 21개월만에 최고,강남 아파트 경매의 평균 경쟁률이 9.1대1을 넘어 21개월만에 최고치를 기록했습니다. 경매정보업체 지지옥션에 따르면 강남과 서초 송파구 3개지역 경매를 조사한 결과 낙찰가율은 지난달 72.9%에서 85.1%으로 12.2% 높아졌고 평균 응찰자수도 5.2명에서 9.1명으로 늘어났습니다. 지지옥션은 8.31대책으로 숨죽이던 투자자들이 판교와 지방선거를 앞두고 추가상승을 예상해 경매에 참가하는 것으로 분석했습니다.,https://news.naver.com/main/read.nhn?mode=LSD&mid=shm&sid1=260&oid=019&aid=0000133713,10
