,date,cat,co,headline,text,url,week
118470,2009.01.08. 오후 5:22,부동산,한국경제TV,리포트 건설인 경제위기 극복 앞장,앵커 새해를 맞아 건설인들이 한 자리에 모였습니다. 경제 위기로 어느 때보다 뒤숭숭한 건설업계지만 도약하겠다는 의지만은 뜨거웠습니다. 건설업계 신년 인사회에 이지은 기자가 다녀왔습니다. 기자 손을 높이 들어 건배를 제의하는 건설인들의 얼굴에 새해를 맞는 설레임이 가득합니다. 어느 해보다도 어려운 한 해가 될 것 같지만 새 출발을 다짐하는 마음에는 희망만이 가득합니다. 건설인들은 경제 위기를 극복하는 데 앞장서자며 뜻을 모았습니다. 인터뷰 이종수 현대건설 사장 금년에도 정부에서 건설업 활성화를 위해 많은 대책을 낸다니 희망을 가지고 임하고 있다. 우리 건설업이 올해 희망을 갖고 임하면 위기를 기회로 잡을 수 있지 않나 하는 생각에 금년에도 열심히 하겠다. 인터뷰 류철호 한국도로공사 사장 오늘의 한국을 만든 것이 건설산업인들이고 건설산업의 불굴의 노력으로 오늘이 이뤄졌다. 우리는 잘 할거다. 희망이 있다고 본다. 건설인들은 정부의 선제적이고도 적극적인 지원을 요구했습니다. 무엇보다 하루 빨리 모든 규제들이 풀리길 기대했습니다. 인터뷰 권홍사 대한건설단체총연합회 회장 지금도 여야의 정치적 공방 탓에 규제 완화가 다소 늦어지는 감이 있다. 경제가 어려울 땐 좀 늦어지면 환자가 제때 약이 공급되지 않으면 죽는 것처럼 죽게 된다. 모든 규제를 빨리 풀어줬으면 한다. 이에 정부는 건설산업을 통해 경기 부양을 꾀하겠다며 지원을 아끼지 않겠다고 화답했습니다. 인터뷰 정종환 국토해양부 장관 올해는 녹색 뉴딜사업 등 좋은 건설 프로젝트를 통해 특히 4대강 살리기 사업으로 건설업계에 일감을 늘려 건설사가 힘도 나고 일자리가 많이 창출되게 할 것이다. 우리 건설산업이 1등으로 다시 태어날 수 있게 하겠다. 스탠딩 추운 날씨만큼이나 건설 경기도 그 어느때와 달리 꽁꽁 얼어붙어 있습니다. 하지만 건설인들의 밝은 표정에서 우리 건설업계의 미래를 엿볼 수 있습니다. WOW TV NEWS 이지은입니다.,https://news.naver.com/main/read.nhn?mode=LSD&mid=shm&sid1=260&oid=004&aid=0001965412,157
118471,2009.01.08. 오후 5:21,부동산,한국경제TV,리포트 속성경매 절반은 버블세븐,앵커 집을 내놔도 팔리지 않아 걱정인 분들 많으실텐데요. 버블세븐지역도 예외는 아닙니다. 민간경매회사에 접수된 물건 중 절반이 버블세븐지역 아파트라고 합니다. 최서우 기자의 보도입니다. 기자 부동산 민간경매를 진행하는 사무실입니다. 이 회사는 오는 15일 기존에 진행해왔던 민간 경매보다 신속한 매각이 이뤄지는 이른바 속성경매 를 실시합니다. 감정절차 자체를 생략하고 매도자가 직접 정한 최저가로 경매를 시작하는 방식입니다. 하루라도 빨리 아파트를 처분해 달라는 소유자가 늘고 있기 때문입니다. 녹취 강은 지지옥션팀장 71번 10초 19초 실제로 매물접수를 받아보니 부동산가격은 하락하고 대출이자는 버거워지면 속앓이를 하는 집주인들이 많았다는 걸 확인할 수 있었습니다. 이번 속성경매에 부쳐질 물건은 모두 10건. 이 가운데 절반은 소위 강남이나 서초 등 소위 버블세븐지역의 아파트들입니다. 나머지 아파트 역시 모두 수도권에 소재한 아파트들입니다. 이번 속성 경매물건으로 나온 아파트 대부분은 시세보다 훨씬 낮은 가격에 시작가가 매겨졌습니다. 양천구 신정동 현대아파트 114㎡의 최저가는 작년 12월말 국민은행 시세 하한가보다 8천만원 가량 낮습니다. 공인중개사가 집주인을 직접 설득해 집을 내놓은 경우도 있어 거래 시장 침체를 단적으로 드러내고 있습니다. 이번엥 진행될 민간경매는 속성경매 이외에도 한남 뉴타운내 다세대 주택 등 48건에 대한 경매도 함께 진행될 예정입니다. WOWTV NEWS 최서우입니다.,https://news.naver.com/main/read.nhn?mode=LSD&mid=shm&sid1=260&oid=004&aid=0001965411,157
118472,2009.01.08. 오후 5:21,부동산,한국경제TV,리포트 제2롯데월드 초고층기술 선뵌다,앵커 제2롯데월드는 우리나라 건설업계의 초고층건물 공사 기법과 소재 개발에도 적잖은 영향을 미칠 것으로 보입니다. 이미 롯데건설은 수년전부터 초고층 건설기법에 대한 체계적인 준비를 해 왔습니다. 박준식 기자의 보도입니다. 기자 8만7천여㎡ 부지에 112층. 높이만 555미터에 달하는 세계적인 마천루. 상하이 세계금융센터나 대만의 TFC 101 빌딩보다 50미터나 높습니다. 롯데가 구상하는 제2롯데월드 메인 타워 모습입니다. 이밖에 지상 3층에서 11층 규모의 9개 쇼핑몰에는 백화점 국내외 일류 패션관 스포츠·레저 전문관과 공연장 등이 들어섭니다. 롯데건설은 수년전부터 초고층건설연구소를 운영하며 관련 기술을 충분히 쌓았다고 설명했습니다. 인터뷰 박순전 롯데건설 기술연구원 수석부장 “잠실 프로젝트에 대비해 4 5년 전부터 초고층 건물에 대한 요소기술을 세분화해 하나하나 실험하고 준비를 해 왔다” 초고층 건축의 핵심은 첨단 소재. 막중한 하중에서도 안전을 유지하기 위해 다양한 연구 개발이 이뤄지고 있습니다. 롯데건설 기술연구소가 지난해부터 진행하고 있는 ‘초고강도 콘크리트의 내화성능 확보 방안과 시공기술 확립’등이 대표적인 연구 과제입니다. 인터뷰 박순전 롯데건설 기술연구원 수석부장 “건물의 막중한 중력을 버터야 하기 때문에 고강도 콘크리트 철근의 연구개발은 필요하다” 롯데건설은 황학동 롯데캐슬 시공현장에 이미 자체 개발한 초고강도 콘크리트를 적용하고 있습니다. 이밖에 초고층 진동제어 시스템 설계는 거주성능을 획기적으로 높이는 기술로 일본에 특허를 출원한 상태입니다. 초고층 건설 기법을 포함해 롯데건설의 R D 투자는 건설업계에서는 높은 수준으로 매년 매출액 대비 3% 안팎의 연구개발이 이뤄지고 있습니다. 한편 롯데건설은 제2롯데월드의 건설을 통해 첨단 초고층 건설기술을 축적할 수 있다는 것으로 기대하고 있습니다. 이를 통해 50조원 규모로 예상되는 세계 초고층 건설 시장에 본격적으로 참여하는 기반을 마련한다는 구상입니다. WOW TV NEWS 박준식입니다.,https://news.naver.com/main/read.nhn?mode=LSD&mid=shm&sid1=260&oid=004&aid=0001965410,157
118473,2009.01.08. 오후 5:21,부동산,한국경제TV,리포트 제2롯데월드 허용 잠실 집값 들썩,앵커 정부가 사실상 잠실 제2롯데월드 신축을 허용함에 따라 잠실일대 부동산 시장이 술렁이고 있습니다. 개발기대감으로 호가는 오르고 있지만 가격상승세는 제한적일 것이란 분석입니다. 박영우 기자가 현장 취재했습니다. 기자 정부가 롯데와 잠실지역 주민들의 숙원사업이었던 제2롯데월드 신축을 사실상 허용함에 따라 인근 지역 부동산 시장이 달아 오르고 있습니다. 아직 서울시의 건축허가가 남아있지만 무난하게 통과될 것으로 예상됩니다. 브릿지 박영우 기자 제 뒤로 보이는 곳이 제2롯데월드 신축공사 현장입니다. 제2롯데월드 신축에 따른 잠실지역 최대 수혜 단지는 잠실주공5단지가 될 것으로 보입니다. 현장 이펙트 전화소리 정부가 제2롯데월드 신축을 사실상 허용한 어제 이후 잠실주공5단지 인근 공인중개사무소에는 문의전화가 이어지고 있습니다. 지난 연말 정부가 재건축 규제 완화입장을 밝힌 뒤 호가가 오르고 있던 이 지역은 제2롯데월드 신축이라는 메가톤급 호재를 추가로 만났습니다. 잠실주공5단지 112㎡의 경우 지난해 12월 9억이었던 호가는 현재 11억까지 껑충 뛰어올랐습니다. 인터뷰 김찬경 잠실일번지공인중개사 “지난번 세계 경제 위기로 급매물이 쏟아질 때 7억원대 후반 매물도 있었습니다. 하지만 어제 정부가 제2롯데월드 신축 허가 계획을 발표하면서 9억 후반에서 10억 후반까지 호가가 나온 상태입니다.” 하지만 이 지역 부동산 가격이 완전히 바닥을 찍었나에 대해 아직 속단하기 이릅니다. 부동산 경기 침체가 지속되고 있는 상황이어서 호가만 존재할 뿐 실제 거래로 이어질지는 미지수입니다. 주택 전문가들 역시 정부의 제2롯데월드 허용 가닥이 집값에 크게 영향을 미치지 않을 것으로 보고 있습니다. 일대 부동산 시장에 큰 호재인 것은 맞지만 매수세가 사라진 상태에선 예전처럼 가격이 크게 오르는 현상은 되풀이 되지 않을 것이란 분석입니다. 게다가 제2롯데월드 완공 시 인근 지역의 교통난이 심화될 것이라는 우려도 집값 상승에 장애물로 작용할 것이라는 분석도 힘을 얻고 있습니다. WOWTV NEWS 박영우입니다.,https://news.naver.com/main/read.nhn?mode=LSD&mid=shm&sid1=260&oid=004&aid=0001965409,157
118474,2009.01.08. 오후 5:21,부동산,한국경제TV,한라건설 창립이래 첫 매출 1조 돌파,한라건설이 회사 설립 이후 처음으로 연 매출 1조원을 넘었습니다. 지난해 총 매출액은 1조3500억원으로 전년보다 38% 늘어난 규모입니다. 한라건설은 올해는 수주액 2조5100억원에 매출액 1조5700억원을 목표로 잡았습니다. 한편 김홍두 사장은 신년사를 통해 현재 힘들고 고통스럽더라도 미래를 위해 차근차근 에너지를 비축해야 한다 며 인재육성과 기술 개발로 성장 동력을 구축해야 한다 고 설명했습니다.,https://news.naver.com/main/read.nhn?mode=LSD&mid=shm&sid1=260&oid=004&aid=0001965408,157
118475,2009.01.08. 오후 4:54,부동산,파이낸셜뉴스,전문가 추천 미분양 아파트 미아뉴타운 송천센트레빌,서울 강북구 미아뉴타운에 위치한 동부건설의 ‘송천센트레빌’ 조감도 은 금융혜택은 물론 입지여건과 분양가격 발전잠재력 등의 3박자를 고루 갖춘 아파트로 손꼽힌다. 이 아파트는 강북구 미아뉴타운 10 1구역을 재개발한 단지다. 미아뉴타운 개발과 함께 오는 2013년 완공을 목표로 서울시가 추진 중인 드림랜드 공원과 인접해 후광효과가 기대된다. 송천센트레빌은 79∼143㎡ 376가구로 이뤄져 있다.지하 3층 지상 15층짜리 4개동이 들어선다. 단지 규모가 크지 않아 대단지의 이점을 누리지 못할 것으로 생각할 수도 있지만 이 아파트는 인근에 2006년 준공된 ‘미아센트레빌 1차 460가구 ’와 ‘길음 센트레빌 1677가구 ’과 연계돼 기반시설을 공유할 수 있다. 송천 센트레빌은 2010년 입주예정이다. 지하철 4호선 미아삼거리역이 걸어서 5분 거리에 있고 내부순환도로 길음 및 월곡IC를 이용하면 강남과 강동지역으로의 진출입이 편리하다. 화랑로와 동부간선도로를 이용해 상계동이나 의정부 방향으로 쉽게 오갈 수 있다. 더불어 상계동∼우이동∼삼양동∼신설동의 미아삼양선 13㎞ 과 상계동∼월계동∼청량리의 월계청량선 14㎞ 등 경전철 2개 노선이 2017년에 개통될 예정이어서 경전철 수혜를 누릴 수 있다. 강북권 명문사학으로 꼽히는 영훈초·중·고교가 단지 바로 앞에 있고 대일외고·서울과학고 등 우수 특목고도 가까이 있다. 미아삼거리역 주변으로 백화점·대형마트·영화관 등 생활편의시설도 풍부하다. 이 아파트는 지난해 10월에 일반에 분양됐다. 이 중 지금까지 90%의 계약률을 보이고 있다. 이미 소형은 계약완료 됐으며 143㎡만 일부 남아있다. 3.3㎡당 분양가는 1300만∼1500만원이다. 분양가는 주변시세와 비슷하거나 비교적 저렴하다. 계약 후 전매가 가능하다. 분양대금 납부조건은 계약금이 10%이며 4층 이하는 중도금 무이자 5층 이상은 이자후불제가 적용된다. 견본주택은 서울 용산구 동자동에 개관 중이다.,https://news.naver.com/main/read.nhn?mode=LSD&mid=shm&sid1=260&oid=014&aid=0002077484,157
118476,2009.01.08. 오후 4:49,부동산,아시아경제,통행료 할인차량도 하이패스 이용 쉬워진다,한국도로공사는 오는 15일부터 통행료 할인대상 차량이 하이패스 단말기를 부착한 경우 별도의 과정없이 통행료를 할인 받을 수 있다고 8일 밝혔다. 현재는 하이패스 차로를 이용해 할인을 받으려면 새로운 하이패스 할인 우대카드를 발급 받거나 기존 카드의 정보를 변경해야 한다. 통행료 할인대상 차량은 출퇴근 통행료 50% 할인받는 차량과 화물차 심야할인 20 100% 차량으로 약 20만대에 이른다. 이 차량들은 그동안 하이패스 단말기를 부착하고도 할인을 받기 위해 일반차로를 이용해야만 했다. 그러나 3인 이상 탑승 승용차는 탑승여부 확인을 위해 현행처럼 출퇴근 50% 할인시간대 출근 오전 5시 7시 퇴근 오후 8시 10시 에 일반차로를 이용해야 할인을 받을 수 있다.,https://news.naver.com/main/read.nhn?mode=LSD&mid=shm&sid1=260&oid=277&aid=0002082952,157
118477,2009.01.08. 오후 4:47,부동산,파이낸셜뉴스,fn매물장터 평촌 e편한세상 2차 등,이번 주에는 주변 시세보다 20% 정도 저렴하게 나온 초급매물 위주로 추천됐다. 경기 안양 평촌동 대림e 편한세상 2차 79㎡는 시세보다 5000만원 정도 싼값에 급매물로 나왔고 경기 용인시 죽전동 건영캐스빌은 시세보다 최대 2억원이나 싸다. 서울 서초동 무지개아파트도 시세보다 5000만원 정도 낮은 가격에 매물로 나왔다. 닥터아파트 측은 “이번 주에 추천된 유망 매물은 대단지거나 교통 및 학군이 양호한 랜드마크급 아파트여서 실수요자들이 관심을 가질 만하다”고 설명했다. 경기 안양 평촌신도시 대림e편한세상 2차 79㎡ 경기 안양시 평촌동의 랜드마크 단지인 대림e편한세상 79㎡가 2억6500만원에 매물로 나왔다. 주변 시세보다 5000만원 안팎이나 저렴한 데다 수요가 많은 지역이어서 환금성이 양호하다. 현재 시세는 2억9000만∼3억2000만원이며 전세시세는 1억3000만∼1억4500만원이다. 총 862가구로 2004년 11월 준공됐다. 해당 물건은 18층 중 4층에 위치해 있다. 방 3개 욕실 2개로 구성됐다. 지하철 1호선과 4호선을 통해 서울과 인근 도시로 출퇴근이 수월하다. 주변에 민백초 벌말초 백운중 백영고 등 교육시설과 롯데마트 이마트 농수산물시장 등 각종 편의시설이 잘 갖춰져 있다. 지하철4호선 인덕원역이 걸어서 10여분 정도 걸린다. 031 425 4800 서울 서초구 서초동 무지개 82㎡ 서울 서초동 무지개 아파트 82㎡가 시세보다 2000만∼9000만원 낮은 5억4000만원에 급매물로 나왔다. 현재 매매가는 5억6000만∼6억1000만원이며 전세가격은 1억5000만∼1억8000만원이다. 방 3개와 욕실 1개로 구성됐으며 해당 물건은 12층 중 9층에 있다. 이 아파트단지는 82∼148㎡ 1074가구의 대단지로 이뤄졌으며 1978년 10월 준공됐다. 서이초 우면초 서운중 영동중 서초고 서울고 등이 인근에 위치해 교육환경이 양호하다. 남부터미널과 전자쇼핑센터 등 각종 편의시설이 있다. 지하철 3호선 양재역이 걸어서 7분 정도 거리에 있다. 02 3474 8989 서울 노원구 중계동 한화꿈에그린 105㎡ 서울 노원구 중계동 한화꿈에그린 105㎡가 4억3000만원에 나왔다. 현재 매매가는 4억5000만∼5억8000만원으로 시세보다 최고 5000만원 저렴하다. 전세시세는 2억∼2억6000만원이다. 2005년 3월 준공됐으며 76∼161㎡ 448가구로 구성됐다. 해당 물건은 15층 중 5층에 위치하며 방 3개와 욕실 2개로 구성됐다. 불암초 을지초 을지중 불암중 상명여중 대진고 대진여고 서라벌고 등 교육시설과 롯데마트 상계백병원 을지병원 등 편의시설이 풍부하다. 지하철 4호선 상계역과 7호선 중계·하계역이 가까이 있다. 02 932 0079 경기 용인시 죽전동 건영캐스빌 195㎡ 경기 용인시 죽전동의 건영캐스빌 195㎡가 6억8000만원에 나왔다. 현재 시세는 7억8000만∼8억8000만원으로 1억원 이상 싸다. 전세시세는 2억4000만∼2억6000만원이다. 1254가구의 대단지로 2004년 준공됐다. 해당 물건은 21층 중 7층에 있다. 방 4개와 욕실 3개로 구성됐다. 대청초 대덕중 죽전고 등 교육시설과 신세계백화점 이마트 홈플러스 등 편의시설이 풍부하다.,https://news.naver.com/main/read.nhn?mode=LSD&mid=shm&sid1=260&oid=014&aid=0002077477,157
118478,2009.01.08. 오후 4:46,부동산,아시아경제,주택보증 9일 아파트·상가 공매,대한주택보증은 분양보증을 이행하는 과정에서 취득한 미분양아파트와 상가 토지 등을 오는 9일부터 전자입찰 시스템 ‘온비드 www.onbid.co.kr ’를 통해 매각한다고 8일 밝혔다. 매각대상 물건은 아파트로 △강화군 강화읍 갑곳리 1100 강화베이힐아파트 4가구 △서울 성북구 정릉2동 산87 27 정릉2차대주피오레 6가구 △강원도 속초시 금호동 629 보람레이크 더하임아파트 89가구 △인천 서구 왕길동 295 1 유승아파트 3가구 △강원도 횡성군 횡성읍 교항리 109 횡성보람더하임아파트 92가구 △수원 권선구 고색동 306 1 수원거산아파트 2가구 △경남 김해시 외동 518 1 김해한솔빌리지 6가구 등이다. 상가와 토지는 △강원도 횡성군 횡성읍 교항리 109 보람더하임아파트 상가동 3실 △대구 북구 칠성동2가 370 2번지 토지 및 지상건축물이다. 자세한 내용은 한국자산관리공사의 온비드 www.onbid.co.kr 와 대한주택보증 홈페이지 www.khgc.co.kr 에서 확인할 수 있다.,https://news.naver.com/main/read.nhn?mode=LSD&mid=shm&sid1=260&oid=277&aid=0002082951,157
118479,2009.01.08. 오후 4:39,부동산,아시아경제,월드메르디앙중견기업 브랜드 선호도 1위,월드건설은 부동산정보업체 스피드뱅크가 진행한 2008년 아파트브랜드평가조사 중견기업 부문에서 1위를 차지했다고 8일 밝혔다. 월드건설의 월드메르디앙아파트는 인지도 선호도 향후 인지도 상승 등 5개 항목으로 구성된 항목에서 고르게 점수를 받아 2년 연속 선호도 1위를 차지했다. 대형기업 부문에서는 대우푸르지오가 2년 연속 1위를 차지했고 선호도 부문에서는 삼성래미안이 1위를 기록했다. 이 조사는 스피드뱅크 회원 및 홈페이지 방문자 중 1876명을 대상으로 2008년 12월11일 12월18일까지 실시했다. 신뢰수준은 95%이며 표본오차는 ±2.3%이다.,https://news.naver.com/main/read.nhn?mode=LSD&mid=shm&sid1=260&oid=277&aid=0002082944,157
118480,2009.01.08. 오후 4:35,부동산,아시아경제,GS건설 올해 분양물량 5440가구..전년 대비 50%↓,GS건설이 올해 분양 목표를 전년 대비 절반 가까이 줄인 5440여가구로 대폭 낮춰 잡았다. 특히 이들 분양예정 물량은 모두 재개발·재건축 수주사업으로 외주사업이나 자체개발사업은 전무하다. 이 중에서도 일반분양물량은 전체의 10% 수준인 560가구에 그치고 있다. 나머지 4880가구는 모두 조합원 분양물량이다. GS건설의 이 같은 2009년도 분양목표는 2008년도 분양목표 1만1548가구의 절반에도 못미치는 규모다. 이 회사는 지난 연말까지 목표 대비 약 80% 이상인 9532가구 분양을 완료했다. 그러나 올해는 시장상황이 불투명한데다 지난해 미분양 증가로 혹독한 아픔을 겪었던 GS건설은 올해 분양계획을 최대한 보수적으로 잡았다. 구체적으로 2월에는 △금호 17구역에서 497가구 재개발·일반분양 30가구 △금호 18구역 403가구 재개발·29가구 를 분양한다. 이어 3월에는 △아현4구역 뉴타운 1150가구 재개발·일반분양 120가구 가 전부다. 또 6월에는 △왕십리 1구역 510가구 재개발·167가구 △왕십리2구역 340가구 재개발·139가구 △포일주공아파트 재건축후분양·75가구 에 그치고 있다. 이마저도 모두 상반기 예정된 물량으로 하반기 계획은 전혀 잡지 못했다. GS건설 관계자는 시행사들이 분양가상한제 시행여부가 불투명하자 올해 분양계획 자체를 잡지 못하고 있다 며 시공사인 우리로서도 최대한 안정적인 주택사업만 하자는 게 올해 방침 이라고 설명했다. GS건설은 실제로 지난 연말 주택사업을 축소하고 공공수주사업을 확대하는 방향으로 조직개편을 단행했다. 허명수 GS건설 신임 사장도 연초 신년사에서 지난해 주택 미분양 및 PF 프로젝트 파이낸싱 리스크 증가로 재무 안정성 관리의 중요성이 새롭게 인식되는 해였다 며 올해는 수익성 제고 등에 내실을 기하겠다 고 밝혔다.,https://news.naver.com/main/read.nhn?mode=LSD&mid=shm&sid1=260&oid=277&aid=0002082941,157
118481,2009.01.08. 오후 4:31,부동산,매일경제,월드메르디앙 브랜드 선호도 중견기업 2년연속 1위,월드건설 대표 조대호 은 부동산정보업체 스피드뱅크가 진행한 2008년 아파트브랜드평가조사 중견기업 부문에서 1위를 차지했다고 밝혔다. 월드건설의 월드메르디앙아파트는 인지도 선호도 향후 인지도 상승 등 5개 항목으로 구성된 항목에서 고르게 점수를 받아 2년 연속 선호도 1위를 유지했다. 대형기업 부문에서는 대우푸르지오가 2007년에 이어 연속 1위를 차지했고 선호도 부문에서는 삼성래미안이 앞섰다. 이 조사는 스피드뱅크 회원 및 홈페이지 방문자 중 1876명을 대상으로 2008년 12월11일 12월18일까지 실시했다. 신뢰수준은 95%이며 표본오차는 ±2.3%이다.,https://news.naver.com/main/read.nhn?mode=LSD&mid=shm&sid1=260&oid=009&aid=0002054485,157
118482,2009.01.08. 오후 4:25,부동산,노컷뉴스,하이패스 이용자 할인 받기 쉬워진다,CBS경제부 정영철 기자 한국도로공사는 오는 15일부터 출퇴근 통행료 50% 할인받는 차량과 화물차 심야할인 20 100% 대상차량 중 하이패스 단말기를 부착한 차량이 하이패스 차로를 이용할때 별도의 과정없이 통행료를 할인 받을 수 있다고 밝혔다. 지금은 하이패스 차로를 이용해 할인을 받으려면 새로운 하이패스 할인 우대카드를 발급 받거나 기존 카드의 정보를 변경해야 한다. 공사 관계자는 “그동안 하이패스 단말기를 부착하고도 할인을 받기 위해 일반차로를 이용해야만 했던 20만대의 차량이 하이패스차로 다닐때도 같은 혜택을 받게 됐다”고 말했다. 하지만 3인 이상 탑승 승용차는 탑승여부 확인을 위해 현행처럼 출퇴근 50% 할인시간대 출근 05～07시 퇴근 20～22시 에 일반차로를 이용해야 할인을 받을 수 있다.,https://news.naver.com/main/read.nhn?mode=LSD&mid=shm&sid1=260&oid=079&aid=0002022428,157
118483,2009.01.08. 오후 4:25,부동산,노컷뉴스,싱가포르항공 집에서 체크인하세요,CBS경제부 정영철 기자 싱가포르항공은 올해부터 온라인 체크인을 완료한 후 탑승권을 프린트해 이용할 수 있는 ‘2D 바코드 셀프프린트 탑승권’ 서비스를 실시한다고 밝혔다. 이를 통해 집이나 사무실에서 편리하게 모든 체크인 절차를 마칠 수 있다는게 회사측의 설명이다. 싱가포르항공 홈페이지 singaporeair.com kr 에서 원하는 좌석을 선택해 체크인을 마친 후 탑승권을 미리 출력하면 된다. 서비스는 출발 48시간 전부터 2시간 전까지 이용 가능하며 미국 노선은 제외된다. 출발 당일2D 바코드 셀프프린트 탑승권을 소지한 고객은 인천공항의 싱가포르항공 인터넷 체크인 전용 카운터에서 여권 비자 신용카드의 확인 절차를 받고 수하물 수속을 마치면 된다.,https://news.naver.com/main/read.nhn?mode=LSD&mid=shm&sid1=260&oid=079&aid=0002022427,157
