,date,cat,co,headline,text,url,week
66002,2007.10.11. 오전 10:18,부동산,아시아경제,9호선 주변 분양물량을 잡아라,지하철 9호선 1단계 사업이 오는 2009년 개통될 예정인 가운데 2단계 사업에 대한 기본계획이 발표되면서 인근 분양단지에 관심이 쏠리고 있다. 한강 이남 지역을 동서로 가로지르는 지하철 9호선 김포공항 방이동 2단계 사업이 주변지역 분양시장의 수혜로 작용할 것이기 때문이다. 11일 부동산정보업체 스피드뱅크에 따르면 9호선 수혜가 예상되는 분양예정 아파트를 조사한 결과 내년까지 5곳에서 2138가구가 공급되고 그 중 634가구가 일반분양되는 것으로 나타났다. 특히 서초 방배동 동작 흑석동 강서구 염창동 등의 9호선이 지나는 이들 지역은 역세권 개발 호재로 벌써부터 수요자들의 관심이 집중되고 있다. 서초구 방배동에서는 금호건설이 주상복합아파트를 공급면적 186 369㎡ 중대형위주로 10월쯤 79가구를 공급한다. 개통예정인 반포역이 도보 7 8분 거리다. 월드건설은 강서구 염창동에 공급면적 113 162㎡ 164가구가 같은 시기 분양에 나선다. 9호선 증산역이 도보 5분 거리다. 노량진뉴타운에서는 쌍용건설이 12월에 45가구를 일반 분양하며 9호선 노량진역이 도보 5분 거리에 위치 한다. 내년에도 9호선 인근지역 2곳에서 분양이 준비 중이다. 흑석뉴타운에서 동부건설이 5구역과 6구역에 분양을 앞두고 있다. 169가구와 177가구가 각각 분양되며 흑석역이 도보 3 5분 거리에 들어선다. 김은경 스피드뱅크 팀장은 이미 기본계획이 확정돼 2009년 개통을 앞두고 있는 1단계 김포공항 논현동 구간을 포함한 9호선 전구간에 대한 윤곽이 드러남에 따라 주변 분양시장에도 큰 영향을 미칠 것으로 보인다 고 말했다. 한편 1단계 사업에 이어 2단계 사업인 논현동 종합운동장 방이동을 연결하는 구간은 정거장 12개 12.5km구간으로 사업비 1조3502억원이 투입되며 오는 2014년 개통될 전망이다. 또 1단계 사업은 김포공항 논현동 25.5km 정거장 25개 을 연결하는 사업으로 3조2545억원을 투입해 2008년 완공 2009년 상반기 개통할 계획이다.,https://news.naver.com/main/read.nhn?mode=LSD&mid=shm&sid1=260&oid=277&aid=0000007075,92
66003,2007.10.11. 오전 10:18,부동산,이데일리,GS건설 경영실적..LG그룹에 물어봐,범 LG그룹 투자지연에 GS건설 3분기 실적 악화 LPL 2조5천억원 투자 확정..GS건설 관계사 리스크 복병 이데일리 윤진섭기자 GS건설 006360 이 그룹 관계사 리스크 라는 복병을 만났다. LG필립스LCD LG전자 등 관계사 공사 물량에 따라 GS건설의 실적이 좌우된다는 설명이다. GS건설의 올 3분기 실적은 이 같은 분석을 고스란히 담고 있다. GS건설은 지난 3분기에 전년 같은 기간보다 41%나 줄어든 830억600만원의 영업이익을 거뒀다. 순이익도 전년보다 29%나 감소한 1286억8800만원을 올리는 데 그쳤다. 매출 감소도 두드러졌다. GS건설의 3분기 매출은 1조2598억600만원으로 작년 같은 기간보다 12%나 줄었다. 그나마 누적 신규 수주가 총 7조6756억원으로 지난해보다 13%가 늘었다는 게 위안거리다. ◇LPL 등 LG그룹 투자지연에 GS건설 3분기 실적 악화 GS건설의 3분기 실적이 부진한 것에 대해 업계는 관계사 물량이 크게 줄었다는 점을 꼽고 있다. 실제 GS건설의 경우 LG필립스LCD로부터 큰 비중의 그룹사 물량을 수주해왔고 지난 2004년 약 1조3000억원의 LG필립스LCD 물량을 수주하면서 본격적으로 외형이 성장했다. 그러나 작년 LG필립스LCD가 작년 상반기 공급과잉을 이유로 설비투자 계획을 4조2000억원에서 3조원으로 조정함과 동시에 8G 투자를 지연 결정했다. 결국 그룹사 설비투자 계획이 지연되면서 GS건설의 실적도 곤두박질 쳤다는 게 업계의 설명이다. 이선일 대우증권 애널리스트는 “LG필립스LCD LG전자 등 관계사의 투자지연으로 추가 수주가 부진한 건축부문의 매출액이 58.2%나 줄어든 것이 GS건설 3분기 실적 부진의 결정적 요인 이라고 밝혔다. 역시 관계사 GS칼텍스 LG석유화학 등 의존도가 높은 국내 플랜트 부문도 신규수주 지연으로 상반기의 급증세를 이어가지 못했다고 대우증권은 분석했다. ◇LIG건영 서브원 등 또 다른 그룹사 리스크도 눈길 GS건설의 또 다른 그룹사 리스크로는 LG그룹 공사의 의존도에 따라 LG그룹 내에서 건설사를 인수 혹은 신설할 때에 발생할 수 있는 수주 감소가 꼽힌다. 실제로 LIG손해보험은 건설업체인 건영을 인수 LIG건영을 출범시켜 범 LG가 물량 수주 가능성이 높아지고 있다. 또 LG그룹도 주 LG 자회사인 서브원을 통해 건설사업과 리모델링을 중심으로 한 종합건설사업 강화 움직임을 보이고 있다. 물론 이 같은 또 다른 그룹사 리스크에 대해 반론도 만만치 않다. 업계 관계자는 GS건설이 현재 가져오는 그룹사 물량은 LG필립스LCD의 클린룸 Clean room 을 비롯 LG텔레콤 LG전자 공사 모두 경험이 필요한 대규모 공사가 대부분 이라며 LG그룹내 건설사를 육성한다 할지라도 대형공사 위주의 계열사 물량을 소화하기는 불가능하다 고 말했다. 이런 상황에서 지난 9일 LPL의 파주 P8 공장에 2조5350억원의 투자를 승인했다는 점은 GS건설 입장에선 그룹 발 호재로 받아들이고 있다. GS건설은 LPL이 투자를 결정함에 따라 관련 사업 수주 물량을 점검하고 있다”며 LPL투자가 본격화됨에 따라 내년 상반기 실적도 크게 개선될 것 이라고 밝혔다. 증권업계 관계자는 관계사 물량의 투자 확정이나 지연이 GS건설의 실적에 막대한 영향을 미치는 상황 이라며 관계사 물량 소진에 따른 매출 공백을 메워줄 것으로 예상되는 해외부문 사업이 본 궤도에 올라야 이 같은 그룹사 리스크를 줄일 수 있을 것 이라고 예상했다. 관련기사 ☞ 특징주 GS건설 하락.. 3분기 실적부진 ☞GS건설 매력 낮아졌다.,https://news.naver.com/main/read.nhn?mode=LSD&mid=shm&sid1=260&oid=018&aid=0000526273,92
66004,2007.10.11. 오전 10:17,부동산,헤럴드POP,브랜드ㆍ입지ㆍ상품성… 중견건설사 죽을맛,아파트 분양시장이 급랭하면서 중견업체 브랜드가 된서리를 맞고 있다. 분양 시장이 철저하게 양극화되면서 수요자들의 관심이 대형업체 브랜드 단지로 몰리고 있기 때문이다. 설상가상으로 전국 모든 분양 단지의 청약경쟁률이 인터넷에 완전 공개되고 부도 와 가점제 등의 영향까지 겹치면서 브랜드 파워가 약한 수도권 및 지방 중견건설사 아파트 분양이 바닥청약신세를 면치 못하고 있다. 따라서 비교적 수요가 탄탄한 것으로 인식되는 남양주 진접 양주 고읍 등에서 중견업체들이 잇따라 고전을 면치 못하고 있는 반면 삼성 현대 등 대형업체들 사업지는 과열양상이 빚어지는 대조적 상황이 연출되고 있다. 10일 1순위 청약을 받은 양주 고읍의 우미와 우남 한양 등 3개 업체 총 1921가구의 동시분양 아파트는 134가구만이 청약 6.97%의 부진한 청약률을 보였다.. 반면 같은날 1순위 청약을 받은 삼성 용두 래미안은 최고 97대1의 경쟁률 속에 전평형 1순위에서 마감됐다. 고읍지구에선 건설업체들이 대규모 미달 사태를 막기 위해 분양가 인하와 무이자 융자 신 평면 개발 등 각종 혜택을 제공했는데도 전혀 효과를 보지 못했다. 우미 린은 110 113㎡ 513가구 중 491가구가 무더기로 미달됐다. 우남 퍼스트빌도 111 113㎡ 376가구 가운데 351가구가 대거 미달됐으며 한양 1블록의 109 149㎡ 598가구도 545가구나 주인을 찾지 못했다. 더구나 중소형과 달리 등기 후 바로 팔 수 있는 중대형 역시 한양의 6 3블록 125 185㎡ 434가구 가운데 400가구가 미달되는 바닥청약상황을 보였다. 지방권은 더욱 심각하다. 청약가점제 시행 이후 전국의 모든 민간 아파트들의 청약 경쟁률이 금융결제원 홈페이지를 통해 낱낱이 공개되면서 그러잖아도 부진하던 중견 건설업체의 분양 시장이 된서리를 맞고 있다. 가점제 시행과 함께 인터넷 청약이 의무화되면서 차마 낯을 내밀기에도 부끄러울 정도의 저조한 청약률이 잇따라 공개되고 있다. 생소한 브랜드 저조한 청약률 미약한 대기수요 탓이다. 춘천에서 분양된 만천리 KCC 아파트의 경우 3순위까지 청약자가 한 명도 없는 사실이 금융결제원 홈페이지를 통해 공개되면서 시장에 충격을 안겨준 데 이어 거제시 장승포동에서 분양한 거제오션타워 역시 26가구 전량이 미달됐으며 광주광역시 양산동에서 공급된 송지트리뷰 역시 159가구 전량에 청약자가 한 명도 접수되지 않았다. 미군기지 이전과 평화도시 조성 등으로 주목을 받아온 평택시 팽성읍에서 분양 중인 늘푸른오스카빌 아파트 역시 174가구 모집에 불과 1명이 청약했다. 수요자들의 구매 심리가 최악인 상황에서 엉망인 청약률마저 공개되는 상황에 이르자 중견업체들은 순위 내 마감은 아예 포기하는 분위기다. 중견건설업체의 한 관계자는 “청약률을 보면 대체적인 계약률이 예상되는데 저조한 청약률이 공개되면서 건설사로선 미분양 물량의 해소에 애로점이 크다”며“결국 건설사로선 미리 계약자를 선별하는 깜깜이 분양 밖에 방법이 없을 것”이라고 토로했다.,https://news.naver.com/main/read.nhn?mode=LSD&mid=shm&sid1=260&oid=112&aid=0000077392,92
66005,2007.10.11. 오전 10:15,부동산,이데일리,프라임그룹 동아건설 인수대금 입금완료,이데일리 윤진섭기자 프라임그룹은 11일 동아건설 인수를 위한 인수대금 6780원을 완납했다고 밝혔다. 프라임그룹은 16일로 예정된 수정회생계획안 인가를 위한 관계인집회를 앞두고 인수대금 전액을 10일 입금완료했다”고 밝혔다. 프라임그룹은 법원이 회생계획안을 인가하는대로 인수단을 파견 경영권 인수를 위한 절차를 진행할 예정이다. 프라임 트라이덴트 컨소시엄은 지난해 9월 동아건설 인수 우선협상대상자로 선정됐고 올해 1월 법원에 의해 회생절차 개시결정이 내려졌다.,https://news.naver.com/main/read.nhn?mode=LSD&mid=shm&sid1=260&oid=018&aid=0000526270,92
66006,2007.10.11. 오전 10:15,부동산,이데일리,혁신도시 토지보상 지연에도 착공 강행,이데일리 남창균기자 정부가 혁신도시 착공을 강행하고 있다. 토지보상률이 한자릿수에 불과한 지역도 착공식 일정을 잡는 등 무리수를 두고 있는 것이다. 이는 참여정부 3대 균형발전정책 중의 하나인 혁신도시에서 가시적인 성과를 내야한다는 조급증 때문으로 풀이된다. 건설교통부는 11일 경남과 광주·전남 혁신도시 기공식을 각각 10월26일 11월8일 갖기로 잠정 결정했다. 광주·전남 혁신도시의 경우 주민과의 갈등 때문에 지난 8일에야 토지보상에 들어간 상황이며 경남도 토지보상협의율이 14.4%에 머물고 있다. 건교부 관계자는 토지보상에만 들어가면 착공을 할 수 있는 것 아니냐 며 혁신도시 9곳 모두 연내 착공을 목표로 사업을 추진하고 있다 고 말했다. 혁신도시 가운데 토지보상에 들어간 곳은 강원 전북 충북을 제외한 6곳으로 경북과 제주를 제외하고는 토지보상협의율이 한 자릿수를 보이고 있다. 이는 원주민들이 사업시행자 토공 주공 가 제시한 토지보상가격에 불만을 갖고 있기 때문이다. 10월8일 기준으로 보상협의율이 가장 높은 곳은 지난 8월20일부터 보상에 들어간 경북으로 59% 소유자수 이며 지난 7월6일 보상을 시작한 제주는 56.4%이다. 이밖에 울산 14% 경남 14.4% 대구 19.1% 등이다. 광주·전남은 지난 8일 보상에 착수했으며 충북은 오는 15일부터 보상에 들어갈 예정이다. 하지만 강원과 전북은 아직까지 보상일정을 잡지 못하고 있다.,https://news.naver.com/main/read.nhn?mode=LSD&mid=shm&sid1=260&oid=018&aid=0000526269,92
66007,2007.10.11. 오전 10:08,부동산,이데일리,양주 고읍 동시분양 1순위서 대거 미달,이데일리 윤도진기자 3개 건설업체가 동시분양에 나선 경기도 양주 고읍지구 아파트가 1순위에서 대거 미달됐다. 청약률은 0.1대 1에도 못 미쳤다. 11일 금융결제원에 따르면 지난 10일 한양 우남건설 우미건설 등 3개 업체가 진행한 양주 고읍지구 아파트 1순위 청약 결과 총 1912가구 모집에 청약자는 138명만이 참여했다. 청약률은 0.07대 1이다. 전체 20개의 주택형 중 유일하게 한양의 6 3블록 185㎡형 4가구 만 모집가구수를 채웠고 나머지는 모두 미달됐다. 청약자가 전혀 없는 주택형도 3개가 있었다. 업체별로 가장 많은 가구수를 내놓은 한양이 1블록 595가구 모집에 48명 6 3블록 432가구 모집에 43명이 신청해 평균 0.09대 1의 청약률을 나타냈다. 이밖에 우미건설이 분양한 513가구에는 22명 우남건설 372가구에는 25명만이 청약을 신청해 각각 0.04대 1 0.07대 1의 청약률을 나타냈다. 이번 동시분양에 참여한 한 분양업체 관계자는 청약가점제 시행에 따라 비교적 가점이 높은 1순위 통장 가입자들이 통장 사용을 보류하고 있는 듯 하다 며 2 3순위에는 가점이 적은 이들이 많기 때문에 청약가구수를 상당수 채울 수 있을 것 이라고 내다봤다.,https://news.naver.com/main/read.nhn?mode=LSD&mid=shm&sid1=260&oid=018&aid=0000526265,92
66008,2007.10.11. 오전 10:00,부동산,아시아경제,미리가본 모델하우스길음뉴타운 두산위브,길음뉴타운 마지막 물량이자 등기후 전매가 가능해 청약예정자들의 관심이 몰리고 있는 길음뉴타운 두산위브 모델하우스를 개관 하루 전인 10일 방문했다. 강남 역삼동 두산건설 주택문화관 3층에 마련된 길음뉴타운 모델하우스에서는 막바지 공사가 한창이었다. 조성태 두산건설 분양소장은 건설업계에서는 이례적으로 일반고객 300여명을 대상으로 사전 품평회를 한 결과 예상외로 반응이 좋았다 며 최근 인기를 끌고 있는 타워형 주택과 기존의 판상형 사각 주택의 비율을 비슷하게 유지해 다양한 고객의 니즈를 반영했다 고 설명했다. 모델하우스에는 84㎡ 112㎡ 145㎡ 등 3개 평면의 유니트가 마련돼있다. 계약기간내 계약을 하는 고객에게는 발코니 확장 공사를 무료 제공하며 안방과 거실에 천청 에어컨도 기본으로 장착된다. 선택옵션인 침실 붙박이 장 가격은 315만 328만원으로 다소 비싸게 책정됐다. 84㎡ 구 25평 은 방을 무리하게 3개로 만들어 전체적으로 공간활용이 애매하다는 느낌이다. 안방옆에 위치한 작은 방은 베란다 확장공간에서도 제외돼 일반적인 방의 기능보다는 드레스룸으로 활용하는 것이 적당해 보인다. 112㎡ 구 33평 은 최근 인기를 끌고 있다는 3.5타워형 구조로 설계됐다. 그러나 기본 평형대에서의 타워형 구조는 현관 입구에서 정면으로 보이는 거실과 양옆으로 이어지는 복도가 좁고 넓게 퍼져 집이 좁아보이는 단점이 엿보였다. 조성태 분양소장은 112㎡이지만 144㎡평형대 거실처럼 넓게 쓸수 있도록 설계했다 며 품평회 때도 거실이 넓어 보인다는 반응이 많았다 고 설명했다. 145㎡ 구 44평 은 전체적으로 화이트 클래식한 분위기로 고급스런 느낌이다. 주방과 거실을 일자형으로 배치해 채광과 통풍이 잘되는 것이 장점이다. 특히 어두워 보인다는 고객 품평회 의견을 반영 거실장 상판을 기존의 브라운 대리석에서 화이트 나무재질로 바꾸기로 결정했다고. 끊임없이 고객의 니즈를 파악하는 노력이 엿보였다. 안방에서 부부욕실로 이어지는 공간에 위치한 드레스룸은 발코니를 확장해 기존드레스룸보다 넓은 것이 특징이다. 각 방이 정사작 유닛트로 설계돼 공간활용이 용이하게 설계됐다.,https://news.naver.com/main/read.nhn?mode=LSD&mid=shm&sid1=260&oid=277&aid=0000007055,92
66009,2007.10.11. 오전 10:00,부동산,아시아경제,경남기업 스웨덴 지멘스와 해외 에너지시설공사 공동 협력키로,경남기업 사장 강창모 은 11일 오전 르네상스 호텔에서 경남기업이 시공하는 국내 최대 구역형 집단에너지시설의 주기기 공급업체로 스웨덴 지멘스사를 최종 선정하고 협약식 및 해외공사 협력에 대한 MOU조인식을 가졌다. 이날 조인식에는 강창모 경남기업 사장과 잔 올프 그릭 스웨덴 지멘스 부사장 라르스 바리외 스웨덴 대사 등이 참석했다. 이번 계약으로 경남기업은 스웨덴 지멘스사로부터 총 설비용량 107MW의 남양주별내지구 집단에너지시설 건설공사 주기기를 공급받게 됐다. 양사는 또 향후 지멘스사가 해외에서 추진하는 중ㆍ저용량 복합화력 공사에 공동 협력키로 합의했다. 이에앞서 양사는 지난 6월 29일 아산배방 집단에너지시설과 광주수완 집단에너지시설 건설공사의 주기기 40MW급 4기 공급계약을 체결한바 있다. 광주수완지구는 광주광역시 아산배방지구는 충청남도 아산시 남양주별내지구는 경기도 남양주시에 건설되는 열병합발전소로서 각각 40MW급 가스터빈 2대와 30MW급 스팀터빈 1대로 이뤄진다. 총 계약금액은 약 1억3000만달러로 광주수완은 2009년 10월 아산배방은 2011년 1월 남양주별내는 2011년 12월 준공예정이다. 지멘스사가 주기기 공급은 물론 기술지원 및 운전원 교육 등을 담당하게 된다. 강창모 경남기업 사장은 포화상태의 건설시장에서 탈피 산업발전의 중추적 역할을 하는 각종 발전ㆍ에너지 사업에 진출하고 있다 며 향후 구역형 집단에너지시설 CES 해외 복합화력 자원개발 사업 등 고부가가치 사업으로 사업의 다각화에 힘쓰겠다 는 포부를 밝혔다.,https://news.naver.com/main/read.nhn?mode=LSD&mid=shm&sid1=260&oid=277&aid=0000007054,92
66010,2007.10.11. 오전 10:00,부동산,이데일리,지금은 분양중 양주 고읍지구 우남 퍼스트빌VOD,이데일리 김인오PD 양주시 고읍지구는 서울에서 북동쪽으로 28키로미터 정도 거리에 있고 의정부시에서 동두천시로 이어지는 개발선에 위치해 있다. 현재 땅고르기 작업이 한창인 고읍지구는 양주시 고읍 만송 광사동 일대 만평 규모로 조성되며 2008년까지 8712가구가 들어설 예정이다. 특히 고읍지구는 옥정 회천 광석 덕정과 함께 양주시가 2004년부터 조성중인 택지개발지구에 속해 있는데 다섯 개 택지지구의 개발이 완성되는 2012년에는 수도권 동북부지역 최대 주거지역에 포함돼 벌써부터 수도권 청약 대기자들 사이에서는 유망 택지지구로 인기가 높다. 고읍지구 2블록에 위치한 우남 퍼스트빌 은 현재 376가구가 분양중이며 지상 15층 8개 동에 112제곱미터 132가구와 111제곱미터 140가구 그리고 113제곱미터 104가구로 구성되어 있다. 우남 퍼스트빌 은 각 동이 모두 타워형으로 설계돼 있고 모든 가구가 남향 위주로 배치돼 있어 채광과 일조권이 좋고 단지 주변이 저층 주택단지와 공원으로 둘러싸여 있어 탁트인 조망을 자랑한다. 또한 모든 동의 1층을 필로티 공법 으로 설계함으로써 저층 세대의 프라이버시를 보호해주고 입주민의 이동을 편리하게 해주고 단지의 개방감을 높인것이 특징이다. 무엇보다도 우남 퍼스트빌 은 부지면적의 40%를 차지하는 조경공간을 다양한 화가들의 이름을 딴 테마파크로 조성한 The First Gallery 라는 조경컨셉이 가장 큰 매력이다. 분양문의 1588 8034 이 프로그램은 경제재테크 전문 채널 이데일리TV www.edailytv.co.kr 매주 목요일 오후 4시에 방영되는 줌인 TV 부동산 에서 보실 수 있습니다.,https://news.naver.com/main/read.nhn?mode=LSD&mid=shm&sid1=260&oid=018&aid=0000526255,92
66011,2007.10.11. 오전 9:58,부동산,SBS,부동산따라잡기 송파 신도시 일정 차질,서울시 의회는 어제 10일 도시관리위원회를 열고 송파 신도시 건설 예정지 그린벨트 해제를 위한 의견 청취 절차를 다음 회기로 연기하기로 결정했습니다. 시의회측은 대규모로 그린벨트를 해제하면 도시 확장에 따라 도시간 경계가 사라지고 도시끼리 맞붙는 도시 연담화가 우려된다고 밝혔습니다. 서울시의회 관계자 해제하는 면적과 개발하는 면적 같은 현장 여건들을 깊이 검토한 뒤 다시 논의하자. 이에따라 송파구 거여동과 장지동 일대 그린벨트 1.645 제곱킬로미터를 해제하는 내용의 회의는 다음 달 2일로 늦춰지게 됐습니다. 현재의 개발제한 구역 지정과 관리에 관한 특별법에는 그린벨트 해제에 앞서 해당 지역 주민들의 공람과 지방 의회 의견을 거치도록 규정돼 있습니다. 따라서 11월에 서울시의회의 의견 청취 절차를 마무리 짓더라도 개발 계획 승인은 12월에나 가능해 당초 정부 계획보다 석 달 가량 늦어질 전망입니다. 이 경우 토지 보상 같은 후속 절차도 순연될 수밖에 없습니다. 건설교통부는 2009년 3월 분양 일정에는 차질이 없도록 하겠다고 강조하고 있지만 서울시가 그동안 계속해서 송파신도시에 반대해온 만큼 사업 추진 과정에서 진통은 불가피할 것으로 보입니다.,https://news.naver.com/main/read.nhn?mode=LSD&mid=shm&sid1=260&oid=055&aid=0000109529,92
66012,2007.10.11. 오전 9:58,부동산,SBS,부동산따라잡기 은평뉴타운 주변 집값 들썩,은평구에 위치한 한 아파트입니다. 이 아파트의 109㎡형 매매가는 6억 원. 지난 해 9월에 비해 2억 4천만 원이 올라 72%의 상승률을 보였습니다. 오는 11월 은평 뉴타운 분양을 앞두고 이 인근의 아파트값이 들썩이고 있습니다. 인근 공인중개업소 작년보다 많이 올랐어요. 도산동 수색동 신사동 같은 경우가 15 20% 정도 올랐죠. 109㎡의 경우 평균 4천만 원 정도 올랐어요. SH공사는 작년 9월 은평 뉴타운의 분양가를 3.3㎡ 당 1천500만 원으로 책정 했다가 고분양가 논란에 휩싸이자 올 하반기로 분양을 연기했습니다. 하지만 분양가가 예상대로 1천500만 원 선에 이를 것으로 보임에 따라 인근 아파트 가격 상승에 영향을 미치고 있는 것으로 분석됩니다. 이곳의 현재 아파트 매매가는 평균 936만 원선에 불과해 예상대로 분양가가 책정될 경우 추가 상승 가능성이 큰 것으로 전망되고 있습니다. 강현구 내집마련정보사 정보분석실장 은평구의 집값이 서울 평균 아파트 매매가에못 미치는 수준이고요. 높은 분양가로 분양이 되면 주변 집값이 올라갈 가능성이 큽니다. 뉴타운 인근의 아파트 가격이 들썩이면서 서민 주거 안정이라는 본래 목적에서 벗어나 공공기관이 부동산 시장 불안을 조장한다는 비난 여론은 피할 수 없을 것으로 보입니다.,https://news.naver.com/main/read.nhn?mode=LSD&mid=shm&sid1=260&oid=055&aid=0000109510,92
66013,2007.10.11. 오전 9:46,부동산,아시아경제,프라임 동아건설 인수대금 완납,동아건설을 인수한 프라임그룹이 지난 10일 인수대금 6780억원을 법원에 완납한 것으로 확인됐다. 프라임그룹은 이달 16일 열리는 동아건설 수정회생계획안 인가를 위한 채권단 등 관계인 집회를 앞두고 인수대금을 모두 완납했다하고 11일 밝혔다. 이에 따라 동아건설 인수와 정상화 작업이 순조롭게 진행될 전망이다. 프라임측은 이번 관계인 집회에서 동아건설의 회생계획안이 무난히 통과될 것으로 보고 있으며 법원이 이 내용을 인가하는대로 곧바로 동아건설 경영권 인수 절차를 밟을 예정이다. 프라임 트라이덴트 컨소시엄은 지난해 9월 동아건설의 인수 우선협상대상자로 선정됐고 올해 1월 회생절차 개시결정이 떨어졌다.,https://news.naver.com/main/read.nhn?mode=LSD&mid=shm&sid1=260&oid=277&aid=0000007048,92
