,date,cat,co,headline,text,url,week
56800,2007.06.19. 오전 8:09,부동산,한겨레21,분양원가가 영업상 기밀이라굽쇼,한겨레 주공 상대로 분양원가 공개 소송 내 이긴 고양시 풍동 주민들 ▣ 고양 글 길윤형 기자charisma hani.co.kr ▣ 사진 박승화 기자eyeshot hani.co.kr 김승기 37 씨는 자신을 “평범한 시민”이라고 불렀다. “중학생 때 부모님의 손을 잡고 고양시 행신동으로 이사왔습니다. 20년 전이네요.” 그 무렵 한강 쪽으로 넓게 펼쳐진 일산의 들판은 너른 논이었고 얕은 언덕이었다. “제가 고등학교에 입학할 때까지 아파트는 없었어요. 그동안 참 많이 변했죠.” 일산이 택지개발예정지구로 지정된 것은 1989년 6월20일이었고 개발이 끝난 것은 6년 뒤인 1995년 12월31일이다. 일산이 아파트로 뒤덮이는 동안 김씨는 학교를 마쳤고 직장을 잡았다. 그는 대학병원에서 일하는 방사선사다. 아파트 숲은 고양시 전체로 확장되기 시작했다. 슬금슬금 늘어나는 아파트 숲을 보며 결혼을 했다. 모두가 그런 것 처럼 인생 목표는 ‘내 집 마련’이었다. 2003년께 기회가 찾아왔다. “고양 풍동지구에 아파트 분양이 있다는 소식을 들었습니다. 고양시 토박이고 무주택자였으니까 가능성이 있었죠.” 김씨는 고양 풍동지구에 대한주택공사가 분양하는 33평짜리 아파트에 청약 신청을 했고 당첨됐다. 경쟁은 치열했다. 물량은 1순위까지는 내려가지도 못하고 0순위에서 마감됐다. 대부분 몇 년 동안 고생해 겨우 자기 집을 갖게 된 서민들이었다. “분양가 비싼 이유 주공에 물어보자” 김씨가 분양받은 고양 풍동 주공아파트 33평형의 분양가는 2억900만원 평당 분양가는 630만원대였다. 지금은 1천만원이 넘는 평당 분양가가 상식인 시대가 됐지만 그때만 해도 사정이 달랐다. 계약자들 사이에서 “분양가가 비싸다”는 말이 나돌았다. 그도 그럴 것이 주공보다 먼저 분양된 주변의 성원아파트·동문아파트·SK아파트의 평당 분양가는 400만원선이었다. “그 와중에 한번 만나 얘기나 해보자는 말이 나온 거죠. 그게 2003년 말입니다.” 그 자리에서 사람들은 계약자 대표자회의를 만들고 당시 위원장이었던 민왕기씨를 중심으로 “분양가가 왜 이렇게 비싼지 주공에 물어보자”는 결론을 내기에 이른다. “지금 생각해보면 계란으로 바위치기였죠.” 처음 질문을 올린 곳은 주공의 홈페이지였다. 2004년 3월10일이었다. 아파트 값은 크게 두 가지 세부 항목으로 나뉜다. 하나는 아파트가 들어서는 땅값이고 다른 하나는 그 위에 건물을 지을 때 드는 건축비다. 고양 풍동처럼 한 지역이 택지개발예정지구로 지정되면 주공은 원래 땅 주인에게서 땅을 강제 수용해 땅을 평평하게 만든다. 이렇게 집을 지을 수 있도록 평평하게 다져진 땅을 택지라고 부른다. 그 위에 시멘트와 철근 등 다양한 건축자재를 동원해 아파트를 짓는다. 주민들이 궁금했던 것도 그런 점이었다. 주민들은 분양가 ‘평당 630만원’의 산출 근거를 확인하기 위해 주공 쪽에 △원주인들에게 땅을 사들일 때 지급한 보상가 △택지 조성 비용 △건축비 등 10개 항목의 질문을 던졌다. 답변은 일주일 만에 나왔다. 예상대로였다. “공개할 수 없다”는 것이었다. “분양원가와 관련된 내용은 영업상 비밀로 보호받고 있는 사항으로 공개가 불가하오니 양지해주시기 바랍니다.” 주공의 답변은 김씨의 상식과 어긋났다. “자기 집의 원가가 얼마인지 아는 것은 너무나 당연한 권리 아닌가요 ” 우리나라에는 행정기관에 알고 싶은 정보를 공개해달라고 요청할 수 있는 행정정보공개제도가 있다는 것을 알게 됐다. 계약자 대표회의는 주공 쪽에 정보공개 청구를 했다. 거부당했다. 이를 받아들일 수 없어 이의신청을 했고 그마저도 거부당했다. “솔직히 오기가 솟더라고요.” 주민들은 소송 비용 300만원을 갹출해 서울행정법원에 정보공개 청구를 거부한 주공의 처분을 취소해달라는 소송을 냈다. 분양가와 매매가의 상승 악순환 김씨는 “소송을 진행하면서 우리나라 건설회사들이 어떻게 돈을 버는지 알게 됐다”고 말했다. 쉽게 말하자면 이런 식이다. 2003년 초 분양된 고양 풍동 동문아파트의 평당 분양가는 400만원선이었다. 2003년 11월에 분양된 주공아파트 2·3단지의 분양가는 630만원선 6개월 뒤 분양된 4단지 현대 ‘아이파크’의 분양가는 800만원으로 치솟았다. 분양가가 오를 때마다 주변 아파트들의 매매가도 같이 뛰어올랐고 건설회사들은 주변 시세가 올랐다는 이유로 다시 분양가를 끌어올렸다. 집이 부족해 집을 지으면 집값이 더 뛰는 부동산 시장의 왜곡 속에서 돈을 버는 것은 건설회사들이었고 허리가 휘는 것은 서민들이었다. “저희가 주공 쪽에 분양가를 정하는 가장 큰 원칙이 뭐냐고 물었죠. 주공 관계자가 그러더라고요 주변 시세라고. 그게 아파트 시장이라는 거예요.” 그렇다면 주민들이 자체 산정해본 아파트의 분양원가는 어느 수준이었을까. 아파트 분양원가는 토지비와 건축비로 나뉜다. 이곳 33평형 아파트의 토지 지분은 16평이다. 여기에 주민들이 자체 산정한 택지 조성원가 183만원을 곱해 토지비를 산출했다. 건축비는 하청 건설업체 평당 낙찰가 185만원을 기준으로 삼았다. 그렇게 뽑아본 주공 2·3단지 아파트의 평당 분양원가는 329만원이었다. 그 계산이 맞다면 주공은 전체 분양가의 40%가 넘는 돈을 분양 차익으로 남겨먹은 셈이다. 조금 양보해 건축비를 건설교통부가 정한 표준건축비로 잡아도 결과는 크게 달라지지 않는다. 그 수치를 대입해 정장선 열린우리당 의원이 2004년 대한주택공사 국정감사에서 발표한 고양 풍동 지역 아파트의 평당 추정원가는 433만원이었다. 주민들의 기대대로 법원의 판결은 명쾌했다. 1심 판결은 소장을 접수한 지 두 달 만에 나왔다. 승소였다. 2004년 7월 서울 행정법원은 “정보들이 공개됨으로써 분양원가 산출 과정의 투명성을 확보할 수 있고 나아가 행정기관이 내부적으로 빠지기 쉬운 행정편의주의와 형식주의 및 권한 남용으로 인한 폐해를 방지하는 데 유효한 수단이 될 것으로 판단된다”고 판결했다. 그 판결의 기조는 2006년 11월 서울 고등법원과 2007년 6월1일 대법원 판결까지 이어졌다. 대법원 재판부는 “분양원가는 영업상 기밀”이라는 주공의 주장을 일축하며 “그 정보가 공개된다고 해서 주공의 사업이 곤란해진다고 할 수 없다”고 못박았다. 이제는 부당 이익금 반환 소송 주민들은 이제 주공을 상대로 부당 이익금을 반환하라는 소송을 준비 중이다. “일단 주공 쪽에서 분양원가와 관련된 자료가 넘어오면 이를 분석해 부당 이익으로 판단되는 부분이 있다면 다시 소송을 걸 예정입니다.” 김씨가 말했다. 공공택지의 분양원가 공개를 못박은 개정 주택법은 오는 9월 시행된다. 전국에서 고양 풍동과 비슷한 소송들이 줄을 이을 것이다. 개미들의 작은 몸부림이 미쳐버린 부동산 왕국을 제자리에 돌려놓을 수 있을까. 풍동의 작은 승리가 세상을 바꿀지도 모른다. ⓒ 한겨레 hp www.hani.co.kr 무단전재 및 재배포 금지 한겨레는 한국온라인신문협회 www.kona.or.kr 의 디지털뉴스이용규칙에 따른 저작권을 행사합니다.,https://news.naver.com/main/read.nhn?mode=LSD&mid=shm&sid1=260&oid=036&aid=0000015038,76
56801,2007.06.19. 오전 8:07,부동산,이데일리,시멘트레미콘업계 가격인상 놓고 전면전,시멘트업계 공급중단 가격 인상안 수용해야 레미콘업계 과도한 가격인상 받아들일 수 없어 이데일리 윤진섭기자 시멘트 업계와 레미콘 업계가 가격 인상을 두고 시멘트 공급 중단이라는 극단적인 상황으로 치닫고 있다. 시멘트 업계가 연초 인상한 가격을 레미콘 업계가 수용하지 않자 지난 주 대형 시멘트 회사들이 수도권의 일부 레미콘사에 공급을 전격 중단한 것이다. 시멘트 회사들은 올 3 4월을 기점으로 t당 4만7000원 4만8000원인 벌크 시멘트 포장되지 않은 상태의 시멘트 가격을 5만5000원 5만6000원으로 8000원 가량 인상해놓은 상태다. 19일 전문가들은 이번 일로 당장 레미콘 수급에 지장은 없겠지만 사태가 장기화될 경우 건설현장까지 공사가 중단되는 등 피해가 확산될 것으로 우려하고 있다. 업계에 따르면 지난 12일 현대시멘트 006390 성신양회 004980 를 비롯해 14일 쌍용양회 003410 등이 빅3사인 아주 유진 삼표 외 중소레미콘사에 시멘트를 전면 공급 중단했다. 동양메이저도 최근 공급이 달리고 있는 인천지역에서 가격 인상안을 수용하지 않은 유진 삼표 등 메이저 업체에 공급을 중단했다. 이와 함께 이번주부터 관련 시멘트 회사들이 동참할 움직임을 보이면서 사실상 시멘트 대란이 발생될 예정이다. 이와 관련 시멘트 업체 한 관계자는 “3월부터 결제를 차일피일 미루고 있기 때문에 더 이상 거래할 수 없다”면서 “시멘트 가격인상이 아니라 가격회복인데 레미콘업계가 이해를 해줘야 할 때”라고 밝혔다. ◇ 시멘트업계 적자폭 누적.. 가격 인상 불가피 시멘트 업계가 공급 중단의 강수를 둔 데는 업계의 만성 적자를 탈피하기 위해선 가격 인상이 불가피하기 때문이다. 실제 쌍용양회의 경우 지난해 영업이익과 순이익에서 각각 70억원과 540억원 가량 적자를 냈고 올해 1분기에도 각각 169억원과 353억원의 적자를 봤다. 동양메이저도 지난해 영업이익은 132억원이 적자 순이익은 232억원의 흑자를 기록했지만 올 1분기에는 각각 52억원과 202억원의 손실이 났다. 성신양회 현대시멘트 아세아시멘트 등도 사정은 마찬가지다. A시멘트 관계자는 “현재 시멘트 40kg 1포대가 1800원으로 담배값에도 미치지 못한 실정”이라면서 “수백억원에 이르는 적자를 더 이상 감내하기 힘든 상황”이라고 토로했다. ◇ 레미콘 업계 톤당 5만2000원 합의안 제시..더 이상 양보 없다 하지만 이에 대해 레미콘 업계는 단기간에 가격을 8000원씩이나 올리는 것은 부당하다고 주장하고 있다. 수도권 지역 레미콘 업체들은 원재료 인상 등을 고려하더라도 t당 6000원 이상은 올려줄 수 없다며 맞서고 있다. 레미콘 한 관계자는 “업체 사장단 및 관련 단체들이 양보안을 제시해 시멘트 가격은 톤당 5만2000원에 합의안을 제시했다”며 “이 가격을 시멘트 업계가 받아들이지 않을 경우 공장 가동 등 극한 상황에 직면할 것”이라고 말했다. 이에 대해 한 건설사 관계자는 시멘트와 레미콘사들간의 분쟁에 개입을 원치 않는다 라면서 다만 양측의 입장 대립이 장기화될 경우 건설 분양원가 상승등 부작용이 예상돼 하루 빨리 합의가 이뤄져야 한다 고 정상화를 촉구했다.,https://news.naver.com/main/read.nhn?mode=LSD&mid=shm&sid1=260&oid=018&aid=0000492916,76
56802,2007.06.19. 오전 8:04,부동산,이데일리,골드만삭스 76억弗 MBS 발행..사상 두번째 규모,이데일리 권소현기자 골드만삭스가 상업용 모기지를 담보로 76억4000만달러 규모의 증권 MBS 을 발행한다고 블룸버그 통신이 19일 보도했다. 이는 와코비아가 지난 3월 발행한 79억달러 규모의 MBS에 이어 사상 두번째 규모다. 이번 MBS는 사무실 호텔 소매업 등에 대한 다양한 신용등급의 상업용 대출채권 206종을 기초자산으로 발행된다. 국제신용평가사인 피치로부터 최상위 등급인 AAA를 받은 66억4000만달러 규모의 대출채권이 포함돼 있다.,https://news.naver.com/main/read.nhn?mode=LSD&mid=shm&sid1=260&oid=018&aid=0000492914,76
56803,2007.06.19. 오전 6:11,부동산,연합뉴스,부동산 재테크 세금 무서워 절세형 부동산 각광,서울 연합뉴스 서미숙 기자 부동산 시장은 요즘 세금과의 전쟁이 한창이다. 예전에 없던 종합부동산세가 생겨나자 보유세 때문에 허덕이고 2주택 이상 보유자들의 양도소득세 부담은 하늘을 찌른다. 취득.등록세율은 낮아졌지만 실거래가로 과세돼 금액이 크긴 마찬가지다. 이 때문에 여기저기에서 부동산 보유하기가 만만치 않다 는 한숨 소리가 깊어지고 있다. 19일 전문가들은 이처럼 세금 걱정이 많은 투자자라면 절세형 부동산 을 찾아보라고 조언한다. 부동산써브 함영진 실장은 분양가 상한제 재건축 억제 신도시 개발 등으로 당분간 주택가격이 크게 오르긴 힘들 것 같다 며 절세가 가능하면서 수익이 기대되는 부동산 상품에 눈을 돌려볼 때 라고 말했다. ◇ 1가구 2주택 가능한 분양 아파트 오는 9월 이후 분양가 상한제가 시행되면 시세보다 싼 아파트가 많이 등장할 전망이다. 청약가점제 시행으로 당첨 가능성은 개인에 따라 희비가 엇갈리게 됐지만 일단 가점제 점수가 높은 사람은 청약시장을 적극 공략해야 한다. 특히 새 아파트는 합법적으로 1가구 2주택 재테크가 가능한 수단이다. 분양권은 등기 입주 시점부터 주택으로 간주돼 계약후 공사가 진행되는 통상 2 3년 동안은 주택 수에 포함되지 않고 입주 후에도 1년내 비과세 요건을 충족한 기존주택을 팔면 양도세가 비과세되는 만큼 약 3 4년간은 세금에서 자유롭다. 함 실장은 새 아파트 분양은 1주택자가 중소형에서 중대형으로 비인기지역에서 인기지역으로 갈아타기에 좋은 방법 이라고 말했다. ◇ 대표 수익형 부동산 상가 상가는 대표적인 수익형 부동산으로 아파트와 달리 전매 제한이나 투자방식 등에 대한 규제가 없다는 것이 장점이다. 상가는 특히 주택과 달리 건물과 토지의 재산세를 분리 과세하고 건물 부분에 대해서는 종부세를 부과하지 않아 부동산 부자들의 분산투자용으로 인기를 끌고 있다. 토지 부분은 개인별로 합산 비사업용 토지 제외 해 누적 공시지가가 40억원을 초과할 때만 종부세를 물어 보유 토지가 적거나 땅값이 낮은 경우 종부세 걱정도 덜 수 있다. 우리은행 안명숙 부동산팀장은 부자고객 가운데는 안정적인 임대료 수입과 시세차익이 가능한 강남권 상가를 찾는 수요가 꾸준하다 며 가격이 적당하고 임대수익이 괜찮은 상가는 없어서 못 살 정도로 인기 라고 말했다. ◇ 세제혜택 많은 주택임대사업 다주택자의 절세 방법중 하나는 임대사업자로 등록하는 것이다. 같은 시.군 혹은 도 내 주택을 5채 이상 매입해 임대사업자로 등록하고 10년 이상 임대할 경우 양도세 중과 대상에서 제외 9 36%의 일반세율로 과세 되고 취.등록세 감면 종부세 대상 제외 등의 세제혜택이 주어지기 때문이다. 임대사업은 일반적으로 기존 주택보다는 중소형 미분양 아파트를 매입하는 게 유리하다. 이 때 전용면적 18평 이하의 주택을 최초로 분양받아 임대주택사업을 하면 취.등록세가 전액 면제되고 재산세도 18평 이하면 50% 25.7평 이하면 25% 감면된다. 최근 주택 공급 확대로 미분양 늘면서 중도금 무이자나 이자후불제 등 대금 납부 조건도 좋은 편이라 관심을 가질 만하다. ◇ 펜션 오피스텔 도 관심 주 5일 근무제 확산과 소득 증가 등으로 펜션에 대한 수요도 늘고 있다. 단지형 펜션은 숙박업 등록이 의무화되면서 다주택자들의 양도세 중과 걱정이 없다. 또 등기분양이 아닌 회원제로 분양받아 전세권이나 근저당권만 설정해놓을 경우 종합소득세나 부가가치세를 내지 않아도 돼 절세 효과가 있다. 다만 1년 기준 수익금이 1천500만원을 넘으면 종합소득세로 합산된다는 점은 유의해야 한다. 최근 송도 더 프라우 의 청약 열풍에서 보았듯이 주택에 대한 정부 규제가 확산되며 오피스텔도 인기다. 오피스텔은 주거용으로 쓰면 주택 수에 포함되지만 사무실 등으로 임대할 경우 주택 수에 합산되지 않는다. 시세차익은 별로 없지만 강남권 역세권의 소형 오피스텔은 월 임대료가 높아 임대수입이 목적인 소액 투자자들이 노려볼 만하다.,https://news.naver.com/main/read.nhn?mode=LSD&mid=shm&sid1=260&oid=001&aid=0001670092,76
56804,2007.06.19. 오전 6:05,부동산,연합뉴스,대토보상제 6월국회 통과 험난,국회 상임위 일정상 무리 건교부 토지보상비 관리위해 통과돼야 서울 연합뉴스 박성제 기자 정부가 토지보상비를 개발된 땅 으로 주는 토지보상법 개정안의 6월 국회 통과가 국회 일정상 쉽지 않을 전망이다. 또 매년 5만가구의 비축용 임대주택을 짓도록 하는 임대주택법 개정안도 통과를 낙관할 수 없는 상황이다. 19일 국회와 건설교통부에 따르면 국회 건설교통위원회는 정부가 지난 4월 제출한 토지보상법 개정안을 이번 국회에서 심의할 계획이다. 정부가 낸 개정안의 핵심은 대토 代土 보상제 도입으로 공익사업을 위해 수용되는 토지에 대한 보상을 개발된 땅 으로 가능하도록 하는 내용이다. 정부는 토지보상에 따른 자금이 다시 부동산시장으로 유입돼 부동산시장을 불안하게 할 수 있다는 우려에 따라 법개정을 추진중이며 시행시기도 최대한 빨리 하기 위해 공포와 동시에 발효되도록 했다. 정부는 이번 국회에서 개정안을 통과시킨다는 목표지만 국회 상임위원회 일정을 고려하면 만만치 않은 상황이다. 소관 상임위인 건교위가 처리할 수 있는 날짜가 26일로 잡혀 있어 건교위를 통과되더라도 법제사법위원회가 마지막으로 열리는 날짜가 29일이어서 법사위 안건으로 상정하기가 어렵다. 법사위에 상정되기 위해서는 최소 5일전에는 소관 상임위를 통과해야 하는 규정때문이다. 건교부 관계자는 토지보상비 관리를 위해서는 이번 국회에서 반드시 통과돼야 한다 면서 특별한 경우에는 5일 규정 에 상관없이 법사위에서 다룰 수 있는 만큼 최대한 노력할 것 이라고 말했다. 토지보상법 개정안이 이번 국회를 통과하지 못할 경우 당장 울산 대구 등 혁신도시에서 대토보상이 어려워질 수 있다. 울산 대구 혁신도시의 경우 토지보상법 개정안이 통과되면 대토보상을 하도록 별도 조항을 두고 보상절차에 이미 들어갔는데 무산된다면 대토보상이 힘들게 된다. 이번 국회에서 부동산시장의 또 하나의 관심은 비축용 임대주택을 짓도록 하는 임대주택법 개정안으로 지난 4월 국회에 이어 또 다시 난항이 예상되고 있다. 임대주택법 개정안은 4월 국회에서는 건교위 법안심사소위에까지 올랐다가 중산층의 주거를 위해 정부예산을 투입하는 게 적절한 지와 토지공사에 임대주택을 짓도록 하는 게 타당한지에 대한 논란으로 통과되지 못했다. 건교부 관계자는 여야 간사간 합의를 통해 법안심사소위에서 다룰 지가 결정될 것 이라면서 기대를 버리지 않고 있으나 다시 심의가 이뤄진다고 하더라도 지난 4월 논란이 되풀이 될 가능성이 높다.,https://news.naver.com/main/read.nhn?mode=LSD&mid=shm&sid1=260&oid=001&aid=0001670088,76
