,date,cat,co,headline,text,url,week
55909,2007.06.11. 오전 11:00,부동산,머니투데이,이달의 건축물에 밀알학교 선정,머니투데이 원정호 기자 대통령자문 건설기술ㆍ건축문화선진화위원회 위원장 김진애 는 장애인 특수학교이자 교회 시설인 서울 강남구 일원동 밀알학교를 6월의 건축문화환경 으로 선정했다고 11일 밝혔다. 밀알학교를 선정한 것은 설계의 창의성과 건축의 완성도를 통해 사람들을 모으고 소통하는 모범적인 사례로 평가됐기 때문이라고 선진화위원회 측은 설명했다. 밀알학교는 건축물 뒤편 경사지에 산책로를 만들고 지붕 한편을 막아 아트리움을 설치 자연 채광이 비추도록 한 게 특징. 또 체육관과 공연장 카페 등의 휴식공간을 도로변에 설치해 지역 주민에게 친근한 공간을 제공한다. 선진화위원회 관계자는 창의적인 건축공간 설계를 통해 지역 사회 문턱을 낮추고 열린사회로 나아갈 수 있는 장을 마련했다 면서 이러한 시도는 장애인과 지역주민의 교류를 쉽게 한다 고 의미를 부여했다.,https://news.naver.com/main/read.nhn?mode=LSD&mid=shm&sid1=260&oid=008&aid=0000793650,75
55910,2007.06.11. 오전 10:24,부동산,뉴시스,서울 역세권 장기전세주택 왕십리뉴타운에 첫선,서울 뉴시스 서울시는 역세권 등 우수한 입지에 직주근접형 職住近接形 장기전세주택을 보급키로 하고 첫 사업으로 왕십리뉴타운 주상복합건물에 들어서는 아파트 69호를 장기전세주택으로 공급할 계획이라고 11일 밝혔다. 지하 4층 지상 25층 규모의 왕십리뉴타운 주상복합건물은 2호선 상왕십리역에서 도보로 5분거리에 있을 뿐 아니라 청계천과 동대문상권에 접하고 있어 입지가 매우 우수하다는 평을 받고 있다. 이곳에는 아파트 69호와 오피스텔 28호 근린생활시설 등이 입주할 예정으로 시는 오피스텔과 근린생활시설은 일반분양하고 아파트 69호는 전량 직주근접형 장기전세주택으로 공급할 계획이다. 왕십리뉴타운의 장기전세주택은 독특한 디자인과 설계로 뉴타운 지역내 랜드마크가 될 것으로 예상되며 공중공원 옥상옥외휴식공간 주민공동시설 등 다양한 주민편의시설이 15 20층에 배치된다. 현재 공정률 약 50%인 왕십리뉴타운 주상복합건물은 20평 미만 소형평수와 37평형 이상 대형평수로 구성돼 있다. 분양시기는 공정률이 약 80%에 이르는 올 12월께가 될 것으로 예상되고 있다. 다만 서울시가 20평형 미만의 소형 평수는 신혼부부에게 우선 공급한다는 입장이기 때문에 소형평형의 청약은 정부와의 협의가 마무리 될 것으로 기대되는 내년 상반기나 되야 가능할 전망이다. 시는 왕십리뉴타운 장기전세주택의 다음 사업으로 서초구 양재동 212번지 양재 인터체인지 인근 약 6570평에 26 33 45평형 등 총 400호 내외의 직주근접형 장기전세주택 건립을 추진중에 있다. 한편 서울시는 이날 오전 서울광장에서 브랜드선포식을 갖고 장기전세주택의 새이름으로 SHIFT 시프트 전환 를 선정 발표했다. 주택의 개념을 사는 것 에서 사는 곳 으로 SHIFT 하겠다는 것. SHIFT는 주변전세시세의 80% 이하로 최고 20년까지 내집처럼 살 수 있다. 지난 5월 송파구 장지동과 강서구 발산동 481세대를 최초로 공급했으며 청약 하루만에 사실상 마감되는 등 높은 호응을 얻은 바 있다. SHIFT의 다음 청약은 발산3단지 33평형 등 총 288호를 대상으로 한 것. 오는 7월9일부터 인터넷 청약과 방문접수를 통해 이뤄지며 입주자 모집공고는 이날 20일 발표될 예정이다.,https://news.naver.com/main/read.nhn?mode=LSD&mid=shm&sid1=260&oid=003&aid=0000448583,75
55911,2007.06.11. 오전 10:21,부동산,파이낸셜뉴스,주택공급 1% 줄면 집값은 0.8% 오른다,서울지역에 신규로 공급되는 주택물량이 분기당 1%씩 감소할 경우 집값은 신규주택 공급량이 분기당 1%씩 감소할 경우 집값은 7분기 1년9개월 이후에는 최대 0.8% 상승한다는 연구결과가 나왔다. 이용만 한성대 부동산학과 교수는 11일 한국주택협회가 ‘주택분양제도 개편에 따른 주택업계 대응방안’을 주제로 프레스센터에서 개최한 세미나에 참석 주제발표를 통해 “분양가상한제는 퇴행적인 제도”라고 지적하고 “신규주택 공급량 감소에 따른 주택가격 상승 신규주택 질 하락 분양 프리미엄 및 암시장 생성 등과 같은 부작용을 유발할 수 있다”고 주장했다. 이 교수는 “신규개발에 의한 신규주택 공급량이 분기마다 1% 지속적으로 감소한다는 가정하에 서울지역 아파트를 대상으로 시뮬레이션을 한 결과 전체 주택가격은 점진적으로 상승해 7분기 이후 최대 0.8% 상승하는 것으로 나타났다”고 밝혔다. 특히 재건축 대상 주택은 7분기 이후 1.2% 상승하는 것으로 조사돼 신규주택의 공급량 감소효과가 일반 아파트보다는 재건축 시장에 더 큰 영향을 미칠 것으로 분석됐다. 이는 공급량 감소에 따른 주택가격 상승이 재건축 시기를 앞당김으로써 재건축 대상 주택가격을 한 단계 더 끌어올리기 때문이라고 이 교수는 설명했다. 이 교수는 이와함께 분양가상한제를 실시하게 되면 공급 감소에 따른 주택가격 상승뿐 아니라 신규주택의 질적 하락 분양 프리미엄 및 암시장 생성 등 부작용을 유발한다고 강조했다. 그는 특히 “청약가점제는 시장의 높은 주택가격에서 시세보다 낮은 분양가격을 제외한 만큼의 분양 프리미엄을 보장하는 영구옵션”이라고 규정했다. 이 교수는 또한 “전매기간 제한은 분양 프리미엄을 없애는 것이 아니라 실현시기를 늦추는 것 뿐이고 신규분양 주택으로 주택구입 희망자가 집중하는 부작용이 불가피하다”고 주장했다.,https://news.naver.com/main/read.nhn?mode=LSD&mid=shm&sid1=260&oid=014&aid=0000311490,75
55912,2007.06.11. 오전 10:17,부동산,머니투데이,메디컬빌딩 신사동 신성 미美타워 분양,머니투데이 문성일 기자 은탑산업개발㈜은 서울 강남구 신사동 신사역 사거리에 들어설 메디컬빌딩 신성 미 美 타워 를 분양한다. 지하7 지상18층 규모로 연면적 3750평이며 2009년 5월 완공 예정이다. 평당 분양가는 2000만 8000만원. 강남대로와 도산대로가 교차하는 신사역 사거리 코너에 위치해 있다. 지하1층은 종합건강검진센터가 지하2층은 구내식당과 카페테리아가 각각 들어설 예정이다. 지상1 3층에는 커피전문점 고급패밀리 레스토랑 약국 은행 증권 관련 등이 추천 업종이다. 4 5층에는 뷰티숍 피부관리숍 고급 헤어숍 유명 한의원 등 뷰티 에스테틱 관련 업종이 예정돼 있다. 한강 조망이 가능한 18층은 스카이라운지로 꾸며진다. 6 18층은 성형외과 치과 피부과 안과 비만 통증 클리닉 등의 전문 병·의원이 계획돼 있다. 입주자에게는 지하3 지하6층의 각 층별로 전용 7 20평 가량의 유틸리티룸을 제공한다. 신성건설이 시공하며 KB부동산신탁이 자금관리를 맡는다. 융자는 분양가의 40%까지 가능하다.,https://news.naver.com/main/read.nhn?mode=LSD&mid=shm&sid1=260&oid=008&aid=0000793613,75
55913,2007.06.11. 오전 10:11,부동산,이데일리,분양가상한제 재건축값 1.2% 올린다,이용만 교수 주택공급 1% 감소 가격 0.8% 상승 재건축 대상 주택 장기적으로 1.2% 가격 상승 예상 이데일리 윤진섭기자 분양가 상한제 실시가 신규 주택 공급량 감소와 집값 상승을 불러온다는 주장이 나왔다. 이용만 한성대 부동산학과 교수는 11일 한국주택협회가 주택분양제도 개편에 따른 주택업계 대응방안 을 주제로 프레스센터에서 개최한 세미나에서 이 같이 주장했다. 이 교수는 신규개발에 의한 신규주택 공급량이 분기마다 1% 지속적으로 감소한다는 가정하에 서울시 아파트를 대상으로 모의 실험한 결과 전체 주택가격은 점진적으로 상승해 7분기 이후 최대 0.8% 상승하는 것으로 나타났다 고 밝혔다. 특히 이 실험에서 재건축 대상 주택의 경우 7분기 이후 1.2% 상승하는 것으로 나타나 신규주택의 공급량 감소효과가 일반 아파트보다는 재건축 시장에 더 큰 영향을 미칠 것으로 분석됐다. 이는 공급량 감소에 따른 주택가격 상승이 재건축 시기를 앞당김으로써 재건축 대상 주택가격을 한 단계 더 끌어올리기 때문이라고 이 교수는 설명했다. 이 교수는 또 분양가상한제는 신규주택의 공급량 감소에 따른 주택가격 상승뿐 아니라 신규주택의 질적 하락 분양 프리미엄 및 암시장 생성 등 부작용을 유발한다고 강조했다.,https://news.naver.com/main/read.nhn?mode=LSD&mid=shm&sid1=260&oid=018&aid=0000490446,75
55914,2007.06.11. 오전 10:06,부동산,이데일리,왕십리뉴타운에 52평형 장기전세 공급,이데일리 윤도진기자 서울 왕십리뉴타운에서 52평형짜리 장기전세주택이 나온다. 이는 서울시의 장기 전세주택 공급 확대정책의 일환으로 추진되는 것이다. 11일 서울시에 따르면 서울시와 SH공사는 청계천변 왕십리 뉴타운에서 공급하는 지상 25층 주상복합아파트를 장기 전세주택으로 전환해 공급키로 결정했다. 당초 임대주택으로 공급될 계획이던 16 52평형 계약면적 23 72평 총 69가구가 장기 전세주택으로 공급되며 공급가격은 인근 전세시세의 60 70% 수준에서 결정될 예정이다. 이 장기 전세주택은 공급가격 등을 결정해 오는 12월 입주자모집공고를 내고 공급을 시작한다. SH공사가 시행하는 이 주상복합은 내년 상반기 입주를 앞두고 있다. 시 관계자는 최근 공급된 장기 전세주택이 높은 인기를 얻음에 따라 기존 임대주택 가운데 일부 물량을 장기전세 주택으로 전환해 공급하기로 했다 며 특히 뉴타운 지역과 역세권 등 시유지에 장기 전세주택을 확대할 것 이라고 밝혔다. 시는 아울러 역세권 시유지 가운데 서초구 양재동 교육문화회관 옆 부지에서도 400가구 규모의 장기 전세주택을 공급할 계획이다. 이 장기 전세주택은 현재 설계 단계이며 평형 등은 결정되지 않았다. 2009년 12월 입주자모집 공고 후 2010년 입주할 계획이다. 시는 이밖에도 시내 역세권 인근 시유지 가운데 장기 전세주택과 임대주택을 건설할 후보지를 검토 중이며 해당 구청 등과 협의해 이를 확보할 계획이다. 시 관계자는 장기전세는 소득 4 5분위 중산층이 주 공급 대상이 된다 며 역세권 시유지에 장기전세를 확대 공급함으로써 대중교통 이용이 쉬운 주거환경을 제공할 계획 이라고 설명했다. 아울러 시는 민간 재개발·재건축 사업에도 장기전세주택을 도입해 인센티브를 주는 방안과 장기전세 주택의 새 브랜드를 제작·발표하는 등 장기전세에 대한 활성화 계획을 적극 추진키로 했다.,https://news.naver.com/main/read.nhn?mode=LSD&mid=shm&sid1=260&oid=018&aid=0000490442,75
55915,2007.06.11. 오전 10:03,부동산,헤럴드POP,판교 ‘협택’ 평당 1200만원 안팎이면 투자해 볼만,판교신도시 협의 양도인 택지 협택 의 분양을 앞두고 매도ㆍ 매수자들이 막바지 저울질에 돌입 프리미엄 변동폭이 커지고 있다. 11일 현지 중개업소들에 따르면 협택 프리미엄이 현재 1억7000만±2000만원 안팎으로 형성된 가운데 매도ㆍ 매수문의가 잇따르고 있다. 이는 오는 21일 추첨이 끝나면 당첨 필지의 입지 등에 따라 수천만원이 왔다갔다 할 것으로 예상되기 때문. 판교신도시 사업시행자인 성남시와 토공 주공 등은 총 1130필지의 협택 용지에 대해 13일 19일 분양신청을 받고 21일 필지 추첨 25일 29일 계약 등 일정으로 추진한다. 분양가는 감정평가를 거쳐 평당 평균 840만원으로 책정됐다. 판교신도시 협택은 소유권이전등기 전 1회에 한해 전매가 가능해 이미 권리를 양수한 사람들은 더욱 촉각을 곤두 세우고 있다. K공인중개 관계자는 “필지추첨이 완료되면 권리가는 위치와 규모 등에 따라 곧바로 1억5000만원 이하 짜리도 나올 거고 2억원이 넘는 물건도 있을 것”이라고 설명했다. R공인중개 관계자도 “판교신도시 협택은 전매가 가능하다는 게 큰 메리트여서 필지추첨이 완료되면 입지에 따라 희비가 크게 엇갈릴 것”이라며 “투자용으로는 권리가가 높더라도 좋은 입지가 전망이 밝아 추첨 뒤 매입하는 게 순서”라고 조언했다. 현지 공인중개사들 가운데는 지난해 분양한 판교신도시 아파트 분양가와 견줘 권리가를 합해 평당 1200만원 정도면 투자가치가 있을 것으로 보고 있다. 예컨대 협택 70평 기준 택지가격 5억9000만원에 권리가가 1억8000만원 가량이면 평당 1100만원 정도여서 투자해 볼 만하다는 분석이다. J공인중개 관계자는 “협택이 평당 1100만 1200만원이면 지난해 4월 분양한 중소형 아파트의 평당 평균 분양가 1176만원 와 비슷한 수준”이라며 8월의 대형 아파트 분양가 채권 포함 평당 1700만 1800만원 와 비교하면서 투자하는 사람이 많다고 말했다.,https://news.naver.com/main/read.nhn?mode=LSD&mid=shm&sid1=260&oid=112&aid=0000068944,75
55916,2007.06.11. 오전 10:03,부동산,헤럴드POP,부동산시장 어디로 가나,동탄2지구 신도시를 발표한지 10일이 지나면서 강남권 주택가격이 다시 강세로 돌아서는 등 지역적으로 서로 엇갈린 반응이 나타나고 있다. 더구나 오는 9월 분양가 상한제와 청약가점제 등의 실시로 주택시장에 일대 변화가 예상 향후 시장전망에 귀추가 모아지고 있는 상황이다. 주택시장 이상기류 변동성 커질듯 동탄2 신도시가 발표된 이후 강남 재건축 시장은 급매물이 회수되고 가격도 무려 1억원 이상이 급등했다. 강남 집값을 주도하는 대치동 은마아파트 31평형은 종부세 부과 기준일을 앞두고 지난달 초 거래가가 8억8000만원까지 떨어졌지만 최근 급매물이 소진되면서 신고된 거래가가 9억5300만원으로 7300만원이나 올랐다. 호가 역시 34평형은 12억원 31평형은 10억원선을 회복했다. 개포 주공 역시 1단지 15평형의 경우 8억2000만원에서 9억2000만원으로 1억원이나 뛰었다. 부동산114에 따르면 강남 재건축 상승 등의 여파로 지난주 서울 전체 아파트 값은 0.03% 올라 최근 12주간의 하락세를 멈췄다. 이와는 달리 동탄 일대 기존 아파트는 주춤한 상황이다. 동탄1 시범단지 포스코 대동 삼성 32 34평형은 신도시 발표 직후 4억5000만 5억원선으로 5000만원 가량 올랐으나 지금은 오른 가격에서 보합세를 유지하고 있다. 이처럼 최근들어 주택시장에 이상기류가 감지되면서 하반기 집값 변동성도 크게 확대될 것으로 예상된다. 9월 분양가 상한제 실시에 따른 향후 싼값 아파트 공급 기대감이 하락요인이라면 대선 주자들의 개발 및 규제 완화 공약 가을 이사철 그리고 입주물량 감소 5만5000여가구로 지난해 동기보다 16.5% 감소 는 집값 불안요인으로 작용할 것으로 분석된다. 향후 5년간 58만가구 공급 과잉공급 우려도 분양가상한제의 적용을 받는 싼 주택이 오는 2011년까지 2기 신도시에서만 58만가구가 쏟아질 예정이다. 이는 수도권 전체 주택 591만가구의 10%에 해당하고 분당ㆍ일산 등 1기 신도시 물량 29만가구 의 두배 수준이다. 정부는 특히 송파 4만9000가구 와 수원 광교 3만1000가구 우면ㆍ세곡ㆍ장지ㆍ의왕청계 1만2000가구 동탄 2지구 10만5000가구 등 강남권 주택수요를 흡수할 수 있는 입지에서 향후 5년간 19만7000가구를 공급되면 강남권 집값 안정에 효과가 있을 것으로 기대하고 있다. 건교부 관계자는 “향후 5년간 강남대체 신도시에서 강남3구 재고아파트 24만가구 의 82%에 해당하는 물량이 쏟아진다”며 “분당ㆍ판교 수준의 주거여건을 갖춘 곳에 주변시세보다 30%이상 싼값에 대규모 주택공급이 이뤄질 경우 기존 집값은 떨어질 수 밖에 없을 것”으로 전망했다. 그러나 송파의 경우 2011년이 지나야 전체 물량의 80%인 3만9000가구 분양이 가능하고 강남 대체 효과가 의문시되는 동탄 2지구도 2010년이후 본격적인 공급이 이뤄지는 등 2010년이전까지는 강남권 공급부족 현상이 지속될 것이란 지적도 제기되고 있다.,https://news.naver.com/main/read.nhn?mode=LSD&mid=shm&sid1=260&oid=112&aid=0000068943,75
55917,2007.06.11. 오전 10:02,부동산,매일경제,석미건설 전곡역 부근 “전곡 석미모닝파크” 분양,석미건설은 경기도 연천군 전곡읍에 전곡 석미모닝파크 잔여분을 분양중이다. 28 32 42평형 총 171가구로 구성되었으며 분양가는 평당 390만원대. 바로 입주 가능하다. 경원선 복선 전철화로 서울 도심까지 1시간대 출 퇴근이 가능하다. 동두천까지 차로 10분 가량 소요되며 37번 3번국도 및 외곽순환고속도로를 통해 진출 입이 편리하다. 연천지역은 150만평 연천신도시 개발 계획과 함께 인근 백학면의 12만평 LCD 협력업체단지 개발 확정으로 포천과 어울려 수도권 북부의 중심도시로 관심이 증가하고 있다. 석미건설 강천호 분양 팀장은“선시공 후분양 아파트라 현장을 확인한 후 원하는 동 호수를 직접 선택할 수 있다”며 “서울 북부권 개발의 가속화로 인해 미분양 물건이 급속히 소진되고 있다”고 밝혔다.,https://news.naver.com/main/read.nhn?mode=LSD&mid=shm&sid1=260&oid=009&aid=0000594527,75
55918,2007.06.11. 오전 9:53,부동산,이데일리,정부 東동탄은 강남대체..왜,이데일리 남창균기자 정부가 東동탄을 강남대체 신도시라고 거듭 주장하고 나섰다. 장만석 건설교통부 신도시지원단장은 지난 8일 국정브리핑에 올린 기고에서 東동탄은 쾌적성 자족성 편리성 을 겸비한 신개념 신도시로 중산층 이상의 주택수요와 강남 등 수도권 중심부의 첨단 비즈니스기능 흡수에 큰 효과가 예상된다 고 강조했다. 그는 또 동탄의 강남 대체성은 수요자들의 청약에서도 확인됐다며 지난주 청약마감된 동탄 메타폴리스 청약결과를 들었다. 청약자 총 2만4000명 중 서울거주자가 4900명으로 전체 청약자의 20.8%나 된다는 것이다. 이에 대해 분양대행사 관계자는 메타폴리스 청약자들은 실수요라기 보다는 투자수요라고 봐야 한다 며 청약자의 거주지 분포를 놓고 강남 대체성을 주장하는 것은 지나친 아전인수식 해석 이라고 지적한다. 정부는 2기신도시 중에서 강남권 주택수요를 흡수할 수 있는 지역으로 송파 4만9000가구 광교 3만1000가구 우면 세곡 장지 의왕청계 1만2000가구 와 함께 東동탄 10만5000가구 을 들었다. 이들 지역에서 공급되는 물량이 강남3구 재고아파트 24만가구의 82%나 된다는 것이다. 정부가 이처럼 東동탄을 강남대체 신도시라고 강조하는 이유는 강남대체 효과 미흡에 따른 실망감으로 강남 집값이 오르는 부작용을 막기 위한 방편으로 보인다. 실제로 지난 1일 분당급 신도시 발표후 강남 집값은 희소성 을 테마로 상승 반전하고 있다. 이와 함께 이용섭 장관이 분당급 신도시는 강남을 대체할 수 있는 곳 이라고 한 발언을 정당화하기 위한 고육책으로 풀이된다. 분당급 신도시로 발표한 東동탄의 강남 대체성이 떨어진다는 지적이 나오면서 정책 신뢰성을 가장 중요한 덕목으로 삼고 있는 이 장관의 입장이 어정쩡해 진 것이다. 전문가들은 정부가 東동탄을 강남대체 신도시라고 주장한다고 해서 강남대체가 되는 것은 아니지 않느냐 라며 정부가 먼저 강남대체라는 허울을 벗어던져야 한다 고 지적한다.,https://news.naver.com/main/read.nhn?mode=LSD&mid=shm&sid1=260&oid=018&aid=0000490431,75
55919,2007.06.11. 오전 9:49,부동산,노컷뉴스,신도시 골프장 회원권값 껑충,동탄 제2신도시 예정지 인근 골프장 회원권 가격이 최근 며칠새 최고 30% 이상 급등한 것으로 나타났다. 동탄신도시 예정지에서 제외돼 논란이 되고 있는 리베라CC의 회원권 가격이 1주일 새 33%나 급등했으며 또 예정지 인근의 한원CC 기흥CC 골드CC 프라자CC 등도 10 20% 상승한 것으로 나타났다. 에이스골프회원권거래소에 따르면 리베라CC의 일반회원권 가격은 현재 1억원 정도로 신도시예정지가 발표된 지 열흘여만에 30% 2500여만원 정도 상승했다. 동탄2신도시 예정지 인근의 한원CC의 일반회원권 가격도 8000만원대에서 최근 9500만원으로 올랐으며 기흥CC도 3억1000만원에서 3억4000만원으로 오른 것으로 나타났다.,https://news.naver.com/main/read.nhn?mode=LSD&mid=shm&sid1=260&oid=079&aid=0000165752,75
55920,2007.06.11. 오전 9:49,부동산,헤럴드POP,주말 모델하우스 스케치지역ㆍ평형별 양극화 두드러져,서울 아파트시장이 모처럼 만에 회복세를 보이자 모델하우스도 더욱 활기를 되찾고 있다. 주말 모델하우스 내방객들은 향후 발전 가능성에 가장 큰 관심을 나타냈으며 이에 따라 평형별ㆍ지역별 양극화 현상도 한층 두드러지는 모습이다. 금호건설이 지난 8일 갈월동에 오픈한 주상복합 ‘리첸시아 용산’ 모델하우스는 가장 관심이 집중된 곳. 각종 개발호재를 지닌 용산에서 2년 여 만에 나온 분양물량으로 86만평 규모의 용산민족공원이나 한강 조망이 가능해 실수요자들이 속속 몰렸다. 32 75평형 총 260가구로 전체가 일반분양 분이다. 32평형은 줄을 서서 기다릴 정도로 붐볐지만 40 50평형대는 상대적으로 한산했다. 평당 1750만 3000만원 선. 32평형은 평당 1750만 1840만원 선으로 문배동 일대 시세 수준. 청약가점제를 앞두고 서울 청약예ㆍ부금 300만원 청약예금 600만원 통장으로 청약이 가능하다. 40평형대는 청약예금 1000만원 50평형대 이상은 1500만원짜리로 청약할 수 있다. 리첸시아 금호는 전용률 약 80% 수준으로 주상복합 치고는 약간 높은 편이다. 곳곳에 붙박이 수납공간을 많이 배치한 것이 특징. ‘무세제 세정수’ 장치를 도입 세제없이 식기 세척이 가능토록 해 주부들의 호응을 얻었다. 별도의 옵션이 없고 확장 비용도 따로 들지 않는다. 이에 비해 인근 서울역 부근에 자리한 가재울뉴타운 센트레빌은 다소 한산한 모습을 보였다. 26 33 43평형 총 473가구 규모로 일반분양분은 154가구. 평당 1360만 1630만원 선으로 올 3월 가재울 뉴타운에서 선보였던 현대아이파크와 비슷한 수준이다. 26 43평형에 대한 견본주택 내부보다는 가재울 뉴타운에 대한 개발 호재에 대해 설명을 듣는 방문객이 많았다. 33평형은 일반분양 분이 1 2층 뿐이다. 확장시 1000만원 가량이 추가되며 온돌마루와 붙박이장도 옵션 품목이다.,https://news.naver.com/main/read.nhn?mode=LSD&mid=shm&sid1=260&oid=112&aid=0000068934,75
