,date,cat,co,headline,text,url,week
2369,2006.01.31. 오후 3:37,부동산,노컷뉴스,2006년 20만호 표준주택단독 가격 공시,전국 평균 5.61% 상승. 연기군 50.45% 전국 최고 상승 건설교통부는 1월 1일 기준으로 단독주택 약 470만호 중에서 대표성이 있는 20만호의 2006년 표준주택가격을 1월 31일 공시했다.표준주택가격은 재산세오 종합부동산세 등 각종 부동산조세의 과세표준이 되는 개별주택가격의 산정기준이 되며 지난해 9월부터 약 5개월간 한국감정원과 감정평가법인 소속 감정평가사 1192명이 직접 참여해 조사 평가했다. 그동안 주택특성 조사 가격자료 수집 지역분석 및 시군구 시도 전국 가격균형협의와 소유자 시군구의 의견청위 결과를 바탕으로 중앙부동산평가위원회의 심의 1.25 를 거쳐 공시하게 됐다. 2006년 표준주택가격의 신뢰성 제고 추진 올해에는 공시가격의 신뢰성을 높이고 적정가격을 도출하기 위해 표준주택수를 2005년 13만 5천호에서 20만호로 확대해 다양한 단독주택의 특성에 맞게 표준주택을 선정했으며 이들 주택의 세밀한 조사와 충분한 가격자료 수집 및 정확한 지역 분석을 위해 현장조사기간을 2005년 20일에서 94일로 확대했다. 또한 시군구에서 산정하는 개별주택가격의 정확성 제고를 위해 모든 개별주택가격에 대해 전문 자격자인 감정평가사의 검증을 반드시 거쳤다. 표준주택수의 지역별 유형 구조별 현황과 가격수준 2006년 표준주택의 시도별 분포는 경북이 24 238호 12.1% 경기 22 840호 11.4% 전남 21 139호 10.6% 경남 20 679 10.3% 서울 18 476호 9.2% 순이며 전체 표준주택의 23.1%인 46 129호가 수도권에 분포했다. 건물 구조 유형별로는 연와조 60 301호 30.2% 시멘트벽돌조 45 274호 22.6% 목조 42 423호 21.2% 시멘트블럭조 31 291호 15.6% 철근콘크리트조 9 401호 4.7% 순으로 나타났다. 가격수준별로는 1천만원 미만이 32 352호 16.2% 1천만원 1억원 미만이 124 355호 62.2% 로 표준주택의 78.4%가 1억원 미만 주택이며 이중 76.6%가 시군 지역에 소재하고 있으며 1억원 이상 주택은 43 293호 21.6% 로 이중 88.2%가 수도권과 광역시 등 대도시에 소재하고 있으며 종부세 대상 6억원 이상 주택은 1000호 0.5% 로 모두 수도권과 광역시에 소재하는 것으로 나타났다. 표준주택 중 최고가격은 지난해 27억 2천만원보다 11% 상승한 30억 2천만원으로 서울 종로구 신문로 2가에 소재한 단독주택이고 최저가격은 경북의 농가주택으로서 지난해 51만 1천원보다 5.5% 하락한 48만3천원으로 평가됐다. 단 표준주택은 전체 단독주택의 가격을 대표하는 것이 아니므로 개별주택가격이 공시 4.28 되면 최고 최저가격이 달라질 수 있다. 2006년 표준주택가격 전국 평균 5.61% 상승. 충남 13.01% 상승 공시가격을 조사단위별 총가액 기준으로 분석한 결과 지난해에 비해 전국 평균 5.61% 상승했으며 수도권은 6.2% 광역시는 4.1%시군은 5.4% 상승했다. 시도별로는 행정중심복합도시 예정지역인 충남이 13.01%로 가장 높게 상승했으며 전남도청의 무안이전 등의 영향으로 광주가 1.21%로 가장 낮은 상승률을 보였다. 서울 강남 서초 송파는 2.89% 3.35% 상승해 이 지역 아파트 가격과는 달리 단독주택가격 상승은 미미했던 것으로 나타났다.수도권의 분당 파주 평택 화성 양주는 대규모 택지개발 영향 등으로 10.35% 21.13%의 높은 상승률을 보였다. 행복도시의 영향으로 연기군은 50.45%로 최고 상승률을 보였고 공주시와 천안시는 각각 16.3% 15.8%의 높은 상승률을 나타냈다. 이의신청은 공시일로부터 30일이내 신청 공시가격은 당해 시군구에서 2월 1일부터 3월 2일까지 30일동안 열람할 수 있으며 이의가 있는 경우에는 동 기간내에 당해 시군구 또는 건설교통부 부동산평가팀에 신청할 수 있다. 이의신청은 반드시 당해 표준주택의 소유자나 법률상 이해관게인만이 신청할 수 있으며 시군구 민원실에 비치한 이의신청서에 의한 서면으로 제출해야한다. 3월 2일까지 접수된 이의신청은 정확한 조사와 평가를 위해 담당 감정평가사가 아닌 제3의 감정평가사가 재조사 평가한 뒤 중앙부동산평가위원회의 심의를 거쳐 3월 24일 재조정 공시된다.,https://news.naver.com/main/read.nhn?mode=LSD&mid=shm&sid1=260&oid=079&aid=0000073430,4
2370,2006.01.31. 오후 3:32,부동산,머니투데이,계룡건설 하바로프스크 주상복합 214가구 공급,머니투데이 최태영 기자 계룡건설이 해외 주택사업으로는 처음으로 올해 러시아 하바로프스크에 주상복합아파트 200여가구를 공급한다. 31일 계룡건설에 따르면 오는 4월 중 러시아 하바로프스크에 주상복합아파트 214가구를 계룡하바로프스크리슈빌 이란 브랜드로 공급할 계획이다. 계룡은 4월 착공 후 분양을 실시 2008년 12월 완공할 방침이다. 공급평형은 24.30.40.50.60평형대로 중소형에서 중대형평형대까지 다양하게 공급할 예정이다. 2004년 사업다각화의 일원으로 해외사업에 진출한 계룡은 러시아 하바로프스크시와 주택건설 양해각서를 체결하고 합작법인을 설립한 뒤 공급하는 첫 주택이다. 이는 계룡이 올 1월로 증권선물거래소에 주식을 상장한 지 10년 만이다. 지난 96년 1월30일 최초 기업공개를 실시한 계룡은 지난해 건설시공능력평가액 기준 9159억원으로 전국 23위 건설업체로 급성장했다. 1995년 말 전국 순위 65위에서 10년만에 42단계나 상승했다. 상장 당시 7500원이던 주가도 지난 26일 현재 3만600원으로 상장 10여년 만에 300% 이상 기업가치가 높아졌다. 주주도 세계적인 외국 투자기관 등이 전체 주식의 35% 내외를 보유하고 있다. 계룡은 최근 4년 연속 기업신용평가 회사채 부문 A등급을 획득하며 우량기업으로서 가치를 인정받고 있다. 또 품질경영 및 환경경영체제 도입을 위해 ISO9001과 ISO14001 인증을 취득했다. 충청권 대표기업으로 출발한 계룡은 현재 용인 부천 수원 등 수도권과 울산 부산 등 전국에 걸쳐 주택을 공급하는 등 사업확장을 꾀하고 있다. 계룡건설 윤건원 이사는 증권선물거래소에 상장한 지 10주년을 맞아 한차원 높은 일류 건설기업으로 성장할 수 있도록 지속적으로 투자할 것 이라고 말했다.,https://news.naver.com/main/read.nhn?mode=LSD&mid=shm&sid1=260&oid=008&aid=0000624646,4
2371,2006.01.31. 오후 3:30,부동산,머니투데이,단독주택 세부담 늘어난다종합,머니투데이 이규성 기자 단독주택 공시가격이 크게 올랐다. 이에 따라 부동산 관련세금도 크게 오를 전망이다. 특히 행정도시 기업도시 혁신도시 신도시 개발 등 호재가 있는 지역은 큰 폭으로 올라 이 지역 주택보유자의 세부담이 늘어날 것으로 보인다. ◇최고.최저주택은 표준 단독 주택 20만 가구 중 최고가격은 서울 종로구 신문로 2가의 연와조 주택 30억2000만원짜리가 최고를 기록했다. 신문로 주택은 대지면적 939.5㎡ 건물연면적 581.99㎡로 지상 3층 지하 1층규모다. 최저가격은 경북 영양군 입암면 대천리 목조 주택으로 48만3000원을 기록했다. 면적은 대지 149㎡ 건물연면적 40.66㎡ 규모다. 두번째로 비싼 집은 용산구 이태원동의 1223㎡짜리 주택으로 28억2000만원 성북구 성북동의 주택 1172㎡ 은 25억2000만원으로 그 뒤를 이었다. 경기도에서는 성남 분당구 분당동의 철근콘크리트집이 12억7000만원 인천에서는 연수구 연수동 단독주택이 8억7300만원으로 각각 최고였다. 반면 전남에서는 최고 주택이 2억6400만원에 불과한 것으로 나타났다. ◇ 연기군 최고 상승률 기록 이번 공시가격 평가에서 가장 많이 오른 지역은 충남 연기군으로 나타났다. 행정중심복합도시 건설이 가장 큰 영향으로 분석된다. 연기군은 단독주택 공시가격 평균 상승률이 50.45%으로 기록했고 공주시도 16.3%나 올랐다. 연기군 서면 부동리에 있는 한 주택은 작년 공시가격이 1840만원에서 올해 2770만원으로 올랐다. 남면 연기리의 주택의 경우도 4870만원에서 7350만원으로 상향 조정됐다. 수도권에서는 신도시가 개발되는 양주시와 인천 중구가 각각 21.13% 20.39%의 상승률을 기록했다.. 천안 15.8% 을 비롯 신도시 확대가 예정된 경기 김포시 16.22% 와 화성 16.77% 부산 기장 15.68% 울주 15.51% 안양 만안 19.79% 전남 신안 17.17% 등 8곳도 15%가 넘게 올랐다. 의왕 14.6% 안양 동안 13.99 충북 청원 13.55% 충남 예산 12.53% .아산 11.95% 기업도시 예정지역인 전북 무주 11.94% 등은 10%가 넘게 올랐다. 그밖에 분당은 13.30% 평택은 12.68% 파주는 10.35%의 상승률을 나타냈다. 지난해 청계천 복원으로 부동산 가격이 크게 뛴 종로구의 단독주택들도 11.60%가 올라 눈길을 끌었다. 고가주택이 밀집된 강남구와 서초구 송파구 등의 공시가격 조정은 2 3%내외로 전국 평균상승률 5.61% 에도 못미쳤다. 강남구의 상승률은 2.89% 서초구 3.34% 송파구 3.35%였다. 하지만 올해부터 종합부동산세가 가구주 기준에서 세대별 합산으로 바뀌고 과표기준이 공시가격의 9억원 이상에서 6억원 이상으로 확대돼 종부세 대상 주택은 작년보다 많이 늘어날 것으로 보인다. 올해 표준주택 20만가구중 6억이상 주택은 1000가구 0.5% 로 6억 9억미만 683가구 9억원이상 317가구다. 표준주택의 비율을 전체 470만가구에 적용하면 대상 주택은 2만3500가구가 된다. 서울시의 경우 작년 9억원을 넘는 단독주택 수는 전체 43만8036가구 의 1.2%인 5093가구였으며 이 숫자가 전국 종부세대상 단독주택의 90%를 차지했다 . ◇ 세 부담 늘어난다 공시가격 상승으로 주택보유자의 세부담도 크게 늘게 됐다. 특히올해부터 취득.등록세와 양도세는 실거래가로 과세돼 공시가격이 올라도 큰 차이가 없다 그러나 재산세와 종합부동산세 등 보유세는 공시가격 상승으로 크게 오르게 됐다. 건교부에 따르면 충남 연기.공주 경기 김포.의왕.평택.분당신도시 등 공시가격 상승폭이 큰 지역은 보유세 부담이 지난해보다 50 60% 이상 늘어날 것으로 예상된다. 실례로 분당 운중동 A주택의 경우 지난해 공시가격이 5억9000만원에서 올해 7억800만원으로 20% 인상됐다. 이에 따라 재산세 교육세 포함 는 지난해 145만8000원에서 올해 181만2000원으로 약 24.3% 오른다. 특히 올해 9억원에서 6억원으로 강화된 종합부동산세 대상에도 포함되면서 종부세 58만3200원 농특세 9만7200원 포함 이 추가돼 전체 보유세는 지난해 145만8000원에서 올해 239만5200원으로 1년새 64.2%나 늘어나게 됐다. 충남 연기군 남면 연기리 소재의 B단독주택의 경우 공시가격이 지난해 4870만원에서 올해 7350만원으로 50% 뛰면서 재산세 부담도 4만3830원에서 6만5744원으로 50% 가량 늘어나는 것으로 나타났다. 공시가격 상승폭이 2.89 3.35%로 상대적으로 낮았던 서울 강남.서초.송파구 등 강남권은 이에 비례해 재산세 증가폭도 크지 않을 전망이다. 다만 올해 종합부동산세 대상에 새로 편입된 주택은 보유세 부담이 크게 증가한다. 지난해 공시가격이 6억8800만원에서 올해 7억1100만원으로 3.3% 증가한 서울 서초구 양재동의 C단독주택의 경우 재산세 교육세 포함 는가 지난해 175만2000원에서 182만1000원으로 3.9% 올랐다. 그러나 종합부동산세 농특세 포함 59만9400원이 추가돼 전체 보유세는 175만2000원에서 242만400원으로 38.1% 불어난다. 따라서 종합부동산세 부과 대상 주택의 경우 공시가격이 5% 늘면 보유세 부담이 최하 20% 이상 늘어나게 된다. 상속.증여세도 증가할 전망이다. 공시가격이 10% 인상되면 상속이나 증여받을 때의 취득.등록세도 이에 비례해 10% 이상 증가할 것이라는게 전문가들의 분석이다.,https://news.naver.com/main/read.nhn?mode=LSD&mid=shm&sid1=260&oid=008&aid=0000624645,4
2372,2006.01.31. 오후 3:21,부동산,조세일보,표준단독주택 평균가격 상승으로 보유세 늘 듯,서울과 전남 표준주택 평균가격 14배 차이 단계별 부과 특성상 가격 상승분보다 보유세 증가 클 전망 건설교통부가 31일 단독주택의 표준주택가격을 공시한 결과 전국 평균가격이 5% 이상 상승함에 따라 단독주택의 재산세·종합부동산세 등 각종 세액도 그만큼 상승하게 될 것으로 보인다. 또 보유세 세율이 단계별로 다르게 적용되는 만큼 보유세액은 표준주택가격의 상승률보다 좀 더 오르게 될 것으로 전망된다. 건교부에 따르면 전국 표준단독주택 20만가구의 평균가격은 7383만원으로 지난해 표준단독주택 13만5000가구의 평균가격 6505만원에 비해 5.61% 오른 것으로 나타났다. 이에 따라 재산세 등 보유세의 평균부담액 역시 상당수준 오르게 될 것으로 예상된다. 특히 재산세의 경우 4000만원·4000만∼1억원·1억원 이상 등으로 과표를 나눠 각각 0.15%·0.3%·0.5% 등으로 세율이 따로 매겨지고 종부세도 이와 비슷한 방법으로 세금이 부과되기 때문에 주택가격 상승분에 따라 더 높은 세율이 부과될 수 있어 보유세 상승률은 가격상승률보다 좀더 높을 것으로 보인다. 더욱이 올해부터 종부세 과표적용률이 20% 상향조정되고 세부담 상한선도 전년대비 1.5배에서 3배 한도로 높아져 주택가격이 높은 경우 세금 부담액도 상당히 오를 것으로 전망되고 있다. 한편 전국의 표준단독주택의 평균가격은 지역에 따라 큰 차이를 보이는 것으로 나타났다. 서울의 표준단독주택의 경우 평균가격이 2억5703만원으로 가장 높았으며 경기도는 1억3162만원으로 수도권이 1억7832만원 가량인 것으로 집계됐다. 또 대전의 경우 1억716만원 인천 9779만원 대구 8631만원 부산 7763만원 등으로 광역시의 전체 평균가격은 8126만원 정도인 것으로 조사돼 전국 평균가격보다 높았다. 이에 비해 경기도를 제외한 모든 도 단위 지역은 전국의 평균가격에 비해 낮게 나타났다. 특히 평균가격이 가장 낮았던 전남지역은 1813만원으로 나타나 가장 높은 서울의 평균가격에 비해 무려 14배 차이를 보였다. 이날 공시된 표준주택가격은 재산세·종부세 등의 과세표준이 되는 개별주택가격의 산정기준이 된다. 개별주택가격은 오는 4월 28일 공시된다. 그러나 올해부터 실시된 부동산실거래가 신고제도에 따라 취득·등록세 및 양도세 등 거래세의 경우 세금이 실거래가에 의해 부과되기 때문에 개별주택가격은 거래세의 과세표준이 아닌 실거래가를 판별하는 기준가격으로 활용될 전망이다. 건교부 관계자는 표준주택가격이 평균 5% 가량 상승함에 따라 재산세도 그만큼 오르게 될 것 이라며 보유세의 경우 과표 단계에 따라 단계적으로 세율이 더 높아지기 때문에 지난해 0.15%의 재산세를 적용받았더라도 올해의 경우 일부분에 대해서는 0.3%의 세율을 적용받을 수 있는 등 평균가격 상승분보다 평균세액이 좀더 오르게 될 것 이라고 말했다.,https://news.naver.com/main/read.nhn?mode=LSD&mid=shm&sid1=260&oid=123&aid=0000004692,4
2373,2006.01.31. 오후 3:18,부동산,머니투데이,주신엔터프라이즈 말레이시아서 1170만평 조림사업,머니투데이 원종태 기자 수천만평의 대규모 임야를 개발하는 해외 조림사업이 부동산 개발의 새로운 틈새시장으로 눈길을 끌고 있다. 해외 조림사업은 대규모 원시림을 임대해 사업초기에는 벌목으로 우드칩 원목을 3∼4cm 크기로 부순 조각 을 생산해 수익을 내고 장기적으로 탄소배출권 매각을 노릴 수 있어 사업전망이 장밋빛이다. 2013년이후 우리나라가 온실가스 의무감축 대상에 포함되기 때문에 온실가수 배출이 많은 민간기업들은 의무적으로 조림사업체 등으로부터 탄소배출권을 확보해야 한다. 주신엔터프라이즈는 최근 말레이시아 사바주에서 현지 인나베스트사와 1170만평 규모의 조림사업권 양해각서를 체결하고 본격적인 조림사업에 나선다. 주신이 조림수종으로 선택한 알비지아 나무는 성장기간이 워낙 빨라 묘목을 심은 뒤 5년후면 직경 60cm 높이 35m까지 자란다. 묘목이 자라기전에는 원시림 벌목을 통해 우드칩을 생산할 수 있다. 주신은 우리나라가 온실가스 의무감축 대상에 포함되는 2013년부터는 국내외 기업들을 상대로 탄소배출권을 적극 매각할 계획이다. 현재 탄소배출권은 톤당 20 25달러 정도에 거래되는데 주신은 1170만평에 조림업 개발을 끝내면 약 100만톤 정도의 탄소배출권 확보가 가능할 전망이다. 주신 이기남 사장은 해외 조림사업은 벌목을 통한 목자재 수익은 물론 탄소배출권 판매로 이중 수익을 노릴 수 있다 며 2013년이후 국내기업들의 탄소배출권 수요가 크게 늘 것으로 예상돼 동남아시아와 중국 등지의 해외 조림사업이 더욱 각광받을 것 이라고 밝혔다. 주신은 현재 사바주에서 300만톤의 탄소배출권 확보가 가능한 4200만평 규모의 조림사업권을 추가로 따내기 위해 주정부와 협상를 벌이고 있다. 또 조림사업 개발자금 유치를 위해 공동투자자도 모집한다.,https://news.naver.com/main/read.nhn?mode=LSD&mid=shm&sid1=260&oid=008&aid=0000624637,4
2374,2006.01.31. 오후 2:57,부동산,연합뉴스,아파트 청약제도 가점제로 전환 검토,서울 연합뉴스 유경수기자 아파트 청약제도를 현행 추첨제에서 가구주 소득과 부양가족 통장가입 기간 등을 반영한 가산점제 로 전환하는 방안이 검토된다. 31일 건설교통부에 따르면 청약제도 개편안을 용역 작업중인 주택산업연구원은 최근 당정회의에서 이 같은 내용을 담은 중간연구 결과를 발표하고 빠르면 2월말 제도개선 방안을 내놓기로 했다. 개편안은 민간택지에 지어지는 주택에 대해서는 현행 청약제도의 골격을 유지하지만 토지공사 주택공사 등이 조성하는 공공택지내 주택은 무주택자 등 실수요자에게 우선 공급한다는 것에 초점이 맞춰졌다. 이에따라 공공택지내 25.7평 이하 주택은 가구주 연령 부양가족수 가구소득 무주택기간 청약통장가입기간 등을 기준으로 배점을 매겨 무주택자에게 우선 공급하고 25.7평 초과주택도 채권입찰제 외에 가산점을 부여 당첨자를 가리는 방안이 추진된다. 또 공영개발지구내 중소형 아파트는 부금 예금 저축을 통합 가점제로 결정하는 방안과 공공택지내 25.7평 이하 주택을 전량 무주택자에게 주는 안도 검토되고 있다. 건교부는 실수요자 중심의 주택청약제도 개편방안을 중장기 차원에서 면밀히 연구중이며 상반기중 정부안을 마련하는 게 목표 라고 말했다. 건교부는 그러나 통장가입자간 이해관계 제도 개편에 따른 시장 혼란 등을 고려할때 당장 전면 시행은 어려울 것 이라며 1 2년의 시차를 두고 충분히 여론을 수렴 단계적으로 시행할 계획 이라고 말했다.,https://news.naver.com/main/read.nhn?mode=LSD&mid=shm&sid1=260&oid=001&aid=0001207932,4
2375,2006.01.31. 오후 2:46,부동산,연합뉴스,충남 연기 분당 단독주택 보유세 5060% 증가,서울 연합뉴스 서미숙 기자 올해 표준 단독주택 공시가격이 지난해보다 오름에 따라 세 부담도 크게 늘게 됐다. 올해부터 취득.등록세와 양도세는 실거래가로 가세돼 공시가격이 올라도 별다른 변화가 없지만 재산세와 종합부동산세 등 보유세는 공시가격에 따라 크게 달라진다. 31일 건교부가 발표한 표준주택 공시가격에 따르면 충남 연기.공주 경기 김포.의왕.평택.분당신도시 등 공시가격 상승폭이 큰 지역은 보유세 부담이 지난해보다 50 60% 이상 늘어날 전망이다. 실제 분당 운중동 A주택의 경우 2005년 공시가격이 5억9천만원에서 올해 7억800만원으로 20% 인상됨에 따라 재산세 교육세 포함 는 지난해 145만8천원에서 올해 181만2천원으로 약 24.3% 증가한다. 특히 올해 9억원에서 6억원으로 강화된 종합부동산세 대상에도 포함되면서 종부세 58만3천200원 농특세 9만7천200원 포함 이 추가돼 전체 보유세는 지난해 145만8천원에서 올해 239만5천200원으로 1년새 64.2%나 늘어나는 것으로 나타났다. 또 충남 연기군 남면 연기리 소재의 B단독주택은 공시가격이 지난해 4천870만원에서 올해 7천350만원으로 50% 뛰면서 재산세 부담도 4만3천830원에서 6만5천744원으로 50% 증가한다. 공시가격 상승폭이 2.89 3.35%로 상대적으로 낮았던 서울 강남.서초.송파구 등 강남권은 이에 비례해 재산세 증가폭도 크지 않을 전망이다. 하지만 올해 종합부동산세 대상에 새로 편입된 주택은 보유세 부담이 크게 증가한다. 지난해 공시가격이 6억8천800만원에서 올해 7억1천100만원으로 3.3% 증가한 서울 서초구 양재동의 C단독주택은 재산세 교육세 포함 가 지난해 175만2천원에서 182만1천원으로 3.9% 증가하는데 그치지만 종합부동산세 농특세 포함 59만9천400원이 추가돼 전체 보유세는 175만2천원에서 242만400원으로 38.1% 불어난다. 김종필 세무사는 올해 새롭게 종부세 과세 대상에 포함된 공시가격 6억 9억원 사이의 주택과 세율이 지난해 1%에서 1.5%로 늘어난 공시가격 9억 20억원 주택의 보유세 부담이 크게 늘어날 것 이라며 공시가격이 5% 늘면 보유세 부담이 최하 20% 이상 늘어난다고 봐야 한다 고 말했다. 공시가격이 오름에 따라 상속.증여세도 증가할 전망이다. 전문가들은 공시가격이 10% 인상되면 상속이나 증여받을 때의 취득.등록세도 이에 비례해 10% 이상 증가할 것으로 내다봤다.,https://news.naver.com/main/read.nhn?mode=LSD&mid=shm&sid1=260&oid=001&aid=0001207902,4
2376,2006.01.31. 오후 2:44,부동산,연합뉴스,대전 도심 재개발 잇따라,대전 연합뉴스 이은중 기자 노후 주택을 헐고 아파트를 짓는 재개발사업이 대전시내 곳곳에서 이뤄진다. 31일 주택공사 대전충남지역본부에 따르면 2011년 준공을 목표로 대전시 중구 선화동 옛 대전MBC 일원 3만9천여㎡에 725가구의 아파트와 상가를 짓는 주택건설사업계획승인을 올해 말까지 마칠 예정이다. 이곳에 지어지는 아파트는 20평형 전용면적 51㎡ 50가구 24평형 전용면적 59㎡ 75가구 34평형 전용면적 84㎡ 530가구 44평형 전용면적 118㎡ 70가구 등 15 30층 규모 13개동이다. 또 한화건설은 대전시 중구 선화동 호수돈여고 인근 선화재개발구역의 시공사로 선정됐다. 한화건설은 이곳에 17평형 43가구 25평형 34가구 26평형 137가구 34평형 424가구 39평형 256가구 등 모두 894가구의 아파트를 2008년 2월 착공 및 일반분양을 한 뒤 2010년 7월 완공할 계획이다.,https://news.naver.com/main/read.nhn?mode=LSD&mid=shm&sid1=260&oid=001&aid=0001207899,4
