,date,cat,co,headline,text,url,week
57444,2007.06.27. 오후 5:51,부동산,파이낸셜뉴스,분양권도 실거래가 신고대상 허위신고땐 최고 5% 과태료,앞으로 아파트 분양권 입주권 거래 때도 신고기간 내 거래신고하지 않거나 거래가액을 허위로 신고할 경우 취득가액의 최대 5%까지 과태료가 부과된다. 또 부동산 실거래가 신고 지연에 대한 과태료가 현행 취득세 신고가액의 2% 의 최고 3배에서 500만원 이하로 낮춰진다. 27일 건설교통부는 이 같은 내용의 ‘공인중개사의 업무 및 부동산거래신고법 하위법령’을 29일 공포하고 즉시 시행에 들어간다고 밝혔다. 개정법률은 아파트 분양권 입주권 포함 매매도 실거래가 신고 대상에 포함돼 허위신고 땐 취득가액의 최고 5%까지 과태료를 부과토록 했다. 실거래가보다 10% 미만으로 축소해 신고하면 취득가액의 2% 20% 이상 가격을 낮춰 신고하면 5%의 과태료가 각각 부과된다. 이에 앞서 건교부는 실거래가 신고기간이 계약 후 30일에서 60일로 완화했다. 개정법률은 또 실거래 신고 지연에 대한 과태료를 종전 취득세의 1∼3배에서 10만∼500만원으로 완화했다. 거래가격대 별로 과태료를 차등화해 거래가격이 5000만원 이하이고 지연기간이 1개월 미만이면 10만원이 부과되고 1억원 이상∼3억원 미만짜리 부동산을 매매해 1개월 이상∼3개월 미만 신고를 미룰 경우 200만원의 과태료 처분을 받게 된다. 최고액인 500만원은 5억원 이상 3개월 이상 신고를 지연한 경우이다. 이와 함께 시·군·구청장에게 실거래가 신고 내역 조사할 수 있는 권한을 부여했다. 해당 지자체는 입출금 내역이 명기된 은행 통장 등 금융거래내역을 요구할 수 있게 된다. 이러한 요구에 응하지 않을 경우 500만원의 과태료를 부과할 수 있다. 개정법률은 이 밖에도 옥외광고물에 중개업자의 이름을 새기도록 의무화했고 실거래가 신고내용 중 작은 오류는 재신고 없이 정정할 수 있도록 했다.,https://news.naver.com/main/read.nhn?mode=LSD&mid=shm&sid1=260&oid=014&aid=0000317156,77
57445,2007.06.27. 오후 5:48,부동산,파이낸셜뉴스,민간아파트 공급 뚝…집값 오르나,올해 상반기 전국의 민간아파트 공급물량이 연간 공급계획 물량의 20% 수준에 그쳐 공급 부족에 따른 집값 상승의 우려가 높아지고 있다. 특히 브랜드파워를 내세우면서 그동안 민간부문 주택공급을 주도해 온 초대형 건설사들의 주택공급이 올 상반기 들어 크게 위축됐다. 27일 한국건설산업연구원과 부동산114에 따르면 올 상반기 전국에 공급된 민간 아파트는 11만6679가구로 연초 계획됐던 연간 공급물량 57만6862가구 의 20.2%에 머문 것으로 조사됐다. 이는 상반기에 지자체의 분양가 심의가 강화돼 분양이 지연된 데다 지방을 중심으로 주택경기가 크게 위축되면서 건설업체들이 아파트 공급을 대거 미뤘기 때문이다. 지역별로는 서울이 연간 공급예정 물량 5만803가구 중 1만964가구만이 공급돼 실적이 21.6%에 머물렀고 △경기도 18.5% 3만3655가구 △부산 5.3% 2487가구 △대구 27.3% 1만1224가구 △인천 25.0% 7060가구 △광주 33.7% 6478가구 △대전 3.7% 541가구 △울산 6.1% 1182가구 등이다. 시공능력 기준 상위 15대 건설업체들의 올 상반기 아파트 공급실적도 연초 목표 대비 20% 수준에 그쳤다. 대우건설 삼성건설 현대건설 15대 건설사들의 올해 연간 공급계획 물량은 14만8050가구. 하지만 올 상반기 지난 25일 현재 까지 실제 분양된 물량은 3만5213가구에 불과하다. 분양가구 수는 연초 계획물량대비 23.7%로 저조한 실적이다. 지난해에는 연초 계획물량 6만862가구 중 40.7%인 2만4788가구가 상반기에 분양된 점을 감안하면 올해 상반기 분양실적은 ‘반토막’ 수준이다. 업체별로는 포스코건설이 7700가구 가운데 상반기까지 4073가구를 분양해 계획물량 대비 분양가구수가 52.9%로 가장 높았고 이어 삼성건설 49.3% 금호건설 41.7% 두산건설 30.4% 현대산업개발 24.1% 등으로 집계됐다. 올해 분양예정물량 2만1260가구 이 가장 많은 대우건설은 상반기에 5043가구를 분양해 23.7%를 기록했고 한진중공업은 83가구 3.2% 한화건설은 297가구 4.4% 를 분양해 한 자릿수에 머물렀다. 업계 관계자는 “분양물량 비중이 큰 지방주택시장이 침체돼 건설사 간 눈치보기가 이어지고 있다”며 “여기에 지자체 분양가심의위와 오랜 진통이 거듭되면서 분양하려는 물량마저 일정이 지연되기 일쑤”라고 토로했다. 부동산114 김규정 팀장은 “미분양 증가 등으로 상반기 물량을 하반기로 연기한 경우가 많았기 때문”이라며 “연기된 물량이 전체의 80%에 달해 하반기 선별분양 후 나머지 물량은 내년으로 또다시 미뤄질 가능성이 높다”고 내다봤다.,https://news.naver.com/main/read.nhn?mode=LSD&mid=shm&sid1=260&oid=014&aid=0000317155,77
57446,2007.06.27. 오후 5:42,부동산,파이낸셜뉴스,하반기 부동산시장 안정기조속 국지적 상승 예상,올 하반기 서울·수도권 집값은 분양가상한제와 청약가점제 실시 등의 영향으로 소폭 하락하거나 보합세를 보일 것으로 전망됐다. 땅값 역시 정부의 강력한 규제로 안정세를 유지할 것으로 예상됐다. 한국건설산업연구원은 27일 서울 논현동 건설회관에서 개최한 하반기 건설·부동산 경기 전망 세미나에서 하반기 서울·수도권 집값은 0.9% 전국적으로는 1.4% 떨어질 것으로 내다봤다. 김현아 연구위원은 “하반기 금리인상과 강력한 주택규제 효과로 매수는 급감하는 반면 매도는 증가해 가격 하락이 불가피할 것으로 예상된다”며 “무주택자의 주택구매 지연은 수도권의 경우 전세가격 상승으로 이어질 것”이라고 말했다. 김 연구위원은 또 “분양가상한제 시행에 따른 ‘밀어내기식’ 아파트 공급으로 연말 이후 미분양 주택이 크게 늘어날 것으로 예상된다”고 덧붙였다. 그는 “올해 하반기 전국적으로 주택시장은 매매가격과 전세가격 모두 약보합세를 보일 것”이라고 덧붙였다. 토지시장은 정부의 규제 강화와 주식시장 호황이 이어지고 있지만 지역별 개발 기대감과 함께 토지 수용자들의 대토 선점 경향이 하반기부터 두드러질 것으로 보여 전체적인 상승률이 지난해 수준 5.61% 인 5%대를 유지할 것으로 전망됐다. 건설경기는 지난 3년간의 침체에서 벗어나 회복세를 보이겠지만 업체 규모별 양극화와 함께 지방 주택 미분양 적체 문제가 여전히 심각해 불안 요인으로 작용할 것이라고 건산연은 밝혔다. 특히 상반기 재정 조기집행과 하반기 재개발 수주 급감에 따라 전반적인 수주 규모가 상반기보다 15.4% 감소한 52조7000억원에 그칠 것으로 전망됐다. 주택산업연구원과 부동산뱅크도 이날 공동발표한 올 하반기 주택경기 전망 보고에서 전국적으로 매매가격은 평균 0.5%정도 상승에 그칠 것으로 분석했다. 이 가운데 서울이 0.7% 수도권은 0.8% 상승해 전국 평균을 웃돌 것으로 전망됐다. 전세가격 역시 서울 0.8% 수도권이 1.2% 오르고 전국적으로는 평균 0.4% 소폭 상승에 머물 것으로 전망됐다. 하반기 주택시장 전망에서 함께 실시한 설문조사 주택건설업체 67개사 에서 70.2%가 주택건설 계획량을 줄이겠다고 응답했다. 줄이는 이유로 66.7%가 ‘분양가상한제 및 원가공개 확대에 따른 수익성 악화’를 24.4%는 ‘분양시장 침체 예상에 따른 사업축소’를 각각 꼽았다. 3·4분기 주택경기 기업경기실사지수 BSI 는 74.6으로 6분기 연속 악화될 것으로 전망됐다. 주택산업연구원 관계자는 “지방 주택시장 불황으로 주택전문업체들의 경영난이 갈수록 심각해 지고 있다”면서 “서울·수도권과 지방 주택시장에 대한 규제를 차별화하지 않을 경우 지방주택경기는 더욱 침체의 늪에서 헤어나지 못할 것”이라고 말했다. 이 관계자는 “집값이 안정된 지역은 투기과열지구 해제나 주택담보대출 규제완화 등 수요를 살리는 방향으로 규제를 일부 푸는 방안도 적극 검토해야 한다”고 강조했다. 주택가격 안정기조가 지속되는 시기에 대해서는 건설업체의 경우 31.3%가 올 하반기 34.4%가 내년 상반기를 꼽았으며 중개업소들은 42.5%가 올 하반기 23.3%는 내년 상반기라고 답했다.,https://news.naver.com/main/read.nhn?mode=LSD&mid=shm&sid1=260&oid=014&aid=0000317147,77
57447,2007.06.27. 오후 5:30,부동산,파이낸셜뉴스,부산·대구·광주 투기과열지구 7월 풀린다,부산 대구 광주 등 지방 대도시의 일부 지역이 오는 7월2일께부터 투기과열지구에서 풀린다. 그러나 수도권과 대전 울산 등 상대적으로 시장침체가 덜한 지역은 투기과열지구가 계속 유지된다. 건설교통부는 27일 정부과천청사에서 이용섭 건설교통부 장관을 위원장으로 하는 주택정책심의위원회를 열고 주택분양 시장이 냉각돼 미분양이 속출하고 있는 부산 대구 광주 등 3개 대도시를 투기과열지구에서 해제키로 방침을 세운 것으로 알려졌다. 정부는 하지만 이들 3개 대도시 중에서도 시장 불안요인이 있는 부산 해운대구와 수영구 대구 수성구 등 일부 지역은 투기과열지구를 유지하는 방안을 검토하고 있다. 정부는 관보 게재 절차 등을 거쳐 7월2일부터 투기과열지구를 해제할 방침이다. 주택가격상승률이 높고 청약경쟁률이 높은 경우 건교부 장관이 지정하는 투기과열지구는 전매제한 등의 규제가 따른다. 지방 투기과열지구 중 충청권은 계약 후 3년 대구와 부산 등 그 밖의 지역은 1년간 아파트를 되팔 수 없다. 현재 서울을 포함한 수도권 대부분 지역과 부산 대구 광주 대전 울산 등 지방 광역시가 모두 투기과열지구로 지정돼 있다. 투기과열지구에서 벗어나면 전매제한이 풀려 미분양 해소 등 지방 주택시장이 다소 숨통이 트일 전망이다. 하지만 오는 9월 분양가 상한제가 시행되면 지방 비투기과열지구도 6개월간 전매제한이 새로 적용된다.,https://news.naver.com/main/read.nhn?mode=LSD&mid=shm&sid1=260&oid=014&aid=0000317129,77
57448,2007.06.27. 오후 5:27,부동산,내일신문,녹지신도시 광교 개발 착수,내일신문 녹지율 41%로 판교보다 높아 … 평당 1000만원 내년부터 분양 녹지 신도시 광교의 밑그림이 나왔다. 전체 면적 중 공원·녹지가 141만4000평으로 가장 많고 도로 95만7000평 주택용지 64만9000평 상업용지 18만8000평 연구개발단지 11만5000평 순이다. 녹지율은 41.4%로 판교 30.1% 분당 28.9% 일산 22.5% 보다 높고 ha당 인구밀도는 68.7명으로 신도시 가운데 가장 낮다. 김문수 경기지사는 26일 수원 나노팹센터에서 기자회견을 열어 건교부로터 광교신도시 실시계획이 승인됨에 따라 광교를 녹지 신도시로 만드는 개발사업을 시작한다고 밝혔다. 수원시 이의·원천동과 용인시 상현동 일대 341만평에 들어서는 광교 신도시는 3만1000가구 7만7500명 수용 규모의 자족형 행정복합도시 형태로 건설된다. 주택 물량 3만1000가구 중 일반 아파트는 72.5%인 2만2469가구이며 연립주택 2313가구 주상복합 5460가구 단독주택 758가구 등이다. 이 중 서울 강남수요를 흡수하기 위해 1만3582가구는 전용면적 85㎡ 25.7평 이상 중대형으로 공급되고 9493가구는 임대주택으로 건설된다. 9월부터 주택용지 공급과 착공이 시작돼 내년 9월에 시범단지 1188가구를 첫 분양한다. 이어 2009년 1만708가구 2010년 1만3358가구 2011년 2688가구 2012년 2300가구가 순차적으로 분양된다. 후분양제가 적용되는 공공주택의 경우 2009년 9월부터 분양하고 입주는 2011년 4월부터 시작한다. 분양가는 수원 영통이나 용인 수지의 70∼80% 수준으로 60∼85㎡ 이하 아파트는 평당 900만∼1100만원 85㎡ 이상 아파트는 평당 1200만원선이다. 기존 신도시와 달리 중심업무지구가 조성돼 자족기능이 대거 확충된다. 원천호수 주변 4만9000평에 국제수준의 복합업무단지인 비즈니스 파크가 조성되고 국제회의나 산업전시회를 개최할 수 있는 컨벤션센터 5만9000평 가 들어선다. 인근에 경기도청과 도의회 등의 행정타운 3만6000평 이 조성되고 원천호수 남쪽 3만7000평에는 복합상업문화 공간인 파워센터가 프로젝트 파이낸싱 방식으로 추진된다. 국내 최초로 에듀타운을 도입해 학교와 지역사회가 소통할 수 있는 공간을 조성한 것도 특색이다. 9만3000평의 부지에 초·중·고등학교를 1개씩 건립하고 학교내 운동장 체육관 도서관과 아파트 단지내 수영장 테니스장을 개방해 학교와 주택 근린생활시설을 연계한다. 이와 함께 광교산과 원천유원지 신대저수지를 연결한 순환형 녹지축이 구축되고 광교 신도시에서 탄천을 지나 여의도까지 갈 수 있는 자전거도로가 개설된다. 신도시 교통량 처리와 서울 등과의 접근성을 높이기 위해 1조7335억원을 투입해 신분당선 연장선 11.9㎞ 1단계 사업을 2014년까지 끝내고 용인 서울간 고속도로 등 6개 도로 19.2㎞를 신설한다. 김문수 지사는 “광교를 보면 경기도가 만들고자 하는 명품 신도시의 개념이 이해될 것”이라며 “앞으로도 값 싼 명품 신도시를 지속적으로 건설하여 수도권 주민의 주거안정과 삶의 질을 개선해 나가겠다”고 말했다.,https://news.naver.com/main/read.nhn?mode=LSD&mid=shm&sid1=260&oid=086&aid=0000064760,77
57449,2007.06.27. 오후 5:25,부동산,이데일리,서광건설산업 38억원 단기차입 결정,이데일리 윤도진기자 서광건설 001600 산업은 금융기관 차입을 통해 38억원을 단기차입키로 했다고 27일 공시했다. 회사측은 차입 목적에 대해 개발사업 부지를 매입하고 이를 운영하기 위한 것 이라고 밝혔다.,https://news.naver.com/main/read.nhn?mode=LSD&mid=shm&sid1=260&oid=018&aid=0000495796,77
57450,2007.06.27. 오후 5:20,부동산,이데일리,남광토건 개성공단에 철구공장 설립,이데일리 윤도진기자 남광토건 001260 은 한국토지공사로부터 북한 개성시 봉동 개성공단 토지이용권 당첨을 통보 받았다고 27일 공시했다. 남광토건은 공단 35 7블록 4만5540.8㎡ 1만3780평 부지에 철구공장을 설립할 계획이다. 토지 분양가는 20억4900만원이다.,https://news.naver.com/main/read.nhn?mode=LSD&mid=shm&sid1=260&oid=018&aid=0000495794,77
57451,2007.06.27. 오후 5:17,부동산,매일경제,하도급 대금 깎다가…부영 시정명령 받아,공정거래위원회는 27일 하도급공사 계약을 체결하는 과정에서 입찰 후 별도 협상을 통해 하도급 대금을 깎은 부영에 대해 시정명령을 내렸다고 밝혔다. 공정위에 따르면 부영은 2005년 4월 광주광역시 아파트 신축공사를 하면서 발파공사 등 8건의 공사를 지명경쟁입찰 방식으로 발주했다. 이 과정에서 한 업체가 최저가를 제시해 낙찰을 받았다. 그러나 부영은 이 최저가에도 만족하지 못하고 낙찰업체와 다시 가격 협상을 벌여 금액을 재차 깎았다.,https://news.naver.com/main/read.nhn?mode=LSD&mid=shm&sid1=260&oid=009&aid=0000599872,77
57452,2007.06.27. 오후 5:17,부동산,매일경제,골프장 지을 농지 늘리고 9홀 골프장에도 콘도 짓게,image0 그동안 관광 레저산업 발전을 가로막았던 규제가 확 풀린다. 이르면 내년부터 골프장 수영장 등 스포츠ㆍ레저시설과 관광휴양단지를 건립할 수 있는 한계농지 정비지구 가능 면적이 현행 10만㎡ 3만평 에서 30만㎡ 9만평 이상으로 확대된다. 폐목장 용지 등 초지로 기능이 없어진 용지에도 골프장 수영장 등이 들어설 수 있게 된다. 또 현재 18홀 이상 골프장에서만 설치할 수 있었던 숙박시설이 내년부터는 9홀 이상에서도 설치할 수 있게 된다. 정부는 27일 중앙청사에서 한덕수 총리 주재로 규제개혁장관회의를 열고 관광ㆍ레저 산업 활성화를 위해 이 같은 내용을 골자로 한 규제개혁 방안을 확정했다. 정부는 우선 10만㎡ 미만으로 제한하고 있는 한계농지 정비지구 가능 면적을 30만㎡ 이상으로 확대해 이곳에 관광휴양단지와 각종 스포츠ㆍ레저시설 등을 설치할 수 있도록 할 계획이다. 정부는 연내 농어촌 정비법 시행령 을 개정해 이르면 내년부터 한계농지 정비지구 가능 면적 확대 방안을 시행할 방침이다. 정부는 현재 상수원보호구역 주변지역에 골프장과 숙박시설이 함께 들어설 경우 광역상수도보호구역에서 20㎞ 일반상수도보호구역에서 10㎞ 떨어진 곳에 숙박시설 설치가 가능하도록 연내 체육시설의 설치ㆍ이용에 관한 법률 시행령 을 고치기로 했다. 현재는 광역상수도보호구역에서 40㎞ 일반상수도보호구역에서 20㎞ 떨어지도록 제한됐다. 정부는 18홀 이상 골프장에만 설치할 수 있었던 숙박시설도 9홀 이상 골프장 내에서도 설치할 수 있도록 했다. 정부는 또 소상공인 관련 규제도 개선하기로 했다. 이와 관련해 정부는 앞으로 식당업이나 골동품 소매업 관련 소상공인도 창업 및 운영에 필요한 자금을 신용보증재단 보증으로 대출받을 수 있도록 할 방침이다. 정부는 내년부터는 전국의 시ㆍ군ㆍ구 어디에서나 조리사 면허증을 재발급받을 수 있는 방안을 추진하기로 했다. 용 어 한계농지 평균 경사율이 15% 이상이나 집단화된 농지 규모가 2만㎡ 미만으로 영농 조건이 불리해 생산성이 낮은 농지를 의미한다.,https://news.naver.com/main/read.nhn?mode=LSD&mid=shm&sid1=260&oid=009&aid=0000599868,77
57453,2007.06.27. 오후 5:07,부동산,뉴시스,진주 초전 푸르지오 1차 812세대 분양,진주 뉴시스 대우건설은 오는 29일 경남 진주시 초전동에서 견본주택 개관과 함께 진주 초전 푸르지오 총 1642세대중 1차분 812세대를 분양한다고 27일 밝혔다. 이번에 분양하는 진주 초전 푸르지오는 지하 2층 지상 28층 아파트 9개동으로 구성되며 110.08㎡ 240세대 33평형 127.56㎡ 114세대 38평형 151.99㎡ 148세대 45평형 159.43㎡ 146세대 48평형 191.79㎡ 164세대 58평형 로 이뤄져 있다. 분양가는 전체 평균 평당 739만원에서 정해질 예정이다. 청약 접수는 다음달 3일부터다. 대우건설 관계자는 “푸르지오가 건설되는 초전지구는 금성초교 동명중고교 명신고 등이 위치해 있고 경남혁신도시 건립예정지와 가까워 배후 주거단지로 주목받고 있다”며 “초전지구의 개발계획이 완료되면 진주지역의 신중심지로 변모 미래가치가 높아 질 것으로 보인다 고 말했다.,https://news.naver.com/main/read.nhn?mode=LSD&mid=shm&sid1=260&oid=003&aid=0000469294,77
57454,2007.06.27. 오후 5:06,부동산,서울경제,광교·동탄2 개발계획 확정…어디가 좋을까,광교 서울인접·교통편리 입지 우수 동탄2 분양가 평당 800만원대 매력 두곳 모두 자족형 기업도시로 개발 눈길 분양가도 주변 시세보다 싸 수요 몰릴듯 ’광교로 갈까 동탄으로 갈까 ” 수도권 남부지역이 동탄2신도시에 이어 광교신도시 개발 계획이 발표되면서 들썩이고 있다. 두 곳 모두 정부와 경기도가 국내 최고의 신도시로 만들겠다고 장담했으며 분양가도 주변 시세보다 저렴하게 공급한다고 밝혔다. 경기 남부에 보금자리를 마련하려는 수요자들이라면 두 지역 중 어느 곳을 노리는 것이 좋을까. 27일 경기지방공사와 건설교통부에 따르면 두 곳의 신도시 모두 자족형 기업도시로 만들어진다. 종전 신도시들이 주택공급에만 치우쳐 서울의 베드타운으로 전락한 문제점을 극복하기 위해서다. 광교에는 4만9 000평 부지로 조성되는 비즈니스파크에 글로벌 기업 본사와 지사 상업문화시설이 유치될 예정이다. 또한 광교테크노밸리와 인근의 아주대ㆍ경기대 등과 연계해 시너지 효과를 발휘하도록 개발한다. 동탄2신도시도 전체 면적의 15%에 해당하는 100만평을 첨단 비즈니스용지로 조성하고 인근 동탄 비즈니스파크 평택 국제화도시 산업단지 등을 연결해 산업벨트를 형성할 계획이다. 또한 두 곳 모두 다양한 형태의 문화ㆍ여가ㆍ교육시설을 만들어 신도시 내에서 모든 생활이 가능하도록 꾸민다. 입지적 여건에서 보면 광교신도시의 판정승이 예상된다. 동탄2신도시에 비해 서울 접근성이 뛰어나고 교통여건도 좋다. 박원갑 스피드뱅크 부사장은 “경기도가 명품 주거단지로 만들겠다고 천명하고 있고 서울과도 그리 멀지 않아 일부 강남 대체 효과도 있을 것 같다”고 평가했다. 동탄2신도시는 기존 1신도시와 연계해 1 000만평에 달하는 초대형 규모를 갖춘다는 점이 부각되고 있다. 하지만 경부고속도로를 사이에 두고 단절된다는 점은 지역 내 접근성을 떨어뜨릴 것이라는 우려도 제기된다. 내년 9월 첫 공급될 광교신도시 분양물량은 경쟁이 치열할 전망이다. 중소형 분양가가 1 000만 1 100만원대로 예상되는데 인근 수원 영통 용인 수지 아파트 가격의 70 80%에 불과하다. 일부에서는 ‘제2의 판교’ ‘부동산 로또’가 될 것이라는 지적이다. 동탄2신도시는 2010년 2월에 평당 800만원대 중소형 에 최초 분양되는데 가격면에서는 광교보다 저렴해 내 집 마련을 노린 실수요자라면 더욱 실속 있는 상품이 될 것으로 보인다. 하지만 구체적인 분양 방법은 나오지 않은 상황이다. 함영진 부동산써브 팀장은 “광교는 수원과 용인으로 행정구역이 구분돼 지역우선 배정물량이나 거주기간 등이 나오지 않았고 동탄은 주택공급 계획도 없어 분양을 원한다면 개발 계획을 수시로 체크해야 한다”고 말했다. 규모면에서 보면 광교가 동탄의 절반에 불과하지만 광교산 자락을 따라 형성된 녹지 비율이 전체 부지의 41.4%에 해당하고 인구밀도도 68.7명 ha로 분당 198명 일산 169명 의 절반 이하 수준으로 판교 95명 보다도 낮다. 동탄도 녹지율 30% 인구밀도 120명으로 쾌적하게 조성된다.,https://news.naver.com/main/read.nhn?mode=LSD&mid=shm&sid1=260&oid=011&aid=0000188382,77
