,date,cat,co,headline,text,url,week
26400,2006.10.04. 오전 11:41,부동산,헤럴드경제,건설빅3아파트CF 불꽃大戰,현대 추석때 집중 방영…대우도 새CF로 맞불 대우건설 삼성건설 현대건설 등 이른바 국내 건설업체 빅 3 가 추석연휴를 이용 아파트 광고전쟁 을 벌인다. 이들은 부동산경기 침체로 업계가 전반적으로 어려운 상황에서 오히려 공격적인 광고를 하고 있어 업계가 신경을 곤두세우고 있다. 4일 건설업계에 따르면 지난달 말 아파트 브랜드를 힐스테이트 Hillstate 로 정한 현대건설은 가족.친지들이 모이는 추석 연휴에 안방을 적극 공략할 계획이다. 새 브랜드 선정을 위해 2년이나 고심해 온 현대건설이 지난달 말에 브랜드 선포식을 가진 것도 추석연휴를 활용하기 위한 계산에 따른 것이다. 현대건설 관계자는 전통의 주택 명가를 재건하기 위해 아파트 브랜드를 새로선정했으며 추석 연휴를 기해 새로운 브랜드의 인지도를 크게 높인다는 전략 이라고말했다. 대우건설도 현대건설의 공세에 뒤질세라 TV CF를 새로 만들어 지난달 30일부터 안방 공략에 나섰다. 톱탤런트 김남주를 모델로 활용하고 있는 대우건설이 이번에 내 놓은 CF는 푸르지오에 사는 여자들은언제 어디에서 만나도 서로를 느낀다 는 내용이다. 대우건설 관계자는 가을시장을 겨냥해 새로운 CF를 제작했다 면서 특히 올해에는 10월이후에 분양계획이 몰려 있어 대대적인 광고전을 펼칠 계획 이라고 말했다. 대우건설은 10월 이후 연말까지 서울 강서구 방화동 구로구 고척동 성북구 하월곡동 이천시 갈산동 천안시 신방동 대전 유성구 대덕테크노밸리 부산 연제구 거제동 경북 구미시 광평동 등 8개 단지에서 총 3746가구 일반분양 2578가구 를 공급할 계획이다. 탤런트 김성수 장서희를 모델로 활용하고 있는 삼성건설은 현대건설 대우건설보다보름가량 앞선 지난달중순부터 새 TV CF를 제작해 내 보내고 있다.,https://news.naver.com/main/read.nhn?mode=LSD&mid=shm&sid1=260&oid=016&aid=0000222060,39
26401,2006.10.04. 오전 11:41,부동산,헤럴드경제,SR개발 亞건축대상 받아 中선양국제신성아파트,해외부동산개발 전문업체인 ㈜SR개발은 중국 부동산 포털사이트 소우펀 SOFUN 주최로베이징에서 열린 아시아 주택박람회 건축대상에서 중국 선양의 SR국제신성 아파트가 아시아 건축대상 아시아 국제단지 대상 등 2개 부분에서 대상을 수상했다고 4일 밝혔다. SR국제신성 아파트는 지난해 중국 CCTV로부터 2005년 가장 촉망되는 아파트 에 상하이 주택 박람회에서는 전 중국 10대 우수 단지 에 각각 선정된 바 있다. 또한 최근에는 2008년 베이징올림픽의 올림픽 선수촌 아파트로도 지정돼 주목을 끌었다. SR국제신성 아파트는 30층 타워형 최고급아파트단지로 지난달부터 2기 2200가구의 분양을 시작했고 오는 2008년 6월 700실 규모의 특급호텔을포함한 총 5484가구를 완공할 예정이다.,https://news.naver.com/main/read.nhn?mode=LSD&mid=shm&sid1=260&oid=016&aid=0000222059,39
26402,2006.10.04. 오전 11:41,부동산,헤럴드경제,중개료 10%상승 불가피 부가세 수령 합법판결,앞으로 일부 중개업자를 통해 부동산을 사고팔 때 중개수수료 외에 부가세 10%를소비자가 부담해야한다. 4일 법제처 등에 따르면 지난 7월 건설교통부가 의뢰한 유권해석에 대해 부동산중개업자가 법정 수수료를 초과하는 부가세를 수령하는 것은 법에 위반되지 않는다는 최종 판결이 내려졌다. 이에 따라 소비자들은 일반 과세자로 등록된 중개업자를 통해 앞으로 부동산을 사고팔 때 법정 수수료 외에 10%의 부가세를 추가로 내야돼 중개수수료 부담이 늘어날 전망이다. 건교부 관계자는 하지만 현재 공인중개사의 90% 이상은 연 매출 4천800만원 미만인간이 과세자로 분류돼 부가세를 면제받는 경우가 많아 실제 부가세를 소비자가 부담해야하는 중개업자는 7% 정도 라고 설명했다. 올들어 부동산 실거래가 신고가 시행되면서 중개업자의 소득이 고스란히 드러나게 되자 대한공인중개사협회 한국공인중개사협회 등 관련단체를 중심으로 법정 중개수수료 외에 별도 부가가치세를 받을 수 있도록 허용해야 한다는 주장이 제기돼 왔다. 건교부는 공인중개사가 받는 수수료 안에 부가세가 포함된 것으로 봐야 한다는 입장을 견지해오다 지난 7월 법제처에 유권해석을 의뢰한 바 있다.,https://news.naver.com/main/read.nhn?mode=LSD&mid=shm&sid1=260&oid=016&aid=0000222058,39
26403,2006.10.04. 오전 11:41,부동산,헤럴드경제,잠자는 조상땅 한번 되찾아볼까,주민번호ㆍ성명 알면 행정망 서비스 신청가능 부동산 가격 상승따라 조회ㆍ성공확률 증가세 행정자치부와 전국 250개 지자체가 시행하는 조상땅 찾아주기 서비스가 큰 호응을 얻고 있다. 각종 사고나 재난으로 토지 소유자가 갑자기 사망한 경우 또는 소유 재산에 대한 토지 소재를 알 수 없어 재산권 행사에 큰 불편을 겪고 있던 상속인 등이 편리하게 이용할 수 있기 때문이다. 하지만 일부 역기능으로 개선 여지가 있다는 주장도 제기되고 있다. 높은 호응 조회 신청 줄이어 지적 地籍 전산망이 갖춰지면서 지자체별로 1996년 1998년부터 도입한 이서비스는 신청건수가 늘고 땅을 찾는 데 성공하는 사례도 증가하고 있다. 4일 행자부와 일선 지자체에 따르면 인천시의 경우 현재까지 1617명이 조상땅 찾기를 신청 2940필지 190만평을 찾는 데 성공했다. 성남시 수정구는 총 231건을 신청해 이중 38%인 87건의 신청자가 서울 경기 등 전국에 있던 445필지 49만1000평을 찾았다. 행자부 관계자는 선대 토지에 대한 조회및 신청이 줄을 잇고 있다 며 부동산가격상승 등으로 호응도가 갈수록 높아지는 추세라고 밝혔다. 하지만 이 사업을 놓고 논란은 이어지고 있다. 일각에서는 국민의 세금으로 그것도 국가가 앞장서 친일파 후손들에게까지 땅을 손쉽게 찾을 수 있도록 도와 주고 있다며 중단을 요구하고 있다. 지난해 국정감사 자료에 따르면 민족문제연구소가 2005년8월 발표한 친일인명사전 에 수록된 사람의 후손 100여명이 2004년 한 해동안만 이 사업을 통해 전국적으로 110만여평을 찾았다. 주민번호 성명 등 모두 가능 전국 토지를 대상으로 지적정보망을 이용해 작고한 조상이나 본인 명의의 재산을 확인 열람 할 수 있는 조상땅 찾아주기 는 토지 소유자 또는 사망자의 재산 상속인이 신청할 수 있다. 상속인 경우 상속권은 공부상 등기인이 1960년 이전 사망했다면 재산상속은 장자상속으로 호주 상속인이 재산 상속인이 된다. 1961년 이후 사망자에 대한 상속은 개정 상속법에 따라 형제자매 전원이 동의한 협의분할에 의한 협의서 전원의 인감증명서 연락두절이라도 찾아야 함 전원의 주민등록등본 등을 갖춰야 상속 등기가 가능하다. 조상 땅을 주민등록번호로 찾으려면 행자부 또는 시ㆍ 도 및 시ㆍ 군ㆍ 구청 지적부서를 본인 또는 상속인이 직접 방문해 신청하면 되며 성명으로 찾고자 할 경우 조상이 토지를 소유하고 있을 것으로추정되는 시ㆍ 도를 직접 방문해 신청해야 한다. 조상땅 신청시엔 신분증을 지참하고 사망자와의 관계가 명시되고 사망신고가 등재된제적등본을 갖춰야한다. 자료를 조회할 수 있는 범위는 주민번호로는 전국의 토지를 확안할 수 있지만 성명으로는 시ㆍ 도 단위로만 검색이 가능하다. 경기도 지적과 관계자는 부부 형제 부자간 등 가족관계라 하더라도 위임장 인감증명 인감도장 없이는 절대로 정보제공이 불가능하다 며 채권확보 담보물권 확인 등이해 관계인이나 제3자에 대한 토지소유현황 조회는 공공기관의 개인정보보호에관한법률에 의해 제공이 불가능하다는 점을 유의해야 한다 고 설명했다.,https://news.naver.com/main/read.nhn?mode=LSD&mid=shm&sid1=260&oid=016&aid=0000222057,39
26404,2006.10.04. 오전 11:29,부동산,머니투데이,건교부 장·차관 추석 귀성현장 순시,머니투데이 문성일 기자 본격 추석 귀성길이 시작된 4일 건설교통부 장·차관이 잇따라 귀성 현장을 방문해 교통상황 등을 점검했다. 추병직 건설교통부장관은 이날 한국도로공사 교통정보센터 고속버스터미널 센트럴시티 등을 방문 정부합동 특별교통대책본부와 유기적 협조를 통해 이번 추석명절 고향길이 원활히 소통될 수 있도록 해 줄 것을 당부했다. 추 장관은 이 자리에서 지난 3일 발생한 서해대교상의 대형참사에 애도를 표하고 유사사고 방지를 위해 안개 등 이상기후에 대해서는 운전자들에게 신속히 관련 정보를 제공하는 한편 사고취약지점에 대한 시설물 점검과 보완을 적극 추진토록 지시했다. 김용덕 차관은 김포공항을 방문해 근무자들을 격려했다. 김 차관은 항공 특성상 조그만 부주의가 대형사고로 이어질 수 있음을 강조하고 안전사고 예방에 각별히 힘써 줄 것을 당부했다. 특히 항공에서도 서해대교 참사와 같은 유사사고 방지를 위해 기상 상황에 주의를 기울이면서 안개 등 기상악화시 운항통제를 강화하는 등 안전대책을 강구하라고 밝혔다.,https://news.naver.com/main/read.nhn?mode=LSD&mid=shm&sid1=260&oid=008&aid=0000707133,39
26405,2006.10.04. 오전 11:26,부동산,MBN,연말까지 수도권에 7만가구 공급,올 연말까지 수도권에서 아파트 7만가구가 공급돼 최근 수급불안에 따른 집값 불안을 상당부분 해소할 것으로 기대됩니다. 건설교통부는 대한주택공사와 주택건설협회 등을 통해 조사한 결과 이달부터 연말까지 수도권 110곳에서 공공부분 만3천180가구 민간 5만6천587여가구 등이 잇따라 분양된다고 밝혔습니다. 공공부문은 분양주택이 11곳에서 4천571가구 임대가 10곳에서 8천609가구가 공급됩니다. 민간부문은 서울에서 31곳 만2천422가구가 공급되는 것을 비롯해 경기도 53곳 3만9천499가구 인천 5곳 4천666가구가 각각 분양됩니다.,https://news.naver.com/main/read.nhn?mode=LSD&mid=shm&sid1=260&oid=019&aid=0000157311,39
26406,2006.10.04. 오전 11:23,부동산,머니투데이,기고용산 생태가족공원,머니투데이 문국현 유한킴벌리 대표이사 세계에서 가장 살기 좋고 경쟁력이 높은 도시들은 주로 유럽과 북미에 많다. 취리히 밴쿠버 시애틀 샌프란시스코 뉴욕 보스턴 등 수많은 도시들이 세계 최고를 향해 선의의 경쟁을 하고 있다. 이런 세계적인 도시들은 오랜 역사와 문화를 가지고 있으면서도 끊임없이 진화하고 있다. 이런 도시들은 무엇보다 도시의 디자인이 다르다. 우선 1인당 생활권 공원 면적이 우리 서울의 3배∼6배에 이르고 녹지 등 공공용지가 차지하는 면적이 도시 전체의 35% 안팎이나 돼서 도시의 색깔이 다르고 기후가 다르며 대기의 맛이 다를 뿐 아니라 석양의 빛깔과 소리도 다르다. 둘째 세계적인 경쟁력을 갖춘 도시들에서는 직·주·상·학·원이 복합·근접 배치되는 설계를 채택해 자동차 이용을 최소화하고 보행자와 자전거 이용의 편의를 극대화하고 있다. 셋째 이런 세계적 도시 전역 곳곳에서는 천 여 개의 작은 근린공원들이 있고 주요 다핵 도심 역할을 하는 거점 지역에는 100만 평 안팎의 대규모 생태 가족공원을 대여섯 개씩 가지고 있다. 이런 크고 작은 공원들은 100여 킬로미터가 넘는 도시 숲길 Greenways 녹지 축 로 때로는 일직선 선형 Linear 으로 환상형 Web 으로 일일이 다 연계돼 거의 모든 가정에서 걸어서 250미터 안팎의 거리에 아름다운 숲길과 시민들을 생명력과 치유력이 넘치는 대규모 생태가족공원으로 인도하도록 설계돼 있는 것이다. 일례로 밴쿠버에는 200만 평이 넘는 아시아 정신 공원 Pacific Spirit Park 과 100만평이 넘는 스탠리 파크 구 영국군 기지 잉글리시 베이 엘리자베스 파크 센트럴 파크 등 아름다운 숲공원이나 해변공원이 즐비하다. 특히 이 공원들을 잇는 수백 킬로미터의 도시숲길 그린웨이 이 거미줄처럼 밴쿠버시 전역을 연결하고 있어 밴쿠버를 세계에서 가장 살기 좋은 도시로 선정되는데 결정적인 역할을 하고 있다. 뉴욕이나 보스턴에 가면 거대한 중앙공원과 거점별 대규모 생태가족공원과 일직선 선형공원이 연계돼 있는 환상형 고리형 도시숲길이 세계적 이목을 끈다. 150년 전에 천재 공원설계가 프레데릭 옴스테드가 만든 맨해턴의 102만평 센트럴 파크는 뉴욕의 경쟁력이다. 옴스테드의 2번째 작품인 프로스펙트 공원도 70만평이 더 되고 그 아름다움이란 센트럴 파크를 앞선다. 이런 뉴욕에 배터리 파크를 따라 허드슨 강을 따라 수십 킬로미터의 선형 공원이 늘어나면서 뉴욕은 이제 그린웨이가 즐비한 박물관만큼이나 명물이 되어가고 있다. 150년 전 옴스테드가 설계한 보스턴의 에메랄드 네크리스 환상형 그린웨이와 최근 보강되고 있는 사파이어 네크리스 수변공원 벨트는 보스턴의 긍지다. 서울이 세계적 도시로 거듭나기 위해서는 600년 천년을 거슬러 올라가는 세계적 문화유산을 잘 계승 발전시켜나가는 한편 서울을 녹·청색 환경도시로 발전시켜 나가야 한다. 푸른 숲과 파란 하늘과 맑은 물을 가진 생명력 높은 도시가 돼야 한다. 이렇게 되기 위해서는 생활권에 공원과 녹지가 최소한 2000만평 이상 늘어야 한다. 상하이 수준이다. 서울 도심 한복판을 흐르는 한강과 30여개 크고 작은 샛강변에는 보스턴의 사파이어 네크리스처럼 수변 공원 벨트가 완성되고 용산 남산 응봉산 뚝섬의 서울숲을 잇는 서울의 첫 ‘에메랄드 네크리스’가 완성되면 우리 서울은 한국의 수도에서 아시아의 수도로 도약하는 대 전기가 될 것이다. 용산 미군기지는 82만평 전부가 100% 생태가족 중앙공원이 돼 천만 서울시민과 7천만 겨레의 치유의 숲 생명의 숲 희망의 숲으로 다시 태어나야만 한다.,https://news.naver.com/main/read.nhn?mode=LSD&mid=shm&sid1=260&oid=008&aid=0000707131,39
26407,2006.10.04. 오전 11:16,부동산,노컷뉴스,토공이 땅장사…신도시 평당 44만원 매입 480만원에 되팔아,정부 택지비 산정방식 논란…보상비 포함 조성원가보다 최고 10배이상 부풀려 한국토지공사등이 분양하는 공공택지 가격이 사업초기 땅주인들에게 사들인 수용가보다 최고 10배나 비싼 것으로 조사됐다. 한국토지공사는 경기도 화성 동탄신도시를 조성하면서 토지 원소유자로부터 평당 44만원에 토지를 매입한 뒤 민간 시행업자에게 평당 151만원에서 479만원에 매각한 것으로 드러났다. 조성원가는 평당 268만원이며 분양시 용적률을 감안한 분양가 중 택지비는 126만원에서 266만원이었다. 성남 판교신도시 조성에 참여한 한국토지공사와 성남시 주공 경기도 등 4개 사업시행자의 토지수용비는 평당 130만원이었고 보상비를 포함한 조성원가는 743만원으로 나타났다. 하지만 이들 시행기관은 지난 3월 중소형 주택분양업체에 평당 450만원에서 960만원에 땅을 팔았다. 분양가에서 택지비 비중은 472만원에서 710만원이었다. 이들 두개 신도시의 토지수용비 총액은 판교가 3조6천여억원 화성 동탄이 1조2천여억원이며 조성원가는 판교 7조9천여억원 동탄은 3조7천여억원으로 확인됐다. 이때문에 시민단체들은 정부가 분양원가 공개범위를 확대하더라도 현재의 택지비 산정방식을 바꾸지 않는 한 큰 효과가 없다고 주장하고 있다. 경실련 시민감시국 윤순철 국장은 토지를 싸게 수용해서 비싸게 팔기 때문에 분양원가 공개 확대나 후분양제를 실시하더라고 분양가 인하 효과는 크게 없을 것으로 보인다 고 지적했다. 분양원가 공개 논쟁이 한창인 가운데 정부가 분양가를 낮추기 위해 어떤 노력을 기울여야할 지 곰곰히 생각해봐야 할 것으로 보인다.,https://news.naver.com/main/read.nhn?mode=LSD&mid=shm&sid1=260&oid=079&aid=0000111822,39
26408,2006.10.04. 오전 11:02,부동산,MBN,아파트 평균가 평당 700만원 돌파,전국 아파트의 평당 평균가격이 700만원을 넘어섰습니다. 종합부동산회사 부동산써브가 전국 만3천여개단지를 대상으로 아파트 시세를 조사한 결과 평당 평균가격은 700만3천원으로 나타났습니다. 이는 2004년 3월말 평당 600만원대에 올라선 이후 2년 6개월만에 100만원이 오른 것입니다. 지역별로는 서울시가 천399만원으로 전국 평균의 2배였고 분당과 일산 등 5대신도시도 천203만원을 기록했습니다. 기초단체별로는 서울 강남구가 3천136만원으로 전국에서 가장 높았고 과천시가 3천20만원 서초구 2천478만원 송파구 2천211만원의 순이었습니다.,https://news.naver.com/main/read.nhn?mode=LSD&mid=shm&sid1=260&oid=019&aid=0000157299,39
26409,2006.10.04. 오전 11:01,부동산,연합뉴스,10월 이후 연말까지 수도권에서 7만가구 공급,서울 연합뉴스 유경수기자 10월부터 연말까지 수도권에서 아파트 7만가구가 공급돼 최근 수급불안에 따른 집값 불안을 상당부분 해소할 것으로 기대된다. 4일 건설교통부가 대한주택공사 SH공사 한국주택건설협회 지자체 등을 통해 조사한 결과 10 12월중 수도권 110곳에서 공공부분 1만3천180가구 민간 5만6천587여가구 등이 잇따라 분양된다. 공공부문은 분양 11곳 임대 10곳에서 분양주택 4천571가구 임대 8천609가구를 쏟아내며 민간은 서울 31곳에서 1만2천422가구 경기 53곳에서 3만9천499가구 인천 5곳에서 4천666가구를 각각 분양할 예정이다. 1천가구가 넘는 민간부문의 대단지만도 서울 은평구 불광동 현대건설 1천143가구 인천 남동구 소래 논현지역 11 12블록의 한화건설 2천916가구 인천 연수구 동춘동 포스코건설 1천346가구 오산시 양산동의 대림산업 1천842가구 파주 운정지구의 삼부토건 1천978가구 용인 동천도시개발구역의 삼성물산 2천515가구 파주 교하지구의 벽산건설 2천504가구 등 16곳이나 된다. 강남권에서는 현대산업개발이 고덕동에서 780가구 롯데건설이 서초구 잠원동에서 554가구 등 2천여가구가 재건축 도급 사업으로 공급된다. 공공부문에서는 성남 도촌 408가구 의왕 청계 612가구 인천 송도 589가구 용인구성 6 7블록 765가구 고양 행신 584가구 용인 흥덕 502가구 등이 관심을 끌 만하다. 국민임대주택은 화성봉담에서 10월과 12월 두차례에 걸쳐 2천859가구가 공급되는 것을 비롯 고양 풍동 1천19가구 용인구성 1천101가구 부천 여월 1천825가구 남양주 가운 1천805가구 에서 적잖은 물량이 쏟아져 나온다. 건교부는 4분기에는 서울을 비롯 파주 신도시 화성 동탄 용인 등 인기택지에서의 물량이 많이 나올 예정이어서 최근 불안 조짐을 보이고 있는 수도권 집값 전셋값 안정에 크게 기여할 것으로 기대된다 고 말했다.,https://news.naver.com/main/read.nhn?mode=LSD&mid=shm&sid1=260&oid=001&aid=0001428432,39
26410,2006.10.04. 오전 11:00,부동산,머니투데이,연말까지 수도권서 7만여가구 공급,머니투데이 문성일 기자 이달 이후 올 연말까지 수도권에서 약 7만여가구의 주택이 공급될 것으로 보인다. 4일 건설교통부에 따르면 대한주택공사와 SH공사 옛 서울시 도시개발공사 등 공공부문이 10월부터 12월까지 4 4분기 동안 수도권 21개 지역에서 1만3100가구의 주택을 분양할 예정이다. 이 가운데 분양은 11개 단지 4500가구이며 나머지 10곳은 임대주택 8600가구다. 이어 민간부문은 89곳에서 5만6587가구가 선보일 계획이다. 지역별로는 서울이 31개 사업장에서 1만2422가구가 공급되며 인천의 경우 5곳에서 4666가구가 공급된다. 경기지역의 경우 모두 53개 단지에서 3만9499가구가 올 12월 말까지 분양에 나선다. 민간주택의 경우 월별로는 이달에는 서울 3054가구 인천 2916가구 경기 1만5276가구 등 모두 2만1246가구가 공급된다. 이어 11월에는 서울 3179가구 인천 200가구 경기 8535가구 등 1만1914가구가 일반에 공개된다. 12월에는 서울 5819가구를 비롯해 인천 1346가구 경기 1만4663가구 등 총 2만1828가구가 분양된다. 나머지 1599가구는 일정이 확정되지 않았다. 민간주택 가운데 1000가구를 넘는 대단지는 16곳에 이른다. 서울에서는 오는 11월 공급될 예정인 현대건설의 은평구 불광동 힐스테이트 가 1143가구 규모의 대단지로 구성된다. 삼성물산 건설부문이 올 12월 선보일 계획인 강북구 미아동 래미안 도 단지 규모가 1035가구 26 44평형 에 달한다. 인천에서는 한화건설이 남동구 소래논현지구에서 1618가구와 1298가구를 각각 이달 중 공급한다. 12월에는 포스코건설이 연수구 동춘동에서 1346가구 규모를 분양한다. 경기지역의 경우 대림산업이 이달 중 오산시 양산동에서 1842가구를 공급하고 삼부토건은 파주신도시에서 1978가구를 역시 10월 중 공급할 계획이다. 포스코건설도 화성 동탄신도시에서 1266가구를 분양한다. 삼성물산과 GS건설은 공동으로 광명 철산동에서 재건축을 통해 2072가구를 공급한다. 대우건설도 같은 지역에서 11월 중 1000가구 규모의 재건축 단지를 선보인다. 벽산건설은 2004가구 규모의 파주 교하지구 물량을 11월에 분양하고 현대산업개발은 안양시 석수동에서 1134가구로 구성되는 재건축아파트를 공개한다. 이어 12월에는 동문건설이 고양시 덕이동에서 2270가구를 동양건설산업이 남양주시 호평동에서 1388가구를 각각 공급한다. 벽산건설과 삼성물산도 같은 달 고양시 일산동구 식사동과 용인 동천지구에서 각각 2735가구와 2515가구를 분양할 예정이다.,https://news.naver.com/main/read.nhn?mode=LSD&mid=shm&sid1=260&oid=008&aid=0000707118,39
