,date,cat,co,headline,text,url,week
126764,2009.03.09. 오전 10:57,부동산,아시아경제,3000억 규모 DDP 시공사 쌍용건설 유력,옛 동대문운장 터에 조성될 동대문디자인플라자 파크 DDP 시공사로 쌍용건설이 가장 유력한 것으로 알려졌다. 최저가 입찰 방식으로 진행된 이번 입찰에서 GS건설이 가장 낮은 금액을 써내긴 했지만 부적격자로 1차 심사를 통과하지 못해 다음으로 가격이 낮은 금액을 써낸 쌍용건설이 유력한 후보로 떠오르고 있다. 9일 서울시와 조달청에 따르면 지난 6일 진행된 3002억원 예정가 규모의 DDP 입찰에 현대건설 SK건설 GS건설 삼성물산 대우건설 태영건설 롯데건설 현대산업개발 대림산업 쌍용건설 동양건설 풍림산업 한일건설 계룡건설 화성산업 등 총 15개 건설업체가 참여했다. 최저가 입찰 방식으로 진행된 이번 입찰에서 가장 낮은 금액을 제시한 건설사는 GS건설이다. 금액은 2098억원으로 투찰율 예정가 대비 입찰가 70% 정도다. 다음으로 쌍용건설 2230억원 현대산업개발 2239억원 삼성물산 2240억원 태영건설 2252억원 현대건설 2261억원 대림산업 2268억원 등의 순으로 투찰율 74 75% 정도다. 가장 높은 금액을 제시한 곳은 계룡건설로 2437억원 투찰율 81% 을 제시했다. 통상적으로 조달청은 입찰시 투찰율이 80% 이하면 부실공사를 우려해 1차적으로 적정섬 심사를 실시한다. 이 과정에서 가장 낮은 금액을 제시한 GS건설과 현대산업개발이 제외됐다. 조달청 관계자는 입찰시 제출한 서류를 바탕으로 컴퓨터가 자동으로 점수를 환산하는데 일정 점수에 미달되면 2차 심사 전에 제외된다 며 공정이 30 40개에 이르다 보니 건설사들의 제출 서류가 미흡한 경우가 종종 있다 고 설명했다. 이에 따라 2차 심사에는 GS건설과 현대산업개발을 제외한 쌍용건설 삼성물산 태영건설 현대건설 대림산업 등 입찰 가격이 낮은 순으로 5개 업체가 우선적으로 이름을 올렸다. 이 중 가장 낮은 금액을 제시한 쌍용건설이 큰 하자가 없는 한 시공사 선정에 있어 유력한 것으로 보인다. 2차 심사는 9명으로 구성된 심사위원들이 제출 서류들을 바탕으로 직접 심사를 하게된다. 열흘 정도의 심사가 진행된 후 다음주 중순 정도면 최종 낙찰자가 가려질 것으로 보인다. 최종 낙찰자로 선정되면 DDP 발추처인 서울시와 오는 31일 본 계약을 체결하게 된다. DDP는 서울시가 세계 디자인사언 중심지로 발돋움하기 위해 건립을 추진해온 복합단지로 서울 중구 을지로7가 2 1번지 일대 6만2957㎡ 부지에 지하3층 지상4층 전체면적 8만3024㎡ 규모로 오는 2011년 준공될 예정이다.,https://news.naver.com/main/read.nhn?mode=LSD&mid=shm&sid1=260&oid=277&aid=0002116323,166
126765,2009.03.09. 오전 10:56,부동산,이데일리,주공 아파트공사 72곳 8만가구 발주,이데일리 박성호기자 대한주택공사는 올해 아파트 건설공사 발주물량을 작년 6만9000가구 대비 17% 증가한 72개 지구 총 8만855가구로 확정했다고 9일 밝혔다. 당장 3월 중에는 수원광교 국민임대주택 375가구를 비롯해 14개지구에서 총 7860가구가 발주될 예정이며 2분기에는 파주운정지구 1564가구 의정부민락2지구 2377가구 등 20개지구 2만2800가구가 발주를 기다리고 있다. 3분기에는 경기도 김포양촌지구 3810가구 등 21개지구 총 2만6545가구 4분기에는 17개지구 총 2만3771가구가 발주될 계획이다. 주공은 이와는 별도로 경기도 군포시 송정지구 충남 공주시 월송지구 대지조성공사 발주를 오는 5월 실시하는 등 11개 대지조성공사도 발주키로 했다. 이와함께 주공은 올해 104개 지구 9만3470가구의 설계수행계획도 앞당겨 수립해 외주용역 설계비 1600여억원 집행을 예년보다 한 달 정도 앞당기기로 했다. 이를 통해 설계사무소를 비롯한 엔지니어링 업체의 자금 확보에 큰 도움이 될 것으로 주공은 기대했다. 박천필 주공 재무처장은 건설경기 침체로 어려움을 겪고 있는 건설업체를 돕고 정부의 경기 활성화 정책에 부응키 위해 발주규모를 확대해 집행하게 됐다 고 설명했다. 지구별 건설공사 발주계획 등 자세한 내용은 주공 조달시스템 hp ebid.jugong.co.kr 을 통해 확인할 수 있다.,https://news.naver.com/main/read.nhn?mode=LSD&mid=shm&sid1=260&oid=018&aid=0002081520,166
126766,2009.03.09. 오전 10:46,부동산,헤럴드경제,신창건설 법정관리 신청,대한주택건설협회장이 대표… 파장 클듯 중견건설업체인 신창건설 대표 김영수 이 최근 법정관리를 신청했다. 신창건설은 지난 3일 수원지방법원에 법정관리를 신청해 지난 6일 법원으로부터 보존처분 중지명령을 받았다고 9일 밝혔다. 신창건설은 주택전문 중견 건설업체들의 연합체인 대한주택건설협회 김영수 회장이 대표를 맡고 있다는 점에서 적지않은 파장이 예상된다. 신창건설 관계자는 “건설경기 침체에 따라 미분양이 증가했고 유동성 문제가 불거지면서 결국 법정관리를 신청하게 됐다”며 “경영 정상화를 위해 최선을 다할 것”이라고 말했다. 신창건설은 지난 2월 대주단 신용도 평가에서 B등급을 받아 자금 수준이 다소 양호하다는 판단을 받았지만 불과 두달만에 법정관리를 신청하게 돼 다른 B등급 건설사들의 자금상태에도 회의적인 시각이 확산될 전망이다. 신창건설은 1984년 설립됐으며 시공능력평가 90위의 주택전문건설업체다. 1993년 용인 동아 아파트 202가구 준공을 시작으로 1994년 1995년 각각 건축과 토목 면허를 취득했다. 1990년대 다섯 차례의 증자를 통해 자본금 70억원을 확보한 뒤 주택사업에 집중하다 2006년 경남 양산 물금에 1248가구의 ‘비바패밀리’를 처음으로 선보였다. 이후 2007년 성남 판교 광명 소하 등 굵직한 아파트 건설을 맡았고 같은 해 남극 세종기지 대수선 및 증축공사를 수주하기도 했다. 지난 해에도 수원 망포 파주 운정 화성 봉담 등에도 활발하게 주택을 공급했고 러시아와 해외계약을 달성하기도 했다. 현재 수원 영통 망포동 378가구 대구 동구 율하1지구에 902가구의 아파트를 성동구 용답동에 상가를 분양 중이다. 신창건설은 2005년 금탑산업훈장을 수훈하기도 했다.,https://news.naver.com/main/read.nhn?mode=LSD&mid=shm&sid1=260&oid=016&aid=0000297733,166
126767,2009.03.09. 오전 10:46,부동산,이데일리,신창 비바패밀리 3200가구 입주지연 불가피,자체 4곳 1608가구..도급 4곳 1626가구 이데일리 윤도진기자 신창건설이 수원지법에 기업회생절차 옛 법정관리 개시신청을 함에 따라 이 회사가 짓고 있는 3200여가구 아파트의 입주 지연이 불가피해졌다. 9일 대한주택보증에 따르면 신창건설이 짓고 있는 아파트 사업장은 7곳 3234가구이다.주택보증의 보증금액은 총 6064억원이다. 이 가운데 시행과 시공을 함께 맡고 있는 자체사업장은 4개 단지 1608가구이며 도급사업장은 4개 단지 1626가구다. 자체사업장 가운데 경기도 동두천 동두천역 신창 비바패밀리 1 3차 409가구 76가구 221가구 의 경우 100% 분양을 완료한 상태. 올 9월말 입주를 앞두고 공정률 70%를 기록 중이다. 내년 4월말 입주를 앞둔 902가구 규모의 대구 동구 율하동 신창비바패밀리의 경우 분양률이 30%에 그친 상태로 공정률도 10%를 채우지 못하고 있다. 시공사업장 중에서는 올 5월 준공 예정인 경남 양산 물금지구 아파트가 80%의 공정률을 보이고 있지만 전체 1248가구 중 40% 이상이 미분양 상태다. 수원 망포동의 2개 단지 236가구 142가구 도 분양률이 한 자릿수에 그치는 것으로 파악됐다. 주택보증은 건설사가 부도 날 경우 해당 사업장을 사고처리해 보증사고가 난 날로부터 3개월안에 보증이행 분양이행 환급이행 방식을 결정한다. 다만 부도 회사가 회생절차 개시를 신청한 경우에는 개시결정 등의 결과를 감안해야 하기 때문에 보증이행방식 결정이 사고일로부터 6개월까지로 연장된다. 주택보증 관계자는 분양보증에 가입한 아파트라면 계약자들이 납부한 중도금을 떼일 염려는 하지 않아도 된다 며 다만 기업회생 절차가 진행되는 과정에서 분양이행시 시공사 교체 등에 따른 입주 지연이 불가피하고 환급이행의 경우 발코니 확장·옵션 비용 등을 돌려받지 못할 수 있다 고 설명했다.,https://news.naver.com/main/read.nhn?mode=LSD&mid=shm&sid1=260&oid=018&aid=0002081514,166
126768,2009.03.09. 오전 10:46,부동산,아시아경제,엄마야 누나야 강변살자 프로젝트 아시나요,江 경제성장의 핏줄 막오른 서해시대 친환경 레저공간·미디어 복합도시.. 경기도 핵심사업 하천정비 넘어선 단절된 한강연결.. 역사문화의 새장 경기도 여주군 능서면 백석리 남한강변. 이곳 1.2㎞구간은 강바닥보다 무려 6∼7m정도 모래가 퇴적돼 있다. 홍수 때 많은 물을 하류로 보내는 유용한 소통로가 이처럼 퇴적돼 제기능을 못하고 있다. 이로인해 지난 2006년 7월 어느날 여주주민들은 대피령이 내려질까 조마조마한 마음으로 밤잠을 설치며 남한강변에 나와 강수위를 지켜봐야 했다. 강 건너편의 논밭은 이미 침수됐고 마을은 집앞까지 물이 차올라 대피령이 내려졌다. 남한강유역에만 7월 한달동안 900㎜의 집중호우가 내려 물이 3배 가까이 불어났다. 경기 여주지역과 한강하류도 금방 집어삼킬 것만 같았다. 이곳은 조선시대부터 근대까지 이천·여주쌀로 유명한 곡창지대였지만 여름철만되면 집중호우에 맥을 못춘다. 다섯개의 댐이 홍수피해를 단계적으로 줄여주는 북한강에 비해 남한강 유역은 충주탬에만 의지할수밖에 없어 홍수에 취약하다. 이에 따라 경기도는 남한강 권역과 북한강권역에 쌓인 토사를 정비해저류지 공간을 확보하는 등 물길을 정비하고 주변을 문화·예술 체험관광지로 개발할 계획이다. 우선 남한강 권역에는 이포나루 등 6개 포구와 나루가 옛모습을 되찾고 주변에 한옥마을이 조성된다. 특히 친수여가활동을 즐길 수 있도록 워터프런트 레포츠시설과 요트 마리나 등 레저시설 등이 들어선다. 북한강 권역은 친환경 휴식과 레저 공간을 테마로 한 각종 사업이 펼쳐진다. 가평군 대성리 일원이 관광지로 탈바꿈하고 남양주 덕소·삼패지구의 내재된 관광자원도 상품화된다. 하남 미사리일대 선사유적지는 관광명소로 개발된다. 이밖에 한강하구에는 김포 고천면 향산리·걸포동 일원에 첨단영상산업단지인 ‘한강시네폴리스’가 들어서고 고양시 덕양구 덕은동 일원에는 방송영상미디어 중심 자족형 국제복합도시가 들어선다. 경기도는 특히 김포시 하성면 봉성리·전류리 일원에는 요트계류장을 설치해 50척이상이 계류할 수 있도록할 계획이다. 또 동북아 물류 비즈니시 중심의 해상교통체계를 구축하기 위해 자유로 이산포IC인근에 이산포터미널을 설치해 치수안전성 확보 및 한강하구 하천 생태환경을 개선할 계획이다. 여기에 24개 시·군에 걸친 398㎞의 자전거도로도 조성된다. 경기도는 이같은 한강잇기 등 6대기본방향에 20대분양 152개 사업을 한데 묶은 ‘강변살자’ 프로젝트를 진행한다. ‘강변살자’프로젝트는 한강 본류 양평 양수리∼한강 하구 와 남한강 여주·이천∼양주 양수리 북한강 가평∼양수리 3개 권역으로 나눠 추진된다. 경기도는 이 사업에 들어갈 20조9000여억원은 국비와 민자를 적극적으로 유치해 조달할 계획이다. 이재율 경기도 기획조정실장은 “단순한 하천정비 수준을 넘어 단절된 한강을 남북으로 잇고 세계로 소통하며 역사와 문화가 흐르는 공간으로 만들 계획”이라고 말했다.,https://news.naver.com/main/read.nhn?mode=LSD&mid=shm&sid1=260&oid=277&aid=0002116305,166
126769,2009.03.09. 오전 10:45,부동산,아시아경제,먹거리·일자리 새 물길여는 한강 르네상스,여의도 국제금융업무지구 조감도 江 경제성장의 핏줄 막오른 서해시대 경인운하 공사로 수변도시 탄생 앞당겨 여객·물류 뱃길연결.. 지역경제 활성화 한강 물잇기 사업에 22조8800억원 투자 나루터·포구복원.. 연계 관광상품 개발 용산에서 출발한 5000t급 국제여객선이 경인운하를 통해 중국 톈진 天津 으로 항해한다. 한강을 가로질러 서해로 향하는 뱃길에서 바라본 여의도 한강공원 샛강 생태공원에는 축체가 한창이고 그 옆 광역여객선착장에는 배를 기다리는 시민들이 줄을 서 있다. 생태공원 안쪽에는 물빛광장이 펼쳐져 있고 국제금융업무지구로 조성된 여의도에 펼쳐진 마천루는 장관을 연출한다. 경인운하로 접어드는 길목에 있는 마곡지구 워터프론트에는 초고층 호텔과 컨벤션센터가 위용을 자랑하고 마곡 호수공원 요트마리나에는 요트를 정박해두고 한가로운 주말을 보내는 시민들로 북적인다. 마곡워터프론트 조감도 미래도시의 모습이 아니다. 10여년 후 한강에서 바라본 서울 도심은 강산의 변화를 실감케한다. 이르면 2012년 한강에서 서해로 이어지는 뱃길이 열리고 한강이 동북아 관광ㆍ문화ㆍ물류 거점으로 다시 태어난다. 또 한강은 서울시가 추진하는 한강르네상스와 맞물려 문화와 생태환경이 어우러진 수변공간으로 재탄생한다. 서울시는 올해 2조3427억원 규모의 추가경정예산안을 편성하고 이중 1조3452억원을 SOC 사회간접자본 등 주요투자사업에 배정했다. 여기에는 서해연결 한강주운 사업 한강나들목 조기완공 사업 등 한강르네상스 프로젝트 예산도 포함돼 있다. 이달 말 시작되는 경인운하 굴포천방수로 연결공사로 한강 뱃길 복원은 더 빨라진다. 2010년이면 한강 하류와 방수로가 연결돼 이곳을 통해 여객과 물류기능을 갖춘 4000t급 선박 운항이 가능해진다. 경기도도 한강 하류 김포와 남한강변 등지의 나룻터와 포구 복원에 나설 계획이다. ◇ 경인운하ㆍ한강르네상스로 서해 시대 개막 한강 뱃길 복원 사업은 서울시와 인천 경기도 등 수도권의 숙원 사업이다. 지난 달에는 3개 시도지사가 만나 경인운하와 연계된 사업 추진에 대한 적극적인 협력 의사를 밝히기도 했다. 각 지자체마다 조금씩 다른 사업의 물줄기가 한강 이라는 젖줄 로 하나로 통하는 셈이다. 서울시는 한강르네상스 프로젝트가 인천시는 인천터미널 및 인천항 재개발 사업이 경기도는 김포한강신도시와 이산포 물류터미널 설치 등 사업이 탄력을 받아 지역경제 살리기에 기여할 것으로 기대하고 있다. 모두 경인운하를 통해서 가능한 일이다. 오세훈 서울시장은 지난 1월 경인운하가 완공되는 시기에 맞춰 용산 국제여객터미널을 완공할 필요가 있다 며 서해 뱃길 복원사업이 포함된 한강르네상스 프로젝트에 속도를 낼 뜻을 밝혔다. 서울시는 오는 4월께 주운 舟運 사업 에 관한 최종 용역보고서가 나오면 사업 착수를 위한 실시설계를 추진하고 조기착공에 나선다는 계획이다. 첨단영상산업단지 김포 시네폴리스 조감도 준공시기도 당초 목표로 잡았던 2015년보다 2∼3년 가량 앞당겨진다. 사업이 완료되면 한강에서 경인운하를 이용해 서해로 최대 5000t급의 국제여객선이 드나들 수 있게 된다. ◇ 복원된 물길이 먹거리ㆍ일자리 만든다 경기도는 한강 물길잇기 사업에 22조8800억원을 투자할 계획이다. 이름하여 경기도 강변살자 프로젝트. 이미 1조9831억원의 예산이 투입됐고 올해와 내년에만 추가로 6조원이 더 투자된다. 이중에서 뱃길과 관련된 사업에 3조8000억원이 쓰인다. 경기도는 한강 하류 이산포에 해상터널을 설치에 물류기능을 확대하고 김포에는 환 環 황해권 해상교통과 연계한 첨단 영상산업단지 클러스터도 조성할 계획이다. 바다로 열린 물길로 일자리가 만들어진다. 본격적인 사업 착수는 내년부터다. 또 한강하구와 북한강 남한강변에 68개소의 나룻터와 포구를 복원할 예정이다. 강을 따라 복원된 나룻터와 포구로 인근 관광지와 연계된 관광상품이 개발되고 여기서 또 한번 먹거리가 생긴다.,https://news.naver.com/main/read.nhn?mode=LSD&mid=shm&sid1=260&oid=277&aid=0002116304,166
126770,2009.03.09. 오전 10:41,부동산,머니투데이,국토부 대물변제 아파트 지원 어렵다,머니투데이 문성일 기자 건설 하도급업체가 원도급사로부터 공사대금 대신 떠넘겨 받은 대물변제 아파트에 대한 정부의 지원이 어려울 것으로 보인다. 국토해양부는 지난 8일 당정이 하도급업체들이 공사대금 대신 떠안은 미분양아파트를 매입하는 방안을 추진키로 한 것과 관련 효과가 별로 없는데다 법적으로도 쉽게 해결할 수 있는 문제가 아니라며 난색을 표했다. 국토부 관계자는 전문건설협회 등으로부터 대물변제 아파트 매입건의가 있어 검토한 것은 있지만 이를 실제 매입하는 것은 사실 관계 규명이 쉽지 않은 일 이라고 말했다. 이 관계자는 이어 불법 대물변제를 전제로 해당 원도급사 등을 처벌해야 하지만 실사에 들어갈 경우 정작 해당 하도급업체조차 이를 인정하지 못하는 사례가 빈번할 것 이라고 덧붙였다. 앞서 당정은 하도급업체가 원청사로부터 건설비 대신 지급받은 미분양 아파트 가운데 불법 대물변제 물건을 제외한 아파트에 대해 정부가 매입해 주는 방안을 검토하겠다고 밝혔다.,https://news.naver.com/main/read.nhn?mode=LSD&mid=shm&sid1=260&oid=008&aid=0002113912,166
126771,2009.03.09. 오전 10:40,부동산,이데일리,영덕오산간 도로 10일 개통,오산시 부산동 청명IC구간 11.5km 개통 나머지는 7월 개통 이데일리 김자영기자 한국토지공사는 오는 10일 동탄신도시 광역교통개선대책의 일환으로 영덕 오산간 광역도로 총 13.8km 노선 중 일부를 조기개통한다고 9일 밝혔다. 자료제공 한국토지공사 이번에 개통되는 구간은 영덕 오산간 광역도로 전체 구간 중 11.5km인 오산시 부산동 청명IC구간이며 나머지 2.3km는 올 7월에 개통된다. 이 도로는 동탄신도시 일대 교통을 개선시키기 위해 계획된 것으로 지난 2006년 12월 착공했다. 오는 6월 공사가 마무리되는 이 도로는 영덕 양재 현재 용인 서울간 고속도로 노선의 연장선이다. 개통되는 구간은 기존 지방도 317호선 4.9km 구간을 4 6차로에서 6 8차로로 넓히고 신설되는 311호선 8.9km 구간은 자동차전용도로에 준하는 고속국도로 개통된다. 또 이 도로는 청명IC와 흥덕IC 등에서 진출입이 가능하다. 이 공사의 총사업비는 8280억원으로 토지공사가 사업비를 전액 부담한 뒤 지자체에 무상으로 기증할 예정이다. 토지공사는 이번 도로개통으로 오산에서 서울 강남까지 지금보다 30분이상 단축될 것으로 보고 있다.,https://news.naver.com/main/read.nhn?mode=LSD&mid=shm&sid1=260&oid=018&aid=0002081511,166
126772,2009.03.09. 오전 10:35,부동산,머니투데이,신창건설 분양보증 3234가구 6064억 달해,머니투데이 이군호 기자 기업회생절차 옛 법정관리 개시를 신청한 신창건설이 분양보증을 받은 사업장이 총 3234가구 6064억원에 달하는 것으로 나타났다. 9일 대한주택보증에 따르면 신창건설이 현재 추진 중인 사업장은 시행사업장 1608가구 2231억원 시공사업장 1626가구 3833억원에 달한다. 시행사업장은 동두천역 신창비바패밀리 409가구 동두천역 신창비바패밀리 2단지 76가구 동두천역 신창비바패밀리 3단지 221가구 대구 율하역 신창비바패밀리 902가구 등이다. 동두천역 사업장은 분양률이 모두 100%지만 대구 사업장은 30%에 불과하다. 시공사업장은 양산 물금지구 신창 비바패밀리 1248가구 수원 망포동 신창비바패밀리 1단지 236가구 수원 망포동 신창비바패밀리 2단지 142가구 등이다. 분양률은 양산사업장 58% 수원 망포 1단지 5% 수원 망포 2단지 2.5% 등이다.,https://news.naver.com/main/read.nhn?mode=LSD&mid=shm&sid1=260&oid=008&aid=0002113904,166
126773,2009.03.09. 오전 10:32,부동산,경향신문,수도권 토지보상금 17조원 부동산 시장 영향은,올해 토지보상금이 수도권에만 17조 원 규모로 풀릴 예정이나 실제 시장에 나오는 규모는 줄어들 것으로 보인다. 구체적으로 살펴보면 마곡지구가 3조3400억 원 동탄 2지구가 4조 원 이상으로 가장 큰 규모로 보상금이 풀리고 위례 신도시 양주 회천지구 고양 향동지구 등도 1조5000억 원 내외의 보상이 예정되어 있다. 이밖에 문정지구 신내3지구 등이 수천억 원대의 보상금이 지급될 예정이며 화성 봉담 2지구 평택 고덕지구 검단 신도시 등도 연내에 보상금을 지급할 예정이다. 국토해양부의 2007년 조사에 의하면 2006년 상반기 토공 주공에서 시행한 사업지구 내 보상금 수령자의 20.6%가 총 보상액의 37.8%를 부동산에 재투자해 영향을 미쳤다. 하지만 업계에서는 시중의 부동자금 규모가 MMF 122조 원 2월27일 기준 환매조건부채권 41조 원 3월 2일 기준 요구불예금 75조 원 2008년 12월 기준 등 이미 총 500조 원에 달하고 있어 보상금이 미치는 영향은 크지 않을 것으로 분석하고 있다. 여기에 더해 채권 보상 규모가 커짐에 따라 보상대상자 1인당 현금 보상액은 규모가 많이 줄어들 것으로 보인다. 또 주택담보대출의 2008년 말 잔액이 239조7000억 원에 달하는 등 가계대출 규모가 눈덩이처럼 불어나 있는 상황에서 부동산 재투자의 여력도 높지 않다. 이런 이유로 전문가들은 올해 지급되는 17조 규모의 토지보상금이 단기적으로 부동산 재투자로 이어질 가능성은 높지 않다고 보고 있다. 상가뉴스레이다 www.sangganews.com 선종필 대표는 “시중의 부동자금 규모를 고려해볼 때 올해 수도권에 지급될 토지보상금의 규모는 미미한 수준”이라며 “다만 장기적으로는 토지보상금을 비롯한 시중의 부동자금이 상대적으로 수익성이 높은 수익형 부동산으로 유입될 가능성이 높다”고 전망했다. 경향닷컴 대한민국 희망언론 경향신문 구독신청 hp smile.khan.co.kr ⓒ 경향신문 경향닷컴 www.khan.co.kr 무단전재 및 재배포 금지 〈경향닷컴은 한국온라인신문협회 www.kona.or.kr 의 디지털뉴스이용규칙에 따른 저작권을 행사합니다.,https://news.naver.com/main/read.nhn?mode=LSD&mid=shm&sid1=260&oid=032&aid=0002000845,166
