,date,cat,co,headline,text,url,week
65616,2007.10.08. 오전 9:17,부동산,헤럴드POP,타워팰리스 93평형 49억원에 거래 ‘최고가’,주상복합 아파트인 강남구 도곡동 타워팰리스 93평형이 49억원에 매매돼 올해 신고된 아파트 거래중 최고가를 기록했다. 8일 건설교통부에 따르면 서울 강남구 도곡동 타워팰리스1차 93평형 전용 223㎡.55층 은 지난 8월30일자로 49억원에 거래된 것으로 신고됐다. 이는 올해 매매된 아파트 가격중 최고 가격으로 6월초 45억원에 거래된 서울 서초동 트라움하우스 3차 83평형 전용 274㎡ 보다 4억원 비싼 것이다. 그러나 작년 거래된 아파트중 최고 가격인 타워팰리스1차 102평형 전용 245㎡ 의 53억6000만원에는 미치지 못한다. 8월에 실거래가 신고된 아파트중 20억원 이상은 모두 9건에 불과했다. 이는 6월에 22건 7월에 20건이 20억원 이상 가격에 거래된 것으로 신고됐던 것과 비교하면 절반에도 미치지 못한다. 이에 따라 전반적인 아파트 거래의 부진에도 불구하고 그동안 움츠러들지 않았던 20억원 이상 고가 아파트의 거래도 감소세로 돌아선 것으로 분석된다. 8월 신고분중에서는 49억원짜리 타워팰리스에 이어 서울 압구정동 신현대11차 61평형 183㎡ 이 27억6000만원에 팔려 두번째로 높았다. 또 서울 이촌동 LG한강자이 65평형 171㎡ 이 25억5000만원에 거래됐다. 타워팰리스3차 60평형 141㎡ 은 23억8000만원에 서울 역삼동 현대까르띠에 710 89평형 230㎡ 은 22억5000만원에 타워팰리스1차 57평형 137㎡ 은 21억8000만원에 각각 팔려 8월 신고된 20억원 이상 아파트 9건중 3건이 타워팰리스였다. 이 밖에 서울 방배동 롯데캐슬파크 244㎡형 20억5000만원 서울 잠실동 아시아 선수촌아파트 57평형 151㎡ 20억원 서울 논현동 브라운스톤 241㎡형 20억원 등도 20억원 이상에 거래된 것으로 신고됐다.,https://news.naver.com/main/read.nhn?mode=LSD&mid=shm&sid1=260&oid=112&aid=0000077067,92
65617,2007.10.08. 오전 9:11,부동산,머니투데이,서울시 新청사 22층 높이로 재탄생,머니투데이 정진우 기자 신재생에너지·초고속정보통신기술 도입 등 친환경 최첨단 건축물 서울시청사가 친환경 최첨단의 22층 건물로 재탄생한다. 서울시는 현 시청사 옆에 들어서게 될 신 新 청사의 디자인 설계안을 확정했다고 8일 밝혔다. 지난 3월 신청사 건립계획안에 대해 조건부로 허가받은 지 7개월만의 일이다. 시는 지난 5일 개최된 문화재위원회에서 신청사의 디자인을 최종 검토한 후 결정했다고 설명했다. 시는 신청사의 연면적을 최초 계획이었던 8만9968㎡ 2만7263평 에서 7만2450㎡ 2만1955평 으로 줄였지만 시민을 위한 문화공간을 대폭 확충했다. 당초 계쵝은 지하4 지상21층으로 시민 문화공간 비율이 16.6%였지만 지하4층 지상22층으로 변경되면서 문화공간 비율은 30%로 배 가까이 늘었다. 신청사에는 시민이 이용할 수 있는 사이버홍보관 IT전시관 취업정보센터 등이 들어설 예정이다. 각종 공연이 가능한 다목적홀도 신설된다. 리모델링을 통해 전시공간 등으로 제공될 구 舊 청사와 연계돼 서울광장과 옥내전시공간 옥내공연공간 등 문화공간이 한곳에 모이게 된다. 을지로와 태평로를 연결하는 필로티 형식의 보행자로가 신청사 부지내에 조성된다. 신청사와 구청사 사이를 시민들이 자유롭게 이용할 수 있는 공간으로 활성화할 예정이다. 덕수궁 문화재를 최대한 배려하는 차원에서 고층부 업무시설의 이격거리와 규모가 고려됐다. 투명 유리벽 사이에 조성되는 조경공간은 서울광장과 덕수궁의 녹지를 시각적으로 연결하는 수직정원 형태로 조성된다. 신청사는 태양열과 태양광발전 지열 등의 신재생에너지가 활용되는 친환경 건물로지어지고 초고속 정보통신건물 특등급인증의 신기술이 도입돼 최첨단 건축물로 건립된다. 신청사 기공식은 오는 11월 초에 열리고 2010년 9월에 완공될 예정이다.,https://news.naver.com/main/read.nhn?mode=LSD&mid=shm&sid1=260&oid=008&aid=0000835796,92
65618,2007.10.08. 오전 9:03,부동산,아시아경제,토공 신입사원 채용제도 개선,한국토지공사는 균형인재 선발을 권고하는 정부정책에 적극 부응하고자 신입사원 채용시스템을 개선해 차기 채용시부터 적용한다고 8일 밝혔다. 채용절차는 서류전형 필기시험 인성검사 면접시험 등 4개 부분으로 구분되며 신입사원 채용제도와의 차이점은 3가지로 요약된다. 먼저 기존 서류전형에서는 어학점수 고득점자 순으로 일정 배수를 선발했는데 향후에는 어학성적 일정점수 이상자 전원에게 필기시험 응시 기회를 부여했다. 또 공인회계사 등 고급자격증 소지자와 사회공헌활동 관련 장관이상 표창 수상자 토지공사 주최 각종 경진대회 또는 공모전에서 입상자는 어학성적이 없어도 지원할 수 있는 등 서류심사기준을 완화했다. 전공과 상식 과목으로 나뉘던 필기시험에서는 응시자에 대한 종합적이고 논리적인 사고능력을 검증하기 위해 상식시험이 폐지되는 대신 전공시험 합격자를 대상으로 중앙인사위원회의 공직적격성평가 PSAT 가 실시된다. 아울러 공공기관 지방이전에 따른 당해지역 활성화를 촉진하기 위해 대학이하 최종학력 기준 전북권역 출신자에 대해 채용 예정인원의 일정비율을 우선 선발하게 된다. 한편 학력 및 연령제한 철폐 장애인에 대한 우대기준 적용 관련법령 개정에 따른 국가유공자 등에 대한 가산점부여 등 그 밖의 제도는 올해와 똑같이 시행된다.,https://news.naver.com/main/read.nhn?mode=LSD&mid=shm&sid1=260&oid=277&aid=0000005674,92
65619,2007.10.08. 오전 8:58,부동산,이데일리,올해 최고거래가 아파트 49억원..작년 53.6억원,이데일리 남창균기자 올들어 8월말까지 거래된 아파트 가운데 최고가는 49억원으로 나타났다. 8일 건설교통부에 따르면 서울 강남구 도곡동 타워팰리스1차 223㎡ 93평형 는 8월30일 49억원에 거래됐다. 이는 올해 거래된 아파트 중 최고가격으로 지난 6월초 45억원에 거래된 서울 서초동 트라움하우스3차 274㎡보다 4억원 높은 것이다. 작년에는 타워팰리스1차 245㎡ 102평형 가 53억6000만원에 거래돼 최고가격을 기록했다. 8월에 실거래가격이 신고된 아파트 중 20억원 이상은 모두 9건에 그쳤다. 이는 6월 22건 7월 20건과 비교하면 절반에도 못 미친다. 8월 신고분 중에서는 49억원짜리 타워팰리스에 이어 서울 압구정동 신현대11차 183㎡ 61평형 가 27억6000만원에 팔려 두번째로 높았다. 또 서울 이촌동 LG한강자이 171㎡ 61평형 는 25억5000만원에 거래됐다. 타워팰리스3차 141㎡ 60평형 는 23억8000만원에 서울 역삼동 현대까르띠에710 230㎡ 89평형 는 22억5000만원에 타워팰리스1차 137㎡ 57평형 는 21억8000만원에 각각 팔렸다.,https://news.naver.com/main/read.nhn?mode=LSD&mid=shm&sid1=260&oid=018&aid=0000524958,92
65620,2007.10.08. 오전 8:44,부동산,이데일리,경매시장 강북 1억원미만 다세대·연립 인기,이데일리 윤진섭기자 경매시장에서 소액투자가 가능한 서울 강북권 중소형 5000만 1억원 규모의 다세대. 연립주택이 인기를 끌고 있는 것으로 나타났다. 8일 법원경매 정보업체 지지옥션에 따르면 지난달 5000만 1억원 규모 서울 재개발 지역 내 다세대 연립주택의 경매 낙찰가율은 135.5%로 전체 다세대 연립주택의 낙찰가율 90.1% 보다 45.5%포인트나 높았다. 지역별로는 재개발 추진이 활발한 금천구가 낙찰가율 173.8%로 가장 높았고 서대문구 152.7% 마포구 142.1% 도봉구 140.5% 광진구 132.1% 순이었다. 5000만 1억원 미만 다세대 연립주택의 경쟁률도 16.3대 1로 전체 경쟁률 9.6대 1보다 높았다. 실제 지난달 20일 경매된 서대문구 홍은동 대지 27.4㎡ 건물 36.6㎡ 규모의 다세대 주택은 53명이 응찰해 감정가 5500만원을 훌쩍 넘긴 1억230만원에 낙찰됐다. 같은 날 입찰된 마포구 망원동 대지 16.5㎡ 건물 38.7㎡ 규모의 다세대 역시 42명이 경쟁한 끝에 감정가 7500만원보다 3000만원이나 많은 1억660만원 낙찰가율 142.1% 에 낙찰됐다. 지지옥션 강은 팀장은 “연립·다세대주택은 DTI 총부채상환비율 규제에서 벗어나 있어 대출 받기가 쉽고 집값도 싸다”며 “특히 재정비촉진지구로 지정되기 전 가격이 저평가됐을 때 소액으로 선점하려는 수요가 늘면서 인기가 높아지고 있는 추세”라고 말했다.,https://news.naver.com/main/read.nhn?mode=LSD&mid=shm&sid1=260&oid=018&aid=0000524948,92
65621,2007.10.08. 오전 8:35,부동산,아시아경제,각종 규제가 복잡하다면..오피스텔 어때,최근 잇따른 규제로 아파트 시장이 불황을 겪자 반사이익으로 오피스텔의 인기가 높아지고 있다. 오피스텔은 청약 통장이 없이 분양 받을 수 있고 전매 제한에서도 자유롭다. 또 주거용으로 사용해도 청약가점제에서는 주택 수에 포함되지 않기 때문에 무주택 기간을 늘릴 수 있는 장점이 있어 최근 인기를 한 몸에 받고 있다. 청약통장 없이 분양을 받을수 있는 데다 총부채상환비율 DTI 규제에서도 제외돼 자금조달이 유리하다. 요즘 골치 아픈 전매제한도 없다. 10 12월 연내 전국에서 분양될 오피스텔은 총 7곳 1296가구로 집계된다. 서울에서 총 2곳 207가구가 분양되고 동탄신도시 2곳 431가구 인천 309가구 부산 319가구 울산 30가구 등이다. 구산건설은 서울 영등포구 양평동에 구산드림타워 총 101가구를 109㎡ 단일 평형으로 분양한다. 양평교와 성산대교가 인접해 있어 교통 접근성은 양호한 편이다. 단 주변에 지하철역이 없다는 단점이 있다. 한강시민공원과 선유도공원이 인접해 있어 쾌적한 주거환경을 자랑한다. 극동건설은 서울 성북구 하월곡동에 초고층 주상복합 코업스타클래스를 11월에 분양 예정이다. 89 175㎡ 총 106가구를 분양한다. 41층 초고층으로 지어진다. 단지 바로 앞에 지하철 6호선 월곡역이 있으며 내부순환도로와 북부간선도로 교차점에 위치해 있어 교통이 원활하다. 지하 1 2층에는 대형 할인마트인 홈플러스가 들어설 예정이다. 동양건설산업은 10월에 경기도 화성시 동탄신도시에서 동탄파라곤 오피스텔 89 112㎡ 총 160가구를 분양한다. 최대 3면을 개방해 채광과 통풍 일조권을 극대화한 타워형으로 설계된다. 남향 중심으로 단지를 배치한다. 지하철 1호선 병점역이 인접해 있고 동탄 양재간 자동차전용도로가 2008년에 개통 예정이어서 서울과 수도권은 물론 강남 접근성이 좋아질 전망이다. 부산시 부산진구 부전동에는 포스코건설 서면 더샵센트럴스타 오피스텔 105 158㎡ 319가구가 11월 분양 예정이다. 포스코건설은 지난 6월 부산 서면 더샵센트럴스타 주상복합아파트 청약경쟁률이 최고 47.5대 1을 기록한 바 있다. 부산 서면은 교통 상업 금융 문화가 집중된 최상의 입지를 자랑하고 있다. 내집마련정보사 양지영 팀장은 오피스텔은 아파트에 비해 상대적으로 규제가 덜하기 때문에 틈새상품으로 떠오르고 있다 면서 청약가점이 낮다면 유망 오피스텔을 노려보는 것도 좋다 고 말한다. 양 팀장은 이어 하지만 오피스텔은 실거래가 자료가 없기 때문에 직접 현장에 가서 주변 시세를 꼼꼼히 따져 봐야 한다 고 충고했다.,https://news.naver.com/main/read.nhn?mode=LSD&mid=shm&sid1=260&oid=277&aid=0000005645,92
65622,2007.10.08. 오전 8:32,부동산,아시아경제,대전·충남지역 연말까지 8897가구 분양 줄이어,노른자위 대규모 단지 낮은 분양가 전매제한 규제로 실수요자 적합 대전충남지역 중요 택지지구 노른자위 위치에 연말까지 대규모 아파트 분양이 줄을 잇고 있다. 이 기간 중 분양물량은 모두 8897가구 정도이며 대부분 분양가 상한제가 적용되고 전매 제한 규제가 있으나 상대적으로 기반시설과 생활편의 시설이 잘 되있으며 분양가가 낮은 장점이 있다. 이에 따라 중장기적으로 가격상승 잠재력이 있어 내집 마련을 위한 실수요자들 입질이 이어질 것으로 보인다. 부동산업계에 따르면 올 연말까지 분양될 택지지구 아파트 중 1000가구 이상인 곳인 대전 서남부 9블록 16블록 서구 관저동 천안 청수지구 등이 있다. 대전의 경우 서구 관저 4지구는 한일건설이 시공을 맡고 있으며 12월 분양을 목표로 사업이 추진되고 있다. 전용면적 99∼198㎡ 규모로 2175가구가 공급될 예정이며 인근에 구봉산을 끼고 있어 자연환경이 뛰아난 데다 서대전IC가 5분 거리에 있어 교통여건도 편리하다. 다음달 중순부터 서남부택지개발지구 내 16블록이 첫 분양에 나서며 뒤를 이어 9블록이 분양에 나설 예정이다. 엘드건설이 시공하는 16블록은 지하 1층∼지상 15 23층의 20개동 규모 전용면적 85㎡의 1306가구를 공급할 계획이다. 대전시도시개발공사가 분양에 나서는 9블록은 1971가구로 전용면적 105∼178㎡ 규모의 중대형으로 구성돼 있으며 서남부택지개발지구의 노른자위로 평가받고 있어 실수요자들의 높은 관심을 끌고 있다. 다음달 중순 또는 말께 공급할 계획이지만 문화재 지표조사 결과에 따라 분양 일정이 조정될 가능성도 있는 상황이다. 충남지역은 천안에서만 5445가구가 분양되는데 청수지구에서 첫 분양을 한다. 한양이 B 1블록에 105㎡와 109㎡ 1043가구를 다음달 분양한다.,https://news.naver.com/main/read.nhn?mode=LSD&mid=shm&sid1=260&oid=277&aid=0000005642,92
65623,2007.10.08. 오전 8:22,부동산,아시아경제,알짜 수도권 북부 미분양 물량은 어디,남북정상회담 영향으로 수도권 북부 미분양 물량이 주목받고 있다. 8일 부동산정보업체 닥터아파트에 따르면 현재 수도권 북부지역 미분양 아파트는 10개단지 총 271가구에 이른다. 이번 회담으로 가장 큰 수혜가 예상되는 파주 고양에는 4개 단지 163가구가 미분양으로 남아있다. 이중 가장 규모가 큰 단지는 진흥기업과 임광토건이 공급하는 아파트다. 고양시 탄현동 111 13번지에 위치했으며 총 905가구 규모다. 아파트가 들어서는 탄현역 일대는 일산과 파주 신도시 양쪽의 편의시설을 이용할 수 있으며 경의선 복선전철 2008년 개통예정 제2자유로 2009년 12월 완공예정 등의 호재가 있는 곳이다. 현재 미분양으로 남아 있는 물량은 153㎡에서 88가구며 계약금 5%에 일부세대는 중도금 무이자 혜택을 주고 있다. 파주시 문산읍 당동리 산33 1에서는 현대건설이 공급한 파주 힐스테이트도 161㎡ 18가구가 미분양으로 남아있는 상태다. 총 631가구 규모며 아파트가 들어서는 곳은 LCD협력 단지가 들어서는 곳이다. 이미 선유리 등으로 두산아파트를 비롯한 2000가구 이상 들어선 상태며 단지에서는 자유로와 통일로로 접근이 쉽다. 또한 2009년 착공 예정인 서울 문간 고속도로가 시작하는 내포리와도 가깝다. 계약금 10%에 중도금 50%는 이자후불제로 융자가 가능하다. 서해평화협력지대 설치로 수혜가 예상되는 곳은 김포와 인천 서구다. 이곳에는 모두 3개 단지에 67가구가 미분양으로 남아있다. 김포에 남아있는 미분양은 동양고속건설이 김포시 북변동 431 10번지에 공급한 동양파라곤2차다. 이미 공급된 1차와 합해 모두 276가구 규모다. 북변동은 김포시 초입으로 서울과 가깝고 인천과는 인접한 곳이다. 주변으로 홈플러스 김포점 김포시청 시민회관등이 위치해 있다. 현재 미분양으로 남아있는 면적은 111㎡ 118㎡ 146㎡ 3개 타입이며 물량은 각각 10가구 14가구 10가구씩 있다. 금융조건은 계약금 정액제로 99㎡ 128㎡ 30형대 는 1500만원 132㎡ 161㎡ 40형대 는 2000만원이면 계약이 가능하다. 중도금은 무이자로 40%까지 융자가 가능하다. 인천 서구 미분양 가운데 물량이 많은 곳은 한일종합건설이 불로동 175 2번지에서 공급한 한일타운이다. 검단신도시에 포함되지는 않지만 후광은 예상되는 단지다. 2개동 138가구 규모며 현재 남아 있는 미분양은 82㎡와 109㎡로 각각 8가구와 19가구가 있다. 선착순 분양으로 900만원 82㎡ 과 1300만원 109㎡ 만 있으면 계약이 가능하다. 중도금은 50%까지 무이자 융자가 가능하다.,https://news.naver.com/main/read.nhn?mode=LSD&mid=shm&sid1=260&oid=277&aid=0000005632,92
65624,2007.10.08. 오전 8:04,부동산,아시아경제,8월 타워팰리스 49억에 거래...올 최고가,8월중 도곡동의 주상복합아파트 타워팰리스가 49억원에 매매돼 올해 신고된 아파트 거래중 최고가를 기록했다. 하지만 20억원이상 고가아파트의 거래는 부진한 것으로 나타났다. u3000 8일 건설교통부에 따르면 서울 강남구 도곡동 타워팰리스1차 전용면적 223㎡형 55층 은 지난 8월 30일 49억원에 거래됐다. u3000 이는 올해 매매된 아파트 가격중 최고 가격으로 6월 초 45억원에 거래된 서울 서초동 트라움하우스 3차 전용 274㎡형보다 4억원 높다. u3000 하지만 지난해 거래된 아파트중 최고 가격인 타워팰리스1차 전용 245㎡형의 53억6000만원에는 미치지 못한다. u3000 8월에 실거래가 신고된 아파트중 20억원 이상은 모두 9건에 불과했다. u3000 이는 6월에 22건 7월에 20건이 20억원 이상 가격에 거래된 것으로 신고됐던 것과 비교하면 절반에도 미치지 못한다. u3000 8월 신고분중에서는 49억원짜리 타워팰리스에 이어 서울 압구정동 신현대11차 183㎡형이 27억6000만원에 팔려 두번째로 높았다. 또 서울 이촌동 LG한강자이 171㎡형이 25억5000만원에 거래됐다. u3000 타워팰리스3차 141㎡형은 23억8000만원에 서울 역삼동 현대까르띠에710 230㎡형은 22억5000만원에 타워팰리스1차 137㎡은 21억8000만원에 각각 팔려 8월 신고된 20억원 이상 아파트 9건중 3건이 타워팰리스였다. u3000 이 밖에 서울 방배동 롯데캐슬파크 244㎡형 20억5000만원 서울 잠실동 아시아선수촌아파트 151㎡형 20억원 서울 논현동 브라운스톤 241㎡형 20억원 등도 20억원이상에 거래된 것으로 신고됐다.,https://news.naver.com/main/read.nhn?mode=LSD&mid=shm&sid1=260&oid=277&aid=0000005619,92
65625,2007.10.08. 오전 7:32,부동산,매일경제,푸짐한 가을분양 설렌다,image0 가을 성수기 분양대전이 시작됐다. 가을 단풍처럼 물량도 다채롭다. 10월 둘째주엔 아파트 10곳 장기전세 4곳 오피스텔 1곳이 청약에 들어간다. 모두 15개 단지에서 4098가구가 쏟아진다. 서초동 방배 금호 리첸시아 등 견본주택 5곳도 손님 맞이에 들어간다. 청약가점제와 분양가상한제에 익숙지 않은 청약자들은 본인 청약가점과 전매제한 여부를 꼼꼼히 따져 청약을 준비해야 한다. 서울에서는 재개발ㆍ장기전세 삼성물산은 9일부터 동대문구 용두1구역을 재개발한 래미안 용두 아파트를 공급한다. 지하 2층 지상 20층 11개동 규모로 총 1054가구 중 조합원분을 제외한 284가구가 일반분양된다. 지하철 2호선 용두역과 지하철 1호선 제기동역이 가깝다. 내부순환도로를 이용하면 서울 외곽으로 쉽게 갈 수 있다. 단지 앞에 청계천과 1만6500㎡ 규모 용두근린공원이 조성됐다. 분양가격은 3.3㎡당 1320만원 선이다. SH공사는 8일 서울시 장기전세주택 시프트를 공급한다. 장지9단지 전용 59㎡ 178가구 발산4단지 59㎡ 287가구 등 총 482가구다. 이 가운데 110가구는 노부모 부양자 등에게 우선 공급되며 나머지 372가구가 청약저축 가입자 몫이다. 장지9단지와 발산4단지는 가구 월평균 소득이 지난해 도시 근로자 가구당 월평균 소득 대비 70% 이하 2006년 기준으로 241만380원 공시지가 5000만원 이하 자동차 현재 가치 2200만원 이하에 해당하는 청약저축 가입자에게 기회가 돌아간다. 대북 호재 기대되는 경기 북부 대북 호재가 있는 경기 북부에서도 분양이 계속된다. 지난 5일 우선 공급을 시작한 파주신도시 운정지구 휴먼시아 는 8일부터 1순위 청약을 받는다. 대한주택공사가 총 1062가구를 공급하며 모두 전용 85㎡ 이하다. 분양가상한제가 적용돼 10년간 전매 제한된다. 분양가는 전용 51㎡가 1억6050만원 59㎡가 2억60만원 74㎡가 2억7510만원 84㎡가 3억1350만원이다. 2010년 6월 입주 예정이다. 9일엔 경기도 양주신도시 인근 고읍지구에서 3개 업체의 1921가구가 동시 분양에 들어간다. 한양 수자인은 중대형 중심으로 1블록에 598가구 6 3블록에 434가구를 분양한다. 3.3㎡당 분양가는 1블록 772만원 6 3블록 840만 979만원이다. 등기 후 전매가 가능하다. 우남퍼스트빌과 우미린은 마감수준이 뛰어나고 조경과 커뮤니티 시설이 잘 갖춰져 있다. 우남퍼스트빌 376가구 우미린 513가구로 둘 다 전용 85㎡ 이하라 분양가상한제가 적용돼 10년간 전매가 제한된다. 분양가는 3.3㎡당 평균 760만원대로 책정됐다. 주상복합 분양도 시작 동양건설산업은 11일 경기도 화성시 동탄신도시 23 1블록에 주상복합 동탄파라곤Ⅱ 오피스텔 청약을 받는다. 지하 5층 지상 38층 규모로 오피스텔은 지상 4 5층에 전용 38 49㎡ 40실로 구성된다. 아파트는 90가구다. 기흥 IC에서 1.5㎞ 거리로 경부고속도로와 서해안고속도로를 이용하기 편리하다. 북쪽으로는 삼성반도체와 화성지방산업단지가 위치해 있다. 금호건설은 12일부터 서울 서초구 방배동에 공급하는 주상복합아파트 리첸시아 방배 견본주택 문을 연다. 지하 4층 지상 16층 규모로 전용 116 261㎡ 총 79가구로 구성된다.,https://news.naver.com/main/read.nhn?mode=LSD&mid=shm&sid1=260&oid=009&aid=0000628696,92
