,date,cat,co,headline,text,url,week
20277,2006.08.02. 오전 11:43,부동산,이데일리,한은 집값 안정 위해 과잉 유동성 흡수해야,세계적 주택경기 연착륙 예상 불구 급락 가능성 상존 집값 급락시 금융시스템 불안 가능성 대비해야 집값 급등에 대한 통화정책의 직접 대응은 곤란 이데일리 강종구기자 한국은행은 2일 장기간의 저금리가 세계적인 주택가격 급등을 유발했다면 물가와 성장을 감안해 가며 과잉 유동성을 흡수해 나가는 노력이 필요하다고 지적했다. 그러나 주택가격만을 잡기 위해 금리인상 등 통화정책으로 직접 대응하는 것은 곤란하다고 덧붙였다. 주택가격이 버블인지 여부를 판단하는 것 자체가 어려운데다 버블이 있다고 판단이 되더라도 버블만을 제거하기 위한 정책수단이 미비하다는 이유에서다. 특히 주택가격과 경기의 상관관계가 약해 주택가격이 올라도 경기가 활황국면이 아닐 수 있는데다 물가가 안정돼 있을 때 주택가격이 오르고 있을 경우 금리인상으로 대응하기가 어렵다는 설명이다. 전국적인 주택가격 상승이 아니라 국지적으로 급등할 경우에 역시 거시경제정책으로 대응하는 것은 곤란하다는 설명도 보탰다. 한국은행 해외조사실은 이날 주요국의 주택가격 리스크와 정책과제 란 보고서를 통해 2000년대 들어 각국 중앙은행이 경기하강에 대응해 정책금리를 대폭 인하했고 모기지금리를 비롯 장기금리도 사상 최저로 하락했다 며 미국 등 대다수 국가에서 시장금리가 명목 균형금리보다 장기간 낮은 수준을 지속하면서 주택가격 앙등을 초래했다 고 밝혔다. 또 주택가격 버블 여부는 판단하기 어려우나 영국과 호주가 최근 2년간 가격상승세 둔화에도 불구하고 여전히 상당한 버블이 내재되어 있으며 스페인과 아일랜드는 버블 정도가 큰 것으로 평가된다고 지적했다. 미국의 경우에는 가격상승폭이 상대적으로 크지 않고 국지적인 현상에 그치고 있으며 프랑스는 연 15% 이상의 급등에도 불구하고 주택가격이 내재가치를 약간 상회하는 정도여서 버블 정도는 미미하다고 덧붙였다. 한은은 대다수 전문가들이 세계 주택경기가 연착륙 할 것으로 예상하고 있지만 스페인과 아일랜드 등을 중심으로 주택가격이 급락할 가능성도 여전히 상존하고 있다고 경고했다. 또 주택가격이 하락할 경우 가계소비가 둔화되고 주거용 건설투자와 건설부문 고용부진으로 경제성장률 둔화요인으로 작용하며 상대적으로 임대료가 오르면서 소비자물가 상승 압력이 높아질 것이라고 예상했다. 특히 주택가격이 급락할 경우 은행의 잠재손실 발생 가능성이 있다며 이를 면밀히 주시해 금융시스템 안정성이 저해되지 않도록 유의해야 한다고 지적했다. 필요할 경우 담보인정비율 LTV 조정과 함께 신용평가기준 강화 대손충당금 적립비율 및 BIS 위험가중치 산정기준 조정 등의 노력을 강화해야 한다는 주문이다.,https://news.naver.com/main/read.nhn?mode=LSD&mid=shm&sid1=260&oid=018&aid=0000403877,30
20278,2006.08.02. 오전 11:19,부동산,머니투데이,이달부터 파주 운정신도시 주택 공급된다,머니투데이 이규성 기자 파주 운정신도시 분양이 소리없이 다가왔다. 수요자들의 시선이 판교신도시 중대형 아파트 분양에 쏠려 있지만 파주 운정신도시는 여러면에서 판교 못지 않다. 다시 한번 꼼꼼히 챙겨볼 시기다. 다만 순차적으로 분양이 이뤄지는 점을 감안 판교 이후를 대비한 접근법이 요구된다. 이달말 한라건설이 40 95평형 937가구를 공급하는 것을 비롯 올해말까지 총 5000여가구가 공급된다. ◇ 총 4만6천가구 건립 파주 운정신도시는 총 285만평 규모로 조성되며 일산신도시 및 교하 금촌 등과 인접해 서북부 최대의 주거벨트를 형성하게 된다. 시행자인 주택공사는 2단계사업으로 나눠 총 4만6054가구를 건립한다. 1단계에서는 국민임대 9109가구 공공임대 3300가구 일반 분양 1900가구를 공급할 예정이다. 신도시 내 민간업체와 달리 주공은 분양 일정을 확정하지 못했으나 내년 초에 공급이 이뤄질 전망이다. 민간업체들이 공급하는 물량은 지구 지정 이전에 주택공급을 위해 토지를 구입 환지 방식으로 돌려받은 택지에서 이뤄지는 것이다. 8월 한라 비발디를 시작으로 △ 9월 동문건설 34평형 4000가구 △ 10월 월드건설 34 47평형 400가구 우림건설 25 45평형 589가구 △ 11월 벽산건설 2 5차 24 44평형 2504가구 벽산 6차 33평형 610가구 등을 공급한다. 삼부토건 및 동양고속건설 등은 가구수와 분양 일정을 확정하지 못한 상태다. 이는 내년 초 분양할 것으로 예상된다. 업계 관계자는 판교신도시 분양으로 수요자의 관심권에서 멀어져 있기는 하지만 주거 환경이 쾌적하고 서울로의 접근성이 양호하다 며 판교 이후 주거 대안으로 떠오를 전망 이라고 말했다. 평당 예상 분양가는 1000만원대로 판교보다 낮을 것이라는게 업계의 설명이다. ◇ 호재 만발 발전 가능성 높아 파주 운정신도시는 서울 도심에서 25km에 위치 분당신도시보다 서울 중심부에 가깝다. 특히 서북부 광역교통망이 입주전에 설치된다. 마포 상암 강매 대화 운정신도시를 잇는 제 2자유로가 오는 2008년 완공된다. 또 내년에는 성산 문산간 경의선 전철 복선 39.6km 화가 완료되며 2009년에는 성산 용산간 2차 구간마저 개통된다. 자족기능도 풍부하다. 우선 인근에 파주 LG필립스LCD 공장이 건립중이며 파주 문발 출판단지 통일동산 등과도 인접해 있다. 통일동산내에는 개성 파주 경제특구 유통물량을 처리하는 11만평 규모의 남북화물기지도 오는 2011년 완공된다. 주공 관계자는 각종 자족기능과 교통망 등의 확충이 이뤄짐에 따라 발전 가능성은 수도권 남부보다 높다 며 주공에서는 다른 신도시와 달리 유비쿼터스가 완비된 u 시티 로 건설해 주거 환경 자족기능 첨단기능이 두루 갖춰진다 고 설명했다. ◇ 첨단 정보 인프라 구축 주공은 파주 운정신도시를 첨단 정보 인프라를 갖춘 u 시티 로 건설할 예정이다. 도시 전체가 첨단 인프라를 통해 행정 의료 문화 커뮤니티 등 각종 정보콘텐츠를 제공받을 수 있는 정보교류체계가 구축된다. 치안 응급 구호 환경 감시 지역 교통 등을 연결하는 관리.보안.생활정보 인프라도 조성돼 환경과 첨단이 어우러진 도시가 만들어진다. 또한 주공은 신도시 중앙공원의 용정저수지 인공 호수 농업생테공원을 연계하고 생태체험공간 수변위락공간 등 다양한 휴식공간을 제공할 계획이다. 더불어 수도권 서북부의 문화 클러스트를 구축 운정신도시 통일동산 출판단지 고양국제전시장을 연계하고 복합문화체험도시 로 만든다. 따라서 내집마련 수요자라면 판교 대안이 되는 파주 운정신도시에 대한 관심을 새롭게 해볼 필요가 있다.,https://news.naver.com/main/read.nhn?mode=LSD&mid=shm&sid1=260&oid=008&aid=0000687698,30
20279,2006.08.02. 오전 11:14,부동산,이데일리,재건축 부담금 내달 25일 실시..최고 50% 환수,이데일리 윤진섭기자 다음달 25일부터 재건축 사업에서 조합원당 3000만원을 초과하는 이익에 대해 최고 50%까지를 부담해야 한다. 이 제도는 다음달 25일 이후 관리처분계획 인가신청 이전단계의 모든 단지에 적용돼 개포 주공 등 현재 사업 추진단계에 있는 서울 강남지역 대부분 재건축 단지들이 이익환수제 대상에 포함될 전망이다. 건설교통부는 다음달 25일 시행 예정인 재건축 초과 이익 환수에 관한 법률 에 대한 시행 시행규칙을 입법예고했다고 2일 밝혔다. 건교부가 밝힌 법령에 따르면 재건축 부담금은 준공시점의 주택가격에서 착수시점 추진위원회 승인시점 의 주택가격과 기반시설부담금 임대주택에 따른 지분 감소액 건축비 등 각종 개발비용 집값 상승분을 뺀 뒤 0 50%의 부담률 조합원 평균 개발이익 기준 을 곱해 산정된다. 주택가격 산정은 공시가격을 기준으로 하되 공시가격이 없을 경우엔 복수의 우수감정평가법인이 조사한 가격의 산술평균으로 산정토록 했다. 또 가격 산정의 공정성을 높이기 위해 해당 재건축 사업과 관련된 업무를 수행한 감정평가 법인은 가격 산정기관에서 배제토록 했다. 개발비용은 건축비 조합운영비 등 조합이 사업과 관련해 지출한 비용을 통해 산정하되 재건축 조합이 제출한 금액이 분양가 상한제 적용을 위한 기본형 건축비 수준을 벗어날 경우 부과권자가 적정성을 검증해야 한다. 정상 집값 상승분은 국민은행 통계상 구별 집값 상승률 구별 통계가 없는 경우엔 건교부 장관이 한국감정원에 의뢰해 조사. 산정한 후 중앙부동산평가위원회의 심의를 거쳐 별도로 고시하기로 했다. 조합에 부과된 부담금을 조합원에 배분하는 것과 관련해 시행령에선 사업 개시시점부터 종료시점까지의 초과이익을 기준으로 부담금을 산정한 후 일 日 단위로 안분해 법 시행일부터 종료시점까지 해당하는 만큼 납부토록했다. 다만 부담금이 법 시행 이후 기간에 대해서만 안분해 부과되므로 법 시행일 이전에 이미 사업이 시작된 경우에는 개시시점 대신 법 시행일 당시의 주택가격을 고려하도록 했다. 하지만 이 경우 법 시행일 이전의 조합원별 보유기간은 고려되지 않아 주택을 오래 보유하고 있던 사람이 상대적으로 유리해 형평성 논란도 있을 것으로 보인다. 부담금은 분납 및 물납도 가능하고 징수된 돈은 국가와 지자체가 기금이나 특별회계를 통해 도시재정비사업 서민주택건설 등에 사용한다. 부담률은 개발이익 규모에 따라 최대 50%까지다. 건설교통부는 조합원당 개발이익이 3000만 5000만원은 10% 5000만 7000만원은 20% 7000만 9000만원은 30% 9000만 1억1000만원 40% 1억1000만원 초과는 50% 선이라고 설명했다.,https://news.naver.com/main/read.nhn?mode=LSD&mid=shm&sid1=260&oid=018&aid=0000403858,30
20280,2006.08.02. 오전 11:13,부동산,한국경제,분양가 6억 밑으로 낮춰라 비상,6억원 초과 고가 주택에 대한 대출 규제로 서울을 비롯한 수도권 분양시장에서 40평형대 이상 중·대형 아파트의 청약 경쟁률과 계약률이 저조한 실적을 나타내는 등 직격탄을 맞고 있다. 이에 따라 신규 분양을 준비 중인 건설업체들은 아파트 분양가를 6억원 아래로 끌어내리기 위한 전략 마련에 고심하고 있다. 1일 업계에 따르면 정부가 투기지역 내 6억원 초과 고가 주택의 연간 총부채상환비율 DTI 이 연소득의 40%를 넘지 못하도록 대출 금액을 제한하면서 서울 도심지역에서도 40평형대 이상 중·대형 아파트들이 대거 계약미달 사태를 겪는 사례가 속출하고 있다. ○6억원 초과 주택 외면 지난달 초 서울 도심에서 분양에 나선 A주상복합아파트는 31·34평형의 경우 3순위까지 3 6 대 1의 비교적 높은 청약 경쟁률을 기록한 반면 44 62평형 경쟁률은 1 1.9 대 1에 머물렀다. 총 분양가 기준층 기준 가 6억원을 넘는 44평형 7억8000만원 을 기준으로 청약률이 극명하게 엇갈린 것. 실제 계약에 있어서도 31·34평형은 100% 계약률을 보였지만 44평형 이상은 계약이 미달돼 추가 선착순 분양을 하고 있다. 회사 관계자는 일반 아파트에 비해 큰 평형의 선호도가 높은 주상복합아파트에서 30평형대에 청약자들이 몰린 것은 고가 주택에 대한 대출규제 여파 때문 이라고 설명했다. A주상복합과 비슷한 시기에 청약 접수한 서울 종로구 B아파트도 25평과 33평형은 최고 43.5 대 1의 경쟁률로 1순위 마감했지만 분양가 6억원이 넘는 41평형은 3순위에서 1 대 1로 겨우 모집 가구수를 채웠다. 지난 6월 말 용인에서 공급된 C아파트도 38평형만 1순위로 마감했을 뿐 나머지 40 70평형은 모두 미달됐다. ○건설업체 분양가 낮추기 고심 이처럼 같은 단지에서도 분양가 6억원을 기준으로 청약률이 양극화 현상을 나타내자 건설업체들은 마이너스 옵션 등을 활용 분양가를 6억원 이하로 낮추는 등 대책 마련에 고심하고 있다. 특히 땅값이 높은 서울과 수도권에서는 분양가 낮추기에 비상이 걸렸다. 지난달 말 경기도 고양시에서 분양에 나선 D아파트는 입주자가 내부 마감재 등을 직접 선택할 수 있는 마이너스 옵션 제를 채택 가장 비싼 45평형의 분양가를 6억원에서 100만원 빠지는 5억9900만원에 맞췄다. 경기도 용인시 구성지구에서 분양 중인 E아파트도 56평형 분양가를 주변 시세보다 평당 100만원 이상 낮은 5억9900만원 선으로 정했다. 김신조 내외주건 사장은 대출 의존도가 높은 신규 분양시장에선 대출 규제가 분양 성공의 여부를 가늠 짓는 잣대가 될 수밖에 없다 며 앞으로 분양가를 6억원 이하로 낮추기 위해 평형을 조정하거나 마이너스 옵션을 사용하는 사례가 크게 늘어날 것 이라고 말했다.,https://news.naver.com/main/read.nhn?mode=LSD&mid=shm&sid1=260&oid=015&aid=0000911286,30
20281,2006.08.02. 오전 11:08,부동산,연합뉴스,재건축 개발부담금 부과 세부 시행 방법,서울 연합뉴스 서미숙 기자 건설교통부가 3일 입법예고한 재건축 초과이익 환수에 관한 법률 시행령은 3.30대책에서 발표한 재건축 개발부담금 부과 방법을 구체화하고 부담금의 기초가 되는 초과이익 의 객관적 산정방법을 규정하고 있다. 건교부 관계자는 재건축 초과이익 환수제도가 본격적으로 시행되면 투기수요가 억제되고 무분별한 자원낭비가 줄어들 것 이라며 환수한 개발부담금 전액은 도시 주거환경 정비 도시재정비 저소득층 주거복지 지원 등에 사용된다 고 말했다. 재건축 개발부담금은 법 시행일 9월 25일 예정 이후 관리처분 인가를 신청하는 단지부터 적용된다. ◇ 개발이익 산정 방법은 재건축의 초과이익은 준공시점의 주택가격에서 추진위원회 승인시점의 주택가격 개발비용 정상집값 상승분을 뺀 가격으로 정한다. 이 때 주택가격은 공시가격을 기준으로 하되 공시제도 도입 전 재건축이 착수된 단지나 준공 직후여서 공시가격이 없는 단지는 복수의 우수 감정평가 법인이 가격을 조사해 산술평균한 가격을 사용하도록 했다. 개발비용은 재건축 사업에 소요된 건설비용 제세공과금 재건축 임대주택 의무건설 비용 조합운영비 등으로 구성된다. 이중 건설비용에는 공사비 설계감리비 부대비 외에 재건축 사업시 필요한 기존 주택의 철거비 안전진단비용 감정평가 수수료 회계.감사비용 컨설팅 등 용역비용을 모두 포함키로 했다. 제세공과금은 취득.등록세 면허세 법인세 산재보험료 등 일반적인 세금에다 기반시설부담금 광역교통시설부담금 등 각종 부담금을 합해 산출된다. 정부는 또 개발이익의 이중환수를 방지하기 위해 재건축 임대주택 의무건설에 따른 소요비용을 개발비용으로 공제하기로 했다. 만약 임대주택 건립으로 인센티브를 적용받아 용적률이 높아진 경우에는 일반분양분은 감소하지 않은 대신 용적률 상승에 따라 대지지분이 줄어드는 만큼 대지지분 감소액을 개발비용으로 공제해주기로 했다. 또 용적률이 높아지지 않을 때는 대지지분은 그대로지만 임대주택 건설에 따라 일반분양 물량이 감소하므로 일반분양분의 예상수익 감소분이 개발비용에 포함된다. 건교부는 또 재건축 조합이 제출한 금액이 공공택지에서 시행되고 있는 분양가 상한제 적용을 위한 기본형 건축비 수준에 비춰 적정범위를 초과할 때는 부과권자가 개발비용의 적정성을 검증하도록 했다. 건교부 관계자는 적정범위를 기본형 건축비의 어느 수준으로 할 지는 아직 미지수 라며 향후 논의를 거쳐 건교부 지침으로 마련할 계획 이라고 말했다. 정상집값 상승분은 정기예금이자율과 국민은행이 집계한 시.군.구의 평균 주택가격 상승률 가운데 높은 비율을 기초로 하되 통계가 없는 경우에는 건교부장관이 한국감정원에 의뢰해 조사.산정한 후 중앙부동산평가위원회의 심의를 거쳐 별도로 고시하기로 했다. ◇ 개발부담금의 조합원 배분은 어떻게 재건축 조합이 조합원별 부담금을 결정할 때는 개시시점부터 종료시점까지의 초과이익을 기준으로 부담금을 산정하고 이를 일 日 단위로 안분해 법 시행일부터 종료시점까지 해당하는 만큼만 부과하기로 했다. 예컨대 전체 부담금이 5천만원이고 개시시점부터 법 시행일까지 1년 6개월 법 시행일부터 종료시점까지 6개월이 걸렸다면 조합원 1인의 개발부담금은 5천만원×6개월 2년 24개월 1천250만원 을 내면 된다. 재건축 조합은 이렇게 결정된 조합원별 부담금 배분비율을 관리처분계획에 명시해야 한다. 다만 법 시행일 이전에 재건축 사업이 시작된 경우에는 개시시점 대신 법 시행일 당시의 주택가격을 고려해야 한다. 여기서 법 시행일 당시의 주택가격은 개시시점 주택가격에 법 시행일까지의 주택가격 변동분을 합하고 주택가격 변동분은 개시시점부터 종료시점까지의 주택가격 변동분을 법 시행일까지 일 단위로 안분해 산정한다. 만약 전체 사업기간이 5년 개시시점부터 법 시행일까지 기간이 2년 전체 개발이익이 5억원일 경우 전체 사업기간 동안 매년 1억원씩의 개발이익이 발생한 것이므로 법 시행일 시점의 주택가격은 그 당시 시세 4억원 에 개발이익 2억원을 더한 6억원이 된다. 하지만 이 경우 법 시행일 이전의 조합원별 보유기간이 고려되지 않아 주택을 오래 보유하고 있던 사람이 상대적으로 유리한 상황이 발생해 형평성 논란이 있을 것으로 보인다. 법 시행일 이전에 같은 평수의 주택을 소유하고 있고 입주후 평수도 동일하다면 법 시행일 전 10년을 보유한 사람이나 5년을 보유한 사람이나 개발부담금이 같기 때문이다. 재건축 부담금은 부과 종료시점부터 4개월 이내에 부과되며 납부 의무자는 부과일로부터 6개월 이내 납부해야 한다. 부담금은 현금납부가 원칙이나 새로 건설되는 주택으로 납부할 수 있다. 건교부 관계자는 부담금은 전체 개발이익중 정상집값 상승분과 개발비용을 모두 공제한 후 산출한 초과이익의 일부만 부과하므로 개발부담금을 내고 나면 조합원이 손해를 보게 된다는 일부의 주장은 맞지 않다 고 말했다.,https://news.naver.com/main/read.nhn?mode=LSD&mid=shm&sid1=260&oid=001&aid=0001373723,30
20282,2006.08.02. 오전 11:01,부동산,연합뉴스,재건축 개발부담금 법 시행일부터 종료시점까지 부과,건교부 초과이익환수 법률 시행령.시행규칙 입법예고 서울 연합뉴스 서미숙 기자 재건축 조합원은 재건축사업 개시시점부터 종료시점까지의 초과이익을 기준으로 개발부담금을 산정한 후 이를 일 日 단위로 안분해 법 시행일부터 종료시점까지 해당하는 만큼을 부담금으로 납부해야 한다. 또 재건축 조합이 제출한 금액이 분양가 상한제 적용을 위한 기본형 건축비 수준을 벗어날 경우 부과권자가 적정성을 검증해야 한다. 건설교통부는 이 같은 내용을 골자로 하는 재건축 초과이익 환수에 관한 법률 에 대한 시행령 및 시행규칙 등 하위법령 제정안을 마련해 3일 입법예고했다. 입법예고안에 따르면 재건축 초과이익은 준공시점의 주택가격에서 추진위원회 승인시점의 주택가격 개발비용 정상집값상승분을 뺀 것으로 산정한다. 이 때 주택가격은 공시가격을 기준으로 하되 공시가격이 없는 경우에는 복수의 감정평가 법인이 조사한 가격을 산술평균해 산정토록 했다. 개발비용은 건축비 조합운영비 설계감리비 등 재건축 조합이 사업과 관련하여 지출한 비용으로 하되 재건축 조합이 회계 감사를 받은 후 계약서 금융자료 세금납부 자료 등 증빙서류를 갖춰 제시해야 한다. 또 개발부담금의 중복부담 소지를 없애기 위해 기반시설부담금 및 기존 재건축 임대주택 의무건설에 따른 비용은 개발비용으로 인정하기로 했다. 이 때 재건축 조합이 제출한 금액이 분양가 상한제 적용을 위한 기본형 건축비 수준에 비해 적정 범위를 초과할 경우에는 부과권자가 직접 외부 전문기관에 회계감사를 의뢰하는 등 적정성을 검증해야 한다. 시행령에는 이와 함께 재건축 조합에 부과된 부담금을 조합원별로 배분할 때는 사업 개시시점 추진위원회 승인일 부터 종료시점 준공일 까지의 초과이익을 기준으로 부담금을 산정한 후 이를 일 日 단위로 기간 안분해 법 시행일부터 종료시점까지 해당하는 만큼 부과하기로 했다. 다만 부담금이 법 시행 이후 기간에 대해서만 안분해 부과되므로 법 시행일 이전에 이미 사업이 시작된 경우에는 개시시점 대신 법 시행일 당시의 주택가격을 고려하도록 했다. 하지만 이 경우 법 시행일 이전의 조합원별 보유기간은 고려되지 않아 주택을 오래 보유하고 있던 사람이 상대적으로 유리해 형평성 논란도 있을 것으로 보인다. 재건축 개발부담금은 조합원의 초과이익에 따라 0 50%까지 차등부과되며 개별 조합원 평균 개발이익이 3천만원 미만일 경우에는 개발담금이 부과되지 않는다. 건교부는 이런 내용을 담은 재건축 초과이익환수에 관한 법률 시행령.시행규칙을 이달 23일까지 입법예고하고 규제심사 법제처 심사 국무회의 등을 거쳐 다음 달 25일부터 시행할 예정이다.,https://news.naver.com/main/read.nhn?mode=LSD&mid=shm&sid1=260&oid=001&aid=0001373714,30
