,date,cat,co,headline,text,url,week
50885,2007.04.30. 오후 2:02,부동산,헤럴드경제,내집마련 전략 60점 넘으면 인기 ‘광교ㆍ송파’ 노려라,시행앞둔 가점제 성공적 청약 이렇게… 통장 서둘러 가입하고 부모봉양으로 점수 높여야 p 29점미만땐 5월분양 마포상암ㆍ용산원효 관심을 정부의 청약 가점제 실시 방안이 공개되면서 수요자들의 발걸음이 분주해졌다. 과연 내 가점은 얼마나 되냐는 원초적 질문부터 시작해 9월 이전에 서둘러 집을 마련해야 하느냐 청약 통장 가입은 어떻게 해야하느냐 등 온갖 문의가 부동산 게시판을 뒤덮고 있다. 전문가들은 동일한 통장 내에서도 부양 가족수와 무주택 기간 통장 가입 기간 등에 따라서 가점이 크게 달라지는 만큼 개인 여건에 따른 맞춤형 대응전략이 필요하다고 조언한다. 우선 제도 개편으로 직접적인 영향을 받게 될 당사자인 청약부금과 예금가입자 477만명 뿐만아니라 내집마련을 염두에 둔 모든 사람에게 해당될 기본 원칙을 소개하자면 다음과 같다. 우선 청약통장 가입기간의 가점이 최대 17점까지 있으므로 청약 통장은 가급적 빨리 가입해야 하겠다. 또 무주택 세대주라면 직계존비속과 3년 이상 같이 살면 청약 가점을 더 쌓을 수 있는 만큼 부모 봉양은 효도 차원을 넘어 필수 요소가 된다. 이어 무주택 기간 산정에 절대적으로 불리한 20대 가운데 결혼이 예정돼 있다면 혼인 신고일로부터 무주택기간을 산정하므로 혼인신고를 빨리 하는 편이 좋다. 물론 무주택 세대주로 부양가족과 통장 가입 기간 등에 유리하다면 선호 평형을 선택한 뒤 통장을 리모델링해 9월 이후에 선택하는 게 현명하다. 이어 가점 점수별로는 주택산업연구원이 청약 가점제 방안을 마련하기 위해 지난해 11월 전용면적 25.7평 이하 주택에 대한 실제 청약자 서울 경기 대구 등 454명을 대상으로 가점제 시뮬레이션을 실시한 결과를 토대로 청약 전략을 수립하는 게 바람직하다. 가점이 60점 이상자들은 시뮬레이션 결과 전체 중 1.76%에 불과했다. 따라서 총점이 60점 이상이면 9월 이후 분양하는 어떤 곳에서도 당첨권에 들 수 있다. 이들은 최고 인기 단지로 꼽히는 광교신도시 2008년 하반기 분양 와 송파신도시 2009년 분양 예정 송도 신도시 등 원하는 곳에 맞춰 청약에 나서면 당첨이 거의 확실시된다. 총 18.44%였던 40점 59점 점수대는 서울과 수도권 주요 재개발 지역이나 인기 택지지구의 당첨권에 들 것으로 보이는 만큼 유망한 단지를 선별하는 작업이 요구된다. 반면 가점이 29점 미만이면 웬만한 아파트의 당첨권에 들기 힘들어 장기적 안목에서 내집 마련 계획을 세우거나 9월 이전 분양물량에 관심을 갖는 것이 좋다. 신혼부부나 새내기 직장인들이 주 대상일 것으로 보인다. 특히 5월을 주목할 필요가 있다. 5월은 9월 이전 최대 분양 성수기인 만큼 건설사들의 분양 판촉전이 가장 치열할 것으로 예상되기 때문이다. 5월 서울에서는 용산구 원효로와 마포구 상암동 물량이 눈에 띈다. 용산구 원효로1가 일대에는 금호건설이 총260세대 모두를 일반 공급할 예정이다. 마포구 상암동 일대의 주택공사물량은 상암 월드컵단지가 들어선 상암지구와 인접해 있고 상암월드컵경기장 하늘공원 등을 이용할 수 있다. 이밖에 삼성건설은 미아뉴타운 지구 내 미아 6 12구역에서 486세대를 5월 일반분양한다. 경기ㆍ인천권에선 우선적으로 송도 신도시의 포스코건설 주상복합 물량이 주목을 받고 있다. 하지만 인허가 과정이 지연되고 있어 일정이 재차 조정될 수 있다. 부천에서는 GS건설이 5월초 송내동 일대에 ‘송내자이’ 436세대를 분양해 관심을 모은다. 남양주 진접에서는 동부건설이 1687세대의 대단지를 분양한다. 현대건설은 올해 첫 아파트 분양사업으로 경기도 파주시 문산읍 당동리에 짓는 파주 힐스테이트 를 선보인다. 지하 3층 지상 10 18층에 35평형 377세대 48평형 192세대 58평형 62세대 등이다. 성원건설은 안양시 동안구 비산동에 주상복합 ‘안양천 상떼빌’ 177세대를 공급한다. 화성 봉담에선 현대산업개발이 829세대를 선보인다. 지방권에선 천안과 원주 등의 물량이 주 대상이다. 한라건설은 원주시에서 1200여 세대의 대단지를 공급한다. 또 천안에서는 신일과 대우가 각각 1026세대와 937세대를 내놓았다. 부산에서는 포스코건설이 부산 진구 옛 제일제당 부지에 단일 규모로는 부산 최대인 1700여 세대 규모의 ‘서면 더샾 센트럴스타’를 분양한다. 현대산업개발은 마산과 울산에서 각각 780세대와 820세대를 분양한다.,https://news.naver.com/main/read.nhn?mode=LSD&mid=shm&sid1=260&oid=016&aid=0000241400,69
50886,2007.04.30. 오후 2:02,부동산,헤럴드경제,내집마련 전략 현실성 없는 ‘무주택 인정범위’ 완화 가닥,가점제 앞으로 어떻게… 2010년부턴 자산ㆍ소득 등 항목도 추가키로 오는 9월부터 시행되는 새 청약제도 개편안의 핵심은 민간 25.7평이하 중소형 아파트의 4채중 3채 75% 를 무주택기간과 부양가족수 가입기간 등에 따른 청약가점제로 당첨자를 가리는 것이다.건교부는 이번주중 이같은 내용의 ‘주택공급규칙 개정안’을 입법예고한 뒤 9월부터 시행할 계획이다. 새 청약제도는 청약예ㆍ부금 가입자들이 청약 가능한 85㎡ 이하 민영주택 공공택지 포함 은 현행 추첨방식으로 25%만 뽑고 나머지 75%는 가점제로 뽑는다.청약저축 가입자들이 청약할 수 있는 공공택지내 전용 25.7평이하 공공주택의 청약방법은 현행대로 유지된다. 이미 가입기간 저축총액 부양가족 수 당해지역 장기거주 등을 고려해 실수요자 위주로 공급되고 있기 때문이다. 청약예금 가입자들에게 공급되는 25.7평초과 주택의 경우는 공급주체에 상관없이 채권입찰제를 우선적용해 입찰금액이 큰 사람에게 우선권을 주되 채권입찰 금액이 같을 경우 가점제로 50%를 우선공급하고 나머지 절반은 추첨제로 당첨자를 가린다. 가점은 ▷무주택기간 2∼32점 ▷부양가족 수 5∼35점 ▷가입기간 1∼17점 이 고려돼 최대 84점이며 수도권 인가 아파트 당첨권인 상위 10%에 드는 점수는 53 54점선으로 추정된다. 세대주 연령은 항목에 포함되지 않는다.유주택자는 점수가 높다고 하더라도 가점제 공급 주택의 청약순위가 2순위 이하로 밀리게 되며 특히 2주택 이상인 경우에는 한채당 5점씩 감점된다.오는 2010년이후부터는 자산과 소득 등의 항목이 추가될 예정이다. 가점제가 아닌 추첨제로 공급되는 주택에 대해서는 1주택자도 1순위 자격이 유지되지만 2주택 이상일 경우에는 2순위 이하로만 인정된다. 전용 18평 이하이고 공시가격이 5천만원 이하인 주택을 10년 이상 보유한 사람이 18평 초과 주택을 청약할 경우에는 무주택자로 인정받는다.정부는 실제 수도권에서 이같은 조건을 충족한 가구가 거의 없다는 지적에 따라 입법예고시 무주택인정범위를 완화하는 방안도 검토중이다. 가점제가 도입되더라도 지역우선공급제도와 3자녀 이상 무주택 세대주 국가유공자 장애인 철거민 등에 대한 특별공급제도는 현행대로 유지된다.,https://news.naver.com/main/read.nhn?mode=LSD&mid=shm&sid1=260&oid=016&aid=0000241399,69
50887,2007.04.30. 오후 2:02,부동산,헤럴드경제,분양 유망단지 단일규모 최대 부산 서면 1700세대,포스코건설 포스코건설은 오는 5월 부산 진구 옛 제일제당 부지에 단일 규모로는 부산 최대인 1700여 세대 규모의 ‘서면 더샾 센트럴스타’를 분양한다. 센트럴스타는 지하5층 지상 최고 58층 5개동 규모로 40 50평형대가 주력 평형인 아파트 1360세대와 오피스텔 319실로 구성돼있다. 센트럴스타는 ‘문화네트워크 아파트’를 지향한다. 하우스 키핑 발렛 파킹 교양강좌 운영 각종 집안 행사지원 자동차 관리 등 다양한 고급호텔 수준의 서비스를 도입해 품격 높은 편리성을 제공한다. 각종 부대시설을 포함한 주거지원시설이 약 1만 여평이나 되며 쇼핑시설도 5800여 평에 달한다. 특히 도심권에서 보기 드물게 넓은 조경면적을 확보해 단지 자체가 공원으로서의 기능을 할 수 있도록 설계된다. 센트럴스타가 들어설 서면은 부산의 교통 금융 상업의 중심지로 반경 500m 내 전포역 1km 이내에 지하철 1호선 2개역이 인접해 있다. 도시고속화도로 동서고가도로 황령산터널을 이용한 시내외 이동 및 해운대 지역으로의 접근성이 뛰어나다. 특히 약 16만평 규모의 부산 시민공원으로 개발 예정인 북측의 하얄리아 미군기지 공원화 계획 남측의 문현금융단지 조성계획 3만4000여평 규모 동천개발계획과 사업지를 둘러싼 13개의 도시환경 정비사업 등 4가지 핵심사업을 통해 해운대 권역에 버금가는 도심 활성화가 이뤄질 것으로 기대된다.,https://news.naver.com/main/read.nhn?mode=LSD&mid=shm&sid1=260&oid=016&aid=0000241398,69
50888,2007.04.30. 오후 2:02,부동산,헤럴드경제,분양 유망단지 미아 6ㆍ12구역 포함 ‘삼성타운’ 우뚝,래미안 삼성건설이 미아뉴타운 지구내 미아 6 12구역 조감도 에서 486세대를 5월 일반분양한다. 일반분양분은 미아 6구역에서는 26평형 123세대 33평형 26세대 44평형 95세대다. 또 12구역에서는 24평형 57세대 32ㆍ 33평형 90세대 42평형 95세대다. 미아 6구역과 12구역에 지어지는 총 아파트는 각각 1247세대 1300세대이다. 이들 아파트가 지어지면 미아 6 12구역을 포함해 길음ㆍ 미아 뉴타운지구내 1만2000여 세대의 래미안 아파트가 밀집 강북의 삼성타운을 형성하게 될 전망이다. 미아 6 12구역은 미아동 일대 낡은 주택을 헐고 새로 짓는 재개발사업으로 2003년 1월 입주한 래미안 길음1차 1125세대 2차 560세대 3차 977가구 아파트 단지가 인접해 있다. 래미안 길음ㆍ 미아 뉴타운이 완공되면 대규모 삼성 타운이 형성돼 강북을 상징하는 랜드마크가 되며 단지내 다양한 생활편의시설과 대단지 프리미엄도 누릴 수 있다. 삼성건설은 북한산의 광역 녹지축과 연계한 생태공원을 단지내에 조성할 방침이며 타워형과 판상형 혼합배치로 리듬감 있게 동을 배치하고 헬스장 골프 연습장 사우나 보육시설 등 다양한 커뮤니티시설도 설치하게 된다.,https://news.naver.com/main/read.nhn?mode=LSD&mid=shm&sid1=260&oid=016&aid=0000241397,69
50889,2007.04.30. 오후 2:02,부동산,헤럴드경제,분양 유망단지 남양주 진접지구 개발로 ‘후광’ 기대,동부건설 동부건설이 동부권의 신흥 개발축으로 주목받는 남양주 진접지구에서 1680여세대에 달하는 대규모 주거단지를 조성한다. 총 3개 단지 1687세대로 구성된 ‘진접센트레빌시티’는 단일 규모로는 남양주시에서 최대다. 단지별 공급물량은 분양에 돌입한 1단지의 경우 1176세대로 평형별로는 34평형 653세대 40평형 306세대 47평형 109세대 57평형 102세대 69평형 6세대 등으로 구성됐다. 2단지 278세대와 3단지 233세대는 7월에 분양할 계획이다. 분양가는 34평형 기준으로 평당 740만원 선에 계획돼 있다. 1만2000평 규모의 진접지구 개발에 따른 후광 효과가 기대된다. 인근에 고급 브랜드의 단지가 전무해 향후 랜드마크 단지로 부상할 가능성이 크다. 특히 총 2200평에 달하는 커뮤니티 시설을 갖추고 있어 인근 분양가상한제 아파트와 비교해 수요층의 선호도가 높을 것으로 보인다. 이곳에는 수영장 골프연습장 피트니스 클럽은 물론 소극장 문화센터 북갤러리 등 다양한 문화시설이 들어선다. 교통 여건으로는 지난해 12월 서울시 노원구와 남양주시가 지하철 4호선을 진접지역까지 연장키로 협약을 맺었으며 퇴계원IC에서 진접으로 이어지는 47번 국도가 현재 8차선으로 확장 공사 중이다.,https://news.naver.com/main/read.nhn?mode=LSD&mid=shm&sid1=260&oid=016&aid=0000241396,69
50890,2007.04.30. 오후 2:02,부동산,헤럴드경제,분양 유망단지 천안 두정역에 27층 타워형 대단지,대우건설 대우건설은 천안 최초의 27층 타워형 아파트단지 천안두정역 푸르지오를 오는 5월 분양한다. 천안두정역 푸르지오는 충청남도 천안시 80 5외 111필지에 지하2층 지상20 27층 아파트 12개동 30평형 57평형 총 937세대로 구성된다. 수도권전철 서울 지하철1호선 연장선 두정역이 도보 2분 거리에 위치한 초역세권 아파트로 KTX 천안아산역과 1번국도 경부고속도로 천안IC가 가까워 사통팔달의 교통환경을 갖추고 있다. 천안두정역 푸르지오는 천안 최초의 27층 타워형 아파트로 각 세대의 조망권을 최대한 보장하는 합리적 설계와 자연이 어우러진 쾌적한 단지로 조성된다. 롯데마트 홈에버 E 마트 갤러리아 백화점 씨너스 영화관 등 쇼핑 및 문화시설이 가깝고 두정지구 중심상업지역과도 인근에 위치해 생활 편의시설 이용이 편리하다. 단지 인근에 두정초ㆍ중교 오성초ㆍ중교 천안북일여ㆍ고교 단국대학교 천안캠퍼스 등이 있어 교육환경도 우수하다. 3배이 4배이 발코니 설계를 적용해 채광과 통풍이 우수하다. 아파트 저층을 녹지와 연계된 필로티로 설계해 쾌적성을 높였다.,https://news.naver.com/main/read.nhn?mode=LSD&mid=shm&sid1=260&oid=016&aid=0000241395,69
50891,2007.04.30. 오후 2:02,부동산,헤럴드경제,분양 유망단지 부천 송내 빼어난 외관 ‘랜드마크’로,GS건설 GS건설은 오는 5월 초 경기도 부천시 소사구 송내동 409 3번지 일대에 ‘송내자이’를 분양한다. 송내자이는 대지 5786평에 지하3층 지상14 20층 9개동 규모로 24 32 45 47평형 등 총 436세대로 구성된다. 송내자이는 ‘원경에서 특별함의 경험’이란 모토 아래 외관 상층부의 주경과 야경을 고려한 특화된 옥상옥탑과 차별화된 경관조명이 적용돼 주변의 랜드마크로 부각될 전망이다. 단지 남동쪽으로 성주산이 위치해 조망권을 확보했으며 전체 사업부지의 20%가 공원으로 조성된다. 서울외곽순환도로 송내IC와 제2경인고속도로가 인접해 사통팔달의 교통망을 형성하고 있으며 도보로 지하철 1호선 송내역을 이용할 수 있다. 인근에 송일초등학교 성주중 부천여중 부천고가 위치해 있어 교육여건도 우수한 편이다. 송내자이가 들어서는 부천시는 기존 시가지역 노후화에 대한 재개발 및 재건축의 개발 호재를 가지고 있다. 중동신도시내 GS백화점 삼성홈플러스 월마트 현대백화점 등 대형 편익시설이 잘 갖춰져 있다. 송내동 인근에 거마산 성주산 기부체납공원 등이 위치해 있어 자연환경이 뛰어나다.,https://news.naver.com/main/read.nhn?mode=LSD&mid=shm&sid1=260&oid=016&aid=0000241394,69
50892,2007.04.30. 오후 2:02,부동산,헤럴드경제,분양 유망단지 마산灣 초고층설계 ‘바다가 한눈에’,현대산업개발 현대산업개발이 5월 경남 마산과 울산 화성 봉담 등 3개 사업지서 총 2429세대를 공급한다. 가장 먼저 ‘마산만 I PARK 조감도 ’를 선보인다. 마산시 신포동에 입지한 ‘마산만 I PARK’는 지하 2층 지상 36층 총 6개동 780세대 규모로 34평형 470세대 50평형 170세대 61평형 136세대 68평형 2세대 82평형 2세대 등으로 구성됐다. 바다조망과 일조권을 극대화하기 위해 최고 36층 높이의 초고층 타워형 아파트로 설계됐다. 전세대가 남향 위주로 배치된다. 특히 단지 전체가 지상으로부터 5m 올려진 데크식으로 설계된다. 모든 동에 2개층 높이의 필로티를 설치하는 등 단지 전체의 개방을 높이고 저층부에서도 바다조망이 가능토록 했다. 055 247 7234 이밖에 화성 봉담과 울산 우정동에서 대단지가 공급된다. 지하 2층 지상 16층 28층 8개동 총 829세대 규모로 판상형과 타워형이 혼합된 단지배치에 34평형 309세대 39평형 81세대 40평형 314세대 47평형 41세대 55평형 84세대 등으로 구성된다. 인접한 봉담지구 및 동탄신도시의 편의시설 이용이 편리하다. 1577 6787 울산 중구 성남동에서도 820세대 규모의 대단지를 공급된다. 지하 2층 지상 21층 25층 10개동 규모다.,https://news.naver.com/main/read.nhn?mode=LSD&mid=shm&sid1=260&oid=016&aid=0000241393,69
50893,2007.04.30. 오후 2:02,부동산,헤럴드경제,분양 유망단지 파주 600여가구…1층에도 자연채광,현대건설 현대건설이 올해 처음으로 경기 북부에 힐스테이트 아파트 631가구를 분양한다. 2009년 말에 입주 예정인 파주 힐스테이트는 지상 10층 18층 아파트 13개동 규모로 35평형 377가구 48평형 192가구 58평형 62가구 등 중대형 평형 위주로 구성됐다. 평당 분양가는 35평형은 평균 815만원 48평형은 평균 873만원 58평형은 평균 893만원이며 서비스면적 즉 발코니 확장 비용은 1200만원 1300만원 선이 될 것으로 보인다. 파주 힐스테이트가 들어설 경기도 파주시 당동리는 인근에 서강대와 이화여대 글로벌 캠퍼스가 조성될 예정이며 문산 첨단산업도시 당동IT 선유 첨단산업도시 월롱 산업단지 역시 입주할 예정이다. 또 차량으로 10분거리에 51만평 규모의 LCD 산업단지가 들어설 예정이어서 앞으로 주택수요가 크게 늘어날 것으로 예상되는 곳이다. 파주 힐스테이트는 지형적 특징을 이용한 피로티 구조 하층이 벽체가 없고 기둥으로만 되어 있는 구조 로 그동안 기피층으로 분류되던 1층이 사실상 일반아파트의 4 5층 높이에 위치해 있고 지하층으로 분류되는 주민편의시설도 지상 3층 높이에 위치해 자연채광이 가능하다. 그밖에 만여평 규모의 부지를 기부채납해 근린공원을 만들었다.,https://news.naver.com/main/read.nhn?mode=LSD&mid=shm&sid1=260&oid=016&aid=0000241392,69
50894,2007.04.30. 오후 2:02,부동산,헤럴드경제,분양 유망단지 원주 우산동 다양한 GX룸 등 눈길,한라건설 최근 기업도시 구역 지정 및 기본계획이 최종 확정되면서 재조명을 받고 있는 원주시에서 한라건설이 1200여 세대의 대단지를 분양해 눈길을 끌고 있다. 원주시 우산동에 들어설 한라비발디는 지하 1층에서 지상 15층의 13개동 규모로 들어선다. 원주한라비발디는 1ㆍ2단지 총 1200여 세대의 대단지로 건립되며 이번에는 1차분 총634세대가 분양된다. 분양이 이뤄지는1단지는 ▷70평형 5세대 ▷ 55평형 8세대 ▷ 50평 3세대 ▷ 47평형 135세대 ▷ 37평형 20세대 ▷ 36평형18세대 ▷ 33평형 105세대 ▷ 32평형 260세대로 구성돼 있다. 원주 한라비발디아파트가 들어서는 우산동은 시외버스터미널과 대규모 쇼핑센터 등이 들어서는 단계지구가 인근에 위치해 있다. 오감체험공간을 비롯하여 헬스클럽ㆍ요가ㆍ에어로빅을 즐길 수 있는 GX룸 등 다양한 시설이 들어서며 남향위주의 단지배치와 원경을 고려한 옥탑 및 경관조명 설치 탑상형과 판상형의 조화를 통한 개방감 극대화 산책 및 조깅코스 조성 지하주차장 엘리베이터 운행 보행자 통로와 차도 분리 등 차별화된 설계를 선보인다. 친환경 단지조성에 중점을 두어 플라자 Plaza 파크 Park 가든 Garden 3가지의 테마로 조경 공간을 구성했다.,https://news.naver.com/main/read.nhn?mode=LSD&mid=shm&sid1=260&oid=016&aid=0000241391,69
50895,2007.04.30. 오후 2:02,부동산,헤럴드경제,분양 유망단지 천안 일봉공원 인접… 교육환경도 ‘굿’,신일건설 천안지역 아파트 공급이 러시를 이루고 있는 가운데 신일이 오는 27일부터 3곳에서 ‘신일 해피트리’ 아파트 1026세대를 동시에 분양 눈길을 끌고 있다. 가장 관심을 끄는 단지는 용곡택지 지구 내 위치한 34평 47평형 295세대 단지. 일봉공원과 천안천 사이에 위치하며 주변이 5000여 세대의 대단위 배후단지로 조성되는 곳이다. 남부대로 쌍용대로 천안아산역이 인접하고 신방지구와 아산신도시가 인접해 있어 교통이 양호하다. 다가동 ‘신일해피트리’는 34 58평형 438세대 규모다. 충무로 대흥로 남부대로 쌍용대로와 인접해 있으며 개통 예정인 봉명역과도 가까워 역세권 프리미엄 수혜가 예상된다. 일봉초 미라초 천안고 등 교육 여건이 탁월하며 단지 바로 뒤로는 일봉공원이 위치해 있다. 33 46평형 293가구 규모인 성정동 ‘신일해피트리’는 동서대로 백석로에 인접해 있으며 수도권 전철 두정역이 1㎞ 거리에 있다. 인근에 재개발 예정 아파트와 더불어 주거지역이 형성되며 갤러리아백화점 롯데마트 등 풍부한 생활 편의시설이 인접해 있다. 타워형 동 배치와 고층화 최대 22층 로 조망권과 개방감을 확보했다. 3개 단지 평당 평균 분양가는 750만원선이다.,https://news.naver.com/main/read.nhn?mode=LSD&mid=shm&sid1=260&oid=016&aid=0000241390,69
50896,2007.04.30. 오후 2:02,부동산,헤럴드경제,분양 유망단지 안양역 역세권ㆍ고속도로 접근성 OK,성원건설 성원건설이 안양시 동안구 비산동 557 4에서 주상복합 ‘안양천 상떼빌’ 177세대를 분양한다. 1063평의 대지에 지상 19∼24층 2개동으로 이뤄진다. 34평형이 139가구로 가장 많고 44평형 20가구 57평형 16가구 27평형과 49평형이 각각 1가구씩으로 구성된다. 사업지 옆과 뒤로 8m의 도로가 위치해 접근성이 좋고 바로 옆에는 안양천이 위치해 전망이 좋다. 도보로 안양역 이용이 가능하다. 석수 평촌 산본I.C 및 일직분기점ㆍ 서해안고속도로 및 서울외곽순환고속도로ㆍ 경수산업도로 및 관악로 등과 인접해 교통 여건이 우수하다. 교육환경으로는 안양초등학교 비산초 임곡중학교 등이 있다. 편의시설로는 이마트가 도보 5분 거리에 있고 안양베네스트골프장 9km 자가 최소10분 최대20분 평촌 중앙공원 자가 10분 자전거도로 안양예술공원 자가 10 15분 성모병원 성심병원 동안구청 안양시청과 가깝다. 또 아울렛 킴스클럽 롯데백화점 뉴코아백화점 등 상권이 형성돼 있다. 주상복합이어서 서울ㆍ경기ㆍ인천 등 수도권 1순위 청약예금통장이 있으면 분양을 신청할 수 있다. 분양가는 1200만원대로 오는 27일 견본주택을 개관한다.,https://news.naver.com/main/read.nhn?mode=LSD&mid=shm&sid1=260&oid=016&aid=0000241389,69
50897,2007.04.30. 오후 2:02,부동산,헤럴드경제,금주의 부동산 캘린더화도 ‘신도브래뉴’ 청약접수,분양 시장이 5월 성수기를 맞아 절정으로 치닫고 있다. 이번주 전국 5개 단지에서 청약접수를 받고 7개 단지에서 당첨자가 발표된다. 또 5개 단지에서 계약이 이뤄지고 새로 10개 단지의 모델하우스가 개관된다. 다음달 2일 동부건설은 경기도 남양주시 진접읍에 공급하는 ‘진접센트레빌시티’의 청약접수를 받는다. 같은 날 신도종합건설도 남양주시 화도읍에 공급하는 ‘신도브래뉴’의 청약접수를 받고 부영이 남양주시 지금동과 도농동에 공급하는 부영사랑으로‘의 모델하우스를 개관한다. 지방에서는 5월 3일 현진에버빌이 경상북도 포항시 장성동에 공급하는 ‘현진에버빌2차’의 모델하우스를 개관 할 예정이다. 이밖에 4일 인천광역시 서구 당하동 보미골드리즌빌을 비롯해 원주시 우산동에서 한라비발디의 모델하우스가 각각 개관한다.,https://news.naver.com/main/read.nhn?mode=LSD&mid=shm&sid1=260&oid=016&aid=0000241351,69
