,date,cat,co,headline,text,url,week
20949,2006.08.10. 오후 4:21,부동산,서울경제,판교 紙上 모델하우스 3공구·4공구,현대건설 컨소시엄이 맡은 판교 신도시 3공구는 서판교 판교공원과 접해 주거환경이 쾌적하면서도 교통 편의성이 좋고 동판교의 중심상업지구와도 거리가 가깝다. 대우건설 컨소시엄의 4공구는 운중천을 끼고 있고 판교공원을 마주하고 있어 조망권이 빼어난 곳으로 꼽힌다. 3공구 현대 컨소시엄 33평 판상형 가족 커뮤니티 공간 눈길 39평 타워형 녹지보며 식사 전원분위기 ◇3공구 현대건설 컨소시엄 현대건설과 한신공영 반도건설 컨소시엄이 맡은 3공구는 39ㆍ45ㆍ57ㆍ69평형 등 모두 4개 평형으로 구성돼 있다. 39평형 판상형은 주 수요자가 30 40대인 점을 고려 가족의 커뮤니티 공간에 신경쓴 것이 특징이다. 부부존 zone 과 자녀존이 구분돼 있으면서도 중심에는 공동생활 공간이 배치돼 있다. 가족들이 얼굴을 마주볼 수 있는 ‘ㄷ’자 대면형 주방으로 작업동선의 효율성을 높였고 거실과 주방을 ‘통경축’으로 이어 자연환기가 잘 되도록 했다. 타워형 39평형은 탁 트인 조망이 가능한 부지의 장점을 살려 3면 개방형으로 설계됐다. 식당에서 녹지를 바라볼 수 있어 전원 분위기가 느껴질 전망이다. 4베이 평면의 39평형에는 거실과 침실1ㆍ2에는 가변형 벽체가 세워져 필요에 따라 공간을 자유롭게 활용할 수 있다. 시카모아 무늬목과 천연대리석 하이그로시 도장 등이 적용돼 마감재의 품격이 높은 편이다. 45평형 판상형의 경우 자녀수에 따라 침실3을 ‘마스터 존’으로 바꿔 활용할 수 있게 한 것이 눈에 띈다. 보조주방을 ‘？？ 존 Wet Zone ’과 ‘드라이 존 Dry Zone ’으로 구분해 주부들의 공간활용에 편의를 더했다. 57평형은 가족 구성원의 프라이버시를 지키면서도 넓은 공간과 개방감의 공동 생활공간이 조화를 이루고 있다. 4공구 대우 컨소시엄 고급 마감재로 도시풍 연출 40A평형 확장감 극대화 평면설계 돋보여 ◇4공구 대우건설 컨소시엄 대우건설이 계룡건설과 짝을 이뤄 짓는 4공구에는 수요자의 연령별 특성을 고려한 33 62평형대 다양한 평면이 선보였다. 33평형 A타입은 집 전체를 밝고 화사한 아이보리 톤으로 꾸며 도시적 감성을 연출하는 데 주안점을 뒀다. 현관에서부터 천연대리석 바닥재와 고급 액자몰딩의 현관 은경 등 국민주택 규모 아파트로서는 상당히 고급스런 마감재가 시선을 끈다. 거실의 대형 우물형 천정이 개방감을 더해주고 침실에는 드레스룸 붙박이장과 화장대가 설치돼 있다. 40평형 A타입은 인조가죽 소재의 거실 아트월과 주방의 수입 폴리싱 타일 바닥재 등이 전체적인 품격을 높혀준다. 전체적으로는 따뜻한 화이트크림 톤으로 여성스럽고 로맨틱한 느낌을 연출했다. 발코니 확장을 전제로 한 평면 설계로 공간 확장감을 극대화할 수 있다. 46평형의 경우 무채색 톤의 절제된 컬러 대비로 44평형과는 사뭇 다른 느낌의 남성적 분위기를 풍긴다. 62평형은 레드 브라운을 테마 색채로 삼아 깊이와 격조가 느껴지는 클래식한 분위기를 연출했다.,https://news.naver.com/main/read.nhn?mode=LSD&mid=shm&sid1=260&oid=011&aid=0000144463,31
20950,2006.08.10. 오후 4:18,부동산,서울경제,동문·월드 파주신도시 분양 내년으로 미뤄,파주 신도시의 일부아파트 분양일정이 다소 미뤄지게 됐다. 대한주택공사는 “지난 6월부터 시작된 파주 운정1지구 36곳에 대한 문화재 조사에서 전체 시굴면적 27만4 000평 의 17%인 4만7 000평에서 구석기시대의 만들어진 것으로 추정되는 돌도끼를 비롯한 유물 등이 출토돼 정밀조사를 실시중”이라고 10일 밝혔다. 이에 따라 해당 부지에서 문화재가 나오지 않은 한라건설 937가구 을 제외하고 이곳에서 연내 분양예정이던 동문건설 월드건설 등 2개 업체의 주택공급이 내년으로 늦춰지게 됐다. 주공 관계자는 “구체적인 향후 공급시기는 문화재 발굴작업의 진척도에 따라 정해질 것”이라고 설명했다.,https://news.naver.com/main/read.nhn?mode=LSD&mid=shm&sid1=260&oid=011&aid=0000144462,31
20951,2006.08.10. 오후 4:18,부동산,서울경제,불법오락실 괜히 들였네…,상권단절·상가가치 떨어져 건물주들 속앓이 “임대료를 올려달라 그럴 수도 없고 나가라고도 못하고…” 서울 광진구 능동에 작은 건물을 소유한 A씨는 최근 1층에 입점한 오락실을 볼 때마다 한숨이 나온다. 처음에는 꼬박꼬박 내는 임대료가 반가워 덜컥 임대차 계약을 맺었지만 시간이 지날수록 잘못 선택했다는 생각이 들기 때문이다. 다른 임차인들이 항의라도 할 땐 가슴이 덜컥 내려앉는 듯 하다. 근린상가 1층을 중심으로 불법오락실이 급속히 퍼지면서 중소형 건물주들이 울상을 짓고 있다. 불법오락실이 들어선 후 주변상권까지 부정적 영향이 미치고 있기 때문이다. 가뜩이나 상가시장이 불황인 데다 임대인을 구하기도 힘든 상태에서 혐오시설로 분류되는 오락실이 들어서자 상권이 단절되고 상가가치가 더 떨어지는 것이다. 여기에 임차인도 임대료를 올려달라거나 점포를 비워달라고 요구하기 거북한 상대인 경우가 많아 건물주들은 계약기간이 끝나기만을 기다리며 속앓이하고 있다. 불법오락실은 비 非 강남권일수록 더 심해 일반 대로변 상가는 물론 최근에는 주택가 옆 근린상가까지 속속 입점하고 있다. 유영상 상가114 소장은 “상권이 살아나기 위해서는 다양한 업종이 들어서야 하는데 최근 강북을 중심으로 불법오락실이 급속히 퍼지면서 상권을 더 죽이고 있다”며 “강남과 강북 대형 아파트단지 인근 신규 상가와 주택가의 오래된 상가의 격차가 더욱 벌어지고 있다”고 말했다.,https://news.naver.com/main/read.nhn?mode=LSD&mid=shm&sid1=260&oid=011&aid=0000144459,31
20952,2006.08.10. 오후 4:12,부동산,서울경제,이 단지 어때요 목동 e편한세상,명문학군에 뛰어난 외관…공원·녹지 많아 쾌적함까지 47평형 166가구등 총 276가구 지하철 9호선 건설등 호재 많아 32평기준층6억7 000만원호가 분양가보다 2억원 이상 껑충 ‘교육환경이 뛰어난 곳에서 쾌적함과 편리함을 누릴 수 있는 아파트’ ㈜삼호가 서울 목동에 지은 ‘e 편한세상’ 입주민들의 한결 같은 자랑이다. 최근 입주를 시작한 목동 e 편한세상은 명문학군으로 유명하고 초고층 주상복합 입주 지하철 9호선 건설 등 호재가 많은 목동신시가지 바로 옆에 자리 잡은데다 단지배치와 실내인테리어ㆍ마감재 등이 뛰어나 높은 평가를 받고 있다. 목동 e 편한세상은 7 15층짜리 8개동에 32평형 54가구 47평형 166가구 56평형 56가구 총 276가구로 구성됐다. 대형인 47평형이 주력 평형인 셈이다. 이 아파트가 눈길을 끄는 것은 무엇보다 외관이다. 목동지역에서는 보기 드물게 아파트 외벽이 화강석으로 마감됐고 지난해 업계 최초로 미술저작권이 등록된 단지외관 입면디자인이 적용돼 고급스러운 느낌이 난다. 위치 또한 관심을 끌기에 충분하다. 월촌초등학교와 신목중학교 등 있어서 목동신시가지 중에서도 대표적인 명문학군으로 꼽히는 2단지 맞은 편에 터를 잡고 있다. 또 용왕산 자연공원이 단지 옆에 펼쳐져 있고 목동종합운동장 파리공원 등도 단지와 가까워 도심 속에서 찾기 어려울 정도로 쾌적한 주거환경을 확보하고 있다. 단지 내부의 쾌적성은 목동 e 편한세상을 더욱 돋보이게 한다. 단지 안에 친환경적 녹지가 비교적 많은 편이다. 특화된 조경방식도 눈에 띈다. 1 3동의 옹벽 150여m에 돌을 쌓아 암벽처럼 보이도록 했다. 단지 정원 곳곳에는 고급 수종의 소나무를 심고 목재울타리 등을 설치했다. 현장 소장인 이창수 부장은 “목동 중대형 평형의 랜드마크 아파트를 목표로 강남의 고급 주상복합 수준에 맞게 시공했다”며 “특히 친환경적 단지를 만들기 위해 조경설계를 여러 차례 개선하는 등 공을 많이 들였다”고 밝혔다. 단지를 이처럼 시원하고 자연 친화적 조경으로 꾸밀 수 있었던 것은 지상 주차장을 없애고 지하에 주차공간을 마련했기 때문이다. 지하 주차장은 546대가 동시 주차할 수 있도록 넉넉하게 설계됐다. 세대당 2대 정도의 주차가 가능한 셈이다. 지하주차장 이용이 편리하도록 지하 2층까지 엘리베이터를 연결한 점도 특징이다. 실내 평면과 마감재 등도 자랑거리다. 발코니 확장 합법화 이전에 분양되었지만 확장 때 장애가 되는 내력벽이 없도록 거실과 침실이 확장형 평면으로 설계됐으며 1.8m의 광폭발코니가 설치됐다. 56평형의 경우 가변형 벽체로 시공돼 거실 또는 침실을 소비자의 기호에 따라 더 넓게 사용할 수 있다. 다만 단지규모가 비교적 작은 점이 단점으로 꼽히고 있다. 시세는 현재로선 정확히 알 수 없다. 이 지역이 투지지역으로 묶여 있어 입주 후 2년간 매매할 수 없기 때문이다. 2004년 분양 당시 기준층의 분양가는 32평형 4억3 200만원 47평형 7억원 56평형 8억2 500만원선이었다. 그러나 인근 중개업소들이 추정하는 매매가격은 32평형 6억7 000만원 47평형 9억2 300만 11억원 56평형 11억 13억원선이다. 2억 4억원 정도의 웃돈이 붙었다는 얘기다. 신시가지 아파트를 제외한 인근 대단지 아파트 시세와 비슷하다. 지난해 7월 1 100여가구 규모로 입주해 그 일대에서 가장 인기가 높은 롯데캐슬위너 32평형은 최근 7억5 000만원에 팔렸다. 하지만 신시가지 아파트에 비해선 턱 없이 낮다. 2단지의 35평형은 12억원 45평형은 16억 17억원 55평형은 20억 22억원 정도이다. 인근 중개업소 관계자는 “매매를 할 수 없는데도 입주시기에 맞춰 시세 등을 문의하는 전화가 이따금씩 걸려오고 있다”며 “신시가지 안의 아파트 시세가 크게 올랐고 주변에 새 아파트가 많지 않아 목동 e 편한세상에 대한 기대감이 높아지고 있다”고 전했다.,https://news.naver.com/main/read.nhn?mode=LSD&mid=shm&sid1=260&oid=011&aid=0000144457,31
20953,2006.08.10. 오후 4:08,부동산,매일경제,이천 송정동 동양파라곤 8월 25일 MH 오픈,동양건설산업은 수도권의 떠오르는 주거지로서 3기신도시 유력후보지로 꼽히는 경기 이천시에 유럽풍 주거명작 이천 송정동 동양파라곤 324세대를 분양한다. 분양가는 평당 600만원 선이며 35평형 46평형 49평형 58평형까지 총324세대로 구성되어 있다. 동양건설산업이 이천 송정동에 공급하는 이천 동양파라곤은 지역에서는 처음으로 도입되는 확장형 신평면 유럽풍 외관의 고급 아파트로 향과 조망을 고려한 설계가 특징이다. 또한 단지 내 고저차를 이용해 합리적인 주차계획을 도입했으며 1층을 필로피로 만들어 개방감과 안정감을 높였다. 동양건설산업 오재순 홍보팀장에 의하면 어린이 등 노약자들의 안전을 고려해 보행자와 차량의 동선을 분리하고 지상을 공원화하여 유럽풍 고품격 테마정원으로 조성함으로써 정원이 아름다운 유럽풍 주거명작이라는 테마로서 이천의 랜드마크로 새롭게 자리매김할 것으로 보여진다 고 말했다. 이천 송정동은 2008년 완공 예정인 성남 이천 장호원을 잇는 자동차 전용도로와 성남 이천 여주간 복선전철 행정타운 조성 등 다양한 지역개발 호재로 새롭게 주목 받는 지역이다. 이천 구도심과의 접근성이 양호하면서도 녹지환경과 교육환경이 우수해 동양 신일 수림1 2차 등 2 400세대가 신 주거타운을 형성하고 있다. 교통여건으로는 중부고속도로 서이천 IC 영동고속도로 이천 IC 3번 국도 42번 국도가 가깝다. 생활편의시설로는 이마트가 5분 거리에 위치하고 있으며 이천고를 비롯한 명문 초 중 고교가 인접해 있다.,https://news.naver.com/main/read.nhn?mode=LSD&mid=shm&sid1=260&oid=009&aid=0000522205,31
20954,2006.08.10. 오후 4:03,부동산,서울경제,한국건축문화대상 심사현장 스케치,폭염 뚫고 1 500㎞ 강행군 공법·재료·마감재는 물론 설계철학까지 송곳 점검 배정시간 넘기는 곳 허다 주민·단체장도 깊은 관심 건축문화대상 위상 실감 지난 7일 오전7시30분. 8명의 준공건축물 부문 심사위원과 진행요원들이 가벼운 옷차림으로 서울 서초동 대한건축사협회 정문 앞의 버스에 올랐다. 올해로 15회를 맞는 국내 최고 권위의 건축대상인 ‘2006 한국건축문화대상 현장심사’의 시작이다. 준공건축물 부문 지방 작품 현장심사는 총 이동거리가 1 500여㎞에 달하는 강행군이었다. 1차 서류심사를 통과한 28개 작품 중 지방 작품이 여느 해보다 많은 비중을 차지한 탓이었다. 특히 첫날부터 천안 청원 대전 전주 군산 무안으로 이어지는 대장정은 30도가 넘는 불볕더위와 어우러져 심사위원들의 혀를 내두르게 했다. 하지만 이 같은 악조건에도 심사위원들의 열정은 식을 줄 몰랐다. 한국건축문화대상 시행위원장이기도 한 장양순 위원 창건축 대표 은 “전국을 돌면서 좋은 작품들을 볼 수 있으니 이게 휴가 아니겠느냐”고 말했다. 심사는 건축주와 설계자의 간단한 현장 브리핑과 작품 심사 등 30분 동안 이뤄질 예정이었다. 하지만 이 같은 계획은 천안 천안시청사 에서의 첫 심사부터 어긋났다. 심사위원들이 작품 구석구석을 돌며 전체적인 외형이나 구조뿐 아니라 공법ㆍ재료는 물론 마감재 등에까지 관심을 보이며 ‘집요하게’ 파고든 탓이었다. 규모가 작은 단독주택이라고 다르진 않았다. 각 공간의 배치가 효율적으로 이뤄졌는지 외부 노출로 사생활이 침해받을 여지는 없는지 또는 실생활의 불편을 초래하는 설계ㆍ시공상의 허점이 있는지 등을 하나하나 점검해 기록하는 등 뜨거운 열정을 보이느라 심사시간이 배정된 30분을 넘어 1시간을 훌쩍 넘기는 곳도 많았다. 2일차인 8일 역시 강행군의 연속이었다. 이번에는 남부지방을 동 서로 횡단하면서 무안에서 나주 남해 김해를 거쳐 부산에 이르는 여정이었다. 심사위원들이 내심 ‘기대했던’ 태풍마저 빗겨나가고 더욱 뜨거워진 날씨는 도로의 아스팔트를 녹여버릴 기세였다. 이따금 눈에 들어오는 피서지 풍경에 ‘작품 심사 휴가’를 떠난 심사위원들과 진행요원들은 아예 눈을 돌리고 싶을 정도였다. 8명의 심사위원들이 이번 심사에서 특히 관심을 보인 부분은 설계 시공 건축주가 얼마나 호흡을 맞추며 작품의 완성도를 높였는가였다. 작품 중 납득이 가지 않는 부분에 대해서는 설계ㆍ시공자와 건축주에게 끊임없이 질문공세를 펼치는가 하면 설계자의 의도는 물론 설계철학까지 평가대상으로 삼는 분위기였다. 심사가 열기를 더하면서 2일차 마지막 심사 작품이었던 부산 재송동 C아파트의 심사는 오후9시가 돼서야 마칠 수 있었고 심사위원들은 시원스러운 바닷가의 야경 감상도 포기하고 파김치가 돼 휴식을 취해야 했다. 지방 심사 마지막날인 9일 아침. 출발을 위해 숙소 로비에 집결한 심사위원들의 표정에는 여전히 의욕이 넘쳐 있었다. 진지한 표정으로 심사 작품에 대한 서로의 의견을 교환하는가 하면 아직 심사가 남아 있는 작품들에 대한 자료를 검토하며 분주한 모습이었다. 이동하는 버스 안은 열띤 토론장이었다. 화두도 작품 심사에서부터 건축ㆍ건설산업 전반의 문제점 등으로 이어졌다. 유원재 위원 다건축 대표 은 이동 중이나 식사 중 틈틈이 심사위원들의 인물화를 그려주는가 하면 간단한 마술을 보여주는 등 피로에 지친 일행에게 즐거움을 주기도 했다. 유 위원은 대한건축사협회지인 ‘건축사’에 만평을 게재하고 있다. 심사과정에서는 한국건축문화대상이 우리 건축계에서 차지하는 비중이 얼마나 큰지 느낄 수 있는 사례도 많았다. 대전의 A아파트 심사에서는 주민들이 직접 심사위원을 맞이하고 심사과정을 관심 깊게 지켜보는가 하면 남해의 B사 연수원 심사에는 하영제 남해군수까지 직접 심사장을 방문해 심사위원들을 격려하기도 했다. 이상준 심사위원장 연세대 공대교수 은 “올해 한국건축문화대상 심사 대상작에서 지방 작품들이 많았던 것은 그만큼 지방 작품의 수준이 올라간 것을 의미한다”며 “특히 이번 한국건축문화대상은 지방 건축계에 대한 관심을 높이는 계기도 될 것”으로 평가했다. 구미에서 3일간의 심사를 마치고 서울로 향하는 버스에 오른 심사위원들의 얼굴은 검게 탔고 몸은 지쳐 보였지만 그들의 열정에서 올해도 한국건축문화대상이 좋은 결실을 거둘 수 있음을 느꼈다.,https://news.naver.com/main/read.nhn?mode=LSD&mid=shm&sid1=260&oid=011&aid=0000144450,31
20955,2006.08.10. 오후 4:03,부동산,서울경제,자족형 택지지구 노려라,청약제 변경 영향받는 고소득·맞벌이 가구 파주 운정·용인 흥덕지구등 관심 가져볼만 ‘판교만한 자족형 택지지구를 찾아라.’ 분양시장이 깊은 침체의 수렁에 빠져 실수요자 위주로 분양시장이 재편되면서 판교 신도시처럼 자족기능까지 갖춘 택지지구에 대한 관심이 더욱 집중되고 있다. 최근 분양에 나선 아파트의 경우 택지지구 분양물량만이 체면치레를 하고 있기 때문이다. 특히 오는 2008년부터 청약제도가 가점제 위주로 크게 바뀌면서 상대적으로 불리한 입장이 되는 고소득의 맞벌이 가구나 단독통장 가입자들이 청약통장을 앞당겨 사용하려는 경향도 있어 올해와 내년에 분양되는 택지지구 아파트의 인기는 크게 높아질 것으로 보인다. 내 집 장만을 하려는 사람들은 우선 하반기에 분양이 예정된 파주 운정지구 용인 흥덕지구 인천 송도국제도시 광주 수완지구 등 입지여건이 좋은 자족형 택지지구에 관심을 가져볼 만하다. 파주 운정지구는 자족형 택지지구 중 가장 대표적인 지역으로 손꼽힌다. 주변에 일산 신도시와 교하지구가 있고 파주LCD단지ㆍ출판문화정보산업단지ㆍ고양국제전시장 등으로 인해 성장잠재력이 크며 경의선 복선전철 제2자유로가 개통되면 주변 지역으로의 접근성은 지금보다 좋아질 전망이다. 한라건설이 이달 말 40 95평형 937가구의 아파트 공급을 위해 모델하우스를 짓고 있으며 벽산건설은 11월 25 44평형 3 000가구의 대규모 분양을 예정 중이다. 용인 흥덕지구도 주목할 만하다. 위로는 광교 테크노밸리 아래로는 영통신시가지와 연결돼 전체적으로 500만평 규모의 생활권을 형성한다. 디지털 시범도시로 개발되는 흥덕지구에는 호반건설 34평형 530가구 경기지방공사 32평형 506가구 경남기업 43ㆍ58평형 931가구 등이 연말쯤 분양계획을 잡고 있다. 국제도시로 개발되는 송도 신도시는 향후 20여년간 개발계획이 세워져 있다. 외국 자본의 투자유치를 위해 경제특구로도 지정됐다. 포스코건설ㆍGS건설 등이 주상복합ㆍ아파트를 분양한다. 지방 택지지구로는 광주 수완지구와 마산 진동 신도시를 꼽을 수 있다. 광주 수완지구는 주변으로 광주첨단과학산업단지를 비롯해 상무ㆍ하남ㆍ신창지구 등 각종 택지지구가 산재해 서북부지역의 중심도시로 부상하고 있다. 마산 진동 신도시는 산업단지와 택지지구가 결합된 대규모 자족신도시이다. 2008년 7월 준공 예정인 진북산업단지는 6 180명의 고용효과를 올릴 것으로 예상되고 있다.,https://news.naver.com/main/read.nhn?mode=LSD&mid=shm&sid1=260&oid=011&aid=0000144447,31
20956,2006.08.10. 오후 3:59,부동산,머니투데이,추건교 무안국제공항 2007년 조기 개항2보,머니투데이 원정호 기자 외국인들의 투자를 활성화하기 위해 무안국제공항을 당초 2008년 개항 목표를 앞당겨 내년에 조기 개통하겠다 추병직건설교통부장관은 10일 서울 대한상공회의소에서 열린 무안기업도시 투자 유치설명회 에서 무안국제공항을 조기 개항할 것이라고 밝혔다. 이에 따라 무안 기업도시 건설이 활기를 띨 전망이다. 이날 설명회는 무안기업도시개발이 한중국제산업단지개발 및 한미파슨스와 공동 주관으로 진행된 행사로 무안기업도시의 비전 및 성과를 소개하고 투자 기업들에 제공되는 혜택을 설명하기 위해 마련됐다. 행사에는 추병직 건교부 장관을 비롯해 이근경 전남 정무부지사 서삼석 무안군수 곽향동 중국광하그룹 회장 코트라 알란팀블릭 투자자문관 대기업 금융기관 건설업체 투자기관 대표 등이 참석했다. 한편 총 1220만평 규모로 들어설 무안기업도시는 생산과 교역이 복합된 한중 자유교역도시로 개발된다. 2011년까지 사업이 진행되며 기반 조성단계에서 약 3조원이 투자된다. 전체 1220만평 중 620만평은 무안기업도시개발이 나머지 600만평은 한중산업단지개발이 각각 개발을 담당한다.,https://news.naver.com/main/read.nhn?mode=LSD&mid=shm&sid1=260&oid=008&aid=0000690433,31
