,date,cat,co,headline,text,url,week
24745,2006.09.18. 오후 12:21,부동산,머니투데이,SH공사은평뉴타운 수익 5%불과상보,머니투데이 김경원 기자 서울시가 은평뉴타운으로 집장사를 하고 있다는 비난이 일자 분양원가를 공개했다. 서울시와 SH공사는 은평뉴타운 34평형의 분양가 1151만원 41평형 1391만원 53평형 1500만원 65평형 1523만원 에 대한 원가를 9월말 분양공고시 공시할 예정이라고 18일 밝혔다. 시와 SH공사는 은평뉴타운 34평형은 입주예정자 70% 이상이 원주민들에게 공급되기 때문에 분양원가로 분양가격을 결정했다고 설명했다. 또 41평 이상은 유주택자도 청약이 가능하기 때문에 당첨자의 과도한 시세 차익으로 또 다른 투기현상을 예방하기 위해 5%의 수익률을 남겼다고 강조했다. 시는 수익이 발생하면 공공임대주택 건설 재원과 임대아파트 운영 등 저소득시민을 위한 공익사업에 사용키로 했다. 시와 SH공사는 평당 분양가가 높은 이유는 토지보상비가 많이 들어갔고 기반시설 비용 상승했기 때문이라고 밝혔다. 시와 SH공사에 따르면 토지보상비 측면에서 은평뉴타운은 30년 전부터 개발돼 대지비율이 높아 보상비가 많이 투입됐다. 판교는 대지가 6%인 반면 은평뉴타운은 40%를 차지한다. 또 기반시설비 측면에서 은평뉴타운은 가용면적 비율이 51%로 불과하고 용적률도 평균 152%로 계획하면서 대지지분이 증가해서 토지비가 상승했다고 해명했다. 이에 대해 업계 관계자는 “분양가를 결정하고 택지비와 건축비를 짜 맞춘 것 같다는 느낌이 든다”며 “건축비가 판교보다도 높게 책정된 점은 이해가 되질 않는다”고 지적했다. 34평 은평뉴타운의 건축비는 515만원이고 41∼65평형은 560만8000원이다. 판교 33평의 건축비가 499만1000원 39∼68평형은 514만2000원인 점을 감안하면 은평뉴타운의 건축비가 높은 셈이다. 그는 “모델하우스를 놓고 비교해 봤을 때 은평뉴타운은 판교보다 조금 떨어지는 것으로 보이는데 건축비가 더 들어갔다는 게 이상하다”며 “원주민에게 보상가를 많이 주면서 손실비를 보전하려는 게 아닌지 의문이 든다”고 말했다.,https://news.naver.com/main/read.nhn?mode=LSD&mid=shm&sid1=260&oid=008&aid=0000702063,37
24746,2006.09.18. 오후 12:09,부동산,머니투데이,SH공사 은평뉴타운 수익률 5% 책정2보,머니투데이 김경원 기자 서울시가 은평뉴타운으로 집장사를 하고 있다는 비난이 일자 분양원가를 공개했다. 서울시와 SH공사는 은평뉴타운 34평형의 분양가 1151만원 41평형 1391만원 53평형 1500만원 65평형 1523만원 에 대한 원가를 9월말 분양공고시 공시할 예정이라고 18일 밝혔다. 시와 SH공사는 은평뉴타운 34평형은 입주예정자 70% 이상이 원주민들에게 공급되기 때문에 분양원가로 분양가격을 결정했다고 설명했다. 또 41평 이상은 유주택자도 청약이 가능하기 때문에 당첨자의 과도한 시세 차익으로 또 다른 투기현상을 예방하기 위해 5%의 수익률을 남겼다고 강조했다. 시는 수익이 발생하면 공공임대주택 건설 재원과 임대아파트 운영 등 저소득시민을 위한 공익사업에 사용키로 했다. 시와 SH공사는 평당 분양가가 높은 이유는 토지보상비가 많이 들어갔고 기반시설 비용 상승했기 때문이라고 밝혔다. 시와 SH공사에 따르면 토지보상비 측면에서 은평뉴타운은 30년 전부터 개발돼 대지비율이 높아 보상비가 많이 투입됐다. 판교는 대지가 6%인 반면 은평뉴탕운은 40%를 차지한다. 또 기반시설비 측면에서 은평뉴타운은 가용면적 비율이 51%로 불과하고 용적률도 평균 152%로 계획하면서 대지지분이 증가해서 토지비가 상승했다고 해명했다.,https://news.naver.com/main/read.nhn?mode=LSD&mid=shm&sid1=260&oid=008&aid=0000702061,37
24747,2006.09.18. 오후 12:05,부동산,연합뉴스,서울 주택보급률 89.7%..주택난 심각,서울 주택보급률 89.7%..주택난 심각 수도권도 96.8% 그쳐 전남은 135.4%로 최고 건교부 시.도별 주택보급률 발표 서울 연합뉴스 유경수기자 서울의 주택보급률이 90%에도 미치지 못해 주택난이 여전히 심각한 것으로 나타났다. 18일 건설교통부가 지난해 인구주택총조사 자료를 바탕으로 시.도별 주택보급률을 조사한 결과 서울의 주택수는 232만1천900채로 총 가구수 258만7천500가구 대비 주택보급률이 89.7%에 불과했다. 이는 2000년 센서스조사때 보급률 77.4% 주택 197만3천200채 254만8천100가구 에 비해서는 8.9%포인트 높아진 것이나 주택보급률 적정선 120 130% 에는 크게 못미쳐 당분간 서울의 주택부족은 쉽게 해소되지 않을 것으로 보인다. 주택보급률은 주택 수를 보통가구 혈연가구 수로 나눈 뒤 100을 곱한 것으로 주택수는 다가구를 1주택으로 계산하고 빈집을 포함해 산정된다. 보통가구는 총 가구에서 1인 비혈연 외국인 집단거주 등 가구를 뺀 것이다. 경기도도 주택이 273만6천200채로 가구수 271만5천700가구를 조금 넘는 정도 100.8% 여서 그간 용인 파주 하남 화성 등 곳곳에서의 택지개발사업에도 불구 적정 수준에 미달했다. 수도권 주택보급률은 인천 107.6% 을 포함 주택 578만1천800채 597만5천700가구로 96.8%의 보급률을 기록 5년전 86.1% 보다 10.7%포인트 늘었지만 여전히 100%를 넘지는 못한 모습이었다. 이외에 주택보급률이 낮은 곳은 대구 92.5% 울산 99.7% 부산 101.4% 대전 102% 광주 103.2% 등 대도시권이었다. 전국에서 주택보급률이 가장 높은 곳은 전남으로 135.5%에 달했으며 충남 129.1% 강원 126.8% 경북 126% 전북 125.5% 충북 119.8% 경남 115.8% 제주 111.1% 등도 적정선을 넘거나 육박했다. 건교부 관계자는 보급률 통계에는 최근 크게 늘고 있는 1인가구 외국인가구 등이 빠져 있고 다가구 주택을 정상주택에서 제외하는 등 다소 현실성이 떨어져 좀 더 통계의 정확성을 기하기 위해 새로운 통계방법을 연내에 만들 계획 이라고 말했다.,https://news.naver.com/main/read.nhn?mode=LSD&mid=shm&sid1=260&oid=001&aid=0001907505,37
24748,2006.09.18. 오후 12:05,부동산,연합뉴스 TV,서울 주택보급률 89.7%..주택난 심각,서울 주택보급률 89.7%..주택난 심각 수도권도 96.8% 그쳐 전남은 135.4%로 최고 건교부 시.도별 주택보급률 발표 서울 연합뉴스 유경수기자 서울의 주택보급률이 90%에도 미치지 못해 주택난이 여전히 심각한 것으로 나타났다. 18일 건설교통부가 지난해 인구주택총조사 자료를 바탕으로 시.도별 주택보급률을 조사한 결과 서울의 주택수는 232만1천900채로 총 가구수 258만7천500가구 대비 주택보급률이 89.7%에 불과했다. 이는 2000년 센서스조사때 보급률 77.4% 주택 197만3천200채 254만8천100가구 에 비해서는 8.9%포인트 높아진 것이나 주택보급률 적정선 120 130% 에는 크게 못미쳐 당분간 서울의 주택부족은 쉽게 해소되지 않을 것으로 보인다. 주택보급률은 주택 수를 보통가구 혈연가구 수로 나눈 뒤 100을 곱한 것으로 주택수는 다가구를 1주택으로 계산하고 빈집을 포함해 산정된다. 보통가구는 총 가구에서 1인 비혈연 외국인 집단거주 등 가구를 뺀 것이다. 경기도도 주택이 273만6천200채로 가구수 271만5천700가구를 조금 넘는 정도 100.8% 여서 그간 용인 파주 하남 화성 등 곳곳에서의 택지개발사업에도 불구 적정 수준에 미달했다. 수도권 주택보급률은 인천 107.6% 을 포함 주택 578만1천800채 597만5천700가구로 96.8%의 보급률을 기록 5년전 86.1% 보다 10.7%포인트 늘었지만 여전히 100%를 넘지는 못한 모습이었다. 이외에 주택보급률이 낮은 곳은 대구 92.5% 울산 99.7% 부산 101.4% 대전 102% 광주 103.2% 등 대도시권이었다. 전국에서 주택보급률이 가장 높은 곳은 전남으로 135.5%에 달했으며 충남 129.1% 강원 126.8% 경북 126% 전북 125.5% 충북 119.8% 경남 115.8% 제주 111.1% 등도 적정선을 넘거나 육박했다. 건교부 관계자는 보급률 통계에는 최근 크게 늘고 있는 1인가구 외국인가구 등이 빠져 있고 다가구 주택을 정상주택에서 제외하는 등 다소 현실성이 떨어져 좀 더 통계의 정확성을 기하기 위해 새로운 통계방법을 연내에 만들 계획 이라고 말했다.,https://news.naver.com/main/read.nhn?mode=LSD&mid=shm&sid1=260&oid=130&aid=0000011188,37
24749,2006.09.18. 오전 11:58,부동산,연합뉴스,서울시 은평뉴타운 분양원가 공개종합,34평 분양가 분양원가와 동일하게 적용 2천66가구 분양에 680억원 수익 예상 서울 연합뉴스 정성호 기자 서울시는 최근 고 高 분양가 논란에 휩싸인 은평 뉴타운의 분양 원가를 18일 공개했다. 허영 서울시 주택국장은 은평 뉴타운이 시범 뉴타운 사업 지역임을 감안 고분양가 논란과 관련한 오해를 불식시키고 분양 가격의 투명성을 알리기 위해 분양 원가를 공개하기로 했다 고 말했다. 은평 뉴타운은 도시개발사업으로 추진돼 분양 가격 공시의무 대상이 아니지만 고분양가 논란이 일자 분양 원가를 공개하게 된 것으로 풀이된다. 시가 공개한 분양 원가 내역에 따르면 평균 분양원가는 국민주택 규모인 34평형의 경우 1천151만원이었으며 평균 분양 가격도 원가와 동일하게 1천151만 원으로 정해졌다. 입주 예정자의 70% 이상이 원주민인 점을 고려해 분양가격을 원가와 동일하게 적용했다는 것이 서울시의 설명이다. 나머지 평형의 분양 원가는 41평형 1천321만7천 원 53평형 1천425만6천 원 65평형 1천446만8천 원이라고 서울시는 설명했다. 이들 평형의 분양 가격은 수익률 5%를 얹어 각각 1천391만3천 원 1천500만7천 원 1천523만1천 원으로 정해졌다. 허 국장은 수익률 5%는 주변 시세와의 차익 미분양으로 인한 리스크 관리 과도한 시세 차익으로 인한 투기 방지 등을 위해 정한 수치 라며 추가로 분양될 은평 뉴타운에도 이 수익률이 적용될 것 이라고 설명했다. 그는 전체 분양 물량 1만5천200가구 중 2천66가구를 이번에 분양하는데 이 경우 분양 수익은 680억 원 정도에 이를 것으로 예상된다 고 덧붙였다. 시는 분양 수익을 공공 임대주택 건설 재원 및 임대 아파트 운영 등 저소득 시민을 위한 공익사업으로 사회에 환원할 계획이다. 허 국장은 고분양가 논란과 관련 판교 신도시와 비교할 때도 특별히 분양가가 높지는 않다 면서 토지 보상비의 경우 판교가 111만6천 원 은평이 321만 원 수준으로 세 배 가량 차이가 나지만 이는 은평의 경우 대지가 40% 판교는 6% 에 달하는 등 개발된 지역이 많았기 때문 이라고 말했다.,https://news.naver.com/main/read.nhn?mode=LSD&mid=shm&sid1=260&oid=001&aid=0001413865,37
24750,2006.09.18. 오전 11:51,부동산,뉴시스,주공 광주진월 휴먼시아 분양,광주 뉴시스 대한주택공사는 광주시 남구 진월동택지개발지구내에 30평형 및 33평형 11개동 576세대를 분양한다. 이번에 분양하는 단지는 진월지구를 감싸고 있는 숲과 기존의 호수인 노대제를 살린 근린공원 7천여평 조성 녹지율 25% 해발 395m 분적산 위치 등으로 쾌적한 자연환경을 갖추고 있다. 이와 함께 제2순환로 연결을 중심으로 나주 목포지역 및 화순 상무.풍암.첨단지구 등 광주도심을 잇는 교통여건이 좋으며 단지 인근 학교 소재 및 개발지구내 초중학교 개소 등으로 교육여건도 양호한 편이다. 또 계약일로부터 1년 후 전매가 가능하고 평당 490만원대의 저렴한 분양가 등으로 투자가치가 높다는 평가를 받고 있다. 분양 규모는 11개동 576세대 30평 182 33평 394 테라스하우스 33평 세대 등이며 오는 2007년 12월 입중 예정이다. 분양가격은 30평형 1억4천930만원 33평형은 1억6천860만원이다. 분양 대상은 최초 입주자 모집 공고일인 19일 현재 광주시 거주 무주택 세대주 신청 접수는 오는 25 27일 계약일은 다음달 18 20일이다.,https://news.naver.com/main/read.nhn?mode=LSD&mid=shm&sid1=260&oid=003&aid=0000182683,37
24751,2006.09.18. 오전 11:40,부동산,연합뉴스,서울시 은평뉴타운 분양원가 공개1보,서울 연합뉴스 정성호 기자 서울시는 최근 고 高 분양가 논란에 휩싸인 은평 뉴타운의 분양 원가를 18일 공개했다. 시가 공개한 분양 원가 내역에 따르면 국민주택 규모인 34평형의 경우 평균 분양 원가는 1천151만 원이며 평균 분양 가격도 원가 그대로 1천151만 원으로 정했다.,https://news.naver.com/main/read.nhn?mode=LSD&mid=shm&sid1=260&oid=001&aid=0001413835,37
24752,2006.09.18. 오전 11:38,부동산,노컷뉴스,서울에서 집 사기 여전히 힘드네..,서울 89.7% 수도권 96.8% 전국 최고는 전남 135.5% 서울의 주택보급률이 90%에도 미치지 못해 주택난이 여전했으며 주택보급률이 적정하지 못한 곳은 부산산 대전 등 주로 대도시권인 것으로 조사됐다. 건설교통부가 지난해 시 도별 주택보급률을 조사한 결과 서울의 주택 수는 232만1900채로 총 가구 수 258만7500가구 대비 주택보급률은 89.7%에 불과했다. 이는 2000년 센서스 조사 때 보급률 77.4%에 비해서는 8.9%포인트 높아진 것이지만 주택보급률 적정선 120에서 130%에는 크게 못 미쳐 당분간 서울의 주택 부족은 쉽게 해소되지 않을 전망이다. 경기도의 경우 주택이 273만6200채로 가구 수 271만5700가구를 조금 넘는 정도 100.8%여서 그동안 용인과 파주 하남 화성 등 택지개발사업에도 불구하고 적정 수준에 미달했다. 수도권 주택보급률은 인천 107.6%를 포함해 주택 578만1800채 597만5700가구로 96.8%의 보급률을 기록해 5년 전보다 10.7%포인트 늘었지만 여전히 100%를 넘지는 못했다. 이 외에 주택보급률이 낮은 곳은 대구 92.5% 울산 99.7% 부산 101.4% 대전 102% 광주 103.2% 등 대도시권이었다. 전국에서 주택보급률이 가장 높은 곳은 전남으로 135.5%에 달했으며 충남 129.1% 강원 126.8% 경북 126% 전북 125.5% 충북 119.8% 경남 115.8% 제주 111.1% 등도 적정선을 넘거나 육박했다.,https://news.naver.com/main/read.nhn?mode=LSD&mid=shm&sid1=260&oid=079&aid=0000108927,37
24753,2006.09.18. 오전 11:30,부동산,머니투데이,SH공사 “은평뉴타운 분양원가 공개”1보,머니투데이 김경원 기자 SH공사는 은평뉴타운 고분양가 논쟁이 일자 34평형의 분양가 1151만원 41평형 1391만원 53평형 1500만원 65평형 1523만원 에 대한 원가를 18일 공개했다.,https://news.naver.com/main/read.nhn?mode=LSD&mid=shm&sid1=260&oid=008&aid=0000702031,37
24754,2006.09.18. 오전 11:28,부동산,쿠키뉴스,재건축，하지 말란 얘기네…건교부，강화된 규정 홍보 착수,쿠키 경제 무분별한 재건축 사업에 대해 정부가 더욱 고삐를 죄고 있다. 건설교통부는 19일부터 각 지자체 공무원을 대상으로 강화된 재건축 안전진단 기준과 사업시행 투명화 조치 교육에 나선다. 첫 교육 대상 지자체는 서울시다. 또 무분별한 재건축 추진은 이제 그만 이란 제목의 보도자료를 배포해 적극적인 홍보작업도 시작했다. ◇재건축 추진위 운영규정 개정 강화된 규정에 따르면 재건축 사업시행이 인가되기 전인 재건축 추진위원회 단계에서 시공자를 선정하면 형사처벌된다. 또 추진위원회는 업무에서 벗어나는 용역업체를 일절 선정할 수 없도록 했다. 이를 위반하면 추진위가 정식 조합으로 구성돼도 민사상 권리를 승계하지 못한다. 주민총회 구성을 의무화하고 의결사항을 대폭 강화했다. 주민총회 의결사항임에도 이를 거치지 않을 경우 도시 및 주거환경 정비법에 의한 효력이 발생하지 않도록 했다. 이미 설립승인을 얻어 운영중인 추진위도 구성원 동의 절차를 거쳐 해산할 수 있게 됐다. 이는 리모델링 등 대체사업으로 유도하기 위한 조치다. ◇재건축 안전진단 기준 개정 재건축 여부를 판정하는 안전진단 기준도 까다로워졌다. 재건축 예비평가 기관을 기존 시·군 평가위원회에서 시설안전기술공단 등 공공기관으로 변경했다. 이에 따라 형식적인 통과의례로 여겨지던 예비평가가 실질평가로 바뀐다. 안전진단 평가항목도 주관적 항목인 비용분석의 비중이 줄어들고 객관적 항목인 구조 안정성 비중이 높아진다. 이에 따라 자의적인 안전진단이 크게 줄어들 것으로 정부는 기대하고 있다. ◇시공자 선정기준 제정 시공자는 사업시행인가를 받은 뒤 조합총회 의결을 거쳐 선정토록 했다. 또 시공자 선정을 위한 조합총회 의결시 서면결의서에 의한 참여도 제한된다. 즉 과반수 조합원이 직접 참여하지 않으면 총회 의사진행이 불가능하다. 의사진행 정족수를 충족한 경우에만 서면결의서도 인정받는다. 건설업체가 합동홍보설명회를 2회 이상 의무적으로 개최토록 했으며 임·직원 및 홍보요원을 통한 개별홍보 행위와 사은품 제공 등도 전면 금지된다. 이같은 조치를 통해 정부는 막대한 로비자금이 조합원 부담금으로 전가되고 분양원가가 상승하는 현상을 차단할 수 있을 것으로 기대했다.,https://news.naver.com/main/read.nhn?mode=LSD&mid=shm&sid1=260&oid=143&aid=0000039051,37
24755,2006.09.18. 오전 11:28,부동산,연합뉴스,재건축사업 제대로 알고 하세요,정비사업 전국 순회 교육..요건 못갖춘 추진위는 처벌 대상 서울 연합뉴스 윤종석 기자 건축 관련 NGO인 주거환경연합이 주관하고 건설교통부와 부패방지위원회가 공동 후원하는 정비사업 전국 순회 교육 이 19일부터 서울시를 비롯한 전국의 지방자치단체에서 열린다. 건교부 관계자는 8월25일부터 개정 시행된 도시 및 주거환경정비법 등 재건축 관련법에 따라 재건축 안전진단이 강화되는 등 재건축 관련 규제가 대폭 강화됐지만 일선 지자체 공무원과 재건축조합 등은 달라진 제도를 제대로 숙지하지 못하고 있는 것으로 파악돼 순회 교육이 기획됐다 고 말했다. 건교부에 따르면 도정법을 비롯해 재건축판정 안전진단기준 정비사업조합설립추진위원회 운영규정 정비사업 시공자선정기준 주택재건축정비사업조합 표준정관 등이 재.개정돼 8월25일부터 시행됐다. 이에 따라 토지 소유자의 과반수 이상 동의를 받고 시장이나 군수의 승인을 얻어야 재건축 추진위원회를 구성ㆍ운영할 수 있으며 이를 어길 경우 형사처벌의 대상이 된다. 또 추진위원회 단계에서는 추진위원회의 업무를 벗어나는 일체의 용역업체를 선정할 수 없으며 이를 위반하면 조합으로 민사상 권리 의무가 승계되지 않는다. 추진위원회 설립 승인을 얻어 운영중인 경우라고 해도 추진위 구성에 동의한 사람의 3분의 2 이상 또는 토지 등 소유자의 과반수의 동의를 얻으면 시장이나 군수에게 신고해 해산 리모델링 등 대체사업으로 전환할 수도 있다. 이와 함께 그동안 형식적으로 이뤄져 온 재건축 안전진단이 훨씬 더 객관적이고 공정하게 실시된다. 형식적인 통과의례에 불과했던 예비평가는 평가 기관이 시.군의 평가위원회에서 시설안전기술공단 등 전문성을 갖춘 공공기관으로 변경되는 등 대폭 강화된다. 또 안전진단 평가항목도 주관적인 항목인 비용분석의 비중이 줄어드는 대신 객관적 항목인 구조 안전성의 비중이 높아진다. 한편 조합의 시공사 선정 과정도 더욱 투명해진다. 시공사의 선정은 사업시행인가를 받은 후 조합총회의 의결을 거쳐 선정해야 한다. 또한 사업시행인가 이전에 시공사를 선정하거나 경쟁입찰에 의하지 않고 시공사를 선정할 경우 형사처벌 대상이 된다. 시공사를 선정하기 위한 조합총회 의결시 서면결의서에 의한 참여는 제한을 받게 돼 과반수의 조합원이 직접 참여하지 않으면 총회를 진행할 수 없다. 건교부 관계자는 앞으로도 재건축 사업이 투기의 대상으로 악용되는 사례를 막기 위해 지속적으로 법령을 정비하고 제도를 개선해 나가겠다 고 말했다.,https://news.naver.com/main/read.nhn?mode=LSD&mid=shm&sid1=260&oid=001&aid=0001413824,37
24756,2006.09.18. 오전 11:26,부동산,뉴시스,대한주택보증 분양계약정보관리 프로그램 무료 제공,서울 뉴시스 대한주택보증 사장 박성표 은 공동주택 분양계약정보관리 프로그램을 개발해 무료로 제공한다고 18일 밝혔다. 이 프로그램은 편리한 사용자 인터페이스와 통계 및 차트 기능 정기적인 데이터 백업 기능이 있다. 또 프로그램을 이용하면 주택업체들이 관계법령에 의해 대한주택보증에 제출해야 하는 입주예정자 및 분양대금수납 현황을 쉽게 작성할 수 있다. 대한주택보증 관계자는 “프로그램의 편리성과 안정성이 확보됨에 따라 독자적인 분양계약정보관리 프로그램을 보유하지 않은 중소규모 주택업체들의 업무에 많은 도움이 될 것”이라고 말했다. 한편 대한주택보증은 자체 개발한 공동주택 사업성분석 프로그램도 홈페이지를 통해 무료로 제공하고 있으며 프로그램의 이용을 원하는 업체는 대한주택보증 홈페이지 www.khgc.co.kr 주택사업자 자료실에서 다운로드 받을 수 있다.,https://news.naver.com/main/read.nhn?mode=LSD&mid=shm&sid1=260&oid=003&aid=0000182639,37
24757,2006.09.18. 오전 11:26,부동산,뉴시스,서울시 은평뉴타운 분양원가 공개,서울 뉴시스 뉴타운 건설을 명목으로 집장사를 하고 있다는 비난을 받고 있는 서울시가 은평뉴타운 분양원가를 공개키로 했다. 서울시는 은평뉴타운이 서울시의 뉴타운시범사업 지역임을 감안해 시민들에게 분양가격의 투명성을 알리기 위해 공개하기로 했다고 18일 밝혔다. 시가 공개한 분양원가 내역을 살펴보면 평균분양원가는 34평형 1151만원 41평형 1321만7000원 53평형 1425만6000원 65평형은 1446만9000원이다. 평균 분양가격은 34평형 1151만원 41평형 1391만3000원 53평형 1500만7000원 65평형 1523만1000원이다. 분양가격 결정은 34평형의 경우에는 입주예정자 70% 이상의 원주민들에게 공급되는 점을 감안하여 분양원가로 결정했다고 시는 밝혔다. 또한 41평형 이상은 유주택자도 청약이 가능하고 당첨자의 과도한 시세 차익으로 또다른 투기현상을 예방하기 위해 최소한의 수익률 5%에서 결정했다는 설명이다. 시는 이로 인해 수익이 발생되는 경우에는 공공임대주택 건설 재원 및 임대아파트 운영 등 저소득시민을 위한 공익사업 등으로 사회에 환원 할 계획이다.,https://news.naver.com/main/read.nhn?mode=LSD&mid=shm&sid1=260&oid=003&aid=0000182635,37
