,date,cat,co,headline,text,url,week
118009,2009.01.05. 오전 10:50,부동산,아시아경제,권홍사 회장 4대강사업 통해 실물경제 회복,권홍사 회장 강바닥 퇴적물 준설로 생태계 복원 기대 소모적 대운하 논쟁 끝내고 지혜 모아야 4대강 사업을 통해 하천정비 등 사회간접자본 사업에 대한 투자로 신규 취업 19만명 창출 23조원의 생산유발 효과 등 침체된 실물경제 회복을 견인하게 될 것이다 건설업계를 대표하는 대한건설협회 권홍사 회장은 정부의 4대강 살리기 프로젝트 추진과 관련해 일자리 창출 내수 진작 등으로 지역경제 활성화에 커다란 도움이 될 것이라며 기존의 환영 입장을 재확인했다. 권 회장은 최근 지구 온난화 등으로 이상기후 현상과 홍수 및 가뭄 피해가 빈발함으로써 근본적인 대책이 필요한 상황에서 4대강 정비사업은 절대적으로 필요하다 며 이번 프로젝트를 통해 노후된 제방의 보강과 하천변 저류지 재개발 친환경 보의 설치 등을 추진함으로 근원적인 물 문제 해결과 생태계 복원 등을 기대할 수 있다 고 말했다. 4대강 정비사업이 대운하 우회 추진이 아니냐는 논란에 대해 권 회장은 올해 초 정부가 한반도 대운하사업을 추진하다가 지난해 5월에 5대강유역 물관리종합대책 연구용역을 추진하였기 때문에 의구심을 갖는 것으로 생각된다 고 설명했다. 그는 이어 이제는 대운하냐 아니냐는 소모적 논란을 끝내고 침체된 지역경제 활성화와 국토의 종합적인 물 자원 관리 차원에서 정부가 원활히 추진할 수 있도록 지혜를 모아야 할 때 라고 강조했다. 4대강 유역정비로 인한 강바닥 준설 강변 정비 등은 하천의 환경을 왜곡할 우려에 대해서는 강바닥 퇴적물 준설은 하천의 보유수량을 높여 깨끗한 물을 안정적으로 공급하고 생태하천 조성으로 잃어버린 생태를 복원하는 것 이라며 강변 정비는 접근성 차단으로 방치돼 죽어가고 있는 공간을 삶의 공간으로 조성하는 것 이라고 설명했다. 실제로 4대강의 오염 실태는 생각보다 훨씬 심각해 현재 낙동강 하류의 경우 가뭄으로 물길이 끊긴 채 거대한 육지로 변해 가고 있다는게 그의 의견이다. 또한 최근 10년간 매년 반복되는 홍수로 인해 사망 20여 명 이재민 5300여 명 재산피해 6700억원에 달하며 복구비용도 연평균 1조900여원에 이르고 있다며 조속히 공사를 마무리 해야 한다고 덧붙였다. 4대강 살리기 프로젝트가 현재 어려움에 처한 건설업계 어느 정도 도움이 될 것인가에 대한 질문에 그는 최근 미국에서 촉발된 사상초유의 국제 금융위기와 대규모 미분양 사태로 건설업계는 매우 어려운 상황에 처해 있는데 4대강 정비사업에 대한 대규모 재정 투자는 가뭄에 단비와 같은 소식 이라고 말했다. 또한 4대강 정비사업을 통한 일자리 창출과 지역경제 활성화라는 정책목표 달성을 위해서는 정비사업의 예산을 지자체에 배정해 지자체 발주를 통해 지역 중소업체가 많이 참여 할 수 있도록 해야한다 고 주장했다. 마지막으로 그는 이번 프로젝트를 통해 홍수와 가뭄으로 고통을 받아온 지역 주민들의 고충이 해소되고 지역경제 활성화의 신 성장동력이 되길 기대한다고 말했다.,https://news.naver.com/main/read.nhn?mode=LSD&mid=shm&sid1=260&oid=277&aid=0002080458,157
118010,2009.01.05. 오전 10:50,부동산,아시아경제,4대江 작년말 첫삽.. 6월 본격 시작,江 경제성장의 젖줄 왜 4대강 프로젝트 인가 정부는 올해부터 2011년까지 4대강 살리기 프로젝트를 진행 여기에 약14조원을 투입한다. 작은 댐과 하천변 저수지 작업은 2012년까지 완료할 계획이다. 구체적으로 추진하는 사업은 제방보강 536㎞ 하천제방 단면 확대 중소규모 댐 및 홍수조절지 5개소 건설 농업용 저수지 96개소 정비 등의 홍수 및 가뭄에 대비한 사업이다. 또 강변 둔치를 재정비하고 자전거길 1297㎞ 을 설치키로 했다. 침수가 잦은 지역은 습지 등 생태공간으로 조성하며 침수되지 않는 지역은 문화·예술공간으로 활용키로 했다. 4대강 사업은 턴키 패스트트랙 등으로 발주 및 시공을 신속히 추진해 2011년까지 사업을 완료하겠다는 방침이다. 안동 등 7개 지구는 이미 지난 29일 착공식을 가졌다. 선도사업지구에는 약 8300억원이 집중 투입될 예정이다. 대구의 2011년세계육상선수권대회 연기군의 행정중심복합도시 나주의 혁신도시 등과 연계해 사업효과를 최대화할 계획이다. 7개 지구는 충주 한강 대구·부산·안동 낙동강 연기 금강 나주·함평 영산강 등이다. 이어 내년 5월께 4대강 마스터플랜을 수립해 6월부터 본격적으로 공사 발주를 시작할 예정이다. 국토부는 사업비 13조9000억원을 투입할 경우 19만명의 고용창출효과와 23조원의 생산유발효과를 거둘 수 있을 것으로 예상하고 있다. 정 장관은 4대강을 중심으로 국토가 재창조되면 폐쇄적 내륙도시들이 개방적이고 창조적인 미래 문화도시로 지역발전의 거점으로 새롭게 태어날 것 이라고 말했다. 또 훌륭한 마스터플랜 마련 재정의 조기 집행 신속한 발주 및 시공 등을 통해 대강 살리기 가 녹색뉴딜 녹색성장의 상징이 될 수 있도록 하겠다 고 강조했다.,https://news.naver.com/main/read.nhn?mode=LSD&mid=shm&sid1=260&oid=277&aid=0002080457,157
118011,2009.01.05. 오전 10:50,부동산,한국경제,12人 가구급증…기숙사ㆍ원룸형주택 관심둘 만,기숙사형ㆍ원룸형 주택이 올해 첫 선을 보인다. 최근 급증하고 있는 1 2인 가구의 주택 수요에 발맞춰 앞으로 10년 동안 수도권에서 6만채를 공급한다는 계획이다. 이에 따라 기존 고시원과 원룸 서비스드 레지던스 단기체류형 호텔식 주거시설 등을 대체하는 신규 주거형태로 자리매김할 전망이다. 생활편의시설은 공동이용 기숙사형ㆍ원룸형 주택은 세탁실과 휴게공간 등 생활편의시설을 공동으로 사용하는 주거 형태다. 다만 원룸형은 기숙사형과는 달리 취사시설은 가구별로 따로 갖춘다. 원룸형은 독립된 주거시설 기숙사형은 준 準 주거시설 개념인 셈이다. 정부가 이들 주택을 도입키로 한 것은 1 2인 가구가 급증하는 반면 저가 소형주택 공급은 오히려 줄고 있기 때문이다. 국토부에 따르면 1 2인 가구는 2005년 669만가구에서 지난해 714만가구로 6.7% 늘어난 반면 3인 가구는 943만가구에서 954만가구로 1.7% 4인 이상 가구는 590만가구에서 604만가구로 2.4% 증가에 그쳤다. 반면 60㎡ 이하 소형주택 건설비율은 2001년 41.7%에서 지난해 26.2%로 크게 떨어졌다. 고시원과 원룸 고급주거형인 서비스드 레지던스 등이 늘어나는 추세지만 고시원은 화재위험 등 주거환경이 열악하다. 원룸과 서비스드 레지던스는 임대료 부담이 만만찮다. 이에 따라 기숙사형ㆍ원룸형 주택으로 저소득층의 주거안정을 도모하고 고급형으로 일부 고소득층을 흡수한다는 것이 정부 방침이다. 임대와 분양 방식 모두 도입 올 상반기까지 법령정비가 완료되면 하반기부터 본격적으로 기숙사형ㆍ원룸형 주택이 나올 것으로 보인다. 역세권 대학가 산업단지 주변 등 1 2인가구의 주거 수요가 많은 곳이 주요 타깃이다. 면적은 기존 원룸이나 고시원 등과 마찬가지로 소형으로 지어진다. 기숙사형은 최소 6 8㎡ 이상 원룸형은 12㎡ 이상이어야 한다. 기숙사형은 저소득 직장인과 학생 노인 등을 주 대상으로 삼고 있다. 원룸형은 초소형과 고급형으로 나뉜다. 초소형은 기숙사형과 입주대상이 같지만 고급형은 전문직 고소득층이 대상이다. 기숙사형ㆍ원룸형 주택에는 어린이 놀이터 경로당 등 공동주택의 부대복리시설이 갖춰지지 않는다. 또 주차시설도 최소 규모만 설치하면 되도록 할 예정이다. 정부는 기존 유휴상가나 제조시설 다가구주택 등을 용도변경해 신속하게 공급하는 방안도 검토하고 있다. 또 도심 내 자투리 땅을 활용하거나 기존 노후화한 영구임대주택 단지 내 주민공동시설을 리모델링하는 방안도 추진한다. 영구임대주택 저층에 주민공동시설 상가 등을 배치하고 중층 이상에는 1 2인가구용 주택을 집중 배치하는 식이다. 대한주택공사는 시범사업으로 하반기에 서울 강서구 가양동 영구임대주택단지의 주민공동시설을 1 2인용 주택이 포함된 복합용도로 리모델링하기로 했다. 공급방식은 임대와 분양 모두 적용된다. 정부는 공공이 건설하거나 민간이 주택기금을 지원받아 지을 경우 임대료나 보증금 등에 상한선을 둘 계획이다. 민간이 주택기금 지원없이 짓는 주택의 임대료는 자율적으로 결정된다. 정부는 임대가 아닌 분양 물량에 대해서는 분양가상한제와 청약가점제 지역우선공급제도 등 현행 분양제도 적용대상에서 제외시킬 방침이다. 국민임대 50㎡ 초과는 청약통장 있어야 입주자격은 공공과 민간 등 건설주체에 따라 다르다. 이 가운데 공공주택은 영구임대와 국민임대 간에 차이가 있다. 영구임대는 정부 재정지원을 받아 시중 전셋값의 30% 수준으로 30년 이상 살 수 있는 주택으로 1993년 이후 사라졌다 지난해 정부의 9ㆍ19 서민주택공급 대책 후속조치로 올해부터 부활한다. 기초생활수급자와 모자 母子 가정 국가유공자 등이 입주할 수 있다. 국민임대도 30년 이상 살 수 있지만 임대료가 시중 전셋값의 60 70% 수준이다. 월소득이 도시근로자 가구 평균 2007년 257만원 의 70% 이하인 무주택 세대주에 한해 물량의 50% 이하가 우선적으로 공급된다. 전용 50㎡ 이상에 입주하려면 청약통장이 필요하다. 가입기간 24개월 이상이 1순위자가 되고 6개월 이상은 2순위다. 50㎡ 미만은 청약통장 미가입자도 입주할 수 있다. 민간주택은 주택기금 지원 여부에 따라 입주자격이 다르다. 기금지원을 받는 주택은 청약저축 가입자가 신청할 수 있다. 기금지원을 받지 않는 주택은 임대사업자 자율로 결정된다. 일반적으로 청약저축 청약예ㆍ부금 가입자 모두에게 신청 자격을 준다.,https://news.naver.com/main/read.nhn?mode=LSD&mid=shm&sid1=260&oid=015&aid=0002032977,157
118012,2009.01.05. 오전 10:50,부동산,아시아경제,위기극복 빅찬스 왔다 건설 새희망을 쏴라,정부는 오는 2011년까지 4대강 정비사업에 14조원을 쏟아부을 계획이다. 江 경제성장이 젖줄 다시 뛰는 건설업계 총 14조 규모 발주공사 본격 수주전쟁 대비 치수사업 경험 토대 공공부문사업팀 등 강화 1. GS건설은 올해 공공부문 수주목표를 1조9000여 억원으로 지난해 수주액 1조400억원 보다 80% 이상 늘려 잡았다. 대형 건설업체가 대부분이 그렇듯 올해 사업 성패가 공공부문과 해외사업에서 판가름 날 것으로 판단하고 있기 때문이다. 공공부문 수주목표를 두배 가까이 늘렸으면서도 4대강 개발사업 등 한국판 뉴딜정책으로 일컬어지는 사업간접자본 SOC 부문 목표를 플러스 알파 로 별도로 책정해놨다. 정부의 녹색뉴딜 사업이 아직 구체적인 모습을 드러내지 않았기 때문에 규모를 가늠할 수 없어서다. 하지만 기존에 2개팀으로 운영하던 공공영업팀을 3개팀으로 늘린 것은 물론 권한도 대폭 강화했다. 미진했던 관련 사업본부 내의 제어권한을 대폭 이양해 준 것도 특기할 만한 점이다. 수주부서에서 수익성 여부를 판단해 자체 사업본부에서 진행하는 공공공사의 제동을 걸 수 있도록 했다. 관 주도의 발주가 많아질 것으로 예상되면서 수주부서가 전문화된 지원조직의 권한 한계를 뛰어 넘었다. 2. 금호건설은 그동안의 실적과 노하우를 바탕으로 4대강 살리기 사업 에 적극적으로 뛰어들겠다고 밝혔다. 이 사업의 정확한 윤곽이 들어날 때를 대비해 이미 사업 검토에도 착수했다. 금호건설 관계자는 이미 컨소시엄을 통해 사업타당성 검토가 이뤄진 낙동간 구간이나 기업도시와 연계돼 계획 중인 영산강 구간 등에 적극적으로 참여할 것 이리고 말했다. 관련 사업에 대한 노하우로 지난해 말 끝낸 영산강 24.9㎞ 황룡강 2.8㎞ 등 총 27.7㎞ 구간에 걸친 치수사업 실적을 들었다. 하천의 퇴적토사를 제거해 치수기능을 확대하는 80개월간의 공사를 통해 친환경 하천 조성을 위한 실력을 충분히 다졌다는 설명이다. 3. 이들 업체와 달리 현대건설이나 대림산업 등은 4대강 관련 대외 발언을 자제하며 극도로 몸을 낮췄다. 현대건설은 공공부문 사업강화를 위한 별도의 조직개편은 없었다 며 4대강 사업과 관련한 별도의 준비는 하지 않고 있다 는 답변을 내놨다. 공공부문의 수주목표나 계획은 이달 중순 최고 경영자와 임원들이 참여하는 경영전략회의 이후 내놓기로 했다. 현대건설 관계자는 토목사업본부에서 주도적으로 나설 것 이라며 풍부한 하천 정비사업 경험을 토대로 발주 나오면 의욕적으로 수주전에 참여한다는 원칙만 정했다 고 말했다. 현대건설은 지난달 30일 유신코퍼레이션의 공시에 근거해 알려진 4대강 살리기 사업 관련 빅5 건설사 단일컨소시엄 구성 논란 때문에 구설수에 올라서인지 더욱 조심스런 입장이다. 그렇지만 지난 80년대 한강종합개발공사에서 낙동강 하구둑공사 영산강 하구언공사 시화지구 간척사업 새만금 간척사업 등 굵직한 강ㆍ하천 정비 관련 사업 경험을 거론했다. 대림산업 역시 공공수주 강화라는 원칙적인 입장만 밝힐 뿐 구체적인 내용을 언급하기를 꺼렸다. 하지만 대형 건설업체에서 대운하 컨소시엄에 참여했던 한 관계자는 대형 건설업체 모두가 별도의 팀을 꾸려 4대강 사업에 올인하고 있는 것으로 알고 있다 며 전체 14조원 어치의 발주물량 중 일부분을 제외한 발주가 모두 올해 이뤄질 것으로 예상되는데 별도의 준비가 없을 수 있겠냐 고 반문했다. 그는 발주에 대비해 기본자료와 발주동향 향후 발주처 준비 등을 하고 있다 며 대형 건설사 대부분이 서울소재 업체이다보니 해당 지역 지방업체와 함께 공사발주에 참여할 것으로 보인다 고 설명했다. 또 다른 업체관계자도 국토부에서 기존에 발표한 자료와 언론을 통해 나온 자료 등을 수집해 내용을 파악하고 있다 며 4대강 정비사업과 관련된 마스터플랜이 아직 나오지 않은데다 대운하 사업의 연장선이 아니냐는 오해 때문에 기업들의 입장이 조심스러울 수 밖에 없지만 물밑에서 차근차근 준비작업을 하고 있다 고 전했다. 이해관계가 엇갈리는 지방의 중소업체의 경우 대형업체와는 다른 입장이다. 공공부문 수주 실적이 전무한 중소업체에서는 사실상 손을 놓고 있으며 관련 포트폴리오가 풍부한 업체에서도 4대강 정비사업 예산을 지방자치단체에 배정해 지자체 발주를 통해 지역중소업체의 참여 통로를 넓여야한다고 주장하고 있다. 중소업체인 A사 관계자는 지방 공공공사 실적을 바탕으로 수주전을 펼치겠지만 하청 재하청 형태로는 지역업체 지방 살리기에 도움을 줄 수 없다 며 중소 업체에까지 분배될 수 있도록 지자체에 발주권한이 넘어와야 한다 고 강조했다. 대한건설협회에서는 이에 대해 4대강 정비사업을 발주하기 전에 지역중소업체 수주지원을 위한 입찰제도가 개선 정비돼야 한다 고 주장했다. 특히 지난달 15일 지역경제활성화 대책에서 언급한 지역제한 입찰 대상공사가 확대돼야 하고 지역의무 공동도급공사의 지역업체 최소참여비율도 상향 조정돼야 한다는 설명이다.,https://news.naver.com/main/read.nhn?mode=LSD&mid=shm&sid1=260&oid=277&aid=0002080455,157
118013,2009.01.05. 오전 10:50,부동산,아시아경제,막혔던 民心열어 경제 르네상스 일으킬 대장정,江 경제성장의 젖줄 왜 4대강 프로젝트 인가 23조원 생상 유발·19만명 일자리 창출 위기의 우리경제 살릴 한국판 녹색뉴딜 기후변화 대비·지역 활성화 신성장 동력 한반도가 4대강 살리기 라는 녹색혁명 프로젝트의 대장정에 올랐다. 방치된 강을 정비해 홍수·가뭄에 대비하고 SOC 사회공공사업 를 확대해 경제를 살리는 것 이외에도 여러 의미를 내포한 대형 프로젝트다. 이미 정부는 지난 12월 29일 영산강 나주지구 기공식을 갖고 이 프로젝트의 시작을 알리는 신호탄을 쏘아올렸다. 동시에 이 프로젝트가 경제와 환경 모두를 살리는 진정한 한국형 녹색뉴딜사업이 되길 바라는 온 국민의 염원과 비판의 눈길도 높이 치솟았다. ◇4대강 정비는 한국형 뉴딜사업 말도 많고 탈도 많던 한반도 대운하 사업을 접은 지 6개월 정부는 대운하 프로젝트를 일부 축소·변경한 4대강 살리기 프로젝트를 내놓았다. 경기침체 장기화라는 난관에 봉착한 한국경제를 살리고 재해와 기후변화에 대응하겠다는 야심찬 계획이다. 일단 기업과 지방자치단체들은 대대적으로 환영을 하고 나섰다. 정부가 2011년까지 이 사업에 14조원을 투자하기로 한 것만으로도 건설기업들에게는 먹거리 창출에 도움이 되기 때문이다. 정부는 이미 안동과 나주 등 7대 선도사업지구 하천정비 치수사업을 벌일 업체들을 선정해 작업에 들어갔다. 7대 지구는 한강 유역의 충주 낙동강 유역의 대구 부산 안동 금강 유역의 연기 영산강 유역의 나주와 함평이다. 이외의 나머지 지역은 오는 5월까지 마스터플랜을 완성한 뒤 추진할 계획이다. 정부는 공공입찰을 통해 사업자를 선정 노후된 제방을 보강하고 토사가 퇴적된 구간을 정비하는 사업을 벌일 예정이다. 홍수저류 공간 확보와 물 공급 확대를 위해서는 중소규모 댐을 짓는다. 홍수조절지 하천변 저류지 및 저수지 재개발 사업을 통해 진행된다. 하천 상하류를 연결하는 자전거길도 설치한다. 수면활용과 가뭄대비 비상용수공급을 위한 친환경 보도 설치한다. 또 장기적으로는 1조여원의 투입하는 민간투자사업도 추진할 계획이다. ◇기후변화 대비한 녹색혁명 기대 4대강 살리기는 환경을 되살리고 기후변화에 대응할 수 있다는 목표를 지닌다. 정부는 4대강 정비사업의 추진 배경으로 홍수 피해가 늘어나는 반면 예방투자 부족으로 사후 복구 비용이 많이 든다는 점을 들고 있다. 실제로 최근 5년간 평균 복구비용이 4조2000억원으로 사전예방투자비보다 4배가 높다는 설명이다. 실제로 물부족국가로 분류된 우리나라는 오는 2011년에는 약 8억㎡의 물부족이 예상돼 댐 저류지 건설 등이 시급하다. 정부가 노후 재방 보강 퇴적 구간 정비 하천 생태계 복원 중소규모 댐 홍수 조절지 하천변 저류지 및 저수지 재개발사업에 나서는 것도 이 때문이다. 나아가 하천둔치에 수변공간을 조성하고 자전거길 조성 등을 통해 국민들에게 다양한 여가의 장을 제공하게 된다. 태양광 및 소수력발전으로 신재생에너시를 생산하고 생태습지 하천숲 등은 이산화탄소를 줄일 것으로 예상된다. 홍수예방과 경제살리기 효과를 넘어 시민들에게 여가공간을 제공하고 글로벌 문제로 부상한 환경문제에도 적극적인 대처가 가능하다는 국토부의 설명이다. ◇23조 생산유발효과·일자리 19만명 창출 4대강 살리기 프로젝트는 우선 침체된 실물경기 회복에도 상당한 도움을 줄 것으로 예상된다. 하천정비 등 SOC사업에 대한 투자를 확대해 신규 일자리창출과 지역경제 활성화에도 큰 도움을 줄 것으로 예상된다.국토부는 신규 취업 19만명 창출 23조원의 생산유발효과 발생 등 지역경제 활성화를 견인할 것으로 기대하고 있다. 홍수를 방지하고 가뭄 등 물 부족 문제를 해결하기 위한 것이 두번째 기대효과다. 제방보강 중소규모 댐·조절지 등을 건설하는 이유가 바로 이 때문이다. 국토부에 따르면 우리나라는 매년 홍수로 2조7000억원의 피해를 입고 복구비만 4조2000억원이 든다. 그러나 퇴적구간 정비 보 설치와 저수지 재개발로 물그릇을 늘리면 가뭄시 비상용수 공급이 가능해진다. 수질도 개선될 것으로 전망된다. 친수환경을 조성해 지역문화에 큰 효과를 가져올 것이란 기대감도 커지고 있다. 하천둔치에 수변공간을 조성하고 자전거길을 설치해 국민들에게 다양한 여가활동 기회를 제공하겠다는 목표다. 태양광 및 소수력 발전으로 신재생에너지 생산 생태습지 및 하천숲 등과 함께 이산화탄소를 저감시키는 효과도 얻을 것으로 보인다. 이상원 인하대 경제학과 교수는 하천정비 사업은 대규모 댐을 건설하는 것보다 경제적 파급효과가 더 커 경기진작에 많은 도움이 될 것 이며 특히 이 프로젝트는 홍수나 가뭄을 대비하는 것으로 친환경개선에 반드시 필요하다 고 말했다.,https://news.naver.com/main/read.nhn?mode=LSD&mid=shm&sid1=260&oid=277&aid=0002080454,157
