,date,cat,co,headline,text,url,week
145132,2009.07.09. 오후 3:50,부동산,매일경제,하반기 중소형아파트 노려볼까,수도권 내에서 주택을 담보로 받을 수 있는 대출 한도 LTV 가 줄어들면서 자금 마련 부담이 적은 중소형아파트가 인기를 얻고 있다. 초기 투자 비용이 많이 드는 대형 아파트보다 리스크가 적고 6억원을 넘지 않는 주택이 많아 대출규제에서 상대적으로 자유롭기 때문이다. 최근 미혼 직장인과 학생 등 1인가구가 늘어나면서 수요도 꾸준하다. 부동산정보업체 닥터아파트에 따르면 올해 하반기에는 전국 136곳 7만9650가구가 전용 85㎡이하 중소형아파트가 포함된 단지를 분양할 예정이다. 서울에서는 고척동 금호동 등 재개발 단지 등이 분양 채비에 들어간다. 벽산건설은 구로구 고척동 고척3구역을 재개발해 80 145㎡ 339가구 중 147가구를 8월경 일반분양한다. 전용 85㎡이하 중소형아파트는 127가구다. 영등포구치소가 천왕동 일대로 2011년까지 이전할 예정이라 주변 환경이 개선될 전망이다. 구치소 부지에는 생태공원과 대규모 상업시설 등이 들어선다. 성동구 금호동2가에서는 GS건설이 금호17구역을 재개발해 497가구 중 31가구를 7월 분양한다. 중소형아파트는 83 111㎡ 19가구로 적지만 지하철5호선 신금호역을 도보로 이용할 수 있는 역세권 단지다. 광진구 광장동에서는 현대건설이 화이자제약 부지에 82 158㎡ 455가구를 10월 경 분양할 예정이다. 80 114㎡ 중소형이 전체의 61%인 279가구를 차지한다. 가재울뉴타운에서도 분양을 이어간다. 삼성물산과 대림산업은 서대문구 북가좌동 가재울3구역을 재개발해 87 188㎡ 672가구를 9월 분양한다. 총 2664가구 대단지로 87 112㎡ 중소형아파트도 394가구나 된다. 경기지역 내 대단지에서도 소형평형 아파트가 나온다. 대한주택공사는 안양시 관양동 관양지구에서 97 110㎡ 1042가구를 10월 분양할 예정이며 전 주택형이 모두 전용면적 85㎡이하 중소형으로 구성된다. 단지 3면이 관악산으로 둘러쌓여있어 쾌적한 편이다. 대우건설은 인천 부평구 산곡동 산곡1구역을 재개발한 765가구 중 78 142㎡ 315가구를 8월 분양한다. 현재 공사중인 지하철7호선 연장구간온수 부평구청역이 2012년 말 개통되면 강남쪽으로 이동이 편리해진다.,https://news.naver.com/main/read.nhn?mode=LSD&mid=shm&sid1=260&oid=009&aid=0002128224,183
145133,2009.07.09. 오후 3:37,부동산,아시아경제,그린홈 기술 어디까지 왔나,‘그린홈’이 국내 주택시장의 새 트랜드로 자리잡아가고 있다. 그린홈 기술은 최근들어 ‘저탄소 녹색성장’ 바람을 타고 빠르게 진화 확산되고 있는 추세다. 정부도 이에 맞춰 오는 2018년까지 ‘그린 홈’ 200만가구를 건설하겠다고 발표하고나서 건설업체에 에너지절감형 아파트 개발에 동기를 부여하고 있다. 건설업체들은 이에 발맞춰 그린홈 기술개발에 박차를 가하고 있다. ◇태양광 발전시설 도입 가장 활발 태양광시스템은 지난 2007년 국내 최초로 아파트에 적용됐다. 대우건설이 2007년 3월 준공한 ‘목포 옥암푸르지오’에 적용했다. 총 680여장의 태양광발전 모듈을 설치해 아파트 전체 전략 사용량 중 5%에 달하는 하루 최대 600kw의 전력을 생산하도록 설계됐다. 옥암푸르지오 태양광시스템은 2008년 기준 연간 1000만원 상당의 전력을 생산해 가구당 연간 20만원 정도의 전기요금 절감혜택을 주고 있다. ◇지열로 냉·난방 해결 낮의 햇빛으로 땅과 콘크리트 바닥에서 발생하는 열로 냉난방을 하는 지중열 시스템은 지난 2005년 국내 처음으로 아파트에 적용됐다. 대림산업이 2005년 경기 용인에 국내 최초로 냉난방 비용을 20 30% 수준으로 낮춘 시범 주택을 준공했다. 삼성물산도 지난해 7월 입주한 ‘대구 달성 래미안’과 지난해 분양한 ‘용인 래미안 동천’에도 이 시스템을 적용했다. 대구 달성 래미안은 지중열 시스템으로 연간 17t의 이산화탄소 발생을 줄이는 동시에 단지 전체 1년 관리비 400만원정도를 절감하고 있다. ◇소형 열병합발전 소형 열병합발전은 녹색아파트 건설신기술로 각광받고 있다. 열병합발전은 발전에 사용된 폐열을 모아 급탕 등에 사용해 에너지효율을 높이는 에너지 절감 기술이다. 열별합발전시스템이란 하나의 연료를 사용해 두 가지 이상의 에너지를 동시에 생산하는 에너지 절감시스템이다. SK건설은 지난해 대구 수성에서 분양한 ‘수성SK리더스뷰’에 소형열방발전 시스템을 설치했다. 이시스템은 단지 전체에 사용되는 전기량의 70%이상을 대체하게 된다. ◇연료전지 아파트 최초 개발 동양건설산업은 경기도 남양주 동양파라곤은 세계 최초로 연료전지를 활용한 아파트를 선보였다. 연료전지시스템은 공기중 산소와 도시가스를 연료로 전기화학반응으로 일으켜 전기를 생산하고 난방과 온수를 한꺼번에 공급하는 일체형 시스템이다. 이시스템이 적용된 곳은 파라곤 아파트 내 테라스하우스 40가구에 적용됐다. 가구당 월 700kw H를 사용하는 경우 연간 200만원의 에너지 절감효과가 있는 것으로 나타났다. ◇에너지절감기술 통합시대 대림산업은 지난해 4월 분양한 울산 ‘유곡 e 편한세상’아파트에 각종 기술을 집약한 에코 3L을 국내 최초로 선보였다. 이 통합시스템은 태양광 풍력 지열 시스템을 집약해 1㎡당 연간 3ℓ의 연료만으로 냉난방을 온전히 할 수 있도록 설계됐다. 여기에 3중유리 및 수퍼단열재 폐열회수형 환기시스템 등의 신기술을 접목시켜 최대 80% 이상의 에너지 절감 능력을 발휘한다. 대림산업이 지난 2006년 대구 수성e 편한세상 아파트 관리실건물에 적용한 에코 3L시스템 개념도 삼성물산도 오는 9월 그린에너지 기술을 모두 집약한 에너지제로 주택 모델인 ‘그린투모로우’를 선보인다. 그린투모로우는 태양광발전 풍력 등을 통해 기존 건축물 대비 60%까지 에너지사용을 줄이도록 설계된 주택이다. 건설업계 한 관계자는 “앞으로는 브랜드보다 녹색기술 보유여부가 건설사의 경쟁력을 좌우할 것”이라며 “그린홈 정책은 한국 주택의 패러다임을 바꾸는 계기가 될 것”이라고 말했다.,https://news.naver.com/main/read.nhn?mode=LSD&mid=shm&sid1=260&oid=277&aid=0002191101,183
145134,2009.07.09. 오후 3:31,부동산,연합뉴스,해남군 자산 1조6천억..1인당 빚 31만원,해남 연합뉴스 조근영 기자 전남 해남군의 총 자산은 1조 6천329억원이며 군민 1인당 부채는 31만원으로 조사됐다. 9일 해남군이 발행한 지난해 말 기준 재무보고서 에 따르면 해남군의 총자산은 1조 6천328억 9천348만여 원 총부채는 253억 6천717만여 원으로 1인당 31만 3천원의 빚을 지고 있다. 총자산을 유형별로 보면 도로 상하수도 농수산 기반 등 사회기반시설에 대한 투자액이 전체의 77.7%인 1조 2천682억원으로 가장 높았으며 현금 등 유동자산은 10.9%인 1천775억원 도서관 주차장 의료 등 주민 삶의 질 향상과 직결되는 주민편의시설은 7.5%인 1천231억원이었다. 군 재정의 건전성을 나타내는 총 자산 대비 총 부채비율은 1.55%로 2007년 1.77%보다 다소 개선된 것으로 나타났다. 백종호 해남군 세무회계과장은 재무보고서는 해남군의 자산과 부채를 동시에 분석해 군 재정의 건전성을 가늠해 볼 수 있는 중요한 보고서인 만큼 지속적인 연구와 보완 작업을 하겠다 고 말했다. 해남군은 군의회의 승인을 얻어 다음 달부터 군민에게 재무보고서를 공개한다.,https://news.naver.com/main/read.nhn?mode=LSD&mid=shm&sid1=260&oid=001&aid=0002756199,183
145135,2009.07.09. 오후 3:31,부동산,한국경제TV,인사 박영식 동아건설 대표이사,동아건설은 박영식 부사장을 대표이사 사장에 선임했습니다. 박 신임 대표이사는 인천 대건고와 서울대 독어독문학과를 졸업하고 1980년 ㈜대우에 입사한 뒤 대우건설 하와이 법인대표과 경영기획실장 등을 역임한 바 있으며 지난해 12월부터 동아건설 부사장을 맡아왔습니다.,https://news.naver.com/main/read.nhn?mode=LSD&mid=shm&sid1=260&oid=004&aid=0001980012,183
145136,2009.07.09. 오후 3:28,부동산,아시아경제,동양건설 1조2000억 규모 해상풍력단지 건설,전남 신안 2MW급 70기 설치..16만 가구 전력 공급 동양건설산업 대표 이길재 이 전남 신안군에 국내 최대 규모의 해상풍력발전단지 건설에 나선다. 신안 해상 풍력발전프로젝트 는 총 사업비 1조2000억원 규모로 올해 착공해 2014년 가동하는 것이 목표다. 신안군 해상 6km 지점 오도 일원에 200MW급 해상풍력발전 단지 3MW급 풍력발전기 70기 가 건설되는데 준공될 경우 연간 16만 가구에 공급할 수 있는 482GWh의 전기를 생산할 수 있다. 풍력발전 단지가 건설되면 승용차 13만대에서 배출하는 양인 29만여t의 이산화탄소 저감 효과를 기대할 수 있다. 동양건설산업은 한국남동발전 동국S C 유러스에너지재팬과 이미 신안 해상 풍력발전 프로젝트 컨소시엄을 구성하고 오는 10일 서울 삼성동 그랜드인터콘티넨털호텔에서 공동사업개발협약 JDA 을 갖는다고 9일 밝혔다. 국내 최대 규모의 해상발전 단지가 들어설 전남 신안군 비금도와 오도 자은도 일대 해상은 양질의 풍력자원과 함께 수심이 얕아 해상풍력발전의 최적지로 꼽히는 곳이다. 특히 이 지역은 연중 풍력 발전이 가능한 양질의 바람이 끊임없이 부는 곳으로 풍력 태양광 발전 등에 최고의 입지를 자랑하면서 신재생에너지 메카로 각광받고 있다. 컨소시엄 참여자인 동국S C는 지난해 6월 신안군과 풍력발전 투자협약 을 맺고 비금도에 시범적으로 3MW급 신안풍력발전소 를 준공 운영하면서 풍력자원 측정을 위한 계측탑 설치 등 기초 연구를 진행하고 있다. 한편 동양건설산업은 지난해 11월 신안군에 세계 최대인 24MW 규모의 추적식 태양광발전소를 준공해 운영하고 있다.,https://news.naver.com/main/read.nhn?mode=LSD&mid=shm&sid1=260&oid=277&aid=0002191088,183
145137,2009.07.09. 오후 3:27,부동산,매일경제,동아건설 대표이사 박영식 씨,동아건설은 9일 대표이사 사장에 박영식 부사장 52 를 선임했다고 밝혔다. 박 신임사장은 80년 대우건설에 입사해 하와이 법인대표 해외개발사업팀장 경영기획실장 등을 역임하고 2008년 12월부터 동아건설 부사장을 맡아왔다.,https://news.naver.com/main/read.nhn?mode=LSD&mid=shm&sid1=260&oid=009&aid=0002128209,183
145138,2009.07.09. 오후 3:17,부동산,매일경제,홍제동 북한산 자락에 리조트형 저층아파트,u3000서울 홍제천변에 저층의 리조트형 아파트 단지가 들어선다. u3000서울시는 종로구 신영동 158 2번지 일대 신영1재개발 정비구역을 도시건축공동위원회 심의를 거쳐 조건부 가결했다고 9일 밝혔다. u3000이로써 1만5669㎡ 부지에는 4 8층의 177가구가 조성된다.용적률 148% 건폐율 32% 이하를 적용받는다. u3000이 구역은 경관 보호를 위해 북한산의 스카이라인을 가리지 않고 어린이공원과 진입도로 등 도로기반시설을 확충하도록 했다. u3000또 아파트 색채는 주변 건축물과 어울리고 지붕 디자인은 자연미를 살리도록 계획됐다. 특히 4층짜리 빌라 4개동에 테라스하우스를 배치해 리조트를 연상하는 단지로 설계된다는 것이 특징이다. 지상주차장을 없애 단지내 휴식공간도 넓혔다. u3000한편 도시건축공동위는 노원구 월계동 672번지 일대 2만3525㎡ 부지의 월계4구역재개발 정비구역지정안도 수정부 가결했다. 이 곳에는 용적률 200% 이하 건폐율 60% 이하 최고층수 9층 8개동 317가구가 건립된다. u3000월계4구역은 서울시 동북권 르네상스 개발의 중심축인 중랑천이 가까우며 도보권내에 지하철역 녹천역 및 초안산근린공원이 위치한다. 올해 말까지 조합 설립 사업시행인가 신청 예정이며 빠르면 내년 착공에 들어간다.,https://news.naver.com/main/read.nhn?mode=LSD&mid=shm&sid1=260&oid=009&aid=0002128194,183
145139,2009.07.09. 오후 3:07,부동산,이데일리,동부간선도로 전구간 교통통제,이데일리 윤진섭기자 서울·경기지역에 호우경보가 내려진 가운데 동부간선도로 전구간이 전면 통제되고 있다. 9일 서울시에 따르면 이들 구간은 이날 오후 12시20분 서울지역에 호우경보가 내려지고 일부 구간이 폭우로 인해 침수되면서 오후 1시20분부터 양방향 교통이 전면 통제됐다. 서울시는 동부간선도로를 운행할 운전자는 우회도로를 이용해달라고 당부했다.,https://news.naver.com/main/read.nhn?mode=LSD&mid=shm&sid1=260&oid=018&aid=0002128917,183
145140,2009.07.09. 오후 3:06,부동산,연합뉴스,동양고속건설 신안에 풍력발전단지 건설,서울 연합뉴스 서미숙 기자 동양건설산업이 전남 신안군에 국내 최대 규모의 해상풍력발전단지 건설을 추진한다. 동양건설산업은 한국남동발전㈜과 ㈜동국S C 유러스에너지재팬과 함께 신안 해상 풍력발전 프로젝트 컨소시엄 을 구성하고 이달 10일 신안군과 해상 풍력발전단지 건설에 관한 공동 사업개발 협약 JDA 을 맺는다고 9일 밝혔다. 이 사업은 전남 신안군 해상에서 6km 떨어진 오도 일원에 200MW 메가와트 급 해상풍력발전 단지를 건설하는 것으로 컨소시엄은 총 1조2천억원을 투자해 3MW급 풍력발전기 70여기를 짓는다. 이르면 연내 사업을 시작해 2014년 준공 및 가동할 계획이다. 이 발전단지가 준공되면 연간 16만여 가구가 쓸 수 있는 482GWh 기가와트 아워 의 전기를 생산할 것으로 회사측은 보고 있다. 전남 신안군 비금도 자은도 일대 해상은 수심이 얕고 양질의 바람이 끊임없이 불어 해상풍력발전의 최적지로 꼽히고 있다. 동양건설산업은 지난해 11월 신안군에 24MW급 규모의 세계 최대 추적식 태양광 발전소를 준공 운영중이며 이번에 풍력발전소 건설에도 참여하면서 신재생 에너지 사업을 확대하고 있다.,https://news.naver.com/main/read.nhn?mode=LSD&mid=shm&sid1=260&oid=001&aid=0002756084,183
145141,2009.07.09. 오후 3:02,부동산,매일경제,국내 최초 금연아파트 탄생,부산에 금연아파트 가 탄생한다. 부산 동래구보건소는 안락 SK아파트 주민들과 담배연기 없는 아파트 만들기 운동에 나선다고 9일 밝혔다. 이에 따라 보건소와 주민들은 아파트 계단 복도 어린이 놀이터 단지내 보행로 등에 금연공간임을 알리는 스티커와 현수막을 붙이고 입주민들의 금연 참여를 독려하기로 했다. 보건소와 주민 대표는 지난달 29일 금연아파트 만들기 협약을 체결했다. 보건소는 내주부터는 매주 한 번씩 아파트 관리사무소 앞에서 이동 금연클리닉을 운영하고 9월에는 모든 입주민을 대상으로 금연 및 건강교육을 할 예정이다. 보건소와 아파트 측은 금연을 위한 여론과 환경이 어느 정도 조성됐다고 판단되면 오는 10월 공식적인 담배연기 없는 아파트 선포식 을 가질 예정이다. 동래구는 안락 SK아파트 금연운동이 성과를 거두면 다른 아파트 단지로 이를 확대 추진할 방침이다. 동래구 보건소 관계자는 아파트 내 금연이 성공을 거두려면 입주민 모두가 간접흡연의 폐해에 공감하고 무엇보다 높은 공동체 의식이 요구된다 며 입주민들의 적극적인 협조를 당부했다.,https://news.naver.com/main/read.nhn?mode=LSD&mid=shm&sid1=260&oid=009&aid=0002128168,183
145142,2009.07.09. 오후 2:56,부동산,이데일리,포스코건설 독거노인 대상 사랑의 삼계탕 행사,이데일리 박성호기자 포스코건설은 지난 9일 초복을 앞두고 서울 관악구와 은평구에 위치한 사회복지관을 방문해 독거노인 및 기초생활수급자 250여명에게 삼계탕과 복수박을 대접하는 행사를 가졌다고 10일 밝혔다. 또 거동이 불편한 50여명의 독거노인 가정에 삼계탕을 직접 배달하고 사내 사회공헌사이트에 조성된 직원 기부금으로 선풍기 15대를 구입해 생활이 넉넉치 못한 가정에 전달했다. 포스코건설 사회공헌을 담당하는 송상훈 사회복지사는 어르신들이 삼복더위를 무사히 이겨낼 수 있도록 삼계탕을 준비하게 됐다 며 앞으로 더 많은 기업들이 뜻깊은 행사에 동참하길 바란다 고 말했다. 포스코건설은 매년 소외된 이웃을 찾아가 연탄배달 사랑의 집짓기 생활용품 지원 등 나눔 경영을 적극 실천하고 있다.,https://news.naver.com/main/read.nhn?mode=LSD&mid=shm&sid1=260&oid=018&aid=0002128903,183
145143,2009.07.09. 오후 2:55,부동산,매일경제,전세금 가파른 상승…한달새 1억 껑충,u3000 .10월 결혼식을 올리는 신모 35 씨는 오는 15일 입주하는 반포래미안 퍼스티지에 신혼집을 마련할 계획이었으나 최근 포기했다. 6월초 3억2000만원이었던 87㎡ 26평형 전세가격이 한달새 4억원으로 훌쩍 올라버렸기때문이다. u3000신씨는 입주가 시작되면 물량이 많이 쏟아져 전세금이 떨어질 것으로 예상하고 계약을 미뤘는데 불과 며칠새 8000만원이 뛰었다 며 신혼 전세집에 4억원 이상을 쏟아붇기는 힘들어 다른곳을 알아보고 있다 고 말했다. .대전 동구에 사는 주부 김 모씨는 7월 들어 매주 서울에 올라가 전세집을 알아보고 있다. 성악을 배우는 딸이 대회준비때문에 8월 한달 간 대치동에 있는 학원에 다니게 됐지만 전세집을 구하기 쉽지않다. 김 씨는 매번KTX를 태우기도 미안해 집을 구해보려 했지만 물도 잘 나오지 않는 집 전세금이 지금 사는 집 매매가보다 비싸다 며 혀를 내둘렀다. 서울지역 전세시장의 비수기가 실종됐다. u3000통상적으로 여름방학이 시작되기전인 6 7월은 전세시장이 소강상태를 보였으나 올해는 이례적으로 전세금이 가파르게 뛰고 있다. u30009일 닥터아파트에 따르면 6월 한달간 서울 전세가 변동률을 조사한 결과 0.75% 상승해 최근 5년내 가장 높은 상승률을 기록했다. 강남권은 1.66%로 상승률이 두드러졌다. 2007년과 2008년 6월 0.1%를 넘지못했던 변동률과 비교하면 대조적이다. u3000이같은 전세금 상승은 신규 입주가 마무리 되면서 물량이 달리는 송파구 잠실동과 서초구 반포동 지하철 7호선 개통 수혜를 입는 강서구 가양동 염창동 등이 주도하고 있다. u3000또한 학원가가 밀집한 강남구 대치동 인근도 전세 품귀현상을 빚고있다. u3000지방에서 여름방학 특강을 들으러 올라오는 학생들과 방학동안 학원 근처로 이사하려는 서울지역 학부모들이 단체로 집을 구하고 있기 때문이다. 한달새 1억원 뛴 곳도 u3000지난 5월 입주가 마무리된 송파구 신천동 파크리오는 전세 계약이 거의 끝나면서 전세금이 급등하고 있다. 총 7000여 가구중 중개업소에 나와있는 전세물량은 10여개 뿐이다. u3000파크리오 108㎡는 3억5000만원에서 4억원으로 한달새 5000만원이 올랐고 174㎡ 는 한달새 1억원이 올라 6억선이다. u3000송파구 신천동 JS파크리오 공인 관계자는 입주가 끝나고 물량이 확 빠지면서 전세금이 일주일새 수천만원이 뛰고 있다 면서 가격이 올랐다기 보다는 수요는 많은데 물량이 부족한 것이 주 원인 이라고 설명했다. u3000서초구에서는 2444가구의 대단지인 반포래미안 퍼스티지가 입주를 앞두고 있어 입주물량 쇼크로 인한 전세가격 하락이 예상됐으나 오히려 오름세를 보이고 있다. u3000반포자이는 전세 물량이 서서히 해소되면서 연초 대비 5000만 1억원 가까이 전세가격이 올랐다. 지난 1월 2억5000만 2억8000만원 선이던 반포자이 84㎡ 전세가는 3억2000만 3억8000만원 3억원 초반대면 구할 수 있었던 116㎡는 4억원이상을 호가한다. 전세금 왜 뛰나 u3000전세금 상승원인으로 전문가들은 서울지역의 공급물량 감소를 지목하고 있다. u3000곽창석 나비에셋 대표는 인천 경기 등 수도권의 경우 입주물량이 계속 대기중이지만 서울은 잠실 반포 외에는 공급이 거의없어 수급 불균형이 심화되고 있다 며 통상적으로 8월말경이 돼야 전세가 모자라는데 전세난이 한달 정도 빨리 온것 같다 고 말했다. u3000학원이나 학군수요도 전세가격을 견인하고 있다는 분석이다. u3000강남구 대치동 은마아파트에는 단지 전체를 통틀어 101㎡ 전세물건이 2 3개밖에 없다. 해외주재원 등 해외에서 자녀들의 방학후 유입되는 수요가 늘면서 전세물건이 귀하다는 것이 중개업소의 설명이다. u3000은마아파트 인근 e공인에서는 지금 전세집을 구하면 9월이나 들어갈 수 있다 며 물건도 1층 아니면 꼭대기층만 간간히 나와 마음에 드는 집을 구하기 어려울 것 이라고 말했다. u3000은마101㎡는 2억6000만 2억7000만원 인근 청실아파트는 105㎡가 2억7000만원 선이다. u3000학군이 좋기로 유명한 양천구 목동 신시가지 2단지도 한달새 전세금이 2000만원 정도 올랐다. 올해 1월까지만해도 학군수요도 살아나지 않아 거래가 뜸했으나 지난달부터는 신학기전 이사 오려는 학부모들의 문의가 이어지고 있다. 현재 89㎡은 지난달에 비해 1000만 2000만원이 오른 2억1000만 2억2000만원 정도 호가가 형성돼 있다. 평수가 커질수록 상승폭도 커서 115㎡의 경우는 2000만 3000만원 오른 3억4000만 3억5000만원 선에 거래된다. u3000전세금 상승에 대해 매매가격 대비 전세가격 비중이 30 40%로 크게 떨어지는 현재의 비정상적인 구조가 깨지는 과정이라고 보는 시각도 있다. u3000김현아 한국건설산업연구원 연구위원은 최근 2년동안 매매가격이 급격히 올랐으나 전세는 2년 단위로 계약을 체결하기때문에 쉽게 쫓아가지 못했다 면서 입주물량이 줄어들면서 현격히 낮은 전세가 비율이 상승하는 구조변화로 봐야 할 것 이라고 설명했다. 전세금 과세 전세난 부를수도 u3000전세금이 상승하는 가운데 정부가 추진중인 전세보증금에 대한 소득세 부과가 전세난을 심화시킬 수 있다는 주장이 제기되고 있다. u3000이영진 닥터아파트 소장은 세금부담을 임대인이 임차인에게 전가시키려 한다면 전세가격은 상승할 수밖에 없다 며 특히 강남3구 등 전통적으로 전세난이 심했던 지역 중심으로 전세금이 올라갈 것 이라 내다봤다 u3000함영진 부동산써브 실장도 전세금을 은행에 맡기거나 주식으로 재투자하기보다는 실수요자가 집을 살 때 자본금을 줄이기 위해 전세를 놓는 사례가 많다 며 전세 수요는 꾸준하기 때문에 집주인이 세금만큼 전세가격을 올리면 오히려 전세시장이 불안정해질 수 있다 고 말했다. u3000전세를 월세로 전환하는 경향이 강해지면서 물량부족으로 전세난이 더 심화될 것이라는 지적도 잇따르고 있다. u3000이남수 신한은행 PB부동산팀장은 재개발 재건축 등으로 멸실주택이 계속 늘어나는 상황에서 장기적으로 주택시장 안정을 꾀하기 위해서는 중장기적으로 공급을 늘리는 데 초점을 맞춰야 한다 고 지적했다.,https://news.naver.com/main/read.nhn?mode=LSD&mid=shm&sid1=260&oid=009&aid=0002128163,183
