,date,cat,co,headline,text,url,week
6234,2006.03.12. 오후 10:33,부동산,파이낸셜뉴스,집값 또 심상찮다…“판교 분양후 더 오른다” 수도권 매물품귀,경기 성남 판교신도시 아파트 분양을 앞두고 서울 강남권과 수도권 주요지역 집값이 가파르게 오르고 있다. 최근 집값 상승세는 강남권과 경기 분당·용인 등 노른자위 지역을 중심으로 양천구 목동 등 다른 지역으로 확산되고 있다는 점에서 제2의 집값 파동마저 우려되고 있다. 특히 주요 아파트단지에서는 판교 분양 이후의 집값 상승에 대한 기대감으로 매물을 회수하고 있고 가격 상승에 불안을 느낀 대기 수요자들이 대거 매수세력에 가담해 호가 상승에 기름을 붓고 있다. 이런 상황에서 한 두건만 거래되면 호가가 실거래가로 굳어지는 ‘악순환’이 되풀이되고 있다. 12일 일선 부동산정보업체와 부동산중개업소에 따르면 서울 강남권과 목동 분당 및 용인 등 인기지역을 중심으로 매물품귀 현상이 나타나면서 집값이 크게 오르고 있다. 부동산114에 따르면 지난주 서울지역 집값 상승률은 0.47%로 8·31대책 발표 이전 수준을 기록했으며 서울 25개구 모두 상승세를 나타냈다. 양천구 목동 K공인 관계자는 “목동과 신정동은 강남지역 집값을 누르면 그 여파가 주변지역으로 번지는 풍선효과로 인해 신시가지를 중심으로 오름폭이 확대되고 있다”면서 “하지만 매물이 없어 실제 거래는 뜸하다”고 말했다. 신정동 신시가지 10단지 38평형은 지난주에 비해 2000만원가량 상승한 11억5000만원선이고 55평형은 18억원에서 20억원으로 올랐다. ‘제2 롯데월드’ 개발호재를 받고 있는 송파구 신천동 일대 아파트값도 큰 폭으로 상승했다. 장미아파트 65평형은 17억원 56평형은 15억원으로 1주일새 호가가 1억원 가까이 올랐고 46평형과 33평형도 호가가 13억원 8억3000만원으로 5000만∼1억원가량 뛰었다. 신천동 D중개업소 관계자는 “중대형 평형에 대한 수요가 꾸준한 데 공급이 전혀 이뤄지지 않으니 당연히 오를 수밖에 없지 않느냐. 지금은 내놓은 매물도 거둬들이는 양상이어서 집값 오름세는 당분간 지속될 것 같다”고 전했다. 분당과 용인도 ‘판교 효과’에 고무된 집주인들이 경쟁적으로 값을 높여 부르고 있다. 이들 지역 집값은 지난해 말보다 평형별로 호가가 수천만원에서 2억원까지 올랐다. 이처럼 호가 오름세가 계속되자 이달들어 평당 5000만원을 돌파하는 아파트 단지도 생겨났다. 강남구 삼성동 아이파크 63평형은 평균 평당가가 5159만원 대치동 동부센트레빌 60평형은 5333만원까지 치솟았다. 아이파크 73평형 중 조망이 좋은 로열층은 평당 5000만원에 실제 거래가 이뤄진 것으로 알려졌다. 전문가들은 이러한 가격 왜곡현상을 개선하기 위해서는 공급확대가 선행돼야 한다고 지적한다. 지금과 같은 규제 위주의 부동산대책은 오히려 매물 출현을 막아 품귀현상을 가속화시키고 가격을 끌어올리는 부작용이 되풀이된다는 것이다. 김영진 내집마련정보사 사장은 “최근의 호가 상승은 판교 분양이나 송파신도시 개발 등 여러가지 호재가 겹친 탓도 있지만 근본적인 요인은 수요에 비해 공급이 턱없이 부족한데서 비롯된 것이기 때문에 앞으로 발표될 부동산대책에는 공급확대를 위한 처방도 함께 제시돼야 한다”고 강조했다.,https://news.naver.com/main/read.nhn?mode=LSD&mid=shm&sid1=260&oid=014&aid=0000216247,10
6235,2006.03.12. 오후 9:42,부동산,한겨레,3월 14일 부동산 파일,한겨레 ‘신도림역 테크노마트’ 잔여분 프라임산업 은 서울 영등포구 신도림동에 지는 초대형 복합쇼핑몰 ‘신도림역 테크노마트’의 잔여분 상가를 분양한다. 분양가는 평당 1600만 4천만원이며 중도금의 40%까지 융자를 알선해 준다. 대우건설이 시공하며 2007년 하반기에 개점할 예정이다. 지하 7층·지상 26층 연면적 8만6천여평으로 신도림역과 직접 연결된다. 전자·전기 전문매장을 비롯해 대형 할인점 멀티플랙스 영화관 스포츠센터 전문 식당가 벤처비즈니스센터 등이 들어선다. 02 3424 7800. 동백지구 쇼핑몰 ‘쥬네브’ 상가 쥬네브 는 경기 용인 동백지구에 짓고 있는 쇼핑몰 ‘쥬네브’의 회사보유분 상가를 선착순 분양한다. 포스코건설과 삼부토건이 연면적 6만4천평 규모로 짓는 초대형 복합상업시설로 2만여평 호수공원이 조성되며 주변에 1만7천가구의 아파트가 지난달부터 입주 중이다. 이번에 분양되는 상가는 병원 식당 제과점 아이스크림 의류 업종의 입점이 가능하며 오는 9월 문을 열 예정이다. 동백 죽전간 도로 개통으로 주변지역에서의 접근성도 개선됐다. 031 717 7411. 경기 이천 사음동 전원주택 단지 파인힐디엔씨 는 경기 이천시 사음동 1만평 터에 전원주택 단지를 분양한다. 필지당 200평 300평 규모로 모두 47필지로 이뤄진다. 분양값은 평당 91만 104만원선이다. 필지분할을 마쳐 소유권 이전과 동시에 건축이 가능하다. 도자기마을 도예촌 뒤편에 자리잡고 있으며 2009년 경전철이 개통될 예정다. 02 3472 7762. ue0565c제피로스 골프클럽 ue05a은 제주도 북제주군 조천읍 와흘리 ‘제피로스‘ 골프장의 정회원을 모집한다. 입회금은 개인 1억2천만원 법인 2억4천만원이며 일시불로 납부하는 경우 1천만원의 할인 혜택이 주어진다. 회원이 되면 정회원 외에 가족 지정 때 2명 회원대우 타인 지정 때 1명 회원대우 무기명카드 중 하나를 선택할 수 있다. 회원에게는 월 4회 주말부킹을 해주며 주중에는 2 5인 라운딩이 가능하다. 02 541 0036. 온라인미디어의 새로운 시작. 인터넷한겨레가 바꿔갑니다. ⓒ 한겨레 hp www.hani.co.kr 무단전재 및 재배포 금지 한겨레는 한국온라인신문협회 www.kona.or.kr 의 디지털뉴스이용규칙에 따른 저작권을 행사합니다.,https://news.naver.com/main/read.nhn?mode=LSD&mid=shm&sid1=260&oid=028&aid=0000148548,10
6236,2006.03.12. 오후 9:42,부동산,한겨레,3월 13일 부동산 캘린더,한겨레 온라인미디어의 새로운 시작. 인터넷한겨레가 바꿔갑니다. ⓒ 한겨레 hp www.hani.co.kr 무단전재 및 재배포 금지 한겨레는 한국온라인신문협회 www.kona.or.kr 의 디지털뉴스이용규칙에 따른 저작권을 행사합니다.,https://news.naver.com/main/read.nhn?mode=LSD&mid=shm&sid1=260&oid=028&aid=0000148547,10
6237,2006.03.12. 오후 9:42,부동산,한겨레,서울 강남권·새도시 매물 없어 ‘강세’,한겨레 봄 이사철이 막바지에 이르면서 아파트 매맷값이 소폭 오르고 있다. 서울 강남권과 양천구 수도권 새도시 등 선호도가 높은 지역에서는 매물부족 현상으로 아파트 값이 강세를 보이고 있다. 또 판교 새도시 분양을 앞두고 용인 등 수도권 주요지역도 매맷값이 조금 올랐다. 전셋값은 전주보다 상승폭이 다소 커졌으나 분당을 비롯한 일부 지역의 전세가격이 내리는 등 이사철로 인한 전세가격 상승세가 한풀 꺾이는 양상이다. 판교 분양 앞두고 수도권 올라 이사철 전셋값 상승 한풀 꺾여 지난주 서울지역 아파트 매맷값 변동률은 한 주간 0.47%를 기록했고 새도시 0.53% 수도권 0.25% 등 비교적 높은 폭의 변동률을 각각 기록했다. 전셋값은 서울 0.28% 새도시 0.17% 수도권 0.21%로 소폭 상승했다. 서울지역 매맷값은 지난주 내린 구가 한 곳도 없는 가운데 양천 0.99% 송파 0.87% 서초 0.79% 용산 0.69% 강남 0.54% 마포 0.47% 등이 평균 변동률을 웃도는 상승세를 보였다. 실수요자 중심으로 간혹 거래가 형성되는 양천구는 목동과 신정동 새시가지단지와 주상복합 단지가 오름세를 보였고 송파구는 ‘제2롯데월드’ 건립계획으로 주변 재건축과 대단지들이 오름세를 보였다. 특히 롯데월드 근처인 신천동 장미1 2차는 수요가 몰리면서 오름세를 보였고 가락동 가락시영1차 잠실동 주공5단지 등 재건축도 소폭 오름세를 이어갔다. 서초구는 서초동 삼호2차와 신동아1차 우성1차 반포동 삼호가든3차 한신15차 등 정밀안전진단을 받은 재건축 추진 단지들을 중심으로 매맷값이 올랐다. 용산과 성동구는 용산공원과 뚝섬 뉴타운 주변으로 중대형 주택단지를 개발한다는 서울시 발표 이후 매수자들의 문의가 늘고 주거용 매물이 회수되는 움직임이 나타나고 있다. 새도시는 평촌 0.61% 분당 0.60% 산본 0.52% 일산 0.48% 차례로 올랐고 중동은 변동이 없었다. 평촌의 경우 귀인동 꿈마을 단지 등에서 꾸준히 학군 수요가 형성되면서 올랐고 신촌동 무궁화 갈산동 샘마을도 주요 40 50평형대 매맷값이 상승했다. 수도권은 용인 0.61% 김포 0.46% 안양 0.46% 파주 0.40% 수원 0.34% 광명 0.28% 등이 오름세를 보였다. 상승률이 높았던 지역들은 모두 새도시 개발이나 판교 분양 주변 재건축 등의 지역별 호재가 있는 곳으로 특히 광명은 재건축 기대심리가 반영된 노후 단지들이 상승세를 보였다. 반면 양주 0.21% 안산 0.05% 오산 0.03% 등은 다소 약세를 보였다. 안산은 고잔동 푸르지오 금강2차 등 대단지 매물이 쏟아지면서 하락세를 보였다. ue056 최종훈 기자·자료제공 부동산114 온라인미디어의 새로운 시작. 인터넷한겨레가 바꿔갑니다. ⓒ 한겨레 hp www.hani.co.kr 무단전재 및 재배포 금지 한겨레는 한국온라인신문협회 www.kona.or.kr 의 디지털뉴스이용규칙에 따른 저작권을 행사합니다.,https://news.naver.com/main/read.nhn?mode=LSD&mid=shm&sid1=260&oid=028&aid=0000148546,10
6238,2006.03.12. 오후 9:33,부동산,한겨레,고분양가 논란 하남 풍산지구 ‘첫 시동’,한겨레 서울과 가까운 택지지구로 관심을 모아온 경기 하남 풍산택지지구에 드디어 첫 분양이 시작된다. 동부건설과 삼부토건 제일건설이 잇따라 분양에 나서 이달에만 모두 899가구를 선보일 예정이다. 또 5 6월께는 동원이앤씨와 하남시 도시개발공사가 1312가구를 내놓는다. 판교 새도시 동시분양을 앞둔 시점이지만 풍산지구 참여업체들은 판교 영향을 크게 받지 않을 것으로 자신하고 있다. 그렇지만 연초부터 고분양가 논란으로 분양이 연기된 곳이어서 수요자들의 선호도가 어떻게 나타날지 관심사다. 동부센트레빌 첫선 동부건설은 동부센트레빌 32평형 168가구의 본보기집을 지하철 5호선 아차산역 인근에 열었다. 청약은 이달 15 17일 사흘간 받고 23일 당첨자 발표할 예정이다. 회사쪽은 하남시 요청에 따라 분양가를 낮추면서 침실 온돌마루 전자오븐 등 가전제품 비데 발코니 확장 등 상당수 마감재를 옵션 선택품목 으로 전환했다. 분양가는 기준층 기준 평당 1227만원으로 결정됐다. 전체 물량의 30%가 하남시 거주자에게 우선 공급되고 70%는 서울 및 수도권 거주자에게 배정된다. 또 모두 전용 25.7평 이하여서 40%는 만 40세 이상 10년 무주택자에게 35%는 만 35세 이상 5년 무주택자에게 각각 우선 공급된다. 동부건설 관계자는 “판교 분양을 앞두고 있지만 지역 실수요자가 많아 1순위 마감이 무난할 것으로 기대한다”고 말했다. 동부건설에 이어 삼부토건은 38평형 471가구를 제일종합건설은 40 50평형 260가구를 각각 이달 중 내놓을 예정이다. 또 동원이앤씨 33평형 317가구 와 하남시 도시개발공사 33평형 994가구 가 각각 상반기중 분양에 나선다. 이 가운데 제일건설이 이달 내놓을 260가구는 중대형으로만 이뤄져 눈길을 끈다. 전가구를 남향으로 배치했고 건물의 외관을 빌라처럼 꾸며 차별화했다. 이와함께 확장형 발코니 설계로 최대 15평을 서비스 면적으로 제공했다. 분양가는 다소 비싸 하남 풍산지구는 30만7천여평 터에 주택 5700여가구가 들어서는 곳이다. 지리적으로 서울 강동 송파구와 맞닿아 있고 주변을 개발제한구역 그린벨트 이 둘러싸고 있어 자연환경이 쾌적하다. 교통여건도 무난하다. 올림픽대로를 타면 서울 잠실까지 15 20분 정도면 도착한다. 서울외곽순환도로 등을 타고 서울 강남 북으로 드나들기도 편리하며 2008년 말 암사대교가 개통되면 서울 강동구와 더 가까와진다. 지하철 5호선 상일역과 연결되는 경전철은 2010년께 완공될 전망이다. 풍산지구가 판교 새도시 아파트와 다른 점은 전매제한 부분이다. 풍산지구 아파트는 분양가 상한제를 적용받지 않아 판교와 달리 입주 후 바로 사고팔 수 있다. 다만 도시개발공사가 분양할 33평형 994가구만 원가연동제를 적용받아 전매제한이 10년으로 묶이게 된다. 그렇지만 분양가격이 비교적 높다는 것은 여전히 약점으로 지적된다. 동부건설의 32평형 기준층 분양값이 평당 1227만원으로 결정됨에 따라 후속 업체들의 이 규모 분양값은 비슷한 수준이 예상된다. 다만 40 50평대 아파트는 평당 1300 1400만원선으로 이 지역 최고가를 경신할 전망이다. 이런 분양가는 하남 신장지구 에코타운이 평당 1천만 1200만원선인 것을 감안하면 평당 100 200만원 정도 비싼 수준이다. 이에 따라 현지 부동산업계도 풍산지구 분양가에 대해서는 의견이 분분하다. 신장동 누리공인중개사사무소 관계자는 “분양값이 다소 높은 게 사실이지만 하남에서는 오랜만에 선보이는 30평대 이상 중대형 단지라는 점은 관심을 끄는 요인”이라며 “단지별로 차별화될 품질이 성패를 가를 것”이라고 내다봤다. 최종훈 기자 cjhoon hani.co.kr 온라인미디어의 새로운 시작. 인터넷한겨레가 바꿔갑니다. ⓒ 한겨레 hp www.hani.co.kr 무단전재 및 재배포 금지 한겨레는 한국온라인신문협회 www.kona.or.kr 의 디지털뉴스이용규칙에 따른 저작권을 행사합니다.,https://news.naver.com/main/read.nhn?mode=LSD&mid=shm&sid1=260&oid=028&aid=0000148543,10
6239,2006.03.12. 오후 9:30,부동산,파이낸셜뉴스,단독·다가구 공시가 형평성 논란,오는 4월28일 발표될 예정인 지방자치단체의 단독 및 다가구주택 ‘공시가격’을 놓고 벌써부터 조세 형평성 논란 등 각종 부작용이 불거질 조짐을 보이고 있다. 일부 지자체들은 주변 개발호재 등을 이유로 공시가격을 대폭 상향조정하는 데 비해 일부 지역은 시가의 50∼60% 수준에서 공시가격을 결정할 것으로 알려졌기 때문이다. 공시가격은 건설교통부의 표준주택가격을 기준으로 주변 주택의 특성을 감안해 산정한 것으로 재산세·종합부동산세·상속세·증여세·양도세의 기준이 되며 일반적으로 시가의 80% 수준에서 결정돼 왔다. 전문가들은 공시가격이 시가와 동떨어지면 ‘동일가격 동일세금’의 원칙이 무너지면서 세금 형평성에 문제가 발생할 수 있고 이는 납세자의 민원과 항의로 이어지게 된다며 우려하고 있다. 한쪽은 오르고 한쪽은 떨어지고 지자체 공시가격 평가담당 실무자들은 단독 및 다가구주택의 개별가격 상승률은 건교부가 기준으로 제시했던 표준주택 오름폭보다 훨씬 높은 경우가 적지 않을 것이라고 밝혔다. 경기도 성남시 관계자는 “분당구의 표준주택 가격은 13.7% 오르는 것으로 건교부가 발표했으나 개별주택에 대한 가격 산정 결과 평균 20% 이상 상승할 것으로 보인다”면서 “이는 토지가격이 45%나 올랐기 때문”이라고 설명했다. 반면 공시가격 상승률이 예상보다 낮거나 시가의 50∼60%에 그치는 곳도 나타날 것으로 보인다. 광진구 관계자는 “표준주택 가격은 3%가량 올랐는데 개별주택에 대한 가격산정 결과 평균가격이 지난해보다 떨어지는 것으로 나타났다”고 밝혔다. 특히 시가를 반영하지 못하는 곳도 많은 것으로 알려져 조세 형평성 등 각종 부작용이 우려된다. 전문가들은 지자체가 주민들의 불만과 조세저항을 감안해 가격을 미리 낮춰주거나 건교부의 주택가격 비준표를 기계적 획일적 으로 적용하면서 이같은 문제가 발생하고 있다고 지적했다. 세금 형평성 등 각종 혼란 우려 단독 및 다가구주택 공시가격은 재산세·종합부동산세·양도소득세·상속세·증여세의 과세기준이 된다. 따라서 이들 주택 소유주들은 인근의 주택가격에 비해 자신의 주택가격이 높을 경우 민원을 제기할 가능성이 높다. 특히 정부가 제시했던 표준주택 가격 상승률보다 자기 주택 가격 오름폭이 적게는 2배에서 많게는 3∼4배인 지역의 경우 항의가 잇따를 것으로 보인다. 서울 구로구 관계자는 “공시가격이 시가보다 높아 과도한 세금을 물게 됐다는 항의와 공시가격이 낮아 토지 수용 관련 보상금을 적게 받게 됐다는 문제제기가 동시에 나올 가능성이 있다”고 말했다. 이와 관련 익명을 요구한 한 감정평가사는 “시가라는 것은 위치 조건 매매상대방 등에 따라 달라지는 매우 불확실한 개념”이라면서 “따라서 누구도 정확한 시가를 제시하기 어려운 점이 있다는 것을 감안해야 한다”고 지적했다.,https://news.naver.com/main/read.nhn?mode=LSD&mid=shm&sid1=260&oid=014&aid=0000216228,10
6240,2006.03.12. 오후 9:15,부동산,한겨레,강남 집값 4개월째 가파른 오름세,한겨레 ‘8·31 부동산대책’ 이후 한동안 잠잠하던 집값이 서울 강남을 중심으로 가파른 오름세를 보이고 있다. 또 이러한 집값 오름세와 함께 판교 청약대기 현상까지 겹쳐 전셋값도 동반상승하고 있다. 12일 부동산정보업체 부동산 114 자료를 보면 지난주 서울의 아파트 매매가격 상승률은 0.47%로 나타났다. 이는 주간 상승률로는 지난해 7월 첫째주 0.53% 이후 가장 높은 것이다. 또 재정경제부의 ‘최근 경제동향’ 자료를 보면 지난달 서울 강남 한강 남쪽 지역 의 아파트값은 1.5% 올라 서울 1.1% 과 전국 0.6% 의 평균 아파트값 상승률을 크게 웃돌았다. 강남의 월별 아파트값 상승률 전월 대비 은 지난해 8·31 대책을 전후한 8 10월에는 0.2% 0% 0.4% 등으로 서울 평균보다 낮았다 표 . 그러나 11월부터는 다시 예전 추세를 회복해 강남의 집값 상승률이 서울 평균을 웃돌기 시작했고 그 격차도 점점 커지고 있다. 올 들어 지난 1월16일과 3월6일의 구별 아파트 평균 평당가격을 비교해보면 강남구는 2634만원에서 2766만원으로 두달반 동안 5.0%나 올랐다. 같은 기간 마포구는 1121만원에서 1138만원으로 1.5% 노원구는 671만원에서 675만원으로 0.6% 올라 상당한 차이를 보여줬다. 서울 강남구 도곡동 타워팰리스 35평형 매맷값은 지난해 8월부터 12월 초까진 9억7500만원에 묶여 있었다. 그러나 지난해 연말부터 값이 뛰기 시작해 현재 10억5천만원까지 올랐다. 덩달아 전셋값도 지난해 8월 4억1천만원에서 현재 4억8500만원으로 7500만원이나 올랐다. 집값 상승은 강남을 시작으로 시차를 두고 인근 목동 등으로 퍼져나가는 흐름도 보인다. 양천구 목동 우성아파트 33평형은 지난해 8월부터 올해 1월 말까진 4억 4억2천만원으로 가격흐름이 완만했다. 그런데 강남 집값상승 등의 영향으로 지난 2월 들어 상승세가 확연해져 한 달 만에 7250만원 오른 4억9250만원에 가격이 형성되고 있다. 권태호 기자 ho hani.co.kr 온라인미디어의 새로운 시작. 인터넷한겨레가 바꿔갑니다. ⓒ 한겨레 hp www.hani.co.kr 무단전재 및 재배포 금지 한겨레는 한국온라인신문협회 www.kona.or.kr 의 디지털뉴스이용규칙에 따른 저작권을 행사합니다.,https://news.naver.com/main/read.nhn?mode=LSD&mid=shm&sid1=260&oid=028&aid=0000148529,10
