,date,cat,co,headline,text,url,week
50671,2007.04.29. 오후 10:51,부동산,스포츠경향,이건희회장 집값 ‘부동의 1위’,서울 용산구 이태원동에 있는 삼성그룹 이건희 회장의 자택이 우리나라에서 가장 비싼 집으로 평가받았다. 건설교통부는 29일 올해 1월1일을 기준으로 산정한 공동주택 아파트 연립 다세대 903만가구의 가격을 30일 기준으로 공시했다. 시·군·구청은 단독주택 405만가구의 가격을 공시한다. 이번 공시에 따르면 이회장의 자택은 공동주택 903만가구와 단독주택 405만가구 등 우리나라에 있는 주택 1308만가구를 통틀어 공시가격이 가장 비쌌다. 이회장 명의의 또 다른 중구 장충동1가 주택과 용산구 이태원동 주택도 ‘비싼 집’ 3위와 4위에 각각 올랐다. 이건희 회장의 이태원동 자택의 공시가격은 91억4000만원으로 작년 85억2000만원 보다 6억2000만원 7.27% 올랐다. 경기 과천 공동주택 가격이 49.2% 오른 것에 비하면 별로 오르지 않았지만 계속 ‘가장 비싼 집’ 자리를 지키고 있다. 공시가격을 실거래가의 80%선에 맞췄다는 게 건교부의 설명이어서 실제 이 주택의 가격은 110억원대에 이를 것으로 예측되고 있다. 이회장이 살고 있는 이 주택은 대지면적 2145㎡ 649평 건물연면적 3438㎡ 1040평 로 지하 2층 지상 2층이다. 청와대 대통령 관저가 건평 444평에 앞마당이 477.6평이니 대통령보다 큰집이다. 신축 당시 농심 집안과 일조권 문제를 놓고 치열한 논란을 벌였던 그 주택이다. 이 집터는 닭이 알을 품고 있는 형상 금계포란형 으로 집터로는 최고의 길지로 꼽히는 곳이다. 삼성물산 건설 부문이 2004년 7월 완공한 이 저택은 직사각형 건축물 위에 검은색 지붕을 얹고 오각형 모양의 창을 내 유럽 저택을 연상시킨다. 하지만 집 내부 구조는 거의 베일에 가려져 있다. 이 주택은 이회장의 글로벌 경영을 진두지휘할 최첨단 주택으로 만든 것으로 알려졌다. 홈 네트워크를 비롯해 각종 첨단 장비와 인테리어 그리고 완벽에 가까운 방화·방음·방진 설계가 이뤄지는 등 미국의 갑부인 빌게이츠 마이크로 소프트 회장의 3차원 집과 견주는 사람들도 많다. 이 주택 신축시 삼성 건강주택팀 연구원이 3개월간 직접 임상실험을 하는 등 엄격한 테스트를 거쳐 실내 페인트를 선정했다고 알려지면서 논란이 일기도 했다. 이 주택은 건축비로 800억 1000억이 들었다는 소문이 나기도 한 집이다. 국내에서 두번째로 비싼 주택은 서울 동작구 흑석동에 있는 방상훈 조선일보 회장 소유 주택으로 공시가격은 86억3000만원으로 산정됐다. 방회장의 집은 건물 연면적이 이건희회장 집의 4분의 1 수준인 246평이지만 대지 1539평에 임야 2209평이 따라붙어 있어 웬만한 공원을 방불케 한다. 고가 주택 3 4위는 이건희 회장 명의의 중구 장충동1가 주택 304평 과 용산구 이태원동의 또 다른 주택 965평 으로 각각 공시가격은 76억9000만원 74억1000만원이다. 이 회장이 가장 비싼 집 1·3·4위를 차지하고 있는 것이다. 또 5번째로 비싼 주택은 서영배 태평양개발 회장 소유의 용산구 한남동 단독주택으로 공시가격은 71억4000만원이다. 이에 비해 단독주택 중 가장 ‘싼 주택’은 경북 울진군 서면 소재 주택으로 30만9000원으로 산정됐다. 이회장의 이태원동 주택은 최저가 주택 3만여채에 해당하는 가격인 셈이다.,https://news.naver.com/main/read.nhn?mode=LSD&mid=shm&sid1=260&oid=144&aid=0000044410,69
50672,2007.04.29. 오후 10:14,부동산,국민일보,올 재산세 11% 오를듯,주택 공시가격의 상승으로 올해 단독주택과 공동주택 아파트 등 에 부과되는 재산세가 평균 11.1% 정도 오를 것으로 추산됐다. 행정자치부는 29일 부동산 가격 상승 등으로 인해 주택 공시가격이 높아짐에 따라 주택에 부과되는 재산세가 지난해에 비해 11.1% 정도 늘어날 것으로 전망된다 고 밝혔다. 이에 따라 전체 재산세수는 지난해 1조145억원에서 1127억원 11.1% 늘어난 1조1272억원에 이를 것으로 집계됐다. 서울지역은 지난해 4587억원에서 813억원 17.7% 늘어난 5400억원이 될 전망이다. 경기지역은 지난해 2139억원에서 2360억원으로 인천은 지난해 507억원에서 535억원으로 각각 증가할 것으로 추산됐다. 1주택당 평균 재산세는 지난해보다 9000원 정도 늘어난 8만5000원선에 이를 것으로 전망됐다. 공시가격별로는 3억원 이하 주택은 2006년 6384억원에서 2007년 6639억원으로 4.0% 3억원 초과∼6억원 이하는 2043억원에서 2239억원으로 9.6% 6억원 초과는 1718억원에서 2394억원으로 39.3%가 각각 늘어난다. 행자부는 올해 재산세가 지난해에 비해 10% 이상 늘게 된 것은 전국의 주택 공시가격 평균상승률이 지난해에 비해 22.8%나 올랐기 때문 이라고 설명했다.,https://news.naver.com/main/read.nhn?mode=LSD&mid=shm&sid1=260&oid=005&aid=0000276891,69
50673,2007.04.29. 오후 9:56,부동산,국민일보,공동주택 공시가격 발표 과천 8단지 31평 4억4400만원서 7억1000만원으로,올해 전국 공동주택 아파트·연립·다세대 공시가격이 지난해 상승률 16.4% 을 웃도는 평균 22.8% 올랐다. 특히 지난해 집값이 크게 오른 서울 강남권 등 버블세븐 지역의 상승폭이 컸다. 공시가격은 재산세 종합부동산세 종부세 증여세 등의 과세 기준이 된다. 어디가 얼마나 올랐나 건설교통부는 29일 “올 1월 기준 전국 903만가구의 공동주택 가격은 지난해보다 평균 22.8% 상승한 것으로 집계됐다”며 “전용면적 85㎡ 25.7평형 초과 주택은 23.8∼28.4% 25.7평형 이하 주택은 12.6∼23.1% 상승률을 보였다”고 밝혔다. 개별 단독 주택 약 405만가구의 가격도 평균 6.22% 올랐다. 시·도별로는 공동주택이 경기도 31.0% 서울 28.5% 울산 20.3% 인천 17.0% 등 순으로 올랐다. 대전 1.9% 은 유일하게 하락했다. 서울은 강남권 31.0% 이 강북권 23.0% 보다 상승률이 높았다. 특히 양천구는 46.1%의 높은 상승률을 기록했고 강남구 31.6% 송파구 28.5% 서초구 27.8% 등 강남 3개구도 크게 올랐다. 경기도에서는 과천시가 전국 최고인 49.2% 올랐고 파주시 48.1% 안양시 동안구 47.8% 군포시 47.7% 성남시 수정구 47.3% 등이 뒤를 이었다. 단독주택은 전체적으로 6.22%가 오른 가운데 울산 13.95% 서울 8.85% 경기 8.54% 인천 5.46% 등이었다. 제주는 0.12% 떨어졌다. 고가주택 상승폭 컸다 공동주택 중에서는 고가 아파트 상승폭이 상대적으로 컸다. 이에 따라 서울·수도권 지역 고가 아파트 소유자들의 세 부담이 늘어날 전망이다. 가격대별로는 1억원 이하 9.7% 1억∼2억원 16.6% 2억∼4억원 30.9% 4억∼6억원 32.9% 6억원 초과 31.5% 올랐다. 단지별로는 과천시 부림동 주공 8단지 31평형이 4억4400만원에서 7억1000만원으로 59.9%나 올랐고 서울 목동 신시가지 3단지 35평형도 8억5600만원으로 54.5% 올랐다. 서울 서빙고동 신동아 31평형은 올해 6억8000만원으로 41.1% 삼성동 아이파크 59평형은 24억5600만원으로 30.1% 올랐다. 공동주택 903만가구 가운데 아파트 719만 연립 45만 다세대 139만가구였다. 규모별로는 25.7평형 이하가 88.3%로 대부분이었다. 가격도 2억원 이하가 82%를 차지했다. 종부세 부과 대상인 6억원 초과 주택은 3% 27만4784가구 에 불과했다. 단독주택을 포함해도 전체 1300여만가구 중 6억원 초과 주택은 30만711가구였다. 이는 지난해보다 90% 가량 증가한 규모다. 건교부는 시세의 80% 수준인 공동주택 공시가격을 30일 홈페이지 www.moct.go.kr 에 올리며 각 시·군·구청도 단독주택 가격을 공시한다. 열람은 다음달 말까지며 건교부 시·군·구 한국감정원에 팩스 등으로 이의신청할 수 있다. 건교부는 중앙부동산평가위원회 심의 등을 거쳐 6월29일 재조정한 결과를 공시한다.,https://news.naver.com/main/read.nhn?mode=LSD&mid=shm&sid1=260&oid=005&aid=0000276849,69
50674,2007.04.29. 오후 9:39,부동산,파이낸셜뉴스,경기 과천 49.2% 공시가 최고 상승,지역별로 공시지가 상승률이 가장 높은 곳은 과천인 것으로 조사됐다. 건설교통부 발표에 따르면 수도권이 지난해와 비교해 28.8% 광역시는 7.7% 각 도는 7.1% 올랐다. 시·도별로는 경기도가 31.0% 서울이 28.5% 상승해 전국 평균 상승률을 웃돌았다. 특히 경기도 과천은 전국 최고인 49.2% 올랐고 파주 48.1% 안양 동안 47.8% 군포 47.7% 성남 수정 47.3% 일산 40.3% 강서 38.6% 등 개발호재 지역도 상승세가 두드러졌다. 버블세븐 지역 중 서울 양천구가 46.1%로 가장 많이 올랐고 강남 31.6% 송파 28.5% 서초 27.8% 등이 25% 이상 올랐다. 이에 따라 과천은 공동주택 중 절반 이상인 54.5%가 공시가격 6억원을 넘어 종부세 대상이 됐으며 서초 49.8% 강남 48.6% 분당 33.2% 송파 27.8% 등에서 6억원이 넘어 종부세를 내는 사람이 크게 늘어났다. 전국적인 상승률은 울산 20.3% 인천 17.0% 경북 13.2% 등 지방도 두자릿수의 상승률을 기록했다. 제주와 강원은 각각 1.1% 2.8%의 상승률을 나타내는 데 그쳤고 행정도시 주변지역인 대전은 되레 1.9% 떨어졌다. 평형별로는 85㎡ 초과 25.7평 중·대형주택은 23.8∼28.4% 오른 반면 85㎡ 이하 소형주택은 12.6∼23.1% 정도 오른 것으로 집계됐다. 한편 올 1∼5월말까지 입주 예정인 주택은 6월1일 추가 가격을 공시해 보유세가 매겨진다. 건교부는 강남을 중심으로 가격이 내리고 있지만 공시가격 재조정은 없을 것이라고 밝혔다.,https://news.naver.com/main/read.nhn?mode=LSD&mid=shm&sid1=260&oid=014&aid=0000299025,69
50675,2007.04.29. 오후 9:39,부동산,파이낸셜뉴스,서울 서초 트라움하우스 230평 50억 ‘전국최고’,서울 서초동 트라움하우스 5차 230평형이 50억4000만원으로 5년 연속 전국 최고가 공동주택 자리를 지켰다. 트라움하우스 230평형의 지난해 공시가격은 40억원이었다. 독일어로 꿈의 집 이란 이름의 트라움하우스는 서초동 서리풀공원 인근에 위치해 있다. 트라움하우스 230평형은 거래가 전혀 없어 실제 거래가격은 알 수 없다. 또 실제 소유주는 물론 내부 모습이나 시설도 확인하기가 힘들다. 국내 최초로 리히터 규모 7 이상의 강진에도 견딜 수 있도록 설계됐으며 지하에는 200여명이 동시에 2개월 이상을 견딜 수 있도록 설계된 방공호도 설치돼 있는 것으로 알려졌다. 가구마다 전용 엘리베이터가 설치돼 있으며 바닥재로 사용한 대리석과 침대는 이탈리아 스팀사우나는 미국에서 수입한 호화제품이다. 트라움하우스에 이어 두번째로 비싼 공동주택에 오른 곳은 서울 삼성동 아이파크 104평형이다. 공시가격이 48억2400만원으로 지난해 39억9200만원에서 9억원 정도 올랐다. 삼성동 아이파크 104평형은 평당 가격이 4638만원에 달해 면적대비 가장 비싼 아파트에 올랐다. 서울 강남구 청담동 상지리츠빌카일룸2차 187평형이 40억4000만원으로 세번째 고가아파트에 이름을 올렸다. 이 아파트는 지난해 9월 준공된 신규아파트다. 16층규모 단일 건물에 15세대가 모두 187평형으로 구성돼 있다. 등록은 아파트로 분류돼 있지만 빌라형태에 더 가깝다. 최고급 자재에 첨단시설을 자랑하며 아직 손바뀜이 한번도 없어 시중 거래가격은 알 수 없다. 이어 서울 도곡동 타워팰리스1차 102평형이 지난해 31억6500만원에서 9억원 가까이 올랐지만 4위를 차지했다. 서울 서초동 트라움하우스3차 185평형은 40억원으로 5위를 차지했다. 한편 개인주택 부문에선 삼성그룹 이건희 회장 소유의 용산구 이태원 자택이 91억4000만원의 공시가격을 기록해 2년 연속 가장 비싼 주택에 올랐다. 이는 공동주택 903만가구와 단독주택 405만가구를 통틀어 가장 비싼 가격이다. 이 회장의 자택은 지상 2층 지하 2층 규모로 대지면적 649평에 연면적이 1040평이다. 지난해 공시가격은 85억2000만원이었다. 두번째로 비싼 개인주택은 서울 동작구 흑석동에 있는 방상훈 조선일보 사장 자택으로 올해 공시가격이 15억원이 올라 86억3000만원이다. 세번째와 네번째 주택도 역시 이건희 삼성회장이 보유하고 있는 서울 중구 장충동1가 단독주택 76억9000만원 과 이태원동 단독주택 74억1000만원 이다. 이어 5번째로 비싼 주택은 서영배 태평양개발 회장 소유의 용산구 한남동 단독주택으로 공시가격은 71억4000만원이다.,https://news.naver.com/main/read.nhn?mode=LSD&mid=shm&sid1=260&oid=014&aid=0000298862,69
50676,2007.04.29. 오후 8:57,부동산,세계일보,분양시장 에듀 아파트가 뜬다,아파트 분양시장에 ‘에듀 Edu·교육 ’ 바람이 불고 있다. 건설업계는 그동안 역세권과 조망권 유비쿼터스 시간과 장소에 구애받지 않고 자유롭게 네트워크에 접속할 수 있는 환경 등의 장점을 내세우며 치열한 경쟁을 벌인 데 이어 최근에는 자녀 교육에 초점을 맞춘 E Education 아파트’를 선보이며 소비자들을 유혹하고 있다. E아파트는 자녀 교육에 초점을 맞춰 단지 내 영어마을과 전자도서관 온라인교육센터 등 다양한 교육 커뮤니티 시설을 특화한 곳이다. 아파트 단지로 들어간 영어마을 동양건설산업은 5월 분양하는 김포시 북변동 ‘김포파라곤 2차 33∼44평형 133가구 ’ 단지 내에 ‘에듀 하우스’를 조성한다. 에듀 하우스는 단지 내 상가가 아닌 원어민 영어 강사가 사는 아파트에 꾸며진다. 특히 파라곤 에듀 하우스는 입주민들의 영어 교육 욕구를 충족시키기 위해 연령대에 맞는 다양한 프로그램을 계발해 쉽게 생활영어를 익히게 한다는 계획이다. 1년간 가구당 한 명씩 영어교육비가 무료로 지원되고 그 이후에는 입주민회의를 통해 교육비가 정해진다. 한국토지신탁이 시공하는 충남 아산시 신창면 남성리 ‘아산코아루에듀파크’ 35∼60평형 에도 영어마을이 들어선다. 영어 마을은 파라곤과 같이 원어민 강사가 입주하는 아파트에 꾸며지며 입주민들은 2년간 무료로 영어학습을 받는다. 롯데건설이 강원도 춘천시 사농동에 짓는 ‘롯데캐슬더퍼스트’ 33∼47평형 669가구 와 금호건설이 강릉시 입암동에 분양한 ‘금호어울림’ 33∼57평형 1017가구 에도 영어마을이 설치되고 입주민들은 2년간 무료 영어교육을 받는다. 또한 영조주택은 부산시 강서구 명지동에 분양한 ‘명지퀀덤2차’ 46∼88평형 1041가구 단지 내 상가에 영어마을을 만들었다. 전자도서관 등 교육 특화한 아파트 진흥기업은 지난해부터 전자책 기업인 북토피아와 연계해 전자책 도서관을 구축하고 있다. 진흥기업은 음향과 영상 등을 결합한 4만여권의 전자책을 기존 아파트 입주민과 분양하는 ‘더블파크’ 아파트 단지 입주민들에게 공개 좋은 반응을 얻고 있다. 진흥기업은 매년 2차례에 걸쳐 1만권 이상의 책을 업데이트해 공급할 계획이다. 서울 노원구 ‘학여울 청구아파트’는 지하 중앙난방실을 바꾸면서 ‘에듀헬스센터’를 만들었다. 이곳에는 학습담당 강사 2명이 상주하며 컴퓨터 화상수업을 통해 온라인 과외를 할 수 있는 온라인 교육센터와 전문 트레이너가 있는 헬스클럽 골프강습장 요가장 등이 들어섰다. 교육을 생활화하기 위한 신평면 구조도 선보이고 있다. 대림산업은 거실과 서재 사이 벽체를 터서 책꽂이를 설치하는 구조를 내놨고 현대산업개발은 TV와 오디오 등을 놓는 벽면에 붙박이 책꽂이를 설치한 ‘라이브러리 하우스’를 선보였다. 신진호 기자 ship67 segye.com ⓒ 세계일보＆세계닷컴 www.segye.com 무단전재 및 재배포 금지 세계닷컴은 한국온라인신문협회 www.kona.or.kr 의 디지털뉴스이용규칙에 따른 저작권을 행사합니다.,https://news.naver.com/main/read.nhn?mode=LSD&mid=shm&sid1=260&oid=022&aid=0000223744,69
50677,2007.04.29. 오후 8:54,부동산,세계일보,공동주택 공시가 어디가 많이 올랐나,올해 공시된 공동주택 가격은 경기도 과천·파주·성남시와 서울 양천구 등 수도권 지역에서 특히 상승 폭이 컸다. 이는 재건축·재개발 산업단지 조성 등 각종 개발 호재가 이들 지역에 집중된 데다 버블세븐 지역을 중심으로 아파트값이 급등했기 때문으로 풀이된다. 수도권 고가 아파트가 상승 주도 지난해 아파트값 폭등이 올해 공동주택 공시가격에 그대로 반영됐다. 지난해에도 공동주택 공시가격 상승률은 16.4%로 비교적 높았지만 올해는 그보다 높은 22.8%를 기록했다. 개별지역 별로는 지난해 성남 분당이 39.1%로 최고 상승률을 기록했지만 올해는 과천이 49.2%나 폭등한 것으로 나타났다. 또 지난해 상승률이 30%를 넘긴 곳이 분당과 평촌 30.1% 밖에 없었지만 올해는 경기도의 평균 상승률이 31%를 기록할 정도로 공동주택 가격이 가파르게 올랐다. 과천을 필두로 파주 48.1% 와 안양 동안구 47.8% 군포 47.7% 성남 수정구 47.3% 서울 양천구 46.15 고양 일산 40.3% 등의 상승률이 40%를 넘겼다. 서울 강서구 38.6% 용산구 33.3% 강남구 31.6% 등도 상승률이 높았다. 규모별로는 전용면적 25.7평 이하는 12.6%∼23.1% 25.7평 초과는 23.8%∼28.4% 올라 대형 주택의 상승률이 소형보다 높았다. 가격별로는 2000만원 이하 3.9% 2000만원 초과∼5000만원 이하 8.2% 5000만원 초과∼1억 이하 10.7%로 저가 주택은 오름 폭이 크지 않았지만 1억원 초과∼2억원 이하 16.6% 2억원 초과∼4억원 이하 30.9% 4억원 초과∼6억원 이하 32.9% 6억원 초과∼9억원 이하 30.6% 9억원 초과 32.3% 등 가격이 비쌀수록 상승 폭도 컸다. 공동주택 903만가구 가운데 1억원 이하가 557만가구 61.6% 로 가장 많았고 1억∼2억원 184만가구 20.4% 2억∼4억원 102만가구 11.3% 가 그 뒤를 이었다. 6억원 초과 공동주택은 2만7000가구 3% 에 그쳤고 4억∼6억원도 3만3000가구 3.7% 에 지나지 않았다. 건교부 관계자는 “지난해 집값이 급등한 것이 고스란히 반영된 데다 시세반영률도 70%에서 80%로 상향 조정되면서 올해 공시가격의 상승 폭이 컸다”고 말했다. 최고가 주택은 이건희 삼성회장 집 우리나라에서 가장 비싼 집은 삼성그룹 이건희 회장이 소유한 서울 용산구 이태원동 단독주택으로 대지면적 649평 연면적 1040평 지하 2층∼지상 2층으로 되어 있다. 이 집은 공시가격이 91억4000만원으로 지난해 85억2000만원 보다 6억2000만원 7.27% 올랐다. 이 회장은 세 번째와 네 번째로 비싼 집도 소유하고 있다. 중구 장충동1가 주택 연면적 304평 은 공시가격이 76억9000만원 용산구 이태원동 주택 〃 965평 은 74억1000만원이다. 서울 동작구 흑석동에 있는 방상훈 조선일보 사장 소유 주택 〃246평 은 공시가격 86억3000만원으로 최고가 2위에 올랐다. 최고가 5위 주택은 서영배 태평양개발 회장이 소유한 용산구 한남동 주택 〃143평 으로 공시가격이 71억4000만원이다. 공동주택 중 가장 비싼 곳은 서울 서초동 ‘트라움하우스Ⅴ’ 230평형 공시가격 50억4000만원 으로 조사됐다. 트라움하우스에는 유명 연예인과 기업체 사장 교수 등이 사는 것으로 알려졌다. 강남구 삼성동 아이파크 104평형 〃48억2400만원 과 청담동 상지리츠빌카일룸2차 187평 〃40억4000만원 도곡동 타워팰리스1차 102평 〃40억800만원 트라움하우스Ⅲ 185평 〃40억원 타워팰리스3차 103평형 〃40억원 타워팰리스2차 101평형 〃39억5200만원 서초구 도곡동 힐데스 하임빌라 210평형 〃32억원 용산구 이촌동 LG자이 92평형 〃31억9200만원 강남구 압구정동 한양2차 88평형 30억8000만원 등도 고가주택 반열에 올랐다. 반면 전남 고흥군 도양면 다세대주택 5평형 은 공시가격이 140만원으로 전국에서 가장 쌌다. 이의신청 기간과 방법 공동주택 가격 열람은 건교부 또는 시·군구 인터넷 홈페이지를 통해 가능하다. 단독주택 가격은 시·군·구 홈페이지나 직접 방문을 통해 열람이 가능하다. 이의가 있는 주택소유자 또는 이해 관계인은 열람기간인 5월30일까지 이의신청서를 시·군·구에 제출할 수 있다. 신진호 기자 ship67 segye.com ⓒ 세계일보＆세계닷컴 www.segye.com 무단전재 및 재배포 금지 세계닷컴은 한국온라인신문협회 www.kona.or.kr 의 디지털뉴스이용규칙에 따른 저작권을 행사합니다.,https://news.naver.com/main/read.nhn?mode=LSD&mid=shm&sid1=260&oid=022&aid=0000223743,69
50678,2007.04.29. 오후 8:51,부동산,세계일보,보유세 얼마나 오르나,올해 공동·단독주택 공시가격이 지난해보다 최고 60%까지 급등하면서 주택 소유자들이 부담해야 하는 종합부동산세 등 보유세가 최고 세 배까지 늘어나게 됐다. 특히 지난해 각 지방자치단체가 최고 50%의 탄력세율을 적용해 재산세를 감면해 준 경우가 많아 올해 주택 소유자들이 느끼는 보유세 체감 증가 폭은 세 배를 훌쩍 넘어설 전망이다. 정부가 지방세법을 개정해 올해부터는 지방세 감면·비과세 대상을 대폭 축소해 탄력세율 적용이 힘들어졌기 때문이다. 29일 김종필 세무사에 따르면 지난해 공시가격이 6억8100만원에서 올해 10억800만원으로 오른 강남구 대치동 은마아파트 34평형은 보유세가 지난해 216만8400원에서 올해 580만7700원으로 168% 늘어난다. 또 지난해 공시가격이 5억5400만원에서 올해 8억5600만원으로 54.5%나 급등하며 새로 종부세 대상에 포함된 양천구 목동 신시가지3단지 35평형은 지난해에는 135만원의 재산세만 내면 됐지만 올해는 종부세까지 포함해 총 371만4600원 175% 증가 을 부담해야 한다. 목동 신시가지 7단지 35평형도 공시가격이 6억원에서 9억2000만원으로 53.5% 늘어나면서 보유세가 148만8000원에서 444만원으로 295만2000원 198.4% 증가한다. 올해 공시가격 상승률 최고치 59.9% 를 기록한 과천시 부림동 주공8단지 31평형은 보유세가 102만원에서 225만6000원 121% 으로 오른다. 공시가격 최고가인 용산구 이태원동 이건희 회장 자택의 보유세는 지난해 1억2740만원에서 올해 1억5729만원으로 23% 증가한다. 반면 종부세 대상에서 제외되는 6억원 이하 주택은 세금 증가가 지난해의 10% 이하로 제한돼 큰 부담이 없을 것으로 예상된다. 3억원 이하 주택은 재산세가 전년 대비 5% 3억원 초과∼6억원 이하는 10%를 넘지 않도록 돼 있다. 나기천 기자 na segye.com ⓒ 세계일보＆세계닷컴 www.segye.com 무단전재 및 재배포 금지 세계닷컴은 한국온라인신문협회 www.kona.or.kr 의 디지털뉴스이용규칙에 따른 저작권을 행사합니다.,https://news.naver.com/main/read.nhn?mode=LSD&mid=shm&sid1=260&oid=022&aid=0000223741,69
