,date,cat,co,headline,text,url,week
24908,2006.09.19. 오전 10:02,부동산,한국경제,은평뉴타운 분양원가 공개 사업 서두르다 보니 땅값 많이 들었다,은평뉴타운의 분양가가 높아진 가장 큰 이유는 토지 보상비다. 경기 판교신도시 등 다른 신도시에 비해 토지 보상비가 높아 어쩔 수 없이 분양가도 높아졌다는 것이다. 토지 보상비의 경우 은평뉴타운은 평당 361만원 수준이다. 판교 111만6000원 에 비해 세 배나 높은 수준이다. 은평뉴타운이 들어선 지역은 이미 개발된 지역.판교신도시 등은 농지나 임야가 많아 보상비가 적게 들지만 은평뉴타운은 대지가 많아 보상비가 높을 수밖에 없다는 것이다. 실제 은평뉴타운의 지목을 보면 대지 40% 임야 24% 전답 31% 기타 5% 등이다. 이에 반해 판교신도시는 대지 6% 임야 48% 전답 38% 기타 8% 등으로 구성돼 있다. 보상가에 대한 시각은 엇갈린다. 은평뉴타운 지역에서 수용을 당한 주민들은 보상가가 너무 낮았다고 주장한다. 200만원에 수용을 당한 L씨는 겨우 200만원에 수용을 해놓고 분양은 최고 1500만원대에서 하면 원주민들은 아파트에 들어갈 수도 없다 고 주장했다. 그러나 부동산업계 일각에선 단기간에 뉴타운 성과를 내려고 하다 보니 보상가를 너무 높게 책정했다고 지적하고 있다. 한편 은평뉴타운 고분양가 논란에 대한 대처방식도 미숙했다는 지적이 많다. 지난주 SH공사가 분양가를 처음 공개할 때 기자들이 10여 차례에 걸쳐 분양수익을 물었음에도 SH공사 담당자들은 조금밖에 붙이지 않았다는 말로 피해 나갔다. 그러다가 고분양가에 대한 여론의 질타가 쏟아지자 마지못해 분양원가를 공개한 것이다. D건설 관계자는 처음부터 정확한 분양원가를 공개하고 양해를 구했더라면 서울시에 대한 비난이 덜했을 것 이라고 말했다.,https://news.naver.com/main/read.nhn?mode=LSD&mid=shm&sid1=260&oid=015&aid=0000919697,37
24909,2006.09.19. 오전 10:01,부동산,한국경제,은평뉴타운 분양원가 공개 평당 건축비 최고 544만원…과다계상 의혹,서울시가 고 高 분양가 논란에 휩싸인 은평 뉴타운의 분양 원가를 18일 공개했다. 34평형 분양가는 이익을 한푼도 붙이지 않은 분양원가이고 40평형 이상 분양가는 분양원가에 5%의 이익만 더했다고 주장하고 있다. 그러나 분양원가가 높아서 분양가가 높을 수밖에 없다는 주장을 하기에 앞서 분양원가를 낮추기 위해 더 많은 노력을 했어야 한다는 지적이 나오고 있다. 또 건축비가 지치게 높다는 지적도 있다. ○40평형대 분양이익 5%에 불과 서울시가 밝힌 34평형의 분양원가는 평당 1151만원이다. 분양가격도 원가와 동일하게 평당 1151만원으로 정해졌다. 입주 예정자의 70% 이상이 원주민인 점을 고려해 분양가격을 원가와 동일하게 책정했다는 설명이다. 40평형 이상의 평당 분양원가를 보면 △41평형 1321만7000원 △53평형 1425만6000원 △65평형 1446만9000원이다. 분양가는 여기에 수익률 5%를 얹어 △1391만3000원 41평형 △1500만7000원 53평형 △1523만1000원 65평형 등으로 정해졌다. 따라서 이번 2066가구 분양으로 발생하는 수익은 680억원 수준이다. 서울시는 분양수익을 공공 임대주택 건설 재원 임대 아파트 운영 등 저소득 시민을 위한 공익사업으로 사회에 환원할 계획이다. 허영 서울시 주택국장은 수익률 5%는 주변 시세와의 차익 미분양으로 인한 리스크 관리 과도한 시세 차익으로 인한 투기 방지 등을 위해 정한 수치 라며 추가로 분양될 은평뉴타운에도 이 수익률이 적용될 것 이라고 설명했다. ○높은 토지보상비·낮은 용적률이 원인 분양원가와 관련 서울시는 판교신도시의 보상비는 평당 111만6000원 수준이지만 은평뉴타운은 361만원이나 된다고 밝혔다. 또 전체 면적에서 대지가 차지하는 비중이 51%밖에 되지 않고 용적률도 판교 164% 보다 낮은 152%밖에 되지 않는다고 설명했다. ○분양원가 낮추는 노력 미흡 그러나 부동산 전문가들은 서울시의 분양원가를 낮추려는 노력이 부족했다고 지적했다. 뉴타운은 청계천 복원과 함께 이명박 전임 시장의 야심작이다. 서울시가 단기간에 성과를 이루기 위해 사업을 서두른 측면이 없지 않다고 부동산 업계는 지적하고 있다. 시간을 정해두고 사업을 추진하다 보면 보상가를 높여줄 수밖에 없다. 주민들이 수용에 반발하면 사업이 한없이 지연되기 때문이다. S건설 관계자는 높은 분양가가 주변 시세를 자극할 것이 뻔한 상황이었던 만큼 분양원가를 낮추기 위해 보상가 건축비 단지조성 등에 대해 고민을 더 했어야 한다 고 말했다. 건축비가 과다하다는 지적도 나오고 있다. 서울시가 공개한 40평형대 이상의 건축비는 평당 510만∼540만원대다. 고급주택 시공업체인 K건설 관계자는 용인 죽전 동백지구 등의 최고급 타운하우스의 공사비가 550만원 수준인 점을 감안하면 건축비가 너무 비싸 보인다 고 지적했다. 그럼에도 모델하우스 방문객들은 높은 건축비에 비해 마감 수준이 만족스럽지 못하다는 평가를 내놓고 있다. 모델하우스를 방문해본 청약대기자 A씨 40 는 건축비는 판교보다 평당 50만원 정도 비싸지만 평면이나 마감수준은 많이 처진다 고 말했다. 이와 관련 경실련 박완기 정책실장은 구체적인 분양원가 항목이 공개되지 않아 타당성 여부를 평가하기 어렵다 며 더 세부적으로 원가를 공개해야 한다 고 말했다.,https://news.naver.com/main/read.nhn?mode=LSD&mid=shm&sid1=260&oid=015&aid=0000919738,37
24910,2006.09.19. 오전 9:35,부동산,머니투데이,뉴타운 재개발 부동산 전문가 돼볼까,머니투데이 김희정 기자 삼일PwC 부동산컨설턴트 전문과정 모집 하반기부터 시행되는 도시재정비촉진특별법으로 도심 뉴타운사업과 재개발 사업이 가속화될 전망이다. 민간투자사업과 다핵화 도심복합개발사업이 최근 부동산개발사업 시장에 초미의 관심사로 대두되고 있어 향후 건설업계 뿐 아니라 개발업계 담당자들은 개발사업 시장동향을 면밀히 주시해야 하는 상황이다. 삼일PwC아카데미는 최근의 부동산 시장 흐름에 발맞춰 부동산 관련 사업 중 가장 부가가치가 높은 부동산개발 부동산금융 자산관리분야의 전문가 양성을 위한 부동산컨설턴트 전문가 과정을 내달 21일부터 매주 토요일 14주간 실시한다. 이번 과정의 커리큘럼은 부동산개발사업의 유형과 접근방법 개발사업의 타당성 분석 부동산 금융과 투자분석 부동산자산관리전략 부동산컨설팅 성공사례로 구성되며 각 과정별로 국내 최고의 전문가들이 강단에 나서게 된다. 또 건설교통부 서울시청 등 정부 부동산 관련 실무자들이 강단에 나서 부동산개발과 정책 방향에 대해 공부하는 시간도 마련했다. 보충학습을 위해 매 강좌가 실시간으로 녹화돼 웹사이트에 동영상으로 제공될 예정이다. 삼일PwC아카데미는 이번 과정을 통해 수강생들끼리의 인적네트워크 뿐 아니라 25명의 국내 유수의 부동산 전문가와의 인적네트워크 구축을 통해 향후 사업 파트너 혹은 동반자로서 프로젝트를 진행하게 될 수 도 있을 것 이라고 밝혔다. 참가 신청은 삼일PwC아카데미 홈페이지 www.samilacademy.com 에서 온라인을 통해 하면 된다.,https://news.naver.com/main/read.nhn?mode=LSD&mid=shm&sid1=260&oid=008&aid=0000702366,37
24911,2006.09.19. 오전 9:31,부동산,뉴시스,동대문구 제기동 일대 도시환경정비구역 지정,서울 뉴시스 도시환경정비구역으로 지정된 서울 동대문구 제기동 650번지 일대 12만4640㎡ 위치도. 사진 서울 동대문구 제공 김종민기자 kim9416 newsis.com 관련기사 있음 서울 뉴시스 서울 동대문구 제기동 650번지 일대 12만4640㎡가 도시환경정비구역으로 지정됨에 따라 서울동북부의 성장거점 도시를 구축하는데 박차를 가 할 수 있을 것으로 예상된다. 이 구역은 서울시 도시 및 주거환경 정비기본계획상 혼합서비스 및 일반업무상업지역으로서 지리적으로 도심의 기능 분화를 담당하는 부도심지역이다. 구역지정 주요내용으로는 제2.3종일반주거지역을 준주거지역으로 제3종일반주거지역을 일반상업지역으로 용도지역을 상향조정 했다. 또한 건축계획은 부도심의 역할에 충실하도록 간선도로변은 용적률 851 994% 높이 70 90m 최고층수 25층까지 이면도로변은 용적률 400 994% 높이 40 60m 최고층수 17층까지 건축물의 주용도는 업무.판매.근생.숙박.문화 집회시설 등으로 계획했다. 기반시설로는 보행자 및 차량의 원활한 통행을 위해 폭원 8 38.5m 25개노선 도로를 주민생활 향상을 위한 녹지공간인 어린이공원 3개소를 보행자의 간이 휴게공간 역할을 할 수는 공공공지 1개소 등을 각각 계획했다.,https://news.naver.com/main/read.nhn?mode=LSD&mid=shm&sid1=260&oid=003&aid=0000183494,37
24912,2006.09.19. 오전 9:14,부동산,연합뉴스,충남 연기 땅값 3년반새 92.7% 급등,서울 연합뉴스 추승호 기자 참여정부 들어 충남과 경기 지역의 땅 값이 크게 오른 것으로 나타났다. 19일 한국토지공사가 국회 건설교통위 소속 한나라당 이진구 李珍求 의원에게 제출한 2003∼2006.6 누적 지가 상승률 상위 20개 지역 자료에 따르면 행정중심복합도시 건설이 예정된 충남 연기 92.7% 와 공주 47.0% 가 전국 지가 상승률 1 2위를 차지했다. 이어 신도시가 건설되고 있는 충남 아산 46.4% 과 경기 평택 41.2% 충남 천안 39.3% 경기 성남 분당 37.2% 등의 순으로 상승률이 높았다. 서울의 경우 고속철도역 건설과 미군기지 이전 등의 개발수요가 있는 용산구 30.6%. 9위 가 상승률이 가장 높았고 뉴타운 개발 수요가 있는 성동구 25.1%. 17위 아파트 가격이 상승한 서초구 24.5%. 20위 가 뒤를 이었다. 올 들어서는 충남 예산 13.2% 과 홍성 13.1% 이 충남도청 이전에 따른 기대감으로 땅 값이 가장 많이 올랐다.,https://news.naver.com/main/read.nhn?mode=LSD&mid=shm&sid1=260&oid=001&aid=0001414648,37
24913,2006.09.19. 오전 9:07,부동산,노컷뉴스,재건축아파트 33세대 100여명에 다중분양 의혹 업체 수사착수,경기도 의정부시 가능동 모연립 재 건축아파트건설업체가 2 3중으로 분양했다는 의혹이 제기돼 검찰이 수사에 나섰다. 의정부지검 형사5부 부장검사 김광준 는 아파트 시공회사와 이 회사 임원들의 자택등에서 압수한 아파트 관련 영업장부와 컴퓨터 본체 등에 대한분석 작업을 벌이고 있다고 밝혔다. 이 건설업체는 지난 2005년 4월부터 경기도 의정부시 가능동 모 연립아파트 33세대를 분양하면서 한 세대당 2 3중으로 분양계약서를 체결하는 수법으로그 동안 1백여명에게 분양해 수십억원을 챙긴혐의를 받고 있다. 검찰은 건설회사와 분양자들을 상대로 수사를 벌여다중 분양 사실이 확인될 경우모두 사법 처리 할 방침이다.,https://news.naver.com/main/read.nhn?mode=LSD&mid=shm&sid1=260&oid=079&aid=0000109111,37
24914,2006.09.19. 오전 9:00,부동산,연합뉴스,분양소식 군산 수송택지지구 군산 수송 아이파크,서울 연합뉴스 박성제 기자 현대산업개발은 전북 군산시 수송동 택지지구에 들어서는 군산 수송 아이파크 566가구를 22일부터 분양한다고 19일 밝혔다. 이 아파트는 지하 1층 지상 15 20층 9개동에 39평형 87가구 40평형 54가구 46평형 328가구 54평형 94가구 86평형 3가구로 구성되며 입주는 2008년 10월 예정이다. 전가구를 남향으로 배치해 조망과 개방감을 강조하고 내부 바닥은 전부 온돌마루로 처리했으며 난방비 절약을 위한 디지털 히팅시스템 바디샤워기 등도 갖추고 있다. 단지내에는 220여평 규모의 휘트니스 센터와 헬스케어룸 등이 조성되고 산책로 선큰가든 등도 갖춘 웰빙단지로 설계됐다. 수송택지지구는 군장 군산.장항 국가 산업단지의 배후도시로 총 7천여가구가 들어설 예정이어서 앞으로 군산시의 중심 생활지역으로 발전할 가능성이 있다.,https://news.naver.com/main/read.nhn?mode=LSD&mid=shm&sid1=260&oid=001&aid=0001414627,37
24915,2006.09.19. 오전 8:51,부동산,서울신문,Zoom in 서울 은평뉴타운 분양원가 공개… 최대 평당 1446만원,서울신문 서울시가 고 高 분양가 논란을 빚고 있는 은평뉴타운의 분양 원가를 공개했다. 앞으로 분양하는 SH공사 아파트는 모두 원가를 공개한다. 시의 분양 원가 공개를 계기로 주공아파트는 물론 판교 등 다른 신도시 민영아파트의 분양원가 공개 압박도 거세질 전망이다. ● ‘수익 5% 공공 위해 쓰겠다’ 허영 서울시 주택국장은 18일 “은평뉴타운의 분양가와 관련한 오해를 풀고 분양 가격의 투명성을 알리기 위해 원가를 공개했다.”고 말했다. 은평뉴타운은 도시개발사업이어서 원가 공개의무가 없지만 고분양가 논란이 일자 오세훈 시장이 공개를 전격 지시했다. 향후 SH공사가 분양하는 아파트는 모두 원가를 공개한다. 다른 뉴타운은 분양주체가 주민이어서 공개대상에 포함되지 않는다. 공공택지의 25.7평 이하는 원가를 공개하고 있다. 시에 따르면 은평뉴타운의 평당 평균 분양원가는 국민주택 규모인 34평형이 1151만원으로 시는 입주예정자의 70% 이상이 원주민인 점을 감안해 이 원가로 분양키로 했다. 국민주택규모 초과의 분양 원가는 41평형 1321만 7000원 53평형 1425만 6000원 65평형 1446만 8000원. 시는 여기에 목표 수익률 5%를 얹었다. 이에 따라 이들 평형의 분양가는 각각 1391만 3000만원 1500만 7000만원 1523만 1000원으로 정했다. 이번 분양물량은 2066가구 전체 분양물량은 1만 5200가구 로 수익은 680억원으로 추산했다. 시는 이 수익을 공공임대주택 건설 등 저소득 시민을 위해 사용한다. ● 은평뉴타운 분양가 수준은 주택업계에서는 일반아파트보다는 다소 높고 주상복합아파트보다는 평당 200만원가량 낮은 것으로 분석한다. 주택업체 한 관계자는 “마감재에 따라 차이가 있기는 하지만 전체 연면적 기준 건축비는 일반아파트가 300만원 안팎 주상복합이 450만원 안팎”이라며 “이를 공용시설 등은 뺀 분양면적만으로 따지면 일반아파트는 400만∼500만원 주상복합아파트는 700만∼800만원선이다.”고 설명했다. 그는 “판교보다 용적률이 낮고 다양한 외양 등을 고려하면 은평뉴타운의 높은 분양가는 불가피한 면이 있다.”면서 “다만 시민들 입장에서는 수용하기가 쉽지 않을 것”이라고 말했다. 은평뉴타운의 건축비는 평당 515만∼544만원이었다. 판교는 499만∼1800만원대 채권액은 상한선 기준 였다. 땅값은 은평이 636만∼812만원 판교는 634만∼775만 6000원이었다. 이는 은평은 대지가 40% 판교 6% 에 달해 평당 보상비가 판교는 111만 6000원인 반면 은평은 321만원이었기 때문이다. ● 분양가 부풀리기 감소 전망 은평뉴타운을 계기로 타지역 아파트의 분양가 부풀리기가 다소 줄어들 전망이다. 분양가를 높게 책정했다가 원가 공개 시비에 휘말릴 것을 우려해 미리 거품을 빼고 분양할 수밖에 없다. 하지만 주택업계는 걱정이 앞선다. 서울시가 앞장서 원가를 공개한 만큼 다른 곳에서 분양하는 아파트의 원가공개 요구가 예상되기 때문이다. 내집마련정보사 김영진 사장은 “은평뉴타운의 분양원가 공개로 분양가 부풀리기가 주춤해지고 다른 아파트의 분양원가 공개도 늘어날 것”이라며 “하지만 원가를 빌미로 분양가를 높일 수도 있는 만큼 검증이 필요하다.”고 말했다.,https://news.naver.com/main/read.nhn?mode=LSD&mid=shm&sid1=260&oid=081&aid=0000104168,37
24916,2006.09.19. 오전 8:42,부동산,파이낸셜뉴스,재개발 투자 가이드－조합원 지분 프리미엄 높아,재개발 분양 물량 중 조합원분이 일반분양분보다 높은 프리미엄을 얻을 수 있다. 일반분양에 앞서 관리처분 총회때 조합원 동·호수 추첨이 이뤄지면서 조합원들에게 동·층·향이 좋은 로열층이 우선 배정되기 때문이다. 전문가들은 “재개발 조합원들이 좋은 층이나 향을 먼저 차지할 수 있어 향후 많은 프리미엄을 기대할 수 있다”면서 “특히 조망권을 낀 재개발 지분의 경우 더 높은 웃돈이 붙을 수 있다”고 말했다. 그러면 재개발 아파트의 프리미엄 차이는 얼마나 될까. 단지별로 차이는 있지만 수천만원에서 조망권을 낀 경우는 수억원대의 차이가 나기도 한다. 몇가지 사례를 살펴본다. 지난해 4월 준공된 서울 성북구 길음뉴타운 길음푸르지오. 33평형은 동별로 4000만∼5000만원 층간 3000만∼4000만원의 차이가 난다. 입지가 좋은 동·층과 그렇지 않은 동·층간에 최소 7000만∼8000만원의 격차 있는 셈이다. 이 아파트는 전면에 배치된 221동과 225동 222동의 입지가 좋고 18층 중 11층이상이 로열층으로 통한다. 반면 남서향인 213동과 216동 등은 입지여건에 떨어진다. 인근의 C공인 관계자는 “로열동의 로열층은 4억∼4억2000만원인 데 비해 비로열동의 저층은 3억3000만∼3억400만원”이라면서 “하지만 층·향이 좋은 물건 일수록 매물이 귀해 구하기가 어렵다”고 전했다. 준공된 지 5년된 성동구 금호동 삼성래미안은 평형별로 5000만∼1억2000만원의 시세격차를 보이고 있다. 평형별 가격차이는 △23평형 5000만원 △31평형 8000만원 △42평형 1억2000만원선이다. 한강이 보이는 103동과 210동 202동이 로열동이 속한다. 13층 이상이 로열층이다. 주목할 점은 로열동의 30·40평대는 전부 조합원 몫이었다. 부동산써브공인측은 “202동에 있는 23평형은 많은 물량이 일반분양되기도 했다. 하지만 로열동·층의 중대형은 조합원들에게 떨어졌다”고 했다. 북한산이 보이는 강북구 미아동 북한산SK시티도 비슷한 상황이다. 북한산 조망이 가능한 142·143·145동과 138·139동 등의 로열층은 수천만원 비싸다. 이들 아파트는 대부분 조합원 몫이었다. 24평형은 1억7000만∼2억원 33평형은 2억5000만∼3억원 43평형은 3억4000만∼4억원의 시세 분포을 보이고 있다. G공인 관계자는 “같은 평형대의 가격차이는 결국 동·향에서 오는 것”이라며 “운좋은 일반 청약자를 빼고 조합원들의 아파트가 3000만∼6000만원 더 올랐다고 보면된다”고 설명했다.,https://news.naver.com/main/read.nhn?mode=LSD&mid=shm&sid1=260&oid=014&aid=0000246100,37
24917,2006.09.19. 오전 8:42,부동산,파이낸셜뉴스,재개발 투자 가이드－조합원 지분 노려라,서울지역에서 이달 이후 연말까지 1만5000 조합원분 포함 가구에 육박하는 재개발 아파트가 쏟아진다. 이들 재개발 아파트 중 상당수가 뉴타운 지역과 인접해 있는데다 기반시설 및 교통입지가 뛰어나 투자가들의 관심이 집중되고 있다. 이런 재개발 아파트 입성의 지름길은 조합원 지분에 투자하는 것이다. 조합원 지분은 일반분양가에 비해 다소 저렴한 데다 청약통장 없이도 층과 향을 추첨을 통해 배정 받을수 있는 등 여러가지 메리트가 있다. 일반분양을 통해 분양받은 경우와 조합원 지분투자를 통해 재개발 아파트를 배정받을 때와의 투자금과 수익률 등을 비교해 본다. ▨조합원 지분 투자 일반분양보다 수천만원 절약 서울 영등포구 신길뉴타운 중 GS건설이 시공하는 5구역의 ‘자이’ 아파트가 오는 11월 분양 예정이다. 현재 평형구성은 25평형과 33평형이며 33평형에 입주하기위에서는 대지지분 20평 이상의 조합원 지분을 구입해야 한다. 지분가격은 1억9000만원 선으로 입주때 예상되는 추가부담금 1억9000만원 정도를 더하면 총 3억8000만원 수준에서 입주할 수 있다. 일반분양물량 가구수는 아직까지 관리처분총회가 확정되지 않아 약간의 조정이 있을 전망이다. 신길뉴타운은 서울 3차 뉴타운 지역중에서 사업속도가 가장 빠르다. 그중에서도 5구역이 사업속도면에서 단연 앞서있어 유망투자지역으로 손꼽히고 있다. 하지만 이 아파트 일반분양분의 분양가는 평당 1300만원선 33평형 기준 약 4억원 에 결정될 것이라는 게 현지 중개업소 관계자들의 전언이다. 대방공인 관계자는 “분양가 조정에 따라 약간의 차이는 있겠지만 분양가를 1300만원으로만 잡아도 1000만∼2000만원 정도는 싸게 입주하게 되는 셈”이라며 “하지만 무엇보다 좋은 층을 고를 수 있고 유망뉴타운에 위치해 향후 가격 추가상승의 여력이 충분하다는 게 장점”이라고 말했다. 서울 동대문구 용두1구역에서는 삼성물산 래미안이 오는 12월 분양 예정이다. 전체 가구수는 1500가구이며 분양예정가는 인근 2구역의 분양가 수준인 1280만∼1300만원 수준이다. 현재 34평형을 배정받을 수 있는 조합원 지분은 20평 안팎이며 지분가격은 평당 1200만원 선이다. 20평지분을 구입할 경우 2억4000만원 정도가 필요하고 여기에 1억5000만∼1억7000만원의 추가부담금을 부담해야 하는 것으로 예상됐다. 34평형 아파트를 구입하기 위해서는 총 3억9000만∼4억1000만원이 필요하다. 34평형의 예상분양가는 4억3000만원 수준을 약간 웃돌 것으로 예상돼 조합원 지분을 구입할 경우 일반분양가에 비해 2000만 정도 저렴할 것으로 예상된다. 인근 동문부동산 관계자는 “조합원들은 일반분양이 끝나면 가격이 더 오를 것으로 기대하고 매도를 꺼려하고 있어 물건이 그렇게 많지는 않다”고 말했다. ▨통장 필요없고 좋은 층·향 배정 ‘유리’ 서울 동대문구 답십리동에서 오는 11월 분양하는 한신 휴플러스의 경우 현재 35평형 조합원 지분을 가진 사람은 42평형을 배정 받을수 있다. 현재 35평형 아파트의 조합원 지분 가격은 2억9000만∼3억원이다. 평형배정때 부과되는 추가부담금은 2억원 정도. 이에 따라 조합원 지분을 구입하는 투자자라면 5억원 정도를 투자해야 42평형을 구입할 수 있는 셈이다. 하지만 현지 부동산 업계에서 예상하는 일반분양가는 평당 1200만원선으로 42평형이 5억원을 호가할 것으로 보인다. 일반분양가와 큰 차이가 없어 당장 분양가와 비교하면 실익이 없어보인다. 하지만 현지부동산 관계자들은 현재 조합원 지분으로 나와있는 매물이 층과 향이 일반분양에 비해 좋은 물량이 다수 있고 일반분양분이 전체 660가구중 60∼70가구 밖에 안된다는 점을 들어 조합원 지분 투자의 메리트는 분명히 존재한다고 강조한다. 신성공인 관계자는 “답십리 뉴타운지역에 포함돼 있어 기반 및 편의시설 이용이 편리하고 천호대로와 완산로 등 교통여건도 양호하다”며서 “분양가격이 평당 1200만원선이면 입주때는 최소 평당 300만원 이상의 시세차익을 기대해볼 만하다”고 말했다. 하지만 조합원 지분투자는 수천만∼1억원의 웃돈을 일시에 지불해야 하는 등 초기 비용이 많이 든다는 단점도 있다.,https://news.naver.com/main/read.nhn?mode=LSD&mid=shm&sid1=260&oid=014&aid=0000246099,37
