,date,cat,co,headline,text,url,week
64747,2007.09.28. 오후 5:42,부동산,서울경제,군포 부곡지구 반값 아파트 내달 15일부터 804가구 분양,주공 29일 60 85㎡형 입주자 모집공고 군포 부곡지구에서 이른바 ‘반값 아파트’가 다음달 첫 분양된다. 반값 아파트는 정부가 지난 1ㆍ11 부동산 대책에서 분양가 인하와 무주택 서민의 내집마련을 위해 추진하는 것으로 사실상 시범사업인 부곡지구가 반값 아파트 사업 성공의 이정표가 될 것으로 보인다. 전문가들은 대체로 분양가가 기대만큼 싸지 않은데다 20년간 매매가 제한돼 수요가 많지 않을 것으로 보고 있다. 대한주택공사는 군포 부곡지구에서 토지임대부ㆍ환매조건부 주택 804가구를 다음달 15일부터 분양한다고 28일 밝혔다. 주택공사는 29일 입주자모집공고를 거쳐 오는 10월15일 17일까지 청약접수를 받을 예정이다. 이번에 공급되는 주택은 모두 전용면적 60 85㎡형 이하 전용면적 기준 사이로 전량 청약저축 가입자 대상이다. 인터넷 청약이 원칙 고령자ㆍ장애인 제외 이고 11월7일 당첨자 발표에 이어 26일 계약이 진행된다. 환매조건부주택은 74㎡형 65가구 84㎡형 350가구 등 총 415가구다. 분양가는 74㎡형이 2억1 800만원선 84㎡형이 2억4 900만원선. 분양가상한제가 적용되는 신규 아파트 분양가의 90% 수준으로 일각에선 이름만 ‘반값 아파트’가 아니냐는 지적도 나온다. 분양가가 다른 아파트에 비해 크게 싸지도 않은 데다 환매기간이 지난 20년 뒤에나 일반인에게 팔 수 있기 때문이다. 토지임대주택은 74㎡형 101가구 84㎡형이 288가구 등 총 389가구다. 건물분양가는 74㎡형이 1억3 470만원선 84㎡형이 1억5 440만원선이다. 토지임대료는 월 40만원 안팎. 토지임대부주택은 입주할 때 소유권을 갖게 되지만 10년간 전매가 금지된다. 토지임대료는 2년마다 갱신되며 증액한도는 2년간 5% 이내다. 김영진 내집마련정보사 사장은 “토지임대료를 분양가로 환산하면 84㎡형의 경우 총 분양가가 2억원을 넘는 셈인데 결코 반값아파트라고 할 수 없다”며 “토지 소유권이 없는 아파트에 수요가 따라 줄지 의문”이라고 말했다. 주택공사는 청약자들의 이해를 돕기 위해 ‘토지임대부 및 환매조건부 분양주택 길라잡이’ 홍보 책자를 제작 군포시 및 동사무소 군포시 관내 청약저축 취급은행 국민은행ㆍ우리은행ㆍ농협 에서 배포할 예정이다.,https://news.naver.com/main/read.nhn?mode=LSD&mid=shm&sid1=260&oid=011&aid=0000200572,90
64748,2007.09.28. 오후 5:19,부동산,노컷뉴스,대우건설 노인의 날 앞두고 봉사활동,대우건설 사회봉사단은 10월 2일 노인의 날을 앞둔 28일 서울시 용산구 시립용산노인종합복지관에서 나눔의 자리를 가졌다. 대우건설 사회봉사단은 임직원 40여명이 자원봉사자로 참여해 500여명의 노인들에게 점심식사를 무료로 제공하고 추석선물용 김도 전달했다. 또한 용산구에 위치한 독거노인 3가구의 도배와 장판을 교체하는 작업도 벌였다. 대우건설은 10월 5일까지 전국에 있는 현장별로 노인시설 및 독거노인에 대한 봉사활동을 벌일 예정이다.,https://news.naver.com/main/read.nhn?mode=LSD&mid=shm&sid1=260&oid=079&aid=0000190650,90
64749,2007.09.28. 오후 5:17,부동산,뉴시스,김우중씨 거제도땅 모두 낙찰,통영 뉴시스 김우중 전 대우그룹 회장의 경남 거제시 땅이 법원경매 첫 기일에 모두 낙찰됐다. 창원지법 통영지원 경매계는 28일 진행된 김 전회장 소유의 거제 토지 58필지 42만5000㎡에 대한 경매에서 감정가 98억4835만원 보다 60억원을 더한 158억8400만원에 낙찰됐다고 밝혔다. 김 전회장의 소유토지로 경매공고부터 화제를 모은 이 토지는 한국자산관리공사가 제일은행 인수채권 250억원을 회수하기 위해 지난해 10월 경매를 신청했다. 통상 경매신청 이후 첫 입찰까지 6개월 정도 소요되지만 이 건의 경우 소유자 김 전회장에 대한 송달과 감정평가 지연으로 11개월만에 입찰을 하게 됐다. 이날 모두 13명이 개인명의로 응찰에 나서 장목관광단지 조성관련 업체의 참가여부는 파악되지 않았다. 김 전회장이 1983년 본인 명의로 매입한 이 토지는 임야 전 답 잡종지 대지로 이뤄져 있으며 토지이용계획상 개발이 용이한 관리지역을 비롯한 관광휴양개발진흥지구로 지정돼 있다.,https://news.naver.com/main/read.nhn?mode=LSD&mid=shm&sid1=260&oid=003&aid=0000579790,90
64750,2007.09.28. 오후 5:17,부동산,뉴시스,대우건설 사회봉사단 노인무료급식 실시,서울 뉴시스 대우건설 사회봉사단이 오는 10월2일 노인의 날을 맞아 28일 서울시 용산구에 위치한 시립용산노인종합복지관에서 무료급식 봉사를 했다. 이날 대우건설 사회봉사단 소속 임직원 40여명이 자원봉사자로 팔을 걷어붙이고 500여명의 노인들에게 점심식사를 무료로 제공하고 추석선물용 김도 전달했다. 또한 용산구에 위치한 독거노인 3가구의 도배와 장판을 교체하는 작업을 진행했다. 대우건설 사회봉사단에 참여한 한 직원은 “10월2일 노인의 날을 맞아 펼친 이번 봉사활동을 통해 고령화 사회의 노인문제에 대해 다시 한 번 생각하게 되는 기회였다”며 “소외 노인계층에 대한 관심과 사랑을 실천하는 뜻깊은 시간이었다”고 말했다. 대우건설은 28일 무료급식 봉사활동 이외에도 전국 현장별로 노인시설과 독거노인에 대한 봉사활동을 10월5일까지 진행한다.,https://news.naver.com/main/read.nhn?mode=LSD&mid=shm&sid1=260&oid=003&aid=0000579786,90
64751,2007.09.28. 오후 4:47,부동산,매일경제,청약 통장 수도권 가입자가 전체의 70% 넘어,전국 청약통장 가입자 수가 지난 2000년 370만여 명에서 2007년 8월 말 710만여 명으로 두 배 가까이 증가한 것으로 나타났다. 특히 전체 가입자 중 서울을 포함한 수도권 지역 가입자가 502만여 명으로 전체의 70%이상을 차지해 심각한 쏠림 현상이 이어졌다. 그러나 2001년 이후 5년 동안 폭발적으로 증가하던 전국 청약통장 가입자 상승률은 올 해 마이너스를 기록하는 등 점차 상승폭이 둔화되고 있는 것으로 나타났다. 부동산정보업체 부동산써브가 조사한 지난 2000년 2007년 8월 말 전국 청약통장 가입자 현황에 따르면 전체 청약통장 가입자 수는 2000년 378만657명에서 710만1 610명으로 332만953명 증가해 87.84%의 누적 상승률을 기록했다. 지역별로는 서울이 180만8 239명에서 242만1 838명으로 33.93% 경기ㆍ인천 110만9 928명에서 260만1 109명으로 134.35% 증가했다. 지방은 5대광역시가 53만3 313명에서 106만5 807명으로 99.85% 기타 지방은 32만9 177명에서 101만2 856명으로 205% 증가했다. ◇ 전국 청약통장 가입자는 IMF 이후 1999년 5월31일 서민주거안정대책 중소형 주택공급 국민주택기금 금리인하 10월 7일 주택건설촉진대책 민영 청약자격 완화 재당첨제한 폐지 2001년 5월23일 건설산업구조조정 및 투자적정화방안 신축주택 구입시 양도세 한시 면제 국민주택 규모 취ㆍ등록세 한시 감면 9월 14일 서민주거생활안정대책 수도권 매년 600만평 공공택지 공급 등의 대책이 발표되면서 청약통장 활용도가 커져 2001년부터 폭발적인 증가세를 보였다. 특히 2001 2003년은 전국 청약통장 가입자 수가 해마다 100만 명 이상 증가했다. 해마다 높은 상승률을 보이던 통장 가입자 수는 2005년 전국 7백만 명을 돌파하면서 포화상태에 이르러 점차 상승폭이 둔화돼 2006 2007년은 1.1%로 마이너스 변동률을 기록했다. ◇ 서울 청약통장 가입자는 2000년 180만8 239명에서 2007년 242만1 838명으로 61만3 599명 증가해 33.93%를 기록했다. 특히 2001 2002년 22.43% 상승률을 보이며 171만8 430명에서 210만3 802명으로 38만5 372명 가입자 수가 늘었다. 서울 지역 청약통장 연간 가입자 변동률은 2002년 이후 점차 상승률이 둔화되다 올 해 마이너스 1.01% 로 돌아섰다. 통장별로는 청약저축이 70만2 817명 청약예금이 20만2 635명 증가한 반면 청약부금은 29만1 853명 감소했다. ◇ 경기ㆍ인천 청약통장 가입자는 2000년 110만9 928명에서 2007년 260만1 109명으로 149만1 181명 증가해 134.35%를 기록했다. 서울 지역과 마찬가지로 2002년 이후 꾸준히 둔화되던 변동률이 지난 해 0.14%에서 올 들어 3.74%로 상승했다. 특히 경기ㆍ인천지역은 2003년 서울 227만5 967명 보다 많은 227만6 512명이 가입한 이후 가장 많은 청약통장 가입자가 거주하고 있는 지역이다. 통장별로는 청약저축이 69만2 924명 청약예금이 79만6 036명 증가했으나 청약부금은 2 221명 증가하는데 그쳤다. ◇ 5대 광역시 청약통장 가입자는 지난 2000년53만3 313명에서 2007년 106만5 807명으로 53만2 494명 증가했다. 연도 별 변동률은 2006년 3% 2007년 9.73%로 하락세이다. 통장별로는 청약저축이 38만773명 청약예금이 17만5 127명 증가했으나 청약부금은 2만3 406명 감소했다. 기타 지방 청약통장 가입자는 2000년 32만9 177명에서 2007년 101만2 856명으로 68만3 679명 증가했다. 통장별로는 청약저축이 51만9 323명 청약예금이 19만8 751명 증가했으나 청약부금은 3만4 395명 감소했다. 청약통장 보유 현황은 지난 2005년 7백만 명 돌파 이후 상승률이 확연히 둔화되는 모습을 보이는 등 사실상 포화상태에 이르렀다. 부동산써브 함영진 실장은 “청약통장이 내집마련의 필수로 인식되고 있는 상황에서 가입자가 수도권에 편중돼 수도권 주택 공급부족은 당분간 이어질 듯 전망된다”고 말하고 “서울 경기 지방 가리지 않고 청약부금 기피 현상이 뚜렷하다. 다양한 실수요자를 위해 청약통장의 균형적인 활용 방안이 시급하다”고 덧붙였다.,https://news.naver.com/main/read.nhn?mode=LSD&mid=shm&sid1=260&oid=009&aid=0000626520,90
64752,2007.09.28. 오후 4:27,부동산,뉴시스,분양소식숨고르는 부동산 시장 전국 1곳 분양,서울 뉴시스 추석연휴가 끝난 10월 첫째 주 분양시장이 숨고르기에 들어갔다. 전국에서 1곳만 분양한다. 견본주택은 서울과 경기에서 4곳이 개관을 준비하고 있다. 경기 남양주시 진접지구 11블록의 원일플로라는 모두 7개 동으로 7층 12층 231가구 규모다. 144㎡ 154A㎡ 155B㎡ 대형으로 구성돼 있다. 분양가 상한제 제외 대상이어서 등기 후 전매가 가능하다. 입주는 2009년 12월이다. 10월5일에는 서울 동대문 재개발 경기 양주 고읍지구에서 견본주택 개관을 준비 중이다. 서울에서는 삼성건설이 동대문구 용두제1구역 재개발단지 래미안을 개관한다. 모두 1054가구 중 284가구가 일반분양된다. 1호선 제기역 과 2호선 용두역이 도보거리인 더블 역세권 단지다. 경기에서는 양주 고읍지구에 우남퍼스트빌 우미린 한양수자인 3개 업체가 10월5일 동시에 견본주택을 개관한다. 2블록의 우남퍼스트빌은 총 376가구 3블록의 우미린은 총 513가구를 공급한다. 두 단지는 109㎡ 113㎡로 구성됐다. 분양가 상한제 적용을 받기 때문에 10년간 전매가 금지된다. 한양수자인은 1 6 3 10블록 세 곳에서 공급된다. 10블록은 80㎡ 113㎡의 중소형으로 구성되며 분양가 상한제가 적용된다. 반면 109㎡ 185㎡의 중대형인 1블록과 6 3블록은 상한제 적용을 받지 않아 등기 후 전매가 가능하다.,https://news.naver.com/main/read.nhn?mode=LSD&mid=shm&sid1=260&oid=003&aid=0000579624,90
64753,2007.09.28. 오후 4:13,부동산,아시아경제,부동산 캘린더 10월 첫째주,추석 이후 가을 성수기를 맞아 건설사들이 본격적인 아파트 분양 채비에 나서고 있다. 이번 주에 분양하는 곳은 없지만 서울 동대문 용두동과 경기도 양주 고읍지구 등 전국 6곳에서 견본주택 개관하는 등 가을 분양대전의 막을 연다. 1일 인천광역시 남동구 논현동 힐스테이트 당첨자 발표와 경상북도 포항시 북구 우현동 풍림아이원 당첨자 계약이 진행된다. 2일 경기도 화성시 반송동 동탄신도시 동양파라곤Ⅱ 주상복합아파트와 인천광역시 남구 주안동 관교한신휴플러스의 당첨자를 발표한다. 4일 경기도 양주시 고읍지구 신도브래뉴 당첨자 계약이 시작된다. 5일 서울 동대문구 용두동에서는 ‘래미안용두’ 견본주택을 선보인다. 용두1구역을 헐고 짓는 아파트로 총 1054가구이며 이 가운데 76 148㎡ 284가구를 분양한다. 지하철 2호선 용두역과 1호선 제기역이 걸어서 이용 가능하며 동대문구청과 경동시장 등이 가깝다. 경기도 양주 고읍지구에서는 4곳에서 견본주택을 연다. 3개 건설업체가 동시분양하는 이곳엔 우남건설이 2블록에서 113 116㎡ 376가구 우미건설이 3블록에 109 113㎡ 513가구 한양이 1블록 109 148㎡ 598가구 6 3블록 122 185㎡ 434가구를 각각 분양한다. 울산 남구 삼산동에서는 ‘한화 꿈에그린’ 모델하우스를 개관한다. 105 157㎡ 716가구로 울산역이 가깝고 단지 인근에 E마트와 롯데백화점 각종 관공서 등이 위치한다. 삼산초와 백합초 대현중과 삼산고 등의 교육시설도 이용 가능하다. 같은 날 충남 당진군 신평면에서는 LIG건영이 당진리가 593가구 109 155㎡ 가 문을 열고 손님맞이를 한다.,https://news.naver.com/main/read.nhn?mode=LSD&mid=shm&sid1=260&oid=277&aid=0000003280,90
64754,2007.09.28. 오후 3:34,부동산,머니투데이,김우중 前회장 거제도땅 158억여원에 낙찰,머니투데이 원정호 기자 김우중 전 前 대우그룹회장의 거제도 땅이 법원경매에서 감정가보다 60억원 높은 158억 8400만원에 낙찰됐다. 28일 지지옥션에 따르면 이날 창원지방법원 통영지원에서 경매된 김우중씨 소유의 토지는 총 58필지 42만5000㎡ 감정총평가액 98억4835만원이며 네 개로 나눠 개별입찰로 붙여져 1회차 경매에서 전부 낙찰됐다. 응찰자는 모두13명으로 도서지역 토지임을 감안하면 많은 사람이 몰렸으며 4건 모두 개인 응찰자가 낙찰 받은 것으로 확인됐다. 경매 신청 채권자는 한국자산관리공사 kamco 로 제일은행 인수채권 250억원의 회수를 위해 지난 2006년 10월에 경매를 신청했다. 채무자는 대우전자다. 경매토지에 대한 가압류를 한 채권자는 한국수출보험공사 대한투자신탁증권 주식회사 예금보험공사 등이며 서울시장 서초구청장 서울중앙검찰청검사장도 체납세금 및 추징금 등을 환수하기 위해 배당요구를 신청한 상태다. 김씨는 이 거제도 토지를 지난 1983년 본인 명의로 매입했으며 임야 전 답 잡종지 대지 등으로 이뤄져 있다. 토지이용계획서 상으로는 개발이 용이한 관리지역을 비롯한 관광휴양개발진흥지구로 지정돼 있다. 통상적인 경매절차상 경매신청 이후 첫 입찰까지는 6개월 내외가 소요되지만 이 사건의 경우 소유자 김씨에 대한 송달지연 과 필지수가 많고 면적이 넓어 감정평가가 지연 되면서 정상적인 경우 보다 두배 이상의 기간이 걸려 첫 입찰을 하게 됐다. 지지옥션 박갑현 매니저는 이번에 경매된 토지는 토지이용계획서상 관리지역 및 관광휴양개발진흥지구로 지정돼 있어 향후 개발에 대한 기대가 높아 첫 입찰에서 전부 낙찰된것 같다 고 말했다.,https://news.naver.com/main/read.nhn?mode=LSD&mid=shm&sid1=260&oid=008&aid=0000832870,90
64755,2007.09.28. 오후 3:29,부동산,이데일리,대한화재 본사 사옥 별도 매각 중단,이데일리 윤도진기자 대한화재해상보험은 별도 매각을 추진하던 서울 남대문로 본사 사옥 매각작업을 중단키로 결정했다고 28일 공시했다. 대한화재 000400 는 사옥 매각을 위해 작년 8월18일 공개입찰을 통해 우선협상대상자로 SEB 임모빌리언 임베스트먼트 예비협상대상자로 코람코자산신탁을 선정해 매각협상을 진행해왔다. 그러나 매매협의 과정에서 매매가격 및 방식의 의견으로 인해 최종 합의에 이르지 못했다고 회사 측은 설명했다. 현재 대한화재의 모그룹인 대주그룹은 유동성 확보를 위해 보유하고 있는 대한화재의 지분 60% 가량을 매각 추진 중이며 이 지분 매각시 본사 사옥도 포함하는 방안을 고려하고 있다.,https://news.naver.com/main/read.nhn?mode=LSD&mid=shm&sid1=260&oid=018&aid=0000522744,90
64756,2007.09.28. 오후 3:24,부동산,파이낸셜뉴스,김우중 前 회장 거제도땅 158억8400만원에 팔려,김우중 전 前 대우그룹회장의 거제도 땅이 법원경매에서 28일 감정가보다 60억원 높은 158억 8400만원에 낙찰됐다. 경매접보업체 지지옥션에 따르면 28일 창원지방법원 통영지원에서 경매된 김우중씨 소유의 토지는 총 58필지 42만5000㎡ 로 감정평가액이 98억4835만원에 이른다. 이 필지는 4개로나눠 개별입찰로 붙여졌고 1회차 경매에서 전부 낙찰됐다. 4건 모두 개인 응찰자가 낙찰받았다. 김씨는 이 거제도 토지를 지난 1983년 본인 명의로 매입했다. 임야 전 답 잡종지 대지 등으로 이루어져 있으며 토지이용계획서에는 개발이 쉬운 관리지역을 포함한 관광휴양개발진흥지구로 지정돼있다. 지지옥션 박갑현 매니저는 “이번에 경매된 토지는 토지이용계획서상 관리지역 및 관광휴양개발진흥지구로 지정돼 있어 향후 개발에 대한 기대가 높아 첫입찰에서 전부 낙찰됐다”고 설명했다.,https://news.naver.com/main/read.nhn?mode=LSD&mid=shm&sid1=260&oid=014&aid=0000343848,90
64757,2007.09.28. 오후 3:20,부동산,뉴시스,칠곡왜관 3지구에 국민임대 528세대 공급,칠곡왜관 3지구에 국민임대 528세대 공급 대구 뉴시스 대한주택공사 대구경북지역본부 본부장 최수호 는 경북 칠곡군 왜관읍 왜관4지구에 국민임대아파트 528세대를 공급한다. 우선순위 및 1 2순위는 내달 4일 3순위는 내달 5일 신청을 접수한다.,https://news.naver.com/main/read.nhn?mode=LSD&mid=shm&sid1=260&oid=003&aid=0000579478,90
64758,2007.09.28. 오후 3:16,부동산,머니투데이,IMF로 집 헐값처분국가가 배상해야소송,머니투데이 양영권 기자 정모씨는 1996년12월 광주광역시에서 아파트를 한 채 샀다. 집값 6500만원 가운데 보험회사로부터 받은 대출금 5000만원을 인수하는 조건이었다. 당시 과외를 하면서 벌어들이는 수익으로 정씨는 대출 이자 30만원을 충분히 감당할 수 있다고 판단했다. 그러나 집을 마련한지 얼마 되지 않은 이듬해 11월 정부의 IMF 구제 금융 수용으로 이자율이 치솟았다. 정씨는 이전까지 내던 이자의 2배에 가까운 월 55만 56만원의 이자를 부담해야 했다. 이자를 감당하지 못해 아파트는 결국 경매에 넘겨졌고 주택 가격 하락으로 1999년5월 약 3300만원이라는 헐값에 낙찰됐다. 큰 손해를 본 정씨는 28일 서울중앙지법에 국가를 상대로 아파트 구입 가격과 처분 가격 차이의 일부인 1000만원을 배상금으로 지급하라며 소송을 냈다. 정씨는 IMF는 자율화와 세계화 과정에서 국가의 감독 소홀 및 안일한 대응이 큰 원인이 됐음을 최근 알게 됐다 며 원고가 입은 손해는 국가의 과실로 인한 것 이라고 주장했다. 정씨는 이어 내가 아파트를 매입할 때는 이자부담이 2배에 달할 것이라고는 도저히 예상할 수 없었고 IMF 사태가 아니라면 아파트를 처분하지도 않았을 것 이라고 강조했다. 이번 소송을 도운 신용사회만들기시민연합 공동대표 문호준 은 730만 금융연체자에게 고통과 상처를 안겨 준 IMF 사태의 책임을 묻지 않을 수 없다 며 앞으로 국가와 금융기관 전부를 상대로 IMF사태의 법적·행정적 책임을 철저히 규명할 계획 이라고 밝혔다. 시민연합은 아울러 금융연체자들에게 파산신청 대행 수수료를 제공하고 불법추심 부채증명 수수료 과대 책정 금융기관을 검찰에 고발하는 등의 사업을 벌일 계획이다.,https://news.naver.com/main/read.nhn?mode=LSD&mid=shm&sid1=260&oid=008&aid=0000832858,90
64759,2007.09.28. 오후 3:15,부동산,연합뉴스,임대차계약시 이런 점을 조심하세요,법률구조공단 과장 임대차사고 예방법 책 출판 수원 연합뉴스 김인유 기자 주택 임대차계약을 할 때는 계약 당사자가 권한이 있는 사람인지를 반드시 확인해야 한다. 권한 없는 당사자와 계약하면 나중에 낭패를 당하기 십상이기 때문이다 대한법률구조공단 수원지부 박균환 51 과장이 20년 가까이 민원인과의 상담경험을 토대로 임대차 계약시 임차인과 임대인이 주의할 점을 담은 주택.상가보증금 등 문제의 예방과 해결 이라는 책을 출판했다. 364페이지 분량의 이 책에는 주택임대차 상담사례 및 판례 상가건물임대차보호법 임대인의 고민문제 전세금보장보증보험 부동산 중개업자의 손해배상책임 등 주택임대차 계약에 필요한 각종 피해사례와 해결책을 담고 있다. 또 주택임대차 계약서와 주택임대차 등기명령 신청서 등 임대차와 관련된 각종 서식이 들어 있어 주택 및 상가 임대차 계약을 잘못해 피해를 입지 않기 위한 노하우가 자세히 설명되어 있다. 법률구조공단에서 18년간 법률상담 및 사건조사 송무업무 등을 담당해 온 박 과장은 29일 임대차 계약시 반드시 당사자 신원을 확인하고 계약 전.후로도 등기부등본을 떼어 봐야 사기 등 피해를 예방할 수 있다 며 상담을 하면서 피해를 당한 민원인이 너무 많아 임대차사고 예방을 위해 책을 썼다 고 말했다.,https://news.naver.com/main/read.nhn?mode=LSD&mid=shm&sid1=260&oid=001&aid=0001766963,90
