,date,cat,co,headline,text,url,week
142650,2009.06.22. 오전 7:51,부동산,이데일리,환율·임대료 상승..외인 국내오피스 투자 늘것,생보신탁 오피스임대료 및 자산가치 비교 보고서 이데일리 박성호기자 원화가치가 떨어져 외국인들의 국내 오피스빌딩 투자가 다시 늘 가능성이 크다는 분석이 나왔다. 특히 국내 오피스시장은 공실률 증가에도 불구하고 월임대료가 꾸준히 상승하고 있어 수익성이 좋은 편이다. 22일 생보부동산신탁이 발표한 아시아 주요 도시 오피스 임대료 및 자산가치 비교 보고서에 따르면 환율을 고려한 아시아 주요 9개 도시의 월임대료 비교결과 서울은 홍콩 도쿄 상해에 이어 네번째로 높았다. 1㎡당 임대료를 각국의 빅맥 Big Mac 지수로 계산할 경우 서울은 중심업무지구 기준 전용면적 1㎡당 6만6650원으로 빅맥 버거 20개를 구매할 수 있다. 이는 홍콩 79개 도쿄 56개 상하이 32개 싱가포르 29개 보다는 낮고 타이페이 쿠알라룸푸르 마닐라 방콕 등에 비해서는 높은 수준이다. 생보신탁은 서울의 월임대료 수준은 다른 도시들에 비해 높은 편은 아니지만 원화가치가 2007년 평균 대비 26.3% 떨어지고 있고 월임대료도 상승하고 있어 외국인들의 오피스 매수에는 긍정적으로 작용할 것으로 내다봤다. 즉 다른 국가에 비해 환율 하락폭이 컸던 한국은 외국인들이 상대적으로 적은 외화로 많은 원화를 확보할 수 있어 투자에 긍정적인 요인으로 작용할 것이라는 이유 때문이다. 특히 서울 오피스빌딩의 월임대료는 상승하고 있어 외국인 투자 증가에 대한 기대감이 커지고 있다는 것이 생보신탁의 분석이다. 올 1분기 서울 중심업무지구 오피스빌딩 공실률은 작년 4분기 0.9%에서 올 1분기 2.2%로 늘어난 반면 월임대료는 오히려 전분기 대비 3.6% 전년동기 대비로는 5.1% 상승한 것으로 나타났다. 이는 상하이 월임대료가 작년 동기대비 14.1% 하락한 것을 비롯 도쿄 23.3% 홍콩 32.2% 싱가포르 34.4% 등 아시아 주요도시 오피스 월임대료가 급락한 것과는 대조적이다. 윤미영 생보신탁 차장은 원화 가치가 떨어진 상황이라 외국인 투자자는 싼값에 한국내 자산을 매입할 수 있을 것으로 보인다 며 임대수요가 급격히 줄어들지 않는 한 아시아 주요도시 오피스에 비해 상대적으로 투자가치가 큰 것으로 평가된다 고 말했다.,https://news.naver.com/main/read.nhn?mode=LSD&mid=shm&sid1=260&oid=018&aid=0002121454,181
142651,2009.06.22. 오전 7:33,부동산,아시아경제,동탄2신도시 산척 저수지 수변공간으로 만든다,나뭇잎을 형상화한 동탄2신도시 특별계획구역의 ‘워터프론트 콤플렉스’구상안 경기도시공사가 화성 동탄2신도시내 산척저수지를 보존하기 위해 이 일대를 특별계획구역으로 설정하고 ‘워터프론트 콤플렉스’를 구상중이다. 특히 공사는 차별화된 특화방안을 마련하고자 국내전문가는 물론 외국의 유명전문가를 참여시켜 연구중인 것으로 알려졌다. 경기도시공사에 따르면 대한국토·도시계획학회와 공동으로 지난 18일 한국과학기술회관에서 동탄2 신도시 개발전략에 관한 워크샵을 개최했다. 워크샵 발표자로 참여한 리차드 플런즈 미 콜럼비아대 교수는 화성동탄2 택지개발사업의 특별계획구역인 워터프론트 콤플렉스 개발전략으로 나뭇잎을 형상화한 구상 안 을 제시했다. 구상 안 은 지형을 살려 녹지를 보존하고 수계를 따라 주거지 배치로 자연친화형 생태·교통체계를 구상했다. 또한 김세용 고려대 교수와 김현수 단국대 교수는 동탄2신도시 개발전략으로 녹색성장 및 친환경 조성을 위한 ‘저탄소 주거단지’와 1인 가구증가에 따른 새로운 주거 패러다임의 ‘맞춤형주거 Single Smart Housing ’단지 건설을 제시했다. 또 장호순 미래E D 상무는 생태녹지축과 학교 연도형 학원가 주민편익시설 등이 하나로 연결돼 길게 뻗은 ‘에코 에듀 컬리도 Eco Edu Corridor ’ 설계를 제안했다. 이날 동탄2신도시 명품화방안 구상연구의 과제책임을 맡고있는 이우종 경원대 교수는 “동탄2신도시는 기존 신도시와는 차별화된 특화전략을 구체화해 보행자 중심의 스마트한 도시·문화복합도시·지속가능한 도시 등으로 개발 명품자족도시를 실현하겠다”고 밝혔다. 리차드 곤잘레스 박사 어스인스터투트 도시설계연구소 PM 는 “2030년을 대비한 도시의 과거 현재 미래를 고민해 건축 디자인을 활용해야 한다”고 말했다. 이에 따라 경기도시공사는 앞으로 심화연구용역을 통해 구체적인 계획 안 을 마련해 워터프론트 콤플렉스 현상설계경기의 개발방향으로 제시될 예정이다. ‘워터프론트 콤플렉스’는 사업지구 남측을 대표하는 랜드마크로서 산척저수지와 어우러진 레져·문화·쇼핑 복합공간으로 추진되고 있다. 올해말까지 현상설계경기를 통해 당선작이 선정될 전망이다.,https://news.naver.com/main/read.nhn?mode=LSD&mid=shm&sid1=260&oid=277&aid=0002180014,181
142652,2009.06.22. 오전 7:09,부동산,아시아경제,서울시 주차장 기준 낮춰 소형주택 공급 확대,서울시내 역세권이나 대학가 등 25곳이 주차장 설치 완화구역 으로 지정돼 기숙사나 원룸형 주택을 지을 수 있게 된다. 이에 소형주택 공급이 늘어날 전망이다. 서울시는 지하철 역세권이나 대학가 등 소규모 주택수요가 많은 지역을 대상으로 오는 11월까지 25곳을 주차장 설치 완화구역 으로 지정해 법정 기준의 15%에 해당하는 주차공간만 확보하면 기숙사형이나 원룸형 주택 등 도시형 생활주택 건설을 허용할 방침이라고 21일 밝혔다. 시는 이를 위해 자치구별로 1 2곳씩 주차장 설치완화구역 지정 신청을 받아 11월까지는 주차장 설치 완화구역을 지정할 방침이라고 설명했다. 주차장 설치 완화구역에서는 20 150가구의 도시형 생활주택을 건설할 경우 주차장 설치 기준이 연면적 200㎡당 1대로 완화된다. 이렇게 되면 이들 지역에서는 주차장 설치에 따른 공간 부족과 비용부담이 크게 줄어 도시형 생활주택 건설이 활성화될 것으로 서울시는 내다봤다. 서울시 관계자는 여기에 지난달 4일 개정된 주택법에 따라 가구당 주차장 확보기준이 기숙사형은 0.3대 원룸형은 0.5대로 줄어든다 면서 이 두가지 주차장 규제완화로 향후 5년 동안 9만가구 정도의 도시형 생활주택이 공급될 수 있을 것 이라고 설명했다.,https://news.naver.com/main/read.nhn?mode=LSD&mid=shm&sid1=260&oid=277&aid=0002179998,181
142653,2009.06.22. 오전 6:54,부동산,아시아경제,충주첨단산단내 용지 10만7000㎡ 분양,충주첨단산업단지 내 단독주택지 등 318필지 10만 7000㎡가 추첨 분양 및 경쟁입찰로 공급된다. 22일 한국토지공사 충북지역본부에 따르면 이번에 공급되는 땅은 전매가 가능하며 조성사업도 막바지 단계로 땅 사용이 곧바로 가능한 상태로 공급된다. 용도별로는 △단독주택용지 280필지 점포겸용 218 주거전용 62 △위험물처리시설 1필지 △업무상업 11필지 △지원시설 15필지 △주차장용지 11필지 등이다. 평균 토지 공급단가는 ㎡당 △점포겸용 단독주택용지 18만 2000원 △주거전용 단독주택용지 15만 3000원 △위험물처리시설용지는 47만 7000원 수준이다. 토지대금은 계약을 맺은 날로부터 5개월 이내에 일시불로 내거나 2년 동안 4번으로 나눠 연 6%의 할부이자로 낼 수 있다. 청약은 토공의 토지청약시스템 hp buy.lplus.or.kr 을 통해 오는 24 25일 인터넷 접수가하면 된다. 추첨 및 개찰은 26일 매각 잔여분은 다음달 8일 오전 9시부터 선착순 수의계약한다.,https://news.naver.com/main/read.nhn?mode=LSD&mid=shm&sid1=260&oid=277&aid=0002179989,181
142654,2009.06.22. 오전 6:33,부동산,아시아경제,남양주 호평 두산위브파크 상가 분양,남양주 호평 두산위브파크 두산중공업이 경기도 남양주시 호평동에 타워형의 두산위브파크 단지 내 상가를 분양한다. 지하 2 지상 12층의 중대형 주상복합아파트 119가구 로 29개 상가가 모두 지상 1층에만 구성돼 있다. 3.3㎡ 당 분양가는 2400만 3400만원 선이며 층고는 최고 7.5m로 매우 높은 편이다. 주변에는 E마트 사이더스9 극장 학원 금융기관 등이 있어 호평지구에서는 최대의 중심 상권이다. 또 배후에는 2만6000여 가구의 아파트 단지가 들어서 있으며 2년내에는 추가로 1만여가구가 입주할 계획이다. 내년 중에는 평내호평역 개통을 비롯 서울 춘천 고속도로도 완공된다. 권장업종은 편의점 뷰티숍 커피전문점 패밀리레스토랑 은행 가전매장 약국 전문식당 세탁소 등이며 특히 선임대 업종으로는 편의점 뷰티숍 패스트푸드 골프숍이 있다.,https://news.naver.com/main/read.nhn?mode=LSD&mid=shm&sid1=260&oid=277&aid=0002179981,181
142655,2009.06.22. 오전 6:03,부동산,뉴시스,대법원 빌라 사잇길 통행로로 내줘선 안돼,서울 뉴시스 주거의 자유와 평온 안전을 고려해 함부로 연립주택 단지 내 토지를 인근 주민들의 통행로로 개방하게 해서는 안된다는 대법원 판결이 나왔다. 대법원 1부 주심 김능환 대법관 는 김포시 A빌라 인근에 사는 B씨 등이 빌라 주민들을 상대로 낸 주위토지통행권 확인소송에서 원고 승소 판결한 원심을 파기 사건을 인천지법으로 돌려보냈다고 22일 밝혔다. 재판부는 주거는 사람의 사적인 생활공간이자 평온한 휴식처로서 인간 생활에 있어서 가장 중요한 장소 라며 주위통행권을 행사함에 있어서도 이러한 주거의 자유와 평온 및 안전을 침해해서는 안된다 고 판시했다. 이어 원고가 평소 해당 토지를 통행로로 이용했고 피고 등이 원고의 통행을 묵인해 왔다거나 해당 토지 아래 피고 등이 사용하는 하수관이 묻혀있다고 하더라도 주위토지통행권 인정여부를 판단하는데 크게 고려할 사항은 아니다 고 덧붙였다. 아울러 해당 토지는 연립주택 단지내를 가로지르면서 주민들의 창고 놀이터 등의 이용에 영향을 미칠 수 있다 며 해당 토지를 통행로로 허용하는 것이 연립주택 주민들에게 손해가 가장 적은 방법이라고 단정할 수도 없다 고 지적했다. B씨는 자신의 채소 경작지로 가는 지름길인 A빌라 사잇길이 차단되자 이를 개방하라며 소송을 냈다. 이에 1·2심 재판부는 B씨에게 해당 토지에 대한 주위토지통행권이 있음을 확인하고 A빌라 주민들이 설치한 벽돌 담장을 철거하라고 명했다.,https://news.naver.com/main/read.nhn?mode=LSD&mid=shm&sid1=260&oid=003&aid=0002738038,181
142656,2009.06.22. 오전 6:00,부동산,머니투데이,국제과학비즈니스벨트 조성 세미나,머니투데이 이군호 기자 국토해양부는 오는 23일 오후 2시 서울 프레스센터에서 국토연구원이 주관하고 국제과학비즈니스벨트 추진지원단이 후원하는 국제과학비즈니스벨트 조성을 위한 과학도시 개념과 공간조성 방향에 대한 세미나 를 개최한다. 이번 세미나는 국토부가 발주한 국제과학비즈니스벨트 공간조성 계획 수립을 위한 연구용역 과 관련 과학도시 개념과 과학도시 공간이 어떻게 조성돼야 하는지에 대한 방향을 논의하는 자리다. 산업연구원 KIET 김영수 연구위원이 과학도시의 개념과 해외사례 를 단국대학교 김현수 교수가 미래도시의 새로운 패러다임과 과학도시 공간조성의 방향 이란 주제로 발표를 하게 된다.,https://news.naver.com/main/read.nhn?mode=LSD&mid=shm&sid1=260&oid=008&aid=0002164852,181
142657,2009.06.22. 오전 6:00,부동산,아시아경제,국제과학비즈니스벨트 공간 조성 세미나 개최,국토해양부는 국제과학비즈니스벨트 조성을 위한 과학도시 개념과 공간조성 방향에 대한 세미나 를 23일 오후 2시에 개최한다. 이번 세미나는 국토해양부가 발주한 국제과학비즈니스벨트 공간조성 계획 수립을 위한 연구 국토연구원 ‘09.5～ 용역 수행과 관련한 사항에 대해 논의한다. 논의은 일반적인 신도시가 아닌 과학도시 로서 신도시의 개념과 과학도시 의 공간은 어떻게 조성돼야 하는지에 대해 산·학·연 전문가와 패널들이 토론하는 형식으로 이뤄진다. 우선 산업연구원 KIET 김영수 연구위원이 과학도시의 개념과 해외사례 를 단국대학교 김현수 교수가 ‘미래도시의 새로운 패러다임과 과학도시 공간조성의 방향’을 이어 발표한다. 이어 안건혁 서울대학교 교수의 진행으로 이희정 서울시립대학교 교수 이창수 경원대학교 교수 임상오 상지대학교 교수 박갑동 한국표준과학연구원 정책팀장 노유라 YUELLA 대표 민범식 국토연구원 도시재생센터장 등 전문가들의 토의가 진행된다.,https://news.naver.com/main/read.nhn?mode=LSD&mid=shm&sid1=260&oid=277&aid=0002179977,181
142658,2009.06.22. 오전 4:15,부동산,경향신문,청라 단독주택 청약도 ‘후끈’…  최고 경쟁률 140대 1,인천경제자유구역청 청라지구 아파트 분양 열기가 단독주택까지 후끈 달아오르게 하고 있다. 한국토지공사 청라영종사업본부는 18일 오후 2시 점포겸용 단독택지 314필지에 대해 전자 추첨을 벌였다. 이날 추첨에는 모두 963명이 참여했으며 추첨 결과 314필지 중 소위 ‘목좋은 곳’ 118필지에 대해 사업자가 선정됐으며 평균 경쟁률은 8대 1을 보였다. 가장 치열한 경쟁률을 보인 단독주택은 8블럭 603부번으로 3.3㎡당 591만여 원으로 이곳은 140대 1에 달했다. 최회운 청라영종사업본부 판매팀장은 “점포형 단독주택은 3층까지 건설이 가능하고 다른 지역보다 공급가격도 3.3㎡당 평균 540만 원으로 비싸지 않아 수익성이 있다고 판단한 수요자들이 몰린 것 같다”며 “최근 이곳은 전매도 허용하기로 결정됐다”고 말했다. 한편 청라영종사업본부는 이날 주인이 나타나지 않은 196필지에 대해서는 다음 달 중 공고를 통해 재입찰할 예정이다. 박준철기자 대한민국 희망언론 경향신문 구독신청 hp smile.khan.co.kr ⓒ 경향신문 경향닷컴 www.khan.co.kr 무단전재 및 재배포 금지 〈경향닷컴은 한국온라인신문협회 www.kona.or.kr 의 디지털뉴스이용규칙에 따른 저작권을 행사합니다.,https://news.naver.com/main/read.nhn?mode=LSD&mid=shm&sid1=260&oid=032&aid=0002016390,181
142659,2009.06.22. 오전 3:13,부동산,동아일보,住소식 地소식천안 쌍용지구 ‘천안동일하이빌’ 964채 外,동아일보 천안 쌍용지구 ‘천안동일하이빌’ 964채 동일하이빌은 충남 천안시 쌍용지구에서 ‘천안동일하이빌’ 964채를 분양 중이다. 107∼289m²로 현재 196 229 231 264 289m²가 남아 있다. KTX 천안아산역이 가깝고 수원∼천안 복선화 전철이 개통될 예정이라고. 분양가는 3.3m²당 750만 원. 2011년 1월 입주 예정. 041 577 0014 인천 연수구 연수동 ‘연수 푸르지오’ 436채 대우건설은 인천 연수구 연수동에서 ‘연수 푸르지오’ 436채를 분양하고 있다. 113∼262m² 7개 동으로 연수지구 상업중심지역과 가깝고 제2경인고속도로 등이 가까이 있어 교통이 편리하다고. 분양가는 3.3m²당 1200만 원 선. 2011년 5월 입주 예정. 032 812 0363 용인 수지구 죽전동 단국대 앞 ‘위즈하우스’ 40채 위즈룩스는 경기 용인시 수지구 죽전동 단국대 정문 앞에서 도시형 생활주택 ‘위즈하우스’ 40채를 분양 중이다. 지상 4 5층에 있고 23∼26m²로 총분양가는 6800만 원. 분양금의 45%를 회사 측을 통해 대출 받을 수 있다고. 월 임대료는 50만 원 선. 031 889 3502 강원 속초 장사동 ‘한화리조트 설악’ 본관 한화리조트는 강원 속초시 장사동 ‘한화리조트 설악’ 본관을 분양하고 있다. 분양가는 2125만 원으로 연 30박을 사용할 수 있고 입회기간인 20년 만기 후 분양대금을 전액 반환받을 수 있다. 02 755 2435 부천 원미구 중동 오피스텔 ‘금광베네스타’ 금광기업은 경기 부천시 원미구 중동에서 오피스텔 ‘금광베네스타’ 233실을 분양한다. 지하 7층∼지상 20층으로 내년 12월 연장 개통되는 지하철 7호선 부천시청역과 가깝다고. 올 10월 입주 예정으로 분양가는 3.3m²당 560만∼590만 원 선. 032 323 7114 포커스에셋 상가빌딩 투자 무료 공개강좌 포커스에셋은 서울 강남구 논현동 코빅스빌딩 5층 포커스에셋 회사 본사에서 24일 오후 2시와 오후 7시 26일 오후 2시에 2시간 동안 상가빌딩 투자에 대한 무료 공개강좌를 연다. 또 7월부터는 매주 화 목요일 모두 8회에 걸쳐 상가빌딩 투자 실전 교육을 시작한다.,https://news.naver.com/main/read.nhn?mode=LSD&mid=shm&sid1=260&oid=020&aid=0002056729,181
142660,2009.06.22. 오전 3:13,부동산,동아일보,부동산 인사이트출산율 하락이 부를 ‘부동산 하락’ 안보이나,동아일보 미국 디즈니랜드나 호주의 큰 공원에서 만나는 젊은 부부들은 대부분 2명 이상의 아이들을 동반하고 있다. 반면 한국 어린이 관련 공원에서는 아이를 1명 정도 데리고 오는 가족이 많다. 2007년 황금돼지해에 잠깐 반짝했던 출산율이 지난해부터 다시 떨어지기 시작해 지난해 한국의 출산율은 세계적으로 가장 낮은 수준인 1.19명이었다. 만약 출산율이 1.0으로 더 떨어지는 상황이 계속된다면 300년 후에는 지구상에서 한국인이 완전히 없어지게 된다고 한다. 매우 심각한 문제가 아닐 수 없다. 출산율이 떨어지면 산부인과 병원과 유아용품산업은 즉각 영향을 받는다. 그러나 종국에는 국내 소비와 연결된 모든 산업이 영향을 받게 되고 모든 분야에서 국력이 약해질 수밖에 없다. 특히 부동산 시장의 경기는 인구문제와 직결돼 있다. 사회문제가 되고 있는 수도권과 지방 간 양극화 문제의 기본은 수도권으로 지방 인구가 몰리기 때문이다. 필자가 경험한 한 사례를 소개해보겠다. 약 10년 전 인구가 10만 명 정도인 경남 밀양시에서 사회간접자본 SOC 투자법인 본사를 유치했다. 상주 및 유동인구는 500명 정도가 늘었는데 그 파급효과는 대단해 시내 음식점에 금방 생기가 돌았고 아파트 가격도 50% 정도 상승했다. 현 인구 5000만 명 선을 유지할 수 있도록 출산율을 높이기 위해 정부에서도 보육비를 지원하고 주택 분양에서 우대하는가 하면 세금을 감면하는 등 다양한 지원정책을 펼치고 있지만 젊은 부부의 마음을 돌리기에는 한참 부족하다. 출산율은 국가안보나 교육문제 이상으로 국가 존망이 달린 사안이므로 최고 우선순위를 둬야 하고 더 획기적인 조치가 필요하다. 첫째 헌법에 출산에 대한 의무를 선언적이라도 언급해야 한다. 우리가 학교에서 배운 국민의 의무인 국방 납세 교육에 추가해 출산의무를 명시할 필요가 있다. 그래야만 지속적인 교육과 홍보가 되고 국가의 지원이 계속될 수 있다. 둘째 저출산의 가장 큰 원인인 보육비 지원을 위해 중앙정부가 나서 과거에 한 때 있었던 방위세같이 출산과 육아를 지원하기 위한 목적세로 보육세를 신설해야 한다. 지금같이 보육비 지원을 재정이 빈약한 지방정부가 맡게 해서는 큰 효과가 없다. 보육세를 신설해 신생아가 취학할 때까지 정부에서 책임을 지고 건강과 보육문제를 해결해 줘야 한다. 그래야만 젊은 부부의 마음을 돌려놓을 수 있다. 부수적으로 보육원에서 일하는 여성 인력에 대한 고용창출 효과도 매우 클 것이다. 이러한 지원은 단순한 지출이 아니라 미래를 위한 시급한 투자라는 점에서 국민적 공감대를 얻을 수 있다. 보육세 신설을 국회에서 조속히 입법화하는 한편 대통령 연임 내각제 채택 등과 관련해 헌법을 손질할 때 출산의무를 헌법에 선언적으로 명시하는 방안을 추가하는 것을 공론화할 필요가 있다.,https://news.naver.com/main/read.nhn?mode=LSD&mid=shm&sid1=260&oid=020&aid=0002056728,181
142661,2009.06.22. 오전 3:13,부동산,동아일보,“입주물량 늘어나 강남 거래 증가… 실제 거래 회복세는 미미”,동아일보 최근 서울 강남 서초 송파구 등에서 아파트 거래가 늘어난 것은 대단지 입주 등 물량 자체가 늘었기 때문이며 실제 회복세는 미미하다는 분석이 나왔다. 한국건설산업연구원 김현아 연구위원은 21일 발간한 ‘현행 주택거래량 통계의 문제점과 개선 방안 강남 3구 거래량 해석을 중심으로’ 보고서에서 “강남 3구의 아파트 거래량을 재고 주택 수 대비 방식으로 재해석한 결과 지난 3년간 강남 3구 아파트 거래량의 절대 수치는 증가했으나 재고 대비 거래량을 추정하면 증가율은 연 3.9%에 불과했다”고 주장했다. 김 연구위원은 “올 들어 강남 3구의 가격 상승 및 거래량 증가가 보이지만 장기적 관점에서 거래량 수준은 총 주택 재고 대비 연 4%대는 돼야 한다”며 “최근 2년간 입주물량 증가 효과를 감안하면 아직 거래가 회복된 수준으로 보기 어렵다”고 해석했다. 또 현행 주택거래량 통계가 집계 방식 및 분류 체계상의 기준이 없어 실제 시장 상황과 거리가 있을 수 있는 만큼 ‘주택거래량 통계’에 대한 근본적인 개선이 필요하다고 주장했다.,https://news.naver.com/main/read.nhn?mode=LSD&mid=shm&sid1=260&oid=020&aid=0002056727,181
142662,2009.06.22. 오전 3:13,부동산,동아일보,올 상반기 분양권 매매가 인천 0.9%↑ 대구 1.9%↓,동아일보 올해 상반기 1∼6월 분양권 시장은 수도권은 오른 반면 지방은 떨어진 것으로 나타났다. 수도권 가운데서도 서울과 인천은 오르고 경기와 신도시는 하락세를 보였다. 부동산정보업체 닥터아파트에 따르면 올 1월부터 6월 19일까지 전국 분양권 매매가는 0.02% 내린 가운데 수도권은 0.30% 올랐다. 지방은 0.65% 내렸다. 서울은 0.71% 올랐다. 특히 서초구는 올 1월부터 한강변 초고층 재건축 허용 강남 3구 투기과열지구 해제 기대감 등으로 매수세가 유입되며 8.89% 올랐다. 반포동 주공2단지 래미안퍼스티지 172m²는 1억6000만 원 238m²는 3억2000만 원 올랐다. 인천은 0.98% 상승했다. 특히 송도국제도시와 가까운 남동구 일대 분양권이 4.35%의 상승률을 보였다. 고잔동 에코메트로2차 114m²가 2000만 원 161m²가 3400만 원 올랐고 고잔동 한화꿈에그린월드에코메트로 A12블록 152m²는 9700만 원 오르기도 했다. 경기는 광명 ―1.24% 안양 ―0.96% 수원시 ―0.42% 등이 내려 전체적으로 0.04% 하락했다. 한편 지방은 수도권과 달리 침체에서 벗어나지 못하고 있다. 올 상반기 가장 많이 내린 곳은 대구 ―1.94% 였고 이어 울산 ―0.77% 광주 ―0.58% 경남과 충북 이상 ―0.55% 순이었다.,https://news.naver.com/main/read.nhn?mode=LSD&mid=shm&sid1=260&oid=020&aid=0002056726,181
142663,2009.06.22. 오전 3:13,부동산,동아일보,국내 부동산 개발계획 망라 ‘대한민국 미래지도’ 출간,동아일보 부동산 투자서적인 ‘유망투자지역이 한눈에 보이는 2010∼2020 대한민국 미래지도 한국비즈니스정보 지음·리더스하우스 ’가 출간됐다. 용산재개발과 한강르네상스 인천경제자유구역 등 각종 도시개발 프로젝트 도로·철도를 비롯한 전국 교통망 정비 등 부동산과 관련된 전국의 핵심 개발계획을 최대한 담았다. 각 장 말미에 지역별 개발 전도를 수록했다.,https://news.naver.com/main/read.nhn?mode=LSD&mid=shm&sid1=260&oid=020&aid=0002056725,181
