,date,cat,co,headline,text,url,week
98232,2008.08.07. 오후 1:21,부동산,머니투데이,급등 강북 집 팔고 송파로 갈아타볼까,머니투데이 원정호 기자 북고남저 강남북간 아파트차 꾸준히 줄어 올 들어 뉴타운 호재를 업고 강북 아파트값이 뜀박질하면서 강북권과 강남권 아파트 가격차가 많이 줄어든 것으로 나타났다. 전문가들은 강남으로 집 갈아타기를 원하는 수요자들에게 지금이 강남 입성 적기라고 주문하고 있다. 7일 부동산정보업체인 부동산114 조사 결과 강남 3구 강남 서초 송파 와 강북 3구 노원 도봉 강북 의 아파트 가격은 지난 2006년 3.3㎡당 1648만원에서 많게는 2661만원의 차이를 보였으나 지난 7월 현재 1164만 2299만원으로 격차를 줄였다. 이처럼 강남북 가격차가 좁혀지면서 갈아타기 수요자들의 시선이 송파쪽으로 이동하고 있다. 강남 핵심지역은 아니더라도 강남 생활권의 혜택을 누릴 수 있는 문정동 풍납동 집값이 강북권 아파트와 큰 차이가 없어졌기 때문이다. 노원구 중계동 건영3차 107㎡의 시세는 5억9750만원으로 송파구 문정동 건영 105㎡ 6억2500만원 와 비교할 때 2750만원 밖에 차이가 안났다. 이들 두 단지는 불과 2년여 전만 해도 시세차이가 1억5000만원에 달했다. 강남 아파트 가격이 정점에 이르던 2006년 3월 각각 3억5000만원 5억원의 시세를 나타냈다. 노원 하계동 극동 102㎡과 송파 풍납동 현대홈타운 105㎡도 같은 기간 가격차가 2억2000만원에서 2500만원으로 줄었다. 하계동 극동 102㎡ 강북의 교육특구 바람을 타고 2억3000만원에서 5억500만원으로 120% 급등한데 비해 풍납동 현대홈타운은 4억5500만원에서 5억3000만원으로 16% 상승하는 데 그쳤다. 문정동 아파트값은 재건축된 잠실 주공과 잠실시영 아파트의 입주 여파로 주춤하고 있지만 입주가 마무리되면 다시 관심을 모을 것으로 전문가들은 보고 있다. 풍납토성으로 유명한 풍납동도 사적 주변 개발 제약으로 빛을 보지 못하고 있지만 영어마을 수혜에다 재건축 잠재성 등 중장기 개발 호재가 적잖은 곳으로 꼽힌다.,https://news.naver.com/main/read.nhn?mode=LSD&mid=shm&sid1=260&oid=008&aid=0002018962,135
98233,2008.08.07. 오후 1:15,부동산,아시아경제,금리인상 후폭퐁 건설업계 유동성 확보 비상,기준금리 인상으로 건설업체들은 안그래도 어려운 현금 유동성 확보에 초비상이 걸렸다. 한국은행 금융통화위원회는 7일 기준금리를 0.25%포인트 올렸다. 풀려있던 시중자금을 묶어 소비자 물가를 잡겠다는 것이 이유다.,https://news.naver.com/main/read.nhn?mode=LSD&mid=shm&sid1=260&oid=277&aid=0002013298,135
98234,2008.08.07. 오후 12:46,부동산,헤럴드경제,제2경부고속道 기대감…용인 ‘땅바람’,모현면ㆍ포곡면ㆍ고림동등 토지수요 급증 3.3㎡당 1000만원 이상 기대 60% 양도세 부담…신중한 투자를 “10년이 지난 후에 100만원 하던 것이 1000만원까지 오른다면 투자 가치가 있죠. 장기적으로 보고 투자 문의를 하는 사람들이 줄 서 있습니다” 가파르게 추락하고 있는 경기도 용인의 부동산 시장. 이 지역에 때 아닌 토지 매수 바람이 불고 있다. 영동 고속도로를 기준으로 북쪽에 자리잡은 모현면 포곡면 고림동 등지에 토지 수요가 급증하고 있는 것. 포곡면의 K부동산 관계자는 “없어서 못 팔지 이곳에 제 2경부고속도로가 들어선다는 소문이 돌고부터 물건만 나오길 기다리는 사람이 수두룩하다”고 전했다. 실제 이 곳엔 제2경부고속도로에 대한 기대감이 크다. 지난 3월 국토해양부가 대통령 업무보고를 통해 제2 경부고속도로 조기 건설 방침을 밝히고 내년 착공 2017년 완전 개통 등 계획안이 전해지면서 투자 바람이 불기 시작한 것. 여기에 동탄 제2신도시 계획에 새로운 부지를 찾는 산업체들의 수요까지 더해져 인근 토지에 대한 관심이 커지고 있다. 부동산 투자 자문 업체인 다산서비스 이종창 대표는 “주택 시장의 침체에 따라 투자처를 찾지 못했던 사람들이 토지로 눈을 돌렸고 가장 먼저 점찍은 곳이 제2경부고속도로 예상지인 이 곳”이라며 “개발과 함께 경부 축의 토지가격이 평당 1000만원 이상이 될 것으로 기대하며 매수 문의를 하고 있다”고 전했다. 구체적인 개발안이 확정되지 않았지만 이 지역 부동산 업계와 투자자들이 예상하는 노선의 중심에는 모현면 포곡면 고림동 등이 속해 있다. 현재 이 곳의 토지 가격은 3.3㎡당 100만원선. 농림지역 50만원선에서 관리지역 100만 150만원선 정도다. 올해 초와 비교해볼 때 20만 50만원까지 상승했다. 하지만 광주시 옥포읍 등 서울권에 인접한 지역의 200만원 이상 가격에 비한다면 아직은 저렴한 수준이란게 현지 중개업자들의 설명. 일각에서는 이러한 토지 시장의 활성화가 처참할 정도로 바닥을 향해 추락하는 용인의 부동산 시장에 한 줄기 빛이 될 것이라는 전망까지 내놓고 있다. 한마디로 제2경부고속도로를 발판으로 용인 지역에 투자의 돈줄 이 다시 몰린다는 것. 용인시 CH부동산 관계자는 “한창 용인지역이 주목을 받았던 이유가 경부고속도로라는 개발 축의 존재였다”며 “제2경부도로가 다시 그 같은 역할을 할 것으로 기대한다”고 전했다. 하지만 대부분의 의견은 부정적이다. 개발재료를 틈탄 반짝 장세일 뿐 용인의 부동산 시장 악화는 당분간 계속될 것이라는 전망이 우세하다. 현도컨설팅 임달호 사장은 “현재의 토지 수요 증가와 지가 상승은 투자라기 보다는 산업체 입주 등 실수요적 측면이다. 60%에 달하는 양도세 문제는 외지의 매도와 매수자 모두에게 큰 부담이다”고 말했다. 스피트뱅크 김은경 팀장 역시 “제2경부고속도로의 수혜도 오히려 분양가 상한제 등으로 인한 분양가 입지 여건 등에서 앞선 광교와 판교 등지로 몰릴 가능성이 크다”고 전망했다.,https://news.naver.com/main/read.nhn?mode=LSD&mid=shm&sid1=260&oid=016&aid=0000278416,135
98235,2008.08.07. 오후 12:46,부동산,헤럴드경제,신혼부부 주택 맞춤설계 하세요,대한주택공사는 신혼부부 주택 공급시 신혼부부가 원하는 평면을 선택할 수 있는 전용면적 59㎡의 소형분양주택을 개발해 공급할 예정이라고 7일 밝혔다. ‘맞춤형 신혼부부 주택’은 신세대의 생활특성을 감안해 가족구성 생활여건 직업형태 등에 따라 주택평면을 선택할 수 있도록 설계될 계획이다. 동일한 평면 내에서 방이 3개인 3LDK형과 방이 2개인 2LDK형으로 구성해 입주자의 필요에 따라 선택과 개조가 가능토록 한 것이 가장 큰 특징이다. 예컨데 3LDK는 ‘방 3개 거실 Living 식당 Dining 부엌 Kitchen ’의 구조를 가진 집을 가리킨다. 또한 2LDK형은 편리한 주방과 쾌적한 식당을 원하는 신세대주부를 위한 ‘주부중심형’ 아이와 함께하는 넓은 거실공간을 선호하는 가족을 위한 ‘가족중심형’ 업무와 가사를 병행하는 전문직을 위한 ‘소호 SOHO 형’ 등 3가지로 구성해 취향에 따라 원하는 평면을 고를 수 있도록 했다. 주공이 공급할 신혼부부 주택은 이 밖에도 신세대 부부를 위해 곳곳에 세심한 배려를 할 계획이다. 안방에는 젊은부부의 요구사항을 반영해 파우더와 드레스룸 샤워부스를 설치한 욕실 등을 설치해 기존 소형주택에서 볼 수 없었던 시설을 적용하고 거실과 식당은 시각적으로 분리되지 않도록 통합적으로 조성해 단란한 가족생활의 중심공간이 되도록 했다. 확장하지 않는 발코니는 세탁 건조 수납 이외에 유사시 피난을 위해 사용할 수 있도록 계획할 방침이다. 맞춤형 신혼부부 주택은 올해 사업승인을 받는 단지 즉 내년 초에 분양하는 단지들부터 적용될 전망이다.,https://news.naver.com/main/read.nhn?mode=LSD&mid=shm&sid1=260&oid=016&aid=0000278415,135
98236,2008.08.07. 오후 12:46,부동산,헤럴드경제,서울 재건축 아파트 급락,정부의 재건축 규제완화 방침에도 불구하고 지난달 서울 재건축 아파트 시장은 오히려 강남권을 중심으로 올 들어 최대 낙폭을 기록했다. 이는 규제완화에 대한 구체적인 계획이 나오지 않고 세제 및 용적률 완화 등 실거래로 이어질 정책이 뒷받침 되지 못한 탓으로 풀이된다. 부동산정보업체 스피드뱅크가 지난 7월 한달 간 서울지역 재건축 매매가 변동률을 조사한 결과 마이너스 0.61%로 올들어 월간 기준 하락폭이 가장 컸다. 정부가 ▷조합원지위 양도금지 ▷소형주택건설 의무비율 ▷재건축 초과이익 부담금 등 규제완화 방안과 분양가 상한제 보완에 대한 입장을 밝혀 일부 재건축 단지에서 반짝 거래가 이어지기도 했으나 매수자들의 관망세가 짙었기 때문인 것으로 보인다. 특히 강남권은 4개구 강남 강동 서초 송파 가 모두 4개월 연속 내림세를 보여 하락세를 이끌었다. 송파구 3.76% 강동구 2.09% 강남구 1.57% 서초구 0.29% 순으로 향후 동향을 주시하는 수요층이 늘어나면서 규제완화 약발이 좀처럼 먹히지 않는 분위기다. 송파구의 경우 올 여름 잠실 일대 대규모 입주가 강남권 집값 약세를 굳혔다. 최근 잠실 리센츠 주공 2단지 등의 입주가 본격화되면서 잠실주공5단지의 경우 극심한 매수 침체가 이어지는 가운데 119㎡ 36평형 가 한 달간 무려 1억원 떨어진 12억 12억5000만원 선이다. 조합원 추가분담금 문제로 사업이 제자리 걸음을 걷고 있는 가락동 가락시영도 하락세가 지속된 가운데 1차 56㎡ 17평형 기준 6억 6억2000만원선으로 2000만원이나 미끄러졌다. 강동구도 급매물이 적체되는 양상을 나타내고 있지만 매수문의는 여전히 뜸하다. 상일동 고덕주공3단지 52㎡ 16평형 의 경우 3000만원이 빠진 4억9000만 5억2000만원 선에 시세가 형성됐다. 강남구도 규제완화 발표에도 불구하고 향후 동향을 지켜보겠다는 매수층이 많아 거래실종이 장기화되고 있다. 대치동 은마아파트 112㎡ 34평형 의 경우 11억2000만 12억원선으로 4000만원 내렸다.,https://news.naver.com/main/read.nhn?mode=LSD&mid=shm&sid1=260&oid=016&aid=0000278414,135
98237,2008.08.07. 오후 12:46,부동산,헤럴드경제,서울시 재개발 임대 공급체계 개편,서울시는 임대주택에 관련된 정보를 실시간으로 공유하고 간편하게 임대 주택을 선택할 수 있는 인터넷 홈페이지를 구축할 예정이라고 7일 밝혔다. 서울시 SH공사 홈페이지 www.i sh.co.kr 에 개설될 이 홈페이지를 통해 서울시는 111개 임대 아파트 단지 위치와 건축년도 임대료 정보는 물론 빈 집 현황을 실시간으로 업데이트할 예정이다. 시민들은 홈페이지를 검색 임대 주택에 빈집이 생길 경우 실시간으로 언제 어디서든 홈페이지를 통해 입주 신청을 할 수 있게 된다. 서울시는 현재 총 111개의 재개발.재건축 단지에 4만6514가구의 임대 주택을 관리하고 있으며 매년 7.3% 이상의 빈집이 발생하고 있다. 하지만 현재의 공급자 위주 정보시스템으로 인해 시민들이 정보부족을 호소 원할한 임대 주택으로의 거주 이전이 이뤄지지 않고 있다. 시는 이번 홈페이지 개설을 통해 임대 주택의 빈 집 감소 임대료 등 세입 증가의 긍정적 효과를 기대하고 있다. 서울시 관계자는 “공급자에서 수요자로 수동적 행정에서 능동적 행정으로의 방향으로 이번에 공급 시스템을 개편했다”며 “이를 통해 재개발 세입자가 원하는 지역과 재정 형편에 맞는 주택을 선택할 수 있을 것”이라고 말했다.,https://news.naver.com/main/read.nhn?mode=LSD&mid=shm&sid1=260&oid=016&aid=0000278413,135
98238,2008.08.07. 오후 12:46,부동산,헤럴드경제,현대엔지니어링 올 상반기 매출ㆍ영업익등 100% 신장,현대엔지니어링이 올 상반기 수주와 매출 영업이익에서 모두 100% 이상 신장하는 등 깜짝실적을 기록했다. 6일 현대엔지니어링 대표이사 사장 김중겸 에 따르면 올 상반기 수주는 전년 동기 대비 131% 성장한 8192억원을 기록했다. 매출은 110% 성장한 2981억원 영업이익은 110% 늘어난 324억원을 각각 달성했다. 특히 영업이익은 지난해 연간 실적 334억을 상반기에 모두 달성했고 창사 이래 처음으로 영업이익률 11%대를 기록하는 성과를 거뒀다. 해외프로젝트의 환차익 등 영업외 수익부문에서도 성과를 거둬 경상이익률이 매출액 대비 13%대를 기록했다. 이는 업계 평균 8 9%보다 크게 높은 것이다. 이 회사 관계자는 “현재 세계적으로 플랜트 시장이 활황을 보이고 있어 올 사업목표인 수주 1조5000억 매출 7000억 영업이익 700억은 무난히 달성할 것”이라고 말했다.,https://news.naver.com/main/read.nhn?mode=LSD&mid=shm&sid1=260&oid=016&aid=0000278412,135
98239,2008.08.07. 오후 12:46,부동산,헤럴드경제,중동 최대 종합병원 공사 포스코건설 1억3500弗 수주,포스코건설은 중동 최대의 종합병원 건설 공사를 1억 3500만 달러에 수주했다고 7일 밝혔다. 쿠웨이트 시티 남수라 South Surra 에 건설될 이 병원은 지하 3층 지상 13층 연면적 66만㎡의 규모로 총 병상이 1150개에 달한다. 포스코건설은 쿠웨이트 대형건설사인 SHBC와 컨소시엄을 구성 이번 사업을 수주했으며 공사 및 CM 분야에 참여하게 된다. 이번 공사는 올해 말 착공 2011년 7월 준공을 목표로 하고 있다. 포스코 건설 관계자는 “중국 이집트 터키 등 해외 대형 건설사와의 경쟁 입찰을 거친 결과”라며 “향후 잇따르게 될 오일 달러를 바탕으로 한 중동 지역의 대형 건설사업 발주에 있어 많은 성과로 이어질 것으로 본다”고 말했다.,https://news.naver.com/main/read.nhn?mode=LSD&mid=shm&sid1=260&oid=016&aid=0000278411,135
98240,2008.08.07. 오후 12:46,부동산,헤럴드경제,부동산 상황관리 시스템 감정원ㆍ국토연 공동개발,한국감정원은 부동산시장의 각종 돌발변수를 사전에 예측 대응할 수 있는 ‘부동산시장 상황 관리 시스템’을 국토연구원과 함께 공동 개발한다고 7일 밝혔다. 이 시스템은 주택과 토지 상업용 부동산의 가격과 시장행태는 물론 주요 부동산 정책의 영향과 성과 등을 데이터베이스로 구축하는 것으로 부동산시장 상황 파악과 전망에 사용될 예정이다. 이에 따라 새로운 시스템을 통해 부동산시장에 대한 거시적인 시각과 미시적인 분석까지 가능할 것으로 감정원 측은 기대하고 있다. 연구원과 감정원은 11월까지 1차 시범사업 결과를 발표한 후 2009년에 전국 단위로 적용 범위를 확대할 계획이다.,https://news.naver.com/main/read.nhn?mode=LSD&mid=shm&sid1=260&oid=016&aid=0000278410,135
98241,2008.08.07. 오후 12:45,부동산,이데일리,한국주택協 국내부동산규제 OECD국가중 최고,이데일리 윤진섭기자 우리나라가 OECD 경제협력개발기구 주요 국가 가운데 주택을 비롯한 부동산분야 규제가 최고 수준이라는 지적이 제기됐다. 한국주택협회 회장 신훈 는 7일 국내 연구보고서와 OECD 보고서를 기초로 주요 국가별 세제·금융 관련 제도를 비교한 결과 이 같이 나타났다고 밝혔다. 협회가 밝힌 자료에 따르면 OECD 국가 중 민간업체들이 공급하는 주택에 분양가상한제와 분양가내역 공시 전매제한 등의 규제를 시행하는 국가는 우리나라가 유일하다. 거래세는 OECD 주요 국가 대부분이 취득세가 없고 등록세 또는 인지세 stamp duty 만 부과하고 있는 반면 우리나라는 취·등록세와 농특세 및 지방교육세 등 다양하게 부과하고 있다고 협회는 설명했다. 보유세와 관련해 협회는 OECD 주요국가 대부분은 개인별로 산정하고 부채를 제외한 금액이나 증가한 자산분에만 세금을 부과하는 등 우리나라와 같은 종부세가 없다고 밝혔다. 전체 조세에서 재산세가 차지하는 비율도 우리나라는 11.9%로 OECD국가 평균 5.6% 의 배를 넘어선다. GDP 국내총생산 대비 재산세 비중은 3%로 OECD 30개 국가 가운데 6위다. OECD 주요국은 통상 LTV 주택담보대출비율 를 특별히 규제하지 않고 80% 수준 이상을 유지하는데 비해 우리나라는 40 60%수준으로 강도가 상대적으로 높다고 주택협회는 주장했다.,https://news.naver.com/main/read.nhn?mode=LSD&mid=shm&sid1=260&oid=018&aid=0002005789,135
98242,2008.08.07. 오후 12:40,부동산,이데일리,재테크광고계곡앞 2000만원대 토지매각 재테크펜션민박형부지 한정매각,토지매각 최초 개발촉진지구내 관리지역 선착순 분양 개발촉진지구란 이데일리 제천시와 한국토지공사가 제안하고 건설교통부가 지정한 곳으로 저평가된 지역에 개발을 촉진하기위해 관광산업개발 스키장 골프장 워터파크 지역명소와 연계된 리조트 및 펜션사업 및 지역특화사업 웰빙 약초 에코세라피 체험마을과 연계된 리조트 및 펜션사업 등에 관한 개발 행위에 대하여 시에서 적극 권장함으로 투자가치가 높은 지역이다. 주 청풍개발은 제천IC에서 10분거리에 있는 개발촉진지구내 재테크 펜션수익형부지를 3.3㎡당 55 000원 159 000원으로 2 000 3 000만원대 한정매각 한다. 이번 매각토지는 아스팔트도로와 접한 계곡 바로 옆에 위치한 남향의 관리지역과 농림지역으로 향후 투자만 해도 재테크의 가치가 높을것으로 예상되고 추천용도로는 관광숙박 전용용지 민박 및 펜션 전원휴양주택 주말전용 세컨드하우스 테마하우스 등으로 회사측은 전하고 있다. 043 642 1012 개발촉진지구내 토지거래허가제외지역이며 많은 관광객으로 넘치는 탁사정계곡과 입구에 위치해 있고 안중 평택에서 출발하는 동서고속도로 중앙선인 원주와 제천을 연결하는 철도복선화 개발촉진지구내에 들어서는 스키장 슬로프 6개 골프장 63개홀 물류유통센터 에코세라피 건강특구 스파 휴양의 테마로한 대규모 리조트가 5년안에 완공이 되면 관광객의 수가 660만명 2006년기준 에서 1 000만명 이상 증가함으로 충북의 관광메카가 될 것으로 예상된다. 또한 인근 제천바이오밸리 및 연수원타운이 완공되면 약 12 000여명 고용이 발생하게 되고 2010년 한방바이오엑스포가 개최되면 지역경제가 활성화되어 주변토지 시세가 2 3배 상승이 기대되는 지역이다. 분양절차는 신청금 100만원 신한은행 110 247 903443 예금주 조현묵 법무사로 입금 필지 배정 후 현장답사를 통해 계약을 결정하면 된다. 소유권 이전등기는 물론 분양에 대한 모든 자금 관리는 조현묵 법무사에서 관리 하며 미 계약시 신청금도 법무사에서 책임지고 100% 환불 한다. 개발촉진지구내 2 000 3 000만원대로 재테크할 수 있는 투자의 마지막 기회이므로 서둘러야 할 것으로 예상된다.,https://news.naver.com/main/read.nhn?mode=LSD&mid=shm&sid1=260&oid=018&aid=0002005788,135
98243,2008.08.07. 오후 12:07,부동산,머니투데이,한국 부동산규제 OECD국가중 최고,머니투데이 문성일 기자 주택協 OECD보고서 등 인용 발표…세제·금융등 규제 심해 우리나라가 OECD 경제협력개발기구 주요 국가 가운데 주택을 비롯한 부동산분야 규제가 최고 수준이라는 지적이 제기됐다. 한국주택협회 회장 신훈 는 7일 국내 연구보고서와 OECD 보고서를 기초로 주요 국가별 세제·금융 관련 제도를 비교한 결과 이 같이 나타났다고 밝혔다. 협회에 따르면 OECD 국가 중 민간업체들이 공급하는 주택에 분양가상한제와 분양가내역 공시 전매제한 등의 규제를 시행하는 국가는 우리나라가 유일하다. 거래세 관련 OECD 주요 국가 대부분이 취득세가 없고 등록세 또는 인지세 stamp duty 만 부과하고 있는 반면 우리나라는 취·등록세와 농특세 및 지방교육세 등 다양하게 부과하고 있다. 보유세의 경우 OECD 주요국가 대부분은 개인별로 산정하고 부채를 제외한 금액이나 증가한 자산분에만 세금을 부과하는 등 우리나라와 같은 종부세가 없다는 게 협회의 설명이다. 이 같은 종부세와 재산세를 합칠 경우 우리나라는 독일과 함께 최고 세율 3.5% 을 부과하고 있다. 전체 조세에서 재산세가 차지하는 비율도 우리나라는 11.9%로 OECD국가 평균 5.6% 의 배를 넘어선다. GDP 국내총생산 대비 재산세 비중은 3%로 OECD 30개 국가 가운데 6위다. OECD 평균은 1.9%. 양도소득세 역시 우리나라는 1가구2주택자 이상에 대해 50% 이상을 부과하는 등 최대 70%까지 중과세율을 적용하고 있어 OECD 주요국가에 비해 지나치게 높다고 협회는 지적했다. OECD 주요국은 통상 LTV 주택담보대출비율 를 특별히 규제하지 않고 80% 수준 이상을 유지하는데 비해 우리나라는 40 60%수준으로 강도가 상대적으로 높다. 협회는 OECD가 지난해와 올해 검토보고서를 통해 세제를 주택가격 통제수단으로 이용하지 말 것을 비롯해 민간의 주택공급관련 규제완화 분양가상한제 등과 같은 규제는 단계적으로 폐지할 것을 권고했다며 정부도 이를 받아들여야 한다고 밝혔다. 협회 관계자는 우리나라도 OECD 국가와 같이 글로벌 스탠다드에 걸맞는 자유시장 경제원리로 빠른 시일 내에 회복될 수 있도록 조속히 개선돼야 한다 고 말했다.,https://news.naver.com/main/read.nhn?mode=LSD&mid=shm&sid1=260&oid=008&aid=0002018933,135
