,date,cat,co,headline,text,url,week
26314,2006.10.03. 오후 5:41,부동산,매일경제,집 살때는 취득ㆍ등록세 팔때는 양도세 고려,집을 사고팔 때 고려해야 할 가장 큰 문제가 바로 세금이다. 매도자는 양도세를 꼼꼼히 따져봐야 하고 매수자는 취득ㆍ등록세까지 고려해 자금계획을 세워야 한다. 2주택자 올해 처분하는 게 유리 실거래가 과세원칙이 2007년부터 전면적으로 도입되고 올해도 대부분 실거래가액으로 양도세가 계산된다. 단 고가주택이 아닌 한 채의 주택을 비투기지역에서 1년 이상 보유한 후 매각하는 경우는 기준시가로 양도세를 낼 수 있다. 2주택자는 올해 어떤 주택을 양도하든지 실거래가로 양도세가 계산되고 기본 세율 9 36% 이 적용된다. 2주택자가 내년에 매각할 때는 장기보유특별공제가 배제되고 중과세율 50% 이 적용돼 세부담이 급증하게 된다. 양도가액이 실거래가액으로 계산되기 때문에 양도차익 중 비용으로 인정되는 부분에 관심이 높다. 비용으로 공제되는 부분은 주택을 취득할 당시 중개수수료 취득세ㆍ등록세 법무사 수수료 및 부대비용 국민채권 할인액 인테리어 비용 등이 포함된다. 취득가액 실거래가로 신고해야 올해 1월 1일부터 부동산 실거래가 신고제 가 시행돼 거래세도 실거래가 기준으로 내야 한다. 실거래가 신고는 계약 후 30일 이내에 시ㆍ군ㆍ구에 해야 하는데 인터넷 부동산거래관리 시스템 을 이용해도 되고 구청을 직접 방문해 취득 사실을 신고해도 된다. 올해 9월부터 개인간 주택 거래시 거래세율은 2.5% 취득세 1.5% 등록세 1% 에서 2% 취득세 1% 등록세 1% 로 0.5%포인트 내리게 됐다. 부동산을 취득한 사람은 취득일로부터 30일 이내 취득세를 신고납부해야 한다. 이를 이행하지 않으면 20%의 가산세가 붙는다.,https://news.naver.com/main/read.nhn?mode=LSD&mid=shm&sid1=260&oid=009&aid=0000535081,39
26315,2006.10.03. 오후 5:41,부동산,매일경제,아산신도시 분양…이달 하순 1102가구,오는 2015년까지 주택 5만8000가구가 들어설 아산신도시 아파트 분양이 이달 하순부터 시작된다. 건설교통부는 중부권 거점도시로 건설중인 아산신도시 주택 공급을 위한 분양공고를 오는 25일 내고 다음달 1일부터 사흘간 청약 접수에 나선다고 밝혔다. 이번 공급 주택은 분양면적을 기준으로 29평형 334가구 33평형 768가구 등 1102가구다. 청약자격은 천안과 아산에서 6개월 1년 이상 거주한 무주택 가구주로 제한될 것으로 보인다. 건교부 관계자는 이번 물량은 주택공사에서 공급하는 것으로 분양가 상한제가 적용돼 상대적으로 저렴할 것 이라며 현지 운영중인 홍보관 내부에 오는 25일까지 모델하우스를 설치할 계획 이라고 말했다. 고속철도 천안ㆍ아산역을 중심으로 개발중인 아산신도시는 분당신도시 594만평 보다 큰 621만평 1단계 111만평 2단계 510만평 의 대규모 개발지구다. 1단계 지역에서는 올해 분양물량을 포함해 2009년까지 약 8600가구를 연차적으로 공급 2007년 3300가구 2008년 1500가구 2009년 2700가구 할 계획이다. 이후 2단계 지역은 개발계획 수립 등 관련 절차를 2009년까지 완료하고 2010 2015년 약 5만가구를 분양해 총 5만8000여 가구를 공급한다는 방침이다. 아산신도시는 선진국 수준의 공원ㆍ녹지 조성과 수도권 내 2 3개 대학 유치 등을 추진하고 있다.,https://news.naver.com/main/read.nhn?mode=LSD&mid=shm&sid1=260&oid=009&aid=0000535080,39
26316,2006.10.03. 오후 5:41,부동산,매일경제,토공 가상설계 모음집 발간,한국토지공사가 가상건축 설계 모음집을 발간했다. 한국토지공사에서 분양하는 토지에 이런 건축물을 지을 수 있어요 라는 제목의 이 책은 용인 동백지구 등 10개 개발사업지구 내 단독주택지ㆍ근린생활지ㆍ상업용지 등 다양한 분양토지를 선정해 사례별 지역현황 건축계획 건축비 분석 내용을 담았다. 이 모음집을 보려면 토공 인터넷 홈페이지 www.iklc.co.kr 에 접속해 알림마당 공지사항 에 들어가면 된다.,https://news.naver.com/main/read.nhn?mode=LSD&mid=shm&sid1=260&oid=009&aid=0000535077,39
26317,2006.10.03. 오후 5:09,부동산,파이낸셜뉴스,아산신도시아파트 25일 첫 분양,중부권 거점 도시로 육성될 경부고속철도 천안아산역세권의 충남 아산신도시 위치도 에서 오는 25일부터 아파트분양이 시작된다. 2단계로 나눠 개발되는 아산신도시에서는 2015년까지 아파트 5만8000여가구가 공급될 예정이다. 건설교통부는 수도권의 인구 및 기능분산과 국가균형발전을 위해 중부권 거점도시로 건설 중인 아산신도시 1단계 사업지구인 배방지구 111만평 3블록 및 8블록에 짓는 대한주택공사의 주공아파트 1102가구에 대한 분양을 개시한다고 3일 밝혔다. 이번 공급분은 아산신도시에서 첫 공급되는 물량으로 25일 분양공고 후 11월1일부터 3일간 청약접수하고 13일 당첨자를 발표한다. 블록별 공급물량은 3블록 378가구 8블록 724가구이며 평형별로는 29평형 334가구 33평형 768가구다. 이번에 공급되는 아파트는 택지비에 표준건축비와 가산비용 등을 더해 산정되는 ‘분양가상한제’가 적용되며 분양가는 이달 중·하순께 결정된다. 특히 아산신도시 일대는 투기과열지구로 지정돼 있어 계약체결 후 5년 간은 전매가 금지된다. 청약자격은 충남 천안과 아산시에 6개월∼1년 이상 계속해 거주한 무주택 세대주로 제한된다. 공급물량의 10% 110가구 는 국가유공자 등에게 특별공급되며 3% 33가구 는 3자녀를 둔 세대에게 공급된다. 현재 천안과 아산지역 청약저축 가입자는 1만가구에 달해 모집 경쟁률이 치열할 것으로 예상된다. 견본주택은 입주자 모집 공고일인 25일부터 공개된다. 건교부는 이번 분양을 시작으로 아산신도시 1단계 지역에서 오는 2009년까지 8600가구를 공급할 예정이다. 연도별로는 2007년 3300가구 2008년 1500가구 2009년 2700가구 등이다. 이어 2단계 지역에 대해서는 개발계획수립 등 관련 절차를 오는 2009년까지 완료하고 2010년부터 2015년까지 5만가구를 추가로 공급한다.,https://news.naver.com/main/read.nhn?mode=LSD&mid=shm&sid1=260&oid=014&aid=0000249138,39
26318,2006.10.03. 오후 5:06,부동산,서울경제,부동산 중개수수료에 별도 부가세 10% 소비자가 부담해야,재경부·법제처 유권해석 3억원 거래시 현재 120만원 수수료 지불하면 되나 앞으로는 120만원 외에 12만원 10% 등 132만원 부담해야 앞으로 소비자들은 중개업소를 통해 거래할 때 중개수수료 외에 10%의 부가세를 별도로 물어야 한다. 현재는 3억원짜리 주택을 매매할 경우 사고 파는 사람은 각각 120만원의 수수료를 부담하면 됐으나 앞으로는 10%의 부가세 12만원 를 추가로 내야 해 소비자들의 부담이 가중되는 셈이다. 부가세 별도 징수는 실거래가 거래 확대로 중개업소의 수입이 늘면서 부가세를 내야 하는 사업장도 급격히 늘어 올 하반기부터 뜨거운 논란거리가 돼왔다. 중개업 단체는 소비자에게 부가세를 별도로 받아야 한다고 주장하고 주무부처인 건설교통부는 불가 입장을 견지하면서 지난 8월 중순 관계당국에 정식으로 유권해석을 의뢰해놓은 상태다. 3일 재정경제부와 법제처 등에 따르면 건교부가 올린 유권해석 의뢰에 대해 공인중개사가 법정 수수료를 초과하는 부가세를 수령하는 것은 법에 위반되지 않는다고 최종 판결했다. 관계당국은 유권해석에서 공인중개가사 용역 제공의 대가로 받는 중개수수료에 부가세가 포함돼 있다는 규정이 없다고 설명했다. 이에 따라 부가세를 해당 법 제15조에 따라 별도로 용역을 제공받는 의뢰인 소비자 이 부담해야 한다고 결정했다. 당초 주무부처인 건교부는 중개수수료에 부가세가 포함돼 있다며 중개업 단체의 논리를 반박해왔다. 재경부의 한 관계자는 “수수료에 부가세가 포함돼 있지 않다면 부가세법에 따라 소비자가 부담하는 것이 옳다”고 설명했다. 한편 이번 유권해석으로 앞으로 중개업소를 통해 물건을 사고 팔 때 지불하는 비용이 현재보다 10% 이상 늘어나게 돼 결국 소비자들만 피해를 볼 것이라는 지적이 강하게 제기되고 있다.,https://news.naver.com/main/read.nhn?mode=LSD&mid=shm&sid1=260&oid=011&aid=0000151951,39
26319,2006.10.03. 오후 5:03,부동산,파이낸셜뉴스,대전 서남부신도시 2만813가구 공급,대전 서남부 신도시 1단계지구에 들어서는 아파트 2만813가구가 내년부터 연차적으로 나뉘어 공급된다. 대전시는 지역의 주택 공급과잉을 막기 위해 서남부 1단계 택지개발지구의 공동주택을 2007∼2011년에 단계별로 나눠 공급한다고 3일 밝혔다. 서남부 1단계 택지개발사업지구는 현재 토지보상이 90% 이상 마무리됐으며 학교 수 축소조정 및 환경기초시설 설치를 위한 개발계획 변경 등의 절차를 진행 중이다. 대전시 관계자는 “서남부 아파트 공급은 동구·중구 등 옛 도심 재개발 등 각종 개발사업을 봐가며 진행할 계획”이라면서 “주택과잉 공급에 따른 미분양 사태 등 기존 도심권 재개발사업의 부작용을 막기 위한 조치”라고 말했다. 연차별 공동주택 공급시기 및 가구수는 △2007년 4716가구 △2008년 5440가구 △2009년 4927가구 △2010년 4501가구 △2011년 1229가구 등이다. 서남부 1단계지구 내 공동주택은 국민임대주택 규모의 18평형 60㎡ 이하 5730가구 18∼25.7평형 60∼85㎡ 8173가구 25.7평 85㎡ 초과 6910가구가 건설된다. 대전시는 이를 위해 각종 중장기 신규 개발사업과 재개발 사업에 따른 주택공급 수요 및 인구주택관련 통계자료 등을 종합적으로 분석 활용할 방침이다. 또 대규모 택지개발사업인 서남부 1단계 주택공급을 적정 배분하는 것과 병행해 현재 자연녹지지역의 도시기본계획상 주거지역의 개발도 오는 2010년 이후로 조정할 계획이다. 대전시는 2005년 인구주택센서스 결과와 각종 통계지표 및 개발사업 등을 종합적으로 고려할 때 매년 1만∼1만2000가구 정도의 주택공급이 적정한 것으로 보고 있다 대전시 관계자는 “서남부 1단계 공동주택 공급이 특정 연도에 편중되면 미분양 사태 등 과잉 공급으로 인한 사회적인 문제가 발생할 수 있다”면서 “각종 개발사업과 공급시기를 차별화해 원도심권 내 각종 재개발사업이 위축되지 않도록 하겠다”고 말했다. 한편 유성구 학하동 일대 8만6000평에 조성되는 서남부 1단계 택지개발사업은 올 연말 대전도시개발공사의 시공업체 선정을 시작으로 내년 1월께 본격 착공될 예정이다.,https://news.naver.com/main/read.nhn?mode=LSD&mid=shm&sid1=260&oid=014&aid=0000249132,39
26320,2006.10.03. 오후 5:00,부동산,파이낸셜뉴스,주공 경기지역본부 포도수확 돕기,대한주택공사 경기지역본부 본부장 성운기 는 최근 자매결연 마을인 경기 화성시 홍법리의 한 농가에서 포도 수확돕기 봉사활동을 가졌다. 이번 행사는 6개조로 편성된 직원 70여명이 하룻동안 5㎏들이 1000여상자의 포도를 수확해 전량 구입했다. 주공 임직원들이 포도 수확에 땀을 흘리고 있다.,https://news.naver.com/main/read.nhn?mode=LSD&mid=shm&sid1=260&oid=014&aid=0000249130,39
26321,2006.10.03. 오후 5:00,부동산,파이낸셜뉴스,추석 연휴“고향부동산 점검하세요”,추석 명절이면 오랜 만에 가족들이 모여 대대로 물려받은 전답 주택 묘지 등 고향 부동산에 대한 이야기를 나누게 마련이다. 특히 세대별 합산과세로 인한 종합부동산세 강화로 보유세 부담이 커진 데다 내년부터는 양도세 중과조치가 시행되기 때문에 올해 추석은 고향 부동산을 다시 한번 점검하고 처리 방안을 논의하는 시간을 가질 필요가 있다. 개발 호재 있는 고향땅 보유하라 8·31 대책 이후 토지는 취득에서부터 개발 보유 양도까지 모든 관련 규제가 강화됐다. 하지만 장기적인 관점에서 본다면 개발재료가 분명한 곳은 가격 상승세가 이어질 전망이므로 보유할 필요가 있다. 개발재료가 풍부해 장기보유할 지역으로 경기지역에선 △파주시 LG필립스LCD공장 출판문화정보산업단지 파주신도시 △평택시 용산기지이전·평화신도시개발 평택항 포승국가산업단지 경부선 복복선전철 △용인시 각종 택지개발 판교 수혜 분당선·신분당선 연장 및 경전철사업 △화성시 동탄신도시 삼성반도체공장 증설 △천안·아산시 고속철 아산신도시 행정중심복합도시 후광 효과 등을 꼽을 수 있다. 또 강원지역에서는 △원주시 구곡·만대·무실·단관지구 등 택지개발 및 중앙선 복선화연장 기업·혁신도시 △평창군 레저수요 펜션 및 전원주택수요 등이다. 제주지역도 제주국제자유도시 개발 등의 호재를 갖고 있다. 이런 식으로 명확한 개발 재료가 있는지 살펴보고 보유 여부를 결정해야 한다. 하지만 전반적으로 토지관련 세금과 토지거래허가구역 관련규제가 강화됐다는 점을 유의해야 한다. 내년부터는 토지매각 때 부재지주 농지·임야·목장용지 비사업용토지 나대지와 잡종지 의 양도세율이 현재 9∼36%에서 60%로 높아진다. 또 장기보유 특별공제 10∼30% 도 받을 수 없게 된다. 땅값 상승을 기대하기 어렵다면 세금 중과 전인 연내에 처분하는 것이 좋을 수도 있다. 토지 취득하려면 규제 면밀히 살펴라 새로 토지를 취득하려면 바뀐 규정을 따져봐야 한다. 개발 재료가 분명한 곳은 대부분 토지거래허가구역으로 묶여 있다. 이런 땅은 가구주와 전 세대원이 해당 지역 시·군에서 1년 이상 거주해야 살 수 있고 취득자금 조달 계획도 제출해야 한다. 따라서 고향에 부모나 친지가 거주할 경우 공동투자하는 방안도 검토해 볼 필요가 있다. 또 토지거래허가구역의 농지는 취득 후 2년 개발사업용 토지는 4년 임야는 3년 수확물이 없는 경우5년 이전에는 전매할 수 없다. 만약 땅을 허가받은 대로 활용하지 않으면 공시지가의 5∼10%의 이행강제금이 부과된다. 외지민이 소유한 주말농장 303평 이하 은 부재지주의 양도세 중과 대상에서 제외되고 취득도 비교적 자유롭기 때문에 관심을 가질 만하다. 농어촌 주택구입 비과세 혜택 따져야 최근 농어촌 주택에 관심을 가진 투자자들이 늘어나는 추세다. 농어촌주택 취득자에게는 오는 2008년 말까지 종전주택을 팔아도 양도세가 비과세되는 과세 특례제도가 적용되기 때문이다. 하지만 아무 시골집이나 양도소득세 비과세 혜택을 누릴 수 있는 것은 아니다. 지역적으로는 수도권 및 광역시와 토지거래허가구역 투기지역 관광단지 개발지역 등은 대상에서 제외된다. 또 대지면적 660㎡ 200평 이하 기준시가 7000만원 이하 건평 40평 이하 등의 요건도 충족해야 한다. 게다가 농가주택을 3년 이상 보유요건을 충족해야 일반주택 양도시 비과세 혜택을 받을 수 있다. 종중땅은 공동명의로 돌려놔야 가끔 종중 땅을 종손명의로 단독 등기해 둬서 매도·상속·증여로 속을 썩이는 경우가 있다. 아직 팔지 않은 땅은 소유권 이전 등기청구소송을 통해 종중 명의로 찾을 수 있다. 하지만 이미 선의의 제3자에게 넘어간 종중 땅은 원인무효소송을 해도 되찾기 힘들다. 이 경우에 대비해 종중 땅은 종중 또는 공동명의로 돌려놓는 것이 좋다. 종중재산은 민법상 총유에 해당해 사원총회를 통해서 매각하게 돼 있으므로 선대재산을 지킬 수 있는 좋은 방법이다. 이밖에 시골에는 지적공부와 측량 기술이 부정확해 이웃 땅을 침범하거나 땅이 뒤바뀐 경우도 적지 않은 만큼 미리 등기 여부나 측량 관리 현황 등을 점검해 놓는 게 바람직하다.,https://news.naver.com/main/read.nhn?mode=LSD&mid=shm&sid1=260&oid=014&aid=0000249129,39
26322,2006.10.03. 오후 5:00,부동산,파이낸셜뉴스,9월 전셋값 상승률，3년6개월만에 최고치,지난달 전국의 아파트 전셋값 상승률이 0.8%로 3년6개월 만에 최고치를 기록했다. 경기 용인시 기흥읍은 이 기간 3.6%나 올라 전국 최고 상승률을 보였고 경기 파주 2.9% 와 서울 은평·중랑구 이상 2.3% 경기 고양시 덕양구 2.7% 및 과천시 2.8% 등 수도권 대부분 지역에서 초강세를 보였다. 주택 매매가격 상승률도 0.5%로 전달 0.2% 에 비해 상승폭이 커졌다. 3일 국민은행이 발표한 ‘전국주택가격 동향조사’에 따르면 9월 전국 전셋값은 매수 대기자의 전세수요 전환 가을 이사철로 인한 계절적 수요 증가로 무려 0.8%나 올랐다. 이는 지난 2003년 3월 같은 폭의 상승률을 기록한 이래 최고치다. 지역별로는 서울의 경우 강북 1.3% 이 강남 1.2% 을 능가했고 울산 1.6% 경기 1.5% 인천 0.9% 전남 0.7% 의 오름세가 두드러졌다. 전셋값이 2% 이상 급등한 시·군·구는 대구 달성 2.9% 울산 북 3.1% ·동 2.7% 경기 수원시 장안 2.1% ·권선 2.5% 구리시 2.2% 용인시 처인구 2.2% 및 수지구 2.2% 화성시 2.5% 충남 공주시 2% 등 16곳에 달했다. 전셋값은 중·소형 0.9% 이 대형 0.6% 에 비해 상승률이 높았다. 주택매매가격은 경기와 울산이 각각 1% 올랐고 서울도 0.8%상승해 전국 평균 상승률을 웃돌았다. 특히 경기 부천시 오정구 2.9% 와 고양시 덕양구 2.7% 구리시 2.3% 부천 소사구 2% 서울 양천 1.9% ·강서·동작 이상 1.3% 경기 수원시 팔달구 1.9% 울산 북구 1.6% 등이 많이 올랐다. 이에 비해 충남 공주 0.8% 대전 대덕 0.7% 대전 서 부산 사상 대구 수성 이상 0.5% 경기 성남 분당 0.1% 등은 하락세를 보였다. 국민은행 관계자는 “중개업소 설문 결과 9월 들어 주택 매매시장에서 ‘매수세 우위’가 늘어난 데 비해 ‘매도 우위’는 줄었다”고 말했다.,https://news.naver.com/main/read.nhn?mode=LSD&mid=shm&sid1=260&oid=014&aid=0000249128,39
26323,2006.10.03. 오후 5:00,부동산,파이낸셜뉴스,추석 연휴 견본주택 나들이 오세요,‘추석 대목시장을 잡아라.’ 아파트 분양시장에도 추석마케팅이 실시돼 관심을 끌고 있다. 최근 수도권 및 지방 곳곳에서 아파트 분양을 시작한 건설사들이 한가위 연휴 기간에도 견본주택을 정상오픈하는 등 가족 단위의 고객을 잡기 위해 분주한 모습이다. 특히 계속되는 분양 시장 침체로 일부 지역의 경우 초기 계약률이 20∼30%대에 머무를 정도로 심각한 상황이어서 이 건설사들은 어느 때보다 긴 이번 명절을 지역주민 뿐만 아니라 고향을 찾는 귀성객에게 브랜드를 알리고 미분양 물량을 떨어낼 수 있는 좋은 기회로 활용한다는 전략이다. 수도·충청권 서울에서는 최근 22∼43평형 181가구를 분양 평균 경쟁률이 3.1대 1을 기록했던 성북구 정릉동 e 편한세상이 추석 당일만 쉬고 연휴기간 모델하우스 문을 연다. 특히 정릉 e 편한세상 견본주택은 다른 곳에서는 보기 드문 실용적인 인테리어로 차별화해 내집마련뿐만 아니라 인테리어에 관심이 있는 사람들도 찾을 만하다. 현재 22평형과 23평형 저층 일부 물량을 선착순으로 계약하고 있다. 경기 부천시 역곡동의 한양수자인도 현장 분양사무소를 연휴 내내 열고 상담을 받는다. 총 206가구 중 1∼3단지 76가구를 일반에 분양하고 있다. 특히 1 2차는 오는 11월에 입주한다. 경기 이천시 갈산동의 현진에버빌도 6일과 7일 이틀만 쉬고 나머지 기간 모두 모델하우스를 오픈한다. 평형은 35평형부터 56평형까지 다양하게 갖추고 있다. 인천 남동구 서창동의 서창자이 역시 추석 당일인 6일을 제외하고 전부 오픈한다. 34∼51평형 아파트 500가구로 이뤄져 있으며 저층 일부가 현재 미분양 상태다. 충청권에서는 행정도시 인근인 충남 공주시 금학동 e 편한세상과 연기군 조치원읍 죽림리 조치원자이가 연휴기간 문을 연다. 34∼57평형 476가구 중 현재 30%가량이 남아 있다. 특히 33평형의 경우 6∼7층 등 로열층도 선택할 수 있다. 이 아파트 모델하우스 관계자는 “폐관 없이 연휴기간 모두 문을 열기로 했다”면서 “계약자들이 명절을 맞아 찾아온 자녀들과 함께 재확인차 방문하거나 신규 수요자들도 상당수 찾아올 것으로 기대하고 있다”고 말했다. 죽림리의 조치원자이도 6일 하루만 빼고 연휴 동안 문을 연다. 총 1429가구로 현재 50%가량이 남아 있다. 호남·영남권 호남지역에서는 광주 수완지구와 전북 군산시 수송지구에 한꺼번에 물량을 선보인 건설사들이 연휴기간 모델하우스를 연다. 동시분양을 통해 수완지구에서 1181가구의 대단지를 공급한 현진에버빌은 6∼7일을 제외한 나머지 기간 오픈할 예정이며 개별분양으로 선보인 양우내안에 총 221가구 는 쉬는 날 없이 전일 견본주택을 열 계획이다. 1만여가구가 한꺼번에 선보인 수완지구의 경우 현재 계약률은 좋은 곳이 40∼50% 나머지는 20∼30%에 머물러 있는 것으로 알려졌다. 전북 군산 수송지구에서 공급 중인 수송아이파크 566가구 제일오투그란데 1380가구 한라비발디 1114가구 등도 휴일 없이 견본주택을 열기로 결정했다. 제일오투그란데 분양사무소 이승용 분양소장은 “이번 연휴기간은 지역 수요자뿐만 아니라 고향 방문객들에게 상품을 선보일 수 있는 좋은 기회”라며 “대단지에 발코니 무료확장 단지내 원어민 영어마을 조성 중도금 60% 무이자융자 등의 조건을 내걸고 수요자들의 마음을 사로 잡을 것”이라고 말했다. 이와 함께 대구에서는 북구 칠성동 신일해피트리칠성과 서구 중리동 롯데캐슬이 6일 하루을 제외하고 연휴기간 오픈을 한다. 롯데캐슬은 현재 40%가량이 남아 있고 대형 평형은 로열층도 구입할 수 있다. 이밖에 경북 경산시 사동 대동다숲과 경주시 황성동 현진에버빌도 연휴기간 모델하우스를 연다. 경주 현진에버빌은 총 604가구 중 현재 30%가량이 남아 있다.,https://news.naver.com/main/read.nhn?mode=LSD&mid=shm&sid1=260&oid=014&aid=0000249127,39
