,date,cat,co,headline,text,url,week
20677,2006.08.07. 오후 4:38,부동산,매일경제,국민임대 성공위한 제언,임대주택 100만가구 건설 문제 많다 下 주거복지 고려하라 필요한 곳에 필요한 양만큼 국민임대주택을 공급하기 위해서는 더욱 치밀한 수요 분석이 필수라는 지적이다. 특히 주택 공급량뿐 아니라 입주민의 삶의 질 개선 정도를 따져 공급량을 결정하라는 주문이다. 권주안 주택산업연구원 연구위원은 단순히 주택 수요가 아니라 주거복지 차원에서 수요를 따져보는 접근이 필요하다 며 소득 수준과 사후관리 쪽에 신경 쓸 일이 많다 고 말했다. 이와 관련해 건교부는 7일 내년중 지역별 건설물량 비율 등 2008 2012년 국민임대 공급계획을 재검토할 계획 이라고 밝혔다. 건교부 관계자는 2005년 인구ㆍ주택 센서스 현재 국토연구원이 진행중인 임대주택 수요 조사 행정ㆍ혁신도시 등 국토공간 구조 변화 등을 종합적으로 감안하겠다 고 밝혔다. 정치색은 쏙 빼라 국민임대주택 정책에서 정치색을 쏙 빼야 한다는 게 전문가들의 한결같은 지적이다. 감 感 에 따르기에는 국민임대 정책의 규모와 중요성이 너무 크다는 것이다. 한 부동산 전문가는 주택시장과 경기 등의 변수를 고려하지 않고 정치적 상징성 때문에 불도저식으로 밀어붙이는 것은 문제가 있다 며 건설물량 100만가구 과 기한 2012년 중 하나에 여유를 허용하는 방안을 검토해볼 만하다 고 말했다. 이 관계자는 국민임대주택이 부족하다는 사실에는 이론의 여지가 없다 며 그러나 더욱 중요한 것은 제대로 짓는 것 이라고 덧붙였다. 사후관리 신경써라 국민임대 정책의 중심축을 서서히 건설에서 사후관리로 옮겨야 한다는 의견도 많다. 또다른 전문가는 현행 국민임대제도는 자영업자 등에 대한 정확한 소득 파악이 어렵다는 근본적인 한계를 갖고 있다 며 2010년 이후 도입될 예정인 ETIC 근로소득보전세제 와 연계해 활용하는 방안을 추진할 필요가 있다 고 말했다. 관리 인력의 보강도 필요하다는 지적이다. 주공은 지사와 본사를 합쳐 25명이 입주한 국민임대주택 약 7만가구를 담당하고 있다. 1인당 2800가구를 담당하고 있는 셈이다. 건교부 관계자는 입주자 사후관리는 앞으로도 지속적으로 개선될 것 이라며 국민임대 증가에 따라 관리 인력도 보강될 것 이라고 말했다. 정부부처간 협력하라 국민임대 사업을 건설교통부가 일방적으로 추진할 것이 아니라 주거복지 차원에서 범부처적으로 추진돼야 한다는 지적도 있었다. 김현아 건설산업연구원 부연구위원은 건교부가 사업을 일방적으로 몰아붙이면서 지자체 반발도 큰 것 같다 며 어차피 예산 문제로 수도권 외곽에 임대를 지어야 한다면 지자체에 인센티브를 주는 방안도 적극 검토해야 한다 고 주장했다. 김 위원은 임대 입주민이 인근에서 일터까지 마련할 수 있도록 복지부 행자부 등 유관부처 협조가 필수 라고 덧붙였다. 권주안 연구위원도 국민임대주택 입지가 문제가 되는 것은 기본적으로 택지 확보가 용이하지 않았기 때문 이라며 정부 각 부처와 시민단체 등의 공감대 형성이 중요하다 고 말했다. 매입임대 활용하라 국민임대주택을 새로 짓는 데 드는 비용 재정지원 기준 단가 은 평균 단가 평당 375만원 와 평균 평형 17.8평 을 곱한 6675만원이다. 이에 비해 기존 주택을 사들여 임대주택으로 활용하는 매입 임대는 가구당 7000만원 정도로 추산되고 있다. 비용상으로는 신설과 매입이 엇비슷한 수준인 셈이다. 그러나 수요자 관점에서는 매입 임대를 선호하는 측면이 강하다. 국민임대단지에 산다는 피해의식을 피할 수 있고 생활권 유지가 가능한 데다 임대료도 저렴하기 때문이다.,https://news.naver.com/main/read.nhn?mode=LSD&mid=shm&sid1=260&oid=009&aid=0000521732,31
20678,2006.08.07. 오후 4:32,부동산,매일경제,담합 단지지정은 했는데…호가 떨어진 곳 전무,아파트 가격 담합을 막기 위한 담합 아파트 지정 이 집값 안정에는 그다지 도움을 주지 못하고 있는 것으로 나타났다. 부동산정보제공업체 닥터아파트가 지난달 21일 건설교통부가 담합 아파트로 지정한 서울ㆍ수도권지역 58개 아파트단지를 대상으로 이달 4일까지 시세 동향을 조사한 결과 57개 단지는 호가 변화가 없고 1개 단지는 오히려 소폭 상승한 것으로 나타났다. 담합 단지 낙인이 찍힌 이후 호가가 떨어진 곳이 아직 한 곳도 없는 셈이다. 서울시 전체 아파트값이 2주 연속 하락하는 등 부동산시장이 약세를 면하지 못하고 있는 상황에서 담합 단지가 다른 곳보다 더 많이 떨어질 것이라는 일반 예상과는 다소 동떨어진 것이다. 담합 단지로 지정되면 정부가 해당 지역 아파트 실거래가를 수시 공개하고 인터넷 정보제공업체 등이 4주 동안 시세정보 제공도 중단하기로 했다. 그러나 서울 구로구 고척동 청구아파트 42평형은 호가 기준으로 담합 단지로 지정된 지난달 21일 3억3000만원에서 이달 4일 현재 3억4000만원으로 오히려 1000만원 올랐다. 32평형도 500만원 오른 2억5250만원 25평형은 250만원 상승한 1억5500만원으로 각각 조사됐다. 관악구 봉천동 보라매삼성 37평형은 3억500만원이었던 호가가 그대로 유지되고 있고 성북구 길음동 대우푸르지오 33평형도 3억6000만원에서 움직이지 않고 있다. 안양시 석수동 현대아파트 역시 25평형 1억9000만원 42평형이 3억5000만원으로 제자리를 지키고 있다. 부천시 중동 대림아파트도 23평형 1억7500만원 33평형 2억5500만원으로 변화가 없다. 담합 지정에도 호가가 떨어지지 않는 것은 해당 아파트 주민들이 담합으로 받아들이지 않기 때문으로 보인다.,https://news.naver.com/main/read.nhn?mode=LSD&mid=shm&sid1=260&oid=009&aid=0000521714,31
20679,2006.08.07. 오후 4:26,부동산,매일경제,판교 내년에도 기회 있다,8월 판교 2차 동시분양이 다가오면서 수요층 관심이 높아지고 있지만 내년 이후에도 남은 물량은 많다. 올해 기회를 놓쳤어도 내년 이후 연립 중대형 아파트 주상복합 등을 노려볼 만하다는 게 전문가들의 평가다. 그러나 이들 단지는 공급시기에 따라 전매제한기간과 청약가점제 적용 여부가 달라져 유의할 필요가 있다는 의견이 많다. 건설교통부 신도시기획팀 관계자는 내년 이후 물량은 아직 확정된 것도 아니고 공급 방식도 추가 협의가 필요하다 며 공급 형태는 2차 동시분양이 끝난 이후 논의될 것 이라고 전했다. 7일 건설교통부에 따르면 내년 이후 판교에서 추가로 분양될 아파트와 연립 등 공동주택은 총 1만888가구에 이른다. 이 중에는 임대 아파트가 8342가구로 가장 많고 나머지 2546가구가 분양주택이다. 임대 중에는 국민임대 아파트가 5784가구 전세형 임대 1266가구 공무원 임대 473가구가 각각 공급된다. 이 중 일반이 관심을 가질 만한 단지는 주공이 공급하는 전세형 임대다. 후분양으로 공급되는 전세형 임대는 공정의 60% 이상이 진행돼야 한다. 전용면적 25.7평 초과 중대형이고 임대차보호법에 따라 2년 단위 전세 계약을 하면 된다. 임대 외에 분양 물량은 주상복합 1266가구와 설계협의로 분양이 미뤄진 연립주택 3개 블록 300가구 한성 등 4개 건설사가 토지공사를 상대로 1심 판결에서 승소한 협의양도택지 아파트 980가구가 있다. 모두 전용 25.7평 초과 단지로 청약예금 가입자만 청약할 수 있다. 이 중 주상복합아파트는 주택공사가 공영개발을 할지 민간이 분양할지 아직 미지수다. 판교 주상복합 용지는 아직 공영개발지구로 지정이 안돼 민간이 분양한다면 입주 후 곧바로 되팔 수 있다. 반면 주공이 공영개발하면 5년 동안 전매가 금지된다. 분양가는 평당 2000만원 안팎으로 예상된다. 동판교 A20 2블록 아파트 948가구 과 서판교 B1 1블록 연립 32가구 은 한성 등 4개 건설사와 토지공사 사이의 법정다툼으로 공급 일정이 유동적이다. 두 블록 모두 위치는 판교 나들목과 2009년 개통 예정인 신분당선 판교역 인근에 위치해 노른자위라는 평가다. 최근 한성이 토공을 상대로 한 1심 소송에서 이겨 민간이 분양할 가능성이 높아졌다. 이 경우 판교신도시에선 유일한 중대형 민간 아파트가 된다. 국제현상공모로 설계중인 연립주택 3개 블록은 주공이 공급한다. 한국판 베벌리힐스로 조성해 고급 수요를 끌어들일 전망이다. 이 밖에 9 10월 우선공급 일정이 있는 단독주택지 2078필지는 대부분 협의양도인과 이주자 몫이 될 전망이다.,https://news.naver.com/main/read.nhn?mode=LSD&mid=shm&sid1=260&oid=009&aid=0000521710,31
20680,2006.08.07. 오후 4:26,부동산,매일경제,동남권 유통단지 10월 착공,서울시가 동남권 물류 거점으로 조성중인 송파구 문정동 일대 15만4000여 평 규모 동남권 유통단지 조성 공사가 가시화되고 있다. 서울시는 7일 이주하지 않은 주택 20동 등에 대해 최근 행정대집행 강제 철거 을 마치고 청계천 이주전문상가를 10월에 착공할 계획 이라고 밝혔다. 서울시는 지난 3일 SH공사와 용역업체 직원 등 220여 명을 투입해 주택 20동 교회 1동 컨테이너 1동을 철거하고 상가26동에 대해서는 단전ㆍ단수 조치를 취했다.,https://news.naver.com/main/read.nhn?mode=LSD&mid=shm&sid1=260&oid=009&aid=0000521709,31
20681,2006.08.07. 오후 4:26,부동산,매일경제,분양 발산지구 107가구 분양,SH공사는 서울 강서구 발산동에 연립주택 32평 107가구를 일반 분양한다. 분양가는 가구당 3억2446만 3억3820만원으로 국민주택기금에서 8000만원까지 대출 가능하다. 분양공고일인 이달 11일 현재 서울ㆍ수도권에 거주하는 청약저축 2년 이상 가입 1순위자들이 신청할 수 있다. 노부모 부양 우선공급 해당자는 오는 16일 1순위자는 17일 청약접수가 시작된다.,https://news.naver.com/main/read.nhn?mode=LSD&mid=shm&sid1=260&oid=009&aid=0000521707,31
20682,2006.08.07. 오후 4:26,부동산,매일경제,관심지역 세운상가 녹지조성 첩첩산중,오세훈 서울시장이 세운상가를 헐고 녹지로 조성한다는 공약을 내세운 뒤부터 세운상가 가 강북개발 핵심으로 떠오르고 있다. 세운상가 터가 녹지로 조성되면 종묘에서 남산까지 끊어졌던 녹지축이 복원돼 북한산에서 남산까지 강북을 관통하는 녹지축이 열리기 때문이다. 전문가들은 청계천보다 더 강력한 강북 개발 촉매제가 될 것이라고 입을 모은다. 그러나 세운상가 철거에는 온갖 어려움이 도사리고 있어 첫 삽을 뜨기조차 힘들다는 비관적인 예상도 함께 나온다. 계획만으로 11년 보냈다 세운상가는 가ㆍ나ㆍ다ㆍ라 등 4개 건물로 구성된다. 이 4개 건물에는 종묘에서 남산 방향으로 종로세운상가 세운상가 가동 청계상가 대림상가 삼풍상가 풍전호텔 신성상가 진양상가 등 7개 상가와 1개 호텔 상가에 부속된 아파트 등이 입주해 있다. 이 가운데 오 시장 공약은 종로세운상가 대림상가를 헐고 녹지축을 조성한다는 내용이다. 공약대로 녹지가 조성되더라도 끊어진 종묘 남산 녹지축은 온전히 이어지지 않는다. 오 시장 공약이 반쪽 공약이라는 소리를 듣는 것도 그래서다. 또 오 시장 공약은 새로운 내용도 아니다. 세운상가 철거 계획은 이미 95년 2월 서울시가 도시계획위원회 조언을 거쳐 발표한 내용이다. 당시 언론은 세운상가 용지 공원화 확정 이라고 대문짝만 하게 보도했다. 그러나 지금까지 세운상가는 헐리지 않은 채 그대로다. 계획만으로 11년을 보낸 셈이다. 그만큼 세운상가 철거가 어렵다는 얘기다. 천문학적인 보상 비용 내 생전에 세운상가가 녹지로 바뀌는 일은 없을 것으로 봅니다. 진양상가 관리회사인 대훈실업 관계자 말이다. 그는 서울시에서 몇 조 원을 과감하게 투자하면 모를까 힘들 것 이라고 했다. 몇 조 원까지는 아니겠지만 세운상가 철거에는 천문학적인 비용이 든다. 오 시장은 대지 면적 2400평에 연면적 2만5000평에 이르는 종로세운상가 대림상가 철거에 보상비 3000억원이 들 것으로 계산했다. 그러나 시장에서는 3000억원으로는 크게 부족할 것으로 본다. 세운상가 인근 C공인 관계자는 청계천 복원과 재개발 바람으로 인근 땅값이 크게 올랐다 며 청계천변은 지분값이 평당 1억원 안쪽은 평당 5000만원에 이른다 고 말했다. 이 계산을 적용하면 종로세운상가 대림상가 대지 지분값은 1조2000억원이 넘는다. 청계천 복원이땅값을 높여 세운상가 철거를 더 어렵게 만든 셈이다. 게다가 상가ㆍ아파트 소유자들은 시세보다 더 높은 보상비를 요구하고 있다. 세운상가에 맞닿은 예지동 85 일대 세운 4구역 재개발사업 시행자인 종로구 관계자는 종로세운상가 위층인 현대아파트 입주자는 시세가 3억원인데 10억원을 달라고 한다 고 말했다. 오 시장은 세운상가 지하를 복합문화공간으로 개발해 얻는 순수입 870억원으로 사업비를 일부 충당한다는 계획이지만 턱없이 부족한 금액이다. 종로세운상가에서 진양상가까지 세운상가 총 대지면적은 4933평 건물 연면적은 6만2284평에 이른다. 이곳 전체를 헐고 남산에서 용산까지 끊어진 녹지축을 회복하려면 조원 단위 천문학적인 비용이 들 게 분명하다. 2067개 점포 임차인 어디로 보내나 세운상가는 점포 수만 2067개에 이르며 대부분 임차 상가다. 세운상가를 철거하려면 이들 임차인에 대한 이주 대책을 마련해야 한다. 공익사업을 위한 토지 등 취득ㆍ보상법 시행규칙 은 임차 상인에게 최고 3개월 동안 영업이익과 이사비 정도만을 보상하도록 규정하고 있다. 그러나 임차 상인이 이 정도 보상으로 만족할 리는 만무하다. 성낙삼 세운상가 시장협의회장은 20 30년 동안 이곳에서 상권을 일궜는데 생존권 대책 없는 철거에는 절대 반대할 것 이라고 말했다. 종로세운상가 대림상가 상인들은 리모델링추진위원회를 결성해 서울시 철거 방침에 정면으로 반발하고 있는 상황이다. 정부 관계자는 법에서 정한 이상으로 임차 상인에게 보상하려면 서울시에서 머리를 쥐어짜야 할 것 이라고 말했다. 이정형 중앙대 교수를 비롯한 일각에서는 세운상가 근처 지주들에게 고층 개발을 허용하고 개발된 건물에 대한 입주권을 세운상가 지분 소유자와 임차인들에게 주는 방안 을 제시하지만 현실적으로 쉽지 않다. 실제로 인근 지역에서 최고 32층 높이로 재개발을 추진하고 있는 종로구청 관계자는 세운상가 인근에 큰 지분이 있는 지주들과 지분은 2 3평이지만 사람 수는 많은 세운상가 지분 소유자들간 이해관계를 조정하기란 어렵다 며 현실성이 없는 주장 이라고 평가했다. 그는 또 고층 재개발 건물에 세운상가 임차인을 이주시키면 지주 몫이 거의 없어지기에 지주들이 받아들이지 않을 것 이라고 덧붙였다. 삼풍상가는 이미 리모델링 일부 상가는 큰돈을 들여 리모델링을 거의 끝마쳤다는 점도 부담이다. 리모델링까지 한 건물을 헐고 녹지로 만든다면 자원 낭비라는 비판도 나올 수 있다. 삼풍상가는 2001년 상반기 구청에서 리모델링 허가를 받아 저층부 외장을 제외하고는 리모델링을 끝마쳤다 고 말했다. 삼풍상가측은 여기를 공원으로 만들지 않았으면 좋겠다 고 했다. 입체공원 주장도 나와 철거 후 녹지 조성 외에는 대안이 없는 것일까. 김진애 서울포럼 대표는 지상 녹지가 가장 좋겠지만 힘들다면 입체공원축을 긍정적으로 생각할 수 있을 것 이라고 지적했다. 세운상가 건물 옆에 보행자 도로 기능을 할 날개를 붙이고 이 날개를 녹지로 조성하자는 얘기다. 건물 옥상도 정원으로 만들 수 있다. 이미 세운상가에는 3층에 데크 가 붙어 있으며 이 데크는 원래 종묘 남산을 잇는 남북 보행축 기능을 하도록 설계됐다. 그러나 현재 일부 데크는 잘려 나갔고 일부 데크는 소규모 점포들이 점령하고 있어 보행축으로서 기능을 완전히 상실했다. 김 대표는 사람들이 즐겨 찾을 수 있도록 지상에서 데크까지 에스컬레이터를 설치하는 등 리노베이션도 한 방법 이라고 말했다. 하지만 뉴욕 등 외국 도시와 비교해 도심 내 공원이 부족한 서울은 세운상가 철거가 필수라는 견해도 많다.,https://news.naver.com/main/read.nhn?mode=LSD&mid=shm&sid1=260&oid=009&aid=0000521706,31
20683,2006.08.07. 오후 4:21,부동산,파이낸셜뉴스,시세 동향강남권 재건축 매매가 하락…전세가는 소폭 상승,본격적인 무더위와 함께 휴가철이 이어지면서 아파트 거래시장은 대체로 한산한 모습이다. 이 때문에 매매가 역시 소폭 하락하는 등 약세를 보이고 있다. 그중에서도 서울 강남 서초 등 강남권 재건축아파트는 하락세가 더욱 두드러지고 있다. 게다가 경기 고양 의왕 등 수도권 주요 재건축 밀집지역도 하락세가 계속되고 있다. ◇매매가 동향 부동산114가 지난달 28일 대비 지난 4일 현재 조사한 자료에 따르면 서울은 0.01%를 기록 2주 연속 하락세를 보였다. 지역별로는 관악 0.25% 강서 0.12% 성북 0.12% 영등포 0.11% 마포 0.1% 종로 0.1% 등 비강남권 중에서도 상대적으로 저평가된 새 아파트나 소규모 단지 중심으로 실수요가 조금씩 움직이면서 가격이 소폭 상승했다. 일례로 관악구의 경우 신림동과 봉천동의 40평형대나 노후단지 소형이 소폭 올랐다. 강서구에서도 염창동 방화동 일대의 소규모 단지 위주로 소폭 오름세를 보였다. 또 영등포지역도 가격이 상대적으로 저렴한 노후단지 30평형대 아파트 가격이 상승했다. 그러나 강남 0.15% 성동 0.14% 양천 0.06% 서초 0.03% 송파 0.02% 등 강남권을 비롯해 투자자들에게 인기가 높았던 지역은 하락세가 두드러졌다. 신도시는 변동 없이 제자리걸음을 보였다. 특히 경기 성남 분당신도시의 하락세가 5주 연속 이어졌다. 분당의 경우 소형부터 대형까지 하락세가 이어지면서 이 시기 0.04%의 변동률을 기록했다. 수내동 양지한양 청구아파트의 경우 매물이 쌓이고 있고 이매동 아름마을 30평형대 이상도 일제히 약세를 보였다. 이외 중동 0.15% 산본 0.03% 평촌 0.02% 등도 소폭 상승했지만 폭은 크지 않았다. 일산은 변동 없이 제자리걸음을 보였다. 경기 인천 등 수도권지역도 상승폭이 0.05%로 둔화됐다. 지역별로는 경기 파주 0.59% 부천 0.29% 김포 0.21% 고양 0.11% 등 서부권 주요 지역이 소폭 오름세를 보였다. 반면 화성 0.01% 광명 0.05% 구리 0.08% 의왕 0.08% 평택 0.08% 등 주로 수도권 서남부권역은 중소형 중심으로 하락세를 보였다. 이외에도 경기 용인 0.01% 수원 0.02% 성남 0.05% 과천 0.04% 안양 0.04% 군포 0.03% 등 수도권 주요 지역들도 거의 변동이 없었다. ◇전세가 동향 전세는 서울이 같은 기간 0.05% 수도권은 0.04% 상승했고 신도시는 횡보세를 기록했다. 서울의 경우 구별로 강남 0.17% 은평 0.16% 구로 0.11% 성동 0.1% 영등포 0.1% 등이 소폭 올랐고 양천 0.1% 광진 0.06% 중랑 0.05% 은 하락했다. 강남은 역삼동 신규 입주단지 중소형이 오름세를 보였고 은평 구로 등도 비교적 저렴한 새아파트 중소형 위주로 전세가격이 오름세를 보였다. 그러나 목동을 중심으로 한 양천구 등은 매매와 함께 전세도 약세가 이어졌다. 신도시에서는 평촌 0.04% 산본 0.03% 중동 0.01% 일산 0.0% 등이 미미한 변동률을 보인 가운데 분당 0.03% 의 하락세가 이어졌다. 수도권에서는 한 주간 전세금이 많이 오른 상위권에 중대형이 많았다. 지역별로는 매매와 마찬가지로 과천 0.24% 파주 0.17% 고양 0.16% 부천 0.12% 등이 오름세를 보였다.,https://news.naver.com/main/read.nhn?mode=LSD&mid=shm&sid1=260&oid=014&aid=0000237648,31
20684,2006.08.07. 오후 3:31,부동산,이데일리,정부 거래세 인하 소급 적용 불가,소급적용땐 형평성 문제 지자체 재정부담 발생 과세체계 와해..혼란만 가중 이데일리 문영재기자 정부가 주택 거래세 인하의 적용시기를 소급해 달라는 잇따른 민원에 대해 불가 입장을 재확인했다. 김한기 행자부 지방세제팀장은 7일 거래행위가 이미 이뤄져 납세의무가 성립된 사람에게 추후에 법을 만들어 세금을 돌려준다면 과세체계가 흔들리게 된다 고 못박았다. 김 팀장은 부동산대책 추진 뒤 보유세 강화에 맞춰 거래세율을 이미 2차례나 내렸다 며 이번에 소급적용을 할 경우 과세대상자들간의 형평성 문제 초래는 물론 소급적용 시기의 규정이 없어 혼란만 가중시킬 뿐 이라고 강조했다. 그는 이어 거래세를 추가 인하한 것은 보유세 증가 예측분을 활용한 것 이라며 소급인하 적용땐 지방자치단체의 재정부담 문제가 발생할 수 있다 고 덧붙였다. 정부는 지난 3일 개인 법인간 개인 개인간 거래세를 모두 2%로 낮추기로 하고 이르면 다음달 초부터 적용키로 했다.,https://news.naver.com/main/read.nhn?mode=LSD&mid=shm&sid1=260&oid=018&aid=0000405169,31
20685,2006.08.07. 오후 3:13,부동산,머니투데이,디자인시티 수완지구 9285가구 동시분양,머니투데이 문성일 기자 GS건설 등 11개사가 참여해 9285가구를 공급하는 광주 수완지구가 오는 25일 모델하우스 개관과 함께 동시분양에 들어간다. 이번 동시분양에서는 8개 업체가 광주지역에서는 처음으로 통합모델하우스를 개관 눈길을 끈다. 7일 건설업계에 따르면 최초로 들어서는 디자인시티 이자 명품신도시로 불리며 관심을 불러일으킨 광주 수완택지지구는 무진로를 이용 도심과 서구 중심지로의 접근성이 양호하다는 평이다. 자동차로 5분 거리에 호남고속도로 산월IC가 있다. 제2순환도로를 비롯해 첨단지구와 연결되는 왕복 6차선의 광로2 9호선과 산월JCT 등이 2007년 개통 예정이다. 택지지구내 다수의 초·중·고교가 들어선다. 이번 동시분양에 나서는 업체는 모두 11개사. 이 가운데 대방건설 대주건설 모아주택산업 새한건설 신안건설산업 영무건설 한양 GS건설 등 8개 업체가 통합 모델하우스를 운영한다. 나머지 진흥기업 코오롱건설 현진은 개별 모델하우스를 선보인다. 각 업체는 디자인시티라는 컨셉에 맞춰 고급화 전략을 추진할 계획이다. 동시분양 참여사 협의체 간사인 대주건설 김정균 소장은 광주지역 대다수 대학과의 접근성이 좋아 우수한 교육여건을 갖추고 있다 며 각종 도로 개통으로 인해 교통여건도 크게 개선될 예정 이라고 말했다. 한편 동시분양 참여 건설업체들은 한국도로공사와 공동으로 광주·동광주 톨게이트에서 휴가철 안전한 고속도로 만들기 캠페인을 벌였다. 업체들은 이번 캠페인에서 각 톨게이트를 이용하는 운전자들에게 수완지구 홍보물과 함께 생수 물티슈 등을 나눠줬다.,https://news.naver.com/main/read.nhn?mode=LSD&mid=shm&sid1=260&oid=008&aid=0000689108,31
