,date,cat,co,headline,text,url,week
64556,2007.09.26. 오후 4:03,부동산,파이낸셜뉴스,“올 수도권 30만가구 공급 어렵다”,‘올해 수도권에 주택 30만가구 공급 가능할까.’ 정부가 올해 수도권에 주택 30만가구를 공급키로 한 것에 대해 대형 건설업체 대부분이 ‘비관적’으로 보고 있는 것으로 조사됐다. 나아가 향후 주택사업에 대해 대형 건설사 모두 ‘현상유지’ 또는 ‘축소하겠다’는 방침이어서 주택수급 불안에 대한 우려가 커질 것임을 예고했다. 파이낸셜뉴스가 26일 주택공급 물량이 많은 상위 20대 건설업체를 대상으로 ‘분양가 상한제 효과와 업계 대응 방안’에 대해 긴급 설문조사한 결과 이같이 나타났다. 조사에서 ‘올해 정부의 수도권 주택공급 정책 목표인 30만가구 공급이 가능한가’에 대한 질문에 전체의 85% 17개사 가 ‘불가능하다’고 응답했다. 30만가구 달성이 가능할 것이라고 응답한 업체는 2곳에 불과했다. 이는 분양가 상한제 시행으로 수익성이 크게 떨어지는 데다 대선 등 외적인 변수로 사업환경이 불투명해질 것이라는 판단때문으로 풀이된다. 올해 수도권에서 30만가구 공급이 불가능할 것으로 내다 본 건설사들 중 40%인 8개사는 절반 수준인 15만가구 미만에 그칠 것으로 내다봤고 나머지 40%는 15만∼20만가구 정도만 공급될 수 있을 것으로 전망했다. ‘분양가 상한제 적용 이후 주택사업을 축소할 것인가’라는 질문에는 ‘아직 계획을 세우지 못했다’가 55% 11개사 ‘현상태를 유지하겠다’ 30% 6개사 ‘축소하겠다’ 15% 3개사 로 각각 나타났다. 앞으로 주택 공급을 늘리겠다는 건설사는 한 곳도 없었다. 이에 앞서 정부는 올해 초 발표한 ‘주택종합계획’을 통해 공공택지에서 14만6000가구 민간택지 15만1000가구 등 총 29만7000가구를 수도권에 연내 공급하겠다고 밝혔으며 최근까지 목표 달성이 무난하다고 강조해 왔다. 하지만 민간부문 주택 공급의 대부분을 차지하는 대형 건설사들이 분양가 상한제 아래에서는 주택 공급을 늘리지 않는다는 방침이어서 정부의 주택 공급 계획에 차질이 불가피할 것으로 보인다. 최근 주요 이슈로 떠 오른 지방 미분양 해소책 복수 응답 에 대해서는 45%인 11곳이 ‘대출규제 완화’와 ‘전매제한 완화’를 각각 꼽았다. 주택투기지역을 해소해야 한다고 응답한 업체는 8% 2개사 에 불과했다. 하지만 정부가 최근 내놓은 ‘미분양 물량 정부 매입’에 호응한 업체는 한 곳도 없었다. 내년 주택 분양시장 전망과 관련해서는 95% 19개사 가 올해보다 나빠지거나 비슷할 것으로 응답했다.,https://news.naver.com/main/read.nhn?mode=LSD&mid=shm&sid1=260&oid=014&aid=0000343191,90
64557,2007.09.26. 오후 4:03,부동산,파이낸셜뉴스,“매매 계약금 지급전 위약금없이 해지”,부동산 거래 과정에서 계약서에 기재된 계약금을 지급하지 않은 상태에서 매매계약을 해지할 경우 해약금이나 위약금을 물지 않아도 된다는 법원의 판결이 나왔다. 서울고법 민사17부 재판장 곽종훈 부장판사 는 정모씨가 김모씨와 이모씨 등을 상대로 낸 손해배상 청구 소송에서 원심을 깨고 원고 패소 판결했다고 26일 밝혔다. 재판부는 “매매계약 체결에 있어 매수인이 계약금을 지급하기로 약정했는 데도 이를 교부하거나 실제 그와 동일한 이익을 받은 단계에 나아가지 못한 상태라면 계약금계약은 요물계약 要物契約ㆍ당사자 중 한쪽이 물건의 인도 및 기타의 행위를 해야 성립되는 계약 이기 때문에 아직 성립했다고 볼 수 없다”고 밝혔다. 재판부는 “약정에 따른 계약금이 지급되기 전까지는 계약 당사자의 어느 일방이든 그 계약에 구속되지 않고 자유롭게 이를 파기할 수 있고 이 때 그 해제를 위해 매수인이 계약금을 지급할 의무를 여전히 부담한다거나 해제에 대한 책임으로 위약금을 지급할 의무가 생긴다고 볼 수 없다”고 판시했다. 정씨는 2005년 6월8일 A공인중개사로부터 김씨 소유의 아파트가 매물로 나왔다는 말을 듣고 중개인과 함께 B중개사에서 김씨 장모인 이씨와 대리방식으로 아파트 매매계약을 체결했다. 매매대금은 5억원으로 계약금은 계약과 동시에 지불하고 해제시 계약금의 배액을 배상한다는 계약서를 작성했으나 계약금이 준비되지 않아 당일 300만원을 중개사무소 계좌로 나머지 5700만원은 김씨 계좌로 송금키로 하고 우선 약 380만원이 예치된 자신 명의의 통장을 중개사무소에 맡겼다. 이 과정에서 김씨 장모 이씨가 계약을 체결한 당일 밤 해외에 체류 중인 김씨 부부에게 매매사실을 알렸으나 김씨 부부가 “아파트를 처분할 의사가 없다”고 하면서 소송이 벌어졌다.,https://news.naver.com/main/read.nhn?mode=LSD&mid=shm&sid1=260&oid=014&aid=0000343189,90
64558,2007.09.26. 오후 4:03,부동산,파이낸셜뉴스,과천 재건축 소송으로 ‘산넘어 산’,경기 과천지역의 주공재건축 단지들이 각종 소송으로 얼룩져 사업추진에 어려움을 겪고 있다. 과천주공3단지의 경우 정상입주추진위와 현 조합간 갈등으로 2건의 소송이 준비 중이어서 사태가 악화일로를 치닫고 있다. 법원의 평형배정 무효판결에 이어 정상입주진위가 조합을 상대로 ‘대출은행 변경소송’과 ‘조합장 업무정지 가처분 소송’ 등을 조만간 제기할 예정이다. 소송 여파로 3단지 입주가 장기화되면서 인근 재건축단지들도 사업진행에 차질이 불가피한 상황이다. 주공3단지 끊이지 않는 법적 분쟁 과천주공3단지는 ‘평형배정 무효판결’로 내년 7월 예정이던 입주 시기가 장기간 연기될 상황에 처했다. 설상가상으로 정상입주추진위측이 ‘입주자 은행선택 배정 변경에 대한 소송’ ‘조합장 업무정지 가처분 소송’ 등 2건의 추가 소송을 준비 중이어서 주공 3단지는 그야말로 소송대란에 휩싸이고 있다. 현재 진행 중인 평형배정 무효소송은 법원이 2심까지 소송 당사자의 손을 들어줬다. 3심까지 원고가 승소할 경우 3단지 주민들은 새로운 평형배정 기준을 만들고 입주 절차를 다시 밟아야 한다. 따라서 입주가 늦어질수록 주민들의 대출이자 부담은 늘어날 전망이다. 이에 비상대책위원회로 만들어진 ‘정상입주추진위원회’는 기존 조합을 상대로 은행선택 배정 변경에 대한 소송을 준비 중이다. 입주자들이 기존에 배정된 은행보다 더 싼 금리로 대출조건을 변경토록 하기 위한 것이다. 조합장을 해임시키기 위한 ‘조합장 업무정지 가처분 소송’도 정상입주 추진위가 준비 중이다. 정상입주추진위 유재명 대표는 “현 조합이 설정한 중도금 이자 기준으로는 타은행 대비 연간 38억원 3800가구 의 이자를 조합원이 더 부담하는 셈”이라며 “조합원들이 자유로이 은행을 변경할수 있도록 정식 공문을 통해 요청했지만 조합측이 받아들이지 않아 조합장 해임과 은행변경을 골자로 한 2건의 추가 소송을 진행하려 한다”고 말했다. 나머지 단지도 재건축 지연 우려 3단지 재건축 소송 악재로 인근 재건축단지들도 줄줄이 사업 지연이라는 후폭풍을 맞을 전망이다. 인근 1·6·7·10단지 등 과천 재건축단지 주민들은 3단지 재건축을 사례삼아 나머지 재건축 사업도 속도가 빨라질 것으로 기대했지만 소송 여파로 사업진행이 장기화될 우려가 커지고 있다. 과천 재건축단지의 한 관계자는 “3단지 재건축 사업이 소송으로 얼룩지고 있어 다른 단지 사업도 장기화할 것이라는 전망이 지배적”이라고 말했다. 3단지 정상입주추진위 유대표는 “조합원 은행선택 권리 소송과 조합장 업무정지 가처분 소송까지 해결되려면 수년은 소요될 것”이라며 “평형 배정 소송이 마무리된다 해도 산 넘어 산이라 다른 단지들은 재건축 엄두도 못내는 상황”이라고 말했다. 3단지의 경우 평형배정 무효 판결로 재건축 절차가 지연될 경우 임대주택 의무비율 등을 추가로 적용받을 수 있어 사업성도 악화될 수 있다는 지적이다. 3단지 주민인 A씨는 “90% 이상 대출을 받아 사업을 진행했는데 입주를 못하면 등기일이 자꾸 늦어져 이자를 감당할 길이 없다”면서 “재건축 절차를 다시 밟게 되면 임대주택의무비율 등이 추가 적용될 수 있다는 말이 나오면서 입주민들이 불안해 하고 있다”고 말했다.,https://news.naver.com/main/read.nhn?mode=LSD&mid=shm&sid1=260&oid=014&aid=0000343188,90
64559,2007.09.26. 오후 3:59,부동산,아시아경제,한국 ICAO 이사국 3회연속 선임,한국이 국제민간항공기구 ICAO 이사국에 3회 연속 선임됐다. u3000 26일 건설교통부에 따르면 한국은 이날 캐나다 몬트리올에서 열린 제36차 ICAO 총회 투표에서 제3분과 이사국에 뽑혔다. u3000 이에 따라 한국은 3년 임기의 ICAO 이사국에 지난 2001년과 2004년에 이어 3회 연속으로 피선됐다. u3000 이용섭 건교부 장관을 비롯한 정부 대표단은 이번 총회에서 각국 고위 인사들을대상으로 적극적인 득표 활동을 벌인 결과 124표를 얻어 17개 입후보 국가 가운데 5위를 차지했다. u3000 특히 이번 제3분과에는 인도네시아 말레이시아 아랍에미리트 레바논 등 같은대륙에서도 많은 국가가 입후보해 표가 분산되는 바람에 마지막까지 예상 득표수를 알 수 없을 정도로 치열한 경쟁을 벌인 것으로 알려졌다. u3000 ICAO 이사국 제1분과는 미국 일본 등 세계 주요 항공국 제2분과는 시설 기여국 그리고 3분과는 지역별 대표국가로 나뉜다. u3000 ICAO 이사국은 총 36개국으로 구성되며 190개 회원국에 적용되는 항공운송관련 각종 기준 및 권고사항 등을 제정하는 의사결정기구로 이번 이사국 선출은 국제 항공 무대에서 한국의 위상을 높이는데 큰 기여를 할 것으로 보인다. u3000 강영일 건교부 물류혁신본부장은 이번 이사국 3회 연속 피선을 통해 세계항공 운송순위 9위 ICAO 기여금 순위 8위의 주요 항공국으로서 국제민간항공의 안전과 발전에 더욱 중요한 역할을 할 것으로 기대된다 고 말했다.,https://news.naver.com/main/read.nhn?mode=LSD&mid=shm&sid1=260&oid=277&aid=0000002516,90
64560,2007.09.26. 오후 3:51,부동산,서울경제,송파·동탄2신도시 대토보상 적용,관련법 내달 중순께 공포 송파신도시와 동탄2신도시에 대토보상제가 적용된다. 26일 건설교통부에 따르면 대토보상제를 가능하게 하는 토지보상법 개정안이 지난 20일 국회 본회의를 통과함에 따라 국무회의 등 관련 절차를 거쳐 오는 10월 중순께 공포될 전망이다. 대토보상은 공익사업에 따라 수용되는 토지의 보상금을 현금 대신 ‘개발된 이후의 땅’으로 보상해주는 것으로 토지소유자가 희망할 경우 상업용지ㆍ단독주택용지ㆍ공동주택용지 등을 받을 수 있다. 개정안은 대토보상을 개정안 공포 이전에 보상계획이 공고된 지역에는 적용할 수 없고 공포 이후 보상계획이 공고되는 지역부터 적용하도록 했다. 따라서 송파신도시와 동탄2신도시 등은 아직 보상계획이 공고되지 않은 지역이어서 대토보상이 가능하지만 10개 혁신도시는 이미 보상계획 공고가 끝나 불가능하다. 보상계획 공고는 개발계획 승인 이후에 가능하며 건교부는 송파신도시의 보상계획 공고를 토지보상법 개정안 공포 이후로 늦춰 송파신도시 예정지 내 토지소유자들이 대토보상을 받을 수 있게 할 계획이다. 동탄2신도시 역시 내년 2월 개발 계획이 승인될 예정이어서 대토보상이 가능하다. 대토보상은 희망자에 한해 1인당 주택용지는 330㎡ 상업용지는 1 100㎡ 이내에서 받을 수 있으며 보상금액이 이를 초과할 경우 나머지는 현금으로 지급된다. 다만 사업시행자가 대토보상이 가능한 면적의 한도를 정하기 때문에 1인 한도까지 대토보상을 받지 못하는 경우도 많을 전망이다. 한편 현금보상을 받을 경우에는 양도소득세가 과세되지만 대토보상을 받을 경우에는 양도소득세를 향후 대토보상을 받은 땅을 매각할 때 내도록 하는 방안이 추진되고 있다.,https://news.naver.com/main/read.nhn?mode=LSD&mid=shm&sid1=260&oid=011&aid=0000200155,90
64561,2007.09.26. 오후 3:48,부동산,파이낸셜뉴스,송파·동탄2신도시 보상，땅으로 한다,공공사업에 따른 토지보상비를 현금 대신 개발된 땅으로 지급하는 대토보상제가 서울 송파신도시와 경기 화성동탄2신도시에 적용된다. 하지만 혁신도시는 이미 보상계획 공고가 끝나 대토보상이 사실상 물 건너갔다. 건설교통부는 대토보상제 도입을 골자로 한 토지보상법 개정안이 지난 20일 국회 본회의에서 통과됨에 따라 국무회의 등 관련절차를 거쳐 10월 중순께 공포 즉시 시행할 계획이라고 26일 밝혔다. 대토보상은 공익사업에 따라 수용되는 토지의 보상금을 현금 대신 ‘개발된 이후의 땅’으로 보상해 주는 것으로 토지소유자가 희망할 경우 상업용지 단독주택용지 공동주택용지 등을 받을 수 있다. 개정안은 대토보상을 개정안 공포 이전에 보상계획이 공고된 지역에는 적용할 수 없고 공포 이후 보상계획이 공고되는 지역부터 적용토록 했다. 이에 따라 송파신도시와 동탄2신도시는 아직 보상계획이 공고되지 않은 상태여서 대토보상이 적용된다. 하지만 당초 정부가 목표로 했던 전국의 10개 혁신도시는 이미 보상계획 공고가 끝나 대토보상이 불가능하게 됐다. 송파신도시는 당초 이달 중에 개발계획을 끝낼 계획이었지만 서울시의회의 의견청취 절차가 늦어지면서 오는 10월께나 개발계획 승인이 가능할 전망이다. 보상계획 공고는 개발계획 승인 이후에 가능하며 건교부는 송파신도시의 보상계획 공고를 토지보상법 개정안 공포 이후로 늦춰 송파신도시 예정지 내 토지소유자들이 대토보상을 받을 수 있게 할 계획이다. 동탄2신도시는 내년 2월 개발계획 승인 예정이어서 역시 대토보상 대상이다. 대토보상은 희망자에 한해 1인당 주택용지는 330㎡ 상업용지는 1100㎡ 이내에서 받을 수 있으며 보상금액이 이들 대토보상 금액을 초과할 경우 나머지는 현금으로 지급된다. 한편 정부는 대토보상을 유도하기 위해 토지소유자가 대토로 보상을 원할 때는 양도소득세를 면제하는 방안을 추진 중이다.,https://news.naver.com/main/read.nhn?mode=LSD&mid=shm&sid1=260&oid=014&aid=0000343166,90
64562,2007.09.26. 오후 3:48,부동산,서울경제,용산역 앞 집창촌터 최고 40층 주상복합,서울 용산역 앞 집창촌 자리에 최고 40층 높이의 주상복합 건물이 들어선다. 서울시는 용산구 한강로2가의 ‘용산역 전면 제2 3 도시환경 사업구역’에 주상복합 3개 동을 짓는 계획안이 지난 21일 제24차 건축위원회에서 통과됐다고 26일 밝혔다. 이에 따라 한강로2가 291번지 일대 제2구역에는 지하9층 지상35층과 38층 규모의 주상복합 2개 동이 342번지 일대 제3구역에는 지하9층 지상40층 높이의 주상복합 건물이 각각 건립된다. 제2구역 건물에는 공동주택 130세대와 판매시설ㆍ업무시설이 들어서며 용적률은 963.28%이다. 제3구역 주상복합에는 공동주택 194세대와 업무시설 등이 들어서며 용적률은 963.37%이다. 또 영등포구 여의도동 22번지 4만6 465㎡의 통일주차장 부지에는 업무용 건물과 호텔ㆍ판매시설 등이 어우러진 ‘파크원 parc1 ’이 조성된다. 연면적 63만361㎡의 파크원에는 지하7층 지상69층과 52층 높이의 사무용 건물 각 1동과 지하7층 지상8층 규모의 쇼핑센터 지하6층 지상30층 높이의 호텔 1동이 각각 들어선다. 용적률은 798.50%로 결정됐다. 영국계 부동산 개발회사 ‘스카이랜 디벨로프먼트’가 2조원을 들여 시행하는 파크원 사업은 삼성물산 건설 부문이 시공하며 오는 2011년 5월 완공될 예정이다. 한편 강동구 암사동 414 2번지 일대에 지하2 3층 지상5 34층 높이의 아파트 3 226세대를 짓는 ‘강동시영1차아파트 재건축사업’ 안은 반려됐다.,https://news.naver.com/main/read.nhn?mode=LSD&mid=shm&sid1=260&oid=011&aid=0000200154,90
64563,2007.09.26. 오후 3:47,부동산,머니투데이,풍물시장이 서울풍물시장으로 바뀝니다,머니투데이 정진우 기자 내년 3월 개장하는 신설동 청계천로변 풍물시장 새이름 확정 ↑ 서울풍물시장 조감도 서울시는 내년 3월1일 신설동 청계천로변 옛 숭인여중 에 개장하는 풍물시장의 새로운 이름을 서울풍물시장 으로 확정했다. 시는 지난 9월1 15일까지 시민과 외국인을 대상으로 새로운 명칭을 공모한 결과 한글 명칭 725건과 영문 명칭 59건 등 모두 784건이 응모됐다고 밝혔다. 9명으로 구성된 심사위원회가 응모 작품을 대상으로 2차에 걸친 심의를 통해 서울의 지명도를 살리고 한국적 풍물시장이라는 뜻을 내포한 서울풍물시장 을 최우수작으로 선정했다. 서울풍물시장 의 공식 영문 표기는 Seoul Folk Flea Market 으로 정해졌다. 우수작으로는 청계천과 풍물 뜻이 내포된 합성어로 시민과 외국관광객이 쉽게 기억하고 부를 수 있는 청계천 풍물시장 청계천과 하늘 주변의 풍경을 의미하는 천변풍경 세계적 브랜드화를 내포한 영문의 ‘Korean Folk Flea Market 등 3편이 선정됐다. 시는 응모된 작품중 ‘갓 밝이 장터’ ‘난장터’ ‘다물시장’ ‘모도리 장’ ‘서울만물장터’ ‘가온 장’ ‘다울마당’ ‘라온 장터’ ‘모꼬지’ ‘어울림장터‘ ’청계풍물장터‘ 등 순 우리말로 된 명칭들도 다수 있었다고 설명했다. 시는 최우수작에 50만원 상당 우수작 3편에 각 30만원 상당 행운상 30편에는 각 2만원 상당의 문화상품권을 시상할 예정이다. 시는 지난 8월21일 서울 도심의 균형발전’과 ‘도시 경쟁력 제고’를 위해 동대문구 신설동 청계천변에 새로운 풍물벼룩시장을 조성한다고 발표한 바 있다. 시장의 조성형태는 열린 공간인 청계천의 이미지를 담은 한자 川 내천 의 형상으로 이뤄진다. 3개의 철골 막 구조물이 연결돼 막힘 없는 칸막이 부스 로 배치되며 1층과 2층을 연결하는 통로 램프 와 조경수가 배치될 예정이다. 건물 전체 높이는 약 14m다. 부대시설로 화장실 쉼터 소규모 공연장 주차장 등이 들어선다. 정문에는 관광안내소가 설치된다.,https://news.naver.com/main/read.nhn?mode=LSD&mid=shm&sid1=260&oid=008&aid=0000832118,90
64564,2007.09.26. 오후 3:45,부동산,파이낸셜뉴스,대전 5개지구 421만㎡ RD특구로 개발,대전시 유성구 둔곡동 등 5개 지구 421만8000㎡가 연구개발특구로 추가 개발된다. 오는 2010년 국제사이언스파크협회 세계총회가 대덕연구개발특구에서 열린다. 과학기술부는 27일 서울 소공동 롯데호텔에서 ‘제5회 연구개발특구위원회’를 열고 대덕연구개발특구 2단계 개발 방안과 2010년 국제사이언스파크협회 세계총회 개최 방안 등을 논의한다고 26일 밝혔다. 연구개발특구위원회는 과학기술부장관을 위원장으로 11개 관계 중앙행정기관장 등 당연직 위원 13명과 특구 개발·운영 관련 분야 민간 위촉위원 7명 등 20명으로 구성되어 있다. 대덕연구개발특구 2단계 개발사업은 대덕특구 혁신클러스터 조성에 필요한 산업용지와 연구개발시설 용지를 공급하기 위한 것으로 1단계에서 유보된 신동·둔곡·용산·전문·문지 등 5개 지구 421만8000㎡를 개발하는 내용을 담고 있다. 과기부와 대전시는 지역 주민의 의견을 수렴하고 ‘2020년 대전권 광역도시계획’과 연계해 개발계획을 수립 내년 8월께 확정 고시한 뒤 2009년 6월과 12월 실시계획 승인과 토지분양을 거쳐 2013년 말까지 사업을 완료한다는 계획이다. 또 이번 회의에서는 지난 7월 대덕특구가 스페인 바르셀로나에서 열린 제24회 국제사이언스파크협회 총회에서 2010년 총회 개최지로 결정된 데 따른 후속조치와 개최 계획 등도 논의된다. 과기부는 70여개국에서 1100여명이 과학도시 관계자들이 참석하는 총회를 통해 대덕특구 브랜드 DAEDEOK INNOPOLIS 의 국제 인지도가 높아지고 과학도시로서의 위상이 강화될 것으로 기대하고 있다. 과기부는 앞으로 해외 클러스터의 성공요인 분석 등을 통해 성공적인 연구개발특구 발전모델을 정립하고 기술이전조직 TLO 강화와 창업보육센터 BI 육성 기술분야별 산·학·연 교류협력 지원 강화 등으로 대덕특구가 시너지 창출을 극대화할 수 있도록 지원할 계획이다.,https://news.naver.com/main/read.nhn?mode=LSD&mid=shm&sid1=260&oid=014&aid=0000343163,90
64565,2007.09.26. 오후 3:45,부동산,서울경제,11월 2만8000여가구 집들이,내달보다 6 400여가구 늘어…지방이 73% 차지 오는 11월에는 전국에서 총 2만8 000여가구가 입주를 시작한다. 지난 10월에 비해 6 400여가구가 증가한 수치이다. 특히 지방 시장의 입주물량이 전체의 73%가량을 차지하며 올 들어 최대 수치를 기록했다. 26일 부동산 정보업체 스피드뱅크에 따르면 11월 입주를 시작하는 단지는 전국적으로 총 49곳 2만8 100가구로 10월 총 46곳ㆍ2만1 615가구 보다 6 485가구 늘어난 것으로 조사됐다. 서울과 수도권 입주물량은 총 7 515가구로 전달 1만2 874가구 보다 41.63% 감소했다. 서울은 지난달보다 34.94%가 감소한 2 387가구가 입주를 앞두고 있다. 특히 1 000가구 이상의 매머드급 단지가 없어 가을 이사철 매매ㆍ전세 시장의 매물 가뭄이 예상된다. 강남권에서는 송파구 한라시영의 재건축 단지인 래미안가락 900여가구 1개 단지만이 입주 준비 중에 있다. 지방 입주물량은 총 2만585가구로 10월 8 741가구 보다 무려 1만1 844가구가 증가하면서 올 들어 가장 풍성한 입주량을 나타냈다. 특히 지방 전체 물량 중 79%에 달하는 1만6 443가구가 경상도 권역에 집중 돼 있다. 송파구 가락동 한라시영을 재건축한 ‘래미안 가락’ 아파트는 총 919가구 14개동 16 27층으로 구성돼 있다. 지하철 5호선 개롱역과 오금역을 걸어서 이용할 수 있는 더블 역세권에 위치해 있다. 용인시 동백동에 위치한 ‘동문굿모닝힐’은 총 512가구 105㎡ 32평형 단일 면적으로 구성돼 있다. 단지 주변에 강남대ㆍ경희대ㆍ명지대ㆍ용인대 등 대학이 많이 밀집해 있고 최근 단국대 죽전캠퍼스가 이전했다. 단지 주변 서울ㆍ수원ㆍ분당 등과 버스로 이동이 용이하고 용인 경전철 어정역이 2008년에 개통 예정이다. 경상남도 창원시에서 반림동 주공1단지를 재건축한 ‘반림노블파크’는 총 2 699가구 35개동 69 188㎡ 21 57평형 로 구성돼 있다. 단지 주변에 반송초ㆍ반송중ㆍ용호고ㆍ중앙고ㆍ문석고ㆍ창원전문대 등의 교육시설이 밀집해 있으며 이마트ㆍ롯데백화점ㆍ파티마병원ㆍ창원종합운동장 등의 편익시설이 위치해 있다.,https://news.naver.com/main/read.nhn?mode=LSD&mid=shm&sid1=260&oid=011&aid=0000200153,90
