,date,cat,co,headline,text,url,week
102115,2008.09.10. 오후 5:30,부동산,파이낸셜뉴스,대학주변 임대사업엔 불황 없다,8·21부동산 대책과 9·1세제개편 방안에 따라 비수도권의 주택임대사업에 대한 양도소득세 중과요건이 완화되면서 지방의 대학 인근 미분양아파트에 투자자들의 관심이 고조되고 있다. 대학 주변 미분양아파트는 대학생들의 전세 및 월세 수요가 꾸준해 임대사업을 통해 안정적 수입을 올릴 수 있기 때문이다. 현재 지방 분양시장은 입지가 좋은데도 미분양된 곳이 많아 선택 폭이 넓고 세금부담도 적어 임대사업 여건이 예전보다 훨씬 좋아졌다. 지방 주택임대업 세부담 경감에 시세차익 기대 10일 부동산업계 등에 따르면 이달 초 정부가 발표한 세제개편 방안은 지방의 주택임대사업자 등록요건이 5가구 이상에서 1가구 이상으로 완화됐고 허용대상 면적도 전용면적 기준 85㎡ 이하에서 149㎡로 확대됐다. 또 임대의무기간도 10년에서 7년으로 줄어들었다. 이에 따라 149㎡ 이하의 지방 아파트를 1가구 이상 구입 7년 이상 임대한 후 되팔 경우 양도세가 중과되지 않고 일반 세율을 적용받아 세부담을 덜 수 있다. 여기에 향후 되팔 때 경기가 좋아지면 시세차익도 누릴 수 있다. 충청·대구·부산권 유망 지방에서 주택임대업으로 가장 유망한 곳은 충청권이다. 대림산업의 충남 연기군 조치원읍 신안리 e편한세상은 115∼181㎡ 983가구 중 115㎡ 163가구가 미분양으로 남아 있다. 고려대 세종캠퍼스와 홍익대 조치원캠퍼스가 걸어서 10분 거리여서 임대수요가 풍부하다. 행정복합도시가 인근에 위치해 향후 시세차익도 예상된다. 분양가는 2억2000만원대로 중도금 60%가 무이자 융자된다. 충남 공주에서는 삼환까뮤가 지난해 분양한 112∼171㎡ 389가구도 주목할 만하다. 이 중 중소형 아파트는 3가구만 남은 상태다. 공주대가 걸어서 5분 거리에 있으며 단지 인근에 신금지구가 조성되고 있어 향후 편의시설도 좋아진다. 분양가는 112㎡가 2억2000만원대다. 3층 이하는 중도금 전액 무이자 융자 혜택이 있다. 충북 청주시 사직동에서는 대우건설과 롯데건설이 컨소시엄을 구성 분양한 사직주공 재건축단지 3599가구도 관심을 가질 만하다. 83∼110㎡ 134가구가 현재 미분양으로 남아 있다. 분양가는 1억7000만∼2억4000만원대다. 충북대가 걸어서 10분 거리에 있으며 주변에 사직공원 청주의료원 등 생활편의시설이 풍부하다. 영남권에서는 대림산업이 대구시 북구 대현동에서 분양한 95∼178㎡ 527가구도 관심단지다. 경북대가 걸어서 15분 거리에 있으며 대구 검단지방산업단지가 인접해 임대수요가 풍부하다. 대구지하철 1호선도 가깝다. 분양가는 105㎡가 2억2000만원대다. 발코니 확장과 새시를 무료로 시공해 준다. 부산지역에서는 SK건설이 금정구 장전1 1구역을 재개발해 분양한 88∼200㎡ 1306가구의 대단지에 관심을 가질 만하다. 부산대 인근에 위치해 임대수요가 많은 편이다. 전북 전주시 덕진동 하가지구에서 분양한 일신건영아파트도 임대사업에 적격이다. 109㎡ 331가구로 구성됐으며 전북대가 차로 5분 거리에 있다. 전주 제2산업단지도 인근에 있어 임대수요가 풍부하다.,https://news.naver.com/main/read.nhn?mode=LSD&mid=shm&sid1=260&oid=014&aid=0002022459,140
102116,2008.09.10. 오후 5:30,부동산,연합뉴스,광역경제권 활성화 노후 산업단지.항만 지역 거점으로 재개발,서울 연합뉴스 박성제 기자 지방 노후산업단지와 노후항만이 지역경제의 거점으로 재개발된다. 국토해양부는 10일 청와대에서 열린 국가균형발전위원회 회의에서 지역의 산업기반 확충과 핵심 규제 해소 지방 이전 기업에 대한 지원강화 등을 내용으로 하는 지역발전기반 구축방안 을 보고했다. 국토부는 지역산업기반 확충에 필수적인 산업용지를 신속히 공급하기 위해 대구 구미 포항 서천 광주.전남 구체적인 지역은 미확정 등 5개 국가산업단지를 내년에 모두 착공하고 공유수면을 매립해 2011년까지 진해 2 통영 2 하동 남해 고흥 신안 등에 조선산업용지 962만㎡를 공급하기로 했다. 지방의 노후산업단지와 노후항만은 복합기능을 갖춘 성장거점으로 재개발된다. 지방의 노후산업단지는 비즈니스 관광 산업 등 복합기능을 갖추기 위해 도시재생사업이 추진되고 부산북항 인천항 군산항 등 10개 노후 항만은 문화 관광 비즈니스 중심으로 재개발된다. 동서남해안 개발과 관련한 복잡한 계획수립 절차 심의는 간소화되고 자연공원에 들어설 수 있는 시설도 합리적으로 완화할 방침이다. 고도 古都 보존법상 역사문화환경지구내의 국유지내에 들어설 수 있는 시설물도 조정된다. 기업의 지방 이전을 장려하기 위해 수도권 소재 본사 및 공장의 지방이전시 법인세.소득세 감면 기한을 2011년말로 3년 연장하고 행정.혁신도시 개발예정지구내의 공장 등이 지방의 다른 지역으로 이전하는 경우 최초 소득발생일로부터 4년간 소득.법인세를 50% 감면할 계획이다. 또 기업도시 개발때는 자회사.계열회사의 토지사용분을 시행자의 직접사용 토지로 인정해 대.중소기업 연계를 강화하고 지방이전기업이 직접 기업도시를 개발하는 경우 최소 개발면적기준을 완화하는 한편 기업이 규제완화를 신청하면 심사를 거쳐 허용하는 맞춤형 규제특례제도 를 도입할 예정이다.,https://news.naver.com/main/read.nhn?mode=LSD&mid=shm&sid1=260&oid=001&aid=0002262766,140
102117,2008.09.10. 오후 5:30,부동산,아시아경제,광역경제 활성화지방이전기업 세제감면 2011년까지 연장,정부가 지방으로 이전하는 기업에 대한 법인세·소득세 감면혜택 기한을 올해 말에서 2011년 말로 연장해주기로 했다. 현재 정부는 수도권에 위치한 기업 본사나 공장이 지방으로 이전할 경우 2년간 50% 5년간 100%의 법인세·소득세를 감면해주고 있다.,https://news.naver.com/main/read.nhn?mode=LSD&mid=shm&sid1=260&oid=277&aid=0002027805,140
102118,2008.09.10. 오후 5:30,부동산,아시아경제,광역경제 활성화용도 지역·지구 통폐합 등 대폭손질,약 400개에 이르는 용도지역ㆍ지구가 절반 수준으로 대폭 줄어들 전망이다. 이 중 행위규제 실적이 없는 109개 지역ㆍ지구제는 폐지된다. 현행 용도지역ㆍ지구를 통합한 뒤 단순화하는 국토관리체계 전반적 재검토 작업이 약 1년간 진행될 전망이다.,https://news.naver.com/main/read.nhn?mode=LSD&mid=shm&sid1=260&oid=277&aid=0002027802,140
102119,2008.09.10. 오후 5:30,부동산,아시아경제,광역경제 활성화노후 산단·항만 재개발 지원방안 마련,대전 대구 부산 전주 등 5 6개 노후 산업단지가 도시재생사업 방식으로 재정비된다. 또 10개 노후항만이 재개발돼 지역경제 거점으로 재탄생할 전망이다. 국토해양부는 노후된 지방 산업단지 및 항만의 복합기능을 확대해 지역경제 거점으로 육성하기 위한 방안을 마련 조만간 구체적 지원방안을 마련할 계획이라고 10일 밝혔다.,https://news.naver.com/main/read.nhn?mode=LSD&mid=shm&sid1=260&oid=277&aid=0002027801,140
102120,2008.09.10. 오후 5:30,부동산,아시아경제,광역경제 활성화5개 국가산단 2009년 착공 완료,대구 구미 포항 광주·전남 서천에 신규 국가산업단지 각각 1개씩 총 5개가 조성된다. 또 진해 2곳 통영 2곳 하동 남해 고흥 신안 등 서·남해안 8개지역의 공유수면을 2011년까지 매립해 조산선업용지 962만㎡를 공급한다.,https://news.naver.com/main/read.nhn?mode=LSD&mid=shm&sid1=260&oid=277&aid=0002027800,140
102121,2008.09.10. 오후 5:25,부동산,아시아경제,사고2008 제3회 아시아건설종합대상 참가작 공모,아시아경제신문은 건설산업 각 분야에 최고의 작품을 공모합니다. u3000올해로 제 3회를 맞는 아시아건설종합대상 은 최고 건설 작품을 선정 시상함으로써 건설문화 창달 및 산업 발전에 기여하고 있는 건설 제전입니다.,https://news.naver.com/main/read.nhn?mode=LSD&mid=shm&sid1=260&oid=277&aid=0002027796,140
102122,2008.09.10. 오후 5:24,부동산,세계일보,10월 전국 3만4000여가구 집들이,◇서울시 용산구에서 10월 말 입주가 시작되는 888가구 규모의 ‘파크타워’ 전경. 추석 연휴가 끝나면 본격화될 이사철을 앞두고 부동산중개업소를 찾는 발걸음이 늘어나고 있다.10일 건설업계와 부동산포털 닥터아파트에 따르면 10월 전국의 입주예정 아파트 주상복합 포함 는 66개 단지 총 3만4271가구에 이를 전망이다. 이는 9월 51곳 2만7790가구 보다 22.32% 늘어난 것으로 은평뉴타운의 입주가 본격화됐던 지난 6월 이후 최대 물량이다. 그러나 서울지역은 11곳 3798가구로 9월 10곳 1만1179가구 에 비해 66.03%나 줄었다. 9월 파크리오 입주를 마지막으로 송파구에 쏟아졌던 대규모 재건축 단지의 입주가 마무리된 때문으로 분석된다. 인천·경기지역은 9월 15곳 4892가구 보다 66.5% 증가한 21개 단지 8145가구가 입주를 준비하고 있다. 지방에서는 29곳 1만7583가구가 집들이 채비를 마쳤다. 서울지역 서울에서는 송파구 장지동 장지지구의 ‘파인타운2·8단지’가 10월1일과 30일에 입주를 시작한다. 파인타운2단지는 13∼15층 6개동 456가구 67∼114㎡ 8단지는 20층 5개동 603가구 56∼83㎡ 로 구성됐다. 분양과 임대가 혼합된 단지로 56㎡형과 67㎡형이 임대물량이다. 서울지하철 8호선 장지역이 걸어서 8분 거리에 있고 단지 앞에 장지초교가 있다. 단지 건너편에 가든파이브 동남권유통단지 문정법조타운 등이 조성될 예정이어서 미래가치가 높다. 용산구 용산동5가 19번지의 ‘파크타워’는 10월 말 입주가 예고돼 있다. 23∼40층 6개동 888가구 규모로 99∼307㎡의 중대형 위주다. 오피스텔 126실도 별도로 구성됐다. 지하철 4호선 이촌역을 도보로 3분 정도면 이용할 수 있고 주변에 이마트 용산전자상가 중대부속병원 등 편의시설이 풍부하다. 용산가족공원과 한강 조망이 가능하고 용산국제업무지구에 속해 메리트가 높다. 강서구 내발산동에서는 ‘마곡수명산파크’가 10월16일부터 입주를 시작한다. 7∼13층 5개동 643가구 109㎡ 규모이며 임대 395가구가 포함됐다. 지하철 5호선 발산역과 마곡역이 걸어서 10분 정도 거리에 있고 우장산 공원과 인접해 주거환경이 쾌적하다. 매매시장은 거래가 거의 없지만 전세는 주변 조망권이 좋고 인근 아파트 전세가보다 저렴한 편이어서 거래가 꾸준하다. 인천·경기지역 경기도에서는 남양주시 가운지구 ‘가운뜨란채’ 총 1042가구가 10월23일부터 입주를 시작한다. 중소형인 95∼105㎡형으로 이뤄져 있고 개발제한구역에서 해제된 택지지구 내에 위치해 환경이 쾌적하다. 서울외곽순환도로 남양주나들목과 인접해 서울 강남·북 접근성이 뛰어나다. 전매 금지로 매매가는 형성돼 있지 않으나 세입자들의 문의가 꾸준히 이어지고 있다. 용인시 청덕동 구성지구에 위치한 ‘휴먼시아’는 100∼112㎡ 988가구로 구성됐으며 10월21일 입주를 시작한다. 경부고속도로와 영동고속도로가 만나는 신갈분기점이 가깝고 동백∼죽전∼분당 간 도로가 택지 중앙을 통과하고 있어 강남 접근성이 좋다. 분양가 대비 프리미엄이 기준층을 기준으로 500만원 정도 형성돼 있다. 인천에서는 동구 송림동 재개발단지인 ‘풍림아이원’이 10월 말부터 입주한다. 52∼145㎡ 1355가구로 구성됐으며 경인고속도로 가좌나들목과 제2경인고속도로와 인접해 서울과 수도권 진입이 수월하다. 지방 광역시 등 대구시 달서구 상인동 ‘상인 e 편한세상’이 10월31일부터 입주한다. 1단지는 109∼158㎡ 총 443가구 2단지는 125∼204㎡ 610가구 등 1053가구의 대단지다. 대구지하철 1호선 상인역이 걸어서 3분 정도 거리에 있고 달서구 명문학군인 영남중·고교가 단지와 도로 하나를 사이에 두고 있어 교육환경이 뛰어난 편이다. 충남 연기군 조치원읍에 위치한 ‘조치원 자이’도 109∼188㎡ 총 1429가구의 대단지로 10월 말 입주를 시작한다. 경부고속국도 청주나들목이 자동차로 10여분 경부선 조치원역이 차로 5분 정도 거리에 있다. 단지 앞을 지나는 1번 국도를 이용해 대전이나 청주 등 인근 대도시에 진입하는 것도 수월한 편이다. 경기침체와 행정도시 축소 우려가 맞물리면서 시세차익을 노렸던 투자자들의 실망 매물이 많이 나오고 있다. 조현일 기자 conan segye.com 10월 주요 입주 예정 단지 위 치 아파트명 총가구수 공급면적 ㎡ 매매가 원 전세가 원 입주 일자 문 의 송파구 장지동 파인타운2단지 456 115D 5억6000만∼6억5000만 1억6000만∼1억9000만 1일 금강부동산 02 3012 8900 용산구 용산동 5가 파크타워 888 126A 11억7000만∼14억8000만 3억∼4억 월말 시티공인 02 797 9119 155A 15억∼17억5000만 4억∼4억5000만 172A 18억5000만∼21억 ― 남양주시 가운동 가운뜨란채3단지 189 96B 전매금지 1억2500만∼1억3500만 23일 부동산타워공인 031 565 1588 106A 1억4500만∼1억5500만 용인시 청덕동 휴먼시아 3블록 988 101A 전매금지 9000만∼9500만 21일 동백 탑 공인 031 284 9977 113F 9000만∼9500만 인천 동구 송림동 풍림아이원 1355 53 1억∼1억3000만 5000만∼5500만 30일 최고공인 032 425 9595 145 3억∼3억3000만 1억5000만∼1억6000만 대구 달서구 상인동 상인e 편한세상 1단지 443 109A 2억4000만∼2억6300만 1억2000만∼1억3000만 31일 대신공인 053 637 7700 159D 3억9000만∼4억1000만 1억7000만∼1억8000만 충남 연기군 조치원읍 자이 1429 109 2억∼2억2500만 7500만∼9000만 월말 명지공인 041 864 1133 188 3억9000만∼4억1000만 1억1000만∼1억3000만 자료 닥터아파트 ⓒ 세계일보＆세계닷컴 www.segye.com 저작자표시 비영리 변경금지 에코피아 가평마라톤대회 세계닷컴은 한국온라인신문협회 www.kona.or.kr 의 디지털뉴스이용규칙에 따른 저작권을 행사합니다.,https://news.naver.com/main/read.nhn?mode=LSD&mid=shm&sid1=260&oid=022&aid=0001986555,140
102123,2008.09.10. 오후 5:21,부동산,서울경제,장위뉴타운1구역 재개발사업안 통과,조만간 시행인가 받을듯 서울 성북구 장위뉴타운1구역과 동대문구 답십리동 465번지 ‘대농ㆍ신안 주택재건축정비사업 조합’ 안이 서울시 건축위원회를 통과해 조만간 사업시행 인가를 받을 것으로 전망된다. 서울시는 지난 9일 제25차 건축위원회를 열고 성북구 장위동 144 24번지 일대 8만145㎡에 공동주택 및 부대복리시설 등을 짓는 ‘장위제1재정비촉진구역 주택재개발정비사업’ 안을 조건부로 동의했다고 10일 밝혔다. 이에 따라 장위뉴타운1구역에는 지하2층 지상29층 높이의 아파트 8개동 733가구 이 건립된다. 용적률 229.92% 건폐율 14.79%가 적용된다. 위원회 측은 “부대복리시설에 노약자들을 위한 접근로를 확보하고 환기와 채광을 고려할 것을 조건으로 달고 통과시켰다”고 설명했다. 위원회는 또 동대문구 답십리동 465번지 2만3 913㎡에 아파트 503가구를 짓는 ‘대농ㆍ신안 주택재건축정비사업조합’ 안을 조건부로 통과시켰다. 하지만 위원회는 노원구 중계동 156 29번지에 아파트 273가구를 건설하는 ‘제일주택재건축정비사업’ 안과 마포구 용강동 91 1번지에 아파트 494가구를 짓는 ‘용강3주택재개발정비사업’ 안을 재심 의결했다.,https://news.naver.com/main/read.nhn?mode=LSD&mid=shm&sid1=260&oid=011&aid=0001969509,140
102124,2008.09.10. 오후 5:21,부동산,서울경제,분양단지 들여다보기 성동구 서울숲 아이파크,편의시설 풍부·교육환경도 좋아 3.3㎡당 평균 분양가 1 500만원선 결정될듯 인근 뚝섬지구·뉴타운등 개발 후광효과 기대 서울 성동구는 지리적으로 강북에 속하지만 강남과 가까워 재개발 예정지로 일찍부터 주목 받았던 곳이다. 실제 인근에서 뚝섬 상업지구 개발이 추진되고 있고 왕십리 뉴타운 및 금호ㆍ옥수동 재개발이 예정돼 있어 해당 지역 전체가 개발 열기에 휩싸여 있다. 현대산업개발은 오는 9월 말 서울 성동구 송정동에서 장미ㆍ세림연립을 재건축한 ‘서울숲 아이파크’를 분양할 예정이다. 송정동은 지난 1999년 이후 신규 아파트 공급이 없었던 곳이다. 지하2층 지상15층 6개동 규모로 73 154㎡형 241가구로 구성돼 있다. 이 중 일반분양 물량은 88가구. 조합원 분양 후 물량이므로 층고 배정 등을 꼼꼼히 따져볼 필요가 있다. 3.3㎡당 평균 분양가는 1 500만원선에서 결정될 것으로 보인다. 인근 뚝섬 상업지구에서 분양되고 있는 물량보다는 저렴하고 성수동이나 행당동의 시세와는 비슷한 수준이다. 하지만 후분양 물량이기 때문에 12월로 예정된 잔금 상환일이 가깝게 남은 점은 부담스럽다. ‘전세 끼고 매입’도 당분간은 어려울 것으로 전망된다. 잠실에서 대규모 입주가 시작되면서 해당 지역 아파트 전세 문의가 뚝 끊긴 탓이다. 송정동 건영공인중개업소의 한 관계자는 “잠실에서 비교적 싼 전세 물량이 급증해 전세 수요가 사라졌다”며 “잠실 입주가 완료될 때까지는 당분간 이런 현상이 지속될 것으로 보인다”고 말했다. 교통 여건은 비교적 양호한 편이다. 영동대교를 이용해 강남 진ㆍ출입이 수월하고 동부간선도로 이용 역시 편리하다. 단지 주변에 서울 지하철5호선 군자역과 7호선 어린이대공원역이 있기는 하지만 모두 1㎞ 정도 떨어져 있어 역세권 형성에 따른 프리미엄은 기대하기 어려울 것으로 전망된다. 3.5 4베이의 평면 설계로 채광을 극대화했으며 안방과 주방공간을 강조한 평면이 돋보인다. 6개동 모두 주민광장을 중심으로 배치돼 단지 개방감을 높였고 지상 주차를 최소화한 보행자 중심의 단지로 조성됐다. 성수동 이마트를 비롯해 롯데백화점 입점이 예정된 스타시티 등이 들어서 생활편의시설이 풍부하다. 교육환경도 잘 갖춰져 있어 단지 북쪽에 송원초등학교가 내년 3월 개교할 예정이고 장평중ㆍ건대부중고ㆍ세종대ㆍ건국대가 가깝다. 중랑천 및 어린이대공원ㆍ서울숲 등의 이용이 편리하며 인근 뚝섬 한강공원도 생태공원으로 조성될 예정이다. 12월 입주를 앞두고 있으며 모델하우스는 9월 말 사업지 내에서 문을 열 계획이다.,https://news.naver.com/main/read.nhn?mode=LSD&mid=shm&sid1=260&oid=011&aid=0001969508,140
102125,2008.09.10. 오후 5:21,부동산,서울경제,토지 빌려줬더니 20년이상 농사지었다고 자기땅이라는데…,알쏭달쏭 부동산 교실 임차인 매년 임대료 지불… 소유권 주장못해 Q. 장씨가 충청도에 있는 본인의 땅을 임차인 최씨에게 임대해준지 어느덧 20년이 넘었다. 임차인 최씨는 1년에 한 차례씩 수확한 농작물 일부를 보내주고 있었다. 그런데 임차인 최씨가 지난해부터 임대료를 내지 않고 있다. 20년 이상 농사를 지었으니 토지가 자신의 소유라면서 앞으로도 임대료를 지불하지 않겠다는 것이다. 장씨는 처음부터 계약서 없이 구두로만 계약을 맺었는데 임차인 최씨의 주장처럼 20년이 지나면 토지 소유권이 임차인에게 넘어가는지 궁금하다. A. 토지 소유주의 관리가 소홀하여 장기간 방치되거나 경계가 불분명해 본인의 땅을 인근 주민이 사용하는 경우가 있다. 이 경우 토지를 사용하는 자가 20년 이상 점유하게 되면 토지의 소유권이 상실될 수도 있다. 민법에서는 ‘20년간 소유의 의사로 평온·공연하게 부동산을 점유하는 자는 등기함으로써 그 소유권을 취득한다’고 규정하고 있다 민법 제245조 제1항 참조 . 이것을 점유시효취득이라 하며 ▦소유의 의사로써 점유하고 있을 것 ▦점유가 평온·공연히 행하여졌을 것 ▦일정한 기간 계속할 것 등의 요건을 갖춰야 한다. 시효기간은 부동산은 20년이며 점유자에게 이미 등기가 되어 있는 때에는 10년이다. 가령 토지 매매 이후 그 매매에 대해 무효ㆍ취소 사유가 있는데도 무효ㆍ취소가 안 된 채 20년 이상 점유한 경우 소유자임을 믿고 점유한 경우에 시효취득을 인정하는 것이다 대법원 1991.1.15. 선고 90다8411 8428 반소 판결 . 위 사례에서 최씨는 이미 임대료 및 경작물을 지불해왔기 때문에 평온ㆍ공연하게 부동산을 점유했다고 판단하기 어렵다. 실제 토지의 임대차계약서가 없어도 수 차례에 걸쳐 토지 사용료를 지불하였으면 토지를 임차했다는 것으로 간주해 임차인의 자주점유가 성립된다고 볼 수 없다. 즉 점유 기간과 상관없이 토지 사용료를 지급한 임차인의 토지 시효 취득은 불가능하다. 따라서 임차인 최씨와 같이 타인의 토지인 것을 알면서도 무단으로 농사를 짓는 경우에는 점유취득시효가 인정되지 않기에 소유권을 주장할 수 없으며 단지 자신의 경작물에만 권한이 있다. 또한 장씨는 임차인 최씨를 상대로 임대료를 요구할 수 있고 이에 응하지 않는 경우 명도를 진행할 수 있다.,https://news.naver.com/main/read.nhn?mode=LSD&mid=shm&sid1=260&oid=011&aid=0001969507,140
