,date,cat,co,headline,text,url,week
67406,2007.10.24. 오후 3:09,부동산,파이낸셜뉴스,성원건설 중동 박람회 100% 분양 완료,성원건설은 지난 16∼18일 3일간 열린 중동최대의 부동산 박람회인 ‘시티스케이프’에서 총 5억5000만달러 규모의 성원 상떼뷰 컬처빌리지 주상복합 아파트 청약을 100% 완료했다고 24일 밝혔다. 다만 이번 기간 동안 공개하지 않은 200억원 규모의 상가부분과 200억원 규모의 펜트하우스는 경쟁 입찰할 예정이다. 이번에 받은 청약은 청약금 환불 없이 모두 중도금으로 전환하는 형식으로 모든 청약이 계약으로 이어져 사실상 분양완료라고 성원건설측은 설명했다. 상떼뷰 컬처빌리지 주상복합 아파트는 두바이 크리크 Creek 전체를 조망할 수 있고 2010년에 완공예정인 두바이 메트로 전철 역사 바로 앞에 위치하고 있다. 이번 박람회 기간동안 성원건설의 부스에는 두바이 국왕 쉐이크 모하메드 빈 라시드 알 막툼 UAE 총리를 포함해 5000여명의 방문객이 다녀갔다. 영국 미국 독일 UAE 러시아 인도 투자자들이 주로 청약했고 소수의 한국 투자자들도 있었다. 성원건설 두바이지사 김범준 차장은 “이번 청약완료로 인해 수백억원에 달하는 추가 순이익을 예상하고 있다”면서 “이번 분양 성공을 발판으로 7개의 인공 섬에 조성하는 초호화 리조트 프로젝트인 ‘더 라군즈 프로젝트’ 등 지속적으로 두바이 신규 사업을 추진할 계획”이라고 말했다. 한편 컬처빌리지는 두바이 국영 부동산 개발사인 두바이 프로퍼티즈가 주도하는 최고급 주상복합 단지 개발 프로젝트다. 런던필하모닉오케스트라가 엔터테인먼트 컨설팅을 하고 베르사체가 호텔을 개발 운영하는 등 입지 뿐 아니라 모든 내용면에서 단연 최고급이라는 평가를 받고 있다.,https://news.naver.com/main/read.nhn?mode=LSD&mid=shm&sid1=260&oid=014&aid=0000352358,94
67407,2007.10.24. 오후 2:51,부동산,파이낸셜뉴스,건설업계 PF전담 자회사 설립 잇따라,서울 용산역세권 등 대규모 프로젝트파이낸싱 PF 사업이 잇따라 나오면서 건설업체가 디벨로퍼 영역까지 진출하고 있다. 이는 PF컨소시엄 구성에서 단순 시공역할만 하기 보다는 부동산개발부터 자금조달 분양 및 임대 자산관리운영 등 전반에 걸쳐 주도권을 잡고 추진하기 위해서다. 24일 건설업계에 따르면 SK건설과 롯데건설 등 대형건설업체가 디벨로퍼 역할을 하는 부동산전담 자회사 설립을 추진하고 있다. SK건설은 부동산 임대 및 공급업을 사업 목적으로 하는 리바이던에셋을 신규로 설립키로 했다. SK건설은 이를 위해 리바이던에셋 주식 990만주를 495억원에 취득 지분율이 전체 주식의 99%에 달하고 있다. 이 회사 관계자는 “리바이던에셋을 통해 복합개발사업의 개발부터 운영까지 모든 프로세스를 맡도록 할 계획이다. SK건설은 현재 수원과 인천 등에서 SK네트웍스 SK케미컬 등 그룹 계열사가 보유한 부지 개발을 진행하고 있고 인천도화구역 PF개발사업 아산배방 PF개발사업 등 공모형 PF개발사업에 사업적격자로 선정되는 등 대규모 복합PF개발사업에 적극 나서고 있다. 롯데건설도 롯데쇼핑과 함께 부동산개발사업을 전담할 롯데자산개발을 설립키로 했다. 롯데쇼핑과 롯데건설이 각각 60대40으로 지분 투자한 롯데자산개발은 그룹이 보유한 부동산의 개발 등을 전담해 추진할 계획이다. 롯데자산개발의 업무영역은 토지작업부터 각종 인허가 프로젝트파이낸싱 PF 임대 컨설팅 투자자문 등 부동산개발사업의 전담을 맡게 된다. 롯데건설측은 “롯데자산개발의 첫 번째 사업은 판교신도시 PF사업이 될 가능성이 높다”면서 “앞으로 대규모 PF사업이 줄을 이을 것라는 전망에 대비하기 이한 측면도 있다”고 말했다ㅣ 업계 관계자는 “주택분양이나 공공공사 수주 등만으로는 현재의 어려움을 극북하기 어렵고 대규모 PF사업이 계속 쏟아져 나올 것으로 보여 시장 선점 차원에서 디벨로퍼 영역에 적극 진출하는 것 같다”고 설명했다.,https://news.naver.com/main/read.nhn?mode=LSD&mid=shm&sid1=260&oid=014&aid=0000352345,94
67408,2007.10.24. 오후 2:41,부동산,매일경제,김포 걸포동 ‘오스타 파라곤’ 11월 초 분양 예정,성우 종합건설과 동양건설산업은 공동 시공으로 오는 11월 초 경기도 김포시 걸포동에 지상 21 22층 30개 동 규모의 김포 걸포 오스타 파라곤 을 분양할 예정이다. 원가연동제 분양가상한제나 채권입찰제 등이 적용되지 않고 입주 후 즉시 매매가 가능하다. 입주는 2010년 초 예정이다. 114㎡431가구 131㎡ 58가구 139㎡ 71가구 152㎡ 445가구 169㎡ 389가구 195㎡ 227가구 215㎡ 9가구 249㎡ 6가구 등 총 1 636가구이다. image0 인근에 김포 신도시 고속화 도로가 있으며 2008년 1월 완공예정인 일산대교 진입이 가능해 일산신도시와 서울로의 이동이 쉽다. 또 송포 인천간 도로가 2008년 12월 올림픽 대로 연장은 2009년 완공 되며 사업지구에서 김포공항까지 이어지는 김포경전철은 2012년 완공될 예정이다. 단지와 인접해 초등학교가 신설예정이고 금파 중 김포 고등학교 김포 대학교 인천 카톨릭대가 있다. 일산대교를 거쳐 일산 롯데 백화점 일산 뉴코아 백화점이 이용이 가능하며 김포 롯데 홈플러스 우리병원 메디컬 센터 김포 시청 등도 이용도 가능하다. 단지를 에워싸고 있는 11만 5천여㎡ 약 4만여 평 규모의 걸포 중앙 공원과 북변공원 신향공원이 접해 있다.,https://news.naver.com/main/read.nhn?mode=LSD&mid=shm&sid1=260&oid=009&aid=0000633521,94
67409,2007.10.24. 오후 2:37,부동산,아시아경제,인터뷰삼정건설 공동시설 갖춰진 전원주택 새 트렌드 될 것,“고밀도 아파트의 답답하면서 건강치 못한 점에서 벗어나면서도 모든 공동시설이 갖춰진 고급전원주택이 앞으로 주택시장의 새로운 트렌드가 될 것으로 확신합니다.” 국내 최대 규모 전원단독주택을 추진중인 대전소재 삼정건설 주 전병호 53.사진 전무이사는 미래의 아파트 시장에 대해 이같이 말했다. 전 전무는 “전원주택이 흔히 공동 관리운영이 안되고 주변 체육시설과 각종 커뮤니티 등이 없는 부분 때문에 실패한 경우가 많은 데 이를 극복하면서 지어진 단독주택이 앞으로 주거문화의 트렌드로 정착 될 것”이라고 강조했다. 이같은 새로운 주거문화가 삼정건설이 추진하고 있는‘삼정킹스우드’이다. 킹스우드는 충북 옥천군 군북면 대청호 주변 27만8000m2 8만4000여평 에 위치한다. 총 225가구 단독주택 1필지 595 661㎡ 125가구 가격 가구당 8억여원 빌라 전 가구 지상2층 100가구 214㎡ 211㎡ 254㎡ 가격 4억 4억5천만원선 를 진행중이다. 전 전무는 “이탈리아 토스카나 지방은 르네상스 주택문화가 꽃 피우는 곳으로 이 지역에 대규모 고급단독전원주택이 주된 주택트렌드인 데 이런 분위기가 앞으로 우리 주택문화의 미래라고 여겨 이를 충청권에 옮겨 왔다”고 말했다. 그는 “아파트는 소품종 대량생산인데 비해 단독전원주택은 다품종 소량생산이고 이에 따라 허가 절차나 설계에서부터 많은 부담이 돼 대기업에서 접근하기 어렵고 대단위 토지 매입이 필요하기에 아주 적은 소규모 주택업체도 나서기 곤란한 점이 있다 며 단독전원주택은 중견 건설업체만이 지을 수 있는 블루오션부분이어서 이 길을 개척하고 있다”고 말했다. 현재 킹스우드는 전국에서 소비자들의 문의가 잇따르고 있으며 2009년 6월 입주를 목표로 분양중이다. 삼정건설 주 은 지난 85년 설립돼 매출 1천억원에 이르는 대전지역 중견건설업체로 전국에 아파트 고급빌라 등 주택사업 뿐 아니라 정부청사 등 각종 건설분야에서 두각을 보이고 있는 업체다.,https://news.naver.com/main/read.nhn?mode=LSD&mid=shm&sid1=260&oid=277&aid=0000011701,94
67410,2007.10.24. 오후 2:32,부동산,매일경제,성원건설 두바이 주상복합 상떼뷰 컬쳐 빌리지 청약 100% 완료,성원건설은 지난 10월16 18일 3일간 열린 중동최대의 건설 부동산 컨벤션인 시티스케이프 성원 상떼뷰 컬쳐빌리지 주상복합 프로젝트의 청약을 완료했다. 이번 기간 동안 공개하지 않은 200억 원 규모의 상가부분과 200억 원 규모의 펜트하우스는 경쟁 입찰예정이다. 상떼뷰 프로젝트는 컬쳐빌리지 전체와 두바이 크리크 전체를 조망하는 중심부에 위치하며 현재 건설되고 있는 2010에 준공 예정인 두바이 메트로 전철 역사 바로 앞에 위치하고 있다. 이번 행사 기간 동안 성원건설의 부스에는 두바이 국왕 쉐이크 모하메드 빈 라시드 알 막툼 UAE 총리를 포함해5천 여명의 방문객이 다녀갔으며 주 청약자들은 영국 미국 독일 UAE 러시아 인도 투자자들이었으며 소수의 한국 투자자들도 있었다. 성원건설 김범준 차장은 “이번에 받은 청약은 청약금 환불 없이 중도금으로 전환하는 청약으로서 모든 청약이 본 계약으로 이어지기 때문에 사실상의 분양 완료라 할 수 있고 성원건설과 성원이 개발 중 인 상떼빌 비즈니스베이가 각종 현지 언론을 통해 집중 조명되었었던 점은 상떼빌 투자자들의 높은 투자신뢰도에 의한 것으로 해석된다”고 말했다. 성원건설은 지난 2년간 해당지역의 입지적 특성을 고려하여 3억불 2800억 원 규모의 41층짜리 주거용 건물과 2억5천 만불 2300억 원 규모의 33층짜리 사무용 건물이 하나의 기단부로 연결되어 있는 주상복합 프로젝트를 준비해왔다. 성원건설은 이번 청약완료로 인해 수백 억 원에 달하는 추가 순이익을 예상하고 있으며 상떼뷰 컬쳐빌리지 프로젝트의 성공을 발판으로 7개의 인공 섬으로 이뤄진 초호화 리조트 프로젝트인 더 라군즈 프로젝트를 비롯한 다수의 프로젝트들을 연이어 발표할 예정이며 아울러 두바이의 선도적 개발사들과 함께 공동 시행 및 시공 참여 등의 방법으로 중동 및 UAE 시장에서의 확장을 가속화할 전망이다.,https://news.naver.com/main/read.nhn?mode=LSD&mid=shm&sid1=260&oid=009&aid=0000633519,94
67411,2007.10.24. 오후 2:32,부동산,매일경제,땅부자 1%가 토지 57% 독식,image0 우리나라 땅부자 1%가 개인소유 토지면적의 57%를 갖고 있는 것으로 나타나 소유 편중이 심한 것으로 나타났다. 규모면에서는 서울 면적 605㎢ 의 45배다. 행정자치부는 24일 2006년 12월말 현재 토지·임야대장에 등재된 등록사항과 주민등록 전산자료를 연계해 토지소유현황 통계를 작성·공표했다. 우리나라 국토면적은 총 9만9678㎢이며 이중 국공유지·법인 등을 제외한 개인 보유 민유지는 전체 면적의 56% 5만5792㎢ 로 가장 큰 비중을 차지하고 있다. 개인별 토지소유현황은 1367만명으로 전년대비 33만명이 증가해 총인구 4899만명 중 27.9%가 토지를 소유하고 있다. 전체 토지소유자 중 상위 50만명의 소유비율은 56.7%로 2005년 57.0% 보다 0.3%포인트 감소했다. 공유지 30.6% 3만540㎢ 법인소유 5.5% 5461㎢ 등이다. 가구별 토지소유현황은 1097만가구로 총가구 1 833만가구 중 59.8%가 토지를 소유했다. 상위 50만가구의 소유비율은 58.9%로 2005년 59.3% 보다 0.4%포인트 감소한 것으로 나타났다. 연령대별 토지소유현황을 살펴보면 50대 27% 60대 25% 40대 19% 순으로 토지를 많이 소유했다. 20세 미만이 소유한 토지는 142㎢ 0.3% 로 나타났다. 거주지별 토지소유현황은 전국 개인토지의 35.3% 약 1 3 를 수도권 거주자가 소유한 것으로 나타났다. 행자부는 매년 토지소유현황 통계와 보도자료를 행정자치부 홈페이지 www.mogaha.go.kr 와 정부부동산정보알리미 www.budongsan.go.kr 에 공개했다.,https://news.naver.com/main/read.nhn?mode=LSD&mid=shm&sid1=260&oid=009&aid=0000633517,94
67412,2007.10.24. 오후 2:15,부동산,파이낸셜뉴스,제7회 fn하우징 파워브랜드 大賞 당신의 선택이 삶의 질을 바꾼다,아파트 브랜드 아파트를 선택하는 하나의 ‘잣대’ 역할을 넘어 ‘삶의 질’까지 좌우한다.’ 이같은 사실은 파이낸셜뉴스가 올해로 일곱번째로 실시한 ‘하우징 파워브랜드 대상 선정을 위한 브랜드 인지도 조사’ 결과 나타났다. 지난 9월부터 한 달여간 일반인 대상 직접설문과 온라인을 통한 네티즌 설문 등을 통해 소비자 1만5450명을 대상으로 실시한 이번 조사에서 브랜드는 아파트의 투자가치를 상승시킬 뿐 아니라 소비자들의 삶의 질에도 큰 영향을 미치는 것으로 조사됐다. 또 응답자 중 대다수는 아파트 브랜드가 주거문화 향상에 크게 기여하고 있다고 답했다. 이번 조사에서 실제 구입자 10명 중 2명 이상이 입지여건이 좋지 않더라도 브랜드가 좋아 구입한 경험이 있다는 조사결과는 이를 방증하는 대목이다. 아울러 아파트 구입할때도 입지보다 브랜드를 먼저 보는 것으로 나타났다. 하지만 현재 거주하는 아파트에 대해 입주자들 절반이상이 만족을 못느끼고 있으며 그 이유로 소음이나 습기 등 구조적인 문제를 꼽아 건설업체들이 화려한외장 경쟁보다 내실을 더 신경써야 할 것으로 지적됐다. “입지여건 좋지 않아도 브랜드 좋으면 OK” 이번 설문조사에서 ‘입지가 다소 좋지 않지만 브랜드 때문에 아파트를 구입한 적이 있는가’라는 물음에 전체 응답자 중 23.5% 1만1805명 가 ‘있다’고 답했다. 이는 상당수 소비자가 주택 구입때 브랜드를 입지여건보다 우선시한다는 결론이다. 이에 따라 건설업체의 아파트 분양에서 브랜드가 주요 변수로 자리매김 한 것으로 분석할 수 있다. 실제로 ‘아파트 구입때 우선 고려하는 사항’에 대한 질문 복수응답 에서 소비자들은 ‘브랜드’를 ‘가격’과 ‘교통’에 이어 세번째로 꼽았다. 과거 주택구입의 주요 잣대였던 입지와 교육여건을 제친 것이다. 아파트 구입 청약 의 최우선 고려 조건으로 29.5%인 9585명이 ‘가격’을 꼽았고 다음으로 교통 25.7% 브랜드 18.9% 입지여건 17.6% 교육 8.1% 등의 순이었다. 하지만 성별로 남성은 브랜드를 여성은 입지여건을 먼저 꼽아 대조를 이뤘다.남성은 응답자의 21.6% 3511명 가 브랜드를 꼽아 입지 16.5% 2690명 보다 훨씬 앞섰다. 그러나 여성은 16.2% 2630명 가 브랜드를 먼저 꼽은 데 비해 입지여건을 꼽은 응답자는 18.8% 3050명 로 입지여건을 브랜드보다 중시하고 있다. 이처럼 브랜드가 주택구입의 주요 잣대로 등장하면서 브랜드 프리미엄도 보편화되고 있다. ‘입지여건이 비슷하다면 최고 브랜드의 아파트에 얼마를 더 투자할 수 있는가’라는 질문에 2명 중 1명 가량이 3000만원 이상을 투자할 의향이 있다고 응답했다. 특히 전체의 50’.9% 7866 가 ‘3000만원미만’을 꼽았고 42.6% 6279명 가 ‘3000만원이상∼6000만원 미만’이라고 답했다. ‘6000만원이상∼1억원’이라고 답한 사람도 7.7% 1195명 나 됐다. 브랜드 “삶의 질까지 좌우” 이처럼 소비자들의 생활속에 브랜드 프리미엄 확실히 자리잡고 있는 가운데 이젠 브랜드가 삶의 질까지 좌우하는 것으로 분석됐다. ‘브랜드가 투자가치 뿐 아니라 실제 삶의 질까지 영향을 미치는가’라는 질문에 전체 1만5450명 중 85.1% 1만3155명 가 ‘그렇다’고 답했다. 이에 비해 ‘아니다’라고 답한 사람은 14.9%에 불과했다. 또 ‘브랜드가 분양가에 어느정도 영향을 미치는가’에 대한 질문에 75.3% 1만1634명 가 ‘많이’라고 답했다. 반면 24.2% 3740명 가 ‘조금’이라고 답변해 대다수 소비자는 브랜드가 삶의 중요한 부분으로 자리잡고 있지만 이로 인해 분양가가 올라가는 부작용이 있다고 여기고 있었다. ‘브랜드가 주택문화 발전에 기여한다고 생각하는가’라는 물음에 대해서는 81.4% 1만2578명 이 ‘그렇다’고 답해 브랜드가 주택문화 발전에도 기여하는 것으로 나타났다. “아파트 소음·습기 등 구조적 문제 개선해야” ‘지금 사는 아파트에 만족하느냐’는 질문에 응답자의 62.2% 9601명 가 ‘아니다’고 답했으며 만족한다는 응답자는 37.8% 5849명 에 그쳐 주택건설업체들이 아파트 건설에 더욱 더 신경써야 할 것으로 조사됐다. 불만족스럽게 생각하는 소비자들을 성별로 보면 여성이 63.4% 남성은 61.0%로 여성이 많았다. 이는 여성이 집에서 머무르는 시간이 많기때문이다. 불만족 이유 복수응답 중 39.5% 8930명 가 ‘소음 습기 내부시설불량 등 구조적시설 개선’을 꼽았다. 21.9% 4939명 는 ‘친환경성 결핍’ 15.0% 3409명 가 ‘교육시설 접근성 부족’ 14.3% 3263명 는 ‘교통불편’ 9.3% 2107명 는 ‘입지선정 잘못’을 지적했다. 낡은 아파트에 거주할 경우에는 브랜드 인지도가 높은 아파트로 명칭을 바꾸는 게 좋다고 생각하는 응답자가 69.8%를 차지했다.,https://news.naver.com/main/read.nhn?mode=LSD&mid=shm&sid1=260&oid=014&aid=0000352325,94
67413,2007.10.24. 오후 2:13,부동산,머니투데이,오세훈 시장 2010년 세계디자인올림픽 개최,머니투데이 정진우 기자 오는 2010년 서울에서 세계 디자인 올림픽 이 개최된다. 오세훈 서울시장은 24일 시청 기자실에서 가진 기자간담회에서 서울이 2010년 세계 디자인 수도로 선정된만큼 앞으로 3년후에 세계적인 디자이너들과 디자인 관련 기업들이 모여 축제를 여는 세계 디자인 올림픽 을 개최할 것 이라고 밝혔다. 오 시장은 세계 디자인 올림픽은 국제 디자인 콘퍼런스 와 국제 디자인 전시회 디자인 상 제정 디자인 모뉴먼트 설치 디자인 페스티벌 등 5가지 프로그램을 중심으로 진행될 예정이다 고 말했다. 그는 이어 서울이 세계 디자인 수도로 선정된 것은 앞으로 세계속에서 디자인 도시로 성장할 수 있는 가능성을 확인시켜 준 것 이라며 디자인 선진 도시가 될 수 있도록 각종 국제 컨퍼런스와 디자인 관련 산업 육성 등 시 차원에서 나설 것 이라고 말했다. 디자인 올림픽 추진과 관련 오 시장은 내년 3월까지 국제산업디자인단체 총연합회와 디자인 올림픽을 어떻게 추진할 것인지에 대해 협의하고 내용을 확정할 것 이라고 설명했다. 한편 오 시장은 시청 건물에 걸어 놓은 2010 세계 디자인 수도 선정 의 내용이 담긴 대형 현수막에 대해 도시 디자인 개선을 위해 서울시가 대형 현수막을 없애자고 했는데 정작 서울 시청 건물에 대형 현수막을 걸어 놓아 유감스럽게 생각한다 며 바로 철거하겠다고 말했다.,https://news.naver.com/main/read.nhn?mode=LSD&mid=shm&sid1=260&oid=008&aid=0000842888,94
