,date,cat,co,headline,text,url,week
56300,2007.06.14. 오후 5:32,부동산,한국경제,건교부ㆍ산하기관 인사바람에 술렁,건설교통부와 도로공사 등 산하기관들이 인사바람에 술렁이고 있다. 도로공사 토지공사 한국감정원 등 3개 산하기관장이 교체되거나 임기 만료되는 데다 이달 말 건교부 내에 1국 3개팀이 신설되는 것을 계기로 사무관들을 포함한 큰 폭의 자리 이동이 예상되기 때문이다. 14일 건교부에 따르면 도로공사는 이달 초 임기가 끝난 손학래 사장 후임을 공모 중이다. 공모에는 권도엽 전 건교부 정책홍보관리실장과 진철훈 전 제주국제자유도시개발센터 이사장 정해수 현 도공 부사장 등 9명이 참여했다. 사장추천위원회는 9명의 후보에 대한 심사를 마쳐 15일 2명을 추천할 계획이다. 현재 권 전 실장이 유력한 후보로 거론되고 있는 가운데 주공 사장 공모에도 참여했던 진 전 이사장과 정 부사장의 기용 가능성도 점쳐지고 있다. 권 전 실장은 정통 관료 출신으로 건교부와 도로공사 간 현안을 매끄럽게 처리할 적임자라는 평가를 받고 있다. 진 전 이사장은 지난해 지방선거에서 열린우리당 후보로 제주지사에 출마했다 낙선한 적이 있다. 도로공사는 임원 5명의 임기가 8월에 끝나 인사폭이 클 것으로 보인다. 부사장 기획·영업·건설·기술본부장 등이 대상이며 이 중 1명이 부사장으로 승진하고 나머지는 물러날 전망이다. 이와 함께 토공 사장은 올 11월 한국감정원장은 12월에 각각 임기가 끝난다. 아직 임기가 몇 달 남아있어 후보로 뚜렷하게 거론되는 사람은 없다. 사장과 원장 공모 절차가 시작되는 9월쯤에는 후보가 가시화될 것으로 보인다. 토공은 설립 이래 세 번째 내부 승진이 나올지 주목된다. 토공에서는 김재현 사장과 김윤기 전 건교부 장관 1997년∼2001년 1월 등 두 명이 내부 승진으로 최고경영자 자리에 올랐다. 한편 건교부에선 이르면 이달 말 늦어도 7월 초까지는 주택정책을 총괄하는 주거복지본부에 기존 토지국과 국민임대주택기획단 등 2개국 외에 주택기금팀 주택건설기획팀 주택공급팀 등 3개 팀으로 구성되는 주택건설기획국이 신설돼 총 3국·17개 팀으로 확대된다. 또 주거복지본부장은 다급 2급 상당 에서 가급 1급 상당 으로 승격된다. 승격된 본부장은 현 서종대 본부장 행시 25기 이 그대로 맡을 예정이다. 건교부는 주택정책을 총괄하는 차관급 본부 신설을 정부에 요청했지만 받아들여지지 않았다 며 정부 조직을 개편하는 것이어서 국무회의를 거쳐야 하지만 행정자치부 기획예산처와 거의 협의를 마친 상태 라고 설명했다. 또 건교부의 일부 지방청장과 본부 국장급의 자리 교체도 이뤄질 전망이다. 송용찬 전 열린우리당 전문위원 행시 22기 은 행정중심복합도시건설청 차장으로 자리를 옮기고 유승화 현 차장은 한국시설안전기술공단 이사장으로 갈 것으로 보인다. 개방직인 감사관 토지기획관 홍보기획팀장 자리는 현재 공모 중이다. 건교부는 이와 함께 주거복지본부 조직 개편과 맞물려 부이사관과 서기관 사무관 인사도 연쇄적으로 단행할 예정이어서 전체 인사 폭이 클 것으로 예상된다.,https://news.naver.com/main/read.nhn?mode=LSD&mid=shm&sid1=260&oid=015&aid=0000970365,75
56301,2007.06.14. 오후 5:29,부동산,한국경제,지방 투기과열지구 일부 해제 … 연쇄부도 방지,건설교통부는 중견 주택건설업체 ㈜신일의 부도와 관련 이달 중 부산 대구 광주 등을 투기과열지구에서 해제하기로 했다. 투기과열지구 해제가 미분양 물량을 줄이고 아파트 거래 활성화로 이어져 지방건설업체에 호재로 작용할지 주목된다. 건교부는 14일 지방 건설업체들의 경영난 가중 우려에 따라 지방의 투기과열지구를 해제하기 위한 절차를 조만간 밟을 계획이라고 밝혔다. 투기과열지구 해제 1순위로 꼽히는 지역은 아파트 미분양 물량이 많은 부산 대구 광주 등이다. 대전 울산 등은 이번에는 포함되지 않을 것으로 보인다. 건교부는 투기과열지구를 조기에 해제하기 위해 주택정책심의위원회를 소집하지 않고 서면으로 의결할 것으로 알려졌다. 이용섭 건교부 장관은 지난달 한 강연회에서 5월 말 또는 6월 초에 주택정책심의위원회를 열 것 이라고 밝혔으나 신도시 추가 발표로 인해 절차가 늦어졌다. 이달에 투기과열지구에서 해제되는 곳은 올 8월 말까지 아파트 전매가 가능하다. 9월부터는 분양가 상한제에 따라 비투기과열지구에서도 아파트 전매가 6개월간 제한된다.,https://news.naver.com/main/read.nhn?mode=LSD&mid=shm&sid1=260&oid=015&aid=0000970362,75
56302,2007.06.14. 오후 5:24,부동산,서울경제,첨단산업 용지 애물단지될라,동탄2신도시등 수도권만 600만평이상 사업 계획 대기업 투자는 제한 中企·벤처만으론 충당힘들듯 ‘간다는 기업은 없는데 오라는 땅만 넘쳐나는 꼴.’ 정부가 수도권 2기 신도시를 ‘자족 신도시’로 만들겠다며 대규모 첨단산업 부지를 마련하고 있지만 정확한 수요예측도 없이 청사진만 남발하는 것 아니냐는 지적이 나오고 있다. 최근 발표된 화성 동탄 2신도시를 비롯해 크고 작은 공공택지에는 어김없이 ITㆍBT 등 첨단산업을 유치하기 위한 ‘도시지원시설’ 용지가 넘쳐난다. 그러나 대기업의 수도권 투자가 엄격히 제한된 마당에 과연 중소ㆍ벤처기업만으로 이 같은 수요를 채울 수 있을지 우려된다. 14일 정부와 관련업계에 따르면 수도권 2기 신도시와 인천 경제자유구역 서울 도시개발사업 등 현재 추진 중인 각종 택지개발사업에서 첨단산업 용도로 잡힌 땅만도 600만평을 넘어섰다. 이미 첨단산업 클러스터를 형성하고 있는 충북 오창ㆍ오송단지까지 합하면 1 000만평 이상으로 늘어난다. 동탄 2신도시의 경우 ‘강남 대체’를 위한 자족성 확보라는 명분 아래 첨단 비즈니스 용지가 신도시 면적의 무려 15%인 100만평 이상으로 계획됐다. 그러나 구체적으로 어떤 첨단기업을 유치할지에 대해서는 이렇다 할 계획이 없는 상태다. 동탄에 가까운 판교와 수원 광교 신도시로 눈을 돌려보면 전망은 더욱 암담해진다. 판교에는 20만여평의 ‘판교 테크노밸리’ 부지가 마련돼 있고 광교 역시 8만6 000여평 규모의 ‘광교 테크노밸리’를 계획해놓았다. 동탄 2신도시 아래 평택 신도시에는 130만여평 규모의 산업단지가 들어설 예정이다. 경제자유구역 서울 도시개발사업 등도 저마다 첨단산업 유치에 혈안이 돼 있다. 인천 송도국제도시는 지식정보산업단지 80만평 첨단바이오단지 8만8 000평 IT클러스터 170만평 등 ‘규모의 경제’로 밀어붙일 태세다. 인천 청라지구 역시 IT와 자동차 산업을 위한 첨단산업단지로 44만평이나 배정해놓았다. 하지만 경제자유구역에 외국 기업의 투자가 얼마나 이뤄질지는 미지수다. 서울시도 이에 뒤질세라 강서구 마곡지구 면적 100만평의 약 25%를 ITㆍNT 등의 산업연구개발단지로 할당했고 마포구 상암지구 역시 17만평의 ‘디지털미디어센터 DMC ’ 조성공사를 추진 중이다. 게다가 서울시는 844만여평에 이르는 시내 준공업지를 첨단산업 용도로 탈바꿈시키기 위해 아파트형 공장 건설 등을 적극 유도하고 있다. 박용규 삼성경제연구소 수석연구원은 “단순 오피스형 산업을 위해서라면 수십만평의 대규모 용지를 마련할 필요도 없다”며 “대기업 없이 중소ㆍ벤처기업만 유치해서는 수요창출의 한계가 명확할 뿐 아니라 첨단산업 용지라는 최소한의 구색을 갖추기도 힘들다”고 지적했다.,https://news.naver.com/main/read.nhn?mode=LSD&mid=shm&sid1=260&oid=011&aid=0000186696,75
56303,2007.06.14. 오후 5:12,부동산,이데일리,송파신도시에 주상복합 3500가구 추진,이데일리 윤진섭기자 송파신도시에 3500가구 규모의 주상복합아파트가 들어설 전망이다. 14일 송파신도시 사업 시행자인 한국토지공사에 따르면 총 205만평의 부지에 4만9437가구를 짓는 내용의 개발계획 초안을 마련해 서울시 성남시 하남시 등 지방자치단체와 협의하고 있다. 초안에 따르면 4만9437가구 중 공동주택은 4만5059가구 주상복합아파트 3584가구 단독주택 794가구다. 지역별로는 송파구에 2만1786가구가 들어설 예정이며 성남시 1만6304가구 하남시 1만1347가구이다. 신도시에 수용될 인구는 총 12만3593명. 토지공사 관계자는 지방자치단체와의 협의를 위해 만든 초안이어서 3개 지자체와의 협의과정에서 크게 바뀔 가능성이 있다 고 말했다. 송파신도시는 9월 개발계획 승인 내년 6월 실시계획승인을 거쳐 2009년 9월에 최초 분양될 예정이다.,https://news.naver.com/main/read.nhn?mode=LSD&mid=shm&sid1=260&oid=018&aid=0000491947,75
56304,2007.06.14. 오후 5:11,부동산,매일경제,분양 경기도 화성시 상가스타타워,image0 칸디앤시는 화성시 봉담읍 봉담택지지구 내 상업용지 중심에 스타타워 ⅠㆍⅡㆍⅢ 를 분양중이다. 지하 2층 지상 7층 1개동과 지하 2층 지상 9층 2개동 규모로 총점포 수는 114개다. 분양가는 1층 기준으로 평당 2600만 3348만원이다. 상가는 근린생활시설 교육시설 의료시설 등으로 구성된다.,https://news.naver.com/main/read.nhn?mode=LSD&mid=shm&sid1=260&oid=009&aid=0000595866,75
56305,2007.06.14. 오후 5:11,부동산,매일경제,건교부 투기과열 대책마련뒷북,부산ㆍ대구ㆍ광주 등이 곧 투기과열지구에서 풀릴 전망이다. 건설교통부는 14일 지방 투기과열지구를 해제하기 위한 절차를 곧 밟을 계획 이라고 밝혔다. 재정경제부도 이날 브리핑을 통해 지방 건설사들이 전반적으로 어려움을 겪고 있다는 사실을 알고 있으며 곧 대책을 마련할 것 이라고 전했다. 이는 중견건설업체 신일이 지난 13일 부도를 맞는 등 지방 건설사들이 어려움을 겪고 있는 데 따른 것이다. 투기과열지구에서는 분양권 전매가 충청권은 3년 여타 지방은 1년간 제한되고 있어 건설사들이 아파트 분양에 어려움을 겪는 요인이 됐다. 미분양이 많은 부산ㆍ대구ㆍ광주 등이 투기과열지구 해제 1순위로 거론되고 있으며 상대적으로 분양이 양호한 울산ㆍ대전 등은 해제 대상에서 제외될 것이라는 관측이 많다. 진동수 재경부 차관은 이달 주택정책심의위원회에서 지방 아파트 미분양 등을 전반적으로 검토해 부동산 시장에 미칠 영향을 분석하고 해결책을 찾을 것 이라며 투기지역 해제를 포함해 전반적으로 방법을 강구할 것 이라고 밝혔다. 주택정책심의위원회는 직접 회의를 소집하는 대신 서면으로 의결할 가능성이 높은 것으로 알려졌다. 재경부와 건교부의 이 같은 방침에 대해 건설업계에서는 뒷북 행정 이라며 질타하는 분위기다. 중견 지방건설사인 J사 관계자는 도대체 지방 투기과열지구는 언제 해제되는 거냐 며 공무원들이 책임 회피를 위해 실효성 없는 규제를 끌어안고 있는 것 아니냐 고 되물었다. 하지만 투기과열지구에서 풀리더라도 효과가 제한적이라는 지적도 나온다. 9월부터 분양가상한제가 전면 실시돼 비투기과열지구도 6개월 동안 분양권 전매가 제한되기 때문이다.,https://news.naver.com/main/read.nhn?mode=LSD&mid=shm&sid1=260&oid=009&aid=0000595865,75
56306,2007.06.14. 오후 5:11,부동산,매일경제,사채까지 쓴 시행사들  땅 줄줄이 내놓을판,image0 이자와 보유세 낼 돈을 마련하기 위해 안간힘을 썼습니다. 임원들 개인자금을 모두 끌어들이고도 돈이 모자라 사채업자에게 2억원을 빌리기도 했습니다. 일주일 쓰는데 선이자 1할을 제외하고 1억8000만원을 주더군요. 그래도 우리는 사업 전망이 밝으니 다행입니다. 무리하게 땅을 확보해놓은 시행사는 죽을 맛일 겁니다. 하반기에는 견디지 못한 시행업체들이 본격적으로 땅을 내놓을 겁니다. 주택시행업체 고위 관계자 주택건설경기가 급속히 위축되자 시행사들의 고민도 깊어지고 있다. 이들은 △경기침체에 따른 미분양 리스크 증가 △분양가상한제 등에 따른 수익률 저하 △금리상승ㆍ보유세 강화에 따른 토지 부담 증가의 3중 쇼크 를 한꺼번에 받고 있다. 특히 오는 9월부터 분양가상한제가 실시되면 시행사가 설 땅은 더욱 좁아진다. 분양가가 제한되고 택지가격이 감정가로 매겨지기 때문이다. 이른바 땅 작업 토지대행업무 에서 발생하는 이익이 사실상 사라지게 된다. 업계에선 올 하반기에는 양질의 사업지가 매물로 쏟아질 것 이란 예상이 빠른 속도로 퍼져나가고 있다. 주택경기 침체로 미분양이 증가하면 주택사업 리스크가 커져 분양 일정을 늦추는 사례가 속출하게 된다. 이는 금리 보유세 등 토지보유 부담 증가로 이어지고 자금 사정과 사업타당성을 악화시켜 할 수 없이 사업지를 매각하는 절차를 밟게 된다는 설명이다. 사업구조가 취약해진 일부 시행사들은 벌써 보유사업지 매각에 나서고 있다. 특히 분양성이 현저하게 떨어지는 지방 택지지구 땅을 보유한 일부 시행사들은 손절매를 무릅쓰고 매물을 내놓고 있다. 실제로 K시행사는 중견 건설업체 W사에 부산 J아파트 사업권을 넘기기 위해 작업중이다. 하지만 사업 지연으로 불어난 금융비용 부담을 놓고 W사와 소송까지 벌어져 매각 작업이 쉽지만은 않은 상황이다.,https://news.naver.com/main/read.nhn?mode=LSD&mid=shm&sid1=260&oid=009&aid=0000595864,75
56307,2007.06.14. 오후 5:11,부동산,매일경제,위기의 주택건설업…수요 무시하고 지방서배짱분양,image0 주택건설 경기가 하늘을 찔렀던 2002년. 이 한해 동안 전국에 66만6541가구 주택 인ㆍ허가 기준 가 공급됐다. 서울ㆍ수도권에 공급된 물량도 전체의 56.4%인 37만6248가구에 달했다. 공급이 수요를 쫓아갈 수 있던 시절이었다. 14일 국민은행 통계에 따르면 2002년 주택가격 상승률은 16.4%였다. 서울 22.5% 이 상승세를 이끌었지만 지방광역시 집값 상승률도 12.3%에 이르렀다. 비교적 균형 잡힌 상승세였다. 주택건설업체들이 앞다퉈 집을 짓기 시작했다. 그러나 4년 뒤인 2006년 시장상황은 딴판 이었다. 주택건설업계 전반에 병색 이 확연해졌다. 특히 지방 주택시장은 헤어나기 힘든 늪 으로 변해버렸다. 수요를 무시한 과도한 주택공급 탓이다. 수요 무시한 과잉공급 지속 2006년 전국 집값 상승률은 11.6%였다. 하지만 상승지역은 서울 18.9% 경기 24.8% 울산 14.8% 등 몇몇 곳에 국한됐다. 나머지 지방에서는 상승률이 마이너스를 기록하거나 1 2%에 그쳤다. 지방에 아파트를 지으면 미분양이 발생한다는 것은 누구나 알고 있었다. 하지만 지방 주택시장에는 우격다짐 식 공급이 이어졌다. 2006년 한해 동안 전국에 공급된 46만7503가구 가운데 29만5445가구가 지방에 쏟아졌다. 2002 2003년 벌어놓은 자금이 두둑했다는 점도 배짱 분양 의 원인이 됐다. S건설사 관계자는 2003년 10ㆍ29대책을 계기로 주춤했던 건설사들도 2005년 집값이 재상승하는 모습을 보더니 투자 의욕을 불태웠다 며 분위기만 잘 타면 대박을 터뜨릴 수 있다는 막연한 기대감이 팽배했다 고 말했다. image1 과격한 정부 정책도 화근 시장수요를 무시했다는 점에서 미분양 급증의 1차적인 책임은 해당 건설사 몫이다. 그러나 업계에서는 정부 책임도 간과할 수 없다는 주장을 펼치고 있다. 지방 사정을 무시한 마구잡이식 규제 가 지방 주택시장을 헤집어 놨다는 지적이다. H건설 관계자는 서울ㆍ수도권과 똑같은 규제가 지방 투기과열지구에 적용되면서 정상적인 시장수요마저 거둬가 버렸다 며 오른 것은 강남 집값인데 번번이 타격을 받은 것은 지방 집값이었다 고 하소연했다. 오는 9월부터 분양가상한제가 실시되면 지방 주택시장은 더욱 위축될 것이라는 전망이 많다. 부산지역 O건설사 관계자는 분양가상한제가 실시돼 싼 아파트 가 공급될 것이라는 기대감이 확산되면서 미분양 해소에 큰 어려움을 겪고 있다 며 미분양 세일도 통하지 않는다 고 말했다. 주택업체 안전 경영 으로 전환 상당수 주택건설업체는 올해 초부터 안전 경영 체제로 전환한 상태다. 올해 초 아파트 5000여 가구 공급을 목표로 삼았던 모 건설사는 6월 초 현재 공급실적이 300가구 수준에 머물고 있다. 시장 상황이 어려워지자 공급 일정을 자꾸 늦춘 탓이다. 중견 S건설 W회장은 요즘 지방사업은 분양률 50% 넘기기도 어렵다는 게 정설로 받아들여지고 있다 며 최근 주택업체 오너들을 만나면 크게 벌이지 않고 내실 있게 해야 살아남을 수 있다 는 이야기를 많이 한다 고 말했다. J건설 A회장도 현재 신규 사업은 전혀 하지 않고 있으며 기존 사업도 마무리 절차를 밟고 있다 며 한때 땅 사라는 교섭이 귀찮을 정도로 많았으나 계속 거절하다보니 요즘은 연락도 없다 고 말했다. 그는 수도권 사업도 자신할 수 없는 분위기로 가고 있다 며 가장 보수적인 관점에서 경영을 하고 있다 고 설명했다. 2 3년 뒤 주택공급 감소 염려 주택건설업체들이 안정성 위주의 비상 경영체제 에 돌입하면 필연적으로 주택공급 물량이 줄어들게 된다. 오는 9월부터 분양가상한제가 실시돼 수익성까지 떨어지면 민간부문 주택공급은 더욱 위축될 것으로 예상된다. 그 부작용은 통상 2 3년 뒤 집값 전세금 급등으로 나타나게 된다. 정부는 주택공사 토지공사 등을 동원해 줄어든 공급 물량을 메운다는 방침이다. 하지만 성공 확률을 낮게 보는 전문가가 많다. 해외사업은 중견 주택건설사들의 또 다른 돌파구 다. 상당수 업체가 2 3년 전부터 해외 주택건설사업을 추진해왔다. 그러나 섣부른 해외사업은 경영 리스크를 높이는 독 으로 작용할 수 있다는 지적이다. 한 은행 관계자는 해외 토목공사와 달리 해외 주택사업은 국내 사업보다 훨씬 위험하다는 게 일반적인 평가 라며 사업 진행에 차질이 생기면 기업신인도에도 악영향을 미칠 수 있다 고 말했다.,https://news.naver.com/main/read.nhn?mode=LSD&mid=shm&sid1=260&oid=009&aid=0000595863,75
56308,2007.06.14. 오후 5:11,부동산,매일경제,분양 경기도 청평면로얄아파트,로얄주택건설이 경기도 가평군 청평면에 로얄아파트 54가구를 분양한다. 지하 1층 지상 11층 2개동 규모로 31ㆍ32ㆍ33평형으로 구성된다. 분양가는 평당 440만 505만원대로 7000만 1억원을 융자받을 수 있다. 청평IC 43번 국도 청평역과 가까워 서울로 진입하기 쉽다. 서울외곽순환고속도로를 통해 경부ㆍ중부고속도로 등과 연결된다.,https://news.naver.com/main/read.nhn?mode=LSD&mid=shm&sid1=260&oid=009&aid=0000595861,75
56309,2007.06.14. 오후 5:11,부동산,매일경제,분양 동탄신도시서해 그랑블,image0 서해종합건설이 경기도 화성시 동탄신도시 중심상업지역에 주상복합타운 서해 그랑블 을 분양한다. 지하 5층 지상 36층 3개동 규모로 아파트 220가구 41 60평형 와 오피스텔 113실로 구성된다. 소유권 등기 후 전매가 가능하다. 특목고ㆍ자립형 사립고 등이 개교 예정이다.,https://news.naver.com/main/read.nhn?mode=LSD&mid=shm&sid1=260&oid=009&aid=0000595860,75
56310,2007.06.14. 오후 5:11,부동산,매일경제,분양 역삼역 오피스텔 성호플라워,image0 성호건설이 서울 강남구 역삼동에 호텔형 레지던스 오피스텔 성호플라워 를 선착순 분양중이다. 12 14평형 160실 규모다. 분양가는 12평형이 9000만원대다. 지하철 2호선 역삼역에서 도보 1분 거리다. 업체 측은 주변에 업무시설이 밀집해 있어 수요가 많아 수익률 10%로 월세를 받을 수 있다고 밝혔다.,https://news.naver.com/main/read.nhn?mode=LSD&mid=shm&sid1=260&oid=009&aid=0000595859,75
56311,2007.06.14. 오후 5:10,부동산,연합뉴스,송파신도시에 주상복합아파트 3천500가구 추진,서울 연합뉴스 박성제 기자 송파신도시에 들어설 4만9천가구중 4만5천가구는 공동주택 3천500가구는 주상복합아파트가 될 전망이다. 14일 송파신도시 사업 시행자인 한국토지공사에 따르면 총 676만㎡ 205만평 의 부지에 4만9천437가구를 짓는 내용의 개발계획 초안을 마련해 서울시 성남시 하남시 등 지방자치단체와 협의하고 있다. 초안에 따르면 4만9천437가구중 공동주택은 4만5천59가구 주상복합아파트 3천584가구 단독주택 794가구이며 수용인구는 12만3천593명이다. 지역별로는 송파구에 2만1천786가구가 들어설 예정이어서 가장 많고 성남시 1만6천304가구 하남시 1만1천347가구이다. 전체 부지는 주택용지가 43.1% 도시계획시설용지 51.8% 상업업무시설용지 3.9% 주거편익시설용지 1.2% 등으로 계획됐다. 토지공사 관계자는 지방자치단체와의 협의를 위해 만든 초안이어서 3개 지자체와 협의하는 과정에서 크게 바뀔 가능성이 있다 고 말했다. 서울 송파구와 경기도 성남시 하남시 등 3개 지자체에 걸쳐 들어설 송파신도시는 9월 개발계획이 승인되고 내년 6월 실시계획승인을 거쳐 2009년 9월에 최초 분양될 예정이다.,https://news.naver.com/main/read.nhn?mode=LSD&mid=shm&sid1=260&oid=001&aid=0001666525,75
