,date,cat,co,headline,text,url,week
20102,2006.07.31. 오전 6:12,부동산,연합뉴스,부동산 중개수수료 부가세 논란 확산,실거래가 신고로 중개업자 일반과세자 전환 불가피 중개수수료외 부가세 받을 수 있나...건교부 유권해석 의뢰 서울 연합뉴스 서미숙 기자 올해부터 부동산 실거래가 신고가 의무화되면서 소득이 노출되는 공인중개사들이 내년 이후 대거 간이 과세자에서 일반 과세자로 전환될 전망이다. 이에 따라 중개사들 사이에 중개수수료에 대한 부가세를 소비자로부터 받을 수 있도록 허용해달라는 목소리가 높아지고 있다. 만약 부가세를 추가로 받게 되면 서민들의 중개수수료 부담은 더욱 커지게 된다. 이와 관련해 건설교통부는 그동안 중개수수료에는 부가세가 포함돼 있다는 입장이었으나 최근 이 문제에 대해 법제처 유권해석을 의뢰해 결과가 주목된다. ◇중개사 일반 과세자 전환 임박 31일 업계에 따르면 현재 공인중개사의 90% 이상은 연 매출 4천800만원 미만인 간이 과세자로 등록돼 있다. 따라서 그동안 부가가치세를 3%만 내거나 6개월 매출을 1천200만원 미만으로 신고해 부가세를 면제받는 사람이 많았다. 자영업자인 중개사의 소득이 파악되지 않았기 때문에 간이 과세자로 등록해 세금을 줄일 수 있었던 것이다. 하지만 올들어 부동산 실거래가 신고가 시행되면서 중개업자의 소득이 고스란히 드러나게 됐다. 김모 세무사는 실거래가 신고를 하면 거래 신고 건수와 매매 가격이 파악되기 때문에 법정 수수료율을 곱하면 공인중개사의 매출액을 알 수 있다 며 실거래가 신고 의무가 없는 전세는 제외하더라도 수입이 큰 매매 거래는 소득이 모두 밝혀지게 될 것 이라고 말했다. 이에 따라 내년부터는 간이 과세자로 등록돼 있던 공인중개사 가운데 매출이 4천800만원 이상인 경우는 모두 일반 과세자로 전환될 전망이다. 서초구 서초동 K공인 관계자는 서울.수도권 지방 대도시의 웬만한 아파트 단지내 상가에 있는 중개업소는 연 매출이 4천800만원은 충분히 넘는다 며 상당수 중개사들이 일반 과세자로의 전환을 부담스러워 하고 있다 고 말했다. ◇ 부가세 받게 해달라 요구 이에 따라 최근 대한공인중개사협회 한국공인중개사협회 등 양 단체는 법정 중개수수료 외에 별도 부가가치세를 받을 수 있도록 허용해줄 것을 건교부에 요청했다. 건교부는 공인중개사의 업무 및 부동산 거래신고에 관한 법률의 사례.증여 그밖의 어떠한 명목으로도 법정 중개수수료 또는 실비를 초과해 금품을 받을 수 없다 는 규정을 들어 부가세를 따로 받을 수 없고 수수료 안에 부가세가 포함된 것으로 봐야 한다는 입장을 견지해왔다. 대한공인중개사협회 관계자는 부가가치세는 최종 소비자가 부담하는 것인만큼 중개사가 아닌 거래 당사자들이 부담해야 한다 며 중개사들의 소득이 완전히 노출되는데 부가세 부담까지 지우는 건 말이 안된다 고 말했다. 중개사들 사이에도 불만이 높다. 서울 동대문구 장안동 S공인 사장은 연 매출 5천만원에 사무실 임대료 직원들 월급 부가세 10% 내고 나면 인건비도 못건질 판 이라며 중개사 지갑이 유리알 처럼 투명해진 만큼 성실 납세를 유도하기 위해 감세 혜택을 줘야 한다 고 주장했다. 또다른 중개사는 회계사.세무사.법무사 등 전문직 종사자들은 모두 수임료 외에 부가세를 따로 받는데 중개사만 수수료에 부가세가 포함돼 있다는 것은 형평성에도 어긋난다 고 말했다. 하지만 중개수수료에 부가세를 붙이면 서민들의 부담이 커진다는 점 때문에 논란이 예상된다. 만약 거래금액이 5억원인 아파트를 팔 때 법정 중개수수료인 200만원만 내면 됐지만 부가세 10% 20만원을 더 받으면 총 220만원을 부담해야 한다. 이에 대해 건설교통부는 이달 중순 법제처에 관련 내용의 유권해석을 의뢰해 결과에 관심이 쏠리고 있다. 법제처는 8월말 9월초는 돼야 결과가 나올 것으로 보고 있다. 부동산 업계의 한 전문가는 중개사의 소득이 완전 노출되는 만큼 중개수료의 부가세 문제가 더욱 뜨겁게 달아오를 것 이라며 정부는 중개사의 심정을 이해하지만 서민을 보호해야 하는 임무도 있어 결론이 쉽지 않을 것 이라고 말했다.,https://news.naver.com/main/read.nhn?mode=LSD&mid=shm&sid1=260&oid=001&aid=0001371520,30
20103,2006.07.31. 오전 6:04,부동산,연합뉴스,그린벨트내 국민임대 건설사업 첫 제동..파장 클 듯,중도위 서울 세곡2.강일3지구 국책사업 지정 부결 올해 국민임대 건설목표 차질 불가피 서울 연합뉴스 유경수기자 정부가 개발제한구역 그린벨트 을 해제하고 국민임대주택을 지으려던 계획이 민간위원회의 제동으로 처음 무산돼 적잖은 파장이 예상된다. 서울 강남구 세곡동과 강동구 상일.하일동에 조성하려던 7천500가구 규모의 국민임대주택단지 건설사업에 대해 중앙도시계획위원회 중도위 가 부결판정을 내린 것이다. 건설교통부는 서울 세곡 2지구와 강일 3지구 구로구 천왕 2지구 등 3곳을 국민임대주택단지로 만들기 위해 국책사업지정 신청을 중도위에 상정했으나 논의결과 천왕 2지구를 제외한 두곳의 개발이 부적합하다는 판정을 받았다 고 31일 밝혔다. 중도위의 부결판정이 내려진 세곡2 강일3지구는 이로써 사업추진이 전면 중단되며 사업지구는 지금처럼 그린벨트로 보존된다. 정부가 2002년 국민임대주택 건설 물량을 확대하기 위해 그린벨트 조정가능지를 활용키로 하고 사업을 추진하다 중도위의 부결 판정을 받은 것은 이번이 처음이다. 이에따라 연내 서울지역 그린벨트 조정가능지에 5곳을 국민임대주택단지로 지구를 지정하고 1만4천여가구를 지어 주택난 해소 서민 주거안정을 꾀하려던 건교부와 서울시의 계획은 적잖은 차질을 빚을 전망이다. 중도위는 두 지구의 자연환경이 우수하고 이들 지역을 개발할 경우 도시연담화 등 부작용을 우려해 이같은 결정을 내린 것으로 알려졌다. 해당 구청과 주민 토지 소유자들의 국민임대주택단지 조성 반대여론도 중도위의 결정에 영향을 미친 것으로 보인다. 건교부는 이에따라 서울시에 대체지를 물색할 것을 요청했으며 서울시는 이들 지구와 유사한 규모로 그린벨트 훼손 지역을 중심으로 연내 부지를 확보한다는 방침이다. 건교부 관계자는 국책사업으로 지정된 천왕2지구외에 강남 내곡지구 24만3천평 중랑 신내3지구 16만7천평 등 두곳이 연말까지 국민임대주택단지 지구로 지정될 수 있도록 최선을 다할 것 이라고 강조했다. 헌릉로 주변의 세곡2지구는 16만5천평 규모로 국민임대 3천140가구 등 4천740가구 강일3지구는 10만7천평에 국민임대 1천860가구 등 2천790가구가 2009년까지 들어설 예정이었으며 주민공람 관계부처 협의를 마친 상태였다. 두곳 모두 교통여건과 생활환경이 좋고 강남 주택수요를 흡수할만한 뛰어난 입지를 갖춰 계획단계에서부터 높은 관심을 끌어왔다. 한편 국책사업으로 지정된 천왕 2지구는 8만4천평 규모로 2009년까지 1천680가구 국민임대 1천120가구 가 공급될 예정이다.,https://news.naver.com/main/read.nhn?mode=LSD&mid=shm&sid1=260&oid=001&aid=0001371506,30
20104,2006.07.31. 오전 4:45,부동산,동아일보,나홀로 가구 중소형 청약 서둘러라,동아일보 《“내 집 마련 계획을 리모델링하자.” 2008년부터 주택청약제도가 크게 바뀐다. 자녀 만 20세 미만 등 부양가족이 많을수록 무주택 기간이 길수록 가구주 나이가 많을수록 청약통장 가입기간이 길수록 소득과 부동산 자산이 적을수록 주택을 분양받기 쉬워진다. 이런 항목을 점수로 매기는 ‘청약 가점제’는 2008년부터 공공택지 내 전용면적 25.7평 이하 민영주택에 적용되며 2010년부터는 민간택지 내 25.7평 이하 주택까지 확대된다.》 ○청약예치금 늘려 중대형 노려볼 만 올해 초 결혼해 5년 뒤 자녀를 가질 계획인 서모 29 씨를 예로 들어보자. 2008년을 기준으로 가구주인 서 씨의 무주택 기간과 청약통장 가입기간은 각각 5년이다. 서 씨의 점수는 나이 31세 40점 무 無 자녀 0점 1가구 35점 무주택 기간 128점 청약통장 가입기간 52점 등 모두 255점. 만점인 532점의 절반에도 못 미친다. 또 아버지가 가구주인 정모 32 씨의 경우 2008년에도 가구주가 아니라면 당첨 가능성은 더욱 적어진다. 청약통장에 가입한 지 5년이 되었다면 그 기간 52점 만 점수화되기 때문. 내집마련정보사 함영진 정보분석팀장은 “점수가 낮으면 2008년 이전에 분양되는 경기 파주시 파주신도시 성남시 도촌지구 수원시 이의신도시 충남 아산시 아산신도시 등을 놓치지 말라”고 조언했다. 청약예금 가입자라면 예치금을 높여 전용면적 25.7평 초과 주택을 노리는 것도 고려해 볼 만하다. 6월 말 현재 전용면적 25.7평 이하 민영주택에 청약할 수 있는 사람은 403만 명이지만 전용면적 25.7평 초과 주택에 청약할 수 있는 사람은 198만 명이다. 다만 예치금을 늘리면 1년 뒤 청약 자격을 얻는다. ○청약저축 가입자 공공물량 많아 ‘방긋’ 만 20세 이상 무주택 가구주이면서 청약통장이 없다면 전용면적 25.7평 이하 공공주택에 청약할 수 있는 청약저축에 가입하는 게 좋다. 닥터아파트 이영호 리서치팀장은 “정부가 부동산 투기를 막기 위해 대한주택공사 등이 사업을 담당하는 공영개발을 늘릴 계획이어서 청약저축으로 분양받을 수 있는 물량이 더욱 늘어날 것”이라고 설명했다. 청약저축 가입자는 2008년 이후에도 무주택 기간 저축액 납입횟수 등에 따라 순차적으로 당첨 순위가 결정되는 기존 ‘순차제’의 적용을 받는다. 청약저축 가입자는 서울 송파구 송파신도시 강서구 발산지구 은평구 은평뉴타운 경기 성남시 판교신도시 등 유망한 공공택지에서 개발되는 공공주택을 골라서 청약하면 된다. ○공공택지 중대형 아파트도 일부 가점제 공공택지 내 전용면적 25.7평 초과 주택에 대해서는 채권입찰제가 적용되지만 대부분 채권상한액을 써내 순위가 같아질 가능성이 높다. 이 경우 2008년부터는 가점제가 적용된다. 하지만 채권입찰제가 적용되지 않는 민간택지 내 전용면적 25.7평 초과 주택은 현행 추첨제가 적용되기 때문에 굳이 서두를 필요가 없다. 가점제를 적용받아 ‘청약 0순위’로 꼽히는 3자녀 이상 가구주도 2009년 송파신도시 등 인기 물량이 나올 때까지 느긋하게 기다리면 된다. 이 밖에 사회초년생인 자녀가 있다면 주민등록을 분리해 일찌감치 가구주로 만들어 주거나 노부모를 모셔 부양가족 수를 늘리는 등 ‘점수 불리기 작전’에 돌입하는 것이 좋다. 김유영 기자 abc donga.com 세상을 보는 맑은 창이 되겠습니다.,https://news.naver.com/main/read.nhn?mode=LSD&mid=shm&sid1=260&oid=020&aid=0000360866,30
20105,2006.07.31. 오전 3:17,부동산,동아일보,분양정보강원 고성군 ‘클래시움 별장형’ 246채 外,동아일보 강원 고성군 ‘클래시움 별장형’ 246채 유진건설은 강원 고성군 청간해수욕장 옆 ‘클래시움 별장형 아파트’ 246채를 분양한다. 16 21 25평형. 2층 이상에서는 동해와 설악산을 볼 수 있다는 것이 회사 측의 설명. 빌트인 냉장고 붙박이장 등이 기본사양에 포함돼 있다. 평당 분양가는 370만∼560만 원. 언제든지 입주할 수 있다. 1588 6063 용인 구성지구 ‘진흥 더블파크’ 786채 진흥기업은 경기 용인시 구성지구에 ‘진흥 더블파크’ 33∼56평형 아파트 786채를 분양하고 있다. 아파트 조경에 서양화가 한젬마 씨가 참여했다. 단지 안에 영어마을도 들어설 예정. 평당 분양가는 905만∼1060만 원. 입주는 2008년 12월. 031 712 9700 성남 모란역 주상복합 ‘하프 아울렛’ 신흥C D는 경기 성남시 성남동 모란역 주변 주상복합건물 ‘하프 아울렛’의 오피스텔과 상가 점포를 분양하고 있다. 지하 1층∼지상 5층에는 의류매장 등 판매 및 업무시설 6∼12층에는 원룸형 오피스텔 110채가 들어선다. 평당 분양가는 오피스텔이 720만∼780만 원 상가는 1700만∼4700만 원. 9월 완공 예정. 031 759 1777 용인 공세지구 ‘대주 피오레’ 2000채 대주건설은 경기 용인시 공세지구에서 ‘피오레’ 아파트 2000채를 분양하고 있다. 중대형 평형 38∼79평형 으로 구성돼 있으며 48평형 이상을 분양받으면 중도금 대출을 전액 알선해 주고 발코니도 무료로 확장해 준다. 평당 분양가는 900만∼1300만 원. A단지 2008년 12월 B단지 2009년 4월 입주 예정. 031 712 2277 세상을 보는 맑은 창이 되겠습니다.,https://news.naver.com/main/read.nhn?mode=LSD&mid=shm&sid1=260&oid=020&aid=0000360865,30
20106,2006.07.31. 오전 3:17,부동산,동아일보,서울 아파트값 0.03% ↓… 9개월 만에 하락,동아일보 지난주 서울 아파트 매매가가 지난해 10월 세 번째 주 이후 9개월여 만에 처음으로 떨어졌다. 부동산 비수기인데다 재건축 단지 아파트 값이 떨어져 전체 아파트 값에 영향을 준 것. 30일 부동산정보 제공업체 부동산114에 따르면 지난주 서울의 아파트 값은 전주에 비해 0.03% 하락했다. 구별로는 송파 ―0.36% 강남 ―0.09% 강동구 ―0.06% 등 강남지역의 하락폭이 상대적으로 컸다. 반면 마포 0.19% 성동 0.17% 용산구 0.14% 등의 아파트 값은 소폭 상승했다. 서울의 재건축 아파트 값은 평균 0.24% 내려 전주 ―0.04% 보다 하락폭이 커졌다. 재건축을 제외한 나머지 아파트 매매가는 0.01% 올랐다. 수도권 신도시 아파트 값은 지난주 0.05% 상승했다. 중동 0.27% 일산 0.11% 산본 0.10% 평촌 0.02% 등은 올랐지만 분당은 0.01% 내렸다. 전셋값도 안정세를 보였다. 서울의 전셋값은 0.04% 올랐지만 수도권 신도시는 0.03% 하락했다. 박중현 기자 sanjuck donga.com 세상을 보는 맑은 창이 되겠습니다.,https://news.naver.com/main/read.nhn?mode=LSD&mid=shm&sid1=260&oid=020&aid=0000360848,30
20107,2006.08.01. 오후 10:21,부동산,스포츠경향,오늘부터 공공택지 원가공개,앞으로 공공택지 공급시 택지 조성원가와 원가 구성 항목들이 일반에 공개된다. 건설교통부는 1일 택지개발 사업의 투명성을 강화하고 택지 조성원가 산정의 객관성을 높이기 위해 공공택지를 공급할 때 조성원가를 공개하도록 ‘택지조성원가 산정기준 및 적용방법’ 지침을 마련 2일부터 시행한다고 밝혔다.지침에 따르면 주택공사나 토지공사 등은 공공택지를 공급할 때 ㎡당 조성원가와 용지비 조성비 직접인건비 이주대책비 판매비 일반관리비 기타비용 등 7개 구성항목을 공개해야 한다. 조성원가는 택지분양 공고시 공개된다. 공개 내역은 토공 등 사업시행자의 홈페이지에 게시해 누구나 조회할 수 있도록 했다. 또 조성원가 공개는 2일 이후 최초로 택지공급을 승인받는 지구부터 적용된다. 이달 말 공급되는 제주 삼화지구를 비롯해 남양주 별내 김포 양촌 오산 세교 파주 운정지구 등이 이에 해당된다.그러나 이미 택지공급 승인을 받아 택지공급이 시작된 사업지구는 예외다.,https://news.naver.com/main/read.nhn?mode=LSD&mid=shm&sid1=260&oid=144&aid=0000022379,30
20108,2006.08.01. 오후 9:21,부동산,파이낸셜뉴스,인터뷰이상필 미래새한감정평가법인 대표,“감정평가 업무의 공공성과 전문성 확보에 배전의 노력을 기울여 국민과 국가로부터 보다 더 신뢰받는 기업으로 이끌겠습니다.” 지난달 19일 합병을 통해 국내 민간 최대의 감정평가업체로 새롭게 탄생한 미래새한감정평가법인의 이상필 대표는 “감정평가업계를 이끌어가는 리더기업으로서 막중한 책임감을 느낀다”며 이같이 밝혔다. 이대표는 “감정평가업무는 특성이 국가 지방자치단체 와 국민 모두를 고객으로 하고 있지만 평가 결과에 대해서는 모두가 불만족스럽게 생각할 수 있는 참으로 어려운 일”이라며 “양쪽 모두가 만족할 수 있는 결과물을 이끌어 내기 위해서는 오직 전문성과 객관성을 확보하는 것”이라고 말했다. 더구나 감정평가시장규모는 연간 4400억원 정도로 한정돼 있는 데 비해 평가사는 해마다 몇백명씩 늘어 과열경쟁과 이로 인한 제살 이를 할 수 밖에 없는 상황에 이르면서 최근 평가의뢰자의 입맞에 맞춘 부실감정의 우려 또한 높아지고 있다. 이런 현실을 감안해 최근 정부는 민간감정평가법인의 대형화를 유도하기 위한 제도적 장치를 마련했고 그 결과 이런 대형법인이 탄생하게 된 것이다. 대형화를 통해서 대국민 서비스의 질을 높이고 업무의 선진화를 꾀할 수 있다는 것을 감안한 것이다. 이대표는 그래서 초대형법인의 탄생이 갖는 의미를 “공공성과 국민 신뢰도 향상”이라고 힘주어 말했다. 서비스 강화차원에서 전국적 네트워크 지점·지사망 를 구축함으로써 국민들이 보다 저렴한 가격에 보다 체계적인 평가서비스를 받을 수 있고 회사차원에서도 세분화된 업무조직을 꾸려 운영함으로써 평가업무의 전문성과 신뢰도를 확보할 수 있다는 것이다. 그는 “국내 부동산 시장 전면 개방으로 외국계부동산 기업들의 국내 진출이 활발해지면서 감정평가업계도 무한 경쟁으로 치닫고 있다”면서 “이에 대응하기 위해 직원들에 대한 교육훈련 확대 품질 제고를 위한 전담팀 구성 및 연구개발 투자 업무영역 확대를 위한 신사업 진출 등을 적극 추진할 방침”이라고 설명했다. 이대표는 연말까지 1∼2곳의 튼실한 평가법인과 합병작업을 벌여 현재 340명 감정평가사 160명 인 직원수를 450명 200명 수준으로 끌어 올릴 계획이라고 덧붙였다. 이대표는 “30년 가까이 부동산업에 몸담아 왔지만 아직도 부동산에 대해 잘 모를 정도로 쉽지 않은 분야”라면서 “부동산은 사람이 살아가는 기본 터전이고 근본인 만큼 국가에서도 매우 조심스럽게 접근해야 한다”고 지적했다. 이대표는 지난 79년 한국토지공사 공채 1기로 입사한 뒤 91년 감정평가업계로 자리를 옮겼다. 토공의 근무경험까지 합치면 그가 부동산업과 쌓은 인연이 26년이다.,https://news.naver.com/main/read.nhn?mode=LSD&mid=shm&sid1=260&oid=014&aid=0000237016,30
20109,2006.08.01. 오후 9:21,부동산,파이낸셜뉴스,일산 신도시 아파트도 평당 1000만원 돌파,경기 일산신도시의 아파트값이 분당과 평촌에 이어 수도권 신도시로는 3번째로 평당 1000만원을 넘어섰다. 부동산 정보제공업체인 부동산뱅크는 일산신도시 아파트 평당가격을 조사한 결과 1일 현재 1001만원으로 집계됐다고 밝혔다. 일산신도시 아파트 평당가는 연초 1월2일 825만원에서 지금까지 176만원이 오른 것이다. 수도권 5대 신도시에서 아파트값이 평당 1000만원을 넘어서기는 분당 1686만원 과 평촌 1166만원 에 이은 세번째다. 앞서 평촌신도시의 아파트값은 지난 4월 초 평당 1000만을 넘어섰다. 일산신도시 아파트의 동별 평당가는 마두동이 1270만원으로 가장 높았고 장항동 1132만원 주엽동 1035만원 일산동 1004만원 등이 그 뒤를 이었다. 평형별로는 소형 30평형대 미만 이 637만원 중형 30평형대 1162만원 대형 40평형 이상 1485만원 이다. 부동산뱅크 길진홍 팀장은 “전통적으로 강세를 보인 마두동과 주엽동 일대 중대형 아파트값이 큰폭으로 오르면서 일산의 아파트값 평당 1000만원 진입을 이끌었다”면서 “하반기 파주 운정신도시 분양을 비롯해 제2자유로 건설 한류우드 조성 등의 개발 호재가 맞물려 일산신도시 아파트 가격 강세는 당분간 이어질 것”이라고 내다봤다.,https://news.naver.com/main/read.nhn?mode=LSD&mid=shm&sid1=260&oid=014&aid=0000237015,30
20110,2006.08.01. 오후 9:12,부동산,파이낸셜뉴스,與 “신규아파트 취·등록세 2.5%로 인하”,열린우리당은 1일 개인이 건설업체로부터 신규 아파트를 분양받을 때 내는 취득·등록세율을 현행 4%에서 2.5%로 낮추는 내용의 지방세법 개정안을 마련 8월 임시국회에서 통과시킬 방침이다. 우리당 송영길 정책위 수석부의장은 이날 열린 고위정책조정회의에서 “개인간 거래세율은 2.5%인데 비해 개인과 법인 건설업체 간 거래세율은 4%에 달해 차별적이란 지적이 있다”며 이같이 밝혔다. 송수석부의장은 이어 “그동안 거래세를 두차례에 걸쳐 인하했지만 과표 현실화 때문에 실질적인 인하가 되지 않았다는 지적이 있다”면서 “거래세 세수 추계를 봐서 추가 인하 여부도 고려하겠다”고 덧붙였다.,https://news.naver.com/main/read.nhn?mode=LSD&mid=shm&sid1=260&oid=014&aid=0000237012,30
20111,2006.08.01. 오후 7:54,부동산,파이낸셜뉴스,파주등 공공택지 조성원가 공개,경기 파주 운정신도시와 김포시 양촌 남양주시 별내 등 앞으로 공급되는 공공택지지구내 아파트의 땅값이 7개 항목으로 나눠 공개된다. 이를 통해 그간 번번이 ‘땅장사’ 또는 ‘과다개발이익’ 논란을 빚어온 대한주택공사와 한국토지공사 등의 토지공급 체계가 투명화되고 이를 공급받아 집을 짓는 공공택지내 공공 및 민간주택의 분양가격이 10%가량 인하될 것으로 전망된다. 건설교통부는 지난 7월1일 공공택지 공급체계 개편에 이어 택지개발 사업의 투명성을 강화하고 조성원가 산정의 객관성을 높이기 위해 택지개발촉진법의 ‘택지조성원가 산정기준 및 적용방법’을 마련해 2일부터 시행한다고 1일 밝혔다. 개정안에 따르면 주공과 토공 등 공공택지개발 사업시행자는 앞으로 공공택지 공급시 단위면적당 조성원가와 용지비 토지취득비 조성비 공사비 등 직접인건비 이주대책비 판매비 일반관리비 그밖의 비용 자본비용 등 7개 구성항목의 총액을 공개해야 한다. 공개내역은 사업시행자측의 홈페이지에 게시해 누구나 조회할 수 있도록 했다. 공개대상은 2일 이후 처음으로 택지를 공급하는 곳으로 이달 말 공급예정인 제주 삼화지구가 첫 대상이다. 이밖에 남양주별내 김포 양촌 오산 세교 파주 운정지구 등이 대상이다. 또 정부는 조성원가의 신뢰성을 높이고 산정과정의 객관성과 공정성을 확보하기 위해 사업시행자 토공 주공 등 가 ‘택지조성원가 자문위원회’를 구성 운영하도록 했다. 자문위원회는 회계사 감정평가사 변호사 학자 등 관계전문가 10명 안팎으로 구성해야 한다. 건교부 공공주택팀 임의택 팀장은 “토지공급 체계가 명확히 규명이 되면 토공이나 주공의 토지가격산정에 대한 소비자 이해도가 높아져 정부의 ‘땅장사’ 등에 대한 논란이 종식되며 분양가 인하효과도 배가될 것으로 보인다”고 말했다. 한편 정부는 지난 7월1일부터 택지지구내 아파트 용지를 감정가격이 아닌 조성원가로 공급하고 있다. 수도권은 조성원가의 110% 광역시는 100% 지방은 90%에 공급한다. 이에 따라 아파트 용지비가 종전에 비해 20∼30% 떨어졌다.,https://news.naver.com/main/read.nhn?mode=LSD&mid=shm&sid1=260&oid=014&aid=0000236967,30
