,date,cat,co,headline,text,url,week
51102,2007.05.01. 오전 5:57,부동산,세계일보,기존 아파트값 떨어지는데 분양시장 평당價는 高高,기존 아파트값의 하향 안정세에도 새아파트의 분양가는 여전히 상승세를 지속하고 있는 것으로 조사됐다. 이에 따라 분양 실적은 당초 목표의 30% 선에도 못 미치는 것으로 나타났다. 30일 부동산정보업체 ‘부동산114’에 따르면 올해 1분기 분양된 전국 아파트 분양가는 기준층 기준 평당 평균 1020만원을 기록했다. 이는 지난해 4분기의 평당 891만원보다 129만원 오른 금액이다. 전국 아파트 평당 분양가는 지난해 1분기 737만원에서 2분기 802만원으로 오른 뒤 3분기에 768만원으로 잠시 상승세가 주춤했으나 4분기 이후부터 상승세를 유지하고 있다. 특히 서울은 분양가가 지난해 1분기 평당 1511만원에서 같은 해 4분기에는 평당 1966만원으로 올랐고 올해 1분기에는 서초구 ‘서초아트자이’ 등 고가 주상복합아파트 분양에 따라 평당 2053만원으로 큰 폭으로 상승했다. 경기도의 평당 분양가는 지난해 4분기 984만원에서 올해 1분기 999만원으로 소폭 올랐으나 같은 기간 인천시는 평당 978만원에서 평당 1093만원으로 올랐다. 이처럼 분양가가 오르자 분양 실적은 저조했다. 부동산정보업체 ‘닥터아파트’가 올해 1∼4월에 분양된 아파트 물량을 조사한 결과 당초 건설업체가 계획했던 9만7755가구의 28%선인 2만7200여가구가 공급되는 데 그쳤다. 수도권 연초 분양계획은 3만2446가구였으나 실제 분양된 물량은 30%선인 9635가구가 공급됐다. 나기천 기자 na segye.com ⓒ 세계일보＆세계닷컴 www.segye.com 무단전재 및 재배포 금지 세계닷컴은 한국온라인신문협회 www.kona.or.kr 의 디지털뉴스이용규칙에 따른 저작권을 행사합니다.,https://news.naver.com/main/read.nhn?mode=LSD&mid=shm&sid1=260&oid=022&aid=0000224070,69
51103,2007.05.01. 오전 3:03,부동산,서울신문,아파트 분양가 여전히 ‘高高’,서울신문 집값은 하향 안정세를 보이고 있지만 아파트 분양가는 여전히 상승 행진 중이다. 분양가 상한제가 아직 실시되지 않은 데다 서울 중구 서초구 등에서 고분양가 아파트들이 많았기 때문으로 풀이된다. 30일 부동산 114에 따르면 올해 1·4분기 서울 지역 아파트 분양가는 기준층 기준 평당 2053만원으로 전 분기인 2006년 4분기 평당 1966만원 보다 87만원 올랐다. 서울 지역 분양가는 지난해 2분기부터 다소 떨어졌으나 지난해 4분기부터 큰 폭으로 올랐다. 지난해 말부터 고분양가 아파트가 많았기 때문이다. 예컨대 1월 분양된 서초 아트자이 54평형의 분양가는 평당 3435만원 기준층 평당 평균 3400만원 으로 국내 최고 분양가를 기록했다. 같은 달 분양된 SK건설의 리더스 뷰 남산은 평당 평균 2248만원 2월 분양된 쌍용건설의 플래티넘 남산은 평당 평균 2472만원이었다. 1분기 인천 지역에서 분양된 아파트의 기준층 기준 분양가격은 평당 1093만원으로 인천에서는 처음으로 1000만원을 넘었다. 경기의 경우 평당 분양가는 지난해 4분기에는 평당 984만원에서 올해에는 평당 999만원으로 상승했다. 수도권 이외의 지역도 사정은 별로 다르지 않다. 올해 1분기 전국 아파트 분양가는 기준층 기준 평당 평균 1020만원으로 지난해 4분기 평당 891만원 보다 평당 129만원이 뛰었다. 부동산 114 김규정 차장은 “지난해 11·15 부동산대책에서 분양가 상한제 도입이 예고되면서 업체들이 제도 시행 전에 분양을 서두르면서도 가격은 크게 낮추지 않은 데다 고분양가 아파트까지 많이 나오면서 평균 분양가가 계속 오른 것으로 보인다.”고 설명했다. 올 들어 집값이 안정되면서 고분양가 논란에 휩쓸린 단지들은 거의 대부분 미분양을 기록했다.,https://news.naver.com/main/read.nhn?mode=LSD&mid=shm&sid1=260&oid=081&aid=0000131357,69
51104,2007.05.01. 오전 3:03,부동산,서울신문,3월 부동산경기 27년만에 최악,서울신문 부동산 거래 위축 등으로 지난달 서비스업 생산이 4.8% 증가하는 데 그쳤다. 부동산 경기는 27년만에 최악을 기록했다. 30일 통계청이 발표한 ‘3월 서비스업 활동동향’에 따르면 지난달 서비스업 생산은 1년전보다 4.8% 증가했다. 꾸준한 증가세를 이어갔지만 지난해 10월 3.4% 이후 5개월만에 가장 낮은 증가율을 기록했다. 업종별로 보면 체감경기에 민감한 도소매업이나 숙박·음식점업 등 대표적인 내수업종이 지지부진했다. 지난달 도소매업 생산은 3.0% 부동산 및 임대업 2.5% 통신업 2.0% 숙박 및 음식점업 1.8% 증가했다. 특히 부동산 대책으로 아파트 거래가 뜸해지면서 부동산 경기는 27년만에 최악을 보였다. 부동산업은 1년전보다 0.4% 감소했다. 금융 및 보험업은 증시 호황 등에 힘입어 10.6%의 높은 성장률을 나타냈다. 경륜·경마 등 오락·문화·운동 서비스업도 9.6%의 높은 증가세를 보였다. 한편 지난 1·4분기 서비스업 생산은 1년전보다 5.5% 증가했다. 지난해 3분기 4.5% 4분기 4.8%에 이어 증가세가 확대됐다.,https://news.naver.com/main/read.nhn?mode=LSD&mid=shm&sid1=260&oid=081&aid=0000131346,69
51105,2007.05.01. 오전 2:16,부동산,YTN,주택 보유세 계속 오른다,앵커멘트 지난해 급등한 집값이 올해 공시가격에 반영되면서 보유세 또한 크게 올랐습니다. 앞으로 집값이 더 이상 오르지 않더라도 재산세와 종합부동산세를 물리는 기준인 과표 상승에 따라 보유세는 계속 증가하게 됩니다. 강태욱 기자의 보도입니다. 리포트 서울 삼성동 아이파크 104평 형은 올해 공시가격이 48억2천4백만 원으로 보유세 총액은 대략 7천9백만 원. 공시가격이 오르지 않더라도 2017년이 되면 1억2백만 원이 돼 29%가 늘어납니다. 공시가격이 4억 원인 서울 홍제동 43평 형 아파트의 올해 보유세는 74만 원이지만 2017년에는 135% 증가한 174만 원을 내야 합니다. 이처럼 공시가격이 오르지 않더라도 보유세 부담이 계속 증가하는 것은 재산세를 부과하는 기준인 과표적용률이 현재 공시가격의 50%에서 내년부터 매년 5% 포인트씩 인상돼 2017년이 되면 100%로 높아지기 때문입니다. 또 종합부동산세 과표적용률도 올해 80%에서 2009년이면 100%가 됩니다. 인터뷰 이종화 세무사 과세표준 적용률이 종부세는 2년동안 10% 재산세는 10년동안 5%씩 증가해 매년 세금 증가율은 13% 예상되므로 고려해야 합니다. 이 같은 보유세 증가에 대해 정부는 미국은 시가의 1.5 1.6% 일본은 1% 선이지만 우리는 아직 0.5% 안팎에 불과해 부담이 덜하다는 입장입니다. 그러나 증가 속도가 너무 빠르고 소득수준을 고려하지 않은 것이라는 비판도 제기되고 있습니다. 인터뷰 김경환 서강대 경제과 교수 추진 속도가 소득에 비해 과도하다는게 문제입니다. 어차피 세금은 소득으로 내야 하기 때문에 소득을 감안해 보유세 증가 속도를 낮출 필요가 있습니다. 기자 이처럼 부과기준에 대한 논란에도 불구하고 보유세 상승은 아파트 값 안정화 추세를 더욱 굳히는 역할을 할 것이라는 분석입니다. YTN 강태욱 taewookk ytn.co.kr 입니다.,https://news.naver.com/main/read.nhn?mode=LSD&mid=shm&sid1=260&oid=052&aid=0000150122,69
51106,2007.05.01. 오전 12:29,부동산,한국경제,공시가격 49% 오른 과천 공시가격이 시세 80% 훌쩍 넘어,재건축 대상 아파트가 대다수인 과천 부동산 시장은 정부가 올초부터 강력한 규제 대책을 연이어 내놓으면서 직격탄을 맞고 있다. 실제 지난 2월부터 아파트를 사겠다는 매수자가 점차 발길을 끊어 3월 이후에는 거래가 거의 공백 상태다. 30일 과천시에 따르면 아파트 실거래 건수는 3월에 7건만 신고됐고 4월에는 3건으로 급감했다. 호가도 계속 떨어져 부동산114 조사로는 13주 연속 하락세를 보이고 있다. 이에 따라 공시가격이 시세의 80%를 넘는 사례도 속출하고 있다. 이달에 거래를 주선한 한 중개업자는 주공 8단지 15층 27평형이 7억원에 팔렸다 고 밝혔다. 이 아파트의 공시가격은 5억9800만원으로 시세의 85%가 넘는다. 주공 1단지 16평형도 이달 실거래가는 5억8000만원이었지만 공시가격은 4억7500만원으로 역시 80%를 넘는다. 같은 평형인 데도 단지별로 공시가격 차이가 적지 않은 사례도 나오고 있다. 18평형의 경우 6단지 17동은 공시가격이 5억9800만원인 반면 7단지에는 6억600만원짜리가 있고 2단지도 간발의 차이로 6억원을 넘어 종부세 과세 대상이 돼 해당 주민들의 반발이 크다. 업계 전문가는 집값 하락세가 계속된다면 대치동 은마아파트처럼 실거래가보다 공시가격이 더 높은 아파트들이 나올 가능성이 높다 며 과천은 물론 올 들어 가격이 큰 폭으로 떨어진 지역에서도 공시가격 조정을 요구하는 여론이 높아질 수 있다 고 말했다.,https://news.naver.com/main/read.nhn?mode=LSD&mid=shm&sid1=260&oid=015&aid=0000959988,69
51107,2007.05.01. 오전 12:11,부동산,한국경제,뉴타운 낀 강북 강남보다 더 올라…서울 단독주택 공시가격 살펴보니,서울에서 동시다발로 추진되고 있는 재정비 촉진사업 뉴타운 이 단독주택 공시가격을 큰 폭으로 끌어올린 것으로 나타났다. 특히 아파트 등 공동주택이 주로 강남지역에서 상승세가 뚜렷한 반면 단독주택의 경우 강북지역 강세가 두드러져 지역 간 차별화가 극명해지는 양상이다. 30일 서울시 및 일선 구청에 따르면 이날부터 공시가격 열람이 시작된 올해 서울지역 단독주택 다가구 포함 은 모두 41만2019가구로 이들 주택의 공시가격 평균 상승률은 작년 3.92% 보다 2배 이상 오른 8.5%로 집계됐다. 이 가운데 종합부동산세 부과대상이 되는 6억원 초과 단독주택은 1만9760가구에 불과하고 나머지는 3억 6억원 7만4500가구 3억원 이하 31만7759가구 등이어서 단독주택 소유주들의 세 부담은 크지 않을 전망이다. 지역별로 보면 종로 12.51% 동작 12.21% 은평 11.41% 용산 11.31% 동대문 11.30% 성북 10.83% 송파 10.13% 등이 10% 이상 올라 상승폭이 컸다. 이어 양천 9.98% 서초 9.26% 중구 9.17% 등도 서울지역 평균 상승률을 웃돌았다. 이에 비해 공동주택에서 공시가격 상승폭이 컸던 강동 7.09% 강남구 5.8% 등은 하위권에 머물렀다. 강북지역 상승세가 두드러진 이유는 재정비 촉진지구 내 재개발사업의 추진이 큰 영향을 미쳤기 때문으로 풀이됐다. 실제 이들 지역 단독주택 공시가격은 평균 20 30% 오른 곳이 수두룩해 서울지역 평균 상승률을 이끌고 있는 것으로 분석된다. 종로구는 작년에 9.4%가 올라 용산구 9.5% 다음으로 상승률 2위를 기록한데 이어 올해는 12.51%가 올라 수위를 차지했다. 종로구는 현재 교남뉴타운 2차 과 청계천변 개발 호재가 맞물려 있는데다 인사동 일대 화랑이 삼청·가회동으로 대거 이전하면서 단독주택 가격이 급상승하는 추세다. 실제 이들 지역은 상승률이 각각 26.05% 20.5%로 급등했다. 올해 상승률 2위를 기록한 동작구도 흑석·노량진 뉴타운 개발이 가시화되면서 상승세를 이끌었다. 이들 지역의 상승률은 24%에 달했다. 은평구에서도 수색 뉴타운의 공시가격 가격상승률이 20%를 넘었으며 용산구는 한남·보광 뉴타운을 비롯해 국제업무지구로 개발이 추진되는 한강로3가 주변을 중심으로 강세를 띠고 있다. 작년까지만 해도 공시가격이 전년에 비해 1.2% 떨어졌던 동대문구도 이문·휘경뉴타운 개발과 청량리 일대 균형발전촉진지구 지정 효과로 공시가격이 급등했다. 송파신도시 후광효과와 거여·마천뉴타운 개발이 한창인 송파구 역시 10%가 넘는 가격 상승률을 보여 눈길을 끌었다. 일선 구청 관계자들은 뉴타운 사업 등 도시재개발사업이 본격화되면서 점차 가격이 크게 오르는 추세인데다 주민들도 시세차익을 목적으로 공시가격이 더 오르기를 원하는 경우가 많다 고 말했다.,https://news.naver.com/main/read.nhn?mode=LSD&mid=shm&sid1=260&oid=015&aid=0000960008,69
51108,2007.05.02. 오후 10:33,부동산,경향신문,국세청 “주택 증여세액 기준은 시가”,국세청은 증여세를 과세할 때 3개월 이전의 시가라도 합리적인 이유가 있다면 이를 증여가액으로 산정해 증여세를 과세해야 한다고 2일 밝혔다. 김모씨는 2004년 11월 아버지가 물려준 단독주택의 증여 재산가액을 공시가격인 5억4000만원으로 신고하고 증여세로 8300만원을 냈다. 이에 대해 국세청은 증여 8개월 전 매매가 8억4000만원을 증여재산 가액으로 산정 세금 1억2000만원을 추가 납부하라고 통지했고 김씨는 과세전 적부심사를 요청했으나 기각됐다. 김씨는 증여가액은 시가를 기준으로 하되 증여일 전후 3개월 이내 유사 매매사례나 감정가가 없는 경우에는 기준시가를 적용할 수 있다는 상속·증여세법 시행령 규정을 들어 부당한 과세라고 주장 심사를 청구했다.,https://news.naver.com/main/read.nhn?mode=LSD&mid=shm&sid1=260&oid=032&aid=0000223253,69
51109,2007.05.02. 오후 10:03,부동산,연합뉴스,탄현 로비의혹 전.현직 고양시의원 검거종합2보,수원 연합뉴스 김정은 기자 정.관.금융계 로비의혹을 받고 있는 일산 탄현 주상복합아파트사업 시행사로부터 뇌물을 받은 전.현직 고양시의원이 검찰에 검거됐다. 수원지검 특수부 조정철 부장검사 는 2일 도시계획조례 개정을 도와주는 대가로 사업 시행사인 K사측으로부터 수천만원을 받은 혐의 뇌물수수 로 고양시의회 전 의원 S 39 씨를 구속하고 억대의 돈을 받은 혐의 특가법상 뇌물수수 로 현 의원 C 42 씨에 대해 구속영장을 청구했다. 검찰은 또 K사 대표 정모 47.구속 씨의 부탁을 받고 C씨에게 돈을 건넨 혐의 뇌물공여 로 K사 계열사 직원 왕모 47 씨를 구속했다. 검찰에 따르면 S씨는 지난해 4월 K사 대표 정씨의 부탁을 받은 브로커 서모 51.사채업자.구속 씨로부터 고양시 의회에서 발의한 주상복합 주거비율을 상향조정하는 내용의 조례개정안이 통과될 수 있도록 도와달라 는 청탁과 함께 현금 2천만원을 받은 혐의를 받고 있다. 조사결과 S씨는 평소 알고 지내던 고양시 공무원을 통해 로비대상을 찾고 있던 서씨를 소개받았으며 돈을 받은 뒤 동료 시의원 등을 상대로 조례 개정안 통과를 위해 힘썼던 것으로 알려졌다. 검찰은 K사 대표 정씨가 브로커 서씨에게 S씨에 대한 로비명목으로 5천만원을 줬다고 진술함에 따라 S씨가 2천만원 외에 추가로 돈을 받았는지 여부를 조사할 예정이다. 그러나 S씨는 관련 혐의를 전면 부인하고 있다고 검찰은 밝혔다. C씨는 2005년 9월 경기도 고양의 한 음식점에서 왕씨로부터 주거비율과 상가비율을 9대1로 변경하는 조례개정안을 발의해 달라 는 부탁을 받고 같은해 10월과 조례개정안 통과 이후인 지난해 5월 2차례에 걸쳐 활동비 등의 명목으로 1억원을 받은 혐의를 받고 있다. 조사결과 왕씨와 C씨는 고등학교 선후배 사이로 K사 대표 정모 47.구속 씨는 주거비율과 상업비율이 7대 3인 고양시 조례로 인해 탄현사업의 사업성이 떨어진다고 판단되자 왕씨를 통해 C씨에게 접근한 것으로 드러났다. 한편 검찰은 왕씨로부터 당시 C씨와 함께 다른 의원 L 56 씨를 만난 적이 있다는 진술을 확보 다른 전.현의원들에게도 금품을 전달했는지를 캐고 있다. 고양시의회는 지난해 5월 고양시 및 시민단체의 반대에도 불구하고 주상복합의 상가대 주거비율을 3대 7에서 1대 9로 변경 사업성을 높여주는 내용의 조례 개정안을 통과시켜 특혜의혹을 받아왔다.,https://news.naver.com/main/read.nhn?mode=LSD&mid=shm&sid1=260&oid=001&aid=0001624950,69
51110,2007.05.02. 오후 9:21,부동산,파이낸셜뉴스,서울 은마아파트 한달새 3억 내려,종합부동산세 등 세금 부담을 피하기 위한 급매물이 속출하고 있는 가운데 서울 강남구 대치동 은마아파트 34평형이 올 1월에 비해 3억원 가까이 떨어진 10억원에 거래된 것으로 나타났다. 건설교통부는 2일 은마아파트 34평형이 10억원에 거래된 것으로 지난달 19일 지방자치단체에 신고됐다며 실제 계약일은 16일로 파악됐다고 밝혔다. 강남구 재건축아파트의 대표격인 은마아파트는 34평형의 경우 지난 1월까지만 해도 12억8000만원에서 13억원에 거래됐다가 이후 가격이 하향 안정세를 보이고 있다. 3월과 지난달 초에 거래된 금액은 12억2000만∼12억7000만원이었다. 10억원에 거래된 경우는 급하게 처분해야 하는 사정 때문에 헐값에 나온 매물로 실제 시세는 10억원까지 떨어지지 않은 것으로 건교부는 보고 있다. 건교부는 또 10억원에 거래된 급매물의 공시가격은 9억8400만원이어서 거래가격보다 낮다면서 아직까지는 공시가격이 시세보다 높은 역전현상이 발생하지는 않고 있다고 덧붙였다.,https://news.naver.com/main/read.nhn?mode=LSD&mid=shm&sid1=260&oid=014&aid=0000300257,69
51111,2007.05.02. 오후 9:00,부동산,MBC,부동산 담보대출‥고객은 봉,뉴스데스크 앵커： 집을 담보로 은행에서 돈을 빌리는 분들 불만이 이만저만이 아닙니다. 은행들이 고객들과의 약속을 지키지 않고 있기 때문입니다. 정시내 기자가 취재했습니다. 기자： 내집마련을 위해 은행에서 아파트 중도금 １억원을 대출받은 신윤순 씨. 은행측은 대출기간인 ３년을 채우지 않더라도 아파트 입주 때에는 수수료를 면제해 주겠다고 약속했습니다. 그러나 ２년 뒤 입주를 앞두고 신 씨가 대출금을 갚으려고 하자 수수료 １５０만원을 내라고 요구했습니다. 인터뷰： 입주시와 전매시에는 중도상환수수료가 없다라고 안내홍보를 했습니다. 그러나 입주시에 대출금을 갚으려고 하니까 수수료가 있다고 했습니다. 기자： 회사원 양 모씨는 지난해 １０월 갑자기 카드사용이 정지됐습니다. 은행측에서 대출 이자가 연체됐다고 양 씨에게 통보도 하지 않은 채 카드사용을 중지시켰기 때문입니다. 인터뷰： 통보 없이 일방적으로 카드정지를 시키는 행동은 납득이 안 되는 거죠. 기자： 소비자 불만 가운데는 사전통보나 설명 없이 연체이자를 부과하는 등 연체 관련이 가장 많았고 다음은 중도상환수수료와 이자율 인상 등입니다. 인터뷰： 대출 연장시 지나치게 불리한 조건을 제시하는 부분 등에 대해서 금감원과 공정위에 개선건의를 할 생각입니다. 기자： 은행의 주택담보대출은 해마다 １０％ 이상씩 늘고 있지만 은행의서비스는 여전히 제자리 걸음을 하고 있습니다. ＭＢＣ뉴스 정시내입니다.,https://news.naver.com/main/read.nhn?mode=LSD&mid=shm&sid1=260&oid=214&aid=0000038463,69
51112,2007.05.02. 오후 8:39,부동산,파이낸셜뉴스,신도시 개발 분양권 보상땐 분양가 10% 인하,신도시 개발을 위한 토지 수용시 보상비를 현금 대신 아파트 입주권 등으로 보상하는 입체환지 방식 을 적용할 경우 아파트 분양가가 10% 이상 낮아지고 아파트 분양가를 결정하는 기준이 되는 택지비도 30% 이상 낮아진다는 연구결과가 나왔다. 이같은 이점이 있는 입체환지 방식 도입에 건설교통부도 적극 찬성하고 있어 신도시 보상 체계의 전면적인 개정이 더욱 더 빨라질 전망이다. 2일 대한주택공사 주택도시연구원이 민주당 이낙연 의원에게 제출한 환지 방식의 효과 및 활성화 방안 에 따르면 신도시 개발시 현금이 아닌 아파트 분양권이나 상가 건물 등으로 보상하는 입체환지 방식을 적용할 경우 분양가 인하 효과와 함께 원주민 정착률도 높일 수 있는 것으로 조사됐다. 연구원이 수도권의 한 택지개발지구를 대상으로 입체환지 방식을 적용해 시뮬레이션을 한 결과 분양가가 14%나 낮아지는 것으로 나타났다. 시뮬레이션 대상이 된 택지개발지구에 토지소유자 267명 중 61명은 현금청산하고 나머지는 모두 입체환지로 보상한다고 가정할 경우 총건립 가구 수인 5515가구 중 182가구가 원주민에게 돌아가고 아파트를 받지 않은 24명은 근린생활시설을 받게 된다. 나머지 5333가구가 일반분양되는 데 이중 1151가구의 분양이익이 원주민용 아파트 182가구를 짓는 건축비로 4182가구의 분양이익은 택지비로 각각 사용된다. 이때 택지비 보상비 대지조성비 기타 는 현행 전면 현금보상때 보다 32%나 낮아진다. 건축비를 평당 400만원으로 가정할 경우 현행 방식으로는 분양가는 720만원이지만 입체환지 방식으로는 619만원이면 가능해 분양가가 14%나 줄어드는 것으로 나타났다. 토지보상을 위한 별도의 금융비용이 지출되지 않는 것을 감안하면 실제 분양가 인하효과는 더욱 클 것으로 분석됐다. 건교부는 연초 신도시 등 공공택지 개발에도 수용되는 땅주인이 요구할 경우 해당 택지지구내 들어서는 아파트 분양권이나 상가 건물 등으로 보상하는 입체환지 방식의 적용하기로 하고 상반기 중 택지개발촉진법 시행령을 고치고 5월 중 입법예고를 거쳐 하반기부터 시행할 계획을 세우고 적극 추진 중이다. 이 의원은 택지개발사업도 재개발사업처럼 아파트 등으로 보상할 수 있도록 하는 택지개발촉진법 일부개정안 을 마련 이번주 안에 국회에 제출할 예정이다. 국가와 지방자치단체 주택공사 등의 공공주체에 의해 택지개발 및 주택건설이 함께 시행되는 경우 입체환지 방식의 사업시행이 가능하도록 법적 근거를 마련하겠다는 것이다.,https://news.naver.com/main/read.nhn?mode=LSD&mid=shm&sid1=260&oid=014&aid=0000300116,69
51113,2007.05.02. 오후 8:32,부동산,매일경제,7월께 용산역세권 사업자 재공모,표류하고 있는 용산역세권 재개발사업이 철도공사와 서울시 간 합의를 통해 7 8월께 사업자 재공모를 거쳐 다시 추진될 것으로 보인다. 이철 철도공사 사장은 2일 서울시와 협의가 끝나는 대로 7 8월께 용산역세권 개발 사업자 공모에 다시 나서겠다 고 밝혔다. 이 사장은 이날 기자간담회에서 용산역세권 개발은 도시개발 차원에서 지자체가 전폭적으로 지원해야 한다 며 서울시가 서부이촌동 연계개발 강변북로 지하화 등을 무리하게 요구하는 것은 바람직하지 않다 고 주장했다. 그는 일본 등 선진국에선 역세권을 개발할 때지자체가 모든 인프라스트럭처를 떠안아 힘을 실어준다 며 서울시도 적극 협조해주길 기대한다 고 강조했다. 철도공사는 용산역세권을 개발하면 개발이익이 수조 원에 달해 누적적자를 해소하는 데 결정적 기여를 할 것으로 보고 있다. 이 사업을 필두로 청량리역사 등 역세권 개발에 본격 나선다는 방침이다. 이 사장은 지난해 적자 폭을 당초 9000억원대로 예상했지만 경영이 정상화하면서 4000억원가량 적자를 줄였다 며 누적부채라는 태생적 한계만 없었다면 흑자로 돌아섰을 것 이라고 말했다. 한편 이 사장은 그동안 한국철도공사 와 코레일 로 혼용돼 사용되던 명칭을 코레일 KORAIL 로 일원화하기로 했다 고 말했다.,https://news.naver.com/main/read.nhn?mode=LSD&mid=shm&sid1=260&oid=009&aid=0000584484,69
