,date,cat,co,headline,text,url,week
57295,2007.06.26. 오후 7:18,부동산,한겨레,투자가치 ‘솔깃’…생활가치는 ‘비호감’,한겨레 초고층 주거시설이 빠르게 확산되고 있다. 2002년 서울 강남구 도곡동 타워팰리스를 시작으로 불붙기 시작한 초고층 바람은 서울을 벗어나 부산 인천 경기 화성 동탄 충남 아산 구미 등 전국으로 퍼지고 있다. 특히 최근에는 주상복합뿐만 아니라 일반 아파트도 초고층으로 설계하는 사례가 늘고 있다. 그러나 초고층 주거시설이 주택시장에서 확고히 자리잡았다고 보기에는 아직 이르다는 평가다. 투자 가치와 조망권·일조권에서 높은 점수를 받고는 있으나 입주자의 건강 측면에서는 여전히 우려를 안고 있기 때문이다. 수년새 가격 껑충…조망·일조권도 각광 자연 환기 곤란…주민 건강 악영향 논란 건축비 비싸 현재 국내에서 아파트값이 가장 비싼 서울 삼성동 아이파크 사진 는 최고 46층인데 지난 2001년 분양 때엔 평당 1500만 2500만원 가량이었으나 현재는 시가가 평당 4천만 5천만원에 이른다. 이렇듯 높은 투자가치는 초고층 건설의 거센 바람을 일으켰으며 주거공간의 다른 가치를 압도하며 소비자들을 끌어들이는 원동력이 됐다. 그러나 초고층은 건설사에 유리하지만은 않다. 30층을 넘어서면 건축비가 크게 증가하기 때문이다. 국내 굴지의 한 건설사 홍보팀은 “30층 미만을 100으로 봤을 때 30층 이상은 5% 40층 이상은 15% 50층 이상은 30% 70층 이상은 60 70% 100층은 100% 이상 건축비가 증가한다”고 설명했다. 무게나 바람 외부 충격 등에 맞서 건물의 안전을 보장하기 위한 구조 비용이 늘어나기 때문이다. 이봉남 건설기술연구원 연구위원은 “현재는 투자가치가 좋지만 공급이 많아지면 가치는 떨어진다”고 말했다. 건강 영향은 논란중 투자가치는 매력적이지만 건강에 대한 우려는 큰 단점으로 꼽힌다. 윤방부 연세대 가정의학과 교수는 “고층에서는 고소공포 메슥거림 소화불량 혈압 저하 불안으로 인한 맥박 빨라짐 산소 부족으로 인한 어지러움 등 여러 가지 문제가 생길 가능성이 있다”면서도 “그 자체가 질병이라고 보기는 어렵고 사람이 살다 보면 대부분 적응이 되는 문제들”이라고 밝혔다. 건국대 소비자주거학과 강순주 교수는 환기 문제가 심각하다고 지적했다. 강 교수는 “고층 건물은 안전 때문에 자연 환기를 하기 어려운데 이로 인해 각종 오염물질과 냄새가 잘 빠지지 않아 머리가 아프고 스트레스를 받거나 아토피 등 질병을 겪을 수 있다”며 “자연 환기를 하면 보통 1년 안에 해결되는 문제들”이라고 지적했다. 현재 타워팰리스에 사는 손아무개 35 씨도 “큰 불편은 없지만 자연 환기를 못해서 느끼는 답답함은 크다”고 토로했다. 현재까지 한국에서 나온 연구들은 초고층과 건강의 관계에 대해 이렇다 할 결론을 내리지 못하고 있다. 2003년 ‘초고층 아파트 거주자의 건강에 관한 조사연구’라는 논문을 낸 한남대 강인호 교수와 주택공사 주택도시연구원 백혜선 선임연구원은 “겨울에 난방으로 인한 건조함이 건강에 영향을 주는 것으로 분석됐으나 거주층과의 관계는 분명하지 않다”며 “그밖엔 여러 건강상의 연관성은 나타나지 않았은데 아마도 평균 거주 기간이 짧고 외국과 생활 방식이 달라 그런 것 같다”고 밝혔다. 풍수지리학자인 최창조 전 서울대 교수는 “전통 풍수의 관점에서 보면 땅 냄새가 나거나 땅에서 자란 나무가 닿는 높이까지만 땅의 기운이 전해진다”면서도 “초고층에 사는 사람의 생각이 가장 중요하다”고 말했다. 강순주 건국대 교수는 “젊고 활동적인 사람들은 원스톱이 가능한 도심의 초고층 주거가 어울리고 아이나 노인들은 아무래도 땅과 가까운 곳에서 사는 게 좋다”며 “고품격 주거는 층수에서 오는 게 아니라 자신의 삶에 맞는 주거를 선택하는 데서 온다”고 말했다. 초고층 아파트란 1879년 미국 뉴욕에서 8층의 다코타·푸에블로 아파트가 지어졌을 때 사람들은 이를 고층 아파트라고 불렀다. 1983년 서울 강남구 압구정동에 지어진 18층 미성아파트는 초고층이었다. 1990년 초반까지 한국에서는 건축법에 따라 16층 이상을 초고층 아파트로 규정했다. 그러나 90년대 후반 20 30층의 아파트들이 대량으로 지어지면서 초고층의 기준은 20층 이상 30층 이상으로 계속 높아졌다. 최근엔 보통 35층 이상을 초고층이라고 부른다. 현재 유럽에선 12층 이상 미국에선 50층 이상을 초고층 주택으로 분류한다. 김규원 기자 che hani.co.kr 도시 살리기냐 죽이기냐 극단적 공간 가르기…경관·환경 영향도 논란 초고층 주거를 둘러싼 또다른 쟁점은 초고층 건물이 도시 안에 들어서면서 일으키는 경관이나 조망·일조권 녹지 확보 등 도시 환경상의 문제들이다. 비판적인 전문가들은 초고층 건물이 산이 많은 한국 도시 경관에 악영향을 준다고 주장한다. 건축가인 김인철 중앙대 교수는 “미국이나 유럽 도시는 주변에 도시를 제한하는 요소가 별로 없는데 한국은 산이 도시 경관을 결정하는 중요한 요소”라며 “산이 두드러진 자연 환경에서 고층 건물은 잘 어울리지 않는다”고 말했다. 김 교수는 “사람들이 스카이라인 하늘선 을 이야기하지만 한국에선 ‘마운틴라인’ 산능선 을 살펴야 한다”고 덧붙였다. 경북대 하재명 건축학부 교수도 “도심이 고층이고 주변이 낮아지는 게 자연스럽고 건강한데 신시가나 주택가에 들어서는 초고층 아파트나 주상복합은 도시 기능을 역전시키고 경관을 해친다”고 비판했다. 이런 문제로 인해 초고층 건물을 지을 때 지역을 가려야 한다는 의견이 많다. 한국초고층건축포럼 초고층포럼 의 김혜정 명지대 교수는 “저층인 지역에 초고층이 들어서면 경관에 악영향을 주는 것은 사실”이라며 “서울에서는 용산 상암과 같은 부도심이나 역세권에 들어서는 게 도시 기능이나 미관상 바람직하다”고 말했다. 지지하는 전문가들은 초고층 건물의 장점도 많다고 말한다. 초고층포럼의 이봉남 건설산업연구원 연구위원은 “초고층 건물은 건폐율이 낮아 토지 이용 효율이 높고 바닥 녹지를 넓게 확보할 수 있으며 조망권·일조권 측면에서도 유리하다”고 주장했다. 그러나 이런 장점들은 ‘그들만의 것’이라는 비판도 나온다. 조명래 단국대 도시지역계획학과 교수는 “초고층으로 지어 바닥에 빈 공간이 넓지만 초고층 주상복합의 바닥 녹지는 입주민들이 독점하고 있다”며 “초고층 입주민의 조망·일조권이 좋아지면 주변 주민들의 조망·일조권을 방해할 수 있다”고 말했다. 조 교수는 “고속 엘리베이터와 인공 냉난방으로 인한 에너지 사용 증가 교통 혼잡 등 환경에도 악영향을 주며 근본적으로 도시 공간을 빈부에 따라 극단적으로 갈라놓는다는 점에서 문제가 크다”고 비판했다. 김규원 기자 che hani.co.kr 온라인미디어의 새로운 시작. 인터넷한겨레가 바꿔갑니다. ⓒ 한겨레 hp www.hani.co.kr 무단전재 및 재배포 금지 한겨레는 한국온라인신문협회 www.kona.or.kr 의 디지털뉴스이용규칙에 따른 저작권을 행사합니다.,https://news.naver.com/main/read.nhn?mode=LSD&mid=shm&sid1=260&oid=028&aid=0000203485,77
57296,2007.06.26. 오후 7:17,부동산,한국경제,임대주택법 개정 사실상 무산,2017년까지 비축용 임대주택 50만가구를 공급하는 것을 골자로 한 임대주택법 개정안이 6월 국회를 통과하지 못해 정부의 임대주택 정책에 비상이 걸렸다. 이와 관련 정부는 당초 연내 5000가구를 공급키로 한 시범사업은 국민연금 우체국 농협 보험사 등의 금융권 프로젝트 파이낸싱으로 펀드를 조성해 예정대로 추진할 방침이다. 26일 건설교통부와 국회에 따르면 임대주택법 개정안이 건설교통위원회 법안심사소위를 통과하지 못해 비축용 임대주택 사업이 불투명해졌다. 정부는 이번 국회에서 건교위원장이 직권상정하는 방안을 고려 중이나 실현 가능성이 낮은 것으로 알려졌다. 이에 따라 정부는 9월 정기국회에 임대주택법 개정안을 재상정할 방침이나 대통령 선거를 앞두고 있는 만큼 법안 논의 자체가 어려울 것으로 예상돼 비축용 임대주택 사업은 내년으로 넘어가거나 장기 표류할 가능성이 커졌다. 건교위 법안심사소위 소속 의원들은 이날 중산층을 위해 재정 부담이 큰 비축용 임대주택을 짓는 것은 저소득층과의 형평성에 어긋나고 성격이 비슷한 임대주택이 난립할 우려가 높다는 이유로 임대주택법 개정안에 부정적인 의견을 낸 것으로 알려졌다. 이에 따라 비축용 임대주택 공급을 포함한 공공부문 역할 강화 방안을 제시한 1·31 부동산대책에 큰 차질이 빚어질 것으로 보인다. 정부는 지난 1월 올해부터 2017년까지 10년간 임대한 뒤 일반에 매각하는 비축용 임대주택 50만가구를 공급하겠다는 계획을 발표했었다.,https://news.naver.com/main/read.nhn?mode=LSD&mid=shm&sid1=260&oid=015&aid=0000973272,77
57297,2007.06.26. 오후 7:00,부동산,한겨레,6월 27일 부동산 파일,한겨레 영종도 리조트 창립회원 모집 롯데건설 은 오는 29일 인천 영종도 을왕동에 골든스카이 인터내셔널 리조트 홍보관 문을 연다. 2008년 9월 들어서는 골든스카이 리조트는 지하 6층·지상 9층으로 모두 201개의 객실을 비롯해 워터파크 스파 대형 연회장 등 부대시설을 갖춘 휴양시설로 운영된다. 골든스카이 리조트는 객실 모두 을왕리해수욕장과 왕산해수욕장을 조망할 수 있도록 한쪽 복도 방식으로 배치돼 있어 서해의 아름다운 낙조를 객실에서 즐길 수 있다. 창립회원 청약은 7월9 10일 시중은행에서 접수한다. 회원모집 계좌는 31 48평형으로 금액은 계좌 12분의 1 당 31평형 6700만원 32평형 6900만원 35평형 7600만원이며 48평형은 계좌 6분의 1 당 2억2400만원이다. 032 752 1188 9. 전주 송천 아이파크 7월 분양 현대산업개발 은 오는 7월 전주시 덕진구 송천동에서 ‘송천 아이파크’ 782가구를 분양한다. 녹지와 인접한 입지적 장점을 살려 공원 같은 아파트로 조성되며 산책로가 단지 앞쪽의 건지산과 100만평 규모의 덕진공원으로 연결된다. 단지 앞쪽의 건지산 조망권을 확보하기 위해 남향 위주로 단지를 배치했다. 지하2층 지상12층 16개동에 40 65평형으로 구성되며 2009년 5월 입주한다. 본보기집은 7월 덕진광장 인근의 서부신시가지에 문을 연다. 063 273 9300. 포항 장성에 타워형 두산위브 두산건설 이 경북 포항 장성동에 ‘두산위브 더 제니스’를 분양하고 있다. 지상 48층 9개동 34 77평형 1713가구로 이뤄진 대단지다. 타워형으로 설계돼 조망권이 우수하며 첨단 홈네트워크 시스템을 채택했다. 인근에 대구 포항 고속도로 철강공단 건천 나들목간 산업도로가 지나며 포항 삼척을 잇는 동해 중부선과 영일만 신항 배후도로가 개설될 예정이다. 분양값은 평당 평균 745만원 선이다. 054 281 0086. 온라인미디어의 새로운 시작. 인터넷한겨레가 바꿔갑니다. ⓒ 한겨레 hp www.hani.co.kr 무단전재 및 재배포 금지 한겨레는 한국온라인신문협회 www.kona.or.kr 의 디지털뉴스이용규칙에 따른 저작권을 행사합니다.,https://news.naver.com/main/read.nhn?mode=LSD&mid=shm&sid1=260&oid=028&aid=0000203466,77
57298,2007.06.26. 오후 6:42,부동산,경향신문,주택대출 금리 소폭 내림세로,주택담보대출 금리가 소폭 내림세로 돌아섰다. 26일 은행권에 따르면 하나은행과 외환은행의 주택담보대출 금리는 연 6.13 6.83%와 연 6.15 7.00%로 지난 주말에 비해 각각 0.01%포인트씩 하락했다. 지난 25일 양도성예금금리 CD 금리가 전날보다 0.01%포인트 떨어진 연 5.03%를 기록하면서 이에 연동된 이들 은행의 주택담보대출 금리도 동반 하락했기 때문이다. 하나·외환은행의 주택담보대출 최저금리는 지난달말 연 6.17%와 6.19%를 기록한 뒤 지난 4일에도 연 6.14%와 6.16%로 0.03%포인트씩 내린 바 있다. 우리·신한은행과 국민은행도 조만간 주택담보대출 금리를 내릴 것으로 보인다. CD금리가 하락세를 보인 것이 금융감독당국이 이달들어 은행들의 과도한 CD와 은행채 발행을 경고하고 나섰기 때문이다. 그러나 다음달부터는 주택담보대출 금리가 다시 상승곡선을 그릴 것으로 보인다. 주택신용보증기금 출연료율이 0.165%에서 0.3%로 인상되기 때문에 주택담보대출 가산금리 인상이 불가피해지기 때문이다. 이에 따라 당장 주택담보대출을 받아야 하는 실수요자들은 이달 안에 대출을 받는 것이 유리할 것으로 보인다. 〈정유진기자 sogun77 kyunghyang.com〉 대한민국 희망언론 경향신문 구독신청 hp smile.khan.co.kr ⓒ 경향신문 미디어칸 www.khan.co.kr 무단전재 및 재배포 금지 〈미디어칸은 한국온라인신문협회 www.kona.or.kr 의 디지털뉴스이용규칙에 따른 저작권을 행사합니다.,https://news.naver.com/main/read.nhn?mode=LSD&mid=shm&sid1=260&oid=032&aid=0000231470,77
57299,2007.06.26. 오후 6:42,부동산,경향신문,中企 부동산 담보대출 더 죈다,앞으로 중소기업이 부동산을 담보로 은행에서 대출받을 수 있는 금액이 크게 줄어들고 대출 용도와 다르게 사용되는지에 대한 점검도 강화된다. 금융감독위원회는 최근 급증하고 있는 중소기업 대출의 관리를 강화하기 위해 이 같은 방안을 검토하고 있다고 26일 밝혔다. 한국은행이 최근 중소기업에 대한 총액대출한도를 1조5000억원 축소한 데 이어 금융감독당국도 중소기업 대출 규제에 나선 것이다. 금감위는 중소기업이 부동산을 담보로 사업자금을 대출받을 때 대출 시점의 부동산 시세가 아닌 과거 2 3년간 평균 시세를 적용해 대출가액을 결정하는 방안을 검토 중이다. 최근 수도권을 중심으로 부동산 가격이 상승세를 보였기 때문에 과거 2 3년간 평균 시세를 적용하면 중소기업이 대출을 받을 수 있는 금액은 줄어들 수밖에 없다. 금감위는 또 현재 5억원인 용도외 유용 의무 점검대상 기준을 낮춰 의무점검 대상을 대폭 늘리는 방안도 강구하고 있다. 현재 중소기업의 평균 대출금액은 3억6000만원으로 이 수준에서 의무 점검 대상 기준이 결정될 것으로 보인다. 금융감독원은 이달부터 중소기업 대출 동향의 점검주기를 10일에서 1일로 단축하고 용도별·업종별 대출 동향과 연체 추이 등을 통해 대출 쏠림 현상과 부실 위험 요인을 파악할 수 있는 지표를 개발 중이다. 5월 말 현재 은행권의 가계대출 잔액은 349조7000억원으로 지난해 말보다 3조9000억원 1.13% 늘어나는 데 그친 반면 중소기업 대출 잔액은 332조8000억원으로 29조5000억원 9.73% 급증했다. 시중은행의 중소기업 대출 증가액은 1·4분기에 월평균 5조1000억원씩 늘었으나 4월 7조원 5월 7조1000억원 등으로 급증하는 추세를 보이고 있다. 지난 3월 말 현재 중소기업 대출 잔액 317조1000억원 가운데 비제조업이 199조2000억원 62.8% 으로 제조업보다 월등히 많았으며 건설업과 부동산업 등 부동산 관련 업종의 비중이 78조4000억원 24.8% 에 이르렀다. 중소기업 대출의 연체율도 지난해 말 1.1%에서 5월 말에는 1.3%로 높아졌다. 금감위 권혁세 감독정책1국장은 “중소기업 대출의 위험성이 커질 가능성이 있다”며 “은행들의 외형 경쟁에 따른 급격한 대출 증가 및 기업활동과 연관이 없는 중소기업 대출이 늘어나는 것은 바람직하지 않다”고 말했다. 〈안호기기자〉 대한민국 희망언론 경향신문 구독신청 hp smile.khan.co.kr ⓒ 경향신문 미디어칸 www.khan.co.kr 무단전재 및 재배포 금지 〈미디어칸은 한국온라인신문협회 www.kona.or.kr 의 디지털뉴스이용규칙에 따른 저작권을 행사합니다.,https://news.naver.com/main/read.nhn?mode=LSD&mid=shm&sid1=260&oid=032&aid=0000231469,77
57300,2007.06.26. 오후 6:42,부동산,경향신문,인천 남동구 주택 투기지역 지정,인천 남동구가 주택 투기지역으로 지정됐다. 재정경제부는 26일 부동산가격안정심의위원회를 열어 인천 남동구와 울산 울주군에 대해 주택 투기지역 지정여부를 심의한 결과 이같이 결정했다고 밝혔다. 이로써 주택 투기지역은 전국 93곳으로 늘어났고 토지 투기지역은 99곳을 유지했다. 인천 남동구는 올해 주택가격 상승률이 3.0%로 전국 평균 1.6% 보다 2배가량 높은 데다 논현·서창지구 택지개발사업 소래·논현지역 도시개발사업 등 각종 개발사업 추진과 2014년 아시안게임 유치에 따른 개발 기대감 등으로 주택가격 상승세가 지속될 가능성이 있다는 점이 고려됐다. 주택 투기지역으로 지정되면 주택담보인정비율 LTV 이 60%에서 40%로 낮아지고 6억원이 넘는 아파트는 총부채상환비율 DTI 40%가 적용되며 동일차주 대출 건수 제한 등의 규제를 받게 된다. 한편 인천 남동구와 함께 심의대상에 오른 울산광역시 울주군은 주택 투기지역 지정이 유보됐다. 〈오관철기자〉 대한민국 희망언론 경향신문 구독신청 hp smile.khan.co.kr ⓒ 경향신문 미디어칸 www.khan.co.kr 무단전재 및 재배포 금지 〈미디어칸은 한국온라인신문협회 www.kona.or.kr 의 디지털뉴스이용규칙에 따른 저작권을 행사합니다.,https://news.naver.com/main/read.nhn?mode=LSD&mid=shm&sid1=260&oid=032&aid=0000231466,77
57301,2007.06.26. 오후 6:42,부동산,경향신문,미분양 아파트 한달새 20％ 늘어,전국에 걸쳐 미분양 아파트가 크게 늘고 있다. 주택경기 침체를 비롯 분양가 상한제 시행을 앞두고 건설업체들이 대거 분양물량을 쏟아낸 데 따른 것이다. 26일 부동산정보업체 닥터아파트에 따르면 6월 현재 전국의 미분양 아파트 주상복합 포함 는 총 507곳 5만2577가구로 조사됐다. 이는 지난달 4만7697가구에 비해 20.8% 4880가구 나 늘어난 수치다. 지역별로는 서울 경기 인천 등 수도권이 2310가구로 지난달 1447가구 에 비해 60%가량 증가했고 지방 광역시는 1만8266가구 지방 중소도시는 3만2000가구로 전달에 비해 각각 7.2% 9.5% 늘었다. 특히 지방 미분양은 닥터아파트가 2004년 10월 미분양 통계 조사를 시작한 이래 2년8개월 만에 최고치를 기록했다. 대구가 7012가구로 가장 많았고 광주광역시 6105가구 경북 구미시 2085가구 충남 천안시 1794가구 대전 1286가구 등이다. 이와 관련 건설업체들은 9월 분양가 상한제 시행을 앞두고 비수기인 7 8월에 ‘밀어내기식’ 분양을 계속 할 것으로 보여 미분양 아파트는 앞으로 계속 증가할 전망이다. 다만 이달 안에 일부 지방 투기과열지구가 해제될 경우 미분양 해소에 다소 숨통이 트일 것이라는 예측도 나오고 있다. 닥터아파트 이영호 팀장은 “미분양 아파트는 청약통장과 무관하고 상한제 적용을 받지 않을 경우 입주와 동시에 되팔 수 있다”면서 “중도금 무이자나 이자후불제 등 조건을 꼼꼼히 따진다면 청약가점제에서 불리한 실수요자에게 도움이 될 것”이라고 말했다. 〈정유미기자 youme kyunghyang.com〉 대한민국 희망언론 경향신문 구독신청 hp smile.khan.co.kr ⓒ 경향신문 미디어칸 www.khan.co.kr 무단전재 및 재배포 금지 〈미디어칸은 한국온라인신문협회 www.kona.or.kr 의 디지털뉴스이용규칙에 따른 저작권을 행사합니다.,https://news.naver.com/main/read.nhn?mode=LSD&mid=shm&sid1=260&oid=032&aid=0000231460,77
57302,2007.06.26. 오후 6:41,부동산,한국경제,광교 분양가 평당 900만1200만원,경기도가 자체 건설하는 명품신도시 1호인 광교신도시 개발계획이 26일 확정됐다. 관심인 분양가는 주변 시세의 70 80% 수준인 평당 900만 1200만원대가 될 전망이다. 경기도는 오는 9월부터 택지 공급 및 조성 공사에 들어가 내년 9월 주택을 첫 분양하고 2011년 4월께부터 입주할 수 있도록 할 계획이다. 김문수 경기지사는 이날 수원 이의동 나노팹센터에서 김용서 수원시장 서정석 용인시장 권재욱 경기지방공사 사장 등이 참석한 가운데 이 같은 내용의 광교 명품신도시 개발계획을 발표했다. 광교 명품신도시는 수원시 이의·원천·우만동 용인시 상현·영덕동 일대 341만평에 사업비 9조3000억원을 투입해 2011년까지 3만1000가구 7만7500명 수용 규모의 자족형 행정복합도시 형태로 건설된다. 김 지사는 광교신도시는 서울 강남역까지 30분 만에 갈 수 있는 자족 기능을 갖춘 품질 좋은 명품신도시로 건설될 것 이라고 말했다.,https://news.naver.com/main/read.nhn?mode=LSD&mid=shm&sid1=260&oid=015&aid=0000973177,77
