,date,cat,co,headline,text,url,week
144674,2009.07.06. 오전 7:00,부동산,머니투데이,삼성엔 26억달러 플랜트수주 대박,머니투데이 이군호 기자 알제리 스키다 Skikda 정유시설 현대화 단일 플랜트로는 국내업계 최대 삼성엔지니어링이 국내 업체가 수주한 플랜트 중 사상 최대인 26억달러짜리 정유 플랜트를 수주했다. 삼성엔지니어링은 지난 4일 알제리 국영석유회사인 소나트랙 Sonatrach 으로부터 지중해 연안 스키다 Skikda 지역에 건설하는 26억달러 VAT 포함 규모의 정유시설 현대화 프로젝트를 수주 공식 계약을 체결했다고 5일 밝혔다. 이번 공사는 원유정제 설비 CDU Crude Distillation Unit 부터 방향족 시설까지 정유 콤플렉스의 모든 공정을 개보수 및 신ㆍ증설하는 사업으로 이번 공사를 통해 스키다 Skikda 정유시설의 원유 정제능력은 일일 33만배럴까지 늘어난다. 또 고부가가치 정유 중간제품인 연 70만톤의 아이소머레이트 Isomerate 연 22만톤의 파라자일렌 Para Xylene 연 20만톤의 벤젠 Benzene 을 생산하는 플랜트도 신설한다. 총 공사 기간은 36개월이며 삼성엔지니어링은 설계ㆍ조달ㆍ공사관리에 이르는 전 과정을 일괄턴키 Lump Sum Turn Key 방식으로 수행하게 되며 벌크자재 구매 및 공사비는 실비정산 Reimbursable 방식으로 계약했다. 특히 조달 부분에서는 기자재 공급과 관련 국내 협력업체를 활용하기로 해 사업주의 비용 절감 및 국내 유관산업의 활성화에도 기여할 전망이다. 특히 이 공사는 국내 업체가 수주한 단일 플랜트로는 사상 최대 규모로 삼성엔지니어링의 올해 수주목표 7조원의 40%에 가까운 금액이다. 종전까지 단일플랜트 중 최대 규모는 지난해 현대건설이 수주한 카타르 라스라판 CIWPP 프로젝트로 20억달러였다. 정연주 사장은 이번 수주는 알제리 국영정유회사인 소나트랙을 신규 고객으로 확보한데다 아프리카 시장에 교두보를 마련했다는 점에서 의미가 크다 고 말했다. 한편 알제리는 원유 매장량 14위 가스 매장량 8위의 자원부국으로 최근 자원개발 및 인프라관련 투자가 급증하고 있는 신흥 건설시장이다. 소나트랙은 정유 및 가스 등 에너지뿐만 아니라 석유화학 분야에도 대규모 투자를 계획 중이어서 세계 글로벌 엔지니어링 업체부터 메이저 발주처로 주목받고 있다. 사진설명 지난 4일 오후 현지시간 알제리 소나트랙 본사에서 삼성엔지니어링 정연주 사장 왼쪽 이 소나트랙 모하메드 메지니 회장 Mr.Mohamed MEZIANE 과 계약식을 마치고 악수를 나누고 있다.,https://news.naver.com/main/read.nhn?mode=LSD&mid=shm&sid1=260&oid=008&aid=0002171682,183
144675,2009.07.06. 오전 6:05,부동산,연합뉴스,하반기 신도시서 2만9천여가구 쏟아진다,김포 한강신도시에 들어설 화성파크드림 자료사진 서울 연합뉴스 박성제 기자 하반기 수도권 신도시에서 2만9천여가구의 주택이 분양된다. 이는 상반기의 4.5배에 이르는 물량으로 특히 전용면적 85㎡ 이하가 73%나 돼 수도권 거주 중산층과 서민들의 내집 마련에 좋은 기회가 될 전망이다. 6일 국토해양부에 따르면 7월부터 연말까지 판교 광교 김포 한강 파주 운정 등 수도권 신도시에서 분양될 주택은 총 2만9천68가구로 집계됐다. 올 상반기에 6천51가구 밖에 분양되지 않았던 것과 비교하면 하반기 분양 물량은 4.5배나 된다. 주택 규모별로 보면 60㎡ 이하가 1만1천253가구로 가장 많다. 이어 60㎡ 초과∼85㎡ 이하가 9천919가구 85㎡ 초과가 7천896가구 등이다. 60㎡ 이하의 비율이 38.7% 85㎡ 이하의 비율은 72.8%에 이르러 대형 평형보다는 소형 평형 위주로 분양된다. 이에 따라 아직까지 내집을 장만하지 못한 수도권의 중산층이나 서민들은 올 하반기를 내집 마련 적기로 삼고 서둘러 치밀한 전략을 세우는 것이 필요하다. 특히 부동산 경기 침체와 분양가 상한제 등으로 건설업체들의 주택 건설이 극도로 부진한 실정이어서 향후 2∼3년 내 분양 물량이 많지 않을 가능성이 크다. 신도시별로는 김포 한강이 1만1천27가구로 가장 많다. 김포 한강에서는 이번 달 동시분양도 추진되고 있다. 이어 파주 운정에서 7천966가구 판교에서 7천42가구 광교에서 3천43가구가 각각 분양된다. 국토부는 시장이나 주택 건설업체의 상황 등에 따라 분양 물량에 변화가 있을 수는 있지만 주택시장이 다소 회복되는 조짐이 나타나고 있어 하반기에는 상반기보다 훨씬 많은 주택이 신도시에서 공급될 것으로 보고 있다.,https://news.naver.com/main/read.nhn?mode=LSD&mid=shm&sid1=260&oid=001&aid=0002748752,183
144676,2009.07.06. 오전 3:10,부동산,동아일보,집값 급등지역 집구입 목적 담보대출 억제,동아일보 투기지역도 생계용 주택대출은 규제 않기로 금융당국은 서민들이 생계비를 마련하기 위해 은행에서 주택담보대출을 받는 것은 계속 규제하지 않기로 했다. 집값이 오른다고 해서 엉뚱하게 서민들이 피해를 보는 것을 막고 경기회복에도 찬물을 끼얹지 않겠다는 의도다. 하지만 서울 강남권 등 일부 지역의 집값 오름세가 심상치 않은 점을 감안해 집값이 급등하거나 주택담보대출 수요가 빠르게 늘어나는 지역에 대해 자금줄을 조이도록 은행들을 독려하고 있다. 금융감독원 고위 관계자는 5일 “주택담보대출을 일괄적으로 규제하면 미분양이 많은 지방이나 서민들에게 미칠 영향이 크다”며 “집값 상승률이 전국 평균치를 크게 웃돌거나 대출 신청이 집중돼 가격이 크게 오를 것으로 우려되는 지역에 한해 규제를 강화할 계획”이라고 밝혔다. 서울 강남 서초 송파구 등 강남 3구뿐 아니라 경기 용인시와 과천시 등 지난해 11월 투기지역에서 해제된 수도권 일부 지역에서 집값이 들썩이고 이에 비례해 주택 구입 목적의 대출이 급증하자 선별적으로 자금줄을 죄겠다는 뜻이다. 금융계에선 규제 예상지역으로 서울 양천구 목동 경기 성남시 분당신도시 과천시 등을 거론하고 있지만 아직 대상이 확정되진 않았다. 금융당국은 수요가 몰려 집값이 급등한 지역을 먼저 추린 뒤 이들 지역에 대해 투기지역 지정 여부와 관계없이 은행들이 자율적으로 대출 취급액을 제한하도록 지도할 계획이다. 대출이 제한되는 지역에서 영업 중인 은행들에 대해 자율적으로 주택담보인정비율 LTV 을 낮추거나 총부채상환비율 DTI 을 적용하도록 유도하는 것이다. 현재 서울 강남 3구를 제외한 수도권 전 지역이 투기지역에서 해제된 뒤 대부분의 지역이 DTI 적용을 받지 않고 있으며 강남 3구는 40% LTV도 금융회사에 따라 60∼80%의 비율로 느슨하게 적용돼 왔다. 하지만 앞으로 정부가 LTV를 40%로 강화하고 DTI 규제를 비 非 투기지역에도 적용하면 주택담보대출을 받기 어려워진다. 예를 들어 연 소득이 5000만 원인 사람이 서울 마포구의 6억5000만 원짜리 아파트를 사면서 ‘연리 5% 10년 만기 원리금 균등분할상환’ 조건으로 대출을 신청할 경우 대출 한도가 지금의 3억9000만 원에서 1억5600만 원으로 줄어든다. 당국은 대출 규제가 강화돼도 생활비를 마련하기 위한 주택담보대출은 현행 체계대로 유지할 방침이다. 투기 수요를 잡기 위해 고강도 규제에 나섰다가 불황으로 생계비 마련이 힘든 서민들이 예기치 않은 타격을 받을 수 있기 때문이다. 현재 주택담보대출의 절반가량은 서민과 자영업자들이 생활자금 및 운전자금을 마련하기 위해 자기 집을 담보로 빌린 자금이다. 금융당국 관계자는 “주택담보대출의 목적을 잘 가려 은행이 투기 수요와 관계없는 서민 대출까지 억제하지는 않도록 권고할 방침”이라고 말했다. 금융당국은 아직 DTI와 LTV 규제를 일률적으로 강화해 전 지역에 적용할 단계는 아니라고 보고 있다. 당국의 한 관계자는 “집값 급등 지역이 확산되고 창구 지도만으로 한계가 있다고 판단되면 규제를 좀 더 강화할 수도 있지만 경기가 불투명한 상황에서 가격 폭락 등의 부작용을 초래할 수 있는 전면 규제를 도입하긴 어렵다”고 말했다.,https://news.naver.com/main/read.nhn?mode=LSD&mid=shm&sid1=260&oid=020&aid=0002060061,183
144677,2009.07.06. 오전 3:06,부동산,동아일보,재건축 아파트가 그냥 ‘집’으로 보이니,동아일보 하락 상승기마다 롤러코스터… “이미 금융상품化”강남3구 올 15.5% 급등… 같은 지역 일반아파트의 5배 《2005년 7월 서울 서초구 반포동 주공2단지 60m²를 7억5000만 원에 매입한 회사원 양모 씨 41 는 이 아파트를 재건축한 반포래미안퍼스티지 109m²를 최근 14억 원에 내놓았다. “입주 시점까지 조금 더 기다리면 집값이 더 오르지 않겠느냐”는 주위의 권유에도 불구하고 양 씨가 처분키로 한 이유는 집값 급등락으로 몇 년간 마음고생이 심했기 때문. 그는 “아파트를 산 직후부터 집값이 7억 13억 9억 원 등으로 널뛰기를 하는 통에 늘 마음을 졸여야 했다”며 “강남 재건축 아파트 투자는 이쯤에서 접겠다”고 말했다.》 안전하고 수익률 높은 투자처로 꼽히는 서울 강남 3구 재건축 아파트는 올해 들어 가격이 반등하면서 ‘대표 부동산’의 자존심을 지켰다. 하지만 최근 몇 년간의 가격추이를 보면 하락기에는 다른 지역보다 가격이 훨씬 많이 떨어져 변동성이 매우 큰 것으로 나타났다. 이런 현상에 대해 전문가들 사이에서는 강남 3구 재건축 아파트가 주식처럼 변동성이 큰 금융상품을 닮아가고 있다는 분석이 나오고 있다. ○ 강남 3구 재건축 아파트 급등락 반복 부동산114가 부동산가격이 고점을 찍었던 2007년 1월 이후 수도권 주요 지역의 아파트 값 등락을 분석한 자료에 따르면 강남 3구 재건축 아파트는 이 기간에 가장 큰 폭으로 급락과 급등을 반복했다. 지난해 하반기 값이 추락했던 강남 3구 재건축 아파트는 지난해 12월 12일 바닥을 찍은 뒤 지난달 26일까지 평균 15.5% 뛰었다. 올 1월 9일 저점을 통과했던 강남 3구의 일반 아파트가 지난달 26일까지 평균 3.5% 오른 것에 비해 상승폭이 단연 돋보였다. 강북 3구 노원 도봉 강북구 아파트 평균 상승률 1.0% 및 서울 아파트 평균 상승률 2.3% 과 비교해도 상승세가 독보적이었다. 하지만 강남 3구 재건축 아파트는 2007년 1월 5일 고점을 찍은 뒤 지난해 12월 12일까지는 19.4%나 급락했다. 강남 3구 일반 아파트가 고점부터 바닥까지 11.8% 내렸고 강북 3구 아파트가 5.5% 내린 것과 비교하면 추락에 가까웠다. 일례로 2007년 1월 8억500만 원이었던 강남구 개포주공4단지 43m²는 지난해 12월 6억2500만 원까지 떨어져 집값 하락폭이 1억8000만 원 22.4% 에 이르기도 했다. 강남 3구 재건축 아파트는 부동산 대세 상승기였던 2003∼2006년에도 하락폭과 상승폭이 다른 지역보다 컸다. 노무현 정부에서 부동산 규제가 본격화되기 시작한 2003년 11월 강남 3구 재건축은 3.6% 하락해 강남 3구 일반 아파트 ―0.7% 와 경기 과천시 ―2.0% 용인시 ―0.04% 보다 하락폭이 컸다. 집값이 뛰었던 2005년 4월에는 강남 3구 재건축 아파트 상승률 7.1% 이 강남 3구 일반 아파트 3.8% 와 과천시 6.4% 등 수도권 주요 지역을 앞질렀다. ○ 실질가치 따져 장기투자 바람직 재건축 아파트는 본래 특징인 ‘비 非 거주성’ 때문에 다른 아파트보다 투자수요가 많이 몰리고 이에 따라 변동성도 클 수밖에 없다고 전문가들은 분석하고 있다. 집주인들이 낡은 재건축 아파트를 전세나 월세로 주고 다른 곳에 살기 때문에 거주 목적이 강한 일반 아파트보다 투자 상품의 성격이 짙다는 것. 스피드뱅크 박원갑 부사장은 “대기수요가 풍부한 강남 3구 재건축 아파트는 주식처럼 사고팔기가 쉬워 통상 부동산의 한계로 지적되는 환금성이 매우 뛰어나고 과거 수익률도 좋았다”며 “전국에서 수요가 몰리는 대표적인 투자상품이 돼 버렸기 때문에 이제는 준 準 금융상품이 됐다고 봐야 한다”고 말했다. 그러나 투자 수요가 많은 점은 역으로 외부 충격에 약하다는 단점으로 돌변한다. 이는 강남 3구 재건축 아파트 값이 단기적으로 급락할 가능성이 늘 존재한다는 배경으로 작용한다. 김규정 부동산114 부장은 “정부 규제가 강남권 재건축 아파트 값에 많은 영향을 미쳤던 노무현 정부 때와 달리 글로벌 금융위기 이후에는 세계 경제 변수가 더 중요해졌다”며 “세계경기의 회복이 아직 불투명하기 때문에 강남 재건축 값이 다시 출렁거릴 수 있다”고 전망했다. 그는 “경제상황이 유동적인 만큼 강남 재건축 아파트가 장기적으로 주택시장을 선도할 수 있을지를 포함해 실질적인 미래가치를 꼼꼼히 따져야 한다”며 “무엇보다 실제 거주 목적으로 접근해야 안전하다”고 조언했다.,https://news.naver.com/main/read.nhn?mode=LSD&mid=shm&sid1=260&oid=020&aid=0002059978,183
144678,2009.07.06. 오전 3:06,부동산,동아일보,전세 시황방학 앞두고 학군수요 많은 강남권 상승,동아일보 지난주 전세시장은 수도권 일부 지역을 제외하곤 전세금이 내린 곳이 많지 않았다. 방학이 다가오면서 강남권 등 주요 학군 주변의 전세 매물이 빠르게 줄고 있다. 부동산정보업체 부동산114에 따르면 지난주 서울의 아파트 전세금은 0.11% 올랐다. 지하철 9호선 개통이 다가오면서 강서구는 0.26% 상승했다. 학군 전세 수요가 많은 송파 0.25% 강남 0.21% 서초 0.18% 강동구 0.18% 의 상승폭도 컸다. 신도시는 0.04% 상승했다. 중동 0.08% 분당 0.04% 등이 올랐지만 하반기 대단지 입주를 앞두고 있는 1기 신도시가 많아 전세 수요자라면 대단지 인근의 전세 매물을 찾아보는 것도 방법이다. 인천 경기 등 수도권은 0.05% 올랐다. 남양주 0.25% 용인 0.19% 고양시 0.03% 등의 순이었다.,https://news.naver.com/main/read.nhn?mode=LSD&mid=shm&sid1=260&oid=020&aid=0002059974,183
144679,2009.07.06. 오전 3:06,부동산,동아일보,닥터봉의 돈되는 부동산‘길’ 따라가면 투자의 길이 보인다,동아일보 《이번 주부터 매주 월요일자에 부동산 컨설팅업체인 닥스플랜 봉준호 대표가 ‘닥터봉’이라는 필명으로 독자 여러분을 찾아갑니다. 봉 대표는 전국 부동산 현장을 속속들이 알고 있는 부동산 컨설팅 및 개발 전문가입니다. 그의 글이 독자 여러분의 부동산 투자 길잡이가 되길 기대합니다.》 7월은 ‘청포도의 계절’이다. 올해 7월에는 부동산도 풍성하게 익어간다. 경의선 복선전철 용인∼서울 고속도로 이상 1일 개통 서울∼춘천 고속도로 15일 개통 예정 서울 지하철 9호선 이달 말 개통 예정 등 이른바 ‘빅4’가 개통되기 때문이다. 교통망 개통 효과는 부동산 경기가 좋을 때는 개통 6개월 전에 경기가 나쁠 때는 이용자들이 그 효과를 충분히 느끼는 시점에 나타난다. 2003년 9월 분당선 연장선이 개통되자 분양가의 2배 수준이던 경기 성남시 분당신도시의 집값은 6개월 전인 3월부터 상승 랠리를 시작했다. 입주를 시작한 지 14년 만인 2006년 이곳 집값은 분양가의 10배로 뛰었다. 물론 이렇게 많이 오른 것은 성숙기에 접어든 서울 중구 명동 강남구 테헤란로와 달리 신생기 부동산이었기에 가능했다. 경의선 복선전철 개통으로 경기 파주시 금촌동 고양시 일산서구 탄현동 일산동구 풍동 덕양구 행신동 등이 혜택을 받게 됐다. 행신역은 고속철도 KTX 종착역이기도 해 지방 도시로의 연결도 가능하다. 지하철 9호선 개통으로 김포공항과 서울 강서 지역에서 쉽게 강남으로 올 수 있고 영등포구 여의도동 동작구 노량진동 흑석동도 덕을 보게 됐다. 또 공항 이용객들과 강남 교보사거리 일대의 출퇴근 인원 강남역 상권 이용자들이 섞이면서 사회적 지리적 가치가 향상될 것으로 전망된다. 용인∼서울 고속도로는 경기 용인시 서부권과 흥덕지구 화성시 동탄신도시 등의 7만여 채에 혜택을 준다. 특히 25분이면 강남으로 올 수 있는 용인시 수지구의 상현동과 성복동 아파트가 대표적 수혜자다. 종전에 90분 걸리던 출퇴근 시간이 국도 23호선 확장과 용인∼서울 고속도로의 개통으로 30분 내로 들어오게 된 것이다. 경춘고속도로는 서울과 춘천을 40분대에 연결해 경기 남양주시를 비롯해 가평군 청평면 강원 춘천시 강촌리 등 추억의 데이트 코스에 호재가 된다. 물론 경춘고속도로가 개통된다고 해서 도로 주변의 모든 부동산이 오를 것 같지는 않다. 일단 아파트는 해당이 안 될 것으로 보인다. 경춘고속도로는 민자고속도로여서 서울∼춘천편도 통행료가 6000원이 넘을 것으로 알려져 있다. 출퇴근하기에는 비용 부담이 너무 크다. 대신 땅은 호재가 될 수 있다. 땅은 사놓고 1년에 한두 번 정도 찾기 때문이다. 일주일에 한 번 정도 방문하는 주말농장도 각광받을 수 있다. 올해부터 토지분 종합부동산세의 과세기준이 공시지가 기준으로 3억 원에서 5억 원으로 완화되고 부재지주의 양도소득세율이 60%에서 6∼35%로 내려간 것도 호재다. 게다가 강원 일대가 토지거래허가구역에서 대폭 풀리면서 경춘고속도로 인근은 땅 투자의 유망 지역이 될 것으로 전망된다. 올해 9월 착공하는 제2영동고속도로에 대한 기대도 매우 크다. 현재 제1영동고속도로는 너무 막혀서 제 기능을 못하는 실정이기 때문이다. 투자를 한다면 제2영동고속도로나 경춘고속도로 주변의 땅이 유망해 보인다. 그중에서도 나들목으로 나와서 차로 15분 이내에 갈 수 있는 땅이 수혜지가 될 듯하다.,https://news.naver.com/main/read.nhn?mode=LSD&mid=shm&sid1=260&oid=020&aid=0002059973,183
144680,2009.07.06. 오전 3:06,부동산,동아일보,住소식 地소식서울 신당동 ‘신당e편한세상’ 219채 外,동아일보 서울 신당동 ‘신당e 편한세상’ 219채 대림산업은 서울 중구 신당동에서 ‘신당 e 편한세상’의 일반분양분 219채를 분양한다. 총 895채로 지하 2층∼지상 15층 전용면적 59∼147m². 단지 바로 앞에 지하철 5 6호선 환승역인 청구역이 있고 2 6호선 환승역인 신당역도 걸어서 10분 정도라고. 분양가는 3.3m²당 1800만 원 선. 8일부터 1순위 청약. 2011년 12월 입주 예정. 02 757 9700 경기 남양주 진접지구 ‘신안인스빌’ 잔여분 신안은 경기 남양주시 진접지구에서 ‘신안인스빌’ 아파트 2340채의 잔여분을 분양 중이다. 112m² 단일 평형으로 지하 2층∼지상 20층. 국도 47호선 8차로 확장 지하철 4호선 당고개∼진접 연장계획 등 교통이 개선되고 특화된 평면 설계로 발코니를 확장하면 넓은 공간 마련이 가능하다고. 분양가는 3.3m²당 700만 원 선. 2010년 2월 입주 예정. 031 527 2002 서울 회현동 ‘남산 롯데캐슬 아이리스’ 386채 롯데건설은 서울 중구 회현동에서 주상복합아파트 ‘남산 롯데캐슬 아이리스’ 386채를 분양하고 있다. 남산3호터널 북단에 있고 지하 7층∼지상 32층 2개 동 142∼314m². 분양가는 3.3m²당 2000만 원 선. 남산이나 서울의 야경을 볼 수 있고 을지로 남대문 명동 일대 편의시설 이용이 쉽다고. 2011년 10월 입주 예정. 02 785 0606 인천 송도국제도시 근린상가 ‘에몬스프라자’ 에몬스가구는 인천 연수구 송도동 송도국제도시에서 근린상가 ‘에몬스프라자’를 분양 중이다. 연면적 9400m²로 지하 2층∼지상 5층. 대형마트 은행 전문식당가 학원 등이 들어설 예정이라고. 지상 1층 분양가는 3.3m²당 2200만∼2900만 원 2층 이상은 3.3m²당 450만∼1100만 원. 8월 입점 예정. 032 858 4955 서울 가산동 아파트형 공장 ‘엘리시아’ CJ건설은 서울 금천구 가산동에서 아파트형 공장 ‘엘리시아’를 분양하고 있다. 연면적 2만1994m²로 지하 3층∼지상 15층. 지상 1층에는 하역장 지상 3층에는 옥상과 하늘공원이 조성된다. 분양가는 3.3m²당 630만 원 선. 지하철 1 7호선 가산디지털단지역이 가깝고 입주기업은 취득 등록세 면제 분양가 70% 이내 잔금 대출 혜택이 있다고. 02 853 0900 인천 서구 ‘신현 e 편한세상 하늘채’ 대림산업과 코오롱건설은 인천 서구에서 ‘신현 e 편한세상 하늘채’ 아파트 3331채의 잔여분을 분양 중이다. 전용면적 59∼170m²로 이뤄져 있고 59m²는 분양이 마감됐다. 계약금 1500만 원 정액제 중도금 40% 무이자 혜택이 있다. 84m² 잔여 40채에 대해서는 입주 후 1200만 원을 지원하는 혜택도 준다.,https://news.naver.com/main/read.nhn?mode=LSD&mid=shm&sid1=260&oid=020&aid=0002059972,183
144681,2009.07.06. 오전 3:06,부동산,동아일보,동탄2신도시 주거 디자인 공모,동아일보 국토해양부와 한국토지공사는 경기 화성시 동탄2신도시의 디자인 아이디어를 대학생과 대학원생들을 대상으로 공모한다고 5일 밝혔다. 공모 주제는 ‘신주거문화타운 내 생태한옥단지’ ‘신도시 인근 체육시설과 연계한 주민 휴식공간 구상’ 중 하나를 선택하면 된다. 국토부 측은 도시건축과 경관을 종합적으로 고려해 디자인하면 된다고 설명했다. 전용 홈페이지 www.dongtan2.kr 에서 13∼26일 참가 등록을 받고 8월 31일까지 작품을 접수한다. 1등 수상자에게 1000만 원의 장학금을 주는 등 11개 작품에 총 3400만 원의 장학금을 수여한다. 또 우수작품은 동탄2신도시 개발 및 실시 계획에 반영된다.,https://news.naver.com/main/read.nhn?mode=LSD&mid=shm&sid1=260&oid=020&aid=0002059971,183
144682,2009.07.06. 오전 3:06,부동산,동아일보,위례신도시 분양권 사기 주의보,동아일보 서울 송파구와 경기 성남시 하남시 일대에 조성되는 위례신도시의 특별분양권을 싸게 판다는 사기광고가 기승을 부리고 있어 위례신도시 사업자인 한국토지공사가 수요자들에게 주의해 달라고 당부하고 나섰다. 5일 토지공사에 따르면 인터넷이나 전화로 위례신도시의 아파트 또는 생활대책용지를 싼값에 판다는 광고가 계속되고 있다. 이는 토지공사 측이 택지지구 내 원주민에게는 택지 또는 주택을 영업 영농 축산을 하는 사람에게는 20∼27m² 크기의 생활대책용지를 특별공급할 계획이라는 점에 착안한 것이다. 하지만 토지공사는 아직 특별공급 대상을 결정하지도 않은 상태라고 밝혔다. 대상이 결정된 뒤에도 특별분양권 매매가 등기 없이 이뤄진다는 점을 감안하면 2중 3중 계약이 가능해 피해가 우려된다. 토지공사 관계자는 “현재 지상물건 보상을 위한 기본조사를 진행하고는 있지만 특별분양권을 받을 대상자는 2010년 이후에 심사를 통해 확정된다”고 강조했다.,https://news.naver.com/main/read.nhn?mode=LSD&mid=shm&sid1=260&oid=020&aid=0002059970,183
