,date,cat,co,headline,text,url,week
25077,2006.09.21. 오후 4:38,부동산,매일경제,파리 센강ㆍ포츠담광장등 도시개발 전문가 방한,프랑스 파리 센강 연안 재개발 독일 베를린 포츠담광장 재개발 일본 나오시마 문화마을 조성 등을 주도한 도시개발 전문가들이 대거 서울을 찾는다. 프랑스 건축가인 질레 드 몽 마린 독일 도시마케팅 전문가인 젠스 임모르더 일본 요코하마 무사시 공대 교수인 가즈오 이와무라 씨 등이 그들이다. 이들 해외전문가는 오는 26 27일 이틀간 서울 코엑스에서 한국토지공사 주최로 열리는 2006 친인간ㆍ친환경ㆍ친문화 도시개발 국제심포지엄 에 연사로 초청돼 자신들이 수행한 프로젝트를 발표한다. 이번 심포지엄은 무료로 열리기 때문에 누구나 선착순으로 참석할 수 있다. 인터넷 사이트 www.klcexpo.com 를 통해서 사전 등록도 할 수 있다.,https://news.naver.com/main/read.nhn?mode=LSD&mid=shm&sid1=260&oid=009&aid=0000532632,37
25078,2006.09.21. 오후 4:38,부동산,매일경제,아파트 브랜드 바꿔 바꿔,아파트 브랜드에 리모델링 바람이 거세다. 브랜드를 론칭한 지 5 6년이 지났거나 이미지 변신을 추구하는 건설업체를 중심으로 아파트 브랜드나 로고를 바꾸는 곳이 급증하고 있다. 건설사마다 앞다퉈 자체 아파트 브랜드를 내놨던 90년대 말 2000년대 초가 1기 브랜드 시대 였다면 지금은 기존 이미지에 대수술을 단행하는 2기 브랜드 시대 로 접어든 셈이다. 쌍용건설과 주택공사가 최근 아파트 브랜드를 부분 또는 전면 교체한 데 이어 현대건설과 SK건설도 곧 새 브랜드를 내놓을 예정이다. 태영은 32년 동안 사용하고 있는 회사명을 연내에 바꾸기로 했다. 토목업체라는 기존 이미지에서 벗어나 종합건설업체 로 재도약하겠다는 뜻이다. 이를 계기로 주택 건축부문을 대폭 강화하는 등 사업구조를 전면 개편할 계획이다. 그러나 아파트 브랜드 데시앙 은 가급적 살리겠다는 방침이다. 쌍용건설은 이달 초 분양한 부산 장전동 아파트부터 쌍용 예가 藝家 라는 브랜드를 사용하고 있다. 기존 쌍용 스윗닷홈 예가 에서 스윗닷홈 을 아예 뺐다. 또한 새 브랜드를 론칭하는 방안도 추진하고 있다. 주공은 지난 7월 말 기존 뜨란채 대신 휴먼시아 라는 새 브랜드를 개발했다. 앞으로 주공이 공영개발할 판교 파주운정 송파 오산세교 등 신도시나 택지개발지구에는 도시 이름 앞에 모두 새 브랜드를 붙일 계획이다. 판교신도시에 주공이 자체적으로 짓는 아파트는 판교 휴먼시아 민간업체 대림산업이 짓는 단지는 판교 휴먼시아 e 편한세상 식으로 이름을 붙이게 된다. 아파트에 홈타운 주상복합에 하이페리온 브랜드를 사용하고 있는 현대건설은 오는 25일 새 브랜드 선포식을 한다. 아파트명가 재건이라는 목표를 내걸고 다음달부터 대대적인 광고를 통해 새 브랜드 알리기에 나서겠다는 방침이다. SK건설도 내년 초까지 기존 SK뷰 View 를 대신할 새 아파트 브랜드를 내놓을 예정이다. 회사 관계자는 최근 입주자들에게 주말농장용 텃밭을 제공하는 등 단순한 주거공간을 넘어 토털 리빙서비스 를 제공한다는 전략 이라며 새 브랜드도 이런 이미지에 걸맞게 만들 계획 이라고 밝혔다. 이에 앞서 우림건설은 루미아트 에서 필유 로 남광토건은 마이루트 에서 하우스토리 로 일신건설은 님 林 에서 에일린의 뜰 로 아파트 브랜드를 각각 교체했다. 브랜드는 놔두고 로고만 새로 교체한 곳도 있다. 롯데건설은 3월부터 롯데캐슬 로고에 귀족이나 가문을 상징하는 방패 문양을 새로 넣었다. 한화건설 꿈에 그린 과 코오롱건설 하늘채 도 올 들어 로고를 새롭게 고쳤다.,https://news.naver.com/main/read.nhn?mode=LSD&mid=shm&sid1=260&oid=009&aid=0000532630,37
25079,2006.09.21. 오후 4:36,부동산,서울경제,토공 초등학생 대상 국토정보 경시대회,한국토지공사는 22일부터 우리 국토에 대한 올바른 이해를 심어주고 국토사랑의식을 함양시키 위해 전국 초등학생을 대상으로 국토정보경시대회를 개최한다. 올해로 네 번째를 맞는 국토정보경시대회는 22일부터 28일까지 7일간 예선전을 치르며 예선을 거쳐 선발된 초등학생 및 가족 1명을 원칙으로 구성된 150팀은 다음달 20일 토지공사 본사 운동장에서 ‘브레인서바이벌’과 ‘도전골든벨’ 방식으로 최후의 승자를 가린다. 초등학교 교과서를 참고해 국토 전반에 관한 문제가 출제될 이번 경시대회에서 대상 1명 최우수상 2명 우수상 3명 장려상 30명에게 상장과 상금이 수여된다. 대상을 받은 학생의 소속학교와 예선 및 본선에 많은 학생이 참여한 학교는 발전기금으로 100만원을 받게 된다. 또 참여 이벤트로 온라인 국토사랑 글 선발대회를 열어 어린이들이 국토탐방기 및 봉사활동에 대한 글을 올리면 추천 점수가 많은 순으로 디지털카메라ㆍMP3 등 총 60만원 상당의 경품을 지급할 예정이다.,https://news.naver.com/main/read.nhn?mode=LSD&mid=shm&sid1=260&oid=011&aid=0000150193,37
25080,2006.09.21. 오후 4:36,부동산,서울경제,응암동 1만2000평 재건축 탄력,도계위 정비구역 지정 서울 은평구 응암동 620 1번지 일대 1만2 000평이 주택재건축 정비구역으로 지정됨에 따라 재건축 사업이 탄력을 받을 전망이다. 서울시는 20일 16ㆍ17차 도시계획위원회를 열고 응암초등학교 북쪽 응암동 620 1번지 일대 4만2 600㎡ 1만2 900평 를 주택재건축 정비구역으로 지정했다고 21일 발표했다. 공동위는 제2종 7층 일반주거지역인 이 구역 전체의 용도지역을 제2종 12층 일반주거지역으로 상향 조정했다. 이에 따라 이 구역은 재건축시 평균 14층 이하 용적률 210% 이하 임대주택 제외 까지 아파트를 지을 수 있다. 공동위는 그러나 종로구 세종로동 178번지 일대 ‘세종로구역 제2지구 도시환경정비 도심재개발 구역 1만5 600㎡ 에 대한 용적률ㆍ층고 계획 건축계획 등을 확정하는 안건은 보류시켰다. 한편 도시위는 서초구 양재동 231 1번지 일대 현대자동차 사옥 옆 완충녹지의 위치를 조정하는 내용의 안건을 통과시켰다. 이는 현대차가 사옥 증축공사를 하면서 차량의 원활한 진입을 위해 추가로 만든 차선이 기존의 녹지를 일부 잠식한 데 따른 것이다. 위원회는 녹지의 일부를 차선으로 내주는 대신 같은 면적의 현대차 사옥 부지를 완충녹지로 편입시켰다. 위원회는 또 노원구 하계중학교 공릉중학교 태릉초등학교 등 3곳이 교육공간 확충을 위해 건물 증축이 가능하도록 용도지역을 자연녹지지역에서 제1종 일반주거지역으로 변경하는 내용의 안건도 통과시켰다. 위원회는 그러나 미아동 42 8번지 일대 미아 균형발전촉진지구 강북2구역 2만㎡ 중 5 000㎡의 용도지역을 준주거지역에서 상업지역으로 상향 조정하는 안건은 보류시켰다. 시 관계자는 “인접한 강북3구역과의 교통연계성 등 도로 구조의 타당성을 재검토하고 용도지역 상향에 따른 공공기여 방안을 보완하기 위한 조치”라고 설명했다.,https://news.naver.com/main/read.nhn?mode=LSD&mid=shm&sid1=260&oid=011&aid=0000150192,37
25081,2006.09.21. 오후 4:36,부동산,서울경제,이 단지 어때요 신대방동 동작상떼빌,편의시설·조망권 뛰어난 주상복합 아파트 545가구…보라매공원·대형병원·E마트등 가까워 32평 최고 4억7 000만원·전세 2억5 000만원 거래 활발 지하철2호선 구로디지털단지 역에서 내려 시흥대로를 따라 올라가다 보면 왼편으로 우뚝 솟아있는 주상복합이 보인다. 성원건설이 동작구 신대방동 719번지에 시공해 지난 8월부터 입주가 시작된 동작상떼빌이다. 동작상떼빌은 시흥대로 전면에 위치한 오피스 2동 105 106동 과 그 뒤로 이어지는 아파트 4동 101 104동 으로 구성돼 있다. 아파트는 총 545가구로 평형별로 32평형 196가구 49평형 163가구 51평형 186가구 등이 있다. 지하철이 지상으로 다니는 신대방역과 구로디지털단지역 사이에 위치해 있지만 지하철역에 바짝 붙어있는 아파트들과 달리 소음이나 분진 영향을 걱정하진 않아도 될 만한 거리에 있다. 또한 대로변에 위치하고 주변이 단독ㆍ다세대 가구로 둘러싸여 조망권이 확보되는 데다 북쪽으로 이어지는 경남 우성 현대 아파트 등과 함께 대규모 주거벨트를 이루고 있어 주거여건이 양호한 편이다. 인근 편의시설로는 구로디지털단지 역 인근 이마트를 이용할 수 있으며 보라매공원도 가깝다. 병원은 대림성모병원 강남성심병원 등이 있고 학교는 문창초등학교 등이 있다. 입주가 진행되면서 최근에는 매매와 전세계약이 활발하게 맺어지는 중이다. 매매 호가는 32평형이 4억5 000만 4억7 000만원 49평형은 6억4 000만 6억8 000만원 51평형은 6억7 000만 7억1 000만원 수준이다. 최근 전세물량이 귀해지면서 전셋값도 32평형이 2억3 000만 2억5 000만원 49평형이 3억7 000만원 선에 계약되고 있다. 다만 저층 가구는 다닥다닥 붙은 주변 상가건물에 조망을 완전히 가리기 때문에 거래 전 이 점을 반드시 확인할 필요가 있다. 지상3층까지 있는 상가 임대는 22평이 보증금 3 000만원에 월 100만원 23평이 2 000만원에 110만원 40평이 4 000만원에 200만원을 부른다. 하지만 최근 재정비 시범지구로 지정된 신길뉴타운의 후광효과를 보긴 거리가 약간 떨어져 있다는 것이 중개업소들의 전언. 신대방동 H공인 관계자는 “실수요자 입장에서 편리한 교통과 편의시설 보라매공원 등이 이 지역 아파트를 고르는 주요 원인이지 뉴타운 호재를 보고 들어오는 투자수요는 거의 없다”고 전했다.,https://news.naver.com/main/read.nhn?mode=LSD&mid=shm&sid1=260&oid=011&aid=0000150186,37
25082,2006.09.21. 오후 4:32,부동산,매일경제,이수 동빙고 군인아파트 수주,이수건설은 최근 국방부가 BTL 임대형 민자사업 방식으로 발주한 서울 용산구 동빙고동 군인아파트 공사를 수주했다고 21일 밝혔다. 이번 사업은 이수건설과 신성건설 신원종합개발이 컨소시엄을 구성해 따낸 것이다. 이수건설 등은 앞으로 총 사업비 1000억원을 투입해 지하 2층 지상 23층 12개동 규모 아파트 810가구를 짓게 된다. 건축 평형은 28평형 110가구 32평형 628가구 38평형 44가구 40평형 28가구 등이다. 내년 9월 착공에 들어가 2010년 상반기 완공될 예정이다.,https://news.naver.com/main/read.nhn?mode=LSD&mid=shm&sid1=260&oid=009&aid=0000532628,37
25083,2006.09.21. 오후 4:32,부동산,매일경제,쌍용건설 연내 조기 매각,쌍용건설 매각 작업이 연내 추진될 전망이다. 쌍용건설 매각을 추진하고 있는 자산관리공사 캠코 는 다음달 말 대우건설 인수ㆍ합병 M A 이 마무리되면 바로 쌍용건설 매각 작업에 착수할 방침이라고 21일 밝혔다. 캠코 관계자는 현대건설 매각 진행과 관계없이 대우건설 매각이 마무리되는 대로 이르면 11월 늦어도 12월에 매각 방향이 잡힐 것 이라고 밝혔다. 채권단은 현대건설 매각 이후 쌍용건설 매각 작업을 추진한다는 방침이었다. 그러나 현대건설 인수희망자가 현대가 家 그룹으로 압축됨에 따라 비슷한 시기에 매각을 진행해도 원매자가 겹치지 않는다고 판단해 조기매각을 결정했다. 쌍용건설은 2004년 10월 워크아웃을 졸업했으며 캠코가 최대주주로 38.75% 지분을 갖고 있다. 또 우리사주조합이 지분 18.93%를 보유한 2대주주지만 우선매수청구권 채권단 지분 최대 24.7% 을 행사하면 최대주주로 올라설 수 있다. 우리사주조합은 우선매수청구권을 행사해 경영권을 인수하겠다는 의지를 이미 여러 차례 밝혔다. 우리사주조합 관계자는 회사 미래가치를 볼 때 우리사주조합이 인수하는 것이 가장 바람직하다 며 금융기관 차입 등을 통해 지분 인수에 필요한 2000억원 이상 자금을 마련할 계획 이라고 밝혔다. 현재 쌍용건설 인수 후보로는 우리사주조합 외에 대주건설 등 4 5개 업체가 거론되고 있다. 쌍용건설 관계자는 우리사주조합이 반대하거나 우선매수권을 행사하겠다고 나오면 가격을 아무리 높게 제시해도 인수하기가 사실상 어렵다 며 사주조합은 가격보다 쌍용건설을건실하게 키울 수 있는 인수자를 지지할 것 이라고 밝혔다. 캠코 관계자는 우선 우리사주조합과 협의를 통해 매각작업을 진행할 것 이라며 매각공고 이전에 우선매수청구권 행사 여부에 대한 협의가 이뤄질 것 이라고 밝혔다. 한편 전현식 한화증권 애널리스트는 쌍용건설이 현대건설에 앞서 M A가 진행될 가능성이 높은 것은 예상 매각가격이 현대건설보다 매우 낮기 때문 이라며 예상 매각가격은 3000억원 내외로 추정된다 고 밝혔다.,https://news.naver.com/main/read.nhn?mode=LSD&mid=shm&sid1=260&oid=009&aid=0000532627,37
25084,2006.09.21. 오후 4:32,부동산,매일경제,호주 부동산 투자 세미나,경제포털인 매경인터넷 www.mk.co.kr 매경교육센터는 오는 27일 서울 강남교보타워에서 호주 부동산 투자 세미나를 개최한다. 이번 세미나는 호주 부동산 평가 전문회사인 펄스프라퍼티와 대형 법률회사인 헌트 헌트 모기지 전문금융기관인 비전랜딩 등 현지 업체에서 활동하는 부동산 전문가를 초청해 호주 부동산 취득이나 투자에 필요한 금융 법률 가치평가 사례분석 등 실제적인 정보를 제공할 예정이다. 또 실제 투자를 원하면 취득 후 2년 동안 임대수익과 환매가 보장되는 물건을 중심으로 현지 전문가가 추천한 매물정보를 제공하고 투자상담과 현지시찰도 진행한다.,https://news.naver.com/main/read.nhn?mode=LSD&mid=shm&sid1=260&oid=009&aid=0000532626,37
25085,2006.09.21. 오후 4:32,부동산,매일경제,아산 신도시도심 연결망 구축 시동,충남 아산시가 고속철도 천안아산역 주변인 아산신도시 와 현재 도심을 잇는 도로망 신설을 추진하고 수도권 전철 아산시 통과 구간 신설역 설치에 적극 나서는 등 신도시와 현재 도심의 상생 발전 에 속도를 내고 있다. 아산시는 시청사가 있는 현재 도심지역과 고속철도 천안아산역 주변에 건설중인 아산신도시를 연결하는 길이 2.2㎞ 폭 30 36ｍ 도로를 건설하기로 하고 아산신도시 건설시행사인 주택공사측과 협의중이라고 21일 밝혔다. 시는 현재 도심지역인 북부외곽도로에서 곡교천을 따라 아산신도시까지 4 6차선으로 건설한다는 계획 아래 올해 말까지 관련 도시관리계획을 확정하기로 하는 등 행정절차를 서두르고 있으며 신도시 1단계 완공시기인 2008년까지 도로 건설을 마무리지을 계획이다. 아울러 시는 2008년 연장 개통 예정인 수도권전철 천안 아산 신창역 구간에 이미 설치가 확정된 △배방 △온양온천역 △신창역 외에 가칭 탕정역과 풍기역 신설을 추진하기로 했다. 시는 수도권전철의 아산지역 연장 공사가 마무리되는 2008년까지 탕정역과 풍기역을 신설하는 것이 바람직하다는 판단 아래 지난해 이후 6차례 건설교통부 기반시설본부 한국철도시설공단 등과 2개역 신설을 협의한 바 있다. 시 관계자는 고속철도 천안아산역과 온양온천역 사이에 2개역을 추가 설치할 경우 균형발전에 도움을 줄 것 이라며 추가역 설치에 대한 용역 결과 2006년 6월 에서도 경제성이 있는 것으로 나왔다 고 밝혔다.,https://news.naver.com/main/read.nhn?mode=LSD&mid=shm&sid1=260&oid=009&aid=0000532625,37
25086,2006.09.21. 오후 4:32,부동산,매일경제,롯데캐슬 색채대상 수상,롯데건설은 아파트 브랜드인 롯데캐슬이 사단법인 한국색채학회가 주관하는 2006 한국색채대상 을 수상했다고 21일 밝혔다. 롯데캐슬아파트는 강한 개성이 느껴지는 버건디 붉은 포도주색 색채와 캐슬골드로 불리는 노랑과 빨강을 혼합한 온화한 색상으로 주목받았다. 롯데건설 관계자는 롯데캐슬은 친환경ㆍ명품ㆍ친인간을 지향하는 한 차원 높은 고품격 생활문화공간 을 추구한다 고 말했다.,https://news.naver.com/main/read.nhn?mode=LSD&mid=shm&sid1=260&oid=009&aid=0000532624,37
25087,2006.09.21. 오후 4:32,부동산,매일경제,응암동 1만2900평 재건축구역 지정,서울 은평구 응암동 백련산 인근 620 1 일대가 대규모 주거단지로 개발될 예정이다. 서울시는 지난 20일 제16차 도시ㆍ건축공동위원회를 열고 응암초등학교 북쪽 응암동 620 1 일대 1만2900평을 주택 재건축 정비구역으로 지정했다고 21일 밝혔다. 공동위는 이 구역 용도지역을 기존 제2종 7층 일반주거지에서 제2종 12층 일반주거지로 상향 조정했다. 이에 따라 용적률 210%를 적용해 평균 14층 이하 아파트를 지을 수 있다. 평형별로 전용면적 18평 이하 228가구 18 25.7평 317가구 25.7평 초과 117가구 임대 100가구 등 총 762가구가 들어설 예정이다. 구역 내에 650평 규모 어린이공원이 조성되며 배후 응암 7 9구역 재개발이 완료되면 대규모 주거단지를 형성하게 된다. 공동위는 하지만 종로구 세종로동 178 일대 세종로 2지구 도심 재개발구역 4700평에 대한 용적률과 층고 계획을 확정하려던 안건은 보류했다. 같은 날 서울시는 제17차 도시계획위원회를 열고 서초구 양재동 231 1 일대 현대자동차 사옥 옆 완충녹지 위치를 조정하는 안건을 통과시켰다. 현대차가 사옥 증축 공사를 하면서 확보한 차선이 기존 완충녹지 일부를 잠식한 데 따른 조치다. 이에 따라 완충녹지 일부를 차선으로 내주면서 같은 면적의 현대차 사옥 용지를 완충녹지로 편입시켰다. 이 밖에 위원회는 노원구 하계중 공릉중 태릉초교 등 3곳 용도지역을 자연녹지지역에서 제1종 일반주거지역으로 변경하는 안건도 통과시켰다. 하지만 미아동 42 8 일대 미아 균형발전촉진지구 강북 2구역 중 용도지역 1500평을 준주거지역에서 상업지역으로 상향 조정하는 안건은 보류했다. 위원회 관계자는 주변과 교통 연계성을 재검토하고 용적률 상향에 따른 공공용지 기여 방안을 보완하라는 의미로 심의를 보류했다 고 밝혔다.,https://news.naver.com/main/read.nhn?mode=LSD&mid=shm&sid1=260&oid=009&aid=0000532623,37
25088,2006.09.21. 오후 4:27,부동산,서울경제,분양정보 울산 문수산 굿모닝힐 472가구,동문건설이 10월 울산대 옆 문수산 자락에 위치한 ‘울산 무거ㆍ굴화 문수산 동문굿모닝힐’ 아파트를 공급한다. ‘문수산 동문굿모닝힐’은 울산광역시 울주군 범서읍 굴화리 149번지와 남구 무거동 산 15 3번지 일원에 지상 16 28층 6개동에 총 472가구 규모로 들어서며 49평형 228가구 54평형 142가구 59평형 102가구 등 중대형 평형으로 구성이 된다. 입주예정시기는 오는 2009년 12월이며 분양가는 평당 950만원 정도로 예상된다. 아파트부지가 문수산 자락에 자리잡아 주거선호지역인 도심에 위치하면서도 맑은 공기와 쾌적한 환경을 자랑한다. 단지 내부에서도 지상에 주차장을 없애고 생태공원을 조성해 지상을 공원화한 아파트이다. 아파트 부지 옆으로 울산대 울산상고 무거초교 등이 붙어 있다. 울산 언양간 고속도로와 24번 국도가 인접해 경부고속도로 접근이 편리하며 7번 국도를 타고 울산공항 경주 양산 부산 등으로 이동하는데 용이하다. 부산 울산간 고속국도와 경전철도 개통될 예정이다. 홈플러스 문수병원 강서병원 문수경기장 문수자동차극장 등 각종 편의시설도 인근에 위치해 있다.,https://news.naver.com/main/read.nhn?mode=LSD&mid=shm&sid1=260&oid=011&aid=0000150171,37
25089,2006.09.21. 오후 4:27,부동산,서울경제,이수건설 BTL사업 진출,동빙고 군인아파트 수주 이수건설이 임대형 민자사업 BTLㆍBuild Transfer Lease 진출을 선언하고 나섰다. 이수건설은 최근 국방부에서 발주한 서울 용산구 동빙고동 군인아파트 공사를 BTL 방식으로 수주했다고 21일 밝혔다. 이 공사는 국방부가 추진하는 BTL 방식 군인아파트 공사로는 최대규모로 이수는 1 000억원을 투입해 동빙고동 7 2 일대에 오는 2009년말까지 23층짜리 12개동 규모의 아파트810가구를 건립할 계획이다. 아파트는 평형별로 ▦28평형 110가구 ▦32평형 628가구 ▦38평형 44가구 ▦40평형 28가구 등이다. 이번 프로젝트에는 이수를 주간사로 신성건설ㆍ신원종합개발등이 컨소시엄 형태로 참여하고 있다. 이수건설측은 “이번 수주를 계기로 주택에 편중된 사업구조에서 벗어나 BTL 등으로 사업영역을 다각화할 방침”이라고 설명했다.,https://news.naver.com/main/read.nhn?mode=LSD&mid=shm&sid1=260&oid=011&aid=0000150168,37
25090,2006.09.21. 오후 4:27,부동산,서울경제,청약제 개선안 연말께 확정,금명간 분양단지 대상 시뮬레이션 실시 오는 2008년부터 시행되는 주택청약제도 개선방안이 금명간 분양하는 단지를 대상으로 시뮬레이션을 거친 뒤 오는 연말께 확정 발표된다. 개선안은 당초 이달말 확정될 예정이었으나 가점제의 검증이 필요하다는 지적에 따라 발표를 늦춘 것이다. 건설교통부 관계자는 21일 “가점제를 골자로 한 새 주택청약제도가 현실에 어떻게 반영되는지 보기 위해 현재 입주자 모집공고를 하고 있는 단지를 대상으로 시뮬레이션을 실시한 뒤 확정하기로 했다”고 밝혔다. 그러나 이관계자는 “이 작업은 당초 발표했던 내용을 보완하거나 크게 수정하기 위한 것이 아니다”며 “다만 추첨제가 가점제로 바뀌면 현실에 어떻게 반영되는지 알아보는 차원”이라고 말했다. 시뮬레이션 용역은 새 청약제도를 만들었던 주택산업연구원이 맡아 연말까지 보고서를 내기로 했으며 건교부는 이를 바탕으로 세부 검토를 거쳐 개선안을 확정할 방침이다. 한편 주택산업연구원은 지난 7월 25일 공청회를 통해 가구주 연령 부양가족수 무주택기간 청약통장 가입기간 등 4개 가점 항목을 토대로 13 35의 가중치를 둬 535점 만점을 기준으로 주택 당첨기회를 차등화하는 청약제도 개편방안을 발표했다. 바뀌는 청약제도는 2008년 공공택지내 25.7평 이하 분양주택에 우선 적용되며 2010년부터는 가점 항목에 가구소득 부동산 자산 등이 추가돼 민간 주택에까지 확대된다.,https://news.naver.com/main/read.nhn?mode=LSD&mid=shm&sid1=260&oid=011&aid=0000150167,37
