,date,cat,co,headline,text,url,week
104744,2008.09.30. 오전 10:50,부동산,연합뉴스,그린벨트 해제 전문가들 땅값 자극할 수도,서울 연합뉴스 서미숙 기자 정부가 개발제한구역 그린벨트 를 풀어 주택 산업단지 등의 용도로 사용하기로 한 것에 대해 전문가들의 의견은 다소 엇갈린다. 녹지로서의 보전가치가 없는 곳의 개발 제한을 풀고 국토의 효율성을 높이겠다는 취지는 원칙적으로 찬성하면서도 개발 방식이나 무분별한 해제에 따른 부작용 등을 우려하는 목소리가 높다. 최근 경제위기로 당장 그린벨트 해제에 따른 땅값 집값 급등 가능성은 작지만 향후 부동산 시장을 자극하는 불쏘시개 가 될 가능성도 있다는 것이다. ◇ 그린벨트 해제 신중해야 전문가들은 훼손된 그린벨트를 풀어 가용 택지를 확보하겠다는 점에 대해서는 대체로 찬성하는 모습이다. 땅값이 큰 폭으로 올라 집을 지을 곳이 마땅치 않은 수도권 도심 인근이나 부산 울산처럼 가용토지가 부족해 지역 현안사업이 중단된 곳에서는 지역 경제 발전을 위해 그린벨트 해제 압력이 큰 상황이다. 하지만 정부의 지나치게 빠르고 공격적인 행보에서 자칫 그린벨트가 무분별하게 훼손하는 것이 아니냐는 우려의 목소리도 나오고 있다. 건국대 부동산학과 조주현 교수는 수요가 있다면 더이상 보존가치가 없는 그린벨트는 풀어줄 수 있겠지만 정부가 개발의 필요성과 수요 총량 등을 면밀한 검토하지 않고 해제를 서두르는 감이 있다 며 그린벨트 해제 후 그만한 녹지를 다른 곳에 확보하는 등 상승하는 사회적 비용을 지불할 준비가 돼 있는지도 의문 이라고 말했다. 중앙대 도시지역계획과 허재완 교수는 택지 확보를 위해 그린벨트 해제는 필요하지만 그에 앞서 녹지보전 대책과 함께 층고제한 등 규제 완화에서 오는 개발이익 환수장치 마련이 반드시 선행돼야 한다 며 기존 녹지 훼손 방지대책이나 보상을 노린 비닐하우스 건립 등을 막는 등 엄격한 관리방안이 마련돼야 해제의 부작용을 줄일 수 있다 고 말했다. 그린벨트를 해제해 서민형 주거단지를 짓는 것에 대해서도 이견이 있다. 연세대 도시공학과 김갑성 교수는 그린벨트는 어차피 대중교통 여건이 좋지 않아 서민들이 출퇴근하기 불편하고 지하철 등 교통시설을 확충에 엄청난 비용을 부담해야 한다 며 차라리 그린벨트 해제지역에는 고밀도 개발보다는 저층의 고급 단독주택을 지어 본래의 친환경성을 살리는 반면 그 개발 이익은 도심 역세권을 고밀개발해 직주근접 형 서민주택을 공급하는 게 바람직하다 고 말했다. 반면 중앙대 허재완 교수는 어렵게 지켜온 땅을 친환경을 이유로 고소득층을 위한 고가주택 건립에 사용한다면 그린벨트를 풀어야 하는 국민적 공감대를 얻지 못할 것 이라며 그린벨트를 해제에 대한 당위성을 얻으려면 서민 주거 안정에 이바지해야 한다 고 말했다. 건설산업전략연구소 김선덕 소장은 경제여건이 좋지 않고 미분양이 많은 상황에서 그린벨트까지 풀어 주택을 추가 공급하는 게 바람직한 지도 재고해봐야 한다 고 말했다. ◇ 장기적으로 땅값 상승 우려 정부가 땅값 폭등을 막고자 공람공고 시점에 해제 지역을 발표하고 보상 시점도 앞당긴다고 했지만 땅값 불안에 대한 우려는 여전하다. 삼성증권 신탁파트 김재언 팀장은 현재 경제여건이 좋지 않고 금리가 오르고 있어 그린벨트에 유입되는 자금은 한계가 있을 것 이라면서도 하지만 과천 의왕 등 유망 지역의 그린벨트가 풀린다면 자금력 있는 강남권 여유계층들의 자금이 유입돼 땅값을 자극할 수도 있다 고 말했다. 김선덕 소장은 그동안 재산권 행사를 못 했던 부분에 대한 주민들의 보상심리가 작용해 보상비가 늘어날 수밖에 없고 결국 땅값 상승이 불가피할 것 이라며 특히 서민주택단지 건설을 위해 인프라 시설 확충 등 주변 여건이 개선된다면 인근 부동산 가격도 동반 상승할 수 있다 고 말했다. 스피드뱅크 박원갑 소장은 그린벨트 해제로 토지의 가치가 높아지는 만큼 국지적인 땅값 상승은 있겠지만 시장 전방위로 확대될 가능성은 작다 며 당장 경제여건이 나빠 안정세가 유지되겠지만 내년 말 이후 보상비가 풀린다면 경제여건에 따라 인근 토지 집값 상승을 자극할 수도 있다 고 말했다. 이 때문에 보금자리 주택의 분양가를 상한제 가격보다 15% 정도 낮추겠다고 한 정부 공언도 불투명한 상황이다. 허재완 교수는 정부가 그린벨트 보상을 지구지정 전으로 앞당긴다 해도 이미 그린벨트 땅값이 크게 올라있고 보상가 상승 압박이 강해 정부가 광역교통시설 등 인프라 비용을 감당하지 않는 이상 상한제 아파트의 10% 이상 낮추기는 어려울 것 이라고 내다봤다. 전문가들은 그린벨트 투자에도 신중을 기해야 한다고 조언한다. 박원갑 소장은 그린벨트 해제지역은 토지거래허가구역으로 묶여 있고 존치지역은 관리가 더욱 강화되는 만큼 해제가 확정되지 않은 곳에 소문만 믿고 투자하는 것은 바람직하지 않다 고 말했다.,https://news.naver.com/main/read.nhn?mode=LSD&mid=shm&sid1=260&oid=001&aid=0002289812,143
104745,2008.09.30. 오전 10:48,부동산,파이낸셜뉴스,우림건설 성남우림라이온스밸리 3곳 동시분양,성남우림라이온스밸리 2차 조감도 우림건설은 경기 성남시 중원구 상대원동 성남산업단지에서 아파트공장인 ‘성남우림라이온스밸리 2 3 5차’를 1일부터 동시분양한다. 성남우림라이온스밸리 2차는 지하2∼지상20층 연면적 9만7812㎡규모로 지어지며 입주는 2010년 8월이다. 3차는 지하1∼지상14층 연면적 3만7455㎡규모로 2009년 7월 입주예정이며 5차는 지하3∼지상20층 연면적 9만9464㎡로 2010년 3월 입주한다. 분양가는 2 3차가 3.3㎡ 당 평균 430만원이며 5차는 3.3㎡당 평균 420만원대다. 계약금은 분양가의 10% 중도금은 40%이며 입주할때 잔금 50%를 내면 된다. 중소기업진흥공단과 경기도 성남시가 대출을 알선해 분양가의 70%까지 대출이 가능하며 중도금은 전액 무이자가 적용된다. 또 성남산업단지는 이미 벤처기업육성촉진지구로 지정돼 있어 이곳에 입주하는 기업은 등록세 및 취득세가 전액 면제되고 재산세와 종합토지세가 5년간 각각 50%씩 감면된다. 성남우림라이온스밸리는 170만㎡ 부지에 2000여개 중소기업 및 벤처기업이 입주해있는 성남산업단지에 위치해 수요가 풍부한데다 성남도촌지구 조성과 인근에 들어서는 행정타운과 접해있어 미래가치가 높은 편이라고 회사측은 설명했다. 또 지하철8호선 단대오거리역과 인접해 있고 3번 국도와 서울외곽순환도로 수서분당고속화도로 동부간선도로 등이 연결돼 교통환경이 탁월하다. 성남우림라이온스밸리는 저층부에 근린생활시설과 주차장 중층부에는 아파트형공장 고층부는 지원시설을 배치하는 수직적 공간 활용으로 최적의 비즈니스 환경을 연출한게 특징이다.,https://news.naver.com/main/read.nhn?mode=LSD&mid=shm&sid1=260&oid=014&aid=0002030141,143
104746,2008.09.30. 오전 10:46,부동산,헤럴드POP,빗장여는 그린벨트…“숙원 해결”vs “환경훼손”논란,정부가 이번에 해제하기로 한 308㎢가 풀리면 그린벨트는 3632㎢만 남게 된다. 이는 애초 설정됐던 그린벨트의 67.5%이다. 정부는 총 308㎢의 그린벨트를 해제 산업단지를 만들어 고용창출과 지역경제를 살리는 한편 수도권에서는 서민용주택을 건설해 수도권 주택난에 대응하겠다는 계획이다. 실제로 해제예정인 물량중 80㎢는 서민주택용지로 활용돼 40만 가구가 들어서 고 나머지는 대부분 첨단산업단지나 연구시설용지 등으로 활용될 것으로 전망되고 있다. 그린벨트가 추가로 해제되면 지방자치단체가 중 점을 두고 있지만 그 동안 용지가 부족해 정체상태였던 사업이 활기를 찾을 전망이다. 특히 가용지가 거의 없어 산업단지 조성 등이 곤란하다며 그린벨트 해제를 끊임 없이 요구해 온 부산 울산 등은 다른 지역보다 속도가 붙을 것으로 보인다. 부산의 경우 부산신항 배후의 첨단국제산업물류단지를 조성하기 위해서는 강서 지역의 그린벨트 해제가 필요했고 울산도 환동해권 원천소재산업 복합클러스터 바 이오 리파이너리 산업단지 태양광 모듈화 산업단지 저탄소 녹색성장과 산업간 융 복합에 필요한 연구벨트 구축사업 등이 답보상태였다. 긍정적인 효과가 기대되는 이면에는 부작용에 대한 우려도 강하게 나오고 있다. 우선 환경 훼손에 대한 반발이 거세게 일면서 소모적인 국력 낭비로 이어질 수 있다. 국토부는 환경평가결과 3 5등급으로 보존가치가 낮은 지역과 표고 70ｍ이하인지 역 20만㎡이상인 지역 등을 위주로 해제하겠다는 ‘기준’을 제시하고 존치지역에 대 해서는 관리를 철저히 해 나가겠다는 방침을 밝혔지만 환경단체의 반발을 무마하기 에는 역부족이다. 이미 정부의 그린벨트 해제 움직임이 보도된 것만으로도 환경단체와 시민단체 등은 해제계획 철회를 요구하고 나섰으며 이번에 정부 방침의 확정 발표로 반발의 수위가 높아질 전망이다. 또 그린벨트 해제 기대감이 반영되면서 그린벨트와 인근지역의 부동산가격이 불 안해질 가능성을 배제할 수 없다. 특히 지금까지 ‘성역’으로 통했던 그린벨트의 해 제 방침은 정부의 규제 완화 의지를 보여주는 것으로 수도권 시장 전체의 불안으로 이어질 가능성도 배제할 수는 없다. 보상을 많이 받기 위해 그린벨트에 비닐하우스 등 불법건축물이 속속 들어서는 사태도 불보듯 뻔하다. 실제 그린벨트 해제지는 내년 10월이 돼야 결정되지만 해제 여부에 상관없이 전국의 그린벨트가 몸살을 앓을 가능성이 높다. 국토부도 이 같은 점을 우려해 해제예정지는 주민공람때에야 처음으로 공개하고 토지거래허강화 무허가건축물 및 불법용도변경 축사 철거 부동산투기대책반 운영 등을 계획하고 있지만 얼마나 실효성을 거둘 지는 미지수이다. 정부가 일방적으로 그린벨트 해제 방침을 밝힌 것도 논란거리다. 1998년 처음으 로 그린벨트 해제가 검토됐을 때에는 주민대표 환경단체 대표 언론인 학계 전문 가 등으로 구성된 협의회가 방안을 마련한 뒤 외국의 전문가단체에도 시안을 보내 의뢰하는 등 절차를 거쳤지만 이번에는 정부가 일방적으로 주도하고 있다.,https://news.naver.com/main/read.nhn?mode=LSD&mid=shm&sid1=260&oid=112&aid=0001955589,143
104747,2008.09.30. 오전 10:40,부동산,헤럴드POP,그린벨트 여의도 36배 2020년까지 ‘무장해제’,오는 2020년까지 최대 308㎢에 달하는 개발제한구역 그린벨트 이 대거 해제된다. 이는 여의도 면적 8.48㎢ 의 36배에 달하는 크기로 해제된 지역에는 보금자리주택 등 아파트와 산업단지 물류단지 등이 들어서게 된다. 그린벨트 해제지역에 공동주택을 건설할 때에는 기존의 획일적인 건축물 층고제한 최고 7층 이 폐지돼 지자체가 주변 여건에 따라 자율적으로 개발할 수 있으며 지역여건에 따라 임대주택건설의무 비율 현행 50% 을 하향 조정하는 방안이 검토되고 있다. 정부는 30일 국무회의에서 이 같은 내용을 담은 ‘개발제한구역 조정 및 관리계획’을 심의 의결했다. 지역경제 활성화를 통한 고용창출 및 서민 주거복지 확대를 위해 그린벨트 일부를 추가 해제하되 그린벨트로 계속 존치되는 지역에 대해서는 한층 관리를 강화하기로 하기로 했다. 이번에 해제되는 지역은 기존 해제계획에 따라 해제하기로 한 면적 중 아직까지 활용하지 못한 잔여면적 120㎢ 수도권 26㎢ 지방 94㎢ 과 서민주택건설 예정 부지 80㎢ 국정과제 추진지역 부산강서 6㎢ 기존 그린벨트 해제예정 면적 342㎢ 의 10 30%에 달하는 34 102㎢ 등을 합산한 수치다. 하지만 지가관리 실패지역 도시문제 유발 지역 등은 빠지게 돼 실제 해제되는 면적은 최대치인 308㎢에 크게 못 미칠 것이라고 국토해양부는 설명했다. 국토부는 이르면 내년 4월부터 순차적으로 개발ㆍ해제계획 안 을 주민공람한 후 10월 경 토지보상 절차를 마쳐 11월부터 토지보상 등 사업에 착수할 수 있다고 설명했다. 해제가능 규모는 내년 상반기에 광역도시계획이 변경ㆍ승인되면 확정되며 구체적인 대상지는 내년 말께 확정될 예정이다. 그린벨트 해제 기준은 환경평가 결과 3 5등급지로 환경적 보전가치가 낮은 지역이 대상이 된다. 난개발 방지를 위해 20만㎡ 이상 지역을 설정하고 우량농지의 경우 농림부와 협의된 경우에는 포함할 수 있다. 또 기존 시가지와 공단 항만 등에 인접하고 간선도로 철도 등 주요 기반시설이 구비되고 대규모 기반시설 설치소요가 적은 지역도 대상이 될 수 있다. 그린벨트는 1971년 도입돼 도시의 무분별한 확산방지와 환경보전 등에 크게 기여했으나 일부 부작용도 발생했다. 1970년대 5397㎢가 지정돼 올 9월 말까지 총 1457㎢가 해제됐으며 현재 총 3940㎢ 수도권 1458㎢ 지방 2482㎢ 가 지정돼있다.,https://news.naver.com/main/read.nhn?mode=LSD&mid=shm&sid1=260&oid=112&aid=0001955563,143
104748,2008.09.30. 오전 10:38,부동산,아시아경제,그린벨트 최대 308㎢ 푼다..분당신도시 16배종합,2020년까지 분당신도시의 16배 여의도의 36배 크기인 최대 308.5㎢의 개발제한구역 그린벨트 이 전국에서 해제될 전망이다. 해제지역에서는 주택뿐 아니라 산업 및 물류단지가 조성된다. 구체적인 해제가능 규모는 내년 상반기 해제위치와 시기는 내년 2ㆍ4분기 이후에나 확정될 전망이다.,https://news.naver.com/main/read.nhn?mode=LSD&mid=shm&sid1=260&oid=277&aid=0002036073,143
104749,2008.09.30. 오전 10:30,부동산,머니투데이,현대엔지니어링 제주서 신입사원 수련대회 가져,머니투데이 문성일 기자 현대엔지니어링 사장 김중겸 은 지난 24일부터 26일까지 사흘간 제주도에서 신입사원 수련회를 실시했다고 30일 밝혔다. 신입사원 114명과 김중겸 사장을 비롯해 각 사업본부 본부장 노사협의회 대표 등을 포함한 임직원 160여명이 참석한 이번 행사에서는 체육대회와 한라산 등반 현대인의 밤 행사 등을 통해 도전정신과 공동체 의식을 다졌다. 이 회사 김중겸 사장은 미래의 주역이 될 신입사원들이 이번 수련회를 통해 현대정신을 배우는 기회가 됐길 바란다 며 이번에 보여준 자신감과 패기로 앞으로 현대엔지니어링의 주인공이 되길 기대한다 고 말했다.,https://news.naver.com/main/read.nhn?mode=LSD&mid=shm&sid1=260&oid=008&aid=0002039797,143
104750,2008.09.30. 오전 10:29,부동산,뉴시스,행복도시 축산 보상 비리 ③일부 간부도 불법 가세…당국은 쉬쉬,행복도시 축산 보상비리 ③일부 간부 불법 가세.. 당국은 쉬쉬 연기 뉴시스 한반도 심장부에 명품도시를 만든다며 행정중심복합도시의 대표를 자임했던 모 단체 전직 간부들도 자신들의 주머니를 채우기에 급급했던 것으로 뒤늦게 밝혀지고 있다. 모 단체 간부였던 A씨는 자신의 지위를 이용 가족들의 이름으로 수천만원의 부당이득을 챙긴 것으로 드러났다. 2005년 5월 연기군에서 조사한 축산폐업에 대한 기초 자료에는 A씨가 사슴을 20마리 사육한다고 신고했다. 그러나 실제는 3 4마리 정도 키웠다는 주민들의 진술과 함께 문제가 불거지자 2005년 11월 조사에서는 사슴을 사육하고 있다는 신고를 하지 않고 A씨의 모친인 B씨 이름으로 26마리를 신고해 2007년 확정보상시 6800여만원을 보상받은 것으로 알려졌다. 또한 한국토지공사가 모 국회의원에게 국감자료로 제출한 축산폐업 확정자료에 따르면 A씨는 소 7마리에 대한 보상 1900여만원 계약준비 라고 표시돼 있었으나 문제가 되자 실제 보상에서 제외된 것으로 알려졌다. A씨의 동생인 C씨 또한 2005년 5월 연기군 사업소에서 조사한 기초자료에는 사슴 20마리를 신고했으나 11월 조사에서 27마리로 증가한 뒤 확정보상에서 사슴 27마리로 6300여만원을 보상받았다. 보상받기 전 실사 단계에서 가축수를 맞추기 위해 A씨 축사로 사슴을 실어 나르는 장면을 목격했다는 주민들도 여러 명 나타났다. 또한 간부였던 D씨는 2005년 5월 기초 조사때 개 800마리와 닭 150마리를 신고했지만 2005년 11월 조사에는 개 1500마리 닭 1000마리 오리 500마리로 늘려 신고했다. 2007년 확정자료에는 개 1500마리 닭 1000마리 오리 500마리 외에 거위도 80마리를 신고해 2억6400만원을 보상받았다. 2005년 5월 초기조사에서는 800마리였던 개가 갑자기 6개월 만에 1500마리로 늘었고 기초자료에는 조사가 되지 않았던 오리가 500마리 신고됐는가 하면 확정자료에는 보이지도 않던 거위가 추가로 신고 되는 등 보상을 받기 위해 허위로 조작했다는 의혹이 받고 있다. E씨 또한 2005년 자료에는 개 530마리 닭 150마리 염소 70마리를 신고했지만 11월 조사 때에는 개가 825마리 염소가 79마리 닭 158마리를 신고해 2007년 1억7500만원을 보상받은 것으로 밝혀졌다. 주민들에 따르면 실제 거주하지 않고 있는 사람도 있어 현실적으로 많은 가축을 관리할 수 없었다 고 말했다. 연기군 남면 양화리 주민들은 하천부지에서 밭을 일궈 평생 먹고 사는 사람들이 제 값에 보상을 받을 수 있게 해 준다고 약속해 간부로 선출해줬는데 자신들의 실속만 챙기고 있다 며 불만을 토로했다. 이에 대해 모 간부는 실제 축사에서 가축을 기르고 있었다 며 대승적인 차원에서 축산농가를 보호해야 하지 않느냐 고 말했다. 시행사인 한국토지공사는 주민들과 원만한 협의로 보상이 이뤄졌다 며 철저하게 실사를 했지만 허위보상이 발견되면 환수조치할 예정이다 고 말했다. 행정중심복합도시에 대한 대대적인 보상은 2007년 초 거의 마무리 됐다. 2년이 다 돼가는 이제서야 불법보상에 대한 의혹이 조금씩 불거지기 시작한 까닭은 주민들이 그동안 불법 사실이 알려지기를 꺼린 부분도 있지만 실제는 고발자라는 낙인이 찍힐까봐 몸을 사렸기 때문이다. 보상을 받은 주민들 또한 허위로 보상받은 사람들이 많은데다 보상받은 사람들이 이웃사촌이거나 종친인 경우가 많아 말을 할 수가 없었던 것이다. 뉴시스가 몇가지 제보들을 바탕으로 취재에 들어가자 연기군 또한 문제에 휘말리지 않으려 자료 제출을 꺼리거나 당시 담당자들이 회피하는 등 떠넘기기로 일관하고 있다. 보상에 대한 불법 사실 외에도 잡음이 끊이질 않고 있다. 현재 모 주민 단체는 회사를 세워 행정중심복합도시 공사에서 파생되는 묘지이장이나 철거사업과 폐기물처리 조경 등 공사를 맡아오고 있다. 이런 가운데 직간접적으로 관여하고 있는 기관 직원들이 단체들과 친분을 쌓으며 업자를 소개해 주는 등 부조리가 발생하고 있다는 소문도 떠돌고 있다. 행복도시는 국민의 세금으로 보상을 해 준 국가사업이다. 철저한 검증 없이 눈먼 돈처럼 마구 뿌린 국민의 세금은 반드시 환수해야 한다. 최근 전국 각 지역에서 공공기관 지방이전과 혁신도시 건설 또한 수도권 지역의 신도시 건설 등과 관련해 보상작업이 진행되고 있다. 이 과정에서 발생할 수 있는 보상비리 특히 축산폐업 보상이 행복도시와 같은 전철을 밟지 않기 위해 수사기관의 적극적인 수사와 제도적 보완이 시급한 상황이다.,https://news.naver.com/main/read.nhn?mode=LSD&mid=shm&sid1=260&oid=003&aid=0002304173,143
104751,2008.09.30. 오전 10:29,부동산,뉴시스,행복도시 축산 보상 비리 ②허무맹랑한 수자 조작,행복도시 축산 보상비리 ②허무맹랑한 수자 조작 연기 뉴시스 연기군 남면과 금남면 동면에서 사육하던 가축을 2005년부터 2008년까지 연도별로 분석한 결과 황당한 수치가 도출됐다. 연기군 남면에서 토끼는 2005년 460여마리 사육되고 있다고 조사됐으나 2006년 사육하고 있다는 통계 없음 자료제공 연기군 산업과 2007년 3월 한국토지공사에서 확정된 보상은 갑자기 1450마리인 3배로 급증했다. 3개면 전체에서 사육하고 있던 토끼는 2005년 1725마리 2006년 1022마리였는데 2007년 3월 보상 확정된 토끼는 2316마리로 2배 이상이나 불어나 그대로 보상을 받았다. 한우 소 의 경우 남면은 2005년과 2006년 전체 사육두수가 4800여 마리였으나 보상을 받은 소는 모두 4657마리였다. 보상을 받고 나면 인근에서 축산업을 할 수 없기 때문에 남면에서는 남은 사육 한우 수가 200마리 안팎으로 줄어야 함에도 불구하고 2007년 조사에서는 2581두 2008년에는 2047두가 남아 있었다. 나머지 2400두는 어디에서 나왔는지 의혹이 제기되는 부분이다. 금남면의 경우에도 2005년 보상받기 전에는 1950두였던 소가 보상으로 1344마리를 받고 난 뒤 오히려 2000두를 넘게 사육하고 있는 것으로 밝혀졌다. 종합해 보면 동면과 남면 금남면 전체에서 사육하고 있는 한우가 2005년과 2006년 7000여두였으나 2007년 초 보상받은 소는 모두 6333마리로 700여두만 남아야 하는데 2007년 하반기에 5000두가 남아 의혹을 더하고 있다. 염소 또한 2년 동안 연기군이 농가에서 사육하고 있다고 조사했던 마리수보다 2배 가까이나 부풀려졌다. 공익사업을 위한 토지 등의 취득 및 보상에 관한 법률에 의거해 축산보상의 경우 개는 기준이 없어 유사 동물인 돼지에 준해 보상을 하도록 되어 있다. 개는 일반 가축과는 달리 축사가 필요하지 않아 허위로 신고하기에 유리해 개 또한 사육하고 있다는 마리수 2005년 1만7786 2006년 1만2161 보다 보상받은 마리수 1만9941 가 더 많은 것으로 밝혀졌다. 보상받고 난 뒤에도 3개면 전체 농가에 3000 5000여 마리가 남아 최소 7000여마리 이상이 부풀려진 것으로 의심이 가고 있다. 오리와 거위에 대한 보상은 더 심해 연기군에서 2005년 2006년 조사 때보다 2 3배나 많아 축산폐업 보상을 많이 받기 위한 ‘뻥튀기’였다는 지적이 설득력을 얻고 있다. 이 시기의 농가수를 조사한 결과 오리를 사육하고 있다는 농가는 12 15개소였으나 보상을 받은 농가는 27개소로 늘어났다.,https://news.naver.com/main/read.nhn?mode=LSD&mid=shm&sid1=260&oid=003&aid=0002304172,143
