,date,cat,co,headline,text,url,week
57603,2007.06.28. 오후 4:12,부동산,서울경제,제2롯데월드 유보발표후 잠실 집값은,1 2달 뒤면 승인 기대…호가 그대로 시장 분위기 냉랭…당분간 눈치보기 국면 예상 다음 행정조정協 결과따라 시장 요동칠 가능성 “제2롯데월드 허가 기대감으로 최근 잠실 아파트의 값이 뛰고 거래가 느는 분위기였는데 국무조정실의 조정이 연기됨으로써 분위기는 일단 냉랭한 상태로 돌아섰습니다. 하지만 매도자들도 1 2개월 뒤면 승인이 날 것으로 기대하며 호가는 낮추지 않고 있습니다.” 정부가 잠실 제2롯데월드 112층 의 건축허가에 대한 결론을 또 다시 유보한 다음날인 28일. 제2롯데월드 부지 건너편 잠실주공5단지 내 송파공인중개의 최명섭 대표는 “전날은 매도자들이 건축승인에 대한 기대감으로 호가를 올릴지 고민하다가 지금은 현재 호가대로 버티기에 나선 양상”이라며 “당분간은 약보합세 속에서 눈치보기 국면이 예상된다”고 전했다. 실제 주공5단지의 경우 총 4 000가구 중 10여건 이상의 매물에 변동이 없는 상황에서 34평형의 경우 12억5 000만원 안팎의 호가가 그대로 유지되고 있다. 5단지는 이달 초부터 가격이 뛰며 34평형이 12억5 000만원선에 거래돼 종합부동산세 회피매물이 나왔던 지난 5월 말 10억9 000만원 에 비해 1억5 000만원 이상 급등한 상태다. 이는 5단지가 2003년 재건축추진위 승인 뒤 예비안전진단 신청 결과 유지보수 판정을 받았지만 오는 2010년 제2롯데월드가 완공될 경우 배후 주거단지가 될 수 있고 단지 도로가쪽이 상업용지로 바뀌며 주상복합으로 탈바꿈할 수 있다는 루머가 번지고 있기 때문이다. 최 대표는 “5단지는 이달 들어 6건이 거래됐는데 지난주부터는 매수자들이 눈치를 보며 거래가 끊긴 상황”이라며 “국무조정실의 다음 행정조정협의회 결과에 따라 잠실을 비롯한 송파의 부동산시장이 요동칠 것”이라고 말했다. 인근지역의 장미ㆍ미성ㆍ진주 아파트 재건축추진위 승인 아직 못 받음 의 분위기도 5단지와 별로 다르지 않다. 3 600가구인 장미아파트의 경우 제2롯데월드 기대감으로 인해 최근 28평형과 33평형이 각각 7억원과 8억5 000만원에 거래되며 5월보다 5 000만원가량 오른 상태에서 눈치보기 장세가 펼쳐지고 있다. 최근에 입주가 완료된 잠실주공4단지 레이크팰리스 와 8월 말부터 입주하는 3단지 내년 8월부터 입주하는 1ㆍ2단지 쪽의 분위기도 마찬가지다. 김한식 한솔부동산 대표는 “4단지는 20 30건 매물이 있는데 5월에 34평형이 9억3 000만원까지 거래됐다가 급매물이 소화되면서 이달 들어 호가가 10억5 000만원까지 오른 상태에서 거래가 거의 없다”고 말했다. 전문가들은 앞으로 제2롯데월드의 건축승인이 날 경우 잠실은 물론 송파 지역 부동산 가격이 상승세를 보일 가능성도 있지만 9월 분양가상한제 실시 등의 시장 변화를 감안할 때 좀더 신중할 필요가 있다는 지적을 내놓고 있다. 박원갑 스피드뱅크 부동산연구소장은 “제2롯데월드의 재료가 선반영되면서 최근 잠실아파트 가격이 올랐다”며 “일반투자자 입장에서는 소위 ‘그들만의 리그’에 뒤늦게 뛰어들었다가는 낭패를 볼 수 있다”고 말했다.,https://news.naver.com/main/read.nhn?mode=LSD&mid=shm&sid1=260&oid=011&aid=0000188569,77
57604,2007.06.28. 오후 4:06,부동산,서울경제,인천 검단·파주 운정3 택지개발예정지구 지정,지난해 말 신도시 예정지로 발표됐던 인천 검단지구 339만9 798평 1 123만9 000㎡ 과 파주 운정3지구 209만5 720평 692만8 000㎡ 이 택지개발예정지구로 지정 고시됐다. 건설교통부는 28일 인천 검단과 파주 운정3지구의 택지지구 지정을 마쳤으며 두 지구 모두 오는 2009년 6월 분양에 들어간다고 밝혔다. 인천 검단지구에는 6만6 000가구가 들어서 17만7 000명을 수용하게 되며 개발계획은 내년 2월 실시계획은 2009년 2월 승인될 예정이다. 2009년 6월 주택공급 2011년 12월에 입주가 이뤄진다. 인천시와 인천시도시개발공사가 공동으로 사업시행을 맡는 검단신도시는 인천 김포 고양 서울을 연결하는 수도권 서북부지역 거점 도시 역할을 할 것으로 기대되며 행정ㆍ문화ㆍ교육 등 다기능 복합도시로 조성할 계획이다. 파주 운정3지구는 3만4 000가구 수용인구 9만3 000명 규모로 주택공급과 입주는 2009년 6월 2011년 12월로 각각 예정됐다. 파주 운정3지구가 추가됨에 따라 파주 운정신도시는 총면적 1 647만7 000㎡ 주택 수는 8만가구로 늘어나게 됐다.,https://news.naver.com/main/read.nhn?mode=LSD&mid=shm&sid1=260&oid=011&aid=0000188568,77
57605,2007.06.28. 오후 4:06,부동산,서울경제,분양정보 중흥 고양시 타운하우스 154가구,중흥종합건설은 오는 7월 초 경기 고양시 일산2지구와 행신2지구에서 연립형 타운하우스 ‘중흥 S클래스’ 154가구를 분양한다. 일산2지구 중흥S클래스 사진 는 지하2 지상4층 4개동 94가구로 51평형의 단일 평형으로 구성돼 있으며 행신2지구 타운하우스는 지하2층 지상4층 3개동으로 46평형 60가구다. 동간거리가 최대 80m로 프라이버시를 확보할 수 있도록 설계했으며 주차장을 모두 지하화해 지상을 공원으로 꾸민 것이 특징이다. 필로티 동을 제외한 나머지 1 3층 가구에는 다용도로 활용할 수 있는 지하 멀티룸 4층 가구에는 다락방이 각각 제공된다. 평당 분양가는 1 100만 일산2지구 1 200만원 행신2지구 선이며 옵션ㆍ확장비용을 포함해도 평당 1 400만원을 넘지 않을 전망이다. 총부채상환비율 DTI 적용을 받지 않는다. 모델하우스는 일산 백석역 인근에서 29일 문을 연다.,https://news.naver.com/main/read.nhn?mode=LSD&mid=shm&sid1=260&oid=011&aid=0000188567,77
57606,2007.06.28. 오후 4:06,부동산,서울경제,분양정보 대우건설 진주 초전 푸르지오 812가구,대우건설은 오는 7월2일부터 경남 진주시 초전동 초전도시개발사업구역 29블록에 건립하는 ‘초전 푸르지오’ 아파트 812가구를 분양한다. 28층 9개동인 초전 푸르지오는 평형별로 ▦33평형 240가구 ▦38평형 216가구 ▦45평형 148가구 ▦48평형 146가구 ▦58평형 164가구 등이다. 평당 분양가는 699만 775만원선. 초전도시개발사업은 초전동 일대 8만2 000여평의 부지를 아파트ㆍ초등학교ㆍ공원 등으로 개발하는 사업으로 주변에 동명고ㆍ명신고 등이 자리잡고 있다. 농수산물시장ㆍ하나로마트ㆍ홈플러스 등의 생활편의시설이 갖춰져 있으며 지구 내에 8 000여평 규모의 공원녹지가 조성될 예정이다.,https://news.naver.com/main/read.nhn?mode=LSD&mid=shm&sid1=260&oid=011&aid=0000188566,77
57607,2007.06.28. 오후 3:39,부동산,파이낸셜뉴스,민간건설 공급 지난해보다 10% 감소,올해 하반기 전국에서 대형 주택업체들이 분양하는 아파트는 19만3000가구로 지난해 하반기보다 10% 가량 물량이 감소하는 것으로 조사됐다. 대형주택건설업체들의 모임인 한국주택협회는 28일 회원사를 대상으로 하반기 분양물량을 파악한 결과 전체 회원사 78개사중 55개사에서 19만3903가구를 분양할 계획인 것으로 집계됐다고 밝혔다. 이는 지난해 하반기 21만4787가구 에 비해 9.7% 감소한 물량이다. 지역별로는 수도권이 9만1542가구로 전체 분양물량의 47.2% 지방이 10만2361가구로 52.8%를 각각 차지했다. 2000가구 이상 대규모 단지는 총 8개로 조사됐으며 주요 단지로는 △한화건설이 인천 남동구 소래논현지구에서 4226가구 △대우건설과 롯데건설이 충북 청주시 흥덕구 사직동에서 3559가구 △풍림산업이 대전 대덕구 석봉동에서 3861가구 △신동아건설이 경기도 고양시 덕이동에 3535가구를 공급한다. 이번 조사에서 78개 회원사중 하반기에 사업계획이 없거나 아직 사업계획을 수립하지 않아 자료를 제출하지 않은 23개 회원사는 제외됐다.,https://news.naver.com/main/read.nhn?mode=LSD&mid=shm&sid1=260&oid=014&aid=0000317598,77
57608,2007.06.28. 오후 3:33,부동산,파이낸셜뉴스,이윤재 씨 등 주공 간부 2명 복직,국회를 상대로 임대주택법 개정반대 로비활동을 벌인 책임을 물어 경질됐던 대한주택공사 간부 2명이 전격 복직됐다. 주택공사는 지난 2월13일 토지공사의 비축용 임대주택 건설 참여를 반대하며 국회에 입법에 반대 활동을 벌여 대기발령 조치됐던 이윤재 경영지원본부장과 김성균 기획조정실장을 원대 복직시켰다고 28일 밝혔다. 당시 토지공사의 비축용 임대주택 건설 진출을 놓고 주공이 격렬하게 반대하고 이에대해 건설교통부가 문책을 요구해 대기발령 조치되는 등 논란이 일었었다. 주공측은 “이번 인사는 이미 예정돼 있는 통상적인 인사였다”고 밝혔다. 하지만 대기발령 이후 박 사장은 몇개월 동안 복직인사를 실시하지 않다가 최근 비축용 장기임대주택 공급을 주 내용으로 하는 ‘임대주택법 개정안’의 국회 통과가 사실상 물건너 가는 등 복직환경이 조성됐다고 판단 이번에 실시한 것으로 분석된다. 박 사장은 또 취임 이후 비서실을 축소하는 등 과감한 행보를 보였으나 아직까지 구체적인 조직 개편안을 내놓고 있지 않다. 박 사장은 취임 초기 기자간담회에서 “기능별 직종별인 수평적 조직을 책임과 권한을 줘 수평적 본부제 형태로 개편해 나갈 계획”이라고 밝힌바 있다.,https://news.naver.com/main/read.nhn?mode=LSD&mid=shm&sid1=260&oid=014&aid=0000317592,77
57609,2007.06.28. 오후 3:09,부동산,머니투데이,투기과열 해제 제외…지역경제 발목 잡고 있다,머니투데이 최태영 기자 충청권 3개 시.도 투기과열지구 해제와 관련한 공동발표문 반발 투기과열지구 해제 대상지역에서 제외된 대전.충청지역 주민이 충격에 휩싸여 있다 정부가 27일 발표한 투기과열지구 해제지역에서 충청권이 제외되자 충청권 3개 시.도가 강력 반발하고 나섰다. 정부는 지난 27일 부산 대구 광주 등 대도시를 중심으로 투기과열지구를 첫 해제했다. 그러나 충청권은 행정도시 등의 투기 재연 가능성이 있다는 점이 고려돼 투기과열지구 해제에서 제외됐다. 대전시와 충남.북도 등 3개 시.도는 28일 투기과열지구 해제와 관련한 공동발표문을 내고 지역경기를 이끌어 가는 건설업은 이미 고사 직전에 왔는데 정부의 주택정책이 투기는 잡지 않고 왜 지역경제의 발목을 잡고 있는지 모르겠다 고 밝혔다. 3개 시도는 또 지역 주택경기는 이미 바닥을 치고 있으며 경제지수가 그 실상을 낱낱이 대변해 주고 있다 며 투기과열지구 해제 요건을 충분히 갖추고 있음에도 불구 해제 대상지역에서 제외된 이유를 납득할 수 없다 고 주장했다. 대전의 경우 지난달 말 현재 주택청약율은 평균 0.36대 1이며 주택가격 하락폭은 이미 전국 최고 수준인 데다 미분양주택마저 2200가구를 넘어선 것을 투기과열지구 해제의 근거로 들었다. 충남도 역시 평균 주택청약율은 0.75대 1 미분양주택은 1만694호로 최근 수년간 최고 수준을 보이며 건설경기가 바닥을 치고 있다는 점을 이유로 꼽았다. 박성효 대전시장은 행정중심복합도시가 이유가 되는지 모르겠다 면서 만약 행정도시 건설 사업이 주된 원인이라며 그로 인한 역차별과 받을 고통은 지역주민들에게 어떠한 말로도 표현할 수 없을 것 이라고 밝혔다. 이완구 충남지사도 정부는 투기 재연이 우려되면 투기를 잡으면 되지 애매한 지역경제를 잡는 우를 범하지 않기를 바란다 고 말했다. 3개 시.도는 이미 충청권 주택경기 동향은 투기과열지구 지정 기준에서 상당히 벗어나 있으며 서비스업 등에 영향을 미쳐 지역경제의 장기 침체로 이어지고 있다고 설명했다. 정우택 충북지사는 지역주민의 여망을 저버린 중앙정부의 정책결정에 대해 일일이 나열하지 않겠다 며 정부의 현명한 판단을 기대하며 해제를 강력히 재촉구한다 고 덧붙였다.,https://news.naver.com/main/read.nhn?mode=LSD&mid=shm&sid1=260&oid=008&aid=0000800576,77
57610,2007.06.28. 오후 3:02,부동산,문화일보,상도대림아파트 재건축,서울 동작구의 상도대림아파트가 주택재건축 정비구역으로 지정돼 재건축 사업이 탄력을 받게 됐다. 서울시는 27일 제14차 도시·건축공동위원회를 열고 동작구 상도동 36 1 일대 4만4223㎡ 1만3377평 규모의 상도1주택재건축 구역을 정비구역으로 지정했다고 28일 밝혔다. 이에 따라 이 구역에서는 조합을 설립하고 시공사를 선정할 수 있게 됐다. 공동위는 제2종 일반주거지역으로 묶여 있던 이 구역 전체의 용도지역을 3종 일반주거지역으로 상향 조정해 용적률과 층고 등을 완화해줬다. 이에 따라 이곳에는 용적률 206% 이하 층수 30층 86ｍ 이하의 범위에서 분양 아파트 610가구와 임대주택 99가구 등 709가구가 들어서게 된다. 평형별로는 24평형 145가구 임대 61가구 포함 33평형 303가구 임대 38가구 포함 45평형 136가구 54평형 83가구 65평형 42가구 등이다. 단지 안에는 또 녹지와 공공공지도 소규모로 조성된다. 공동위는 또 3만5051㎡ 1만603평 규모의 동대문구 청량리7주택재개발 구역도 정비구역으로 지정했다. 이에 따라 이곳엔 용적률 232% 이하 높이 75ｍ 평균 16층 이하 이하의 범위에서 12평 102가구 임대주택 18평 114가구 25.7평 282가구 35평 100가구 등 598가구가 건립된다. 공동위는 아울러 6만719㎡ 1만8367평 규모의 은평구 응암제10주택재개발 구역에 대해 2·3종 일반주거지역이 혼재해 있던 것을 모두 3종 주거지역으로 상향 조정해 통일하면서 정비구역으로 지정했다. 이에 따라 이 구역에는 용적률 243% 이하 높이 25층 80.5ｍ 이하 범위에서 아파트 1136가구가 들어서게 된다. 공동위는 이와 함께 성북구 보문 제4주택재개발 구역의 경우 차량 진출입로를 확보하고 녹지공간을 추가로 조성하도록 면적을 7000㎡ 줄여 3만1172㎡ 9430평 로 변경하면서 정비구역으로 지정했다. 이 구역에는 용적률 218％ 이하 지상 15층 이하 범위에서 아파트 446가구가 건립된다.,https://news.naver.com/main/read.nhn?mode=LSD&mid=shm&sid1=260&oid=021&aid=0000198053,77
57611,2007.06.28. 오후 3:02,부동산,문화일보,“취득·등록세 계산 쉽게 하세요”,“취득세와 등록세 거래 전에 인터넷에서 미리 확인하세요.” 서울 서초구 구청장 박성중 는 28일 전국 최초로 홈페이지를 통해 취·등록세 등 납부할 세금과 채권구입 금액까지 한눈에 파악할 수 있는 ‘취·등록세 및 채권구입금액 자동산출 서비스’를 오는 7월부터 제공한다고 밝혔다. 이에 따라 그동안 아파트 등 부동산 매매 시 소유권 이전 등기용 국민주택채권 매입액수 등 복잡한 계산 때문에 ‘나홀로 등기’를 포기하고 법무사 또는 중개인에게 맡기던 관행이 사라지게 될 것으로 전망된다. 특히 최근 산정기준을 시가 표준액이 아닌 실거래가로 계산해 높은 수수료를 챙기는 등 소유권 이전등기 업무 대행과정에서 국민주택채권 할인비용을 부풀리는 수법으로 폭리를 취하는 문제도 근절될 것으로 보인다. 서초구 홈페이지 hp www.seocho.go.kr 에 접속한 뒤 좌측 하단에 있는 ‘종합정보서비스’→‘취·등록세 자동산출 서비스’를 클릭하면 된다. 김윤 서초구 세무2과장은 “구청을 방문하거나 전화로 문의할 필요 없이 인터넷을 통해 클릭 한번으로 취득세와 등록세 그리고 채권구입금액을 확인할 수 있어 편할 뿐만 아니라 만만찮은 대행수수료 비용도 절약하는 일석이조의 효과가 있을 것으로 기대한다”고 말했다.,https://news.naver.com/main/read.nhn?mode=LSD&mid=shm&sid1=260&oid=021&aid=0000198052,77
57612,2007.06.28. 오후 2:56,부동산,이데일리,인사동양매직,이데일리 윤진섭기자 동양매직 023020 은 다음달 1일자로 이건주 동양매직 부장을 상무보로 승진 발령했다고 28일 밝혔다.,https://news.naver.com/main/read.nhn?mode=LSD&mid=shm&sid1=260&oid=018&aid=0000496184,77
57613,2007.06.28. 오후 2:45,부동산,경향신문,강남구 과천 제치고 ‘부자동네 1위’ 탈환,서울시 강남구가 가장 높은 아파트 평당가를 기록하며 최고 부자동네 자리를 되찾았다. 부동산정보업체 스피드뱅크’가 올 상반기 서울과 경기도 지역 아파트 평당 가격을 지난해 연말과 비교해 본 결과 강남구가 3500만원으로 가장 높은 것으로 나타났다. 이는 지난해 말 평당가 순위 1위를 기록한 과천시를 꺾은 것으로 강남구는 현재 과천시 평균 평당가 3473만원보다 27만원 높다. 서초구는 2788만원으로 강남구에 이어 두번째로 높은 평당가를 기록했으며 송파 용산 양천도 각각 2521만원 2406만원 2126만원으로 평당가 2000만원 대를 유지했다. 한편 버블세븐에 해당되는 강남 서초 송파 목동 분당 평촌 용인 등은 평당가가 일제히 내림세를 보였다. 양천구가 지난해 말 2198만원에서 현재 2126만원으로 평당 72만원 떨어졌고 강남구 69만원 3569만원→3500만원 강동구 50만원 2041만원→1991만원 서초구 28만원 2816만원→2788만원 송파구 26만원 2547만원→2521만원 으로 각각 하락했다. 재건축 밀집지역인 강남권과 강동구가 하락세를 보였고 재건축 물량이 상대적으로 적은 용산구는 평당가격이 상승했다. 과천시 역시 재건축 밀집지역이라 평당가가 지난해 3906만원에서 현재 3473만원으로 평당 433만원 내렸다. 강남권 신도시 후보지로 거론됐던 경기도 광주와 용인도 각각 한 계단씩 올라 평당가가 850만원 1235만원으로 조사됐다. 판교 후광효과 재건축 및 신도시 개발로 그 동안 크게 오른 의왕시 광명시 김포시 등은 순위가 하락했고 상반기 동안 별다른 호재가 없었던 안성은 5계단이나 내려가 경기지역에서도 평당가가 가장 낮은 곳으로 나타났다. 〈손봉석 온라인뉴스센터기자〉 대한민국 희망언론 경향신문 구독신청 hp smile.khan.co.kr ⓒ 경향신문 미디어칸 www.khan.co.kr 무단전재 및 재배포 금지 〈미디어칸은 한국온라인신문협회 www.kona.or.kr 의 디지털뉴스이용규칙에 따른 저작권을 행사합니다.,https://news.naver.com/main/read.nhn?mode=LSD&mid=shm&sid1=260&oid=032&aid=0000231788,77
57614,2007.06.28. 오후 2:45,부동산,경향신문,강남구 아파트 평당가격 과천 재치고 다시 1위 올라,서울시 강남구가 가장 높은 아파트 평당가를 기록하며 최고 부자동네 자리를 되찾았다. 부동산정보업체 스피드뱅크’가 올 상반기 서울과 경기도 지역 아파트 평당 가격을 지난해 연말과 비교해 본 결과 강남구가 3500만원으로 가장 높은 것으로 나타났다. 이는 지난해 말 평당가 순위 1위를 기록한 과천시를 꺾은 것으로 강남구는 현재 과천시 평균 평당가 3473만원보다 27만원 높다. 서초구는 2788만원으로 강남구에 이어 두번째로 높은 평당가를 기록했으며 송파 용산 양천도 각각 2521만원 2406만원 2126만원으로 평당가 2000만원 대를 유지했다. 한편 버블세븐에 해당되는 강남 서초 송파 목동 분당 평촌 용인 등은 평당가가 일제히 내림세를 보였다. 양천구가 지난해 말 2198만원에서 현재 2126만원으로 평당 72만원 떨어졌고 강남구 69만원 3569만원→3500만원 강동구 50만원 2041만원→1991만원 서초구 28만원 2816만원→2788만원 송파구 26만원 2547만원→2521만원 으로 각각 하락했다. 재건축 밀집지역인 강남권과 강동구가 하락세를 보였고 재건축 물량이 상대적으로 적은 용산구는 평당가격이 상승했다. 과천시 역시 재건축 밀집지역이라 평당가가 지난해 3906만원에서 현재 3473만원으로 평당 433만원 내렸다. 강남권 신도시 후보지로 거론됐던 경기도 광주와 용인도 각각 한 계단씩 올라 평당가가 850만원 1235만원으로 조사됐다. 판교 후광효과 재건축 및 신도시 개발로 그 동안 크게 오른 의왕시 광명시 김포시 등은 순위가 하락했고 상반기 동안 별다른 호재가 없었던 안성은 5계단이나 내려가 경기지역에서도 평당가가 가장 낮은 곳으로 나타났다. 〈손봉석 온라인뉴스센터기자〉 대한민국 희망언론 경향신문 구독신청 hp smile.khan.co.kr ⓒ 경향신문 미디어칸 www.khan.co.kr 무단전재 및 재배포 금지 〈미디어칸은 한국온라인신문협회 www.kona.or.kr 의 디지털뉴스이용규칙에 따른 저작권을 행사합니다.,https://news.naver.com/main/read.nhn?mode=LSD&mid=shm&sid1=260&oid=032&aid=0000231786,77
57615,2007.06.28. 오후 2:38,부동산,매일경제,발산3지구·신월동 장기전세 288가구 분양,u3000SH공사는 다음달 9일부터 발산 택지개발지구 3단지와 신월동 동도센트리움에서 장기 전세주택 시프트 288가구를 분양한다고 28일 밝혔다. u3000이번에 공급될 물량은 발산 3단지에서 전용면적 25.7평 281가구 동도센트리움에서 전용면적 20평 8가구 등이며 이 가운데 발산3단지의 28가구는 노부모 부양자에게 우선 공급된다. u3000또 발산 3단지의 나머지 253가구는 청약저축 가입자에게 일반 공급되고 재건축 매입 임대주택인 동도센트리움의 7가구는 무주택 기간과 양천구 거주 기간이 각각 1년 이상인 사람에게 분양된다. u3000전세 보증금은 발산 3단지 1억3033만원 동도센트리움은 9533만 원으로 주변 아파트 전세가격의 62∼80% 수준에 책정됐다. u3000입주 시기는 발산 3단지의 경우 10월 동도센트리움의 경우 9월로 예정돼 있다. u3000입주자 모집 공고일 현재 서울에 살면서 본인과 가구원 모두가 무주택자인 가구주에게만 신청 자격이 주어진다. u3000접수 일정은 우선 공급자 7월 9∼13일 1순위자 10∼13일 2.3순위자 16.18일이다. 신청은 주택공급 홈페이지 www.shift.or.kr 또는 SH공사를 방문해 접수하면 된다.,https://news.naver.com/main/read.nhn?mode=LSD&mid=shm&sid1=260&oid=009&aid=0000600075,77
