,date,cat,co,headline,text,url,week
20806,2006.08.08. 오전 10:38,부동산,헤럴드POP,개나리 래미안ㆍ푸르지오 33평형 웃돈 최고 5억원,서울 강남 청담ㆍ도곡 저밀도 13개 단지 재건축 사업이 막바지에 이르고 있다. 이미 2000여가구가 입주를 마친 가운데 8 9월 역삼동 개나리3차를 재건축한 개나리푸르지오 332가구 를 비롯해 개나리래미안 438가구 역삼아이파크 541가구 등 유망 재건축 단지들도 속속 입주를 시작한다. 개나리래미안ㆍ푸르지오 웃돈 최고 개나리래미안과 개나리푸르지오의 현 시세는 33평형이 10억 11억원 50평형이 16억 17억원 역삼아이파크는 10평형이 2억5000만원선 49평형이 17억원선으로 평당 3000만원을 훌쩍 넘어섰다. 비슷한 입지여건에 이미 입주가 마무리된 역삼래미안이나 대림e편한세상 보다 가격이 높다. 기 입주 아파트의 경우 20 30평형대 중소형으로 구성된 반면 이번에 입주가 시작되는 단지들은 새 아파트인데다가 중대형 평형이 포함돼 있어 같은 30평형대라도 매매가가 5000만원 가량 높다.웃돈은 역삼아이파크 10평형이 1억원 개나리래미안ㆍ개나리푸르지오 33평형이 4억 5억원 50평형이 6억5000만 7억원 가량이 붙었다. 현지 한 중개업자는 “3ㆍ30 대책 이후 거래가 거의 없어 호가 위주의 가격”이라며 “시장이 워낙 침체된 탓에 시장에 나온 매물도 많지 않고 매수 관련 문의도 뜸하다”고 말했다. 임대용 각광받는 10평대 강남권에서 처음으로 10평대 아파트 재건축으로 관심을 모았던 역삼아이파크 10평형의 경우 임대용으로 인기를 끌고 있다. 임대 수익을 노리고 분양을 받은 사람이 대부분이어서 총 178가구 중 절반 이상이 임대를 놓고 있다. 임대료는 보증금 3000만원에 월세 70만원 보증금 2000만원에 월세 80만 90만원 선이다. 비슷한 평형대의 인근 오피스텔의 임대료인 보증금 1000만원에 월세 70만원보다 비싸지만 아파트를 선호하는 독신자들의 수요로 물량은 2 3개 정도만 남아있다. 한티역일대 상권 주목 3000여가구에 달하는 고급 소비층이 형성됨에 따라 한티역을 중심으로 새롭게 상권이 형성되고 있다. 한티역 상권의 경우 월세가 지난해말 입주 전 월100만 250만원선이던 것이 최근 20 50%까지 상승했다. 권리금도 7000만 8000만원에서 갑절인 1억5000만원대에 이른다. 매매가도 평당 1억 1억5000만원에 달한다. 여기에 선릉역과 한티역에 이르는 대로변 근린상가 역시 가격이 상승세다. 평당 매매가는 7000만 8000만원선으로 지난해에 비해 20 30% 가량 올랐다. 상가 매물은 많지 않지만 공급에 비해 수요가 많아 거래가 잘 되는 편이다. “거래세 인하혜택 받게 해달라” 민원 봇물 오는 9월 거래세 인하를 앞두고 개나리푸르지오 주민들의 입주 시기 관련 문의가 빗발치고 있다. 잔금을 납부하고 입주를 해야 발코니 확장 공사에 들어갈 수 있는데 잔금 납부를 9월로 미루고 먼저 입주할 수 없느냐는 주민들의 문의가 대부분이다. 일단 입주 시기가 9월 중순까지여서 조합측은 큰 문제가 없다는 입장이다. 개나리래미안은 8월 30일부터 9월 말까지 역삼아이파크는 9월30일부터 입주 예정이다. 대우건설관계자는 “당장 이번달부터 입주를 시작해 거래세 관련 문의가 입주민들의 큰 관심사”라면서 “최대한 입주민들의 편의를 도모한다는 생각이지만 임의로 입주기간을 연기하는 등의 방법을 동원하는 것은 쉽지 않다”고 말했다.,https://news.naver.com/main/read.nhn?mode=LSD&mid=shm&sid1=260&oid=112&aid=0000045868,31
20807,2006.08.08. 오전 10:38,부동산,헤럴드POP,중소형 주거시설 임대료 급상승,중소형 주거시설 임대료가 급상승하고 있다. 새 아파트가 중대형평형 위주로 공급되면서 30평대 이하 새 아파트는 전세물건 찾기가 하늘에 별따기다. 자금부담이 덜해 신혼부부 등에 인기였던 오피스텔도 천정부지로 임대료가 치솟고 있다. 전문가들은 지금까지 중대형평형 위주로 시장이 움직이다보니 상대적으로 중소형평형 아파트와 오피스텔 공급이 부족했던게 원인이라면서 수급불균형부터 우선적으로 해결해야한다고 입을 모으고 있다. 강남권의 경우 새아파트 입주가 시작되면서 중소형평형을 중심으로 오히려 전세가격이 급등하는 기현상이 발생하고 있다. 새 아파트가 대부분 중대형평형 위주로 구성되다보니 30평형대이하 중소형 평형을 찾기 힘든게 이유. 실제 상반기에 입주를 마친 역삼동 푸르지오의 경우 33평형 전세가 두달 전만해도 3억7000만원 선이던게 현재 4억1000만원대까지 올라갔다. 이번달부터 역삼동일대에 개나리푸르지오와 래미안 역삼아이파크 등 1000여가구가 순차적으로 입주를 시작하지만 이들 단지가 대부분 중대형평형위주로 이뤄져 30평대가 귀한 상황이다. 도곡렉슬도 상황은 마찬가지. 역삼동일대 입주가 진행될수록 30평대이하 전세가격도 동반상승하고 있다. 도곡렉슬 33평형은 현재 3억8000만원대로 2 3달 전에 비해 5000만원 가량 올랐다. 도곡렉슬인근 신세계공인 김기준사장은 “가격은 둘째치고라도 중소형평형의 경우 전세를 찾지 못하고 있다”면서 “올해 입주한 새아파트의 경우 중소형평형 공급이 부족한데다 거래부진까지 겹쳐 물건이 귀하다”고 설명했다. 전반적인 공급부족으로 중소형오피스텔 임대료도 급등하는 추세다. 서울 지역 오피스텔 임대료는 지난 5월부터 꾸준히 오름세를 보이고 있다. 종로구 일대 직장인들이 선호하고 있는 종로구 내수동 ‘경희궁의 아침’은 지난해 보증금 1000만원에 60만원이던 월세가 최근 65만원으로 올랐다. 2004년 분양된 강남구 역삼동 두산위브센티움는 강남의 직장인 벤처사업가 등 수요로 17평형의 임대료가 지난해에 비해 5 7%정도 상승했다. 현재 임대가는 보증금 1000만원에 65만원 70만원선이다. 인근 한숲공인중개사 관계자는 “작년이나 제작년에 오피스텔에 입주한 입주자들이 움직이지 않아 나오는 임대 매물이 없다”고 설명했다.,https://news.naver.com/main/read.nhn?mode=LSD&mid=shm&sid1=260&oid=112&aid=0000045867,31
20808,2006.08.08. 오전 10:32,부동산,헤럴드POP,수도권 개발 불 붙는다…도시정비 기본계획 속속 승인,경기도 안산ㆍ부천ㆍ안산 인천 등지의 ‘2010년 도시 및 주거환경 정비 기본계획 안 ’이 이달 들어 속속 도시계획위원회를 통과 이들 지역 개발에 가속도가 붙을 전망이다. 지난 7일 열린 경기도 도시계획위원회 분과위에서 안산 도시정비기본계획 안 이 조건부로 통과됐다. 안산 도시정비기본계획 안 은 지난달 도계위 본 회의에서 분과위에 수권 위임돼 현지 조사를 마친 분과위원들이 이날 조건을 붙여 승인했다. 분과위 개최 결과 안산 도시정비기본계획 안 은 당초 시가 요구한 38개소 가운데 7개소가 제외됐다. 또 2종 일반주거지역인 14곳의 용적률은 230%로 조정됐다. 이번에 제척된 구역은 시가 추진 단계에서 ‘유보’구역으로 분류한 곳으로 원곡동3 선부동7 와동1 부곡동1ㆍ2 팔곡일동2 사사동2 등이다. 안산시는 총 146만7600㎡에 대한 도시정비기본계획 안 을 수립하면서 추진 단계별로 1단계 17곳 2단계 14곳 유보 7곳 등으로 정해 도 도시계획위원회의 승인을 요청했다. 안산시는 유보구역의 경우 정비구역 설정 요건 만족 시 2단계로 추진할 방침이었지만 이번 도계위에서 모두 제척됐다. 용적률 조정과 관련 안산시 관계자는 “2종 일반주거지역의 도 용적률 기준인 230%가 일괄 적용됐다”고 설명했다. 이에 앞서 지난 3일에는 부천 도시정비기본계획 안 이 분과위에서 승인됐다. 총 55곳 390만7060㎡의 도시정비기본계획 안 에 대해 분과위는 2종 일반주거지역 3종 일반주거지역의 용적률을 각각 230% 250% 적용 조건으로 통과시켰다. 원정동 고강동 오정동 등 항공법이 적용되는 지역은 ‘관련 법에 따른다’는 조건을 달아 승인했다. 또 지난 1일 열린 분과위에서는 총 33곳 220만㎡의 안양 도시정비기본계획 안 에 대해 제척되는 구역 없이 만안구 안양유원지 주변구역과 동안구 호원지구의 용적률만 시 요구안 232% 에서 230%로 소폭 조정했다. 또 향후 정비사업 추진 시 1종 단독주택지는 중ㆍ저층으로 계획을 수립하도록 조건을 달았다. 안양시 관계자는 “용적률이 미세 조정됐지만 원안 통과된 것으로 본다”고 말했다. 이들 시의 도시정비기본계획 안 은 일선 시가 조건부에 대한 수정계획을 담은 이행계획서를 도에 제출하고 도가 도시기본계획 결정고시문을 일선 시에 통보하면 시가 확정 고시하게 된다. 이 밖에 수원 도시정비기본계획 안 은 오는 10일 도 도계위 분과위에서 심의할 예정이다. 한편 인천시는 노후ㆍ불량주택지역 124곳 954만여㎡에 대한 ‘2010년 인천시 도시 및 주거환경 정비 기본계획’을 지난 1일 확정 고시했다. 시 도시계획위는 정비예정구역 대상 183곳에 대해 7차례의 심의를 벌여 136곳은 원안 및 조건부 가결하고 이 가운데 124곳을 정비예정구역으로 최종 확정했다. 43곳은 부결 처리했다. 인천시 관계자는 “나머지 4곳 신촌 주안1ㆍ7ㆍ8구역 중 주안1ㆍ7ㆍ8구역은 인근 지역을 포함해 하나의 구역으로 묶어 주안1구역 신촌구역 등 2곳으로 구분해 재공람을 실시하고 있다”고 밝혔다.,https://news.naver.com/main/read.nhn?mode=LSD&mid=shm&sid1=260&oid=112&aid=0000045862,31
20809,2006.08.08. 오전 10:32,부동산,헤럴드POP,‘담합 온상’ 부천 중개업소 장기 휴가전 돌입,부천 중동ㆍ상동 일대 중개업소들이 장기 휴가전에 돌입했다. 집값 담합이 집중됐던 부천 중동 신도시 중개업소들이 지난달 24일부터 1주일 간의 집단 휴업을 실시한 데 이어 일부 중개업소를 중심으로 이달 7일부터 재차 휴업에 들어갔다. 건설교통부의 집값 담합 발표 이후에도 집주인들이 좀처럼 호가를 내리지 않는 상황이 이어지면서 거래 성사가 사실상 불가능하게 되자 재차 집단 휴가를 떠나기로 결정한 것. 그나마 문을 연 곳도 ‘개점휴업’상태다. 중동은 물론 상동 신도시 일대 중개업소들도 지난달 30일부터 이달 6일까지 9일간의 집단 휴업을 실시한 바 있다. 인근 S공인 관계자는 “휴가철 비수기와 거래 급감으로 결국 재차 휴가를 떠나는 최악의 사태까지 이르게 됐다”며 “이미 중동 일대 중개업소들은 7 8월 가게 임대료조차 포기한 곳이 태반일 정도로 어려움이 크다”고 토로했다. 실제 중ㆍ상동 신도시 아파트의 호가 담합 사태는 좀처럼 해소될 기미를 보이지 않고 있다. 상동 신도시의 한라비발디 27평형의 매도 호가는 3억2000만원까지 치솟아 있지만 실제 거래 사례는 2억7500만원으로 큰 차이를 보이고 있다. 또 중동 그린타운의 32평형 매도호가는 평균 3억5000만원선이나 이를 찾는 매수자들은 3억1000만 3억2000만원 선을 요구하고 있다. 지나친 가격 담합으로 영업난이 심화되면서 중개업소들의 불만 또한 높아지고 있다. 중개업소 연합회 측은 부녀회들의 강도 높은 담합 행위에 대응키 위해 수시로 집단 회의를 소집 담합 사례에 대한 정보를 공유하면서 공동으로 해결책을 모색해 나가기로 했다.,https://news.naver.com/main/read.nhn?mode=LSD&mid=shm&sid1=260&oid=112&aid=0000045861,31
20810,2006.08.08. 오전 10:17,부동산,헤럴드POP,판교 거래세 과표는 ‘분양가’ 채권손실액은 제외,채권입찰제가 적용되는 판교신도시 중대형 아파트의 취득ㆍ등록세는 채권손실액을 감안하지 않은 순수 분양가에 대해서만 세금이 부과될 전망이다. 반면 양도소득세는 채권 할인에 따른 손실액이 필요경비로 인정돼 양도차익에서 공제된다. 8일 행정자치부에 따르면 판교신도시 중대형과 같은 채권입찰제 적용 아파트의 경우 채권손실액은 취득세 과표에 포함시키지 않고 순수 분양가에 대해서만 과세하기로 했다. 행자부 관계자는 “소비자가 아파트를 분양받기 위해 매입하는 2종 국민주택채권은 만기 때 전액 환급받는 것이며 당첨확률을 높이기 위한 수단이므로 취득세 과표에 넣기 어렵다”며 “발코니 확장이나 새시비용이 취득가에 포함되는 것과는 다른 개념으로 봐야 한다”고 말했다. 과거 1980년대 말 90년대 아파트 채권입찰제가 시행됐을 때에도 채권 상한액이나 채권손실액은 취득세 과표 대상에 포함하지 않았다. 따라서 판교 중대형 아파트 44평형의 경우 분양가 상한제를 적용한 분양가가 5억6000만원이라면 다음달 초 취득ㆍ등록세 인하 방침에 따라 입주 시 5억6000만원의 2.7% 농특세ㆍ교육세 포함 인 1512만원을 납부하면 된다. 반면 양도소득세는 ‘국민주택 채권을 만기 전에 은행 증권사 등에 양도함으로써 발생한 매각차손은 양도자산의 필요경비로 공제한다’는 소득세법 시행령에 의해 채권손실액을 경비로 인정해준다. 따라서 채권 상한액이 6억5800만원이고 채권 매입 즉시 38%의 이자율로 할인한다면 채권손실액 2억5004만원은 나중에 집을 팔 때 양도차익에서 빼면 돼 그만큼 양도세 부담이 줄어들게 된다. 국세청 관계자는 “채권을 할인하지 않고 만기까지 보유할 경우엔 그 금액을 환급받으면 되지만 양도세 필요경비로 인정받지는 못한다”고 말했다.,https://news.naver.com/main/read.nhn?mode=LSD&mid=shm&sid1=260&oid=112&aid=0000045856,31
20811,2006.08.08. 오전 10:13,부동산,머니투데이,뉴타운 집ㆍ땅 사기 어려워진다,머니투데이 원정호 기자 이르면 내달부터 투기가 우려되는 서울시내 뉴타운이 토지거래 허가구역으로 묶일 전망이다. 이렇게 되면 6평 20㎡ 이상 토지 매매시 허가를 받아야 해 투기 수요의 진입이 어려워진다. 건설교통부는 뉴타운 등 재정비촉진지구 지정전이라도 토지거래허가제를 조기에 적용할 수 있느냐는 서울시의 질의에 대해 가능하다는 답변을 내렸다 고 8일 밝혔다. 건교부 관계자는 도시재정비촉진을 위한 특별법 상 재정비촉진지구로 지정되면 토지거래허가구역으로 묶인다 면서 다만 재정비 촉진지구 예정지역이라도 투기가 우려되면 건교부 장관이 시장에 위임에 허가구역으로 고시할 수 있다 고 설명했다. 건교부의 답변에 따라 서울시는 현재 제정중인 특별법 조례에 이 규정을 삽입하는 한편 재정비촉진지구 지정예정인 뉴타운 26곳과 균형발전촉진지구 8곳에 이를 적용하는 방안을 검토중인 것으로 알려졌다. 서울시는 일부 뉴타운 등에 토지거래허가제를 도입 시행하고 있으나 거래면적기준이 주거지역은 180㎡ 상업지역은 200㎡ 이상이어서 기준이 20㎡ 이상으로 확대될 경우 뉴타운내 주택 및 토지거래가 크게 위축될 것으로 보인다. 서울시는 오세훈 서울시장이 뉴타운 사업지역을 현재 26곳에서 50곳으로 확대하겠다고 공약한 이후 뉴타운 지정 기대감으로 단독주택 밀집지역을 중심으로 서울 곳곳의 집값.땅값이 큰 폭으로 상승하고 있다. 특별법상 재정비 촉진지구는 노후.불량 주택과 건축물이 밀집한 15만평 이상의 주거지형과 상업지역.역세권.도심.부도심 지역의 6만평 이상 중심지형으로 구분되며 지구내에서 재개발사업의 분양권이 주어지는 20㎡ 이상 토지 거래시 투기방지 차원에서 거래허가를 받도록 정하고 있다.,https://news.naver.com/main/read.nhn?mode=LSD&mid=shm&sid1=260&oid=008&aid=0000689340,31
20812,2006.08.08. 오전 9:42,부동산,연합뉴스,포천 신도시 건설계획 축소 불가피,포천 연합뉴스 구정모 기자 경기도 포천시는 건설교통부가 최근 350만평 신도시 건설계획에 대해 부적합 판정을 내림에 따라 규모 축소 등을 통해 사업을 재추진할 계획이라고 8일 밝혔다. 시 市 에 따르면 지난달 20일 건교부 중앙도시계획의위원회 분과회의에서 포천시 인구 수에 비해 규모가 크고 기반시설이 없다는 이유로 신도시 건설이 부적합하다는 견해가 나왔다. 시는 이에 따라 신도시 규모를 200만평으로 축소하거나 기존 350만평을 단계적으로 개발하는 방안을 마련 건교부에 재심의를 요청할 예정이다. 시 관계자는 지금까지 신도시 개발은 중앙정부의 정책 차원에서 이뤄졌다 며 지자체에서 지역 현실과 의지가 담긴 신도시 개발계획을 건교부가 긍정적으로 검토해줬으면 좋겠다 고 말했다. 이에 앞서 시는 지난 2003년부터 군내.가산면 일대 350만평 신도시를 개발 목표인구 5만6천가구에 주거.상업.행정.유통 기능을 갖춘 자족적인 도.농복합도시로 건설할 계획을 추진해왔다.,https://news.naver.com/main/read.nhn?mode=LSD&mid=shm&sid1=260&oid=001&aid=0001378029,31
20813,2006.08.08. 오전 9:39,부동산,한국경제,승인받은 추진위가 선정한 시공사도 무효…재개발 시장 혼선,지방자치단체들이 이달 25일 개정 도시 및 주거환경정비법 도정법 시행에 앞서 재개발 추진위원회의 시공사 선정을 원천 봉쇄하고 있는 가운데 건설교통부가 추진위의 시공사 선정은 무효 라는 공문을 일선 지자체에 보낸 것으로 확인됐다. 이는 재개발 조합 설립 이전에 추진위가 이미 선정한 시공사의 효력을 취소하는 것이어서 전국 재개발 시장이 일대 혼란에 빠져들 것으로 우려된다. 한국경제신문 7월31일자 A1 5면 참조 건교부는 부천시 등 일선 지자체에 승인받지 않은 재개발 추진위가 시공사를 선정할 경우 고발 조치를 취하는 것과 함께 이미 승인받은 추진위가 시공사를 선정한 경우에도 승인을 취소하라 는 내용의 공문을 지난달 24일 보낸 것으로 7일 확인됐다. 이에 따라 건설업체들이 지난해부터 추진위에서 수주한 시공권은 전면 백지화 될 수밖에 없게 돼 재개발 사업은 전국적으로 중단될 가능성이 높아졌다. ○ 추진위 시공사 선정은 무효 이에 대해 건교부 관계자는 지자체 승인 여부와 관계 없이 추진위 단계에서의 시공사 선정은 합법적 지위가 인정되지 않는다 며 승인된 추진위라도 원칙적으로 시공사를 뽑을 수 없는 만큼 법 위반 사유로 승인 취소가 가능하다 고 강조했다. 이에 따라 부천시는 계수범박구역 신곡본동구역 등 이미 추진위가 승인을 받은 곳이라도 시공사를 선정할 경우 취소할 예정이다. 특히 승인된 추진위가 과거에 선정한 시공사의 효력도 무효 처리될 수밖에 없어 혼란이 확산될 전망이다. 검찰의 재개발 수사나 추진위와 대립하는 주민 투서 등을 통해 지자체가 기존 시공권을 문제삼을 수 있는 소지가 다분하기 때문이다. 건설업체들이 지난해와 올해 추진위에서 시공권을 확보한 물량은 적게는 수조원 많게는 수십조원에 달할 것으로 관련업계는 보고 있다. ○업계 건교부서 혼선 초래 업계는 조합설립 후 시공사 선정 을 골자로 한 개정 도정법 시행과 관련 건교부의 유권 해석이 혼선을 초래했다고 불만을 터뜨리고 있다. 도정법이 개정되기 직전까지만 해도 재개발 시공사 선정 시기에 대해 명확한 언급이 없었다는 것이다. 심지어 지난해 5월6일 건교부 유권 해석에서는 조합설립인가 전 단계에서의 시공자 참여에 대해서는 이를 법에서 제한하지 않는다 는 등으로 모호하게 언급해 혼란을 부추겼다는 주장이다. 이 때문에 국가청렴위원회도 최근 재개발·재건축시장 투명화 공청회에서 관련 유권해석을 삭제하라 고 권고하기도 했다. 이에 대해 건교부 관계자는 개정전에도 도정법 조항에 분명히 조합에서 시공사를 뽑도록 돼 있다 며 그동안 시공사나 추진위가 일부 문구를 놓고 아전인수격 해석을 했을 뿐 이라고 주장했다.,https://news.naver.com/main/read.nhn?mode=LSD&mid=shm&sid1=260&oid=015&aid=0000912269,31
20814,2006.08.08. 오전 9:00,부동산,서울신문,아파트 ‘담합 지정’ 효과 별무… 거래값 안내려,서울신문 정부가 ‘담합’ 아파트를 지정하는 게 실제 아파트값 인하에는 별로 도움이 되지 않고 있다. 7일 부동산 정보업체인 닥터아파트가 지난달 정부가 담합이 이뤄졌다고 실거래가를 공개한 서울·수도권 58개 단지에 대한 최근 시세를 조사한 결과 57개 단지는 시세 변화가 없었다.1개 단지는 오히려 소폭 올랐다. 최근 2주간 서울 아파트 매매가가 2주 연속 하락 행진을 이어가고 있지만 정부가 부풀려졌다고 지목했던 단지들은 그렇지 않은 셈이다. 담합 아파트에 대한 실거래가 내역은 건설교통부 홈페이지에서 계속 공개된다. 시세제공 유보 처분은 지정 후 4주가 지나면 자동 해제된다.,https://news.naver.com/main/read.nhn?mode=LSD&mid=shm&sid1=260&oid=081&aid=0000099450,31
20815,2006.08.08. 오전 8:45,부동산,한겨레,부동산 값 부실신고자 세무조사 착수,한겨레 축소 금액 1억 이상땐 5년간 거래 조사 서울 강남구에 70평대 아파트를 소유한 조아무개 39 씨는 지난 3월에 13억8400만원에 이 아파트를 팔았다고 신고했다. 조씨는 아파트 매매에 따른 양도차익 12억7100만원에 해당하는 양도소득세 2억7700만원도 국세청에 신고했다. 하지만 건설교통부가 한국감정원과 국민은행의 부동산 거래 자료 등을 통해 파악한 이 아파트의 적정 실거래가는 17억5000만원이었다. 올해 1월부터는 부동산 실거래가 신고제가 시행되고 있기 때문에 건교부는 조씨를 부실신고 혐의로 국세청에 통보해 조사를 의뢰했다. 부실신고 혐의가 확인되면 조씨의 양도차익은 16억3700만원으로 늘어나고 양도소득세도 애초 신고한 금액보다 1억1100만원이 늘어난 3억5900만원을 내야 한다. 서울 영등포구에 70평대 아파트를 소유한 김아무개 65 씨도 아파트 매맷값을 낮춰 17억6000만원으로 신고하고 양도차익 9억6400만원에 대한 양도세 2억6900만원을 납부했다. 하지만 건교부가 국세청에 통보한 이 아파트의 적정 실거래가는 20억500만원이었다. 실제 매맷값을 제대로 신고하지 않은 김씨는 양도세 1억1300만원을 더 물게 됐을 뿐 아니라 과거 부동산 거래 내역에 대해서도 국세청의 세무조사를 받게 됐다. 국세청은 7일 조씨나 김씨처럼 올해 1월부터 시행하고 있는 ‘부동산 실거래가신고제’를 위반한 이들을 추려 세무조사를 벌이겠다고 밝혔다. 국세청은 “축소 신고한 금액이 1억원 이상인 것으로 파악된 51명에 대해 우선적으로 세무 조사를 벌일 방침”이라며 “이들의 소명 여부와 관계없이 최근 5년간 모든 부동산거래에 대해 세무조사를 벌이게 된다”고 설명했다. 국세청은 또 “불성실 신고 혐의가 짙은 것으로 판단되는 494명에 대해서도 국세청에 소명할 것을 요구해 놓은 상태”라며 “소명 내용을 파악한 뒤 고의로 실거래가를 속여 신고한 경우 추가 세무조사를 벌이기로 했다”고 덧붙였다. 이에 앞서 건설교통부는 올해 상반기 전체 부동산거래 62만543건 가운데 실거래가 신고제를 위반한 것으로 의심되는 4만3천여건을 국세청에 통보해 실사를 의뢰했다. 석진환 기자 soulfat hani.co.kr 온라인미디어의 새로운 시작. 인터넷한겨레가 바꿔갑니다. ⓒ 한겨레 hp www.hani.co.kr 무단전재 및 재배포 금지 한겨레는 한국온라인신문협회 www.kona.or.kr 의 디지털뉴스이용규칙에 따른 저작권을 행사합니다.,https://news.naver.com/main/read.nhn?mode=LSD&mid=shm&sid1=260&oid=028&aid=0000165872,31
