,date,cat,co,headline,text,url,week
56650,2007.06.18. 오전 11:31,부동산,뉴시스,윤두환 의원 동탄신도시 부동산 가격 안정 효과 없을 것,울산 뉴시스 한나라당 윤두환 울산 북구 의원은 정부의 부동산대책이 국민의 신뢰를 얻지 못하고 있는 것으로 나타났다고 18일 밝혔다. 윤 의원에 따르면 지난 13일 여론조사 전문기관 여의도리서치에 의뢰해 정부의 부동산 정책 동탄신도시를 중심으로 과 관련해 CTS를 이용한 자동 여론조사 유효샘플 1564 표본오차 95% 신뢰수준 2.48 를 실시한 결과 이 같이 나타났다. 조사결과에 따르면 응답자의 48.2%가 동탄 신도시가 향후 부동산 가격안정에 별로 효과가 없을 것 이라고 응답했으며 응답자중 26%는 오히려 부동산 가격에 악영향을 줄 것 이라고 답했다. 윤 의원은 이에 대해 정부의 신도시 발표에 대해 국민들이 큰 불신을 보여주고 있는 대목 이라고 말했다. 특히 6조원에 이르는 보상금 사용처에 대해서도 62.3%가 다시 부동산에 자금이 몰릴 것 이라고 답해 이번 신도시 발표가 또 다른 부동산 투기를 조장할 가능성을 키운 결과가 될 것이라는 우려를 반영하고 있다. 골프장 제외 문제에 대해서는 응답자의 59.5%가 골프장 사업자들에게 특혜를 준 것 같아 반대한다 고 대답해 주변 경관 및 주거 환경에 도움이 될 것 이라는 정부의 주장 찬성율 21.4%에 비해 2.8배나 높은 응답률을 나타냈다. 윤 의원은 이번 여론조사 결과에서 정부의 부동산대책은 아직도 국민의 신뢰를 얻지 못하고 있다 며 특혜 시비가 있다면 명백히 밝혀 정부의 부동산정책이 더 이상 국민들에게 신뢰를 잃지 않도록 해야한다 고 주장했다.,https://news.naver.com/main/read.nhn?mode=LSD&mid=shm&sid1=260&oid=003&aid=0000457508,76
56651,2007.06.18. 오전 11:13,부동산,이데일리,아파트단지 조망권 좋아야 로열棟,수도권 681단지 중 397단지 로열동있다 이데일리 윤도진기자 아파트 거주자들은 방향이나 교통보다는 조망권 좋은 아파트를 더 선호하는 것으로 조사됐다. 18일 부동산정보업체 부동산114가 서울 및 경기 소재 아파트 681개 단지 나홀로 단지 제외 총 5547개 동을 대상으로 단지내 동별 선호도 를 조사한 결과 58.3%인 397개 단지에 로열동이 있는 것으로 나타났다. 397개 단지에서 로열동으로 꼽힌 곳은 총 1049개 동이며 이유는 조망권 양호 가 49.6%로 가장 높았다. 이어 조용함 21.0% 방향 양호 13.5% 일조권 양호 6.4% 등의 순으로 나타났다. 3000가구 이상 규모의 대단지에서는 조망 33.3% 교통 24.1% 등이 로열동의 기준이 됐다.,https://news.naver.com/main/read.nhn?mode=LSD&mid=shm&sid1=260&oid=018&aid=0000492641,76
56652,2007.06.18. 오전 11:03,부동산,파이낸셜뉴스,국민 48% “동탄신도시 부동산 안정 효과 없다”,국회 건설교통위 소속 한나라당 윤두환의원은 18일 여론조사 전문기관인 ‘여의도 리서치’에 의뢰 6월 13일 전국민을 대상으로 조사한 결과에 따르면 “응답자의 48.2%가 동탄 신도시가 향후 부동산 가격안정에 별로 효과가 없을 것’이라고 응답했다고 밝혔다. 응답자중 26%는 ‘오히려 부동산 가격에 악영향을 줄 것’이라고 답해 이번 신도시 발표에 대해 국민들이 큰 불신을 보여주고 있는 것으로 나타났다고 밝혔다. 6조원에 이르는 보상금 사용처에 대해서도 62.3%가 ‘다시 부동산에 자금이 몰릴 것이다’라고 답해 이번 신도시 발표가 또 다른 부동산 투기를 조장할 가능성을 키운 결과가 될 것이라는 우려를 나타냈다. 또 골프장 제외 문제에 대해서는 응답자의 59.5%가 ‘골프장 사업자들에게 특혜를 준 것 같아 반대한다’고 답해 ‘주변 경관 및 주거 환경에 도움이 될 것’이라는 정부의 주장 찬성율 21.4%에 비해 2.8배나 높은 응답률을 나타냈다고 밝혔다. 윤 의원은 “이번 여론조사 결과를 보더라도 정부의 부동산 대책은 아직도 국민의 신뢰를 얻지 못하고 있다”면서 “특혜 시비가 있다면 명백히 밝혀내서 정부의 부동산 정책이 더 이상 국민들에게 신뢰를 잃지 않도록 해야한다“고 주장했다.,https://news.naver.com/main/read.nhn?mode=LSD&mid=shm&sid1=260&oid=014&aid=0000313894,76
56653,2007.06.18. 오전 11:00,부동산,이데일리,남광토건 개성에 철구공장 건립 추진,이데일리 윤진섭기자 남광토건 001260 이 북한 개성 공단에 철구공장 건립을 추진한다. 또 앙골라 공사현장에 북한 인력을 투입할 계획이다. 이동철 남광토건 사장은 지난 15일 서울 강남구 본사에서 창립 60주년 기자간담회를 갖고 이같이 밝혔다. 이 사장은 대북사업 일환으로 개성 공단에 철구공장 건립을 추진 중이고 이를 위한 별도의 팀을 운영하고 있다 며 다만 사업이 구체화 되기까지는 좀 더 시간이 필요하다 고 말했다. 남광토건은 이와는 별도로 아프리카 앙골라 해외현장에 북한인력 투입도 검토중이다. 이 사장은 북한 당국에 이 같은 뜻을 전달했고 북한도 긍정적으로 검토하고 있다 며 올해는 다소 힘들고 내년부터는 북한 인력 투입이 가능할 것 이라고 밝혔다. 그는 신재생에너지 부문 진출에 대해서도 경북 군위에 태양광 발전소 건립을 위한 부지를 확보했고 또 다른 지역의 부지 매입도 검토중 이라며 제주도에 풍력발전소 건립도 내부적으로 논의중 이라고 설명했다.,https://news.naver.com/main/read.nhn?mode=LSD&mid=shm&sid1=260&oid=018&aid=0000492631,76
56654,2007.06.18. 오전 11:00,부동산,이데일리,남촌복지재단 무료병원 안과의료기기 기증,이데일리 윤진섭기자 남촌복지재단 이사장 허창수 은 지난 15일 경기도 안산시에 위치한 무료병원 안산 빈센트 의원에 2000만원 상당의 의료기기를 지원했다고 18일 밝혔다. 이광미 안산 빈센트 의원 원장은 안과 진료 시 기본적으로 마련되어야 할 장비가 없어 어려움이 많았다 라며 안질환을 겪고 있는 많은 환자들에게 큰 선물이 될 것 이라고 감사의 뜻을 전달했다.,https://news.naver.com/main/read.nhn?mode=LSD&mid=shm&sid1=260&oid=018&aid=0000492627,76
56655,2007.06.18. 오전 10:56,부동산,머니투데이,상반기 상가시장 이끈 5대 이슈,머니투데이 원정호 기자 주공단지내 상가 인기..삼성타운덕에 강남역상권 활황 올 상반기 상가시장은 연초 기대 만큼의 투자자 유입이 많지 않았다. 분양가는 크게 오른 반면 실물경기 침체로 임차 수요는 활성화되지 않았기 때문이다. 정부의 강력한 주택시장 규제 여파로 아파트보다는 상가가 투자 대상으로 빛을 볼 것이라는 당초 전망이 빗나간 셈이다. 상가뉴스레이다 정미현 연구원은 올 하반기에도 고분양가와 경기 침체로 상가시장 활성화에 어려움이 예상된다 면서 상가는 유형별로 수익률과 시세 차익이 차이가 크므로 투자시 옥석을 가려야 한다 고 말했다. 상반기 상가시장을 이끈 5대 이슈를 정리해봤다. ◇주택공사 단지내 상가 인기 올 상반기에도 주택공사의 택지지구 단지내 상가가 큰 인기를 누렸다. 지난 1 5월 주공이 분양한 상가는 총 155개로 예정가 대비 낙찰가률은 131%에 달했다. 주공 단지내 상가라 해도 배후단지 규모가 작은 상가는 미분양을 보였다. 지난 1 5월중 분양한 155개 상가 중 52개가 최초 입찰에서 미분양된 것으로 조사됐다. 근린상가의 경우 주요 택지지구인 발산지구와 장지지구 근린상가에 투자자 선호가 높았다. 역세권 상권도 일부 신설 역세권에 투자자들이 모였지만 그 외의 지역은 투자문의 조차 뜸했다. ◇잠실 레이크팰리스 단지내상가 최고 분양가 역대 최고가 상가가 등장해 고분양가 논란을 일으켰다. 잠실 레이크팰리스 단지내 상가 B동의 1층 평당 분양가가 1억3000만원에 공급된 것. 이 상가는 지상 2 5층 분양가도 역대 상가분양가 최고치를 기록했다. 2층 평당가 5600만원 △3층 4050만원 △4층 5층 3000만원 수준이다. 하지만 분양률 저조현상과 투자수익률 제시 어려움 등으로 지난달 분양가를 최고 3000만원까지 낮춰 분양중이다. ◇삼성타운 입주 기대감으로 강남역 상권 활황 삼성타운 입주가 시작되면서 이 일대 강남역 상권은 매매가와 임대가가 동반 상승했다. 삼성타운과 인접한 지역에서 분양중인 주상복합상가의 1층 평균 평당분양가는 6300만 8700만원선으로 지역적인 가격선을 고려한다고 해도 상당히 높은 수준이다. 기존 점포의 경우 권리금이 삼성타운 조성 계획이 발표된 3년 전보다 2배 정도 뛰었다. 상가도 삼성타운 주변 1층 40 50평 규모의 권리금이 3억원 안팍이며 임대보증금 3억 5억원에 월세 1000만 1500만원에 달해 강남역 상권에서도 최고의 수준을 보였다. ◇ 동탄신도시 상가시장도 들썩 동탄2신도시 발표에 따라 동탄신도시 중심상업지구 등 인근 상가 시장도 들썩였다. 발표 이후 중심상업지구에 투자자의 방문이나 전화문의가 쇄도한 것. 그러나 관심에 비해 직접적으로 상가투자에 뛰어든 투자자는 많지 않았다. 중심상업지구내의 분양 상가의 잔여 물량이 많아 투자자들이 관망세를 보였다. 신도시 발표 초기여서 아직까지는 아파트나 토지쪽의 관심이 더 많은 상태다. ◇ 고수익 보장 허위광고 대거 적발 공정거래위원회는 올 초 상가 분양.임대 과정에서 허위.과장 광고를 하거나 중요 정보를 제공하지 않는 등 표시.광고법을 위반한 23개 업체를 적발 시정 명령을 내리고 과징금을 부과했다. 이들 업체는 확정수익 보장기간이 1 2년에 불과한데도 장기간 수익이 보장되는 것으로 표시했다. 또 대형 학원 문고 유명브랜드 등의 입점이 확정된 것으로 허위 사실을 표시했으며 △객관적 근거없이 예상수익률을 부풀려 제시하고 △광고에 출연한 유명 연예인이 상가에 입점한 것처럼 허위 과장 광고를 했다.,https://news.naver.com/main/read.nhn?mode=LSD&mid=shm&sid1=260&oid=008&aid=0000796209,76
56656,2007.06.18. 오전 10:55,부동산,이데일리,청약부금가입자 1년새 38만명 감소,청약저축가입자는 1년새 28만명 증가 이데일리 남창균기자 청약가점제 도입으로 당첨 가능성이 낮아진 청약부금 가입자가 지난 1년새 38만명 18.1% 이나 줄어든 것으로 나타났다. 반면 공영개발 확대로 청약기회가 확대된 청약저축 가입자는 1년새 28만명 가량 늘었다. 하지만 청약저축에 가입해도 신도시에서 당첨되려면 가입기간이 최소 5년 이상은 되어야 한다. 오는 9월부터 청약가점제가 도입되면 중소형 주택의 75%는 무주택자이면서 부양가족수가 많은 사람에게 돌아간다. 중대형 주택은 1차로 채권입찰금액 순으로 당첨자를 뽑고 동점자가 생기면 가점제 50% 추첨제 50%로 선발한다. 18일 금융결제원에 따르면 5월말 현재 청약부금 가입자는 171만4672명으로 1년전 209만5576명보다 38만904명 감소했다. 반면 청약저축 가입자는 같은 기간 229만3553명에서 257만7457명으로 28만여명 12.3% 증가했다. 청약예금 가입자 역시 부금 가입자들의 갈아타기 유입이 생기면서 같은 기간 6만여명 늘었다. 287만9198명→293만9806명 하지만 청약통장 가입자는 지난 4월을 고비로 감소추세를 보이고 있다. 청약가점제 도입으로 전체적인 당첨 가능성이 낮아졌기 때문이다. 올해 청약통장 가입자수는 1월 724만1476명 2월 725만8983명 3월 726만2284명 4월 725만9322명 5월 723만1935명 등이다.,https://news.naver.com/main/read.nhn?mode=LSD&mid=shm&sid1=260&oid=018&aid=0000492624,76
56657,2007.06.18. 오전 10:52,부동산,뉴시스,검단사거리 근린상가 프라임타워 분양,검단사거리 근린상가 프라임타워 분양 서울 뉴시스 대상종합건설은 인천 서구 마전동 검단 2지구의 근린상가 프라임타워 40점포를 분양한다고 18일 밝혔다. 지하 2층 지상 10층 규모이며 1·2층은 프렌차이즈 음식점 금융권 등 근린생활 시설 3층은 노래방 PC방 DVD방 4 6층은 정형외과 또는 증권사 보험사. 법무사 등 개인사무실 6 9층은 학원 체육관 서점 10층은 스포츠센터 스카이라운지 등이 권장 업종이다. 평당 분양가는 400만원 2800만원선이다.,https://news.naver.com/main/read.nhn?mode=LSD&mid=shm&sid1=260&oid=003&aid=0000457457,76
56658,2007.06.18. 오전 10:50,부동산,헤럴드POP,투기과열지구 해제 유망단지 선별청약 나설만,신일부도로 지방경기를 살려야한다는 여론이 비등해지면서 투기과열지구 해제에 관심이 높아지고 있다. 특히 그동안 해제에는 긍정적이면서도 시기와 대상지역에 대해서는 여전히 함구해온 건설교통부가 재차 해제 방침을 천명 지자체와 아파트 분양업체들의 주목을 받고 있다. 투기과열지구에서 해제되면 전매가 가능하고 청약1순위자격도 완화되기 때문에 유망단지의 경우 ‘실거주 투자 프리미엄’라는 1석2조의 효과를 기대할 수 있기 때문이다. 일단 주택건설업계는 해제 시기는 이르면 이달말 대상지역은 부산 대구 광주광역시가 될 것으로 내다보고 있다. 이는 하반기 들어 분양가 상한제 시행등이 예정되어 있어 자칫 주택건설업체들의 경영난이 더욱 가중될 우려가 크기 때문에 조기에 푸는 것이 효과적이라는 판단에서이다. 실제로 신일 부도이후 건교부 등 정부 내부에서도 이같은 분위기가 팽배 상반기중 단행될 가능성이 높은 것으로 알려지고 있다. 또 대상지역은 현재 미분양이 급증하고 지방경기불황으로 극심한 경영난을 겪고 있는 대구와 부산 광주가 1차 대상이 될 공산이 큰 것으로 점쳐지고 있다. 일단 투기과열지구에서 해제되면 가장 큰 혜택을 보는 지방 대도시는 부산일 것으로 예상된다. 부동산 정보업체 부동산 써브에 따르면 부산에서 연말까지 신규 분양 사업장만 42곳 2만7935가구에 이른다. 여기에 미분양물량 8548가구 까지 합하면 약 3만6000가구가 전매제한의 굴레를 벗는 셈이다. 이어 대구는 33곳 1만8762가구 광주는 26곳 1만2527가구가 하반기 분양대기 중인 것으로 집계됐다. 또 투기과열지구 해제 지역에서 분양되는 단지 가운데 역세권이나 1000가구 이상 대단지 톱 브랜드 아파트의 경우 청약 경쟁률이 크게 높아질 전망이다. 다만 투기과열지구에서 해제된다 하더라도 9월부터 분양가 상한제가 실시되면 다시 6개월간 전매가 금지된다는 사실에 유의해야 할 것으로 지적되고 있다.,https://news.naver.com/main/read.nhn?mode=LSD&mid=shm&sid1=260&oid=112&aid=0000069488,76
56659,2007.06.18. 오전 10:46,부동산,머니투데이,봉천역주변 40년 무허가촌 사라진다,머니투데이 채원배 기자 10층아파트 6개동으로 변모..하반기 착공 서울 봉천역 주변의 40년된 무허가촌이 아파트로 바뀐다. 관악구는 봉천역 주변지인 봉천8동 1522 1번지의 노후주택 단지가 10층 아파트 6개동으로 변모하게 된다고 18일 밝혔다. 총 5018㎡ 1518평 규모의 이 지역은 60년대 후반부터 타지역 이주민들에 의해 형성된 무허가 불량주택지역으로 도시 경관을 저해한다는 지적을 받아왔던 곳이다. 또한 이 곳은 전철역 주변으로 입지가 좋아 20년 전부터 재건축을 바라는 주민들의 민원이 끊이지 않았다. 이에 관악구는 이 지역에 대한 주거환경개선사업을 지속적으로 추진 지난 1999년에 주거환경개선지구로 지정하고 2002년에 개선계획을 수립했다. 이 계획은 지난달 서울시 도시·건축공동위원회 심의를 통과해 총107가구를 수용할 수 있는 건축이 가능해졌다. 이에 따라 주거환경개선사업 추진위원회가 6월말쯤 건축허가를 신청해 허가를 받으면 하반기쯤 착공이 가능할 것으로 전망된다.,https://news.naver.com/main/read.nhn?mode=LSD&mid=shm&sid1=260&oid=008&aid=0000796200,76
56660,2007.06.18. 오전 10:32,부동산,헤럴드POP,끝없이 진화하는 아파트…미래 영화같은 주거생활 ‘성큼’,아파트의 진화가 갈수록 눈부시다. 지속적인 외관 디자인 및 평면 혁신에다 지역 랜드마크를 지향하는 초고층으로의 진화 최근 들어선 주거 편의성을 획기적으로 높이기 위한 미래형 첨단 주거기능이 경쟁적으로 도입되고 있다. 심지어 방범 로봇 지중열을 활용한 냉난방시스템 무인택배 호텔식 공용공간 교통기능까지 겸하는 만능 아파트 열쇠 등 미래 영화속에서나 볼 수 있는 주거생활이 현실로 성큼 다가오고 있는 것이다. 외관 디자인ㆍ 색채까지도 차별화 아파트 층이나 향에 따라 내부 설계가 달라지는 다평면시대가 본격적으로 열리고 있다. 현대산업개발은 부산 해운대 우동 주상복합 아파트 1750여가구 에 무려 120여개의 평면을 도입한다. 돛단배를 형상화한 곡선형 외관과 바다 조망권을 살리기 위해서다. GS건설도 내달 중순께 약 40개의 다양한 평면을 갖춘 ‘송도자이 하버뷰 1069가구 ’를 선보인다. 앞서 현대건설은 서울 뚝섬숲 힐스테이트의 외관에 한강을 바라보는 요트 형태를 도입했다. 공용공간구조 혁신도 돋보인다. GS건설은 일명 ‘자이안 로비 Xian Lobby ’ 특허를 최근 획득했다. 공간구조 개선 디자인이 발명으로 인정받아 특허등록을 한 경우는 이번이 처음이다. 공동주택 1 2층의 계단구조를 변경해 1층에 넓은 홀을 제공하고 높은 창호와 천창을 통해 많은 양의 빛이 홀 내부로 들어오도록 고안했다. 아파트 색채까지 차별화한 아파트도 등장한다. 현대건설은 최근 세계적인 색채 디자이너와 협력해 통합 색채 디자인을 개발 김포 고촌과 서울 뚝섬숲 힐스트이트에 시범 적용한 뒤 향후 분양하는 힐스테이트에도 지역 특성에 맞춰 이를 적용키로 했다.아파트 화장법 까지 진화를 거듭하는 셈이다. 지역 랜드마크로 자리매김하기 위한 덩치 진화도 한창이다. 주상복합ㆍ제3세대 복합단지는 물론 일반아파트도 키재기 경쟁에 가세 인천 학익동에 들어서는 풍림산업의 엑슬루타워는 일반 아파트로는 최고층인 53층에 달한다. ‘더 편리하게’ 최첨단 주거공간 창출 동부건설은 최근 분양을 마친 진접 동부센트레빌 1687가구 에 단지 방범 로봇인 ‘센트리’를 개발해 업계 최초로 도입했다. 센트리는 반경 50m 범위를 360도 회전하며 주변을 자동으로 감시하고 화면을 저장한다. 외부인의 침입을 감지하면 출동 경비업체에도 자동 연락된다. 현대건설은 최근 아파트 출입은 물론 대중교통과 지하철 등 대중교통을 이용할 수 있는 만능 키를 개발했다. 현대측은 이같은 기능에 더해 극장과 편의점 등에서 소액결제 서비스와 인터넷 게임을 비롯한 다양한 콘텐츠 서비스도 제공할 계획이다. 현대산업개발은 주방에 컨버터블 벽체를 설치하는 상품으로 주부들의 관심을 모았다. ‘천안 백석 I PARK’ 68평형에 적용된 컨버터블 벽체는 거실과 주방 사이에 위치 손으로 끌기만 하면 공간 변화가 가능한 게 특징. 손님을 초대해 음식을 준비할 때 발생하는 소리와 냄새 등을 거실에 있는 손님들로부터 감출 수 있어 신선하다는 평가를 받았다. 에너지 절약 등 비용 절감을 위한 노력도 주거공간의 진화를 재촉하고 있다. 삼성물산 건설무분은 에어컨 실외기나 냉각탑 없이도 여름에는 찬 공기를 겨울에는 더운 공기를 공급할 수 있는 ‘지중열 地中熱 ’ 시스템을 개발했다. 또 아파트 곳곳에 태양광을 이용한 조명ㆍ난방장치 빗물을 재활용해 청소나 분수대에 재사용하는 우수 雨水 처리시스템 하수를 재활용해 변기 등에 사용하는 중수시스템도 도입했다. 대림산업은 업계 최초로 아파트 단지 내에 태양광 태양열 등의 신재생에너지 및 특수건축기법을 활용한 에너지 절약형 시스템을 개발 아파트 단지에 적용키로 했다. 태양열 급탕 시스템의 경우 집열기를 통해서 태양에너지를 흡수해 건물 등에 필요한 온수를 공급하는 시스템이다. 대림산업은 또 건물 전체의 연간 냉난방 에너지 사용량이 제로에 가까운 패시브하우스 Passive House 도 일부 상용화했다.,https://news.naver.com/main/read.nhn?mode=LSD&mid=shm&sid1=260&oid=112&aid=0000069472,76
56661,2007.06.18. 오전 10:30,부동산,세계일보,건설업풍향계남광토건 설계·광고 등 마케팅 공모전 외,남광토건은 오는 9월5일까지 대학 원 생을 대상으로 설계 광고 논문 등 3개 부문에 걸친 ‘제2회 하우스토리 마케팅 공모전’을 실시한다. 수상자에게는 대상 1000만원 등 총 2850만원의 장학금을 비롯해 공채 지원 시 가산점을 부여한다. 모집요강은 하우스토리 홈페이지 www.haustory.co.kr 에서 확인할 수 있다. 교통카드 겸용 출입카드 개발 현대건설은 교통카드 기능을 포함한 아파트 출입카드 ‘원패스 골든키’를 개발 향후 분양하는 힐스테이트 아파트에 적용할 계획이라고 17일 밝혔다. 이 카드는 엘리베이터 호출 차량 위치 파악 CCTV 실시간 모니터링 등이 가능한 주차위치정보시스템 UPIS 과 연동하며 극장과 편의점 인터넷 게임몰 등에서 소액 결제도 가능하다. 대학생 대상 주택건축 대전 대한주택공사는 대학생을 대상으로 ‘일상공간의 확장 접점공간의 디자인’이란 주제로 제11회 주택건축대전을 개최한다. 2년제 이상의 대학 및 대학원에 재학 중인 학생이면 누구나 참가 가능하며 개인이나 3인 이내로 팀을 구성할 수 있다. 동상 이상의 당선작 대표 한 사람에게는 해외 건축기행 특전도 준다. 참가신청은 7월6일까지 인터넷 접수로만 가능하다. 자세한 사항은 공모전 홈페이지 hp itis.jugong.co.kr 를 참조하면 된다. 제17대 대선 특별 사이트 hp 17daesun.segye.com ⓒ 세계일보＆세계닷컴 www.segye.com 무단전재 및 재배포 금지 세계닷컴은 한국온라인신문협회 www.kona.or.kr 의 디지털뉴스이용규칙에 따른 저작권을 행사합니다.,https://news.naver.com/main/read.nhn?mode=LSD&mid=shm&sid1=260&oid=022&aid=0000233468,76
56662,2007.06.18. 오전 10:27,부동산,머니투데이,국민 절반 동탄신도시 효과 없을 것,머니투데이 박재범 기자 국민의 절반 정도는 동탄 신도시가 향후 부동산 가격 안정에 효과가 없을 것으로 내다봤다. 국민의 1 4 정도는 오히려 부동산 가격에 악영향을 줄 것이란 생각을 가진 것으로 나타났다. 18일 한나라당 윤두환 의원이 여론조사 전문기관인 여의도 리서치 에 의뢰해 조사한 결과에 따르면 응답자의 48.2%는 동탄 신도시가 향후 부동산 가격 안정에 별 효과가 없을 것으로 대답했다. 응답자의 26%는 동탄 신도시가 부동산 가격에 악영향을 줄 것으로 내다봤다. 6조원에 이라는 보상금 사용처의 경우 62.3%는 다시 부동산에 자금이 몰릴 것 이라고 답했다. 윤두환 의원은 이번 신도시 발표가 또다른 부동산 투기를 조장할 것이라는 우려가 높다는 얘기 라며 그만큼 국민들의 불신이 크다 고 말했다. 동탄 신도시 계획중 골프장을 제외한 것에 대해서도 응답자의 59.5%가 골프장 사업자들에게 특혜를 준 것 같아 반대한다 는 응답을 했다. 주변 경관 및 주거 환경에 도움이 될 것 이라는 정부 주장에 대한 찬성은 21.4%에 그쳤다.,https://news.naver.com/main/read.nhn?mode=LSD&mid=shm&sid1=260&oid=008&aid=0000796181,76
