,date,cat,co,headline,text,url,week
142867,2009.06.24. 오후 6:54,부동산,한국경제TV,파워인터뷰이순광 한미파슨스 사장 “2015년 세계 10대 CM기업 목표”,앵커 지난 23일 상장한 한미파슨스가 오는 2015년까지 세계 10대 CM 기업으로 도약하겠다는 비전을 밝혔습니다. 이와 함께 국내 건설산업을 글로벌 스탠다드에 맞게 선진화하는데도 역할을 다하겠다는 포부입니다. 박준식 기자의 보도입니다. 기자 지난 23일 유가증권시장에 성공적으로 상장한 한미파슨스. 이순광 한미파슨스 사장은 5년 뒤 세계 10대 CM기업으로 도약하겠다는 포부를 밝혔습니다. 인터뷰 이순광 한미파슨스 사장 ”투명하고 합리적인 경영방침을 바탕으로 현재의 경영목표인 2015년까지 세계 10대 CM 기업이 된다는 비전을 꼭 달성하겠다” CM은 건설사업의 기획단계부터 설계 발주 시공 등 건설 사업 전분야를 관리하는 것. 사업 비용을 획기적으로 줄이는 동시에 공사 기간을 단축시켜 미국이나 영국 등 선진국에서는 건설사업의 40% 이상을 CM으로 발주되고 있습니다. 인터뷰 이순광 한미파슨스 사장 ”CM은 건설산업의 가치를 창출하는 역할을 하는 만큼 국내 건설산업을 글로벌 스탠다드에 맞게 선진화하는 데 주도적인 역할을 다할 것이다” 한미파슨스는 서울월드컵경기장 과천국립과학관 등 대형 건설사업에 CM기업으로 참여한 바 있습니다. 해외에서는 사우디아라비아의 IT컴플렉스 프로젝트 오만정부의 조선소 건설프로젝트 등을 수주하면서 세계 CM업계에서 두각을 나타내고 있습니다. 인터뷰 이순광 한미파슨스 사장 ”현재 33개 국가에 프로젝트를 수행한 경험으로 가지고 있으며 중동과 아시아 지역에 다수의 법인과 지사를 운영하고 있다. 앞으로도 글로벌 기업으로서의 경쟁력 증진을 위해 해외사업을 더욱 확대해 나갈 계획이다” 새로운 도약을 위한 토대를 마련한 한미파슨스 상장 성공으로 세계적인 기업으로 성장하는 데 하나의 전환점을 맞고 있습니다. WOW TV NEWS 박준식입니다.,https://news.naver.com/main/read.nhn?mode=LSD&mid=shm&sid1=260&oid=215&aid=0000011416,181
142868,2009.06.24. 오후 6:52,부동산,한국경제TV,분양조건 완화 대형 건설사도 동참,앵커 미분양 물량을 소진하기 위한 건설사들의 노력이 이어지고 있는 가운데 최근엔 대형 건설사들도 속속 동참하는 모습입니다. 대단지로 구성된 물량이 많아 내 집 마련을 꿈꾸는 실수요자들에게 좋은 기회로 작용할 것으로 보입니다. 보도에 박영우 기자입니다. 기자 그동안 자존심을 지켜오며 고분양가를 고집했던 대형 건설사들이 문턱을 낮추고 있습니다. 중도금 무이자 대출과 발코니 확장은 기본. 심지어 인테리어 비용까지 무상으로 제공하는 등 금액으로 따지면 수천만 원 상당의 혜택을 제공합니다. 두산건설은 부천시 원미구 약대동에서 부천약대 두산위브 미분양 물량을 분양하고 있습니다. 지하 2층 지상 25층 27개동 규모로 전용면적 59 114㎡로 구성된 1843가구 대단지입니다. 중동신도시와 상동지구가 인접해 기반시설과 편의시설 이용이 가능하다는 점이 장점으로 꼽힙니다. 계약금 5%에 중도금 50%는 이자후불제가 적용됩니다. KCC건설은 안성시 공도읍에서 안성 공도 KCC스위첸을 분양 중입니다. 1101가구로 양도세는 5년간 전액 면제되고 취득ㆍ등록세도 50% 감면됩니다. 여기에 발코니와 새시를 무료로 시공해 줍니다. 이밖에 벽산건설이 고양 식사동에서 동부건설이 용인 신봉에서 조건을 완화해 분양하고 있습니다. 전문가들은 미분양 아파트 투자에 앞서 단지 주변에 개발 호재가 있고 브랜드 인지도가 높은 아파트 위주로 투자할 것을 당부했습니다. 인터뷰 김규정 부동산114팀장 “건설사들이 미분양 아파트를 해소하기 위해서 분양가 인하와 마감재 업그레이 등 여러 가지 혜택을 제공하고 있습니다. 이런 혜택과 더불어 수요자들 입장에서는 단지를 직접 가보며 체크하는 것이 중요해 보입니다.” 미분양 문제로 골머리를 썩고 있는 대형 건설사들마저 속속 자존심을 꺾으면서 내집마련을 꿈꾸는 수요자들의 선택의 폭은 더욱 넓어지고 있습니다. WOWTV NEWS 박영우입니다.,https://news.naver.com/main/read.nhn?mode=LSD&mid=shm&sid1=260&oid=215&aid=0000011415,181
142869,2009.06.24. 오후 6:51,부동산,한국경제TV,30% 이상 오른 아파트 ‘강남권 집중‘,앵커 올해 상반기 30% 이상 가격이 오른 아파트의 숫자가 지난해에 비해 대폭 줄었습니다. 그중에서도 가격이 많이 오른 아파트 대부분이 강남권에 집중돼 있어 강남북 간 집값 편차가 커지고 있습니다. 김효정 기자의 보도입니다. 기자 지난 상반기 서울에서 30% 넘게 가격이 오른 아파트는 모두 1만6천여가구. 지난해 같은 기간 30% 이상 오른 아파트가 20만1천가구에 이르렀던 것과 비교하면 그 수는 10분에 1에도 못 미칠 정도로 부동산시장 침체를 반영했습니다. 하지만 강남불패 신화는 여기서도 뚜렷이 나타났습니다. 30% 이상 가격이 오른 아파트의 70%가 강남과 강동 서초 송파 등 강남 4개구에 몰려 있기 때문입니다. 지난해 노원구와 도봉구 등 강북권의 아파트 가격이 크게 올랐던과 크게 비교됩니다. 강남 4개구의 가격이 크게 오른 것은 재건축 아파트 사업이 본격적으로 추진됐기 때문입니다. 인터뷰 김혜연 부동산 114 본부장 “강남은 작년 말 가격 하락 폭 커 강남 재건축 규제완화로 가장 큰 수혜 .상대적으로 강남 아파트 상승세 높아” 특히 송파구는 1월부터 꾸준한 상승세를 이어가고 있습니다. 잠실 주공5단지 120㎡는 14억3500만원으로 올해 초보다 37% 가까이 올랐습니다. 강남구 개포동 주공1단지 56㎡도 33.5% 오른 12억7500만원에 거래됐습니다. 서초구 반포동 주공1단지 73㎡는 30.4% 올라 10억5000만원에 팔렸습니다. 반면 강북 아파트 가격도 4월 저점을 지나 상승세로 돌아섰지만 지난해 가격을 회복하기에는 상당한 시간이 필요해 보입니다. 이에 따라 한동안 좁혀지는 것 같았던 강남북간 가격 편차도 점차 심해질 전망입니다. WOWTV NEWS 김효정입니다.,https://news.naver.com/main/read.nhn?mode=LSD&mid=shm&sid1=260&oid=215&aid=0000011414,181
142870,2009.06.24. 오후 6:48,부동산,한국경제TV,송파구 전셋값도 훌쩍,앵커 입주 물량이 쏟아지면서 한 때 역전세난까지 보였던 송파구 아파트 전셋값이 나날이 치솟고 있습니다. 지난해 말에 비해 평균 3천만원 넘게 오른 것으로 나타났습니다. 보도에 이지은 기자입니다. 기자 지난해 말까지만 해도 2억 3천만원이면 전세를 구할 수 있었던 송파구 잠실의 109㎡ 짜리 재건축 아파트. 전셋값이 6개월 만에 1억 3천만 원이나 뛰었습니다. 인근 신천동도 상황은 마찬가지여서 108㎡짜리 아파트의 전셋값은 1억 1천만 원이나 올랐습니다. 실제로 송파구의 아파트 평균 전세값은 최고점이었던 지난해 8월 수준을 넘는 2억 5천만 원을 기록했습니다. 지난해 말 이후 꾸준한 상승세를 보이면서 3천 3백만 원 넘게 오른 것입니다. 이는 서울 평균 상승 폭을 훨씬 웃도는 수준입니다. 이 같은 상승세는 송파구와 가까운 서초구와 강동구에도 옮아 붙고 있습니다. 올 들어 서초구는 평균 1천2백만 원 강동구는 9백만 원 전셋값이 상승했습니다. 인터뷰 채훈식 부동산써브 리서치센터장 송파구는 과거 가격이 떨어졌던 매물들이 빠르게 소진되면서 전셋값이 큰 폭의 상승세를 보였다. 향후 경기나 금리 여부에 따라 변동이 있을 수 있지만 수요에 비해 매물이 부족한 편이라 송파구를 비롯한 강남권 전세가 상승세는 당분간 이어질 것으로 보인다. 적어도 올 하반기까지 강남 지역에 예정된 대규모 입주 물량이 없는 만큼 이 일대 전셋값은 더 오를 것이라는 분석입니다. WOW TV NEWS 이지은입니다.,https://news.naver.com/main/read.nhn?mode=LSD&mid=shm&sid1=260&oid=215&aid=0000011413,181
142871,2009.06.24. 오후 6:47,부동산,뉴시스,버블세븐 분양시장 기지개 활짝,서울 뉴시스 침체일로를 걷던 ‘버블 세븐’ 지역의 아파트 분양시장이 다시 살아나고 있다. 집값 상승세가 강남권에서 버블세븐 전역으로 확대된 데다 올해 보금자리 주택공급까지 예정돼 있기 때문이다. 24일 부동산정보업체 스피드뱅크에 따르면 올해 버블세븐 지역에는 31개 단지 1만1392가구가 들어서며 이 중 일반에 1만431가구가 공급된다. 버블세븐 지역은 판교분양 당시 정부가 집값에 거품이 끼었다고 지목한 강남 서초 송파 목동 용인 분당 평촌 등 7개 지역이다. 지난해 실물경기 침체로 거래량이 급감했지만 올해 초부터 이어진 규제완화로 강남권에서부터 시작된 집값 상승 분위기가 버블세븐 전역으로 확대되는 모습을 보이고 있다. 특히 9월 강남 세곡동과 서초 우면동에 보금자리주택 2400가구가 사전예약 방식으로 공급될 예정이어서 판교 이후 마땅히 청약할 곳이 없었던 수요자들의 관심을 모으고 있다. 강남 세곡지구 보금자리주택의 경우 분당수서 간 고속화도로 수서IC 와 서울외곽순환도로 송파IC 분당내곡 간 고속화도 내곡IC 가 가깝고 지하철 3호선 수서역과 8호선 복정역 인근에 위치해 있어 교통여건이 우수하다. 또 대치동 학원가와도 인접해있는 데다 주변이 녹지와 산으로 둘러싸여 있어 교육·주거 여건도 괜찮다는 평이다. 9월 사전예약 방식으로 청약을 시작하며 일반분양 예정 물량은 1300가구 정도로 예상된다. 서초 우면지구 보금자리주택 역시 과천 우면산 간 고속화도로를 이용해 남쪽으로는 과천 안양 수원 등 수도권 남부지역 북측으로는 우면산터널을 통과해 고속터미널과 반포대교 북단의 도심 지역으로 이동이 쉽다. 2013년에는 강남순환 도시고속도로가 완공돼 서울 서부로 이동성도 증가될 전망이다. 주변에 강남역과 정자역을 잇는 신분당선 1단계 구간도 내년 완공을 앞두고 있다. 단지 남측과 우측에 각각 청계산과 양재천이 인접해 조망권이 우수한 편이다. 세곡지구와 마찬가지로 9월 사전예약 방식으로 공급되며 약 1100가구 정도가 일반에 선보일 것으로 예상된다. 경기 성남 판교신도시에는 대한주택공사가 짓는 연립주택이 10월쯤 분양될 예정이다. B5 1 B5 2 B5 3 등 3개블럭에서 총 300가구가 나오며 공급면적은 128 254㎡ 등 중·대형으로만 구성된다. 고려개발이 하반기 분양을 계획중인 경기 용인 성복동 아파트는 1314가구 1·2가구 가 공급될 예정이다. 공급면적은 113 320㎡의 중대형이다. 용인 서울 간 고속화도로 성복IC가 단지와 인접하고 신분당선 수지 연장사업 18㎞ 연장 과 성복역 가칭 을 통해 강남 접근성이 용이하다. 이밖에 롯데건설은 서초구 서초동 삼익 2차 아파트를 재건축해 10월 252가구 중 13가구를 일반 분양할 계획이다. 경기 용인시 흥덕지구에서는 모아건설의 타운하우스가 분양된다. 총 24가구로 공급면적은 380 400㎡다.,https://news.naver.com/main/read.nhn?mode=LSD&mid=shm&sid1=260&oid=003&aid=0002743222,181
142872,2009.06.24. 오후 6:45,부동산,머니투데이,에코메트로 특별공급분 경쟁률 최고 869대 1,머니투데이 김정태 기자 한화건설의 인천 소래논현지구 에코메트로 특별공급분이 최고 869대 1의 청약경쟁률을 기록하며 전 주택형을 마감했다. 23일과 24일 양일에 걸쳐 이뤄진 이번 특별공급은 인천 에코메트로 7BL 20가구 모집에 총 1만0667명이 접수해 평균 533대 1의 경쟁률을 보였다. 114.25㎡형 34A 타입 의 경우 5가구 모집에 4347명이 몰려 869대 1의 최고 경쟁률을 기록한 것을 비롯해 △114.28㎡형 34B 타입 568대 1 △113.61㎡형 34C 타입 464대 1 △114.18㎡형 34D 타입 232대 1을 기록했다. 이번 특별분양은 이주자 보상 대책용 잔여가구에 한해 실시됐다. 이번 공급분은 임의분양이 가능하나 입주자모집승인권자와 협의해 인터넷을 통해 공개모집했다. 당첨자 발표는 오는 26일 에코메트로 홈페이지 www.ecometro.co.kr 를 통해 확인할 수 있다. 계약 기간은 6월 30일부터 7월 1일까지 양일간 진행된다. 입주는 2010년 12월경에 이루어질 예정이다. 한화건설 관계자는 2년 전 분양 당시와 같은 분양가를 적용해 높은 경쟁률을 기록한 것 같다 면서 오는 7월 말 인천 에코메트로 1차 시범단지의 입주도 순조롭게 진행될 것으로 예상된다 고 말했다.,https://news.naver.com/main/read.nhn?mode=LSD&mid=shm&sid1=260&oid=008&aid=0002166755,181
142873,2009.06.24. 오후 6:34,부동산,이데일리,쌍용건설 남양주 택지 출자회사에 양도,이데일리 박성호기자 쌍용건설 012650 은 남양주 별내지구 택지를 SPC 특수목적법인 설립에 따라 출자회사인 정암에이치앤디에 양도하기로 했다고 24일 공시했다. 처분금액은 1358억원으로 자산총액 1조5037억원의 9% 정도다.,https://news.naver.com/main/read.nhn?mode=LSD&mid=shm&sid1=260&oid=018&aid=0002122838,181
142874,2009.06.24. 오후 6:08,부동산,매일경제,송도국제도시 2020년까지 공원 10배 늘린다,image0 바다를 메워 2020년까지 5 340만㎡ 규모의 거대한 도시로 조성되고 있는 인천경제자유구역 송도국제도시가 ‘공원의 천국’으로 만들어지고 있다. 1994년 매립공사를 시작해 최근 주요 시설이 속속 완공되면서 도시 모습을 갖춰가고 있는 송도국제도시는 2009년 현재 근린공원 8곳 어린이공원 9곳 등 146만㎡ 규모의 공원이 조성돼 있다. 특히 오는 7월말 송도국제도시의 핵심지구인 국제업무단지 내 약 40만㎡ 크기의 중앙공원이 완성된다. 첨단업무지구와 주거단지 한가운데 조성되는 중앙공원은 연장 1.8km 최대폭 110m 에 이르는 거대한 수로가 만들어진다. 인천 앞바다의 바닷물을 끌어오게 될 이 수로는 타 공원의 소규모 조경용 수로와는 달리 수로 내 수상택시를 운영할 계획이어서 실질적인 교통수단도 갖고 관광코스로도 이용될 예정이다. 인천경제자유구역청은 2020년 송도국제도시 개발사업이 완료될 때까지 현재 146만㎡보다 약 10배 가량 많은 총 1401만㎡의 공원을 조성할 계획이다. 공원뿐만 아니라 현재 송도국제도시 내 약 24만㎡ 조성돼 있는 녹지도 197만㎡로 늘어난다. 광장 보행자도로 녹지까지 포함한다면 녹지율이 32.2%에 이르며 이는 분당 19.4% 일산 23.5% 동탄 24.3%보다 월등히 높아지게 된다. 송도국제업무단지 개발을 맡고 있는 송도국제도시유한개발회사 NSIC 관계자는 “최근 인천시가 실시한 ‘2025년 인천도시기본계획 수립을 위한 시민의식조사’에서 인천시민들이 가장 거주하고 싶은 지역으로 송도국제도시가 선정됐다”면서 “중앙공원이 완성되고 앞으로 더 많은 녹지가 개발되면 송도국제도시는 곧 우리나라를 대표하는 녹색도시가 될 수 있을 것”이라고 밝혔다.,https://news.naver.com/main/read.nhn?mode=LSD&mid=shm&sid1=260&oid=009&aid=0002122291,181
142875,2009.06.24. 오후 5:57,부동산,서울경제,강남 재건축값 숨고르기,오를만큼 올랐다 이달초보다 호가 최고 5 000만원 내려 “지난주부터 거래가 뚝 끊겼습니다.” 서울 강남구 대치동 신대치공인 관계자 거침없는 상승행진을 벌이던 서울 강남 재건축아파트 가격이 숨고르기에 들어갔다. 꾸준히 이뤄지던 매매가 뚝 끊기면서 매도호가도 이달 초에 비해 3 000만 5 000만원씩 하락했다. 집값이 전고점을 회복하면서 추가 상승이 어렵다는 인식이 확산되고 있는데다 정부가 집값 안정을 위해 담보인정비율 LTV 과 총부채상환비율 DTI 강화를 검토하고 있다는 신호를 잇따라 보내면서 투자심리가 한풀 꺾인 것으로 풀이된다. 24일 부동산업계에 따르면 한강 르네상스 계획과 제2롯데월드 신축 등의 호재로 올 들어 집값이 급등한 송파구 잠실주공5단지의 호가는 최근 5 000만원가량 하락했다. 이달 들어 최고 13억원에 거래가 이뤄졌던 112㎡형은 최근 12억5 000만원에 매물이 나왔고 14억원선에서 매도호가가 유지되던 115㎡형 역시 5 000만원 내린 13억5 000만원에 나와 있다. 실거래 건수도 크게 줄었다. 송파구청에 따르면 잠실주공5단지 112㎡형의 경우 지난 5월에만도 12건이 거래됐지만 6월 들어 현재까지 6건으로 줄었다. 그나마 이달 중순 이후로는 거래가 거의 이뤄지지 않는다는 게 현지 공인중개업소의 설명이다. 인근 송파공인의 최명섭 사장은 “매도자와 매수자 모두 집값이 오를 만큼 올랐다는 생각을 가진 것으로 보인다”며 “최근에는 집값이 조금씩 내려가는 추세”라고 전했다. 주로 저층단지로 이뤄져 사업성 및 진행속도가 양호한 편에 속하는 강남구 개포동 주공아파트의 매도호가도 하락하고 있다. 개포주공1단지 49㎡형은 이달 들어 평균 10억원선에서 거래가 이뤄졌으나 최근 거래가 실종되면서 2 000만 3 000만원가량 호가가 내렸다. 일부 급매물은 9억5 000만원 아래에서 나오기도 한다. 인근 제일공인의 한 관계자는 “매도자와 매수자의 호가 차이가 1억원 이상 크게 벌어졌다”며 “매물 자체도 적어 거래가 끊겼다”고 말했다. 2004년 재건축조합이 설립된 개포주공1단지는 투기지역에서 해제되지 않는 한 조합원 지위 양도가 불가능해 2004년 이후 이 아파트를 구입한 투자자는 되팔 수 없다는 설명이다. 강남재건축의 바로미터인 강남구 대치동 은마아파트 가격도 최근 거래가 주춤하면서 하락하고 있다. 9억6 000만원에 거래가 이뤄지던 102㎡형은 9억3 000만원선에서 급매물이 나왔고 12억2 000만 12억3 000만원선에 매매되던 112㎡형은 12억원 아래로 매도호가가 떨어졌다. 익명을 요구한 현지의 한 공인중개소 관계자는 “강남 집값이 과열이라고 하나 지금은 매도ㆍ매수자 간 균형점을 찾아가는 상황”이라며 “정부가 집값을 잡기 위해 규제책을 빼들면 시장이 급격히 위축될 수도 있다”고 우려했다.,https://news.naver.com/main/read.nhn?mode=LSD&mid=shm&sid1=260&oid=011&aid=0002013134,181
142876,2009.06.24. 오후 5:48,부동산,세계일보,분양 정보 ‘김포신안실크밸리’ 1074가구 외,‘ 김포신안실크밸리’ 1074가구 신안건설산업은 김포시 감정동에서 ‘김포신안실크밸리’ 조감도 를 공급할 예정이다. 공급면적 113 202㎡ 총 1074가구 규모로 가구별로는 84Am2 375가구 84Bm2 401가구 118m2 242가구 153m2 56가구다. 김포신안실크밸리는 기존 48번 국도와 2013년 개통 예정인 김포경전철 현재 공사 중인 김포고속화도로 등과 가깝다. 교통망을 통해 인천과 일산으로 접근이 가능해 교통이 편리한 편이다. 사업지 인근에는 감정초등학교와 홈플러스가 위치한다. 단지 내 근린공원 및 감정동 근린공원 걸포중앙공원도 이용할 수 있다. 1577 0034. ‘청라 롯데캐슬 오피스텔’ 498실 롯데건설은 오는 30일 인천 청라지구 중심 상업지역에 ‘청라 롯데캐슬 오피스텔’ 조감도 498실을 분양한다. 청라 롯데캐슬 오피스텔은 지하 2 지상 50층 규모로 공급면적 기준 82㎡ 180실 119㎡ 88실 143㎡ 96실 150㎡ 46실 162㎡ 88실 등 총 498실로 구성됐다. 건폐율은 26.73%로 매우 낮고 전용률 또한 71.3%대로 기존 주상복합 오피스텔과 비교해 넓은 구조를 자랑한다. 분양가는 계약면적 기준 3.3㎡당 평균 700만원선이며 계약금 5%에 중도금 60% 전액 무이자 82㎡ 이자후불제 혜택이 주어진다. 또 시스템 에어컨 및 일부 주방가전이 무상제공된다. 입주는 2013년 2월 예정이다. 032 427 7171. Segye.com 인기뉴스 아웃사이더 잡는다…얼짱 랩퍼 이비아 대한늬우스 15년만에 부활 가수 이소은 美 로스쿨 네 군데 합격 존엄사 시행 김 할머니가 흘린 눈물의 의미는 5만원권 벌어짐 현상… 공정상 오류 아니다 맨유 공식 잡지 박지성은 한국에서 베컴 ⓒ 세계일보 Segye.com 무단 전재 및 재배포 금지 ☞공짜로 연극ㆍ뮤지컬보기 ☞세계일보 지면보기 세계닷컴은 한국온라인신문협회 www.kona.or.kr 의 디지털뉴스이용규칙에 따른 저작권을 행사합니다.,https://news.naver.com/main/read.nhn?mode=LSD&mid=shm&sid1=260&oid=022&aid=0002054082,181
