,date,cat,co,headline,text,url,week
51321,2007.05.03. 오후 5:27,부동산,서울경제,모델하우스 탐방 천안 용곡·다가·성정동 신일 해피트리,전평형 주방공간 극대화…他아파트보다 1.5배 넓어 ㈜신일이 천안에서 분양예정인 ‘해피트리’는 주방공간을 근대화한 점이 돋보인다. 천안 성정동 KT G 사옥 옆에 위치한 ‘신일 해피트리’의 동시분양 모델하우스에 들어서면 그 규모에 시선이 끌린다. 일반적인 모델하우스가 2 3층 규모인데 반해 이 모델하우스는 5층이나 된다. 용곡동ㆍ다가동ㆍ성정동 등 3개 사업장의 견본이 함께 설치돼 있어 그만큼 넓은 내부공간이 필요한 것. 외관 또한 웅장한 원형기둥 등을 적용해 고대 유럽의 신전 같은 분위기가 연출되고 내부엔 이례적으로 엘리베이터와 에스컬레이터까지 설치돼 있다. 1층은 방문객을 위한 카페테리아 및 휴식공간으로 꾸며졌고 2 5층은 층마다 각 사업장의 모델하우스가 들어서 있다. 3개 사업장 분양물량은 ▦용곡동 34 47평형 295가구 ▦다가동 34 49평형 438가구 ▦성정동 33 48평형 293가구 등 총 1 026가구다. 천안 해피트리 전 사업장 모든 평형에 고루 적용된 가장 큰 특징은 주방공간을 극대화했다는 점이다. 주방쪽 발코니 확장을 기본형으로 주방 가구를 배치 주방공간이 기존 아파트에 비해 1.5배 정도 넓다는 게 회사측 설명. 또 거실폭도 평형별로 30cm정도 넓다. 주방엔 최근 트렌드인 대면형 주방이 적용됐다. 평형별로 모던ㆍ클래식ㆍ오리엔탈 인테리어 컨셉이 고루 적용됐다. ‘모던’은 개방감을 높인 게 가장 큰 특징이다. 성정동 34평형의 경우 전체적으로 기본형인 베이직 톤에 그린색을 포인트색으로 단조로움울 피했다. 예컨데 현관 전면 아트월에 그린색 포인트 타일을 적용해 밋밋한 공간에 생동감을 살렸다. 비교적 나이 드신 고객을 타깃으로 꾸며진 ‘오리엔탈’ 컨셉은 편안한 분위기를 연출하는 게 핵심이다. 다가동 49평형b 타입의 경우 거실 아트월에 간접 조명을 설치해 거실 조명이 전체적으로 은은하다. 또 아트월 아랫 부분엔 빛이 퍼져보일 수 있도록 동양적인 문양의 포인트 타일을 적용했다. 용곡동 47평형은 ‘노블 클래식’컨셉이 적용됐다. 전체적으로 어두운 갈색톤을 적용해 차분한 느낌이 나는 게 가장 큰 특징. 마루 또한 짙은 밤색의 월넛톤 온돌마루가 설치됐다. 여기에 구석구석 샴페인골드 색상의 포인트 벽지를 사용해 절제되면서도 클래식한 분위기가 난다. 성정동은 현재 분양중이고 용곡동의 경우 5일부터 순위별로 청약신청서를 받는다. 다가동은 조만간 분양할 예정이다. 분양가는 평당 평균 750만원 선으로 천안시가 제시한 분양가가이드라인에 부합한다. 그러면서도 광파 오븐ㆍ음식쓰레기 건조기ㆍ과일ㆍ야채 세척기ㆍ전기쿡탑ㆍ콤비형 냉장고 등 거의 모든 가전과 가구가 기본형으로 제공된다.,https://news.naver.com/main/read.nhn?mode=LSD&mid=shm&sid1=260&oid=011&aid=0000180984,69
51322,2007.05.03. 오후 5:18,부동산,한국경제TV,강남 3구 공시총액 전국 16%,서울 강남과 서초 송파 등 강남 3구 공동주택 공시가격을 합한 금액은 206조원으로 전국 공시가격 총액의 16%에 이르는 것으로 나타났습니다. 건설교통부에 따르면 강남 3구 소재 아파트와 연립주택 등 공동주택수는 국내 전체 공동주택의 4%에 불과하지만 강남 3구의 공시가격이 급등하면서 지난해 보다 비중이 오히려 커졌습니다.,https://news.naver.com/main/read.nhn?mode=LSD&mid=shm&sid1=260&oid=004&aid=0000088049,69
51323,2007.05.03. 오후 5:18,부동산,서울경제,분양정보 대우자판 여주 현암 586가구,대우자동차판매㈜ 건설부문이 경기도 여주군 여주읍 현암리 위치한 ‘iaan 이안 여주강변’ 586가구를 분양한다. 지하 1층 지상 25층 7개 동 규모로 ▦33평형 387가구 ▦34평 99가구 ▦50평형 100가구 등으로 구성되는 여주 최대 규모의 아파트 단지이다. 오는 2011년 여주 분당간 복선전철이 개통되면 분당까지 40분 서울까지는 1시간 이내에 접근이 가능할 전망이다. 2013년 성남 여주 원주를 잇는 제2영동고속도로 2009년 서울 여주간 중부내륙고속도로도 뚫릴 예정이라 수도권으로의 접근성이 크게 향상될 전망이다. 남한강의 남향 조망권이 가능하고 100m 이내에 남한강 공원화 조성사업이 이뤄질 계획이라 쾌적한 생활환경이 기대된다. 하나로마트와 AMC할인마트ㆍ농협 등의 생활편익시설이 가깝고 신세계첼시 명품 아웃렛과 이마트도 인근에 개장할 예정이다. 수도권임에도 분양권 전매가 가능한 것이 장점이다. 모델하우스는 여주 시외버스터미널 인근에 위치하며 11일 개관할 예정이다.,https://news.naver.com/main/read.nhn?mode=LSD&mid=shm&sid1=260&oid=011&aid=0000180968,69
51324,2007.05.03. 오후 5:18,부동산,서울경제,길음에 100m 높이 주상복합 들어선다,서울시 도시건축공동위 허용…다동 7·8지구 업무용 빌딩도 서울 성북구 길음 도시환경정비구역에 100ｍ 높이의 주상복합 아파트와 업무ㆍ판매시설이 들어선다. 서울시는 2일 제9차 도시건축공동위원회를 열고 길음동 524번지 일대 2만8 178㎡ 8 524평 규모의 길음 도시환경정비구역 도심재개발구역 에 주상복합 3개 동과 업무ㆍ판매시설 1개 동 조감도 을 짓도록 허용했다고 3일 발표했다. 이들 건물 4개 동은 용적률 400% 이하 최고 높이 100ｍ 이하 규모로 건립된다. 주상복합에는 25 46평형 464가구가 들어선다. 공동위는 또 중구 다동 156번지 일대 다동 도시환경정비구역 제7지구 2 851㎡ 846평 를 8지구와 통합한 뒤 용적률 1 000%이하 높이 99.8ｍ 이하 범위에서 업무용 빌딩 1개 동을 짓도록 했다. 이에 따라 이곳에는 지하 6층 지상 23층에 연면적 8 462평 규모의 업무ㆍ판매ㆍ근린생활시설이 지어진다. 공동위는 중랑구 면목동 1447번지 일대 면목2주택재건축구역 1만6 628㎡ 5 030평 을 정비구역으로 지정하고 구역 내 1종 및 2종 일반주거지역 7층 을 모두 2종 주거지역 12층 으로 상향 조정했다. 면목2구역에는 용적률 214% 높이 43ｍ 평균 12층ㆍ최고 15층 이하 아파트가 들어선다. 이날 공동위는 이미 도시환경정비사업으로 정비됐으나 20년이 경과한 지구에 건축물을 새로 지을 때 적용될 처리 기준을 확정했다. 이에 따르면 앞으로 이들 지역은 신축해서 연면적이 증가하는 만큼 도로ㆍ공원 등 기반시설을 추가로 부담하거나 문화ㆍ복지시설 및 각종 공공시설을 지어 기부채납해야 한다. 신축 허용대상은 ▦안전진단 D급 이하 또는 C급이면서 유지ㆍ관리상 문제가 있는 건물 ▦리모델링에 한계가 있는 건물 ▦토지 이용ㆍ스카이라인ㆍ외부 공간 등 주위환경과 조화를 이루지 못한다고 판단되는 건물 등이다.,https://news.naver.com/main/read.nhn?mode=LSD&mid=shm&sid1=260&oid=011&aid=0000180966,69
51325,2007.05.03. 오후 5:18,부동산,서울경제,수도권 국민임대 물량 풍성,주공·SH공사 고양 행신2등 23곳서 올 2만가구 공급 무주택 서민들이 인근 시세보다 싼 임대료로 거주할 수 있는 국민임대 아파트가 올해 수도권에서만 2만여가구 공급된다. 3일 부동산 정보제공업체인 닥터아파트에 따르면 올해 대한주택공사와 서울시 SH공사가 수도권에서 공급할 예정인 국민임대 아파트는 모두 23곳 2만467가구로 조사됐다. 주택공사 국민임대는 경기 고양시 행신2 성남 도촌 파주 운정 하남 풍산 화성 동탄 및 향남 인천 논현2 등 7개 지구에서 15개 단지 1만7 440가구 SH공사 국민임대는 서울 발산 장지 상암 등 3개 지구와 은평뉴타운에서 5개 단지 3 027가구가 나온다. 특히 은평뉴타운과 동탄신도시ㆍ도촌지구 등 인기지역 물량이 많을 뿐만 아니라 1 000가구 이상 대규모 단지가 대거 공급된다. 국민임대는 주택공사 또는 지방공사가 공급하는 주택으로 분양으로 전환되지 않고 임대로만 거주할 수 있다. 보통 임대기간은 2년으로 갱신이 가능하며 임대료는 인근 시세보다 저렴하다. 다만 입주자격이 까다롭다. 일단 소득 수준이 전년도 도시근로자 가구당 월평균소득의 70%를 넘지 않는 무주택자여야 한다. 지난해 기준으로 월 평균소득이 241만370원 이하면 입주자로 선정될 수 있다. 특히 전용 50㎡ 미만 주택의 경우 도시근로자 가구당 월평균소득의 50% 이하 소득자에겐 우선 입주권이 주어진다. 또 토지와 자동차 등 자산이 일정한 기준을 넘어서도 안된다. 토지는 개별공시지가 5 000만원 자동차는 취득가액에서 매년 10%씩 감가상각한 금액이 2 200만원을 넘지 않아야 한다. 이와 함께 전용 50㎡ 미만은 청약저축통장이 필요 없지만 전용 50㎡ 이상에서 60㎡ 이하와 전용 60㎡ 초과 평형에 입주신청하려면 청약저축통장을 보유해야 한다.,https://news.naver.com/main/read.nhn?mode=LSD&mid=shm&sid1=260&oid=011&aid=0000180964,69
51326,2007.05.03. 오후 5:18,부동산,서울경제,신성건설 두바이에 오피스빌딩 짓는다,24·33층 신성타워 2동 연내 착공 계획 신성건설이 두바이 중심지에 연면적 2만평 규모의 상업 및 오피스건물을 짓는다. 신성건설은 3일 서울 논현동 임페리얼팰리스호텔에서 ‘두바이 신성타워 개발사업 투자설명회’를 열고 두바이 비즈니스베이 중심에 짓는 오피스빌딩의 분양 계획을 소개했다. 이로써 신성건설은 지난해 두바이에 진출한 반도건설과 성원건설에 이어 현지에 프로젝트를 수행하는 세번째 국내 업체가 됐다. 신성건설은 올해 두바이 신성타워 착공을 목표로 이미 현지법인을 설립했다. 두바이 신성타워는 업무 및 상업시설을 갖춘 두개 빌딩으로 들어선다. 에스타워1 S Tower 1 은 연면적 1만2 440평 41 120㎡ 지하 4층 지상 33층 에스타워2는 연면적 7 116평 23 525㎡ 지하 2층 지상 24층으로 각각 지어질 예정이다. . 신성건설의 한 관계자는 “중동의 허브로 불리는 두바이는 최근 국제무역의 중심지로 떠오르고 있어 매년 오피스와 상가 임대료가 지속적으로 상승하고 있다”며 “이에 따라 국내 건설업체의 진출이 활발하게 진행돼 신성건설 외에도 현진을 비롯한 국내업체도 현지 사업을 물색 중”이라고 밝혔다.,https://news.naver.com/main/read.nhn?mode=LSD&mid=shm&sid1=260&oid=011&aid=0000180963,69
51327,2007.05.03. 오후 5:12,부동산,서울경제,용인 아파트 작년말 매입자들 속터져,올들어 최고 2억원까지 급락 동천등 30평대도 3 000만 5 000만원 하락 매수자들 추가하락 기대에 급매물 조차 외면 전문가 내달 신도시 발표때까진 조정 지속 지난해 상종가를 연달아 치던 용인 일대 아파트를 매입했던 사람들의 속앓이가 깊어지고 있다. 판교신도시 분양을 앞뒤로 무섭게 상승했던 지난해와 달리 올해는 연초 대비 적게는 3 000만 5 000만원 많게는 1억 2억원씩 가격이 빠졌기 때문이다. 여기에 올해 초 예상과 달리 삼성건설ㆍGS건설 등 대형사의 대규모 아파트의 분양일정이 지연되면서 신규공급으로 이 지역 집값이 다시 한번 탄력을 받을 것이란 기대도 불투명한 상태다. 3일 현지 중개업소들에 따르면 지난해 하반기 집값이 급등할 당시 추가상승을 예상하며 용인 지역 아파트를 매입했던 사람들의 불안감이 높아지고 있다. 용인 수지구청이 집계한 주택거래허가건수를 보면 지난해 11월 1 076건까지 치솟았던 거래량은 지난 3월 74건까지 급감했다가 4월 들어 급매물을 중심으로 거래가 이뤄지면서 121건으로 소폭 늘었다. 성복ㆍ신봉동 일대 중대형 아파트는 가격이 1억 2억원씩 떨어진 매물이 나와 있지만 쳐다보는 매수자가 없다. 성복동 LG빌리지 6차의 경우 지난해 8억7 000만원까지 거래됐던 51평형이 현재 1억2 000만원 떨어진 7억5 000만원이지만 하락압력이 여전히 높다. 신봉동 LG자이1차는 지난해 7억8 000만원에 거래됐던 43평형이 최근에는 급매물이 6억원대에 팔리면서 7억원선까지 내려앉았다. 이 지역 A공인 관계자는 “일부 급한 매도자들은 3년 보유조건을 채운 터라 그나마 집을 팔지만 지난해에야 집을 샀던 주민들은 떨어지는 것을 보면서 많이 속상해 한다”며 “매수자들은 가격이 더 떨어질 것으로 예상하고 아예 기다리는 분위기”라고 말했다. 삼성건설의 동천동 래미안타운의 수혜를 기대하는 동천동 일대도 지난해 말부터 힘이 빠진 분위기다. 동천동 동문그린 37평형의 경우 5억2 000만 5억6 000만원을 부르던 가격이 현재 3 000만 4 000만원 빠진 상태. 써니밸리 33평형도 지난해 5억9 000만원을 찍은 후 현재는 5 000만원 떨어진 5억4 000만 5억5 000만원이다. 동천동 B공인 관계자는 “가격이 계속 빠지니까 꽉 차게 대출을 받아서 아파트를 산 사람들은 속이 시커멓게 탄다”며 “삼성래미안 하나만 바라보고 있을 뿐”이라고 전했다. 전문가들은 이 같은 조정장세가 6월 강남 대체 신도시가 발표될 때까지 지속될 것으로 보고 있다. 김영진 내집마련정보사 사장은 “신도시 발표와 함께 강남ㆍ분당ㆍ용인 일대 내림세가 멈출 것”이라며 “1억 2억원씩 싸게 나온 급매물이라면 지금 잡아도 손해보진 않는다”고 말했다.,https://news.naver.com/main/read.nhn?mode=LSD&mid=shm&sid1=260&oid=011&aid=0000180962,69
51328,2007.05.03. 오후 4:38,부동산,매일경제,이자부담 고려하고 수도권 미분양 노려라,집 언제 사야하나 전문가 긴급 좌담회 －실수요자가 가장 궁금해 하는 것은 매수 시점이다. 적절한 매수 시점은. 김 대표＝업체들이 분양가 상한제를 피하기 위해 제도가 실시되는 9월 이전에 공급을 서두를 것이다. 하지만 분양가 상한제가 실시되더라도 분양가 하락 효과는 제한적일 것이다. 서울ㆍ수도권은 택지비가 분양가에서 50 60%를 차지하고 있다. 땅값이 안 떨어진다면 분양가를 낮추는 데 한계가 있다. 30% 정도를 차지하는 건축비를 줄이면 주택의 질적 수준이 떨어지게 된다. 지금은 32평형 아파트도 4베이가 나오지만 분양가 상한제가 실시되면 2베이ㆍ3베이로 되돌아갈 수 있다. 결론적으로 공급과 정부 정책이 맞닥뜨리는 연말을 매입 시점으로 잡을 만하다. 차 부장＝동감이다. 선호 지역의 급매물을 눈여겨 봐 두다 연말쯤 내집 마련을 시도해 보는 것도 괜찮을 것이다. 다만 집을 사기 전에 금융 여건과 이자부담을 반드시 고려해야 한다. 덜컥 계약부터 했다가 나중에 어려움을 겪는 사례가 많다. 대선 정책 공약과 활황세를 보이고 있는 주식시장 상황 시중 단기 부동자금의 향배도 살펴봐야 한다. 김 소장＝연말쯤 선택해도 시기적으로 늦지 않을 것이다. 내년에는 공급량이 적지만 수요도 위축돼가는 상황이기 때문이다. 집값이 떨어질 줄 알고 집을 사는 사람이 없다. 지금은 실수요 관점에서 봐야 한다. 최우선적인 기준은 이자 감당 능력이다. 무리하게 대출을 받아 집을 산 후 2 3년만 참아야지 라는 생각으로 접근하면 위험한 투자가 될 수 있다. 경험상 집값 하락 안정기에는 미분양이 많이 나온다. 서울에서 30 40㎞ 범위에서 미분양이 많아질 수 있다. 미분양을 선택하면 혜택이 많다. 청약통장을 사용하지 않고도 품질 면에서 괜찮은 아파트를 잡을 수 있다. －은마아파트 34평형이 10억원에 거래됐다고 한다. 저점 근처에 왔다고 봐야 하나. 김 소장＝10억원 수준에서는 매수세가 살아 있다는 얘기다. 최고점에 비하면 30% 정도 떨어진 것이다. 개별 단지 차원에서는 저점 근처라고 봐도 될 것 같다. 하지만 하반기중에 한 번쯤은 낙폭이 쉬어갈 것으로 보인다. 보유세 부과 기준일 6월 1일 이 지나면 하락 폭이 다소 꺾이면서 약보합세가 연말까지 이어질 가능성이 있다. 추가 매수세가 안 붙는다면 내년 이후 집값이 더 내릴 수도 있을 것이다. 물론 변수는 많이 남아 있다. 올해 풀리는 보상금만 해도 20조원에 달한다. 차 부장＝집을 안 사고 전세로 많이 돌아섰다. 전세금은 실질적으로 오르고 있다. 가격이 많이 떨어졌다는 것은 급매물 위주로 거래됐기 때문이다. 급매물 실거래가가 시세로 굳어지면서 폭락이라는 얘기가 나왔다. 통계적으로는 그렇게 많이 떨어지지 않았다. 2분기까지는 보유세 부담 때문에 1년 조건부 처분 대출 때문에 매물이 많이 나올 것이다. 청약시장에서는 분양가 상한제와 관련해서 가점제 혜택 보지 못하는 사람들이 소형평형에 몰릴 수 있다. 김 대표＝주택법 개정 대출규제 등으로 주택 공급이 줄어들 것이다. 연말께 새 정부의 대선정책 윤곽이 나타나고 내년 중ㆍ후반기에 전체적인 정책 변수가 확정될 것이다. 문제는 서울ㆍ수도권인데 분양가 상한제가 실시되는 9월 이전에 물량을 내놓은 후 나머지 물량은 이월될 것이다. 가격의 급격한 상승은 없더라도 현 수준은 유지할 수 있다. 민간 부문의 주택 공급이 줄어드는 부분을 공공 부문이 책임지도록 하겠다는 게 정부 방침이다. 과연 그렇게 되고 있는지에 대해서는 의문이다.,https://news.naver.com/main/read.nhn?mode=LSD&mid=shm&sid1=260&oid=009&aid=0000584657,69
51329,2007.05.03. 오후 4:38,부동산,매일경제,아파트값 하락세 연말까지 이어질듯,집 언제 사야하나 전문가 긴급 좌담회 서울지역 일부 아파트 단지의 가격이 급락하면서 집값이 대세 하락기에 진입했다 는 진단이 잇따르고 있다. 이용섭 건설교통부 장관은 지난 2일 강남 불패신화는 이제 끝났다 며 앞으로 집값 하락은 지속될 것 이라고 장담했다. 박현주 미래에셋 회장도 같은 날 주택시장은 긴 가격 하락의 터널을 지날 것 이라고 밝혀 관심을 끌었다. 그렇다면 집값은 언제까지 얼마나 떨어질까. 매일경제신문은 주택전문가 긴급 좌담회를 열어 최근 주택시장 동향과 집값 전망을 점검했다. 전문가들은 올 하반기까지는 약보합세가 지속될 가능성이 높다 면서도 대통령 선거 등 변수가 남아 있는 만큼 대세 하락이라고 단정하기는 곤란하다 고 조심스러운 의견을 밝혔다. 하지만 모두 주택 실수요자라면 연말을 주목하라 고 충고했다. －정부가 집값이 하락 안정세로 접어들었다 며 자신감을 보이고 있는데. 김선덕 소장＝올 들어 도입된 두 가지 대책이 주택시장 흐름을 바꿨다. 첫째는 주택법 통과로 실시가 확정된 분양가 상한제고 둘째가 총부채상환비율 DTI 규제 강화다. 지난 2 4월 집값 하락 폭이 심상치 않다. 하락세가 확산되어 가는 단계인 것은 맞는 것 같다. 이런 추세가 가을 이후까지 연장될 가능성이 있다. 지금까지 과도하게 수요자 선호가 높았던 지역이 빠지는 것 같다. 거품 붕괴 대세 하락으로 보기는 어렵다. 서울 강북 뉴타운과 용산 지역 인천 일부 지역은 집값이 오르고 있다. 차형근 부장＝공시가격이 급등했기 때문에 주택 보유자뿐만 아니라 수요자도 종합부동산세에 큰 부담을 느끼고 있다. 특히 1인 1건 대출 과 처분 조건부 대출 상환 은 금융권의 화두다. 집이 안 팔려 어려움을 겪고 있는 사람들이 적지 않다. 집값 약보합세가 지속될수 있다고 본다. 그러나 매물이 늘어나면서 집값이 폭락할지에 대해서는 의문이다. 강남지역 다주택 보유자에 대한 설문 결과를 보면 집을 처분하지 않겠다는 응답이 많았다. 장기투자 양도세 부담 매도가격 불만족 때문에 처분하느니 보유하겠다는 비율이 압도적이었다. －정부 정책의 변화를 기다리며 버티는 주택 소유자들이 많은데. 박재룡 수석연구원＝연말 이전에 정부 정책이 바뀔 가능성은 거의 없다고 본다. 집값 추이도 연말까지 지금 기조를 벗어날 가능성은 거의 없다. 대통령 선거 라는 변수가 있지만 참여정부 부동산 정책이 대부분 법제화됐기 때문에 정책 변경이 쉽지 않다. 새 정권이 부동산 정책을 바꾸겠다는 마인드를 갖고 있어야 하고 국민 여론이 정책 변경의 명분을 인정해줘야 한다. 다만 최근 집값 하락세가 정상적인 것이냐에 대해서는 논의가 필요하다. 시장 기능이 제대로 작동하지 못하는 불안한 상황이다. 김철수 대표＝분양가 상한제 분양원가 공개 DTI 적용 등에 따라 집값이 하락하고 있다. 하지만 수급 불균형 문제가 근본적으로 해소된 것은 아니다. 인구구조와 소득 증가 서울ㆍ수도권 주택 수요 등을 감안하면 오는 2015년까지 안정적인 집값 상승세가 이어질 가능성이 높다. 더군다나 부동산 투자를 대체할 수 있는 투자 수단이 없는 상태다. －재건축 문제는 어떻게 풀어야 하나. 차 부장＝이른바 버블세븐 지역의 재건축 아파트는 단기적으로 많이 올랐다. 단기적인 조정은 당연하다. 재건축 수익률이 많이 떨어졌기 때문에 추진하기도 어려워진다. 문제는 강남 고급 주택 수요를 채울 방법이 없다는 점이다. 시장 불안 요인이다. 김 대표＝90년대만 해도 서울 인구가 분당ㆍ일산ㆍ평촌으로 갔지만 지금은 안 간다. 인구 전ㆍ출입을 분석해 보면 지금은 서울 바깥으로 나가려는 인구가 많지 않다. 앞으로는 계층별로 주택이 공급되어야 한다. 어차피 강남ㆍ용산은 서민들이 살기에는 너무 비싼 지역이 됐다. 박 연구원＝재건축의 주택 공급 순증효과가 적은 것은 사실이다. 하지만 인식의 전환이 필요하다. 소형평형 의무비율을 맞추려고 10평형짜리 네 채를 짓는 것보다 40평형 한 채를 짓는 게 더 효과적일 수 있다. 시장에서 원하는 주택을 공급하는 게 중요하다. 현행 재건축 억제정책이 지속된다면 재건축 대상 주택이 슬럼화할 수도 있다. 그때는 정부가 재건축을 유도하기 위해 보조금을 줘야 할지도 모른다. －대출 규제와 금리 인상이 향후 집값에 미칠 영향은. 차 부장＝올해 만기가 돌아오는 주택담보대출이 52조원이다. 전체에서 24%에 달한다. 대출을 연장할 때는 DTI를 적용해야 하기 때문에 소득이 적은 사람은 일부를 상환해야만 한다. 시장에 관망세가 확산되면서 집이 팔리지 않기 때문에 처분 조건부 대출이 큰 문제가 될 것이다. 은행에 따라 금리 적용 방식을 전환할 수 있는 제도가 있다. 지금은 금리 상승기인 만큼 고정금리로 갈아타고 일정 기간 후 변동금리로 전환하는 방법도 적극 검토해야 한다. 박 연구원＝이론상 금리는 경제성장률에 물가상승률을 합친 것이다. 대출자는 경제가 좋아지면서 금리가 낮아지길 바라지만 불가능하다. 새 정부도 DTI 규제의 큰 틀은 유지하는 게 바람직하다. 금리 변동에 취약한 한계 대출자 를 양산하면 곤란하다.,https://news.naver.com/main/read.nhn?mode=LSD&mid=shm&sid1=260&oid=009&aid=0000584656,69
