,date,cat,co,headline,text,url,week
58526,2007.07.09. 오전 8:40,부동산,이데일리,유진그룹 컨소시엄，2기 로또 사업자 응찰,이데일리 윤진섭기자 유진그룹은 지난 6일 조달청이 주관한 제2기 로또 수탁사업자 선정 입찰에 유진기업과 LG CNS 농협 KTeMS 상품기획 및 사업운영 엔젤로또 그리스 복권솔루션 전문업체인 인트라롯사와 컨소시엄을 구성해 사업 제안서를 제출했다고 9일 밝혔다. 컨소시엄 이름은 ‘㈜나눔로또컨소시엄’으로 복권업무의 핵심 역량이라 할 수 있는 시스템 은행 복권업무 분야 전문회사가 각각 10% 이상 지분을 보유해 책임경영이 가능한 것이 최대 장점이라고 유진측은 설명했다.,https://news.naver.com/main/read.nhn?mode=LSD&mid=shm&sid1=260&oid=018&aid=0000499130,79
58527,2007.07.09. 오전 8:39,부동산,SBS,부동산따라잡기 철도 뚫리면 집값도 뛰려나,서울시가 오는 2017년까지 건설하겠다고 발표한 7개의 경전철 노선입니다. 이번에 확정된 경전철 노선들은 그동안 교통은 물론 집값 면에서도 소외됐던 지역을 관통할 예정이어서 향후 수혜지역들의 집값 상승 여부에 관심이 집중되고 있습니다. 이번에 확정된 경전철 노선은 주로 서울 서남부와 동북부 지역. 이들 지역은 그동안 대중교통이 불편해 집값이 상대적으로 낮았습니다. 그러나 경전철이 개통되면 집값을 끌어올릴 것으로 예상됩니다. 길진홍 부동산뱅크 팀장 지역에 주거수요에 비해서 턱없이 전철 노선이 모자란 이런 상황이기 때문에 경전철 노선이 이들 지역을 잇게 된다면 주변 아파트 위주로 상당한 가격상승이 있을 것으로 예측이 되고. 가장 수혜를 볼 것으로 기대되는 곳은 서남부 지역 일대. 여의도에서 신림을 잇는 신림선은 뉴타운 호재와의 상승 작용으로 재개발 아파트들의 가격 상승이 점쳐집니다. 또 당산동에서 신월동을 연결하는 목동선의 경우 기존 지하철의 사각지대였다는 점과 9호선 개통까지 겹쳐 최대 수혜지가 될 전망입니다. 함영진 부동산써브 실장 신림선이라든가 서부선이든가 목동선 같은 경우는 기존에 뉴타운 사업이라든가 재정비 촉진사업과 연결되면서 더 시너지 효과를 발휘할 것으로 보여지고요 지하철 교통이 좀 떨어져서 가격이 저평가 되어있는 단지들이 많았는데 그런 것들이 착공 시점과 맞물리게 되면 가격 상승에 탄력을 받으리라고 생각됩니다. 경전철 노선 주변 부동산 시장은 아직은 비교적 차분한 모습입니다. 경전철이 완공되기까지는 꽤 많은 시간이 남아있기 때문입니다. 인근 공인중개업소 조금 좋아지겠죠. 근데 이게 전부터 소문이 나가지고 그런 것들이 많이 반영이 됐을거예요. 그리고 좀 상당히 아직도 남았으니까. 경전철 건설계획 노선 주변의 올해 하반기 분양 예정인 아파트는 총 2 700여 가구. 그러나 경전철 개발계획이 아직 최종 승인이 남아있고 개통까지는 앞으로 십 여 년 이상의 시간이 남아있는 만큼 단기적인 투자보다는 실수요적 측면에서의 중장기적인 접근이 필요합니다. 함영진 부동산써브 실장 건교부에 최종 승인을 받고 착공까지는 아직 많은 기간이 남아있는 상태이기 때문에 성급히 투자를 하시는 것보다는 실수요 목적에서 정확히 역사가 어느 곳에 들어오는지 그리고 개발계획 7개 노선 중에 어느 것이 가장 먼저 착공하는지를 따져보고 내 집을 마련하셔야 될 것으로 보여집니다. 서울시의 교통시책의 완성도를 높이고 도시의 균형적 발전을 도모하기 위해 계획된 경전철. 경전철이 교통 불편을 해소시키면서 주변 지역 집값 까지 끌어올릴 수 있을지는 더 두고 볼 일입니다.,https://news.naver.com/main/read.nhn?mode=LSD&mid=shm&sid1=260&oid=055&aid=0000102567,79
58528,2007.07.09. 오전 8:32,부동산,이데일리,청주지웰시티 견본주택 갤러리로 변신,이데일리 남창균기자 갤러리로 변신한 견본주택 주 신영은 오는 8월 5일까지 청주 지웰시티 견본주택에서 한국 근현대미술 명품전 을 개최한다. 가나아트 갤러리가 주관하고 주 신영과 충북예총이 주최하는 이번 전시회에서는 박수근의 여인 이중섭의 아이들 등 한국의 대표적인 근현대 작가 20여명의 작품을 감상할 수 있다. 특히 이번 전시회는 평소 접하기 힘든 개인소장의 수작들을 모았다는 점에서 의미가 크다. 정춘보 신영 회장은 문화와 교육의 도시 청주에서 미술전시회를 열게 돼 뜻 깊다 며 모델하우스 안의 전시회라 건축과 예술을 한꺼번에 감상할 수 있는 좋은 기회 라고 말했다. 향후 신영은 지웰시티 부지내에 약 2400㎡ 규모의 문화예술회관을 지어 청주시에 기부하는 한편 청주시민들을 대상으로 음악회 공연 전시회 등 다양한 문화행사도 개최할 예정이다.,https://news.naver.com/main/read.nhn?mode=LSD&mid=shm&sid1=260&oid=018&aid=0000499124,79
58529,2007.07.09. 오전 8:27,부동산,MBN,국내 집값 조정국면 오래간다,미국과 국내 주택가격의 동조화 현상에다 국내 금리도 상승기조가 유지될 것으로 보여 현재의 집값 조정국면이 조기에 마무리되기는 어려울 것이라는 전망이 나왔습니다. 신후식 국회예산정책처 거시경제분석팀장은 해외 주요국의 부동산가격 조정과 시사점 보고서에서 미국의 주택가격 조정이 당초 예상보다 길어지고 조정폭이 커지면 국내 주택가격 조정폭도 지금보다 확대될 것 이라며 이같이 전망했습니다. 신 팀장은 미국 주택가격과 영국 호주 뉴질랜드 한국의 주택가격을 분석한 결과 미국 주택가격이 10% 하락하면 이들 4개국 주택가격은 평균 5.3% 떨어지는 것으로 나타났고 한국은 1.5% 하락하는 것으로 추정됐다고 밝혔습니다.,https://news.naver.com/main/read.nhn?mode=LSD&mid=shm&sid1=260&oid=057&aid=0000061852,79
58530,2007.07.09. 오전 8:26,부동산,매일경제,집값 조정국면 오래간다,미국 주택가격의 하락 안정세가 장기화되면서 국내 주택가격도 하락 안정 국면이 계속될 것이라는 전망이 나왔다. 신후식 국회예산정책처 거시경제분석팀장은 8일 해외 주요국의 부동산 가격 조정과 시사점 보고서에서 미국의 주택가격 조정이 당초 예상보다 길어지고 조정폭이 커지고 있다 며 이같이 전망했다. 미국 내에서 부동산 경기 하락이 실물경기 침체로 이어지고 다시 부동산 경기가 하락하는 악순환이 전개되면서 국내 주택가격 조정기가 더 길어질 수 있다는 것. 그 근거로 신 팀장은 금융시장이 글로벌화되면서 미국과 국내 주택가격간 동조화 경향이 강해지고 있다는 점을 지적했다. 신 팀장이 미국 호주 영국 뉴질랜드 한국 등 5개국의 주택가격을 분석한 결과 미국 주택가격이 10% 내리면 다른 4개국은 평균 5.3% 한국은 1.5% 내리는 것으로 추정됐다. 미국 주택가격은 2005년 12.9% 상승했으나 2006년에는 1.7%로 상승률이 급격히 낮아졌고 지난 4월에는 작년 동기 대비 0.8% 하락하는 등 하락세를 면치 못하고 있다. 유로지역 주택가격도 2005년 상반기 8.3% 오른 것을 정점으로 점차 둔화돼 작년 상반기에는 6.9% 오르는 데 그쳤다. 영국은 정책금리가 2003년 3.5% 수준에서 2004년 8월 초 4.75%로 상승하면서 주택가격 상승세가 크게 둔화됐다. 신 팀장은 국내 정책금리가 상승 기조를 유지할 것으로 예상되는 점 등을 감안하면 국내 집값의 조정 국면이 조기에 마무리되기는 어려울 것 이라고 말했다.,https://news.naver.com/main/read.nhn?mode=LSD&mid=shm&sid1=260&oid=009&aid=0000603194,79
58531,2007.07.09. 오전 7:29,부동산,한국경제,강북 도심에 첫 타운하우스형 아파트,서울 강북권 구도심인 종로구 한 재개발구역에 타운하우스 개념을 도입한 고급 저층아파트 가 등장할 예정이다. 개발지역은 인왕산 자락의 노후 주택 밀집지역인 옥인동 일대다. 8일 옥인1구역 재개발추진위원회와 시공을 맡은 대림산업은 국내 유명 건축가인 김원씨 광장건축 대표 와 손잡고 옥인1구역에 지상 5층에 330가구 규모의 타운하우스형 저층 아파트단지를 조성한다 고 밝혔다. 대림산업은 옥인1구역은 건물 외형 단지 내 조경 편의시설 등에서 기존 재개발단지와는 크게 차별화해 강북권 도심주거개발의 새로운 모형을 제시할 것 이라고 밝혔다. 최근 정비구역 지정신청을 한 옥인1구역은 인왕산 줄기와 맞닿아 있는 구릉지로 자연경관과 쾌적성이 뛰어나다는 평가를 받고 있다. 개발면적은 3만3000㎡ 1만여평 이다. 현재 기본 계획상으로는 85㎡ 32평형 265가구 126㎡ 46평형 20가구 201㎡ 61평형 45가구 등 330가구가 들어설 예정이다. 조합원분인 150가구를 제외한 나머지 180가구가 일반에 분양된다. 건물 규모는 지하 2층 지상 5층 15개동 까지의 저층이다. 이르면 내년 상반기쯤 공급되고 분양가는 3.3㎥당 2000만 2500만원 안팎으로 예상된다. 옥인1구역 재개발사업에서 가장 눈길을 끄는 대목은 건축가 김원씨가 내세운 고급 타운하우스형 저층 아파트 개념이다. 이곳 주민인 그는 옥인동의 역사·문화적 전통과 자연녹지환경을 살리는 설계 대안으로 타운하우스 컨셉트를 선택했다. 단지 내 15개 동을 열십자 ＋ 로 배치하고 각 동의 3개면에 발코니를 설치해 인왕산 북악산 등의 조망권이 확보되도록 했다. 단지 중앙에 인왕산 개천을 유입시킨 중앙광장을 조성하고 이 개천은 다시 청계천으로 이어질 수 있게 수로를 내는 계획을 세웠다. 옥상에는 도심 아파트에서 보기 힘든 태양열 집광판을 설치해 환경친화적 에너지 시스템도 적극 도입할 예정이다. 또한 건물구조를 기존 콘크리트 아파트와 달리 철골로 구성해 실내에 기둥이나 벽체를 없앴다. 이로써 입주자들은 각자 가족 상황에 알맞은 집안구성을 할 수 있게 됐다. 실내 마감도 15명의 인테리어 디자이너를 참여시켜 각 동마다 다르게 꾸며지도록 하는 방안을 추진 중이다.,https://news.naver.com/main/read.nhn?mode=LSD&mid=shm&sid1=260&oid=015&aid=0000976265,79
58532,2007.07.09. 오전 7:09,부동산,파이낸셜뉴스,남양주 진접·양주 고읍 1만가구 분양,‘남양주시 진접지구냐 양주시 고읍지구냐.’ 8일 업계에 따르면 아파트 분양 비수기인 오는 8월 하순께 경기 남양주시 진접지구와 양주시 고읍지구에서 총 1만여가구가 동시분양으로 공급된다. 특히 이들 두 곳은 한강 이북에 있는 공공택지지구로 교통망이나 신도시 등 각종 개발호재를 타고 최근 새롭게 부상하는 지역이어서 수도권 청약통장 가입자들의 관심을 집중시키고 있다. 부동산 전문가들은 이 아파트들은 대부분 분양가 상한제가 적용되고 오는 9월 청약가점제 시행을 앞두고 있어 가점에서 불리한 신혼부부 등 젊은 층과 1주택 이상 보유자들이 적극 노려볼 만하다고 입을 모은다. 남양주 진접지구에서는 내달 24일께 신안 경기지방공사 남양건설 반도건설 금강주택 신영 신도종합건설 등 7개 업체가 5927가구를 동시분양한다. 신안이 113∼114㎡ 34A B평형 2340가구 경기지방공사가 113㎡ 34평형 509가구 남양건설 110㎡ 33평형 443가구 반도건설 110㎡ 33평형 금강주택 116㎡ 35평형 신영 129∼192㎡ 39∼58평형 434가구 신도종합건설 126∼262㎡ 38∼79평형 538가구다. 이 가운데 전용 85㎡ 25.7평 이하 중소형은 모두 분양가 상한제가 적용돼 계약 후 10년간 전매할 수 없고 중대형은 상한제에서 제외돼 등기 후 바로 매매할 수 있다. 분양가는 3.3㎡ 1평 당 700만∼800만원대에서 책정될 전망이다. ‘양주신도시 개발’의 특급호재인 양주 고읍지구에서는 3474가구가 동시분양된다. 내달 17일께 모델하우스가 공개된다. 한양이 1832가구 신도종합건설 744가구 우남건설 376가구 우미건설 522가구를 각각 공급한다. 중소형은 모두 분양가 상한제가 적용돼 10년 동안 전매가 금지되지만 토지공사에서 택지를 채권입찰 방식으로 공급받는 한양의 6 3블록은 상한제 대상에서 제외돼 입주 후 매매가 가능하다. 예상 분양가는 중소형이 3.3㎡ 1평 당 750만원대 중대형은 800만원대다.,https://news.naver.com/main/read.nhn?mode=LSD&mid=shm&sid1=260&oid=014&aid=0000320546,79
58533,2007.07.09. 오전 7:09,부동산,파이낸셜뉴스,현대·삼성·GS 용인 분양 ‘속앓이’,현대건설과 삼성건설 GS건설 등 이른바 ‘빅 3’건설사가 경기 용인에서 준비중인 노른자위 아파트 분양을 놓고 속앓이를 하고 있다. 8일 업계에 따르면 이는 경기도가 지난달 26일 인근의 수원 광교신도시 분양가를 3.3㎡ 평 당 900만∼1200만원에 분양하겠다고 발표한 뒤 용인시가 지역내 민간분양아파트의 분양가책정에 대한 고삐를 바짝 죄고 있기 때문이다. 이에 따라 용인지역의 유망 분양 ‘삼총사’로 불려 온 상현동의 현대 힐스테이트와 성복동의 GS수지자이2차 동천동의 삼성래미안 아파트 분양의 분양일정이 다시 한 치 앞도 내다볼 수 없게 됐다. 이들 3개 단지는 앞으로 분양승인 과정에서 용인시와 여론에 맞서 힘겨운 싸움을 해야 할 것으로 보인다. 하지만 건설사마다 느끼는 부담감은 확연히 다르다. 3개 단지 중 제일 먼저 지난 5월 말 용인시에 분양승인서를 제출해 사실상 ‘총대’를 멘 현대 상현힐스테이트는 ‘고분양가’ 지적을 받으면서 용인시로부터의 갈 수록 거센 분양가 인하압력과 여론의 따가운 눈총을 받고 있다. 이에 비해 동천래미안과 성복수지자이2차는 일단 상현힐스테이트의 분양가 결정 등을 관망하면서 ‘이 결과에 따라 움직여도 늦지 않다’며 비교적 느긋한 입장이다. 상현힐스테이트 분양가 인하 압력 거세 상현힐스테이트는 분양가격 책정을 놓고 용인시와 두달째 실랑이를 벌이고 있다. 5월 말 3.3㎡당 평균 1690만원에 분양승인을 신청한 이후 분양승인은 못받은 채 고분양가 논란에 휩싸여 있다. 상현힐스테이트의 시행사인 한백씨앤티는 5월 3.3㎡당 1690만원에 처음 분양 승인 신청을 했으나 시의 조정 권고를 통해 1640만원에 재차 승인 신청을 했었다. 이 과정에서 용인시 분양가자문위원회는 1605만원으로 권고안을 냈고 시는 이 가격대에 분양 승인을 내준다는 방침이었다. 하지만 이 과정에서 상현힐스테이트 분양가격이 상현동 평균 아파트값보다 300만원 이상 비싸다는 고분양가 논란이 잇따라 제기된 데 이어 지난달 26일 광교신도시 분양가가 발표되면서 상황이 급반전됐다. 서정석 용인시장이 분양가를 대폭 낮추라는 지침을 내리면서 자문위 권고안이 결국 사실상 백지화 된 것. 시행사측은 분양가를 1600만원대로 생각하고 있지만 시는 1300만원대를 고수하고 있어 접점을 찾기가 힘든 상황이다. 이 상황에서 용인시청 홈페이지에는 연일 상현힐스테이트 고분양가를 성토하고 용인시장을 응원하는 글이 쇄도하고 있어 해당 건설사는 당혹감을 감추지 못하고 있다. 현대건설 관계자는 “분양이 지연되고 고분양가 논란마저 일고 있어 브랜드 이미지도 타격을 입고 있다”면서 “일정이 어떻게 될 지 예측할 수 없어 답답하다”고 말했다. 삼성 GS는 “힐스테이트 지켜본 뒤 분양시기 결정” 용인지역 상황이 이렇듯 수시로 변하자 삼성건설과 GS건설은 분양일정을 일단 미루고 지켜보자는 입장이다. 시의 가이드라인이 아직 확정되지 않은 상황에서 괜히 나서봐야 상현힐스테이트 처럼 여론의 질타만 받을게 뻔하다는 이유 때문이다. GS건설 관계자는 “지난달 24일 성복수지자이2차 시행사인 삼호에서 3.3㎡당 1468만원에 분양승인 신청을 했지만 거절당했다”며 “시행사가 당분간 상현힐스테이트 진행상황을 지켜본 후 일정을 진행하기로 한 것으로 알고 있다”고 말했다. 동천래미안도 마찬가지다. 아직 토지문제가 완전히 정리되지 않아 일정이 지연되고 있지만 굳이 분양승인절차를 서둘러 진행하지 않겠다는 방침이다. 삼성물산 건설부문 관계자는 “당초 견본주택을 7월 말께 열 생각이었지만 역시 상현힐스테이트의 분양가격 책정 등 분양승인이 어떻게진행되는 지를 보고 분양시기를 결정할 예정”이라고 말했다.,https://news.naver.com/main/read.nhn?mode=LSD&mid=shm&sid1=260&oid=014&aid=0000320538,79
58534,2007.07.09. 오전 7:09,부동산,파이낸셜뉴스,8월 비수기에 4만7천가구 쏟아진다,본격적인 여름휴가로 인해 전통적인 아파트 분양비수기인 데도 오는 8월 전국에서 4만7000여가구의 아파트가 쏟아질 예정이다. 이는 지난해 동기 계획물량에 비해 무려 2배 정도 많은 물량으로 분양가 상한제 시행 9월 을 앞두고 건설사들이 막판 밀어내기 분양에 나서기 때문으로 풀이된다. 8일 부동산 정보업체 닥터아파트에 따르면 내달 전국에서 분양 예정인 아파트 주상복합 포함 는 4만7604가구에 달한다. 지난해 같은 기간 2만625가구 의 130%나 많고 이달 계획 물량 2만4782가구 과 비교 해도 90% 이상 늘어난 것이다. 지역별로는 서울을 포함한 수도권에서 1만9090가구 지방 5대광역시에서 1만6007가구가 공급된다. 서울지역은 대부분 재개발지역의 일반분양 물량이다. 총 1817가구가 분양될 예정으로 강서권 758가구 강북권 701가구 도심권 325가구 강남권 33가구 등 비교적 지역별로 고른 분포를 보이고 있다. 이 중 강북권인 길음8구역 월곡1구역 정릉길음9구역 등은 대규모 재개발 단지여서 청약자들이 관심을 가질 만하다. 길음8구역은 삼성건설이 재개발 사업을 통해 대규모 단지 2곳을 분양한다. 총 1617가구로 일반분양은 79∼132㎡ 24∼40평 29가구 정릉길음9구역은 총 1254가구 중 79∼145㎡ 24∼44평 320가구다. 2곳 모두 길음뉴타운에 포함되며 기존 삼성래미안단지와 함께 대규모 삼성타운을 형성하게 된다. 강남권에서는 계룡건설산업이 금호빌라를 재건축해 총 53가구중 277∼337㎡ 84∼102평 33가구를 일반분양한다. 강남권 분양 단지가 적은 데다 양재천 조망이 가능해 수요자들의 관심이 높다. 경기지역은 양주 고읍지구 남양주 진접지구 등의 동시분양이 집중되면서 지난해 8월 6995가구보다 무려 1만2095가구가 늘어났다. 남양주 진접지구에서는 총 8개 단지 5927가구 양주 고읍지구에서는 4321가구 중 3439가구가 각각 동시분양될 예정이다. 공공택지이기 때문에 전용면적 85㎡ 25평 이하는 분양가 상한제가 적용돼 분양가가 다소 낮아질 전망이다. 다만 계약 후 10년간 전매가 금지된다. 전용면적 85㎡ 초과는 분양가 상한제를 적용받지 않는다. 이달 초 대부분 지역에서 투기과열지구가 해제된 지방 5대광역시와 지방중소도시는 전년동기 대비 각각 9289가구 5595가구가 늘어 투기과열지구 해제효과가 나타날지 여부에 관심이 집중되고 있다.,https://news.naver.com/main/read.nhn?mode=LSD&mid=shm&sid1=260&oid=014&aid=0000320536,79
58535,2007.07.09. 오전 7:06,부동산,파이낸셜뉴스,대구 국책사업에 땅값 ‘꿈틀’,대구·경북지역이 부동산 경기 침체에 따라 아파트 값은 계속 하락하고 있는 반면 땅값은 꾸준히 오르고 있는 것으로 나타났다. 이는 대규모 국책사업 건설예정지역에서 토지보상을 앞두고 보상에 따른 개발 기대심리가 작용 땅값이 들썩이고 있기 때문으로 분석된다. 8일 한국토지공사 대구·경북본부에 따르면 대구 동구 신서혁신도시와 달성군 현풍의 대구테크노폴리스 경북 김천 농소 남면 일원의 혁신도시 및 고속철도 역사후보지 등 건설예정지역 일대 땅값 상승세가 두드러지고 있다. 토지공사 조사에 따르면 대구 전체 지가는 지난해 6월부터 올 5월 말까지 1년간 매월 꾸준히 상승하고 있는 가운데 올 들어서는 1.46%가 올랐다. 특히 대구테크노폴리스 건립지인 현풍면 일대는 토지공사가 지난달 14일 기본조사를 진행하자 건립대상부지는 물론 인근 구지면 일대까지 땅값이 가파르게 뛰고 있다. 현풍에 있는 부동산 중개업자는 “대구지역 아파트 개발에 따른 토지 보상금이 대구테크노폴리스 건립예정지역으로 대거 유입됨으로써 주변 농지는 물론 인근지역 농경지까지 땅값 상승을 부추기고 있다”고 말했다. 실제 지난 5월 중 전국 지가 상승률은 0.26%로 2005년 9월 이후 가장 낮은 상승률을 기록했으나 대구 달성군의 경우 0 .35%로 나타났다. 올 들어 5월 말까지 달성군 지가 누계상승률은 2.34%로 대구지역에서 가장 높은 상승률을 보였으며 이는 대구지역 평균 상승률 1.46% 의 2배에 이르는 것이다. 또 대구 동구 신서혁신도시 건립예정지 일대 역시 현재 감정평가가 진행 중이며 이르면 다음달 초부터 토지 보상에 착수할 예정이다. 이 지역은 토지거래허가구역과 주택 및 토지투기지역으로 묶이면서 실질적인 거래는 많지 않지만 호가를 중심으로 오름세를 보이고 있다. 올 들어 동구지역의 지가 상승률은 1.53%로 달성군 및 달서구 2.19% 에 이어 높은 지가 상승률을 보였다. 기타 지역은 약 상승세를 보이는 가운데 지하철 2호선 역세권지역과 개발제한구역 해제지역 및 신흥개발지구 등은 강세를 나타내고 있고 이같은 추세는 당분간 지속될 것으로 전망됐다. 경북지역은 칠곡군이 대구와의 접근성 양호로 인구 유입이 계속되면서 아파트 신축 가능부지를 중심으로 가격 상승률이 1.89%로 높은 편이었으며 다음은 경주시로 1.46%였다. 혁신도시 건립 예정지인 김천시는 0.99%로 도내 평균 0.75% 보다 높았으며 이 지역은 토지거래 허가구역 및 토지투기지역에 지정되는 등 정부의 강력한 규제로 매매는 한산한 편이지만 생산녹지지역은 대토 수요와 개발 기대감으로 급등세를 보이며 땅값 상승을 이끌고 있다. 경주시는 방폐장 유치에 따른 한국수력원자력 본사 이전 및 양성자 가속기 등 대규모 국책사업에 따른 인구 증가와 자금 유입에 대한 기대가 지가 상승을 부추기고 있다. 배판덕 토지공사 대구경북본부장은 “대구·경북지역 토지시장은 전반적으로 정부의 강도 높은 규제로 보합세를 보일 것으로 예상되지만 테크노폴리스와 혁신도시 등 개발 호재 지역은 호가 위주의 강세가 지속될 것”이라고 전망했다. 한편 대구지역 올 상반기 아파트 시장은 소비자들의 관망세 속에 약세를 면치 못하고 있는 가운데 매매 가격이 평균 1.6% 하락했고 경북지역은 평균 1.5% 상승했다.,https://news.naver.com/main/read.nhn?mode=LSD&mid=shm&sid1=260&oid=014&aid=0000320532,79
