,date,cat,co,headline,text,url,week
2507,2006.02.01. 오전 10:03,부동산,연합뉴스,성남시 송파지구 공람공고,송파신도시 건설 본격화 성남 연합뉴스 김경태 기자 경기도 성남시는 송파신도시 건설과 관련해 송파거여 택지개발예정지구 지정을 위한 주민공람을 지난달 31일부터 시작했다고 1일 밝혔다. 성남시가 기존의 공람공고 거부입장을 바꾼 것은 건교부가 지난달 24일 경기도에 직무이행명령을 통보한 상황에서 도가 시에 직무이행명령을 시행할 경우 타협의 여지가 없다고 보고 건교부의 공람공고요청을 수용한 것으로 전해졌다. 사유지를 포함 84만평이 포함되는 성남시는 행정구역 개편 광역녹지축 보존 교통문제 재개발 이주단지 확보 등에 대한 건교부의 의견을 들어야 한다며 건교부의 공람공고 요청을 한달간 이행하지 않았다. 서울 송파구 하남시에 이어 성남시가 송파거여지구 공람공고 절차를 이행함에 따라 송파신도시 건설사업이 본격화될 것으로 보인다.,https://news.naver.com/main/read.nhn?mode=LSD&mid=shm&sid1=260&oid=001&aid=0001208488,4
2508,2006.02.01. 오전 9:41,부동산,헤럴드POP,송파신도시 본격화..주민공람 한달만에 재개,지자체의 반발로 유보된 송파신도시 주민공람이 한달만에 실시돼 신도시 건설사업이 본격화될 전망이다. 1일 건설교통부는 송파구의 주민공람이 20일 마무리된데 이어 개발제한구역 추가 해제 등을 요구하며 주민공람을 늦춰온 하남시와 성남시가 지난달 25일 31일을 기해 주민공람에 들어갔다고 밝혔다. 건교부는 이에 따라 하남시와 성남시의 주민공람이 이달 14일 17일 각각 끝나는 대로 주민 및 관계기관 의견을 종합한뒤 이르면 4월 중앙도시계획위원회 및 주택정 책심의위원회에 상정할 예정이다. 중도위 등의 심의가 마무리되면 6월중 지구를 지정하고 개발계획 및 실시계획에 착수 2009년 부지조성공사와 분양에 들어갈 방침이다. 건교부는 대신 하남시와 성남시의 추가 그린벨트 해제 및 행정타운 건설 허용 등 요구사항에 대해 추후 검토키로 했다. 또 서울시의 광역교통대책 추가 마련 요구에 대해서는 6월중 별도 용역을 통해 대책을 마련하되 건설 시기 조정 문제는 받아들이지 않기로 했다. 건교부 관계자는 “이 지역의 투기 방지를 위해 성남시와 송파구 하남시가 작년 12월과 1월중 개발행위허가제한 고시를 완료했다”면서 “보상을 노린 불법 건축물 등 은 엄중히 선별해 한푼도 보상을 받지 못하도록 할 것”이라고 말했다. 현재 남성대골프장과 특전사 등이 위치한 송파 동남지역 205만평에 들어설 송파 신도시는 주상복합을 포함한 아파트 4만5천가구와 연립 200가구 단독주택 800가구 등 4만6천가구가 2013년까지 들어설 예정이다. 이중 50%가 임대주택으로 40%는 강남수요를 흡수하기 위해 중대형 위주로 건설 되며 아파트의 평균 용적률은 200％ 인구밀도는 1ha당 170명으로 정해졌다. 신도시 건설에 따른 주변지역 교통난을 덜기 위해서는 지하철 8호선인 복정역과 산성역 사이에 역사를 신설 5호선과 연계토록 하고 노면전차나 경전철 등을 도입하는 방안이 검토되고 있다.,https://news.naver.com/main/read.nhn?mode=LSD&mid=shm&sid1=260&oid=112&aid=0000029250,4
2509,2006.02.01. 오전 9:41,부동산,헤럴드POP,전국 주택 미분양 또 사상최대,판교 청약을 앞두고 신규 분양 시장이 침체가 심화되면서 전국 주택 미분양 물량이 지난 12월에 이어 또 다시 사상 최대치를 갱신했다. 1일 부동산포털 닥터아파트가 전국의 1월 미분양 주택 주상복합 및 오피스텔 포함 을 조사한 결과 총 464곳에서 3만5813가구의 미분양 물량이 발생한 것으로 집계됐다. 이는 지난해 12월의 3만2421가구에 비해 10.5%P 늘어난 것이다. 지역적으로는 지방 중소도시가 192곳 1만9541가구로 미분양물량이 가장 많았다. 이어 지방 광역시는 111곳 8836가구 서울 인천 경기 등 수도권은 161곳 7436가구 순으로 뒤를 이었다. 지방 중소도시의 미분양물량이 전체 미분양물량에서 차지하는 비중 54.6% 이 50%를 넘어선 반면 용인과 화성 등의 미분양물량은 판교 신도시 분양을 앞두고 실수요자들의 관심이 증대되면서 전달 대비 각각 9.8%P와 5.7%P 감소했다.,https://news.naver.com/main/read.nhn?mode=LSD&mid=shm&sid1=260&oid=112&aid=0000029249,4
2510,2006.02.01. 오전 9:06,부동산,서울신문,신혼부부용 ‘역세권 전셋집’ 인기,서울신문 8·31대책 이후 전셋값이 계속 오르는 가운데 예비 신혼부부들을 위한 1억원대 미만의 20평대 전세 물량에 관심이 쏠리고 있다. 강남권에서는 강동구 길동 삼익파크 21평형이 대단지 역세권으로 꼽힌다. 길동 53 일대 12층 12개동 1102가구로 구성됐다. 서울지하철 5호선 굽은다리역에서 걸어서 3분 거리. 단지 뒤로 일자산이 있고 차로 5분 거리에 GS슈퍼마켓과 이마트가 있다. 단 1983년 입주한 노후단지란 게 단점. 방 2개 욕실 1개인 21평형 전세가 9000만∼1억원 18·19평형은 8000만∼8500만원. 구로구 구로동 1265 일대 15∼25층 11개동 1727가구 규모의 두산 아파트는 1998년 말 입주한 단지다. 서울지하철 7호선 남구로역이 도보 3분 거리다. 방 3개에 욕실 1개의 20평형은 801가구로 전세가 9500만∼1억원 22평형도 1억원 선이다. 단지 뒤에 구로시장이 있고 애경백화점 구로점과 이마트가 차로 5분거리다. 종로구 창신동 703 일대 13∼15층 7개동 919가구로 이뤄진 쌍용2차의 23평형은 서울지하철 6호선 창신역에서 걸어서 3분거리로 시청과 충무로 등 도심권 출퇴근자들에게 인기다. 주변에 대형 편의시설이 없는 것은 단점. 입주는 1993년 10월.23평형이 방 2개 욕실 1개로 전셋값은 9000만∼1억원이다.,https://news.naver.com/main/read.nhn?mode=LSD&mid=shm&sid1=260&oid=081&aid=0000076161,4
2511,2006.02.01. 오전 8:47,부동산,연합뉴스,재건축 승인권한 중앙정부 환수 검토안해종합,참여정부 주택가격 7.4% 토지가격 12.8% 상승 김석동 재경차관보 SBS 라디오 출연 서울 연합뉴스 이 율 기자 김석동 재정경제부 차관보는 1일 정부는 지방자치단체의 재건축 승인권한의 환수 여부를 검토하고 있지 않다 고 밝혔다. 그는 이 날 SBS라디오 진중권의 SBS 전망대 에 출연해 정부는 8.31대책의 후속대책으로 분양가 인하나 청약제의 합리적 운영 서민.저소득층 주택공급대책을 중점적으로 보고 있다 면서 일부 지역에 부동산 가격 불안 조짐이 있기 때문에 8.31대책의 확고한 추진을 위해 준비하고 있는 것 이라고 말했다. 그는 이어 토지공개념 도입을 위해 헌법개정을 논의해야 한다는 열린 우리당 김근태 의원의 주장에 대해 헌법개정이 필요하다고 보지 않는다 면서 8.31대책으로 가수요에 대한 확실한 제어장치가 마련됐기 때문에 앞으로는 실수요에 맞춰 5년 간 전국 50만 호 가량으로 예정된 주택공급을 제대로 하는 게 중요하다 고 말했다. 그는 참여정부 출범 이후 땅값이 수십배 상승했다는 지적에 대해 분석결과 참여정부 들어 주택가격은 7.4% 토지가격은 12.8% 올랐다 면서 주택가격은 안정된 반면 토지가격은 국토균형개발의 영향으로 생산성이 향상돼 올랐음을 보여준다 고 말했다. 김 차관보는 1 2인 가구 근로소득 추가공제 폐지와 관련 부양가족이 적을수록 공제가 많은 고출산 시대에 만들어진 제도를 합리화하는 것 이라며 이를 통해 2010년까지 저출산사회안전망 마련을 위해 국세에서 추가로 조달해야할 2조9천억원 중 5천억원의 재원을 확보할 수 있을 것 이라고 말했다. 그는 맞벌이 부부만 세금 폭탄을 맞는다는 지적에 대해 맞벌이 부부에게 현행 제도는 상대적으로 유리하게 돼 있다 며 이는 지속적으로 불합리하다고 지적돼 왔던 부분 이라고 말했다. 그는 스크린쿼터와 관련된 정부입장은 확고하다면서 지난 주 27일 이미 관련 법령의 입법예고를 마쳤다고 밝혔다. 그는 한.미 자유무역협정 FTA 추진은 앞으로 우리의 생존전략을 찾기 위해 가야 할 길 이라며 경제 대외의존도가 70% 넘는 나라에서 범세계적 무역자유화 기조에 동참하지 않으면 생존하기가 불가능하다 고 덧붙였다. 그는 올해 경기에 대해 성장이 어느 정도 궤도에 오를 것으로 보고 있다 면서도 유가와 환율이 빠른 속도로 상승하고 있지만 내성이 생긴 것으로 보인다 고 말했다.,https://news.naver.com/main/read.nhn?mode=LSD&mid=shm&sid1=260&oid=001&aid=0001208427,4
2512,2006.02.01. 오전 7:32,부동산,동아일보,전국 단독다가구주택 표준가격 공시,동아일보 전국의 단독 다가구 다세대 주택 중 1년 동안 공시가격이 가장 많이 오른 지역은 충남 연기군으로 50.45% 급등했다. 행정도시 건설의 영향이다. 이 밖에 기업도시 혁신도시 신도시 등 ‘호재’가 있는 지역의 주택은 예외 없이 공시가격이 크게 올랐다. 공시가격은 재산세와 종합부동산세의 부과기준이므로 세금 부담도 그만큼 늘어난다. ○ 개발이 있으면 집값은 오른다 지난해 공시가격 1840만 원이던 연기군 서면 부동리의 한 단독주택은 올해 공시가격이 2770만 원으로 뛰었다. 연기군 남면 연기리의 주택도 4870만 원에서 7350만 원으로 올랐다. 충남 공주시도 평균 16.3%의 높은 상승률을 보였다. 수도권에서는 신도시 개발 등 호재가 있는 경기 양주시와 인천 중구가 각각 21.13% 20.39%의 상승률을 보였다. 신도시가 예정돼 있는 경기 화성시 16.97% 안양시 만안구 19.79% 김포시 16.22% 와 부산 기장군 15.68% 도 상승률이 15%를 넘었다. 지난해 집값 상승의 진원지였던 경기 성남시 분당신도시는 13.30% 미군기지가 이전하는 경기 평택시와 LCD산업단지가 들어선 경기 파주시도 각각 12.68% 10.35% 올랐다. 청계천 복원의 영향으로 서울 종로구 단독주택들도 11.60% 상승했다. 강남 서초 송파 등 서울 강남권 단독주택은 2.89∼3.35%로 상대적으로 상승률이 낮았다. ○ 재산세와 종합부동산세 늘어난다 올해부터 취득세 등록세 등 거래세는 실거래가로 과세되지만 재산세 종부세는 여전히 건교부의 공시가격을 기준으로 매겨진다. 건교부는 공시가격을 실제 거래가격의 80% 수준에서 결정하고 있다. 지난해 공시가격이 6억8800만 원에서 올해 7억1100만 원으로 3.3% 오른 서울 서초구 양재동의 A단독주택은 재산세가 지난해 175만2000원 교육세 포함 에서 182만1000원으로 3.9% 오른다. 특히 지난해에 내지 않았던 종부세 농어촌특별세 포함 가 59만9400원 추가돼 전체 보유세는 175만2000원에서 242만400원으로 크게 늘어난다. 박정현 세무사는 “올해 단독주택의 공시가격은 실제 시세에 많이 근접한 것 같다”면서 “지난해에는 재산세 상한선 2004년 부과의 150% 이 있어 부담이 급증하지 않았지만 올해는 상한선 기준이 300%로 높아져 크게 증가할 것”이라고 설명했다. 종부세 대상은 지난해 ‘공시가격 9억 원 초과’에서 올해부터 ‘6억원 초과’로 확대됐다. ○ 집값 이상하면 이의신청해야 이번 조사는 전국 470만 채의 단독주택 중 대표성 있는 20만 채를 대상으로 이뤄졌다. 해당 주택 소유자는 지방자치단체가 발급하는 고지서를 통해 자기 집의 공시가격을 확인할 수 있다. 해당 시군구청에서 1일부터 3월 2일까지 30일간 열람도 가능하다. 집값이 너무 높거나 낮게 책정돼 있으면 시군구 또는 건교부의 부동산평가팀에 서면으로 이의신청을 할 수 있다. 이의신청이 들어오면 가격을 다시 조사하며 중앙부동산평가위원회의 심의를 거쳐 3월 24일 다시 공시한다. 아파트 다세대 연립주택 등 공동주택 886만 채와 전체 단독주택의 개별 공시가격은 4월 28일 발표할 예정이다.,https://news.naver.com/main/read.nhn?mode=LSD&mid=shm&sid1=260&oid=020&aid=0000334842,4
2513,2006.02.01. 오전 7:32,부동산,연합뉴스,회전목마 판교 앞에서는 뭉쳐야 산다,서울 연합뉴스 윤종석 기자 우리는 뭉쳐야 산다 부동산 로또 판교신도시 분양을 전후해 수도권 택지개발지역에 분양을 준비중인 건설사들이 똘똘 뭉치고 있다. 아직 두달 정도 청약 날짜가 남았지만 벌써부터 수도권 청약통장 가입자들을 블랙홀처럼 빨아들일 태세인 판교 때문에 3월을 전후해 수도권 택지지구에 분양을 준비해 온 업체들은 어떻게 하면 판교에 맞서 분양 지역을 알릴 수 있을까 전전긍긍하고 있다. 업체들은 여건이 허락하는 한 분양날짜를 맞춰 동시분양을 시도하고 있으며 과거 동탄신도시에서 선보였던 공동 모델하우스는 물론 공동 홍보 유인물 제작도 적극 검토하고 있다. 올 3월 반도건설과 이지건설 제일건설 등이 1천412가구를 동시분양하는 김포 장기지구에는 업체들이 택지지구 상업지역에 공동 모델하우스를 열기로 했다. 반도건설 관계자는 아무래도 판교신도시 분양이 있고 중소규모 회사들이 모여 분양을 하다보니 인지도가 낮은 단점을 극복하기 위해 공동으로 모델하우스를 열기로 했다 고 말했다. 또 이들 회사는 한 광고사에 분양 홍보물 제작을 맡겼다. 개별 단지 소개보다는 김포 장기지구의 입지와 미래가치 등 지역의 입지에 대한 설명이 홍보물의 주요 내용을 차지하게 될 예정이다. 우방과 신영 대방건설 등 11개 건설업체가 4월말 5천889가구를 동시분양하는 화성 향남지구에서도 모델하우스가 공동 운영될 예정이다. 업체 관계자는 동시분양을 하고 모델하우스를 같이 운영하기로 한 것은 비용절감보다는 향남지구 홍보에 더욱 효과적이기 때문 이라고 말했다. 당초 작년 연말에 분양될 예정이었지만 이런 저런 사정으로 분양이 올해로 넘어온 하남 풍산지구는 형편이 여의치 않은 실정이다. 문화재발굴과 건설사간 도급계약 문제 개발비리 등으로 인해 풍산지구에 참여한 업체간 사정이 각각 달라 동시분양을 하려고 해도 도저히 힘이 닿지 않는 실정이다. 일단 올 3월 분양을 계획하고 있는 동부건설 관계자는 아무래도 판교 신도시 분양을 앞두고 분양을 같이 하면 지역 홍보에 도움이 되겠지만 건설사마다 다른 현안이 걸려 있어 동시 분양은 힘든 상황 이라고 말했다.,https://news.naver.com/main/read.nhn?mode=LSD&mid=shm&sid1=260&oid=001&aid=0001208390,4
2514,2006.02.01. 오전 7:30,부동산,동아일보,생애 최초 주택구입자금 대출…대출금 64% 수도권에 풀렸다,동아일보 지난해 11월 재개된 ‘생애최초 주택구입자금 대출 생애최초 대출 ’을 통해 연말까지 약 1조 원의 돈이 풀린 것으로 나타났다. 1인당 평균 대출금액은 5500만 원가량이지만 지역별로 큰 편차를 보였다. 본보 취재팀은 건설교통부가 강길부 열린우리당 의원에게 제출한 ‘생애최초 대출 시도별 지원 실적’ 자료를 단독 입수해 분석했다. 생애최초 대출은 전용면적 25.7평 85m² 이하 주택을 생애 처음으로 구입할 때 정부가 국민은행 우리은행 농협을 통해 연 5.2%의 금리로 최대 1억5000만 원까지 빌려 주는 제도. 31일부터는 부부합산 연소득 5000만 원 이내로 요건이 강화됐다. ○주택담보대출의 40% 차지 생애최초 대출이 지난해 11월 7일 재개된 이후 연말까지 1만7567명이 총 9755억 원을 빌린 것으로 집계됐다. 이는 지난해 11 12월 시중은행 주택담보대출 2조9012억 원 의 33.6%에 이른다. 대출이 7일부터 재개된 데다 신청 이후 대출이 이뤄지기까지 3∼5일이 걸리는 점을 감안하면 실제로는 은행 주택담보대출의 40% 이상이 생애최초 대출을 통해 풀리고 있는 것으로 보인다. 담보물건 대출을 통해 산 주택 소재지 기준으로 생애최초 대출의 63.9%는 주택보급률이 상대적으로 낮은 경기와 서울에 집중됐다. 건교부 통계에 따르면 전국 평균 주택보급률은 102.2%이지만 서울은 89.2% 경기는 95.8%이다. 반대로 대출자 주소지 기준으로 58억 원 0.59% 이 풀려 생애최초 대출 이용실적이 가장 저조한 전남은 주택보급률이 126.8%로 전국에서 가장 높다. 61억 원 0.62% 이 대출된 강원의 주택보급률도 120.1%로 전국에서 3위. 1인당 대출금액도 서울과 경기가 각각 7500만 원 6200만 원으로 평균치보다 많았고 강원 2000만 원 과 전남 2500만 원 은 평균치를 크게 밑돌았다. 신한은행 고준석 부동산재테크팀장은 “내 집 마련 수요는 주택보급률이 낮은 지역에 많다”며 “생애최초 대출이 실수요자의 내 집 마련에 주로 쓰인 것으로 보인다”고 말했다. ○대출받아 전세에서 내 집으로 서울에서는 강서 노원 구로구 경기에선 고양 화성시 등에 생애최초 대출이 집중됐다. 이들 지역의 공통점은 전세금과 집값의 차이가 크지 않다는 것. 노원구 상계동 25평형 아파트의 매매가는 1억2000만 원 안팎이고 전세금은 8000만 원 정도로 4000만 원가량 빌리면 내 집 마련이 가능하다. 국민은행 노원지점 한갑희 과장은 “전세를 사는 30대 중반 이상 고객이 이 기회에 내 집을 마련하기 위해 생애최초 대출을 많이 신청했다”고 전했다. 반면 서민 주거안정이라는 취지가 무색하게 서민 밀집지역인 서울 금천 강북구 등은 이용 실적이 저조했다. 우리은행 안명숙 부동산재테크팀장은 “생애최초 대출은 금리가 연 5.2%로 낮지만 이마저도 감당하기 어려운 사람들이 많기 때문”이라며 “이들에게는 임대주택 공급을 늘리는 정책이 필요하다”고 말했다. 서울 강남지역과 경기 성남시 분당구 용인시 등도 생애최초 대출이 적었다. 집값이 너무 비싸 최대 1억5000만 원을 대출 받더라도 집을 살 수 없기 때문으로 풀이된다. ○대출 많은 지역 부동산값 들썩 생애최초 대출로 거래가 활발했던 지역은 아파트 값도 대체로 오른 것으로 조사됐다. 생애최초 대출자들이 집을 많이 산 전국 12개 시구의 전용면적 25.7평 이하 아파트 월별 가격동향을 부동산 정보업체인 부동산114에 의뢰해 조사한 결과 11개 지역에서 지난해 11 12월에 가격이 오른 것으로 나타났다.,https://news.naver.com/main/read.nhn?mode=LSD&mid=shm&sid1=260&oid=020&aid=0000334845,4
2515,2006.02.01. 오전 7:01,부동산,한국경제,아파트 만족도 브랜드 보다 품질이 좌우,아파트 주거만족도는 브랜드 인지도보다 건물 유지관리 등 주거요소 품질 가 더 큰 영향을 미친다는 연구 결과가 나왔다. 김경숙 동원대 실내건축과 교수는 아파트 브랜드와 소비자 주거만족도에 관한 연구 를 주제로 한 한양대 건축공학과 박사학위논문에서 브랜드 인지도가 높은 아파트와 그렇지 않은 아파트가 인접해 있는 구리 용인시 등지의 9개 단지 입주자 900명을 대상으로 설문조사한 결과 이같이 나타났다고 1일 밝혔다.,https://news.naver.com/main/read.nhn?mode=LSD&mid=shm&sid1=260&oid=015&aid=0000869214,4
2516,2006.02.01. 오전 6:12,부동산,연합뉴스,아파트 만족도 브랜드 보다 품질이 좌우,서울 연합뉴스 서미숙 기자 아파트 주거만족도는 브랜드 인지도보다 건물 유지관리 등 주거요소 품질 가 더 큰 영향을 미친다는 연구 결과가 나왔다. 김경숙 동원대 실내건축과 교수는 아파트 브랜드와 소비자 주거만족도에 관한 연구 를 주제로 한 한양대 건축공학과 박사학위논문에서 브랜드 인지도가 높은 아파트와 그렇지 않은 아파트가 인접해 있는 구리 용인시 등지의 9개 단지 입주자 900명을 대상으로 설문조사한 결과 이같이 나타났다고 1일 밝혔다. 이 논문에 따르면 구리시 인창동 삼성래미안과 한진그랑빌의 경우 입지여건이 비슷한 곳에 위치해 있지만 주민들의 주거만족도는 브랜드 인지도가 높은 삼성래미안 3.42 보다 한진그랑빌 3.51 이 더 높은 것으로 나타났다. 용인시 죽전동 현대 아이파크 2.87 와 건영캐스빌 2.93 도 입주시기나 단지규모 입지여건 등이 모두 비슷하지만 입주민의 만족도는 건영이 더 높아 인지도가 높다고 반드시 입주자 만족도가 큰 것은 아닌 것으로 조사됐다. 하지만 입주후 아파트값은 브랜드 인지도가 높을 수록 상승폭이 큰 것으로 나타났다. 구리 인창동 래미안 33평형은 조사 시점인 2005년 9월 평당 시세가 697만원으로 분양가 평당 383만원 대비 182%가 올랐지만 상대적으로 브랜드 가치가 낮은 한진 그랑빌 32평형은 평당 583만원 분양가 평당 424만원 으로 138% 오르는 데 그쳤다. 또 용인 죽전동 아이파크 33평형은 지난해 9월 현재 평당 1천563만원으로 분양가 평당 675만원 대비 232% 올랐으나 건영캐스빌 33평형은 평당 1천303만원으로 분양가 평당 658만원 대비 198% 상승해 차이를 보였다. 이는 브랜드가 아파트값 상승에는 큰 영향을 미치지만 주거만족도까지 좌우하지는 않는다는 의미라고 김 교수는 설명했다. 설문 결과 주거만족도와 연관성이 높은 것은 아파트 단지 특성을 가리는 주거요소 로 건물 유지관리 단지계획 세대계획 주변근린환경 등의 순으로 밀접한 관련이 있었다. 이에 따라 건설사들이 브랜드 가치를 높이기 위해서는 광고보다는 품질 개선으로 입주자의 만족도를 높이는 것이 중요하다고 김 교수는 지적했다. 김 교수는 주거만족도가 높은 아파트는 입주자들의 재구매 의사도 높은 것으로 조사됐다 며 건설사들이 높은 광고비를 지불해 분양가를 상승시킬 것이 아니라 입주자들이 원하는 아파트를 설계부터 반영하는 것이 장기적인 브랜드 관리 측면에서 유리하다 고 말했다.,https://news.naver.com/main/read.nhn?mode=LSD&mid=shm&sid1=260&oid=001&aid=0001208347,4
2517,2006.02.01. 오전 4:05,부동산,동아일보,연기군 단독주택 공시價 50% 올라…전국표준 평균5.6% ↑,동아일보 재산세와 종합부동산세의 부과 기준이 되는 단독주택 다가구 다세대주택 포함 의 공시가격이 지난해에 비해 전국 평균 5.61% 올랐다. 단독주택 보유자들의 재산세 관련 부담도 5∼6% 커지게 됐다. 건설교통부는 전국의 단독주택 470만 채 가운데 20만 채의 표준주택에 대한 감정평가 결과 가격을 31일 공시했다. 건교부는 이 표준주택 공시가격을 기준으로 전국 모든 단독주택의 개별 공시가격을 산정해 4월 28일 발표한다. 공시가격의 기준일은 올해 1월 1일. 행정중심복합도시가 들어서는 충남 연기군 단독주택은 공시가격이 평균 50.45% 올라 상승률이 가장 높았다. 경기 양주시 인천 중구 등도 20% 이상 올랐다. 시도별로는 행정도시 및 각종 개발사업의 영향으로 충남의 상승률이 13.01%로 가장 높았으며 이어 경기 8.87% 울산 7.40% 대전 7.23% 인천 5.78% 의 순이었다. 표준주택 가운데 공시가격이 가장 높은 곳은 서울 종로구 신문로2가에 있는 단독주택으로 30억2000만 원. 최저가는 경북에 있는 48만3000원짜리 농가다. 종합부동산세 대상이 되는 공시가격 6억 원 초과 단독주택은 표준주택 가운데 1000채로 전국적으로는 약 2만3000채로 추산된다.,https://news.naver.com/main/read.nhn?mode=LSD&mid=shm&sid1=260&oid=020&aid=0000334981,4
