,date,cat,co,headline,text,url,week
117808,2009.01.04. 오후 10:54,부동산,아시아경제,서울시 재정비촉진지구 공사비 등 지원,오는 3월부터 재정비촉진지구내 재개발ㆍ재건축ㆍ도시환경정비사업 등에 들어가는 건축공사비 세입자 주거이전비 조합설립추진위원회 운영자금 등을 서울시 재정에서 융자받을 수 있는 길이 열린다. 서울시는 지난 2일 재정비촉진특별회계 용도를 확대하는 서울특별시 도시재정비 촉진을 위한 조례 개정안을 입법예고 했다고 4일 밝혔다. 조례가 개정되면 서울시는 재정비촉진지구안에서 시행하는 정비사업 시행자에게 건축 공사비의 40% 이내에서 저리 융자 해줄 수 있다. 또한 조합설립추진위원회에 운영자금의 80% 이내의 융자를 제공해 사업 초기 단계에 조합설립추진위원회와 용역업체 등간에 음성적으로 비용을 지원해 발생하는 비리 문제를 미연에 방지할 수 있을 것으로 기대하고 있다. 세입자 주거이전비 융자도 가능하도록 해 세입자와 조합간의 마찰로 인해 사업이 지연되는 것을 예방할 수 있도록 할 계획이다. 이와 함께 시는 조례개정으로 재촉지구내 한옥에 대한 신축 및 개ㆍ보수 비용을 지원 및 융자 할 수 있도록 할 방침이다. 한옥지원조례가 개정되면 비한옥을 한옥촌으로 조성할 경우 최대 8000만원의 보조와 2000만원의 융자를 지원하고 한옥밀집지역의 개ㆍ보수 및 신축비용도 6000만원 보조와 4000만원 융자가 가능하도록 할 계획이다. 재개발ㆍ재건축사업으로 사라지는 동네 모습을 간직하기 위한 시설물 조성사업비도 지원된다. 서울시에서는 도시재정비 촉진을 위한 조례 개정을 위해 입법예고 및 조례규칙심의회 시의회 의결 등을 거쳐 오는 3월부터 시행할 예정이다. 재촉지구 내에서 시행하는 정비사업은 주거환경개선사업 재개발ㆍ재건축사업 도시환경정비사업 등이다.,https://news.naver.com/main/read.nhn?mode=LSD&mid=shm&sid1=260&oid=277&aid=0002080160,157
117809,2009.01.04. 오후 9:55,부동산,한겨레,상반기 전국 집값 78% 떨어질듯,한겨레 국민은행연구소 전망 하반기부턴 서울 강남등 오름세 전환 예상 올해 상반기 전국 집값이 7∼8% 더 떨어질 것이라는 전망이 나왔다. 하반기를 포함해 연간으로는 5% 정도 하락이 예상됐다. 국민은행연구소는 4일 ‘주택시장 리뷰’ 겨울호 에서 “주택시장 침체와 경기 위축으로 올해도 주택가격이 회복되기는 어려울 것”이라며 이와 같이 밝혔다. 연구소는 외환위기 당시 급격한 금융 및 실물경제 충격으로 13개월 동안 전국 주택 매매가격이 13.2% 하락했지만 현재 주택시장 침체는 약 10 12개월 동안 이어지고 가격 하락 폭은 10% 수준일 것으로 내다봤다. 이에 따라 이미 지난해 4분기에 1.2% 하락한데 이어 올 상반기에 추가로 7∼8%가 떨어질 것이라는 분석이다. 그러나 2007년부터 가격 조정이 시작된 서울 강남지역과 개발 호재가 많은 서울 강북지역은 하반기에 오름세로 돌아설 것으로 연구소는 내다봤다. 이들 지역을 중심으로는 수요가 회복되면서 하반기부터는 집값도 소폭 상승해 연간으로는 5% 안팎의 하락세를 보일 것으로 관측했다. 연구소 관계자는 “최근 주택담보대출 금리가 하락하고 있고 정부의 부동산 관련규제 완화가 올해도 지속될 것으로 보여 하반기부터는 관망세를 보이던 실수요자들의 시장 참여가 시작될 것”이라고 말했다. 연구소의 이런 집값 전망은 한국건설산업연구원 등 다른 연구기관의 전망치보다는 다소 낙관적인 편이다. 건설산업연구원은 올해 전국 집값이 기본적으로 5% 정도 떨어지며 실물경기가 더 나빠지는 최악의 경우 최대 10%까지 하락할 것이라고 예상하고 있다. 정종환 국토해양부 장관도 “빠르면 하반기부터는 주택시장이 회복될 것으로 전망된다”는 의견을 내놓았다. 정 장관은 지난 3일 한국방송 의 ‘국민 대정부 질문 경제 언제 좋아집니까’에 출연해 “지난해 각종 주택시장 활성화 대책을 내놓았는데 오는 2월까지 시행에 필요한 조치들이 이뤄지면 효과가 나타날 것”이라고 말했다. 정 장관은 잇따른 규제 완화에도 불구하고 부동산 시장이 살아나지 않고 있다는 지적에 대해선 “규제 완화 같은 조치만으로 시장이 정상화가 되는 것이 아니라 경제 상황과 수요 상황이 맞물리는 것”이라며 “종합적인 경제 상황이 좋아지면서 이런 대책들이 함께 상승효과를 나타내면서 주택시장이 회복하는데 기여할 것”이라고 말했다. 한편 국민은행연구소 집계 결과 지난해 전국 주택 매매가격은 전년 말보다 3.1% 상승했으며 서울은 5.0%가 올랐다. 수도권에서는 지역별로 편차가 심해 인천 계양구 20.5% 서울 노원구 18.8% 의정부 18.7% 등이 크게 오른 반면 용인 수지구 13.5% 과천 12.9% 성남 분당구 9.4% 는 많이 떨어졌다. 최종훈 기자 cjhoon hani.co.kr 세상을 보는 정직한 눈 한겨레 한겨레신문 구독 한겨레21 구독 ⓒ 한겨레신문사 무단전재 및 재배포 금지 한겨레는 한국온라인신문협회 www.kona.or.kr 의 디지털뉴스이용규칙에 따른 저작권을 행사합니다.,https://news.naver.com/main/read.nhn?mode=LSD&mid=shm&sid1=260&oid=028&aid=0001980854,157
117810,2009.01.04. 오후 9:16,부동산,세계일보,국민은행硏 상반기 주택가격 7∼8% 떨어질 듯,올해 상반기 전국 주택가격이 7∼8% 하락할 것이라는 전망이 나왔다. 국민은행연구소는 4일 ‘주택시장 리뷰 겨울호’에서 “주택시장의 전반적인 침체와 경기 위축으로 올해도 주택시장이 큰 폭으로 회복되기는 어려울 것”이라며 이같이 밝혔다. 연구소는 “외환위기 당시 급격한 금융 및 실물경제 충격으로 13개월 동안 전국 주택가격이 13.2% 하락했지만 현재 주택시장 침체는 10∼12개월 동안 지속하고 가격 하락 폭은 10% 수준일 것”이라고 설명했다. 따라서 이미 지난해 4분기에 1.2%가 하락한 만큼 올 상반기에 추가로 7∼8%가 떨어질 것이라는 분석이다. 연구소는 그러나 2007년부터 가격 조정이 시작된 서울 강남지역과 개발 호재가 많은 서울 강북지역을 중심으로 수요가 회복되면서 하반기에는 소폭 상승해 연간으로는 5% 안팎의 하락세를 보일 것으로 관측했다. 연구소의 한 관계자는 “최근 주택담보대출 금리가 하락하고 있고 정부의 부동산 관련 규제 완화가 올해도 지속될 것으로 보여 하반기부터는 관망세에 있던 실수요자들의 시장 참여가 시작될 것”이라고 말했다. 연구소는 올해도 주택 인·허가와 입주 물량이 감소할 것으로 예상했다. 작년 3분기까지 주택 인·허가 실적은 지난해 같은 기간보다 30.2% 아파트 인·허가 실적은 50.7%가 각각 감소했는데 이미 쌓인 미분양으로 올해도 회복되기는 어려울 것이라는 설명이다. 황계식 기자 ⓒ 세계일보＆세계닷컴 www.segye.com 저작자표시 비영리 변경금지 세계닷컴은 한국온라인신문협회 www.kona.or.kr 의 디지털뉴스이용규칙에 따른 저작권을 행사합니다.,https://news.naver.com/main/read.nhn?mode=LSD&mid=shm&sid1=260&oid=022&aid=0002012506,157
117811,2009.01.04. 오후 9:09,부동산,YTN,이달중 종부세 3000억 원 환급,앵커멘트 지난해 종합부동산세를 냈던 납세자 35만여 명에게 약 3 000억원의 세금이 이달 중에 환급됩니다. 과표적용율 자체가 인하돼 모든 납세자가 기본적으로 환급을 받게 되고 여기에 장기보유자나 고령자들은 추가로 세액공제를 받게 됩니다. 신현준 기자의 보도입니다. 리포트 지난해 부과된 종합부동산세는 대상자 41만명에 모두 2조 8 000여억 원. 이 가운데 세금을 냈던 35만명에게 3 000억 원 정도가 이달 안에 환급됩니다. 개정된 종부세법의 소급 적용에 따른 것입니다. 먼저 과표적용률이 90%에서 80%로 내려가면서 모든 납세자가 낸 세금의 13%정도를 돌려받게 됩니다. 여기에 1주택 장기보유자는 최대 40% 60세 이상 고령자는 최대 30%까지 추가로 세금을 돌려받게 됩니다. 예를 들어 12억 원짜리 주택을 소유한 경우 종부세로 612만 원을 냈다면 과표적용률 인하로만 90만 원을 환급받을 수 있습니다. 여기에 70세 이상 10년 이상 보유한 경우라면 추가 공제로 종부세의 74%가 줄어 455만 원을 돌려받게됩니다. 종부세 환급은 헌법재판소의 세대별 합산 위헌결정에 따른 1차 환급에 이어 이번이 두번째입니다. 인터뷰 이병렬 국세청 종합부동산세과장 세대별 위헌 결정에 따른 1차 환급과는 달리 이번에는 별도 서류를 제출할 필요가 없습니다. 또 계좌 개설 신고서를 내면 편리하게 환급받을 수 있습니다. 국세청은 또 세대별 합산과세 위헌결정과 관련해 종부세를 신고납부 하지 않아 환급신청을 할 수 없었던 2 400명에게도 환급 기회를 주기로 하고 신청안내문을 발송했습니다. 올해부터 종부세는 기준 금액이 사실상 9억 원 이상으로 상향되고 세율도 대폭 낮아지면서 당초의 입법취지를 잃고 유명무실해질 전망입니다. YTN 신현준입니다.,https://news.naver.com/main/read.nhn?mode=LSD&mid=shm&sid1=260&oid=052&aid=0000232969,157
117812,2009.01.04. 오후 7:58,부동산,파이낸셜뉴스,주거 재정비사업 공사비 융자 지원,앞으로 민간사업자나 구청장이 재정비촉진지구내에서 시행하는 사업의 건축공사비 등을 서울시로부터 융자 또는 보조받을 수 있게 된다. 서울시는 이 같은 내용을 담은 ‘도시재정비 촉진을 위한 조례 일부 개정안’을 입법예고했다고 4일 밝혔다. 개정안에 따르면 민간사업자들이 서울지역 재정비촉진지구에서 주거환경개선이나 주택재개발·재건축 도시환경정비사업을 할 때 총 건축공사비의 40% 이내를 재정비촉진특별회계기금에서 융자받을 수 있도록 했다. 융자 지원 대상에는 세입자 주거이전비와 조합설립추진위원회 운영자금도 포함됐다. 이와 함께 개정안은 구청장이 시행하는 주거환경개선과 주택재개발·재건축 도시환경정비사업에서의 공사비를 80% 이내에서 융자해주는 한편 지역 상징물을 보존하는 ‘과거 흔적 조성 사업비’는 전액 보조해주도록 했다. 이 개정안은 시의회 의결 절차 등을 거쳐 이르면 3월부터 시행되며 현재 서울시내 재정비촉진지구로는 1·2·3차 뉴타운 35곳 중 흑석 신림 한남 방화 지구 등 총 25개 지구가 지정돼 있다. 2007년부터 매년 도시계획세의 10%로 조성되고 있는 재정비촉진특별회계 기금은 지금까지 구청장이 시행하는 재정비 계획수립비나 기반시설 설치비 등의 용도에 주로 지원돼 왔으며 올해 재정비촉진특별회계 기금은 1650억원이다. 시 관계자는 “침체된 경기를 활성화하기 위해 재정비사업의 공사비 등을 융자해 주도록 조례를 개정한 것”이라고 말했다.,https://news.naver.com/main/read.nhn?mode=LSD&mid=shm&sid1=260&oid=014&aid=0002074972,157
117813,2009.01.04. 오후 7:47,부동산,파이낸셜뉴스,올 부동산시장 어떻게 변할까（상） 주택시장,장기적인 부동산 시장 침체에다 글로벌 금융위기까지 겹치면서 서울 강남권 등 이른바 ‘버블세븐’ 지역에서 지난해 집값이 반토막나는 사례가 속출했다. 특히 우리나라 주택시장은 그동안 정부의 부동산 규제 여부에 따라 등락을 반복했지만 올해는 외부요인인 글로벌 금융위기가 ‘최대 복병’으로 등장했다. 전문가들은 미국발 금융위기가 진정되고 국내 경기가 회복되는 것을 전제로 올해 하반기 이후 바닥을 찍고 서서히 ‘L’자 또는 ‘U’자 곡선을 그릴 것으로 내다봤다. 다만 부동산 시장이 급락의 충격에서 벗어나려면 지속적인 규제완화와 세제개편을 통한 수요 진작 시중은행의 가계대출 재개 및 대출금리 인하 등이 이뤄져야 한다는 게 전문가들의 한결같은 지적이다. 더불어 실수요자들은 내집마련을 서두르기보다는 당분간 시장 상황을 지켜보며 반등 기미가 보일 때 매입에 나서는 게 좋다고 전문가들은 조언한다. 파이낸셜뉴스는 2일 김학권 세중컨설팅 사장 박원갑 스피드뱅크 부사장 김용진 부동산뱅크 본부장 김선덕 건설산업전략연구소장 고종완 RE멤버스 대표 박상언 유엔알컨설팅 대표 등 전문가 6명과 지상좌담을 통해 기축년 부동산 시장을 미리 내다봤다. ―올해 주택시장을 좌우할 가장 큰 변수는 어떤 게 있을지. 박원갑 소장 무엇보다 실물경기 회복 여부라고 본다. 그동안 경제 여건과 같은 대외변수는 사실 주택시장에 영향을 주지 못했지만 최근 들어서는 미국발 금융위기가 가장 큰 타격을 주고 있다. 글로벌 금융위기 극복 여부와 이에 따른 국내 실물경기 회복이 가장 큰 변수라고 생각한다. 김학권 사장 맞다. 금융시장이 가장 큰 변수다. 현재 글로벌 금융위기가 다소 진정되고 있다고는 하지만 이제부터는 대기업을 비롯한 산업계의 구조조정이 불어닥친다. 이렇게 되면 수요가 더욱 위축될 수 있다. 따라서 실물경기 회복이 가장 중요하다. 고종완 대표 실물경기 회복과 함께 규제완화 여부도 중요한 변수다. 지난해 말 서울 강남3구에 대한 투기지역 해제 예고 후 강남 재건축단지에 매수세가 유입되면서 매물이 소진되고 회수되는 등 급격하게 반응했다. 추가적인 규제완화와 대출금리 인하가 또다른 중요 변수다. ―주택시장은 언제쯤 회복될 수 있다고 보나. 김학권 사장 금융시장이 올해 상반기 중 안정된다는 것을 전제로 할 때 지난해와 같은 양상은 펼쳐지지 않을 것으로 본다. 정부가 지속적으로 규제를 완화하고 있기 때문에 강남은 물론이고 강북도 현재보다는 오를 것이다. 2006년 말의 최고점까지 회복되긴 어렵겠지만 올해 하반기에는 최고점 대비 80%까지 회복할 가능성이 높다. 김용진 본부장 맞다. 경제 전반에서 금융불안이라는 불확실성이 제거되면 현재 상황은 반전될 것으로 보인다. 하반기쯤에는 낙폭이 컸던 지역의 급매물 위주로 거래가 살아날 것으로 보인다. 하지만 시세상승을 논하기는 다소 이르다고 생각한다. 김선덕 소장 올해 하반기쯤 반등할 가능성이 높아 보인다. 그러나 반등 폭은 크지 않을 것이다. 아마 전국 평균 6∼7% 정도 상승할 것으로 예상한다. 고종완 대표 그러나 실물경기 위축으로 인한 수요 부진과 미분양 아파트가 문제다. 정책변화 금리 경기흐름 수급 투자심리 등 5대 변수를 종합해 보면 상승요인과 하락요인이 혼재한다. 따라서 상반기 중 5% 정도 추가 하락하고 하반기에는 보합이 예상된다. 올해 급격한 추세전환은 힘들어 보인다. 박원갑 소장 오히려 더 하락할 가능성도 높다. 국내 경기가 쉽게 회복되지 못할 수도 있어 올해 1·4분기에 최악의 상황을 맞을 것으로 본다. 현재로서는 주택시장을 이끌 수 있는 동력이 매우 약해져 있는 만큼 곧바로 반등하기는 불가능하다. 따라서 올해는 바닥을 다지는 ‘L자형’이나 아주 완만한 ‘U자형’의 가격흐름을 보일 것이다. ―정부가 지난해부터 규제를 풀고 있지만 시장은 아직 큰 반응을 보이지 않고 있다. 주택시장 회복을 위해 추가로 필요한 조치가 있다면. 박상언 대표 수도권과 지방을 가리지 않는 양도세 특례제도 부활과 시중은행의 가계담보대출 금리 인하가 시급하다. 또 현재 거론되고 있는 민간택지 분양가상한제도 폐지해야 한다. 공공택지지구 내 주택공급 시기도 다소 늦춰야 한다. 공급이 너무 많다. 김학권 사장 강남권 규제부터 풀어야 한다. 현재 집값이 단기간에 급락하면서 일부 지역에서는 ‘깡통아파트’까지 등장하고 있다. 하지만 수요자들은 여전히 집값이 더 내릴 것으로 생각하고 관망세를 보이면서 집값이 계속해 떨어지는 상황이 반복되고 있다. 이 때문에 일각에서는 국내 부동산시장도 서브프라임 모기지 비우량 주택담보대출 위기가 오는 것 아니냐는 위기감까지 확산되고 있다. 따라서 이 같은 상황을 막으려면 집값이 바닥을 쳤다는 신호를 주는 것이 중요한데 강남권 규제완화가 그 역할을 할 수 있을 것으로 본다. 박원갑 소장 맞다. 그동안 정부가 각종 규제를 완화했지만 가시적인 효과를 내지 못하고 있는 것은 경기침체로 인해 소비심리가 극도로 위축됐기 때문이다. 따라서 주택시장을 살리기 위해서는 규제완화를 비롯한 거시적인 경제활성화 대책이 필요하다. 김선덕 소장 꼭 그렇지만은 않다고 본다. 현재 부동산 시장은 규제완화로 해결될 일이 아니라고 본다. 글로벌 금융위기와 실물경기 침체 등 부동산 시장 외적인 변화가 더 크기 때문이다. ―현재 서울 강남 경기 분당 등 버블세븐 지역에서 반토막 아파트가 늘고 있다. 버블세븐이라는 용어처럼 그동안 이들 지역 집값이 거품붕괴 과정에 있는지 아니면 일시적인 급락으로 판단하고 있는지. 김선덕 소장 반토막 아파트는 극히 일부고 아직 그 정도까지는 안 내렸다고 본다. 일시적인 급락세는 아니다. 지난해에는 대출규제와 경기침체로 인한 대출압박 등으로 하락했지만 올해는 구조조정에 따른 실업률 증가로 인한 수요감소로 더 떨어질 것이다. 박원갑 소장 버블세븐 지역은 지난 수년간 과도하게 올랐던 집값이 제 자리를 찾아가는 측면으로 해석할 수 있다. 실업률 증가로 추가 하락도 불가피하다. 다만 낙폭이 클수록 바닥권 거래도 일어날 수는 있겠지만 급등세로 돌아서는 건 불가능해 보인다. 박상언 대표 거품이 걷히는 과정이라고 생각한다. 그동안 부동산 시장을 주도하던 베이비부머 세대들의 은퇴와 맞물려 고가·대형 아파트의 수요감소는 필연적이라고 볼 때 일시적인 급락은 아니라고 본다. 고종완 대표 거품이 걷히는 과정으로 볼 수 있지만 추가 하락은 쉽지 않아 보인다. 현재까지의 낙폭과 미국 등 주요국의 하락률을 비교해 볼 때 저점 근처에 왔다고 생각한다. 따라서 추가 하락보다는 반등에 무게를 두고 싶다. ―시장에서는 집값의 추가 하락 가능성과 바닥매수 기회라는 상반된 시각이 맞서면서 수요자들이 크게 혼란스러워하고 있다. 실수요자 입장에서 본다면 내집마련 시기와 전략을 어떻게 운용해야 하나. 김선덕 소장 실수요자 입장에서는 서두를 필요가 없다. 거래가 증가하고 전세가격이 상승하는 시기가 와야 집값이 뛰기 때문에 전셋값이 6개월 이상 지속적으로 상승하는 시기에 매입에 나서는 게 좋다. 그 시기는 2010년 이후가 될 것으로 보인다. 박원갑 소장 투자보다는 실수요 위주로 접근해야 한다. 과거와 같이 단기간에 급등하기는 어렵기 때문이다. 따라서 시기를 따지기보다는 입지 여건이 좋은 곳을 대상으로 고점대비 하락폭이 큰 단지라면 매입에 나서는 것도 괜찮을 것으로 생각된다. 김학권 사장 너무 보수적으로만 볼 필요는 없을 것 같다. 주식시장이 본격적인 반등세를 탈 때 그때가 매수에 나설 때라고 본다. 아직은 이르지만 글로벌 금융위기가 잦아들면 낙폭이 컸던 강남권 등 버블세븐 지역 아파트를 매입하는 것이 좋다고 본다. 고종완 대표 맞다. 의외로 현재 가격보다 조금 더 하락할 가능성이 높은 상반기가 매수적기라고 볼 수 있다. 특히 강남권은 지난 한 해 동안 입주물량이 2만6170가구나 쏟아지면서 하락 폭이 더 커졌으나 올해는 입주물량이 4506가구로 뚝 떨어진다는 데 주목할 필요가 있다. ―주택시장이 아무리 침체돼도 뜨는 곳은 있다. 올해 주택시장 양극화도 더 심해질 것으로 보이는데 주목할 만한 곳이 있다면. 고종완 대표 정책 수혜가 예상되는 곳을 눈여겨볼 필요가 있다. 역시 강남 재건축단지와 역세권 중소형 주택이 유망해 보인다. 김학권 사장 자금력이 있는 실수요자라면 강남권 재건축 입주단지를 주목해야 한다. 서울 서초구 반포 송파구 잠실 등에서 입주하는 아파트는 과거 고점대비 4억∼5억원씩 내린 상태다. 입주물량이 몰리면서 하락했지만 주거가치가 떨어져서 하락한 것이 아니다. 따라서 재건축 예정단지보다 오히려 유망하다. 박원갑 소장 낙폭이 큰 강남권과 한강변 아파트단지는 저점에서 매수를 고려해볼 만하다. 특히 한강변 개발에 따른 수혜가 예상되는 곳은 매력이 있다. 박상언 대표 올해 개통되는 9호선 라인에 관심을 둘 만하다. 강서 마곡동과 동작 흑석동 지역을 유망지역으로 추천하고 싶다. ―지난해 강남지역에서 신규아파트 입주가 몰리면서 초유의 역전세난이 발생했는데 올해는 어떻게 될까. 고종완 대표 올해부터 강남권 신규공급 물량이 급감하기 때문에 역전세난은 해소될 것이다. 다만 서초구는 래미안퍼스티지 2444가구가 7월 중 입주하지만 역전세난까지는 가지 않을 것으로 본다. 김선덕 소장 상반기까지는 역전세난이 계속되겠지만 하반기부터는 공급과잉이 다소 해소될 것으로 본다. 박원갑 소장 꼭 그렇지만은 않다. 매매가격 하락에 따른 전세수요도 줄어들기 때문에 공급과잉이 쉽게 해소되지는 않을 것이다. 더구나 경기불황이 계속되면 역전세난은 오래갈 수도 있다. 경기 남부권은 판교신도시 입주가 시작되면서 약세가 더 두드러질 전망이다.,https://news.naver.com/main/read.nhn?mode=LSD&mid=shm&sid1=260&oid=014&aid=0002074970,157
