,date,cat,co,headline,text,url,week
104950,2008.10.01. 오전 9:17,부동산,노컷뉴스,이달부터 중대형 미분양 정부매입 추진,CBS경제부 정영철 기자 미분양 사태로 자금난을 겪고 있는 건설업체를 위해 정부가 이르면 이달 말부터 중대형 미분양주택도 매입한다. 1일 국토해양부에 따르면 대한주택보증이 지방의 미분양주택을 환매조건부로 매입하도록 허용하는 방안을 조속히 시행하기 위해 관련 절차를 서두르고 있다. 국토부는 지난달 29일 주택법 시행령 개정안을 입법예고했으며 이달 말부터 시행하는 것을 목표로 하고 있다. 환매조건부 매입은 대한주택보증이 현재 건설 중인 미분양 아파트를 분양가의 70 75%수준에서 사들이는 것으로 85㎡를 초과 중대형도 대상으로 한다. 또 현재 주공이 벌이고 있는 매입사업과 달리 건설업체가 원할 경우 일정 수수료를 더해 되살수 있다.,https://news.naver.com/main/read.nhn?mode=LSD&mid=shm&sid1=260&oid=079&aid=0001996910,143
104951,2008.10.01. 오전 9:13,부동산,아시아경제,경기도시공사 파주 LCD시티 자연앤 731가구 분양,경기도시공사는 경기도 파주시 문산읍 당동택지지구에 파주 LCD시티 자연앤 아파트 731가구를 오는 7일 분양한다. 파주 LCD시티 자연앤 은 분양가상한제가 적용돼 수도권에서는 보기 드물게 3.3㎡당 700만원 초반대에 선보이며 공급면적은 수요층이 가장 두터운 112 113㎡으로만 구성된다.,https://news.naver.com/main/read.nhn?mode=LSD&mid=shm&sid1=260&oid=277&aid=0002036656,143
104952,2008.10.01. 오전 9:00,부동산,이데일리,대한주택보증 중대형 미분양주택도 매입,이달말부터 환매조건부 방식으로 매입 나서 최대 2조원 투입 예정 이데일리 윤진섭기자 정부가 중대형 미분양 주택 매입에 나선다. 1일 국토해양부에 따르면 대한주택보증은 이르면 이달말부터 규모에 상관없이 지방 미분양 주택을 환매조건부로 매입에 나설 계획이다. 이를 위해 국토부는 지난달 29일 주택법 시행령 개정안을 입법 예고했으며 현재 의견수렴중이다. 국토부는 관계부처 협의 등을 빠르게 진행해 이달 말부터 시행하는 것을 목표로 잡고 있다. 국토부 관계자는 주공의 경우 전용면적 85㎡ 이하만 매입토록 하고 있지만 대한주택보증은 규모에 상관없이 미분양 주택을 매입할 수 있다 고 말했다. 환매조건부 매입은 대한주택보증이 현재 건설 중인 미분양 아파트를 분양가의 70 75%수준에서 사들인 뒤 준공 시점에 다시 건설사에 팔도록 하는 것이다. 미분양으로 자금난을 겪고 있는 주택건설업체를 지원하기 위한 방안으로 건설업체는 주택이 준공되는 시점에 콜 옵션을 행사해 되살 수 있다. 주택보증이 환매조건부 미분양주택 매입에 투입할 자금은 최대 2조원 정도로 추산되고 있다.,https://news.naver.com/main/read.nhn?mode=LSD&mid=shm&sid1=260&oid=018&aid=0002023277,143
104953,2008.10.01. 오전 8:59,부동산,MBN,미분양 사상 최고…중대형 미분양도 정부 매입,앵커멘트 전국 미분양주택이 16만 가구를 넘어 사상 최고 수준을 기록했습니다. 분양되지 않은 중대형 주택 매입에 나서는 등 정부가 특단의 대책 마련에 나섰습니다. 이성수 기자의 보도입니다. 기자 부동산 통계 집계 이후 전국 미분양 가구가 지난 7월 사상 최고치를 기록했습니다. 4월과 5월 소폭 줄어드는 모습을 보이던 미분양 주택 수는 정부가 지난 6월 미분양 대책을 내놓은 이후 오히려 더 큰 폭으로 늘어나는 추세입니다. 대책에서 제외됐던 수도권은 무려 21%가 늘어났고 대책의 핵심 대상이던 지방 미분양도 줄어드는 기색이 보이지 않고 있습니다. 인터뷰 김학권 세중코리아 대표 전반적인 부동산 경기가 침체된 상황에서 대출 규제가 여전히 남아 있기 때문에 미분양 해소가 당분간 쉽지는 않을 것으로 판단됩니다. 특히 중대형 아파트는 미분양이 더욱 심각합니다. 85㎡ 초과가 8만 6천여 가구로 가장 많고 60㎡ 초과 85㎡ 이하는 6만 6천여 가구 60㎡ 이하는 8천 가구에 불과합니다. 상황이 이렇자 중소형 미분양주택만 구입해 온 정부가 중대형 매입에도 나섰습니다. 국토해양부는 대한주택보증이 85㎡ 이상을 포함한 지방 미분양주택을 환매조건부로 매입하도록 허용하는 방안을 이달 말부터 시행하려고 관련 절차를 서두르고 있습니다. 환매조건부 매입은 대한주택보증이 현재 건설 중인 미분양 아파트를 분양가의 70 75% 수준에서 사들이고 나서 준공 시점에 다시 건설사에 팔게 하는 내용입니다. 건설업체는 주택이 준공되는 시점에 콜옵션을 행사해 되살 수 있고 상황이 좋지 않아 분양이 어려울 것으로 판단되면 콜옵션을 행사하지 않으면 됩니다. 주택보증이 환매조건부 미분양주택 매입에 투입할 자금은 최대 2조 원 정도가 될 전망입니다. mbn 뉴스 이성수입니다.,https://news.naver.com/main/read.nhn?mode=LSD&mid=shm&sid1=260&oid=057&aid=0000088060,143
104954,2008.10.01. 오전 8:56,부동산,헤럴드POP,9월 공동주택 2만1589가구 분양..한달새 78% 증가,지난 달 전국에서 공급된 공동주택이 한달 전보다 78% 증가했다. 1일 국토해양부에 따르면 9월에 전국에서 공급된 주택은 분양 1만2433가구 임대 8466가구 조합주택 690가구 등 총 2만1589가구로 집계됐다. 이는 8월 1만2146가구 보다 78% 증가한 수치이며 지난해 9월 2만1934가구 과는 비슷하다. 지역별로는 수도권 1만3838가구 지방 7751가구 등이다. 올 1월부터 지난 달까지 공급된 공동주택은 수도권 10만1192가구 지방 9만6460가구 등 총 19만7652가구로 지난해 같은 기간 18만1486가구 와 비교하면 9% 증가했다. 지난 달 분양물량은 6월 2만8702가구 이후 3개월 만에 2만가구선을 회복했지만 실제 분양성적은 아직 나오지 않고 있다. 7월 말 기준 미분양주택이 16만가구를 넘었을 정도로 시장상황이 나쁜 것을 고려하면 9월 분양에 들어간 공동주택 중 상당수도 미분양으로 이어질 것으로 관측된다. 또 10월 달 분양예정물량은 분양 1만5567가구 임대 1만976가구 조합주택 3915 가구 등 총 3만458가구에 이를 것으로 집계됐지만 대체로 예정 물량의 50 70% 가량만 실제 분양되는 점을 감안하면 10월에도 예년 수준을 기록할 것으로 예상된다.,https://news.naver.com/main/read.nhn?mode=LSD&mid=shm&sid1=260&oid=112&aid=0001955754,143
104955,2008.10.01. 오전 8:56,부동산,헤럴드POP,‘김윤규’표 오피스텔 청약률 최고  32.7 대 1,아천세양건설 김윤규 회장의 첫 작품으로 관심을 모은 ‘신림역 아르비채’ 오피스텔이 청약 마감 결과 최고 32.7대 1의 청약경쟁률로 마감했다. 1일 아천세양건설에 따르면 신림역 아르비체 오피스텔은 9월30일까지 이틀간 청약접수를 받은 결과 평균 26.1 1의 경쟁률을 나타냈다. 군별로는 1군이 32.7 1 2군 22.9 1 3군 21.4 1 등으로 군별로 비교적 고른 수치를 냈다. 옛 신림극장 자리에 위치한 신림역 아르비채 오피스텔은 지하철 2호선 신림역에서 도보로 2분거리로 전 가구가 바닥난방이 가능한 초고층 오피스텔 지하8층 지상 26층 이다. 47 123㎡ 총 414가구 규모로 분양가는 3.3㎡당 790 910만원이다. 소형 평형이 전체의 80%를 차지하며 무제한 전매가 가능해 실수요자는 물론 임대사업자 투자자들의 관심을 끌었다는 분석이다. 계약금은 분양가의 10%이며 중도금은 최대 50%까지 대출이 가능하다. 당첨자 발표는 10월 6일 삼모포커스 아르비채 견본주택 및 홈페이지 hp www.seyang.co.kr sillim 에서 확인할 수 있으며 계약일은 10월7 8일 이틀간이다.,https://news.naver.com/main/read.nhn?mode=LSD&mid=shm&sid1=260&oid=112&aid=0001955751,143
104956,2008.10.01. 오전 8:34,부동산,아시아경제,대전 3·4산업단지 이름 ‘대덕산업단지’로,내일부터 대전시 제3·4산업단지 이름이 ‘대덕산업단지’로 바뀐다. 대전시는 1일 산업단지 특색과 지역이미지를 잘 나타낼 수 있는 이름변경을 위해 입주기업설문조사와 시 홈페이지 시민의견수렴을 통해 결정했다고 밝혔다.,https://news.naver.com/main/read.nhn?mode=LSD&mid=shm&sid1=260&oid=277&aid=0002036623,143
104957,2008.10.01. 오전 8:23,부동산,아시아경제,서초구 아파트값 1년10개월만에 10억 붕괴,강남권 고가아파트의 하락세가 계속되면서 서초구 평균 아파트값이 1년10개월만에 10억원 밑으로 떨어졌다.부동산정보업체 부동산써브에 따르면 서초구 소재 아파트 6만4697가구를 대상으로 시세를 조사한 결과 평균 아파트값이 9억9977만원을 기록했다.,https://news.naver.com/main/read.nhn?mode=LSD&mid=shm&sid1=260&oid=277&aid=0002036616,143
104958,2008.10.01. 오전 7:56,부동산,헤럴드POP,분당ㆍ서초 6억 잠실u30008억원…아파트 가격저항선 붕괴,분당ㆍ서초 6억원 잠실 8억원…. 대한민국 집값상승을 견인하던 지역의 105 109㎡ 32 33평형 아파트값이다. 미국발 금융위기여파의 충격으로 최근 버블세븐지역을 중심으로 아파트값이 하락세를 보이면서 심리적 가격 저항선이 속속 무너지고 있다. 정부의 각종 규제완화 폭탄에도 불구하고 경기침체와 유동성 위기 심리적 불안감으로 매수자들이 관망세로 돌아서면서 지역별로 형성됐던 암묵적 저지선의 통념이 깨지고 있는 것이다. 1일 부동산업계 관계자는 “분당과 서초에는 6억원을 들고 가면 30평대 아파트를 살수 있고 재개발전에 13억원까지 올랐던 잠실지역 30평대 아파트도 8억원이면 구입할 수 있다”고 밝혔다. 실제 부동산 업계에 따르면 최근 집값이 큰 폭으로 하락한 분당신도시의 경우 105 109㎡ 32 33평형 의 저지선으로 여겨졌던 6억원이 붕괴됐다. 수내동 양지청구 109㎡는 5억9000만원에 매물이 나와 있다. 이매동 이매삼성 105 ㎡는 5억8000만원이면 당장에 구입할 수 있고 수내동 양지금호 105㎡는 5억3000만원 짜리 매물이 나와 있다. 연초만해도 6억3000만 7억3000만원을 호가하던 아파트들이 불과 몇개월사이에 1억원 이상이 하락한 것이다. 분당에서 109㎡ 아파트 가격이 6억원밑으로 깨진 것은 2년 만에 처음이다. 매물이 쌓여 있는데 매수세가 전혀 없기 때문에 약세를 면치 못하고 있다는게 현지 부동산 업자들의 분석이다. 강남권 102 109㎡의 가격이 10억원대 밑으로 떨어진지는 이미 오래다. 강남구 은마아파트 102㎡는 9억3000만원선의 매물이 나오며 연초대비 평균 5000만원 하락했다. 서초구 잠원동 한신21차 132㎡는 2007년 1월 11억8000만원까지 올라갔으나 현재 9억7500만원으로 2억500만원 떨어졌다. 지난해 1월 13억3500만원까지 거래됐던 송파구 문정동 올림픽훼미리 142㎡는 10억원이 붕괴돼 현재 9억7000만원에 거래됐다. 이들 지역의 경우 급매물이 나와도 매수자가 없기 때문에 알음알음으로 8억원대에 거래되는 경우도 많다. 최근 경기침체에 거래가 위축되면서 심리적 저항선이 여지없이 무너지고 있는 것이다. 뿐만 아니라 경부고속도로축을 따라 형성된 용인지역도 하락세를 면치 못하고 있다. 5억원대를 심리적 마지노선으로 간신히 지켜온 용인 성복지역의 105 109㎡ 아파트들도 폭락하고 있다. 성복동 경남아너스빌 109㎡는 4억6000만 4억9000만원의 매물이 나오면서 연초 대비 평균 6500 만원 하락했다. 신봉동 일대 아파트들도 연초대비 8000만원 가량 빠져 화성 동탄신도시와 비슷한 수준까지 추락했다. 문제는 최근 경기침체와 맡물려 속락하고 있는 부동산 가격이 전체 경제에 악영향을 미칠 가능성이 크다는 것이다. 부동산에 낀 거품이 빠지는 것은 바람직하지만 폭락에 가까운 갑작스런 집값하락이 금융불안과 금융권 부실로 이어질 가능성이 높다. 재경부 관계자는 “집값하락은 피할 수 없지만 문제는 경착륙”이라면서 “집값폭락이 국가경제 전체에 연쇄적으로 미칠 충격을 최소화하는데 부심하고 있다”고 우려했다.,https://news.naver.com/main/read.nhn?mode=LSD&mid=shm&sid1=260&oid=112&aid=0001955738,143
104959,2008.10.01. 오전 7:38,부동산,아시아경제,김윤규 오피스텔 청약률 26대 1 마감,김윤규 아천세양건설 회장 전 현대아산 부회장 의 첫 작품으로 관심을 끈 신림역 아천세양아르비채 오피스텔 청약율이 평균 26.1 1로 마감됐다. 1일 아천세양건설에 따르면 지난 29일과 30일 청약 접수를 마감한 결과 소형 평형으로 인기가 높은 1군 계약면적 47∼55㎡ 의 최고 청약률은 32.7대 1을 기록했으며 2군 61∼66㎡ 과 3군 86㎡ 123㎡ 은 각각 22.9대 1과 21.4대 1의 경쟁률을 보였다.,https://news.naver.com/main/read.nhn?mode=LSD&mid=shm&sid1=260&oid=277&aid=0002036575,143
104960,2008.10.01. 오전 7:34,부동산,이데일리,9월 공동주택 2만1589가구 분양,이데일리 윤진섭기자 9월 전국에서 공급된 공동주택이 8월 대비 78% 증가한 2만1000가구를 넘어섰다. 1일 국토해양부에 따르면 9월에 전국에서 공급된 주택은 분양 1만2433가구 임대 8466가구 조합주택 690가구 등 총 2만1589가구로 집계됐다. 이는 8월 1만2146가구보다 78% 증가한 것이며 작년 9월 2만1934가구와 비슷한 수준이다. 이에 따라 올 1월부터 지난달까지 공급된 공동주택은 수도권 10만1192가구 지방 9만6460가구 등 총 19만7652가구로 작년 18만1486가구와 비교하면 9% 증가했다. 이번달 분양 예정물량은 분양 1만5567가구 임대 1만976가구 조합주택 3915가구 등 총 3만458가구에 이를 것으로 집계됐다.,https://news.naver.com/main/read.nhn?mode=LSD&mid=shm&sid1=260&oid=018&aid=0002023220,143
104961,2008.10.01. 오전 6:39,부동산,동아일보,광주전남광주지역 땅값 상승률 전국서 가장 낮았다,동아일보 김대중 노무현 정부가 집권했던 10년간 광주지역 땅값 상승률이 전국에서 가장 낮았다는 통계가 나왔다. 국회 국토해양위 소속 한나라당 김정권 경남 김해 의원이 최근 공개한 국토해양부 국감자료에 따르면 1998년 7월부터 올해 7월까지 10년간 광주지역 땅값 상승률은 6.01%로 전국 16개 광역자치단체 가운데 가장 낮았다. 전남과 전북지역도 각각 16.22% 15.25%로 전국 평균 상승률 41.21% 의 절반에도 못 미쳤다. 이 기간 땅값이 가장 많이 오른 곳은 서울 63.35% 이었고 △경기 57.82% △충남 47.18% △인천 46.27% △충북 29.67% △제주 28.08% △대전 25.57% △강원 19.89% 등이 뒤를 이었다. 노무현 정부 2003년 10월∼2008년 7월 시절 광주 땅값 상승률은 6.14%로 전국 최하위였고 전남 8.48% 전북 10.39% 도 같은 기간 전국 땅값 상승률 25.20% 의 절반에도 못 미쳤다. 이 기간 서울은 37.34%로 가장 많이 올랐고 행정수도 이전 바람을 탄 충남 35.59% 경기 29.63% 가 뒤를 이었다. 김대중 정부 1998년 7월∼2003년 9월 에서는 전남 땅값이 전국에서 7번째 상승률을 보였다. 이 기간 전남지역 지가상승률은 7.14%로 전국 평균 12.79%에 못 미쳤으나 수도권 충청권 제주도를 제외하고는 가장 높았다. 그러나 ‘전남도청 무안 이전’ 영향으로 광주 땅값은 오히려 0.12% 떨어져 전국 유일의 ‘하락지역’으로 꼽혔다. 이 기간 경기지역 땅값상승률이 21.75%로 최고를 차지했고 서울 18.94% 제주 16.46% 인천 15.51% 충북 10.25% 충남 8.55% 순이었다.,https://news.naver.com/main/read.nhn?mode=LSD&mid=shm&sid1=260&oid=020&aid=0001993140,143
104962,2008.10.01. 오전 6:29,부동산,동아일보,대구경북대구 대명동 노후단지 ‘타운 하우스’로 개발,동아일보 대구의 노후 주택단지를 고급 단독주택 지구로 재개발하는 방안이 적극 추진된다. 대구시는 30일 이 같은 내용이 담긴 ‘대구 그랜드디자인 기본구상’을 발표했다. 이 구상에 따르면 도시의 품격을 높이기 위해 지역 노후 단독 주택지를 고급 단독주택 단지인 ‘타운 하우스’ 형태로 개발하기로 했다. 대구시는 노후 단독주택이 몰려 있는 남구 대명동 등의 주택단지를 타운하우스로 재개발할 경우 민간사업으로 추진하되 필요하면 시가 지원하는 방안을 강구키로 했다. 또 시 외곽지가 산업단지 위주로 개발돼 주거공간이 부족한 문제점을 보완하기 위해 택지도 함께 개발하는 결합개발 제도를 도입하고 도심의 낡고 오래된 공장용지 등을 문화·산업 공간으로 재개발하는 사업도 함께 추진키로 했다. 대구시 관계자는 “향후 100년 도시개발의 밑그림이 될 기본구상을 마련했다”며 “시민과 전문가 등의 의견을 수렴한 뒤 이달 말 최종안을 확정할 예정”이라고 말했다.,https://news.naver.com/main/read.nhn?mode=LSD&mid=shm&sid1=260&oid=020&aid=0001993137,143
104963,2008.10.01. 오전 6:05,부동산,연합뉴스,이달 말부터 중대형 미분양주택도 정부가 매입,주택보증 2조원 규모 여유자금 투입 서울 연합뉴스 박성제 기자 정부가 빠르면 이달말부터 중대형 미분양주택도 매입한다. 지금까지 정부는 중소형 주택만 매입해 왔으나 최근 미분양주택 증가가 중소형보다는 중대형에서 이뤄지고 있는 데 따른 조치이다. 1일 국토해양부에 따르면 대한주택보증이 지방의 미분양주택을 환매조건부로 매입하도록 허용하는 방안을 조속히 시행하기 위해 관련 절차를 서두르고 있다. 이를 위해 국토부는 지난달 29일 주택법 시행령 개정안을 입법예고했으며 현재 의견수렴중이다. 국토부는 관계부처 협의 등을 빠르게 진행해 이달 말부터 시행하는 것을 목표로 잡고 있다. 환매조건부 매입은 대한주택보증이 현재 건설중인 미분양 아파트를 분양가의 70 75%수준에서 사들인뒤 준공 시점에 다시 건설사에 팔게 된다. 미분양으로 자금난을 겪고 있는 주택건설업체를 지원하기 위한 방안으로 건설업체는 주택이 준공되는 시점에 콜옵션을 행사해 되살 수 있다. 시장상황이 좋지 않아 분양이 어려울 것으로 판단되면 콜옵션을 행사하지 않으면 된다. 주택보증이 환매조건부 미분양주택 매입에 투입할 자금은 최대 2조원 정도가 될 전망이다. 미분양주택의 공공기관 매입은 대한주택공사에 이어 주택보증이 두번째이다. 주택공사는 2006년 말부터 지방의 준공후 미분양인 중소형 주택을 사들여 왔다. 주택보증은 전용면적 85㎡를 초과하는 중대형도 매입한다는 점에서 주택공사와는 차이가 있다. 정부가 중대형매입까지 하기로 한 것은 최근 미분양 증가가 중대형에서 많기 때문으로 여겨진다. 실제로 7월말 기준 미분양주택을 규모별로 보면 85㎡ 초과가 8만6천386가구로 가장 많고 60㎡초과 85㎡이하는 6만6천206가구 60㎡이하는 8천3가구에 불과하다. sungje yna.co.kr 긴급속보 SMS 신청 포토 매거진 스포츠뉴스는 M SPORTS 저작권자 c 연합뉴스. 무단전재 재배포금지. 관련기사 미분양주택 16만가구 돌파..사상 최고 11월부터 주택거래신고지역내 60㎡이하도 신고해야 9월 공동주택 2만1천여가구 분양..전월보다 78%↑ 아파트 가격 저항선 무너진다.,https://news.naver.com/main/read.nhn?mode=LSD&mid=shm&sid1=260&oid=001&aid=0002291390,143
104964,2008.10.01. 오전 6:01,부동산,연합뉴스,아파트 가격 저항선 무너진다...분당 109㎡ 6억 붕괴,서울 연합뉴스 서미숙 기자 최근 버블세븐 지역을 중심으로 아파트값이 하락세를 보이면서 심리적 가격 저항선이 속속 무너지고 있다. 정부의 각종 규제 완화에도 추진에도 경기침체로 매수자들이 꿈쩍 않으면서 지역별로 암묵적으로 형성돼 있는 어떤 지역의 어떤 주택형의 가격은 얼마일 것 이라는 통념이 깨지는 것이다. 1일 부동산 업계에 따르면 최근 집값이 큰 폭으로 하락한 분당신도시의 경우 105 109㎡ 32 33평형 의 저지선으로 여겨졌던 6억원이 붕괴됐다. 수내동 양지청구 109㎡는 5억9천만원에 매물이 나와 있고 이매동 이매삼성 105㎡는 5억8천만원에 살 수 있다. 수내동 양지금호 105㎡는 5억3천만원짜리 매물이 나와 있다. 이들 아파트는 올 연초만해도 6억3천만 7억3천만원을 호가했던 것들이다. 인근 지역 중개업소 관계자는 분당 109㎡가 6억원이 깨진 것은 2년 만에 처음 이라며 매물은 쌓여 있는데 매수세가 없다 보니 가격이 약세를 면치 못하고 있다 고 말했다. 용인 성복지역의 105 109㎡는 심리적 마지노선인 5억원이 붕괴됐다. 성복동 경남아너스빌 109㎡는 4억6천만 4억9천만원의 매물이 나오면서 연초 대비 평균 6천500만원 하락했다. 신봉동 LG신봉자이 1차 109㎡는 올 봄에도 5억 5억5천만원 이상 호가하던 것이 4억1천만 4억9천만원으로 연초대비 8천500만원 내렸다. 이 정도 시세는 화성 동탄신도시의 시범다은 우남 115㎡ 4억9천만 5억500만원 시범한빛 금호 109㎡ 4억3천만 4억5천만원과 비슷한 수준이다. 신봉동의 한 중개업소 사장은 용인 아파트값이 동탄신도시 가격과 맞먹는다는 것은 시장 침체가 심각한 수준이라는 방증 이라며 요즘엔 급매물이 나와도 좀처럼 소화가 되지 않는다 고 말했다. 강남권의 102 109㎡는 10억원대 이하로 떨어진 곳이 등장한 지 오래다. 강남구 은마아파트 102㎡는 9억3천만원선의 매물이 나오며 연초대비 평균 5천만원 하락했다. 또 서초구 잠원동 한신21차 132㎡는 2007년 1월 11억8천만원까지 올라갔으나 현재 9억7천500만원으로 2억500만원이 떨어졌고 재건축 단지인 주공1단지 72㎡도 10억7천만원에서 현재 9억5천500만원으로 1억1천500만원이 하락했다. 송파구는 문정동 올림픽훼미리 142㎡는 지난해 1월 13억3천500만원까지 올랐으나 지금은 9억7천만원으로 10억원이 붕괴됐다. 스피드뱅크 김은경 팀장은 최근 경기침체에 거래가 위축되면서 심리적 저항선이 여지없이 무너지고 있다 며 실수요자라면 최근 나오는 급매물 추이를 봐가며 매수하는 것도 방법 이라고 말했다.,https://news.naver.com/main/read.nhn?mode=LSD&mid=shm&sid1=260&oid=001&aid=0002291382,143
104965,2008.10.01. 오전 6:01,부동산,아시아경제,올 19월 공동주택 19만7천여가구 공급,올 1일부터 9월까지 전국에서 공급된 공동주택은 19만7652가구로 전년도 같은 기간 18만1486가구에 비해 9% 증가했다. 특히 9월 한달간은 전국에서 2만1589가구의 공동주택이 공급 전년 같은 기간 2만1589가구와 비슷한 수준이다.,https://news.naver.com/main/read.nhn?mode=LSD&mid=shm&sid1=260&oid=277&aid=0002036536,143
