,date,cat,co,headline,text,url,week
67606,2007.10.25. 오후 12:51,부동산,이데일리,은평뉴타운1지구 1643가구 일반분양,이데일리 윤도진기자 서울 은평뉴타운 1지구의 일반공급 물량은 예정대로 1643가구가 된다. 25일 SH공사 관계자는 1지구 분양아파트 총 3338가구 중 특별공급 물량 1174가구를 제외한 1643가구를 12월 중 분양할 것 이라고 밝혔다. 은평뉴타운 1지구에 건립되는 아파트는 총 4660가구. 이 중 임대아파트와 원주민 특별공급물량 1174가구 을 제외한 전용 59 167㎡ 78 211㎥ 형 1643가구가 일반공급 물량이 된다. SH공사는 1지구와 2지구를 포함한 특별공급 물량 총 3338가구는 분양가 상한제에 따른 전매제한을 피해 11월 중에 일괄적으로 분양할 계획이다. 당초 업계에서는 2지구 특별공급 분양시점이 11월로 당겨지며 1지구 분양물량이 축소되는 것 아니냐는 우려가 있었다. SH공사는 2지구 특별공급분과 1지구 물량은 전혀 별개라는 입장이다. SH공사 관계자는 투기성 청약방지를 위해 일반청약을 12월 이후에 하는 안에 대해 건교부도 긍정적으로 보고 있는 것으로 알려졌다 며 같은 차원에서 거주기간에 따른 자격요건도 분양공고 시점으로 할지 1년 이상 거주 제한을 둘 지 논의 하고 있다 고 덧붙였다.,https://news.naver.com/main/read.nhn?mode=LSD&mid=shm&sid1=260&oid=018&aid=0000530808,94
67607,2007.10.25. 오후 12:50,부동산,이데일리,재테크광고용인땅 6만8000원㎡ 선착순 특별매각공고,용인I.C에서 5분 거리 수도권 투자 1번지 이데일리 주 용인미래타운은 용인시 처인구 양지면 주북리 일대 회사 보유분 토지를 선착순 분양한다. ㎡당 분양가는 68 000원으로 495∼661㎡ 150∼200 기준 총 분양가는 3300∼4500만원선이다. 앞으로 10년간 경기도 용인 개발의 청사진이 될 2020년 용인 도시기본계획이 건설교통부로부터 최종승인을 받았다. 그동안 개발이 집중됐던 서북부 대신 미개발지가 많은 동남부 740만평에 새로 시가지화 예정용지로 지정했다. 특히 동남부 양지면 일대는 전원생활을 누리려는 일반인들에게 유망지역으로 각광받고 있고 이미 전문가들 사이에서는 용인시 동남부를 노려라는 말이 나올 정도로 일반화 되어 있다. 이번에 분양에 들어가는 양지면 주북리 일대 토지는 서울 강남에서 30분대 진입 용인IC에서 5분거리 영동고속도로 8차선확장공사 57번 자동차전용도로 금이IC에서 2분 용인경전철에서 3분거리로 주변 인프라가 잘 갖추어진 토지이다. 더욱이 요즘 인기가 많은 대형 전원주택단지와 타운하우스가 주변에 개발중에 있으며 토지거래허가구역 제외지역이라 투자자들이 선호하는 모든 조건을 갖추었다. 에스크로우제도 법무사를 통한 제3자 안전거래 보장제 접수 방식으로 신청금 100만원을 기업은행 038 082164 01 015 김안식법무사 로 입금하면 필지 배정우선권을 부여받아 답사 전까지 토지를 확보 할 수 있다. 현장 답사 후 계약 결정이 가능하고 신청 철회시 전액 환불된다.,https://news.naver.com/main/read.nhn?mode=LSD&mid=shm&sid1=260&oid=018&aid=0000530806,94
67608,2007.10.25. 오후 12:40,부동산,이데일리,재테크광고충주호 땅 회사보유분 5필지한정매각,이데일리 땅에 투자할 생각을 갖으신 분이라면 눈여겨 볼 물건이 나왔다. 약 천만원대 정도로도 661㎡ 200평 991㎡ 300평 의 전원토지를 구입할 수 있어 특히 소액 투자자들에겐 안정맞춤일 것으로 생각되며 향후 주변개발 호재로 지가 상승도 기대된다. 전원주택지 및 대기업 연수원 부지로 큰 인기를 끌고 있는 충주호수 주변토지를 3.3㎡당 5만5000원 15만9000원에 매각한다. 1만6700원기준 827㎡ 250평 1 375만원 이번 매각 토지는 주변 낚시터와 관광단지활용이 용이해 향후 펜션 전원주택 연수원부지 등 다양한 활용이 가능하다. 매각은 선착순 필지 배정 방식으로 진행된다. 토지거래허가제외지역이며 대단위 전원주택단지 개발예정지와 접하고 있어 투자가치가 높아 조기매각될 것으로 예상된다. 충주호 주변 개발계획으로는 제천개발촉진지구 총 3 612억원의 사업비가 투자되는 리조트 단지로 약 170만평의 규모로 스키장과 72홀 규모의 골프장 골프대학 호텔 등이 2012년까지 완공될 계획이다. 또한 제천시는 한방특화도시로서 조성을 위해 오는 2010년까지 4612억원이 투입되고 매각 지역 인근에는 대규모 온천리조트 계획이 확정되어 있다. 교통망도 중앙고속도로 제천 IC와 남제천 IC가 있고 동서고속도로 안중 삼척 서울 덕소 양평 원주 신림 제천을 잇는 중앙선 복선 전철 행정도시와 연결되는 청원 충주간 도로가 개통될 예정이다. 신청금 100만원을 신한은행 110 222 037890 예금주 조현묵 법무사 으로 입금하면 필지 배정 뒤 현장답사를 통해 계약을 결정한다. 소유권 이전등기는 물론 분양에 대한 모든 자금 관리는 조현묵 법무사에서 관리 하며 미계약 시 신청금도 법무사에서 책임지고 100% 환불 한다. 한정물량으로 조기마감 예상된다.,https://news.naver.com/main/read.nhn?mode=LSD&mid=shm&sid1=260&oid=018&aid=0000530800,94
67609,2007.10.25. 오후 12:35,부동산,이데일리,재테크광고1필지 290만원 철원토지 선착순매각,임도 벌목 기초공사 완료 이데일리 신철원의 4차선도로와 인접한 조합보유 토지를 주 철원산림영농조합에서 금일 선착순 매각한다. 165㎡ 50 단위부터 소유권이전이 가능하고 총 투자금액은 290만원 선으로 1인 최대 1000㎡ 303 까지 매입이 가능하다. 신철원은 경전철이 확정된 경기도 포천과 인접해 서울 강남을 기준으로 현장까지는 1시간대 거리로 접근성이 좋으며 추가개통을 앞둔 신설도로들이 개통이 되면 거리는 더욱 가까워진다. 최근 남북정상회담으로 토지개발에 활기를 띠고 있는 철원일대는 민.관 공동으로 80여만평 종합리조트 개발계획을 수립하는등 성장 잠재력이 충분한 만큼 투자자들의 많은 관심이 집중되고 있다. 또한 철원군일대의 접경지역에 경제특구와 관광특구를 설치할 계획도 전해지고 있어 향후 큰폭의 지가상승과 년10%정도의 수익이 예상된다며 조합측은 설명했다. 선착순 신청접수 방식으로 신청금 10만원을 농협 235 01 198346 주 철원산림영농조합 입금하면 담당자가 해당 평수의 필지를 선착순 임의 배정한다. 매각토지는 위탁관리가 가능하고 10년간 매년 25만원상당의 철원의 특산품인 철원청정미와 자연산두릅 산도라지등 지급된다. 한정 물량으로 조기마감이 예상되며 신청철회시 신청금은 전액반환된다.,https://news.naver.com/main/read.nhn?mode=LSD&mid=shm&sid1=260&oid=018&aid=0000530796,94
67610,2007.10.25. 오후 12:25,부동산,이데일리,재테크광고112000원 청평 전원주택지 1차분양,청약선착순 9세대 등기이전비용 면제 정남향 우선 배정 이데일리 가평군 청평면 대성리 청평 에코힐 전원주택 단지를 금일부터 ‘농업법인 주 케이씨엔와이’에서 선착순 한정 분양한다. 분양필지는 기차역인 대성리역에서 2분거리로 천혜의 계곡에 접해있으며 토지분할 및 공부정리가 완료된 개별필지로 잔금 납입후 즉시 소유권 이전 등기가 가능하다. 면적은 495 992㎡ 150 300평 이며 분양가는 112 000원 ㎡으로 모든 인허가 및 토목공사가 포함된 총분양가는 5천5백만원대로 언제라도 건축이 가능하도록 설계 인허가 및 6m 포장도로 전기 상하수도 기본석축공사 등을 농업법인에서 직접 시행 시공 및 일괄분양 하여 주변시세보다 훨씬 저렴하다는 것이 회사측의 설명이다. 또한 신설 46번 자동차전용도로 완공됨에 따라 서울에서 30분대 거리이며 경전철 개통으로 대중교통수단 이용이 가능한 역세권 전원주택지를 찾는 실소비자와 땅테크를 선호하는 투자자들에게 최고의 투자기회로 주목할 만하다. 분양방식은 법무사가 직접 자금관리하는 에스크로우 제도 로 청약금 100만원을 농협은행 207017 51 045099 강주원법무사 에 입금하면 접수가 된다. 특히나 1차분 30세대 중에서 청약 선착순 9세대에 한해 등기이전비용 전액을 회사에서 지원해줌은 물론 정남향 필지 우선 배정의 기회도 주어진다. 청약은 물론 잔금 및 등기완료시까지 해당법무사에서 책임 관리하고 현장 답사 후 미계약시 청약금은 법무사를 통해 전액 반환된다.,https://news.naver.com/main/read.nhn?mode=LSD&mid=shm&sid1=260&oid=018&aid=0000530791,94
67611,2007.10.25. 오후 12:17,부동산,헤럴드경제,거여ㆍ마천 뉴타운 ‘개점휴업’,재정비계획 발표 불구 일반분양 물량 적어 실망…거래 ‘썰렁’ 현장 스케치 “재정비기본계획안 공개에도 불구하고 문의조차 없습니다” 24일 준강남권의 차세대 주거지로 관심을 모으고 있는 거여.마천 재정비촉진지구 일대 현장은 쥐죽은 듯 조용했다. 거래 공백 상태가 이어진 가운데 23일 주민공람을 위한 재정비기본계획안이 언론에 공개됐지만 기대감과 달리 현장은 정막한 상태였다. 송파구가 기존의 고층 아파트 일색에서 중.저층 아파트와 연립주택 단독주택 등으로 구성한 저밀도 주거지역으로 개발 방향을 정한 데 따른 파장이다. 사업성이 크게 악화될 것이란 우려를 현장 곳곳에서 들을 수 있었다. 잠정적으로 집계된 거여.마천 재정비촉진지구 내 가구수는 7749 규모다. 송파구는 정비사업 이후 이를 1만1090 가구로 확대키로 했다. 하지만 이 가운데 임대 비율을 17% 이상으로 잡고 있어 일반 분양 물량은 크게 줄어들게 된다. 17%를 기준으로 한다면 일반분양 물량은 1885가구에 불과하게 된다. 게다가 분양가상한제까지 적용받게 돼 조합원들의 부담금이 크게 늘어나 투자성이 떨어질 수 있다는 지적이다. 거여.마천 재정비촉진지구 내 정비구역은 모두 7개로 구성돼 있으나 아직 조합 설립이 이뤄진 곳은 없다. 모두 가칭 추진위 설립 상태다. 그나마 촉진구역으로 지정받은 곳은 거여2구역 재개발 사업지와 과 마천시장 시장정비사업지 일대만 진척이 비교적 빠르게 진행될 전망이다. 나머지 5개 구역은 존치정비구역과 존치관리구역으로 지정돼 2010년 이후에 사업이 시행될 것으로 보인다. 거여2구역은 과거 롯데건설이 재개발을 추진하던 곳이어서 사업 진행이 가장 빠를 것으로 예상된다. 거여 마천 일대는 과거 철거민의 집단이주 지역으로 무허가 건물이 많다. 무허가 건물의 시세는 19.8㎡ 33㎡ 6 10평 지분의 소형 물건이 3.3㎡당 3000만 3500만원 선이다. 건물만 소유하게 되는 시유지 위 건물은 3.3㎡당 2000만원 선이다. 새로 지어진 소형 빌라는 3.3㎡당 4000만원 선이다. 또 대지지분 99㎡이상 30평이상 의 단독주택은 3.3㎡당 1800만 2000만원 선이다. 19.8㎡ 6평 이상은 모두 토지거래허가대상이어서 실거주가 아니면 투자가 쉽지 않다. 신유안공인의 이범재 사장은 “일반분양물량이 예상보다 적어 조합원 부담이 다소 늘어날 수 있다”며 “거여 2구역 등 사업 추진 속도가 빠를 것으로 보이는 지역에 투자 우선 순위를 두는 게 나을 것”이라고 설명했다. 토지거래허가의 규제를 피해 실거주를 면할 수 있는 경매시장에선 매물을 찾기가 힘들다. 실제로 올해 10월까지 일대에서 경매로 나온 물건은 불과 7건에 불과했다. 또 이마저도 대부분 취하나 경매 중지로 진행이 되지 않아 3건만 낙찰이 이뤄졌다. 가장 최근에는 지난 15일 대지지분 26㎡ 8평 의 다세대 주택이 경매로 나와 3억6400만원에 낙찰됐다.,https://news.naver.com/main/read.nhn?mode=LSD&mid=shm&sid1=260&oid=016&aid=0000255632,94
67612,2007.10.25. 오후 12:17,부동산,헤럴드경제,미분양 서울 도심ㆍ강남권까지 확산,도곡리슈빌파크ㆍKCC웰츠타워 등 청약부진 아파트 미분양세가 서울 도심과 강남권까지 대거 확대되고 있다. 25일 금융결제원에 따르면 3.3㎡당 최고 4000만원을 넘는 최고가 아파트로 화제를 모았던 강남 도곡 리슈빌파크는 23 24일 1 2순위 청약결과 일반분양 32가구 중 3가구만 신청했으며 이마저 일반층 수요자가 아닌 펜트하우스 수요자인 것으로 알려졌다. 3 4순위 대기수요도 비싼 분양가에다 소규모 단지 낮은 브랜드 인지도 등으로 청약과 계약이 용이하지않을 것으로 현지 중개업소들은 보고 있다. 마포로 주변에서 공급된 KCC웰츠타워 주상복합아파트 역시 비슷한 결과를 보였다. 24일 1순위 청약결과 일반분양 총 118가구 중 19가구만 청약돼 무려 99가구가 대거 미달됐다. 각각 24가구씩을 모집한 133㎡ 135㎡는 3명씩만 청약했으며 149㎡는 73가구 중 13가구만 청약했다. 역시 단지 규모가 적고 분양가가 비싸다는게 현지 분위기이다. 3.3㎡당 1800만 2300만원으로 인근 시세에 버금갈 정도라는 것. 지난달말 강남권 소규모 단지의 0 청약에 이어 이번 도곡 리슈빌과 마포로 KCC웰츠타워 주상복합아파트의 청약부진은 미분양세가 도심권까지 확산되고 있음을 보여주는 사례로 분석되고 있다. 한편 충남 천안에서 분양중인 주상복합아파트 펜타포트 793가구 는 24일 1순위 청약결과 평균 2.85대 1의 경쟁률을 기록해 비교적 양호한 것으로 나타났다. 이는 분양권 전매가 결정적인 영향을 미친 것으로 해석된다. 펜타포트 이원익 사장은 “투기과열지구 해제로 분양권 전매가 가능한데다 지역 최고의 입지 대단지 편의시설을 갖춘 복합개발에 대한 기대감으로 관심들이 높았다”고 설명했다.,https://news.naver.com/main/read.nhn?mode=LSD&mid=shm&sid1=260&oid=016&aid=0000255627,94
67613,2007.10.25. 오후 12:17,부동산,헤럴드경제,주목받는 국내 건설 3社 현대건설 태안기업도시로 ‘국내 NO.1’ 가속페달,현대건설이 ‘태안기업도시’라는 새로운 성장동력을 장착하고 ‘국내 NO.1 글로벌 리더’ 목표를 향해 가속도를 내고 있다. 현대건설은 지난 24일 국내 첫 기업도시인 관광레저형 태안기업도시 착공식을 갖고 대역사에 착수했다. 오는 2020년까지 장장 13년간에 걸쳐 완성할 태안기업도시는 총 9조156억원을 들여 태안군 태안읍.남면 천수만 간척지 B지구 일원 1464만4000㎡ 442만평 에 100층 규모의 랜드마크 빌딩을 중심으로 국내 최대 규모인 6개 골프장 108홀 과 테마파크 국제비즈니스단지 웰빙타운 첨단복합산업단지 주말농장 비즈니스호텔 마리나센터 등을 갖춘 세계 최고 수준의 관광.휴양도시로 건설된다. 이곳에는 아파트 등 공동주택 5200가구와 단독주택 800가구 등 6000가구의 주거단지가 조성돼 1만5000명이 상주한다. 이종수 현대건설 사장은 “기업도시 조성이 완료되는 2020년까지 14조원이 넘는 생산유발 효과와 16만명의 고용 효과 연간 780만명 이상의 관광객 유치가 가능할 것”이라며 “태안기업도시가 프랑스의 그랑모트나 미국의 디즈니랜드를 능가하는 세계적인 수준의 관광레저도시로 자리잡을 수 있도록 최선을 다하겠다”고 강조했다. 한편 현대건설은 태안기업도시에 조성되는 상업업무용지와 주거용지를 각각 3단계로 나눠 2009년부터 2012년까지 순차적으로 분양할 계획이다. 주거용지의 경우 임대단지용은 추첨방식으로 공급하고 일반 주거시설용은 경쟁입찰과 추첨방식을 혼용할 예정이다.,https://news.naver.com/main/read.nhn?mode=LSD&mid=shm&sid1=260&oid=016&aid=0000255623,94
67614,2007.10.25. 오후 12:17,부동산,헤럴드경제,주목받는 국내 건설 3社 현진에버빌 불황 속 인재채용등 ‘공격경영’ 눈길,현진에버빌이 시장불황속에서 공격 경영에 나서 눈길을 끌고 있다. 사옥 건설로 회사를 분당신도시로 옮긴 현진은 연말까지 수도권 인근에서 1100여 가구의 대규모 분양에 나서는 데 이어 100여 명의 인재채용을 추진하는 등 본격적인 사세 확장을 꾀하고 있다. 연말까지 분양하게 될 해당 사업지는 수원 망포동 530가구 곤지암 2차 376가구 이천 갈산동 168가구 등으로 비교적 수요가 탄탄한 수도권 분양에 나설 계획이다. 특히 수원 영통구 망포동에 공급될 현진에버빌은 중대형아파트 총 530가구로 2010년에 개통예정인 분당연장선의 영통역. 방죽역 수혜지역에 위치해 있다. 곤지암2차 현진에버빌은 공급이 뜸했던 광주에 건설하는 전원단지로 총 376가구 규모다. 성남 여주 복선전철 예정지인 곤지암역에서 차량으로 약 5분 거리에 위치 입지가 양호한 편이다. 또 이천 갈산 현진에버빌은 총 168가구로 입주예정인 2010년도에 성남 이천 여주를 잇는 복선전철과 성남 이천 장호원간 자동차 전용도로가 개통될 예정이어서 호재로 작용할 전망이다. 현진은 사업지의 대규모 분양에 이어 하반기 정기 공채를 통해 경력 및 대졸신입사원 100여명을 뽑는다. 최근 중견 건설사들이 인력감축 등 긴축 경영에 돌입하는 모습과는 상반된 움직임이어서 주목을 끌고 있다. 오는 31일까지 원서를 받게되는데 ㈜현진 ㈜현진에버빌 ㈜에버빌리조트 등 그룹 내 계열사에서 경영.기획.홍보.사업.관리.기술.디자인 분야로 나눠 채용될 예정이다.,https://news.naver.com/main/read.nhn?mode=LSD&mid=shm&sid1=260&oid=016&aid=0000255618,94
67615,2007.10.25. 오후 12:17,부동산,헤럴드경제,주목받는 국내 건설 3社 YM건설 평택에 첫 도심형타운하우스 분양 관심,평택에 첫 도심형 타운하우스가 분양 관심을 모으고 있다. YM건설은 비젼택지지구내에 건설하는 “프라젠하우스 PRAZENHAUS ” 63가구를 오는 25일부터 분양에 들어간다. 이번에 공급되는 평택 첫 타운하우스는 지상 4층의 6개동 119㎡ 36평 단일 평형으로 특히 고급 아파트와 단독주택의 장점을 동시에 누릴수 있는데다 대지 지분이 아파트 규모보다 넓은 120㎡규모에 달해 관심을 끌고 있다. 또 30여㎡의 전실 및 발코니가 제공되며 최상층인 4층에는 40여㎡의 다락방 및 테라스가 달려 있다. 타운하우스의 특별함을 살려 세대당 1.5대의 주차를 100%로 지하화 하고 지상은 공원화한 점도 특징이다. 주변에는 300만㎡의 소사벌택지 개발지구가 인접하여 공공편익시설을 공유할 수 있으며 뉴코아백화점과 평택시청 덕동초등학교 등이 가깝다. 평택지역에서 도시개발사업등 5개의 현장을 보유하고 있는 YM건설은 사천고속도로 휴게소 등 유통업을 계열사로 거느리고 있는 중견 주택건설업체이다. YM건설 관계자는 “평택지역 최초의 도심형 타운하우스이니 만큼 최고의 시설로서 작품을 만들 예정”이라면서 “수도권 신도시 및 택지개발지구에만 있는 타운하우스를 이제 평택에서도 만날 수 있는 만큼 많은 사람들의 관심이 이어지고 있다”라고 밝혔다.,https://news.naver.com/main/read.nhn?mode=LSD&mid=shm&sid1=260&oid=016&aid=0000255617,94
67616,2007.10.25. 오후 12:01,부동산,노컷뉴스,정부 지하철 승강기 대폭확충···1200대 추가 설치,정부가 오는 2013년까지 1482억원의 예산을 지원해 부산·대구·인천 지하철의 모든 역에 엘리베이터나 에스컬레이터 600여대를 구비토록 했다. 또 서울시에도 860억원의 국고를 지원해 같은 기간동안 엘리베이터 122대 에스컬레이터 471대를 추가로 확충토록 했다. 기획예산처는 25일 지하철 역사에 노약자와 장애인 등의 지하철 이용 편의시설을 설치하는 지방자치 단체에 대해 그 비용의 일부를 지원하기로 했다고 밝혔다. 그 동안 지하철 이용 편의시설 설치는 지자체가 지방비를 투입해 자체적으로 추진해 왔으나 기존 역사 지반굴착 등에 따른 사업비 부담이 커 사업추진이 잘 안 돼 왔다. 이에따라 5대광역시 지하철 이동편의시설 추가 확충율도 지난 2004년 2%에서 올해 8.5%로 소폭 느는데 그치는 등 제자리걸음을 해왔다. 정부는 내년부터 사업비 가운데 40%를 국고로 보조하기로 함에 따라 지자체의 사업추진이 크게 활성화 될 것으로 예상했다. 서울시는 지난해까지 지하철 1～8호선에 이미 1역사 1시설을 자체 완료한 바 있다.,https://news.naver.com/main/read.nhn?mode=LSD&mid=shm&sid1=260&oid=079&aid=0000197159,94
67617,2007.10.25. 오후 12:00,부동산,노컷뉴스,김포신도시 2008년 3천가구 첫분양,김포신도시가 올해 안에 착공에 들어가 2008년 6월부터 본격 분양에 들어간다. 건설교통부는 25일 김포양촌 신도시 1085만㎡에 대한 실시계획을 관계부처 협의를 거쳐 승인했다고 밝혔다. 이에 따라 김포신도시는 올 연말 안으로 공사를 시작해 2008년 6월 3000가구를 시작으로 2009년까지 총 5만2812가구가 분양된다. 주택 유형별로는 아파트가 4만5787가구 주상복합 2060가구 단독주택 1665가구 연립 3300가구 등이다. 규모별로는 주상복합을 포함한 85㎡초과 중대형이 2만가구로 가장 많다. 국민임대를 포함 60㎡이하가 1만3000가구 60～ 85㎡이하는 1만7000가구가 공급된다. 전체 공급물량 중 69%인 3만4000가구는 분양주택이고 나머지 1만5000가구는 임대주택이다. 건교부는 “연접한 장기지구와 합하면 1173만㎡의 규모에 총 5만7492가구가 들어서는 수도권 서북부지역의 대규모 신도시가 될 것”이라고 말했다.,https://news.naver.com/main/read.nhn?mode=LSD&mid=shm&sid1=260&oid=079&aid=0000197157,94
