,date,cat,co,headline,text,url,week
101909,2008.09.08. 오전 6:02,부동산,노컷뉴스,아파트 주변 차량소음 방치... 관청 책임,CBS사회부 심나리 기자 아파트 주변 차량 통행으로 인한 소음이 주거 지역의 소음 기준을 크게 초과함에도 불구하고 이에 대한 시정조치를 취하지 않았다면 이를 허가해준 관할 관청이 책임을 져야 한다는 대법원 판결이 나왔다. 대법원 3부 주심 이홍훈 대법관 는 부산 광역시의 한 아파트 주민 900여 명이 방음벽 설치를 요구하면서 중앙환경분쟁조정위원회에 재정신청을 해 배상결정을 이끌어내자 부산 광역시와 A건설이 이에 불복하며 낸 채무부존재확인 상고 사건에서 원고 패소 판결한 원심을 확정했다고 밝혔다. 앞서 중앙환경분쟁조정위원회는 야간 등가소음도가 65데시벨 ㏈ 이상인 세대에 거주하는 주민들에 대해 모두 1억 9천여만 원을 지급하라고 결정내렸다. 부산시는 아파트 인근 도로에 반터널식 방음벽을 설치하면 구조 관리상 그리고 장기간 교통차단으로 인한 문제가 발생한다 는 이유를 들어 방음벽 설치가 불가능하다고 주장했다. 이에 대해 재판부는 방음벽을 설치하는 데에 여러가지 난점이 있는 것은 부인하기 어렵지만 그것이 불가능하다고 할 수 없으며 특히 아파트 사업승인 당시 A건설이 낸 방음벽 설치계획서에 따라 아파트 건축과 더불어 방음벽을 설치했다면 그 설치가 더 용이했을 것 이라며 부산시의 주장을 배척했다. 재판부는 또 부산시의 손해배상 책임과 관련해 사회통념상 참을 수 없는 피해인지 여부는 기물의 공공성 피해의 내용과 정도 이를 방지하기 위하여 노력한 내용 등을 종합적으로 고려해 판단해야 한다 고 덧붙였다. 한편 같은 내용으로 상고를 한 A건설에 대해 대법원 재판부는 아파트 건설 당시 피해가 예상됐다고 볼 수 없으며 피해를 최소화하기 위한 노력을 기울인 점 등을 고려해 1심 판결과는 달리 원소 승소 판결했다.,https://news.naver.com/main/read.nhn?mode=LSD&mid=shm&sid1=260&oid=079&aid=0001991293,140
101910,2008.09.08. 오전 6:02,부동산,노컷뉴스,인천 영종대교 석달간 정밀점검 실시,CBS경제부 박종환 기자 국토해양부와 인천국제공항고속도로를 관리하는 신공항하이웨이㈜는 오는 11월까지 석달간 영종대교의 안전성 확보를 위해 정밀점검을 실시한다고 8일 밝혔다. 이번 정밀점검은 현수교 구간 상판을 지탱하는 행어와 주케이블 행어와 주케이블을 결속하는 밴드볼트에 대해 이뤄진다. 도로.철도 병용 복층구조인 영종대교는 상부도로에 왕복6차로 하부도로에 왕복4차로와 복선철도가 통행하는 3차원 자정식 현수교다. 국토부는 영종대교 정밀점검기간 중 영종대교 상부도로의 부분적인 차단과 일방향 전면통제를 실시할 예정이다. 그러나 상부도로 교통제한시 영종대교 하부도로를 이용할 수 있기 때문에 교통소통에는 전혀 지장이 없으며 교통량이 많은 출퇴근 시간대와 나들이 차량이 많은 주말과 공휴일은 교통을 차단하지 않기로 했다.,https://news.naver.com/main/read.nhn?mode=LSD&mid=shm&sid1=260&oid=079&aid=0001991291,140
101911,2008.09.08. 오전 6:01,부동산,연합뉴스,재건축 규제완화로 조합원당 1천173만원 절감,주거환경硏 강동구 M아파트 사례연구 결과.. 사업초기일수록 혜택 커 서울 연합뉴스 서미숙 기자 정부의 8.21 부동산 대책에 포함된 아파트 재건축 규제 완화 효과로 재건축 조합원당 1천만원 이상 부담금이 감소할 것이라는 분석결과가 나왔다. 이는 재건축 규제 완화 효과가 전혀 없다는 일부 재건축 조합들의 주장을 뒤엎는 것이어서 주목된다. 사단법인 주거환경연구원의 김태섭 선임연구위원과 강현귀 연구원은 서울 강동구 성내동 M아파트의 재건축 사업성을 분석한 결과 사업기간 단축과 후분양제 폐지 분양가 상한제 완화 등의 조치로 가구당 1천173만원의 부담금이 줄어드는 것으로 나타났다고 8일 밝혔다. M재건축 단지는 현재 조합원이 356명이며 재건축후 총 440가구 임대아파트 34가구 포함 를 짓고 50가구를 일반분양할 예정이다. 연구원은 재건축 안전진단 완화와 중복심의 생략 시공사 조기 선정 등 절차 간소화로 재건축 사업기간이 종전 3년에서 1년6개월로 단축됨에 따라 직접 공사비가 3.3㎡당 370만원에서 358만원으로 줄어들 것으로 예상했다. 이에 따라 사업비 총액 1천238억1천483만원 대비 2.85%에 이르는 35억원이 절감되고 가구당 991만원의 추가부담금이 감소할 것으로 분석됐다. 또 분양가 상한제의 택지비를 감정가의 120%까지 인정해주기로 하면서 일반분양 물량의 분양가를 올려받을 수 있게 돼 조합원 수입이 사업비 총액 대비 1.17%인 14억원 가량 늘어나고 조합원 가구당 부담금이 405만원 줄어들 것으로 전망됐다. 하지만 공정률 80% 이후 일반분양분을 공급하도록 한 재건축 후분양제 폐지로 착공과 동시에 선분양을 했을 때보다 일반 분양가 조합원 수입 가 8억원 정도 감소하면서 가구당 224만원 사업비 총액 대비 0.64% 의 비용이 증가할 것으로 예상됐다. 이를 종합해볼 때 8.21 재건축대책으로 M아파트는 총 41억원의 비용이 절감돼 사업총액 대비 3.37% 가구당 1천173만원의 추가부담금이 감소하게 된다고 연구원은 설명했다. 강현귀 연구원은 사업 초기단계에 있는 재건축 아파트는 운영비나 금융비용 등의 비용 절감효과를 극대화할 수 있어 규제 완화 효과가 상대적으로 더 크다 며 일부 조합 주장처럼 8.21대책의 효과가 전혀 없는 것은 아니다 고 말했다. 강 연구원은 그러나 이 정도로 겹겹규제로 꽁꽁 묶여 있는 재건축 사업을 활성화하기에는 미흡하다 며 소형의무비율 임대주택 의무건립 등 후속 대책이 뒷받침 돼야 할 것 이라고 덧붙였다.,https://news.naver.com/main/read.nhn?mode=LSD&mid=shm&sid1=260&oid=001&aid=0002257222,140
101912,2008.09.08. 오전 6:00,부동산,아시아경제,추석연휴 항공 운항편수 14% 늘린다,항공안전본부는 오는 9월12일부터 16일까지 5일간 추석절 특별교통대책 시행의 일환으로 운항편수를 14% 증강한다고 8일 밝혔다. 추석 연휴기간 항공운송 수요가 전년에 비해 7% 정도 증가할 것으로 예상됨에 따라 이 기간 중 1일 국내선 운항 편수를 21편 증편한 317편 같은 기간 총 1586편 을 운항 평시보다 14% 증강된다.,https://news.naver.com/main/read.nhn?mode=LSD&mid=shm&sid1=260&oid=277&aid=0002026061,140
101913,2008.09.08. 오전 5:41,부동산,아시아경제,개인에게 부관된 종부세 1년새 2배 증가,개인에게 부과된 종합부동산세가 1년 동안 2배가 넘게 증가하는 등 세금 부담이 급증하고 있는 것으로 나타났다. 국회 기획재정위 나성린 의원 한나라당 이 8일 국세청으로부터 제출 받은 자료에 따르면 지난 2006년 32만7797명에게 7671억6900만원이 부과됐던 종부세가 지난해에는 46만8529명에 총 1조5731억1600만원이 부과돼 세금부담이 2.05배 증가한 것으로 집계됐다.,https://news.naver.com/main/read.nhn?mode=LSD&mid=shm&sid1=260&oid=277&aid=0002026053,140
101914,2008.09.08. 오전 5:30,부동산,연합뉴스,나성린 개인 종부세 1년새 2배 증가,한나라당 나성린 의원 자료사진 서울 연합뉴스 안용수 기자 개인에게 부과된 종합부동산세가 1년 동안 2배가 넘게 증가하는 등 세금 부담이 급증하고 있는 것으로 나타났다. 국회 기획재정위 나성린 의원 한나라당 이 8일 국세청으로부터 제출 받은 자료에 따르면 지난 2006년 32만7천797명에게 7천671억6천900만원이 부과됐던 종부세가 지난해에는 46만8천529명에 1조5천731억1천600만원이 부과돼 세금부담이 2.05배 증가한 것으로 집계됐다. 법인에 대한 종부세 역시 같은 기간 9천507억8천900만원에서 1조1천940억1천400만원으로 증가했다. 지역별 개인 종부세 신고자 및 신고액은 서울이 25만8천133명에 1조457억1천만원으로 전국 대비 개인 신고자의 55% 신고액으로는 66.4%를 각각 차지했다. 이어 경기도는 14만2천840명 30.4% 에 3천774억1천900만원 22.9% 인천은 8천564명 1.8% 이 199억6천100만원 1.3% 을 신고했다. 이에 따라 수도권이 개인 종부세 신고 대상의 88.2% 신고액 기준으로는 83.7%를 차지한 것으로 조사됐다. 나 의원은 종부세 도입 이후 개인과 법인 모두 과세 대상 인원과 세액이 엄청난 증가율을 보이고 있어서 완화할 필요가 있다 며 우선 소득이 없는 고령자와 투기적 목적이 아닌 1주택 장기보유자에 대한 종부세를 완화해 줘야 한다 고 말했다.,https://news.naver.com/main/read.nhn?mode=LSD&mid=shm&sid1=260&oid=001&aid=0002257212,140
101915,2008.09.08. 오전 4:11,부동산,매일경제,수도권 거래 꽁꽁…분당ㆍ용인 하락세,부동산 NOW NEW image0 8ㆍ21 대책 발표 이후 잠깐 상승세로 돌아섰던 수도권 주요 신도시 집값은 9ㆍ1 세법 개편안 발표 이후 다시 하락세로 반전됐다. 8ㆍ21 대책에 포함된 전매제한 완화에 대한 기대심리가 거주 요건 강화를 담은 9ㆍ1 세제 개편안에 의해 실망감으로 바뀌었기 때문이다. 반면 양도세 감면 기준이 6억원에서 9억원으로 상향 조정되면서 6억 9억원대 강남권 중소형 아파트들은 바닥다지기를 하는 모양새를 보이고 있다. 이영진 닥터아파트 리서치연구소 소장은 8ㆍ21 대책과 9ㆍ1 세제 개편안 발표 이후 서울 아파트 하락세가 상승세로 반전된 것은 아니지만 하락폭은 줄어드는 분위기 라며 앞으로 도시정비법이나 세법이 개정돼 규제 완화 사항들이 시행되면 강남권 아파트값은 다시 반등할 소지가 있다 고 말했다. 수도권 신도시 하락세로 돌아서 image1 거주 요건이 2년에서 3년으로 늘어나게 된 과천과 분당 등 5개 신도시는 약보합세를 유지했다. 성남시 분당구 정자동 S공인 대표는 대형 평형은 사겠다는 사람이 없어 매물을 내놨던 사람들이 포기한 상태 라며 매물이 한두 건 나오지만 거래는 끊긴 지 오래 라고 말했다. 두산파빌리온 132㎡ 급매물은 5억원 초반대에서 가격을 조정하는 데도 거래가 없다. 거주 요건이 없다가 3년으로 추가되게 된 용인 등은 약보합에서 다시 하락세로 돌아섰다. 용인시 동천동 L공인 관계자는 동천동 쪽에는 세입자가 30 50%인데 갑자기 거주 요건이 생겨버리면 용인이 제일 큰 피해를 본다 며 가격이 싸다고 매수시점이라고 판단하던 사람들도 이제 여기서 거주해야 하나 라며 망설인다 고 전했다. 신봉동 M공인 대표도 132㎡는 모두 6억원 이상이었는데 지금은 4억 7억원까지 가격차가 벌어졌다 며 전년 호가 기준으로 1억원 이상 빠진 아파트도 있지만 다들 내놓은 지 오래고 거래도 없다 고 말했다. 상반기 강북 열풍을 주도했던 뉴타운지역 지분값은 맥을 못 추고 있다. 기대를 모았던 도심 재개발 규제 완화 등 희망이 가물가물해졌기 때문이다. 한남동 D공인 관계자는 지난해 말 한남뉴타운 동빙고구역 36㎡짜리 지분을 7억원에 구입한 사람이 현재 5억5000만원에 내놓았지만 몇 개월째 수요자를 못 찾고 있다 고 말했다. 9ㆍ1 세제개편안에 거주요건 강화 내용이 담기면서 수도권 거래시장은 사실상 올스톱됐다. 주택가격이 약보합세를 보이고 있는 경기도 성남시 분당구 정자동 일대. 상계뉴타운 역시 한때 2800만원 이상 나가기도 했던 이 지역 지분값은 최근 3.3㎡당 2500만원 안팎으로 떨어졌다. 더러 2000만원 이하 지분도 등장하고 있지만 거래는 거의 없다. 의정부 인천 광명 등은 가을 이사철을 맞아 전세금이 소폭 상승했다. 아파트가 모여 있는 경기 의정부시 신곡동과 용현동 등지에는 전세 매물이 부족한 상황이다. 호원동 K공인 관계자는 호원가든 79㎡가 9500만원 선이지만 시세보다 다소 비싸도 매물이 나오는 대로 물건이 빠진다 며 공급이 달리다 보니 원세입자들은 10% 정도 가격을 올려주고 계약을 연장하는 사람이 많다 고 말했다. 강남권 급매물 소진 강남 몇몇 곳에서 거래가 좀 살아나는 듯한 분위기다. 재건축은 여전히 거래가 어렵지만 하락세는 멈춘 상태다. 개포주공 2단지 52㎡는 8억원대 초반에서 보합세를 보이고 있고 개포주공 1단지 50㎡ 역시 9억원대 후반에서 추가 하락은 없는 상태다. 잠실주공 5단지 112㎡도 10억원대 초반에서 매수자와 매도자 간에 치열한 눈치공방이 벌어지고 있다. 하지만 기존 아파트들은 실수요자 위주로 매수세가 꿈틀거리는 모습이다. 압구정 구현대 115㎡가 최근 14억8000만원과 14억9000만원에 팔렸고 신현대 115㎡도 13억9000만원에 거래됐다. 이 같은 급매물이 일부 거래된 후 더 이상 매물은 나오지 않고 급매물이 아닌 매물들은 집주인들이 거둬들이고 있다. 양도세법 개정 이후 다시 물건을 내놓겠다는 의도다. 반포와 잠원동도 급매물은 거의 다 소진됐다. 불과 1 2주 전까지만 해도 최고 10억원까지 호가했던 한신 13차 105㎡가 7억7000만원에 급매물로 나와 있었어도 거래가 안 됐던 반면 지난주 이 같은 급매물들은 대부분 팔렸다. 압구정동 중개업소 관계자는 정부가 세제 대책을 발표한 이후 급매물은 빠르게 소진되고 있다. 워낙 부동산 경기가 침체라 섣불리 예단하기는 힘들지만 강남 지역 아파트들은 20% 이상 시세가 급락한 중대형 물건들을 중심으로 점차 상승 반전을 시도하지 않을까 전망된다 고 말했다.,https://news.naver.com/main/read.nhn?mode=LSD&mid=shm&sid1=260&oid=009&aid=0002007303,140
101916,2008.09.08. 오전 4:11,부동산,매일경제,경인운하 개통…철강재ㆍ모래 실어나르고 유람선 띄우고,image0 평상시에는 운하 홍수 때는 방수로. 경인운하는 다목적 물길로 불린다. 운하 길이가 짧고 평탄한 지형이어서 사업비가 많이 들지 않는다. 한강과 인천항을 연결하므로 배후에 대도시인 서울과 인천을 두고 있다는 것도 장점이다. 서울에서 배를 타고 서해안으로 나가 중국으로 향하게 할 수 있다는 한강 르네상스 프로젝트 와도 연계된다. 경인운하는 굴포천의 홍수 방지를 위해 시작된 사업에 운하기능을 부가한다는 측면에서 새롭게 산을 뚫고 물길을 내야 했던 경부운하와 다르다. 물류ㆍ관광 기반이 충분해 경제성은 상당히 높은 반면 환경 침해도 많지 않은 것으로 분석된다. 정부도 이를 바탕으로 90년대 중반 이후 10년 넘게 표류해 오던 경인운하에 대해 재추진 의사를 밝혔다. 국토해양부는 이미 지난달에 한국개발연구원 KDI 에 타당성 검증을 의뢰했다. 결과가 나온 후 이르면 올해 안에 민자사업으로 시작한다는 계획이다. 하지만 정부가 경인운하를 예정대로 추진하려면 무엇보다 대운하의 시범사업은 아니다 라는 점을 명확히 할 필요가 있다. 권진봉 건설수자원정책실장은 경인운하는 굴포천 방수로를 활용하는 효과가 있다. 방수로만 놔두면 여름 홍수기에 15일 정도 쓸 수 있는 데 갈수기에 계속 놔두면 물이 썩고 관리하는 데도 적잖은 문제가 생긴다. 운하로 활용하면 물류ㆍ관광 측면의 경제적 효과도 클 뿐 아니라 한강과 서해안의 맑은 물이 들어오니 오히려 환경이 개선된다. 한반도 대운하와도 별개다 고 설명했다. 경인운하가 뚫리면＝경인운하는 총 14.2㎞의 굴포천 방수로를 기본 물길로 하고 있다. 여기에 3.8㎞의 연결수로를 잇게 되면 서해와 한강이 연결된다. 운하의 기본 골격은 연장 18㎞ 폭 80ｍ 수심 6.3ｍ다. 서울 강서구 개화동에 위치한 서울터미널은 109만㎡ 크기로 물류단지를 포함한다. 인천시 서구 시천동에 들어설 인천터미널은 149만㎡ 넓이로 역시 물류단지를 끼고 건설된다. 갑문은 총 5기로 4000ｔ의 선박이 오갈 수 있다. 경인운하 아이디어는 상습 침수지역인 굴포천 유역 총 134㎢ 인구 150만명 의 물길을 돌리는 작업을 하면서 시작됐다. 홍수 때는 당연히 물을 빼는 수로로 사용된다. 이러한 물길을 평상시에 배가 다니는 운하로 돌린다는 것이다. 그렇게 되면 한강에서 인천 앞바다까지 배가 오가게 된다. 경인운하 건설을 추진했던 현대건설 측은 홍수 피해를 막고 한강까지 배를 띄움으로써 컨테이너 철강재 바다 모래 중고차 쓰레기 등 물류체계를 개선하는 효과가 있다고 설명했다. 한강에서 출발해 서해안으로 물길 여행을 하는 관광 창출 효과도 크다고 얘기한다. 현재 한강 물길은 남북 대치관계 때문에 하구에서 막혀 있다 5일 경인운하 공사 예정구간인 인천시 서구 시천동 굴포천 일대 2공구에서 GS건설이 남측 방수로작업을 진행하고 있다. 김성중 기자 image1 경제적 편익 높다＝사회간접자본 SOC 투자의 핵심은 경제성이다. 논란은 여전히 있지만 경인운하의 경제성은 충분하다는 게 국토부의 입장이다. 경제성 분석은 크게 KDI 평가와 DHV 평가를 볼 필요가 있다. KDI는 2002년 경제성 분석에 나섰다. 당시 비용 대비 편익 비율 B C 을 보면 방수로와 운하시설을 동시에 건설할 때는 B C가 0.9223 1.0545 수준이었다. DHV 네덜란드 운하컨설팅기업 와 삼안 설계업체 이 2004년부터 2년간 실시한 용역결과에서는 경제성이 훨씬 높아진다. 여러 가지 경우의 수를 전제로 하지만 어찌 됐든 B C는 1.39 1.76에 달한다. 특히 중국과의 교역이 늘고 있으며 한강을 물길로 활용해야 한다는 의견이 많아지고 있는 만큼 시간이 갈수록 경제성은 높아진다는 분석이다. 서울시도 2006년부터 추진하고 있는 한강 르네상스 프로젝트 와 관련해 경인운하의 필요성에 찬성하고 있다. 한강 용산역세권 개발의 경우 선진도시처럼 워터프런트 타운 Waterfront Town 조성을 구상하고 있다. 이러한 워터프런트가 활성화되려면 배가 많아져야 하고 배가 오가는 항로로 경인운하의 가치는 상당히 크다는 게 서울시 생각이다. 안상수 인천시장도 최근 굴포천 방수로 공사가 끝났으므로 운하를 빨리 할수록 좋고 더 이상 늦추는 것은 국정의 도덕적 해이 라고 주장했다. 물론 반대 의견도 있다. 비용 대비 편익이 0.4 0.9배에 불과하고 서울 인천 간 대체 수송수단도 많다는 것이다. 임석민 한신대 교수는 운하 길이 18㎞는 트럭으로 20분이면 오갈 거리로 시속 9㎞ 정도의 바지선은 운항시간만 2시간이 걸린다. 운하는 장거리 저가 화물이 아니면 경제성이 없다 며 DHV의 경제성 분석이 과장됐다 고 주장했다. 환경피해는 크지 않아＝환경단체들은 운하에 들어온 바닷물이 지하수로 들어가면 주변 농경지에 피해를 주며 오염물질이 유입될 수 있다고 지적한다. 담수가 배출될 경우 해양생태계에 대한 충격도 크다는 주장이다. 국토부는 방수로를 홍수기에 약 2주일만 쓸 경우 평상시에는 쓰레기 투기장으로 변모할 수 있고 해충 서식 등의 가능성이 크다고 얘기한다. DHV는 용역 보고서에서 바닷물과 담수가 섞여 염분이 낮은 물 기수지역 이 생성되면 다양한 생물종이 출현해 새로운 생태계가 형성될 것으로 기대했다. 초당 20㎥의 운하수를 방류해도 염분농도는 1ppt 바닷물 염분은 19.3 19.5ppt 이상 감소하는 해역이 0.17㎢에 불과하다고 설명했다. 국토부는 특히 운하 내 바닷물의 지하수 침투도 기술적으로 해결 가능하다는 입장이다. 이와 함께 운하는 도로에 비해 대기오염 유발효과가 작다는 점을 강조했다.,https://news.naver.com/main/read.nhn?mode=LSD&mid=shm&sid1=260&oid=009&aid=0002007299,140
101917,2008.09.08. 오전 4:11,부동산,매일경제,경인운하 추진 과정…환경 논란속 13년 오락가락,image0 경인운하 모태인 굴포천 방수로사업의 계기는 1987년 굴포천 홍수 였다. 굴포천이 범람해 사망 16명 이재민 5427명 농경지 침수 3767㏊ 재산손실 400억원의 피해가 발생한 것이다. 굴포천은 원래 수위가 해발 6.5ｍ로 한강 10.6ｍ 보다 낮다 보니 홍수 때는 자연 배수가 불가능했다. 굴포천 유역 면적 134㎢의 40%가 10ｍ 이하 저지대였다. 자연스럽게 물길을 돌려야 한다는 얘기가 나왔으며 1991년 12월 굴포천유역 종합치수 기본계획이 수립됐다. 서해까지 14.2㎞의 방수로 폭 60ｍ 를 건설하는 사업이었다. 그러다가 나온 게 홍수기 외에는 사용하지 않는 방수로를 운하로 활용하자는 아이디어였다. 경인운하는 13년 전인 95년 3월에 민자유치 대상 사업으로 선정됐고 99년 9월에는 현대건설 지분 52% 이 주축이 된 경인운하 주 가 설립됐다. 운하가 논의되는 와중에 굴포천 방수로는 1단계 2001년 8월 2003년 6월 폭 20ｍ 임시방수로 사업이 완료됐다. 2단계 사업은 2004년부터 시작돼 임시방수로 폭을 20ｍ에서 80ｍ로 넓히는 사업이다. 2단계 기간 중에는 남측 제방도로가 건설되고 주민 여가선용을 위한 친수공간이 조성된다. 2단계 총사업비는 5539억원으로 현재 공정률은 42%다. 방수로 사업과 달리 운하는 중간에 좌초된다. 환경단체가 정부의 경제성 분석이 과장됐다며 거세게 반발하고 나섰기 때문이다. 정부는 2003년 9월 경인운하 재검토 결정을 내렸고 2004년 7월 사업시행자가 취소된다. 결국 경인운하 주 는 정부를 상대로 사업중단에 대한 위약금청구 소송을 내 지난해 9월 서울고법으로부터 정부가 360억원을 물어줘야 한다는 조정 결정을 받아냈다. 국토해양부는 이명박 대통령이 대선 공약으로 내건 한반도 대운하와 관련해 올해 3월 조직개편에서 운하지원팀을 신설 경인운하와 관련된 사안을 추진했다.,https://news.naver.com/main/read.nhn?mode=LSD&mid=shm&sid1=260&oid=009&aid=0002007287,140
