,date,cat,co,headline,text,url,week
64647,2007.09.27. 오후 3:39,부동산,아시아경제,신창건설 남극 세종기지 증축 수주,신창건설이 세종기지 증축공사를 수주하는 등 본격적인 해외사업 발판을 마련했다. 신창건설은 지난 10일 한국해양연구원 부설 극지 연구소가 집행한 남극세종과학기지 대수선 및 증축공사 입찰에 참여한 신창건설은 현대엔지니어링 주 등 총 6개 사가 입찰에 참여한 가운데 최종 낙찰자로 결정됐다고 27일 밝혔다. 이번 공사는 철골조 지상 1 2층으로 총 8개동 중 3개동을 신축하고 5개동을 리모델링 하는 등 연면적 1974㎡로 건축 토목 기계설비 전기공사 및 기타 부대공사를 통해 75억3100만원에 투찰됐다. 공사기간이 내년 3월 31일까지로 짧은 공사기간 내에 공사를 완료시켜야 하는 만큼 시공능력과 공사자재 수급능력의 원활한 조달이 필요하다. 이에 따라 신창건설은 공기단축과 운송비 절감을 위해 공사자재를 자사 과테말라 지사를 활용하는 등 공사를 성공적으로 수행하기 위해 총력을 기울일 계획이다. 최근 신창건설은 국내 부동산 경기 침체를 타파하기 위해 러시아 과테말라 등의 해외사업에 박차를 가하고 있으며 이번 남극 세종기지 공사는 이러한 해외사업 진출에 상징적인 이미지가 될 것으로 보여진다. 신창건설 관계자는 이번 사업은 극한의 상황에서 진행되는 공사인 만큼 기술적인 노하우와 안전성이 요구되는 만큼 추후 어떠한 기후조건과 현장상황에서도 공사진행에 자신감을 줄 수 있을 것 이라고 말했다.,https://news.naver.com/main/read.nhn?mode=LSD&mid=shm&sid1=260&oid=277&aid=0000002897,90
64648,2007.09.27. 오후 3:36,부동산,파이낸셜뉴스,“국내건설업체 견실해졌다” 건설협회,지난해 국내 건설업체는 지속적인 구조조정 등으로 견실해 진 것으로 나타났다. 27일 대한건설협회가 전국 1만1179개사의 2006년말 재무제표를 분석한 결과 매출이 상승세를 보였고 수익성 또한 제조업보다 좋은 것으로 조사됐다. 건설매출액의 경우 분양시장이 저조했으나 해외건설시장 약진과 국내시장 호조로 2005년보다 7.9% 상승한 139조5716억원으로 나타났다. 수익성은 매출액 순이익률이 전년보다 0.1% 포인트 하락한 6.0%를 기록했지만 매출액 경상이익률은 전년보다 0.2% 포인트 상승한 6.1%를 기록해 각각 제조업의 4.5% 5.7%보다 호조를 보였다. 안정성 지표는 부채비율이 2003년 이후 큰 폭의 변동없이 150% 수준을 유지하고 있으며 유동비율은 2002년부터 130∼140%대로 상승하는 등 건전한 재무구조를 유지하고 있는 것으로 분석됐다. 협회 관계자는 “이같은 상승세는 분양가상한제 실시 등 정부의 강력한 규제 일변도 정책으로 올들어 꺾이기 시작했다”면서 “외환위기 이후 견실한 성장을 해 온 건설업계의 기반이 한꺼번에 무너지지 않도록 규제 완화가 절실하다”고 강조했다.,https://news.naver.com/main/read.nhn?mode=LSD&mid=shm&sid1=260&oid=014&aid=0000343481,90
64649,2007.09.27. 오후 3:32,부동산,문화일보,지난 3년간 아파트값 평균 상승률 평촌 ＞ 과천 ＞ 용인 順,경기 평촌 신도시가 지난 3년 동안 91%의 가격 상승률을 보여 아파트값이 가장 많이 오른 곳으로 나타났다. 이어 경기 과천 82% 용인 68% 분당 64% 서울 양천구 63% 등의 순으로 높은 상승률을 보였다. 27일 부동산 정보업체 부동산써브에 따르면 평촌의 아파트값 평균 시세는 2004년 2억2822만원에서 지난 20일 기준 4억3493만원으로 올라 91%의 변동률을 기록했다. 이는 부동산써브가 평촌의 아파트 3년전과 같은 아파트 4만3가구를 대상으로 가구당 평균 매매가격을 조사한 결과에 따른 것이다. 3년간 평균 매매가 변동률은 과천 용인 분당 서울 양천구에 이어 강남구 62% 서초구 61% 용산구 58% 송파구 57% 광진구 44% 가 뒤를 이었다. 지난 3년 동안 서울의 이른바 버블지역인 강남구 서초구 송파구 양천구의 아파트값은 평균 60.1% 올라 차액만 3억6000만원이 넘는 것으로 조사됐다. 버블지역을 제외한 서울의 아파트 매매가 역시 42.28%의 오름세를 나타내 1억1000만원의 차액을 기록한 것으로 나타났다. 서울의 아파트는 102만781가구를 대상으로 가구당 평균 매매가격을 조사한 결과 3년 전 3억4839만원에서 현재 5억2478만원으로 상승한 수치다. 차액은 1억7639만원으로 변동률은 50.63%로 조사됐다. 액수로는 강남구가 4억3151만원이 올라 가장 높았다. 다음으로 서초구 3억8018만원 용산구 3억2063만원 송파구 2억9387만원 양천구 2억5842만원 광진구 1억7839만원 등의 순으로 올랐다. 개별아파트는 3년 동안 양도 차액이 가장 높은 아파트로 서울 강남구 삼성동 ‘현대아이파크’ 241㎡ 73평형 가 차지했다. 현대아이파크 241㎡는 2004년 23억5000만원에서 현재 45억원으로 21억5000만원의 시세 차액을 기록했다.,https://news.naver.com/main/read.nhn?mode=LSD&mid=shm&sid1=260&oid=021&aid=0000208599,90
64650,2007.09.27. 오후 2:56,부동산,뉴시스,부동산임대업자 부가세 과표 이자율 상향…세부담 증가,서울 뉴시스 부동산임대보증금의 부가가치세 과세표준에 적용되는 이자율이 상향조정된다. 이에 따라 부동산임대사업자 약 87만명의 세부담이 늘게 될 전망이다. 국세청은 부동산임대보증금에 대한 부가세 과세표준 간주임대료 을 계산할 때 적용하는 이자율을 현행 4.2%에서 5.0%로 개정해 고시했다고 27일 밝혔다. 부동산임대사업자가 부동산을 임대하고 전세금이나 임대보증금을 받는 경우 임대보증금에 국세청장이 정한 이자율을 곱한 금액을 임대료로 간주해 부가세를 과세하도록 돼있다. 이자율은 시중은행의 1년 만기 정기예금이자율 평균을 감안해 정해진다. 예를 들어 사무실 200평을 보증금 3억원과 월세 200만원 부가가치세 별도 에 임대하고 있는 경우 올해 제2기 부가세 예정신고 때 신고해야할 부가세 과세표준 금액은 3개월간 월 임대료 600만원과 3개월간 92일 365일 간주임대료 378만820원을 합한 978만820원이 된다. 이에 따라 기존 이자율을 적용했을 경우의 917만5890억원에 비해 6만여원 가량 세부담이 늘게 된다. 새로 조정된 이자율은 이달 30일까지가 신고기한인 올해 제2기 부가세 예정신고분부터 적용된다. 국세청 관계자는 “그동안 은행의 정기예금이자율이 점차 상승해 지난 7월의 시중은행 정기예금이자율 평균이 5.04%가 된 점을 반영해 이자율을 조정했다”고 설명했다.,https://news.naver.com/main/read.nhn?mode=LSD&mid=shm&sid1=260&oid=003&aid=0000578240,90
64651,2007.09.27. 오후 2:54,부동산,파이낸셜뉴스,땅 vs 현찰…토지소유주 보상 어떻게,‘대토보상을 받을까 현금보상이 좋을까.’ 정부가 송파 및 동탄2신도시에 대토보상제를 첫 적용키로 함에 따라 대토보상에 대한 관심이 높아지고 있다. 특히 직접적인 이해당사자들은 현금보상과 대토보상을 놓고 저울질이 한창이다. 정부가 대토보상을 단순히 ‘땅 보상’ 차원을 넘어 지구 내 ‘개발한 땅’을 보상키로 했기 때문이다. 대토보상 대상은 지구내 단독주택용지 상업용지 공동주택용지 등이다. 전문가들은 일단 현금보상이 토지소유주에게는 가장 좋은 방안이지만 대토보상 역시 땅의 성격에 따라 좋은 결과를 가져 올 수도 있다고 조언한다. 투모컨설팅 김정용 본부장은 “대토보상의 경우 땅으로 보상을 받는다는 점에서 현금보상보다 선택의 폭이 좁다는 것이 단점”이라면서 “하지만 택지개발지구내에서 입지가 좋은 상업용지를 대토로 받게 되면 향후 상당한 재테크 수단으로 각광을 받을 수도 있다”고 말했다. 그는 “현금보상은 펀드 주식 부동산 등 다른 용도로 전용이 얼마든지 가능한 장점이 있어 대부분의 토지소유주들이 선호하고 특히 상속이나 증여를 할때에도 토지보다는 유리한 점이 많은 게 사실”이라고 말했다. 그는 따라서 “가능한 한 현금보상을 원칙으로 하되 필요할 경우 좋은 입지의 상업용지도 대토보상으로 노려봄직하다”고 강조했다. 스피드뱅크 박원갑 소장은 “이번에 정부에서 밝힌 대토보상 방식은 예전의 환지보상 방식과 비슷한 측면이 있다”면서 “지구내 대토의 경우에는 앞으로 가격이 오를 가능성이 충분하기 때문에 관심을 가져볼만 하다”고 밝혔다. 박 소장은 “그러나 지구내 대토는 환지보상 방식처럼 토지소유주에게 과도한 시세차익을 줄 가능성도 있다”고 지적했다. 건교부 토지정책팀 관계자는 “이번에 도입한 대토보상 방식은 현금보상 중 일부를 개발된 땅으로 보상한다는 것”이라면서 “만약 토지소유주가 원하지 않는다면 대토보상 대신 현금보상을 받을 수 있다”고 말했다. 한편 건교부는 대토보상제 도입을 골자로 한 토지보상법 개정안이 지난 20일 국회 본회의에서 통과됨에 따라 국무회의 등 관련절차를 거쳐 10월 중순께 공포 즉시 시행할 계획이다.,https://news.naver.com/main/read.nhn?mode=LSD&mid=shm&sid1=260&oid=014&aid=0000343470,90
64652,2007.09.27. 오후 2:50,부동산,아시아경제,대덕특구 2단계 개발사업 가속도...2013년 준공,대전시는 27일 서울 소공동 롯데호텔에서 과학기술부와 한국토지공사 사업시행자 등이 참석한 가운데 제5회 연구개발특구위원회를 갖고 대덕연구개발특구 2단계 개발사업 추진계획 안 등을 의결할 계획이라고 26일 밝혔다. 시가 제출한 대덕특구 2단계 개발계획에 따르면 개발범위는 일반조정가능지역인 신동지구 186만7000㎡와 둔곡지구 151만1000㎡ 용산지구 35만1000㎡을 비롯해 국가정책사업지구인 전민지구 18만7000㎡ 자연녹지지역인 문지지구 30만3000㎡ 등 모두 421만8000㎡다. 사업은 시행자로 지정된 한국토지공사가 맡아 공영개발방식으로 추진하며 개발범위 제외 및 추가 등 세부 개발계획은 한국토지공사 조사용역 수행 과정에서 반영 확정될 예정이다. 특구의 경쟁력 확보를 위해 공업지역 건축제한 층수를 현행 7층에서 15층 이하로 운영하는 방안을 검토 중이며 과기부와 건교부 대전시 등은 역할분담을 통해 원활한 사업추진을 도모할 방침이다. 향후 계획은 9월 중 개발계획 조사용역 착수 한국토지공사 2008년 6월 개발계획 수립 및 고시 과기부 2009년 6월 실시계획 승인 대전시 2009년 12월 토지분양 2013년 12월 사업준공 등으로 제출됐다. 한편 지난해 8월 고시된 1단계 개발사업 구역으로는 방현과 신성 죽동 등 3개 지구 146만9000㎡가 포함돼 2009년 1월 분양을 목표로 추진되고 있다.,https://news.naver.com/main/read.nhn?mode=LSD&mid=shm&sid1=260&oid=277&aid=0000002870,90
64653,2007.09.27. 오후 2:50,부동산,매일경제,하반기 집값상승 인천 으뜸…서울도 소폭 올라,u3000올 3 4분기에 전국에서 아파트값이 가장 많이 오른 곳은 인천시로 나타났다. u300027일 부동산써브에 따르면 전국 아파트를 대상으로 올해 7 9월 가격 변동률을 조사한 결과 평균 1.33% 상승한 것으로 나타났다. 이 같은 상승률은 지난해 같은 기간 1.32% 과 비슷한 수치다. u3000가장 많이 오른 지역은 경제자유구역 인천세계도시엑스포 2014년 아시안게임 등 잇따른 호재에 힘입은 인천으로 이 기간 동안 5.47% 오른 것으로 조사됐다. 이와 함께 새아파트 분양이 몰리며 주변 집값을 끌어 올린 것도 주요 원인이 됐다. u3000인천에서는 남동구 8.42% 연수구 8.11% 남구 8.00% 강화군 5.11% 부평구 4.61% 등이 많이 올랐다. u3000분당 일산 등 5대 신도시를 포함한 경기도와 서울이 각각 1.48%와 1.38%씩 상승했다. u3000지방에서는 울산 1.24% 경북 0.80% 부산 0.39% 충북 0.29% 전북 0.28% 등은 상승한 반면 대구 0.61% 대전 0.26% 강원 0.20% 제주 0.14% 는 약세를 보였다. u3000시군구별로는 군자지구 개발과 시화멀티테크노밸리 MTV 착공 등 다양한 호재에 힘입은 시흥시가 21.04% 올라 최고 상승률을 기록했다. u3000이어 포천시 11.87% 안산시 7.16% 의정부시 6.91% 이천시 6.73% 등 경기 외곽 지역의 상승률이 두드러졌다. u3000반면 과천시 1.89% 고양시 0.53% 여주군 0.37% 화성시 0.18% 김포시 0.16% 용인시 0.11% 등은 약세를 보였다. u3000서울은 강북구가 5.43%로 가장 높은 상승률을 기록했고 용산구 4.26% 도봉구 3.53% 종로구 3.14% 은평구 3.13% 등이 상위권을 차지했다. u3000반면 양천구 0.40% 와 송파구 0.10% 는 마이너스 변동률을 나타냈고 서초구 0.37% 광진구 0.68% 강동구 0.75% 등 고가 아파트가 많은 지역도 1%대 미만의 미미한 상승률에 그쳤다.,https://news.naver.com/main/read.nhn?mode=LSD&mid=shm&sid1=260&oid=009&aid=0000626148,90
64654,2007.09.27. 오후 2:45,부동산,머니투데이,월드건설 화환 대신 쌀 모금해 기증,머니투데이 원정호 기자 월드건설은 동두천 지역의 불우이웃을 돕기 위해 쌀 20kg들이 300포를 동두천시청에 기증했다고 27일 밝혔다. 이번에 기증한 쌀은 월드건설이 이달 초 동두천 중앙역 월드메르디앙 모델하우스를 오픈하면서 축하 화한을 받지 않은 대신 모은 것이다. 월드건설 조영호 상무는 협력업체에게서 축하화환을 받으면 분양 종료 뒤 버려지는 게 아까워 그에 상응한 쌀을 접수했다 면서 접수한 쌀 한 포대당 두 포대의 쌀을 회사측에서 부담하는 매칭그랜트 방식으로 상당한 양을 모금해 기증했다 고 말했다.,https://news.naver.com/main/read.nhn?mode=LSD&mid=shm&sid1=260&oid=008&aid=0000832445,90
64655,2007.09.27. 오후 2:19,부동산,뉴시스,쌍용 싱가포르서 6억8천만불 수주…역대 최대 규모,쌍용 싱가포르서 6억8천만불 수주…역대 최대 규모 서울 뉴시스 해외건설 진출 40년 역사상 최대인 6억8600만불 규모의 해외건축 공사를 국내 건설사가 단독 수주해 화제다. 쌍용건설 회장 김석준 은 27일 2600객실 규모의 싱가포르 마리나 베이 샌즈 호텔 Marina Bay Sands Hotel）공사를 미화 6억8600만 달러 한화 약 6300억원 에 단독 수주했다고 밝혔다. 싱가포르 마리나 베이 샌즈 복합 리조트 Marina Bay Sands IR Integrated Resort 개발의 메인 프로젝트인 마리나 베이 샌즈 호텔은 57층 3개동 총 2600객실 규모로 건설된다. 마리나 베이 샌즈 IR은 최근 매년 7%대의 고속 경제 성장률을 이어가고 있는 싱가포르 정부가 ‘하위권 선진국 The lower half of the 1st World ’에서 ‘상위권 선진국 The upper half ’로 도약하기 위한 성장동력을 마련한다는 차원에서 야심차게 국책사업으로 추진 중인 초대형 프로젝트다. 세계 최고의 복합 리조트를 건설한다는 계획 아래 중심상업지구 CBD Central Business District） 인근 싱가포르 최고의 요지인 마리나 베이 매립지에 총 35억 달러를 투입해 2009년 12월까지 완성된다. 이곳에는 2600객실 규모의 마리나 베이 샌즈 호텔과 5만4000명을 수용할 수 있는 컨벤션 센터 1만명 수용 규모의 이벤트 광장 2000석 극장 2곳 카지노 예술사 박물관 쇼핑 센터 등을 갖춘 도심형 복합 리조트 개발을 추진 중이다. 리조트가 완공되면 현재 공사 중인 센토사Sentosa）섬 복합 리조트와 함께 매년 수십억 달러의 이익 창출을 통해 GDP 1 1.5% 상승의 효과가 있을 것으로 기대하고 있다. 세계적인 이목을 끈 이번 마리나 베이 샌즈 호텔 최초 입찰자격심사에는 쌍용건설 등 국내 3개 건설사와 일본의 시미즈 Shimizu 오바야시 Obayashi 가지마 Kajima 다케나카 Takenaka 펜타오션 Penta Ocean 나카노 Nakano 프랑스의 드라가지 Dragages 홍콩의 개몬 Gammon 등 14개 건설사가 참여했다. 이중 쌍용건설 시미즈 드라가지 개몬 등 4개사만 본 입찰에 초청됐다. 최종 경합에서는 화교계 기업으로 최근 마카오 카지노 리조트를 완공한 홍콩의 개몬이 가장 유리한 위치에 있었다. 반면 쌍용건설은 최저 가격을 제시하지 않았음에도 시공사로 선정된 것이다. 이와 관련해 발주처인 라스베거스 샌즈 Las Vegas Sands 의 고위 관계자는 “1년 이라는 긴 입찰기간 동안 쌍용건설 지사와 입찰팀 등 관련 직원들이 보여준 열정 싱가포르를 비롯한 세계 곳곳에서 쌓아 온 뛰어난 고급건축 실적 및 한국에서 직접 확인한 고품질 시공능력 그리고 김석준 회장의 공사 수행에 대한 확고한 믿음과 열정에 깊은 감명을 받았다”며 “쌍용건설이 최저가격을 제시하지 않았음에도 최종 낙점하게 된 결정적인 이유”라고 밝혔다. 한편 마리나 베이 샌즈 호텔은 지하 3층∼지상 57층 3개동 총 2 600객실에 연면적이 63빌딩의 약 2배에 가까운 30만2171㎡ 규모에 달한다. 2009년 12월 완공 예정이다. 특히 싱가포르 해변과 도심 전체를 한눈에 조망할 수 있도록 호텔 상층부인 지상 약 200m 높이에 3개동을 연결하는 약 1만2000㎡ 규모의 스카이 파크Sky Park 가 들어선다. 이곳에 정원과 산책로 레스토랑 스파 Spa 수영장 전망대 등이 조성된다. 한편 쌍용건설은 세계 최고층 호텔로 기네스북에 오른 스위스 스탬포드 호텔 73층 을 포함한 싱가포르의 래플즈 시티 Raffles City Complex 를 건설했으며 두바이 3대 호텔 중 2곳을 시공하는 등 모두 1만 객실이 넘는 호텔 시공실적을 보유해 이 부문에서 세계 2위까지 오른 바 있다. 현재는 해외에서 약 63억 달러 규모의 수주고를 기록하고 있다.,https://news.naver.com/main/read.nhn?mode=LSD&mid=shm&sid1=260&oid=003&aid=0000578181,90
64656,2007.09.27. 오후 2:19,부동산,뉴시스,버블세븐 시가총액 올 6조1700억 ‘증발’,서울 뉴시스 서울 강남 서초 송파 양천 용인 분당 평촌 등 ‘버블세븐’ 지역의 아파트 매매가 총액이 무려 6조1700억원이나 ‘증발’한 것으로 조사됐다. 부동산 정보업체 스피드뱅크가 강남 서초 송파 등 버블세븐지역의 아파트 53만2993가구의 아파트값 총액을 조사한 결과 연초보다 6조1712억원이 하락했다고 27일 밝혔다. 시가총액이 제일 많이 하락한 곳은 양천구로 연초 39조1671억원에서 37조2753억원으로 1조8918억원이 떨어졌다. 송파구는 58조5917억원에서 56조8271억원으로 1조7646억원 3.01% 이 하락했다. 양천구와 송파구를 합쳐 약 9개월간 3조원 이상이 빠진 것이다. 시가총액이 가장 높은 강남구는 연초 102조2974억원에서 101조5528억원으로 7445억원 0.73% 하락했고 서초구는 58조5874억원에서 57조7163억원으로 8710억원이 떨어졌다. 경기지역은 총 가구수가 가장 많은 용인시 0.12% 가 시가총액이 792억원 64조1949억원→64조1157억원 하락했고 분당 1.03% 이 5604억원 54조2897억원→53조7292억원 평촌 1.42% 은 2593억원 18조3천12억원→18조418억원 이 각각 감소했다. 양천구의 시가총액 하락비율이 가장 컸던 이유는 학군 수요 감소로 목동 신시가지 아파트값이 약세를 보였기 때문이다. 올해 목동 신시가지 아파트의 경우 많게는 3억원 중대형은 1억 2억원 소형은 수천만원가량 하락했다. 송파구는 재건축과 대규모 단지의 하락이 두드러졌다. 가락시영 잠실주공5단지 등이 내림세를 주도했고 대단지인 올림픽훼밀리와 올림픽선수촌 역시 하락에 동참했다. 강남구와 서초구 역시 정책에 민감한 재건축 단지와 물량이 넉넉한 대규모 아파트 하락세가 짙었다. 분당과 평촌은 중대형 아파트 위주로 값이 내렸고 용인도 대단지를 중심으로 대형아파트 하락이 계속됐다.,https://news.naver.com/main/read.nhn?mode=LSD&mid=shm&sid1=260&oid=003&aid=0000578179,90
64657,2007.09.27. 오후 2:12,부동산,파이낸셜뉴스,양주고읍 ‘우남퍼스트빌’ 분양,우남건설이 경기 양주시 고읍택지지구에서 우남퍼스트빌 376가구를 분양한다. 양주고읍 우남퍼스트빌은 지하 2층∼지상 15층 8개동에 112㎡ 132가구 111㎡ 140가구 113㎡ 104가구가 들어선다. 양주고읍 우남퍼스트빌이 들어서는 고읍지구는 인근에 조성되는 옥정 회천 등 양주신도시와 함께 총 1421만㎡ 규모의 거대 신도시로 조성되며 미군부대 이전 등 호재가 많다. 지난해 말 개통한 경원선 가운데 덕계역을 오는 10월부터 이용할 수 있으려 내년에 국도3호선의 만성적 적체도 우회도로 의정부∼장암∼회천구간 가 뚫리면 외곽순환도로와 동부간선도로 접근성도 좋아질것으로 전망된다. 양주고읍 우남퍼스트빌은 각 동이 모두 타워형으로 설계됐으며 모든 가구가 남향 위주로 배치돼 있어 채광과 일조권이 좋다. 단지 주변이 저층 주택단지와 공원으로 둘러싸여 3면이 탁 트인 조망권이 특징이다. 양주고읍 우남퍼스트빌은 ‘더 퍼스트 갤러리 The First Gallery ’라는 컨셉을 도입해 아파트 단지와 실내 인테리어를 예술적 느낌으로 설계했다. 지상에는 차가없는 아파트 단지를 실현하고 다양한 화가들의 이름을 딴 테마파크를 조성한다. 단지 면적중 40%를 조경공간으로 구성해 풍부한 녹지공간을 자랑한다. 특히 단지 중앙에 위치한 주민 커뮤니티 건물은 입주민들이 여유로운 공동체 생활을 할 수 있도록 다양한 시설이 들어선다. 2층짜리 건물에 연면적 1200여㎡로 조성되며 헬스장 실내골프연습장 GX룸 영화감상실 북갤러리 등 각종 시설이 조성된다.,https://news.naver.com/main/read.nhn?mode=LSD&mid=shm&sid1=260&oid=014&aid=0000343440,90
64658,2007.09.27. 오후 2:05,부동산,연합뉴스,경기도 주인 없는 부동산 의정부시보다 넓어,수원 연합뉴스 강창구 기자 경기도내 토지 가운데 등기가 되지 않거나 소유자를 확인할 수 없는 무주 無主 부동산 면적이 의정부시 전체 면적보다 넓은 것으로 나타났다. 27일 경기도에 따르면 도 道 가 각 시군별 토지를 대상으로 무주 부동산 현황을 파악한 결과 모두 2만2천140필지에 8천281만6천457㎡로 의정부시 면적 8천100만5천900㎡ 보다 넓은 것으로 나타났다. 시군별로는 연천군이 4천837만1천957㎡ 8천966필지 로 가장 많고 파주시 2천975만6천448㎡ 6천567필지 용인시 115만2천824㎡ 2천601필지 가평군 97만3천948㎡ 76필지 양평군 42만8천244㎡ 26필지 등 순이다. 이처럼 무주부동산 면적이 많은 것은 과거 국유재산 권리보전 조치 과정에서 누락되거나 한국전쟁 후 지적 대장분실 및 복구에 따른 착오 연천.포천 등지의 비무장지대 DMZ 면적이 대거 포함됐기 때문이다. 반면 과천시 33㎡ 1필지 광명시 383㎡ 4필지 고양시 400㎡ 4필지 부천시 2천806㎡ 19필지 등 주요 도심지역은 무주 부동산이 거의 없었다. 도 관계자는 앞으로 실태조사 및 부동산 공고 전산화 작업을 통해 지속적으로 정리해 나가 주인을 찾아주거나 국가에 소유권이 부여될 수 있도록 해 나갈 것 이라고 말했다.,https://news.naver.com/main/read.nhn?mode=LSD&mid=shm&sid1=260&oid=001&aid=0001765852,90
