,date,cat,co,headline,text,url,week
65807,2007.10.10. 오후 4:57,부동산,서울경제,분양단지 들여다보기 길음 두산위브,길음뉴타운 마지막 물량·등기후 전매 가능 가을 청약시장 최고 우량주 지하철4호선 10분거리… 교육·편의시설도 양호 두산건설이 길음7구역에서 선보이는 두산위브 총 548가구는 ‘길음뉴타운’과 ‘등기 후 전매가능’이라는 두 가지 조건만으로도 가을 청약시장 최고 우량주로 꼽히는 곳이다. 지난 8월 8구역과 9구역에서 삼성물산의 분양 이후 길음뉴타운에서 공급되는 거의 마지막 물량이기도 하다. 길음뉴타운은 서울시 최초의 시범뉴타운 중 하나로 주변의 미아뉴타운 미아균형발전촉진지구 장위뉴타운 등과 복합 개발이 진행되고 있으며 향후 서울 동북부의 주거중심로 거듭날 계획이다. 길음 두산위브가 들어설 7구역은 총 1만2 000가구가 조성되는 길음ㆍ미아 뉴타운 내에서도 최중심에 위치해 조용하고 쾌적한 주거환경을 자랑한다. 교통환경도 뛰어나다. 지하철 4호선 길음역이 700m 도보 10분 거리에 위치하며 미아ㆍ정릉ㆍ삼양ㆍ도봉로를 이용해 도심에 진입할 수 있다. 내부순환도로와 북부간선도로 동부간선도로를 이용해 수도권 외곽지역 진출입이 편리하다. 또 우이 신설로 이어지는 지하경전철이 2013년 개통 예정이다. 교육시설로는 고려대ㆍ국민대와 대일외고 영훈초등학교와 가깝고 길음뉴타운 내에 자립형사립고를 신설할 예정이다. 편익시설로는 현대백화점 롯데백화점을 비롯해 롯데마트가 들어설 예정이며 길음ㆍ미아ㆍ숭인시장 등 재래시장과 인접해 있으며 삼각산문화예술회관 미아CGV 고려대학교병원 경희의료원 등을 이용할 수 있다. 단지는 경사지 최고 18m 차 에 위치한 특성을 감안해 층단형으로 설계됐으며 필로티 설계를 적용해 저층부가 다른 아파트 4 5층에 해당하는 높이며 단지 전체적으로 개방감과 조망권이 뛰어나다는 장점이 있다. 전동이 탑상형으로 설계됐으며 남향과 남서향이 고루 배치됐다. 단지 내 녹지율이 34%로 각종 테마공원이 조성되며 장애인 주차시설을 제외한 모든 주차공간을 지하화 했다. 내부 설계에 있어서는 부엌을 비롯해 집안 곳곳의 자투리에 수납장을 짜 수납공간이 풍부하고 부엌이 동일평형에 비해 넓다는 것이 길음 두산위브의 장점. 하지만 부부침실이나 공용욕실 면적이 상대적으로 비좁게 설계된 것은 단점이며 가구수도 다른 구역에 비해 적은 편이다. 분양가는 87㎡형이 3.3㎡당 평균 1 270만원대이며 112㎡형이 1 350만원대 146㎡형이 1 350만원 대로 최근 분양을 마친 길음8ㆍ9구역 삼성래미안 보다 저렴한 편이며 분양가에 발코니확장비용과 붙박이장 및 각종 옵션이 포함됐다.,https://news.naver.com/main/read.nhn?mode=LSD&mid=shm&sid1=260&oid=011&aid=0000202078,92
65808,2007.10.10. 오후 4:54,부동산,파이낸셜뉴스,현장르포 인천 강화군 일대“남북경협 기대？ 남의 이야기죠”,“파주와 김포지역만 해도 남북 정상회담에 따른 경협확대 기대감으로 부동산시장이 꿈틀거리고 있는데 여기 강화도 는 요지부동이에요. 토지거래허가구역으로 묶여 있는 데다 교통여건 등 각종 기반시설이 부족해 시세도 올 하반기 들어 큰 변동이 없어요.” 인천 강화군 강화읍내 H중개업소 관계자 10·4남북 공동선언의 최대 수혜지로 예상되는 수도권 서북부 3각축 경기 파주 김포 인천 강화 중 한 곳인 인천 강화군의 부동산 시장은 다른 지역과 달리 차분한 분위기였다. 지난 9일 강화군 현지를 찾은 기자는 두 번 놀랐다. 하나는 경협의 최대 수혜지 중 한 곳이면서도 ‘각종 호재가 있는 곳에 반드시 시장 움직임이 있을 것’이라는 기대와는 정반대 현상이 이곳 부동산 시장에 일어나고 있다는 것이다. 또 다른 하나는 휴·폐업으로 문을 닫은 중개업소가 너무 많아 취재를 할 수 없는 지경이라는 것이었다. 실제 강화군의 중심지인 강화군청과 강화시외버스터미널 주변 등 강화읍내 부동산중개업소는 2곳 중 1곳가량은 폐업 또는 휴업상태로 중개업자를 만나기조차 쉽지 않을 정도였다.그마저 불이 켜진 중개업소들도 대부분 문이 잠겨 있어 발걸음을 뒤로 해야만 했다. 자리를 지키고 있는 중개업소 관계자들도 시장 동향에 대한 물음에 한결같이 “남북경협에 따른 영향은 없다”고 말했다. 취재시간 동안 중개업소를 찾는 발길이나 문의전화도 전혀 없어 이들의 대답을 증명하는 듯했다. 이에 대해 한 중개업소 관계자는 “강화군 일대는 토지거래허가구역으로 묶여 있어 외지인의 거래가 쉽지 않은 데다 그동안 땅값이 많이 오른 상태여서 아직은 시장 움직임이 없다”고 말했다. 이 관계자는 “게다가 강화군 일대의 토지 중 거래될 만한 땅은 대부분 이미 외지인의 소유여서 물건도 잘 나오지 않는다”고 귀띔했다. 이에 따라 이 일대는 올해 들어 토지거래가격은 큰 변화가 없고 아파트 시세는 최대 1000만원 정도가 오른 게 전부다. 군청 인근에 자리한 세광아파트 현대아파트 82.5∼100㎥ 시세는 1억2000만∼1억4000만원선으로 두 달 전 나온 매물도 아직까지 주인을 찾고 있었다. 3.3㎡당 200만∼300만원대로 강화도에서 가장 고가아파트들이 포진한 남부 화도면 길상면 해안가 아파트들도 거래가 없긴 마찬가지다. 읍내의 주거지역은 용적률이 60%로 비교적 높은 편이지만 읍을 둘러싸고 있는 자연녹지는 20% 외곽지역은 40%선이다. 땅을 사도 실제로 살 수 있는 공간은 그리 넓지 않고 사업성도 떨어진다는 얘기다. 다만 김포와 강화 초지진을 잇는 초지대교가 들어서면서 대교 인근인 길상면 일대 땅값이 오를 것이라는 게 현지 중개업자들의 설명이다. 남북 경협의 영향보다는 기반시설 수혜에 따른 전망이다. H공인 관계자는 “다리가 놓여지면 인근 땅값이 오르게 마련”이라며 “지금보다 더 오를 것으로 보고 강화도 현지인 이름을 빌려 매입하려는 서울사람들도 부쩍 늘었다”고 전했다. 현지 중개업자들에 따르면 초지대교가 놓인 길상면의 땅값은 상가지역의 경우 3.3㎡당 평균 400만원선으로 산을 제외한 강화도지역 땅값이 3.3㎡당 싼 곳은 30만∼40만원 집이 지어지면 80만∼100만원인 점을 고려하면 꽤 높은 수준이다. winwin fnnews.com 오승범 김아름기자 사진설명 남북 경협 확대에 대한 기대감으로 경기 파주와 김포 등지 부동산 시장에 투자자들의 관심이 쏠리고 있는 데 비해 인천 강화군 일대는 예상외로 차분해 대조적이다. 강화군 시외버스터미널 인근 한 중개업소 유리창에 매물만이 덩그러니 걸려 있다.,https://news.naver.com/main/read.nhn?mode=LSD&mid=shm&sid1=260&oid=014&aid=0000347643,92
65809,2007.10.10. 오후 4:54,부동산,파이낸셜뉴스,“차라리 미분양이 낫다” 건설업체,건설업체들의 아파트 분양 마케팅에 변화의 바람이 불고 있다. 10일 건설업계에 따르면 건설업체들은 아파트 미분양이 서울·수도권까지 확산되자 순위 내 마감에 매달리기보다는 정식 분양 전에 미리 대기수요자들로부터 사전 청약을 받는 이른바 깜깜이 분양과 미분양 발생에 따른 선착순 분양에 마케팅을 집중하고 있다. 이같은 전략은 비인기지역 아파트에 더욱 집중되고 있다. 비인기지역의 경우 청약통장 사용을 기피하는 소비자 특성을 고려해 분양공고를 지방신문에 작게 내고 홍보도 하지 않고 정식 분양에 들어간 뒤 미분양이 발생하면 각종 할인 또는 로열층 배정 등을 무기로 계약몰이에 나서는 것이다. 실제로 KCC건설은 지난달 말 청약에 들어간 춘천시 동면 만천리 ‘스위첸’ 아파트 367가구가 3순위까지 청약률 0%를 기록했다. 전매가 가능한 비투기과열지구인 데다 3.3㎡당 530만∼566만원에 계약금 5% 인하 중도금 60% 무이자 융자 혜택까지 부여한 물량임을 감안하면 저조한 결과다. 하지만 이같은 결과는 KCC측이 의도적으로 유도한 측면이 강하다는 게 전문가들의 시각이다. 분양공고를 지방 신문에 작게 내고 홍보도 하지 않아 당연한 결과로 나타난 것이다. KCC는 대신 3순위 청약 이후 미분양 물량에 대해 로열층 우선 배정 등으로 선착순 모집에 나서 지난 9일 현재 계약률이 15%를 돌파했고 추가 계약자도 잇따르고 있는 것으로 알려졌다. 지난달 중순 메디치가 서울 서초구 서초동에서 분양한 주상복합 ‘캐슬 메디치’ 50가구도 역시 3순위까지 청약률이 0%였다. 업계에서는 그러나 이는 시행사측이 청약통장과 무관한 강남권 고소득층을 겨냥 홍보를 제대로 하지 않은 결과로 보고 있다. 업계 한 관계자는 “강남 부자 중에서 청약통장을 가지고 있는 사람이 몇이나 되겠냐”면서 “이 아파트는 미분양된 것이 오히려 마케팅 측면에서는 유리할 것”이라고 말했다. 그는 “강남 부자를 타깃으로 접촉하면 계약률 100%는 시간문제일 것”이라고 강조했다. 경기 남양주시 진접에서 동시분양했던 업체들도 분양 당시에는 3순위까지 청약률이 절반에도 미치지 못했지만 선착순 분양 이후 계약자들이 몰리면서 일부 업체는 계약률이 70∼80%를 넘어선 것으로 알려졌다. A사 관계자는 “실수요자들이 청약통장 사용을 꺼리는 데다 미분양이 나면 각종 할인혜택이 주어지는 점을 이용 의도적으로 청약을 하지 않다가 선착순 분양 때 몰려든 것 같다”면서 “분양가 상한제와 청약가점제 등 청약환경이 크게 바뀌면서 청약자들의 생각도 변하고 그에 맞춰 건설업체의 분양마케팅도 바뀌고 있다”고 말했다.,https://news.naver.com/main/read.nhn?mode=LSD&mid=shm&sid1=260&oid=014&aid=0000347642,92
65810,2007.10.10. 오후 4:54,부동산,파이낸셜뉴스,송파신도시 연내 토지보상 힘들듯,서울 송파신도시 개발예정지의 개발제한구역 그린벨트 해제를 위한 서울시의회의 의견청취 일정이 오는 11월 초로 연기됐다. 이에 따라 연내에 개발계획승인 및 토지보상에 들어가려던 정부의 송파신도시 개발 일정에 ‘빨간불’이 켜졌다. 서울시의회 도시관리위원회는 10일 오전 열린 제167회 임시회의에서 서울시가 입안한 ‘도시관리계획 개발제한구역 해제 결정에 관한 의견청취’ 안건을 다음 회기로 연기하기로 결정했다. 이 안건은 송파신도시 개발예정지 중 서울시 관할구역인 송파구 거여동·장지동 일대 그린벨트 155.554㎢를 푸는 내용을 담은 것으로 당장 송파신도시 개발의 첫 단추인 개발계획 승인에 앞서 반드시 서울시의회 의견청취 절차를 거쳐야 한다. 서울시의회 한 관계자는 “지금까지 국토 개발 과정에서 이렇게 대규모로 그린벨트를 해제한 경우가 없었기 때문에 의원들 간에 논란이 많다”면서 “서울 위주의 수도권 집중을 억제하자는 국토의 균형발전 계획과도 어긋나 논란이 많은 만큼 시민들과 관계기관 의견을 더 파악하고 신중히 결정하자는 취지로 의견청취를 연기하기로 결정했다”고 설명했다. 서울시의회는 이에 따라 오는 11월2일부터 시작하는 제33회 서울시의회 본회의에 이 안건을 다시 올려 의견청취 절차를 진행할 예정이다. 하지만 아직도 서울시의회 의원간에 논란이 많아 내달에도 제대로 의견이 수렴될 수 있을지는 미지수라는 게 시의회측의 설명이다. 서울시의회의 또 다른 관계자는 “의원 간에 논란이 많아 내달 본 회의에서도 제대로 절차가 진행될지 여부는 지금 판단하기 어렵다”면서 11월에도 의견청취 결과를 모으기 쉽지 않을 것임을 내비쳤다. 서울시의회 의견청취 절차가 11월로 미뤄짐에 따라 송파신도시 개발 일정도 연기될 가능성이 한층 커졌다. 정부는 서울시의회 의견청취 후 ‘관계부처 협의 및 중앙도시계획위원회 심의 개발계획 승인 감정평가·보상협의 토지보상 착수’ 등을 진행해야 한다. 앞서 정부는 지난 9월까지 시의회 의견청취를 마치고 개발계획을 승인해 올해 안에 토지보상에 착수한다는 계획이었다. 하지만 시의회 의견청취 절차가 정부의 예상보다 두 달가량 늦춰지면서 예정대로 올해 내 토지보상에 착수하기 어려울 것이라는 전망도 힘을 얻고 있다. 지자체 한 관계자는 “서울시와 송파구 등 지자체들이 반대하는 상황에서 무리하게 송파신도시를 밀어붙이려다 보니 사업이 자꾸 지연될 수밖에 없다”면서 “11월에서 또 다시 의견청취 절차가 연기되고 대선 시기가 되면 올해 안에 토지보상 착수는 거의 불가능할 것”이라고 말했다. 한편 일부 전문가들은 올해 안에 개발계획 승인과 토지보상에 착수하지 못한 상태에서 대선에서 정권이 야당으로 교체될 경우 송파신도시 사업은 원점부터 다시 논의될 가능성이 크다고 입을 모은다.,https://news.naver.com/main/read.nhn?mode=LSD&mid=shm&sid1=260&oid=014&aid=0000347641,92
65811,2007.10.10. 오후 4:54,부동산,파이낸셜뉴스,리모델링 쉬운 공동주택 용적률 완화,이달 말부터 리모델링이 쉬운 구조로 공동주택을 건설할 경우 최대 20%까지 용적률 인센티브가 주어지며 건설회사 건축주 등이 용적률 인센티브를 받는 데 소요되는 행정처리기간도 대폭 단축된다. 이렇게 되면 리모델링이 쉬운 라멘조 기둥과 보로 건물을 지탱하는 방식 아파트 건설이 활성화 될 전망이다. 건설교통부는 리모델링이 쉬운 구조인지를 판단하는 ‘건교부장관 고시기준’이 지난 4일 중앙건축위원회 심의를 마쳤으며 규제개혁위원회 심사를 거쳐 이달 중 관보에 고시한 뒤 곧바로 시행할 방침이라고 10일 밝혔다. 이 기준이 고시되면 지방자치단체는 주택사업자가 제출한 건축설계가 리모델링에 적합한지를 판단해 조례에서 정한 용적률보다 20%를 추가로 허용해 줄 수 있다. 건교부는 특히 용적률 인센티브 제공에 따른 행정처리기간 단축을 위해 도시계획상의 지구단위계획 변경과 건축허가 사업계획 승인 포함 절차 등을 간소화하도록 하는 내용의 지침을 각 시·도에 시달했다. 건교부는 우선 도시관리계획 승인권자와 건축허가권자가 같기 때문에 처리기간이 단축될 수 있도록 지구단위계획과 건축설계 등을 유기적으로 작성토록 했다. 건교부는 또 도시계획심의위원회와 지방건축위원회의 심의를 공동으로 운영토록 했다. 심의위원들에게는 설계자들이 리모델링 촉진을 위한 건축법 특례 취지 등과 필요한 자료를 사전에 설명하도록 의무화했다. 이와함께 도시 및 주거환경정비법 택지개발촉진법 등에 따라 지구단위계획을 의제처리하는 경우 기본 정비계획과 사업계획을 연계해 수립토록 했다. 이밖에 지구단위계획을 최초로 수립할 경우 지구단위계획과 건축법상 용적률 기준 완화 관계를 연계 계획수립과 설계도서를 동시에 작성할 수 있도록 했다. 이렇게 되면 주택사업 승인 등에 따른 행정처리기간이 현행 6개월∼1년에서 3∼6개월로 대폭 단축될 전망이다.,https://news.naver.com/main/read.nhn?mode=LSD&mid=shm&sid1=260&oid=014&aid=0000347639,92
65812,2007.10.10. 오후 4:54,부동산,파이낸셜뉴스,분양정보 길음 두산위브 126가구,두산건설은 서울 성북구 길음동 길음뉴타운 7구역에 들어서는 ‘길음뉴타운 두산위브’ 126가구를 오는 15일부터 일반에 분양한다. 이 아파트는 총 548가구 조감도 로 구성됐으며 조합원분을 뺀 일반분양 물량은 84.66㎡ 22가구 87.38㎡ 24가구 112.024㎡ 18가구 112.137㎡ 18가구 145.96㎡ 22가구 146.40㎡ 22가구 등이다. 11일 강남구 역삼동 두산건설 주택문화관에서 모델하우스를 오픈하고 15∼18일 청약을 받는다. 주택형별 분양가는 3.3㎡당 84.67㎡는 1270만원대 112.02㎡는 1350만원대 146.40㎡는 1530만원대다. 조망과 개방감이 양호한 타워형으로 건설되며 남향 배치 가구가 많은 게 특징이다. 외부 저층부는 화강석으로 마감하고 주차장은 모두 지하화한다. 아파트 거실과 안방에 천장형 에어컨이 설치되며 계약기간 내 계약자에게는 무료로 발코니 확장을 해준다. 걸어서 10분 거리에 지하철 4호선 길음역이 있다.,https://news.naver.com/main/read.nhn?mode=LSD&mid=shm&sid1=260&oid=014&aid=0000347638,92
65813,2007.10.10. 오후 4:51,부동산,연합뉴스,전국 어디서든 인터넷으로 부동산 등기 가능,서울 연합뉴스 임주영 기자 등기소를 직접 가지 않고도 집이나 사무실에서 토지ㆍ건물 등기를 신청할 수 있는 부동산 등기 전자신청 서비스 가 전국에서 제공된다. 대법원은 현재 부동산 등기 전자신청이 서울과 수도권의 60개 등기소ㆍ법원 등기과에서만 가능하지만 실시 지역을 97곳 추가해 전국 157개 등기소ㆍ과에서 확대 시행한다고 10일 밝혔다. 서비스 확대 지역은 제주와 강원 광주ㆍ전남 대구ㆍ경북 부산 대전ㆍ충남 지역의 97개 등기소ㆍ과이며 소유권 보존ㆍ이전 건물멸실 등 9개 등기 유형의 전자신청이 추가로 가능해진다. 대법원은 지난해 6월 서울중앙지법 등기과를 시작으로 전자신청을 도입 올 3월까지 3차례 시행범위를 넓혔으며 종전까지는 서울과 수도권 60개 등기소ㆍ과에서 35개 유형의 전자신청이 가능했었다. 전자신청 확대로 제주도나 울릉도에 있는 부동산도 집에서 등기 신청을 하게 되는 등 특히 원격지에 있는 부동산의 등기 신청이 한결 편리해졌다. 예를 들어 서울 노원구 주민이 제주도에 땅을 사 등기 신청을 할 경우 제주도 등기소를 방문해야 하기 때문에 인지세 증지수수료 숙박ㆍ교통비 등 53만원 가량이 들지만 전자신청을 하면 증지수수료 6천원만 든다. 전자신청 1건당 절약 비용은 국민은 4만6천415원 등기소 공무원의 경우 1천293원으로 분석돼 가계 부담과 예산 절감효과도 크다고 대법원은 설명했다. 대법원 관계자는 전국에서 등기 전자신청이 가능해져 국가 경제적 효과와 함께 국민의 편익 증진이 기대된다 라고 말했다.,https://news.naver.com/main/read.nhn?mode=LSD&mid=shm&sid1=260&oid=001&aid=0001780668,92
65814,2007.10.10. 오후 4:51,부동산,뉴시스,희림 ‘2007 부산다운 건축상’ 수상,희림 2007 부산다운 건축상 수상 서울 뉴시스 희림종합건축사사무소가 2007 부산다운 건축상 에서 부산 남구청사가 최고상인 금상에 부산 디자인센터는 같은 부문 동상 공공기여 건축물 부문에서 남구청사가 은상을 수상했다고 10일 밝혔다. 금상 수상작인 남구청사는 심플하고 다이나믹한 건물 외관과 현대적인 내부 설계로 기존의 딱딱하고 권위적인 관공서 이미지를 탈피해 공공건물이 가야 할 바를 알려준다는 점에서 심사위원들에게 인정 받았다. 남구청사와 디자인센터 건물은 희림과 씨엔티 사무소가 공동 설계했다. 희림 정영균 대표는 두 작품으로 3부문에서 수상했다. 수상 결과는 희림의 우수한 설계 능력을 대변해주는 것 이라며 앞으로 국내 경쟁력을 바탕으로 설계 능력을 강화해 해외 수주를 활발히 진행시켜 글로벌 건축설계 전문기업으로 도약할 것 이라고 자신했다. 부산다운 건축상 은 올해 5회째로 부산시건축사회가 주관한다. 부산에서 디자인이 가장 아름다운 건축물을 선정해 알리기 위해 만들어졌다.,https://news.naver.com/main/read.nhn?mode=LSD&mid=shm&sid1=260&oid=003&aid=0000595790,92
65815,2007.10.10. 오후 4:51,부동산,서울경제,주목 이곳 부천 소사지구,256만㎡ 규모…경기 뉴타운중 최대 2020년까지 3만6 100가구 건립 환경쾌적 3년후 소사 안산 전철완공 교통도 좋아져 지분쪼개기 많지 않아 중장기적 투자가치 부천 소사지구는 경기도의 시범 뉴타운으로 소사본동과 괴안동 일대 256만㎡에 걸쳐 있다. 현재는 낡은 주택과 공장 등이 혼재돼 있지만 5단계에 걸쳐 2020년까지 미니 신도시로 탈바꿈하게 된다. 도로 공원 교육시설 등 기반시설을 체계적으로 갖추고 현재 가구수보다 소폭 많은 아파트가 들어서게 된다. 곳곳에 산재해 있는 소규모 공장들도 이전하게 돼 쾌적한 주거환경이 조성된다. 김문수 경기도지사의 과거 지역구에 포함됐던 소사뉴타운은 2006년 11월 지정된 경기도뉴타운 10개 중 최대 규모이다. 자체 개발면적이 넓은데다 부천의 다른 뉴타운지구인 원미지구 및 고강지구와 함께 광역개발을 꾀할 수 있어 시너지효과가 기대된다. 또한 고강지구의 경우에는 고도제한에 묶여 초고층 아파트를 지을 수 없는 것에 비하면 상대적 우위도 확보하고 있다는 평가다. 소사뉴타운은 지난 6월 건설교통부로부터 광명뉴타운 등과 함께 재정비촉진사업 시범지구로 선정돼 사업추진에 속도가 붙을 것으로 보인다. 재정비촉진지구로 지정되면 정부로부터 재정적ㆍ행정적 지원을 받게 된다. 또한 김 지사가 주거안정을 위해 뉴타운 개발과 신도시 건설에 많은 관심을 두고 있다는 점에서 사업추진에도 힘이 실릴 것으로 보이는 점도 긍정적 요인으로 꼽힌다. 교통여건의 경우도 좋아질 전망으로 현재 구역내 국철 소사역과 역곡역 등 지하철을 비롯 경인국도 소사로 외곽순환도로 등을 이용할 수 있으며 2010년에는 소사 시흥 안산간 복선전철이 완공될 예정이다. 소사뉴타운은 전반적으로 평지로 이뤄져 있는 점이 특징이다. 다만 동네별로는 역곡역 주변의 괴안동 일대가 완경사지로 이뤄져 있고 편의시설과 주거쾌적성면에서 소사동에 약간 밀린다는 평가다. 특히 소사뉴타운은 다른 재개발지구에 비해 지분쪼개기가 많지 않아 중장기적 차원에서 접근한다면 투자가치가 있다는 게 전문가들의 얘기다. 이미영 스피드뱅크 분양팀장은 “재개발을 하는 과정에서 지분쪼개기가 많지 않다는 것은 그만큼 사업추진이 꾸준히 이뤄질 수 있다는 것을 의미한다”고 말했다. 다만 소사뉴타운은 투기차단을 위해 지난해 말 뉴타운 발표 직후 토지거래허가구역으로 묶이면서 거래는 별로 이뤄지지 않고 있다. 대지 지분 20㎡이상의 물건을 사려면 실입주를 해야 하기 때문이다. 가격은 토지허가구역으로 묶인 뒤에는 보합권이지만 개발호재로 인해 지난해 여름무렵부터 치솟았던 것에 비하면 2배가량 오른 상태다. 20㎡ 지분이 안되는 빌라는 3.3㎡당 2 300만 2 400만원선이며 좀 큰 빌라는 1 700 1 800만원선이다. 다가구주택의 경우에는 대체로 지분이 커 3.3㎡당 800만 900만원선이다. 부천시 소사본동의 키움컨설팅중개 김철호 대표는 “토지거래허가구역으로 묶인 뒤에는 가격이 정체상태이지만 내년에 촉진계획이 나오고 당초 계획대로 이르면 2009년 말부터 착공에 들어가면 가격이 다시 움직일 것”이라고 내다봤다.,https://news.naver.com/main/read.nhn?mode=LSD&mid=shm&sid1=260&oid=011&aid=0000202077,92
