,date,cat,co,headline,text,url,week
64479,2007.09.23. 오후 4:39,부동산,아시아경제,유망택지지구 양주 고읍 2000여가구 동시분양,추석이후 양주고읍지구에서는 2000여가구의 동시분양 물량이 쏟아질 전망이다. 기존에 4개사가 동시분양을 준비해 왔지만 신도종합건설 물량이 동시물량에서 빠지면서 3개사로 줄었다. 우남 우미 한양 등 3개 업체로 블록별로는 퍼스트빌 2블록 376가구 우미린 3블록 513가구 수자인 1블록 598가구 수자인 6 3블록 434가구 등이다. 분양가는 주변시세보다 약간 높은 700만원대가 예상된다. 청약가점제 도입으로 중소형은 청약 예.부금 가입자로 가점제 75% 와 추첨제 25% 방법이 적용되며 중대형은 청약예금 가입자로 채권매입예정금액이 우선 적용된다. 매입예정금액이 같은 경우 가점제 50% 와 추첨제 50% 가 병행 적용된다. 양주 옥정 회천 신도시와 인접해 있어 후광효과가 기대되며 2008년 완공되는 국도3호선 의정부 장암 회천구간 우회도로가 지나간다. 또한 올 10월에 개통되는 경원선 복선전철 주내역과 덕정역 사이에 위치한 덕계역을 이용할 수 있어 교통환경도 크게 좋아졌다. 이외에도 주거환경이 정비되고 있다 의정부 동두천 양주일대에 산재해 있던미군부대가 한강 이남으로 이전하면 대규모 녹지. 택지가 조성되고 첨단산업 교육 광역행정타운 건설도 추진된다. 부동산 전문가들은 양주시는 행정타운 국제자유도시 건설 지역첨단산업 육성을 통해 경제 인프라를 구축해가고 있다 며 신도시. 택지지구 개발과 함께 자족기능을 갖춘 도시로 성장할 것 이라고 말했다. 한편 신도종합건설이 동시분양 일정을 깨고 지난 17일 청약을 실시한 데 이어 한양도 분양가상한제 적용으로 전매제한 대상인 10블록 800가구 분양을 연기 설계변경에 들어가 동시분양 물량은 3465가구에서 1921가구로 줄어들게 됐다.,https://news.naver.com/main/read.nhn?mode=LSD&mid=shm&sid1=260&oid=277&aid=0000002412,90
64480,2007.09.23. 오후 3:30,부동산,머니투데이,올 전국 아파트값 1.49%↑..부동산광풍 소멸,머니투데이 원정호 기자 시황 매매 연초대비 아파트값 얼마나 올랐나 올해 전국 아파트값은 1.49% 오르는 데 그쳐 작년 같은 기간에 비해 극히 미미한 움직임을 보였다. 봄시장과 가을시장을 중심으로 강세를 보인 작년 서울과 수도권 시장에 비해 올해는 1월 초부터 세금 대출 등 각종 규제 영향으로 아파트값이 안정세를 보이면서 가격 변동이 크지 않았다. 23일 부동산정보업체 부동산114의 시세조사에 따르면 올 1월 초 대비 9월 21일까지 서울지역은 1.08% 전국은 1.49% 변동률을 기록했다. 작년 같은 기간 서울이 16.37% 전국이 12.76% 각각 상승한 것과 비교하면 미미한 움직임이다. 규모별로는 대출이자와 세금 부담 증가로 중대형이 약세를 보인 반면 상대적으로 가격이 저렴한 서울 강북권이나 수도권 외곽의 중소형 중심으로 오름세를 보였다. 전국 평균 기준으로 69 99㎡대는 매매가격이 연초대비 3.54% 올랐으나 168㎡이상 대형은 0.15% 하락했다. 전세 역시 99㎡이하 중소형이 훨씬 높은 상승률을 보였다. 서울 구별로는 강남권과 양천 등 고가 지역의 약세가 두드러졌다. 서대문 8.49% 중구 8.32% 도봉 7.46% 중랑 7.43% 동대문 7.0% 강북 6.94% 노원 6.34% 은평 5.79% 성북 5.74% 구로 5.24% 등이 오른 반면 양천 4.42% 강동 4.2% 송파 2.49% 강남 1.3% 서초 0.62% 등 강남권 4개 구와 양천은 하락했다. 이에 따라 이들 강남권 4개 구와 양천구 만은 연초대비 평균 2.1% 하락했고 나머지 20개 구는 평균 4.68% 올라 양극화된 모습을 보였다. 고가 아파트 약세 속에 재건축도 강남권 중심으로 하락세를 나타냈다. 올 연초대비 서울 재건축은 3.68% 경기 2.43% 인천은 1.08% 각각 하락한 것으로 나타났다. 수도권의 경우에도 시흥 25.49% 의정부 18.74% 이천 12.38% 양주 12.06% 안산 10.49% 인천 8.87% 동두천 8.53% 등 다양한 개발호재와 신규 분양에 따른 관심 증가로 수요가 늘어난 지역들이 연초보다 크게 상승한 것으로 나타났다. 반면 과천 6.27% 고양 1.13% 안양 1.05% 용인 0.95% 성남 0.77% 구리 0.65% 의왕 0.26% 등은 하락했다.,https://news.naver.com/main/read.nhn?mode=LSD&mid=shm&sid1=260&oid=008&aid=0000831934,90
64481,2007.09.23. 오후 2:54,부동산,파이낸셜뉴스,추석이후，분당연장선 인근 분양 봇물,추석이후 수원시에 신규 분양이 집중된다. 2011년 개통되는 분당 연장선 인근에 위치하고 있어 교통여건이 크게 개선되기 때문이다. 23일 부동산뱅크에 따르면 추석이후 수원시에서 새로 분양되는 물량은 총 12개 단지 1558가구에 달한다. 대부분 분당연장선 구간에 집중된 역세권 수혜단지가 될 전망이다. 대림산업과 GS건설은 10월 권선주공 1 3차 재건축 단지인 ‘권선e 편한세상자이’ 일반분양 분 416가구를 분양한다. 분당선 연장 구간인 ‘수원시청역’ 근처다. 83∼228㎡의 다양한 주택형에 1754가구로 구성된다. 지하철 1호선 세류역도 차로 5분 거리에 있다. 한화건설도 10월 팔달구 인계동 1127 1번지에 ‘한화꿈에그린’ 148∼205㎡ 214가구를 공급한다. 역시 분당선 연장구간이 ‘수원시청역’을 걸어서 10분 내 이용할 수 있는 역세권 단지로 관심을 모은다. 동수원초 매탄초 인계초 매원중 산남중으로 통학이 가능하며 인근에 매탄공원 올림픽공원 효원공원이 위치해 조망프리미엄도 누릴 수 있다. 11월에는 임광토건이 망포동에 ‘임광그대가’ 1 2 3단지를 동시에 분양한다. 1단지에 79∼178㎡ 808가구 2단지에 79∼149㎡ 674가구 3단지에 145∼182㎡ 299가구가 각각 공급된다. 지하철 1호선 수원역이 차로 15분 거리에 있으며 새로 개통될 분당선 연장구간 ‘방죽역’과 ‘영통역’이 가깝다. 곡선초 매탄초 권선초 권선고 등으로 통학이 가능해 교육환경이 우수하다. 역시 11월 분양예정인 영통구 망포동 ‘현진에버빌’ 530가구 87∼177㎡ 는 ‘영통역’ 인근이며 매탄동 ‘메탄e 편한세상’ 586가구 129∼172㎡ 는 ‘매탄역’과 ‘영통역’이 가깝다. 12월 신창건설이 망포동 472 2번지 일대에 공급하는 129∼172㎡ 383가구도 분당연장구간 수혜를 볼 전망이다. 지하철 1호선인 수원역을 차로 20분 내 이용이 가능하고 새로 개통 될 ‘방죽역’이 가깝다. 대선초 영동중 영일중으로 통학이 가능하며 올림픽공원 아주대병원 삼성홈플러스 그랜드마트 등 편익시설 또한 풍부하다. 한편 분당연장선은 기존 분당선의 오리역과 지하철 1호선의 수원역을 잇게 된다. 죽전4거리 ‘죽전역’ 구성지구 앞 ‘신갈역’ 녹십자입구 ‘기흥역’ 상갈·보라지구 내 ‘상갈역’ 활공주공아파트 앞 ‘영덕역’ 영통홈플러스 앞 ‘영통역’ 망포4거리 앞 ‘방죽역’ 매탄임광아파트 앞 ‘매탄역’ 갤러리아백화점 4거리 ‘수원시청역’ 결혼회관 앞 ‘매교역’이 건설되고 여기에 추가로 2곳이 신설된다. 분당연장선은 수원역에서 수인선 및 수도권 지하철 1호선과 환승 가능하며 이후 왕십리∼선릉 수원∼인천 노선과 연결돼 서울과 인천으로의 접근성이 한층 수월해질 전망이다.,https://news.naver.com/main/read.nhn?mode=LSD&mid=shm&sid1=260&oid=014&aid=0000342993,90
64482,2007.09.23. 오후 2:00,부동산,머니투데이,흙속의 진주를 찾자…즉시 입주 미분양,머니투데이 문성일 기자 분양가상한제를 중심으로 각종 규제로 인한 주택경기 침체와 수요 기근으로 최근들어 시장의 화두 중 하나는 건설업체의 잇단 부도다. 일단 업체가 부도를 내면 해당 사업장의 아파트를 분양받아놓은 수요자들은 당장 입주에 이르는 과정을 걱정해야 한다. 무엇보다 계약금이나 중도금 등으로 낸 분양대금을 떼일 수 있는 불안감을 안게 된다. 아파트를 시공중인 건설사가 도산할 경우 분양보증기관인 대한주택보증에서 보증을 받아놨더라도 또다른 시공사를 재선정해야 하는 등 입주시까지 적지 않은 시간이 필요하다. 그만큼 입주 지연은 불가피하다. 미분양아파트도 마찬가지다. 최근 줄잇는 건설업체들의 부도도 사실상 미분양에서부터 야기된다. 이런 점에서 청약통장이 필요없고 동·호수를 마음대로 고를 수 있는 미분양아파트일지라도 수요자 입장에선 걱정이 앞선다. 하지만 이런 우려와 공포를 크게 걱정하지 않아도 되는 미분양아파트도 있다. 바로 준공 미분양이 그렇다. 미분양아파트는 부동산시장에서 가장 주의할 상품으로 분류된다. 미분양의 가장 큰 이유는 입주여건이나 조건 등이 좋지 않아서다. 이런 이유로 미분양아파트는 시장에서 찬밥 신세다. 계약 즉시 입주가 가능한 준공 미분양아파트는 이런 점에서 잘만 고르면 수요자 리스크를 최소화할 수 있는 상품이 될 수 있다. 통상 아파트는 분양후 입주시까지 2년6개월에서 3년 가량 시간이 걸린다. 이에 비해 계약 직후 입주할 수 있는 단지라면 적어도 시공사 부도의 공포를 덜 수 있다. 건설사들은 통상 미분양 해소를 위해 계약시 갖가지 혜택을 주는 경우가 대다수다. 중도금이나 잔금 등의 납부를 계약자에게 유리하게 해주는 경우가 있는가 하면 아예 분양가를 크게 낮춰주는 사례도 심심치 않다. 이는 미분양아파트가 흙 속의 진주 가 될 수도 있는 이유이기도 하다. 23일 건설업계에 따르면 전국 717개 미분양단지 가운데 181곳이 입주를 시작한 아파트다. 수도권에선 입주후 미분양단지가 34곳으로 나머지는 모두 지방에 몰려있다. 한국토지신탁이 공급한 경기 안성시 신소현동 코아루 는 829가구 규모의 대단지로 올 초 입주를 시작했으나 일부 물량이 아직 주인을 못찾아 빈집으로 남아있다. 물론 계약만 하면 곧바로 입주가 가능하다. 삼환기업은 충남 천안시 성거읍에 지은 910가구 규모의 삼환나우빌 을 분양 중이다. 수도권전철 1호선 연장선 직산역과 인접해 있다. 수원역까지 30여분 천안역까지 6분 거리다. 메가마트와 농수산물 도매센타 천안시청 북부출장소 단국대 부속병원 등이 가깝다. 잔여물량을 공급 중인 부산 북구 만덕동 상록한신 휴플러스 는 882가구 규모로 부산지하철 3호선 만덕역이 걸어서 10분 거리다. 롯데백화점과 메가마트도 차량으로 10분 정도 소요된다. 계약자에겐 발코니 섀시와 거실 방 온돌마루 등을 무료로 시공해 준다. 주방가전도 서비스로 제공한다. 잔금을 한꺼번에 납입하면 분양가의 10%를 할인해 준다. 대우건설은 양산 서창지구에 들어선 웅상신도시 푸르지오 잔여가구를 분양 중이다. 987가구으로 구성된 이 아파트는 7번 국도가 인접해 있다. 웅상읍을 경유하는 경전철이 올 연말 개통된다. 1층은 섀시가 무료로 시공되며 2층은 냉장고를 제공한다. 대구 수성구 황금동 황금아파트 재건축단지인 롯데화성캐슬골드파크 도 일부 미계약 물량을 분양하고 있다. 66개동에 4256가구 규모의 초대형아파트로 단지 내에는 분수광장 산책로 테마공원 등이 있다. 섀시를 무료로 제공한다. 스피드뱅크 김은경 팀장은 미분양아파트는 대부분 중소 규모 단지인데다 주변환경까지 열악한 경우가 많아 고를 때는 반드시 단지 규모나 주변환경 등을 세세하게 살펴야 한다 고 말했다.,https://news.naver.com/main/read.nhn?mode=LSD&mid=shm&sid1=260&oid=008&aid=0000831925,90
64483,2007.09.23. 오후 1:00,부동산,아시아경제,추석 後 내집마련 전략2분양물량 봇물,하반기 분양을 준비중인 대기 물량이 넘쳐나고 있어 모처럼 큰 장이 펼쳐질 전망이다. 특히 건설사들이 분양가상한제를 피하기 위해 서둘러 사업승인 받았던 아파트들이 올 하반기 분양시장에 무더기로 쏟아진다. 우선 호재있는 대규모 공공택지 물량부터 차근차근 청약체크 리스트에 올리는 게 좋을 성 싶다. 수도권을 중심으로 유망물량이 집중돼 있기 때문에 본인의 청약가점을 고려해 청약통장을 사용해보자. 내집마련정보사 김영진 사장은 대단지 아파트는 부동산시장 침체기에도 가격 하락폭이 작아 청약 경쟁이 뜨거울 것 이라며 분양일정과 청약가점 등을 미리 따져볼 필요가 있다 고 조언한다. ◇추석 이후 유망 청약단지 리스트 작성해야 서울지역에서는 은평뉴타운과 마포구 하중동에서 유망물량이 집중 공급된다. 경기지역은 파주운정신도시와 용인시 성복동 일대 인천에선 청라지구 아파트 분양이 본격화된다. 용인에서는 GS건설이 성복동에 121∼197㎡ 500가구를 분양하고 흥덕지구에서는 한국종합건설이 115㎡규모 499가구 호반건설은 155㎡짜리 236가구를 각각 내 놓는다. 7년 만에 아파트 대규모 아파트 물량이 쏟아지는 경기도 광주시 일대도 주목할 필요가 있다. 광주시에서는 올해 하반기부터 약 8000가구의 아파트 공급이 이어질 전망으로 오는 10월부터 우림건설이 태전동과 송정동에서 각각 475가구와 372가구를 연이어 내놓을 예정이다. 또 한국종합건설이 115㎡규모 499가구 호반건설은 155㎡짜리 236가구를 각각 내 놓는다. 지방 유망 물량으로는 최근에 투기과열지구에서 풀려 언제든지 전매가 가능한 충청권 분양시장을 살펴볼 필요가 있다. 이 중에서도 오는 10월경 아산신도시에서 분양될 예정인 펜타포트 주상복합아파트의 투자성이 돋보인다. 3개동 최고 66층 793가구 규모 복합단지로 개발될 예정이다. ◇수도권 1000가구 이상 대단지 거 괜찮네 연내 분양예정 물량 중 1000가구 이상 수도권 대단지 아파트는 3만8227가구다. 총 26곳 3만8227가구가 공급되고 이 중 3만4375가구가 일반분양 물량이다. 지역별로는 경기 17곳 2만5945가구 서울 6곳 6859가구 인천 3곳 2971가구 순으로 경기지역이 수도권 전체 공급물량의 72% 이상을 선보인다. 서울에는 은평뉴타운 1지구 분양이 11월에 시작된다. 경기지역에는 신동아건설이 고양시 일산 서구 덕이동에 11월 3094가구가 넘는 메머드급 물량을 선보여 눈길을 모으고 있다. 고양시 식사동에 벽산건설이 132 310㎡ 2736가구의 입주자 모집을 12월 진행하고 김포시 걸포동 249일대 동양건설산업과 성우종합건설이 공동으로 1636가구를 10월 분양한다. 수원에서는 권선동 일대 권선주공 1차 3차를 재건축해 대림산업과 GS건설이 컨소시엄으로 83 228㎡로 1754가구를 건설하고 그 중 416가구를 오는 10월 일반분양한다. 분양열기가 식지 않는 용인지역에도 대단지가 공급된다. 신봉지구 1 2 4블록에 동일토건이 1320가구를 11월쯤 선보인다. 인천에서는 한신공영이 문학경기장 인근에 1509가구 중 481가구를 일반분양한다. 지하 2층 지상20층 총 18개 동이며 65 148㎡로 구성된다. ◇안전한 서울분양 물량 어떨까 미분양에 위험이 없고 전매규제도 약한 서울 분양 시장에 청약자들의 관심이 모아지고 있다. 내집마련정보사 조사결과에 따르면 연내 서울 분양 예정인 지역은 45곳으로 총1만8892 가구 중 8657가구가 일반 공급 예정이다. 동대문구 용두동 용두1구역에 삼성물산은 총1054가구 중 260가구 79 148㎡ 를 9월 중에 공급한다. 성북구 하월곡동 월곡1구역에 대우건설은 총 714가구 중 57가구 7만9135㎡ 를 10월 중에 공급 예정이다. 용산구 용문동 일대에 이수건설은 총195가구 중 64가구 79 148㎡ 를 은평구 불광동 불광3구역에 현대건설은 총1185가구 중 63가구 148 165㎡ 를 10월 공급한다. 은평뉴타운 1지구는 11월 예정으로 2817가구 84 215㎡ 일반분양한다. 분양가 상한제 적용이 제외돼 입주 후 전매가 가능하다. 이외에도 GS건설이 마포구 하중동 일대에 총488가구 중 75가구 145 198㎡ 를 동작구 상도동 일대에 신원종합개발은 총899가구 중 305가구 79 148㎡ 을 11월 중에 공급한다. 대우건설이 용산구 효창동에 총302가구 중 161가구 76 145㎡ 를 동일하이빌이 성북구 하월곡동에 총440가구 중 400가구 152 297㎡ 를 12월 분양한다. 마포구 합정동 일대에 GS건설은 총546가구 155 204㎡ 한진중공업은 동작구 상도동 일대에 총1592 가구 중 324가구 79 152㎡ 를 12월 공급 예정이다.,https://news.naver.com/main/read.nhn?mode=LSD&mid=shm&sid1=260&oid=277&aid=0000002403,90
64484,2007.09.23. 오후 12:17,부동산,머니투데이,서울시 빌딩 공실률 세계 최저수준,머니투데이 정진우 기자 1 4분기보다 0.4%P 하락한 2.4%...뉴욕보다 2%P 낮은 수준 서울에 있는 대형 오피스 빌딩의 공실률이 세계 최저 수준인 것으로 나타났다. 23일 부동산 업계에 따르면 서울 소재 연면적 6600㎡ 2000평 이상 또는 10층 이상의 빌딩 500여개를 대상으로 2 4분기 공실률을 조사한 결과 지난 분기 보다 0.4%p 하락한 2.4%를 기록했다. 공실률 2.4%는 세계적 업무 밀집 도시인 뉴욕 4.4% 보다도 2%p 낮은 수준이다.. 서울시 주요 도심 권역인 종로 세종로 강남 여의도는 모두 1%대의 공실률을 기록하고 있다. 특히 종로 세종로 권역의 경우 지난 분기까지 2.9%의 공실률을 보였지만 이번 분기들어 1.3%p 떨어진 1.6%를 나타냈다. 관내 대형 빌딩들의 공실이 없는 것은 기업들의 체감 경기가 좋아지고 있기 때문인 것으로 풀이된다. 저스트알 이주용 과장은 전반적으로 기업들의 경기가 좋아질 때 사업 영역이 확장되고 거기에 따라 사무실도 늘어나 공실률은 줄어들게 돼 있다 며 1 4분기 보다 서울 도심의 공실률이 낮게 나타난 것은 기업들의 경제적인 사정이 갈수록 좋아지고 있다는 것을 의미한다 고 말했다.,https://news.naver.com/main/read.nhn?mode=LSD&mid=shm&sid1=260&oid=008&aid=0000831918,90
64485,2007.09.23. 오후 12:12,부동산,파이낸셜뉴스,추석연후 직후 강원도 춘천 KCC스위첸 청약접수,추석 연휴를 맞은 9월 마지막 주 분양시장은 휴식에 들어간다. 추석 연후 직후 1개 단지만 청약 접수에 들어간다. 27일엔 KCC건설이 강원도 춘천시 동면에 ‘KCC스위첸’의 청약접수를 받는다. 이날 1순위 접수를 시작으로 28일 2순위 접수로 이어진다. 주택형 109∼158㎡ 총 384가구로 구성된다. 한림대 한림대병원 강원대병원 춘천시청 등과 가깝고 2009년에는 서울 춘천간 동서고속도로와 경춘선 복선전철 개통이 예정돼 있다. 28일엔 경기도 양주시 고읍지구 ‘신도브래뉴’의 당첨자 발표가 있다. 17∼19일까지 청약 접수를 받은 결과 주택형 166㎡와 258㎡를 제외하고는 순위 내에서 모집 가구 수를 채우지 못했다.,https://news.naver.com/main/read.nhn?mode=LSD&mid=shm&sid1=260&oid=014&aid=0000342986,90
64486,2007.09.23. 오전 11:37,부동산,뉴시스,추석 이후 부동산 시장 ‘안정세 지속’,서울 뉴시스 대통령선거가 부동산 시장에 일대 변수로 작용할 것이겠지만 전문가들은 추석 이후 분양시장이 안정권에 머무를 것이라고 보고 있다. 현재 부동산 시장은 소형만 간간히 거래될 뿐 대체적으로 거래는 뜸한 상황이다. 전세는 역세권 중소형이 인기지만 중대형은 거래가 끊긴 상황이다. 가점이 낮은 수요자들이 무주택 기간을 늘이기 위해 기존 전세에 눌러 앉는 경우가 늘면서 품귀현상도 보이고 있다. 닥터아파트가 지난 14일부터 20일까지 서울 인천 경기 등 수도권 아파트값 주간 변동률을 조사한 결과 매매가는 0.00% 전셋값은 0.02%를 기록했다. 서울 매매가 변동률은 0.01%였다. 지역별로는 송파구 0.09% 서초구 0.05% 강남구 0.05% 등이 하락했다. 성동구 0.09% 서대문구 0.06% 노원구 0.06% 금천구 0.06% 등은 상승했다. 분양가 상한제가 시행되면서 분양가가 다소 낮아질 것이라는 기대감이 수요자들이 게걸음을 하고 있다. 게다가 올해 하반기 부동산 시장 최대의 이슈인 대선이 12월로 다가오면서 대선주자들의 양도세 경감이나 재건축 규제 완화와 같은 공약이 이어져 규제 일변도의 부동산 정책 변화를 기대하는 수요도 있다. RE멤버스 고종완 대표는 “중대형을 중심으로 거래가 뜸해 약세가 연말까지 지속될 가능성이 높다”며 “대출규제는 물론 금리까지 올라 돈줄이 막혔고 분양가 상한제로 기존 주택 매수세도 줄어들어 부동산 시장 안정세가 지속될 것으로 보인다”고 밝혔다. 정부는 이 같은 안정세가 내년 초 길게는 수년 이상 이어질 것으로 보고 있다. 건교부 서종대 주거복지본부장은 지난 20일 미분양 주택 대책 관련 브리핑에서 “가을 이사철인 9월 중순까지도 전반적인 안정세를 유지하고 있다. 이러한 현상은 내년 초까지 계속 이어질 전망”이라며 “투기억제장치와 공급확대 기조가 흔들림 없이 유지될 경우 앞으로 수년간 주택시장은 전반적인 하향 안정기조를 유지할 것으로 전망된다”고 말했다. 부동산 대출규제에 금리도 올라 돈줄이 막힌 실수요자들은 그 자리에 주저앉았고 분양가 상한제로 기존 주택 매수세까지 줄어든 부동산 시장 안정세가 지속될 것으로 관측되고 있다. 대선 이후 부동산 정책의 변화를 기대하는 수요도 있어 매물이 자취를 감춘 하반기 부동산 시장은 위축될 가능성이 높다. 하지만 전문가들은 대선 이후 부동산 규제가 일부 완화되어 시장에 활기를 불어넣게 될 것으로 보는 시각이 우세하다.,https://news.naver.com/main/read.nhn?mode=LSD&mid=shm&sid1=260&oid=003&aid=0000575170,90
64487,2007.09.23. 오전 10:53,부동산,뉴시스,부산·대구 미분양↓…투기과열지구 해제 약발,서울 뉴시스 부산과 대구지역 9월 미분양 물량이 8월보다 각각 4.5% 2.7% 줄어든 것으로 나타나 2차례에 걸친 정부의 투기과열지구 해제에 따른 효과를 보는 것 아니냐는 조심스런 관측이 나오고 있다. 9월 전체 미분양은 5만6000여가구였으며 수도권 중에서는 인천만 유일하게 미분양 물량이 감소했다. 닥터아파트가 지난 17일부터 20일까지 전국의 9월 미분양 아파트 주상복합 포함 를 조사한 결과 총 562곳 5만6535가구로 나타났다. 이는 8월의 5만4747가구보다 3.2% 1788가구 증가한 것이다. 수도권은 모두 2789가구였는데 8월의 2362가구보다 18.1% 427가구 증가했다. 특히 경기도 1943가구 의 경우 지난달 1579가구보다 23.0% 364가구 가 늘었다. 서울은 모두 460가구로 8월의 346가구보다 32.9% 114가구 가 증가했다. 반면 인천은 386가구로 최근 활기를 띠고 있는 부동산시장에 힘입어 미분양 역시 8월의 437가구보다 11.6% 51가구 가량 감소했다. 지방 5대 광역시는 8월 1만9699가구에서 1.0% 188가구 증가한 1만9887가구가 미분양 상태였다. 하지만 투기과열지구가 대거 해제된 부산과 대구는 미분양물량이 다소 줄어들었다. 3815가구를 기록한 부산은 8월의 3998가구보다 4.5%인 183가구가 감소했고 대구도 7042가구로 집계되어 지난달의 7242가구보다 2.7%인 200가구가 감소했다. 하지만 투기과열지구가 그대로 유지되고 있는 울산 1673가구 은 지난달의 1256가구보다 33.2%인 417가구가 증가했다. 지방 중소도시는 현재 3만3859가구가 미분양 돼 8월의 3만2686가구보다 3.6%인 1173가구가 늘었다.,https://news.naver.com/main/read.nhn?mode=LSD&mid=shm&sid1=260&oid=003&aid=0000575140,90
