,date,cat,co,headline,text,url,week
65433,2007.10.07. 오후 9:24,부동산,세계일보,서울 버블·비버블 지역간 아파트값 격차 줄어,올 들어 서울 강북권의 강세로 버블 거품 지역과 여타 지역 간 아파트 가격 차이가 크게 줄어들고 있는 것으로 나타났다. 7일 부동산정보업체 부동산써브에 따르면 강남·서초·송파·양천구 등 서울지역 ‘버블 4개구’의 평균 아파트값은 9억4907만원으로 나머지 21개구의 3억9257만원에 비해 5억5650만원 비싼 것으로 조사됐다. 이는 올해 1월 초 5억8498만원 버블지역 9억5622만원 여타 지역 3억7124만원 보다 평균 2848만원이 감소한 것이다. 두 지역 간 아파트값은 지난해 6월 초 2.74배까지 벌어졌으나 연말 버블 논란으로 강남권 집값이 떨어져 올해 1월 초 2.57배로 좁아졌으며 1.11부동산대책 이후에는 강북권 아파트의 강세로 격차가 더욱 줄어들어 10월 초 현재 2.42배 수준으로 떨어졌다. 지역별로는 양천구가 1월 초 가구당 6억8454만원에서 이달 초 6억6155만원으로 2299만원 떨어졌으며 송파구 1304만원 8억6229만원→ 8억4924만원 서초구 528만원 10억1837만원→ 10억1310만원 강동구 759만원 5억4339만원→ 5억3580만원 등도 내리막을 걸었다. 반면 각종 호재를 등에 업은 용산구가 8억60만원에서 8억5899만원으로 5839만원이나 뛰었으며 광진구 4591만원 5억7921만원→ 6억2512만원 동대문구 2995만원 3억1866만원→ 3억4861만원 종로구 2920만원 3억8175만원→ 4억195만원 강북구 2895만원 2억6594만원→ 2억9489만원 서대문구 2583만원 2억9709만원→ 3억2292만원 등도 평균 2000만원 넘게 올랐다. 박세환 기자 greg segye.com 제17대 대선 특별 사이트 hp 17daesun.segye.com ⓒ 세계일보＆세계닷컴 www.segye.com 무단전재 및 재배포 금지 세계닷컴은 한국온라인신문협회 www.kona.or.kr 의 디지털뉴스이용규칙에 따른 저작권을 행사합니다.,https://news.naver.com/main/read.nhn?mode=LSD&mid=shm&sid1=260&oid=022&aid=0000252014,92
65434,2007.10.07. 오후 9:21,부동산,세계일보,토지거래허가구역 지정 올해 3억1000만㎡ 달해,올 들어 전국에서 토지거래허가구역으로 새로 지정된 면적이 3억1000만㎡ 9370만평 에 이르는 것으로 나타났다. 이에 따라 우리나라 전체 면적의 21.83%인 218억800만㎡ 65억9689만평 가 토지거래허가구역으로 묶여 이들 지역에서 땅을 사고팔 때에는 허가를 받아야 한다. 7일 건설교통부에 따르면 각종 개발 호재에 따른 토지 투기를 막기 위한 조치가 잇따르면서 올 들어 토지거래허가구역 신규 지정이 많았다. 9월 말 현재 토지거래허가구역은 모두 218억800만㎡로 지난해 말에 비해 3억1000만㎡가 늘어났다. 토지거래허가구역은 토지의 투기적 거래가 성행하거나 땅값이 급등하는 지역을 대상으로 건교부 장관이 중앙도시계획위원회의 심의를 거쳐 지정한다. 토지거래허가구역으로 묶이면 일정 면적을 초과하는 토지를 거래할 경우에는 관할 시장·군수·구청장의 허가를 받아야 되며 토지를 취득한 뒤에는 일정 기간 허가받은 목적대로 이용해야 한다. 올해 신규 지정이 많은 것은 지방에서 산업단지 조성이 활발한 데다 공공기관의 지방 이전 등으로 토지 시장이 불안해질 가능성이 커진 데 따른 것으로 분석된다. 박세환 기자 greg segye.com 제17대 대선 특별 사이트 hp 17daesun.segye.com ⓒ 세계일보＆세계닷컴 www.segye.com 무단전재 및 재배포 금지 세계닷컴은 한국온라인신문협회 www.kona.or.kr 의 디지털뉴스이용규칙에 따른 저작권을 행사합니다.,https://news.naver.com/main/read.nhn?mode=LSD&mid=shm&sid1=260&oid=022&aid=0000252012,92
65435,2007.10.07. 오후 7:42,부동산,국민일보,서울 뚝섬에 49층 아파트,서울 성수동 서울숲 옆 뚝섬에 49층 높이의 아파트가 들어서게 된다. 서울시는 지난 5일 제25차 건축위원회를 열고 성수동 1가 547의1 일대 2만7716㎡ 에 49층짜리 아파트 건립을 허가하는 내용의 건축계획안을 통과시켰다고 7일 밝혔다. 용적률 319.58%가 적용되는 이곳에는 지하 3층 지상 49층 연면적 13만1343㎡로 아파트 4개 동 546가구가 지어진다. 건축위는 다만 건축주에게 건물 옥상의 지붕 구조를 단순화하는 등 일부 디자인을 간결하게 한 뒤 다시 보고하도록 했다.,https://news.naver.com/main/read.nhn?mode=LSD&mid=shm&sid1=260&oid=005&aid=0000291583,92
65436,2007.10.07. 오후 7:41,부동산,머니투데이,국민·신한銀 용산 국제업무지구 입찰 참여할 듯,머니투데이 임대환 기자 국민은행과 신한은행이 호주의 맥쿼리와 함께 서울 용산역 일대 용산 국제 업무지구 개발사업 입찰에 참가할 계획이다. 용산 국제업무지구 개발사업은 사업비가 20조원에 달할 것으로 추산되는 초대형 프로젝트 개발사업으로 150층짜리 최고층 빌딩이 들어설 예정이다. 국민은행 관계자는 7일 맥쿼리와 함께 컨소시엄을 구성해 입찰에 참여하려 한다 고 확인했다. 신한은행 관계자도 아직 최종 결정을 내리지는 않았지만 컨소시엄 참여를 검토하고 있는 것은 사실 이라고 전했다. 업계에 따르면 이번 입찰에는 16개 컨소시엄이 참여할 것으로 예상되고 있어 그 어느 때보다 치열한 수주경쟁을 펼쳐질 전망이다. 이미 삼성과 현대그룹이 컨소시엄을 구성했고 그 외 다수의 롯데관광개발 등 국내 업체들도 입찰에 참여할 것으로 전해졌다. 여기에 아랍에미리트연합의 자본들도 큰 관심을 보이며 입찰에 참여할 것으로 전해져 국내외 자본간 치열한 수주경쟁이 예상된다.,https://news.naver.com/main/read.nhn?mode=LSD&mid=shm&sid1=260&oid=008&aid=0000835710,92
65437,2007.10.07. 오후 6:41,부동산,매일경제,분양 한성건설 천안 한성 필하우스,한성건설이 충남 천안시 신방 통정 택지지구에 아파트 한성 필하우스 를 분양한다. 10 19층 111 220㎡ 1049가구로 구성된다. 분양가는 3.3㎡당 750만원이다. 아산신도시와 행정타운인 청수지구에 인접해 있다. 중도금 70% 대출 무이자 40% 대출 혜택이 있다. 전매가 가능하다.,https://news.naver.com/main/read.nhn?mode=LSD&mid=shm&sid1=260&oid=009&aid=0000628563,92
65438,2007.10.07. 오후 6:41,부동산,매일경제,분양 두산건설 해운대 수영만 두산위브,두산건설이 부산 해운대 우동 두산위브 포세이돈 재분양에 나선다. 해운대 두산위브 포세이돈은 지하 5층 지상 47층 규모 초고층 아파트로 아파트 255가구와 오피스텔 256실이 다양한 부대시설 게스트룸 연회장 스포츠센터 스크린골프 과 함께 공급됐다. 두산건설 측은 신용불량 가구 일부를 3년 전 분양가 아파트는 3.3㎡당 880만원부터 오피스텔은 670만원부터 로 분양할 예정이다.,https://news.naver.com/main/read.nhn?mode=LSD&mid=shm&sid1=260&oid=009&aid=0000628562,92
65439,2007.10.07. 오후 6:41,부동산,매일경제,분양 한신공영 인천 관교 한신 휴플러스,image0 한신공영은 인천 문학경기장 인근에 짓는 한신 휴플러스 아시아드시티 를 분양한다고 밝혔다. 지하 2층 지상 20층 18개동 66 148㎡ 총 1509가구로 구성됐으며 이 가운데 481가구가 일반에 공급된다. 분양가는 3.3㎡당 680만 850만원 선이다. 회사 관계자는 인근 2㎞ 안에 스포츠 선수촌과 각종 배후시설이 건립될 예정으로 입주민들이 이 시설들을 이용하기 수월할 전망 이라고 말했다.,https://news.naver.com/main/read.nhn?mode=LSD&mid=shm&sid1=260&oid=009&aid=0000628561,92
65440,2007.10.07. 오후 6:41,부동산,매일경제,MK 추천매물 인천 학익동 6층빌딩 55억원,◇인천시 학익동 빌딩＝법원 앞에 위치한 대지 1337㎡ 연면적 6679㎡인 6층 빌딩이 55억원이다. 융자 25억원 보증금 4억6000만원 월 2870만원이다. 2002년 12월에 준공됐다. 032 428 7724 ◇서울 역삼동 수익용 빌딩＝대지 630㎡ 연면적 1950㎡인 7층 건물이 65억원이다. 보증금 3억원 월세 3000만원이다. 사옥이나 임대수익용으로 적합하다. 02 534 8338 ◇서울 자양동 역세권 빌딩＝대지 1300㎡ 연면적 9000㎡ 규모 대로변 빌딩이 143억원이다. 보증금 10억원 월세 9000만원이다. 사옥용으로 명도도 가능하다. 02 514 3690 ◇서울 역삼동 대로변 빌딩＝대지 400㎡ 연면적 970㎡인 5층 건물이 38억원에 급매로 나왔다. 보증금 1억5000만원 월 1200만원이 나온다. 02 566 0351 ◇서울 역삼동 대로변 빌딩＝대지 385㎡ 연면적 1600㎡ 규모 신축 빌딩이 75억원이다. 융자 30억원 보증금 4억2000만원에 월수익 3000만원이 나온다. 02 501 7279 ◇서울 청담동 코너 빌딩＝대지 595㎡ 연면적 2100㎡ 규모 근린상가빌딩이 130억원이다. 7층 규모로 신축할 수 있다. 임대수익용 또는 사옥용으로 적합하다. 02 555 6540 image0 ◇서울 청담동 대로변 빌딩＝대지 496㎡ 연면적 1603㎡인 6층 코너 건물이 107억원이다. 7호선 전철역 출구 앞의 환승역세권이다. 임대 수익용이나 사옥용으로 적합하다. 02 512 8850 ◇서울 신사동 신축 빌딩＝대지 410㎡ 연면적 1600㎡인 7층 빌딩이 57억원이다. 신사역에서 5분 거리다. 보증금 4억원 월 2700만원에 임대 중이다. 먹자상권에 위치해 수익용으로 적합하다. 02 6326 2555 ◇서울 역삼동 빌딩＝대지 209㎡ 연면적 509㎡인 5층 사옥 겸 근생주택이 19억원이다. 융자 10억원 보증금 1억원 월 1300만원이 나온다. 회사 사옥으로도 적합하다. 02 563 3800 image1 ◇서울 역삼동 수익용 빌딩＝강남역에서 1분 거리에 있는 대지 432㎡ 연면적 2840㎡인 11층 신축 빌딩이 200억원이다. 보증금 11억원 월 8400만원이다. 상업지역 내 역세권에 위치한다. 02 527 3322 ◇서울 삼성동 사옥용 빌딩＝테헤란로 이면에 있는 대지 355㎡ 연면적 1221㎡인 7층 신축 건물이 55억원에 급매로 나왔다. 보증금 4억원 월 2500만원에 임대 중이다. 사옥이나 임대용으로 적합하다. 02 585 8113 ◇서울 신림동 수익용 상가빌딩＝서울대 주변 대지 240㎡ 연면적 870㎡인 6층 교육시설 빌딩이 25억원이다. 융자 10억원 보증금 6000만원 월 2200만원이다. 연 수익률은 8%다. 02 876 4455 ◇수원시 곡반정동 상가주택＝삼성전자 인근 대지 225㎡ 연면적 640㎡인 6층 신축 건물이 15억2000만원이다. 융자 3억5000만원 보증금 4억4200만원에 월 610만원이 나온다. 승강기가 설치돼 있다. 031 237 0006 ◇서울 논현동 대로변 빌딩＝환승역세권 상가지역에 있는 대지 240㎡ 연면적 690㎡인 6층 건물이 51억원이다. 보증금 2억원 월 2100만원이 나온다. 주변에 오피스빌딩이 많아 유동인구가 많다. 02 554 1426 ◇용인시 보라동 상가＝보라지구 내 5층 건물 중 1층 80㎡인 코너 점포가 6억원이다. 융자 3억원 보증금 8000만원 월 300만원에 편의점으로 임대됐다. 사거리 횡단보도 앞에 있다. 031 898 1954 ◇서울 청담동 수익용 빌딩＝학동사거리에 있는 대지 645㎡ 연면적 1983㎡인 건물이 120억원이다. 융자 50억원 보증금 5억원 월 5700만원이다. 역세권 예정지 인근에 있다. 02 515 6782 ◇화성시 동탄동 단지 내 상가＝동탄택지지구 내 2300가구 아파트 단지 내 2층 실면적 135㎡인 코너 점포가 7억5000만원이다. 융자 2억3000만원이 있다. 병원 등으로 적합하다. 031 898 9445 ◇경기 여주군 금사면 토지＝도곡리에 있는 관리지역 밭 2161㎡가 3.3㎡당 25만원으로 총 1억6500만원이다. 전원주택지 또는 수익용으로 적합하다.,https://news.naver.com/main/read.nhn?mode=LSD&mid=shm&sid1=260&oid=009&aid=0000628560,92
65441,2007.10.07. 오후 6:41,부동산,매일경제,분양 금호건설 리첸시아 방배,image0 금호건설이 서울 서초구 방배동에 주상복합 리첸시아 방배 를 선보인다. 지하 4층 지상 16층 규모로 142 318㎡ 총 79가구로 구성돼 있다. 평균 분양가는 3.3㎡당 2000만원대 후반으로 예상된다. 23개 타입의 평면 설계로 맞춤형 주거공간을 선보인다. 250㎡ 이상 펜트하우스는 3층 복층형으로 내부 전용 엘리베이터가 설치된다. 2009년 12월 입주 예정이다.,https://news.naver.com/main/read.nhn?mode=LSD&mid=shm&sid1=260&oid=009&aid=0000628559,92
65442,2007.10.07. 오후 6:41,부동산,매일경제,버블 vs 비버블지역 아파트값 격차 줄어,집값 거품 버블 정도에 따라 정부가 지적한 버블지역과 비버블지역 간 아파트 격차가 크게 줄어든 것으로 나타났다. 7일 부동산써브에 따르면 강남ㆍ서초ㆍ송파ㆍ양천구 등 서울지역의 버블 4개구 가구당 평균 아파트값은 9억4907만원으로 나머지 21개구의 3억9257만원에 비해 5억5650만원 비싼 것으로 조사됐다. 그러나 이 같은 가격 차이는 올해 1월 초 5억8498만원 버블지역 9억5622만원 비버블지역 3억7124만원 보다는 가구당 평균 2848만원 감소한 것이다. 두 지역 간 가구당 아파트값은 지난해 6월 초 2.74배까지 벌어졌으나 지난 연말 이후 강남권 집값 약세가 이어지며 올해 1월 초 2.57배로 좁아졌다. 올해 1ㆍ11 대책 이후에는 강북권 아파트의 강세로 격차가 더욱 줄어 10월 초 현재 2.42배 수준으로 떨어졌다.,https://news.naver.com/main/read.nhn?mode=LSD&mid=shm&sid1=260&oid=009&aid=0000628558,92
65443,2007.10.07. 오후 6:41,부동산,매일경제,남한 땅 22% 거래허가구역,image0 올해 들어 지난 9월 말까지 전국에서 토지거래허가구역으로 신규 지정된 땅 면적이 3억1000만㎡ 9370만평 에 달하는 것으로 나타났다. 이에 따라 사고팔 때 허가를 받아야 하는 땅은 남한 전체 면적 중 21.83%인 218억800만㎡ 66억848만평 로 늘어났다. 7일 건설교통부에 따르면 올해 들어 개발호재를 틈타 토지투기가 일어나는 것을 막기 위한 조치가 잇따르면서 토지거래허가구역 신규 지정도 많았다. 지난 9월 말 현재 토지거래허가구역은 218억800만㎡로 지난해 말보다 3억1000만㎡ 증가했다. 올해 들어 새로 토지거래허가구역에 들어간 곳은 지난 8월 지정된 서부이촌동이 대표적이다. 용산국제업무지구와 통합 개발되는 이곳은 5년간 특별관리된다. 총 56만6800㎡인 이 지역에서는 180㎡를 넘는 토지를 거래할 때 이용목적ㆍ자금조달계획서를 제출해 허가를 받아야 한다. 한국수력원자력이 이전할 땅인 경주시 양북면 장항리ㆍ범곡리ㆍ안동리ㆍ입천리ㆍ어일리 일대 3610만㎡도 올해 1월 5년간 거래허가구역으로 지정됐다. 지방산업단지가 조성되는 전북 김제시 만경읍 대동리ㆍ백산면 하정리 일대 2527만㎡와 남해조선산업단지 개발예정지인 경남 남해군 서면 작정리ㆍ남상리ㆍ노구리 일대 2580만㎡도 토지거래허가구역으로 묶였다. 지방산업단지 건설로 땅값이 불안해진 경남 창녕군 대합면 합리 일대 1670만㎡ 제주영어타운이 조성되는 서귀포시 대정읍 일대 1100만㎡도 토지를 사고팔 때 허가받아야 한다. 토지거래허가구역으로 묶이면 일정 면적을 넘는 토지를 거래할 때 관할 시장ㆍ군수ㆍ구청장에게 허가를 받아야 하고 토지를 취득한 후에도 3 5년간 허가받은 목적대로만 사용해야 한다. 이행하지 않으면 취득가액 중 최고 10%를 이행강제금으로 물게 된다. 토지거래허가구역은 건교부 장관이 중앙도시계획위원회 심의를 거쳐 지정하고 있다.,https://news.naver.com/main/read.nhn?mode=LSD&mid=shm&sid1=260&oid=009&aid=0000628557,92
65444,2007.10.07. 오후 6:36,부동산,서울경제,서울 버블非버블지역 아파트 가격차 줄었다,연초보다 2 848만원 감소 개발 호재가 많은 강북권 아파트 가격이 크게 오르면서 서울의 ‘버블’지역과 ‘비버블’지역 간의 아파트 가격 격차가 줄어든 것으로 나타났다. 7일 부동산정보업체 ‘부동산써브’에 따르면 강남과 서초ㆍ송파ㆍ양천구 등 서울 지역 ‘버블 4개구’의 가구당 평균 아파트값은 9억4 907만원으로 나머지 21개구의 아파트 평균 가격 3억9 257만원 보다 5억5 650만원이 비싼 것으로 조사됐다. 여전히 큰 가격 차이지만 올 1월 초의 5억8 498만원 버블지역 9억5 622만원 비버블지역 3억7 124만원 보다는 가구당 평균 2 848만원 감소한 것이다. 지역 간 가구당 아파트 가격은 지난해 6월 초의 2.74배에서 연말 버블 논란으로 강남권 가격이 떨어지면서 올해 1월 초 2.57배로 좁아졌다. 또 정부의 1ㆍ11대책 이후에는 강북권 아파트가 강세로 돌아서면서 10월 초 현재 2.42배 수준으로 떨어졌다. 지역별로는 양천구가 지난 1월 초 가구당 6억8 454만원에서 이달 초 6억6 155만원으로 2 299만원 떨어져 가장 두드러진 하락세를 기록했다. 또 송파구가 1 304만원 8억6 229만원→8억4 924만원 하락한 것을 비롯해 서초구가 528만원 10억1 837만원에서 10억1 310만원 떨어졌고 강동구도 759만원 5억4 339만원→5억3 580만원 내렸다. 다만 강남구는 기존 아파트 가격의 하락에도 불구하고 고가의 새 아파트 입주 영향으로 평균 가격이 445만원 11억6천64만원→11억6천509만원 올랐다. 반면 비버블지역은 국제업무지구 조성 등 각종 호재를 등에 업은 용산구가 8억60만원에서 8억5 899만원으로 5 839만원이나 뛰어 새로운 버블지역으로 등장했다. 광진구 역시 개발 호재와 ‘스타시티’ 등 신규 입주 아파트의 영향으로 5억7 921만원에서 6억2 512만원으로 4 591만원 상승했다. 이와 함께 ▦동대문구 2 995만원 3억1 866만원→3억4 861만원 ▦종로구 2 920만원 3억8 175만원→4억1 095만원 ▦강북구 2 895만원 2억6 594만원→2억9 489만원 ▦서대문구 2 583만원 2억9 709만원→3억2 292만원 등도 가구당 평균 2 000만원 넘게 값이 올랐다.,https://news.naver.com/main/read.nhn?mode=LSD&mid=shm&sid1=260&oid=011&aid=0000201641,92
65445,2007.10.07. 오후 6:32,부동산,한국경제,빚내서 집 산다고 다 비합리적일까,경제학자 밀턴 프리드만 경제학에서는 일반적으로 인간이 합리적이라고 가정한다. 하지만 인간이 정말 합리적인지에 대해서는 많은 의문이 있어 왔고 앞으로도 그 의문은 계속될 것이다. 실제로 우리 주변을 돌아보면 합리적인 사람보다는 비합리적인 사람을 찾는 것이 훨씬 쉬워 보인다. 멀리 볼 것도 없이 우리 스스로도 바보 같은 일을 자주 하고 또 후회하기를 반복하지 않는가. 그래서 인간은 합리적이라고 가정하고 있는 경제학에 대해 너무 이론적이라든지 혹은 너무 비현실적이라는 비판을 하기도 한다. 이러한 비판에 대한 대답 중 하나는 가정이 비록 비현실적이더라도 유용하기만 하면 된다는 것이다. 얼마 전 작고한 경제학자 밀턴 프리드만 Milton Friedman 은 경제학에서 가정 자체가 항상 현실적일 필요는 없으며 비현실적인 가정이라 하더라도 그 가정을 바탕으로 한 이론이 현실을 잘 설명하기만 하면 된다는 주장을 폈다. 최근의 경제학 조류를 보면 여기에서 한 발 더 나아가 인간이 합리적이라는 가정을 좀 더 진지하게 생각하고 있는 것으로 보인다. 지난 30 40년간 경제학을 근본적으로 뒤흔든 합리적 기대 가설 은 각 경제 주체들이 주어진 정보를 최대한 활용해 즉 합리적으로 의사 결정을 내린다고 주장한다. 정보가 부족하다거나 주변 상황이 왜곡된 경우 사후적으로 잘못된 선택을 할 수 있을지 모르나 사전적으로는 누구나 자신이 처한 상황하에서 나름대로 최선의 선택을 하게 된다는 의미이다. 오늘 로또에 당첨되더라도 어제 한 저축이 헛된 것은 아니며 자신의 예술적 재능을 자각하지 못했다면 수학 공부를 열심히 하는 것이 당연하며 집값이 오를 것이라고 믿으면 집값이 높더라도 집을 사는 것이 올바른 결정이다. 이렇게 보면 인간이 합리적이라는 가정은 아주 현실적인 것처럼 보인다.,https://news.naver.com/main/read.nhn?mode=LSD&mid=shm&sid1=260&oid=015&aid=0000999773,92
65446,2007.10.07. 오후 6:23,부동산,매일경제,분양 평택 늘푸른오스카빌,image0 늘푸른오스카빌이 경기도 평택시 송화지구 내 아파트 오스카빌 을 분양한다. 189 328㎡ 175가구로 구성된다. 분양가는 3.3㎡당 790만 920만원이다. 462대 주차가 가능하다. 한옥의 미를 살린 인테리어가 특징이다. 최고층은 다락방이 딸려 있다. 인근에 미군주둔지인 K 2기지가 있다.,https://news.naver.com/main/read.nhn?mode=LSD&mid=shm&sid1=260&oid=009&aid=0000628549,92
65447,2007.10.07. 오후 6:23,부동산,매일경제,분양 동탄신도시 상가 시네스타,image0 화성시 동탄신도시 중심상업지구에서 복합상가 동탄 시네스타 가 분양 중이다. 지하5층 지상13층 규모로 70여 개 점포로 구성돼 있다. 분양가는 1층 기준 3.3㎡당 3500만 4300만원이다. 지상 1 3층 프랜차이즈 입점 지상7 11층 CGV 등이 계획돼 있다.,https://news.naver.com/main/read.nhn?mode=LSD&mid=shm&sid1=260&oid=009&aid=0000628548,92
65448,2007.10.07. 오후 6:23,부동산,매일경제,분양 잠실 트리지움 단지내상가,image0 서울특별시 송파구 잠실동 트리지움 단지 내 상가를 분양 중이다. 지하1층 지상5층 1개동으로 총점포 수는 209개다. 분양가는 3.3㎡당 3000만 7000만원 선이다. 지하철2호선 신천역과 연결된다. 1만여 가구 잠실재건축단지를 배후로 두고 있다.,https://news.naver.com/main/read.nhn?mode=LSD&mid=shm&sid1=260&oid=009&aid=0000628547,92
65449,2007.10.07. 오후 6:23,부동산,매일경제,분양 인천 부개동 푸르지오,image0 대우 푸르지오 아파트는 지상 20 26층 12개동 규모로 82 194㎡ 1054가구로 구성된다. 분양가는 3.3㎡당 1100만원 선이다. 10월 한 달 간 158 194㎡ 중 10층 이하는 계약금 10% 중도금 10% 11층 이상은 계약금 10% 중도금 30%로 중도금이자 후불제가 적용된다.,https://news.naver.com/main/read.nhn?mode=LSD&mid=shm&sid1=260&oid=009&aid=0000628546,92
65450,2007.10.07. 오후 6:23,부동산,매일경제,서울시 성냥갑아파트 무더기 퇴짜,새로운 디자인 아이디어가 없으면 서울에서 아파트를 짓기가 점점 어려워진다. 서울시는 지난 5일 열린 제25차 건축위원회에서 심의안건 5건 중 4건에 대해 디자인 수준 미달 을 이유로 재심 결정을 내렸다. 이날 재심 결정을 받은 건축계획안은 성내동 미주아파트 재건축 금호 제13구역 주택재개발 SH공사 구로구 천왕동 3ㆍ5단지 공동주택 건설사업 등이다. 민간 재개발ㆍ재건축 아파트뿐만 아니라 서울시 산하기관인 SH공사 건축계획안도 디자인 미비로 심의를 통과하지 못할 정도로 건축심의가 까다로워지고 있는 것이다. 이 결정은 최근 새로 선임된 서울시 건축위원들이 내린 것으로 주택업계는 향후 움직임을 주목하면서 설계 능력 제고에 비상한 관심을 보이고 있다. 서울시 관계자는 이번에 재심 결정이 내려진 4개 사업안에 대해 건축위원들은 디자인에 관심이 없다 고 지적했다 면서 앞으로 성냥갑 아파트 건축은 허용하지 않겠다는 견해를 밝혔다 고 설명했다. 이 관계자는 디자인 심의가 한층 더 강화됨에 따라 앞으로 새로운 디자인만 건축위원회를 통과할 수 있을 것 이라고 설명했다. 이번에 건축심의를 통과한 성수동 서울숲 아파트 도 디자인 일부 개선을 조건으로 건축허가를 받았다. 서울숲 아파트 신축공사는 성동구 성수동1가 547 1 일대 2만7716㎡에 49층 규모 아파트 546가구를 짓는 사업이다. 서울시는 지난 8월 29일 성냥갑처럼 획일적인 아파트와 고층 건물 디자인을 개선하기 위해 건축심의 개선대책을 마련하고 내년 3월부터 본격 시행한다고 했다. 건축심의 개선대책은 △아파트 동별 디자인 차별화 △아파트 동별 층수 다양화 △탑상형 아파트 디자인 차별화 △상층부와 저층부 디자인 차별화 △하천변 아파트 디자인 차별화 등 5가지 핵심 대책으로 이뤄졌다.,https://news.naver.com/main/read.nhn?mode=LSD&mid=shm&sid1=260&oid=009&aid=0000628545,92
