,date,cat,co,headline,text,url,week
98005,2008.08.06. 오후 6:06,부동산,파이낸셜뉴스,경기 양평 전원주택 11가구,전원주택 전문회사인 ㈜드림컨트리가 경기 양평군 전수리 남한강 인근에 전원주택 뷰티풀하우스 11가구 사진 를 분양한다. 뷰티풀하우스는 가구당 대지면적 533∼992㎡에 건축면적 135∼185㎡ 19가구로 구성됐다. 분양가는 5억5000만∼8억7000만원이다. 이 중 8가구는 1차로 입주가 완료된 상태며 이번 분양분이다. 뷰티풀하우스는 콘크리트 조적식으로 외부는 대리석과 치장벽돌로 마감돼 외관이 우아하다. 실내는 거실과 주방은 대리석으로 치장해 고급스런 느낌을 주며 안방에는 고급자재의 드레스룸과 붙박이장이 설치된다. 욕실은 3개로 구성됐다. 서울에서 30분 거리에 위치해 출퇴근이 가능하며 서울∼양평∼용문간 복선전철이 내년 개통되면 대중교통도 편리해질 것이라고 회사측은 설명했다. 2010년 개통되는 마석∼양평∼여주∼김천 중부내륙고속도 양평구간이 준공돼 향후 교통여건이 더욱 개선된다.,https://news.naver.com/main/read.nhn?mode=LSD&mid=shm&sid1=260&oid=014&aid=0002008773,135
98006,2008.08.06. 오후 6:03,부동산,파이낸셜뉴스,포스코건설 쿠웨이트서 중동최대 종합병원 수주,포스코건설은 쿠웨이트에서 초대형 종합병원 조감도 건설공사를 수주했다고 6일 밝혔다. 현지 대형 종합건설사인 SHBC와 공동으로 수주한 이 공사는 쿠웨이트 정부가 발주한 것으로 수도인 쿠웨이트 시티 남수라에 지하 3층 지상 13층에 연면적 66만㎡로 중동지역에서 최대 규모로 건설된다. 1150실의 병상을 갖추게 된다. 이 병원 건설공사는 총 사업비가 12억달러에 달하며 포스코건설의 지분은 1억3500만달러다. 올해 말 착공해 2011년 7월 준공예정이다. 포스코건설 측은 “이번 프로젝트는 중국 이집트 터키 등 제3국의 대형 건설사들과 치열한 경쟁 속에 수주에 성공했다”며 “이 사업 수주를 계기로 중동지역 건설공사 수주가 한층 가속화될”이라고 말했다. 한편 SHBC는 1946년에 설립된 건설사로 250여개의 상업 및 공업용 건물 건설실적을 보유하고 있다.,https://news.naver.com/main/read.nhn?mode=LSD&mid=shm&sid1=260&oid=014&aid=0002008772,135
98007,2008.08.06. 오후 6:03,부동산,파이낸셜뉴스,서울 분양가상한제 민간아파트 ‘0’,올해 들어 전국의 민간택지지구 내 일반분양 물량 중 상한제 적용 아파트는 4%에도 못미치는 것으로 나타났다. 특히 서울지역은 분양가 상한제를 적용한 민간아파트가 단 한 채도 없는 것으로 조사됐다. 6일 건설업계와 스피드뱅크에 따르면 올해 들어 지난달 말까지 전국 민간택지에서 공급된 일반 분양물량은 324개 단지 9만7477가구로 분양가 상한제가 적용된 곳은 17개 단지 3726가구 3.8% 에 불과했다. 지열별로는 서울은 총 51개 단지 5415가구가 일반분양됐지만 이 중 상한제가 적용된 아파트는 한 가구도 없다. 수도권은 135개 단지 4만1127가구 중 4개 단지 1607가구만 상한제가 적용됐다. 수도권에 비해 지방에서는 분양가 상한제 아파트가 상대적으로 많았지만 전체 138개 단지 5만935가구 중 13개 단지 2119가구에 그쳤다. 스피드뱅크 김은경 팀장은 “상한제 아파트가 적은 이유는 분양물량이 많은 중대형 업체에서 분양을 꺼렸기 때문”이라고 말했다. 실제로 GS건설은 지난달 말까지 14개 단지 7729가구를 분양했지만 이 중 상한제 아파트는 한 채도 없다. 또 올해 분양을 많이 한 현대산업개발 7개단지 4509가구 대림산업 8개단지 4479가구 현대건설 8개단지 4004가구 신동아건설 8개단지 4004가구 벽산건설 7개단지 2977가구 대우자동차판매건설 5개단지 2775가구 두산건설 4개단지 2977가구 등도 상한제 아파트 공급이 없었다. 이에 비해 중소건설업체들을 중심으로 소형 아파트에서만 상한제를 적용해 선보였다. 양우건설의 강원 강릉시 노암동 양우내안애 182가구 를 비롯 전북 전주시 인후동 송정써미트 156가구 울산시 천곡동 웰빙 109가구 울주군 범서읍 휴스콘문수산수필아파트 205가구 등이다.,https://news.naver.com/main/read.nhn?mode=LSD&mid=shm&sid1=260&oid=014&aid=0002008771,135
98008,2008.08.06. 오후 6:03,부동산,파이낸셜뉴스,부동산정책 효과 검증 시스템 개발 추진,부동산시장에 대한 국지적이고 단기적인 분석뿐 아니라 금융이나 세제 등 부동산정책 변화나 도입에 따른 효과까지 미리 검증할 수 있는 시스템이 오는 2010년까지 개발된다. 국토연구원과 한국감정원은 부동산 시장의 선진화와 가격 안정을 위해 ‘부동산 시장 상황관리시스템’을 공동개발키로 하고 양해각서를 체결했다고 6일 밝혔다. 이 시스템은 주택 및 토지 상업용 부동산의 가격과 시장 행태 주요 부동산 정책의 성과 등을 데이터베이스로 구축해 향후 부동산 시장 상황을 파악하고 전망하는 데 사용된다. 두 기관은 시스템 개발이 완료되면 부동산 시장을 거시적 시각뿐 아니라 국지적 변동 심리와 정부 정책요인 등을 감안한 미시적 시각에서도 분석이 가능해져 부동산 시장의 이상징후를 조기에 포착할 수 있을 것으로 기대하고 있다. 연구원과 감정원은 11월까지 1차 시범사업 결과를 발표한 뒤 2009년에는 전국단위로 적용범위를 확대할 계획이다. 한국감정원 관계자는 “2010년 상반기에는 모든 시스템이 완성될 예정”이라며 “이 시스템이 도입되면 부동산 시장에 대한 시공간 분석이 가능해져 부동산 시장의 이상 징후 발생을 조기에 포착할 수 있게 된다”고 말했다. 이 관계자는 “부동산 시장을 보다 면밀히 진단하고 시장의 반응을 가상실험할 수 있는 시스템이 갖춰지기 때문에 부동산 정책 도입의 성과를 높일 수 있을 것으로 기대하고 있다”고 덧붙였다.,https://news.naver.com/main/read.nhn?mode=LSD&mid=shm&sid1=260&oid=014&aid=0002008770,135
98009,2008.08.06. 오후 6:00,부동산,파이낸셜뉴스,자이갤러리 ‘매직쇼’,GS건설은 최근 부산 연산동의 주택문화관 ‘자이갤러리’에서 여름방학을 맞아 ‘온 가족이 즐기는 사이언스 매직쇼’를 개최，큰 호응을 얻었다고 6일 밝혔다. 연산동 자이갤러리에서 열린 사이언스 매직쇼에 초청된 어머니와 함께 온 어린이들이 즐거운 시간을 보내고 있다.,https://news.naver.com/main/read.nhn?mode=LSD&mid=shm&sid1=260&oid=014&aid=0002008769,135
98010,2008.08.06. 오후 6:00,부동산,파이낸셜뉴스,정부 “전국 10개 혁신도시 연말까지  보상 완료”,정부는 수도권 공공기관이 이전할 전국 10곳의 혁신도시 개발예정지에 대한 토지보상을 연내에 마무할 방침이라고 6일 밝혔다. 국토해양부 관계자는 “현재 혁신도시 개발예정지의 토지보상률이 84.6%에 이르고 있으며 올해 말까지는 토지보상을 마무리할 예정”이라고 말했다. 이 관계자는 또 “이 달 중 각 지자체에 기업유치방안 등 혁신도시 보완·발전방안에 대한 가이드라인을 제시할 것”이라고 덧붙였다. 혁신도시는 현재 부산혁신도시의 경우 4개 지구 중 2개지구 문현·대연 를 제외하고 개발·실시계획 등의 관련 행정절차가 마무리된 상태다. 정부는 앞서 지난해 대구 등 9개 혁신도시에 대한 개발·실시계획을 승인했다. 지난 3월에는 전북 혁신도시 실시계획을 6월에는 부산 혁신도시 문현·대연지구의 개발계획을 승인한 바 있다. 또 10개 혁신도시 모두 시범단지에 대한 시공사를 선정해 부지조성공사에 착수했으며 대부분의 혁신도시에서 8∼9월 중 제2·3공구에 대한 공사를 발주할 예정이다. 국토부는 혁신도시 발전을 위해 미래형 첨단도시 건설 특목고·자율형사립고 설치 등으로 인구 유입을 촉진하고 산·학·연 클러스트 용지 일부를 임대산업용지 등으로 조성해 장기임대하는 방안도 추진할 계획이다.,https://news.naver.com/main/read.nhn?mode=LSD&mid=shm&sid1=260&oid=014&aid=0002008767,135
98011,2008.08.06. 오후 6:00,부동산,파이낸셜뉴스,토공 79만8000㎡ 공급 평택 골프장 등 15필지,한국토지공사는 경기 평택시 청북지구내 골프장 부지와 강원 양양물치·강선지구 공동주택용지 충북 오송생명과학단지 산업시설용지 등 15필지 79만8000㎡를 오는 21일부터 공급한다고 6일 밝혔다. 평택 청북지구에서는 골프장 부지를 포함해 체육시설용지 4필지와 블록형 단독택지 1필지 등 5개 필지 59만4000㎡가 경쟁입찰방식으로 공급된다. 골프장 2곳을 포함해 4곳의 체육시설을 지을 수 있는 용지 4필지 를 낙찰 받은 사람에게 골프빌리지 582가구를 지을 수 있는 블록형 단독주택용지까지 일괄 공급된다. 오는 21일 입찰 신청을 받아 22일 낙찰자를 결정한다. 골프장 부지는 국내에서는 처음으로 공공택지 안에 조성된다. 2만4000여명의 평택청북택지지구 주민들이 쉽게 이용할 수 있어 인기를 끌 것으로 토공은 예상하고 있다. 오송생명과학단지 산업시설용지는 총 8필지 8만2000㎡이다. 오는 25∼27일 입주심사 신청을 받는다. 양양물치·강선지구에서 공급되는 땅은 공동주택용지 2필지 2만2000㎡다. 각각 60㎡ 이하 국민임대 30년 를 지을 수 있는 땅과 60∼85㎡ 분양주택을 지을 수 있는 땅이다. 공급가격은 3.3㎡당 각각 69만1000원 조성원가의 60% 103만7000원 조성원가의 90% 이다. 21일 분양신청을 받아 22일 추첨을 통해 당첨자를 결정한다. 자세한 사항은 토공 토지청약시스템 buy.lplus.or.kr 에서 확인할 수 있다.,https://news.naver.com/main/read.nhn?mode=LSD&mid=shm&sid1=260&oid=014&aid=0002008765,135
98012,2008.08.06. 오후 6:00,부동산,파이낸셜뉴스,위례·동탄2신도시에 ‘디자인’ 접목,서울송파구와 경기 성남 및 하남시 일원에 조성되는 위례 송파 신도시와 경기 화성 동탄2신도시가 디자인 시범도시로 건설된다. 디자인도시는 민간 디자인 전문가와 해당 지자체 공무원이 참여 도시별 특성을 반영해 디자인 가이드라인을 마련하고 이 가이드라인에 따라 건물의 간판에서부터 공공시설의 안내 표지판 도로와 건물의 형태 및 색깔 등을 설계하도록 하는 방식이다. 국토해양부는 도시의 미관을 향상시키고 도시별로 특화된 문화적 요소를 결합하기 위해 앞으로 짓는 모든 신도시에 총괄디자인 체제를 도입키로 하고 위례신도시와 화성동탄2신도시에 이를 시범 적용한다고 6일 밝혔다. 총괄디자인 체제는 일본의 마쿠하리와 독일의 포츠다머 플랏츠 등 대부분 신도시에서 적용되고 있지만 국내에 도입이 시도되는 것은 이번이 처음이다. 국토부 관계자는 “경기 성남 분당과 안양 평촌 등 1기 신도시는 도시별로 개발시기와 사업주체가 달라 디자인의 통일성이 떨어지고 전체 도시구조와 공공건축물이 조화가 되지 않는 등의 문제가 있었다”며 “이를 해소하기 위해 민간 전문가를 중심으로 지자체 공무원까지 참여시켜 개발계획 수립에서 설계 시공 때까지 디자인을 일체화하는 총괄디자인 체제를 도입하게 됐다”고 설명했다. 국토부는 이를 위해 현재 도시계획 단계에서 자문과 심의 수준에 머무르고 있는 민간 전문가 일명 ‘MP Master Planer ’의 역할을 확대할 계획이다. 또 다양한 의견을 도시 설계에 반영하기 위해 현재 건축 도시계획 환경 교통분야 전문가로 구성된 MP를 경제 사회 환경 전문가 등으로 다변화할 예정이다. 아울러 지자체간 협의체를 구성해 신도시의 구상에서부터 완공 때까지 디자인을 협의하고 디자인 리뷰 시스템을 구축해 도시 디자인을 지속적으로 점검해 나갈 계획이다. 특히 앞으로 짓는 모든 신도시별로 디자인 컨셉트를 담은 디자인 가이드라인을 만들어 도시 건설 때 적용할 예정이다. 국토부 관계자는 “신도시별 디자인 가이드라인이 마련되면 개별 가이드라인에 따라 간판에서부터 교통 표지판 건축물의 모양까지 통일성이 유지되도록 규제가 된다”고 설명했다. 국토부는 현재 총괄디자인 체계 도입을 위한 연구 용역을 진행 중이며 오는 9월 중 용역결과를 보고받을 예정이다.,https://news.naver.com/main/read.nhn?mode=LSD&mid=shm&sid1=260&oid=014&aid=0002008763,135
98013,2008.08.06. 오후 5:57,부동산,파이낸셜뉴스,양도세 면제되는 입주 3년차 주부 “나 떨고 있니？”,경기 용인시 동백지구의 W아파트 99㎡에 사는 오모씨 36 는 요즘 아파트값 때문에 불안하다. 집값이 한창 많이 올랐을 때인 2006년 6월에 이 아파트를 3억8000만원에 매입했지만 지금은 시세가 3억2000만원으로 6000만원이나 떨어졌다. 무엇보다 이 아파트는 곧 입주가 시작된 지 3년이 된다. 양도소득세 면제기간이 지나면 매물이 쏟아질 것으로 예상돼 집값이 더 떨어질 것 같아 고민이 이만저만이 아니다. 6일 부동산업계에 따르면 입주한 지 3년째 되는 아파트 보유자들이 좌불안석이다. 시장 상황이 좋지 않은 데다 양도소득세 면제기간 서울 및 5대 신도시 3년 보유·2년 거주 이 도래하면서 대량으로 매물이 쏟아질 가능성이 크기 때문이다. 입주 3년째 아파트 보유자 불안 부동산정보업체 부동산써브에 따르면 올해 하반기 입주한 지 3년째가 되는 아파트는 전국적으로 350개 단지 15만7000가구에 이른다. 수도권에만 213개 단지 8만5500가구가 입주한 지 3년을 넘긴다. 이들 아파트의 분양권을 가진 사람 중에는 입주 후인 2005∼2006년 집값이 크게 올라 엄청난 시세차익을 챙기는 사람도 많았다. 수도권에서는 당시 분양가 대비 거의 두 배나 되는 값을 치르고 새로 입주한 사람도 꽤 됐다. 하지만 최근 집값이 계속 하락하면서 이들이 불안에 떨고 있다. 집값은 떨어지는데 양도세 면제기간이 끝나는 매물이 급증할 전망이어서다. 닥터아파트 이민정 선임애널리스트는 “최근 입주 후 3년 된 아파트 보유자 중에서 매물 급증으로 집값이 더 떨어질까 불안해하는 사람이 많다”면서 “실수요가 탄탄한 중소형에 비해 상대적으로 중대형 급매물이 급증할 가능성이 크다”고 내다봤다. 유앤알컨설팅 박상언 사장은 “최근 인천 송도 경기 파주 등의 아파트 거주자 중에서 양도세 면제기간이 지났기 때문에 갈아타고 싶다며 상담하는 사람이 부쩍 늘었다”면서 “집값이 하락세이므로 서둘러 팔고 주택형을 줄이더라도 서울의 알짜 지역에 들어가려는 사람이 늘고 있다”고 말했다. 실수요자라면 적극 노려볼 만 전문가들은 갈아타기를 원하는 실수요자라면 입주 후 3년 된 아파트를 중심으로 급매물을 찾는 것도 좋은 방법이라고 권한다. 새 아파트면서 급매물이 많이 나올 가능성이 크기 때문이다. 다만 기존에 살던 집을 먼저 처분하는 것이 우선이다. 서둘러 집을 샀다가 기존 집이 팔리지 않아 자금마련 등에서 낭패를 보는 경우가 최근 늘고 있기 때문이다. 내집마련정보사 김영진 사장은 “올해 하반기 집값이 더 떨어질 가능성이 있다고 해도 큰 폭으로 하락하긴 어려울 것”이라면서 “아직 새 아파트인 입주한 지 3년 된 아파트 급매물을 노리는 게 지금 할 수 있는 최선의 재테크가 될 것”이라고 말했다. 한편 닥터아파트는 입주한 지 3년 된 아파트 중 유망한 곳으로는 서울 강동구 암사동 현대홈타운 관악구 신림동 신림 푸르지오 동작구 상도동 삼성래미안3차 마포구 공덕동 래미안공덕3차 송파구 문정동 래미안문정 영등포구 영등포동 8가 당산푸르지오 등을 꼽았다.,https://news.naver.com/main/read.nhn?mode=LSD&mid=shm&sid1=260&oid=014&aid=0002008761,135
98014,2008.08.06. 오후 5:54,부동산,한국경제TV,혁신도시 청사진은 없다,앵커 이처럼 정부는 혁신도시를 차질 없이 추진하고 있다지만 사실상 혁신도시 개발 청사진은 아직 없습니다. 해당 지방자치단체들에게 지역특성에 맞는 개발 그림을 요구하고 있어 지자체들의 부담만 가중됐단 평가입니다. 이주은 기자입니다. 기자 지역 스스로 보완발전방안 마련해 지역 성장거점 도시로 혁신도시를 육성하겠다. 새 정부가 내놓은 혁신도시 개발 방침은 이 뿐입니다. 10개 혁신도시 모두 부지조성공사를 시작했지만 구체적인 개발안은 전무합니다. 전화인터뷰 국토부 관계자 “해당 지자체 별로 특성이나 여건이 다르기 때문에 여건이나 특성에 맞게끔 발전방안을 수립해달라…지자체 중심으로..” 산업기능을 대폭 확대한다지만 이마저도 담보된 것은 없습니다. 산학연 클러스터 용지 일부를 임대산업용지로 조성해 조성원가를 낮출 계획이지만 지역 수요에 따라 가변적으로 조정할 수 밖에 없다고 설명합니다. 혁신도시 추진 지자체들은 새정부가 사실상 지자체에게 부담을 떠넘긴 것 뿐이라고 불만을 토로했습니다. 녹취 김천시 혁신도시지원단 관계자 “산학연 클러스터 연관 기업을 어떻게 채울 것인가가 고민이죠. 과연 어떤 인센티브를 줘서 수도권에서 끌고 올 수 있을 지… 유치하고 하는 건 지방 몫인데..수도권에서 과연 오겠느냐..” 또 산업단지를 강화한다해도 기업들을 유치하긴 쉽지 않을 것으로 우려했습니다. 녹취 충북 진천시 관계자 “산업기능이 추가 된다고 해서 지금 진천 지역에는 산업단지가 많이 조성이 되고 있거든요. 거기다가 특별한 컨셉을 가지고 산업기능을 갖는 다고 해서 기업들이 반가워하진 않을 것 같아 고민입니다.” 몇 번의 혼선끝에 새정부가 지역민심을 의식해 혁신도시 지속 추진방침을 밝혔습니다. 하지만 아직까지도 밑그림은 물론 공공기관 이전 등 남은 문제가 많아 차질없는 추진이 쉽진 않아보입니다. WOW TV NEWS 이주은입니다.,https://news.naver.com/main/read.nhn?mode=LSD&mid=shm&sid1=260&oid=215&aid=0000007647,135
98015,2008.08.06. 오후 5:53,부동산,경향신문,신도시 개발 주변 집값에 되레 ‘악재’,SUB TITLE START ㆍ시세보다 싼 ‘새 집’ … 물량도 풍부 ㆍ판교·위례 인근 거래 끊기고 하락세 SUB TITLE END 주변지역 땅값과 집값을 오르게 하는 신도시 개발 ‘후광효과’가 사라지고 있다. 신도시 계획 발표가 나오면 주변지역 집값이 오히려 떨어지거나 미분양이 느는 등 ‘악재’로 작용하는 지역도 생겨났다. 입주를 앞둔 판교신도시 주변인 분당 용인 평촌지역 집값이 떨어지고 있으며 위례 송파 신도시와 광교신도시 주변도 ‘신도시 개발 호재’를 찾기 힘든 실정이다. 6일 부동산업계에 따르면 서울 송파구 거여·마천·문정동 일대와 하남시 학암동 성남시 복정동 등 최근 개발 계획이 확정 발표된 위례신도시 주변지역은 거래가 거의 이뤄지지 않고 있다. 송파구 문정동 아파트 매매가는 이달 현재 3.3㎡당 2187만원으로 4월 2343만원 이후 하락세가 계속되고 있다. 거여동과 마천동 일대 아파트 호가도 지난 1월과 비교해 큰 변동이 없다. 김포·동탄신도시 발표 때처럼 곧바로 땅값이 치솟고 아파트 호가가 상승하는 분위기는 찾아볼 수 없다는 게 이 지역중개업소 관계자들의 전언이다. 닥터아파트 이영호 리서치센터장은 “송파구 거여동 등 인접지역의 부동산 매수문의가 늘거나 호가가 오르는 현상은 나타나지 않고 있다”면서 “신도시 분양가가 3.3㎡당 1300만원으로 예상되나 주변 지역 시세는 이를 넘어서기 때문으로 보인다”고 말했다. 다음달 첫 분양에 나서는 광교신도시 주변에는 미분양 아파트가 속출하고 있다. 이는 2006년 건설교통부가 인천 검단지역을 신도시로 지정하자 잘 알려지지 않은 중소 건설업체의 소규모 단지 청약에 청약자들이 밤샘 줄서기를 하던 ‘신도시발 發 청약광풍’과는 사뭇 다른 모습이다. 현재 광교신도시가 들어서는 수원지역에는 지난해 말부터 27개 단지가 분양에 나섰지만 계약률은 극히 낮다. 지난 6월 분양된 율전동의 한 아파트 182가구 모집 는 3순위까지 청약자가 4명뿐이었다. 이 아파트는 얼마 전부터 계약금 5% 중도금 40% 이자후불제 조건을 내걸었지만 상황을 반전시키지 못하고 있다. 1월 망포동에서 분양한 600여가구의 아파트 단지도 절반가량이 주인을 찾지 못하고 있다. 광교신도시 후광효과를 내세우며 현대건설 GS건설 동일하이빌 등 국내 대표급 건설사들이 분양에 나선 용인 성복·신봉지구 역시 계약률이 오르지 않아 고민 중이다. 판교신도시 후광지역으로 각광받던 분당 용인 평촌의 집값 하향세도 계속되고 있다. 분당과 용인지역 아파트 가격은 올 1월보다 평균 2.96% 3.05%씩 빠졌다. 분당 서현동 시범한양 198㎡형의 올 초 시세는 12억5000만원이었지만 이달 현재 11억원으로 1억5000만원이 하락했다. 정자동 파크뷰 178㎡의 매매가도 연초보다 2억 2억5000만원 떨어진 17억원 안팎에 머물고 있다. 스피드뱅크 박원갑 부사장은 “분양가상한제의 영향으로 신도시 아파트 가격이 주변 아파트나 집값보다 내려가 굳이 비싼 아파트를 살 필요가 없기 때문”이라며 “이 같은 현상은 당분간 지속될 것으로 보인다”고 말했다. 박재현기자 parkjh kyunghyang.com 대한민국 희망언론 경향신문 구독신청 hp smile.khan.co.kr ⓒ 경향신문 경향닷컴 www.khan.co.kr 무단전재 및 재배포 금지 〈경향닷컴은 한국온라인신문협회 www.kona.or.kr 의 디지털뉴스이용규칙에 따른 저작권을 행사합니다.,https://news.naver.com/main/read.nhn?mode=LSD&mid=shm&sid1=260&oid=032&aid=0001970075,135
