,date,cat,co,headline,text,url,week
58667,2007.07.11. 오후 5:02,부동산,매일경제,6억이하 아파트 눈길가네,image0 올 9월 분양가 상한제와 청약가점제 전면 시행을 앞두고 건설사들과 청약 수요자들이 동분서주하고 있다. 건설사들은 밀린 물량을 쏟아내고 있고 가점제에서 불리한 수요자들은 알짜 물량 찾기에 나서고 있다. 대출 규제 탓에 수요자들의 자금 계획이 쉽지 않기 때문에 수도권 6억원 이하 아파트에 관심이 쏠리고 있다. 특히 이달부터 수도권 6억원 이하 분양 아파트 중도금 대출 때 적용될 예정이던 총부채상환비율 DTI 규제가 계속 미뤄지고 있어 9월 이전에 중소형 아파트 청약에 나서는 게 여러 모로 낫다는 분석이다. 함영진 부동산써브 실장은 6억원 이하 주택은 DTI 추가 규제가 없고 주택담보인정비율 LTV 도 종전대로 집값의 60%가 적용된다 면서 자금사정을 고려하면서도 투자가치와 주거가치를 동시에 만족시킬 수 있는 6억원 이하 분양 아파트는 눈여겨볼 만하다 고 말했다. 대출 규제 적용을 받는 수도권 투기지역과 투기과열지구에서 9월 이전 분양하는 6억원 이하 유망 물량으로는 인천 소래논현지구의 한화꿈에그린 인천 에코메트로 용인 동천지구의 동천래미안 송도국제도시의 송도 GS자이 하버뷰 남양주 진접지구의 신안과 반도건설 분양 물량 등이 있다. 인천 에코메트로는 전체 4226가구 중 114㎡ 34평 161㎡ 48평 3330가구가 6억원 이하다. 114㎡ 2504가구 가 3억3000만원 수준이며 134㎡ 40평ㆍ204가구 4억2000만원 154㎡ 46평ㆍ284가구 4억9000만 5억2000만원 161㎡ 48평ㆍ338가구 5억4000만원 선이다. 용인 동천래미안 총 2393가구 의 분양가는 미정이지만 ㎡당 514만 544만원 평당 1700만 1800만원 선에서 책정될 전망이어서 112㎡ 34평 는 6억원 아래로 공급될 것으로 보인다. 송도 GS자이 하버뷰도 30평대는 6억원보다 낮은 가격이 가능하다. 남양주의 신규 분양 물량도 대부분 6억원 이하로 나올 예정. 택지개발지구인 진접지구에서 신안과 반도건설 등이 다음달 새 아파트를 내놓을 계획이다. 신안은 2개 블록에서 2340가구 반도건설은 873가구를 분양할 계획이다. 분양가 상한제 적용에 따라 계약 후 10년간 팔 수 없는 것은 단점으로 꼽힌다.,https://news.naver.com/main/read.nhn?mode=LSD&mid=shm&sid1=260&oid=009&aid=0000604203,79
58668,2007.07.11. 오후 5:02,부동산,매일경제,반값아파트 군포 부곡서 첫선,image0 오는 10월 이른바 반값아파트 로 불리는 토지임대부ㆍ환매조건부 아파트가 경기도 군포 부곡택지개발지구에서 처음 분양에 들어간다. 분양되는 물량은 토지임대부와 환매조건부가 각각 350여 가구씩 총 700여 가구. 평형은 전용면적 75 85㎡로 모두 85㎡ 25.7평 이하 규모다. 분양가격을 두고 막바지 검토작업이 진행되고 있지만 시중에서 기대하는 반값아파트 에는 턱없이 못 미칠 것으로 전해졌다. 건설교통부는 11일 토지임대부ㆍ환매조건부 분양주택 시범사업을 경기도 군포 부곡 택지개발지구에서 추진하기로 결정했다고 밝혔다. 건교부는 당초 안산 신길지구도 반값아파트 시범사업 대상지로 검토했지만 문화재 발굴 등으로 사업 추진에 차질이 예상돼 제외한 것으로 전해졌다. 반값아파트는 토지를 임대하고 건물만 분양하는 토지임대부 주택과 일정기간 이후 공공기관에 되팔아야 하는 환매조건부 주택을 통틀어 말한다. 청약가점제 적용 안 돼 주택 규모는 전용면적 85㎡가 대부분이 될 전망이며 일부 75㎡짜리도 포함될 것으로 알려졌다. 분양은 10월 중 이뤄지게 되는데 청약자격은 일반 공공주택 청약 때와 같다. 시범사업은 공공택지에서 공급되는 85㎡ 이하 규모 주택인 만큼 청약저축 가입자만 분양신청을 할 수 있고 청약가점제도 적용되지 않는다. 분양가는 토지임대부 주택이 토지 부분에 대한 임대료와 건물 부분 분양가 두 부분으로 나뉜다. 토지 임대료는 현재 공공택지 공급가격을 기준으로 주택공사의 자본비용률 4 5% 을 적용해 산정될 것으로 전해졌다. 건물 분양가는 분양가 상한제가 적용된다. 환매조건부 주택도 분양가 상한제가 적용되며 택지 공급가격 조정 등을 통해 일반 분양주택에 비해서는 다소 낮은 가격에 공급될 것으로 알려졌다. 환매 기간은 20년이며 환매 기간이 되기 전에 환매할 때에는 사업자인 공공기관에 넘겨야 한다. 초기 부담만 줄어 무늬만 반값 image1 토지임대부 분양을 받으면 건축비는 그대로에 택지비만 사업 주체인 주택공사 자본이용률 4.5% 을 곱해 월세로 낸다. 지난해 분양된 판교 전용면적 85㎡로 따져보면 건축비 1억6400만원 가 분양가인 셈이고 월 임대료 77만3000원이 추가된다. 현재 가치로 환산하면 기존 방식으로 분양한 가격 3억7000만원과 같아진다. 초기 부담을 더는 것 외에 수요자 이득이 없는 셈이다. 기존 분양 방식에 비해 시세차익을 노리기가 불가능하다. 환매조건부 주택도 20년간은 투자가치가 거의 없다. 건교부 관계자는 정책당국에서 반값아파트란 말을 공식적으로 한 적이 없다 며 토지임대부ㆍ환매조건부 등 다양한 분양 방식으로 주택을 공급해 선택폭을 넓히는 데 의의가 있다 고 말했다. 사업 편한 부곡지구로 낙점 반값아파트가 시범물량으로 공급되는 군포 부곡지구는 경기도 군포시 부곡동 일대로 총 사업면적이 47만3000㎡ 14만3000평 이며 서울과 수원 중간에 자리잡고 있다. 부곡지구는 북쪽으로 영동고속도로 군포 나들목이 있고 경부선철도 서울 외곽순환도로 국도47호선도 인접해 서울 접근성이 좋은 편이다. 지구 내 학교용지는 4만8000㎡로 초등학교 2곳 중학교 1곳 고등학교 1곳을 신설해 교육환경도 개선된다. 주택용지는 18만7000㎡로 전체 택지의 39.6% 선이며 이곳에서 반값아파트를 비롯해 공급되는 주택 수는 총 2991가구다. 성남 도촌지구와 함께 인구밀도가 높은 게 흠이다. 용 어 토지임대부 분양 건물만 분양받고 건물이 서 있는 토지에 대해 월 임대료를 납부하는 형태의 주택분양 방식이다. 환매조건부 분양 분양받은 주택을 팔 때 분양한 회사에 되판다는 조건이 붙은 주택분양 방식으로 환매가격은 분양가에 은행 이자율을 더해 계산한다.,https://news.naver.com/main/read.nhn?mode=LSD&mid=shm&sid1=260&oid=009&aid=0000604202,79
58669,2007.07.11. 오후 5:02,부동산,매일경제,숲속의요정 펜션 웨딩행사,내집마련정보사가 강원도 평창의 리조트형 테마 펜션 숲속의 요정 에서 미리 가 본 신혼여행 행사를 개최한다. 오는 14일부터 이틀간 열리는 이 행사는 웨딩 이벤트 컨설팅 회사인 웨딩피플 이 함께한다. 깜짝 프러포즈 댄스 경연대회 와인 파티 등이 열리며 허브나라와 웰컴 투 동막골 촬영지 등도 둘러본다. 야외 바비큐장이 갖춰져 있으며 래프팅 서바이벌 게임 산악 오토바이 등 다양한 레저 체험도 할 수 있다.,https://news.naver.com/main/read.nhn?mode=LSD&mid=shm&sid1=260&oid=009&aid=0000604201,79
58670,2007.07.11. 오후 5:02,부동산,매일경제,현진 분당 사옥으로 이전,image0 현진이 13 15일 기존 안양 사옥에서 성남시 분당구 미금역에 신축한 에버빌타워로 옮긴다. 에버빌타워는 연면적 9236㎡의 지하 2층 지상 8층 규모로 전층을 현진 임직원이 사용한다. 회사측은 기존 안양 사옥은 2003년에 설립한 백우현진복지재단에 출연돼 있어 사옥 이전 후 발생하는 임대수익을 복지활동에 사용할 계획이라고 밝혔다. 한편 현진은 사옥 이전에 발맞춰 CI 개편과 사가 제작 홈페이지 주소 www.hyunjin.com 도 새롭게 단장했다.,https://news.naver.com/main/read.nhn?mode=LSD&mid=shm&sid1=260&oid=009&aid=0000604200,79
58671,2007.07.11. 오후 5:02,부동산,매일경제,현대건설 LACP 선정건설산업부문 대상,현대건설이 세계 최고 권위의 마케팅 조사기관 LACP League of American Communications Professionals 에서 주관한 2006 전 세계 기업 연차보고서 Annual Report 평가에서 건설산업 부문 대상을 수상했다. 현대건설은 정보전달 명확성 정보접근 용이성 가독성 등에서 우수한 점수를 얻어 대상을 수상했으며 전 세계 기업 순위에서도 79위에 입상하는 성과를 거뒀다. 올해 2006 Annual Report Awards 에는 역대 최다인 21개국 2500개 이상 업체가 참가했다.,https://news.naver.com/main/read.nhn?mode=LSD&mid=shm&sid1=260&oid=009&aid=0000604199,79
58672,2007.07.11. 오후 5:02,부동산,매일경제,주택공사 하반기 임대 2만8천가구 공급u3000u3000,대한주택공사가 올 하반기에 전국 39개 지구에서 임대주택 총 2만8000여 가구를 공급한다. 종류별로는 국민임대주택 2만6310가구 5년 공공임대 673가구 10년 공공임대 1352가구 등이다. 11일 주택공사에 따르면 5년 공공임대는 서울상암 140가구 인천동산 310가구 부산만덕 86가구 천안구성 137가구 등 4곳에서 분양된다. 또 10년 공공임대는 화성동탄에서 503가구 오산세교에서 849가구가 공급된다. 이 밖에 국민임대주택은 수도권에서 고양행신 성남도촌 하남풍산 화성향남 파주운정지구 등지에서 공급된다. 구체적인 내용은 국민임대주택 전용 홈페이지 kookmin.jugong.co.kr 에서 확인할 수 있다.,https://news.naver.com/main/read.nhn?mode=LSD&mid=shm&sid1=260&oid=009&aid=0000604197,79
58673,2007.07.11. 오후 5:02,부동산,매일경제,남양주 마제스타워 도농 분양,image0 경기도 남양주시 개발이 속도를 내고 있는 가운데 진흥기업의 마제스타워 도농이 13일 모델하우스를 열고 분양에 들어간다. 마제스타워 도농은 33층과 40층인 초고층 타워형 아파트 두 개동으로 지어지며 중앙선 도농역을 도보로 이용할 수 있는 도농역 역세권이어서 앞으로 남양주시의 랜드마크가 될 것으로 보인다. 120.9185㎡ 36평형 56가구 138.7812㎡ 41평형 56가구 154.3217㎡ 46평형 118가구 237.7524㎡ 71평형 4가구로 총 234가구가 공급되며 고층 일부에서는 한강 조망도 가능하다. 33층과 40층 각 동의 20층과 25층에 층고 5.4ｍ의 하늘공원과 맨 꼭대기층에 스카이라운지를 배치할 예정이며 전용면적률이 83.9%로 넓게 설계됐다는 게 진흥기업측의 설명. 분양가는 평균 3.3㎡당 1500만원대로 3자녀 우선 특별분양에 해당된다. 청약접수 기간은 17일부터 20일까지다. 당첨자 발표는 25일 계약은 7월 30일부터 8월 1일까지다.,https://news.naver.com/main/read.nhn?mode=LSD&mid=shm&sid1=260&oid=009&aid=0000604196,79
58674,2007.07.11. 오후 4:57,부동산,파이낸셜뉴스,성원건설 두바이서 금융회사와 모기지 계약,성원건설이 두바이에서 현지금융기업들과 잇따라 전략적 제휴를 맺고 있다. 성원건설 전윤수 회장은 지난 8일 두바이현지 상떼빌 견본주택에서 아랍에미리트 UAE 의 대표적인 금융기관인 암락 Amlak 의 나세르 알 셰이크 회장과 국내 최초로 모기지 파이낸싱을 위한 전략제휴계약을 체결했다. 이틀 후인 10일 성원건설 중동지역본부장인 박창표 사장은 글로벌 은행인 HSBC와 모기지 파이낸싱에 대한 전략적 제휴를 맺었다. 이번 계약에 따라 두바이 비즈니스베이 상떼빌과 자다프 컬쳐빌리지 계약자들은 분양가의 85%까지 모기지론을 받을 수 있다. 대출 기간은 최장 25년. 이 모기지론은 부동산을 담보로 설정하는 것을 부도덕한 일로 인식하는 이슬람교 교리에 따라 준공 전까지는 계약금 외에 중도금과 이자를 내지 않는다. 대출 금리는 개인 신용도에 따라 7.25∼9.5%로 차등 적용된다. 이 조건은 앞으로 성원이 개발하는 현지 모든 프로젝트에 동일하게 적용되는 것이라고 성원측은 설명했다.,https://news.naver.com/main/read.nhn?mode=LSD&mid=shm&sid1=260&oid=014&aid=0000321669,79
58675,2007.07.11. 오후 4:54,부동산,파이낸셜뉴스,하반기 분양시장 랜드마크 청약전략“지역우선·가점제 점수등 따져야”,랜드마크 아파트는 인기가 높기 때문에 치밀한 청약전략이 필요하다. 일단 랜드마크 아파트를 청약 대상으로 잡았다면 자신의 청약 자격을 따져봐야 한다. 용인이나 송도 등의 유망 지역에서 분양은 지역우선제가 적용되기 때문에 청약당첨이 쉽지 않다. 또 가점제에서 높은 점수를 받는 무주택자라면 9월 이후를 노리고 유주택자 등 가점제에서 불리한 경우는 9월 이전 서둘러 유망단지에 청약에 나서는 것이 좋다고 전문가들은 지적한다. 부동산114 김규정 차장은 “랜드마크 단지일 수록 인기가 많아 당첨이 쉽지 않다”면서 “지역우선 물량 가점제 점수 자금여력 등 자신의 조건을 따져보고 청약에 나서야 한다”고 조언했다. 지방의 경우 미계약 물량이 많기 때문에 청약통장 사용보다는 재당첨금지까지 고려해 미계약가구와 전매규제에서 해제될 분양권 아파트를 선택하는 것이 좋은 방법이다. 특히 투기과열지구 해제 지역의 유망 단지는 전매가 가능해 단기접근이 가능하지만 초기에 수요가 빠지면 프리미엄도 낮아질 수 있다는 점을 유의해야 한다. 지방분양시장 역시 대단지 역세권 브랜드 등으로 양극화 현상이 심화돼 지역적 호재를 꼼꼼히 살펴 수혜를 입을 만한 단지를 선택해야한다. 분양가상한제를 앞둔 시점이라 건설사들의 고가분양가 책정이 줄어들기는 했지만 분양가상한제 시행 전까지는 주변시세 분양물량의 금융혜택 분양서비스 제품 등을 비교해 봐야 한다.,https://news.naver.com/main/read.nhn?mode=LSD&mid=shm&sid1=260&oid=014&aid=0000321668,79
58676,2007.07.11. 오후 4:54,부동산,파이낸셜뉴스,하반기 분양시장 랜드마크 경남 진주 초천동 푸르지오，1순위 마감,지방주택시장 침체가 호전되지 않고 있는 가운데 최근 대우건설이 경남 진주시 초전동에 분양한 푸르지오가 지난 3일 1순위에 마감돼 눈길을 끌었다. 경쟁률은 평균 4.6대1. 이렇게 수요자들이 몰린 배경에는 1 2차를 합쳐 총 1600여가구의 대규모 대단지라 해당지역의 랜드마크로 급부상했기 때문이다. 여기에 지난달 말 지방의 투기과열지구가 해제된 점도 일조했다. 부동산써브 함영진 팀장은 “실거주 목적뿐만 아니라 향후 자산가치를 생각한다면 이러한 지역 랜드마크 단지에 적극 청약할 필요가 있다”고 말했다. 현재 분양을 앞둔 지방의 랜드마크급 주요단지로는 광주시 수완택지개발지구 ‘피오레’ 대광역시 수성구 두산동 ‘SK리더스뷰 충청남도 아산신도시 펜타포트 주상복합 등이 꼽히고 있다. 수완택지개발지구 13 1 2블록의 ‘피오레’는 오는 9월 분양예정으로 143㎡ 전용 43평 162㎡ 49평 총 580가구 규모다. ‘수완자이’는 단지 외부의 1 057 856㎡ 규모의 풍부한 녹지지구와 단지 앞으로 흐르는 풍영정천을 가깝게 이용할 수 있다. 하반기에 SK건설이 대구광역시 수성구 두산동에서 분양하는 ‘SK리더스뷰’는 지하3층∼지상57층 153㎡ 전용 46평 ∼347㎡ 105평 총 788가구다. 입주민전용 커뮤니티센터에는 피트니스클럽 사우나 체력 측정실 등이 들어서고 지하 1층에는 대형마트가 입점할 예정이다. 충청남도 아산시 아산신도시의 펜타포트 주상복합은 3개동 총 793가구로 구성된다. 1블록에는 2개 동 41층 45층 의 주상복합아파트가 건설되고 3블록에는 66층 높이 235m의 초고층 주상복합아파트가 들어선다. 첨단시설을 갖춘 펜타포트는 복합단지 안에 대형 할인점 영화관 대형서점은 물론 백화점까지 들어서 충청권 지역발전을 대표하는 랜드마크로서 손색이 없다는 평가다.,https://news.naver.com/main/read.nhn?mode=LSD&mid=shm&sid1=260&oid=014&aid=0000321667,79
58677,2007.07.11. 오후 4:53,부동산,매일경제,청약가점땐 지역민에 10점 얹어주는 셈,지역우선공급제 확 뜯어고치자 3 image0 오는 9월이면 부양가족이 많은 무주택자에게 아파트를 우선공급하는 청약가점제가 실시된다. 그러나 지역우선공급제도가 지금처럼 유지되는 한 실수요자에게 아파트를 먼저 주겠다 는 청약가점제 기본 취지도 상당 부분 훼손될 것이라는 지적이 나오고 있다. 한 부동산 전문가는 2기 신도시 등에서 지역 주민의 당첨가점이 다른 지역 주민 당첨가점보다 크게 낮은 상황이 반복된다면 저항이 엄청날 것 이라며 정부가 어떻게 대처할지 염려된다 고 말했다. 신도시에선 청약가점 10점 격차 현행 지역우선공급제도에 따르면 66만㎡ 20만평 이상 공공택지에서는 일반분양 가운데 30%만이 지역 거주민에게 우선공급된다. 이 때문에 다른 지역 주민들도 당첨 가능성이 완전히 봉쇄되지는 않는다. 그러나 실제 당첨 가능한 청약가점에는 9 10점가량 격차가 생길 것으로 예상된다. 지난해 3월 판교신도시에서는 전용면적 85㎡ 이하 민영 아파트의 75% 2511가구 가 무주택자에게 우선공급됐다. 청약가점제 물량 중소형 아파트 75% 과 같은 비율이다. 이 중 지역우선공급제에 따라 성남 시민에게 우선 할당된 물량은 760가구로 총 1만6005명이 청약에 참여해 당첨 확률은 4.7% 수준이었다. 이에 비해 서울 인천 기타 수도권지역 당첨 확률은 1.9%에 불과했다. 1751가구에 무려 9만1295명이 청약했기 때문이다. image1 주택산업연구원의 청약가점제 시뮬레이션 결과를 준용하면 무주택자 가운데 상위 4.7%의 가점점수는 약 57점이었다. 반면 상위 1.9%의 가점점수는 약 66점으로 분석됐다. 결론적으로 청약가점이 58점인 지역 거주민은 아파트에 당첨될 수 있지만 다른 지역 거주민은 가점이 66점이더라도 아파트에 당첨되지 못한다는 얘기다. 결국 다른 지역 거주자가 지역우선공급 대상자를 따라잡으려면 무주택 기간이 5년 길거나 부양가족이 2명 이상 많아야 한다. 그래도 대규모 공공택지는 사정이 나은 편이다. 민간택지와 66만㎡ 미만 공공택지 아파트는 해당 지역 거주민에게 전량 우선공급되기 때문에 다른 지역의 청약가점은 소용이 없다. 용인이나 인천경제자유구역에서 나오는 민간택지 물량에 다른 지역 청약통장 가입자는 아무리 가점이 높아도 그림의 떡 일 따름이다. 지역우선공급제는 존속해야 현행 지역우선공급제에 불합리한 측면이 많다는 사실은 대다수 전문가가 공감하고 있다. 심지어 정부 관계자들도 고개를 끄덕이고 있다. 다만 완전한 폐지는 곤란하다는 시각이 많다. image2 지역우선공급제도 자체는 유지하되 지나친 지역 특혜는 바로잡아야 한다는 게 대다수 전문가들 시각이다. 장성수 주택산업연구원 연구실장은 대규모 아파트단지가 들어서는데 해당 지역 주택난이 여전하다면 말이 되느냐 며 지역우선공급제도는 나름대로 근거가 있다 고 말했다. 장 실장은 지역우선공급제도를 완전히 폐지하기는 어려울 것 이라며 정책적 필요성에 따라 일부 조정이 있을 수 있다 고 덧붙였다. 고준석 신한은행 부동산재테크팀장도 아파트가 들어서는 지역 주민들에게 청약우선권을 준다는 것 자체는 이상할 게 없다 면서도 다만 공급 비율을 결정할 때 특정 지역에 혜택이 집중되는 것은 고칠 필요가 있다 고 말했다.,https://news.naver.com/main/read.nhn?mode=LSD&mid=shm&sid1=260&oid=009&aid=0000604183,79
58678,2007.07.11. 오후 4:53,부동산,매일경제,지역우선공급제 이렇게 바꾸자,지역우선공급제 확 뜯어고치자 3 image0 전문가들이 거론하는 지역우선공급제도 개선방안은 크게 세가지다. 첫 번째 해법은 지역우선공급 비율을 하향 조정하는 것이다. 면적이 66만㎡ 이상인 신도시급 택지지구에서는 현행 30%인 지역우선 할당비율을 10 20%로 낮추고 지역 거주자에게 100% 청약우선권이 주어지는 민간택지와 소형 택지지구 66만㎡ 미만 에서도 일부 물량을 다른 지역 일반분양 물량으로 돌리는 방안이다. 두 번째는 9월부터 적용될 청약가점제를 활용하는 방법이다. 물량을 떼어내는 현행 방식 대신 아파트단지가 들어서는 지역 거주자에게는 일정한 청약가점을 제공하는 방안이 검토될 수 있다. 무주택 기간 부양가족 수 가입 기간으로 구성된 가점항목에 해당 지역 거주 여부 항목을 추가하자는 아이디어다. 세 번째는 지역우선공급을 받을 수 있는 자격요건을 강화하는 방안이다. 통상 6개월 1년인 거주기간 요건을 3 5년으로 강화하면 위장전입 등 부작용을 피할 수 있다는 설명이다. 그러나 각각 방안이 장ㆍ단점을 함께 갖고 있는 만큼 충분한 사전검토가 필요하다는 지적이다. 박재룡 삼성경제연구소 수석연구원은 해당 지자체 처지에서 아파트 지역우선공급은 당연한 제도 라며 지역 집중이 지나치다면 할당비율을 조정하는 방식이 무난하다 고 말했다. 박 연구원은 우선공급 대상에 대한 결정권을 지자체장에게 준 것은 지역 사정을 가장 잘 알고 있기 때문 이라며 또 지역우선공급을 청약가점제에 반영하려고 하면 또 다른 문제점이 생길 수도 있다 고 걱정했다.,https://news.naver.com/main/read.nhn?mode=LSD&mid=shm&sid1=260&oid=009&aid=0000604182,79
