,date,cat,co,headline,text,url,week
2658,2006.02.02. 오전 8:21,부동산,SBS,재건축 개발이익 환수 추진…논란 예상,앵커 8.31 부동산 대책의 후속대책을 정부와 열린우리당이 오늘 2일 본격 논의합니다. 재건축 아파트의 재건축 시세차익을 정부가 환수하는 방안이 추진되고 있습니다. 남상석 기자가 보도합니다. 기자 열린우리당은 재건축 아파트의 개발이익을 보다 강력하게 환수하기 위해 재건축 아파트의 용적률이 증가한 부분에 대해 개발부담금 부과를 강화하는 방안을 마련하기로 했습니다. 열린우리당은 어제 부동산 정책기획단 회의를 열고 재건축 아파트의 용적률을 올려줘 강남 지역을 중심으로 아파트 가격이 올라가고 있다고 분석하고 개발이익 환수를 강화하기로 했습니다. 윤호중 열린우리당 부동산정책기획단 간사 의원 종합적으로 검토해서 재건축 아파트의 개발이익을 환수할 수 있는 방안을 마련하기로 했다. 윤 의원은 최근 서울 강남 일대 재건축 아파트 값이 큰 폭으로 오르면서 주변 집값 상승을 이끌고 있기 때문이라고 설명했습니다. 열린우리당은 또 현재 아파트 청약제도가 실수요자인 무주택 서민층에게 주택을 공급한다는 본래 취지에서 많이 벗어나 있다고 보고 실수요자에게 우선 공급되도록 청약제도를 보완하기로 의견을 모았습니다. 정부와 열린우리당은 오늘 청와대에서 노무현 대통령 주재로 회의를 열어 이런 방안을 포함한 8.31 부동산 종합대책의 후속대책을 논의할 예정입니다.,https://news.naver.com/main/read.nhn?mode=LSD&mid=shm&sid1=260&oid=055&aid=0000063045,4
2659,2006.02.02. 오전 8:14,부동산,MBN,송도 100층 빌딩 2010년 완공,인천 송도 경제자유구역에 오는 2010년 완공을 목표로 100층 높이의 초고층 복합빌딩이 들어섭니다. 이와 관련해 재정경제부와 인천 경제자유구역청은 송도 국제업무단지 인근 매립지역에 100층 규모의 초고층 빌딩을 세우기로 하고 비공개 입찰을 진행중인 것으로 전해졌습니다. 입찰에는 현재 아시아계와 미국계 등 외국 개발사업자 3곳이 제안서를 제출한 것으로 확인됐습니다.,https://news.naver.com/main/read.nhn?mode=LSD&mid=shm&sid1=260&oid=057&aid=0000032858,4
2660,2006.02.02. 오전 8:14,부동산,MBN,당정 재건축 개발이익 부담금 도입,8.31 부동산 대책의 후속으로 재건축에 대한 개발이익 부담금을 물리는 방안이 추진되고 있습니다. 정부는 노무현 대통령 주재로 오늘 8.31 후속대책 회의를 가집니다. 김건훈 기자입니다. 지난달 노 대통령은 신년 연설을 통해 부동산 가격 안정에 대한 강력한 의지와 대책을 강조했습니다. 인터뷰 노무현 대통령 집값을 안정시키고 서민들이 내 집 마련의 꿈을 실현할 수 있도록 공급도 확실히 늘리겠습니다. 이같은 정부의 확고한 의지는 8.31 후속대책의 일환으로 재건축에 대한 투기 억제를 골자로 가닥을 잡아가고 있습니다. 정부와 열린우리당은 재건축발 부동산시장 불안을 막기 위해 가칭 재건축 개발이익 부담금 을 새로 도입하기로 의견을 모았습니다. 부담금은 현행 땅값 상승분이 아닌 재건축으로 늘어난 용적률에 땅값을 따져 부과하는 방식이 거론중입니다. 또 재건축 아파트값이 오르는 구조를 원천 차단하기 위해 조합원 분양가와 일반 분양가를 똑같은 금액으로 산정하는 방안도 검토중입니다. 이밖에 지역별 아파트 입주량을 고려한 재건축 총량제와 지역별 허용물량 조절 안전진단 기준 강화 방안 등도 고려하기로 했습니다. 정부는 오늘 노 대통령 주재로 관련 부처와 국책연구기관 등이 참석한 가운데 8.31 후속 2단계 대책 비공개회의를 갖습니다. mbn뉴스 김건훈입니다.,https://news.naver.com/main/read.nhn?mode=LSD&mid=shm&sid1=260&oid=057&aid=0000032857,4
2661,2006.02.02. 오전 7:56,부동산,매일경제,SKㆍ동부건설 판교 참여 포기,판교에선 삼성래미안과 SK뷰 동부 센트레빌 아파트를 볼 수 없게 될 전망이다. 3 월 초 시작되는 주택공사 판교 중대형 아파트 턴키입찰에 이들 업체가 참여하지 않 기로 내부방침을 정했기 때문이다. 불참키로 한 건설사들은 주택공사가 제시한 공사비로는 적자를 면하기 어렵다고 주 장하고 있어 적정 공사비를 놓고 논란도 벌어질 조짐이다. 4공구 입찰참가를 준비 했던 SK건설과 2공구 참가를 준비했던 동부건설 역시 비용문제로 불참을 결정했다. 당초 1548억원의 공사비가 책정된 1공구에 입찰하려던 삼성물산 건설부문은 참여 여부를 놓고 고민중이다. 대형 건설사들은 평당 325만원에 나온 판교 중대형 공사비가 부가세를 빼면 평당 3 09만원 선에 불과해 비슷한 규모의 은평뉴타운 공사비인 평당 320만원과 10만원 이 상 차이나는 것으로 보고 있다. 대형 G건설사 임원은 은평뉴타운에 비해 공사감리 조건은 더 까다로운데 금액은 적으니 고민 이라고 말했다. 업체들의 이 같은 입장에 대해 턴키 발주를 맡고 있는 주택공사 측은 공사금액에 문제 없다는 반응이다. 통상 주택공사가 발주하는 아파트 평당 공사비는 280만원 수준인데 판교의 경우 이를 평당 40만원 이상 올려준 것이라는 설명이다. 반면 대 우건설과 현대건설은 수익보다 랜드마크 단지 건설에 무게를 두고 입찰에 참여키로 했으며 대림산업 현대산업개발 금호산업 건설부문 롯데건설 등도 참여하는 쪽에 무게중심을 두는 것으로 보인다.,https://news.naver.com/main/read.nhn?mode=LSD&mid=shm&sid1=260&oid=009&aid=0000485104,4
2662,2006.02.02. 오전 7:56,부동산,매일경제,광명역세권 단지 사업자 공모,대한주택공사는 광명역세권 택지개발사업지구 내 복합단지를 개발하는 공공ㆍ민간 합동형 프로젝트파이낸싱 PF 사업에 참여할 민간사업자를 공모한다. 주공은 이를 위해 8일 성남 분당의 주공 본사 3층 대회의실에서 사업설명회를 열고 공모를 거쳐 5월 10일 최종 사업자를 선정할 예정이다. 대상 지역은 경부고속철도 광명역 역사 전면 2만2361평으로 컨벤션센터 호텔 국 제업무단지 백화점 주상복합아파트 등 대규모 복합단지로 조성된다. 주공 관계자는 광명역세권지구는 앞으로 수도권 지역 교통ㆍ물류 거점도시 음악 밸리와 연계된 문화도시로 거듭날 것 이라고 밝혔다.,https://news.naver.com/main/read.nhn?mode=LSD&mid=shm&sid1=260&oid=009&aid=0000485103,4
2663,2006.02.02. 오전 6:03,부동산,연합뉴스,정부 부동산 실거래가 위반사례 첫 정밀조사,신고된 1만2천건중 61건 색출 서울 연합뉴스 유경수기자 올해 도입된 부동산실거래가 신고제도를 위반한 혐의가 짙은 61건에 대해 정부가 처음으로 정밀조사에 착수했다. 부동산 실거래가 신고건수는 제도시행 19일만에 1만2천여건을 돌파 최근 시장 분위기를 반영했다. 2일 건설교통부에 따르면 올해 처음 시행된 부동산실거래가 신고제의 신고 건수가 지난달 19일 현재 1만2천43건에 이르렀으며 주변시세와 거래가격을 비교한 결과 61건 5% 에 대해 부적정 판정을 내렸다. 적발된 허위신고 의심 사례는 아파트 24건 토지 20건 단독주택 17건 순이었다. 서울시 양천구의 32평 아파트의 경우 검증기준 가격의 하한가와 시세 4억원 보다 크게 낮은 3억2천500만원에 매매된 것으로 신고돼 국세청 조사를 받게 됐다. 1천500㎡짜리 경남 고성군 토지는 검증기준 가격보다 8천만원 낮은 4억6천500만원에 신고 국세청에 조사의뢰됐다. 건교부는 정밀조사 통보된 허위신고 혐의건에 대해서는 국세청과 지자체가 자금 추적 등을 실시 실제 허위신고 여부를 구체적으로 조사하게 될 것 이라고 말했다. 조사결과 허위신고로 판명되면 거래 당사자와 중개업자는 취득세의 3배 이하 범위의 과태료 및 중개업 등록 취소 등 조치가 취해진다. 또 양도소득세 가산세가 부과되고 고의로 조세 탈루 혐의가 입증될 경우 조세범처벌법에 따라 고발조치돼 3년이하의 징역 또는 탈루세액의 3배에 해당하는 벌금을 물게 된다. 부동산 실거래가 신고제도는 토지 및 건축물을 매매할때 거래계약 체결일로부터 30일 이내 실제 거래가격을 시.군.구청에 신고하는 제도로 신고된 거래내역 및 가격 검증 결과 등은 국세청 및 지자체 세무부서에 통보돼 과세자료로 활용된다. 박상우 건교부 토지기획관은 비교적 제도가 잘 정착되고 있으나 아직도 일각에서는 세금을 피하기 위해 허위신고를 하는 사례가 적지 않다 면서 당분간 단속활동을 지속 허위신고를 철저히 가려낼 방침 이라고 말했다.,https://news.naver.com/main/read.nhn?mode=LSD&mid=shm&sid1=260&oid=001&aid=0001209311,4
2664,2006.02.02. 오전 6:02,부동산,연합뉴스,작년 서울 주택건설 인.허가 실적 10.9% 감소,서울 연합뉴스 유경수기자 지난해 서울지역의 주택건설 인.허가 실적이 10.9%나 줄어든 것으로 나타났다. 2일 건설교통부에 따르면 2005년 서울의 주택건설 인.허가 실적은 아파트 4만4천84가구 다세대 및 다가구 7천713가구로 전년 대비 11.1% 9.6%가 각각 감소했다. 전국적인 물량은 수도권 19만7천901가구 3.8% 지방 26만5천740가구 3% 로 2004년과 비슷한 46만3천641가구를 기록했다. 지역별로는 경기 2.7% 부산 24.1% 대구 64% 광주 39% 전북 39.6% 경남 25.8% 등의 증가세가 두드러졌고 부문별로는 공공부문이 14만1천가구로 13.7%가 늘어난 반면 민간부문은 32만3700가구로 5%가 줄어 대조를 보였다. 유형별로는 아파트가 41만5천511가구로 2.6% 늘어난데 반해 다가구 및 다세대는 4만8천130가구로 18.3%가 줄었다. 전용면적별로는 18 25.7평이하가 43.3% 18평 이하 29.2% 25.7평 초과 27.5% 순이었다. 한편 12월 주택건설실적은 수도권 7만4천664가구 전년 동월대비 8.8% 지방 7만3천366가구 32.5% 전국 14만8천30가구 19.4% 였다.,https://news.naver.com/main/read.nhn?mode=LSD&mid=shm&sid1=260&oid=001&aid=0001209304,4
2665,2006.02.02. 오전 3:53,부동산,동아일보,재건축 개발이익 환수추진…‘8·31 약발’ 안듣자 극약처방 쓰나,동아일보 열린우리당과 정부가 추진하는 재건축 아파트에 대한 개발부담금 제도가 실제로 시행되면 재건축 사업은 결정적인 타격을 받을 것으로 보인다. 정부 또는 지방자치단체가 용적률을 올려줘 발생하는 집값 상승분을 정부가 거둬 가면 아파트를 재건축하더라도 얻을 수 있는 이익이 크게 줄어들기 때문이다. 하지만 재산 증식을 위해 재건축을 추진해 온 아파트 주민들의 반발이 클 수밖에 없는 데다 용적률을 높여 준 만큼의 개발이익을 정확히 산정하기가 어려워 논란이 적지 않을 것으로 예상된다. 부동산114 김희선 金希鮮 전무는 “서울 강남의 유일한 주택 공급 통로인 재건축이 위축돼 장기적으로 공급 부족 현상이 더욱 심해질 것”이라고 우려했다. ○재건축 개발부담금 얼마나 물리나 1일 열린우리당 부동산정책기획단 회의에서 대한주택공사 산하 주택도시연구원이 내놓은 방안의 핵심은 재건축으로 늘어난 아파트 층수와 평수를 가격으로 환산해 일정 비율을 부담금으로 떼어 간다는 것이다. 재건축 개발이익은 사업이 끝난 뒤 용적률 상승으로 늘어난 평수를 포함한 전체 토지가격에서 재건축 전의 토지가격과 각종 비용을 빼 계산한다. 부담금 비율로 나온 세 가지 방안에는 개발이익을 100% 환수하는 방안까지 포함돼 있어 격심한 반발은 불을 보듯 뻔한 상황이다. 나머지 두 가지 방안도 △25% 환수 △이익 규모에 따라 10∼40% 환수하자는 것이어서 해당 아파트 주민들은 직접적인 재산권 침해로 받아들일 만하다. 다만 대상지역은 전국이 아니라 수도권 전역과 지방의 각종 개발 수요가 있는 ‘투기과열지구’로 한정하는 방안을 제시했다. 현재로서는 법적인 근거가 없기 때문에 당정은 특별법을 새로 만드는 방안을 검토하기로 했다. 정부는 이미 올해 1월 1일부터 택지 산업단지 관광단지 등 30개 대형 신규 개발사업에 대해 개발이익의 25%를 환수하는 개발부담금 제도를 시행하고 있다. ○재건축 사업 추진에 결정타 될 수도 정부와 여당이 ‘극약 처방’이라고 할 만한 대책을 추진하는 이유는 재건축 아파트가 ‘주거용’이 아니라 ‘투자용’으로 인식되고 있기 때문이다. 재건축 아파트 ‘투자’를 통한 시세차익을 줄이면 재건축 아파트 수요가 감소할 것이라는 판단이다. 실제로 전문가들은 임대아파트 의무건설 비율이 시행되고 있는 상황에서 개발부담금까지 부과하면 조합원들의 기대이익이 크게 감소해 재건축이 빠르게 냉각될 것으로 예상했다. 게다가 이르면 올해 7월부터 건물의 증축이나 재건축 재개발에 따라 필요한 도로 공원 학교 등 주변 기반시설의 설치비용 중 20%를 건축주가 부담하는 ‘기반시설부담금제’가 시행되기 때문에 재건축에 따른 건설업체와 조합원들의 부담은 크게 늘어날 전망이다. ○재건축 조합원 반발 거셀 듯 이날 회의에서 주택도시연구원 박헌주 朴憲注 원장은 “토지와 재건축을 개발이익 환수 대상으로 삼는 것은 적절하지 않다는 반론이 있지만 ‘가용 토지 부족’이라는 한국의 특수성에 입각해 다른 재산권과 달리 개발이익을 환수할 수 있다”는 의견을 냈다. 하지만 자신의 재산권이 침해당한다고 느끼는 아파트 주민들은 강하게 반발하고 있다. 서울 송파구 잠실동 주공아파트 재건축사업 관계자는 “최근 재건축 단지 아파트 값이 오른 것은 정부와 서울시의 갈등에 따른 규제완화 기대심리와 공급부족 때문인데 엉뚱한 데서 원인을 찾고 있다”며 정부와 여당을 비난했다. 사유재산권 침해라는 위헌 논란이 불거질 수도 있다. 익명을 요구한 변호사 K 씨는 “개발부담금은 택지 개발처럼 공공의 개발사업으로 발생한 이익을 환수하는 것인데 공공 개발사업이 아니라 개인이 갖고 있는 오래된 아파트를 헐고 새로 짓는 과정에서 발생하는 이익을 정부가 가져가겠다면 위헌 소송이 제기될 가능성이 크다”고 예상했다.,https://news.naver.com/main/read.nhn?mode=LSD&mid=shm&sid1=260&oid=020&aid=0000335161,4
2666,2006.02.02. 오전 2:24,부동산,세계일보,강남 아파트값 지난달 1% 상승,서울 강남지역의 1월 아파트값이 1%나 오르며 8·31 부동산 종합대책 발표 이전 수준을 회복한 것으로 조사됐다. 1일 국민은행의 ‘1월 전국주택가격 동향조사’에 따르면 전국 집값은 지난해 12월 대비 0.3% 서울 강남 지역은 1% 올라 작년 9월 이후 월간기준으로 가장 높은 상승률을 기록했다. 강남 집값 상승률은 작년 6월 2.4%로 정점을 이룬 뒤 10월에 반짝 마이너스 0.2% 로 돌아섰지만 이후 11월 0.3% 12월 0.7%로 상승폭이 커졌다. 특히 서울 서초구의 경우 지난달 매매가격이 1.9% 올라 전국 최고 상승률을 보였고 강남구 1.8% 경기 김포 1.7% 성남 분당 1.4% 울산 중구 1.1% 등도 상승세가 두드러졌다. 국민은행은 “봄 이사철을 앞두고 이사수요와 생애최초주택자금 대출을 이용한 수요가 몰린 데다 일부 지역에서 재건축 규제완화에 대한 기대감이 확산돼 매매가격이 많이 뛰었다”고 풀이했다. 지역별로는 부산 0.1% 전남 0.2% 을 제외하고 서울 0.6% 강북 14개구 0.2% 강남 11개구 1% 대구 경기 광주 이상 0.4% 울산 충북 전북 경남 이상 0.3% 인천 대전 강원 이상 0.2% 등 대부분 지역이 올랐다. 강갑수 기자 kks segye.com ⓒ 세계일보＆세계닷컴 www.segye.com 무단전재 및 재배포 금지 세계닷컴은 한국온라인신문협회 www.kona.or.kr 의 디지털뉴스이용규칙에 따른 저작권을 행사합니다.,https://news.naver.com/main/read.nhn?mode=LSD&mid=shm&sid1=260&oid=022&aid=0000144650,4
2667,2006.02.02. 오전 12:49,부동산,한국경제,수도권에 한국판 디즈니랜드 ‥ 건교부 검토 자연보전권역에,경기도 광주와 양평 가평 남양주 등 수도권 자연보전권역에 대규모 여가시설을 허용하는 방안이 검토된다. 건설교통부는 1일 국제 용역업체인 아서디리틀이 수도권 경쟁력 확보와 정부청사 및 공공기관 이전으로 인한 공백을 막기 위해 이 같은 내용을 담은 용역보고서를 정부에 제출했다고 밝혔다. 보고서는 경기 용인 광주 이천 여주 등 8개 시·군에 걸쳐 있는 자연보전권역을 활용해 한국판 디즈니랜드 와 같은 대규모 여가단지를 조성하고 과천 정부청사와 공공기관 이전지를 박물관과 오페라극장 등 여가·문화공간으로 만들 것을 검토해야 한다고 제안했다. 보고서는 또 수도권 외곽에 신도시 건설을 활성화해 도심인구를 분산하는 한편 수도권 신도시는 특화전략과 첨단기능 시설이 구축된 자립형으로 조성 서민주택 공급을 늘려야 한다고 권고했다. 보고서는 국제경쟁력을 높이기 위해서는 △수도권 대표산업으로 인정받는 첨단제조업에 대한 투자지원 확대 △동북아 허브로 육성가능한 신규 대표산업 선정 △국내외 기업의 집적 유도를 위한 신규 대표산업 육성지역 설정 등을 제시했다. 보고서는 이 밖에 서울 도심의 철도와 간선도로망을 지하화하되 지상공간을 여가공간으로 활용하고 도심 오염을 줄이기 위한 폐기물 처리기관 통합 운영 등이 추진돼야 한다고 덧붙였다. 건교부 고위 관계자는 이 같은 최종 보고서와 전문가 간담회 결과 등을 토대로 관계부처 협의를 거쳐 이달 중 수도권 발전대책을 확정 발표할 예정 이라고 말했다.,https://news.naver.com/main/read.nhn?mode=LSD&mid=shm&sid1=260&oid=015&aid=0000869536,4
2668,2006.02.02. 오전 12:24,부동산,한국경제,강남 재건축 아파트에 개발부담금 부과키로,서울 강남권 재건축 아파트에 올해 부활된 개발부담금을 부과하는 방안이 적극 추진된다. 열린우리당 주도로 검토되고 있는 이 방안이 확정·시행될 경우 재건축 사업이 어려워져 상당한 파장이 예상된다. 이와 관련 노무현 대통령은 2일 오후 청와대에서 건설교통부 등 관련 부처 장관과 국책연구기관 공기업 사장 등이 참석한 가운데 8·31 후속 2단계 부동산대책 비공개 회의를 주재할 예정이어서 주목된다. 열린우리당 부동산대책기획단은 1일 이강래 단장 주재로 제4차 회의를 열어 최근 집값이 급등하고 있는 강남 재건축 아파트에 대한 개발이익 환수방안 등을 집중 논의했다. 이날 박헌주 주공 주택도시연구원장은 주제발표를 통해 재건축 기대이익에 따른 집값 상승을 억제하고 시세 차익을 노리는 투기를 막기 위해서는 재건축도 개발부담금 부과 대상에 포함시키는 것이 가장 효과적 이라고 제안했다. 그는 재건축과 성격이 비슷한 도시환경정비사업에 대해서는 이미 개발부담금이 부과되고 있기 때문에 큰 문제는 없을 것 이라고 설명했다. 윤호중 열린우리당 의원은 회의 후 브리핑을 통해 재건축에 개발부담금을 부과하는 쪽으로 어느 정도 의견이 모아졌다 고 설명했다. 기획단은 오는 21일 5차 회의를 열어 △재건축 개발이익 환수방안 △분양가 인하방안 △청약제도 개선방안 △임대주택 공급확대방안 등을 논의하기로 했다. 개발부담금이란 택지·산업단지 등 30개 대규모 개발사업에 대해 개발이익의 25%를 부담금으로 물리는 제도로 지난 2004년 수도권지역을 끝으로 중단됐다가 지난해 8·31대책을 통해 부활돼 올해 1월1일부터 시행되고 있다.,https://news.naver.com/main/read.nhn?mode=LSD&mid=shm&sid1=260&oid=015&aid=0000869527,4
2669,2006.02.03. 오후 8:51,부동산,파이낸셜뉴스,3월 전국 2만2천가구 입주…2월 4만가구 비해 급감,오는 3월에는 전국적으로 80여개 사업장에서 총 2만2000여가구가 입주한다. 이는 2월 입주물량인 4만가구에 비해 크게 줄어든 물량이다. 특히 서울보다도 경기지역과 지방 광역시에 입주 물량이 집중돼 있는 것으로 나타났다. 부동산 정보제공업체인 내집마련정보사 관계자는 서울의 경우 2월에 3002가구에 이르는 서울 도곡동 도곡렉슬이 입주를 한 탓에 3월 입주물량이 2월에 비해 크게 줄었다 며 경기도는 용인 동백지구에서 2월에 이어 2400여가구가 입주를 하며 지방에서는 대전 대덕테크노밸리 대구 부산광역시 등에 입주 물량이 몰려 있다 고 말했다. 서울에서 가장 큰 입주단지는 대한주택공사가 서대문구 천연동에 공급한 뜨란채 1008가구. 평형은 12∼34평형으로 이뤄져 있으며 12평형은 임대아파트다. 3호선 독립문역이 가깝고 적십자병원 강북삼성병원도 인근에 있다. 성북구 돈암동 더샵 339가구도 2월 서울지역 입주아파트 중 비교적 큰 단지. 4호선 성신여대입구역을 이용하기가 편리하다. 경기지역에서는 용인 동백지구의 계룡리슈빌 567가구 모아미래도 838가구 한라비발디 342가구 동일하이빌 734가구 이 3월에 입주한다. 오는 2009년 6월에 개통 예정인 용인경전철 어정역이 가깝고 분당지역까지는 차로 30분 정도 걸린다. 용인에버랜드 한국민속촌도 오가기가 편리하다. 이외에 경기지역에서는 의정부 신곡동 주공아파트를 재건축한 신곡 한일유앤아이 700가구와 조합아파트인 용인시 마북동 대우파인힐1∼2차 총 770가구 가 3월 입주아파트로 비교적 큰 단지다. 지방에서는 부산 해운대구 재송동 더샵센텀파크2차 998가구 대전 유성구 관평동 신동아파밀리에 922가구 경북 김천시 교동 코아루1차 690가구 주상복합아파트인 대구 북구 침산동 침산2차 푸르지오 대구 달서구 월성동 래미안월성 760가구 등이 3월 주요 입주 아파트들이다.,https://news.naver.com/main/read.nhn?mode=LSD&mid=shm&sid1=260&oid=014&aid=0000211158,4
