,date,cat,co,headline,text,url,week
147657,2009.07.28. 오후 9:45,부동산,한겨레,시프트 꾸준한 인기…새달 은평·신내지구 노려라,한겨레 SH공사 신내2지구 866가구 등 1166가구 공급 11월 재당첨 제한 예정…‘묻지마 청약’ 피해야 시프트 장기전세주택 서울시 산하 에스에이치 SH 공사가 공급하는 장기전세주택 ‘시프트’ SHift 의 인기가 대단하다. 지난 5월 공급된 서울 구로구 구로동 경남아너스빌 시프트 65㎡ 는 9가구 모집에 1158명이 청약해 128.67 대 1의 경쟁률을 보였고 반포 래미안 퍼스티지 역시 266가구 모집에 4800명이 몰려 18 대 1의 경쟁률을 기록했다. 서울시는 “주변 전세시세보다 저렴한 가격에 서울 시내 역세권 지역에서 살 수 있다는 게 시프트의 성공 요인이었다”며 “다른 임대주택과 달리 시프트는 단지 내에 혼재돼 있어 사회계층 통합도 가능하다”고 밝혔다. 8월 ‘건설형 시프트’ 풍성 하반기에도 대규모 시프트 공급이 예정돼 있다. 먼저 8월 서울 은평 뉴타운 사진 과 송파 장지지구 등에서 1166가구가 우선 공급된다. 이번 공급 물량은 7가구를 제외하곤 모두 건설형 시프트다. 시프트는 에스에이치공사가 직접 공급하는 ‘건설형’ 시프트와 재건축으로 늘어난 용적률 가운데 일부를 임대주택으로 지은 뒤 이를 서울시가 매입해 공급하는 ‘재건축 매입형’이 있는데 건설형 시프트에 청약 신청하려면 청약통장이 있어야 한다. 8월 공급에서 가장 많은 물량을 내놓는 곳은 서울 중랑구 신내동 신내2지구다. 전용면적 60㎡ 이하부터 85㎡ 이하 85㎡ 초과 중·대형까지 총 2400가구 가운데 시프트 공급 물량은 866가구에 이른다. 신내 나들목 인근에 있는 신내2지구는 택지지구여서 기반시설이 비교적 잘 정비돼 있다. 지하철 6호선 봉화산역이 걸어서 10 15분 거리에 있으며 7호선 중화역은 자동차로 5분 안에 도착할 수 있다. 신내초 동원중 송곡고 신현고 미디어고 등 교육시설과 가깝다. 은평 뉴타운 2지구에서도 247가구가 공급된다. 은평 뉴타운은 이미 여러 차례 공급된 바 있어 인기가 검증된 지역이다. 모두 전용면적 85㎡ 이하로 4단지에서 83가구 5단지에서 164가구가 공급된다. 2지구는 진관근린공원과 갈현근린공원 중심에 있어 주변 환경이 매우 쾌적하며 북한산을 조망할 수 있다. 특히 4단지는 지하철 3호선 구파발역과 가까워 걸어서 5분 내에 도착할 수 있다. 에스에이치공사는 이 밖에 송파구 장지동에서 전용 85㎡ 이하 46가구와 마포구 도화동에 전용 85㎡ 이하 7가구를 공급한다. 도화동에서 공급되는 시프트는 8월 공급 물량 가운데 유일한 재건축 시프트다. 마포맨션을 재건축한 건물로 5호선 마포역과 5·6호선 환승역인 공덕역에서 도보로 10분 안에 닿을 수 있다. 11월 재당첨 제한 등 바뀐 청약제도에 유의 수도권 전세가격이 심상찮게 오르고 있는 상황에서 청약저축통장이 있는 수요자들은 8월에 공급되는 시프트를 노려볼 만하다. 최근 공급된 시프트의 전세금은 주변 시세의 55 80%를 유지할 만큼 저렴하기 때문이다. 올해 들어 청약제도에 약간의 변동이 있으니 수요자는 변화된 제도에 유의해야 한다. 서울시는 올해 11월부터 시프트에 재당첨 제한을 마련할 계획이다. 지금까지는 시프트 청약시 가구주의 나이와 부양가족 수 무주택 기간 등을 고려해 청약가점이 높거나 납기일이 많으면 계속 당첨될 수 있었다. 실제 지난 2년간 공급된 시프트 5217가구 가운데 490가구가 최대 5번까지 당첨돼 형평성 논란이 일었다. 서울시는 “이미 당첨된 사람이 다시 시프트에 청약할 경우 일정 기간별로 청약가점을 감점하는 방식을 도입할 계획”이라고 밝혔다. 스피드뱅크 이미영 분양팀장은 “과거에는 좀 입지가 안 좋은 시프트에 들어갔다 하더라도 여러 번 재당첨이 가능했기 때문에 마음껏 청약할 수 있었지만 앞으로는 제약이 가해질 수 있다”며 “청약 점수가 높은 사람은 앞으로 불이익을 받지 않으려면 무조건 청약을 시도할 것이 아니라 조건과 위치를 꼼꼼히 따져본 뒤 정말로 원하는 지역에 청약해야 한다”고 말했다. 한편 85㎡ 이하 건설형 시프트에 청약하기 위해서는 본인이 청약저축에 가입돼 있어야 하며 가족 구성원 모두가 무주택자여야 한다. 청약저축은 납입 횟수가 24회 2년 이상일 때 1순위 자격을 얻는다. 전용면적 59㎡ 이하는 소득 제한 규정도 있는데 △월평균 소득이 전년도 도시근로자 월평균의 70% 이하 △토지 소유자의 경우 개별공시지가 기준 5000만원 이하 △자동차 소유자의 경우 현재 가치가 2200만원 이하여야 한다. 황춘화 기자 sflower hani.co.kr 세상을 보는 정직한 눈 한겨레 한겨레신문 구독 한겨레21 구독 ⓒ 한겨레신문사 무단전재 및 재배포 금지 한겨레는 한국온라인신문협회 www.kona.or.kr 의 디지털뉴스이용규칙에 따른 저작권을 행사합니다.,https://news.naver.com/main/read.nhn?mode=LSD&mid=shm&sid1=260&oid=028&aid=0002006332,186
147658,2009.07.28. 오후 9:45,부동산,한겨레,7월 29일 부동산 파일,한겨레 서울 금호동 ‘금호자이 1·2차’ 분양 지에스 GS 건설은 서울 성동구 금호동2가 562번지 일대 금호 17구역을 재개발하는 ‘금호자이 1차’와 금호동3가 632번지 일대 금호 18구역을 재개발한 ‘금호자이 2차’를 10월에 분양한다고 28일 밝혔다. 금호자이 1차는 지하 4층 지상 15 20층 6개동 규모이다. 54 140㎡ 총 497세대 중 조합원과 임대분양을 제외한 31세대만 일반 분양한다. 금호자이 2차는 지하3층 지상13 22층 6개동 규모이며 59 115㎡ 총 403세대 중 조합원과 임대분양을 제외한 38세대를 일반 분양한다. 견본주택은 대치동 자이갤러리에서 열었다. 분양가 상한제를 적용받지 않아 계약 뒤 전매할 수 있다. 입주는 2012년 2월 예정. 1577 4254. 순천 조례동 롯데캐슬 분양 롯데건설은 전남 순천시 조례동에 순천 롯데캐슬 1161가구를 분양한다. 올해 9월 입주를 앞두고 있는 순천롯데캐슬은 전용면적 84 182㎡의 중·대형으로 지하1층 15층 16개 동으로 순천에서 공급된 아파트 단지 가운데 가장 큰 규모다. 단지 내 영어마을 유아놀이방 도서관 골프연습장 등 고급 커뮤니티 시설이 마련돼 있다. 2012년 여수세계박람회가 근처에 예정돼 있어 호재를 누릴 수 있다고 회사 쪽은 설명한다. 호남고속도로 순천 나들목을 이용하면 호남지역은 물론 서해안 지역을 쉽게 오갈 수 있다. 순천 롯데캐슬은 지난 24일 사업현장 인근의 홈플러스 옆 부지에 본보기집을 열었다. 061 727 6900. 나인스에비뉴 상가 특별분양 %%IMAGE3%%㈜나인스에비뉴는 서울 구로구의 아웃렛백화점 나인스에비뉴 상가의 회사보유분을 특별분양한다. 지하5층 지상36층 규모로 상가는 지하1층 지상4층에 있다. 구로는 인천 수원 안산 환승 지역이어서 하루 유동인구가 50만명에 이른다. 2013년 세계야구클래식 WBC 유치를 목표로 돔구장과 대형 콘서트 시설 디지털문화센터 등이 들어설 계획이다. 지하 2층엔 한류테마관이 설치돼 이병헌 최지우 등의 한류스타 매장도 입점된다. 나인스에비뉴는 애경백화점과 다리로 연결돼 있어 함께 쇼핑할 수 있다. 분양가는 7300만원부터 1억4500만원까지다. 선착순으로 층과 호수를 지정할 수 있어 빨리 계약하면 좋은 위치를 고를 수 있다. 02 6678 7111. 세상을 보는 정직한 눈 한겨레 한겨레신문 구독 한겨레21 구독 ⓒ 한겨레신문사 무단전재 및 재배포 금지 한겨레는 한국온라인신문협회 www.kona.or.kr 의 디지털뉴스이용규칙에 따른 저작권을 행사합니다.,https://news.naver.com/main/read.nhn?mode=LSD&mid=shm&sid1=260&oid=028&aid=0002006331,186
147659,2009.07.28. 오후 8:26,부동산,뉴시스,관청·문화체육시설…개발제한구역에 못들어선다,서울 뉴시스 김형섭 기자 개발제한구역내 입지가 허용됐던 공공청사와 박물관 미술관 등 11개 시설의 입지가 다음달 7일부터 금지된다. 반대로 노인요양시설과 대중교통 환승센터는 허용된다. 국토해양부는 개발제한구역 관리제도를 조정한 ‘개발제한구역의 지정 및 관리에 관한 특별조치법 시행령’ 개정안이 28일 국무회의에서 확정돼 다음달 7일부터 시행된다고 밝혔다. 개정안에 따르면 그 동안 개발제한구역에 입지할 수 있었던 공공청사 국제경기시설 전문체육시설 제조업소 재활용시설 박물관 미술관 과학관 문화예술회관 시험연구시설 화물차 차고지 사업착수된 시설은 2년간 한시 허용 등 11개 시설의 입지가 금지된다. 그러나 수목장림 소규모 실내체육관 2층 이하 건축연면적 5000㎡ 이하 노인요양시설 대중교통 환승센터 5층 이내 의 입지는 허용된다. 또 개발제한구역 경계선을 지방자치단체장이 2012년까지 일부 조정해 해제할 수 있도록 하고 지구단위계획 없이 해제된 집단취락은 2012년까지 지구단위계획을 수립토록 의무화했다. 아울러 개발제한구역을 해제해 사업을 시행하고자 할 때 주변 10㎞ 이내에 공원이나 녹지를 제공토록 하는 제도도 최초로 시행된다.,https://news.naver.com/main/read.nhn?mode=LSD&mid=shm&sid1=260&oid=003&aid=0002796179,186
147660,2009.07.28. 오후 8:20,부동산,뉴시스,건물 잔수리 허가 대신 신고로,서울 뉴시스 김형섭 기자 올해 하반기부터 허가 없이 신고 만으로도 건축물의 경미한 수선이 가능해진다. 또 주변 환경을 심각하게 오염시킬 우려가 있는 건축물은 행정대집행 절차 없이도 철거할 수 있게 된다. 국토해양부는 이같은 내용을 담은 ‘건축법 시행령’ 개정안이 28일 국무회의를 통과함에 따라 하반기부터 시행한다고 밝혔다. 개정안에 따르면 내력벽 30㎡ 이상 수선 기둥·보 또는 지붕틀 3개 이상 수선 방화벽 또는 방화구획을 위한 바닥 벽의 수선 등 경미한 건축물 수선은 허가없이 신고로 대체된다. 종전에는 3층 이상 연면적 200㎡ 이상인 건축물의 모든 대수선은 반드시 허가를 받아야 했다. 또 건축물 강제 철거시 거쳐야 했던 ‘행정대집행법’ 절차도 주변 환경을 심각하게 오염시킬 경우는 신속한 철거를 위해 생략이 가능토록 했다. 개정안은 이와 함께 국토부장관이나 지식경제부장관의 지도하에 있는 기관 중 전문 인력을 확보한 기관을 ‘건축물 에너지 효율등급’ 인증기관으로 지정할 수 있도록 했으며 ‘건축위원회’에 ‘건축분쟁전문위원회’를 둘 수 있도록 하위법령을 정비했다.,https://news.naver.com/main/read.nhn?mode=LSD&mid=shm&sid1=260&oid=003&aid=0002796178,186
147661,2009.07.28. 오후 8:19,부동산,경향신문,수도권 전셋값 올해 초 대비 최고 30% 뜀박질,SUB TITLE START ㆍ전세시장 들썩 왜 ①신규 입주물량 부족 ②방학맞아 학군 수요 ③재개발 철거 늘어나 SUB TITLE END 수도권 전세시장이 들썩이고 있다. 연초만해도 하락세를 보이던 전셋값이 빠르게 상승하면서 경기 과천 서울 송파 등 버블세븐 지역을 중심으로 올초 대비 최고 30% 가까이 올랐다. 전셋값이 오르는 것은 신규 입주 물량이 부족하고 방학철 학군 수요가 겹친 데다 현 정부 들어 동시다발적으로 재개발이 추진돼 철거지역이 늘어나면서 전세 수요가 많아졌기 때문으로 분석된다. 전문가들은 하반기에도 신규 주택공급 물량이 적은 서울지역은 전셋값 상승이 지속될 것으로 보고 있다. 28일 부동산정보업체인 부동산114에 따르면 지난 24일 기준 서울지역의 전셋값은 올초에 비해 4.42% 경기도 1기 신도시 포함 는 2.24% 상승했다. 인천은 0.79% 떨어졌다. 특히 경기도 과천은 29.29%나 올라 최고 상승률을 기록했다. 서울 송파구와 서초구 강남구도 각각 18.28% 7.07% 5.78% 올랐다. 전셋값 상승은 기본적으로 부동산 시장 회복에 대한 기대감으로 집값이 오르고 있는 데다 신규 공급량이 부족하면서 생긴 현상으로 풀이된다. 강남권의 경우 지난해말까지도 잠실 재건축 단지의 입주가 대거 시작되면서 세입자를 구하지 못한 ‘역전세난’이 나타날 정도였지만 올해는 반포동 래미안 2400여가구를 제외하고는 신규 입주물량이 거의 없는 상황이다. 부동산114 김규정 팀장은 “시장 전망이 불확실해 전세 기간이 끝나도 집을 사기보다는 전세에 머물려는 수요가 많은 상황에서 상대적으로 공급량이 부족하다보니 가격이 오르고 있다”고 설명했다. 방학철을 이용해 강남 목동 등 인근 학교와 학원가로 옮겨가려는 ‘학군 수요’도 전셋값 상승에 한 몫 하고 있다. 일각에선 현 정부들어 도심 재개발 사업이 대거 추진되면서 철거지역에서 나온 전세 수요가 가격 상승으로 이어지고 있다는 지적도 나온다. 건설산업전략연구소 김선덕 소장은 “재개발이 2011년까지는 본격적으로 이뤄지기 때문에 여기저기서 집단 철거가 진행되고 있다”며 “정부는 내년 이주 철거물량을 5만 7만가구로 추산하지만 서울에서 이를 받아낼 입주 물량이 안 나온다는 게 문제”라고 말했다. 경실련 윤순철 정책실장은 “정부가 부동산 규제를 풀어 버블세븐 지역의 집값이 상승하면서 집값 상승에 대한 기대 심리가 전세시장으로까지 옮아붙은 측면이 있다”고 설명했다. 전문가들은 경기도의 경우 하반기에 판교 1만가구 입주 물량 등이 있어 안정될 여지가 있지만 서울은 전셋값 상승세가 가을 이사철까지 지속될 것으로 전망했다. 부동산써브 함영진 실장은 “서울지역은 지난해 4만가구 정도 됐던 공급량이 올해는 2만가구도 안돼 연말까진 전셋값 상승세가 지속될 것”이라고 내다봤다. 이주영기자 young78 kyunghyang.com 대한민국 희망언론 경향신문 구독신청 hp smile.khan.co.kr ⓒ 경향신문 경향닷컴 www.khan.co.kr 무단전재 및 재배포 금지 〈경향닷컴은 한국온라인신문협회 www.kona.or.kr 의 디지털뉴스이용규칙에 따른 저작권을 행사합니다.,https://news.naver.com/main/read.nhn?mode=LSD&mid=shm&sid1=260&oid=032&aid=0002022017,186
147662,2009.07.28. 오후 8:05,부동산,머니투데이,하반기 블루칩 은평2지구 분양 시작,머니투데이 조정현 MTN 기자 앵커멘트 하반기 최고의 유망 단지로 꼽히는 은평뉴타운 2지구가 내일 29일 청약 접수를 받습니다. 단지가 워낙 넓고 주택형이 다양해 어느 때보다 세심한 접근이 필요합니다. 조정현 기잡니다. 리포트 북한산 자락의 전원 도시 은평뉴타운 2지구가 분양을 시작합니다. 전체 천2백27가구로 3.3m²당 분양가는 9백90에서 천4백만 원 선에 책정돼 주변 시세보다 30% 이상 저렴합니다. 접수 일정은 다음 달 3일까지지만 상당한 시세 차익이 기대되는 만큼 내일 29일 1순위 마감 가능성이 높습니다. 전용면적 85m²이하의 경우 24회 이상을 불입한 청약저축 가입자가 1순위 대상잡니다. 85m²초과는 청약예금 가입자를 대상으로 가점제가 적용되지만 가구 수의 절반은 추첨제가 적용돼 뜻하지 않은 행운을 기대할 수 있습니다. 기자 스탠딩 이번에 공급되는 2지구 분양분은 구파발역과 북한산 자락을 따라 모두 8개 단지에서 선보입니다. 따라서 청약자들은 입지별 특성을 꼼꼼히 따져봐야 합니다. 가장 주목받는 곳은 2단지 두산위브와 6단지 동부센트레빌입니다. 구파발역과 가깝고 앞으로 조성될 중심상업지역과 지척이어서 관심이 높습니다. 역에서 멀더라도 북한산 조망이나 단지 특성에 따라선 인기가 높을 수 있습니다. 11단지엔 랜드마크형 건물이 들어서고 3단지엔 초등학교와 중학교가 조성됩니다. 인터뷰 강봉성 희망공인 대표 이쪽 2 4 6단지는 주로 젊은 분들이나 투자를 목적으로 하는 분들이 많이 찾고 북한산 쪽에 가까운 쪽은 주로 쾌적성이나 나이 드시 분들이 많이 찾고 있습니다. 고를 수 있는 주택형만 모두 73개 세부 입지를 파악하는 것도 빼놓을 수 없습니다. 공업고등학교의 위치를 비롯해 아파트와 지하 주차장의 연결 여부도 청약 대기자들에겐 모두 점검 대상입니다. 전문가들은 입지가 가장 좋은 2단지와 6단지의 경우 60점 후반에서 70점 상대적으로 입지가 떨어지는 단지도 40점대 후반의 당첨 가점을 형성할 것으로 예상하고 있습니다. 머니투데이방송 조정현입니다.,https://news.naver.com/main/read.nhn?mode=LSD&mid=shm&sid1=260&oid=008&aid=0002182860,186
147663,2009.07.28. 오후 8:03,부동산,머니투데이,소보원 호수 조망권 허위분양 분쟁조정 개시,머니투데이 조정현 MTN 기자 한국소비자원은 경기도 부천시 상동 BYC 위더스빌 주상복합 아파트에 대해 집단분쟁조정절차를 개시한다고 밝혔습니다. 이에 앞서 아파트 소유자 52명은 분양과 시공을 맡은 비와이씨가 당초 계약 내용과 다르게 호수 조망권을 확보하지 않았고 놀이터를 시공하지 않았다며 아파트 하자 보수와 손해배상 청구 를 제기했습니다. 소비자원 소비자분쟁조정위원회는 홈페이지 www.kca.go.kr 를 통해 오는 30일부터 다음 달 14일까지 소유자들의 분쟁조정 참가 신청을 받아 9월 중에 조정 결정할 예정입니다.,https://news.naver.com/main/read.nhn?mode=LSD&mid=shm&sid1=260&oid=008&aid=0002182859,186
147664,2009.07.28. 오후 8:01,부동산,머니투데이,서울시 정비구역지정 소요기간 6개월 단축,머니투데이 조정현 MTN 기자 서울 시내에서 정비구역으로 지정되는 시간이 최장 여섯 달 단축 됩니다. 서울시는 정비구역지정 소요기간 단축ㆍ개선방안 을 확정해 평균 228일이 걸렸던 지정 시간을 대폭 줄이겠다고 밝혔습니다. 이에 따라 2 3차례 심의를 거친 뒤에도 한달 넘게 기다려야 구역지정이 고시됐던 복잡한 절차가 간소화 됩니다. 서울시는 자치구와 합동으로 신청된 서류를 검토해 정비구역지정 소요기간 단축을 추진할 방침입니다.,https://news.naver.com/main/read.nhn?mode=LSD&mid=shm&sid1=260&oid=008&aid=0002182858,186
147665,2009.07.28. 오후 7:59,부동산,머니투데이,18억 펜트하우스 대출은 0원,머니투데이 김수홍 MTN 기자 앵커멘트 용인에서 지난 2007년 분양됐던 한 아파트 단지에서 가격 문제로 분양이 미뤄졌던 펜트하우스가 재분양에 나섭니다. 분양가가 무려 18억 원에 달하지만 중도금 대출은 전혀 받을 수 없다고 합니다. 김수홍 기자의 보돕니다. 리포트 2천 4백 세대 대단지 용인 수지의 래미안 동천입니다. 2007년 청약경쟁률 최고 192대 1로 성공적인 분양을 마쳤습니다. 금융위기 이후 분양가 아래로 떨어졌던 분양권 값은 회복세를 보여 최고 7천만 원까지 웃돈이 붙었습니다. 인터뷰 강찬기 용인동천동 공인중개사 분위기는 4월부터 반전이 됐죠. 4월부터 급매물이 소진되고 마이너스 피들이 빠지면서 프리미엄이 붙기 시작한 게 4월 말 경이요. 당시 36가구 펜트하우스는 일반 가구보다 3.3제곱미터 당 백만 원 가량 분양가를 높게 매겼다가 지자체 승인을 얻지 못해 분양을 하지 못했습니다. 입주가 다가오면서 건설사는 결국 일반아파트와 비슷한 가격인 3.3제곱미터 당 1811만 원에 29일부터 청약접수를 받습니다. 230에서 330제곱미터 초대형으로 14억 원에서 18억 원 선입니다. 2007년 당시와는 달리 양도세 100% 면제 혜택을 받을 수 있어 수요자의 관심이 높습니다. 하지만 실거주 목적이라면 청약 전 따져볼 게 많습니다. 건설사가 중도금 집단대출을 제공하지 않아 자금을 마련이 걸림돌입니다. 녹취 분양상담원 중도금 대출은 없고요. 개인적으로 마련하셔야 합니다. 펜트하우스이기 때문에 중도금 대출은 없습니다. 스탠드업 내년 5월 입주로 올해 안에 집값의 60%에 해당하는 중도금을 납부해야 합니다. 계약금까지 합하면 대출금 한 푼 없이 집값의 80%를 내야 하는 셈입니다. 개인적으로 은행을 찾는다 해도 최근 은행들이 대출심사를 엄격하게 하면서 돈 빌리기가 힘들어졌습니다. 녹취 공인중개사 상반기엔 대출이 쉽게 나왔잖아요. 지금 하반기 되서는 대출이 쉽게 안 나와요. 지금은 DTI 다 보잖아요. 은행에서 그래서 그게 제일 문제죠. 조금씩 살아나는 부동산경기 속에서 자금마련이 만만치 않은 고급 펜트하우스 투자자들의 어떤 평가를 받을 지 주목됩니다. 머니투데이방송 김수홍입니다.,https://news.naver.com/main/read.nhn?mode=LSD&mid=shm&sid1=260&oid=008&aid=0002182857,186
147666,2009.07.28. 오후 7:58,부동산,MBN,인터넷으로 전국 아파트 관리비 한눈에,앵커멘트 다음 달부터 전국의 모든 아파트 관리비를 인터넷을 통해 한눈에 알아볼 수 있게 됩니다. 아파트 관리비를 둘러싼 입주자와 관리 주체 간의 분쟁이 줄어들지 관심입니다. 윤석정 기자가 보도합니다. 기자 매달 적게는 수만 원에서 많게는 수십만 원에 이르는 아파트 관리비. 하지만 아파트 입주자 가운데 관리비가 구체적으로 어떤 항목으로 어떻게 쓰이는지. 또 관리비 수준은 적정한지 아는 사람은 그리 많지 않습니다. 인터뷰 이태숙 아파트 입주자 글쎄요. 저희는 그냥 관리비가 빠져나가니까 별로 모르겠어요. 아직은…. 이런 이유로 그동안 아파트 관리비를 둘러싼 입주자와 관리 주체 간 분쟁은 끊이질 않았습니다. 그러나 앞으로는 자신이 사는 아파트의 관리비가 언제 어떤 항목에서 얼마나 쓰였는지 알 수 있는 길이 열렸습니다. 정부가 주택법 개정을 통해 다음 달 4일부터 아파트 관리비를 인터넷을 통해 모두 공개하도록 한 겁니다. 공개 항목은 일반 관리비와 청소비 경비비 등 6개 공동 관리 항목이며 전기료나 수도료 등 개별 가구가 부담하는 항목은 공개 대상에서 제외됩니다. 관리사무소장이나 주택관리업체는 관리비를 매달 집계해 올려야 하며 만약 정당한 이유 없이 공개하지 않으면 과태료를 물게 됩니다. 관리비가 공개될 경우 관리비 운영이 투명해지고 불필요한 인상을 막을 수 있어 관리비를 둘러싼 분쟁은 이전보다 줄어들 전망입니다. 하지만 다른 아파트와 관리비를 비교할 수 있게 돼 적정한 관리비 수준을 놓고 또 다른 마찰이 빚어질 가능성도 배제할 수 없습니다. MBN뉴스 윤석정입니다.,https://news.naver.com/main/read.nhn?mode=LSD&mid=shm&sid1=260&oid=057&aid=0000107833,186
