,date,cat,co,headline,text,url,week
89723,2008.05.29. 오전 9:57,부동산,머니투데이,기본형건축비 3개월마다 조정,머니투데이 문성일 기자 국토부 자재가격 15%이상 변동시 적용 빠르면 다음달 말부터 건축자재가격이 15% 이상 오르거나 내릴 경우 현행 6개월 단위로 조정해 온 기본형건축비를 3개월 단위로 단축 운영한다. 국토해양부는 자재가 변동에 따른 기본형건축비 탄력 조정방안을 담은 공동주택 분양가격의 산정 등에 관한 규칙 개정안을 마련 이달 30일 입법예고한다고 29일 밝혔다. 개정안에 따르면 현재 6개월인 기본형건축비 조정 주기 전이라도 건축자재값이 15% 이상 등락하는 경우 3개월마다 건축비를 조정토록 했다. 현행 규정상 건축비 조정주기는 매년 3월과 9월 등 6개월로 공정돼 있어 자재가격이 단기간에 대폭 오르거나 내릴 경우 건축비와 실제 적용하는 가격간에 상당한 괴리가 있다는 지적이 제기돼 왔다. 규칙 개정안에는 별도로 정한 철근 레미콘 PHC파일 동관 등 4개 자재품목 46개 세부 품목 가격이 기본형건축비 고시후 3개월 동안 15% 이상 변동하는 경우 해당 단일 자재값을 고려 건축비를 조정할 수 있도록 했다. 이때 이들 4개 품목은 기본형건축비 산정에 활용한 품목 가운데 가격이 기본형건축비에서 1% 이상 차지하는 것으로 선정했다는 게 국토부의 설명이다. 국토부는 다만 이번 개정안이 발효되기 전에 분양승인을 신청한 주택에는 소급 적용하지 않기로 했다. 국토부 관계자는 이번 개정안 마련으로 자재값 상승기에는 주택공급 위축과 그에 따른 주택시장 불안을 예방할 수 있고 반대로 하락기에는 분양가 인하 효과를 조기화할 수 있을 것으로 기대한다 고 말했다. 국토부는 이번 규칙 개정안에 대해 오는 6월18일까지 입법예고 기간 중 다양한 이해관계자와 전문가 의견을 수렴하고 법제처 심사 등을 거쳐 6월 말이나 7월 초부터 시행할 예정이다.,https://news.naver.com/main/read.nhn?mode=LSD&mid=shm&sid1=260&oid=008&aid=0001989898,125
89724,2008.05.29. 오전 9:56,부동산,이데일리,웰빙단지 은평뉴타운 입주 가이드,2지구 177가구 오는 7월 분양 내년에도 1349가구 추가 분양 이데일리 윤도진기자 서울 은평뉴타운이 다음 달 1일 첫 집들이를 시작한다. 리조트형 생태전원도시를 목표로 하는 은평뉴타운은 은평구 진관동 일대 349만2421㎡에 들어선다. 전체 3개 지구 총 1만6172가구 중 이번에 입주를 시작하는 것은 1지구 4981가구다. 이 가운데서도 지난 4월 공사를 마친 1 12단지가 우선 입주를 시작하고 13 14단지는 오는 7월1일부터 집주인을 맞게된다. 입주기간은 각각 2달 간이다.,https://news.naver.com/main/read.nhn?mode=LSD&mid=shm&sid1=260&oid=018&aid=0001981599,125
89725,2008.05.29. 오전 9:50,부동산,아시아경제,철근·레미콘·PHC파일·동관 4개품목 단가인상,정부가 철근 레미콘 PHC파일 동관 등 분양가상한제의 기본형건축비 중 1% 이상을 차지하는 4개 자재품목에 대해 기본형건축비를 인상한다. 국토해양부는 현행 6개월인 기본형건축비 조정 주기 전이라도 건축자재 가격이 15%이상 변동하는 경우에는 건축비를 조정한다는 내용의 공동주택 분양가격의 산정 등에 관한 규칙 개정안을 마련 30일 입법예고한다고 29일 밝혔다.,https://news.naver.com/main/read.nhn?mode=LSD&mid=shm&sid1=260&oid=277&aid=0001985263,125
89726,2008.05.29. 오전 9:50,부동산,노컷뉴스,SK건설 정기 미니 음악회 개최,CBS경제부 정영철 기자 SK건설은 21일 서울 종로구 관훈동에 위치한 본사 사옥 1층 로비에서 ‘SK건설 정기 미니 음악회’를 개최했다고 밝혔다. ‘즐거운 봄 그 축제 속으로’라는 주제로 열린 아번 연주회에는 이윤정 기타리스트 외 3명의 연주자가 파헬벨 J. Pahelbel 의 캐논 Cannon 등을 40분간 연주했다. 이 달부터 시작된 ‘SK건설 정기 미니음악회’는 SK건설 사옥에서 매월 열린다. SK건설측은 “클래식 팝 재즈 가요 국악 등 매 공연마다 다양한 장르를 선보일 것”이라고 말했다.,https://news.naver.com/main/read.nhn?mode=LSD&mid=shm&sid1=260&oid=079&aid=0001965674,125
89727,2008.05.29. 오전 9:48,부동산,세계일보,오세훈 시장 “뉴타운 수정 불가피”,오세훈 서울시장 사진 은 28일 “전임 시장 이명박 대통령 이 해놓은 것을 바꾸는 것이 조금 불경스럽기는 하지만 뉴타운 사업을 수정해야 한다”며 기존 입장을 재확인했다. 오 시장은 이날 서울 소공동 조선호텔에서 한국외국어대 총동문회 주최로 열린 ‘제8회 세계외대 미네르바 포럼’의 ‘서울을 디자인하라 ’는 주제 강연에서 이같이 말했다. 오 시장은 지난 4·9총선의 뉴타운 공약 논란을 거론하며 “그때 제가 고집을 좀 피웠다”면서 “훗날 ‘그렇게 한 덕분에 이만 한 도시에서 살고 있다’는 이야기를 듣게 될 것”이라고 강조했다. 이어 “기존 서울시 뉴타운 사업을 180도 완전히 바꾸기는 어렵겠지만 수정을 해야 한다”며 “현재 뉴타운 검토 작업을 진행하고 있다”고 덧붙였다. 오 시장은 이에 앞선 지난달 21일 기자설명회에서 “현재 방식으로 뉴타운 사업이 추진될 경우 5년 내에 서울 주거환경의 80% 가까이가 아파트 일변도로 변한다는 점에서 성찰과 보완책이 필요한 시점”이라고 밝힌 바 있다. 이에 따라 학계와 시민단체 전문가 18명으로 구성된 자문단은 29일 첫 회의를 열고 전반적인 주거 정책 재검토 작업에 들어갈 예정이다. 이귀전 기자 ⓒ 세계일보＆세계닷컴 www.segye.com 저작자표시 비영리 변경금지 세계닷컴은 한국온라인신문협회 www.kona.or.kr 의 디지털뉴스이용규칙에 따른 저작권을 행사합니다.,https://news.naver.com/main/read.nhn?mode=LSD&mid=shm&sid1=260&oid=022&aid=0001962428,125
89728,2008.05.29. 오전 9:46,부동산,노컷뉴스,2008 자이 디자인 피에스타 수상작 발표,CBS경제부 박종환 기자 GS건설은 2008 자이 디자인 피에스타 2008 Xi Design Fiesta 공모전에서 Drama City 노지현 씨 외 1명 인하대 가 대상으로 선정됐다고 29일 밝혔다. 이 작품은 좁은 공간에서의 삶을 ‘움직임’과 ‘빌트인’ 두 가지의 개념을 통해 해석한 작품으로 주거공간이 커다란 제품 또는 상품으로 정리된 부분이 흥미로웠다는 평이다. 또 우수상으로는 iSTRAP 강태욱 씨 외 1명 연세대 ㎥ 박세윤 씨 외 1명 콜롬비아대 Nostalgic Interface 이승택 씨 외 2명 하버드대 고려대 의 작품이 선정됐다. 대상팀에게는 상패와 상금 1 500만 원 우수상팀에게는 상패와 상금 500만 원 입선팀에게는 상장과 지원금 100만 원이 주어진다. 이번 공모전에는 국내 및 해외에서 모두 1 000여 개 작품이 응모했다.,https://news.naver.com/main/read.nhn?mode=LSD&mid=shm&sid1=260&oid=079&aid=0001965670,125
89729,2008.05.29. 오전 9:43,부동산,머니투데이,전세계 상업용 부동산 수요 4년만에 첫 감소,머니투데이 김유림 기자 글로벌 신용위기와 경기 둔화로 1분기 상업용 부동산 임대 수요가 4년만에 첫 감소세를 보였다고 영국 왕립공인중개인협회 RICS 가 밝혔다. 블룸버그통신에 따르면 RICS는 28일 현지시간 경기 악화와 임대 비용 상승 등으로 1분기 상업용 부동산 수요가 4년만에 처음으로 감소했다 고 발표했다. 올리버 길마틴 수석 이코노미스트는 지난해부터 시작된 신용위기의 늪을 빠져나갈 수 있었던 시장은 거의 없었다 며 선진 시장에서 시작된 수요 위축이 이머징마켓으로까지 확대됐다 고 말했다. RICS는 전반적인 침체 속에서도 상대적으로 견조했던 곳은 두바이와 도하 등 중동 경제 중심지였다고 밝혔다.,https://news.naver.com/main/read.nhn?mode=LSD&mid=shm&sid1=260&oid=008&aid=0001989884,125
89730,2008.05.29. 오전 9:42,부동산,경향신문,‘땅땅’거리는 불패 40년 땅투기도 진화한다,투기과열지구인 판교신도시의 지반공사 장면. 부동산 투기는 ‘부동산 불패’ 신화에서 형성된다. 부동산 불패의 믿음은 어제 오늘 만들어진 것이 아니다. 1967년 우리나라 최초의 부동산 정책인 ‘부동산 투기 억제에 관한 특별조치법’ 서울과 부산의 부동산 양도 때 무조건 차액의 50%를 부과 이후 40년 동안 투기와의 전쟁이 계속됐지만 오히려 투기는 시장에 버젓이 존재하고 있다. 앞으로도 투기없는 부동산을 기대하기 힘들다는 푸념이 나올 정도다. 왜 그럴까. 정부는 경기부양을 위해 주택과 부동산을 주로 이용하다 수출 호재 등으로 투기가 과열되면 비상대책을 들고 나오기를 반복했다. 그 사이 정부 정책에 대한 신뢰는 물론 거래투명성까지 떨어졌고 그 결과 사회 고위층과 재벌이 독점했던 부동산 투기는 점점 중산층까지 확대돼 왔다. 이와 더불어 투기의 방법도 다양해졌다. 개발정보를 미리 빼내 땅을 사던 수법은 고전이 됐다. 투기꾼들은 각종 정부 정책을 그럴듯하게 포장해가며 스스로 개발호재 지역을 만들기도 하고 알박기 지분 쪼개기 등 제도적 허점을 비집고 다양한 투기수법을 생산해내고 있다. 투기의 시작 복부인 현대적 의미의 국내 부동산 투기 역사는 산업화의 신호탄이기도 했던 경부고속도로 착공이 그 시발점이다. 현재까지 투기의 현장이 판교 용인 동탄 등 경부고속도로 라인에 집중되어 있는 것을 보면 경부고속도로가 갖는 상징성은 크다. 67년 11월 제3한강교 한남대교 남단이 경부고속도로의 기점으로 결정된 후 현재의 서울 서초구 양재동 부근인 말죽거리에서 땅값 폭등은 시작됐다. 온통 논밭이던 말죽거리는 영동 영등포 동쪽이라 해서 생긴 지역명 개발계획이 발표되자 “말죽거리에 땅을 사면 떼돈을 번다”는 소문이 돌면서 강북의 돈 있는 사람들이 몰리기 시작했다. 강북에서 동작동 국립묘지까지 버스를 이용하고 말죽거리까지는 걸어가야 했던 시절이지만 말죽거리 복덕방에는 매일 수십명이 북적거렸다. 말죽거리에서 시작된 땅값 폭등은 강남 전역으로 확산됐으며 미등기 전매를 일삼는 투기가 성행하기 시작했다. 66년 초 신사동 일대는 전기도 전화도 없는 허허벌판으로 땅값은 1평에 200원 정도였다. 1년 후에는 1평에 3000원을 넘어섰으며 71년 전반에는 강남의 땅값이 평당 1만4000 1만6000원에 달했다. ‘투기부인’이란 신조어가 생겼고 나중에 부동산 중개업소를 가리키는 복덕방에서 따온 ‘복부인’이라는 말로 바뀌었다. 복부인의 활약은 70년대 두드러진 현상이었다. 이들은 70년대 중반 서울 용산구 이촌동 강남 영동·잠실 등의 아파트와 땅 투기에 열을 올리며 투기세력의 대명사로 자리잡게 됐고 지금은 국어사전에까지 오른 일반명사가 됐다. 이들은 75년 영동·잠실 등에서 아파트가 대량으로 분양되자 본격적인 활동을 시작했다. 당시에는 선착순 분양에다 1가구 1주택 등 청약 관련 제한이 없었다. 또 계약을 해지해도 건설업체들이 관례적으로 계약금을 돌려줬으므로 웃돈이 많이 붙지 않는 호수에 당첨되면 계약을 해지할 수도 있었기 때문에 돈을 최대한 끌어다 여러 채를 청약하는 일이 다반사였다. 복부인들이 달려든 곳이 바로 이런 신규 아파트 단지와 개발이 예정돼 있는 지역 주변의 토지였다. 1. 투기바람이 한창이던 70년대 투기지역에 밀집한 철새 부동산가. 2. 부동산 투기꾼들의 발길이 끊이지 않던 70년대 복덕방 풍경. 3. 70년대 중반 강남 영동·잠실 등의 아파트와 땅투기에 열을 올렸던 복부인들. 4. 부동산 투기근절 대책을 요구하는 시위를 벌이는 경제정의실천시민연합 회원들 권력형 투기의 전성시대 빨간 바지 80년대 정부는 아파트로 경기를 부양하면서 투기를 부추겼다. 81년 정부는 해방 후 처음으로 서울의 녹지를 풀어 택지로 개발하는 사업을 벌였다. 강남구 개포동 일대. 광주 민주화운동으로 사회가 뒤숭숭해지자 강남 개발을 경기부양의 수단으로 삼은 것이다. 게다가 장영자 어음사기 사건 82년 과 금융실명제 추진 움직임이 부동산 시장을 달궜다. 88서울올림픽을 전후로 국제수지 흑자 등에 힘입어 시중자금이 넘쳐나던 80년대 말 복부인들이 다시 부동산시장에 모습을 드러냈다. 이때 복부인을 상징하는 ‘빨간 바지’라는 말이 생겨 유행처럼 번졌다. 당시 땅투기로 이름을 날렸던 고위층 부인들이 즐겨 입고 다니던 바지 색깔에서 비롯된 말이다. 이처럼 전국의 택지 예정 및 도로 건설지를 대상으로 군장성 부인 등 투기세력들은 동·서·남해안 일대와 심지어 섬지역의 논·밭·임야를 가리지 않고 닥치는 대로 사들인 뒤 단기간에 미등기 전매하는 수법으로 막대한 차익을 챙겼다. 대규모 신도시가 개발되고 있는 화성·판교 지역도 80년대부터 수도권 신도시 개발후보지로 지목돼 오면서 이미 90년대에 ‘거물 외지인’들의 투자가 집중됐다. 특히 정치인 등 고위층은 80년대 초반부터 본격적으로 이 지역 토지를 매입했다. 93년 문민정부에서 시작된 공직자 재산공개 이후 많은 행정부·사법부의 장·차관급 인사들과 국회의원 군 장성들이 투기성 불법·탈법 부동산 거래와 보유가 밝혀져 옷을 벗었다. 이후에도 2000년 제정된 인사청문회법에 따라 총리 등 고위공직자들이 국회에서 청문회를 거칠 때마다 빠짐없이 등장하는 항목도 부동산 투기 관련 의혹이었다. 고위공직자 검증때 부동산 투기가 매번 메뉴로 등장하는 것도 이 때문이다. 전문화·기업화한 투기 기획부동산·떴다방 고위층에 머물던 부동산 투기는 90년대 들어서며 기업화·전문화됐다. 외환위기로 초토화된 부동산 시장 활성화를 위해 분양권 전매제한이 폐지된 98년 이후에는 분양권 전매와 청약통장 거래를 전문적으로 알선하는 일명 ‘떴다방’이 활개를 치기 시작했다. 99년 초 3700여가구 분양에 8만명의 인파가 몰린 구리 토평지구의 한 모델하우스 주변에는 파라솔에 ‘청약통장 상담환영’ 등의 플래카드를 내건 떴다방 수십개가 호객행위로 실랑이를 벌이는 등 극심한 과열양상을 보였다. 2002년 초 서울 강남구 도곡동에 지어질 한 주상복합아파트 모델하우스에서는 선착순 분양계약일을 1주일 앞두고 대형 떴다방 3개가 주변을 선점한 채 아르바이트 학생들을 풀어 24시간 줄을 세웠다. 하루 뒤부터 떴다방이 자체 발행한 대기표가 장당 20만 30만원에 거래되기 시작하더니 1주일 뒤인 분양계약일에는 대기표 장당 가격이 최고 450만원까지 치솟는 기가 막히는 현상까지 생겼다. 몇 년 전부터는 특정 지역에 대한 그럴듯한 개발소문을 흘린 뒤 헐값에 사들인 땅을 쪼개서 비싸게 팔아넘기는 이른바 ‘기획부동산’도 기승을 부리고 있다. 주로 강남 일대에 밀집한 기획부동산 업자들은 ‘XX육림조합’ 등의 상호를 내걸고 무작위로 전화를 걸어 특정지역의 개발호재를 내세워 큰 시세차익을 거둘 수 있다며 부동산 투자를 권유한다. 대규모 택지개발이 잇따르자 최근 집지을 땅이 고갈되면서 ‘알박기’도 기승을 부렸다. 알박기란 주택업체가 아파트를 짓기 위해 매입하려는 땅 가운데 일부를 선점해 비싼 값을 받고 되파는 방식을 말한다. 사업 진행을 위해 땅을 매입해야 하는 약점을 이용 수십배의 매매차익을 거둔다. 진화하는 투기 지분쪼개기·유령상가·축산투기까지 지난해 분당급 신도시로 경기 화성시 동탄 일대에 동탄2신도시가 지정됐다. 신도시 지정 발표 전후에 온통 논밭으로 둘러싸인 이곳에는 상권에 어울리지 않는 스키 대여점 화방 불교용품점 옷 수선점 등이 급증했다. 영업행위도 않는 이들 상가는 전형적인 보상을 노린 유령상가였다. 건물을 지으면 논이나 밭으로 보상받을 때보다 훨씬 많은 돈을 받을 수 있다는 점을 노린 것이다. 동탄지역의 투기가 기승을 부리자 국세청 등 관계기관이 단속을 벌였다. 당시 단속 관청은 다양한 투기 행태에 혀를 내두를 정도였다. ‘통물건’ ‘껍데기’ ‘막차 태워 시집 보내기’ 등 다양한 은어들이 세상에 알려졌다. 원주민 소유의 주택을 매매할 때 보상금과 입주권 모두를 매매 대상으로 하면 ‘통물건’이라고 하고 이면계약을 통해 보상금은 투기세력이 가지는 대신 입주권만 매매 대상으로 하면 ‘껍데기’라는 용어가 사용된다. 또 ‘돌려치기’는 오피스텔 등의 분양권 매매 의뢰를 받은 중개업자가 투기꾼들과 사고팔기를 반복하면서 계속 가격을 올리는 것을 말하고 이런 방법으로 가격이 상승한 분양권을 실수요자에게 파는 것이 ‘막차 태워 시집 보내기’다. 최근에는 지분쪼개기가 유행처럼 번지면서 새로운 투기수법으로 부각됐다. 도심의 재개발을 통해 주택공급을 늘리겠다는 이명박 정부가 들어서자 서울의 용산과 마포 성동구 등 뉴타운과 재개발 후보지역에서 기승을 부리고 있다. 지분쪼개기란 뉴타운 등 재개발지역에서 다가구주택 1인 소유 등기 을 부수고 다세대주택 여러명이 등기 으로 신축하는 행위를 말한다. 주택지분 소유자 모두에게 아파트 입주권이 주어지는 점을 노리는 것이다. 이러한 지분쪼개기는 서울시가 노후지역 내 다세대주택 건축허가를 제한하자 상대적으로 규제가 덜한 오산 김포 등 경기지역으로 옮겨가고 있다. 지분쪼개기가 성행하면 해당지역의 건축노후비율이 떨어지고 재개발 조합원 수가 불어나 재개발사업이 지연되거나 채산성이 악화될 수 있다. 최근 인천 용현·학익지구에서 1조원대 도심재개발 사업이 중단된 게 대표적인 사례다. 사업 초기 250명이던 토지 소유자는 지난해 10월 566명으로 늘었다가 최근 1500명 이상으로 급증했다. 특히 집주인만 448명에 달하는 82㎡짜리 단독주택까지 등장했다. 최근엔 근린상가 오피스텔을 신축해 지분을 쪼개는 신종 수법까지 등장했다. 조류 인플루엔자 AI 가 서울까지 확산되면서 국민들의 불안이 가중되고 있는 상황에서 신종 축산투기까지 적발됐다. 서울시가 AI 확산을 막기 위해 지난 6 7일 이틀간 서울지역 조류를 전수 조사한 결과 서울 송파구 문정·장지지구에 서울시 사육 조류의 43%에 해당하는 8175마리가 송파구 문정도시개발사업지구 한 곳에 집중적으로 몰려 있었다. 문정지구엔 법조단지와 미래형 업무단지가 들어설 예정으로 현재는 비닐하우스가 촘촘히 들어서 있다. 이들이 서울 한복판에서 갑자기 가축을 키우기 시작한 것은 축산농가로 인정받아 택지개발에 따른 손실을 보상받고 상가 입주권 등을 받기 위해서였다.,https://news.naver.com/main/read.nhn?mode=LSD&mid=shm&sid1=260&oid=032&aid=0001958464,125
89731,2008.05.29. 오전 9:36,부동산,헤럴드POP,분양가상한제 유명무실…내달부터 줄줄이 인상 전망,다음달부터 아파트 분양가 인상을 위한 제도가 잇따라 도입된다. 이에 따라 민간아파트의 가격 거품을 빼기 위해 9년 만에 재도입된 분양가상한제가 본격 시행되기도 전에 유명무실해지고 있다는 지적이 나오고 있다. 29일 국토해양부는 다음달부터 철근 레미콘 PHC파일 동관 등 4개 품목의 건설 자재가격이 ‘기본형 건축비 고시 후 3개월 동안 15% 이상’ 변동하면 건축비에 곧바로 반영해 주는 ‘단품슬라이딩제도’를 도입할 계획이라고 밝혔다. 단품슬라이딩제도는 자재가격을 반영해 6개월마다 건축비를 조정하는 것과 달리 가격이 급등한 폼목은 3개월 만에 건축비에 반영해주는 제도를 말한다. 이에 따라 지난 3월 1일자로 고시된 기본형 건축비 중 3개월 새 가격이 15% 이상 오른 품목은 오는 9월까지 기다리지 않고 6월부터 바로 건축비에 반영된다. 6월부터 단품슬라이딩제도가 도입되면 이후 입주자모집 승인신청을 하는 주택부터 분양가를 올려받을 수 있게 된다. 또 9월부터는 소비자만족도가 높은 업체가 분양하는 주택의 분양가가 높아진다.이를 위해 국토부는 이달 말까지 주택업체로부터 소비자만족도 평가 신청을 받고 있으며 다음달부터 입주자들을 대상으로 조사에 착수해 8월 중에 신청업체 중 최대 10%를 우수업체로 선정할 예정이다. 우수업체로 선정되면 9월 1일 이후 입주자모집 승인신청을 하는 주택의 경우 지상층 건축비의 1%를 분양가에 추가할 수 있다. 이와 함께 주상복합아파트의 경우도 9월 1일부터 분양가가 오른다. 국토부는 일반 아파트보다 많은 공사비가 들어갈 수밖에 없는 특수성을 감안해 9월 1일부터 주상복합의 가산비를 올려줄 계획이다. 이처럼 분양가 인상 요인이 점진적으로 나옴에 따라 분양가상한제가 제대로 시행해 보기도 전에 도입 취지가 무색해지고 있다는 지적이 나오고 있다. 민간아파트에 분양가상한제를 도입키로 한 주택법 개정안은 작년 9월부터 시행에 들어갔지만 10개월이 지난 현재까지 분양가 상한제가 적용되는 주택이 아직 본격적으로 나오지 않고 있다.,https://news.naver.com/main/read.nhn?mode=LSD&mid=shm&sid1=260&oid=112&aid=0001945922,125
89732,2008.05.29. 오전 9:32,부동산,이데일리,제2영동고속도로 내년초 착공,이데일리 윤진섭기자 경기도 광주와 강원도 원주를 연결하는 제2영동고속도로가 내년 초 착공에 들어간다. 국토해양부는 이달 30일 제이영동고속도로㈜와 광주 원주간 56.95㎞의 제2영동고속도로 건설을 위한 민간투자사업 실시협약을 체결한다고 29일 밝혔다. 이번 협약 체결에 따라 연내 실시계획 승인을 거쳐 2009년 1월 착공 2013년 완공할 예정이다. 광주시 초월읍과 원주시 가현동을 잇는 제2영동고속도로는 준공시 소유권을 국가에 귀속하고 30년간 운영하는 BTO 수익형 민자사업 방식으로 추진된다. 총 투자비 1조3813억원을 투입하는 이번 사업에는 한국인프라이호투융자회사 25% 한국산업은행 15% 우리은행 10% 국민연금관리공단 8% 사립학교 교직원연금관리공단 7% 현대건설 000720 4% 등이 지분 참여한다. 제2영동고속도로가 개통될 경우 인천대교 2009년 완공 안양 성남고속도로 2013년 완공 성남 장호원 국도 2011년 완공 영동고속도로 원주 강릉 와 연결돼 강릉에서 인천공항까지 2시간50분 소요되는 최단거리 252㎞ 동서 고속도로망이 완성된다는 게 국토부의 설명이다. 중부고속도로 하남 분기점에서 원주까지는 기존 영동고속도로 이용시보다 15㎞ 101㎞→86㎞ 가 단축 소요시간이 23분 77분→54분 가량 줄어드는 등 연간 1800억원의 물류비 절감이 가능할 것으로 분석했다. 통행요금은 광주 원주간 이용시 3300원 2004년 6월 불변 기준 으로 책정할 예정이다. 국토부는 초기 민자도로사업과는 달리 정부에서 최소 운영 수입 보장을 하지 않기로 협약을 체결 통행량 부족시에도 별도의 지원금을 주지 않을 방침이다.,https://news.naver.com/main/read.nhn?mode=LSD&mid=shm&sid1=260&oid=018&aid=0001981581,125
