,date,cat,co,headline,text,url,week
311120,2012.05.10. 오후 12:06,부동산,헤럴드경제,2012 여수세계박람회 남도 끝자락서 펼쳐지는 지구촌 ‘꿈의 잔치’,저녁마다 90여회 환상의 공연 세계최대 파이프오르간 설치 스카이타워 주최국 전시관·국제관 등 볼거리 다양 여수의 수려한 경관 세계인 눈앞에… 여수 앞바다의 수려한 경관이 세계인의 눈앞에 펼쳐진다. 8월 12일까지 93일간 다양한 눈요기와 체험 콘텐츠가 쉴새없이 쏟아질 2012 여수엑스포가 12일 막을 연다. 이번 엑스포 행사장은 ‘살아있는 바다 숨쉬는 연안’이라는 큰 주제 아래 총 80개의 전시실로 꾸며진다. 105개국이 참석한 가운데 각국의 문화를 보여주는 다양한 전시물이 공개되는 동시에 이들 국가와 공동 협력을 통해 기후 변화에 대응하고자 하는 노력이 진행될 예정이다. 연영진 국토해양부 해양정책국장은 “육지 공간 부족 및 자원 고갈 환경오염 등의 문제를 바다에서 해결할 수 있다는 가능성에 대해 그간의 기술성과를 공유하고 미래를 열어가자는 국제사회의 협력의 장이 될 것”이라고 엑스포의 의의를 설명했다. 여수세계박람회가 ‘살아있는 바다 숨쉬는 연인’이라는 주제로 12일부터 93일간 펼쳐진다. 박람회에서 최고의 볼거리를 제공할 ‘빅오 Big O ’쇼 예행연습이 펼쳐지고 있다. 여수엑스포는 올림픽 이상의 국격 향상 효과가 있을 것이란 기대감도 크다. 1993년 대전엑스포 개최 이후 20년 만에 다시 여는 엑스포를 통해 그간 이뤄온 대한민국의 발전상을 보여주는 한편 해양문제에 있어 주도권을 갖고 임할 수 있는 기회가 될 것이란 분석이다. 엑스포 개최를 통한 생산유발 효과만 12조2000억원에 이르고 고용창출이 7만9000명 부가가치 유발 규모가 5조7000억원에 이르는 등 국가 및 지역경제 활성화에 기여하는 바도 크다. 특히 여수시와 더 나아가 남해안 일대 지역에 대한 국민 인식을 새롭게 하는 데도 큰 효과가 있을 것으로 보인다. 목포에서 울산에 이르는 남해안 벨트를 수도권에 대응하는 성장거점으로 육성하겠다는 국가적 프로젝트도 마련된 상황이다. 엑스포 개최에 앞서 여수시민이 “여수가 천지개벽했다”고 얘기할 정도로 그동안 이 지역에 인프라 투자가 적었던 것도 사실이다. 이번 엑스포 이후 최첨단 해양교통 수단 일류 조선기술 차세대 해양관광업 해양 바이오산업 등에 대한 투자가 적극적으로 이뤄질 것이란 기대감이 크다. 여수 오동도 인근 엑스포장에 들어선 각각의 전시실에서부터 그런 기대감을 엿볼 수 있다. 세계적 디자이너가 참여해 건설한 시설물은 절묘하게 바다와 어우러져 아름다운 모습을 연출한다. 행사장의 랜드마크 역할을 하는 ‘빅오 The Big O ’ 세계 최대의 파이프오르간이 설치된 스카이타워 여수엑스포역에서부터 천연색의 대형 화면으로 손님맞이를 하는 엑스포디지털갤러리 등을 비롯해 주최국 전시관 국제관 기업전시관 등 다양한 볼거리로 꾸며졌다. 거기엔 첨단 IT기술과 감성을 접목한 전시물이 관람객의 눈길을 사로잡을 채비를 하고 있다. 태양열ㆍ해수열ㆍ수소전지 시스템 등 신재생에너지가 어떻게 활용되고 있는지 알아보는 것도 전시실을 둘러보는 가운데 맛보는 색다른 경험이 될 것이다. 저녁마다 매일 90여회에 이르는 공연을 포함해 총 8000여 차례에 이르는 공연을 찾아다니는 재미도 쏠쏠하다. 백웅기 기자 kgungi heraldm.com 오늘의 인기기사 고영욱 성관계 혐의 인정...처벌수위는 신수지 완벽 옆태 ‘관심 폭발’…“콜라병 몸매” 日 NHK 글래머 女아나 스기우라 유키 ‘시청률 제조기’ 화제 이건희 회장이 놀랐다 그리고 울었다.,https://news.naver.com/main/read.nhn?mode=LSD&mid=shm&sid1=260&oid=016&aid=0000418017,331
311121,2012.05.10. 오후 12:01,부동산,머니투데이,權국토장관 주택관련 규제 다 풀었다,머니투데이 최윤아 기자 5·10대책 권도엽 국토해양부 장관 브리핑 일문일답 권도엽 국토해양부 장관 사진 은 10일 주택거래 정상화 및 서민·중산층 주거안정 지원방안 중 서울 강남3구 강남·서초·송파 투기지역 해제와 관련 투기지역은 가격이 급등하거나 과열될 우려가 있는 경우 지정하는 것으로 현재는 그 여건이 바뀌었다 며 이런 상황에서 거래가 침체되는 쪽으로 가고 있어 가격 과열기에 도입된 규제를 모두 걷어낸다는 차원에서 해제했다 고 설명했다. 5·10대책에 DTI 총부채상환비율 완화가 빠진 이유에 대해선 금융과 관련된 규제는 주택시장만 보고 판단하기 어려운 문제 라며 가계부채 부분을 고민할 수밖에 없었다 고 말했다. 이어 지난 12·7대책 발표 후 상당한 거래 활성화 효과가 있었지만 이후 대내·외적인 여건 변화로 최근 다시 거래가 침체되고 있다 면서 이번에 발표된 각종 규제 완화와 세제상 대책이 시장 정상화 기여 할 것으로 본다 고 덧붙였다. 다음은 권도엽 장관 박상우 국토해양부 주택토지실장 백운찬 기획재정부 세제실장 고승범 금융위원회 금융정책장 등과의 일문일답. DTI규제 완화가 빠진 이유와 강남3구 투기지역 해제의 배경은 권 장관 투기지역은 가격이 급등하거나 과열될 우려가 있는 경우 지정하는 것인데 시장 침체로 지정 요건에서 벗어난 지 이미 오래됐다. 이 와중에 거래가 침체 되는 쪽으로 가고 있어 주택 시장 과열기에 도입된 규제를 걷어 낸다는 차원에서 시행했다. 이번 조치를 통해 주택 거래와 관련된 규제들은 대부분 다 없어지는 셈이 된다. 금융규제는 주택시장만 봐서 판단하기 어려운 부분이 있다. 가계부채 문제를 정부로선 고민할 수밖에 없었다. 최근 거래부진의 근본적 이유는 구매력 약화보다는 집값 상승에 대한 불확실성이다. 이 상황에서 과연 이번 대책이 실효성이 있을 것으로 보나. 효과는 없으면서 가계부채 문제만 키우지 않을까. 권 장관 금융관련 규제는 큰 틀에서 손 댄 것이 없다. 지난 12·7대책 발표 후 상당한 거래 활성화 효과가 있었지만 그 이후에 대내·외적인 여건 변화로 최근 다시 거래가 침체되고 있다. 각종 세제상 규제 완화로 시장 정상화 기여 할 것으로 본다. 1대 1 재건축규제 완화가 나온 배경은 박상우 실장 재건축시 기존 주택 면적 증가범위를 기존 10%에서 확대하는 정책이다. 과거 대형 아파트에 대한 재건축 가능성을 제한하기 위해 10%로 규제를 뒀는데 이번에 이것을 풀기로 했다. 다만 기존 어느 정도로 규제를 풀 지에 대해서는 5월 중 결론을 낼 것이다. 이 같은 대책이 재건축 아파트 거래활성화에 기여할 것으로 기대한다. 총선 이전에 얘기가 나왔던 전·월세상한제 주택바우처는 이번에 검토하지 않았나 박상우 주택토지실장 이번 대책 목표는 거래활성화를 통한 서민 주거 안정이다. 전월세 가격은 현재 안정적이고 하반기에도 현 상황이 유지될 것이라는 전망이다. 계약기간을 2년에서 4년으로 늘리는 전월세 상한제에 대해서는 부작용 우려 때문에 신중해야 한다는 생각이다. 한정된 재원을 사용해야 하기 때문에 주택바우처보다는 LH·SH공사 등을 통한 직접 공급에 더 무게중심을 두고 있다. 지난 12·7대책도 소득세법 개정 부분이 결국 국회에서 막혔다. 이번 대책의 국회 통과 가능성은 얼마나 높다고 보나 백운찬 기획재정부 세재실장 이번 대책 중 법률 개정이 필요한 부분은 2가지다. 다주택자 중과세율 폐지와 주택 양도세율 인하다. 아직 야당과 구체적인 협의 안 된 상태지만 19대 국회에서 빠른 시일 내 실행될 수 있도록 하겠다. 1세대 1주택 양도세 비과세 보유기간 완화와 일시적 1세대 2주택자에 양도세 비과세기간 연장은 시행령으로 추진할 수 있다. 6월 하순에 실행할 수 있도록 추진하겠다. DTI 추가 논의 가능성 있나 고승범 금융위원회 금융정책장 DTI는 금융회사의 건전성과 개인 보호를 위한 것으로 부동산 정책으로 활용하는 것은 현 상황에서 불가능하다. 가계부채 문제 때문이다. 완화하는 게 현재로선 어렵고 추가로 문제를 논의할 가능성도 없다.,https://news.naver.com/main/read.nhn?mode=LSD&mid=shm&sid1=260&oid=008&aid=0002839428,331
311122,2012.05.10. 오후 12:01,부동산,조선비즈,5.10부동산대책김샜다 실망 강남 3구는 되레 썰렁,서울 강남의 주요 재건축아파트 단지인 반포 주공1단지 전경 정부가 꽁꽁 얼어붙은 부동산시장을 회복시키기 위해 ‘강남 3구의 투기지역 해제’ ‘분양권 전매제한 완화’등의 5·10 대책을 내놨지만 부동산 시장의 반응은 뜨뜻미지근하다. 대출규제완화 취득·등록세 감면 등 직접적으로 시장에 영향을 줄 수 있는 내용은 빠진 탓이다. 10일 정부의 5.10 부동산 대책이 발표됐지만 서울 강남 3구 일대 부동산 시장의 반응은 시큰둥하다. 이 일대 공인중개사들은 대책에 따른 효과는 이미 가격에 반영된 만큼 시장에 영향은 제한적일 것으로 내다봤다. 취득·등록세 감면 등 추가 대책을 요구하는 목소리도 높다. 서울 서초구 잠원동 인근의 S 공인중개사 관계자는 “부동산 대책 발표를 앞두고 급매물이 사라지고 매수문의가 들어오고 계약이 체결되는 게 보통인데 이번은 전혀 그렇지 않다”면서 “화끈한 대책을 기대했던 주민들 사이에 김빠졌다 는 소리가 나온다”고 말했다. 서울 강남구 개포동 K 공인중개사 관계자는 “발표 전에 매수 문의가 조금 오는 것 같더니 계약까지 이어지진 않았다”면서 “투기지역에서 해제된 것은 거래가 조금 편리해지게 됐다는 것 말고는 별 뜻이 없다”고 말했다. 취득·등록세 완화 총부채상환율 DTI 등 대출규제 완화 등이 대책에서 빠진 것에 대한 불만의 목소리가 컸다. 송파구 잠실동 일대 A 공인 관계자는 “실질적으로 거래에 도움이 될 만한 DTI 규제 완화 취 등록세 감면이 빠졌다”면서 “분위기가 나아질 것으로 보이지 않는다”고 전망했다. 서울 송파구 잠실동 S 공인중개사 “미리 정보 나온 것에 비해서 특별해진 것도 없고 해서 다들 실망한 분위기”라면서 “5단지는 재건축 이슈도 있고 취득세가 비싸고 해서 취득세 감면 재건축 초과 이익환수제 완화 같은 대책 정도가 나와줘야 시장이 활기를 띨 것 같다”고 말했다. 잠원동 일대 또 다른 공인중개사인 H공인 관계자는 여기는 재건축 단지가 몰려 있어서 재건축 초과 이익환수제 완화나 다주택자 양도세 중과폐지 같이 국회에 있는 문제들이 해결돼야 시장이 움직일 것 이라며 이 정도 약한 대책으로는 심리가 살아날 거 같지 않다 고 말했다. 개포동 T 공인 관계자는 “여기는 지금 개포2단지 소형평형 30%대로 늘려서 통과된 거에 집중하고 있지 부동산 대책 자체에는 관심이 없다”면서 “박원순 시장이 방문한 이후 아파트 값이 조금 오르는가 싶더니 최근 거래가 뜸하면서 급매물이 나올 조짐”이라고 말했다.,https://news.naver.com/main/read.nhn?mode=LSD&mid=shm&sid1=260&oid=366&aid=0000057947,331
311123,2012.05.10. 오전 11:55,부동산,이데일리,5·10 부동산대책 일문일답“추후에도 DTI 완화는 검토 안할 것”,이데일리신문 이 기사는 이데일리신문 2012년 05월 11일자 03면에 게재됐습니다. 이데일리 김동욱 기자 정부가 강남3구 투기지역 해제 등을 골자로 한 주택거래 정상화 대책을 10일 발표했다. 이날 나온 대책은 수도권 전매제한을 완화해 거래 규제를 풀고 1가구 1주택자에 대한 양도세 비과세 요건을 완화하는 등 세 부담을 줄여주는 게 핵심이다. 단 시장에서 지속적으로 요구해온 총부채상환비율 DTI 완화 취득세 감면 조치 등은 이번 대책에서 빠졌다. 정부는 DTI 규제 완화는 가계부채 문제가 우려되는 만큼 추후에도 DTI 규제 완화는 논의하지 않겠다는 입장을 분명히 했다. 백운찬 기획재정부 세제실장은 “법률 개정이 필요한 다주택자 양도세 중과 폐지 등은 19대 국회에 제출해 가능한 한 빨리 입법이 되도록 할 것”이라며 “특히 분양권 전매제한 완화 1가구 1주택자 비과세 보유 요건 완화 등 시행령 개정 사항은 국무회의를 거쳐 6월부터 시행할 것”이라고 말했다. 다음은 권도엽 국토해양부 장관 등 정부 관계자와의 일문일답 DTI 완화 빠진 이유와 강남3구 투기지역 해제 배경은 권 장관 투기지역 제도는 가격이 급등하거나 과열될 우려가 있는 경우 적용한다. 하지만 현재 강남3구는 투기지역 지정 요건에 해당하지 않는다. 주택 거래가 많이 침체돼 가격 급등기에 지정한 과도한 규제를 걷어낸다는 차원에서 이번에 해제했다. 이번 조치로 주택 거래와 관련한 규제들은 대부분 다 없어졌다. 단 DTI 완화 등 금융규제는 주택시장 현황만 봐서 판단하기 어렵다. 이번 대책의 효과는. 강남3구 투기지역 해제로 가계부채 문제를 더 키울 것이란 우려도 있다. 권 장관 지난해 12.7 대책 발표하고 나서 상당한 거래 활성화 효과가 있었다. 그 이후에 대내외적인 여건이 변화돼 최근 거래가 침체되긴 했지만 이번에 각종 규제를 걷어낸 만큼 시장이 정상화되는 데 기여할 것으로 본다. 1 1 재건축 주택규모 제한 완화 효과는. 박상우 주택토지실장 앞으로 1 1 재건축 시 기존주택의 면적 증가범위가 현재는 10%로 제한돼 있지만 이 범위를 완화할 예정이다. 구체적인 범위는 전문가와 시장 의견을 참고해 5월 중으로 발표할 계획이다. 큰 아파트의 증축 범위가 커지면 용적률이 높아진 만큼 소형주택도 더 많이 확보할 수 있다. 전용면적 85㎡ 이하 규모의 아파트도 부분 임대 아파트를 설치할 수 있어 리모델링 여건이 상당히 개선될 것으로 보인다. 작년에 여섯 번이나 대책을 발표했지만 효과가 미미했다. 박 실장 지난해 발표한 대책은 초점이 전·월세 안정에 맞춰져 있었다. 전·월세 공급을 단기간에 늘리기 위해 도시형생활주택 다가구 주택 건설을 위해 저리로 건설자금을 대출해주고 입주물량을 앞당기는 등의 대책이 골자였다. 이 때문에 현재 전·월세 가격은 안정됐다. 다만 이번 대책은 집값을 띄우는 게 아니라 집 살 능력이 있지만 정부의 규제로 주택 거래에 불편을 느낀 분들을 위해 과도한 규제를 완화한 게 이번 대책의 핵심이다. 주택 거래 정상화를 위해 규제를 완화한 만큼 효과가 있을 것으로 예상된다. 총선 이전에 논의됐던 서민 세입자 대책 전·월세 상한제 바우처 등은 검토 안 됐나. 박 실자 지난해 전·월세 대책을 주로 발표해 현재 전·월세 가격은 안정세다. 하반기도 안정세가 예상된다. 이번에 직접적인 전·월세 대책은 검토하지 않았다. 특히 여야가 총선 과정에서 서로 다른 내용으로 전·월세 상한제 대책을 공약한 만큼 국회가 개원하면 본격적인 논의가 있을 것으로 보인다. 바우처 부분은 정책 실현 가능성을 열어두고 있다. 다만 현재는 주택 신규 공급이 더 필요하다고 판단하고 있기 때문에 정책 우선 순위상 뒤로 밀린 것 뿐이다. 향후 주택 공급이 안정화된다면 바우처를 시행할 수도 있다. 이번 대책 중 법 개정 사항도 있는데 국회 문턱 넘을 수 있는지. 백운찬 기획재정부 세제실장 다주택자 양도세 중과 폐지 등 이번 대책 중 4가지가 법률 개정이 필요하다. 국회에서도 주택 거래 활성화에 공감하고 있기 때문에 통과할 수 있을 것으로 본다. 이외 시행령 개정 사항은 국무회의를 거쳐 6월 중으로 시행할 것이다. 이번 대책으로 주택 거래가 활성화되지 않는다면 추후에 DTI 규제 완화할 수 있나. 고승범 금융위원회 금융정책 국장 DTI 제도는 여러 가지 측면에서 고려해야 하고 부동산 정책으로 활용하는 것이 곤란하다는 게 정부의 입장이다. 추후 주택거래가 살아나지 않더라도 DTI 규제 완화는 현재로서는 고려하고 있지 않다. 대책 발표 시점이 늦었다는 지적도 있다. 박 실장 부처 내 보는 시각은 같아도 해법은 다를 수 있다. 그런 것들을 종합해서 금융 세제 그리고 실무를 아우르는 해법을 찾는 게 간단한 작업이 아니다. 빨리하는 게 중요한 것이 아니라 실질적으로 부동산 거래에 도움이 되는 대책을 마련하는 게 중요하다고 본다.,https://news.naver.com/main/read.nhn?mode=LSD&mid=shm&sid1=260&oid=018&aid=0002598885,331
311124,2012.05.10. 오전 11:53,부동산,머니투데이,정부 재건축정책 서울시와 또 충돌,머니투데이 이군호 기자 5.10대책 서울시 소형 확대 등 관리 중심 VS 정부 규제완화로 시장 활성화 정부가 5.10대책을 통해 내놓은 재건축 규제 완화 방안이 서울시 정책과 충돌이 불가피할 것으로 보인다. 서울시가 박원순 시장 취임 이후 인구구조 변화에 맞춰 소형주택을 확대하고 부동산시장에 미치는 파장을 최소화하는 방향으로 재건축을 관리하고 있는 반면 정부는 여전히 재건축 규제 완화를 통한 시장 활성화에 초점을 맞추고 있어서다. 정부는 10일 발표한 주택거래 정상화 및 서민·중산층 주거안정 지원방안 을 통해 입주민 선호도와 단지 특성에 맞는 재건축이 가능하도록 1대 1 재건축 때 기존주택의 면적 증가 범위를 확대하기로 했다. 1대 1 재건축은 기존 주택면적의 10% 범위 내에서 면적을 증가시키는 것으로 용적률 범위 내에서 추가 공급되는 가구는 85㎡이하로 짓게 된다. 이번 조치로 1대 1 재건축 때 현행 10%인 기존주택의 면적 증가 범위를 더 늘릴 수 있고 반대로 축소도 가능해진다. 국토부는 구체적 면적 증감 범위를 소형주택 확보방안 등을 마련하고 전문가 의견 수렴 등을 거쳐 이달 중 확정할 예정이다. 정부는 또 뉴타운지구내 재개발사업에만 적용되던 용적률 인센티브 제도를 재건축까지 확대해 국토의 이용 및 계획에 관한 법률 상한까지 허용키로 했다. 이에 따라 재건축사업 용적률은 현행 250%에서 최대 300%까지 상항 조정된다. 대신 증가된 용적률의 20 50% 이상은 임대주택으로 공급해야 한다. 정부의 이같은 규제 완화는 결국 재건축의 사업성을 높여 강남 부동산시장을 활성화하려는 의지로 분석된다. 늘어나는 용적률 가운데 일부 임대주택을 지어야 하지만 일반분양 물량이 늘어나고 이에 따라 조합원 분담금이 줄기 때문에 사업추진에 동력이 생길 수 있다. 전문가들은 결국 재건축 규제를 놓고 정부와 서울시간 충돌을 피할 수 없을 것이라고 지적했다. 정부 대책이 재건축사업장에는 인센티브로 받아들여지겠지만 관리를 해야 하는 서울시 입장에선 기존 정책을 다시 조정해야 하기 때문이다. 서울시는 박 시장 취임 이후 인구구조 변화에 맞게 소형주택 비율을 확대하고 일반주거지역 2종을 3종으로 상향조정하려는 재건축단지들에 대해 도시계획관리 차원에서 세밀한 관리를 하고 있다. 주택산업연구원 김덕례 연구위원은 서울시는 관리하는 방향이고 국토부는 시장 정상화를 위한 촉매제로 만들려다 보니 궤가 다르다 며 재건축은 지자체의 영향력이 큰 만큼 국토부와 서울시가 정책방향을 조율할 필요가 있다 고 지적했다. 세종대 도시부동산대학원 김수현 교수는 재건축 규제 완화가 시장에 어떤 영향을 미칠지는 아직 판단하기는 어렵다 며 국토부와 서울시가 기술적인 부분을 협의해 풀어나갈 것으로 본다 고 말했다.,https://news.naver.com/main/read.nhn?mode=LSD&mid=shm&sid1=260&oid=008&aid=0002839414,331
