,date,cat,co,headline,text,url,week
70294,2007.11.19. 오전 9:59,부동산,아시아경제,특허청 제2의 인사혁신 단행,특허청이 인사혁신에 나섰다. 특허청은 최근 직무중심ㆍ개인역량개발ㆍ조직성과 극대화를 모토로 하는 제2의 인사혁신을 단행 한다고 밝혔다. 특허청은 지난 2005년 진행한 제 1단계 인사혁신 작업을 통해 과거 수십 년간 이어져 온 연공서열 중심의 조직을 성과주의 조직으로 탈바꿈시킨 바 있다. 특허청의 이번 인사혁신 시스템은 그동안의 성과주의 인사시스템의 일부 문제점을 보안해 직원의 역량개발을 통한 초일류 조직으로 거듭나기 위한 방안이며 이중에는 직위공모제 정착을 통해 내부 전보 및 팀장 승진에 있어 경쟁 원리를 도입하는 한편 직무 중심의 인사원칙을 실현 구성원의 보직경로를 조직ㆍ개인ㆍ부서장이 함께 설계하고 관리하는 시스템 구축 역량기반교육체계 구축 등의 내용을 담고 있다. 특허청은 이 같은 내용의 제 2의 인사혁신을 경력개발지원시스템인 My KIPOway 시스템을 통해 웹상에서 운영함으로써 상시적이고 쌍방향적인 인사정보시스템을 갖출 예정이다. 특허청 이준석 대변인은 이번 인사혁신 안은 조직과 구성원 직무와 사람이 조화를 이루는 인적자원 개발 및 관리체계를 구축를 위한 것이며 이로써 국제지식재산질서를 선도하는 초일류 혁신조직으로써 경쟁력을 갖추게 될 것 이라고 말했다.,https://news.naver.com/main/read.nhn?mode=LSD&mid=shm&sid1=260&oid=277&aid=0000020243,98
70295,2007.11.19. 오전 9:57,부동산,아시아경제,엎친데 덥치고…쌓여만가는 아파트,쏟아지는 분양물량에 매매시장은 죽을 맛이다. 실수요자들이 분양가 상한제로 공급되는 주택이 늘어날 것을 의식해 매입 시기를 늦추고 있는데도 건설사들은 상한제를 피하기 위해 그동안 준비해 왔던 분양 물량을 연내 대거 공급하고 있기 때문이다. 또 건설사들이 신규 분양물량을 토해낼 때마다 미분양물량도 동반 상승하면서 실수요자들의 선택 폭이 넓어지고 있기 때문으로 풀이된다. 분양물량 쏟아진다 19일 부동산정보제공업체들에 따르면 광주 용인 수원 화성 오산 성남등 수도권 남부에서 연내 분양하는 단지는 총 61곳 3만63가구다. 지역별로는 용인이 8515가구로 가장 많으며 뒤를 이어 수원에서 6536가구가 공급된다. 그 밖에 화성 659가구 광주 4655가구 오산 2718가구 성남 1130가구가 준비를 하고 있다. 고양시 김포시 등 연내 수도권 서북부 3개 지역에서 도시개발사업으로 1만3500여가구가 쏟아질 예정이다. 각종 개발호재를 안고 있는 데다 등기 후 전매도 가능해 연말 분양시장을 달굴 것으로 예상된다. 내달에는 일산 주변 대규모 도시개발사업지인 덕이지구와 식사지구에서 신규 분양이 이뤄질 전망이어서 청약 결과에 관심이 쏠리고 있다. 덕이지구에선 동문건설과 신동아건설이 각각 1556가구 3316가구 등 4872가구를 식사지구에선 GS건설과 벽산건설이 각각 4504가구 2353가구 등 6857가구를 공급할 예정이다. 미분양 물량은 쌓이는데 미분양 물량도 갈수록 눈덩이처럼 불어나면서 수도권에서도 확대되는 추세다. 건설교통부에 따르면 지난 9월 말 현재 전국 미분양 주택은 9만8235가구로 전달보다 7.1% 증가했다. 이 같은 추세라면 연말에는 미분양 주택 수가 사상 최대치인 10만2701가구 1998년 12월 를 넘어설 것으로 예상된다. 서울은 9월 말 현재 미분양 주택이 724가구로 전달보다 0.8% 감소했지만 인천을 제외한 경기 지역은 7906가구로 77.6%나 증가했다. 이에 따라 수도권 전체 미분양 주택은 9137가구로 57.1% 늘었다. 지방 미분양 주택도 8만9098가구로 3.7% 증가했다. 대표적 주택공급 과잉 지역인 대구는 전달보다 1.1% 줄어든 반면 하반기 들어 분양이 집중됐던 울산은 한 달 사이 107.2%나 늘어난 3240가구로 나타났다. 부산은 1만739가구로 처음으로 1만가구를 넘어섰다. 대전도 41.7% 증가한 2095가구로 집계됐다. 매매시장은 한숨만 쌓이네 이로 인해 기존 주택 매매시장도 덩달아 얼어붙고 있다. 지난해 10월 11만가구에 육박했던 주택 거래건수는 지난 9월 현재 5만4000여건으로 줄었다. 이사를 가고 싶어도 기존 집이 팔리지 않아 새 집에 들어가지 못하는 불꺼진 아파트도 태반이다. 내년부터 비교적 값이 싼 상한제 아파트가 쏟아져 나올 것이라는 기대감이 크기 때문이다. 또 청약가점제 도입에 따라 통장사용을 자제하기 때문에 대기업 유명 브랜드라도 입지와 가격경쟁력이 없으면 실패하게 마련이다. 대출규제와 보유세 강화 전매제한도 매수심리를 압박하는 요인으로 작용하고 있다. 부동산 중개업소 관계자는 부동산 경기가 좋다는 서울 용산구에서도 문닫는 중개업소가 한두 곳이 아니다 라고 말했다.,https://news.naver.com/main/read.nhn?mode=LSD&mid=shm&sid1=260&oid=277&aid=0000020241,98
70296,2007.11.19. 오전 9:46,부동산,헤럴드POP,아파트청약 채권액 하늘과 땅 차…눈치작전 치열,신규 분양시장에 거센 한파가 휘몰아치면서 분양가가 시세보다 크게 저렴해 채권입찰제가 적용되는 전용 85㎡ 이상의 중대형 아파트 조차도 2 3순위 청약 미달이 속출 당첨자들간 희비가 엇갈리고 있다. 청약자가 써내는 채권금액은 해당 아파트 당첨 여부는 물론 실질적인 분양가 부담액을 결정짓는다는 점에서 향후 채권제 적용 아파트 청약 예정자들은 순위 내 미달 및 미분양 가능성 등을 염두에 두고 채권금액을 써내는 신중한 ‘채권전략’이 요구된다. 최근 청약접수를 끝낸 고양시 일산2지구 C1블록 주공 휴먼시아 총 410가구 의 경우 당첨자들이 써낸 채권액은 하늘과 땅 만큼 큰 차이를 보였다. 총 410가구 가운데 공급면적 150.96㎡와 151.42㎡는 1순위에서 마감됐고 150.97㎡와 151.46㎡는 2순위에서 나머지 3개 주택형 167.95㎡ 168.49㎡ 168.59㎡ 은 3순위에서 각각 마감됐다. 이 가운데 3순위에 마감된 168㎡ 안팎의 3개 주택형의 경우는 당첨자들 중 채권액을 상한액인 1억3000여만원을 써낸 청약자가 있는가 하면 수백만원만 써낸 ‘배짱파’들도 많았던 것으로 나타났다. 실제 1순위로 신청한 A씨는 상한액인 1억3200만원을 써냈지만 3순위로 신청해 당첨된 B씨는 고작 500만원만 써내고서도 당첨됐다. 국민주택채권을 매입 즉시 매각할 경우 65% 안팎을 회수 실 부담액은 35% 안팎이기 때문에 A씨는 4620만원 B씨는175만원을 분양가외 추가로 부담하게 된다. 두 사람간 채권금액에서 무려 4445만원의 차이가 나는 셈이다. 이는 1 2 3 순위의 경우 채권액을 많이 써낸 순서대로 당첨자를 결정하지만 1 2순위와는 달리 3순위의 경우는 가점제와 무관하고 채권액을 한푼도 써내지않아도 당첨될 수 있기 때문이다. 예비당첨자 20%도 채권액을 많이 써낸 청약자를 대상으로 선정한다. 물론 미분양이 발생한 경우 채권액 없이 분양가격으로 선착순으로 계약자가 결정된다. 인근 M공인 관계자는 “분양시장이 꽁꽁 얼어붙어 향후 은평뉴타운 등 ‘알짜 중 알짜’단지가 아니면 채권제 대상 아파트도 2 3순위 미달이나 미분양이 발생할 것”이라며 1 2 순위자들의 경우 채권액을 써내는데 신중을 기해야할 것”이라고 조언했다.,https://news.naver.com/main/read.nhn?mode=LSD&mid=shm&sid1=260&oid=112&aid=0000080482,98
70297,2007.11.19. 오전 9:35,부동산,아시아경제,천안지역 아파트 분양 연기 잇달아,충남 천안지역에 새롭게 아파트 분양을 준비중인 다수 건설사들이 이달 안에 천안시에 입주자 모집공고 신청만 한 채 내년으로 분양을 미룰 움직임을 보이고 있다. 우선 정부 분양가 상한제를 피하기 위해 분양신청을 해 놓기는 하돼 미분양이 우려되니 분양은 미루자는 것이다. 19일 천안시와 건설사에 따르면 이달 말까지 정부의 분양가 상한제 적용을 피하기 위해 시에 입주자 모집공고 신청을 하거나 신청 예정인 업체는 13개 업체 9천762가구 로 잠정 파악됐다. 그러나 정부가 아파트 시장 안정을 위해 지난 9월부터 분양가 상한제를 시행 다음달 입주자 모집공고 신청분부터 이를 적용하게 돼 있어 이들 회사 중 10여개 업체는 이달 말까지 시에 입주자 모집공고 신청을 한 뒤 실제 청약은 내년 봄 이후로 미룰 움직임을 보이고 있다. 이 가운데 연내에 시민을 대상으로 아파트 청약에 실제로 나설 건설사는 964가구를 분양할 쌍용동 D아파트와 1천163가구를 분양할 용곡동 H아파트 등 2곳에 불과하며 나머지 11개 업체 7천635가구 는 미분양을 걱정해 내년 봄 이후에나 실 분양에 나설 것으로 알려졌다. 건설업계 관계자는 정부의 아파트값 상한제 적용을 피하기 위해 상당수의 건설사들이 이달 안에 입주자 모집공고 신청을 할 것으로 보이며 다만 아파트 시장상황이 불투명해 연내에 실제 분양에 나서는 업체는 소수에 그칠 것으로 내다봤다.,https://news.naver.com/main/read.nhn?mode=LSD&mid=shm&sid1=260&oid=277&aid=0000020217,98
70298,2007.11.19. 오전 9:34,부동산,머니투데이,해외사업 리스크잡는 거미손RM팀,머니투데이 원정호 기자 해외건설 역사 우리가 쓴다 ⑦GS건설 한때 해외건설 사업은 자선사업이라는 냉소적 유머가 유행하던 시기도 있었다. 해외 현장에서 고생은 고생대로 하고 환차손과 원자재가 상승 등 여러 이유로 뒤로 까먹기 일쑤였기 때문이다. 하지만 GS건설에겐 남의 얘기 다. 해외건설시장에서 손실을 최소화하기 위한 리스크관리시스템을 촘촘히 짜놓았기 때문이다. 마케팅 및 수행 단계별로 리스크를 정확히 정의하고 각 단계별로 체계적인 관리를 하고 있다. 지난해에는 해외사업 리스크관리를 전담해 온 기존의 FS 시장타당성 팀을 대폭 보강해 RM 리스크관리 팀 으로 변경했다. 이 팀은 해외사업 진출에 따른 타당성 분석은 물론 영업에서 애프터서비스 AS 까지 전 과정에 걸친 리스크 관리를 전담한다. 해외플랜트 공사와 관련해 관리하는 리스크 유형은 50여가지에 이른다. 환율변동 플랜트 경기 변동 등 사업여건 변화에 따른 리스크와 설계오류 기자재 가격 상승 공기지연 등 공사 수행과정에서 발생하는 모든 리스크들이 포함된다. GS건설은 환율관리도 이원화해 시행하고 있다. 원달러 환율은 환변동 보험 가입을 통해 커버한다. 지난해 10월 이집트에서 1억달러 규모의 건설 공사에 입찰하면서 곧바로 수출보험공사의 환변동 보험에 가입했다. 일반적으로 입찰시점이 아닌 계약시점에 보험에 가입하지만 GS건설은 계약 전에 발생할 수 있는 환위험까지도 적극 관리한 것이다. 국제금융팀 김종민 팀장은 그 당시 환율이 930원대니까 환변동 보험에 가입하지 않았다면 120억원의 환차손을 입을 뻔 했다 고 전했다. 달러 이외의 유로화나 엔화 등은 선물환을 통해 리스크를 분산시키고 있다. 김팀장은 선물환에 따른 비용은 특별히 추가되지 않는다 면서 지출통화와 수입통화를 통일시키는 자동 헷지도 시행하고 있다 고 말했다. 이 외에 유럽이나 일본 등 선진 건설업체들이 시행하고 있는 단계·국가별 리스크 관리도 강화하고 있다.,https://news.naver.com/main/read.nhn?mode=LSD&mid=shm&sid1=260&oid=008&aid=0000853363,98
70299,2007.11.19. 오전 9:27,부동산,이데일리,프리즘수도권 공무원 잠 못이루는 11월,이데일리 윤도진기자 저녁 6시 땡 하면 퇴근하는게 공무원이라고요 말도 마세요. 요즘은 새벽 두세시에 별 보며 집에 갑니다. 수도권 지자체에서 주택 관련 업무를 맡고 있는 공무원들의 귀가시간이 늦어졌다. 분양가 상한제 가 이들을 붙잡고 있는 것이다. 주택업체들이 분양가 상한제 를 피해 아파트를 지으려면 늦어도 이달 말까지는 분양승인을 신청해야 한다. 이 때문에 분양할 물량이 산더미처럼 밀려 있는 경기도 일대 지자체의 주택업무 관련 직원들은 전혀 공무원스럽지 않게 됐다. 경기도 용인시 고양시 파주시 김포시 등이 대표적이다. 업무량에 비해 처리할 시간이 모자라다 보니 야근을 밥먹듯이 한다. A시 주택과 직원은 분양승인 신청과 관련한 민원인들이 밀려오다보니 낮에는 일할 짬이 나지 않는다 며 서류 검토와 문서 작업은 모두 일과시간 이후에 할 수밖에 없다 고 토로했다. 그도 그럴 것이 용인시의 경우 이 달안에 분양승인 신청을 넣으려는 단지가 30여곳이 넘는다. 수지구에서 25개 단지 9545가구 를 비롯해 기흥구 8개 단지 2240가구 처인구 1개 단지 782가구 등 총 1만2567가구의 아파트가 연내 분양을 목표로 사업을 진행 중이다. 고양시에서는 식사지구와 덕이지구에 각각 5개 단지 가좌지구와 구일산 지역 등에도 분양물량이 대기 중이다. 걸포지구 물량이 상당수인 김포시와 신도시 동시분양을 앞두고 있는 파주시를 비롯해 남양주시 광주시 등에서도 분양승인 신청을 준비하는 단지들이 많다. 특히 재작년 12월에 사업승인을 받았지만 올 하반기에 착공계를 낸 GS건설의 용인 성복동 자이2차처럼 행정절차에 마찰을 겪는 경우도 많아 일처리는 간단치 않다. B시 주택과장은 매년 분양이 몰리는 시기가 있지만 올해만큼 시간에 쫓기며 일하기는 처음 이라며 12월에도 분양승인 신청을 받은 사업지에 대한 검토 작업이 남아 있기 때문에 쉴 시간이 없을 것 같다 고 말했다.,https://news.naver.com/main/read.nhn?mode=LSD&mid=shm&sid1=260&oid=018&aid=0000537918,98
70300,2007.11.19. 오전 9:26,부동산,헤럴드POP,눈길끄는 분양대단지 물량 김포 ‘오스타 파라곤’,지난 16일 모델하우스를 연 김포 걸포동 ‘오스타 파라곤’은 김포지역에서 오랜 만에 선보인 대단지 물량으로 실수요자들의 관심을 끌었다. 동양건설산업과 성우종합건설의 공동사업인 오스타 파라곤은 112 249m² 33 75평 총 1636가구로 구성된다. 분양가상한제가 적용되지 않아 등기 후 바로 되팔 수 있다. 지난 주말 모델하우스에는 김포 인천 서울 일산 등지의 거주자들이 속속 찾았다. 방문객들은 전매 여부와 교통여건 대단지 특화시설 부문에 관심을 보였다. 김포신도시 인근에 위치한 단지로 내년 초 일산대교가 완공되면 일산신도시까지 차로 5분 거리다. 일부는 한강 조망이 가능하다. 주방은 ‘ㄷ’자형으로 설계해 동선을 줄였다. 안방에 붙박이장이 없는 것이 특징. 대신 드레스룸 공간을 한층 넓혔다. 녹지율이 37%로 높은 편이다. 특히 김포 지역 최초로 지역난방이 적용돼 난방비가 개별난방보다 30% 가량 절감되는 점이 수요층의 눈길을 끌었다. 분양가는 3.3m²당 평균 1216만원 선 가장 큰 249m²는 3.3m²당 1500만원 선으로 다소 비싼 편이다. 인근 북변동 동양파라곤 105m² 31평형 매매가는 3.3m²당 850만원 선이다. 2006년 11월 입주한 고촌 동부센트레빌은 30평형대 기준 3.3㎡당 1066만 1142만원 선이다. 다만 확장 비용을 빼면 별도의 옵션비용은 추가되지 않는다.,https://news.naver.com/main/read.nhn?mode=LSD&mid=shm&sid1=260&oid=112&aid=0000080477,98
70301,2007.11.19. 오전 9:26,부동산,헤럴드POP,눈길끄는 분양분당생활권 광주 우림 필유,판교ㆍ분당 생활권역인 경기도 광주에서 우림건설이 태전동과 송정동 2개 단지에서 110 148㎡ 구 33 45평형 849가구를 공급해 눈길을 끌고 있다. 특히 광주시는 각종 개발행위 규제로 인해 그 동안 아파트 공급이 워낙 없었다는 점에서 실수요자의 관심이 집중되는 곳이다. 광주 태전동 우림필유 조감도 는 지하2층 지상 20층 8개동 규모로 공급면적 기준 109㎡ 63가구 129㎡ 335가구 155㎡ 67가구 175㎡ 2가구 211㎡ 6가구 234㎡ 2가구 총 475가구다. 기존의 판상형 배치를 탈피하고 조망과 향을 고려한 ‘타워형 주동배치“로 단지 내 공간 효율을 극대화했다. 단지 중앙에는 대규모 중앙광장이 들어서며 남동 및 남서향 위주의 동배치를 통해 탁트인 조망을 실현했다. 또한 아파트 주동과 단지커뮤니티간 공간을 이중 데크로 설치하여 휴식 공간으로 이용할 수 있다. 보행축과 연계된 주거동에 일반아파트에서는 보기 힘든 호텔식 주출입 로비공간을 설치하여 동별 입주자의 휴게 및 사교의 장으로 활용할 수 있도록 했다. 중부고속도로와 3번 43번 45번 국도가 인접해 있고 2010년 개통예정인 성남 광주 장호원간 6차선 자동차 전용 도로가 건설되면 서울 및 수도권 접근성이 크게 개선된다. 또한 성남 광주 여주간 복선전철이 2011년 완공될 예정이다. 단지 인근으로 태전초교 광주중고교 광주종고 등이 위치하고 있어 교육여건이 우수하다.,https://news.naver.com/main/read.nhn?mode=LSD&mid=shm&sid1=260&oid=112&aid=0000080476,98
70302,2007.11.19. 오전 9:26,부동산,헤럴드POP,모델하우스 도우미 몸값 ‘천정부지’,모델하우스 도우미의 몸값이 치솟고 있다. 분양가 상한제를 피하기 위한 아파트 공급이 급증하면서 인력난이 극심해지고 있기 때문. 여기에다 9월 말 현재 전국의 미분양 주택이 10만 가구에 육박하는 등 IMF 이후 사상 최대 규모로 늘어나면서 분양 기간이 길어진 것도 인력난을 가중시키는 요인으로 지적되고 있다. 최근 경기도 오산시에서 분양을 시작한 D사는 도우미 17명을 4차례에 걸쳐 겨우 구했다. 연말까지 경기도 파주 광주 등 6개 사업지에서 분양에 들어가는 B건설도 도우미와 TM인력난을 겪고 있다. 수원시에서 아파트 분양을 앞둔 H사는 약속했던 도우미들이 이전의 미분양 현장에 투입되면서 새로 구해야할 처지다. 이로인해 일당이 급등하는 추세. 올 초 모델하우스 도우미의 일당은 11만 12만원 선이었으나 요즘엔 12만 13만원으로 1 2만원 가량 올랐다. TM 텔레마케팅 인력도 일당이 8만 10만원으로 연초보다 2만원 가량 오른 상태다. 한 분양대행사 사장은 “분양 때 최정예 멤버로 분양팀을 꾸릴 수 있었는데 요즘엔 인력이 달리면서 숙련된 사람을 구하기가 어렵다”며 “가뜩이나 분양도 잘 안 되는데 인력난까지 겪고 있으니…”라며 말끝을 흐렸다. 한편 분양 현장이 늘면서 모델하우스 시공회사의 일손이 달려 모델하우스 개관을 못하는 경우도 속속 생겨나고 있다. 지난 달 서울에서 분양한 D아파트는 모델하우스 개관도 못한 채 청약에 들어갔다. 이번 주 모델하우스를 공개하고 분양에 들어가는 울산 W아파트도 일부 인테리어를 바꾸려 했으나 공사업체가 다른 현장에 투입되는 바람에 날짜를 맞출 수 없어 포기했다.,https://news.naver.com/main/read.nhn?mode=LSD&mid=shm&sid1=260&oid=112&aid=0000080473,98
70303,2007.11.19. 오전 9:24,부동산,뉴시스,중견 건설사 채용 노려라,서울 뉴시스 건설취업포털 건설워커 www.worker.co.kr 대표 유종현 에 따르면 우미건설 성우종합건설 동양메이저 건설 일신건영 부영 등 중견 건설사들이 잇따라 신규인력 채용에 나서고 있다. 우미건설 www.woomi.co.kr 이 경력 및 인턴사원을 공개모집한다. 경력직 모집분야는 경영기획 사업기획 해외영업 민자사업 수주영업 견적 환경 등이며 인턴사원 모집분야는 건축 전기 설비 영업기획 민자사업 마케팅 해외사업 재개발 경영기획 인사 총무 재무 비서 등이다. 인턴사원은 25일까지 경력직은 12월 2일까지 회사 홈페이지 채용란의 이력서관리에서 직접 입력 입사지원하면 된다. 성우종합건설 www.swconst.co.kr 이 신입 및 경력사원을 모집한다. 모집분야는 경력직이 건축 전기 설비 C S 현장관리 영업 기획 경리 총무인사 등이며 신입은 기획 경리 등이다. 입사지원서는 건설워커에서 다운받아 작성한 뒤 12월 12일까지 이메일로 제출하면 된다. 동양메이저 건설 www.tycon.co.kr 이 그룹공채 형태로 신입 및 경력사원을 모집한다. 모집분야는 경력직이 건축 전기 기계 현장관리 등이며 신입직은 건축 자재관리 현장관리 기획 IT 등이다. 21일까지 동양그룹 홈페이지 hp recruit.tongyang.co.kr 에서 온라인 입사지원하면 된다. 회사는 인테리어 팀장급 경력사원을 29일까지 별도로 모집한다. 입사지원서는 건설워커에서 다운받아 작성한 뒤 방문 우편 이메일 등을 통해 제출하면 된다. 일신건영 www.ilshinc.com 이 신입 및 경력사원을 모집한다. 모집분야는 건축 해외사업 등이며 12월 2일까지 회사 홈페이지에서 온라인 입사지원하면 된다. 우편 및 이메일 접수방법으로도 지원이 가능하다. 부영 www.booyoung.co.kr 이 신입 및 경력사원을 모집한다. 모집분야는 건축 토목 전기 설비 기획 영업 통계 경리 해외사업 등이며 입사지원서는 회사 홈페이지에서 다운받아 작성한 뒤 26일까지 방문 및 우편으로 제출하면 된다. 한국중부발전 www.komipo.co.kr 이 하반기 신입사원 채용에 나선다. 모집분야는 건축 토목 기계 전기 화학 정보통신 법률 상경 등이며 29일 12월 5일 기간 중 회사 홈페이지에서 온라인 입사지원하면 된다. 엄앤드이종합건축사사무소 www.aumlee.co.kr 는 건축계획 및 설계분야 신입사원을 공개모집한다. 이력서 자기소개서 등 입사지원서류는 30일까지 포트폴리오 등과 함께 방문 및 우편으로 제출하면 된다. 한편 대형 건설사인 GS건설 www.gsconst.co.kr 은 현장계약직을 모집한다. 모집분야는 건축 토목 CAD 안전 품질 측량 전기 설비 사무보조 자재 민원관리 환경관리 등이며 25일까지 GS건설 채용 홈페이지 hp recruit.gsconst.co.kr 에서 온라인 입사지원하면 된다. 이밖에 경남기업 23일까지 유진기업 23일까지 신한 30일까지 효자건설 30일까지 엠코 30일까지 원일종합건설 22일까지 중흥종합건설 20일까지 서광건설산업 23일까지 EG건설 20일까지 대영엔지니어링 12월8일까지 한일건설 채용시까지 한화건설 채용시까지 등이 수시채용을 진행하고 있다.,https://news.naver.com/main/read.nhn?mode=LSD&mid=shm&sid1=260&oid=003&aid=0000650587,98
