,date,cat,co,headline,text,url,week
148121,2009.07.30. 오후 12:01,부동산,헤럴드경제,부동산특집명문 초중고 대학인접 ‘교육타운’,금호건설은 오는 8월 중 경기도 수원시 세류동 351번지 일원에 수원 권선 어울림 160가구 일반분양 112가구 조합 48가구 를 공급한다. ‘수원 권선 어울림’단지는 대지면적 6491㎡ 연면적 3만2233㎡ 이며 지하 2층부터 지상 15층 3개동 규모로 △120.41㎡ 43평형 57가구 △84.98㎡ 34평형 103가구로 구성돼 있다. 수원 권선 어울림은 그동안 인근 주거환경개선사업지구와 연계돼 새로운 도심주거지역으로 개발될 것이라는 기대감을 모아왔다. 특히 하천 치수공간으로 개발중인 수원천변에 자리 잡고 있어 입주자들이 탁 트인 전망과 함께 쾌적한 주거여건을 누릴 수 있게 된다. 또 단지 옆으로 수원천을 두고 있어 조망권이 우수할 뿐 아니라 수원천 내 산책로 등이 조성돼 윤택한 생활이 가능하다. 중소형 평형임에도 불구하고 내부 인테리어에서는 모던 분위기를 더해 입주민들의 만족감을 극대화하기 위한 노력을 기울였다. 107.61㎡ 형의 경우 전체적인 내부 컨셉을 오크 내츄럴 컬러 패턴에 짙은 라인을 주어 단조로움이 최소화된 모던 풍으로 내부를 꾸밀 예정이다. 거실과 주방의 연결도 최대한 개방해 거실이 전반적으로 넓게 보일 수 있게 설계됐다. 145.26㎡형은 아이보리와 다크 우드 등 심플하면서 세련된 다양한 컬러가 적용된다. 독립된 다이닝 공간이라든지 부부욕실의 공간을 넓혀 최대한 편안한 가족생활이 가능하도록 설계됐다. 권선구 세류동은 수원시의 중심부에 위치한 원도심 지역으로 42번국도 경수산업도로를 통해 서울로의 접근이 용이하다. 수원역과 종합터미널이 인근에 위치하고 있고 2010년 개통예정인 분당선 연장선 매교역과 수인선 복선전철 건설계획으로 입주자들은 더욱 빠르고 편한 대중교통을 이용할 수 있게 될 전망이다. 수원 권선어울림 일대에는 세류초ㆍ중을 비롯해 수원고ㆍ수원여고 아주대 경희대 성균관대 캠퍼스 등 훌륭한 교육여건이 갖춰져 있다. 입주예정일은 2010년 5월이다.,https://news.naver.com/main/read.nhn?mode=LSD&mid=shm&sid1=260&oid=016&aid=0000313128,186
148122,2009.07.30. 오후 12:01,부동산,헤럴드경제,부동산특집‘서울춘천 고속도로’ 개통 후광기대,서울 춘천 고속도로의 개통으로 강원도 지역이 들썩이고 있다. 그동안 서울에서 멀게만 느껴졌던 춘천과 강릉이 이제 가볍게 다녀올 수 있는 지역으로 가까워졌기 때문이다. 새롭게 주목받는 강원도에서 롯데건설이 강원도 강릉 교동과 춘천 사농동에서 명품 아파트를 선보여 주목된다. 롯데건설은 강릉시 교동지역에서 ‘강릉 교동 롯데캐슬’ 아파트 잔여물량을 분양하고 있다. 2009년 12월 입주를 앞두고 있는 이 아파트는 전용면적 84 244㎡ 규모의 중대형 아파트로 지하 1층 지상 15층 8개동 총 581가구로 구성돼 있다. 교동은 강릉을 대표하는 부촌 지역으로 생활인프라가 잘 갖춰져 있으며 중대형 평형으로 구성된 고급 아파트단지로 강릉지역의 랜드마크 단지라 할 수 있다. 또한 강릉에서 가장 선호하는 솔올지구 구 교동택지 와 인접해 있어 관공서 종합병원 대형 할인마트 등 기존 도심의 편의시설 이용이 편리하다. 계약금은 정액제로 납입하며 전세대 발코니 확장을 무상으로 제공한다. 문의 033 655 3700 02 582 9700 또 춘천시 사농동 809 일대에 들어선 ‘롯데캐슬 더 퍼스트’ 1 2단지는 총 669가구가 입주 중이며 일부 잔여세대가 특별분양 중이다. 이 아파트는 전용면적 84 129㎡ 규모의 지하 2층 지상 15층 8개동으로 구성돼 있다. 춘천 롯데캐슬은 서울 춘천고속도로 개통으로 서울 외곽순환도로 강일IC에서 춘천JCT까지 불과 약 60㎞로 승용차로 서울 출퇴근이 이루어질 수 있는 거리다. 또한 2010년 완공되는 청량리에서 춘천역까지 복선전철이 공사 중에 있어 서울까지 40분대에 이동이 가능하다. 우두택지개발 예정지구 내에 위치하고 있어 향후 개발 호재가 많은 지역이라는 설명이다. 롯데건설은 단지 내에 춘천 지역 최초로 원어민 강사 상주 영어마을을 지난 6월 오픈 2년간 무료로 운영할 방침이다.,https://news.naver.com/main/read.nhn?mode=LSD&mid=shm&sid1=260&oid=016&aid=0000313126,186
148123,2009.07.30. 오후 12:01,부동산,헤럴드경제,부동산특집세계적 조경ㆍ건축가 그린디자인,현대산업개발이 수원시 권선구 권선동 일대에서 단독으로 개발하는 ‘수원 I PARK CITY’는 6594가구 규모의 주거시설과 더불어 테마쇼핑몰 복합상업시설 공공시설 등이 어우러져 개발되는 민간 도시개발 프로젝트다. 현대산업개발은 세계적인 건축가 벤 판 베르켈과 네덜란드의 저명한 조경설계가인 로드베이크 발리옹과 함께 부지내의 하천을 복원하고 독특한 디자인의 아파트 입면을 개발하는 등 차별화된 친환경 디자인 도시를 조성하고 있다. ‘수원 I PARK CITY’는 자연형 하천이 흐르는 친환경 도시로 설계된 것이 특징이다. 우시장천과 장다리천을 맑은 물이 흐르는 친수공간으로 복원하고 하천을 따라 다양한 녹지공간과 수공간을 조성할 계획이다. 총길이 2.5km의 하천변에 자전거도로 및 산책로 등을 조성하고 6만㎡의 근린공원 친수광장 소공원 및 어린이공원 등을 만든다. 아파트 건물의 디자인에도 신경을 썼다. 아파트 입면은 숲과 계곡 대지 물의 파동 지평선 등 자연을 주제로 △파크 Park △빌리지 Village △시티 City △워터 Water △필드 Field 등 총 5개 타입으로 구성된다. ‘파크 타입’은 곧게 자란 나무와 무성한 가지들이 교차되는 숲의 모습을 입면에 적용한 것이며 ‘빌리지 타입’은 강이 흘러 대지에 남기는 흔적을 형상화했다. 주거시설로는 아파트 공동주택 단독주택 등 총 6594가구가 조성된다. 이중 일반분양 아파트는 4384가구로 현대산업개발은 올 9월 1블록 지하 2층 지상 14층 10개동 110㎡ 257㎡ 543가구와 3블록 지하 2층 지상 14층 15개동 111㎡ 259㎡ 793가구 등 총 1336가구의 분양을 시작으로 순차적 분양을 실시한다. 오는 9월 분양하는 1블록과 3블록은 부지 동쪽에 입지한 단지로 두 단지 모두 우시장천과 맞닿아 있다.,https://news.naver.com/main/read.nhn?mode=LSD&mid=shm&sid1=260&oid=016&aid=0000313125,186
148124,2009.07.30. 오후 12:01,부동산,헤럴드경제,부동산특집강남 10분대… ‘미니 신도시급’ 변모,GS건설은 경기도 의왕시 내손동 623번지 일대 포일주공아파트를 재건축한 ‘포일자이’를 오는 9월께 분양한다. ‘포일자이’는 지하 2층 지상 16 25층 38개동 규모로 82 205㎡ 총 2540가구로 구성된 초대형 단지다. 이중 조합원을 제외한 319가구가 일반분양된다. 2007년 5월 착공해 올해 11월 입주예정이다. 단지는 △82㎡ 510세대 △112㎡ 1191세대 △142㎡ 177세대 △148㎡ 426세대 △172㎡ 188세대 △205㎡ 48세대로 이뤄져 있다. 82㎡의 경우 510가구 중 일반분양 317가구이며 172㎡에는 일반분양분 2가구가 있다. 내손동 일대는 평촌과 인접한 대규모 도시계획단지로 인근의 대우사원아파트 의왕내손조합 프라자 현대모닝 청화조합 등이 동시에 재건축중이다. 재건축이 완료되면 이 일대에 약 6000여 가구 이상의 대단위 재건축단지가 조성된다. 게다가 내손동 재개발 예정지역에 아파트 3000여 가구가 추가로 들어서면 내손동 일대는 1만여 가구의 아파트가 밀집한 미니 신도시급으로 변모하게 된다. 의왕시 내손동은 평촌신도시와 가까워 이 곳의 쇼핑 문화 교육시설을 그대로 이용할 수 있다. 4호선 평촌역 인덕원역이 가깝고 서울외곽순환고속도로 과천 봉담간 고속화도로가 인접해 서울 및 수도권으로 진ㆍ출입이 용이하다. 서울 강남권은 차량으로 10분대에 진입할 수 있다. 모락산 청계산 백운호수 등이 멀지않다. 단지 입구는 대형 석재문주로 왕궁같은 분위기를 연출했고 각 동마다 중형문주를 설치했다.,https://news.naver.com/main/read.nhn?mode=LSD&mid=shm&sid1=260&oid=016&aid=0000313124,186
148125,2009.07.30. 오후 12:01,부동산,헤럴드경제,부동산특집하반기에만 총 9000여가구 공급,삼성물산 건설부문이 하반기 총 9000여가구를 공급한다. 이 가운데 1000가구가 넘는 대규모 단지가 많아 눈길을 끈다. 서대문구 북가좌동 144번지 일대 15만6935㎡에 아파트 52개 동이 들어서는 가재울뉴타운 3구역의 경우 공급면적 84 184㎡ 총 3293가구가 들어선다. 이 중 675가구가 일반분양된다. 가재울뉴타운은 첨단 교육 생태가 어우러진 1만여세대의 미니 신도시로 변모할 예정이다. 총 2644가구가 건립되는 래미안산본은 군포 산본권에 위치한 단지 중에서 최대 규모로 지역 내 랜드마크 단지로 급부상할 전망이다. 644가구가 일반분양된다. 1 4호선 금정역에서 가깝고 외곽순환도로 산본IC를 이용해 수도권 진출입이 편리하다. 주변에 능앙공원을 비롯해 동산공원 중앙공원이 자리해 쾌적한 주거환경을 자랑한다. 광명시 철산3동에 건립되는 래미안광명 역시 총 2072가구의 대단지로 눈길을 끈다. 철산근린공원을 중심으로 하안본 2단지 하안본 1단지 철산주공 2단지 등이 새아파트로 탈바꿈할 예정으로 향후 7400여가구에 달하는 미니 신도시로 조성될 예정이다. 7호선 철산역이 도보로 10분 거리에 위치해 있고 서부간선도로 진입이 용이하다. 고양시 원당주공 2단지를 재건축하는 원당래미안 역시 1651가구의 대단지다. 후분양단지로 225가구가 일반분양된다. 인근에 8만평의 성사체육공원 한양CC가 있고 북한산과 한강 조망이 뛰어나다. 성동구에서는 금호19구역과 옥수12구역이 재개발돼 각각 1057가구와 1821가구의 대규모 래미안단지로 거듭난다. 금호19구역은 1057가구 규모로 이 중 33가구가 82 150㎡형으로 일반분양된다. 옥수12구역은 용적률 236%로 개발되며 총 16개동이 들어선다. 총 가구수는 18211로 90가구가 일반분양된다.,https://news.naver.com/main/read.nhn?mode=LSD&mid=shm&sid1=260&oid=016&aid=0000313123,186
148126,2009.07.30. 오후 12:01,부동산,헤럴드경제,부동산특집연수역 인접…프리미엄 보장제 눈길,대우건설은 인천 송도국제도시와 인접한 연수택지지구 중심상업지역에 초고층 주상복합 ‘연수 푸르지오’를 공급한다. 최고 43층의 4개 단지 7개동 아파트 436가구 113 261㎡ 와 오피스텔 235실 50 223㎡ 로 구성돼 있으며 분양가는 3.3㎡당 950만원 아파트 550만원 오피스텔 정도로 인근 시세와 비슷한 수준이다. 대우건설은 ‘인천 청약 바람’에 힘입어 연수푸르지오에 대해 파격적인 분양조건을 내걸어 눈길을 끌고있다. 오는 8월까지의 계약자에 한해 ▷프리미엄 보장제 ▷계약금 정액제 ▷발코니 확장비 무료 ▷시스템에어컨 무상설치 등을 제공하고 있다. 가장 눈에 띄는 것은 프리미엄 보장제로 입주시점에 프리미엄 웃돈 이 붙지않을 경우 최대 3000만원까지 보장해준다. 169㎡ 이상 계약자에게는 3000만원 163㎡이하 계약자에게는 2000만원까지 입주 후 6개월이 지난 후 웃돈을 보장해 주는 제도다. 연수푸르지오에 대한 확신이 없으면 시행하기 어려운 조건인 것이다. 또한 대우건설은 계약금 정액제를 실시하고 발코니 확장과 시스템에어컨을 무료로 설치해 사실상 10% 수준의 분양가 인하혜택을 주고있다. 계약자는 계약금 2000만원 163㎡ 이하 에서 3000만원 169㎡ 이상 으로 계약이 가능하게 된 셈이다. 게다가 인천 연수구는 양도세 60% 면제혜택과 분양권 전매가 가능한 지역으로 계약자의 자금마련 부담을 덜어주는 한편 투자가치도 높여주고 있다. 단지 내 장점도 수요자들이 짚고 넘어갈 필요가 있다. 2011년 개통예정인 수인선 연수역이 단지와 인접해 있으며 차량 10분 이내 거리에 제2경인고속도로 남동ㆍ문학 나들목이 위치하고 있다. 또한 연수동 일대가 30평형대 이하의 아파트가 대부분인 상황에서 연수푸르지오는 중대형 평형이어서 더욱 차별화되고 있다.,https://news.naver.com/main/read.nhn?mode=LSD&mid=shm&sid1=260&oid=016&aid=0000313122,186
148127,2009.07.30. 오전 11:55,부동산,세계일보,서울의 중심 신림역 신축아파트 1000만원대 선착순 계약,▷ 지하철 2호선 신림역 도보로 2분 거리 ▷ 강남 16분 서울역 여의도역 20분 ▷ 3.3㎡ 평당 1000만원대 파격 조건 최근 서울 서남 지역을 중심으로 각종 개발 사업이 이루어지고 있다. 상권 형성은 물론 각종 생활 편의시설이 풍부하게 들어서면서 주거용 부동산 매매도 활발하게 진행되고 있다. 특히 지하철 2호선 신림역 2분 거리에 위치해 있는 “가야 위드안”은 편리한 교통과 평당 900만원대라는 파격적인 조건으로 선착순 수의 계약되고 있어 실수요자들의 발길이 끊이지 않고 있다. ▷ 융자 50% ▷ 무제한 전매 가능 ▷ 롯데백화점 포도몰 아울렛 보라매병원 관악산 인접 114.88㎡ 34평형 의 A타입과 115.33㎡ 34평형 B타입 81.26㎡ 24평형 C타입 이렇게 총3가지로 구성되어 있는 “가야 위드안”은 지하4층 지상10층 연면적 2만3천967㎡ 규모로 B4 2층은 주차장 B1층은 부동산 대형마트 휘트니스 센터 대형 찜질 사우나 등이 입점될 예정이며 지상1층은 스크린골프 약국 쥬얼리 테이크아웃 잡화 의류 등 각종 판매시설로 조성된다. 그만큼 생활편의적인 아파트로 평가받고 있다. 롯데백화점과 씨앤백화점 포도몰 아울렛이 인접하고 있어 쇼핑환경이 뛰어나고 보라매공원과 관악산 보라매 병원도 가까이 위치하고 있다. 특히 서울대학교와 숭실대학교 영어마을 효과로 인해 탁월한 교육여건을 자랑한다. ▷ 서울대학교 숭실대학교 국제신학대학교 당곡 초.중.고 신림 청소년 독서실 등 ▷ 2014년 4차로 신림 봉천터널건설 심각한 교통난 해소 ▷ 시흥IC 강남순환도시고속도로 건설 2014년완공 여기에 신림뉴타운 경전철 확정 강남순환도시고속도로 개통 등 각종 개발 호재까지 풍부해 투자가치는 물론 높은 프리미엄을 기대할 수 있다. “가야위드안” 관계자는 가야위드안이 30년 전통의 가야쇼핑을 재건축하는 재래시장 재건축 사업의 일환 이라며 청약통장 및 전매제한과 무관하고 고가주택에 해당되지 않아 과세대상에서도 배제된다 고 설명했다. 그리고 가야위드안 자금관리는 계약 시 아시아자산신탁 주 에서 관리하므로 안전하고 믿을 수 있다. ♣ 평당 1200 1500만원 상향 조절 예정 신청계좌 신한은행 100 024 060377 예금주 주 토마토씨앤씨 상담 신청금 접수 문의 02 887 3666 홈페이지 바로가기 www.withan.net ♣ 미계약 시 신청금은 전액 환불 Segye.com 인기뉴스 알몸뉴스 중단위기…앵커들 돈도 못받아 남친 집에서 도둑질…20대女 CCTV에 덜미 미달이 김성은 조승우와 연기해보고 싶다 미스재팬 의상논란…기모노 포르노 호날두냐 벤제마냐 레알 마드리드 딜레마 현직교사 딸 다니는 학교 교사 폭행 ⓒ 세계일보 Segye.com 무단 전재 및 재배포 금지 ☞공짜로 연극ㆍ뮤지컬보기 ☞2009 피스컵 안달루시아 세계닷컴은 한국온라인신문협회 www.kona.or.kr 의 디지털뉴스이용규칙에 따른 저작권을 행사합니다.,https://news.naver.com/main/read.nhn?mode=LSD&mid=shm&sid1=260&oid=022&aid=0002062643,186
148128,2009.07.30. 오전 11:54,부동산,머니투데이,왕좌 탈환한 현대건설 영욕의 6년,머니투데이 서동욱 기자 6년 만에 국내 건설업계 1위 시공능력평가액 기준 를 탈환한 현대건설은 2000년대 들어 영욕의 세월 을 보냈다. 지난 1947년 설립 이후 건설 한국의 대명사 로 불리며 대한민국 경제 성장의 견인차 역할을 해 온 현대건설은 2001년 유동성 위기와 함께 위상이 흔들렸다. 가뜩이나 집중적인 견제를 받아온데다 자체 경쟁력마저 떨어지면서 대폭적인 수주 감소와 수익성 악화로 2004년에 처음으로 42년간 지켜왔던 1위 자리를 삼성물산에 내줬다. 김중겸 현대건설 사장 이후 구조조정과 영업력 확대 등 뼈를 깍는 자구책을 실시했지만 재무구조는 크게 나아지지 않았고 급기야 2005년과 2006년 3위로 떨어진 이후 2007년에는 4위까지 추락했다. 하지만 부활의 신호탄은 지난해 예고됐다. 세계적인 금융위기 속에서도 안정적인 사업 포트폴리오를 구성하고 수익성 중심으로 기업을 운영하면서 업계 최초로 매출 7조원 시대를 연 것. 지난 3월 김중겸 사장 취임 이후에는 재개발·재건축과 공공부문 수주 역량이 강화됐고 해외에서도 대형 공사를 잇달아 수주하는 등 글로벌 기업으로서의 위상을 공고히 하고 있다. 특히 중동에서 수조원대의 초대형 플랜드 공사를 수주하는 등 아라비아 반도의 산업지도를 다시 그리고 있다. 이달들어선 17억200만달러 2조2000억원 규모의 아랍에미리트 UAE 통합 가스개발 시설공사를 수주하는 등 2차 중동붐 을 이끌고 있다. 이 공사는 아부다비에 있는 국영 석유회사 가스코 GASCO 에서 발주 이 지역에 산재돼 있는 가스전 통합 개발 공사다. 현대건설은 총 5개의 패키지 가운데 2공구를 맡았다. 현대건설은 올 상반기에 지난해 같은 기간보다 42.9% 증가한 4조6402억원의 매출을 올려 건설업계 역대 최대 기록을 갈아치웠다. 이는 매출액 증가는 중동 플랜트 부문을 비롯한 해외 매출 증가와 국내 토목분야 실적 증가에 따른 것. 영업이익과 순이익은 각각 2312억원과 2207억원을 올렸다. 이같은 실적 호조에 따라 최근들어 최고경영자 CEO 를 비롯해 현장 중심으로 해외경영을 더욱 강화하고 있다. 지난 27일부터 7일간의 일정으로 중동 현장을 방문한 김 사장은 쿠웨이트 사우디 등의 정부 관계자와 발주처 대표들을 잇따라 만나 수주 관련 활동을 펼치고 있다. 이와 함께 고무적인 것은 현대건설이 올해 시평 1위를 차지했을 뿐 아니라 기술능력과 신인도 평가부문에서도 수위를 차지했다는 점이다. 수주 극대화와 수익성 중심의 사업운영 등 경영 전반에 대한 자구 노력이 결실로 다가온 것이다. 상반기 최고 경영실적과 함께 시평에서도 1위에 복귀 겹경사 를 맞은 현대건설은 앞으로 진정한 글로벌 톱 리더로 도약해 나간다는 계획이다. 현대건설 관계자는 시공실적과 기술능력에 이어 경영과 재무상태도 우량기업으로 성장했다 며 이제는 국내 경쟁보다는 세계 유수의 선진 건설사들과 겨룰 시점 이라고 말했다. 지난 2003년 이후 6년 만에 국내 건설업계 1위에 오른 현대건설은 국내는 물론 해외수주 확대를 위한 경영체계를 구축하고 있다.,https://news.naver.com/main/read.nhn?mode=LSD&mid=shm&sid1=260&oid=008&aid=0002183843,186
148129,2009.07.30. 오전 11:41,부동산,아시아경제,폭스바겐 승용차 제작결함...리콜,국토해양부는 아우디폭스바겐코리아가 수입ㆍ판매한 투아렉 Touareg 승용차 2개 차종 96대에 제작결함이 발견돼 수입사가 자발적으로 결함을 시정 리콜 한다고 30일 밝혔다. 제작결함 내용은 투아렉 Touareg 승용차 뒤쪽에 설치된 스포일러 spoiler 고정 지지대가 운행 중 진동으로 파손될 가능성이 있어 뒤따라오는 자동차의 안전운행에 지장을 줄 수 있는 결함이 발견됐기 때문이다. 리콜 대상은2006년 12월23일부터 2008년 12월10일 사이에 생산된 투아렉 3.0 TDI 7L 와 투아렉 R50 7L 2개 차종으로 자동차 소유자는 오는 31일부터 아우디폭스바겐코리아 서비스센터에서 무상수리받을 수 있다. 리콜하기 전에 자동차 소유자가 수리한 비용도 보상받을 수 있도록 자동차관리법령이 개정돼 법 시행일인 지난 3월29일 이후 자동차 소유자가 직접 제작결함을 시정한 경우 비용 보상을 신청할 수 있다. 자세한 사항은 아우디폭스바겐코리아서비스센터 02 6009 0042 에 문의하면 된다.,https://news.naver.com/main/read.nhn?mode=LSD&mid=shm&sid1=260&oid=277&aid=0002203234,186
148130,2009.07.30. 오전 11:37,부동산,한국경제TV,폭스바겐 투아렉 2개 차종 리콜 실시,국토해양부는 아우디폭스바겐코리아에서 수입 판매한 투아렉 Touareg 승용차 TDI 와 R50 두 개 차종 96대에서 결함이 발견돼 자발적으로 리콜한다고 밝혔습니다. 국토부는 이들 승용차 뒤쪽에 설치된 고정 지지대가 운행 중에 발생하는 진동으로 파손될 가능성이 있고 이럴 경우 뒤따라오는 자동차의 운행에 지장을 줄 수 있어 리콜을 한다고 설명했습니다. 해당 자동차를 가진 사람은 오는 31일부터 아우디폭스바겐코리아 서비스센터에서 무상으로 수리를 받을 수 있습니다.,https://news.naver.com/main/read.nhn?mode=LSD&mid=shm&sid1=260&oid=004&aid=0001982042,186
148131,2009.07.30. 오전 11:35,부동산,헤럴드POP,‘독서광’ 정종환 장관 휴가중 ‘독서삼매경’,지난 29일부터 사흘간의 짧은 휴가에 들어간 정종환 국토해양부 장관은 평소 독서광으로 알려진 대로 휴가기간 자택 경기도 산본 소재 에 머물면서 독서삼매경에 빠져있는 것으로 전해졌다. 최근 정 장관이 읽고 있는 책은 △기적의 사과 △아웃라이어 △공부하는 독종이 살아남는다 △2011년 부동산 대폭등 시대가 온다 4권인 것으로 알려졌다. ‘기적의 사과’는 대자연의 생명력을 굳게 믿고 상식과 불가능을 과감히 뒤집고 무농약 사과재배에 최초로 성공한 고집쟁이 농부의 도전과 역경 눈물과 성취의 감동실화를 다룬책이다. 일평생 오로지 사과에 미쳐서 세계 최초로 썩지 않는 기적의 사과를 생산하며 온세상을 뒤흔든 한 농부의 인생 성공 비결이 주요 내용이다. 또 ‘아웃라이어’는 타고난 지능과 재능 그리고 열정이 성공의 원인이라는 상식에 도전하는 책이다. 이 책은 성공한 사람은 무에서 유를 창조하는 것이 아니라 숨겨진 이점과 특별한 기회요소 그리고 문화적 유산과 역사적 공동체의 혜택을 누려왔다고 지적하고 있다. 특히 관심을 끄는 책은 국내 부동산 시장을 예측한 ‘2011년 부동산 대폭등 시대가 온다’이다. 이 책은 국내외의 다양한 경제지표를 통해서 미국 서브프라임과 대한민국 부동산의 차별적 메커니즘과 부동산 대폭락의 원인과 실리를 이론적으로 조목조목 분석하여 제시하고 있는 책이다. 또 이 책은 대한민국에서 부동산 대폭락이 가져올 부작용이 무엇인지 부동산시장이 상승랠리의 곡선으로 진입할 시기와 부동산 대폭등을 불러올 경제법칙을 등을 설명하고 있다. 국토부 관계자는 “이밖에도 정 장관은 음악에도 조예가 깊은 만큼 아마 휴가중에는 음악CD 감상과 독서 두가지에 심취하면서 재충전을 하게 될것”이라고 말했다.,https://news.naver.com/main/read.nhn?mode=LSD&mid=shm&sid1=260&oid=112&aid=0002024342,186
