,date,cat,co,headline,text,url,week
66573,2007.10.17. 오후 5:45,부동산,파이낸셜뉴스,상한제 피한 ‘밀어내기’ 봇물…내년 미분양 대란 오나,분양가 상한제를 적용을 피한 ‘밀어내기’ 분양물량이 이달 이후 연말까지 전국에서 20만가구에 달할 것으로 예상되면서 미분양 우려가 고조되고 있다. 18일 건설·부동산업계에 따르면 부동산 전문가들은 지금도 지방에서는 미분양 물량이 넘쳐나는 상황에서 연말까지 추가로 밀어내기식 분양이 이뤄질 경우 자칫 미분양 대란에 휘말릴 수 있다고 경고하고 있다. 한 마디로 분양가 상한제 후폭풍이 밀어닥칠 것이라는 얘기다. 일각에서는 이로 인해 오는 2008년 초께는 미분양 물량이 국제통화기금 IMF 외환위기 이전인 1995년의 15만여 가구를 넘어 사상 최대치를 기록할 것이라는 성급한 주장도 제기되고 있다. 건설산업연구원 김현아 박사는 “건설사들이 수요예측을 잘못한 것도 문제지만 정부가 분양가 상한제 시행에 따른 문제의 심각성을 인지하지 못하는 게 더 큰 문제”라며 “분양가 상한제가 가져올 부정적 영향에 대한 문제의식이 약한 것 같다”고 지적했다. 내년 1·4분기엔 미분양 사상 최대 돌파 전망 건설교통부에 따르면 지난 8월 미분양 물량은 9만1714가구로 6월 이후 증가세를 보이고 있으며 지난해 12월 7만3772가구보다 20% 이상 급증했다. 여기에 연말까지 20만가구가 추가 공급예정인 것을 미분양 물량은 앞으로 기하급수적으로 늘어날 전망이다. 아파트 미분양 물량은 주택 200만가구 공급 정책이 시행되던 1995년의 15만2000가구가 최대였으며 IMF 환란기인 1998년에도 10만2000가구로 지난 8월 미분양 물량만도 외환위기 때 수준에 근접하고 있다. 김현아 박사는 “긍정적으로 봐도 연말까지의 공급예정 물량 중 계약률은 50% 정도에 머물 것”이라면서 “이 경우 미분양 물량은 19만가구에 달할 수 있어 내년 1·4분기가 되면 역대 최고치를 기록할 것”이라고 내다봤다. 전국 미분양 물량은 늘어나고 신도시 등 정부의 공공물량이 지속적으로 공급되는 상황에서 건설사들이 연말까지 밀어내기식 분양에 나서는 것은 분양가 상한제를 피하기 위한 것이다. 따라서 연말로 접어들수록 미분양 적체심화 우려가 고조될 것으로 보인다. D건설 관계자는 “분양가 상한제를 비켜가기 위해서는 11월 말까지 분양승인을 받아야 하는 데다 상한제 물량이 본격적으로 나오기 시작하면 기존물량 분양이 더욱 힘들어질 가능성이 높아지면서 분양물량을 연말에 집중하는 것”이라고 설명했다. 연말까지 20만가구 분양대기 부동산정보업체 부동산써브에 따르면 이 달 중순 이후 연말까지 분양예정된 아파트물량은 20만1309가구에 이른다. 지역별로는 서울 1만2129가구 경기 6만4995가구 인천 1만690가구 5대 광역시 5만6330가구 충청권 2만7375가구 기타 지역 2만9790가구 순으로 지방이 절반 이상을 차지한다. 부동산서브 함영진 팀장은 “이처럼 분양물량이 연말에 몰리는 것은 1·11 부동산 대책’ 발표 이후 분양시장 양극화 현상이 나타나자 건설사들이 분양시기를 저울질하며 적극적으로 분양에 나서지 않은 데 있다”며 “2005년 이후 청약통장 가입자는 전국적으로 700만명을 넘어섰지만 실수요자들은 청약통장을 극도로 아끼며 유망단지에만 몰리고 있어 사업장별 분양결과에 희비가 엇갈릴 것”이라고 내다봤다.,https://news.naver.com/main/read.nhn?mode=LSD&mid=shm&sid1=260&oid=014&aid=0000350207,93
66574,2007.10.17. 오후 5:43,부동산,뉴시스,대우건설 올 하반기 굿디자인 6건 선정,대우건설 올 하반기 굿디자인 6건 선정 서울 뉴시스 대우건설이 최근 산자부가 주최하고 한국디자인진흥원이 주관한 2007 하반기 우수디자인상품 선정에 모두 11개 품목을 출품해 6건이 굿디자인 으로 선정됐다고 17일 밝혔다. 선정된 6건은 푸르지오 엘리베이터 디자인 푸르지오 아트월 문주 푸르지오 과학놀이터 트럼프월드마린 아일랜드가든 유니버셜욕조 욕실매입형 악세사리 등이다. 푸르지오 엘리베이터 디자인과 과학놀이터는 상반기에 선정된 월드마크웨스트엔드의 인테리어디자인 에 이어 타 업종 굿디자인 수상제품과 심사를 통해 대통령상이 수여되는 본상 수상후보로 선정되었다. 본상 수상후보로 선정된 푸르지오 엘리베이터 디자인은 폐쇄적이고 협소한 엘리베이터에 감성 자연 웰빙 개념을 도입해 미려한 디자인과 편안한 느낌을 갖도록 해 높은 점수를 받았다. 테마 과학놀이터인 사이언스파크 는 어린이 놀이터에 우주선 형상의 과학 조합 놀이시설을 설치해 다양한 과학원리를 현상 체험을 통하여 자연스럽게 학습할 수 있게 했다. 대우건설 주택상품개발팀장 이희성 부장은 11건을 출품해 6건이 굿디자인에 선정되어 업계 최고의 선정률을 기록했다 며 대표 브랜드인 푸르지오의 디자인 우수성을 객관적으로 입증된 결과로 6년 연속 공급실적 1위를 차지한 푸르지오를 명실상부한 국내 대표 주거브랜드로 자리잡게 하는 끌차 역할을 할 것이다 라고 말했다.,https://news.naver.com/main/read.nhn?mode=LSD&mid=shm&sid1=260&oid=003&aid=0000606246,93
66575,2007.10.17. 오후 5:42,부동산,파이낸셜뉴스,분양정보 화성남양우림필유 344가구,우림건설은 경기 화성시 남양동 도시개발사업지구에서 ‘화성남양 우림필유’ 344가구 조감도 를 공급한다. 화성 남양 우림필유는 지하 2층 지상15층 6개동에 105㎡ 32평형 87가구와 127㎡ 38평형 257가구가 들어선다. 단지 전체를 남향 위주로 배치해 채광이 좋고 주변에 높은 건물이 없어 탁월한 조망권을 갖췄다. 또 단지 레벨을 이용한 주차장 설계로 지상주차장을 최소화했으며 주출입 공간을 호텔식 로비공간으로 꾸며 고급스럽다. 단지 내에는 수변식물과 계절별 초화를 심은 매직아쿠아가든과 자연석이 어우러진 개울가 등 조경공간이 뛰어나다. 서울에서 1시간 거리에 위치해 있고 서해안 고속도로 비봉 나들목이 4㎞ 이내에 위치해 있어 교통 편의성이 좋다. 입주는 2009년 10월 말 예정이다. 견본주택은 18일 현장에서 문을 연다.,https://news.naver.com/main/read.nhn?mode=LSD&mid=shm&sid1=260&oid=014&aid=0000350203,93
66576,2007.10.17. 오후 5:41,부동산,아시아경제,국감건교위 경부운하 문제 있다.없다 팽팽,한나라당 이명박 대선 후보의 공약인 경부운하 문제가 17일 건설교통부 국정감사의 최대 이슈로 떠올랐다. 이날 건교위 소속 대통합민주당 의원 12명은 이날 공동 정책자료집을 내고 한나라당 이명박 후보의 경부운하 공약 11가지 문제점을 집중 제기 철회해야한다고 주장했다. 한나라당 의원들도 이에 반박 자료를 내고 열린우리당 의원들이 야당후보의 지지도를 끌어내리기 위해 국회를 정략적 수단으로 이용하고 있다 며 11개 문제점에 대해 조목조목 반박했다. 먼저 신당 의원들은 경부운하는 경제성이 과대포장됐고 홍수피해와 식수오염 등의 재난위험이 있다 며 총 11가지 문제점을 제기했다. 신당 주승용 의원은 이 후보측 주장대로라면 하루 운행 선박은 12척에 불과하다 며 이를 위해 수십조원을 들여 553㎞의 운하를 건설하는 것이 말이 되느냐 고 비판했다. 문학진 의원도 경부운하는 약 540㎞에 달하는 전 구간을 폭 200∼300ｍ 깊이 6∼9ｍ로 파헤쳐야 가능해 생태계 파괴 수질오염 하천구조물 파괴 지하수위의 급격한 변화로 인한 주변도시 기반시설물 붕괴위험 등 국가적 재앙을 초래할 것 이라고 강조했다. 홍재형 의원은 경부운하 건설은 경제적으로도 환경적으로도 효과가 없고 국토의 골칫거리로 등장할 가능성만 짙어지고 있다 고 말했다. 한나라당 위원들은 신당 의원들의 경부운하 관련 잇단 발언과 자료에 반박했다. 한나라당 박승환 의원은 정부가 5월에 TF팀을 구성해 경부운하 처리 물동량을 연 481만톤으로 가정했는데 부산항 물동량이 인천항 물동량의 10배에 이르는 점을 감안한다면 이 보고서는 허구성이 크다 고 말했다. 박 의원은 또 국정감사에서 미리부터 대선 후보의 공약을 두고 비판하는 것이 맞느냐 고 항의했다. 또 김재경 의원은 미국에서 환경공학을 전공한 박재광교수를 참고인으로 불러 경기운하의 타당성 입증을 시도했다. 박 교수는 수질오염 등 경부운하 관련 신당 의원들의 주장에 라인강은 하루 3만5000척의 바지선이 운항하고 있지만 2000만명이 식수원으로 사용하고 다뉴브강도 1000만명이 식수원으로 사용하고 있다 며 일반처리공정의 정수처리로 얼마든지 상수원 요염을 막을 수 있다 고 강조했다.,https://news.naver.com/main/read.nhn?mode=LSD&mid=shm&sid1=260&oid=277&aid=0000009288,93
66577,2007.10.17. 오후 5:40,부동산,노컷뉴스,비축용 임대주택 민간자금 투자 제로,금융주간사 2곳서 공모 거짓으로 판명 건교부가 추진중인 비축용 임대아파트 시범사업에 민간사업자의 참여가 전무한 것으로 밝혀졌다. 건교부는 이에따라 국민연금의 투자자금을 끌어들이면서 마치 민간사업자가 사업에 참여한 것 처럼 포장해왔던 것으로 드러났다. 17일 국회 건설교통위원회 정희수의원 한나라당 의 국감자료에 따르면 9월20일 비축용 임대주택 사업의 재원마련을 위한 금융주간사 공고모집 결과 서울자산운용이 단독 응모해 우선협상대상자로 선정됐다. 특히 서울자산운용이 만든 펀드에는 국민연금관리공단이 유일하게 투자한 것으로로 밝혀져 결국 시범사업은 민간자금없이 공공자금으로만 추진될 처지에 놓인 것이다. 9월10일 1차 모집에 서울자산운용만이 응모해 다음날인 11일 재공모가 실시됐지만 이때도 서울자산운용이 단독 신청했다. 이는 일정 수익보장 등 건교부의 유인책에도 민간에서는 사업성이 없다고 판단했기 때문이다. 건교부는 9월 20일 보도자료를 통해 시범사업을 위한 투자자 모집에 2개 기관이 신청해 유리한 조건을 제시한 서울자산운용을 우선협상대상자로 지정한다 고 밝힌 바 있다. 하지만 정의원측은 국민연금 외 A사는 공모지침을 어기고 현금 등이 아닌 확약서로 신청보증금을 납부해 심사대상에서 제외돼 사실상 단독 응모로 사업자가 선정됐다 고 주장했다. 시범사업을 위해 재원 중 57.8%는 국민주택기금 융자를 통해 충당돼고 33.8%는 서울자산운용 그리고 나머지는 주공.토공이 조달한다. 정의원은 시중 민간자금을 끌여들여 비축용 임대사업을 벌이겠다는 정부 구상이 사실상 물거품이 된 셈 이라며 비임대주택법이 통과되더라도 축용임대 재원 수십조원을 어떻게 마련할지 의문 이라고 말했다. 한편 향후 10년에 걸쳐 50만가구를 지을 예정이었던 비축용 임대사업 물량은 절반가량으로 줄어들 전망이다. 여.야는 이 사업을 위한 민간자금과 재정지원은 각각 3조원과 3000억원으로 크게 낮추기로 합의한 상태다.,https://news.naver.com/main/read.nhn?mode=LSD&mid=shm&sid1=260&oid=079&aid=0000195263,93
66578,2007.10.17. 오후 5:39,부동산,머니투데이,조세특례 혜택 2주택자 올해 말까지 파세요,머니투데이 김정태 기자 먼저 취득한 주택 팔아야 절세혜택 김모씨는 지난 2001년 서울 송파의 갤러리아팰리스 109㎡ 33평 를 분양받아 보유한 상태에서 2003년 경기도 용인 수지 LG빌리지 152㎡ 46평 기존 아파트를 사들였다. A씨가 집을 팔아야 한다면 어느 아파트를 언제까지 팔아야 할까. A씨가 양도소득세를 물지 않으려면 올해 안에 기존의 수지 LG빌리지를 아파트를 파는 것이 바람직하다. A씨의 경우 올해 안에 LG빌리지를 팔면 양도세를 면제받을 뿐 아니라 2년 이상 살아온 갤러리아팰리스를 팔 때도 양도세를 안내거나 내더라도 2003년 말을 기준으로 오른 집값에 대한 양도세만 내면 되기 때문이다. 이는 정부가 건설경기 부양을 위해 1998 2003년까지 신규 분양아파트를 사들인 사람에 한해 한시적으로 비과세 혜택을 주면서 신축주택과 기존 주택을 1채씩 보유한 2주택자도 기존 주택을 먼저 팔 때는 신축주택은 소유한 것으로 보지 않고 비과세 처리해서다. 신축주택에 대한 특례는 정부가 1998 2003년까지 시행했던 정책으로 이 기간 내에 건설업체로부터 최초로 취득 분양권 전매 제외 한 경우 5년 동안 양도소득세를 면제해줬다. 그러면서 신축주택과 기존 주택을 1채씩 보유한 2주택자에게도 이 같은 비과세 혜택을 부여했다. 그러나 이는 올해 말까지만 적용된다. 신축주택에 대한 5년간 양도세 감면은 그대로 유지되지만 내년부터는 기존 주택을 팔면 시세차익에 따라 9 36%의 양도세를 물어야 한다. 조세특례제한에 해당하는 주요 아파트는 서울지역의 경우 △강남구 도곡동 타워팰리스3차 △대치동 동부센트레빌 △양천구 목동 하이페리온 II 등이며 경기도에서는 △분당 동양파라곤 △용인 보정동 죽전자이 등이 대표적이다. 조세특례제한법은 지난 1998년 5월22일부터 1999년 6월30일까지 전용면적 85㎡ 이하는 1999년 12월 31일까지 수도권지역의 신축주택의 매매계약을 체결한 경우 해당됐다. 수도권 이외 지역은 2000년 11월1일 2001년 5월22일까지의 기간이 추가됐고 또다시 2001년 5월23일 2003년 6월30일까지는 전국 서울 및 분당 등 5대 신도시는 2002년 12월 31일까지 으로 확대했다. 내집마련정보사 강현구 실장은 부동산 관련 조항이 자주 바뀌면서 혼동하는 경우가 많다 며 조세 특례에 적용되는 신축주택과 기존 주택을 한 채씩 보유한 경우에는 올해 말까지 기존 주택을 팔아야 혜택을 볼 수 있기 때문에 2주택자들은 이에 유의해야 절세혜택을 볼수 있다 고 말했다.,https://news.naver.com/main/read.nhn?mode=LSD&mid=shm&sid1=260&oid=008&aid=0000840148,93
66579,2007.10.17. 오후 5:38,부동산,연합뉴스,靑.한 반값 아파트 책임 공방 가열,한 국민 오도하기 위한 사기 아파트 靑 정치권 포퓰리즘 이 정책의 배경 서울 연합뉴스 김종우 김남권 기자 군포 부곡지구 반값 아파트 시범사업 실패를 둘러싼 청와대와 한나라당의 네탓 공방 이 가열되고 있다. 한나라당 홍준표 의원은 17일 국회 기자회견에서 이번 사업은 노무현 정부가 야당의 정책이 엉터리라는 것을 국민에게 오도하기 위한 사기 아파트 였다 며 반값 아파트가 실패한 것이 아니라 정부의 국민 기만책이 성공한 것 이라고 반박했다. 토지임대부 분양주택제도 를 제안했던 홍 의원은 토지임대부 특별법안 등 반값 아파트 관련법안들이 정부 방해로 국회를 통과하지 못했다 며 군포 시범사업은 분양가를 주변시세 대비 반값 이하로 낮출 수 있는 법적 근거와 제도적 장치없이 시행됐다 고 주장했다. 군포 시범사업은 국공유지 활용 우선 용적률 특례를 통한 월세 절감 분양원가 공개를 통한 분양가 절감 토지임대 기간 40년 보장 등이 고려되지 않은 채 강행됐다고 홍 의원은 강조했다. 그는 이는 야당 정책이 성공 되지 않도록 하기 위한 목적의 시범 사업이자 국민 기만술이었다. 야당 정책이 엉터리라고 폄훼하고 오도하기 위한 사기 아파트였다 고 목소리를 높였다. 홍 의원은 건교부는 국.공유지가 대부분인 송파지역과 같은 시범사업 최적지를 버려두고 개발지역 전체가 사유지인 군포지역을 시범사업 지역으로 선택했으며 개발비용 등에 대한 원가 공개를 하지 않아도 되는 지역을 선택했다 고 설명했다. 그는 토공과 주공이 땅장사 집장사를 하지 않고 주거복지 차원에서 용적률을 250%로 높이고 월세도 낮추는 식으로 접근하면 반값 아파트는 현실적 대안 이라며 정부는 반값 아파트 특별법을 즉시 통과시켜야 할 것 이라고 덧붙였다. 이에 천호선 청와대 대변인은 오후 정례브리핑에서 반값 아파트란 말은 애초부터 국민의 기대를 높이는 표현이었다 며 정책의 시범사업 결과 부진하다 는 보도가 있어 사업추진 배경을 충분히 설명하기 위한 것 이라고 말했다. 그는 이 정책의 구체적 실행 배경은 정치권의 한건주의 소위 포퓰리즘 때문이었다는 정부의 판단을 강조한 것도 사실 이라며 정부는 현실적으로 반값이 어렵다는 입장을 분명히 했고 정치권의 강력한 요구에 대해 시범사업을 해보고 결정하자는 입장이었다 고 거듭 강조했다. 이어 대통령 선거를 앞둔 지금 각 당의 대통령 후보가 선거공약을 할 때 또 공약을 국민과 언론이 평가할 때 이런 교훈이 우리에게 유익할 것이라는 것도 말하고자 한 큰 취지의 하나 라고 덧붙였다. 천 대변인은 또 분양가가 반값이 안돼 성과가 부진한 것 이란 한나라당 주장에 대해 우리는 반값 분양가를 맞추는 게 거의 불가능하다는 판단이 당초부터 있었다 고 반박했다. 그러면서 엄청난 용적률을 허용하는 기괴한 아파트를 짓거나 엄청난 사업주체가 엄청난 손해를 감수하는 수밖에 없는데 이는 바람직하지 않고 지속할 수 없는 안정적이지 못한 정책 이라고 비판했다. 그는 이어 한 일간지에 어느 지역에서 반값 아파트가 가능하다고 단정했는데 대개 그 전제는 땅값 문제가 해결된다면 저렴하게 공급된다면 이다 면서 문제는 그것이 쉽지가 않다는 것 이라고 반박했다.,https://news.naver.com/main/read.nhn?mode=LSD&mid=shm&sid1=260&oid=001&aid=0001788566,93
66580,2007.10.17. 오후 5:36,부동산,서울경제,반값아파트 실패는 잘못된 입지선정 탓,전문가들 분양가상한제 적용안되고 면적 협소 최근 논란이 되고 있는 ‘반값 아파트’ 실패는 정부의 잘못된 입지선정 때문이라는 주장이 제기되고 있다. 정부가 토지임대부와 환매조건부 아파트의 시범사업지로 지정한 군포 부곡 지역은 분양가상한제가 적용되지 않는 곳으로 확인돼 사실상 분양가를 최대한 낮출 수 없는 구조이기 때문이다. 게다가 이 지역은 미니 신도시급 면적에 교통여건도 좋지 않아 전문가들은 분양 실패를 예상하고 있었다. 17일 대한주택공사에 따르면 지난 15일부터 분양에 들어간 군포 부곡지구 내 토지임대부ㆍ환매조건부 아파트는 분양가상한제 대상에서 제외된 지역이다. 주공의 한 관계자는 “이번에 분양한 토지임대부ㆍ환매조건부 아파트는 2004년 8월 사업승인을 받은 곳으로 분양가상한제 대상에 포함되지 않는다”고 밝혔다. 공공택지 전용 85㎡ 이하 아파트에 분양가상한제가 적용된 것은 2005년 1월부터로 그 이전에 사업승인을 받은 군포 부곡지구는 상한제 적용 대상이 아니라는 것이다. 상한제 제외로 군포 부곡지구 토지임대부ㆍ환매조건부 아파트는 주공 임의대로 분양가를 책정했으며 분양가 내역도 공개하지 않고 있다. 이에 따라 건축비도 3.3㎡당 450만원 안팎으로 책정됐다. 이는 최근 주공이 분양한 파주 신도시 운정지구 아파트보다 최소한 100만원 이상 비싼 것이다. 특히 시범단지를 분양한 군포 부곡지구는 주변에 이렇다 할 기반시설조차 없는 외곽지역인데다 지구 면적이 47만3 300㎡ 주택 수가 3 000가구가 채 안돼 일반 재개발단지 규모에 불과한 미니지구라는 점도 정부가 분양 실패를 자초했다는 의혹을 들게 하고 있다. 한 민간 부동산전문가는 “일반적으로 시범사업지의 경우 수요자의 관심을 모으기 위해 최상의 사업여건을 갖춘 곳을 선택한다는 점을 감안하면 ‘반값 아파트’ 시범단지는 난센스에 가깝다”고 말했다.,https://news.naver.com/main/read.nhn?mode=LSD&mid=shm&sid1=260&oid=011&aid=0000203154,93
66581,2007.10.17. 오후 5:33,부동산,서울경제,靑 반값아파트 백지화 연내 결정,정부 책임없다 재차 강조 청와대는 반값 아파트의 백지화 여부를 연내 결정짓겠다고 17일 밝혔다. 청와대는 그러나 정책 실패의 책임을 떠넘기고 있다는 지적에는 또다시 ‘책임이 없다’는 점을 고수했다. 천호선 청와대 대변인은 이날 오후 정례 브리핑에서 “반값 아파트의 3순위 분양이 끝난 만큼 이를 토대로 여러 가지 분석을 할 것”이라며 “사회적 토론과 합의를 통해 백지화 여부에 대한 최종 결론을 올해 안에 내놓을 것”이라고 밝혔다. 그러나 이날 끝난 3순위 분양에서도 미분양이 해결되지 않은 만큼 정책 실패는 기정 사실화된 상황이어서 정책 실패에 대한 원인 분석작업이 조만간 본격화할 것으로 보인다. 천 대변인은 이와 관련 “ 이번 분석 작업에는 처음 입지가 잘못됐다는 지적 등도 포함될 것”이라고 밝혀 청와대의 의지와 관계 없이 정부의 책임론이 비등해질 가능성을 배제할 수 없다. 그런 상황임에도 청와대는 이날 정부는 책임이 없다는 점을 계속해서 강조했다. 천 대변인은 “반값 아파트가 구체적으로 실행되게 된 배경에는 정치권의 한건주의식 포퓰리즘 인기 영합주의 이 작용했다”면서 “ 전날 정치권의 책임론을 강조한 것은 대선을 앞둔 지금 후보가 공약하고 시민과 언론이 평가할 때 이런 교훈이 유익할 것이란 취지에서였다”고 설명했다. 한편 권오규 부총리 겸 재정경제부 장관은 국정감사 답변을 통해 최근 대거 분양 미달 사태를 빚은 군포 부곡지구 ‘반값 아파트’ 문제에 대해 17일 “이번에 분양되지 않은 물량을 정부가 매입 임대로 전환하는 방안을 생각해보겠다”고 밝혔다.,https://news.naver.com/main/read.nhn?mode=LSD&mid=shm&sid1=260&oid=011&aid=0000203145,93
