,date,cat,co,headline,text,url,week
310922,2012.05.09. 오후 1:56,부동산,한국경제TV,서울시 9호선 요금인상 계획 철회 다행,서울시메트로9호선 메트로9 이 오늘 9일 대국민 사과 후 지하철 9호선 요금인상 계획을 철회한 것에 대해 서울시가 늦었지만 다행 이라고 밝혔습니다. 윤준병 서울시 도시교통본부장은 그 동안 서울시민과 수도권 주민들에게 우려와 심려를 끼친 점에 대해 지휘·감독기관으로서 깊은 사과의 말씀을 드린다 고 말했습니다. 이와함께 메트로9호선 측에 이번 사례를 반성의 계기로 삼아 공공시설을 운영하는 공익사업자로서 역할과 책무를 다해 다시는 민간투자논리에 의해 멈추거나 잘못된 방향으로 가지 않도록 노력해야 한다 고 요구했습니다. 윤 본부장은 그 동안 언론과 의회 등을 통해 제기된 문제점을 원점에서 재검토하고 시민의 눈높이에 맞게 조율하면서 시민의 이익이 최대한 보장될 수 있도록 협상을 진행해 나갈 것 이라고 강조했습니다. 특히 민자사업 전반에 대해서도 구조적인 문제점을 점검하고 합리적으로 제도를 보완해 나갈 것 이라고 덧붙였습니다.,https://news.naver.com/main/read.nhn?mode=LSD&mid=shm&sid1=260&oid=004&aid=0002130848,331
310923,2012.05.09. 오후 1:56,부동산,한국경제TV,교통안전공단 사고후유 장애인 주거환경 개선 지원,교통안전공단은 자동차사고 후유장애인 가정의 주거환경 개선사업을 올해부터 새롭게 추진한다고 밝혔습니다. 이번 사업은 출입문 문턱보완 도배 좌변기 손잡이 등을 무상으로 개·보수해 주는 것으로 교통사고로 인한 1급 중증후유장애인 가정 중 신청을 받아 주거환경이 열악한 가정을 우선적으로 선정해 실시합니다. 정일영 이사장은 앞으로도 생활형편이 어려운 자동차사고 피해가족에 대한 다양한 지원을 통해 사회 구성원으로서 이들이 밝고 건강하게 살아갈 수 있도록 노력하겠다고 밝혔습니다.,https://news.naver.com/main/read.nhn?mode=LSD&mid=shm&sid1=260&oid=004&aid=0002130847,331
310924,2012.05.09. 오후 1:42,부동산,매일경제,공사심의제도 공정성 강화 간담회,국토해양부는 9일 서울 양재동 교육문화회관에서 13개 공공발주기관 대 중.소 건설사들이 참여한 가운데 공사 심의제도 공정성 강화를 위한 합동간담회를 개최했다. 국토부는 이 자리에서 지난달 발표한 설계심의제도 공정성 강화방안을 설명하고 업계 공동노력을 촉구했다. 아울러 입찰시 지질조사자료 제공 등을 통한 업체 측 입찰부담 완화 등 향후 실천계획도 발표했다.,https://news.naver.com/main/read.nhn?mode=LSD&mid=shm&sid1=260&oid=009&aid=0002712268,331
310925,2012.05.09. 오후 1:27,부동산,매일경제,미분양 털어내기…눈물 겨운 이색 마케팅,입주 직전에 계약을 해지하더라도 계약금을 돌려 드립니다 미분양 아파트를 털어내기 위한 건설사들의 이색 마케팅이 활발하다. 중도금 무이자 발코니 확장비 지원 등은 물론 계약을 해지하더라도 계약금을 돌려주는 계약금 안심보장제 에 분양금 캐시백 자녀 교육비 지원 등의 혜택까지 제공하며 잔여물량 소진에 나서고 있다. 단지별로 청약자에게 유리한 다양한 조건이 제시되고 있기 때문에 저렴한 가격에 좋은 집을 마련할 수 있는 기회다. 지난해 11월 김포시 풍무동에서 분양을 시작한 한화 꿈에그린 유로메트로 는 입주시점에 계약자가 해약을 원할 경우 계약금까지 돌려주고 해약을 허용하는 계약금 안심보장제를 내걸었다. 1.2블록을 합쳐 총 1810가구에 달하는 매머드급 단지로 전체 가구수의 35%가 미분양으로 남아있다. 지난 4월 분양한 서울 은평구 응암동의 녹번역 센트레빌 도 빠른 물량 소진을 위해 각종 혜택 제공에 나섰다. 당초 4억5473만원이었던 기준층 전용 84㎡의 분양가는 4억3788만원으로 5% 내렸다. 1회차 중도금을 납입할 경우 추가로 분양가의 2%를 현금으로 지급하는 캐시백 혜택도 주어진다. 전용 114㎡의 경우 분양가의 3%를 캐시백으로 돌려받을 수 있으며 잔금을 모두 납부하면 자녀 교육비로 1년간 2400만원을 지원해 눈길을 끈다. 강서구 화곡3주구 재건축 아파트인 강서 힐스테이트 는 1억원 선 분양가의 10% 이던 계약금에 최소정액제 를 적용해 현재 3500만원만 내면 계약이 가능하다. 1 4층 저층 계약자에게는 중도금 60% 5 10층 계약자에게는 중도금 30%를 무이자 지원하는 세대별 중도금 차별 지원 서비스도 진행 중이다. 가구.가전 설치 및 발코니 무료 확장과 같은 전통적인 방식의 혜택을 주는 곳도 많다. 2월 공급된 경기 광교신도시 광교 푸르지오월드마크 는 붙박이장 설치와 발코니 확장을 무료로 해주고 중도금 이자 후불제를 실시한다. 경기 고양시 덕이동의 일산 아이파크 1.5단지 도 발코니 확장과 시스템에어컨 설치을 무료로 해주며 분양가도 최대 15%까지 인하했다. 다만 단순히 혜택만을 보고 무작정 청약에 나서는 것은 금물이다. 장기간 미분양 상태로 남아있던 단지의 경우 입지나 기반시설 가격 추이 등을 꼼꼼히 살펴 손익계산을 확실히 하는 것이 중요하다. 이영호 닥터아파트 리서치연구소장은 각종 혜택을 받으며 내집 마련의 꿈을 이룰 절호의 찬스지만 혜택에는 반드시 특정한 조건이 붙기 때문에 단서조항을 명확히 숙지하고 분양을 받는 것이 좋다 고 조언했다.,https://news.naver.com/main/read.nhn?mode=LSD&mid=shm&sid1=260&oid=009&aid=0002712240,331
310926,2012.05.09. 오후 1:26,부동산,뉴시스,5·10대책 강남3구 투기지역 해제 확실시,분양시장 양극화는 더욱 심해질 전망 DTI규제 취득세 감면 제외시 효과 반감 서울 뉴시스 우은식 기자 오는 10일 예정된 정부의 추가 부동산대책에 강남3구 투지기지역 해제가 확실시 되고 있다. 하지만 정부의 추가 대책에도 분양시장 양극화는 더 심해질 것으로 보인다. 또 DTI 규제와 취득세 감면 등이 제외될 경우 정부의 추가 대책 효과는 감소할 것이라는게 전문가들의 견해다. 아직까지 10일 나올 대책에 어떤 내용이 최종적으로 포함될지 확실치 않지만 앞서 언급한 것들이 실제로 정책에 반영되어 시장에 영향을 끼친다 해도 찬바람 부는 부동산 시장에 온기를 불어넣기에는 부족할 것으로 예측된다. 부동산 정보업체 닥터아파트의 도움을 받아 그동안 기획재정부 국토해양부 관계자 등이 언급한 부동산 대책 내용에 대해 살펴봤다. ◇강남3구 투기지역 해제돼도 효과는 미미 이번 대책에 포함될 것으로 확실시되는 강남3구 투기지역 해제는 파급력에 비해 효과는 미미할 것으로 예측된다. 투기지역에서 해제될 경우 주택담보인정비율 LTV 과 총부채상환비율 DTI 상한선이 기존 40%에서 50%로 10% 상향 조정된다. 또 강남3구는 주택거래 신고지역에서도 해제가 유력한데 이 경우 주택구입자금 조달계획서를 제출할 필요가 없어진다. 특히 강남3구의 경우 자금 출처를 밝히기 꺼리는 수요자가 많기 때문에 매수심리가 조금이나마 살아날 가능성이 높다. 그러나 이같은 당근책이 거래활성화에 곧바로 영향을 끼친다고 보기에는 어려움이 많다. 중대형과 고가의 주택이 약세인 상황에서 이들 평형이 가장 큰 비중을 차지하고 있는 지역이 바로 강남3구이기 때문이다. 그나마 2003년부터 족쇄로 작용했던 규제를 푼다는 상징적 의미를 갖기 때문에 중장기적으로 국내외 경제가 활기를 찾는 시점에는 집값을 끌어올리는데 긍정적인 영향을 줄 수 있을 것으로 전망된다. ◇정부 대책 내놔도 분양시장 양극화는 심화될 듯 정부의 추가 부동산 대책이 나와도 분양시장의 양극화는 수그러들지 않을 것으로 보인다. 정부가 분양시장 활성화 방안으로 검토하고 있는 것은 분양권 전매제한 완화 청약가점제 완화 재당첨 제한 폐지 등이다. 분양권 전매제한 기간 완화의 경우 거래가 거의 끊기다시피 했던 분양권 거래는 숨통이 트일 전망이다. 특히 수도권 공공택지 중 지구면적 50% 이상 개발제한구역을 해제한 경우 현재 7 10년의 전매제한 기간이 있는 보금자리주택까지 완화해 준다면 적지 않은 파급력이 클 것으로 보인다. 반면 이번 대책에서는 수도권 공공택지 내 전용면적 85㎡ 이하 주택 전매제한 3년 과 그린벨트 해제 공공택지 내 민영주택 전매제한 5년 정도가 완화될 것으로 보인다. 수도권 민간택지의 경우 현행 1년인 전매기한을 폐지하는 것이 유력하다. 무주택자 위주의 주택공급방안인 청약가점제 역시 개선될 것으로 보인다. 청약가점이 높아 당첨 가능성이 큰 사람들은 오히려 경제능력이 없는 경우가 많기 때문이다. 가격이 비싼 민영주택에는 청약가점제를 줄일 가능성이 크다. 재당첨 제한 조항도 축소 또는 폐지가 유력하다. 그동안은 아파트를 분양받을 경우 일정 기간 1 5년 동안 다시 청약을 할 수 없도록 묶어뒀었다. 앞서 언급한 분양시장 활성화 방안이 모두 추가 부동산 대책에 포함될 경우 분양시장은 앞으로 사업지에 따라 극명한 온도차 를 보일 것으로 전망된다. 인기지역과 비인기지역에 대한 구분이 지금보다 더 명확해지면서 일부 지역은 오히려 가격이 떨어지는 역풍 을 맞을 수도 있기 때문이다. ◇성공 관건은 금융·세제 완화 정책 정부의 추가 부동산대책이 성공하려면 금융·세제 완화 정책이 제대로 나와야 한다. 이 점이 이번 대책의 핵심이기도 하다. 특히 DTI규제 취득세 추가 감면 생애최초 주택구입자금 대출 미분양주택 양도세 감면 1가구2주택자 비과세 연장 2→3년 등이 이번 대책의 주요 골자가 될 전망이다. 이중 DTI규제 완화와 취득세 추가 감면 조치가 부활할지 여부는 불분명하지만 현재까지는 제외될 가능성이 높다. DTI규제 완화는 가계대출 부실화 우려로 취득세 감면 조치 부활은 지자체 반대 때문에 협의가 원활치 않기 때문이다. 문제는 이 두 가지 방안이 제외될 경우 5·10 부동산대책은 시장에 큰 영향을 주지 못할 것이라는 점이다. 실제로 DTI규제가 완화됐던 2010년 10월 2011년 3월에는 수도권 주택거래량이 크게 늘어났었다. 이는 DTI규제 완화에 따른 직접 수혜자가 늘어서가 아니라 규제 완화 신호로 받아들여 매수세가 살아났기 때문이다. 취득세 감면 조치 부활 역시 주택 실수요자의 거래를 늘릴 수 있는 최소한의 조치지만 추가 대책에서 제외될 경우 매수세 위축은 장기간 지속될 가능성이 크다. 시장 불확실성이 매우 큰 상태에서 주택 취득비용까지 증가한다면 위험을 무릅쓰고 매수에 나설 사람은 많지 않기 때문이다. 반면 대출 자금 확대 자격 완화 금리 완화 등이 예상되는 생애최초 주택구입자금은 신혼부부 등 일부 수혜 계층에게 기회로 작용해 거래활성화에 도움이 될 것으로 예상된다. 또 2009년 2월부터 1년간 시행했던 미분양주택 양도세 감면 조치도 미분양 감소에 도움이 될 것으로 보인다. 하지만 이 방안이 건설사를 위한 특혜라는 여론도 있어 최종 대책에 포함될지는 미지수다. 대신 분양가 할인 등 건설사들의 자구노력이 동반된 경우에 한해 양도세를 깎아주는 방안 등이 검토될 것으로 보인다. 일시적 1가구2주택자의 비과세 기간도 2년에서 3년으로 연장할 경우 경제적 여유가 있는 계층에게 혜택이 돌아가게 돼 포함 여부가 불확실하다. 하지만 이 내용이 포함될 경우 매수세 위축으로 집을 팔지 못해 어려움을 겪던 2주택자들의 숨통이 트일 것으로 예상된다.,https://news.naver.com/main/read.nhn?mode=LSD&mid=shm&sid1=260&oid=003&aid=0004489712,331
310927,2012.05.09. 오후 1:25,부동산,아시아경제,경기도 그린벨트내 단절토지·관통대지 3백만㎡ 해제,수원 이영규 기자 여의도 면적의 절반에 가까운 경기도내 300만㎡의 개발제한구역 그린벨트 토지가 해제된다. 이번에 해제되는 대상 토지는 도내 개발제한구역 내 소규모 단절 토지 및 경계선 관통대지 등이다. 경기도는 이번 개발제한구역 내 소규모 토지 해제로 부동산시장에도 훈풍이 불 것으로 기대하고 있다. 경기도는 9일 18개 시군 관계자들과 소규모 개발제한구역 내 토지 및 관통대지 개발제한구역 해제 추진실태를 점검했다. 이날 회의에서 경기도는 개발제한구역 해제 업무 추진 시 발생하는 문제점이나 애로사항에 대해 의견을 교환하고 시군별 추진상황과 향후 일정 등을 점검해 올해 말까지 해제를 완료할 수 있도록 최선을 다해 줄 것을 당부했다. 지역별 개발제한구역내 관통대지는 고양시 73만8306㎡ 남양주시 47만4220㎡ 양주시 39만9290㎡ 하남시 28만2000㎡ 시흥시 24만6374㎡ 안산시 12만8685㎡ 광주시 12만7400㎡ 수원시 7만582㎡ 등이다. 또 개발제한구역내 단절토지 규모는 남양주시 5만9094㎡ 양주시 5만7209㎡ 안산시 4만6589㎡ 시흥시 3만3182㎡ 고양시 3만146㎡ 의정부시 2만6737㎡ 김포시 2만5213㎡ 등이다. 이들 지역 중에서 안양시는 오는 25일 경기도도시계획위원회 심의를 거쳐 5091㎡인 관통대지에 대한 해제작업을 제일 먼저 추진한다. 한편 소규모 단절 토지는 개발제한구역 지정 후 도로ㆍ철도ㆍ하천 등 공공시설 설치로 인해 단절된 1만㎡ 미만의 토지를 말한다. 반면 경계선 관통대지는 개발제한구역 지정 당시 또는 해제 당시부터 대지의 면적이 1000㎡ 이하로 개발제한구역의 경계선을 관통한 대지를 지칭한다.,https://news.naver.com/main/read.nhn?mode=LSD&mid=shm&sid1=260&oid=277&aid=0002782693,331
310928,2012.05.09. 오후 1:22,부동산,한국경제,한경점포마당 서울 가산디지털단지 커피전문점 신규창업 외 10건,서울 금천구 가산디지털단지 이디야 신규창업 매장 가산디지털단지 내 자리하고 있어 IT사무실이 밀집되어 있고 패션아울렛매장 이용자도 많아 유동인구와 소비인구가 많은 상권. 보증금 5000만원에 월 300만원. 총창업비용 1억2000만원. 상세문의 010 7215 3690 서울 중구 커피테이크아웃 전문 양도양수매장 역세권과 언론사 사무실 밀집지역에 위치하고 있으며 월매출 2000만원 순이익 500만원의 안정적 매출이 장점. 보증금 4000만원에 월 290만원이며 총양도양수금액은 1억5000만원. 상세문의 010 7215 3690 서울 강남역 상권에 위치한 호프전문점 양도양수매장 강남역 1층에 위치한 호프전문점으로 역출구와 가깝고 코너자리에 있어 유동인구 많은편. 월매출 8000만원 순이익 2000만원이며 보증금 1억 총양도양수금액 2억 5000만원. 상세문의 010 6232 1643 서울 강남 도곡동 커피전문점 양도양수매장 도곡역 오피스 건물 로비에 위치한 테이크아웃전문 이디야 매장으로 월매출 1600만원에 순이익 500만원이며 오피스에 위딩홀이 들어와 있어 주말에도 매출기대 가능. 보증금 3000만원 권리양도금액 8000만원. 상세문의 010 6232 1643 경기도 남양주 호평동 프랜차이즈점 양도양수매장 경기도 남양주 호평역과 이마트 주변에 위치하고 있으며 월매출6000만원 순이익 1500만원. 보증금 6000만원에 월 400만원이며 권리양도양수금액 1억4000만원. 상세문의 010 6644 1212 서울 강남 카페베네 창업 양도양수매장 서울 강남에 위치한 카페베네 매장으로 역세권과 대단위 아파트가 밀집되어 있는 복합상원에 위치하여 유동인구 많은 편. 총양도양수금액 4억원. 상세문의 010 6644 1212 서울 성북구 대학교 내 프랜차이즈 커피테이크아웃 신규창업 매장 서울 성북구 대학교 내 벨기에와플을 주메뉴로 하는 매장. 보증금 3000만원에 월200만원으로 총양도양수금액 1억2000만원. 상세문의 010 5599 0061 서울 성북구 닭강정전문 양도양수매장 서울 성북구 아파트와 주택상권 초입에 위치한 닭강정과 떡볶이 테이크아웃 매장. 월매출 3000만원이며 보증금 2000만원에 월140만원. 총양도양수금액 1억3000만원. 상세문의 010 5599 0061 경기 동부권 음식점 양도양수매장 경기 동부권 상업지역과 주택밀집지역이 있는 복합상권에 위치한 매장으로 월매출 5700만원. 실면적158.7㎡에 주차공간 확보되어 있으며 총양도양수금액은 2억원. 상세문의 010 2249 5263 서울 강서권 놀부보쌈 양도양수매장 서울 강서 아파트 밀집지역에 입점되어 있는 매장으로 월매출 3600만원 순이익 700만원이다.,https://news.naver.com/main/read.nhn?mode=LSD&mid=shm&sid1=260&oid=015&aid=0002687447,331
310929,2012.05.09. 오후 1:20,부동산,파이낸셜뉴스,정부건설업계 턴키제도 개선위한 간담회,국토해양부는 9일 서울교육문화회관에서 주요 공공 발주기관 13곳과 국내 30대 대형중견건설업체와 함께 턴키제도 개선을 위한 합동간담회를 개최했다고 밝혔다. 이날 간담회는 최근 일부 지자체와 공기업의 심의관련 비리근절 등을 위한 방안들을 논의해 공정한 경쟁의 룰을 모색하고 그릇된 관행을 개선하기 위해 개최됐다. 국토부는 이날 간담회에서 지난 4월 발표한 턴키 등 설계심의제도 공정성 강화방안을 업계와 발주기관에 설명하고 공동노력을 촉구해 비리근절에 대한 정부의 강력한 의지를 전달했다. 특히 비리행위에 대한 처벌 감점 을 강화하고 감점사항을 지속적으로 관리적용해 공정한 경쟁분위기를 조성하기로 했다. 또 심의위원 상시관리 차단을 위해 낙찰업체는 일정기간 1년 심의위원에게 연구 등을 의뢰하지 못하게 했다. 이와함께 입찰시 지질조사자료 제공 등을 통한 업체의 입찰부담 완화와 총점차등제 및 업체간 토론제도 도입 등 기술경쟁 강화 방안을 소개하고 하반기부터 시행하기로 했다. 국토부는 앞으로도 발주기관 협의회 및 업체 간담회 등을 지속적으로 개최해 발주기관과 업계의 협력을 강화하고 투명하고 공정한 설계심의 문화가 조성될 수 있도록 노력할 계획이다.,https://news.naver.com/main/read.nhn?mode=LSD&mid=shm&sid1=260&oid=014&aid=0002644667,331
310930,2012.05.09. 오후 1:11,부동산,이데일리,법정관리 건설사 직원에 분양 아파트 강매,건설기업노련 경영실패 책임 떠넘겨 10일 회생 대책 촉구 기자회견 예정 이데일리 류의성 기자 임금도 제대로 받지 못하고 있는 직원들에게 미분양 아파트 1000가구를 강매한 법정관리 건설사가 생길 정도다. 전국건설기업노동조합연합 건설기업노련 은 10일 법정관리 및 워크아웃 건설사 회생 대책을 촉구하는 회견을 연다고 9일 밝혔다. 이 단체는 풍림산업 001310 과 우림건설 벽산건설 남광토건 등 35개 중견 건설사 노동조합 연합체다. 건설기업노련은 워크아웃 및 법정관리 건설사들이 직원들에게 미분양 아파트 강매와 임금체불 부당해고 등 책임을 전가하고 있다고 주장했다. 경영실패 책임을 직원들에게 넘기고 채권단은 워크아웃제도 취지를 잊은 채 채권회수에만 열을 올리고 있다는 것이 이들 주장이다. 안중언 건설기업노련 부장은 풍림산업의 법정관리를 시발로 중견건설사들의 위기가 심각한 상황에 이르렀다 며 이들 기업에 대한 올바른 회생대책을 촉구한다 고 말했다.,https://news.naver.com/main/read.nhn?mode=LSD&mid=shm&sid1=260&oid=018&aid=0002598224,331
310931,2012.05.09. 오후 12:59,부동산,아시아경제,경기도시公 미분량 물량 파격조건에 팝니다,수원 이영규 기자 경기도시공사 사장 이재영 가 시장에 내놨으나 팔리지 않는 토지와 공장용지 아파트 처분에 나섰다. 조건도 파격적이다. 무이자할부와 중도금 무이자는 물론 토지리턴제까지 도입했다. 토지리턴제는 계약한 고객이 일정기간 이후 잔금 약정일까지 해약을 요구하면 계약금은 원금으로 납부한 중도금은 일정 금리를 붙여 다시 되돌려주는 제도이다. 경기도시공사는 우선 수원 광교신도시 내 공동주택용지 3만8923 6만175㎡ 는 토지리턴제로 공급한다. 광교 의료시설용지 1만33 1만1347㎡ 안성공도 연립주택용지 1016 1만47㎡ 및 양주홍죽 공장용지 3236 3만3867㎡ 는 토지리턴제 및 무이자할부 공급을 추진한다. 또 미분양용지의 대금납부기간을 최장 5년까지 분할 수납할 수 있도록 조건을 완화했다. 특히 경기도시공사는 연천 백학산단 공장용지 1935 1만6438㎡ 전곡 해양산단 공장용지 2468 4만4527㎡ 에 대해서는 업종변경을 추진키로 했다. 입주가능업종이 지정돼 있는 산업단지 공장용지의 경우 시군과 협의 후 수요에 맞는 적극적인 업종변경을 추진해 수요자 맞춤형 산업단지를 공급한다는 것. 경기도시공사는 아파트 미분양 해소를 위해 파격적인 분양조건도 내걸었다. 김포한강 이편한세상 84㎡ㆍ94세대 과 김포한강 힐스테이트 84㎡ㆍ54세대 는 중도금 무이자를 조건으로 내놨다. 또 김포 양촌 자연앤 84㎡ㆍ26세대 과 파주당동 자연앤 84㎡ㆍ53세대 은 계약금 5% 중도금 50% 무이자 2년 후 잔금납부 등을 분양조건으로 제시했다. 경기도시공사 관계자는 부동산 경기 침체로 분양이 안되는 토지와 공장용지 아파트 매물이 있어 이번에 파격적인 조건을 내걸고 분양을 추진하고 있다 고 배경을 설명했다.,https://news.naver.com/main/read.nhn?mode=LSD&mid=shm&sid1=260&oid=277&aid=0002782684,331
