,date,cat,co,headline,text,url,week
147879,2009.07.29. 오후 5:33,부동산,파이낸셜뉴스,강남 재건축 ‘급랭’..조정기 돌입？,과열 양상을 보일 정도로 단기간 급등했던 서울 강남 재건축아파트 가격이 하락세로 돌아서면서 앞으로의 추이에 관심이 집중되고 있다. 단기급등에 대한 부담감과 재건축 소형평형의무비율 20% 유지 등의 악재로 매수세가 빠르게 위축돼 시장의 불안감이 증폭되고 있다. 하지만 전문가들은 소형평형의무비율 20% 유지나 투기과열지구 내 재건축조합원 지위양도 금지 등의 효과가 제한적이어서 비수기에 소폭 하락하는 일시 조정에 들어갔다고 평가하고 있다. 강남 재건축단지 하락세 확산 29일 강남지역 부동산중개업소에 따르면 이달 말로 접어들면서 강남 재건축아파트 가운데 하락세로 반전되는 곳이 늘고 있다. 강남구 대치동 은마아파트 112㎡는 지난 24일까지 12억2500만원에 호가가 형성돼 있었으나 28일 기준 12억원으로 호가가 내려앉았다. 개포동 주공1단지 49㎡도 같은 기간 10억원에서 9억9000만원으로 내렸고 송파구 잠실 주공5단지 102㎡도 14억원에서 13억9000만원으로 떨어졌다. 닥터아파트에 따르면 강남권 강남·서초·송파 재건축아파트는 지난 28일 기준 전주 대비 0.01%의 변동률을 기록했다. 폭등세를 기록하던 강남 재건축아파트가 지난 3월 13일 이래 처음으로 마이너스로 돌아선 것이다. 닥터아파트 윤송희 전임연구원은 “강남 재건축아파트가 단기 급등한 데 따라 가격이 조정을 받고 있는 것”이라며 “너무 과열됐었기 때문에 당분간 소폭 하락할 가능성이 크다”고 내다봤다. J K투자연구소 권순형 대표는 “상반기 강남 재건축아파트 가격이 크게 오른 것은 용적률 상향 등이 미리 반영된 결과”라며 “최근 전반적인 부동산 가격 회복세가 주춤한 상황에서 더 이상 강남 재건축단지만 오르긴 어렵다”고 평가했다. 전문가 ‘일시적 조정’에 무게 전문가들은 하지만 강남권 재건축아파트 값 하락세에 대해 일시적 조정국면이라는 평가가 지배적이다. 신한은행 이남수 부동산팀장은 “최근 강남권 재건축아파트 가운에 일부 하락 반전하는 곳이 생기는 것은 거래량이 수반되지 않은 가운데 나타나는 몇몇 단지의 호가조정에 따른 것”이라며 “하락세로 접어들었다고 평가하긴 어렵다”고 진단했다. 이 팀장은 “휴가철로 접어들면서 단기간 급등에 따른 휴지기로 봐야 한다”면서 “수요자가 여전히 많기 때문에 당분간 소강 상태가 이어지다 다시 더 오를 가능성이 크다”고 예상했다. 서울시가 최근 확정 발표한 ‘재건축아파트 소형평형 20% 유지’ 계획도 한강변 몇몇 중층 재건축단지만 해당될 뿐 강남권 전체 시장에 미치는 영향은 크지 않다는 지적도 나온다. 현도컨설팅 임달호 사장은 “서울시가 재건축 소형평형의무비율 20%를 유지할 것이란 이야기는 사실 강남권 시장에서는 이미 다 예상하고 있었던 것”이라면서 “몇몇 단지를 제외하고는 사업성에도 큰 영향을 미치지 않는다”고 설명했다. 그는 “최근 일부 단지에서 가격이 하락했다는 것은 10억원 이상 주택에서 1000만∼2000만원 정도 호가가 조정된 것일 뿐”이라면서 “여름휴가철이 지나고 9월로 접어들면서 다시 오를 가능성이 더 크다”고 내다봤다. 조합원 지위양도 금지 시장 효과 미미할 듯 내달 중순께부터 투기과열지구 내 재건축조합원 지위 양도 금지가 풀리는 데 따라 재건축시장에 급매물이 늘어날 것이라는 전망도 기우에 불과하다는 주장이 많다. 해당 아파트가 조합설립인가를 받은 곳 가운데 3년 이내 사업시행인가 신청이 없는 곳 등으로 제한을 두고 있어 강남의 주요 재건축아파트는 대부분 해당사항이 없어서다. 해당 단지 중 관심을 둘 만한 곳은 강남구 개포동 주공아파트 가운데 주공1단지 대치동 청실1차 반포동 신반포 한신1차 등이다. 강남구 개포동 A공인 관계자는 “개포 주공1단지가 내달부터 조합원 지위양도가 가능해져 매물이 늘어날 가능성이 있다고 다른 개포 주공아파트보다 가격이 더 떨어지거나 하진 않았다”면서 “큰 영향은 없을 것으로 본다”고 예측했다. 내집마련정보사 양지영 팀장은 “조합원 지위양도 금지 해제로 인해 강남권 재건축 급매물이 크게 늘어날 가능성은 크지 않지만 그동안 가격 급등락으로 마음고생이 심했던 일부 조합원이 매물을 내놓을 가능성이 있다”면서 “규제 해제 이후 상황을 지켜보고 투자에 나설 필요가 있다”고 조언했다.,https://news.naver.com/main/read.nhn?mode=LSD&mid=shm&sid1=260&oid=014&aid=0002174105,186
147880,2009.07.29. 오후 5:33,부동산,매일경제,남광토건 1350억원 베트남 고속도로 건설 공사 수주,남광토건 대표이사 이동철 은 베트남에서 1 350억원 규모의 고속도로 건설공사를 수주했다고 했다고 29일 밝혔다. 베트남 국영기업 비디피 VIDIFI 에서 발주한 이번 프로젝트는 하노이 하이퐁 고속도로 전체 노선 105.5km 가운데 하이퐁 인근에 위치하고 있는 10공구로 남광토건은 연장 9.2km 노폭 33m 6차로 의 자동차전용도로를 건설하게 된다. 공사기간은 36개월이다. 이번 공사는 총공사금액이 1 350여억원으로 남광토건 매출액 2008년 6 699억원 의 20%에 해당하는 대규모 사업이다. 남광토건은 대외경제협력기금 EDCF 차관으로 수행되는 이번 공사의 총공사금액 중 15%인 196억원을 선수금으로 받게 된다. image0 29일에 진행된 공사계약 서명식에는 비디피 VIDIFI 다오 반 치엔사장 베트남개발은행 니옌 쾅 덩 사장 駐 베트남 임홍재 대사 한국도로공사 해외사업처 김재형 단장 남광토건 이동철 사장 등 양측 대표 및 관계자 50여명이 참석했다.,https://news.naver.com/main/read.nhn?mode=LSD&mid=shm&sid1=260&oid=009&aid=0002136730,186
147881,2009.07.29. 오후 5:32,부동산,파이낸셜뉴스,‘그린홈’ 취득·등록세 50% 감면,이르면 8월부터 에너지 절약형 아파트는 가산비를 최대 3%까지 인정받고 취득·등록세도 50% 감면받을 수 있게 된다. 내년부터는 최대 4m 떨어지도록 했던 주동 간 거리도 5m 이상 떨어뜨려 짓고 판상형으로 지을 경우 6가구 이상을 붙여 지을 수 없다. 국토해양부는 이 같은 내용을 담은 ‘공동주택의 디자인 가이드라인과 그린홈 건설기준’을 마련했다고 29일 밝혔다. 국토부는 이 기준을 토대로 30일 오후 3시 서울 논현동 건설회관 2층 중회의실에서 업계 전문가들을 초빙해 공청회도 개최하고 각 지자체는 이를 기준으로 지역실정에 맞게 세부 지침을 마련할 예정이다. 디자인 가이드라인에 따르면 내년부터 아파트의 주동간 측벽 거리는 종전 ‘4m 이상’이 ‘5m 이상’ 떨어지도록 바뀐다. 주택 저층부의 벽면 외장재는 상부층과 다른 재질이나 색상으로 해서 다채로운 외관을 조성토록 했다. 아파트의 주동 형태는 외관이나 높이 등이 획일화되지 않아야 하며 단지 내 옹벽이 5m를 넘거나 안테나 등 돌출물이 있으면 문양마감 등을 이용해 미려한 외관을 갖추도록 했다. 20가구 이상 지어지는 공동주택은 그린홈 건설기준에 부합할 경우 분양가 가산비를 최대 3%까지 높일 수 있다. 주택사업계획승인을 받고자 할 경우 전용면적 60㎡를 넘는 주택은 총 에너지 비용을 표준비용 대비 15% 이상 절감토록 하고 그 이하의 주택은 10% 이상 낮추도록 했다. 그린홈으로 인정받으려면 대기전력 차단장치 일괄소등 스위치 실별온도 조절시스템 등도 설치해야 한다. 공동주택 디자인 가이드라인 오는 9월 말 사전예약제로 최초 분양되는 보금자리주택부터 우선 적용하고 이르면 내년부터 모든 아파트에 적용할 계획이다. 그린홈은 오는 8월부터 현재 기술수준을 감안해 전용 60㎡ 이하 분양주택은 25% 이상 임대주택은 10% 이상으로 에너지절약 설계방법을 적용할 예정이다.,https://news.naver.com/main/read.nhn?mode=LSD&mid=shm&sid1=260&oid=014&aid=0002174101,186
147882,2009.07.29. 오후 5:30,부동산,머니투데이,남광토건 1350억원 베트남 도로공사 수주,머니투데이 전예진 기자 ↑ 이동철 남광토건 사장 왼쪽 과 다오 반 치엔 비디피 사장 ⓒ남광토건 남광토건은 1350억원 규모의 베트남 고속도로 건설공사를 수주했다고 했다고 29일 밝혔다. 베트남 국영기업 비디피 VIDIFI 에서 발주한 이번 프로젝트는 하노이 하이퐁 고속도로 전체 노선 105.5km 가운데 하이퐁 인근에 위치하고 있는 10공구다. 남광토건은 길이 9.2km 노폭 33m 6차로 의 자동차전용도로를 건설하게 된다. 공사기간은 36개월이다. 총 공사금액은 1350억원 달러당 1264원 적용 로 남광토건 매출액의 20%에 해당한다. 남광토건은 대외경제협력기금 EDCF 차관으로 수행되는 이번 공사의 총공사금액중 15%인 196억원을 선수금으로 받게 된다. 이날 베트남 현지에서 진행된 공사계약 서명식에는 다오 반 치엔 VIDIFI 사장 니옌 쾅 덩 베트남개발은행 사장 임홍재 주 베트남 대사 김재형 한국도로공사 해외사업처 단장 이동철 남광토건 사장 등 양측 대표 및 관계자 50여 명이 참석했다.,https://news.naver.com/main/read.nhn?mode=LSD&mid=shm&sid1=260&oid=008&aid=0002183448,186
147883,2009.07.29. 오후 5:22,부동산,한국경제TV,지방 신규분양 미분양에 부담,앵커 최근 수도권 분양 시장이 되살아날 조짐을 보이고 있지만 지방의 분양 시장은 여전히 안갯 속입니다. 올 하반기에는 상반기보다 더 많은 물량이 나올 예정이지만 이미 쌓일 대로 쌓인 미분양에 발목이 잡히지 않을까 우려됩니다. 이지은 기자가 취재했습니다. 기자 지난 2007년 분양에 들어간 대구시 수성구의 한 주상복합 단지. 내년 입주를 앞두고 미분양이 여전하자 해당 건설사는 파격적인 계약 조건을 내걸었습니다. 입주한 뒤 6개월 이내에 언제든 해약할 수 있는 것은 물론이고 이미 낸 계약금의 이자도 돌려주기로 한 겁니다. 그럼에도 여전히 쌓여 있는 지방의 미분양은 새로운 분양을 앞둔 건설사들의 발목을 잡고 있습니다. 녹취 강종학 대구 분양 관련 대행사 지방은 수도권처럼 지역 개발호재가 많지 않고 지역 경제 차원에서 뒷받침할 동력이 없어서 신규 분양을 하더라도 무리수가 있을 것 같다. 기존의 미분양 털어내기도 급급한 상황이다. 실제로 올해 들어 지금까지 지방에 분양한 아파트 42개 단지는 단 한 곳을 빼고 모두 미달됐습니다. 심지어 10곳 중 8곳은 청약자가 아예 없었습니다. 이런 가운데 다음 달부터 연말까지 지방에 일반 분양될 예정인 물량은 87곳에 모두 5만 8천여 가구. 상반기 분양된 물량보다 많고 지난해 같은 기간 분양된 물량의 2배가 넘습니다. 최근 수도권의 뜨거운 청약 열기를 이어받아 미뤄온 분양에 나서겠다는 것인데 기존 미분양이 많은 까닭에 부담입니다. 아직까지는 분양 시장이 투자 수요 위주로 움직이고 있는 만큼 차익이 확실하지 않은 지방은 쉽지 않은 상황입니다. 인터뷰 김규정 부동산114 부장 지방에도 대표적인 건설사들이 시장을 타진해 볼 수 있는 지역에 분양 물량을 내놓을 예정인데 전반적으로 미분양이 많아 전체 청약률은 높지 않겠지만 일부 주변 산업체 기반 시설이 있어 새 주택에 대한 매수력이 있는 곳은 상대적으로 나은 청약률이나 계약률 보일 것으로 예상한다. 지금까지 지방에 남아 있는 미분양 아파트는 모두 12만여 가구. 아무리 계약의 문턱을 낮춰도 지방은 좀처럼 살아나기 힘든 상황이어서 자칫 미분양만 더 쌓이지 않을까 우려됩니다. WOW TV NEWS 이지은입니다.,https://news.naver.com/main/read.nhn?mode=LSD&mid=shm&sid1=260&oid=215&aid=0000011923,186
147884,2009.07.29. 오후 5:14,부동산,한국경제TV,남광토건 1350억원 베트남 고속도로 공사 계약,남광토건은 지난 15일 베트남에서 수주한 1천350억 원 규모의 고속도로 공사에 대한 계약 체결식을 가졌다고 밝혔습니다. 오늘 29일 오전 열린 체결식에는 이동철 남광토건 사장을 비롯해 발주처인 베트남 국영기업 비디피 다오 반 치엔 사장과 베트남개발은행 니옌 쾅 덩 사장 임홍재 주베트남 대사 등 50여 명이 참석했습니다. 베트남 국영기업 비디피에서 발주한 이번 프로젝트는 베트남 하노이와 하이퐁을 잇는 고속도로 총 105.5km 가운데 10공구를 건설하는 것으로 남광토건은 총 길이 9.2km 폭 33m의 자동차 전용도로를 건설하게 됩니다. 총 공사금액은 남광토건의 지난해 매출액 6천7백억 원의 20%에 달하며 남광토건은 이 중 15%인 196억 원을 선수금으로 받게 됩니다.,https://news.naver.com/main/read.nhn?mode=LSD&mid=shm&sid1=260&oid=004&aid=0001981962,186
147885,2009.07.29. 오후 5:06,부동산,세계일보,김규정의 부동산 특강 휴가철 투자전략,신흥부촌 서초지구 새 아파트 관심 경춘 고속도로주변도 눈여겨 봐야 본격 휴가철이 시작됐다. 자연을 벗삼아 지친 몸과 마음을 추스르고 재충전하는 시간이다. 황금 같은 휴가기간을 더 알차게 쓸 수도 있다. 휴가철에 둘러볼 만한 전국 곳곳의 부동산시장과 상품을 둘러보는 것. 휴가도 만끽하고 부동산 전략도 세우는 그야말로 일석이조다. 휴가지로 이동하면서 둘러볼 만한 새 아파트 분양시장이나 모델하우스를 들러보자. 잠시 쉬어 갈 수도 있고 현장에서 공부도 할 수 있다. 임대단지를 제외하고 7월 현재 분양 중인 사업장이 15곳이고 8월까지 분양을 예정 중인 곳은 21개 단지에 이른다. 남양주 별내지구나 김포 한강신도시 인천 경제자유구역 등 수도권 유망지역부터 부산광역시 등 지방 대도시에서도 새 아파트 공급이 재개될 예정이어서 귀추가 주목된다. 가을 시장을 앞두고 3분기에 입주하는 대단지 새아파트도 관심을 가져보자. 서울에서는 지역 랜드마크로 새로 떠오른 대단지 새아파트촌을 살펴볼 만하다. 서초 반포지구나 강동 고덕지구는 최근 재건축 대단지가 집들이를 하면서 규모는 작지만 지역 내 신흥 부촌으로 떠올랐다. 경기 지역에서도 용인 흥덕지구 남양주 진접지구 입주시장을 비롯해 판교신도시 입주 러시가 연말까지 이어질 예정이다. 판교신도시에서는 7월 말부터 8월까지 임대단지 3개를 포함해 총 7개 단지 4559가구가 입주할 예정이다. 인천 고잔지구 대단지와 송도지구 새아파트촌도 봐두면 좋다. 이번 휴가철에는 새로 뚫린 도로를 이용해 보자. 길도 덜 막히고 시간도 절약하고 도로 주변의 투자처도 살펴볼 수 있다. 지난 15일 개통된 서울∼춘천고속도로를 이용하면 춘천까지 40분 정도면 닿을 수 있다. 가는 길에 남양주와 춘천의 주요 아파트지구를 둘러보고 도로 수혜가 예상되는 단지를 점검해 볼 수 있다. 하반기 분양계획은 물론 분양혜택이 많은 미분양단지도 현장에 상당량 남아 있다. 입주예정 새 아파트도 도로가 개통된 후 실수요 관심이 늘어난 상태다. 용인고속도로도 이용해 보자. 지난 1일 개통된 용인고속도로를 타면 강남에서 판교신도시는 물론 용인 흥덕지구 광교신도시 등을 차례로 둘러볼 수 있다. 용인 신봉 성복 일대 미분양과 하반기 분양예정지 흥덕지구 새 아파트들을 살펴보면 좋다. 지방 휴양지로 가는 길에는 대형 개발 프로젝트나 관련 수혜지역을 둘러보자. 4대강 정비사업지 주변의 토지시장이나 대단위 신흥 택지지구는 이참에 한번 둘러보면 좋다. 계약금 500만∼1000만원 정도면 계약할 수 있는 미분양 아파트도 있다. KTX 역세권 등 상대적으로 청약성적이 좋을 것으로 예상되는 분양시장도 미리 살펴보자. 하반기 경기회복이 진행되면 지방 분양시장에서도 업체들이 서서히 공급에 나설 전망이다. 부동산114 부장 Segye.com 인기뉴스 미달이 김성은 조승우와 연기해보고 싶다 이병헌 영어 대사 어떻게 소화했나 미스재팬 의상논란…기모노 포르노 호날두냐 벤제마냐 레알 마드리드 딜레마 이 먹지는 특수처리한 유로화 6억 사기 미수 출소 허경영 잭슨 사망 3일 전 영혼이 찾아와 ⓒ 세계일보 Segye.com 무단 전재 및 재배포 금지 ☞공짜로 연극ㆍ뮤지컬보기 ☞2009 피스컵 안달루시아 세계닷컴은 한국온라인신문협회 www.kona.or.kr 의 디지털뉴스이용규칙에 따른 저작권을 행사합니다.,https://news.naver.com/main/read.nhn?mode=LSD&mid=shm&sid1=260&oid=022&aid=0002062371,186
147886,2009.07.29. 오후 5:05,부동산,MBN,상반기 수도권 아파트 거래 3년 만에 최저,앵커멘트 상반기 수도권 아파트 거래량이 3년 만에 최저 수준으로 떨어져 부동산시장 침체를 그대로 반영했습니다. 이 와중에도 강남 중대형 등 일부 아파트는 오히려 지난해보다 거래량이 늘었습니다. 윤석정 기자가 보도합니다. 기자 올해 상반기 수도권에서 거래된 아파트는 총 16만 7천여 가구. 지난해 같은 기간보다는 20% 부동산 경기의 전 고점이었던 지난 2006년보다는 40% 가까이 줄어든 수치입니다. 서울지역 거래량은 5만여 건으로 지난해보다 20% 가까이 감소했고 인천과 경기 지역 역시 10% 이상 줄었습니다. 인터뷰 정태희 부동산써브 연구원 올 들어 아파트 거래량이 꾸준하게 증가하고 있지만 세계 경기 침체 여파로 상반기 아파트 거래량은 최근 4년 중 가장 낮은 수치를 기록한 것으로 나타났습니다. 하지만 특정 지역이나 면적별로 살펴보면 거래 양극화가 뚜렷했습니다. 먼저 서울지역에서는 강동구와 서초구 강남구 등 강남지역과 은평구 용산구 등의 거래량이 증가세였습니다. 반면 노원구와 강서구 도봉구는 거래량이 지난해의 절반 수준으로 떨어졌습니다. 수도권에서는 성남시와 용인시 인천 연수구가 큰 폭의 거래 증가세를 보였고 의정부와 부천 안성시는 깊은 거래 침체에 빠졌습니다. 면적별로는 전용 85㎡ 이하 중소형은 12만 9천여 건으로 2006년보다 10만 건 가까이 줄었습니다. 반면 전용 85㎡ 초과 중대형의 경우 지난해보다 거래량이 오히려 40% 이상 증가했습니다. 이는 올 상반기에 수요자나 투자자가 검증된 지역이나 인기 지역으로만 몰리는 쏠림 현상이 두드러졌기 때문으로 분석됩니다. MBN뉴스 윤석정입니다.,https://news.naver.com/main/read.nhn?mode=LSD&mid=shm&sid1=260&oid=057&aid=0000107919,186
147887,2009.07.29. 오후 5:05,부동산,MBN,인천 경제자유구역 분양 러시…하반기 1만 5천 가구,앵커멘트 올 상반기 분양시장의 이슈는 단연 인천 청라와 송도였는데요. 이 두 지역을 포함해 인천 경제자유구역에는 하반기에만 모두 1만 5천여 가구의 분양이 예정돼 있어 관심을 끌고 있습니다. 한성원 기자가 보도합니다. 기자 부동산 침체 속에 분양 불패 행진을 이어갔던 인천 송도와 청라. 일반 택지지구와는 달리 자족성을 높인 경제자유구역이라는 장점에 세제 감면 등의 수혜가 더해지면서 관심이 고조되고 있습니다. 먼저 올 상반기 60대 1의 기록적인 청약 경쟁률을 보였던 송도에서 9월경 1천여 가구가 쏟아집니다. 114 145㎡로 구성되며 3.3㎡당 분양가는 1천3백만 원대에서 결정될 것으로 보입니다. 인터뷰 김주철 닥터아파트 팀장 앞으로 교통여건이 크게 개선될 전망입니다. 또 외국인 학교와 외국인 병원 등의 경제특구로서의 개발 호재도 풍부하기 때문에 장기적으로 장점이 있다고 생각합니다. 청라지구에서도 6개 업체가 분양을 준비하고 있습니다. 중앙호수공원과 상업지구 등이 맞물린 A8블록을 비롯해 60층 규모의 초고층 아파트 또 1천 가구 이상의 대규모 단지 등 4천3백여 가구의 다양한 물량이 공급될 예정입니다. 오는 10월 인천대교 개통과 맞물려 영종하늘도시에서도 첫 분양이 시작됩니다. 9월 중순 6개 업체가 모두 7천2백여 가구를 공급하며 인기가 높은 중소형 평수를 중심으로 3.3㎡당 900만 원 1천만 원대에 분양가가 책정될 것으로 예상됩니다. 세 곳 모두 양도세 전액 면제에 중소형은 3년 대형은 1년간 전매가 제한됩니다. 다만 앞서 송도와 청라 분양처럼 투자수요가 대거 몰릴 것으로 예상돼 입주 시점에 청약 당시의 열기 만큼 집값이 오르지 못할 수 있다고 전문가들은 조언합니다. MBN뉴스 한성원입니다.,https://news.naver.com/main/read.nhn?mode=LSD&mid=shm&sid1=260&oid=057&aid=0000107918,186
147888,2009.07.29. 오후 5:05,부동산,세계일보,분양 정보 휘경동 10개동 아파트 714가구 외,휘경동 10개동 아파트 714가구 SK건설은 최근 서울 동대문구 ‘휘경2재정비촉진구역 재개발사업’을 1097억원에 수주했다. 휘경2재정비촉진구역 재개발사업은 서울 동대문구 휘경동 128 12 일대 2만8777㎡에서 지하 2층 지상 7∼20층짜리 10개동에 아파트 50∼128㎡ 714가구를 짓는 것이다. 2010년 11월 분양과 동시에 착공이 이뤄지며 조합원과 임대아파트를 제외한 146가구가 일반에 분양된다. 휘경2재정비촉진구역은 이문·휘경뉴타운 내에 위치해 있으며 배봉산 근린공원 중랑천 공원 등이 인접해 주거환경이 쾌적한 게 특징이다. 또 지하철 1호선 동부간선도로 한천로 등 이용이 쉬워 교통환경도 뛰어나다. 김포한강신도시 ‘한양 수자인’ 1473가구 한양은 오는 9월 중소형 대단지 저렴한 분양가로 3박자를 고루 갖춘 김포한강신도시에 ‘한양 수자인’ 조감도 아파트를 공급한다. 김포한강신도시 Ab 09블록에 공급되는 한양수자인은 지하 3층∼지상 26층 총 17개동 규모 전용면적 71∼84㎡주택형 1473가구로 구성됐다. 특히 이 아파트는 모든 공급가구가 최근 높은 인기를 보이고 있는 중소형 면적으로 구성돼 있다. 분양가상한제 적용으로 주변 아파트단지보다 저렴한 900만원대의 분양가로 공급될 예정이며 전매 제한은 3년이 적용된다. 수도권 과밀억제권역 외의 지역으로 분류되어 취득일로부터 5년간 양도세가 100% 면제된다. 인근에 모담산과 운유산 생태공원이 연계되며 고층 위주의 공동주택단지가 조성되는 문화교류지구 내에 위치해 있어 단지 주변으로 문화예술의 거리 아트빌리지 문화예술센터 등 차별화된 광역형 문화시설이 도입된다. Segye.com 인기뉴스 미달이 김성은 조승우와 연기해보고 싶다 이병헌 영어 대사 어떻게 소화했나 미스재팬 의상논란…기모노 포르노 호날두냐 벤제마냐 레알 마드리드 딜레마 이 먹지는 특수처리한 유로화 6억 사기 미수 출소 허경영 잭슨 사망 3일 전 영혼이 찾아와 ⓒ 세계일보 Segye.com 무단 전재 및 재배포 금지 ☞공짜로 연극ㆍ뮤지컬보기 ☞2009 피스컵 안달루시아 세계닷컴은 한국온라인신문협회 www.kona.or.kr 의 디지털뉴스이용규칙에 따른 저작권을 행사합니다.,https://news.naver.com/main/read.nhn?mode=LSD&mid=shm&sid1=260&oid=022&aid=0002062369,186
