,date,cat,co,headline,text,url,week
310686,2012.05.07. 오전 8:40,부동산,머니투데이,산보다 강·바다…블루 조망권 아파트 인기,머니투데이 최윤아 기자 알짜경매브리핑 최근 주택시장을 살펴보면 블루 조망권 이 그린 조망권 보다 더 좋은 평가를 받고 있음을 알 수 있다. 블루 조망권은 강·호수·바다를 조망할 수 있는 것으로 무엇보다 희소성 때문에 높은 평가를 받는다. 전문가들이 경매에 나온 블루 조망권 아파트를 눈여겨볼 것을 주문하는 것도 같은 이유에서다. ↑서울 마포구 망원동 한강1차 대주파크빌 . ⓒ사진 제공 부동산태인 7일 경매전문업체 부동산태인 www.taein.co.kr 에 따르면 오는 29일 서부지법7계에서는 서울 마포구 망원동 500 한강1차 대주파크빌 79.38㎡ 이하 전용면적 입찰이 진행된다. 감정가는 5억원 2회 유찰돼 이번 최저가는 3억2000만원이다. 14층 중 7층에 위치하며 방 3개와 욕실 2개다. 주변에는 단독·다세대주택 아파트 교육시설 공공시설 근린생활시설 등이 들어서 있다. 강변북로를 끼고 한강을 마주하고 있어 한강 조망이 가능하다. ↑강서구 가양동 한강아파트. ⓒ사진 제공 부동산태인 14일 남부지법4계에선 강서구 가양동 1460 한강아파트 84.99㎡에 대한 입찰이 실시된다. 감정가는 4억5000만원 1회 유찰돼 최저가는 3억6000만원. 15층 중 9층이며 방 3개와 욕실 2개다. 성재중학교 북측 250m 지점에 위치하고 주변이 대단지여서 주거환경이 양호한 편이다. 버스 정류장이 걸어서 5분 거리다. 올림픽대로를 사이에 두고 한강과 인접해 있어 한강 조망권이 확보된 물건이다. 오는 21일에는 동부지법2계에서 광진구 자양동 87 1 한강 우성아파트 84.72㎡ 입찰이 진행된다. 감정가는 6억5000만원으로 1회 유찰돼 최저 입찰가는 5억2000만원이다. 14일 동부지법4계에서는 강동구 강일동 670번지 강일리버파크 59.87㎡의 두 번째 입찰이 진행된다.,https://news.naver.com/main/read.nhn?mode=LSD&mid=shm&sid1=260&oid=008&aid=0002836968,331
310687,2012.05.07. 오전 8:26,부동산,아시아경제,경기도 나홀로가구 20% 돌파,수원 이영규 기자 경기도내 다섯 가구 중 한 가구는 1인 가구이며 30대가 가장 많은 것으로 조사됐다. 7일 경기도가 2010년 통계청 인구주택총조사 결과를 분석한 결과 도내 1인 가구 비율은 1980년 5.1%에서 2010년에는 20.3%로 15.2%p 증가했다. 30년 새 1인 가구 수가 4배가량 늘어난 셈이다. 연령별 1인 가구 비율을 보면 30대가 24.6%를 차지해 가장 많았다. 이는 가족과 떨어져 경기도에서 출퇴근 하는 사람들이 많은데 따른 것으로 풀이된다. 이에 반해 전국의 1인가구는 70세 이상이 19.2%로 가장 많았다. 경기도의 평균 가구원 수는 1980년 4.5명 1990년 3.8명 2000년 3.3명 2005년 3.1명 2010년 2.9명으로 지속적인 감소추세에 있어 1인 가구 증가세는 지속될 것으로 전망됐다. 경기도는 1인 가구 증가를 감안해 부분 임대형주택 제도 도입 등 중소형주택 공급확대를 추진하고 있다. 또 수요변화에 대응한 주택공급체계 구축을 위해 경기도 2020 주택종합계획 을 올해 말까지 수립할 예정이다. 한편 경기도의 총 가구 수는 2010년 383만 1000 가구로 2005년 332만 90000 가구보다 15.1% 증가했다. 같은 기간의 인구 증가율이 9.3%였던 점을 고려하면 가족의 분화현상이 급속히 이뤄지고 있다는 게 경기도의 설명이다.,https://news.naver.com/main/read.nhn?mode=LSD&mid=shm&sid1=260&oid=277&aid=0002781024,331
310688,2012.05.07. 오전 8:11,부동산,헤럴드POP,GPS 토지 측량 정확도 높아진다,헤럴드경제 백웅기 기자 GPS 정확도가 한층 높아지고 접속제한도 줄어들 전망이다. 국토해양부은 실시간 정밀 GPS 측량시 접속자수에 제한이 없고 위치보정정보 정확도도 3㎝이하에 이르는 ‘단방향위치보정정보 송출시스템 FKPㆍFlat Korrect Parameter ’을 도입해 올해 안에 전국에 서비스할 계획이라고 7일 밝혔다. 실시간 정밀 GPS 측량은 전국의 위성기준점을 이용해 생성한 위치보정정보를 송신 서비스하는 것으로 이번에 국토지리정보원이 도입한 FKP는 많은 사람이 지상파 방송국의 실시간 인터넷 방송을 보듯 일방적 위치보정정보 수신을 가능케 해 접속자 수에 제한이 없다. 그간 사용돼온 ‘가상기준점 VRSㆍVirtual Reference Station ’ 방식이 인터넷 통신모뎀을 통한 사용자 서버간 양방향 송수신 시스템으로 서비스 회선이 200회선으로 제한돼 200명 이상이 동시 접속할 경우 불편을 겪어왔던 점이 대폭 개선될 전망이다. 또 지난해 12월부터 국토지리정보원이 설치한 통합기준점에서 시범서비스를 실시한 결과 통합기준점의 평면좌표값과 차이는 평균 3㎝ 미만으로 일반측량 사용에도 적합한 것으로 나타났다. 국토부 관계자는 “올해 중 내륙지역 내년엔 도서지역으로 확대 서비스할 예정으로 FKP 서비스가 본격적으로 제공되면 위성측량시간 단축 및 측량비용 절감 뿐 아니라 위치정보제공 서비스 관련 산업도 활성화 될 것으로 기대된다”고 밝혔다.,https://news.naver.com/main/read.nhn?mode=LSD&mid=shm&sid1=260&oid=112&aid=0002295396,331
310689,2012.05.07. 오전 8:04,부동산,아시아경제,경기도 향남2지구 동서간선도로 연내 착공된다,수원 이영규 기자 경기도 화성 향남2지구의 향남사거리와 양감IC를 잇는 6.16Km의 왕복4차선 동서간선도로 가 연내 착공된다. 경기도는 화성 향남2지구 택지개발사업 광역교통개선 대책에 포함됐으나 관계기관 간 이견으로 착공시기가 불투명했던 동서간선도로에 대해 사업시행자인 LH와 화성시간 중재를 통해 올해 착공키로 했다고 7일 밝혔다. 이번 공사는 총 1270억 원의 사업비가 투입된다. 동서간선도로는 사창 교차로의 교차 형식에 대한 화성시와 LH간 이견으로 동서간선도로 도시계획시설 변경 결정 및 실시계획인가 절차가 지연되면서 올해 착공여부가 불투명했다. 그러나 경기도는 5월 중순 도시계획시설결정 및 실시계획인가 고시를 완료하고 LH가 7월부터 보상절차를 진행키로 하는 등 두 기관 간 중재를 거쳐 올해 말부터 공사를 추진키로 했다. 동서간선도로가 개통되면 국지도 82호선 동오사거리 향남IC 교통량 분산은 물론 서해안고속도로 국도43호선과 39호선 팔탄북부 우회도로와 연계되는 광역교통망이 갖춰져 낙후된 화성 서부 권역의 균형발전에 큰 도움이 될 전망이다. 이 도로는 서해안 고속도로 발안 IC에서 향남2지구를 거쳐 팔탄북부우회도로와 서수원 평택간 민자고속도로를 연결하는 도로로 향후에는 양감 서탄간 도로 2016년 개통예정 평택시 및 서부우회도로 지방도 314호선 와도 연계된다.,https://news.naver.com/main/read.nhn?mode=LSD&mid=shm&sid1=260&oid=277&aid=0002781002,331
310690,2012.05.07. 오전 7:21,부동산,아시아경제,한국생산성본부 프로젝트 파이낸싱실무 과정 개설,아시아경제 박미주 기자 한국생산성본부가 ‘프로젝트 파이낸싱실무’ 과정을 개설한다. 이 과정은 부동산 개발사업에 필요한 프로젝트 파이낸싱 관련 제도 제반지식 및 기법 사례분석 등 실무 위주의 강의로 최근 위축된 PF시장 상황을 극복할 수 있는 방안을 모색할 예정이다. 온라인 수업도 함께 들을 수 있으며 이달 29일부터 31일까지 진행된다.,https://news.naver.com/main/read.nhn?mode=LSD&mid=shm&sid1=260&oid=277&aid=0002780983,331
310691,2012.05.07. 오전 6:53,부동산,아시아경제,6월 입주 2만5천가구 풍성.. 서울은 1천가구 그쳐,아시아경제 박미주 기자 오는 6월 상반기 중 가장 많은 물량이 입주를 기다린다. 5월의 4배에 달한다. 하지만 서울에서는 1000가구에 못 미치는 739가구만이 입주에 들어간다. 부동산정보업체 부동산1번지에 따르면 6월 입주를 앞둔 아파트 주상복합 임대 포함 오피스텔 제외 물량은 전국적으로 34개 단지 2만5455가구로 집계됐다. 이는 5월 6399가구 대비 1만9056가구 늘어난 수치다. 수도권에는 서울 739가구 경기 6914가구 인천 1521가구 등 총 9174가구로 전국 물량대비 35.5% 가량 차지한다. 서울은 2개 단지 739가구에서 입주를 기다리고 있다. 5월 563가구 보다 늘었지만 여전히 적은 물량이다. 경기는 전월 대비 4434가구 증가해 10개 단지 6914가구가 입주할 전망이다. 김포 한강신도시의 물량이 경기 전체 물량의 53.54%를 차지하고 있으며 총 3개 단지 중 2개 단지가 1000가구가 넘는 대단지다. 가평군은 긴 휴식기를 마무리 하고 2008년 이후 4년 만에 신규 물량을 선보인다. 인천은 3개 단지 1521가구가 준공을 앞두고 있다. 5월 1496가구 보다 25가구 늘었지만 남동구 서창동 1196가구 한 곳으로만 물량이 집중돼 있어 나머지 지역의 대기수요를 충족시키기에는 부족한 모습이다. 수도권을 제외한 지방의 경우 19개 단지 1만6281가구에서 집들이가 진행될 계획이다. 전월 1860가구 보다 1만4421가구나 늘어난 물량이다. 지방 입주물량은 5월에 이어 부산 5개 단지 6818가구 에 가장 많은 물량이 배치됐다. 이어 충남 5개 단지 4582가구 대전 2개 단지 1269가구 전북 2개 단지 1089가구 충북 2개 단지 930가구 울산 1개 단지 918가구 경남 1개 단지 369가구 강원 1개 단지 306가구 순이다. 울산과 강원은 올해 들어 처음으로 신규 입주 물량이 공급된다. 서울특별시 마포구 합정동 메세나폴리스 메세나폴리스는 공급면적 163 322㎡ 4개동 최고 39층 총 617가구로 구성됐다. 지하철 2 6호선 더블 환승역인 합정역이 단지와 직접 연결돼 있어 편리하다. 교육시설은 성산초 성산중 등이 도보로 10분여 거리에 위치해 있으며 생활편의시설인 현대백화점 홈플러스 등을 차로 15분 내외면 이용 가능하다. 경기도 김포시 장기동 호반베르디움 김포한강신도시 Aa 07블록에 들어설 호반베르디움은 15개동 지상 15 21층의 규모로 총 1584가구다. 수요층이 두터운 중소형 공급면적 82㎡ 만 공급한다. 48번 국도와 인접해 있어 교통이 편리하며 도보로 15분 정도 가면 운유초 장기중 등의 교육시설이 있다. 생활편의시설로는 차로 7분 거리에 롯데마트가 있으며 단지 주변으로 근린공원이 많이 조성돼 있어 쾌적한 환경을 갖추고 있다. 부산광역시 금정구 장전동 벽산블루밍 장전동 벽산블루밍아파트는 장전1 2구역을 재개발한 아파트로 공급면적 86 205㎡ 총1539가구로 이뤄졌다. 단지별로는 1단지 118가구 2단지 1335가구 3단지 86가구다. 부산지하철 1호선 온천장역과 부산대앞역의 중간 지점에 위치해 있어 차로 8분 내외면 지하철을 이용할 수 있다. 장전중을 중심으로 부산의 대표학군으로 불리 우는 동래학군에 속해 있어 교육환경도 우수하다. 차로 11분여 거리에는 롯데백화점 홈플러스 GS마트 등 풍부한 생활편의시설이 있다. 충청남도 연기군 남면 세종시 첫마을 푸르지오 힐스테이트 래미안 세종시 첫마을 2단계 아파트인 푸르지오 1240가구 공급면적 109 193㎡ 22개동 최고 28층 와 힐스테이트 1388가구 공급면적 109 194㎡ 15개동 최고 29층 래미안 1328가구 공급면적 77 196㎡ 13개동 최고 29층 이 6월 입주한다. 도보로 11분 내외면 한솔초 한솔중 등의 교육시설로 이동 가능하며 비슷한 거리에 세종공원이 있어 쾌적하다.,https://news.naver.com/main/read.nhn?mode=LSD&mid=shm&sid1=260&oid=277&aid=0002780971,331
310692,2012.05.07. 오전 6:01,부동산,이데일리,몸값 낮춘 일본 조립식 단독주택 한국서 성공할까,이에스하임 미코하우스 등 3.3m²당 700만원대 출시 한국식 온돌문화와 안맞아 난방땐 바닥 뒤틀려 문제 이데일리신문 이 기사는 이데일리신문 2012년 05월 07일자 30면에 게재됐습니다. 이데일리 이진우 기자 일본 단독주택 건축 전문업체들이 종전보다 20% 이상 저렴해진 평당 700만원대의 조립식 주택을 들고 한국 시장을 노크하기 시작했다. 이에 따라 그동안 높은 건축비가 가장 큰 걸림돌로 꼽혔던 일본 단독주택업체의 한국시장 진출에도 변화가 올 지 관심이 쏠리고 있다. 6일 관련업계에 따르면 일본계 단독주택 업체인 이에스하임과 미코하우스는 최근 3.3m²당 700만원 안팎의 조립식 주택 모듈러 하우스 을 시장에 내놨다. 종전 모델은 3.3m²당 1000만원에 가까운 가격대였지만 한국 시장의 상황을 감안해 700만원대로 낮춰 내놨다는 것. 이에스하임이 내놓은 평당 680만원의 일본산 모듈러 주택. 일본산 조립식 주택은 고객의 주문이 들어가면 일본 현지 공장에서 모든 자재를 제작해 들여와 한국에서는 3일정도 기간동안 조립만 하는 방식이다. 이에스하임 관계자는 주문 후 2개월 정도면 자재들이 한국에 들어오고 인테리어까지 1개월 안에 모두 끝난다 면서 집을 지으면 10년이 늙는다는 말이 있는데 모듈러 주택은 건축주 입장에서 공사현장 스트레스가 없다는 게 가장 큰 장점 이라고 말했다. 이에스하임은 일본 모듈러 주택 업체인 세키스이하임에서 만드는 모듈러 주택 가운데 15개 모델을 3.3m²당 680만원에 50채 한정으로 공급할 계획이다. 이에스하임 관계자는 판교 택지지구 등 비교적 고급 단독주택 주거지에 지어지는 집들은 평당 500만원대에 계약하더라도 이것 저것 비용이 추가되어 평당 600만원 내외에서 지어지고 있다 면서 평당 700만원선인 일본산 모듈러 주택의 가격은 소비자들 입장에서는 그리 부담스럽지 않은 영역으로 들어왔다 고 말했다. 이에스하임이 내놓은 주택 모델은 36평형에서부터 60평형까지로 다양하다. 이에스하임 관계자는 계약을 하겠다는 의사를 보인 분들이 약 20명쯤 된다 면서 작은 평형대를 찾는 경우도 많지만 45평형과 54평형을 추천하고 있다 고 말했다. 약 1500만원 가량의 비용이 추가되는 지열 시스템을 갖추면 단열이 잘 되는 조립식 주택의 특성상 겨울철 난방비를 10만원대로 낮출 수 있다는 게 이에스하임 측의 주장이다. 그러나 여러가지 제약요건이 있는 택지지구의 규제에 맞추기 위해서는 별도의 설계 수정이 필요해 10% 가량의 비용 상승도 따른다. 미사와홈이라는 일본 단독주택 브랜드를 한국에 판매하고 있는 미코하우스도 평당 700만원선의 조립식 주택을 지난달부터 50채 한정판매를 진행중이다. 이 주택은 일본에서 태양의 집 으로 불리는 모델로 지붕 경사도가 45도로 디자인은 아름답지만 지붕 경사도를 15도로 제한하고 있는 우리나라 택지지구 규제 때문에 주로 전원주택용으로만 팔리고 있다. 미사화홈 관계자는 택지지구에 맞는 모듈러주택도 조만간 출시할 계획 이라며 평당 700만원대로 가격이 낮아지면서 고객 문의가 급증하고 있다 고 말했다. 일본산 조립식 주택의 가장 큰 문제점은 바닥난방을 하지 않는 일본 주택문화와 온돌 문화인 한국식 주택 문화의 충돌에서 생긴다. 바닥 난방을 하지 않을 수 없는데 바닥이 뜨거울 경우 자재의 뒤틀림이 발생할 수 있기 때문. 국내 건축 전문가들도 이 점을 일본 업체의 한계로 지적하고 있다. 이에스하임 관계자는 초기에는 그런 문제들이 있었지만 온수 난방과 시멘트모듈을 결합해 이 문제를 해결했다 면서 별 문제 없을 것 이라고 말했다.,https://news.naver.com/main/read.nhn?mode=LSD&mid=shm&sid1=260&oid=018&aid=0002596689,331
310693,2012.05.07. 오전 6:00,부동산,뉴시스,똑똑한 GPS측량 시스템 나온다,국토부 오차범위 3㎝이하 FKP방식 도입 서울 뉴시스 우은식 기자 올해 안에 다중접속이 가능하고 오차범위도 3㎝이하인 위치보정정보 시스템이 도입된다. 국토부 산하 국토지리정보원 국토원 은 7일 실시간 정밀 GPS측량 중 접속에 제한이 없고 위치보정정보 정확도도 3㎝이하인 FKP 단방향위치보정정보 송출시스템 방식을 도입해 연내에 전국에 서비스할 계획이라고 밝혔다. 실시간 정밀 GPS측량 은 전국의 위성기준점을 이용해 생성한 위치보정정보를 송신서비스 하는 것이다. 각종 기준측량 및 도로 등 국가기간시설의 시공측량 등에 널리 사용되고 있다. 그동안 국토원은 RTK 실시간 후처리 이동측위 방식중 하나인 가상기준점 VRS 방식을 이용해 위치보정정보 데이터를 사용자에게 제공해 왔다. 그러나 인터넷 통신 모뎀을 쓰기 때문에 서비스하는 가상기준점은 사용자와 보정정보생성 서버간 양방향 송수신 시스템이어서 서비스 회선수가 200회선으로 제한됐다. 200명 이상 동시 접속하면 위치정보를 제공해주는 서버가 다운돼 불편을 겪어왔다. 국토원이 이번에 도입한 FKP 서비스는 다수가 실시간 인터넷 방송을 시청하듯 일방적 위치보정정보 수신이 가능해 접속자 수에 제한이 없다. 지난해 12월부터 수도권 지역에 설치한 통합기준점에서 시범서비스한 결과 통합기준점의 평면 좌표값과 차이는 평균 3㎝ 미만으로 일반측량 사용에 적합한 것으로 나타났다. 올해는 내륙지역에서 서비스되고 내년에는 도서지역으로 확대된다. FKP 서비스가 본격적으로 제공되면 위성측량시간 단축 및 측량비용 절감 위치정보제공 서비스 관련 산업도 활성화 될 것으로 국토원은 내다봤다.,https://news.naver.com/main/read.nhn?mode=LSD&mid=shm&sid1=260&oid=003&aid=0004484966,331
310694,2012.05.07. 오전 6:00,부동산,아시아경제,실시간 정밀 GPS측량 접속제한 없어진다,아시아경제 박미주 기자 국토해양부는 실시간 정밀 GPS측량 중 접속에 제한이 없으며 위치보정정보 정확도가 3㎝ 이하인 단방향위치보정정보 송출시스템 FKP 방식을 도입해 올해 전국에 서비스한다고 7일 밝혔다. 실시간 정밀 GPS측량 은 전국의 위성기준점을 이용해 생성한 위치보정정보를 송신서비스 하는 것으로 각종 기준측량과 도로 등 국가기간시설의 시공측량 등에 널리 사용되고 있다. 그간에는 200명 이상 동시 접속 시 위치정보를 제공해주는 서버의 렉 wreck 발생 등으로 많은 사람들이 불편을 겪어왔다. 이번에 국토지리정보원에서 도입한 FKP는 많은 사람들이 동시에 지상파 방송국의 실시간 인터넷 방송을 시청하듯 일방적 위치보정정보 수신을 가능하게 해 접속자 수에 제한이 없다. 국토부 관계자는 올해 안에는 내륙지역 내년에는 도서지역으로 서비스를 확대할 예정 이라며 FKP 서비스가 본격적으로 제공되면 위성측량시간 단축과 측량비용의 절감뿐 아니라 위치정보제공 서비스 관련 산업도 활성화될 것 이라 내다봤다.,https://news.naver.com/main/read.nhn?mode=LSD&mid=shm&sid1=260&oid=277&aid=0002780959,331
310695,2012.05.07. 오전 5:19,부동산,머니투데이,도시형주택·오피스텔 뻥튀기 청약률 사라질까,머니투데이 민동훈 기자 도시형생활주택·오피스텔도 인터넷 청약… 금융결제원 이용 의무없어 실효성 의문도 u3000앞으로 도시형생활주택과 오피스텔도 금융결제원 청약시스템을 통해 청약할 수 있게 되면서 청약의 신뢰성과 공정성을 확보할지 주목된다. 그동안 도시형생활주택과 오피스텔의 경우 사업주체들이 자체적으로 청약을 접수하면서 높게는 수백대1의 경쟁률을 기록했다고 홍보하는 등 뻥튀기 경쟁률 의혹을 받아왔다. 관련기사 청약 대박이라던 오피스텔 왜 또 분양하지 u30007일 부동산업계에 따르면 국토해양부는 지난달 30일 이후 입주자 모집공고를 낸 도시형생활주택·오피스텔 청약도 금융결제원 인터넷 청약시스템을 통해 접수할 수 있도록 했다. u3000이는 최근 평균 수십대1의 경쟁률을 기록한 것으로 알려진 서울 등 수도권 오피스텔들이 계약률 저조로 여전히 특별공급 이나 추가공급 의 명목으로 미분양 해소에 나서는 등 청약시스템의 신뢰성에 문제가 있다는 지적에 따른 조치다. u3000그동안 도시형생활주택과 오피스텔의 경우 복수청약이 가능한 데다 금융결제원이 집계하지 않아 신뢰성을 담보할 수 없다는 지적을 받아왔다. 실제 지난 2월 말 청약접수를 실시한 서울 강남구 역삼동 강남역 쉐르빌 삼성중공업 시공 의 경우 평균 26대1 최고 54대1의 경쟁률을 기록했다고 밝혔지만 이후에도 미계약분 분양에 분주했다. 인근에서 선보인 효성 인텔리안 더 퍼스트 오피스텔 역시 비슷한 시기에 청약을 받아 평균 28대1 최고 33.7대1의 경쟁률을 기록했다고 홍보했으나 최근까지도 광고전단을 통해 계약자 모집에 나섰다. u3000이처럼 오피스텔이나 도시형생활주택의 경우 1인 1청약 이 아니어서 청약자수를 부풀리는 일명 뻥튀기 가 성행한다는 지적이 나온다. 이런 이유로 업체들이 주장하는 청약률을 그대로 믿고 투자했다간 낭패를 볼 수 있어 주의가 요구돼왔다. u3000이에 비해 일반아파트와 같이 금융결제원 청약시스템을 통해 분양할 경우 신뢰성이 크게 향상된다. 국토부는 사업주체가 거래은행에 청약접수를 의뢰하면 금융결제원이 인터넷 청약시스템을 통해 청약 신청과 당첨자 선정업무를 대행한다. u3000국토부 관계자는 인터넷 청약시스템을 활용하면 신뢰성과 공정성을 확보하고 청약고객의 편의를 높여 은행 창구의 혼잡을 해소하는 데 크게 도움을 줄 것 이라고 강조했다. u3000대형건설사들의 경우 금융결제원의 청약시스템 이용을 긍정적으로 검토하고 있다. 최근 수익형 부동산에 대한 관심이 높아지면서 도시형생활주택이나 오피스텔의 분양이 어렵지 않은 상황이어서 신뢰성과 공정성을 담보할 수 있는 금융결제원의 시스템 이용을 마다할 이유가 없다는 것이다. u3000실제로 이달 말이나 다음달 초에 세종시에서 오피스텔을 분양할 계획인 대우건설은 금융결제원 시스템을 통해 청약접수를 받을 예정이다. u3000대우건설 관계자는 세종시 오피스텔의 경우 청약자가 많이 몰릴 것으로 예상돼 금융결제원 시스템을 이용할 계획 이라며 신뢰성 확보가 가능해 앞으로도 이용할 예정 이라고 말했다. u3000하지만 금융결제원을 통한 청약이 의무는 아니라는 점에서 어느 정도 실효성을 거둘지에 대해선 의문부호가 달린다. 도시형생활주택이나 오피스텔 공급의 대부분을 담당하는 소형건설사들은 물량이 많지 않고 청약도 쉽지 않다는 판단이 들면 굳이 금융결제원을 이용할 필요가 없어서다. u3000이와 관련 지난달 30일 이후 모집공고문부터 인터넷 청약이 가능하지만 이날 현재까지 금융결제원에서 청약관련 안내를 받을 수 있는 도시형생활주택과 오피스텔은 전무하다. u3000박상언 유엔알컨설팅 사장은 소규모 도시형생활주택이나 오피스텔 사업자의 경우 굳이 청약정보가 공개되는 금융결제원의 시스템을 이용할 이유가 없어 이용률은 좀더 지켜봐야 할 것 이라고 말했다.,https://news.naver.com/main/read.nhn?mode=LSD&mid=shm&sid1=260&oid=008&aid=0002836898,331
