,date,cat,co,headline,text,url,week
78657,2008.02.13. 오후 6:36,부동산,매일경제,광교신도시 지역우선공급 갈등,광교신도시 아파트의 지역 우선물량 배정 비율을 놓고 자치단체 간에 갈등을 빚고 있다. 13일 경기도에 따르면 광교신도시 지역 우선공급 물량은 전체 물량 중 30%가 배정되고 나머지 70%는 서울을 비롯한 수도권 지역 주민들에게 청약 기회가 주어진다. 이를 기준으로 광교신도시 지역 우선공급 물량은 전체 3만1000가구 가운데 30%인 9300가구로 수원과 용인 거주자에게 우선 공급된다. 문제는 수원시와 용인시가 아파트 물량 배정 비율을 놓고 대립하고 있다는 점이다. 수원시는 이의ㆍ원천ㆍ우만동 등과 용인시 상현ㆍ영덕동 일대 1128만㎡ 규모로 조성되는 광교신도시 전체 면적의 88%를 수원시가 차지하고 있는 만큼 편입 면적 비율대로 물량을 우선 공급해야 한다는 입장이다. 이런 기준을 적용하면 용인시와 면적 비율로 지역 우선공급 물량을 산정했을 때 수원지역 청약자들에게 돌아갈 물량은 9300가구 중 8184가구가 된다. 반면 용인시는 택지개발사업지구 등이 2개 시ㆍ군 행정구역에 걸치면 해당 행정구역 모두를 동일 주택건설지역으로 본다는 주택공급에 관한 규칙 에 따라 주택물량이 균등하게 배정돼야 한다고 주장하고 있다. 양측의 이 같은 입장 차이에 대해 전문가들은 관할구역에 따라 공급량을 결정하는 것이 바람직하다는 의견이다. 공동주택 분양 승인이 관할구역에서 이뤄지는 만큼 이를 기준으로 물량을 배정하자는 것이다. 광교신도시 내 주택은 모두 37개 블록에서 나온다. 이 가운데 수원 33개 블록 용인 4개 블록에서 공동주택이 공급되는데 이를 가구 수 비율로 보면 수원 85% 용인 15%로 배분된다. 한편 광교신도시는 올해 1188가구 분양을 시작으로 총 3만1000가구를 순차적으로 분양한다.,https://news.naver.com/main/read.nhn?mode=LSD&mid=shm&sid1=260&oid=009&aid=0001942461,110
78658,2008.02.13. 오후 6:36,부동산,매일경제,美 금리인하로 홍콩부동산값 급등,홍콩 부동산값이 급등하고 있다. 홍콩 달러를 미국 달러화에 연동시켜 놓은 상황 홍콩 달러 페그제 에서 미국이 금리를 내리자 홍콩 금리도 덩달아 떨어지고 있기 때문이다. 여기에 신규 주택 공급마저 줄어들면서 수요를 따라가지 못하는 상황이 벌어지고 있고 그동안 싱가포르 부동산에 투자했던 자금과 중국 본토 자금까지 몰리고 있다. 월스트리트저널 WSJ 은 13일 값싼 주택 대출이 홍콩 부동산시장에 불을 붙이고 있다 는 제목의 기사에서 최근 홍콩 부동산 과열 양상을 상세히 보도했다. 2005년 이후 하락세를 보였던 홍콩 주택가격은 지난해 여름 이후 급등세를 타면서 두 자릿수 상승률을 기록하고 있다. 여기에 지난달 두 주 사이 금리를 두 차례나 인하한 미국 연방준비제도이사회 FRB 결정 후 홍콩 금리까지 떨어지면서 집값 상승폭이 더욱 커지는 모습이다. 실제로 홍콩 주택담보대출 모기지 금리는 현재 3.1% 수준으로 물가 상승률 3.8%를 감안하면 사실상 마이너스 상태다. 가파른 임금 상승세와 사상 최저 수준에 근접한 실업률 연간 20%씩 늘어나고 있는 은행예금 등도 부동산 상승세에 힘을 보태고 있다. 자금도 홍콩 부동산시장으로 몰리고 있다. 몇 년 전까지만 해도 싱가포르 부동산시장으로 향했던 자금들이 홍콩 부동산시장으로 유입되고 있고 중국 본토 투기꾼들까지 가세하는 상황이라고 WSJ는 분석했다. 반면 주택 공급은 되레 모자라는 상황이다. 2005년만 해도 1055채에 달했던 신규 고급주택이 지난해 70채로 급감했고 일반 주택도 지난해 전년 대비 44% 줄었다.,https://news.naver.com/main/read.nhn?mode=LSD&mid=shm&sid1=260&oid=009&aid=0001942460,110
78659,2008.02.13. 오후 6:36,부동산,매일경제,여수에 42층 대규모 주상복합단지 개발,2012년 엑스포 유치가 확정된 전남 여수 해변에 최고 42층 높이 2000가구의 대규모 주상복합단지가 개발된다. 민간 시행사인 여수도시개발은 13일 여수시 중앙동과 고소동 일대 7만㎡를 재개발해 여수 최고층 주상복합단지로 건설한다고 밝혔다. 단지 이름은 확정되지 않았으나 여수엑스포 와 시공사로 선정된 대형 건설사 아파트 브랜드를 함께 사용하게 될 것으로 보인다. 단지는 22 42층 10개동 규모로 연면적은 52만㎡에 달한다. 1800 2000가구 79.2 247.5㎡ 24 75평 로 구성될 계획이다. 총 사업 규모는 8000억원 선. 단지 안에는 아파트와 쇼핑센터 테마파크 시민공원 등이 들어설 계획이다. 사업지인 해변지역은 엑스포 개최지와 맞닿아 있으며 인근에 1만4000㎡의 해양수변공원이 조성된다. 한려해상국립공원 다도해 돌산대교 여수시내 야경 등을 조망할 수 있는 입지가 장점이다. 여수도시개발은 현재 토지매입 절차를 대부분 마무리 지은 상태로 곧 여수시 인ㆍ허가를 받을 예정이다. 다음달 중으로 시공사를 선정한 뒤 이르면 올 하반기에 분양할 계획이다. 준공은 2011년 예정이다.,https://news.naver.com/main/read.nhn?mode=LSD&mid=shm&sid1=260&oid=009&aid=0001942459,110
78660,2008.02.13. 오후 6:36,부동산,매일경제,분양 서울대역 역세권 상가,image0 동민종합건설은 서울대입구역에 위치한 관악맥스텔 오피스텔 1층 근린상가를 3.3㎡당 799만원에 지하 1층 상가는 399만원에 분양한다. 오피스텔 126실이 입주 완료했으며 지하철 2호선 서울대입구역에서 도보로 2분 거리다. 서울대와 관악구가 공동 투자로 추진 중인 바이오의학 연구개발단지 2만평 및 제2대학로 조성 등 호재가 있다. 1층 상가는 233㎡ 70평 규모로 부동산 사무실 PC방으로 보증금 3000만원 월세 250만원의 임대수익이 나온다.,https://news.naver.com/main/read.nhn?mode=LSD&mid=shm&sid1=260&oid=009&aid=0001942458,110
78661,2008.02.13. 오후 6:36,부동산,매일경제,분양 대구 시지 월드메르디앙,월드건설은 대구 수성구 시지동 고산역 역세권에 재건축 아파트 시지 월드메르디앙 603가구 중 일반분양 물량 53가구를 이달 말 분양한다. 주택형은 중소형 평형인 109㎡를 중심으로 81.85 157.94㎡로 구성돼 있으며 지하 2층 지상 25층 6개동으로 이뤄져 있다. 이달 20일 특별분양에 이어 21일 1순위 분양이 시작되며 계약은 다음달 10 12일이다. 2009년 5월 입주 예정으로 이미 공정률 60% 이상을 기록 중이다. 분양가는 109㎡ 기준으로 3.3㎡당 799만원이며 납부조건은 계약금 5%에 중도금 60% 전액 무이자 융자다.,https://news.naver.com/main/read.nhn?mode=LSD&mid=shm&sid1=260&oid=009&aid=0001942457,110
78662,2008.02.13. 오후 6:36,부동산,매일경제,무영건축 베트남 국제설계 당선,무영건축이 지난 12일 베트남 다낭의 지아라이호텔에서 비엔동 메르디안 타워 국제현상설계 공모에 최종 당선돼 베트남 쭝남그룹 비엔동사와 조인식을 가졌다. 비엔동 메르디안 타워 는 1만1168㎡ 대지에 지하 3층 지상 49층 연면적 25만4499㎡에 달하는 주상복합건물. 내부에는 컨벤션센터 호텔 사무실 등이 들어서며 올해 4월 착공돼 2010년 말 완공될 예정이다.,https://news.naver.com/main/read.nhn?mode=LSD&mid=shm&sid1=260&oid=009&aid=0001942456,110
78663,2008.02.13. 오후 6:36,부동산,매일경제,금호건설 베트남 신도시 개발,금호건설이 베트남 하노이 인근에 40억달러 규모 신도시 개발 프로젝트를 추진한다. 금호건설은 지난달 31일 베트남 하노이에서 현지 국영기업인 UDIC Urban Infrastructure Development Investment Corporation 와 베트남 하노이시 인근 박꼬누헤 쨈 신도시 개발 프로젝트에 관한 양해각서 MOU 를 체결했다고 13일 밝혔다. 박꼬누헤 쨈 신도시는 하노이시 도심에서 약 7㎞ 북서쪽에 위치하고 있다. 박꼬누헤 쨈 신도시 개발 프로젝트는 약 360만㎡ 규모 용지에 40억달러를 투입하는 신도시 개발사업으로 2015년까지 완료한다는 계획이다. 금호건설은 5월까지 사업제안서 제출을 끝내고 6월에 투자 승인 및 조인트 벤처 회사를 설립할 예정이다. 금호건설은 베트남을 동남아 거점으로 삼아 해외사업을 확대할 계획이다. 금호건설 측은 현재 호찌민시 인근에 2000여 가구의 주택 사업과 27홀 및 레지던스 시설을 갖춘 골프장 수주를 앞두고 있으며 붕따우 종합 리조트 사업과 호찌민 7군 푸미훙 지역 아파트 공사 등 수주에도 전력을 다하고 있다 고 설명했다. 금호건설은 또 지난 12일 두바이 도심과 운하를 개발하는 주메이라 가든 시티 개발 프로젝트 참여에 관한 투자의향서 LOI 를 받았다고 밝혔다. 발주처는 두바이 국영기업인 MERAAS로 두바이 전략 계획 2015 의 하나로 진행된다. 두바이 해안 일대 약 1000만㎡ 용지에 24만명이 거주하는 도시를 개발하는 사업이다. 해안가를 확장하는 팜 Palm 개발 컨셉트가 적용돼 길이 약 7㎞에 달하는 내부 운하도 함께 개발된다. 한편 금호건설은 지난해 매출은 전년 대비 21% 증가한 1조6100억원 영업이익은 32% 증가한 1223억원을 기록했다고 밝혔다. 수주액은 4조1596억원 수주잔액은 7조6510억원이었다. 올해 매출과 수주액 목표는 지난해보다 각각 55% 37% 늘어난 2조5000억원 5조7000억원으로 잡았다.,https://news.naver.com/main/read.nhn?mode=LSD&mid=shm&sid1=260&oid=009&aid=0001942455,110
78664,2008.02.13. 오후 6:36,부동산,매일경제,쌍용건설 말레이시아서 고급주택 분양,image0 해외에서 고급 호텔 건설 등으로 이름값을 높인 쌍용건설이 단순 시공을 넘어 직접 해외 고급주택 개발사업에 뛰어든다. 김병호 쌍용건설 사장은 지난 9일 올해 고급 주택시장 공략을 강화하기로 했다 며 오는 7월께 말레이시아 수도 쿠알라룸푸르에서 핵심지인 대사관 거리에 고급 주택 56가구를 분양할 계획 이라고 밝혔다. 쌍용이 추진하는 이 아파트가 들어설 지역은 대사관 거리로 인근에 국제학교 4곳이 자리잡아 대사관 직원 외국 기업 주재원 말레이시아 부유층이 가장 선호하는 고급 주거지다. 가까운 곳에 명문 골프장인 로열 셀랑고르 골프클럽도 있어 인기 지역으로 꼽힌다. 지하 1층 지상 5층 건물에 308㎡ 93평 4가구 318㎡ 96평 14가구 324㎡ 98평 14가구 397㎡ 120평 6가구 408㎡ 124평 4가구 507㎡ 153평 14가구 등 총 56가구가 모두 초대형으로 만들어진다. 펜트하우스에는 전용 수영장과 전용 엘리베이터가 설치되고 수영장 피트니스센터 운전기사 라운지도 생긴다. 쌍용건설은 분양가를 3.3㎡당 900만 1000만원으로 잡고 있다. 쌍용건설은 또 해외 특급호텔 아파트 건설 노하우를 기반으로 국내 고급 주택시장 진출을 가속화할 방침이다.,https://news.naver.com/main/read.nhn?mode=LSD&mid=shm&sid1=260&oid=009&aid=0001942454,110
78665,2008.02.13. 오후 6:27,부동산,파이낸셜뉴스,용산개발호재로 마포아파트 거래 꿈틀,용산역세권 개발이 가시화되고 서울시의 한강르네상스 사업 계획이 발표되는 등 용산일대에 개발호재가 넘쳐나면서 최근 용산지역은 물론 인근 마포지역 주택시장까지 후광효과가 미치고 있다. 13일 용산과 마포지역 부동산 중개업소들에 따르면 개발호재로 그동안 용산지역의 아파트 및 단독·다세대주택 부동산 시장이 초강세를 이어 온 가운데 최근들어 마포지역도 아파트값이 꿈틀대고 있다. 용산구 도원동 삼성래미안 79㎡는 현재 시세가 4억6000만원선으로 지난해 말보다 5000만원정도 올랐다. 또 이 아파트 84㎡는 6억∼7억원 138㎡는 8억8500만원까지 치솟았다. 이 영향으로 바로 길건너에 있는 마포구 도화 현대아파트까지 동반 상승세를 보이고 있다. 현대1차 아파트 99㎡는 4억2000만원 142㎡는 6억2000만원에 각각 거래되고 있다. 2년전 현대2차아파트에서 이름이 변경된 현대홈타운 138㎡는 6억5000만∼7억선이다. 다른 지역 아파트매수세가 위축된 반면 지난해 10월 이전 가격으로 회복세를 보이고 있다는게 인근 중개업소의 설명이다. 마포구 도화동 현대아파트 조은부동산관계자는 “용산역세권 개발 등으로 2년 전부터 용산지역 땅·아파트값이 껑충 뛰면서 중소형은 물건이 바닥이 났다”면서 “올해들어 이같은 품귀현상과 가격상승현상은 인접한 마포지역으로 옮아붙고 있다”고 전했다.,https://news.naver.com/main/read.nhn?mode=LSD&mid=shm&sid1=260&oid=014&aid=0001943045,110
78666,2008.02.13. 오후 6:27,부동산,서울경제,금호건설 베트남 하노이 인근에 신도시 개발,40억불 규모 MOU 체결 금호건설이 베트남 하노이시에서 40억달러 규모의 신도시 개발사업을 추진한다. 금호건설은 지난 1월31일 베트남 현지 국영기업인 UDIC와 베트남 하노이시 인근 ‘박 꼬뉴에 쨈’ 신도시 개발 프로젝트에 관한 양해각서 MOU 를 체결했다고 13일 밝혔다. 박 꼬뉴에 쨈 프로젝트는 하노이시 도심에서 약 7㎞ 북서쪽에 위치한 약 360만㎡ 규모의 신도시 개발사업으로 사업비가 40억달러 한화 4조원 에 이른다. 금호건설은 주거단지를 비롯해 상업ㆍ업무ㆍ교육ㆍ녹지 등을 개발하며 오는 2015년께 사업을 완료할 계획이다. 금호건설은 5월까지 사업제안서를 제출하고 이 프로젝트의 공동시행을 목적으로 하는 합작회사를 올해 중순께 설립할 예정이다. 이와 함께 금호건설 측은 아랍에미리트의 두바이 도심과 운하를 개발하는 ‘쥬메이라 가든시티’ 신도시 개발 사업에 대한 참여초청 LOI 도 받았다고 밝혔다. 일단 총연장 7㎞ 사업비 2억달러 규모의 내부 운하를 건설하고 약1 000만㎡ 규모에 총사업비가 40억 60억달러로 추정되는 신도시 개발사업에도 참여할 계획이다. 이 프로젝트는 국영기업 MERAAS사가 발주처이며 하반기에 분양하기로 했다. 한편 금호건설은 올해 매출액과 수주액 목표를 각각 2조5 000억원과 5조7 000억원으로 잡아 지난해보다 55% 37% 확대했다. 또 지난해 총매출액은 1조6 100억원에 달해 3년 연속 성장세를 유지했다.,https://news.naver.com/main/read.nhn?mode=LSD&mid=shm&sid1=260&oid=011&aid=0001940047,110
78667,2008.02.13. 오후 6:24,부동산,아시아경제,인천 경제청 용유·무의개발팀 신설,인천경제자유구역청 이하 경제청 은 천혜의 자연경관을 지닌 용유·무의 관광·레저복합단지를 세계적으로 특화된 관광지로 개발하기 위한 용의무의 전담 개발팀을 개발2국에 신설했다고 13일 밝혔다.용유·무의 관광단지는 지난해 7월 독일 호텔·리조트업체인 캠핀스키 컨소시엄 Kempinski 등 과 기본협약 체결 후 12월 민관협의체를 구성하는 등 순조로운 사업진행을 보이고 있다.,https://news.naver.com/main/read.nhn?mode=LSD&mid=shm&sid1=260&oid=277&aid=0001943913,110
78668,2008.02.13. 오후 6:18,부동산,파이낸셜뉴스,분양정보 수원 ‘권선 데시앙’ 잔여분,태영건설은 경기 수원시 권선구 세류동에 짓고 있는 ‘권선 데시앙’아파트 잔여가구를 선착순 분양 중이다. 이 아파트는 111㎡ 24가구 112㎡ 78가구 114㎡ 69가구 147㎡ 25가구 150㎡ 26가구 등 총 222가구로 구성됐다. 수원 세류동 일대는 수원시가 주택공사를 사업시행자로 지정해 주거환경정비사업을 추진하고 있고 인근 호매실지구 권선지구에서도 대단위 주거단지가 조성되는 등 개발호재가 많다. 계약금 1000만원으로 계약이 가능하고 중도금 40% 대출을 이용하면 입주 때까지 자금부담이 적다. 일부가구는 중도금 무이자 융자 혜택도 있다. 견본주택은 동수원 사거리에 있다.,https://news.naver.com/main/read.nhn?mode=LSD&mid=shm&sid1=260&oid=014&aid=0001943033,110
78669,2008.02.13. 오후 6:18,부동산,파이낸셜뉴스,분양정보 대구 시지 월드메르디앙 53가구,월드건설은 대구 수성구 시지의 대구지하철 고산역세권에 짓는 시지 월드메르디앙 아파트 53가구 조감도 를 이달 중 일반분양한다. 시지 월드 메르디앙은 81∼157㎡ 총 603가구 규모로 109㎡가 주를 이루고 있다. 분양가는 109㎡ 기준 3.3㎡당 799만원이다. 이 아파트는 수성구 시지에서 시내로의 대중교통이 잘 갖춰진 고산역과 도보 5분 거리에 있다. 모든 가구가 남향으로 배치됐다. 주변에 시지·고산초등학교 매호중학교 등이 있다. 2009년 5월 입주 예정이다.,https://news.naver.com/main/read.nhn?mode=LSD&mid=shm&sid1=260&oid=014&aid=0001943032,110
78670,2008.02.13. 오후 6:18,부동산,파이낸셜뉴스,“용산개발로 서울 10대도시 도약”오세훈 시장,오세훈 서울시장은 13일 “용산국제업무지구 조성사업은 서울이 세계 10대 도시가 될 수 있는 토대”라고 말했다. 오 시장은 이날 세종로 광화문빌딩에서 박광석 코레일 사장 이상대 삼성물산 사장 등이 참석한 가운데 열린 ‘용산역세권개발㈜ 창립기념식’에 참석 축사를 통해 이같이 강조했다. 서울시는 지난해 8월 코레일과 함께 용산국제업무지구와 한강변에 인접한 서부이촌동 지역 총 56만6000㎡를 통합개발하는 데 합의했으며 이 사업을 위해 지난해 12월 18일 삼성물산 등 26개 주주회사가 설립한 용산역세권개발㈜에도 향후 지분 참여할 예정이다. 오 시장은 “현재 서울시는 세계 10위권의 경쟁력 있는 도시를 목표로 지역간 균형을 이뤄가는 ‘도시 균형발전 프로젝트’ 한강을 1000만명의 시민과 세계인이 즐겨찾는 명소로 만드는 ‘한강르네상스 프로젝트’ 등을 추진 중’이라며 ‘이 모든 프로젝트의 총 집합체가 용산국제업무지구”라고 말했다. 그는 “용산국제업무지구 조성사업은 한강르네상스의 구체적인 실현과 강북 활성화의 시발점이 돼 서울시가 목표로 하고 있는 세계 10대 도시가 될 수 있는 토대를 마련하는 아주 중요한 사업”이라고 했다. 오 시장은 “국제업무지구가 완공되면 서울은 연간 5000만명의 대규모 관광수요를 창출하는 경제문화의 허브로 자리매김할 것”이라며 “서울시도 용산국제업무지구가 세계적인 명품 국제도시로 거듭날 수 있도록 지원을 아끼지 않겠다”고 말했다.,https://news.naver.com/main/read.nhn?mode=LSD&mid=shm&sid1=260&oid=014&aid=0001943031,110
78671,2008.02.13. 오후 6:18,부동산,파이낸셜뉴스,아파트단지 상가 인기 옛말,그동안 탄탄한 배후상권 확보로 안정적인 수익률을 보장해 주던 아파트 단지내 상가가 최근 고분양가와 대형할인점의 등장으로 투자자들에게 인기가 급락하고 있다. 12일 건설·부동산업계에 따르면 삼성건설이 서울 성북구 월곡동에서 지난해 말 분양한 월곡래미안 2차 단지내 상가는 인근에 ‘대형할인점 입점 계획’이라는 직격탄을 맞아 지난달까지 분양률이 20%에도 못미치는 것으로 알려졌다. 또 지난해 7월 잠실 최대역세권 상가에서 3.3㎡당 1억5000만원의 역대 최고 분양가로 분양했던 트리지움 잠실 단지내 상가도 고분양가에 따른 수익성 악화와 잇단 소송에 시달리면서 분양률이 40%를 밑도는 것으로 나타났다. 건설사들은 단지내 상가 분양이 이처럼 어려워지자 분양 전에 임대업자를 먼저 선정해 수익성을 맞춰준 뒤 분양에 나서는 맞춤형 영업전략까지 구사하고 있다. 고분양가로 수익성 낮아져 외면 단지내 상가가 투자자에게 외면받는 가장 큰 이유는 고분양가 때문이다. 건설사나 상가공급업체들이 주변시세에 비해 턱없이 높게 분양가를 책정함에 따라 이를 매입한 투자자들은 도저히 상가운영을 통해 적정수익을 확보할 수 없기 때문이다. 이로 인해 좋은 상권이라도 미분양이 줄을 잇고 있다. 지난해 7월 3.3㎡당 1억5000만원의 역대 최고 분양가로 분양됐던 서울 송파구의 트리지움잠실 잠실주공 3단지재건축 단지내 상가는 7개월이 지난 지금까지도 분양률이 40%를 밑돌고 있다. 3000여가구의 배후수요와 전철역을 끼고 있어 유동인구도 많지만 워낙 분양가가 높다보니 수익성이 안나와서다. 1층 일부 상가의 경우 월세가 1500만∼2000만원은 돼야 수익성을 맞출 수 있는 것으로 알려졌다. 인근 상가 관계자는 “아무리 장사가 잘된다 하더라도 이 수준의 월세를 내고 장사를 할 업종은 없다”면서 “이 상가에 투자한 사람들은 임차인 구하기가 쉽지 않을 것”이라고 잘라 말했다. 주변 대형마트 등장도 분양에 악재 삼성건설은 지난해 말 서울 성북구 월곡동에서 분양한 월곡래미안2차 단지내상가 분양 결과를 보고 깜짝 놀랐다. 5층규모 47개 점포의 분양률이 채 20%에도 못미쳤기 때문이다. 삼성건설이라는 브랜드와 비교적 높지않은 분양가에도 이같이 저조한 분양 성적표를 받아든 것은 바로 인근에 대형할인점이 들어선다는 소식 때문이었다. 상가투자자들은 래미안2차 단지내 996가구를 비롯해 총 5000여가구의 배후세대를 등에 업고도 대형할인점 때문에 분양받는 것을 포기했기 때문으로 풀이된다. 래미안2차 인근 근린상가 관계자는 “입지도 분양가도 조건이 나쁘지 않아 갈아타려고 했지만 인근에 대형할인점이 들어온다는 소문이 있어 생각을 바꿨다”면서 “예전에는 단지내 상가라 하면 독점상권이 보장됐지만 최근에는 근린상가에 손님을 많이 뺏기는 상황에서 대형할인점까지 인근에 생기면 무슨 수로 버틸수 있겠느냐”며 이유를 설명했다. 먼저 임차인 구하고 분양 새 풍속도 고분양가에 따른 수익성 악화를 우려해 투자자들이 외면하자 분양대행사가 임차인부터 입주시키고 분양하는 새로운 영업전략을 구사하고 있다. 2006년 말 분양을 시작한 송파구 잠실 갤러리아팰리스 잠실주공 4단지 재건축 단지내 상가는 1년이 지나도록 분양률이 저조하자 분양대행사에서 임차인을 맞춰놓고 분양을 하고 있다. 이 상가는 3.3㎡당 1억3000만원이라는 고분양가로 인해 한때 투자자들이 외면했지만 점차 주인을 찾아가고 있다. 최근엔 단지내 상가 B동이 최근 개인병원과 편의점 입점이 확정되면서 분양계약이 성사됐다. 현재 A동은 미분양이 20% B동은 10%정도만 남아있는 상태다. 박대원 상가정보연구소 연구원은 “고분양가로 인해 임차인 구하기가 쉽지 않을 것을 우려한 투자자들을 안심시키기 위해 최근 일부 상가에서 임차인을 입주시키면서 분양하는 사례가 늘고 있다”고 말했다.,https://news.naver.com/main/read.nhn?mode=LSD&mid=shm&sid1=260&oid=014&aid=0001943029,110
