,date,cat,co,headline,text,url,week
97011,2008.07.28. 오전 11:16,부동산,MBN,강남·강북 아파트 낙찰가율 양극화,서울 강남과 강북의 아파트 경매 낙찰가율의 희비가 엇갈리고 있습니다.경매전문업체 지지옥션은 지난 10일부터 23일까지 경매가 진행된 아파트를 조사한 결과 강동과 강북권 등 도심권의 낙찰가율이 상승했고 강남권과 강서권은 하락했다고 밝혔습니다.강동권 낙찰가율은 93.8%로 한 달 전보다 9.2%p 상승했고 강북권 역시 109.1%로 한 달 전보다 19%p 오른 반면 강남권은 1.9%p 강서권은 0.2%p 하락했습니다.,https://news.naver.com/main/read.nhn?mode=LSD&mid=shm&sid1=260&oid=019&aid=0001971372,134
97012,2008.07.28. 오전 11:15,부동산,머니투데이,자하하디드 등 디자인 거장들 서울에 모인다,머니투데이 원정호 기자 10월 서울디자인컨퍼런스 참석 세계적 건축가 자하 하디드 Zaha Hadid 사진 를 비롯한 디자인 거장들이 오는 10월 서울을 방문한다. 서울시는 10 월9 12일 잠실종합운동장에서 열리는 서울디자인컨퍼런스 에 세계적 디자이너들이 참여한다고 28일 밝혔다. 이 행사는 서울디자인올림픽2008 의 일환으로 개최된다. 자하 하디드는 동대문 디자인플라자 파크와 영국 런던올림픽 수영센터의 건축 디자이너이자 명품브랜드 샤넬이 만든 움직이는 미술 전시장 샤넬 모바일아트 파빌리온 독일 바일암라인의 소방서 등을 건축한 이라크 출신의 건축가다. 지난 2004년엔 여성으로는 처음으로 건축계의 노벨상 이라 불리는 프리츠커 상 을 수상했다. 이밖에 주요 참석 인사로는 9.11 테러로 붕괴된 뉴욕 세계무역센터 WTC 자리에 들어설 새 빌딩의 설계자 다니엘 리베스킨트 Daniel Libeskind 영국 산업 디자인계의 거장 로스 러브그로브 Ross Lovegrove 100달러 노트북으로 유명한 스위스 산업디자이너 입스 베허 Yves Behar 등이 있다. 서울디자인 컨퍼런스는 국내외 디자이너 교육가 기업인 도시정책 입안자 등이 디자인의 현재와 미래에 대해 논의하는 국제 디자인 교류의 장으로 펼쳐진다. 세션연설과 토론에는 야오잉 지아 리차드 뷰캐넌 카즈오 스키야마 등 국내외 디자인 석학들이 참여 디자인의 확장성 융합 지속가능성 생명력 흐름에 대한 발표와 논의를 펼친다. 서울디자인 컨퍼런스 참가의 사전 접수는 8월 1일부터 9월 12일까지 서울디자인올림픽 공식홈페이지 sdo.seoul.go.kr 를 통해 이뤄진다. 현장접수는 10월 9일부터 10월 12일까지 서울디자인 컨퍼런스 개최기간 동안 회의장에서 받는다.,https://news.naver.com/main/read.nhn?mode=LSD&mid=shm&sid1=260&oid=008&aid=0002014607,134
97013,2008.07.28. 오전 11:13,부동산,아시아경제,우림건설 카자흐스탄 애플타운 사업 PF 성공,우림건설이 카자흐스탄에서 진행중인 우림애플타운 조성사업과 관련 금융기관으로부터 4000억원의 PF 프로젝트 파이낸싱 에 성공했다. 우림건설은 우리·국민은행·농협 등 3개 금융기관이 카자흐스탄 우림애플타운 도심복합단지 PF를 제공 오늘 28일 11시 기념식을 갖는다고 밝혔다.,https://news.naver.com/main/read.nhn?mode=LSD&mid=shm&sid1=260&oid=277&aid=0002008791,134
97014,2008.07.28. 오전 11:10,부동산,한국경제TV,중개법인 모든 건축물 분양대행 가능,부동산 중개법인도 모든 주택과 상업용 건축물에 대한 분양대행이 가능해집니다. 국토해양부는 이같은 내용과 시·군·구 단위의 분사무소 설치기준 완화 등을 주요 내용으로 하는 공인중개사 업무와 부동산 거래신고에 관한 법률 개정안을 내일 29일 입법예고한다고 밝혔습니다. 중개법인은 그동안 주택법 등의 사업계획승인 대상이 아니거나 미분양 건축물에 한해 분양대행을 할 수 있었습니다. 개정안은 또 중개수요에 맞는 사무소 설치 운영이 가능하도록 중개법인의 주된 사무소 관할 구역 내에서도 분사무소를 설치할 수 있게 했습니다.,https://news.naver.com/main/read.nhn?mode=LSD&mid=shm&sid1=260&oid=004&aid=0001952693,134
97015,2008.07.28. 오전 11:06,부동산,MBN,강남·강북 아파트 낙찰가율 양극화,서울 강남과 강북의 아파트 경매 낙찰가율의 희비가 엇갈리고 있습니다.경매전문업체 지지옥션은 지난 10일부터 23일까지 경매가 진행된 아파트를 조사한 결과 강동과 강북권 등 도심권의 낙찰가율이 상승했고 강남권과 강서권은 하락했다고 밝혔습니다.강동권 낙찰가율은 93.8%로 한 달 전보다 9.2%p 상승했고 강북권 역시 109.1%로 한 달 전보다 19%p 오른 반면 강남권은 1.9%p 강서권은 0.2%p 하락했습니다.,https://news.naver.com/main/read.nhn?mode=LSD&mid=shm&sid1=260&oid=019&aid=0001971363,134
97016,2008.07.28. 오전 11:03,부동산,아시아경제,강남권 집값하락은 계속된다,강남권 집값 하락이 거침없다. 정부의 종합부동산세 등의 세제완화 정책이 추진되고 있는 가운데서도 강남 등 고가아파트의 집값 하락은 계속되고 있다. 특히 고유가 대출규제 등으로 전반적인 시장침체가 이어지고 있어 매수세가 실종되면서 하락세가 좀처럼 멈출 기미를 보이지 않는 모습이다.,https://news.naver.com/main/read.nhn?mode=LSD&mid=shm&sid1=260&oid=277&aid=0002008780,134
97017,2008.07.28. 오전 11:03,부동산,파이낸셜뉴스,중개법인도 아파트 신규분양대행 허용,부동산 중개법인도 내년 4월부터는 새로 분양하는 아파트의 분양을 대행할 수 있게 된다. 국토해양부는 부동산 중개법인에 모든 주택 및 상업용 건축물에 대한 분양대행 업무를 허용하는 내용의 ‘공인중개사의 업무 및 부동산 거래신고에 관한 법률’ 개정안에 대해 내달 19일까지 입법예고 등을 거쳐 법 공포 후 3개월 후인 내년 4월부터 시행할 계획이라고 28일 밝혔다. 중개법인은 현재 주택법에 따른 사업계획승인 대상인 공동주택 아파트 연립주택 가운데 미분양 주택이나 건축법에 따른 상업용 건축물 및 다세대 다가구의 분양만 대행할 수 있다. 또 주된 사무소 본점 가 있는 관할 시 군 구에 분사무소 지점 을 낼 수 있도록 허용되고 중개보조원의 법령 위반때 중개업자가 중개보조원에게 해당 업무에 관한 주의와 감독을 했다는 증명을 하면 중개업자는 처벌받지 않게 된다. 아울러 공인중개사시험위원회가 폐지대는 대신 매년 초 공인중개사 선발예정 인원 등을 담은 공인중개사시험 기본계획이 수립돼 발표된다.,https://news.naver.com/main/read.nhn?mode=LSD&mid=shm&sid1=260&oid=014&aid=0002004599,134
97018,2008.07.28. 오전 11:02,부동산,노컷뉴스,중개법인 全 건축물 분양대행 가능해진다,CBS경제부 박종환 기자 내년 3월부터 부동산 중개법인도 모든 주택 및 상업용 건축물에 대한 분양대행이 가능하게 될 전망이다. 국토해양부는 이 같은 내용의 공인중개사의 업무 및 부동산 거래신고에 관한 법률 개정안을 이달 29일 입법예고한다고 28일 밝혔다. 개정안을 보면 중개법인은 그 동안 주택법 등의 사업계획승인 대상이 아니거나 미분양 건축물에 한해 분양대행을 할 수 있었으나 내년 3월부터는 모든 주택 및 상업용 건축물에 대한 분양대행 업무를 수행할 수 있게 된다. 또 중개법인의 주된 사무소 관할 구역 내에서도 분사무소를 설치할 수 있게 된다. 이와 함께 그 동안에는 중개보조원의 법령 위반시 중개업자도 처벌을 받았으나 중개업자가 해당업무에 관한 상당한 주의와 감독을 다한 경우에는 처벌을 받지 않게 된다. 부동산 중개법인은 지난 3월 말 현재 408곳에 이르고 있다.,https://news.naver.com/main/read.nhn?mode=LSD&mid=shm&sid1=260&oid=079&aid=0001981055,134
97019,2008.07.28. 오전 11:01,부동산,노컷뉴스,최재덕 주공사장 대한근대5종연맹 회장 취임,CBS경제부 정영철 기자 대한주택공사 최재덕 사장은 29일 서울시 송파구 올림픽파크텔에서 대한근대5종연맹 신임회장으로 취임한다. 주공사장은 지난 1985년부터 24여년간 연맹 회장을 맡아 왔다. 우리나라 근대5종은 베이징올림픽에 이춘헌 대한주택공사 남동훈 상무 윤초롱 한국체육대학교 이 참가해 8월 21일 22일 올림픽 첫 메달 획득에 도전한다.,https://news.naver.com/main/read.nhn?mode=LSD&mid=shm&sid1=260&oid=079&aid=0001981053,134
97020,2008.07.28. 오전 11:01,부동산,이데일리,중개법인도 아파트 분양대행 가능,이데일리 남창균기자 내년 4월부터는 부동산 중개법인 408개 도 아파트·상가 등의 분양대행 일을 맡을 수 있게 된다. 국토해양부는 이같은 내용을 골자로 한 공인중개사의 업무 및 부동산 거래신고에 관한 법률 개정안을 29일자로 입법예고한다고 28일 밝혔다. 개정안은 내년 4월부터 시행될 전망이다. 개정안에 따르면 중개법인의 영업범위를 미분양 건축물 분양대행에서 모든 주택 및 사업용 건축물에 대한 분양대행으로 확대했다. 이에 따라 중개법인은 주택업체가 아파트를 분양할 때부터 영업에 참여할 수 있게 된다. 또 영업 활성화를 위해 중개법인의 지점을 본사가 있는 곳에도 둘 수 있도록 했다. 예컨대 중개법인이 서울 강남구에 있다면 지점도 강남구에 설치할 수 있는 것이다. 이와 함께 중개보조원이 법령을 위반한 경우라도 중개업자가 해당 업무에 대해 상당한 주의를 줬다면 처벌대상에서 제외된다.,https://news.naver.com/main/read.nhn?mode=LSD&mid=shm&sid1=260&oid=018&aid=0002002000,134
97021,2008.07.28. 오전 11:00,부동산,연합뉴스,부동산 중개법인도 모든 주택 분양대행 가능,서울 연합뉴스 박성제 기자 내년 상반기중에는 부동산 중개법인도 모든 주택에 대해 분양대행을 할 수 있게 될 전망이다. 국토해양부는 28일 중개법인에 대한 분양대행 허용 범위를 확대하는 내용의 공인중개사 업무 및 부동산 거래 신고에 관한 법률 개정안을 마련해 29일 입법예고한다고 밝혔다. 개정안은 중개법인도 모든 주택과 상업용 건축물에 대한 분양 대행 업무를 할 수 있도록 했다. 지금은 사업계획승인 대상이 아니거나 미분양인 경우에만 중개법인의 분양대행이 허용되고 있다. 국토부 관계자는 분양 대행과 관련해 공인중개사에 대해서는 별도의 규제가 없고 중개법인에 대해서 제약을 둬 왔는데 규제완화 차원에서 이를 개정하기로 했다 고 말했다. 개정안은 또 중개법인의 주된 사무소 관할 구역내에서도 분사무소를 설치할 수 있도록 해 중개수요에 맞춰 사무소를 늘릴 수 있도록 하고 중개보조원이 법령을 위반한 경우 중개업자까지 처벌할 수 있도록 한 규정을 개정해 중개업자가 상당한 주의와 감독을 다한 경우에는 처벌하지 않도록 했다. 국토부는 개정안의 연내 국회통과를 목표로 하고 있고 공포뒤 3개월이후 시행할 계획이어서 내년 상반기중에는 시행에 들어갈 것으로 보인다.,https://news.naver.com/main/read.nhn?mode=LSD&mid=shm&sid1=260&oid=001&aid=0002194785,134
97022,2008.07.28. 오전 10:59,부동산,연합뉴스,현대건설 이종수 사장 임직원에게 삼계탕 선물,현대건설 창립 61주년 기념 체육대회 자료사진 서울 연합뉴스 박성제 기자 현대건설 이종수 사장이 작년에 이어 올해에도 전 임직원에게 삼계탕을 선물해 현대건설 가족의 훈훈한 정을 느끼게 했다. 현대건설은 이 사장이 중복을 하루 앞둔 28일 임직원 6천여명의 가정으로 4인용 즉석 삼계탕을 배달했다고 이날 밝혔다. 특히 해외에서 근무중인 임직원의 가정에도 빠짐없이 배달했다. 이 사장은 작년에도 임직원들의 가정으로 삼계탕을 보내 회사를 위해 땀흘리는 임직원을 격려하는 한편 임직원의 가족까지도 현대건설에 대한 애정을 가질 수 있도록 했다. 현대건설 관계자는 이종수 사장은 올 여름휴가에도 카타르 쿠웨이트 두바이 등 건설현장을 방문할 정도로 직원과의 소통을 중시하고 있다 면서 직원들이 가족과 함께 삼계탕을 즐기면서 여름을 건강하게 나고 다 함께 신명나는 일터를 만들어가자는 뜻에서 삼계탕을 선물했다 고 말했다.,https://news.naver.com/main/read.nhn?mode=LSD&mid=shm&sid1=260&oid=001&aid=0002194779,134
97023,2008.07.28. 오전 10:58,부동산,노컷뉴스,부동산 QA 1가구 2주택 양도세,Q 성동구 옥수동에 주택 1채와 분당에 주택 1채를 보유하고 있습니다. 올해 12월이 되면 분당 소재주택을 구입한 지 1년이 되는 날이라 그 전에 팔아야 양도세 중과세에 적용되지 않는다고 들었습니다. 2주택 중 1주택 처분이 불가피한 상황인데요. 어느 주택을 매도해야 할지 모르겠습니다. A 1가구 2주택을 보유하고 있을 경우 향후 다주택자에 대한 양도세 중과세 등 불이익을 받을 수 있다는 점 말씀드립니다. 하지만 일시적으로 2주택이 된 보유자에게 특혜를 주어 신규주택을 취득한 날로부터 1년이내에 기존 주택을 매도할 경우 양도세 비과세 혜택을 받을 수 있습니다. 다만 일시적 1가구 2주택 비과세 특례를 받기 위해서는 매도해야할 기존주택이 3년 보유 및 2년 거주 서울 과천 및 5대신도시 기준 요건을 충족해야만 비과세를 받을 수 있습니다. 즉 분당 주택의 취득으로부터 1년 이내에 양도세 비과세를 받기 위해서는 반드시 기존주택을 매도해야 하는 만큼 옥수동 주택을 매도해야만 양도세 비과세를 받을 수 있다는 점 말씀드립니다. 만약 분당 주택의 매입시점부터 1년 이내에 옥수동 주택을 매도하지 않는다면 1가구 2주택이 된다는 점에서 양도세 중과세에 노출될 수 있는 만큼 올해 12월 이전에 매도를 서두르시기 바랍니다.,https://news.naver.com/main/read.nhn?mode=LSD&mid=shm&sid1=260&oid=079&aid=0001981050,134
97024,2008.07.28. 오전 10:57,부동산,노컷뉴스,신혼부부용 임대주택 7월 마지막 주 첫 선 보여,주간분양소식 CBS경제부 박종환 기자 7월 마지막 주에는 신혼부부용 임대주택이 첫 선을 보이게 된다. 인천 계양구 박촌동에서 대한주택공사가 공급하는 국민임대아파트 69가구가 신혼부부들에게 돌아갈 전망이다. 신혼부부용 주택은 7월 15일 이후 입주자모집공고를 하는 공동주택 단지 중 일정 주택형 이하 임대 전용 85㎡ 이하 분양 전용 60㎡ 이하 의 경우 공급량의 30%를 신혼부부에게 우선 공급하게 된다. 부동산정보업체 스피드뱅크 www.speedbank.co.kr 에 따르면 7월 마지막 주에는 전국 4개 단지에서 810가구 임대 210가구 포함 의 청약을 받는다. 견본주택은 넷째 주에 이어 마지막 주도 개관하는 곳은 없다. 또 7곳에서 당첨자를 발표하며 계약은 2곳에서 이뤄진다. 입주자모집공고는 2곳에서 준비 중이다. 인천 계양구 박촌동에서 대한주택공사는 국민임대아파트 ‘인천박촌 휴먼시아 230가구 48 75㎡ ’의 청약접수를 29일부터 받는다. 인천지하철 1호선 박촌역이 도보 6분 거리다. 서울외곽순환도로 계양IC도 가까워 서울로 쉽게 이동할 수 있다. 이 아파트는 올해 신혼부부용 임대주택으로 첫 선을 보이는 아파트로 69가구가 신혼부부들에게 돌아간다. 같은 날 라일건설은 인천 서구 가좌동에서 ‘가좌 라일실크빌’ 60가구의 청약접수를 받는다. 1개 동 14층규모로 건립되며 공급면적은 56 106㎡까지 중소형으로만 구성된다. 사업지가 경인고속도로 가좌IC와 인접해 있어 서울접근성이 좋은 편이다. 주변에 가림초 가림고 가정여중 제물포중 동인천여중 등 도보로 통학 가능한 학교들이 많다. 가좌근린공원과 완충녹지공원이 가까이 있어 여가활동을 즐기기 쉽다. 울산 남구 선암동에서 풍진종합건설이 28일에 ‘풍진 힐그린파크’ 39가구 110㎡ 의 청약접수를 받는다. 또 전북 익산시 동산동에서는 대한주택공사가 ‘동산여울 휴먼시아’ 481가구 97 125㎡ 도 청약접수를 받는다.,https://news.naver.com/main/read.nhn?mode=LSD&mid=shm&sid1=260&oid=079&aid=0001981048,134
97025,2008.07.28. 오전 10:57,부동산,한국경제TV,미분양 2개월째 감소,공동주택 신규 분양이 위축되면서 미분양 주택이 2개월 연속 감소한 것으로 나타났습니다. 국토해양부는 5월 말 현재 전국의 미분양 주택은 12만 8천 170가구로 한 달새 1천 689가구 줄어 4월에 이어 2개월 연속 감소세를 보였다고 밝혔습니다. 부문별로는 민간부문이 12만 7천 401가구 공공부문이 769가구로 지난 달에 비해 각각 659가구와 30가구 줄었습니다. 수도권은 440가구 지방은 1천 249가구 줄었으며 이 중 부산이 1천31가구로 가장 많이 감소했습니다.,https://news.naver.com/main/read.nhn?mode=LSD&mid=shm&sid1=260&oid=004&aid=0001952691,134
97026,2008.07.28. 오전 10:57,부동산,한국경제TV,감정평가사 매년 일정 인원 배출,최소합격인원제 도입으로 해마다 일정 인원 이상의 감정평가사가 배출될 전망입니다. 국토해양부는 감정평가사 최소합격인원제 도입과 감정평가사 징계위원회의 공정성 강화 등을 주요내용으로 하는 부동산 가격공시·감정평가에 관한 법률 시행령·시행규칙 개정안을 오늘 28일 부터 21일 동안 입법예고한다고 밝혔습니다. 내년부터 시행될 감정평가사시험에서는 현행 절대평가방식의 약점을 보완 감정평가사를 안정적으로 배출하고 수험생들이 합격인원을 예측할 수 있도록 매년 최소합격인원을 미리 공고하고 그 인원수 이상을 배출한다는 방침입니다. 최소합격인원제는 현행 절대평가방식으로 합격자를 결정하되 합격자가 최소합격인원에 미달하는 경우 일정기준 매과목 40점 이상 득점한 자 중 고득점자 순 에 해당하는 사람을 추가 합격시키는 제도입니다.,https://news.naver.com/main/read.nhn?mode=LSD&mid=shm&sid1=260&oid=004&aid=0001952690,134
97027,2008.07.28. 오전 10:51,부동산,헤럴드POP,부동산 보유ㆍ거래세 모두 내린다,정부ㆍ여당의 부동산 관련 세제개편 방향이 윤곽을 드러냈다. ‘보유세 강화 거래세 인하’라는 참여정부의 원칙을 허물고 ‘보유세나 거래세 모두 내리겠다’는 것이다. 여기에 부동산시장의 총수요 관리 차원에서 대출 규제 등 기존 금융정책 역시 장기적으로 손질할 수 있다는 입장도 조심스럽게 내비치고 있다. 한나라당은 이를 ‘ 부동산 시장 정상화’를 위한 불가피한 조치라고 강조한다. ‘세금폭탄’으로 표현되는 참여정부 부동산 정책이 부동산 보유자뿐 아니라 부동산이 없는 서민들에게까지 악영향을 미쳤고 이로 인해 극도의 주택경기 침체 더 나아가 거시경제 전반에 부정적인 영향을 끼쳤다는 게 정부 여당의 기본 인식이다. 종부세 기준 내리고 양도세 완화하고… 정부 여당은 우선 참여정부 부동산 세제의 상징처럼 인식돼온 종합부동산세에 대해 ‘손을 보겠다’는 방침을 밝힌 데 이어 양도소득세도 개편하겠다는 입장을 천명했다. 종부세 기준을 6억원에서 9억원으로 올려 종부세 부과대상 가구 수를 줄이고 1가구 1주택 장기 보유자들의 양도세 부담도 낮추겠다는 것이다. 1가구 2주택 양도세 부담 완화도 중장기적으로 필요하다는 얘기까지 여권 내에서 심심찮게 들린다. 일부 한나라당 의원들은 개별적으로 1가구 2주택 양도세 부담 완화를 위한 세제개편 법안을 준비 중이다. 임태희 한나라당 정책위 의장은 27일 기자간담회에서 “부동산시장의 거래가 지금처럼 이뤄지지 않아서는 시장에 의한 가격조절 기능이 제대로 작동을 못한다”면서 “부동산시장을 정상화하면서 거래가 이뤄지기 위해서는 양도세를 손봐야 한다”고 강조했다. 최경환 한나라당 수석정조위원장도 28일 헤럴드경제와의 통화에서 “지금처럼 부동산 거래가 끊겨 공급이 안 되면 2 3년 내에 다시 가격이 폭등하는 상황이 올 수 있다”며 시장 정상화 차원에서 종부세와 양도세 부담 완화의 당위성을 설명했다. “부자 위한 정책 아니다” 설명…그러나 여권은 종부세와 양도세 부담 완화가 부동산시장의 정상화를 위한 것이지 부동산 부자들을 위한 게 아니라고 설명하고 여론의 향배에 촉각을 곤두세우고 있다. 자칫 이번 부동산 세제개편이 이명박 정부와 한나라당은 역시 ‘부자정당’이란 부정적 인식만 확신시키는 결과를 초래할까 조심스러워하는 분위기다. 최경환 위원장은 “참여정부의 잘못된 정책을 정상화시키는 게 목적이지 부자들의 세금을 깎아 주자는 게 아니다”고 강조했다. 최 위원장은 또 “과거 한나라당은 세금으로 부동산 투기를 막겠다던 참여정부 정책이 얼마나 잘못된 것인지 수도 없이 지적해왔다”면서 “세금이 아닌 수요관리 차원에서 부동산 정책을 정상화시키는 데 주력할 것”이라고 밝혔다. 최 위원장은 이를 위해 “세제개편 후 장기적으로 금융 규제도 손질할 필요가 있다”고 말했다. 하지만 민주당 등 야당은 부동산 거래 활성화를 위한 원론적 입장엔 찬성하지만 참여정부 부동산 정책의 근간을 흔드는 종부세 부담 완화 등에 대해서는 “강남부자들만을 위한 정책”이라며 반대입장을 분명히 하고 있다. 박병석 민주당 정책위 의장은 이날 BBS 라디오에 나와 “민주당의 기본방침은 종부세를 포함한 보유세는 현 수준을 유지하되 거래세를 낮추자는 것”이라면서 “종부세 기준을 6억원에서 9억원으로 올리고 가구별 합산을 인별 합산으로 바꾸는 한나라당의 안에 대해서는 단호히 반대한다”고 말했다.,https://news.naver.com/main/read.nhn?mode=LSD&mid=shm&sid1=260&oid=112&aid=0001950125,134
