,date,cat,co,headline,text,url,week
66782,2007.10.18. 오후 3:09,부동산,머니투데이,강남 떠난 주상복합 아파트를 만나다,머니투데이 원정호 기자 경계 허물며 수요층 넓혀… 전용률 높이며 관리비 문제도 줄어 주상복합아파트가 서울 강남을 벗어나고 있다. 강북권은 물론 수원 죽전 아산 대구 등지로 저변을 넓혀가고 있다. 변호사 의사 등 고소득 전문직이 선호하는 주거 수단에서 대중적 주거 수단으로의 변신을 꾀하고 있는 것이다. 주상복합의 영역 확대는 그만큼 수요층이 두터워졌다는 것을 의미한다. 생활의 편리함은 그대로 유지하면서 일반 아파트와의 경계를 줄인 덕택이다. 18일 건설업계에 따르면 그 동안 강남이나 용산 등 핵심상권에서 분양되던 주상복합이 전국 주요지역으로 공급이 확대되고 있다. 이달 중 GS건설은 서울 중랑구 묵동에 411가구을 분양하며 현대건설은 인천 연수구 송도신도시에서 507가구를 내놓는다. 월드건설도 이달 중 용인 죽전지역 최초의 주상복합인 죽전역월드메르디앙 104가구를 분양한다. 한화건설과 SK건설은 각각 경기 수원과 충남 아산신도시에 212가구 793가구 펜타포트 로 구성된 주상복합을 공급한다. 대구 수성구 두산동에서는 SK건설이 57층 788가구 규모의 주상복합 SK리더스뷰를 선보인다. 아파트와 경계가 사라진다 주상복합 설계가 일반 아파트와 닮아가면서 주상복합에 대한 일반 소비자들의 선입견과 거부감이 줄고 수요층도 넓어졌다는 게 건설업계의 분석이다. 주상복합에 적용되던 타워형 디자인이 일반 아파트에 흔해졌고 일반아파트의 평형과 평면도 주상복합에 그대로 쓰인다. 월드건설 장해주 이사는 죽전월드메르디앙의 경우 평형과 평면이 일반아파트와 똑같다 면서 단지 상가가 함께 있어 주상복합으로 분양하는 것 이라고 전했다. 상가와 주거지를 함께 쓰면서 발생하는 단점인 혼잡함도 줄였다. 묵동 ‘GS자이’의 정광록 분양소장은 지하주차장 상가 지상주차장 주거지역 식으로 지으면서 주거 동선을 상가 지역과 철저히 분리했다 고 소개했다. 대구 두산동 SK리더스뷰도 지상 2층에서 5층까지 입주민 전용 주차공간으로 구성하는 등 지하 상가존과의 구별을 뒀다. 관리비가 많이 드는 단점 역시 개선되고 있다. 정광록 분양소장은 주상복합은 대개 공유면적이 넓어 아파트에 비해 관리비가 많다 면서 최근엔 전용률을 아파트 수준인 80%선까지 끌어올리면서 관리비가 절감됐다 고 강조했다. 조망과 사생활보호는 그대로 이처럼 아파트의 장점은 수용하면서 주상복합만의 특징은 더욱 강조해 수요층을 흡수하는 분위기다. 최근 조망권이 중요성이 커지면서 로열층의 개념이 고층으로 올라가자 주상복합은 점점 초고층화되는 추세다. 아산 펜타포트 와 두산동 SK리더스뷰’는 각각 66층 57층 크기다. 이밖에 △생활습관이 점차 개인화되면서 사생활 보호를 강조하고 △상가 등과 함께 지으면서 편리함을 유지한 점 △분양가를 전에 비해 낮춘 점 등이 주상복합의 영역 확대 이유로 꼽힌다. 그러나 주상복합도 분양가 상한제가 적용되는 탓에 건설업체들이 사업성을 근거로 주상복합 사업을 접을 경우 모처럼 활성화되던 주상복합 공급도 다시 침체될 것으로 보인다.,https://news.naver.com/main/read.nhn?mode=LSD&mid=shm&sid1=260&oid=008&aid=0000840636,93
66783,2007.10.18. 오후 3:02,부동산,문화일보,“반값아파트는 국민 오도한 사기 아파트”,청와대가 군포 부곡지구 ‘반값 아파트’ 시범사업 실패를 정치권의 탓으로 돌린 데 대해 ‘반값 아파트’를 처음 공론화한 홍준표 한나라당 의원과 이계안 대통합민주신당 의원이 강하게 반박하고 나섰다. 반값 아파트가 애초부터 성공할 수 없었다는 청와대의 주장에 대해 이들은 “정부가 추진한 반값 아파트는 애초 주장한 정책과 많이 다르다”고 맞선 것이다. 홍 의원은 17일 오후 국회에서 기자회견을 열어 “이번 사업은 노무현 정부가 야당의 정책이 엉터리라고 국민을 오도하기 위해 벌인 ‘사기 아파트’ 사업이었다”며 “반값 아파트가 실패한 것이 아니라 정부의 국민 기만책이 성공한 것”이라고 목소리를 높였다. 분양가를 주변 시세 대비 반값 이하로 낮출 수 있는 제도적 장치 없이 시행됐다는 것이다. 그는 군포의 토지임대부 분양 주택이 청약 미달 사태를 빚은 주된 원인으로 높은 토지 임대료를 들었다. 토지공사가 매입가보다 훨씬 높은 가격으로 건설회사에 땅을 팔았고 또 용적률을 140% 수준으로 낮췄기 때문이라고 진단했다. 홍 의원은 “정부는 야당 안인 토지임대부 분양 주택에 대해 300가구 정도의 ‘실패하도록 의도된’ 시범 사업을 했다. 반면 정부 안인 비축형 임대주택을 위해서는 토지공사를 관여시켜 2017년까지 총 50만가구에 이르는 계획을 밀어붙이고 있다”고 주장했다. 환매조건부 분양 주택을 주창한 이계안 의원도 이날 정부를 강하게 비판했다. 그는 “군포의 환매조건부 분양 주택은 내가 내놓은 법안과 이름만 같을 뿐 내용은 완전히 다르다”고 말했다. 이 의원은 군포의 실패 이유로 주변 분양가의 90%에 이르는 높은 분양가 집값 안정에 대한 신뢰 부족 분양시장 침체와 맞물린 부적절한 시기 등을 들었다. 이에 천호선 청와대 대변인은 이날 오후 정례브리핑에서 “반값 아파트란 말은 애초부터 국민의 기대를 높이는 표현이었다”며 “정책의 시범사업 결과 ‘부진하다’는 보도가 있어 사업추진 배경을 충분히 설명하기 위한 것”이라고 말했다. 그는 “이 정책의 구체적 실행 배경은 정치권의 한건주의 소위 ‘포퓰리즘’ 때문이었다는 정부의 판단을 강조한 것도 사실”이라며 “정부는 현실적으로 반값이 어렵다는 입장을 분명히 했고 정치권의 강력한 요구에 대해 시범사업을 해보고 결정하자는 입장이었다”고 거듭 강조했다.,https://news.naver.com/main/read.nhn?mode=LSD&mid=shm&sid1=260&oid=021&aid=0000211095,93
66784,2007.10.18. 오후 2:57,부동산,노컷뉴스,건교부 반값 아파트 확대시행 여부 올해말 결정,건설교통부는 경기도 군포 부곡지구 반값아파트 시범사업이 차질을 빚은 것과 관련해 다음달 한 달간 시범사업 결과를 평가해 올해말까지 확대시행 여부를 포함한 향후 추진방향을 결정하기로 했다. 건교부는 이를 위해 주택시장 전문가와 학계 연구기관 등이 참여하는 시범사업 평가단을 구성하기로 했다. 건교부는 군포 부곡지구의 미분양 주택 685가구에 대해서는 주택공사를 통해 다음주 중 입주자 모집공고를 낸 뒤 수도권에 거주하는 무주택 세대주를 대상으로 선착순으로 청약접수할 예정이라고 밝혔다. 입주자 모집공고일과 청약접수 일정은 추후에 확정하기로 했다.,https://news.naver.com/main/read.nhn?mode=LSD&mid=shm&sid1=260&oid=079&aid=0000195490,93
66785,2007.10.18. 오후 2:51,부동산,노컷뉴스,화물차 3대 중 1대 배출가스 검사 불합격,국회 건교위 소속 김선미 의원 18일 국감 자료에서 이같이 밝혀 주행 중인 화물차 3대 중 1대는 지난 5년 동안 배출가스 검사에서 불합격 판정을 받은 것으로 나타났다. 18일 국회 건설교통위원회 참주인연합 김선미 의원이 내놓은 국정감사 자료에 따르면 2002 2007년 8월까지 자동차 배출가스 정밀검사를 받은 화물차 60만대 중 35.8%인 21만 5천대가 검사에 불합격했다. 승용차는 136만대 중 12.6%인 17만대 승합차는 19만대 중 30%인 5만 7천대가 각각 불합격했다.,https://news.naver.com/main/read.nhn?mode=LSD&mid=shm&sid1=260&oid=079&aid=0000195483,93
66786,2007.10.18. 오후 2:48,부동산,노컷뉴스,현대건설 제주 수재민에 1억원 성금,현대건설은 17일 제 11호 태풍 나리로 수해를 입은 제주도 지역 수재민들에게 수재의연금 1억원을 제주도청에 전달했다고 18일 밝혔다. 현대건설 김선규 영업본부 본부장을 비롯해 본사 직원과 제주지역 현장 직원 등은 17일 오후 제주도청을 방문해 김태환 제주도지사에게 수재의연금 1억원을 기탁했다. 현대건설 임직원들은 또한 제주시 소재 모자원 母子院 을 방문해 봉사활동과 함께 서산미와 생필품을 전달했다.,https://news.naver.com/main/read.nhn?mode=LSD&mid=shm&sid1=260&oid=079&aid=0000195482,93
66787,2007.10.18. 오후 2:48,부동산,이데일리,반값아파트 미분양분 수도권 무주택에게 공급,이데일리 윤진섭기자 군포 부곡지구에 공급된 이른바 반값아파트 미분양 물량이 수도권 무주택 세대주에게 선착순 분양한다. 18일 건설교통부는 지난 15일부터 17일까지 청약 1 3순위 분양 후 남아 있는 685가구의 주택에 대해 다음주 중 입주자 모집공고를 한 뒤 수도권에 거주하는 무주택 세대주를 대상으로 선착순으로 청약을 접수한다고 밝혔다. 수도권 무주택 세대주에게 선착순 분양하는 물량은 토지임대부 349가구와 환매조건부 336가구다. 건교부는 “청약저축 가입여부와 관계없이 무주택 세대주라면 누구나 선착순 청약이 가능하다”고 밝혔다.,https://news.naver.com/main/read.nhn?mode=LSD&mid=shm&sid1=260&oid=018&aid=0000528716,93
66788,2007.10.18. 오후 2:45,부동산,노컷뉴스,잦은 설계변경으로 도로공사비 1조 5천억원 낭비,국회 건교위 정희수 의원 18일 국감에서 이같이 밝혀 서울과 부산 등 5개 지방국토관리청이 잦은 설계변경으로 2004년 이후 1조 5천억원의 예산을 낭비한 것으로 드러났다. 국회 건설교통위원회 한나라당 정희수 의원은 18일 국회에서 열린 건교부 산하기관 국정감사에서 5개 지방 국토관리청이 시행한 500억원 이상 규모의 도로공사를 대상으로 조사한 결과 2004년 이후 188개 노선에서 모두 506차례에 걸쳐 설계 변경이 이뤄졌고 도로 공사비는 당초 17조 1 879억원에서 18조 6 840억원으로 무려 1조 4 960억원이나 증가했다 고 밝혔다. 국토관리청 별로는 익산청이 4 333억원 108회 설계변경 으로 가장 많았고 이어서 부산청 3 213억원 166회 원주청 2 976억원 93회 대전청 2 528 92회 서울청 1 907억원 47회 등의 순이었다. 정 의원은 설계변경의 주요 원인이 장기간의 공기로 인한 물가 변동과 현장 여건 변경이라고 하지만 이는 핑계에 불과하다 면서 설계 전에 현장에 대한 세심한 조사와 제반 검토가 수반되었다면 설계 변경을 충분히 예견할 수 있는 일 이라고 주장했다.,https://news.naver.com/main/read.nhn?mode=LSD&mid=shm&sid1=260&oid=079&aid=0000195481,93
66789,2007.10.18. 오후 2:40,부동산,연합뉴스,반값아파트 평가단 구성..연말까지 확대여부 결정,서울 연합뉴스 박성제 기자 건설교통부는 18일 미분양으로 논란이 되고 있는 일명 반값아파트 에 대한 객관적인 평가를 거쳐 올해말까지 확대시행 여부를 결정하기로 했다고 밝혔다. 건교부는 군포 부곡지구의 환매조건부주택과 토지임대부주택 분양결과 85%가 미분양된 데 대한 평가를 위해 주택시장 전문가 학계 연구기관 등이 참여하는 시범사업 평가단 을 구성해 11월 한달간 객관적이고 실정적인 평가를 할 방침이다. 건교부는 또 국민여론조사와 군포 부곡지구 청약자 및 지역주민 대상 설문도 실시해 환매조건부 및 토지임대부 주택에 대한 선호도 시범사업의 성과와 한계 등을 진단할 계획이다. 건교부는 토론회도 개최할 계획으로 평가단의 평가결과 여론.설문조사 등을 모두 반영해 12월말까지는 환매조건부 및 토지임대부주택 확대시행 여부를 확정하기로 했다. 한편 군포 부곡지구의 미분양 주택 685가구에 대해서는 다음주중 입주자모집공고를 내고 수도권 거주 무주택세대주를 대상으로 선착순 분양할 계획이다. 선착순 분양에서는 청약저축에 가입하지 않은 사람도 청약할 수 있다. 청약접수 일정은 추후 확정된다.,https://news.naver.com/main/read.nhn?mode=LSD&mid=shm&sid1=260&oid=001&aid=0001789483,93
66790,2007.10.18. 오후 2:36,부동산,이데일리,건교부 반값아파트 계속 추진여부 12월 결정,이데일리 윤진섭기자 건설교통부는 18일 이른바 반값 아파트 로 불리는 토지임대부 및 환매조건부 아파트에 대해 12월말까지 추진방향을 결정키로 했다고 밝혔다. 건교부는 이를 위해 주택시장 전문가 학계 연구기관 등이 참여한 시범사업 평가단을 구성해 군포부곡 시범사업의 결과를 평가키로 했다. 건교부는 토지임대부 및 환매조건부 아파트가 새로운 주택공급방식으로 자리 잡을 수 있을지 여부에 대한 광범위한 사전 조사가 진행될 것 이라며 이를 토대로 제도의 확대시행 여부를 포함한 향후 추진 방향을 12월말까지 확정할 계획 이라고 밝혔다. 한편 지난 15일부터 17일까지 청약 1 3순위자 분양 후 남아 있는 토지임대부 환매조건부 주택 685가구는 다음주 중 입주자 모집공고를 거쳐 수도권에 거주하는 무주택 세대주를 대상으로 선착순으로 청약을 접수할 예정이다.,https://news.naver.com/main/read.nhn?mode=LSD&mid=shm&sid1=260&oid=018&aid=0000528711,93
66791,2007.10.18. 오후 2:26,부동산,이데일리,쌍용건설 인천경인·대전중부 지사 개설,이데일리 윤진섭기자 쌍용건설 012650 은 영업력 강화를 위해 경인지사와 중부지사를 개설했다고 18일 밝혔다. 경인지사를 설립한 것은 창사 이래 처음이고 중부지사는 외환위기 이후 대전지사와 광주지사를 폐쇄한 후 7년여만이다. 이에 따라 쌍용건설은 2004년 부산지사를 영남지사로 확대 개편한 이후 서울.수도권과 충청권 영남권을 연결하는 지사 체계를 갖추게 됐다. 인천 경인지사는 인천과 수도권 초대형 개발사업과 도심재개발 시장을 적극 공략할 계획이다. 2009년 세계도시엑스포와 2014년 아시안게임이 인천에서 열리는 만큼 인프라 구축 등 도심 재생 사업에 전념한다는 것이다. 대전 중부지사는 행정중심복합도시 건설과 관련 민간개발공사 조달청 발주 관공사 등 공사 물량 확보에 주력할 예정이다. 쌍용건설 관계자는 각 지사의 적극적인 영업활동을 통해 초대형 민자사업 민관합동 프로젝트 파이낸싱 등 다양한 사업을 따낼 것으로 기대된다 고 말했다.,https://news.naver.com/main/read.nhn?mode=LSD&mid=shm&sid1=260&oid=018&aid=0000528706,93
66792,2007.10.18. 오후 2:26,부동산,MBN,노 대통령 반값아파트 실패,노무현 대통령은 소위 반값 아파트는 정부가 검토하다가 폐기한 것으로 정치권이 밀어붙여 결국 실패하게 됐다고 밝혔습니다. 노 대통령은 서울 코엑스에서 열린 2007벤처기업 대상 시상식 특별강연을 통해 이같이 말했습니다. 노 대통령은 정부는 토지임대부 아파트를 검토하다 이치상 안된다고 보고 폐지했으나 어느날 갑자기 정치권이 반값아파트란 말을 만들고 언론이 동시에 떠들어서 하게 된 결과 결국 실패하게 됐다고 주장했습니다. 노 대통령이 반값아파트 실패에 대해 이같이 발언한 것은 이번이 처음입니다.,https://news.naver.com/main/read.nhn?mode=LSD&mid=shm&sid1=260&oid=019&aid=0000214974,93
66793,2007.10.18. 오후 2:08,부동산,매일경제,대우건설 2007년 하반기 굿디자인 6건 선정,대우건설이 우수 디자인 개발에 박차를 가하고 있다. 대우건설은 최근 산업자원부에서 주최하고 한국디자인진흥원에서 주관한 2007 하반기 우수디자인 상품 선정에 총 11개 품목을 출품해 푸르지오 엘리베이터 디자인 아트월 문주 과학 놀이터 트럼프월드 마린 아일랜드 가든 유니버셜 욕조 욕실 매입형 악세사리 6개 품목이 ‘굿디자인’으로 선정됐다. 이중 푸르지오 엘리베이터 디자인과 과학 놀이터는 상반기 월드마크 웨스트엔드의 인테리어디자인 에 이어 타 업종 굿디자인 수상 제품과 심사를 통해 대통령상이 수여되는 본상 수상 후보로 선정되었다. 본상 수상 후보로 선정된 푸르지오 엘리베이터는 폐쇄적이고 협소한 공간으로 단순한 이동 수단으로 인식되기 쉬운 엘리베이터에 “감성” “자연” “웰빙”의 개념을 도입하여 고급스러운 디자인과 편안한 공간의 느낌을 적용하여 높은 점수를 받았다. 테마 과학 놀이터인 “사이언스파크”는 우주선 형상의 과학 조합 놀이 시설로 단지 내 어린이 놀이터에 설치되었다. 어린이들이 놀이 활동 속에서 다양한 과학 원리를 체험할 수 있도록 하여 자연스러운 학습이 가능하도록 고려된 놀이터로 바닥은 태양계를 형상화 하였으며 우주선 모양의 놀이대에는 복합적 체험 및 활동이 가능하도록 다양한 아이템이 설치되어 있다. image0 대우건설 주택상품개발 팀장 이희성 부장은 “이번 우수 디자인 상품 선정에서 대우건설은 11건을 출품하여 6건이 굿디자인에 선정되어 업계 최고의 선정율을 기록했다.”며 “이는 푸르지오의 디자인 우수성을 객관적으로 입증한 결과로 금번 선정 품목 이외에도 향후 공급될 푸르지오에서 다양하고 우수한 디자인으로 소비자들의 취향을 만족시키기 위해 노력할 것이다.”라고 밝혔다.,https://news.naver.com/main/read.nhn?mode=LSD&mid=shm&sid1=260&oid=009&aid=0000631873,93
66794,2007.10.18. 오후 2:08,부동산,매일경제,용산 이안프리미어 강점과 약점,2007년 8월초 입주를 시작한 용산구 문배동 용산 이안프리미어 2차는 총296세대로 구성된 34층 주상복합으로 아파트 188세대 오피스텔 108세대로 되어 있다. 아파트는 142㎡와 109㎡의 두 개 평형이 있고 오피스텔은 33㎡형부터 119㎡까지 12가지 면적으로 구성되어 다양한 젊은 소비층을 겨냥하고 있다. 최근 이안프리미어 아파트 매매가격은 타 지역의 약보합세에 불구하고 하락 없이 지속적으로 상승하고 있다. 오피스텔은 전용율 72%이 높아 매매나 임대 모두 인기가 많다. 임대면적 119㎡의 경우 실면적이 86㎡로 방3개 욕실2개의 웬만한 일반 아파트 중소형에 해당되지만 가격은 아파트 보다 상대적으로 저렴하고 주택 수에 포함되지 않을뿐더러 종합부동산세 비과세 대상이며 주택과 달리 여러 채를 소유하고 있어도 양도소득세 중과대상에 포함되지 않아 젊은층과 향후 임대수익을 목적으로 하는 노년층 모두에게 많은 관심을 받고 있다. 인근 용산문배공인의 양윤숙 대표에 의하면 “실입주보다는 가수요가 많은 아파트의 경우 불황기인 여름철에 입주를 시작했고 이안프리미어보다 먼저 입주를 시작한 인근 주상복합에서 소화되지 못한 전세 매물이 겹치면서 전세가격이 지속적으로 하락했다. image0 하지만 추석 이후 가을철 이사수요와 함께 예비 신혼부부들의 발길이 계속 이어지고 있어 저렴한 매물들이 소진되면서 전세가가 꿈틀거리고 있다. 전세수요자들이라면 발 빠른 움직임이 필요할 것으로 보여 진다”라며 향후 시세가 강세를 보일 것으로 전망했다.,https://news.naver.com/main/read.nhn?mode=LSD&mid=shm&sid1=260&oid=009&aid=0000631871,93
66795,2007.10.18. 오후 2:00,부동산,파이낸셜뉴스,C우방ENC，부천 ‘송내 우방유쉘’ 142가구 분양,㈜C 우방ENC는 경기도 부천시 소사구 송내동에 ‘송내 우방유쉘’ 아파트 142가구 조감도 를 분양한다. 지하 1층 지상 15∼18층 3개동 규모로 111.442㎡와 111.649㎡ A·B 두 타입으로 구성돼 있다. 타워형 4베이 설계로 고급스러움을 강조하고 지상에 차가 없도록 주차장을 100% 지하화했다. 또한 펜트하우스 복층형 설계로 선택의 폭을 넓혔으며 층간소음방지 시공했다고 업체측은 밝혔다. 부천 초·중·고와 부천여고 부명고 등이 인접해 있어 교육환경이 우수하고 LG백화점 까르푸 현대백화점 삼성 홈플러스 등 할인점과 백화점이 승용차로 5분 거리에 있다. 성주산까지 걸어서 10분이면 닿을 수 있고 2009년까지 송내공원이 조성될 예정으로 자연환경도 한층 쾌적해 질 전망이다. 모델하우스는 송내동 부천역 인근에 19일 개관한다.,https://news.naver.com/main/read.nhn?mode=LSD&mid=shm&sid1=260&oid=014&aid=0000350484,93
66796,2007.10.18. 오후 1:59,부동산,뉴시스,당산동 유보라 팰리스 부적격자 물량 선착순 분양,서울 뉴시스 반도건설이 서울 영등포구 당산동 당산동 반도유보라 팰리스 에 대한 DTI대출 부적격자 물량과 일부 계약 해지분을 오는 22일부터 인터넷과 모델하우스 접수를 통해 선착순 분양한다고 18일 밝혔다. 이번에 분양하는 DTI 총부채상환비율 대출 부적격자 물량은 전체 299가구 가운데 10%에 로 청약통장과 무관하게 선착순 공급된다. 공급일정은 22일부터 인터넷 www.uborapalace.co.kr 과 모델하우스에서 선착순으로 계약을 받는다. 한편 반도건설은 이번 DTI부적격자 물량 선착순 분양과 함께 신규 계약자들에게 DTI적용 이후 부족한 중도금을 회사 측에서 입주시까지 연기해주는 중도금 연기신청제 도 실시한다.,https://news.naver.com/main/read.nhn?mode=LSD&mid=shm&sid1=260&oid=003&aid=0000607335,93
66797,2007.10.18. 오후 1:57,부동산,이데일리,광장동 화이자공장터 아파트단지로 변신,3.3㎡당 2122만원에 매각 ㈜삼호 참여 아파트 단지 개발 이데일리 윤도진기자 서울 광장동 아파트 단지 사이에 위치한 화이자 공장터가 아파트 단지로 탈바꿈된다. 18일 건설업계에 따르면 현대증권·한원컨설 ㈜삼호 등이 참여한 컨소시엄은 최근 한국화이자로부터 서울 광진구 광장동 427번지 일대의 14개필지 총 3만3803㎡ 1만225평 을 2170억원에 매입했다. 이 부지는 한국화이자의 본사 및 공장이 위치한 땅으로 광장동 아파트 단지 앞에 있어 유망 주거지로 꼽혀왔다. 컨소시엄은 이 부지를 최고 25층 높이의 주상복합아파트와 빌라형 저층 아파트로 조성할 예정인 것으로 알려졌다. 아파트 시공은 지분을 투자한 대림산업 계열 ㈜삼호가 맡게될 전망이다. 3.3㎡당 매입가가 2122만원으로 매우 높은 만큼 고급 주택단지로 꾸며질 것이 예상된다. 그러나 분양가 상한제가 적용되기 때문에 실제 매입비를 인정받지 못할 경우 수익성이 크지 않을 것으로 보인다. 이 부지는 1 3종 일반주거지역이 섞여 있으며 한국화이자는 지난 2005년 이 부지에 35층 주상복합건물 등을 짓는 개발계획안을 광진구청에 제출해 자체 개발을 시도했으나 결국 포기했다. 한국화이자 본사는 지난 6월 중구 회현동 화이자 타워로 이전한 상태다. 한 컨소시엄 참여업체 관계자는 연내에 지구단위계획을 관할 구청에 신청하고 용도 변경 등의 절차를 거쳐 이르면 2009년 초쯤 분양이 가능할 것 이라고 내다봤다.,https://news.naver.com/main/read.nhn?mode=LSD&mid=shm&sid1=260&oid=018&aid=0000528679,93
