,date,cat,co,headline,text,url,week
68214,2007.10.31. 오후 12:11,부동산,헤럴드경제,전통 부촌은 ‘잠잠’…재개발은 ‘들썩’,‘개발 열풍’ 용산은 지금… 재정비촉진지구 검토 서계ㆍ청파동 투자처로 각광 “내 돈 1억원만 있으면 투자할 수 있어요. 1가구 2주택에도 해당하지 않아 매물도 별로 없어요.” 용산역세권 개발이 재벌기업들의 돈싸움으로 번지고 있는 가운데 용산권역이 개미들의 관심이 높아지면서 다시 뜨거워지고 있다. 지난 30일 용산 한강로 일대 한 부동산 중개업소. ‘1억원 미만 소액 투자’라는 간판이 눈에 띈다. 각종 개발호재를 안고 올 들어 가격 상승이 가장 활발한 용산. 요즘 이 곳은 전통 부촌은 잠잠한 반면 그 동안 주목도가 낮았던 서계동 청파동 일대 재개발 지분이 소액 투자처로 각광받고 있다. 이들 지역은 용산구 내에서도 상대적으로 선호도가 낮아 저렴한 지역인데다 최근 재정비촉진지구로 검토중이어서 평당 지분 가격이 최고 6000만원 대로 치솟았다. 서계동 224번지 일대와 청파동 1가 121번지 주변은 재정비 촉진지구로 검토 중이며 청파동 1가 일부 지역을 추가지역으로 요청한 상태다. 현재 서계동 일대 재개발 지분가격은 평당 5000만 6000만원선. 청파동 1가 일대는 이보다 저렴한 평당 2600만 3500만원 선이다. 단독주택지의 경우 1가구2주택에 해당되므로 근생상가 지분 투자도 주목받고 있다. 청파동1가 근생상가 지분의 경우 평당 3500만원 선이다. 인근 Y공인 관계자는 “재정비촉진지구 추가 지역으로 거론되는 청파동 1가의 경우 근생상가 지분이 6평 기준 평당 3500만원선으로 자기 돈 1억원만 있으면 융자와 월세 등을 통해 투자가 가능하다”고 말했다. 이에 비해 용산 일대 주상복합 시장은 거래가 많지 않다. 시티파크가 3.3㎡당 4300만원 안팎을 기록하고 있는 가운데 벽산 메가트리움과 GS용산자이가 올 연말까지 한시적으로 세금이 면제되는 조세특례제한 아파트이지만 용산의 잠재가치 때문에 생각만큼 매물이 나오지는 않고 있다. 특히 벽산메가트리움은 현재 3.3㎡당 2500만원 미만으로 GS용산자이 3.3㎡당 3000만원 선 보다 낮아 3000만원 선을 기록할 때까지 집주인들이 매물을 내놓지 말자는 담합까지 이뤄지고 있는 것으로 알려졌다. 이에 비해 문배동의 주상복합 용산이안은 30평형대 기준 4억원 미만으로 상대적으로 저렴한 편이다. 전통 부촌인 동부이촌동도 올해 내내 잠잠한 상태다. 간혹 문의가 있긴 하지만 실제 거래는 많지 않다. 올 들어 약 2000만원 가량 하락했던 가격이 지난해 말 수준으로 다시 회복된 정도이다.,https://news.naver.com/main/read.nhn?mode=LSD&mid=shm&sid1=260&oid=016&aid=0000256084,95
68215,2007.10.31. 오후 12:11,부동산,헤럴드경제,“협회개혁ㆍ회원사 권익보호 앞장”,주택건설협회 서울지회장에 우교순회장 선출 ‘우정에쉐르’ 아파트로 유명한 우정건설의 우교순 사진 회장이 대한주택건설협회 제6대 서울시회장에 선출됐다. 주택건설협회는 10월30일 서울 여의도 63빌딩 국제회의장에서 서울특별시회 2007년 정기총회를 열어 우 회장을 선출했다. 이번 선거에서는 그 동안의 관례였던 추대 합의 방식을 지양하고 경선으로 바꿔 우 회장과 대명종합건설 지승동 회장이 후보로 나서 열띤 경합을 벌였다. 서울시 2500여 회원사 중 874개사가 참석한 이번 선거 투표결과 우회장은 전체 324개 유효 표가운데 과반수가 넘는 196표를 얻어 앞도적인 표차이로 지 후보를 누르고 서울시회장에 당선됐다. 우 회장은 경기고와 서울대 문리대를 나와 지난 81년부터 우정건설 대표를 거쳐 우정건설 및 진도종합건설 회장을 겸임하고 있다. 올해로 창립 20주년을 맞이한 주택건설협회 서울시회의 회장은 선거가 열리기 전부터 후보로 나선 우 회장과 지 후보 지지자들 사이에 극심한 신경전도 벌어졌으나 원만한 진행으로 경선 회장선거를 이끌어 냈다. 우 회장은 “앞으로 서울시회를 투명하게 운영하고 회원사들의 화합을 위해 노력할 것”이라며 “모든 회원사들의 권익보호와 이익증진을 위해 최선을 다해 나갈 것”이라고 포부를 밝혔다. 우회장은 또 협회를 사업중심의 회원사들이 적극적으로 이끌어 나갈수 있도록 대대적인 개혁을 추진할 것으로 알려져 향후 움직임이 주목된다.,https://news.naver.com/main/read.nhn?mode=LSD&mid=shm&sid1=260&oid=016&aid=0000256082,95
68216,2007.10.31. 오후 12:11,부동산,헤럴드경제,삼성물산 에너지 절약아파트 눈길,개별세대 전력사용량ㆍ요금 휴대전화로 통보 귀댁의 아파트 전기사용량과 사용요금을 휴대폰으로 알려줍니다 삼성물산 건설부문이 지난 30일 역삼동 래미안 아파트 현장에서 에너지 IT 국책과제 시범사업으로 연구개발해 온 아파트 공용부 전력낭비 최소화와 각 세대별 사용자 참여형 수요관리서비스를 시연했다. 이날 발표된 에너지 수요관리서비스는 전력에너지의 단순한 공급이나 원격검침 차원을 넘어 각종 부가서비스를 제공하는 진화된 사업모델이다. 전력수요관리서비스는 국내 최초로 개별 세대의 전력사용량과 사용요금을 실시간 측정하고 월말 최종 사용량을 예측 입주자에게 단계적으로 휴대전화 문자메시지 SMS 로 통보해 주는 것. 한국산업기술대학교 한국전력공사 한국전기연구원 전자부품연구원 등 15개 기업 4개 대학 3개 연구기관이 참여한 에너지 IT 국책사업은 통합서비스사업자 가칭 가 전력관리 전력안전 보안서비스 인터넷 부가서비스 등을 통합적으로 제공하는 신사업 개발 프로젝트로 삼성건설은 래미안 아파트에 개발 내용의 일부를 실제 적용했다. 이백금 주택기전팀 상무는 “향후 지능형 분전반과 전력선 통신을 이용한 콘센트 부착형 센서를 통해 필요한 곳의 온습도 및 조명 밝기 조절 동체감지 등 다양한 유비쿼터스 기술을 부가적으로 구현해 나갈 예정”이라며 “전기화재 사전예측 대기전력 최소화 등 다양한 전력 부가서비스도 지속적으로 개발 보급할 것”이라고 덧붙였다.,https://news.naver.com/main/read.nhn?mode=LSD&mid=shm&sid1=260&oid=016&aid=0000256080,95
68217,2007.10.31. 오후 12:11,부동산,헤럴드경제,토지보상금 1000억원,주인을 못찾은 토지보상금 공탁 이 무려 1000억원에 달하는 것으로 나타났다. 공탁된 토지보상금은 15년이 지나면 국고로 환수된다. 31일 국회 건설교통위원회소속 한나라당 이재창 의원은 “건설교통부 산하 8개 공공기관이 지난 1998년부터 10년간 공익사업을 위해 토지를 수용하면서 땅 주인을 찾지 못해 법원에 공탁한 총 1007억원에 달하는 것으로 집계됐다”고 밝혔다. 공공기관이 토지를 매입할 경우에는 토지 소유자에게 토지보상금을 지급해야 하지만 소유자의 사망이나 상속인 미확인 소유자의 주소불명 이민 등의 경우에는 법원에 토지보상금을 공탁해야 한다. 토지공사 주택공사 도로공사 수자원공사 철도시설공단 인천국제공항공사 한국공항공사 제주국제자유도시개발센터 등 8개 공공기관이 지난 10년간 공탁한 면적은 160만㎡에 이르며 건수는 4381건이다. 기관별 공탁금은 주택공사 751억원 토지공사 113억원 도로공사 65억원 수자원공사 52억원 철도시설공단 17억원 등이다. 공탁한 토지보상금 중 최대는 주택공사가 경기도 의왕시 청계동 일대의 땅을 수용하면서 6052㎡ 땅의 소유자를 찾지 못해 공탁한 22억1096만원이다. 이재창 의원은 “전체 공탁금의 75%를 주택공사가 공탁했다”며 “토지 매입이 주요 업무인 토지공사의 공탁금이 113억원에 불과한 것을 고려하면 주택공사가 준공기일 단축이나 토지 소유자와의 충돌을 피하기 위해 토지 매입 및 보상절차를 졸속으로 진행했을 가능성이 있다”고 지적했다.,https://news.naver.com/main/read.nhn?mode=LSD&mid=shm&sid1=260&oid=016&aid=0000256045,95
68218,2007.10.31. 오전 11:51,부동산,파이낸셜뉴스,“민간투자 적정공사비는 설계가의 70% 이상 돼야”,민간투자사업의 적정공사비가 최소한 설계가 설계당시 공사비 의 70%이상이 돼야 한다는 주장이 제기됐다. 지난달 31일 서울 여의도 국회 의원회관에서 유필우 의원 대통합민주신당 주최로 열린 ‘민자 SOC사업 활성화를 위한 정책토론회’에서 신승철 삼일회계법인 이사는 “현행 민간투자사업은 평가상 최저가로 제안한 사업자가 유리하도록 돼있어 민간사업자는 사실상 최저가 제안을 유도받고 있다”며 “적정한 가격경쟁과 함께 기술경쟁을 유도해야 한다”고 주장했다. 그는 는 이어 “재정사업과 달리 민자사업은 민간이 위험을 부담하며 추진함으로 최저가공사 낙찰률 68.5% 에다 민간사업자의 자본금 납입부담 2% 과 자금조달 리스크 등을 감안할 때 최소 공사비는 설계가의 70% 이상이 돼야 한다”고 강조했다. 또한 공사비를 포함한 총사업비의 적정성에 대한 심사기준을 만들어 명확화해야 한다고 덧붙였다. 김남용 신성회계법인 이사는 ‘민자사업의 적격성조사 개선방안’이란 발표를 통해 “운영수입보장제도 MRG 가 폐지된 상황에서 민간이 제시한 수요를 정부가 재추정해 반영하는 것은 비합리적”이라며 “민자사업에 있어 수요에 대한 위험은 민자사업법인의 운영에 영향을 미치는 중요한 변수인 만큼 수요산출에 대한 책임은 사업제안자에게 부담시켜야 한다”고 주장했다. 김 이사는 또 “현행 규정에 공기연장과 공사비 증액 위험 금리상승 및 계약해지 위험 등을 적격성조사시 반영할 수 있도록 돼있으나 정부는 위험계량화의 어려움을 이유로 반영하지 않는다”고 지적하며 “현실적으로 이런 위험은 일반화돼있어 위험도를 적격성 조사시 반드시 반영해야 한다”고 지적했다.,https://news.naver.com/main/read.nhn?mode=LSD&mid=shm&sid1=260&oid=014&aid=0000354689,95
68219,2007.10.31. 오전 11:51,부동산,이데일리,신일건업 효명건설 인수액 사실상 500억,내년 1월까지 만기도래 부채 규모 500억 신일 효명 건실한 업체..싼 값에 샀다 이데일리 윤도진기자 중견 건설회사인 신일건업이 최종 부도 위기에 놓였던 인천 건설업체 효명건설과 그 계열사를 단돈 50억원에 인수해 그 배경에 관심이 모아지고 있다. 그러나 단기간에 상환해야 할 부채를 고려하면 인수금액은 사실상 500억원에 달할 것으로 예상된다. 신일건업 014350 은 30일 ㈜효명과 ㈜효명건설 ㈜효명레저산업 ㈜효명디엔씨 ㈜효명기업 ㈜효진 테크 등 6개사의 주식 182만9658주 76.75% 를 취득 경영권을 인수했다고 공시했다. 신일건업은 효명 외 5개사의 주식취득가액을 50억2997만원으로 추정해 집행했다고 덧붙였다. 효명이 지역 중소업체라 해도 전 계열사에 대한 인수 금액치고는 싼 값이다. 그러나 이 금액은 인수금액의 일부로 사실상 전체 인수금액은 500억원 가량이 될 것으로 예상된다. 예정취득가액으로 발표된 50억원은 지난 29일 효명건설이 부도낸 만기 어음 약 27억원과 이어 30일 추가로 만기도래한 어음 23억원으로 신일건업이 효명건설 인수조건으로 대납한 금액이다. 효명건설을 비롯한 효명 계열사는 다음달 11일까지 추가로 처리해야할 만기도래 어음이 110억원 가량 있으며 효명의 부채까지 모두 인수한 신일건업은 이를 상환해야 할 의무도 함께 지게 된다. 신일건업 관계자는 짧게는 내년 1월까지 효명이 상환해야 할 부채가 약 500억원 가량 된다 며 단기적인 부채상환액 규모가 사실상 인수금액이 되는 것 이라고 말했다. 신일건업은 현재 효명 등의 인수를 위해 부채를 포함한 자산내역 등에 대한 실사에 들어간 상태며 정확한 취득금액은 실사를 마친 후에야 알 수 있다. 사실상 인수금액이 500억원이라는 점에 대해 시장에서는 인수비용을 뛰어넘는 시너지효과가 있을 지에 의문을 제기한다. 최근들어 주택시장 등 건설업황이 좋지 않은 상황에서 무리한 투자가 아니냐는 지적이다. 효명건설은 올해 시공능력평가 321위 업체로 최근 충남 청원의 스파월드를 인수하여 레저사업에 진출하면서 자금압박을 받은 것이 화근이 돼 1차 부도 처리됐고 현재 이 사업에 500억원 가량의 자금이 묶여 있는 것으로 알려졌다. 그러나 신일건업은 일부 사업장에 대한 무리한 투자가 원인이 돼 일시적인 유동성 위기를 겪은 것일 뿐이라고 주장한다. 신일건업 측은 효명그룹은 2006년 한해동안 3610억원의 계약실적과 1389억원의 기성실적을 가졌다 며 효명이 관급 토목공사 등 받아야 할 기성금액이 100억원과 신일이 효명에 내줘야할 하도급 사업비 100억여원을 감안하면 인수비용에 따른 부담은 적은 편 이라고 밝혔다. 신일건업과 효명건설은 협력업체로 효명은 지난 4월부터 신일건업이 수주한 118억원 규모의 용인 흥덕지구 도로개설에 참여해 왔다. 신일건업은 부동산 개발업체인 ㈜마승산업 토목시공 업체인 ㈜선준실업 등을 건설업 관련 계열사로 두고 있으며 ㈜유토빌개발 쇼핑문화 ㈜유토힐개발 레저 준희 복지법인 다사랑 등을 거느리고 있다. 신일건업은 지난 25일 창립 50주년을 맞아 건설관련 계열사와 관계사들을 재정비해 신일그룹 으로 도약한다는 계획을 밝힌바 있다. 이번 효명의 인수 역시 그룹차원의 건설사업 역량 강화 포석이라고 신일건업 측은 덧붙였다.,https://news.naver.com/main/read.nhn?mode=LSD&mid=shm&sid1=260&oid=018&aid=0000532552,95
68220,2007.10.31. 오전 11:33,부동산,파이낸셜뉴스,신일그룹 인천 효명그룹 인수 합병,신일그룹은 계열사 신일건업을 통해 인천의 대표적인 건설그룹인 효명그룹을 인수 합병했다고 31일 발표했다. 신일그룹은 ㈜효명 외 5개 계열사의 주식 182만9658주 76.75% 을 취득 경영권을 인수하게 됐다. 취득 후 소유주식수 및 지분비율은 ㈜효명 78만8033주 85.72% ㈜효명건설 38만2125주 82.86% 효명레저산업㈜ 52만2500주 62.50% ㈜효명디엔씨 6만주 77.60% 효명기업㈜ 4만7000주 78.30% ㈜효진테크 3만주 100% 등이다. 홍범식 부회장은 “신일그룹은 이번 효명그룹 인수를 계기로 그룹으로서의 면모를 갖추는 동시에 대형건설사로 도약하는 발판을 마련하게 됐다”고 말했다. 신일건업은 최근 창립 50주년을 맞아 임직원들의 연봉을 두배씩 인상 화제를 모으기도 했다. 한편 효명그룹은 2006년 한해동안 3610억원의 계약실적과 1389억원의 기성실적을 올리는 등 인천지역 전문건설업체 중 1위를 지켜왔으며 특히 국내 최고의 수중건설 기술을 보유한 기업이다.,https://news.naver.com/main/read.nhn?mode=LSD&mid=shm&sid1=260&oid=014&aid=0000354668,95
68221,2007.10.31. 오전 11:30,부동산,파이낸셜뉴스,반도건설 아부다비 진출,반도건설은 30일 아랍에미리트 UAE 아부다비에서 현지 대기업인 NBB그룹과 합작 건설회사 NB MENA 를 설립하는 조인식 사진 을 가졌다고 31일 밝혔다. 합작 회사는 반도건설과 NBB사가 각각 49%와 51%의 지분을 투자해 만든 업체로 토목 건축 플랜트 공사 부동산 매매 및 개발 등에 진출한다. 이 합작회사는 첫 사업으로 NBB그룹이 발주한 3만명 수용 규모의 아부다비 건설인력 주거단지 조성 공사비 1억8000만달러 과 북아프리카 지부티 국제공항 건설 공사비 5억달러 프로젝트를 맡을 예정이다. 이들 사업에서 NBB는 투자와 운영을 담당하고 반도건설은 시공 분야를 맡을 예정이다. 권홍사 회장은 “아부다비 NBB사와의 합작 건설회사 설립을 통해 국내 건설시장의 침체로 많은 어려움을 겪고 있는 우리 건설사들에게 새로운 블루오션을 제시하겠다”고 말했다. 한편 반도건설은 지난해 두바이에 진출해 현재 두바이 비즈니스 베이에서 57층 규모의 오피스 빌딩과 16층 짜리 주거 및 상업 빌딩을 포함한 ‘두바이 유보라 타워’를 짓고 있다.,https://news.naver.com/main/read.nhn?mode=LSD&mid=shm&sid1=260&oid=014&aid=0000354663,95
68222,2007.10.31. 오전 11:19,부동산,아시아경제,송도 동북아 허브 뜬 구름 잡나,NSIC 4년간 외자 한푼 유치않고 돈되는 주택 짓기만... 인천경제자유구역은 침체된 대한민국 경제의 새로운 성장 동력을 만들기 위해 시행된 사업이다. 특히 NSIC가 개발하고 있는 송도지구내 국제업무단지 1 3공구 는 세계의 이목이 집중되고 있는 핵심선도 사업으로 인천경제자유구역의 성공과 직결되어 있다. 이러한 핵심선도 사업을 맡고 있는 NSIC가 당초 약속과 달리 외자유치 부진으로 공사기간이 연장되는 등 개발사업에 상당한 차질을 빚고 있어 우려의 목소리가 높다. 127억달러를 들여와 업무용 빌딩을 2008년까지 69동을 건설하기로 약속해 놓고 2005년 설계변경을 통해 2014년까지 50동 이상을 건설하는 것으로 계획을 수정 사업기간을 연장하는 등 사업이 더뎌지고 있기 때문이다. 특히 NSIC는 이같이 설계를 변경하면서 업무용 빌딩 건설은 뒷전에 두고 주택사업에만 전력을 다해와 여론의 질타를 받아왔다. NSIC 게일사 70% 포스코 건설 30% 지분으로 설립한 합작법인 가 개발하고 있는 국제업무단지는 전제 11개 공구 가운데 1 3공구 562만㎡ 173만평 이다. 부동산 개발 전문회사인 게일사는 2002년 인천시와 개발계획에 따른 토지계약에서 127억달러를 유치하여 업무용 빌딩을 2004년부터 2008년까지 69동을 건설하기로 약속했다. 그러나 게일사는 외자유치를 전혀 하지 못한 상태에서 업무용 빌딩 건설 후 외국기업 유치에 대한 부담으로 2005년부터 2014년까지 기간을 늘리고 업무용 빌딩도 50동 이상으로 줄였다. 이 뿐만이 아니고 NSIC는 2005년 11월 실시계획에서 총 조달금액의 51% 또는 30억 달러이상 외자를 직접 도입한다고 계획을 발표했다. 당시 수정된 계획에는 2005년 15억원 2006년 1195억원 금년 580억원 등 총 1754억원을 외국인 직접투자로 들어왔어야 하는데 현재까지 그런 사실이 전혀 없다. 특히 지난해 미국 투자은행인 모건스태리가 1억5000만달러를 3년간 분할 투자하기로 했다고 NSIC는 밝혔지만 현재 실행되지 않고 있다. 2002년 이후 현재 10월말 까지 NSIC는 인천시에 납입한 금액은 총 1550만달러 150억원 이외에는 전무한 상태다. 이 같이 외자유치를 전혀 못하고 있는 NSIC는 계속해서 장미 빛 청사진만 내놓고 있다. NSIC의 최대 주주인 게일사는 지난 18일 기자간담회를 통해 국제업무단지내에 아태지역본사 및 다국적기업 유치위한 인터네셔널 플라자 게이트웨이 센터 등 업무용 초고층 빌딩 16개동을 건설하겠다고 밝혔다. u3000 또한 국제업무단지의 모든 건물과 시설에 에너지절약형 엘리베이터 등 친환경 설비를 구축하기 위해 미국 유나이티드테크놀로지 UTC 와 MOU를 체결했다. 인천 시민단체는 외자유치를 전혀 못하고 있는 NSIC가 어떻게 내년부터 10여개가 넘는 초고층 업무용 빌딩을 건설하겠다는 것인지 도저히 이해할 수 없다며 장미 빛 청사진만 내놓고 있다고 비난했다. 대통합신당 유필우 인천 남동갑 의원도 지난 25일 인천시에 대한 국정감사에서 한국의 경제자유구역에 한국이 들어있지 않고 그렇다고 외국기업이 북적대는 것도 아니다 면서 공허한 동북아 허브 구호만 남아았다 고 지적했다.,https://news.naver.com/main/read.nhn?mode=LSD&mid=shm&sid1=260&oid=277&aid=0000014058,95
68223,2007.10.31. 오전 11:10,부동산,노컷뉴스,아이파크몰 개장 2주년 기념행사,아이파크백화점은 아이파크몰 창사2주년을 맞아 다음달 2일 금 부터 11일 일 까지 10일간 ‘Happy Twins Festival’을 열고 다채로운 사은행사를 연다고 밝혔다. 우선 아이파크백화점 카드 구매고객 가운데 20명을 추첨해 순금 골드 카드 10돈 와 무료식사 이용권을 증정한다. 또 15만원 이상 구매고객부터 구매금액별 7%에 해당하는 상품권을 증정하고 3만원 이상구매고객을 대상으로 생활용품을 증정한다. 그 밖에 유명 브랜드 50% 70% 할인행사 등을 가질 예정이며 수익금의 일부는 불우이웃 돕기에 쓰일 예정이다.,https://news.naver.com/main/read.nhn?mode=LSD&mid=shm&sid1=260&oid=079&aid=0000198647,95
68224,2007.10.31. 오전 11:02,부동산,노컷뉴스,다음달 전국에 6만 7천가구 분양,11월 중 전국에서 6만 7천가구의 공동주택이 분양될 전망이다. 31일 건설교통부는 주택업계가 제출한 자료를 취합한 결과 11월에 총 6만 7 430가구의 공동주택이 분양될 예정이라고 밝혔다. 11월 분양물량은 10월 분양계획 6만 4 113가구 대비 5% 늘어난 수준이다. 지역별로는 수도권에서 3만 1 579가구 비수도권에서 3만 5 851가구가 분양되며 유형별로는 분양주택 5만 3 626가구 임대주택 5 459가구 재건축.재개발 등 조합주택 8 345가구 등이다. 건교부는 과거 사례로 볼 때 분양예정물량 중 50～70% 가량이 실제 분양된다고 밝혔다. 한편 10월 20일 기준 에 분양된 공동주택은 총 2만 1 846가구로 전년 동기 1만 9 936가구 대비 9.6% 증가했다. 10월 중 아파트 유형별 분양실적은 분양주택 1만 4 330가구 임대주택 5 908가구 재건축.재개발 등 조합주택이 1 608가구다. 지역별로는 수도권이 9 541가구로 전년 동기 1만 1 016가구 보다 13% 감소했지만 비수도권은 1만 2 305가구로 전년 동기 8 920가구 보다 38% 늘었다. 올 들어 10월까지 분양실적은 총 20만 3 332가구로 전년 동기 18만 2 822가구 대비 11% 증가했다. 수도권은 9만 7 385가구로 전년 동기 7만 1 522가구 보다 36% 증가했다.,https://news.naver.com/main/read.nhn?mode=LSD&mid=shm&sid1=260&oid=079&aid=0000198641,95
68225,2007.10.31. 오전 11:01,부동산,이데일리,11월 공급물량 6만7천가구,이데일리 남창균기자 11월에 전국에서 6만7000여가구의 아파트가 공급된다. 31일 건설교통부에 따르면 11월 주택공급 물량은 수도권 3만1579가구 지방 3만5851가구 등 6만7430가구에 달한다. 서울의 경우 분양주택 683가구를 비롯해 총 3246가구가 공급된다. 유형별로는 분양 5만3626가구 임대 5459가구 조합 재건축 재개발 8345가구 등이다. 한편 올 10월까지 공급된 아파트는 총 20만3332가구로 전년동기 18만2822가구 대비 11% 증가했다. 특히 수도권은 전년대비 36% 늘어난 9만7385가구가 공급됐다.,https://news.naver.com/main/read.nhn?mode=LSD&mid=shm&sid1=260&oid=018&aid=0000532516,95
