,date,cat,co,headline,text,url,week
80481,2008.03.03. 오전 8:56,부동산,MBC,미분양 아파트 분양실적 저조,뉴스투데이 ● 앵커： 분양시장이 얼어붙으면서 전국의 미분양 아파트가 크게 늘었는데요. 지난달도 주택 건설업체들의 분양실적이 저조한 것으로 나타났습니다. 정시내 기자입니다. ● 기자： 전국의 미분양 아파트가 사상 최대인 １２만 가구를 넘어서자 건설업체들이 분양 물량을 줄이고 있는 것으로 나타났습니다. 국토해양부가 발표한 ２월 공동주택 분양 실적에 따르면 지난달 전국에서 분양에 들어간 공동주택은 수도권 ２３００가구， 지방은 ５６００가구로 모두 ７９００가구인 것으로 집계됐습니다. 이는 애초 분양 예정물량인 ３만 ３０００가구 중 ２４％에 불과한 것으로 결국 지난달 분양할 예정이었던 ４채 중 １채만이 실제 분양으로 이어진 셈입니다. 이처럼 주택분양이 저조한 이유는 통상 ２월이 분양시장이 비수기인데다 작년 하반기부터 미분양 주택이 급증하고 있어 주택 건설업체들이 무리한 분양을 자제한 것으로 분석됩니다. 한편 ３월 분양 예정물량은 수도권 １만 가구，지방 １만 ８０００가구로 모두 ２만 ８０００가구에 이를 것으로 집계됐습니다. ＭＢＣ 뉴스 정시내입니다.,https://news.naver.com/main/read.nhn?mode=LSD&mid=shm&sid1=260&oid=214&aid=0000062736,113
80482,2008.03.03. 오전 8:54,부동산,아시아경제,대림산업 뚝섬 한숲 e편한세상 오늘 분양,대림산업은 서울시 성동구 성수동1가 685 700 일대 뚝섬상업용지 3구역에 한숲 e 편한세상 196가구를 4일 분양한다. 뚝섬상업용지 3구역에 들어서는 한숲 e 편한세상 은 지상 51층 초고층 아파트 2개 동과 지상 33층 오피스 1개 동 지상 5층 규모의 아트센터 1개 동 그리고 지하에 상업시설이 들어서는 4세대형 복합문화타운으로 구성된다.,https://news.naver.com/main/read.nhn?mode=LSD&mid=shm&sid1=260&oid=277&aid=0001951239,113
80483,2008.03.03. 오전 8:54,부동산,이데일리,채권·대토 토지보상 실패작,채권보상 5% 대토보상 2.5% 수준 이데일리 남창균기자 정부가 토지보상금이 부동산시장으로 다시 흘러들어 가격을 부추기는 부작용을 막기 위해 도입한 채권보상과 대토보상이 효과를 보지 못하고 있는 것으로 나타났다. 정부는 이 제도를 도입하면서 전체 보상금 가운데 대토와 채권보상금이 각각 30% 20% 정도를 차지할 것으로 기대했었다. 3일 국토해양부에 따르면 부재지주 토지보상금 중 1억원 초과분에 대한 채권보상 의무화가 도입된 2006년의 경우 전체 보상금 중 5% 정도만 채권으로 지급됐다. 의무적으로 채권 보상을 받아야 하는 토지보상금 1억원 초과 부재지주가 많지 않은 데다 채권보상에 대한 메리트가 없어 자발적인 채권보상 희망자가 전혀 없었기 때문이다. 이에 따라 최근 의원입법으로 현지인이 채권보상을 받을 경우 3년만기 국고채 금리를 적용키로 하는 토지보상법 개정안 이 통과됐다. 지금은 3년만기 정기예금 금리 작년말 기준 국고채금리보다 0.61%포인트 낮음 가 적용된다. 작년 11월부터 시행에 들어간 대토보상제도 인기를 끌지 못하고 있다. 대토보상은 해당지역의 개발된 땅 으로 보상하는 방식이다. 이 제도가 처음 시행된 양주 옥정지구의 경우 총 토지보상금 1조6000억원의 2.5%이 400억원에 대해서만 대토보상 신청이 이뤄졌다. 이는 사업시행자인 토지공사가 책정한 대토보상규모 4000억원의 10%에 불과한 것이다. 대토보상이 외면 받는 이유는 비인기지역의 경우 개발된 땅 을 받아도 값이 오른다는 보장이 없기 때문이다. 한편 작년에 개발사업에 따라 지급된 보상금은 총 29조6182억원으로 추정됐다. 이에 따라 참여정부 5년동안 지급된 보상금은 103조원에 달한다.,https://news.naver.com/main/read.nhn?mode=LSD&mid=shm&sid1=260&oid=018&aid=0001949246,113
80484,2008.03.03. 오전 8:52,부동산,아시아경제,광교 에듀타운 공모전환 마찰,경기도가 광교신도시내 5조원 대 특별계획구역 개발사업 중 국내 최초로 추진하고 있는 에듀타운 사업과 관련 공모냐 추첨이냐 를 놓고 국토해양부 구 건설교통부 와 마찰을 빚고 있다.경기도는 에듀타운을 특화개발하기 위해선 민간공모방식으로 추진해야 한다는 입장인 반면 국토해양부는 관련법상 추첨을 통해 사업을 추진해야 한다며 경기도의 사업추진방법에 제동을 걸었다.,https://news.naver.com/main/read.nhn?mode=LSD&mid=shm&sid1=260&oid=277&aid=0001951238,113
80485,2008.03.03. 오전 8:49,부동산,머니투데이,뚝섬 한숲 e편한세상 오늘부터 분양,머니투데이 정진우 기자 한화건설 갤러리아 포레 는 7일부터 진행 ↑ 뚝섬 한숲 e 편한세상 조감도 사상 최대 분양가로 관심을 모은 뚝섬 상업용지 주상복합아파트가 3일부터 분양된다. 대림산업은 3일 서울 성동구 뚝섬 한숲 e 편한세상 의 특별공급을 시작으로 1 3순위별 분양 4 6일 에 들어간다고 밝혔다. 한숲 e 편한세상 은 지하7층 지상51층 높이의 초고층 아파트 2개동과 33층짜리 오피스 1개동 지상5층 높이의 아트센터 1개동으로 구성된다. 아파트 196가구는 모두 331㎡ 단일 주택형으로 이뤄진다. 3.3㎡당 분양가는 3856만 4594만원이다. 한숲 e 편한세상 은 오는 2011년 6월에 완공될 예정이다. 대림산업은 서울 삼청동 디자인 꾸베 02 736 0431 에서 사전 예약자에 한해 분양 상담을 실시하고 있다. 홈페이지 www.hansoop.co.kr 를 통해서도 정보가 제공된다. 한화건설도 오는 7일 특별공급 부터 뚝섬 1구역 갤러리아 포레 의 분양을 시작한다. 10 12일까지 1 3순위별 분양이 진행되며 18일 당첨자 발표가 이뤄진다. 계약일정은 25 27일까지 진행된다. 갤러리아 포레 는 1만7491㎡ 규모로 용적률 399%를 적용 지하7층 지상45층 높이의 아파트로 공연·전시장 쇼핑시설 스포츠시설 등이 들어선다. 주택형별 가구수는 230㎡형 77가구 260㎡형 38가구 300㎡형 75가구 331㎡형 36가구 370㎡형 4가구 등이다. 분양가는 3.3㎡당 3971만 4598만원이다.,https://news.naver.com/main/read.nhn?mode=LSD&mid=shm&sid1=260&oid=008&aid=0001952359,113
80486,2008.03.03. 오전 8:32,부동산,아시아경제,인천 용유·무의 등 초대형 사업 추진 난항,인천시가 추진하고 있는 용유·무의 해양관광단지 개발사업 등 초대형 프로젝트 사업이 정확한 사업성 검토 없이 시작했다는 이유로 시민단체가 전면 재검토를 요구하고 나서 제동이 걸렸다.시민 사회단체 등은 시의 각종 개발사업에 대한 특혜의혹을 제기하며 사업성 검토 없이 추진하고 있는 모든 사업에 대해 전면 재검토해야 한다며 시민참여특별기구 설치를 요구하고 있다.,https://news.naver.com/main/read.nhn?mode=LSD&mid=shm&sid1=260&oid=277&aid=0001951223,113
80487,2008.03.03. 오전 7:52,부동산,아시아경제,지난해 토지보상금 30조원...5년간 103조원,지난 2006년에 이어 지난해에도 토지보상금이 30조원에 육박하는 것으로 나타났다. 이에따라 참여정부 5년간 보상금 총액은 103조원을 넘어섰다.,https://news.naver.com/main/read.nhn?mode=LSD&mid=shm&sid1=260&oid=277&aid=0001951193,113
80488,2008.03.03. 오전 7:30,부동산,아시아경제,양도세 완화혜택 강남부자에 집중,이달 말부터 시행될 이명박 정부의 1가구 1주택자 양도소득세 감면 혜택이 강남 3개구 등 특정 지역에만 집중된 것으로 나타나 실효성에 의문이 제기되고 있다.현 정부는 대통령직 인수위원회때부터 양도세 장기보유공제 비율을 최고 80%까지 공제해주겠다고 밝혔으며 이를 실현하기 위한 소득세법 개정안이 시행을 앞두고 있다. 하지만 이에 따른 효과가 강남 3개구 등에서 종부세를 내는 부자들에만 집중돼 있고 특히 부산·경남지역 200여 가구를 제외한 모든 지방에서 이에 해당하는 아파트가 단 한 가구도 없는 것으로 나타났다.,https://news.naver.com/main/read.nhn?mode=LSD&mid=shm&sid1=260&oid=277&aid=0001951179,113
80489,2008.03.03. 오전 7:26,부동산,매일경제,서울 청진동 골목길 빌딩숲 된다,image0 서울 종로구 청진동 뒷골목이 고층 오피스빌딩으로 탈바꿈한다. 특히 한일관과 청진옥 등 유명 음식점들이 영업하고 있는 구역은 개발업체들이 땅 매입을 거의 완료해 종로구청의 인허가 과정만 거치면 곧 바로 개발에 들어갈 수 있는 단계다. 2일 부동산업계에 따르면 청진동 도시환경정비구역 19개 지구는 현재 3 4개 구역으로 나뉘어 개발이 추진되고 있다. 이 가운데 가장 관심을 끄는 지역은 12 16지구 1만2730㎡ 로 한일관과 청진옥 서울관광호텔 등이 자리잡은 곳이다. 이 구역 개발 주체인 지엘에이엠시 GLAMC 는 12 16지구 땅 80% 이상과 자금 확보를 마무리했고 개발 절차와 대략적인 설계도 마련해 놓은 것으로 확인됐다. 이 회사 관계자는 시공사는 GS건설로 결정됐고 오피스빌딩 2동을 건립할 수 있도록 5개 지구를 하나로 묶는 구역변경을 종로구청에 신청해 놓은 상태 라고 밝혔다. 종로구청 담당자는 역사적인 의미가 있는 청진동 골목에 대규모 개발이 진행되면 보전과 개발 간 이견이 생길 수 있고 다른 지역에도 영향을 주기 때문에 서울시 도시건축 공동위원회에 개발 타당성과 관련해 자문을 요청해 놓았다 고 전했다. 청진동 2 3지구는 12 16지구에 비해 사업 진행이 느린 편이다. 이 지역은 시행사인 국도개발이 땅 매입 작업을 하고 있다. 시공사로는 청진동 인근에 본사를 두고 있는 대림산업이 참여한다. 12 16지구와 달리 80%까지 땅을 확보하지 못한 데다 자금 조달과 개발 방안 등도 결정되지 않았다. 청진동 1지구는 유진그룹 본사가 있는 곳이다. 유진그룹도 인허가 절차를 밟아 새 사옥을 고층 빌딩으로 건립할 계획이다. 5지구는 개발을 위한 사업시행인가 단계에 있으며 시공사도 선정된 것으로 알려졌다. 청진동 인근 중개업소에 따르면 청진동 개발 소문이 퍼지면서 3.3㎡당 5000만원대였던 땅값은 수천만 원씩 올랐다.,https://news.naver.com/main/read.nhn?mode=LSD&mid=shm&sid1=260&oid=009&aid=0001948126,113
80490,2008.03.03. 오전 7:26,부동산,매일경제,단지안에 5성급호텔…광주에 첫 주호복합 금호 갤러리303,image0 광주 김대중컨벤션센터 인근에 문을 연 금호건설 갤러리 303 견본주택. 흰색의 독특한 외관이 눈에 띈다. 178 338㎡ 364가구 아파트와 200실 규모 호텔로 구성된 갤러리 303 은 광주 최초로 아파트 분양가 3.3㎡당 1000만원대 시대를 열었다. 하지만 서울의 최고급 주거문화에 목말라 하던 광주 자산가들이라면 탐낼 만한 요소가 적지 않다. 우선 인터컨티넨탈호텔이 운영하는 광주 최초 5성급 호텔이 단지 한쪽에 들어선다. 주민들이 호텔 부대시설을 준회원 자격으로 이용할 수 있도록 호텔과 논의가 진행 중이다. 빛과 돌을 형상화한 외관은 서울에서도 보기 힘들 정도로 독특하다. 아파트는 크게 영국ㆍ프랑스ㆍ뉴욕 등 세 유형으로 나눠진다. 각각은 다시 세부적으로 나뉘어 총 18개 타입으로 설계됐다. 저층부의 영국형은 복층형으로 201ㆍ202㎡ 등 2개 타입이 있다. 폭 3ｍ를 넘는 앞뒤의 넓은 발코니가 특징. 뒤쪽 발코니는 바비큐 그릴과 테이블을 놓고 앞쪽 발코니에는 나무를 심을 수 있다. 3 9층은 178 205㎡ 10개 타입 프랑스형으로 구성된다. 요즘 새 아파트에서 흔히 볼 수 있듯이 주방과 거실 사이가 개방된 평면을 적용했다. 다른 두 유형과 마찬가지로 두 가구가 함께 거주할 수 있도록 평면이 나눠져 있다. 10 14층에는 가장 독특한 평면의 뉴욕형이 들어선다. 4가구의 펜트하우스를 포함해 208 333㎡로 구성된다. 업무영역과 휴식영역이 철저히 분리돼 재택근무에 적합하다. 업무영역 쪽에는 서재 같은 업무공간과 함께 작은 방 2개가 있고 휴식영역 쪽은 넓은 안방과 거실 주방 등이 자리잡는다. 두 영역은 사선형 복도로 연결된다. 업무영역 쪽에는 젊은 부부가 휴식영역 쪽에는 노부모 세대 등 두 세대가 함께 사는 식으로 써도 손색이 없다. 입지도 괜찮다. 공항에서 차로 5분 거리에 광주 지하철 김대중컨벤션센터역이 걸어서 5분 거리다. 학교를 가려면 대로를 건너야만 한다는 점이 아쉬운 대목이다. 선착순 분양은 오는 7일부터 받는다. 평균 분양가는 3.3㎡당 930만원 선이다.,https://news.naver.com/main/read.nhn?mode=LSD&mid=shm&sid1=260&oid=009&aid=0001948125,113
80491,2008.03.03. 오전 7:26,부동산,매일경제,전국서 6500여가구 봄맞이 분양,image0 지난달 잔뜩 움츠렸던 분양시장이 봄철 성수기를 맞아 기지개를 켠다. 3월 첫째주에는 전국 9곳에서 6473가구가 쏟아진다. 아파트 일반분양 물량이 5367가구 오피스텔이 190실이다. 견본주택도 10곳에서 손님 맞을 준비를 한다. 안성ㆍ부산 대단지 주목 이번주엔 경기도 안성과 부산에 1000가구가 넘는 대단지 물량이 예정돼 있다. KCC건설이 경기도 안성시 안성 공도읍에 공급하는 KCC스위첸 은 총 1101가구로 안성에서 보기 드문 대단지다. 106 211㎡로 구성되며 3.3㎡당 분양가는 612만 757만원 선이다. 분양가 상한제가 적용되지 않아 등기 후 전매할 수 있다. 단지 내 36석 규모 전용 영화관을 갖춘 점이 특이하다. 발코니 무료 확장 혜택이 있다. 평택과 안성 중간 위치인 안성 공도택지개발지구와 가깝다. 단지 인근에 약 130만㎡에 달하는 농축산테마파크와 문화재공원 등이 2009년까지 조성될 예정이다. 공도초ㆍ중학교 인근이며 공도고가 신설될 예정이다. 롯데건설은 부산시 사상구 엄궁동에서 엄궁 롯데캐슬 리버 를 분양한다. 엄궁 주공아파트를 재건축한 단지로 82 173㎡ 25 52평형 총 1852가구로 구성된다. 이 중 일반분양 물량은 956가구다. 3.3㎡당 분양가는 619만 773만원 선으로 인근 아파트 시세와 비슷하다. 승학산과 낙동강이 만나는 낙동강 하구에 위치하며 인근에 도심권 공단 조성과 5000여 가구의 대규모 뉴타운 프로젝트가 진행 중이다. 부산 지하철 2호선 주례역과 1호선 하단역을 이용할 수 있다. 부산과 김해 양산을 연결하는 항만 배후도로와 김전 나들목이 가깝다. 엄궁동과 강서구 대저동을 잇는 엄궁대교도 건설될 예정이다. 수원 영통ㆍ인천 용현도 주목 이번주엔 서울 등 수도권에서 총 3437가구가 쏟아진다. 경기도 수원시 영통구 망포동에서는 신창건설이 신창비바패밀리 1ㆍ2단지 청약 접수를 한다. 133 180㎡ 중대형 378가구로 구성된다. 3.3㎡당 분양가는 1400만원대다. 분당 연장선이 2010년 개통되면 방죽역과 영통역을 이용할 수 있다. 단지 바로 앞에 태안 영통 고속화도로가 개통되면 2 3분 안에 영통지구로 접근할 수 있고 327번 도로와 수원 나들목이 직접 연결되므로 서울 강남과 접근성도 개선된다. 인근에 일산호수공원의 3배인 기흥호수공원이 조성될 예정이다. 갤러리아 그랜드백화점 홈플러스 이마트 등 편의시설을 이용할 수 있다. 단지 주변 경희대 아주대 경기대를 비롯해 초ㆍ중ㆍ고교가 가깝다. 경기도 안양시 평촌동에서는 대림산업과 고려개발이 평촌e 편한세상 220가구를 선보인다. 지하 2층 지상 16층 7개동 규모며 157 186㎡로 구성된다. 지하철 4호선 인덕원역이 가깝고 경수산업도로 외관순환도로 제2경인고속도로 2010년 예정 를 이용할 수 있다. 풍림산업은 인천시 남구 용현동에서 용현엑슬루타워 주상복합아파트를 선보인다. 83 173㎡ 630가구와 오피스텔 103 291㎡ 190실로 이뤄져 있다. 아파트는 1순위를 5일부터 오피스텔은 6 7일부터 청약접수를 시작한다. 1ㆍ2경인고속도로가 가까이 있고 제2외곽순환도로 인천 김포 구간이 개통될 예정이다. 이마트 홈에버 인하대병원 등을 이용할 수 있다.,https://news.naver.com/main/read.nhn?mode=LSD&mid=shm&sid1=260&oid=009&aid=0001948124,113
80492,2008.03.03. 오전 7:26,부동산,매일경제,뚝섬 한숲 e편한세상 3일 청약,image0 국내 최고가 분양 아파트인 서울 뚝섬 상업용지 주상복합 아파트가 분양을 시작한다. 대림산업이 상업용지 3구역에 짓는 한숲 e 편한세상 사진 196가구가 3일 특별공급을 시작으로 4 6일 1 3순위 청약에 들어간다. 서울 삼청동에 있는 디자인 꾸베 02 736 0431 에서 사전 예약자에 한해 분양 상담을 하며 홈페이지 www.hansoop.co.kr 를 통해서도 정보를 제공한다. 청약통장 가입 은행이나 금융결제원 홈페이지 www.apt2you.com 를 통해 청약 신청을 하면 된다. 한숲 e 편한세상은 지상 51층 초고층 아파트 2개동과 지상 33층 오피스 1개동 지상 5층 규모 아트센터 1개동 지하 상업시설 등이 들어서는 복합타운으로 조성된다. 아파트 면적은 331㎡ 100평 단일형으로만 구성된다. 분양가는 3.3㎡당 평균 4259만원이다. 세계적인 설계회사인 미국 nbbj에서 설계를 맡았으며 116만㎡ 규모 서울숲과 한강을 끼고 있다. 삼면 개방형 설계가 이뤄졌다. 한화건설 갤러리아 포레 도 7일 특별공급을 시작으로 10 12일 사흘 동안 1 3순위 청약접수를 한다. 강남구 삼성동에 위치한 예약 상담센터 1600 0089 에서 사전 예약자를 상대로 상담한다. 홈페이지 www.galleriaforet.co.kr 에서도 정보를 제공한다. 갤러리아 포레는 지하 7층 지상 45층 2개동이다. 아파트 230가구와 극장 공연장 전시시설 상업용지 지하에는 지하 쇼핑센터 운동시설 등이 들어선다. 주택 면적은 233 377㎡로 평균 분양가는 3.3㎡당 4374만원이다. 프랑스 출신 세계적인 건축가 장 누벨이 인테리어를 맡았다. 삼면 개방으로 조망권을 극대화했다. 뚝섬 주상복합은 서울 강남 등의 고액 자산가를 상대로 철저한 1대1 마케팅을 펼치고 있다. 그러나 가구 한 채당 최고 가격이 52억원에 달하는 초고가 상품인 데다 보유세만도 8000만 1억원에 달해 수요층이 한정돼 있는 것으로 보인다. 분양대행업체인 세중코리아 김학권 대표는 입지와 상품성이 빼어나긴 하지만 아직은 주변 정비가 덜 돼 강남보다 생활편의성은 떨어질 것 이라며 조망이 좋은 고층부 수요는 충분하겠지만 저층부는 다소 고전할 것 같다 고 전망했다. 업계에서는 뚝섬 주상복합 입주 뒤 매매 가격이 삼성동 아이파크 등 강남 초고가 아파트 가격의 70 80% 선에서 움직일 것으로 내다보고 있다. 워낙 고가여서 단기간 큰 폭의 프리미엄을 기대하기는 힘들 것으로 보인다. 투자 목적보다는 일정 기간 실거주를 하면서 가치 상승을 기대하는 게 좋을 것이라는 얘기다.,https://news.naver.com/main/read.nhn?mode=LSD&mid=shm&sid1=260&oid=009&aid=0001948123,113
80493,2008.03.03. 오전 7:26,부동산,매일경제,회현동 롯데캐슬 4월로 분양연기,당초 3월로 예상됐던 서울 중구 회현동 롯데캐슬 386가구 분양이 한 달 정도 늦춰질 전망이다. 분양시장 상황이 여의치 않은 만큼 3일부터 시작되는 서울 강북권 최대 관심사인 뚝섬 주상복합 분양을 지켜본 뒤 일반분양을 시작해도 늦지 않다는 판단이 작용한 것으로 보인다. 롯데건설 관계자는 이르면 3월 중에 일반분양을 추진하겠지만 시장상황과 수요 변동 등을 감안해 분양일정이 다소 연기될 전망 이라고 말했다. 회현동 롯데캐슬은 3.3㎡ 1평 당 분양가가 평균 2300만원대로 예상돼 사상 최고 분양가를 올린 뚝섬 주상복합 3.3㎡당 4259만 4374만원 에는 크게 못 미친다. 그러나 서울 한복판인 남산자락에 위치한 데다 앞서 인접지역에 분양했던 쌍용플래티넘과 SK리더스뷰 등이 잇달아 미분양 사태를 빚었다는 점에서 올 1분기 강북권 고급 주상복합 분양의 풍향계 가 될 것으로 간주돼 왔다.,https://news.naver.com/main/read.nhn?mode=LSD&mid=shm&sid1=260&oid=009&aid=0001948122,113
