,date,cat,co,headline,text,url,week
68390,2007.11.01. 오전 9:25,부동산,이데일리,마포 KCC오피스텔 청약열풍..경쟁률 13대 1,모델하우스 앞 청약자 100여미터 줄서기도 임대수익 기대한 중장년층 인근 중개업자 몰려 이데일리 윤도진기자 KCC건설이 분양한 서울 마포구의 한 오피스텔 분양현장에 1000명이 넘는 청약자가 몰렸다. KCC건설은 지난 31일 하루동안 마포구 공덕동 KCC웰츠타워 주상복합의 오피스텔 청약을 접수한 결과 84실 모집에 총 1104명이 신청했다고 1일 밝혔다. 청약 경쟁률은 13.1대 1에 달했다. KCC측은 오피스텔 청약 접수를 오전 9시30분부터 오후 4시30분까지 모델하우스 현장에서만 받았다. 면적별로 3개군으로 나눠 1인당 1개군에만 청약할 수 있도록 제한했다. 면적 66.8 107.11㎡ 20 32평 의 오피스텔 중 청약자들이 가장 많이 몰린 것은 66.8 77.96㎡ 20 23평 의 소형이 배치된 3군으로 430명의 청약자가 몰려 17.9대 1의 청약률을 기록했다. 가장 넓은 면적인 97.89 107.11㎡ 29 32평 의 1군에는 398명이 청약해 11.1대 1의 경쟁률을 중간 크기의 2군에는 276명이 신청해 11.5대 1의 청약경쟁률을 보였다. 모델하우스 관계자는 시세차익이나 실거주 목적 보다는 안정적인 임대 수익을 노린 중장년층 및 인근 부동산업자들의 청약이 많았다 며 도심권과 여의도권 접근성이 좋은 게 매력으로 작용한 것으로 보인다 고 말했다. 한편 KCC웰츠타워의 아파트는 전체 121가구 일반분양에 모두 78명만 신청하는데 그쳐 4개 주택형 중 3개가 모집인원을 채우지 못했다. 아파트 분양가는 3.3㎡당 1800만 2300만원에 책정됐으며 오피스텔은 아파트의 3분의 1 수준인 3.3㎡당 700만원대에 분양됐다. 오피스텔 추첨은 오는 2일 모델하우스에서 진행된다.,https://news.naver.com/main/read.nhn?mode=LSD&mid=shm&sid1=260&oid=018&aid=0000532885,95
68391,2007.11.01. 오전 9:11,부동산,헤럴드POP,수도권 주택 모자라나 남아도나,수도권의 주택은 아직도 크게 모자란다 지난 2006년 현재 수도권 주택보급률은 96.9%로 2000년 86.1% 이후 꾸준히 상승해왔다. 수치적으로 보면 대량부족시대는 벗어나고 있는 것. 그러나 이같은 수치는 이는 단순하게 ‘주택 수를 가구 수로 나눈’ 수치이어서 허점이 많다. 예컨대 분모인 가구수의 산정에서 1인 단독가구나 비혈연가구는 모두 제외된 것이다. 예컨대 노처녀와 노총각 이혼녀등이 사는 단독가구는 모두 빠져있어 분모숫자가 실제보다 줄어 들어 있다는 것. 때문에 보급률이 높게 나올수 밖에 없는 구조를 지니고 있다. 때문에 선진국에서는 단순보급률 통계지표가 아닌 ‘인구 1000명 당 주택 수’를 기준으로 하고 있다. 가구가 아닌 인 人 별로 주택보급을 측정하므로 오히려 정확한 주택보급환경을 반영하게 할 수 있기 때문이다. 저출산 및 고령화 사회를 대비한 좀 더 객관적인 주택보급 계획을 반영할 수 있는 장점도 지닌다. 현재 우리나라의 인구 1000명 당 주택 수는 2005년 기준 수도권의 경우 1000명 당 254호 전국 280호 에 불과하다. 이는 선진국에 비해 크게 부족한 수치다. 일본 동경은 1000명 당 500호 런던은 415호 파리는 616호 정도로 추정되고 있다. 한편 건교부도 현 주택보급률이 이 같은 문제점이 있다고 판단 올 초 주택 관련 통계로 앞으로는 ‘인구 1000명 당 주택수’로 바꾸기로 했다. 신도시나 임대주택 건설 등 주택정책 입안 시 인구 1000명 당 지표를 쓰되 주택보급률은 주택정책 수립의 보조 지표로만 사용할 계획이다. 또 신주택보급률 산정방식을 개발 합리적인 지표로 삼을 방침이다. 한편 수도권과 달리 지방은 주택이 과잉 공급된 상태다. 2006년 기준 전국의 주택보급률은 107.1%이며 전남의 경우 138.9%까지 높아진 상태다.,https://news.naver.com/main/read.nhn?mode=LSD&mid=shm&sid1=260&oid=112&aid=0000079079,95
68392,2007.11.01. 오전 9:10,부동산,노컷뉴스,주공 마감재 SH공사보다 훨씬 떨어져,대한주택공사가 공급하는 국민임대주택의 마감재 수준이 서울시 산하 SH공사의 국민임대주택보다 훨씬 떨어져 입주자 기호를 충족시키지 못한다는 지적이 제기됐다. 1일 대한주택공사가 대통합민주신당 이낙연 의원에게 제출한 국감자료에 따르면 두기관의 국민임대의 25개 마감재를 비교한 결과 주공 마감재의 질이 낮은 것으로 조사됐다. 주공과 SH공사가 내놓은 국민임대 마감재 수준 2007년 10월 현재 을 살펴보면 현관문의 경우 SH공사는 고급형 디지털도어록을 설치하는 반면 주공은 일반형 일반도어록을 설치하고 있다. 현관 바닥도 SH공사는 천연대리석을 사용하지만 주공은 타일을 쓰고 있다. 현관 마루귀틀도 SH공사는 천연대리석을 붙이지만 주공은 플라스틱으로 만든 BMC를 붙이고 있다. 거실바닥의 경우 주공은 비닐장판 륨카펫 을 사용하지만 SH공사는 나무로 만든 강화마루를 설치하고 있다. 욕실 발코니의 타일에 대해서는 SH공사 300×600각 는 주공 400×250 에 비해 크기가 큰 타일을 사용하고 있다. 일반적으로 타일은 크기가 클수록 고급제품이다. 주방 가스레인지도 주공 국민임대에는 설치되지 않지만 SH공사 국민임대에는 빌트인 4구형 쿡탑이 설치된다. 가스레인지 후드의 경우 주공은 슬립형인 반면 SH공사는 고급제품인 침니형을 쓰고 있다. 비디오폰은 주공 국민임대에는 흑백이 SH공사 국민임대에는 컬러비디오폰 홈오토 이 설치되고 있다. 이는 주공과 SH공사의 국민임대주택 마감재에 대한 설계목표부터 차이가 나기 때문인 것으로 분석된다. SH공사는 입주자 기호를 충족시켜 시장에 대응하는 것이 설계목표인 반면 주공은 유지관리를 위한 내구성 확보가 설계목표여서 마감재 질을 높이려는 노력이 부족하다는 것이다. 이에 대해 대통합신당의 이낙연의원은 임대주택이라고 해서 품질이 낮은 제품을 사용하면 되겠는가 라고 반문하면서 주공도 SH공사처럼 국민임대주택 마감재를 입주자 기호에 맞게 설치해야 한다 고 지적했다.,https://news.naver.com/main/read.nhn?mode=LSD&mid=shm&sid1=260&oid=079&aid=0000198884,95
68393,2007.11.01. 오전 9:07,부동산,이데일리,중대형 매입임대..주택정책 실패작,1300가구 매입계획에 실적은 12가구 그쳐 이데일리 윤진섭기자 대한주택공사의 중대형 매입 임대사업이 겉돌고 있다. 당초 올해까지 1300가구를 매입키로 했지만 실제 계약이 이뤄진 것은 1%도 안된다. 1일 국회 건설교통위원회 강창일 의원이 밝힌 중대형 매입임대사업 계획 및 실적 자료에 따르면 주택공사가 작년과 올해 매입한 주택은 각각 1건 12건에 그쳤다. 이는 주택공사가 작년과 올해 매입키로 계획한 1300가구의 1%에 불과하다. 올해 매입한 지역별 중형 아파트는 서울의 경우 노원구 1가구 영등포구 1가구 금천구 2가구 성북구 1가구 구로구 1가구 강동구 1가구 등이다. 인천광역시에서는 남동구 1가구 서구 1가구 부평구 3가구 등이며 경기도에선 매입된 주택이 한 가구도 없었다. 정부는 지난해 3.30 부동산 대책에서 서울 경기 인천 등 수도권 도심에 있는 중대형 아파트를 2012년까지 6300가구를 사들여 임대용으로 공급하기로 했다. 이처럼 중형 아파트 매입·임대사업이 지지부진한 이유는 집주인들의 매도 희망 가격과 주공의 매수 가격이 맞지 않기 때문이다. 주공이 시세보다 낮은 감정가를 제시하고 있어 가격 절충이 이뤄지지 않는다는 것이다. 이에 대해 주택공사는 올 8월에 매입공고를 냈고 10월 현재 78가구를 접수받아 매입 협의 중이라고 설명했다. 또 내년부터는 주택규모를 85㎡이상에서 60㎡초과로 확대하고 매입대상지역도 기존 수도권에서 전국으로 확대한다고 주공은 덧붙였다. 주공은 “앞으로 중형 매입임대사업을 정부의 미분양 주택매입계획과 통합해 운영할 계획”이라며 “우선 2008년까지 3000가구 정도를 매입할 계획”이라고 밝혔다.,https://news.naver.com/main/read.nhn?mode=LSD&mid=shm&sid1=260&oid=018&aid=0000532869,95
68394,2007.11.01. 오전 8:53,부동산,아시아경제,부평 오피스텔 현대 더 로프트 1118실 분양,로프트서비스는 인천 부평 역세권에 1118실 대규모의 오피스텔 현대 더 로프트 를 분양 및 임대한다. 지하 4 지상 15층 3개동 규모로 39.67㎡ 79.34㎡의 중소형으로 구성돼 있다. 3.3㎡ 1평 당 분양가는 400만원대다. 인테리어는 타워팰리스를 디자인한 에시스디자인 최시영 대표가 직접 설계했으며 층고가 3.8m로 공간 활용이 가능하고 주거 및 업무시설로 사용이 용이하도록 했다. 부평 환승역이 바로 연결돼 있는 것은 물론 인천국제 공항과의 이동시간은 지하철로 30분 정도 소요되며 송내IC를 통해 서울 외곽순환도로 및 고속도로와 바로 연결되고 부평IC를 통해 경인고속도로 진입이 용이하다. 또 만월산 터널이 개통돼 송도미디어밸리와 직통으로 연결될 전망이어서 송도국제도시의 프리미엄이 기대되며 인천 지역 교통망의 중심지로 자리잡을 전망이다. 회사 관계자는 현재 인천은 아시아게임 유치로 관광객 수요를 확보한 상태이며 송도국제도시 지정으로 비즈니스 고객의 수요도 창출될 것으로 예상돼 투자자에게 높은 수익을 안겨줄 것으로 보인다 고 말했다.,https://news.naver.com/main/read.nhn?mode=LSD&mid=shm&sid1=260&oid=277&aid=0000014379,95
68395,2007.11.01. 오전 8:46,부동산,머니투데이,서울시 공무원 1300명 감축한다,머니투데이 정진우 기자 2010년까지 상시적으로 인력·조직 구조조정 ↑ 서울시 인력 감축 계획 자료 서울시 오는 2010년까지 서울시 공무원 1300명이 감축된다. 서울시는 1일 정원 1300명 감축과 7개 기구를 줄이는 내용을 담은 2단계 조직개편 및 인력 감축계획 을 발표했다. 시는 이를 통해 몸집은 줄이면서도 사업추진과 성과에 중점을 두는 강소 强小 조직 으로 거듭날 방침이라고 밝혔다. 시는 앞으로 서울시정개발연구원과 시 자체 조직평가 민간전문기관의 조직진단 등 상시 진단을 통해 오세훈 시장 임기내 1300명을 감축시킬 예정이다. 시는 행정환경 변화로 기능이 쇠퇴한 조직 인력 880명을 감축하고 하부이양이나 민간위탁을 통해 420명을 감축할 방침이다. 시는 또 현재 국 局 단위 이상 조직의 업무 성격상 상호 밀접한 관계가 있어 통합관리가 필요한 기관은 본부로 합쳐 효율적으로 운영할 계획이다. 이에따라 산업국과 환경국 건설기획국 교통국 등 10개 기구가 폐지된다. 도시교통본부 물관리국 도시기반시설본부 등 3개 조직이 신설돼 모두 7개 기구가 감축되는 셈이다. 시는 경쟁력강화본부에 산업국 기능을 통합해 신성장 동력산업을 일원화 하고 맑은서울본부의 경우 환경국 기능에 통합시켜 환경관련기능을 일원화할 예정이다. 또 교통국과 건설기획국을 통합해 도시교통본부를 설치하고 건설안전본부와 도시철도건설본부를 합쳐 도시기반시설본부를 신설하게 된다. 시는 이밖에 3급이상 고위직에도 복수 직급·직렬·직위 개념을 도입해 능력과 실적에 따라 보직이 부여되는 경쟁체제로 전환한다는 방침이다. 본부장을 1 2급 복수직급으로 해 능력과 실적에 따라 본부장 7명중 4명을 1급 보직을 주게 된다. 2 3급 국장급은 모든 직위를 복수 직렬로 열어 놓아 행정과 기술 직렬 구분 없이 적임자를 임명할 수 있게 했다. 그동안 결재만 하던 5급 사무관이 직접 주요 업무를 맡아 사업을 수행토록하고 그 결과에 따라 평가 받는 시스템도 도입된다. 시 관계자는 서울시 조직 전반에 경쟁 중심의 신인사시스템을 체계적으로 구축하고 장기적인 인재양성정책을 수립할 수 있도록 인력정책 담당부서인 인력정책과를 신설할 예정이다 며 이번 2단계 조직개편으로 서울시 조직은 작지만 더 강한 조직으로 거듭날 것 이라고 말했다.,https://news.naver.com/main/read.nhn?mode=LSD&mid=shm&sid1=260&oid=008&aid=0000846204,95
68396,2007.11.01. 오전 8:37,부동산,아시아경제,경기지방公 국내 첫 전자상거래 중개시스템 특허 등록,경기지방공사는 지난 달 31일 광교명품신도시의 전략의 일환으로 지역정보통합센터를 이용한 전자상거래 중개시스템 을 특허 등록했다고 1일 밝혔다. 이번 특허는 국내에서 공공부문으로는 처음으로 2010년도에 현실화될 전망이다. 지역정보통합센터를 이용한 전자상거래 중개시스템 은 기존의 TV 홈쇼핑 및 인터넷 쇼핑시 발생되는 불편함을 없애고 언제 어디서나 다양한 단말기 월패드 휴대폰 IPTV DTV 키오스크 컴퓨터 등 를 통해 상품들을 구매할 수 있는 민간비즈니스 모델이다. 이번 특허는 기존의 단점 단방향 정보제공 정보제공사이트의 신뢰도 구매시간 장기화 을 보완해 유비쿼터스 시대에 맞도록 다양한 매체를 통한 쇼핑의 편리성을 대폭 개선한 것이다. 이 시스템은 u City를 추진하고 있는 지역의 상점 또는 대형마트에서 제공하는 정보를 지역정보통합센터를 거쳐 시민들이 이용하는 다매체에 정보를 제공 상품을 주문할 수 있는 방식이다. 상품에 대한 다양한 정보 반짝세일 전자할인쿠폰 를 이용하여 언제 어디서나 주문 가능한 유비쿼터스 환경이 이루어지게 되고 향후 지역정보통합센터 BcN 광대역 융합망 등의 기반 인프라가 조성이 되는 2011년경에 서비스 가능해질 것으로 예상된다. 소비자들의 다양한 구매 욕구를 만족할 수 있는 소비자 차원의 혁신적인 시스템이 될 것으로 예상된다. 향후 u City가 구현되는 국내ㆍ외 신도시에서 이 전자상거래 중개시스템을 구현할 경우 공사는 로열티 등을 받을 수 있어 엄청난 부가가치도 창출할 것으로 예상된다.,https://news.naver.com/main/read.nhn?mode=LSD&mid=shm&sid1=260&oid=277&aid=0000014364,95
68397,2007.11.01. 오전 8:36,부동산,세계일보,건설업풍향계SK건설 태국 TPP와 공장건설 계약 외,SK건설 유웅석 사장 오른쪽 두번째 이 지난 26일 서울 중구 순화동 SK본사에서 태국 SCG 케미컬사 자회사인 TPP의 솜차이 사장 〃세번째 과 1억800만달러 1000억원 규모의 폴리프로필렌 공장 건설공사 계약식을 갖고 있다. 이 공사는 태국 방콕 동남쪽 250㎞에 위치한 맙타풋 산업단지 내에 SCG 케미컬사의 세 번째 폴리프로필렌 생산 공장을 신설하는 것으로 SK건설은 설계와 구매·시공을 턴키 일괄도급 으로 수행하게 된다. 리비아 주택시설 공사 수주 ㈜신한은 지난 2일 리비아 주택기반시설청과 5억달러 규모의 주택기반시설토목공사 추가수주에 성공했다. 이는 지난 8월 초 리비아 수도 트리폴리에 5000가구 건설 공사대금 5억 달러 단독수주에 이은 토목분야 추가수주다. 이번 공사는 질리튼시의 2400ha 726만평 에 달하는 면적에 상하수도와 도로 전기통신공사 등의 토목공사를 하는 초대형 프로젝트다. 신일그룹 으로 새출발 ㈜신일건업은 지난 25일 창립 50주년 기념식 및 신일그룹 출범식을 가졌다. 홍범식 부회장은 기념사에서 “건설 관련 계열사와 관계사들을 재정비해 신일그룹으로 새로운 50년을 시작하고자 한다”고 밝혔다. 제17대 대선 특별 사이트 hp 17daesun.segye.com ⓒ 세계일보＆세계닷컴 www.segye.com 무단전재 및 재배포 금지 세계닷컴은 한국온라인신문협회 www.kona.or.kr 의 디지털뉴스이용규칙에 따른 저작권을 행사합니다.,https://news.naver.com/main/read.nhn?mode=LSD&mid=shm&sid1=260&oid=022&aid=0000256390,95
68398,2007.11.01. 오전 8:34,부동산,아시아경제,고양 능곡지구 뉴타운지구 지정,고양 능곡지구의 뉴타운 사업이 본격화될 전망이다. 경기도는 오는 5일 고양시 토당동 행신동 일원 805 789㎡의 능곡지구를 지정ㆍ고시한다고 1일 밝혔다. 이번에 지정된 능곡지구는 당초 고양시에서 신청한 면적보다 축소된 805 789㎡로 결정됐다. 지난 8월 말 열린 제4회 도시재정비위원회 심의에서 지구계 설정의 타당성 등 소위원회의 현장 확인이 필요하다는 사유로 유보됐었다. 이후 경기도도시재정비위는 9월 19일 소위원회 현장 확인을 거쳐 25일 열린 제5회 도시재정비위원회에서 존치예상 밀집 지역을 제척하는 것으로 의결됐다. 능곡지구는 지구지정과 함께 곧 바로 촉진계획수립에 착수하게 되면 2009년 하반기에는 촉진계획수립이 완료돼 세부적인 촉진구역이 정해질 것으로 예상된다. 능곡지구는 그동안 경기도 지정한 소사 원미 고강 인창ㆍ수택 광명 금정 역세권 원당지구에 이어 8번째 뉴타운사업지구다. 경기도 관계자는 경기도 심의기준을 지구지정 심의 시 가이드라인으로 활용하고 상황에 따라 지구의 특수성 등을 종합적으로 고려해 탄력적으로 운영할 방침 이라고 말했다. 고양시 관계자는 주민들의 이해와 부합하는 계획을 세우기 위해 지구지정 단계와 계획수립 단계에서 주민 시의회의 의견을 최대한 반영했다 며 이번 지구지정으로 사업이 발빠르게 진행될 것으로 보인다 고 밝혔다.,https://news.naver.com/main/read.nhn?mode=LSD&mid=shm&sid1=260&oid=277&aid=0000014362,95
68399,2007.11.01. 오전 8:31,부동산,MBN,주공·토공 눈덩이 분양 차익,주택공사와 토지공사가 분양사업으로 수천억원대의 차익을 남겨 빈축을 사고 있습니다. 서민들 주택 공급을 위해 만들어진 공기업들이 이래도 되는 건지 답답할 뿐입니다. 임진택 기자입니다. 주택공사는 작년 이후 택지개발지구에서 공동주택용지를 분양해 약 7천 억원의 차익을 남겼습니다. 토지공사도 지난 5월 프로젝트 파이낸싱을 통한 분양으로 모두 1천500여억원의 수익을 냈습니다. 기업 차원에서 수익을 낸다는 것은 바람직하지만 문제는 차익을 낸 만큼 서민이 살 집 값을 함께 올려놨다는 점입니다. 주택 공사가 대통합민주신당 이낙연 의원에게 제출한 자료에 따르면 작년 주공이 민간에 매각한 택지 개발지구의 조성원가는 1조8천억. 하지만 공급가격은 무려 2조5천억원에 달합니다. 덕분에 평균 수익율이 27%에 달했고 일부는 수익률이 50%를 넘는 단지도 있었습니다. 주공은 감정가 대로 공급했기 때문에 전혀 문제가 없다는 입장입니다. 인터뷰 대한주택공사 관계자 공동주책 용지는 감정가대로 공급하고 있기 때문에 수익이 난다고 지적하는 것은 맞지 않습니다 그러나 감정가격은 개발 이익이 거의 반영된 것이어서 주공이 서민 주택 공급보다는 잇속 챙기기에만 급급하다는 비판이 나오고 있습니다. 이와함께 싼 값에 토지를 공급해야 하는 토지 공사도 지난 5월 화성 동탄에서 555억원 용인 동백에서 423억 등 수도권 알짜배기 지역에서 집장사를 통해 큰 차익을 남겼습니다. 서민들 주택마련을 위해 만들어진 두 공기업의 설립 취지가 무색할 뿐입니다. mbn뉴스 임진택입니다.,https://news.naver.com/main/read.nhn?mode=LSD&mid=shm&sid1=260&oid=057&aid=0000068697,95
68400,2007.11.01. 오전 8:30,부동산,세계일보,이영호의 부동산특강파주신도시 청약 할려면,경기도 남양주시 진접과 양주시 고읍택지지구 동시분양에 이어 파주신도시에서 11월 중순 동시분양으로 아파트가 공급된다. 모두 7개 업체에서 6026가구가 쏟아진다. 2기 신도시 물량이고 남북 정상회담으로 경기 북부가 새롭게 주목받고 있지만 새 분양제도가 적용되는 만큼 챙길 것이 많다. 먼저 청약가점제 해당 여부다. 7개 업체에서 공급하는 모든 물량은 청약가점제 적용 대상이다. 전용 85㎡ 이하의 가점커트라인은 애초 예상했던 것보다 높을 것으로 예상된다. 청약가점제가 최초로 적용됐던 인천 ‘논현 힐스테이트’의 당첨자 가점 커트라인은 85㎡ 이하가 69∼44점이었다. 서울 역시 가점제에 해당한 ‘래미안 용두’ 85㎡ 이하가 74∼41점을 기록했다. 이는 정보업체에서 예상했던 예상치보다 적어도 10점 이상 높은 점수다. 분양가 상한제 역시 7개 사업장 모두 해당된다. 분양가는 전용 85㎡ 이하 중소형이 3.3㎡당 900만원대 전용 85㎡ 초과 중대형은 1050만∼1200만원대에서 결정될 전망이다. 특히 85㎡ 초과 중대형 물량의 분양 예정가격은 주변시세와 비슷해 채권입찰제는 적용되지 않을 것으로 보인다. 현재 운정신도시 132∼161㎡ 40평형대 평균 매매가는 1160만원 선이다. 분양가 상한제가 해당되는 만큼 전매제한 기간은 85㎡ 이하는 10년 85㎡ 초과는 7년이다. 즉 7개 사업장에서 나오는 아파트를 분양받으면 법으로 정한 기간 동안 매매를 할 수 없는데 전매제한 기간의 기준은 당첨일이 아닌 ‘계약일’이다. 재당첨제한 역시 강화된 규정이 적용된다. 분양가 상한제가 적용되고 파주가 수도권 성장관리권역에 들어가는 만큼 85㎡ 이하는 10년 85㎡ 초과는 5년 동안 주택 당첨자뿐만 아니라 가구원 모두 법으로 정한 기간 동안 1 2 3순위로 청약할 수 없다. 지역우선공급의 경우 파주신도시 1647만㎡ 가 66만㎡를 초과하는 만큼 파주시 거주자에게 30%를 우선 공급한다. 청약은 판교신도시와 마찬가지로 사이버모델하우스를 관람한 후 인터넷을 통해 청약해야 하며 당첨자에 한해 실제 모델하우스를 개방한다. 닥터아파트 리서치센터장 제17대 대선 특별 사이트 hp 17daesun.segye.com ⓒ 세계일보＆세계닷컴 www.segye.com 무단전재 및 재배포 금지 세계닷컴은 한국온라인신문협회 www.kona.or.kr 의 디지털뉴스이용규칙에 따른 저작권을 행사합니다.,https://news.naver.com/main/read.nhn?mode=LSD&mid=shm&sid1=260&oid=022&aid=0000256388,95
