,date,cat,co,headline,text,url,week
80830,2008.03.06. 오후 5:09,부동산,파이낸셜뉴스,‘강북 U턴’ 수혜 아파트 어딜까,최근 서울 성동구 뚝섬의 주상복합 아파트 분양을 시작으로 서울시의 ‘U턴 프로젝트’ 주변 분양단지가 주목받고 있다. U턴 프로젝트는 청계천 복원 서울숲 등의 파급 효과를 서울시 전역으로 확산하고 용산 민족공원 뚝섬 서울숲 한강 주변지역 등을 쾌적하고 살기 좋은 고급 주택지역으로 개발 강남권 주택 수요를 강북지역으로 유턴시키기 위한 것이다. 나아가 은평 미아 도봉구 지역까지 확대해 U자 형태로 발전시켜 나간다는 강북 업그레이드 전략이다. 이 프로젝트가 본격적으로 시행되면 강북권에서도 개발 수혜지역과 비수혜지역의 아파트 가격 격차가 벌어질 것으로 전망된다. U턴 프로젝트 수혜가 예상되는 올해 분양 예정 주요 아파트를 살펴본다. 뚝섬 일대 주상복합 ‘갤러리아포레’ 지난 4일 청약접수를 시작한 대림산업의 ‘한숲e 편한세상’에 이어 한화건설의 고급주상복합 ‘갤러리아포레’가 7일 특별분양을 시작으로 10일부터 일반 순위 청약이 시작된다. 뚝섬 1구역에 들어서는 갤러리아포레는 233∼377㎡ 229가구가 일반에 공급된다. 주상복합 아파트와 함께 극장 및 공연시설 운동시설 등이 들어선다. 아파트는 전 가구가 남향으로 설계됐고 욕실에서도 한강은 물론 서울숲 조망이 가능할 정도로 조망 여건이 양호하다. 용산 일대 용문·신계 등 재개발 아파트 관심 이수건설은 용산구 용문동 78일대 용문재개발 구역에서 195가구 중 80∼138㎡ 64가구를 이달 중 일반분양한다. 또 효창동에는 대우건설이 총 302가구 중 78∼147㎡ 161가구를 6월에 일반분양한다. 서울지하철 6호선 효창공원역이 걸어서 2분 거리에 있는 초역세권 단지로 용산구청 효창운동장 전쟁기념관 등이 가깝다. 인근에 금양초교 선린중 선린인터넷정보고 성심여중 성심여고 등의 학군이 잘 갖춰져 있다. 신계동에서도 대림산업이 신계구역 재개발아파트 699가구 중 79∼185㎡ 263가구를 6월에 일반분양할 예정이다. 서울지하철 6호선 효창공원역을 걸어서 이용할 수 있고 인근에 남정초등교 등의 교육시설이 있다. 마포 아현·동대문 전농뉴타운도 유망 U턴 프로젝트 수혜지역으로 마포구 아현뉴타운과 동대문구 전농·답십리뉴타운을 꼽을 수 있다. 이들 지역 역시 은평∼마포∼용산∼뚝섬∼도봉 등으로 이어지는 U턴 프로젝트의 핵심축 상에 있기 때문이다. 마포구 아현뉴타운에는 대우건설이 아현3구역을 재개발해 총 1532가구 중 413가구를 8월에 일반분양할 계획이다. 공급면적은 아직 정해지지 않았다. 지하철 2호선 아현역과 5호선 애오개역 5·6호선 환승역인 공덕역이 인접해 있는 트리플 역세권이다. 동대문구 답십리동 전농·답십리뉴타운 12구역에서는 한신공영이 141가구 중 84∼146㎡ 51가구를 내달 일반분양한다. 지하철1호선 청량리역이 도보로 7분 거리에 있으며 2013년 청량리∼신내 경전철이 개통 예정이어서 교통 여건도 크게 개선된다. 뉴타운 주변지역인 길음뉴타운 인근 성북구 하월곡동에서는 대우건설이 총 714가구 중 79∼140㎡ 57가구가 이달 분양 예정이다. 지하철 6호선 상월곡역이 걸어서 10분 정도로 현대백화점 미아점 롯데백화점 미아점 등 편의시설 이용이 편리하다. 숭인초등 숭곡초등 월곡초등 장위중 등의 교육시설이 자리잡고 있다.,https://news.naver.com/main/read.nhn?mode=LSD&mid=shm&sid1=260&oid=014&aid=0001950383,113
80831,2008.03.06. 오후 5:06,부동산,서울경제,분양정보 쌍용건설 부산 사직 330가구,쌍용건설이 부산 동래구 사직동 600 8번지 일대에서 ‘사직 2차 쌍용 예가’ 625가구 중 조합원분을 제외한 330가구를 7일부터 분양한다. 오는 2010년 말 입주하는 이 단지는 107.99 198.32㎡형으로 구성돼 있고 3.3㎡당 분양가는 760만 990만원대이다. 중도금의 60%까지 이자후불제가 적용된다. 특히 단지 2㎞ 이내에 사직초ㆍ중ㆍ고교 등 우수학교가 있고 주변 녹지나 편의시설도 양호한 편이다. 1㎞ 거리에 지하철 3호선 사직역이 있고 2016년에는 경전철도 개통된다. 지난 2006년 입주한 2 947가구의 ‘사직 1차 예가’가 근처에 있다.,https://news.naver.com/main/read.nhn?mode=LSD&mid=shm&sid1=260&oid=011&aid=0001943136,113
80832,2008.03.06. 오후 5:06,부동산,서울경제,MB정부 부동산정책 성공하려면 1부2 집값 안정 땅이 문제다,기반시설등 무리한 부담 줄여라 수도권 아파트 분양가 중 대지비용이 절반 경쟁입찰방식 택지공급도 땅값상승 주요인 개발이익은 환수 공공목적에 사용이 바람직 한화건설이 다음주부터 뚝섬에서 공급하는 ‘갤러리아 포레’의 3.3㎡당 분양가는 최고 4 500만원가량으로 이제까지 분양가 중 가장 높은 수준이다. 많은 사람들이 건설사가 폭리를 취하는 것으로 생각하고 있지만 분양가에서 건축비가 차지하는 비중은 37% 정도이고 나머지는 모두 대지비용 금융비 포함 이다. 즉 땅값만 낮았어도 분양가가 훨씬 낮아질 수 있다는 말이다. 뚝섬은 워낙 인기지역이라 땅값 비중이 높은 편이지만 통상적으로 수도권에서 공급하는 아파트의 대지비용도 분양가의 50%가량인 것으로 업계는 추정하고 있다. 한국토지공사가 공급하는 택지지구 아파트의 경우 택지비가 분양가에서 차지하는 비중은 29% 수준으로 민간에 비해서는 낮지만 전문가들은 기반시설부담금 및 학교용지 공급구조 완화 개발이익의 체계적인 관리 등을 통해 땅값 비중을 더 낮출 수 있다고 지적했다. ◇민ㆍ관 경쟁입찰보다 공급가격 결정 방법이 더 중요 이명박 정부는 현재 대한주택공사와 토공ㆍ지자체가 과점하고 있는 택지개발사업에 대해 민ㆍ관 경쟁입찰제도 도입을 추진하고 있다. 민ㆍ관 경쟁입찰제도가 도입되면 어느 정도는 가격이 내려갈 수 있을 것으로 예상된다. 두성규 건설산업연구원 연구위원은 “현재 아파트의 분양가에는 토지의 비중이 상당히 높은 편인데 현재는 공급업체가 과점시장을 형성하고 있어 가격이 내려갈 여지가 없다”며 “경쟁 체제가 도입되면 일정 부분 공급가격이 낮아질 수 있을 것”이라고 말했다. 그러나 공급가격을 낮추기 위해서는 경쟁입찰제도의 도입보다는 공급가격 결정 방법을 조정하는 것이 더 효과적이라는 지적도 나왔다. 토공이 인천 청라지구에서 공급한 주택용지의 조성 원가는 3.3㎡당 200만원가량으로 추산된다. 그러나 최종 낙찰가격은 4배 이상 증가한 814만원이었다. 인천 청라지구의 경우 경제자유구역법에 따라 주택용지의 가격 결정 방법이 경쟁입찰 방식이었기 때문이다. 따라서 민간이 택지를 조성해 공급한다 하더라도 경쟁입찰 방식으로 공급할 경우 인기지역에서는 땅값이 올라갈 수밖에 없어 주체가 누구인가보다는 어떤 방식으로 공급하느냐가 더 중요하다고 전문가들은 지적했다. ◇택지개발이익금을 투명하게 관리해야 개발이익은 나대지인 땅에 아파트를 지어 판매할 때 그 과정에서 생기는 이익으로 주공ㆍ토공 등 시행사 건설사 분양자 정부 등이 나눠갖게 된다. 즉 개발이익이 많아지면 자연스럽게 땅값은 올라가게 되고 땅값이 올라가면 집값이 올라가기 때문에 개발이익을 어떻게 관리할 것인가가 땅값 관리의 관건이다. 심충진 건국대학교 교수는 “개발이익은 정부로 환수돼 공공 목적을 위해 쓰이도록 해야 한다”며 “현재는 건설업체와 분양자에게 과도하게 배분되는 측면이 있는데 주공ㆍ토공 등의 시행사가 이를 환수한 뒤 정부에 배당금 형식으로 납부하는 게 바람직해 보인다”고 했다. 위평량 희망제작소 연구위원도 “현재 정부는 개발이익 중 얼마를 배분하고 환수할 것인가에 대한 고민이나 계획이 없다”며 “이를 체계적으로 관리할 필요가 있다”고 주장했다. 또 개발이익을 누가 가져갈 것인지 어디에 쓸 것인지에 대한 고민도 필요하다는 지적이다. 가령 나대지를 주공ㆍ토공이 100원에 사서 200원에 건설사에 넘기고 건설사가 이를 400원에 분양할 경우 총 300원의 개발이익이 발생하는데 이 이익을 주공ㆍ토공이 가져가는 게 좋은지 어디에 쓸지에 대한 계획이 부족하다는 말이다. 주공의 한 관계자는 “택지개발이익금은 다른 종류의 세금 및 제도로 흡수되는 부분이 많은데 이를 전체적으로 짜임새 있게 쓰기 위해서는 특별회계를 설치하는 방안이 필요해 보인다”고 말했다. 택지개발이익금을 국민임대주택 건설 등에 쓰는 것도 한 방법이다. 현재 우리나라의 임대주택 물량은 58만가구가량으로 전체 주택 수 1 330만가구의 4%가량에 불과하다. 유럽연합 EU 이나 일본의 경우 10년 이상 장기임대되는 주택이 전체 주택에서 차지하는 비중은 10%가 넘는다. ◇무리한 부담금은 땅값 상승의 주요인 기반시설 부담금이나 학교용지ㆍ공원 등 무상공급 등의 이유로 땅값이 올라가는 경우도 있다. 교육청은 토공이 공급하는 청라지구에 대해 19개에 달하는 학교용지를 무상으로 공급할 것을 요구했다. 19개 학교용지의 전체 토지조성비용은 1 300억 1 400억원가량으로 전체 사업비의 5% 안팎에 해당하는 금액이고 이는 결국 정부 예산으로 해야 하는 사업을 분양받는 사람들에게 떠넘기는 구조가 된다. 학교용지뿐 아니라 광역교통시설 등의 기반시설부담금 비중도 점차 높아지고 있다. 분당ㆍ일산ㆍ평촌ㆍ산본 등 1기 신도시의 경우 전체 기반시설 설치비용 중 시행자가 부담한 비율은 58%였지만 판교ㆍ동단ㆍ파주ㆍ흥덕의 경우에는 67%로 10%포인트가량 높아졌다. 택지조성비 중 기반시설이 차지하는 비율은 대략 20 30%가량으로 추산되기 때문에 기반시설비가 올라가게 되면 땅값은 자연히 높아진다. 여기에 공원ㆍ하천 등의 녹지율도 점차 높아지고 있다. 녹지율이 높아지게 되면 가처분 면적이 줄게 돼 땅값이 올라가게 된다. 주공에 따르면 분당ㆍ일산ㆍ산본ㆍ중동ㆍ평촌 등의 평균 녹지율은 18.7%였지만 최근 택지를 공급한 판교ㆍ김포ㆍ동탄ㆍ파주 등 9개 지구의 평균 녹지율은 29%에 달했다.,https://news.naver.com/main/read.nhn?mode=LSD&mid=shm&sid1=260&oid=011&aid=0001943135,113
80833,2008.03.06. 오후 5:01,부동산,머니투데이,한화건설 뚝섬 갤러리아 포레 7일부터 분양,머니투데이 정진우 기자 7일 특별공급 10 12일 1 3순위 분양 ↑ 뚝섬 갤러리아 포레 조감도 한화건설이 서울 성동구 뚝섬 1구역에 짓는 주상복합아파트 갤러리아 포레 가 7일부터 분양된다. 한화건설은 7일 뚝섬 1구역 갤러리아 포레 의 특별공급을 시작으로 10 12일까지 순위별 청약을 실시한다고 6일 밝혔다. 10 12일까지 1 3순위별 분양이 끝나면 3월18일 당첨자 발표가 이뤄진다. 오는 25 27일까지 계약 일정이 진행된다. 한화건설이 시공하고 인피니테크가 시행을 맡은 갤러리아 포레 주상복합아파트는 1만7491㎡에 지하7층 지상45층 높이 2개동 230가구 로 이뤄진다. 399%의 용적률이 적용된다. 또 공연·전시장 쇼핑시설 스포츠시설 등도 건립한다. 주택형별 가구수는 230㎡ 77가구 260㎡ 38가구 300㎡ 75가구 331㎡ 36가구 370㎡ 4가구 등이다. 분양가는 3.3㎡당 3971만 4598만원이다. 갤러리아 포레 는 모든 가구가 남향으로 배치돼 있다. 거실에서는 3면이 내려다 보인다. 4층에 설치되는 옥상정원을 비롯 다양한 주민커뮤니티시설도 눈길을 끈다.,https://news.naver.com/main/read.nhn?mode=LSD&mid=shm&sid1=260&oid=008&aid=0001954643,113
80834,2008.03.06. 오후 5:00,부동산,이데일리,부영 제주도에 부영컨트리클럽 개장,이데일리 윤진섭기자 ㈜부영이 8일 제주 서귀포시 남원읍 수망리에 27홀 규모의 골프장을 개장한다. 부영 컨트리클럽은 수망관광지구 개발사업지 내 102만㎡ 규모로 지어지며 골프장과 대식당 연회장 사우나 등의 편의시설이 구비된다. 한라산과 바다 조망이 가능하다. ㈜부영은 앞으로 9홀을 추가로 조성하고 휴양콘도를 지어 골프와 레저 휴식을 겸할 수 있는 종합 리조트로 조성할 계획이다.,https://news.naver.com/main/read.nhn?mode=LSD&mid=shm&sid1=260&oid=018&aid=0001950991,113
80835,2008.03.06. 오후 4:54,부동산,파이낸셜뉴스,GS건설  레드닷 디자인 어워드 수상,GS건설은 세계적 디자인 공모전인 ‘2008 레드닷 디자인어워드 Red Dot Design Award ’에서 큐브 벤치 CUBE bench 와 이노큐브 INNO CUBE 가 수상했다고 6일 밝혔다. 이로써 GS건설은 세계 최고 권위의 3대 디자인 공모전 중 지난해 ‘IF 국제포럼 디자인상 ’를 수상한데 이어 올해 ‘레드닷 디자인 어워드’를 연이어 수상하는 영예를 안았다. 큐브벤치와 이노큐브는 독창성 인간공학적 배려 기능성 등의 주요 평가 항목에서 높은 점수를 받은 것으로 전해졌다. 큐브벤치는 공공장소에 설치되는 모듈식 구조의 의자이며 이노큐브는 한국의 조각보를 컨셉으로 간결한 비례감을 살린 욕실 수납장이다. GS건설 원종일 주택기술담당은 “앞으로도 혁신적인 상품 개발을 통해 국내 주택시장은 물론 해외에서도 자이의 역량을 널리 전파할 것”이라고 말했다.,https://news.naver.com/main/read.nhn?mode=LSD&mid=shm&sid1=260&oid=014&aid=0001950367,113
80836,2008.03.06. 오후 4:53,부동산,연합뉴스,주택대출 쏠림현상 개선해야,서울 연합뉴스 조재영 기자 서브프라임 모기지 비우량 주택담보대출 사태 같은 주택금융시장의 위기를 막기 위해서는 단기변동금리 일변도의 주택대출 쏠림현상 을 해소해야 한다는 지적이 제기됐다. KDI 국제정책대학원의 조만 교수는 6일 한국주택금융공사가 주관한 평생금융교실 에서 미국 서브프라임 사태는 변동금리대출 ARM 특히 2년간 고정금리 적용 후 변동금리로 전환되는 대출이 급증한 데서 비롯된 것 이라고 진단한 뒤 한국도 변동금리 대출의 과다한 쏠림현상을 개선해야 한다 고 주장했다. 국내 주택담보대출 시장에서 주택금융공사의 보금자리론이 차지하는 비중은 지난해 12월 말 현재 3.7% 수준으로 시장 안정을 위해서는 장기고정금리 대출의 점유율을 지속적으로 확대해야 한다는 지적이다. 한편 조 교수는 서브프라임 사태가 미국 경제 전반에 미칠 수 있는 주요 위험 요인으로 원리금 상환조건 재조정 미국 주택가격 하락 프라임 모기지 시장으로의 위험 전이 등 세가지를 꼽았다. 그는 서브프라임 모기지 공급이 집중된 2006년 대출의 원리금 상환조정이 올해 대량으로 이루어짐에 따라 차입자의 상환부담이 커져 연체율과 대손율이 올라갈 수 있다 며 지난 10년간 큰 폭으로 상승한 미국 주택가격이 지난해 이미 8% 하락했고 20 30%의 조정될 것이라는 예측이 현실화될 경우 미국 주택시장은 1930년대 대공황 이후 최악의 침체를 맞을 수 있다 고 말했다. 그는 특히 연체율 상승이 미국 전체 모기지시장의 80% 이상을 차지하고 있는 프라임모기지 시장으로 확산될 수 있으며 이미 그런 조짐은 나타나고 있다 며 미 모기지 시장에서 부도율이 올라가고 압류된 주택이 할인된 가격으로 시장에 매물로 나올 경우 미국 주택가격은 더 큰 폭으로 하락하고 미국 경기는 더욱 깊은 침체 국면으로 빠져드는 악순환이 이어질 수 있다 고 내다봤다.,https://news.naver.com/main/read.nhn?mode=LSD&mid=shm&sid1=260&oid=001&aid=0001989687,113
80837,2008.03.06. 오후 3:57,부동산,파이낸셜뉴스,부영 제주도에 부영컨트리클럽 개장,㈜부영이 8일 제주 서귀포시 남원읍 수망리에 27홀 규모의 골프장을 개장한다고 6일 밝혔다. 부영 컨트리클럽은 수망관광지구 개발사업지 내 102만㎡ 규모로 지어지며 골프장과 대식당 연회장 사우나 등의 편의시설이 구비된다. 한라산과 바다 조망이 가능하다. ㈜부영은 앞으로 9홀을 추가로 조성하고 휴양콘도를 지어 골프와 레저 휴식을 겸할 수 있는 종합 리조트로 조성할 계획이다.,https://news.naver.com/main/read.nhn?mode=LSD&mid=shm&sid1=260&oid=014&aid=0001950332,113
80838,2008.03.06. 오후 3:44,부동산,아시아경제,다세대.연립 공시가격 크게 상승한 이유는,전국적으로 공동주택 공시가격이 2 3% 상승한 가운데 연립.다세대 주택이 50%에 육박하는 상승률을 기록해 관심이 쏠리고 있다. 이는 강북지역의 개발 호재로 재개발 뉴타운지역 중심으로 집값 상승이 이어졌기 때문으로 분석된다.,https://news.naver.com/main/read.nhn?mode=LSD&mid=shm&sid1=260&oid=277&aid=0001953380,113
80839,2008.03.06. 오후 3:19,부동산,이데일리,GS건설 독일 디자인 공모전 2개작품 수상,이데일리 윤진섭기자 GS건설 006360 은 독일에서 열린 2008 레드 닷 디자인 어워드 Red Dot Design Award 에서 자사가 출품한 큐브 벤치 CUBE bench 와 이노 큐브 INNO CUBE 2개 작품이 상을 받았다고 6일 밝혔다. 이로써 GS건설은 2007년 국제포럼 디자인전 IF 에 이어 세계적 권위의 디자인전에 연이어 수상하는 영예를 안게 됐다. 큐브벤치는 공공장소에 설치되는 모듈식 구조의 벤치다. 사용환경에 맞게 길이와 각도 등을 조절해 다양한 조합이 가능한 제품이다. 이노 큐브는 한국의 조각보를 응용해 간결한 비례감을 살린 욕실 수납장이다. 수납제품의 규격 및 용도를 고려 기능성 디자인을 추구했다. GS건설 원종일 주택기술담당은 혁신적인 상품 개발을 통해 국내 주택시장은 물론 해외에서도 Xi 의 역량을 널리 알릴 것 이라고 말했다.,https://news.naver.com/main/read.nhn?mode=LSD&mid=shm&sid1=260&oid=018&aid=0001950928,113
80840,2008.03.06. 오후 3:10,부동산,이데일리,6천억 안양덕천 시공권을 따내라..대형사 각축,25일께 사업자 윤곽..대형 4사 총력전 대우 한화 삼성 동부 현대 경남 대림 두산 이데일리 윤진섭기자 6000억원 안양 덕천 재개발 시공권을 따내라 대한주택공사가 발주한 주택 턴키 사업에 국내 대형건설사들이 모두 참여해 경쟁을 벌이고 있어 최종 결과에 관심이 쏠리고 있다. ◇국내 상위 4개 건설사 빅매치 6일 업계에 따르면 대한주택공사가 작년말 지명경쟁 턴키방식으로 발주한 안양시 만안구 안양 덕천재개발사업의 사업자가 이달 25일 경에 윤곽이 드러난다. 공사예산 5950억원의 덕천 재개발사업은 26만여 ㎡에 모두 4276가구의 대단지 아파트를 공급하는 공공 프로젝트 사업이다. 이 사업에 출사표를 던진 회사는 대우건설 047040 삼성물산 000830 건설부문 현대건설 000720 대림산업 000210 등 4개사다. GS건설은 안양 덕천 재개발 시공사 선정에서 주공과 경합을 벌여 탈락한 바 있어 이번 입찰에는 참여하지 않았다. 또 롯데건설은 입찰에 참여하지 않기로 최종 입장을 정리한 것으로 알려졌다. 이들 5개사는 재개발 조합이 주민들을 대상으로 진행한 선호 브랜드 조사 결과에 따라 결정됐다. ◇주공 발주 역대 최대규모 턴키 발주 이번 공사는 주택공사가 발주한 턴키 아파트 공사 중 역대 최대규모다. 판교 아파트공사 중 최대 규모인 3공구 2514억원 의 2배이고 최대 건축 턴키공사인 서울 동남권 이주상가 가블록 5657억원 을 웃도는 사업 규모다. 이번 프로젝트는 설계점수 1·2위 간 점수 격차를 두는 설계심의 강제차등제 를 적용하고 있다. 이에 따라 각 업체들은 설계 심의에서 1위를 차지하기 위해 설계에 총력을 기울이고 있다. 경남기업 000800 과 손을 잡은 현대건설은 올 첫 주간사 턴키 수주라는 점에서 심혈을 기울이고 있다. 현대건설은 올해 강원랜드가 턴키방식으로 발주한 하이원 콘도와 호텔을 컨소시엄 서브회사로 참여해 수주했었다. 대우건설은 주택공사가 발주한 성남 단대 재개발 사업을 따낸 여세를 몰아 이번 프로젝트도 따내겠다는 입장이다. 대우건설은 한화건설과 컨소시엄을 구성했다. 동부건설 005960 과 컨소시엄을 구성한 삼성물산 건설부문은 이번 사업을 따내 주택공사 발주공사를 처음으로 수주하겠다는 입장이다. 대림산업은 두산건설 011160 과 컨소시엄을 구성해 입찰에 참여하고 있다. 한편 안양 덕천재개발사업은 오는 25일 실시설계적격자 확정 내년 10월 사업인가 및 철거 내년 4월 분양관리처분 등의 순으로 사업이 진행될 예정이다.,https://news.naver.com/main/read.nhn?mode=LSD&mid=shm&sid1=260&oid=018&aid=0001950924,113
