,date,cat,co,headline,text,url,week
78815,2008.02.14. 오후 2:07,부동산,이데일리,프리즘쌍용건설 사주조합 쿠르드 딜레마,최대 10조원 쿠르드 재건사업 쌍용건설 주간사로 참여 주가급등 우선매수청구권 부담으로 이어져 우리사주 고민 이데일리 윤진섭기자 쌍용건설 012650 우리사주조합이 고민에 빠졌다. 최대 10조원 규모의 이라크 쿠르드 재건사업 때문이다. 대형 프로젝트를 따낸 것은 반가운 소식이지만 주가가 덩달아 뛰는 게 문제다. 12일 종가 1만5900원이었던 쌍용건설 주가는 재건 참여 소식이 전해진 뒤 어제 주당 2350원이 올랐다. 14일 현재도 상한가를 지속 중이다. 회사 인수를 추진 중인 사주조합 입장에서 결코 달갑지 않은 상승이다. 사주조합이 주가 급등에 민감한 데는 쌍용건설 M A의 독특한 방식 때문이다. 쌍용건설 우리사주조합은 캠코 지분 가운데 24.72%에 대한 우선매수청구권을 갖고 있다. 우리사주조합은 현재 김석준회장 등 현 경영진 지분 1.71%와 우호지분 쌍용양회 6.13% 등을 합쳐 25.65%를 갖고 있다. 우선매수청구권을 행사하면 50% 이상 지분을 확보해 경영권을 되찾아 올 수 있다. 캠코는 동국제강 오리온 남양건설 군인공제회 아주그룹 등을 인수 후보군으로 선정했다. 본 입찰을 받아 내달 중 5곳 중 1곳을 우선협상대상자로 선정할 계획이다. 우선협상대상자가 제시한 가격을 기준으로 사주조합에 행사 여부를 묻겠다는 게 캠코의 생각이다. 결국 사주조합이 쌍용건설을 인수하는 데 가장 큰 변수가 우선협상대상자가 제시한 가격이다. 우선협상대상자가 주당 얼마에 인수가격을 책정할지는 현재로선 알 수 없다. 다만 인수가격을 제시할 때 기준이 되는 게 현재 주가다. 주가가 크게 오를 경우 우선협상대상자가 제시하는 가격도 높을 수밖에 없다. 사주조합이 주가에 민감한 이유가 여기에 있다. 예컨대 12일 종가 1만5900원에 경영권 프리미엄 30% 정도를 더하면 사주조합이 우선매수청구권 750만주 에 드는 비용은 1500억원 안팎이다. 그러나 14일 현재가 2만1000원이면 인수금액이 2000억원에 육박한다. 불과 이틀 만에 인수대금이 500억원이상 오른 것이다. 여기에 M A 업체간 경쟁 경영권 웃돈까지 오른다면 사주조합의 부담은 더욱 커진다. 이라크 쿠르드 재건사업이 회사입장에선 대형 호재지만 사주조합 입장에선 대형 악재 인 셈이다.,https://news.naver.com/main/read.nhn?mode=LSD&mid=shm&sid1=260&oid=018&aid=0001943339,110
78816,2008.02.14. 오후 1:59,부동산,아시아경제,인천시 지적측량 전자식 도입,인천시의 지적측량 방식이 전자식으로 바뀐다. 시는 100년 동안 종이 도면에 현지의 지형 건물을 연필 등으로 표시하던 측량 방식을 지적도 전산화일을 이용 레이저 측량장비인 토탈스테이션과 휴대용 컴퓨터를 연결하는 전자 지적측량으로 전환한다고 14일 밝혔다.,https://news.naver.com/main/read.nhn?mode=LSD&mid=shm&sid1=260&oid=277&aid=0001944305,110
78817,2008.02.14. 오후 1:56,부동산,이데일리,대우건설 강남 주택문화관 18일 오픈,이데일리 남창균기자 대우건설은 오는 18일 서울 강남역 근처에서 주택문화관 푸르지오 밸리 를 오픈한다. 오전 9시부터 오후 10시 월 토 까지 문을 연다. 푸르지오 밸리는 최근의 주거 트랜드와 미래형 주택을 보여주는 공간이자 도심 쉼터 역할을 맡게 된다. 전체 4층 규모 780평 로 1층은 로비 2층과 3층은 주거생활공간 4층은 분양마케팅 공간으로 꾸몄다. 주거생활공간은 푸르지오本 푸르지오秀 푸르지오流 등으로 테마화해 각각 오늘과 내일의 주거트렌드를 보여 준다. 푸르지오밸리는 자녀동반 고객을 위해 어린이 놀이터와 갤러리 공간을 설치했으며 밸리가든과 스카이가든에서 휴식을 취할 수 있도록 했다. 땅을 상징하는 건물의 허리를 파내 계곡 StartFragment Valley 을 형상화했다.,https://news.naver.com/main/read.nhn?mode=LSD&mid=shm&sid1=260&oid=018&aid=0001943335,110
78818,2008.02.14. 오후 1:23,부동산,아시아경제,강남아파트 거래부진..호가격차 최대 3억5000만원,고가아파트 밀집지역인 강남의 아파트 거래가 부진한 가운데 호가격차가 갈수록 커지고 있다. 새정부 출범을 앞두고 용적률 상향조정 세제완화 등의 기대감속에 매도.매수자간 정책개편에 대한 상반된 시각차가 나타나고 있기 때문이다.,https://news.naver.com/main/read.nhn?mode=LSD&mid=shm&sid1=260&oid=277&aid=0001944279,110
78819,2008.02.14. 오후 1:10,부동산,아시아경제,효율·수명 높인 OLED 인캡슐레이션 기술 특허 급증,휴대폰 등 화면의 고해상도와 초박형 특성으로 인해 OLED Organic Light Emiing Diode 유기발광다이오드 가 LCD 이후 차세대 디스플레이로 각광받는 가운데 OLED 인캡슐레이션 Encapsulation 밀봉 기술 관련 특허출원이 최근 급증한 것으로 나타났다. OLED는 휴대폰 등의 화면이 LCD로 구성돼 있는데 이에 대해 보다 화면 해상도를 높이기 위해 생긴 유기발광다이오드다.,https://news.naver.com/main/read.nhn?mode=LSD&mid=shm&sid1=260&oid=277&aid=0001944274,110
78820,2008.02.14. 오후 12:53,부동산,이데일리,재테크광고용인토지 84000㎡ 1차분 선착순분양,도시지역 토지 금이I.C 2분 금어천 인접필지 이데일리 ‘수도권의 투자유망 1번지’로 꼽혀온 용인시 동남부 일대가 최근 “2020년 용인도시기본계획 및 시가지화예정용지로 확정되면서 용인의 동남부 지역의 개발 기대감이 고조되고 있다. 대한택지개발 주 은 용인시 처인구 포곡읍 금어리 일대 회사 보유분 토지를 선착순 분양한다. ㎡당 분양가는 8만4천 ㎡ 396㎡ 495㎡ 120 150 기준이며 투자금액은 3천 4천만원선이다. 이번 분양필지는 이미 133만1000㎡ 40만평 저밀도 전원형문화복합도시 예정지역으로 주거단지와 상업시설 공공시설들이 조성될 계획이다. 서울강남에서 20분대 진입 용인I.C 5분거리 57번 자동차전용도로 금이I.C 2분거리 용인경전철 수포역에서 3분거리로 주변 인프라가 잘 갖추어진 토지이다. 회사측은 분양토지와 접한 전원주택지의 경우 현재 시세는 180만원선이라고 한다. 또한 용인시 및 동백 신도시 분당의 각종 편의시설 이용 에버랜드 2Km인접 지산과 양지리조트 6Km인접 아시아나C.C 등 26개의 주변 골프장 산재등 사계절 휴양지 및 주거지로써 최상의 입지조건을 갖추고 있다. 고 설명한다. 소액투자와 전원생활을 동시에 누릴수 있고 토지거래허가구역 제외지역으로 투자자들이 선호하는 모든 조건을 갖추었다. 에스크로우제도 법무사를 통한 제3자 안전거래 보장제 접수방식으로 신청금 100만원을 농협 100162 52 007584 손세운법무사 입금하면 필지 배정우선권을 부여받아 답사 전까지 토지를 확보할 수 있다. 현장 답사 후 계약 결정이 가능하고 신청 철회시 전액 환불된다.,https://news.naver.com/main/read.nhn?mode=LSD&mid=shm&sid1=260&oid=018&aid=0001943308,110
78821,2008.02.14. 오후 12:40,부동산,이데일리,재테크광고대세는 충주호 땅 2000만원대 토지매각,스키장 골프장 개발지 초입 땅 한정매각 충주호 접한 토지 55 000원 3.3㎡ 1필지 2000만원대 확장 국도변 이데일리 ㈜호반레져산업에서는 미래가치가 뛰어난 충주호변 제천시 금성면 일대의 토지를 한정 매각한다. 매각 필지는 관광지로 유명한 금월봉 리조트 맞은편이며 조망권은 부지 앞으로 충주호가 펼쳐져 있는 배산임수 지역이다. 또한 개발촉진 지구로 들어가는 초입으로 확장 공사중인 523국도를 끼고 있다. 분양단가는 3.3㎡ 55 000원이다. 기준 3 306㎡ 1 650㎡ 금일 매각 토지는 토지거래허가제외지역이며 저렴한 시세 넘쳐나는 개발호재와 교통환경 개선으로 투자가치를 확신할 수 있는 지역으로 소액 투자자들에게 절호의 기회다. 접수 및 문의 043 652 1813 매각부지 주변 개발 계획으로 제천개발촉진지구 중 총 3 612억원의 사업비가 투자되는 리조트 단지로 약 170만평의 규모로 스키장과 72홀 규모의 골프장 골프대학 호텔 등이 2013년까지 완공될 계획이며 매각부지가 초입이 된다. 교통망도 중앙고속도로 제천 IC와 남제천 IC가 있고 동서고속도로 안중 삼척 서울 덕소 양평 원주 신림 제천을 잇는 중앙선 복선 전철 행정도시와 연결되는 청원 충주간 도로가 개통될 예정으로 충주호 일대는 많은 투자자들의 관심이 집중 되고 있으며 주말에도 토지를 사려는 사람들이 많이 찾아온다. 분양절차 신청금 100만원 신한은행 110 188 668030 예금주 조현묵 법무사 필지 배정 현장답사 계약 회사 소유 토지로 소유권 이전등기는 물론 분양에 대한 모든 자금 관리는 조현묵 법무사에서 관리 하며 미 계약 시 신청금도 법무사에서 책임지고 100% 환불 한다.,https://news.naver.com/main/read.nhn?mode=LSD&mid=shm&sid1=260&oid=018&aid=0001943306,110
78822,2008.02.14. 오후 12:35,부동산,뉴시스,서울 돈의문뉴타운에 아파트 1887가구,돈의문뉴타운 개발 계획도 서울 뉴시스 도시환경 정비구역으로 지정된 서울 종로구 교남동 돈의문뉴타운 에 최고 23층의 탑상형 아파트 1887가구가 들어선다. 서울시는 지난 13일 도시·건축공동위원회를 열어 이 같은 내용의 돈의문 도시환경정비구역 변경 지정안 을 가결했다고 14일 밝혔다. 이에 따라 교남동 62 1번지 일대 16만8000㎡ 규모의 돈의문뉴타운 에는 전용면적 85㎡ 미만 1380가구와 85㎡ 이상 507가구 등 총 1887가구가 건립된다. 이중 조합원분을 제외한 아파트는 일반 분양된다. 아파트 최고 층수는 당초 최고 20층에서 임대아파트 5개 동은 최고 19층 일반아파트 25개동은 23층으로 확대됐으며 디자인도 판상형에서 탑상형으로 변경됐다. 공동위원회는 또 성북구 하월곡동 34 10번지 일대에 최고 26층 이하의 아파트 398가구를 짓는 월곡 제4주택재개발정비구역 지정안 을 통과시켰다.,https://news.naver.com/main/read.nhn?mode=LSD&mid=shm&sid1=260&oid=003&aid=0001961047,110
78823,2008.02.14. 오후 12:31,부동산,이데일리,재테크광고795만원 전국골프장 정회원대우 선착순 공개모집,금일 신청자 제주왕복항공권 3년간 증정 이데일리 선진국형 골프 서비스 페이백 PAY BACK 제도를 국내에 처음 도입한 주 스위스레져코리아가 창립 9주년을 맞아 795만원 개인 상품을 출시 그 동안 가격 부담으로 구입을 망설였던 국내 골퍼들에게 큰 반향을 일으키고 있다. 개인형 795만원 은 연 15회 주중에 전국 모든 골프장에서 회원과 비회원의 그린피 차액을 지원해주고 부부형 법인형 1590만원 은 연 30회 그린피 차액을 지원해준다. 특히 기존상품과 달리 주말 라운딩 시에도 주중 회원가 기준으로 그린피 차액을 지원하여 회원권이 없이 주말 동반 라운딩을 즐기는 골퍼들에게는 안성맞춤 실속형 상품이다. 제주도는 주중 주말에 관계없이 그린피 전액이 무료로 제공되며 협재 해수욕장에 있는 골프텔을 매년 5박씩 무료로 이용할 수 있다 해외골프는 태국 필리핀을 매년 3박 5일 기준으로 숙박 식사 그린피 차량. 가이드의 비용이 회원 본인에 한해 전액 무료로 제공 된다. 회원자격은 개인형 입회금은 795만원 보증금 501만원 부부형 법인형 은 1590만원 보증금 1000만원 으로 골프혜택은 6년이며 보증금은 회원기간 7년 만기 후 반환한다. 보증금은 제주 골프텔 17평 회원자격을 부여해 입회 기간 동안 안전하게 즐길 수 있다. 신청 절차는 청약금 100만원 을 국민은행 829 01 0302 302 주 스위스레져코리아로 입금하면 창립회원 접수가 되며 담당 직원이 방문하여 계약서 작성을 하면 된다. 금일 신청자에 한해 제주왕복항공권 1인기준 이 3년 간 주어진다.,https://news.naver.com/main/read.nhn?mode=LSD&mid=shm&sid1=260&oid=018&aid=0001943302,110
78824,2008.02.14. 오후 12:01,부동산,헤럴드경제,재개발 ‘중대형 마찰’ 사라지나,제도개선 곳곳서 제기…서울시의회 관련법 개정안 발의 ‘중대형 평형을 분양받려는 재개발단지의 조합원간 마찰이 사라질 것인가’ 현재 재개발 사업지 내 국민주택규모 전용 85㎡ 이상 공급 물량 가운데 50%는 반드시 일반 분양 물량으로 공급하도록 규정 도시 및 주거환경정비조례 중대형 평형을 원하는 조합원들간의 마찰이 불가피하다. 중대형을 원하는데 국민주택규모 이하 물량을 배정받거나 심지어 현금 청산 대상에 포함되는 일이 잇따라 발생 제도 개선이 강하게 제기되고 있다. 따라서 서울시의회 도시관리위원회 이주수 의원 외 10명은 주택 재개발 사업에서 분양대상 조합원이 현금 청산이 되는 경우 해당 조합원 수에 한하여 권리가액이 많은 순으로 국민주택규모 초과 주택을 추가 공급할 수 있도록 하는 내용의 도시 및 주거환경정비조례 일부 개정안을 발의 향후 처리여부가 주목된다. 재개발구역 내 국민주택규모 초과분에 대한 50% 일반분양 규정에 관계없어 조합원이 추가로 분양받을수 있는 길이 열리기 때문이다. 예컨대 조합원 1000명중 500명이 중대형을 원할 경우 국민주택규모 이상 총물량이 500가구라면 현재는 250가구만 조합원들이 분양받을 수 있고 나머지 250명은 현금청산 대상이 되는 것이다. 특히 개정안은 현금청산 50명에 대해서는 국민주택규모 초과 물량의 제한을 없애 조합원들이 분양받을 수 있도록 했다. 현재 이같은 현상이 발생하고 있는 사업지는 지분 쪼개기로 분양 예정 물량보다 조합원 수가 많아진 금호동 재개발 사업지 등이 꼽히고 있다. 개정안은 또 높은 권리가액을 판정받고도 중대형 50% 규정으로 국민주택규모 주택을 배정받게 되는 조합원에 대해서도 권리가액이 중대형평형의 공급가와 인접하면 조합원이 직접 희망 평형을 선택할 수 있도록 했다. 대표적인 곳이 왕십리 뉴타운 재개발 사업지로 넓은 지분의 단독주택 등을 소유한 조합원이 높은 가격의 감정가격을 가지고도 중대형 평형 50% 제한으로 전용면적 85㎡ 32평형 을 배정받아 불만이 팽배해 있는 상황이다. 이번 개정안은 조례 시행 당시 관리처분인가서가 접수된 정비구역부터 적용할 방침으로 오는 19일 도시관리위원회 의견청취와 20일 본회의를 거쳐 이르면 3월부터 시행에 들어갈 예정이다.,https://news.naver.com/main/read.nhn?mode=LSD&mid=shm&sid1=260&oid=016&aid=0000263953,110
78825,2008.02.14. 오후 12:01,부동산,헤럴드경제,금호 베트남 발판삼아 해외사업 박차,4조원대 하노이 신도시 사업 추진…UAE 운하도 금호건설 대표 이연구 사진 이 베트남과 아랍에미리트 두바이를 발판 삼아 해외 사업에 박차를 가한다. 금호건설은 하노이시 인근에 총 사업비가 4조원에 가까운 대규모 신도시 개발 사업을 추진한다고 14일 밝혔다. 사업 지역은 베트남 하노이시 뜨리엠현 박 꼬뉴에 쨈 지역 360만㎡ 부지로 총 사업비는 40억달러 규모다. 하노이시 도심에서 7㎞거리에 위치한 이곳 사업지에는 주거단지와 상업 공업 업무 학교시설 공원 등이 조성된다. 금호건설은 이와 관련해 최근 베트남 현지 국영기업인 UDIC Urban Infrastructu re Development Investment Corporation 와 양해각서 MOU 를 체결하고 5월까지 사업제안서를 제출할 계획이다. 이어 6월에는 UDIC와 50대 50 지분으로 합작회사를 설립하고 본격적인 사업추진에 나선다. 금호건설은 이와 함께 지난 12일 아랍에미리트 UAE 두바이 시내 중심지와 운하를 개발하는 ‘쥬메이라 가든 시티 Jumeriah Garden City 프로젝트’의 사업참여 의향서 LOI 를 두바이 국영기업인 메라스 MERAAS 로부터 받았다. 이 사업은 두바이 해안을 포함한 약 1000만㎡ 부지에 24만명 인구가 상주할 도시의 기반시설공사와 7km에 이르는 내부 운하를 건설하는 공사로 이미 두바이 국왕으로부터 사업추진 허가를 받았다. 도시기반시설 공사와 랜드마크 빌딩 등을 건설하는 사업비는 약 40억달러 운하공사비는 약 2억달러 규모로 추산된다. 금호건설은 이밖에도 베트남 호찌민시에 주택 2000여가구와 레지던스 시설을 갖춘 28홀짜리 골프장 붕따우 종합리조트 사업 등 추가 수주를 앞두고 있으며 총 사업비만 100억달러에 달하는 아라비안 운하가 다음달 중 입찰에 부쳐질 예정이어서 조만간 수주 여부가 결정될 전망이다. 한편 금호건설은 지난해 매출 1조6100억원 수주 4조1600억원 영업이익 1223억원을 기록했으며 이를 바탕으로 올해 매출은 작년보다 55% 증가한 2조5000억원 수주는 37% 늘어난 5조7000억원을 목표로 잡았다.,https://news.naver.com/main/read.nhn?mode=LSD&mid=shm&sid1=260&oid=016&aid=0000263952,110
78826,2008.02.14. 오후 12:01,부동산,헤럴드경제,성원건설 1500억 규모 두바이 프로젝트 참여,해외사업에 올인하고 있는 성원건설은 최근 아랍에미리트 UAE 두바이에서 약 1500억원 규모의 2개 프로젝트에 참여키로 했다고 14일 밝혔다. 성원건설은 이날 트렌드 캐피털 Trend Capital Gmbh Co 사와 두바이 비즈니스베이 지역에 703억원 규모로 추진 예정인 실버스타 저먼 비즈니스 타워 프로젝트 Silver Star German Business Tower Project 의 LOI 투자의향서 를 체결했다. 이와 별도로 성원건설은 지난달 BMG 미들이스트 디벨롭먼트 BMG Middle East Development LLC 와도 745억원 규모의 더 큐브 The Cube 두바이 스포츠 시티 프로젝트 Dubai Sports City Project 의 LOI를 맺었다. 이 사업은 발주처로부터 공사수주를 받는 도급사업으로 성원건설은 향후 본계약 체결시 재공시할 예정이다. 성원건설 관계자는 “현재 두바이 바레인 카타르 등지에서 15개 프로젝트를 검토중이어서 향후 해외수주실적이 지속적으로 증가할 것”이라며 “지난해 양해각서를 체결한 19조원 규모의 두바이 구도심 데이라지역 재개발 프로젝트도 계속 진행중”이라고 말했다.,https://news.naver.com/main/read.nhn?mode=LSD&mid=shm&sid1=260&oid=016&aid=0000263951,110
78827,2008.02.14. 오후 12:01,부동산,헤럴드경제,용산 국제업무지구개발 막올랐다,추진업체 창립식…2016년 완공 예정 총 사업비 28조원으로 단군 이래 최대 사업비가 투입될 서울 용산 국제업무지구 개발사업이 본격적으로 시작됐다. 시행사인 드림허브프로젝트금융투자㈜와 개발계획 수립에서 분양.관리까지 도맡는 용산역세권개발㈜이 13일 창립식을 갖고 사업 시동을 걸었다. 용산국제업무지구 개발사업은 용산 철도정비창 터와 서부이촌동 일대 56만6 800㎡에 150층 높이의 랜드마크 타워와 국제업무.상업.주거시설과 문화시설이 결합된 복합개발단지를 건설하는 초대형 프로젝트로 오는 2011년 착공해 2016년 완공될 예정이다. 용산 국제업무지구는 업무시설과 쇼핑.주거 기능을 모두 갖춘 ‘한국판 두바이’가 될 것으로 기대를 모으고 있다. 용산국제업무지구는 앞으로 추진될 마스터플랜에 따라 지상 152층 620m 높이의 랜드마크 타워를 비롯해 전체적인 건물 조형이 바뀔 것으로 예상된다. 상업시설에는 현재 미국의 쇼핑몰 개발업체인 터브먼과 아랍에미리트연합의 국영 개발업체인 나킬 세계적 명품 업체인 루이비통을 소유한 LVMH그룹과 세계 최고의 호텔 운영업체인 포시즌 만다린도 적극적인 참여 의사를 표명한 것으로 전해졌다. 이날 기념식에는 오세훈 서울시장을 비롯해 이상대 삼성물산 사장 박해춘 우리은행 행장 박광석 코레일 사장 등 컨소시엄의 주주 대표와 각계 인사 100여명이 참석했다.,https://news.naver.com/main/read.nhn?mode=LSD&mid=shm&sid1=260&oid=016&aid=0000263950,110
78828,2008.02.14. 오후 12:01,부동산,헤럴드경제,“세계적 워터프런트 신도시 조성”,이원익 사장 인터뷰 용산역세권개발㈜의 초대 대표이사인 이원익 56.사진 사장은 “용산을 미국 라스베이거스와 같이 전 세계적으로 유례가 없는 신천지로 만들겠다”며 “가장 한국적인 가치가 스며들어 있으면서도 세계적인 경쟁력을 갖춘 최초의 워터프런트 신도시로 조성하겠다”고 강조했다. 이 사장은 특히 “후손에게 물려줄 자랑스런 문화유산이 될 수 있도록 우리 만의 독창적인 복합단지를 만들 것”이라며 “올 6월 께 세계적인 건축 설계사무소들이 참여하는 국제 현상공모를 통해 구체적인 개발 청사진을 마련하겠다”고 밝혔다. 이를 위해 지난해 말 일본 도쿄의 롯본기힐스와 미드타워 오다이바 홍콩의 쇼핑몰과 마카오 등 대표적인 복합개발 지역을 둘러봤다고 설명했다. 용산국제업무지구 중심에는 152층 규모의 드림타워가 자리잡고 20 50층 높이 주상복합 7개동 20 70층 높이 오피스빌딩 12개동이 병풍처럼 둘러싸면서 서울의 새로운 스카이라인을 형성하게 된다. 이 사장은 “용산역세권을 명실상부한 국제업무지구로 조성하기 위해서는 법인세 감면 혜택 등을 통해 글로벌 기업을 유치하는 것이 유리하다”며 “용산역세권을 ‘경제특구’로 지정하는 방안을 재정경제부와 협의해나갈 것”이라고 말했다. 아울러 걸림돌이 될 철도기지창 이외 사유지 6만㎡ 에 대한 보상문제에 대해서는 “끊임없는 대화로 설득하는 방법밖에 없다”며 “사업 성공 이후 가치 상승 등에 대해 설명하면 주민들의 동의를 어렵지 않게 끌어낼 수 있을 것 이라고 말했다.,https://news.naver.com/main/read.nhn?mode=LSD&mid=shm&sid1=260&oid=016&aid=0000263949,110
78829,2008.02.14. 오후 12:01,부동산,헤럴드경제,종로구 돈의문 뉴타운 1887채 대단지 탈바꿈,서울 도심지의 알짜 뉴타운으로 꼽히는 서울 종로구 교남동 ‘돈의문 뉴타운’이 1800여 가구 규모의 대단지로 조성된다. 서울시는 13일 제3차 도시.건축공동위원회를 열고 ‘돈의문 도시 환경정비구역 변경 지정안’을 조건부 가결했다고 14일 밝혔다. 교남동 62 1번지 일대 16만8000㎡ 규모의 ‘돈의문 뉴타운’에는 전용면적 85㎡ 미만 1380가구와 85㎡ 이상 507가구 등 총 1887가구가 건립된다. 이는 당초 계획한 전용면적 85㎡ 미만 1847가구 85㎡ 이상 393㎡ 가구 등 총 2240가구보다 줄어든 것이다. 대신 주택 규모는 전용 85㎡ 이상의 경우 당초 115.0㎡ 1개 형에서 119㎡ 269가 구 144㎡ 160가구 161㎡ 78가구 등 3개 형으로 다양화됐다. 또 아파트 최고 층수는 당초 최고 20층에서 임대아파트 5개 동은 최고 19층 일반아파트 25개동은 23층으로 확대됐으며 아파트 디자인도 판상형에서 탑상형으로 변경됐다. 공동위원회는 또 이날 심의에서 성북구 하월곡동 34 10번지 일대 2만여㎡에 건폐율 18% 용적률 250%를 적용해 최고 26층 이하의 아파트 398가구를 짓는 ‘월곡 제 4주택재개발정비구역 지정안’을 일부 수정해 통과시켰다.,https://news.naver.com/main/read.nhn?mode=LSD&mid=shm&sid1=260&oid=016&aid=0000263948,110
