,date,cat,co,headline,text,url,week
97241,2008.07.30. 오후 5:30,부동산,파이낸셜뉴스,서울 사당·신수동 재개발 추진,노후 단독주택 밀집지역인 서울 동작구 사당동 171 일대 2만1644㎡가 재개발돼 452가구의 아파트단지로 탈바꿈한다. 또 마포구 신수동 325 일대 1만3555㎡에는 313가구의 아파트가 건설된다. 서울시는 지난 29일 열린 건축위원회에서 ‘사당동 지역주택사업’과 ‘신수지역 주택사업’안이 가결됐다고 30일 밝혔다. 이에 따라 사당동지역 주택사업은 건폐율 19.99% 용적률 225.93%가 적용돼 최고 17층짜리 아파트 8개동 452가구가 건설된다. 또 신수 지역 주택사업은 건폐율 15.82% 용적률 245.26%가 적용돼 최고 25층짜리 아파트 5개동 총 313가구가 들어선다. 건축위는 그러나 중랑구 상봉동 73의 10 일대에 공동주택 497가구를 포함한 주상복합건물을 짓는 ‘상봉8재정비촉진구역 도시환경정비사업’안은 유리로 건물 외벽을 두르는 ‘커튼 월’ 구조에 대한 문제점이 제기돼 심의가 보류됐다.,https://news.naver.com/main/read.nhn?mode=LSD&mid=shm&sid1=260&oid=014&aid=0002005994,134
97242,2008.07.30. 오후 5:30,부동산,파이낸셜뉴스,강남권 아파트 865가구 일반 분양,이달 이후 올해 말까지 서울 강남권에서 865가구의 아파트가 일반에 분양된다. 특히 이 기간 공급되는 아파트들은 후분양제로 입주시기가 빠른 데다 노른자위의 대단지 아파트여서 관심이 집중된다. 30일 건설업계와 스피드뱅크에 따르면 서울 강남권에서 이달 이후 연말까지 공급될 아파트는 865가구로 지난해 연간 공급물량 530가구 보다 많다. 삼성물산은 오는 8월 중 서초구 서초동 삼호2차 재건축아파트 ‘래미안 서초 스위트’를 분양한다. 79∼112㎡ 392가구 중 69가구가 일반에 공급된다. 내년 5월 말 개통예정인 지하철 9호선 신논현역이 5분거리에 있고 경부고속도로 반포IC가 인접해 시외곽으로도 진출입이 편리하다. 내년 1월 입주 예정이다. 이 회사는 또 10월에 서초구 반포주공2단지 재건축아파트 2444가구 중 85∼267㎡ 26가구를 일반분양한다. 역시 지하철 9호선 신반포역이 단지앞에 들어선다. 서해종합건설은 강남구 역삼동 역삼종합시장을 재개발하는 주상복합아파트 77∼113㎡ 59가구를 일반에 분양한다. 이 아파트는 지하 4층 지상 10층짜리 1개동으로 구성됐다. 대림산업은 10월께 강남구 청담동에서 청담3차 e 편한세상을 분양한다. 공급면적은 105∼156㎡로 재건축아파트 86가구 중 18가구가 일반인 몫이다. 신동아건설은 송파구 신천동 향군회관 부지에 짓는 주상복합 아파트 280가구를 일반 분양한다. 99∼305㎡로 지상 40∼41층 아파트 2개동과 13층 오피스빌딩 1개동 등 3개동으로 이뤄졌다. 지하철 2호선 잠실역과 잠실대교 및 올림픽대로가 인접해 교통여건이 양호하다.,https://news.naver.com/main/read.nhn?mode=LSD&mid=shm&sid1=260&oid=014&aid=0002005993,134
97243,2008.07.30. 오후 5:27,부동산,파이낸셜뉴스,여의도 시범아파트 77층으로 재건축 추진,서울 여의도 63빌딩 맞은편의 시범아파트를 최고 77층 높이로 재건축 조감도 하는 방안이 추진된다. 여의도 시범아파트 재건축정비사업 조합설립추진위원회는 지난 26일 주민총회를 열어 이런 내용을 골자로 한 재건축 사업계획을 설명했다. 추진위에 따르면 1971년 10월 준공된 이 아파트는 현재 24개동에 1584가구로 이뤄졌으며 이 아파트를 지하 2층 지상 최고 77층짜리 7개동 1796가구로 재건축할 예정이다. 추진위는 재건축 단지 명칭을 ‘리버팰리스 River Palace ’로 정했으며 건축설계 업체로 무영종합건축사사무소를 선정했다. 주택형별 신축 계획물량은 △59㎡ 396가구 임대 130가구 △84㎡ 750가구 임대 52가구 △115㎡ 212가구 △128㎡ 212가구 △152㎡ 222가구 △178㎡ 4가구 등이다. 계획대로 재건축이 승인될 경우 조합원 물량 1584가구 과 임대아파트 182가구 를 제외한 30가구 정도가 일반 분양될 예정이다. 하지만 추진위 측의 계획대로 재건축이 추진될지는 미지수라는 게 일반적인 지적이다. 이 단지의 재건축 허용 용적률이 230%로 제한돼 있고 아파트 구조 역시 양호해 안전진단에 제대로 통과할지가 의문이다. 여기에 서울을 포함한 수도권에서 초고층 건물을 지을 경우 군 당국과의 협의가 필요한데 이 역시 쉽지 않다는 것이다. 영등포구청 관계자는 “상업지구도 아닌 용적률 230% 3종주거지에 77층 높이의 아파트를 짓는다는 것은 사실상 불가능할 것으로 보인다”면서 “인센티브를 받아 용적률을 30% 더 올린다고 해도 현실적으로 쉽지 않고 대공방어를 책임지는 수도방위사령부가 이 같은 높이를 인정해 줄지도 의문”이라고 말했다. 여의도 시범아파트는 현재 재건축을 위한 안전진단을 준비 중이며 8∼9월께 안전진단에 들어가 내년 1·4분기께 재건축 허용 여부가 판가름날 전망이다.,https://news.naver.com/main/read.nhn?mode=LSD&mid=shm&sid1=260&oid=014&aid=0002005991,134
97244,2008.07.30. 오후 5:27,부동산,파이낸셜뉴스,전세끼고 집사기 힘들다,전국의 아파트 전세가율 매매 가격에 대한 전세 가격의 비율 이 9년 5개월 만에 최저치를 기록했다. 특히 서울은 전세가율이 40% 밑으로 떨어졌다. 일반적으로 전세가율이 낮으면 낮을수록 세입자가 매매로 갈아타는 수요가 줄어 매매 가격의 추가 하락을 불러올 수 있다는 점에서 주목된다. 특히 전세를 끼고 아파트를 사려는 수요도 크게 위축된다. 30일 국토해양부와 국민은행에 따르면 전국의 아파트 전세가율은 지난 6월 말 현재 52.8%로 99년 2월 51.6%를 기록한 이래 9년 5개월 만에 최저치를 기록했다. 서울은 전세가율이 39.3%로 관련 통계가 시작된 98년 12월 이후 최저치다. 서울의 경우 비강남권 한강 이북 14개 구와 강남 11개 구의 전세가율 격차가 컸다. 강북지역은 전세가율이 42.4%로 전국 평균보다 낮은 수준이지만 40%를 웃돌고 있는 데 비해 강남권은 36.7%로 통계 집계 이후 최저치는 물론 전국에서도 최저 수준이다. 지난해까지 아파트값이 큰 폭으로 오른 인천과 경기도의 사정도 비슷하다. 인천의 전세가율은 43.1% 경기도는 42.5%로 두 곳 모두 조사 이래 최저 수준으로 떨어졌다. 이로써 수도권 전체 아파트의 전셋값 비율 41.4% 도 조사 이래 최저치를 기록했다. 하지만 대전은 전세가율이 61.0%로 2004년 4월 61.2% 이후 4년 2개월 만에 최고치를 기록했으며 전국에서도 가장 높다. 이처럼 전세가율이 급락세를 보이고 있는 것은 전셋값에 비해 매매값이 더 큰 폭으로 올랐기 때문이다. 국민은행 연구소 고혜진 과장은 최근 아파트 매매값에서 전셋값이 차지하는 비율이 최저치로 떨어진 것은 전셋값이 하락했다기보다는 매매값이 전셋값에 비해 더 많이 올랐기 때문 이라고 설명했다. 실제 전국의 아파트 값은 최근 3년간 21.8% 오른 데 이어 올해 상반기 3.1% 뛰었다. 이에 비해 전셋값은 같은 기간 15.2% 상승한 데 이어 올해 상반기에도 1.8% 올랐다. 서울 강남지역은 최근 3년 6개월 동안 매매값 상승률 43.6% 이 같은 기간 전셋값 상승률 21.7% 의 2배에 달했다. 전세가율이 낮아지고 있는 것은 아파트값이 약세로 가는 신호라는 견해도 있다. 국토부 관계자는 전세가율이 낮을수록 비용 부담 측면에서 보면 서민들은 전세로 사는 것이 더 유리하다 며 전세가율이 계속 하락하면 매매로 갈아타는 수요가 줄어 아파트 값도 약세를 보일 수밖에 없다 고 말했다. 실제로 2004년 6월부터 12월까지 전국의 아파트 전세가율이 60.4%에서 57.2%로 3.2%포인트 하락하는 동안 아파트 매매값은 1.5% 떨어졌다. 한편 정종환 국토해양부 장관은 이날 국회 민생안정대책특위에 출석해 지금까지 수도권 집값은 5∼10% 정도 빠졌으며 앞으로도 집값이 좀 더 빠질 가능성이 있다고 본다 면서 현재로서는 집값이 불안한 상황이 아니라고 생각한다 고 말했다.,https://news.naver.com/main/read.nhn?mode=LSD&mid=shm&sid1=260&oid=014&aid=0002005987,134
97245,2008.07.30. 오후 5:26,부동산,매일경제,화성산업 여의도 샛강 생태공원 조성공사 수주,화성산업은 조달청에서 발주한 여의도 샛강 생태공원 조성공사를 수주하여 7월30일 계약을 체결했다고 밝혔다. 여의도 샛강 생태공원 조성공사는 서울시 영등포구 여의도동 49번지 일대에 위치하며 공사금액은 283억 원으로 공사기간은 금년 8월부터 내년 11월까지 16개월이다. 매일종합건설이 공동 도급사로 참여한다.,https://news.naver.com/main/read.nhn?mode=LSD&mid=shm&sid1=260&oid=009&aid=0001996306,134
97246,2008.07.30. 오후 5:25,부동산,MBN,경기도 성냥갑 건축물 짓지 맙시다,경기도가 독창적이고 예술적인 건축물을 짓도록 유도하려고 각계와 공동 협약을 추진합니다.경기도는 다음 달 중순 김문수 도지사와 31개 시·군 자치단체장 토지공사 등 공기업 민간 건설업체 사장 등이 참여한 가운데 다양화를 위한 공동협약식을 할 계획이라고 밝혔습니다.경기도는 지자체와 건설사들이 도시개발과 각종 건설사업 때 협약의 정신에 따라다양성을 추구한다면 도시 미관이 크게 개선될 것으로 기대하고 있습니다.,https://news.naver.com/main/read.nhn?mode=LSD&mid=shm&sid1=260&oid=019&aid=0001971899,134
97247,2008.07.30. 오후 5:21,부동산,파이낸셜뉴스,강남 주상복합 “우린 끄떡없다”,서울 강남권을 중심으로 재건축 및 일반 아파트값이 올 들어 급락세를 보이고 있는 데 비해 같은 강남권의 주상복합은 오피스텔과 결합된 소형을 중심으로 ‘나홀로 상승세’를 보이고 있는 것으로 나타났다. 이는 이들 강남권의 주상복합은 대부분 역세권에 입지한 데다 소형의 수요층이 탄탄하기 때문으로 풀이된다. 부동산정보업체 닥터아파트에 따르면 올 들어 지난 25일까지 강남권 주상복합 매매가격은 0.41% 올랐다. 이는 같은 기간 일반아파트 재건축단지 포함 값이 1.8%나 급락한 것과 대조적이다. 강남권 전체 주상복합아파트 1만9227가구 중 올 들어 1.6% 308가구 만 매매가격이 빠졌고 80.60% 1만5497가구 가 보합세를 보였으며 17.80% 3422가구 는 가격이 올랐다. 규모별로는 대형보다는 소형 중심으로 매매가 변동률이 컸다. 67∼99㎡의 경우 매매가는 1월 초 3.3㎡당 평균 999만원에서 1050만원으로 5.15% 상승했고 67㎡미만 아파트는 1092만원에서 1120만원으로 2.57% 올랐다. 100㎡가 넘는 대형은 0.12∼0.48% 오르는 데 그쳤다. 특히 오피스텔과 아파트가 복합된 주상복합아파트가 매매가 상승을 주도했다. 강남구 삼성동 에클라트B 95㎡A는 올 들어 매매가가 4500만원 올라 2억9000만∼3억3000만원에 거래되고 있다. 이 아파트는 월세로 놓을 경우 보증금 2000만원 정도에 월 160만원의 임대료를 받을 수 있다. 이 아파트는 8층까지는 오피스텔 9∼15층까지는 주상복합으로 구성돼 있다. 저층이 오피스텔로 구성된 서초구 서초동 쌍용플래티넘도 매매가가 올 들어 이달 현재까지 2000만∼4000만원 올랐다. 서초동 일대는 지난해부터 삼성타운 입주 여파로 오피스텔 거래도 활발했던 곳이다. 62㎡는 이 기간 4000만원 상승해 3억∼3억5000만원에 거래되고 있다. 송파구 가락동 한화오벨리스크 69㎡도 3800만원 정도 올라 매매가가 2억2000만∼2억3000만원이다. 한화오벨리스크는 지하철 8호선 가락시장역이 걸어서 5분 거리인 역세권단지로 단지 바로 옆에 IT벤처타워가 있어 월세수요가 꾸준하다. 이처럼 주상복합이 상승한 이유는 대부분 역세권단지에 있고 유동인구가 풍부해 수요가 많기 때문인 것으로 전문가들은 분석하고 있다. 강남권 주상복합 중 도보 10분 거리에 지하철이 있는 역세권 단지는 전체 물량의 97.26% 1만8700가구 로 대부분 지하철 이용이 편리하다. 닥터아파트 이영진 리서치연구소 소장은 “대부분의 주상복합이 역세권에 위치해 있어 소형을 중심으로 인기를 끌고 있다”며 “고유가시대에 이들 강남권의 주상복합은 소형을 중심으로 앞으로도 강세가 이어질 것”이라고 내다봤다.,https://news.naver.com/main/read.nhn?mode=LSD&mid=shm&sid1=260&oid=014&aid=0002005983,134
97248,2008.07.30. 오후 5:21,부동산,파이낸셜뉴스,무주택 저소득층 전세자금 지원,대한주택보증은 연내에 58곳의 무주택 저소득층가구에 총 3억원의 전세자금을 무상 지원키로 하고 29일 오후 한국사회복지협의회와 ‘무주택 저소득층 주택임차자금 무상지원사업을 위한 업무협약’을 체결했다. 이상범 대한주택보증 사장 오른쪽 이 협약을 체결한 뒤 한국사회복지협의회에 기금을 전달하고 있다.,https://news.naver.com/main/read.nhn?mode=LSD&mid=shm&sid1=260&oid=014&aid=0002005979,134
97249,2008.07.30. 오후 5:21,부동산,파이낸셜뉴스,‘엘스’ 학교용지 공터 ‘뜨거운 감자’,서울 강남권의 노른자위 재건축 단지인 송파구 잠실동 주공1단지 엘스 에 학교용지가 ‘뜨거운 감자’로 등장했다. 총 5390가구로 구성된 이 단지는 오는 9월 말 재건축 사업을 끝내고 입주를 시작할 예정이지만 단지 내 중심부인 학교부지가 건물이 들어서지 못한 채 누런 공터로 흉물스럽게 남아 입주민을 맞게 된 것. 잠일초등학교 옆에 위치한 이 땅은 당초 고등학교 신축 예정지로 부지 면적만 5860㎡에 달하며 2007년 말 기준 감정가격이 485억원이었던 것을 감안하면 실제 가격은 500억원을 훨씬 웃돈다. 잠실주공1단지 ‘엘스’내 학교부지 공터로 방치 30일 인근 부동산업계에 따르면 서울 송파구 한강변 잠실의 고층 아파트단지에 이런 금싸라기 땅이 공터로 남게 된 것은 2004년 3월 재건축 사업계획 승인 당시 서울교육청이 재건축 이후 학생 수가 늘어날 것을 예상해 조합측에 학교부지를 조성해 줄 것을 사업승인 조건으로 내걸면서부터다. 재건축 조합은 학교용지를 조성할 경우 단지 내 재건축 가구 수 감소와 감정가격의 70%로 교육청에 팔아야 해 사업성이 떨어지는 데도 불구하고 교육청과 협의를 거쳐 단지 안에 들어서는 잠일초등학교 부지 옆에 금싸라기 땅을 고등학교 신축용지로 배정했다. 하지만 학교용지가 배정된 뒤 서울교육청이 2006년께 갑자기 학생 수요가 당초보다 많지 않을 것으로 판단해 고등학교 부지 매입을 취소하기로 하면서 문제가 불거지기 시작했다. 조합측은 서울교육청이 막상 신축계획을 취소하자 학교 부지에 대해 주민 공동커뮤니티 시설 신축 등 다양한 방안 등을 놓고 조합원 투표까지 실시했지만 결국 정해진 용도인 학교신축부지에 사립고등학교를 추진하기로 결론이 나면서 아직까지도 서울교육청의 부지 매입을 기다리고 있는 상태다. 학교 건축 쉽지 않아 입주예정자 고민 커져 조합 관계자는 “2007년 2월 자립형 사립고나 특목고를 유치하기 위해 분양 공고까지 냈지만 투자 업체가 없었다”면서 “현재로서는 교육청이 매입해 예정대로 학교를 신축하는 방안밖에 없지만 교육청에서 매입을 계속 늦추고 있어 난감하다”고 말했다. 이에 대해 서울교육청 관계자는 “오는 9월 말께 감정평가 금액을 기준으로 연내 매입해 공립학교 설립을 추진할 것으로 알고 있다”면서 “교육과학기술부 예산이 없기 때문에 학교신축은 민간투자사업 BTL 형식으로 오는 2011년 개교를 목표로 고등학교 설립을 추진하고 있다”고 말했다. 그러나 학교부지가 인근 초등학교 부지보다 작은 데다 사업성도 떨어져 BTL 사업자가 나타날 지는 미지수다. 서울교육청이 부지 매입을 끝내더라도 사업자를 찾지 못할 경우 단지 가운데 학교용지는 계속 공터로 남아 방치될 수 있다. 이에 따라 재건축 단지에 입주를 해도 청산 등 재건축 조합 사무가 늦춰져 주민들의 재산권 행사에 제약을 받을 것으로 우려된다. 단지 시공을 담당하고 있는 건설업체의 한 관계자는 “당초 고등학교 부지가 계속 매입이 늦춰지면서 입주가 시작되는 시점에도 공터로 남게 돼 흉물스러운 것은 사실”이라며 “설사 입주 후에 학교 신축이 이뤄진다해도 소음과 교통불편 등은 입주민이 감수해야 할 수밖에 없을 것”이라고 말했다.,https://news.naver.com/main/read.nhn?mode=LSD&mid=shm&sid1=260&oid=014&aid=0002005978,134
97250,2008.07.30. 오후 5:19,부동산,MBN,강남 주상복합 나 홀로 상승세,앵커멘트 올 들어 강남권 부동산 시장이 약세를 면치 못하는 가운데 주상복합 아파트값은 오히려 오른 것으로 나타났습니다.윤석정 기자가 보도합니다. 기자 한 부동산 정보업체의 조사 결과 올해 초부터 현재까지 강남권 주상복합 아파트값은 0.41% 올랐습니다.전체 강남권 주상복합 1만 9천여 가구 중 1.6%만이 매매가가 떨어졌고 80%는 보합세를 18%는 오히려 올랐습니다.재건축단지를 포함한 일반 아파트값이 1.8% 하락한 것과는 대조적입니다.이처럼 주상복합 아파트값이 강세를 보이는 이유는 대부분의 주상복합이 편의시설과 교통이 발달한 시내 중심가에 있어 수요층이 탄탄하기 때문입니다. 인터뷰 ☎ 이영호 닥터아파트 팀장 대부분의 주상복합 아파트들이 편의시설이나 교통이 발달한 시내 중심가에 있어 수요층이 탄탄해 가격이 강세를 보이는 것으로 분석됩니다. 실제 강남권 주상복합 대부분이 걸어서 10분 정도면 지하철을 이용할 수 있는 역세권에 자리 잡고 있습니다.특히 최근 임대 수익을 목적으로 소형 타입의 강세가 두드러졌습니다.서울 서초구 서초동의 한 오피스텔 62㎡형의 경우 현재 시세는 연초보다 4천만 원 오른 3억에서 3억 5천만 원입니다.송파구 가락동의 오피스텔도 69㎡가 연초보다 3천8백만 원 정도 올라 2억 3천만 원 정도에 거래되고 있습니다.전문가들은 높은 임대 수익을 기대할 수 있는 시내 중심부의 소형 주상복합을 중심으로 당분간 주상복합 아파트 강세가 이어질 걸로 내다봤습니다.mbn뉴스 윤석정입니다.,https://news.naver.com/main/read.nhn?mode=LSD&mid=shm&sid1=260&oid=057&aid=0000084246,134
97251,2008.07.30. 오후 5:19,부동산,MBN,정종환 국토장관 집값 더 빠질 가능성 있다,정종환 국토해양부 장관은 지금 집값은 5∼10% 정도 빠졌는데 앞으로도 좀 더 빠질 가능성이 있다 고 전망했습니다.정 장관은 오늘 30일 국회 민생대책 특위에서 부동산 가격이 급격하게 상승하는 것은 바람직하지 않다 면서 현재로서는 집값이 불안한 상황은 아니다 고 밝혔습니다.정 장관은 이어 분양가 상한제와 관련해서는 상한제를 풀기보다는 불합리한 면을 풀면서 주택을 공급하는 여러 가지를 생각하고 있다 고 전제한 뒤 부분적 완화 입장을 시사했습니다.,https://news.naver.com/main/read.nhn?mode=LSD&mid=shm&sid1=260&oid=057&aid=0000084245,134
97252,2008.07.30. 오후 5:19,부동산,MBN,강북 전셋값 급등…대책 마련 시급,앵커멘트 서울지역 아파트 매매가격이 약세를 보이고 있는 가운데 강북 뉴타운 주변 전셋값은 급등하고 있습니다.뉴타운 개발에 따른 이주 수요가 갑자기 많아졌기 때문인데 대책 마련이 시급한 정도입니다.이혁준 기자가 취재했습니다. 기자 서울 동대문구 답십리동의 1천500여 세대 규모의 아파트 단지입니다.76㎡의 전세가격은 1억 5천500만 원 선 올 초보다 1천만 원 이상올랐습니다.인근 전농 뉴타운의 이주가 시작되면서 전세를 찾는 사람이 많아졌지만 매물은 한두 개밖에 없습니다. 인터뷰 유제준 현지 공인중개사 상대적으로 부족하죠. 매물이 나와도 재계약되는 경우가 많고 내년 봄까지 본격적으로 상승할 것으로 봅니다. 비교적 전셋값이 저렴한 다세대 연립주택의 경우 문제는 더욱 심각합니다.36 43㎡의 경우 올초까지만 해도 4천 5천만원에 거래되던 전셋값이 전농뉴타운 7구역의 이주가 시작된 뒤 6천 7천만원으로 급등했습니다.이같은 전세난으로 이 지역 소형 아파트도 올초보다 4천만 원가량 오른 상황 인근 제기동과 신설동 장안동까지 들썩이고 있어 서민들은 살 곳을 찾기 막막합니다. 스탠딩 이혁준 기자 이곳 전농 뉴타운 외에도 강북 뉴타운 곳곳에서 하반기에 이주가 시작돼 전세난이 갈수록 심화될 것이라는 우려가 나오고 있습니다. 지난 5월부터 최근까지 관리처분인가를 받아 이주해야 하는 뉴타운 가구 수만 2만 가구에 달합니다.이에 비해 강북 14개 구에 올해 공급되는 신규 입주아파트는 1만 5천 가구에 불과한 상황 이미 의정부와 동두천 등 외곽지역도 가격이 올라 만만치 않습니다.전문가들은 이같은 전세난이 서민 주택시장의 불안요인으로 작용하고 있다고 지적합니다. 인터뷰 함영진 부동산써브 실장 서울 뉴타운과 재개발 외에도 경기도에서 개발이 많이 이뤄지고 있어 서울과 경기도가 함께 이주 시점을 조절해야 할 필요가 있습니다. 주거환경개선을 위한 뉴타운사업.정작 집이 없는 서민들은 뛰는 전세값에 거리로 내몰리게 됐습니다.mbn뉴스 이혁준입니다.,https://news.naver.com/main/read.nhn?mode=LSD&mid=shm&sid1=260&oid=057&aid=0000084243,134
97253,2008.07.30. 오후 5:19,부동산,MBN,경기도 주택 특별공급 대상자 다음 달 확정,경기도의 주택 특별공급 대상자 선정기준이 다음 달 중순쯤 확정돼 오는 9월 분양을 시작하는 광교신도시 아파트부터 적용될 전망입니다.경기도는 주택 특별공급 대상자 선정 기준안을 현재 실무부서에서 마련 중이라며 특별공급 기준은 광교신도시 아파트 분양 개시 이전에 확정 고시될 것이라고 밝혔습니다.경기도는 주택 특별공급 대상자에 기존 국가유공자와 새터민 등 외에 경기지역 소재 기업의 장기근속 근로자 연구원 외자유치에 기여한 도민 전통문화 보존에 공헌한 경기도민 등을 추가할 예정입니다.,https://news.naver.com/main/read.nhn?mode=LSD&mid=shm&sid1=260&oid=057&aid=0000084236,134
97254,2008.07.30. 오후 5:19,부동산,한국경제TV,현대엔지니어링 상반기 실적 전년비 2배 증가,현대엔지니어링 상반기 실적이 지난해 같은 기간보다 2배 이상 증가한 것으로 집계됐습니다. 현대엔지니어링은 상반기동안 수주가 작년 보다 231% 성장한 8192억원 매출은 210% 증가한 2981억원 영업이익은 210% 늘어난 324억원을 각각 기록했다고 밝혔습니다. 특히 영업이익률은 창사 이래 처음으로 11%대를 달성한 가운데 해외프로젝트의 환차익 등 영업외 수익부문에서도 성과를 거둬 경상이익율이 업계 평균인 매출액 대비 8 9%대를 훨씬 상회하는 13%대를 기록했습니다. 현대엔지니어링은 현재 세계 플랜트 시장이 활황세를 보이고 있어 올해 목표인 수주 1조5천억 매출 7천억 영업이익 7백억원을 초과 달성할 것으로 전망했습니다.,https://news.naver.com/main/read.nhn?mode=LSD&mid=shm&sid1=260&oid=004&aid=0001953026,134
