,date,cat,co,headline,text,url,week
70485,2007.11.21. 오후 5:40,부동산,뉴시스,서울 아파트 3채 중 1채 6억 넘어..금천구는 0,서울 뉴시스 서울 아파트 3채 중 1채는 시가 6억원이 넘는 고가 아파트인 것으로 조사됐다. 부동산 정보업체 부동산써브가 서울 아파트 115만3506가구의 시가를 조사한 결과 35만2010가구가 6억원 이상인 것으로 나타났다. 이는 올 초 보다 2만3586가구 늘어난 것으로 전체 아파트에서 6억원 이상의 아파트가 차지하는 비중도 올 초 28.9%에서 30.5%로 30%대를 넘어섰다. 올 초 6억원 이상 고가 아파트는 1.32% 하락했지만 신규 입주 아파트의 영향으로 가구 수는 늘어났다. 6억원 이상 아파트가 가장 많은 지역은 강남구가 8만4452가구로 부동의 1위를 차지했고 송파구 5만5054가구 서초구 5만4327가구 양천구 3만390가구 등이 뒤를 이었다. 버블세븐지역 4개구가 나란히 상위권을 차지한 것이다. 이들 지역내 6억원 아파트 비중은 강남구가 84.3%로 역시 1위를 차지했고 서초구 83.8% 송파구 69.1% 용산구 63.8% 양천구 48.9% 순으로 조사됐다. 반면 금천구는 6억 이상 아파트가 한 채도 없는 것으로 조사됐다. 강북구 26가구 은평구 353가구 중랑구 926가구 등은 1000가구 미만이었다. 한편 올 들어 중저가 아파트의 강세로 1억원 미만 아파트는 1만7378가구가 사라져 전체 가구 중 비중은 2.2%에서 0.7%로 줄어들었다. 1억원대는 3만6372가구 15.9%→12.5% 2억원대는 7626가구 19.6%→18.6% 가 줄었다. 또 10억원 이상 초고가 아파트도 2164가구가 줄어 비중도 11.9%에서 11.5%로 낮아졌다. 이에 반해 3억원대는 2만7885가구 14.0%→16.2% 4억원대 2만2328가구 10.7%→12.5% 5억원대 5237가구 8.6%→9.0% 로 증가한 것으로 나타났다.,https://news.naver.com/main/read.nhn?mode=LSD&mid=shm&sid1=260&oid=003&aid=0000654709,98
70486,2007.11.21. 오후 5:32,부동산,MBN,서울 6개구 분양가 2천만원 돌파,강동구와 마포구 등 서울 6개 구의 분양가가 올해 처음으로 2천만원을 넘어섰습니다. 부동산정보업체 닥터아파트가 서울 경기 인천 등 수도권에서 11월까지 분양된 230곳 7만여가구의 분양가를 조사한 결과 3.3제곱미터당 평균 분양가는 천 3백 12만원으로 나타났습니다. 특히 서울 강남구와 강동 마포 영등포 종로 중구 등 6개 구의 3.3제곱미터당 분양가는 2천만원을 넘어섰으며 이중 강남구는 3천 8백만원으로 최고가를 기록했습니다.,https://news.naver.com/main/read.nhn?mode=LSD&mid=shm&sid1=260&oid=057&aid=0000069981,98
70487,2007.11.21. 오후 5:32,부동산,MBN,청라 국제업무타운 개발 본격화,인천 청라지구 국제업무타운 개발 사업이 본격화됩니다. 한국토지공사는 인천 청라지구 외자유치 사업 중 하나인 국제업무타운 개발과 관련해 포스코건설 컨소시엄과 사업협약을 체결했습니다. 모두 6조 2천억원이 투자되는 인천 청라지구 국제업무타운은 오는 2015년을 목표로 동아시아 투자 허브 구축을 위한 23만 제곱미터 규모의 국제업무시설과 관광·휴양 문화시설 기능을 갖춘 국제도시로 조성될 계획입니다.,https://news.naver.com/main/read.nhn?mode=LSD&mid=shm&sid1=260&oid=057&aid=0000069980,98
70488,2007.11.21. 오후 5:19,부동산,뉴시스,동정권홍사 대한건설협회 회장,서울 뉴시스 권홍사 대한건설협회 회장은 23 25일 제주 그랜드 호텔에서 이재정 통일부장관 이용섭 건설교통부 장관 김성진 조달청장 등 정부인사와 협회 대의원 및 회원이사 유관기관 기관장 등 240여명이 참석한 가운데 2008년 건설산업발전 모색 연찬회 를 개최한다. 참석자들은 창조와 혁신을 통한 건설산업의 지속성장 전략 이란 주제로 열릴 이번 연찬회에서 건설산업의 비전과 건설산업이 국가경제의 미래성장 사업으로 지속성을 확보할 수 있는 방안 등에 대해 심도 있게 논의한다.,https://news.naver.com/main/read.nhn?mode=LSD&mid=shm&sid1=260&oid=003&aid=0000654641,98
70489,2007.11.21. 오후 5:06,부동산,서울경제,분양정보 당진 109㎡형이상 360가구,대우자동차판매 건설부문이 충남 당진읍에서 ‘이안 신 新 당진’을 분양한다. 총 360가구가 분양되는 이번 물량은 109.45㎡형과 ▦112.28㎡형 ▦110.54㎡형 ▦154.0㎡형으로 구성된다. 지상21층 5개동으로 설계된 ‘이안 신 新 당진’은 현대제철의 일관제철소 추진과 동부제강의 전기로 추진 등 철강산업단지 확대로 15만명 이상의 인구 유입이 예상되는 당진군의 새로운 랜드마크로 부상할 것으로 기대된다. 등기 후 분양권 전매가 가능한데다 ‘당진 상주’ 간 고속국도 중 ‘청원 상주’ 구간이 오는 12월 개통을 앞두고 있고 당진 대전 구간은 2009년 준공될 예정이다.,https://news.naver.com/main/read.nhn?mode=LSD&mid=shm&sid1=260&oid=011&aid=0000208056,98
70490,2007.11.21. 오후 5:06,부동산,서울경제,분양정보 마포 146㎡형이상 75가구,GS건설은 서울 마포구 하중동에 146㎡형 이상의 중대형 아파트로 구성된 ‘한강밤섬자이’를 분양한다. 지하2층 지상25층 7개동으로 구성되는 ‘한강밤섬자이의 전체 가구는 488가구로 일반 분양 물량은 75가구이다. 일반 분양 물량은 ▦146㎡형 12가구 ▦163㎡형 13가구 ▦169㎡형 18가구 ▦192㎡형 10가구 ▦200㎡형 22가구 등이다. 이 단지는 한강변에 위치해 있어 한강과 밤섬 조망이 가능한데다 인근에 월드컵공원과 와우산공원ㆍ한강시민공원 등을 이용할 수 있다. 지하철 6호선 광흥창과 강변북로ㆍ올림픽도로 이용도 수월하고 연세대와 서강대ㆍ홍익대 등 대학교와 연세대 세브란스병원 등이 인근에 위치한 점도 특징이다.,https://news.naver.com/main/read.nhn?mode=LSD&mid=shm&sid1=260&oid=011&aid=0000208055,98
70491,2007.11.21. 오후 5:06,부동산,서울경제,분양정보 동탄신도시 주상복합 상가,풍성주택㈜은 경기도 화성시 동탄신도시 중심상업지구 내 주상복합인 ‘동탄 풍성신미주 위버폴리스상가’를 분양한다. 1층 기준으로 3.3㎡당 분양가는 2 100만 3 700만원 2층은 950만 1 300만원선이다. 동탄 풍성신미주 위버폴리스는 지상41층 2개동 규모의 주상복합단지로 상가는 지하1층 지상2층 3개층 연면적 1만767㎡ 에 총 57개 점포가 들어선다. 동탄신도시의 최중심상권인 백화점 사거리에 위치한 위버폴리스상가는 CGV영화관까지 연계된 동탄 최고의 입지를 갖추고 있다. 경부고속도로 기흥IC에서 2㎞ 오산 양재 간 도로 개통시 서울에서 20분이 소요되며 수도권전철 병점역에서 차량으로 5분 거리에 위치해 교통여건도 뛰어나다. 입점 예정일은 오는 2009년 12월이며 중도금30%에 대해 1년 무이자 혜택이 주어진다.,https://news.naver.com/main/read.nhn?mode=LSD&mid=shm&sid1=260&oid=011&aid=0000208054,98
70492,2007.11.21. 오후 5:06,부동산,서울경제,분양정보 삼성역 은탑타워 매매·임대,은탑산업개발㈜는 강남 삼성역 인근에 ‘은탑타워’를 매매 및 임대 중이다. 지하2층 지상10층에 연면적 2 061㎡ 규모의 근린생활시설 및 오피스 용도이며 지하철 2호선 삼성역이 도보로 5분 거리인 역세권이다. 빌딩 주변으로 섬유센터ㆍ글라스타워 등의 주요 업무시설이 위치해 있는 업무 중심지이며 무역센터ㆍ현대백화점ㆍ인터컨티넨탈호텔 등 각종 편익시설을 이용할 수 있다. 기업체 사옥으로 적합하며 최근 강남 일대의 오피스 수요 증가로 임대사업자의 투자용도로도 적합하다.,https://news.naver.com/main/read.nhn?mode=LSD&mid=shm&sid1=260&oid=011&aid=0000208052,98
70493,2007.11.21. 오후 5:03,부동산,서울경제,해외지사 발령으로 1년전 산 아파트 처분하려는데…,알쏭달쏭 부동산교실 국외 1년이상 거주 입증하면 비과세 Q. 대기업에 근무하고 있는 김씨는 얼마 전 해외지사로 발령을 받아 출국 준비를 하고 있다. 김씨의 이번 해외파견은 장기간으로 예정돼 있어 가족 모두가 출국할 예정이며 1년 전에 구입해 현재 가격이 많이 오른 분당의 아파트도 이번 기회에 처분할 계획이다. 그런데 보유 및 거주요건을 채우지 못해 비과세를 적용받지 못하고 오히려 단기매매로 간주돼 많은 세금을 물어야 하는 것은 아닌지 고민이다. A. 원칙적으로 양도세 비과세 혜택을 받기 위해서는 1세대 1주택자로서 주택을 3년 이상 보유해야 하며 서울ㆍ과천 및 5대 신도시 지역 분당ㆍ일산ㆍ평촌ㆍ산본ㆍ중동 은 2년 이상 거주해야 하는 요건을 동시에 갖춰야 한다. 반면에 1주택자라 하더라도 집을 산 지 1년 미만에 다시 처분할 경우엔 50% 2년 미만의 경우 40%의 양도세를 물어야 한다. 그러나 외국으로 이민을 가는 등 부득이한 사유가 있는 경우에는 3년 보유나 2년 거주요건을 충족하지 않아도 양도세 비과세 규정을 적용받을 수 있다. 즉 ▦해외이주법에 의한 해외이주 ▦1년 이상 해외근무 또는 취학 등의 사유로 세대 전원이 출국하는 경우엔 출국 후 2년 이내에 소유주택을 처분하면 보유기간 및 거주기간에 관계없이 비과세 적용을 받는다. 여기서 해외근무나 취학 등의 경우에는 관련 서류 재직증명서ㆍ해외근무발령통지서 또는 재학증명서 등 를 제출하고 국외에 계속해서 1년 이상 거주해야 함을 입증해야 비과세 혜택을 받을 수 있다. 해외이주로 세대 전원이 출국함으로써 비거주자가 된 상태에서 1주택을 양도하는 경우에는 출국 후 2년 이내에 양도해야 보유 및 거주기간에 관계없이 비과세를 받을 수 있으며 출국 전이라도 해외이주 신고확인서 발행일로부터 1년 이내에 양도하면 똑같이 비과세 혜택을 받을 수 있다. 물론 양도 후 출국하기 전에 국내에서 다른 주택을 취득하지 않는다는 조건이다. 그리고 2006년 2월9일 전에 해외이주법에 따라 이미 해외로 이주한 경우에는 올해 12월31일까지 양도하면 출국일로부터 2년이 지났어도 양도세 비과세 혜택이 가능하다. 이와 함께 해외이주 등이 아니라 취학이나 근무상의 형편 질병의 요양 기타 부득이한 사유로 다른 시ㆍ도로 이전할 경우에도 1년 이상 거주 요건만 충족하면 비과세 혜택을 받을 수 있다. 반면 사업상 형편에 의한 주거 이전은 인정되지 않으며 취학의 경우에도 유치원ㆍ초등학교ㆍ중학교 취학에 따른 주거이전은 인정되지 않으므로 유의해야 한다.,https://news.naver.com/main/read.nhn?mode=LSD&mid=shm&sid1=260&oid=011&aid=0000208043,98
70494,2007.11.21. 오후 5:03,부동산,서울경제,분양단지 들여다보기 동작구 보라매 e편한세상,공원조망 멀티역세권 시세 상승 가능성커 85 166㎡ 386가구 일반분양…85㎡형 3.3㎡당 1 500만원선 다음주 청약접수가 시작되는 서울 동작구 신대방동 ‘보라매 e 편한세상’은 386가구 전가구가 일반분양이다. 동작구 일대 올해 일반분양 물량이 총 71가구로 새 아파트 공급이 부족한 상황이어서 시세상승 여력이 크다는 분석이다. 전체 가구 수의 60%인 232가구가 전용면적 85㎡ 이하의 국민주택 규모여서 실수요자들에게 특히 관심을 끌 것으로 보인다. 보라매 e 편한세상은 지하3 지상12 19층짜리 5개동으로 이뤄지며 85 166㎡형 등 총 5개 타입으로 구성됐다. 주택형별 분양가는 85㎡형 97가구 1 500만원대 106∼110㎡형 135가구 1 600만원대 154∼166㎡형 154가구 1 800만원대다. 인근 시세에 비해 20%가량 싸다. 입지도 좋은 편. 오는 2016년 완공되는 용산국제업무지구에서 차로 20여분 거리고 대방로를 통해 국제금융지구로 조성되는 여의도로 쉽게 접근할 수 있다. 강남까지 지하철로 20분 거리다. 지하철 7호선 신대방역과 2호선 신림역이 가깝고 경전철 신림선 당곡사거리 이 2017년 개통되면 트리플역세권이 된다. 5개동 단지배치는 남향 가구 수를 최대화하고 인근 보라매공원 조망권을 확보하는 데 주안점을 뒀다. 165㎡형으로 구성된 타워형 2개동의 7∼16층 가구는 남서향 보라매공원 조망이 가능하다. 46만㎡ 규모의 보라매공원은 12월 리모델링 사업이 완료된다. 주차장은 모두 지하로 넣었다. 경사진 지형을 이용해 주차장 출입구 쪽에서 보면 마치 지하 주차장이 1층처럼 보인다. 지상은 물빛공원과 퍼팅그린 등 테마공원으로 조성된다. 조깅코스의 연결을 위해 각 동 1층의 일부는 필로티로 설계됐다. 모델하우스를 통해 본 평면설계는 공간감을 극대화하는 데 초점이 맞춰졌다. 모델하우스엔 110ㆍ154ㆍ165㎡형 등 세가지 타입이 꾸며져 있다. 110ㆍ154㎡형은 전체적으로 옅은 원목톤으로 꾸며져 실제 규모에 비해 넓어 보인다. 110㎡의 경우 거실폭이 470㎝로 154㎡형과 같다. 전타입 모두 주방가구를 1자형으로 배치 식탁공간을 최대화하는 데 신경을 썼다. 154㎡의 경우 안방 파우더룸 옆에 주부가 전용으로 쓸 수 있는 붙박이장이 추가로 설치되는 등 수납공간이 충분한 것도 장점이다. 165㎡형은 짙은 원목색으로 중후한 맛이 난다. 주방과 거실ㆍ안방에 한옥식 창틀을 적용 전체적으로 전통적 분위기가 강하다. 22일 모델하우스가 문을 열고 26 28일 청약접수를 받는다. 모델하우스는 지하철 7호선 장승배기역 6번 출구 인근에 있다.,https://news.naver.com/main/read.nhn?mode=LSD&mid=shm&sid1=260&oid=011&aid=0000208042,98
70495,2007.11.21. 오후 5:03,부동산,서울경제,주목 이곳 천호·성내지구,27만㎡ 상업·주상복합단지 탈바꿈 작년 재촉지구 지정되며 값 급등·손바뀜 활발 최근 매물은 나오지만 호가 높아 거래는 한산 단독주택 3.3㎡당 값 최고 2 000만원 육박 강동구 천호동과 성내동 일대는 단독주택이 밀집해 있는 대표적인 곳 중 하나다. 5개동으로 이뤄져 있는 아파트 단지가 ‘대단위’로 꼽힐 정도다. 이곳에 대규모 업무ㆍ상업ㆍ주상복합 지구를 오는 2015년까지 만들겠다고 강동구가 밝힌 뒤 현지인은 물론 외부인들의 문의가 이전에 비해 늘어나는 모습이다. 강동구는 천호동 453번지 일대와 성내동 일부 등 총 27만7 100㎡를 개발하는 ‘천호ㆍ성내 재정비 촉진계획’을 마련하고 현재 주민공람을 실시하고 있다. 천호 사거리 부근에 위치한 D공인중개사 사장은 21일 “ 발표 이후 투자문의가 많이 늘었다”며 “주로 상가 등 적은 돈으로 투자할 수 있는 물건을 찾는 경우가 많고 사업 시행사 쪽에서도 땅을 사들이려는 움직임도 보인다”고 말했다. 또 다른 공인중개사 사장도 “외부사람은 지금 아파트를 사도 되는지 현지인들은 앞으로 더 발전할지에 대해 물어보고 있다”며 “매물은 나오지만 호가가 높아 거래는 한산한 편”이라고 했다. 천호동 태영의 경우 시세는 142㎡형이 6억1 500만 6억2 000만원 109㎡형이 4억7 500만 5억원으로 형성돼 있지만 호가는 142㎡형이 7억원선 109㎡형이 5억2 000만 5억3 000만원선이다. 이 일대는 이미 지난해 10월 ‘도시재정비 촉진을 위한 특별법’에 따라 재정비 촉진지구로 변경 지정되면서 한차례 집값이 크게 올랐다. 단독주택의 경우 지난해 초까지만 해도 3.3㎡당 가격은 800만 900만원 수준이었으나 지난해 말 1 200만 1 300만원까지 오른 상태다. 여기에 구체적인 개발 계획이 발표되면서 지금은 호가만 올라 있다. 인근 지역의 Y공인중개사 대표는 “지난해 말 광풍 狂風 이 불면서 현지인들과 외지인들 간의 손 바뀜이 많이 이뤄진 상태”라며 “새로 집을 사서 들어온 가구가 많아 집값을 싸게 내놓으려는 사람이 없다”고 말했다. 이 때문에 거래 없이 호가만 치솟아 단독주택의 경우 3.3㎡당 가격이 최고 2 000만원에 달하는 곳도 있다. 반면 개발 지역에서 조금 떨어진 곳은 분위기가 이전과 크게 다르지 않다고 현지 부동산 관계자들은 전했다. 천호대로변은 신축 오피스빌딩ㆍ오피스텔 등이 줄지어 서 있지만 이면에는 재래시장뿐 아니라 20년 이상 된 노후 건축물과 다세대ㆍ다가구 주택이 많아 기반시설이 많이 부족하기 때문이다. L공인중개사 사장은 “발표 후에도 문의가 늘거나 크게 변한 점은 없다”며 “매물은 많이 나와 있지만 거래는 한산한 편”이라고 말했다.,https://news.naver.com/main/read.nhn?mode=LSD&mid=shm&sid1=260&oid=011&aid=0000208041,98
70496,2007.11.21. 오후 5:01,부동산,매일경제,서울 6개구 분양가 2천만원 첫 돌파,강동구 마포구 등 서울 6개 구 區 의 분양가가 올해 처음으로 2천만원을 넘는 등 서울 아파트 분양가 고공행진이 지속되고 있다. 부동산정보업체 닥터아파트에 따르면 서울 경기 인천 등 수도권에서 올해 11월까지 분양된 230곳 73 799가구의 분양가를 조사한 결과 3.3㎡당 평균 1천3백12만원으로 나타났다. 2006년 1천1백68만원 과 비교해 12.3% 증가한 것이다. image0 역별로 평균 분양가는 서울이 1 787만원 인천 1 264만원 경기 1 042만원 순이다. 지난해와 비교해 인천이 50.3%로 오르면서 가장 상승폭이 컸으며 서울은 36.4%로 올랐다. 반면 경기는 9.5% 하락했다. 이번 조사에서 특이할 만한 점은 서울 6개 지역 분양가가 2천만 원을 넘어선 것이다. 2006년 당시 서울에서 분양가가 2천만원이 넘는 곳은 광진구 서초구 2곳뿐 이었다. 하지만 올해 들어서 강남구 강동구 마포구 영등포구 종로구 중구 6곳이 고분양가 대열에 들어섰다. 특히 강남구는 올해 분양가가 3천만 원을 넘어섰다. 2006년 강남구 평균 분양가는 2천만 원에도 못 미치는 1 779만원이었는데 이는 2006년 한 해 동안 강남구에서 분양된 아파트가 삼성동 현대힐스테이트 한 곳밖에 없었고 대부분 59㎡이하의 소형이어서 분양가가 1천만원대에 머물렀다. 하지만 올해는 분양가가 3천만 원을 넘었다. 물량이 많지 않았지만 강남구 도곡동 도곡리슈빌 분양가가 높아 단숨에 1위 자리를 차지했다. 강동구와 마포구 영등포구 종로구 역시 올해 분양이 이뤄진 곳은 두 개 단지였지만 대부분 시내 중심 상업지구에 들어서는 주상복합 등 이여서 분양가가 올해 처음으로 2천만 원을 넘었다. 강동구에서 올해 분양된 곳은 암사동과 천호동에서 한솔솔파크리버와 임광그대家다. 마포구와 영등포구도 신공덕동과 당산동4가에서 KCC웰츠타워와 유보라팰리스가 분양됐다. 종로구는 역시 평창동 롯데캐슬로잔 한 곳 만이 분양돼 분양가 상승을 이끌었다. 중구는 황학동과 회현동1가에서 아크로타워 리더스뷰남산 쌍용플래티넘 3곳이 분양에 나섰다. 인천 분양가 2006년 8백41만원 도 올해 송도국제도시와 남구 학익동 고가 주상복합 분양으로 분양가가 3.3㎡당 1천만원을 넘어섰다. 반면 경기는 분양지역이 2006년 보다 오히려 늘었지만 17개시 24개시.군 분양가는 오히려 하락했다. 분양가 상한제가 적용된 택지지구 고읍 진접 흥덕 등 와 양평 여주 등 분양가가 낮은 지역에서 분양이 이뤄지면서 평균 분양가를 낮춘 것으로 분석된다. 특히 2006년 운정신도시 고가분양으로 평균 분양가가 3.3㎡당 1천25만원까지 기록했던 파주시는 올해 분양가 상한제가 적용된 물량이 나오면서 8백86만원으로 평균 분양가가 떨어졌다.,https://news.naver.com/main/read.nhn?mode=LSD&mid=shm&sid1=260&oid=009&aid=0000641714,98
70497,2007.11.21. 오후 4:51,부동산,서울경제,미분양 털자 분양조건 완화 바람,서초 아트자이·수명산 SK뷰등 중도금 무이자 건설사들이 미분양 물량을 처리하기 위해 중도금을 무이자로 대출해주는 등 분양 조건을 크게 완화하면서 실수요자들을 끌어들이고 있다. 21일 업계에 따르면 GS건설이 시공 중인 강남 서초동 아트자이 주상복합 아파트는 잔여분에 한해 1ㆍ2회차 중도금을 입주 시 잔금으로 전환하고 3ㆍ4회차 중도금은 총부채상환비율 DTI 범위 내에서 무이자로 대출해준다. 아트자이는 지하4층 지상25층 4개 동이며 181 336㎡형으로 구성돼 있다. 총 164가구를 분양하며 현재 19가구 정도가 남아 있다. 3.3㎡당 분양 가격은 2 880만 3 390만원이며 우면산공원ㆍ예술의 전당ㆍ서리풀공원 등이 10분 거리에 있다. SK건설도 양천구 신월동 일대에 공급하는 수명산 SK뷰에 대해 잔여 가구 중 일부에 대해 중도금 전액 무이자 융자를 실시하고 있다. 중도금 중 DTI 적용으로 대출이 불가능한 금액은 연기 신청을 하면 잔금과 같이 납부할 수도 있다. 수명산 SK뷰는 지하1층 지상12층의 아파트 3개 동으로 구성됐으며 108㎡형 175㎡형 등 총 171가구를 분양한다.,https://news.naver.com/main/read.nhn?mode=LSD&mid=shm&sid1=260&oid=011&aid=0000208009,98
