,date,cat,co,headline,text,url,week
66371,2007.10.16. 오후 11:15,부동산,경향신문,靑－정치권 ‘반값 아파트 실패’ 책임 떠넘기,이른바 ‘반값 아파트’ 정책 실패를 둘러싼 당사자간의 낯뜨거운 책임공방을 보면 이번 정책실패가 총체적 부실이라는 사실이 그대로 묻어난다. 책임공방은 청와대가 불을 지폈다. 청와대는 “ 이번 정책은 실효성이 낮을 것으로 봤다”며 이번 결과가 예견된 것이었다는 입장을 보였다. 정부가 이같은 정책을 수용할 수밖에 없었던 것은 여야의 압박 때문이었다며 정책실패의 책임을 정치권으로 떠넘겼다. 그러나 정작 관련 법안을 성사시킨 정치권은 발끈했다. 한나라당 대선후보 경선 과정에서 ‘반값 아파트’ 공약을 제시한 홍준표 의원은 “지금 건설교통부에서 군포에 만든 아파트는 한나라당이나 내가 주장하는 반값 아파트가 아니라 순 엉터리”라고 말했다. 홍의원은 “주변 아파트 가격의 80 90%를 받으면 무슨 대지임대부 아파트고 누가 사겠느냐”고 지적했다. 그는 “건교부가 야당이 주장하는 반값 아파트 정책이 잘못됐다고 왜곡하기 위해 장난을 치는 것”이라고 덧붙였다. 홍의원과 같이 정책을 입안한 옛 열린우리당 관계자도 “정부는 처음부터 이 정책에 관심이 없었다”면서 “결론적으로 정부가 하기 싫은 정책을 성의 없게 해놓고 ‘그것봐라 안되지 않느냐’고 한 것 아닌가 싶다”고 정부를 꼬집었다. 그는 또 “공급가를 현격히 낮춰서 시세의 70% 정도라면 소비자들이 매력을 느꼈을텐데 90%는 매력을 느끼기 어려운 것 아니냐”고 정부에 화살을 돌렸다. 주택공사는 한술 더 떠 ‘반값’이라는 단어를 꺼낸 적조차 없다며 난색을 표하고 있다. 주공 관계자는 “아직 3순위 청약도 안 끝난 상황에서 성공 실패를 논하는 것은 의미가 없다”면서 “정부당국의 정책을 수행하는 것이 주공의 업무인 만큼 향후 반값아파트 사업을 계속 추진할지도 우리가 결정할 사항이 아니다”라고 말했다. 주부 강모씨는 이에 대해 “처음부터 ‘정치꾼’의 말장난일 것이라고 생각했으면 이렇게 억울하지는 않았을 것”이라면서 “정부를 믿고 내집 마련 꿈을 미뤄왔는데 이제는 집을 사고 싶어도 너무 비싸 엄두를 못낸다”고 말했다. 〈정유미기자〉 대한민국 희망언론 경향신문 구독신청 hp smile.khan.co.kr ⓒ 경향신문 경향닷컴 www.khan.co.kr 무단전재 및 재배포 금지 〈경향닷컴은 한국온라인신문협회 www.kona.or.kr 의 디지털뉴스이용규칙에 따른 저작권을 행사합니다.,https://news.naver.com/main/read.nhn?mode=LSD&mid=shm&sid1=260&oid=032&aid=0000248615,93
66372,2007.10.16. 오후 10:30,부동산,아시아경제,국내 최초 세계 프로폴리스 사이언스 포럼 열린다,천연 항생제로 불리는 프로폴리스 propolis 국제학술포럼이 국내 최초로 대전 대덕연구개발특구에서 열린다. 프로폴리스 Propolis 는 꿀벌이 자신의 생존과 번식을 위해 다양한 식물에서 뽑아낸 성분에 침과 효소 등을 섞어 만든 물질이다. 병균이나 바이러스로부터 인체를 보호해주고 항염과 항산화. 면역증강 등의 효과가 있어 천연 페니실린으로도 불린다. 바이오프로폴리스연구회 회장 이승완 서울프로폴리스 대표 는 오는 25일부터 이틀간 대전 국립중앙과학관에서 한국과 일본 독일 등 세계 8개국 관계자가 참석한 가운데 제1회 세계 프로폴리스 사이언스 포럼 WPSF 을 개최한다고 16일 밝혔다. 포럼은 양봉산업의 현황과 발전방안 프로폴리스의 효능 프로폴리스의 활용 등 크게 3개 분야로 나뉘어 주제발표 및 토론형식으로 진행될 예정이다. 또 프로폴리스 관련 제품 전시와 관람객들을 위한 봉침 시술 등도 이뤄진다.,https://news.naver.com/main/read.nhn?mode=LSD&mid=shm&sid1=260&oid=277&aid=0000008807,93
66373,2007.10.16. 오후 10:30,부동산,한겨레,청와대 “반값 아파트 지속 여부 재검토”,한겨레 청와대는 이른바 ‘반값 아파트’로 알려진 환매조건부와 토지임대부 주택 분양이 청약 미달 사태를 빚자 사업 지속 여부를 재검토하기로 했다. 천호선 청와대 대변인은 16일 정례 브리핑에서 ‘반값 아파트’ 사업이 실패했다는 평가에 대해 “반값 아파트는 정부가 붙인 이름이 아니며 정부는 이런 결과를 어느 정도 예견하고 있었다”고 밝혔다. 그는 “반값 아파트는 지난해 말 홍준표 한나라당 의원의 제안으로 시작됐는데 정부는 애초부터 현실성이 낮은 정책이라는 시각을 갖고 있었다”며 “하지만 여야를 떠나 몰아붙이는 분위기가 있어 수용하지 않을 수 없었고 반값 아파트의 문제를 제기한 건설교통부 주택국장이 사퇴 압력을 받은 일도 있었다”고 말했다 천 대변인은 “일단 시범적으로 추진해 보자고 해서 사업이 이뤄진 만큼 결과를 놓고 평가해 제도적으로 보완해 발전시킬 수 있는지를 검토할 것”이라며 “이것은 무책임한 한건주의 정책의 결과로 앞으로 정책 수립 과정에서 경계해야 할 대목”이라고 말했다. 그는 ‘검토 뒤 문제가 있다고 판단하면 사업을 포기할 수 있느냐’는 질문에 “아직 분양이 남아 있기 때문에 지금 단언할 수는 없으며 분양 결과를 보고 그 결과에 따라 국회와 정부에서 논의하게 될 것”이라고 답변했다. 한편 대한주택공사가 15 16일 군포 부곡지구에서 환매조건부와 토지임대부 분양 주택의 1 2순위 청약 신청을 받은 결과 620가구에 74명만이 신청해 경쟁률이 0.12 대 1에 불과했다. 환매조건부는 321가구에 48명 토지임대부는 299가구에 26명만 신청했다. 주택공사는 17일 무주택 가구주들을 대상으로 3순위 청약을 받는다. 이처럼 청약 경쟁률이 낮은 것은 이들 주택이 애초 알려진 것보다 값싸지 않은데다 재산권 행사에 제한이 있기 때문으로 분석된다. 최종훈 신승근 기자 cjhoon hani.co.kr ⓒ 한겨레 hp www.hani.co.kr 무단전재 및 재배포 금지 신뢰도 1위 믿을 수 있는 언론 한겨레 구독신청 하기 한겨레는 한국온라인신문협회 www.kona.or.kr 의 디지털뉴스이용규칙에 따른 저작권을 행사합니다.,https://news.naver.com/main/read.nhn?mode=LSD&mid=shm&sid1=260&oid=028&aid=0000216311,93
66374,2007.10.16. 오후 10:28,부동산,아시아경제,정보화 기술 교류 양해각서 체결,정보통신연구진흥원 IITA 과 한국지질자원연구원은 16일 IITA 대회의실에서 정보화 기술 교류 및 발전을 위한 양해각서를 체결했다고 밝혔다. 양 기관은 협약에 따라 IITA의 이두레 e DURE 시스템과 지질자원연의 제안마일리지시스템 기술을 상호 교환하는 등 모두 8개 분야에서 협력을 추진한다. 이두레는 정보통신부 정책관리시스템을 22개 산하 유관기관에 적용하는 온라인 업무공동체 구현 시스템으로 유관기관 및 정통부와의 실시간 업무협의 실현이 가능한 방식을 채택하고 있다. 제안마일리지는 구성원의 창의적인 우수 아이디어가 제도로 정착되도록 관리하는 시스템으로 개인별 성과에 따라 마일리지 점수가 부여되도록 했다. 양 기관은 두 시스템의 상호 교환을 통해 원내 제안제도 활성화와 효율적인 업무추진이 가능할 것으로 기대하고 있다.,https://news.naver.com/main/read.nhn?mode=LSD&mid=shm&sid1=260&oid=277&aid=0000008806,93
66375,2007.10.16. 오후 10:27,부동산,아시아경제,토공대전충남본부 지역장애아동과 봉사활동,한국토지공사 대전충남지역본부 본부장 김광수 온누리 봉사단은 16일 대덕대학 한국토지공사 지역장애아동과 함께하는‘동 同 고동 同 락’행사에 참여했다. 이날 행사는 정신지체장애인 생활시설인 정화원 대덕구 대화동 39 1 소재 원생들과 함께 계족산 장동 산림욕장에서 가을 나들이를 함께 함으로써 장기간 시설생활에 지친 장애우들의 심신을 일깨우고 사회적응도를 높일 일환으로 실시됐다. 정화원생 대덕대학 사회복지계열학생 토지공사 온누리봉사단원 등 90여명은 일대일 짝을 지어 함께 즐거운 체조와 2인 삼각 달리기 조별 장기자랑 등 명랑 레크레이션을 통해 서로에 대한 이해를 높이는 시간을 가졌다. 특히 장애우와 정상인이 서로 손을 잡고 계족산 산행에 나서 낙오자 없이 전원 무사히 등산을 마쳤다. 이날 봉사활동에 참여한 온누리 봉사단원 관계자는 “짧은 만남이었지만 장애우들과 함께 가을나들이를 하니 좋은 추억이 되었고 순수한 장애우들을 보니 오히려 우리 일반인들이 배워야 할 점이 많은 것 같다”면서 기회가 된다면 다음에도 꼭 참여하겠다 고 약속했다. 한편 토공 대전충남지역본부는 사회공헌활동을 내실있게 수행하기위해 복지분야의 전문기관인 대덕대학 사회복지계열과 산학협동으로 사회공헌활동을 해 오고 있다. 지난 5월에는 둔산어르신 큰잔치 9월에는 유성어르신 한마당 잔치에 함께 참여했고 앞으로도 대덕대학과 함께 소외된 지역주민을 위한 봉사활동을 할 예정이다.,https://news.naver.com/main/read.nhn?mode=LSD&mid=shm&sid1=260&oid=277&aid=0000008805,93
66376,2007.10.16. 오후 10:26,부동산,아시아경제,勞使政 한마음 되자 계룡산에서 다짐대회 열어,충남도는 16일 공주시 반포면 소재 계룡산에서 ‘노사화합 한마음 다짐대회’를 열고 노 사 정간 화합을 바탕으로 협력관계를 지속해 나가기로 다짐했다. 한국노총 충남지역본부 의장 홍재복 가 주관한 이날 대회에는 이완구 충남도지사 홍재복 한국노총 충남지역본부의장을 비롯한 노동계와 사용자 대표 등 250여명이 참석한 가운데 노사간 화합과 신뢰를 쌓는 소중한 시간을 가졌다. 행사는 1부와 2부로 나누어 진행됐다. 1부 행사는 홍재복 의장의 대회사를 시작으로 이완구 도지사의 격려사 등 의식행사가 2부에서는 노사가 함께 어우러져 동학사를 시작으로 남매탑을 돌아오는 4시간 코스의 산행이 이어졌다. 이완구 도지사는 격려사를 통해 “노사관계는 지역산업 발전을 이끄는 쌍두마차며 무엇보다도 상호간 호흡을 맞추는 협력관계가 중요하다” 며 “특히 8월 기준으로 무역수지 133억 3400만달러로 전국 1위 중소기업수출 52억 8100만달러로 14개월 연속 전국 1위를 달성하게 된 것도 노사가 하나가 돼 노력해 온 성과”라며 참가자들의 노고를 치하했다. 이 대회를 준비한 한국노총 충남지역본부 홍재복 의장은 “오늘 대회가 비록 소규모 행사지만 노사간 안정을 기반으로 지역경제 활성화와 발전을 위한 소중한 시간이 되기를 바란다.”고 말했다.,https://news.naver.com/main/read.nhn?mode=LSD&mid=shm&sid1=260&oid=277&aid=0000008804,93
66377,2007.10.16. 오후 10:25,부동산,아시아경제,수확철 농촌 농기계 안전사고 잇따라,수확철 농촌 농기계 안전사고 잇따라 충남도내 9월부터 10월 16일까지 콤바인 등 농기계 안전사고 19건 20명 발생 수확철을 맞은 농촌에서 농기계 안전사고가 급증 각별한 주의가 요구되고 있다. 충남도의 경우 지난 14일 당진군 고대면 당진포리 논에서 장모씨 62 가 콤바인 예취부분에 낀 이물질을 제거하다 오동작으로 사고가 발생해 당진 119구조 구급대의 도움으로 병원에 이송됐다. 이에앞서 지난 13일에는 예산군 삽교읍 성리 농로에서 이모씨 70 가 경운기에 부인 황모씨 69 를 태우고 커브길을 돌다 조작미숙으로 농수로에 전복돼 출동한 예산 119구조 구급대의 응급처치를 받고 병원으로 후송됐다. 충남도에 따르면 수확에 들어간 9월부터 10월 16일까지 농기계 안전사고는 총 19건 20명 이 발생했다. 이 가운데 경운기로 인한 사고가 13건 68.4% 14명으로 가장 많았으며 콤바인은 5건 26.3% 5명으로 나타났다. 충남도 소방본부 관계자는 수확철에 농기계 안전사고가 급증하는 것은 농민 대부분이 고령이고 사고에 대한 대처능력이 부족해 안전사고가 발생하는 것으로 분석된다 고 밝혔다. 도 소방본부 관계자는 “수확이 끝나는 기간까지 농기계 안전사고 주의보 발령과 함께 농기계 사용자들의 각별한 주의와 사용전 사전점검 및 조작 요령을 완전 숙지한 후 농기계를 사용할 것”을 당부하였다.,https://news.naver.com/main/read.nhn?mode=LSD&mid=shm&sid1=260&oid=277&aid=0000008803,93
66378,2007.10.16. 오후 10:00,부동산,한겨레,11월 수도권 노른자위 1만2천가구 쏟아져,한겨레 올해 수도권 분양시장에서 ‘빅3’로 손 꼽혀온 은평 뉴타운 파주 새도시 인천 청라 경제자유구역이 비슷한 시기에 맞대결하면서 큰 장이 서게 됐다. 은평 뉴타운 분양 일정이 한달 늦춰진 11월로 연기되는 바람에 다음달에 이들 3개 지역에서 1만2천여가구의 아파트가 한꺼번에 쏟아져 나오게 된 것이다. 이들 지역은 대체로 입지 여건이 우수하고 개발 잠재력이 뛰어나 청약 대기자들이 눈독을 들여왔던 곳들이다. 그러나 수요층이 많은 만큼 당첨의 문턱도 높을 전망이다. 또 청약 가점제와 채권입찰제 등이 적용돼 수요자들로서는 따져봐야 할 것들도 많다. 특히 자신의 청약 가점 수준에 맞춰 청약 대상을 잘 고르는 것도 당락의 변수가 될 것으로 보인다. 공급 물량과 분양값은 서울에서는 다음달 은평 뉴타운 1지구에서 전용면적 59 167㎡형 2817가구가 선보인다. 원주민 특별 공급분을 제외하면 일반 분양은 2400가구 안팎에 이를 전망이다. 이 가운데 중소형 전용 85㎡ 이하 1250가구는 청약저축 가입자 중대형 전용 85㎡ 초과 1200여가구는 청약예금 600만원 이상 가입자가 각각 신청할 수 있다. 분양값은 3.3㎡당 1100만 1400만원선으로 예상된다. 분양값 상한제가 적용되지 않기 때문에 중대형에도 채권입찰제가 적용되지 않는다. 특히 공정률 80%를 넘긴 뒤 분양하는 후분양제가 적용돼 입주 시기가 내년 4 5월로 빨라 수요자로서는 자금 조달 계획을 잘 세워야 할 것으로 보인다. 대신 분양권 전매 제한은 입주 때까지만 적용되는 게 장점이다. 파주 새도시에서는 벽산·동문·삼부토건 등 8개사가 참여해 민간 아파트 6026가구를 동시분양한다. 분양값은 중소형이 3.3㎡당 950만원 안팎 중대형은 3.3㎡당 1100만원 안팎에서 결정될 것으로 보인다. 중대형의 경우 채권입찰제가 실시되는데 비교 대상 인근 유사지역을 어디로 볼 것인지에 따라 채권 상한액이 달라진다. 파주 교하지구를 인근 지역으로 정할 경우 채권을 포함한 중대형 실질 분양값은 3.3㎡당 1200만원선에 이를 전망이다. 은평은 후분양제 청라는 분양가 낮은 게 특징 생활반경·교통여건·청약가점 잘 따져 선택을 그러나 일산 새도시를 기준으로 채권 상한액을 결정하게 되면 실질 분양값은 3.3㎡당 1400만원선으로 높아질 수 있다. 인천 청라지구에서는 11월부터 지에스건설과 중흥건설 등이 9개 단지 5천여가구를 단계적으로 분양한다. 분양값은 중소형이 3.3㎡당 800만원대 중대형은 3.3㎡당 1천만원선으로 예상된다. 분양값 상한제 이전에 택지가 공급된 지에스건설과 중흥건설 등은 중대형에 채권입찰제가 적용되지 않는다. 이에 따라 청라지구는 분양값이 저렴하다는 게 장점으로 꼽힌다. 청약 전략은 어떻게 은평 뉴타운 파주 새도시 청라지구 모두 앞으로 수도권의 인기 주거 지역으로 떠오를 만한 잠재력을 고루 갖췄다는 평가를 받는다. 실수요자라면 입지와 교통 여건을 따져 자신에게 적합한 곳을 선택할 필요가 있다. 파주 새도시는 서울 서북부 생활권 수요자에게 알맞다. 파주 새도시는 유비쿼터스 시범 도시로 환경이 쾌적한데다 경의선 복선전철 운정역 을 이용해 서울 도심권으로 출퇴근하기 편리하다. 청라지구는 인천공항철도 및 경인고속도로를 이용해 여의도 마포 상암 영등포권으로 쉽게 연결된다. 은평 뉴타운은 지하철 3호선을 이용하기 편리하고 북한산 자락에 있어 주거 환경이 쾌적한 게 장점이다. 다음으로 자신의 청약 가점을 고려해야 한다. 은평 뉴타운의 경우 강북에 사는 중장년층의 선호도가 높은 지역이어서 중대형 물량에 당첨되려면 청약 가점이 50점대 이상은 돼야 할 것으로 보인다. 일부 인기 평형은 60점대까지도 점쳐진다. 또 청약저축 가입자에게 공급되는 중소형은 5년 이상 무주택 가구주로서 청약저축 납입 회수 60회 이상 가입자들의 경쟁이 예상된다. 청라지구는 대체로 중소형의 경우 40 50점 수준이면 당첨 가능권으로 예상되지만 업체별로 청약 가점 당첨선이 큰 차이를 보일 가능성이 높다는 점을 유의할 필요가 있다. 가점이 낮은 수요자라면 중견업체를 선택하는 게 절대 유리하다. 그러나 중대형은 지난달 분양된 인천 논현 힐스테이트처럼 청약 가점 30점대 미만이라도 도전해볼 수 있다. 파주 새도시는 중소형의 경우 청약 가점 50점대 이상 중대형은 40점대 이상이면 당첨권으로 예상된다. 박상언 유앤알컨설팅 대표는 “청약 가점이 50점을 넘으려면 무주택 기간이 10년 이상 22점 부양가족 수 3명 이상 20점 청약통장 가입 기간 6년 이상 8점 등의 요건을 갖춰야 한다”며 “그 정도면 파주 새도시 당첨이 유력하다”고 말했다. 최종훈 기자 cjhoon hani.co.kr ⓒ 한겨레 hp www.hani.co.kr 무단전재 및 재배포 금지 신뢰도 1위 믿을 수 있는 언론 한겨레 구독신청 하기 한겨레는 한국온라인신문협회 www.kona.or.kr 의 디지털뉴스이용규칙에 따른 저작권을 행사합니다.,https://news.naver.com/main/read.nhn?mode=LSD&mid=shm&sid1=260&oid=028&aid=0000216310,93
66379,2007.10.16. 오후 10:00,부동산,한겨레,뜸했던 수원 분양시장 ‘북적’,한겨레 광교 새도시 개발 삼성반도체 공장 신설 등 굵직굵직한 개발 호재가 많은 경기 수원시에서 아파트 분양이 봇물을 이루고 있다. 수원에서는 이달부터 연말까지 16개 단지 총 6952가구의 아파트가 쏟아질 예정이다. 한화건설은 인계동에서 주상복합 아파트 212가구를 이달 중 선보인다. 지하 3층 지상 20층 규모로 152 179㎡ 로 구성된다. 수원역과 동수원 나들목이 가깝고 권선고 효원고와 경희대 아주대 경기대 등이 인접해 있다. 갤러리아백화점과 홈플러스 등 편의시설도 반경 1㎞ 안에 있다. 대림산업과 지에스건설은 권선주공 1 3차를 재건축한 ‘권선e 편한세상자이’를 이달 말 선보인다. 83 228㎡ 1754가구로 구성되며 이 가운데 416가구가 분양된다. 지하철 1호선 세류역이 차로 5분 거리이며 분당선 연장 구간인 수원시청역 2011년 개통 예정 과도 가깝다. 곡반정동에서는 대주건설이 ‘대주피오레’ 아파트 105·109㎡ 196가구를 이달 중 선보인다. 1호선 세류역이 10분 거리이며 인근에 곡반초교와 성균관대 등이 있다. 분양값은 3.3㎡에 1천만원 선이다. 광교 새도시의 수혜가 예상되는 매탄동에선 삼호가 ‘수원매탄e 편한세상’ 아파트 584가구를 다음달 선보인다. 82 152㎡로 구성되며 원천초교와 동수원중 산남중 등 교육시설을 이용할 수 있다. 그밖에 신창건설은 망포동에서 129 172㎡ 383가구를 12월 분양할 예정이다. 경부선 수원역을 이용할 수 있고 새로 개통될 방죽역이 가깝다. 대선초 영동중 영일중이 인근에 위치하고 올림픽공원 아주대병원 삼성홈플러스 등 편의시설도 두루 있다. 수원은 앞으로 광역 교통망이 크게 확충될 예정이다. 분당선 오리역과 수원역을 잇는 공사가 2011년 완공 목표로 진행되고 있다. 또 분당 정자역에서 수원 화서 및 호매실까지 연결되는 신분당선 연장선의 정자 광교 구간은 2014년 개통될 예정이다. 내집마련정보사 강현구 실장은 “수원은 광교 새도시 개발과 더불어 교통망 개선으로 접근성이 더 좋아지고 있다”며 “그동안 아파트 분양 물량이 많지 않았던 곳이어서 관심을 가져볼 만하다”고 말했다. 최종훈 기자 ⓒ 한겨레 hp www.hani.co.kr 무단전재 및 재배포 금지 신뢰도 1위 믿을 수 있는 언론 한겨레 구독신청 하기 한겨레는 한국온라인신문협회 www.kona.or.kr 의 디지털뉴스이용규칙에 따른 저작권을 행사합니다.,https://news.naver.com/main/read.nhn?mode=LSD&mid=shm&sid1=260&oid=028&aid=0000216309,93
66380,2007.10.16. 오후 10:00,부동산,한겨레,청구 새 아파트 브랜드 ‘지벤’으로 사업 재개,한겨레 대구 중견 건설업체인 ㈜청구가 새 브랜드 ‘청구 지벤’으로 수도권에서 사업을 재개해 눈길을 끌고 있다. 청구는 90년대 초 서울과 분당 등 수도권 새도시에 성공적으로 진출해 ‘아파트 명가’로 급성장했다가 외환위기 당시 쓰러진 건설업체다. 청구는 다음달 초 경기 김포시 고촌면에 347가구의 아파트를 내놓으며 옛 명예를 회복하겠다는 출사표를 던졌다. 지방에서도 포항 우현1차 울산 강변 등 연내 2천가구를 잇달아 선보일 예정이다. 새롭게 선보인 청구 아파트 브랜드 ‘지벤’은 ‘집에는 집엔 ’을 소리나는 대로 읽은 우리말로 겉치레를 배격한 집다운 집을 짓겠다는 의지를 표현한 것이라는 게 회사쪽의 설명이다. 지벤 ZIVEN 의 ‘Z’ 를 형상화한 로고는 벽과 천장의 조합 편하게 쉴 수 있는 의자 아이들이 즐겁게 뛰놀 수 있는 놀이터 외부로부터 안전하게 가족을 지켜주는 창문의 모습 등을 상징한다. 한편 최근 청구를 인수한 ㈜새날은 도시개발 전문 업체로 2005년 경기 화성시에 99만㎡ 규모의 산업단지를 조성해 분양을 완료한 시행사다. 이 회사는 김포 고촌 신곡6지구 약 4천가구 평택 가재지구 등 4개의 도시개발 사업지에서 총 1만5천가구 규모의 아파트 사업을 진행 중이다. 최종훈 기자 ⓒ 한겨레 hp www.hani.co.kr 무단전재 및 재배포 금지 신뢰도 1위 믿을 수 있는 언론 한겨레 구독신청 하기 한겨레는 한국온라인신문협회 www.kona.or.kr 의 디지털뉴스이용규칙에 따른 저작권을 행사합니다.,https://news.naver.com/main/read.nhn?mode=LSD&mid=shm&sid1=260&oid=028&aid=0000216308,93
