,date,cat,co,headline,text,url,week
70657,2007.11.22. 오후 2:01,부동산,이데일리,건설공제조합 부동산 큰 손으로 등장,3600억 투자..개발사업 골프장사업 진출 이데일리 남창균기자 건설공제조합이 상가·오피스 등 부동산 개발사업에 본격적으로 뛰어든다. 그동안 조합은 공사보증과 융자업무에 치중해 왔다. 최영철 건설공제조합 이사장 사진 은 22일 서울 논현동 건설회관에서 기자간담회를 갖고 내년부터 조합의 사업범위가 확대됨에 따라 3600억원의 자금을 신규사업에 투자할 것 이라고 밝혔다. 최 이사장은 보증시장 개방 요구 등 달라진 경영환경 변화에 대처하기 위해 그동안 조합의 발목을 잡아온 건설산업기본법상 조합의 사업범위를 대폭 확대했다 며 사업규모를 매년 확대해 갈 것 이라고 말했다. 건설공제조합은 우선 1500억원의 자금으로 부동산 개발사업과 기업 인수합병에 나설 계획이다. 수도권에 적당한 토지를 매입해 상가나 오피스빌딩을 지어 분양을 하고 조합원 편익을 위해 적당한 기업을 인수합병키로 했다. 조합은 또 수익사업의 일환으로 행정도시에 600억원을 투자해 사옥을 건축할 예정이다. 아울러 안정적인 수익구조를 만들기 위해 1500억원을 들여 수도권에 퍼블릭 골프장을 개발하거나 인수하는 방안도 검토 중이다. 최 이사장은 그동안 은행에 예치해 두었던 1조3000억원 정도의 여유자금을 적극적으로 운용해 수익을 창출할 계획 이라며 자산운용 전문인력을 영입해 채권과 펀드 등 다양한 투자상품에 투자할 것 이라고 말했다. 한편 지난 63년 설립된 건설공제조합의 조합원수는 1만2562개사이고 자본금은 5조원이다. 10월말 현재 보증잔액은 64조원 융자는 3조8000억원 프로젝트파이낸싱 투자액은 184억원 수준이다.,https://news.naver.com/main/read.nhn?mode=LSD&mid=shm&sid1=260&oid=018&aid=0000539213,98
70658,2007.11.22. 오후 1:44,부동산,연합뉴스,서울 도심 재개발 고질비리 또 적발,조합간부 뇌물은 업체들의 경쟁 참가비 전직 검찰직원.조폭.고발 협박꾼까지 진흙탕 가세 서울 연합뉴스 장재은 기자 조합 간부들의 뇌물수수와 조합장직 쟁탈전 업체들의 과열된 수주 경쟁 등에 따른 재개발 비리가 또 적발됐다. 서울 서부지검은 22일 용산 집창촌 재개발 사업을 둘러싸고 수주 청탁과 함께 억대 금품을 받은 재개발 조합장과 조합추진위원회 부조합장 등 간부 4명과 돈을 준 업체 대표 3명 등 7명을 기소했다. 간부들이 수십억원의 부당이익을 기대하며 조합장이 되려고 이전투구를 벌인 점 업체들이 조합 간부들에게 주는 뇌물을 경쟁 참가비 로 간주한 점 등을 감안하면 최근 적발된 청계천 재개발 비리와 다른 점이 거의 없다. 용산역 전면 3구역 조합장 정모 52.구속기소 씨는 다른 간부들과 함께 설계업체와 도시정비업 등 업체 3곳으로부터 사업을 수주하도록 힘써주겠다는 명목으로 5억원을 챙겼다. 설계비용 60억원을 바라보며 1억7천만원을 건넨 한 설계회사는 경쟁에서 탈락했지만 이후 별다른 이의를 제기하지 않았던 것으로 미뤄 검찰은 회사들이 뇌물을 경쟁 참가비 로 미리 책정해둔 것으로 보고 있다. 조합장의 뇌물수수는 기본이고 조합장 선출을 위한 사건청탁과 전직 검찰직원 조직폭력배 고발 협박꾼의 사기ㆍ공갈 행각 등이 이권다툼을 더 어지럽게 만들어놓은 것으로 드러났다. 조합추진위원회 부위원장 신모 44 씨는 이권에서 배제된 세력들이 미는 인물을 새 조합장으로 선출하기 위해 조합장 정씨를 구속시켜 주겠다며 2억원을 받은 혐의로 구속기소됐다. 신씨는 정씨의 비리를 제보한다며 검찰에 접근했다가 먼저 구속됐다. 현직 대법관의 전 운전사 심모씨는 대검찰청의 인맥을 활용해 정씨의 구속을 돕겠다며 신씨에게서 4천300만원을 받은 혐의 함모씨는 조합 비리를 검찰에 제보하겠다며 간부들에게서 7천만원을 뜯어낸 혐의로 각각 지명수배됐다. 검찰은 세입자들이 원만하게 이주를 할 수 있도록 돕겠다며 조직폭력배들이 이권에 가세하려고 한 정황을 잡고 수사를 계속하고 있다. 검찰 관계자는 조합 비리가 결국은 분양가 상승의 원인이 돼 피해는 서민에게 돌아간다 며 재개발ㆍ건축 사업은 그 속성상 비리 발생을 안고 있기 때문에 첩보를 계속 수집해 서대문ㆍ마포ㆍ은평 등지로 수사를 확대할 방침 이라고 말했다.,https://news.naver.com/main/read.nhn?mode=LSD&mid=shm&sid1=260&oid=001&aid=0001830896,98
70659,2007.11.22. 오후 1:21,부동산,매일경제,SK건설 협력업체에 품질안전환경 관리 노하우 전수,SK건설은 협력업체 상생경영의 일환으로 오는 23일 금 까지 대전광역시 유성구에 위치한 아드리아 호텔에서 협력업체 실무자들을 대상으로 한 QSE 품질 Quality 안전 Safety 환경 Environment 교육인 ‘Biz. Partner 실무자 QSE 과정’을 실시한다. 이 과정은 품질 안전 그리고 환경의 중요성에 대한 공감대 형성과 의식고취 및 협력업체의 품질 안전 환경 역량 강화를 목적으로 실시되며 20일 화 부터 1박 2일 과정으로 건축 임업 토목 통신 플랜트 등 전 부문 총 294명의 협력업체 실무자들이 교육을 이수하게 된다. 주요 교육 프로그램은 품질경영활동 안전환경경영 현장 QSE실무 현장 품질 안전 환경 관리실무 응급처치 등으로 구성됐다. 또한 협력업체 실무자들이 실제 현장에서의 QSE 활동과 관련한 자유로운 의견을 교환하는 분과토의도 이루어진다.,https://news.naver.com/main/read.nhn?mode=LSD&mid=shm&sid1=260&oid=009&aid=0000642003,98
70660,2007.11.22. 오후 1:15,부동산,머니투데이,주공 단지내 상가도 차별화,머니투데이 김정태 기자 인천논현2지구 1 3블록 내정가 대비 평균낙찰가 171% 안정적인 투자로 꾸준한 인기를 누리고 있는 주공 단지내 상가도 조건에 따른 차별화 현상이 두드러지고 있다. 22일 관련업계에 따르면 지난 19 21일 이뤄진 성남도촌지구 A1 A4블록 고양행신2지구 A1 A3 B1 B2블록 인천논현2지구 1 3블록 주공아파트의 단지내 상가 입찰 결과가 크게 엇갈린다. 총 49개의 점포를 일반에게 분양한 인천논현2지구의 경우 평균낙찰가가 예정가의 171%에 달해 인기를 모았다. 인천논현2지구 3블록 B동 102호는 예정가에 비해 340%수준인 약 2억5000만원선에 낙찰됐고 3블록 A동 102호는 예정가의 296%인 2억1800만원에 분양이 이뤄졌다. 상가시장의 불황에도 인천논현2지구 단지내 상가의 인기의 요인은 배후 가구수가 크기 때문인 것으로 파악된다. 인천논현2지구 3블록은 2148가구 2블록은 1278가구 1블록은 872가구 규모에 달한다. 반면 기대를 모았던 고양행신지구 A1 A3 B1 B2블록 는 총 25개 점포 분양 중 9개의 점포가 유찰됐으며 분양된 점포들의 평균 낙찰가도 112%수준에 그쳤다. 성남도촌지구A1 4블록의 분양도 총 26개 점포중 15개의 점포가 유찰됐으며 낙찰된 상가의 평균 낙찰가는 예정가 대비 108%수준에 그쳤다. 이처럼 도촌지구 A1 4블록의 분양이 저조했던 이유는 상대적으로 이들 배후 가구수가 적고 모든 블록의 단지가 소득수준이 떨어지는 국민임대 아파트라는 점 등이 컸던 요인으로 분석됐다. 상가뉴스레이다 정미현 선임연구원은 최근에는 단지내 상가라도 배후 가구규모 및 고정고객의 소득 수준 등을 따져 투자하는 계층이 늘어나고 있다 고 말했다.,https://news.naver.com/main/read.nhn?mode=LSD&mid=shm&sid1=260&oid=008&aid=0000855177,98
70661,2007.11.22. 오후 12:42,부동산,이데일리,재테크광고용인토지 68500원㎡ 2차분매각,양지I.C 3분거리 부동산투자1순위 용인땅 이데일리 최근 용인시 개발의 청사진이 될 ‘2020년 용인 도시기본계획’이 확정되면서 용인시의 개발 중심축이 동남부권을 따라 재편되고 있다. 용인시는 동남부 740만평을 ‘ 시가지화 예정 용지 ’ 로 지정하고 적극적인 개발을 유도한다는 계획이다. 주 용인미래타운에서는 처인구 양지면 주북리 일대 회사보유분 토지 1차분를 성황리에 마치고 2차분를 매각공고한다. 분양가는 6만8500원 ㎡ 495㎡∼661㎡ 150∼200 기준이며 투자금액은 3000만원∼4500만원 선이다. 이번에 분양에 들어가는 양지면 주북리 일대 토지는 서울 강남에서 30분대 진입 양지IC에서 3분거리 영동고속도로 8차선확장공사 57번 자동차전용도로 금이IC에서 2분 용인경전철에서 3분거리로 주변 인프라가 잘 갖추어진 토지이다. 더욱이 요즘 인기가 많은 대형 전원주택단지와 타운하우스가 주변에 개발중에 있으며 토지거래허가구역 제외지역이라 투자자들이 선호하는 모든 조건을 갖추었다. 에스크로우제도 법무사를 통한 제3자 안전거래 보장제 접수 방식으로 신청금 100만원을 기업은행 038 082164 01 015 김안식법무사 로 입금하면 필지 배정우선권을 부여받아 답사 전까지 토지를 확보 할 수 있다. 현장 답사 후 계약 결정이 가능하고 신청 철회시 전액 환불된다.,https://news.naver.com/main/read.nhn?mode=LSD&mid=shm&sid1=260&oid=018&aid=0000539189,98
70662,2007.11.22. 오후 12:39,부동산,머니투데이,호가만으로 산정한 공시지가는 무효,머니투데이 양영권 기자 서울고법 판결 법령서 요구하는 평가방식 채택해야 실제 거래가격이나 원가 임대료 기준이 아닌 중개업체 등이 내놓는 호가를 기준으로 공시지가를 산정하는 것은 위법하다는 판결이 나왔다. 서울고법 특별5부 재판장 조용호 부장판사 는 서울 중구 주자동에 토지를 소유하고 있는 조모씨가 2006 연도 공시지가 처분을 취소하라 며 건교부장관을 상대로 낸 소송에서 1심대로 원고 승소 판결했다고 22일 밝혔다. 재판부는 감정평가법인들이 법령에서 요구하는 표준지 평가방식인 거래사례비교법 원가법 수익환원법 중 어느 하나의 방식을 채택하지 않고 합리적인 이유 없이 세평 世評·호가기준 가격만을 참작해 감정평가를 했다 며 판결 이유를 밝혔다. 앞서 건교부는 조씨 소유 토지 70.1㎡을 표준지로 선정하고 공시지가 산정을 위해 감정평가법인 2곳에 감정을 의뢰했다. 이들 법인은 이 일대 토지가 지구단위계획으로 건축제한이 돼 있어 인근 토지의 거래 사례를 찾지 못하자 평가선례와 세평가격 인근표준지 등을 감안해 지가를 산정했고 건교부는 이를 바탕으로 지난해 2월 이 땅의 공시지가를 ㎡당 495만원으로 확정해 공고했다. 이에 조씨는 토지의 가치에 비해 턱없이 높게 공시지가가 산정됐다며 소송을 냈다.,https://news.naver.com/main/read.nhn?mode=LSD&mid=shm&sid1=260&oid=008&aid=0000855165,98
70663,2007.11.22. 오후 12:34,부동산,머니투데이,연말 집 갈아타기 버블세븐지역,머니투데이 이재경 기자 머니위크 박원갑 스피드뱅크 연구소장 인터뷰 내년은 부동산 가격 재상승을 위한 에너지 축적기간이 될 것이다. 박원갑 스피드뱅크 연구소장은 거의 대부분 부동산값이 치솟는 무차별 상승세는 지났다 며 이 같이 밝혔다. 내년에는 일부 호재가 있는 지역을 중심으로 상승세를 보이며 전체적으로는 큰 오름세가 없을 것이라는 전망이다. 내년 부동산 시장의 가장 큰 변수로는 정책의 변화를 꼽았다. 올 12월 대통령선거 이후 새로 집권하는 정당 및 정부의 정책의지에 따라 부동산시장이 큰 변화를 겪을 수 있다는 얘기다. 박 연구소장은 누가 집권하든지 부동산 정책의 미세조정은 있을 것 이라며 양도소득세 종합부동산세 대출규제 등은 지금보다는 다소 완화할 가능성이 있지만 획기적인 규제완화는 불가능할 것 이라고 내다봤다. 내년 부동산시장 소폭 상승에 그칠 것 박 소장은 내년 수도권 주택가격의 경우 소비자 물가상승률인 3 4% 수준의 상승을 예상했다. 인구감소와 지역경제침체 등 악재가 많은 지방은 약세를 면치 못할 것으로 진단했다. 이에 따라 전국적으로는 1 2% 정도만 상승하는 강보합세를 보일 것으로 전망했다. 박 소장은 매매가격이 물가상승률 정도에 머무는 것은 그동안 펀드 등 대체상품의 등장으로 투자메리트가 크게 상실한 상황인 데다 부동산시장이 실수요 위주로 재편돼 상승여력이 크지 않기 때문 이라고 설명했다. 또 각종 세금이나 대출규제 등 압박으로 투자수요가 크지 않은 점도 요인으로 꼽았다. 시기적으로는 집권 초기인 상반기에 약세를 보이다가 하반기 들어 강보합세 띨 것이라는 전망이다. 상반기 약세는 6월 1일 종합부동산세 과세 기준일을 앞두고 매물 출회 가능성이 있다는 데 기인한다. 그렇다고 해서 가격이 크게 떨어지지는 않을 것이라는 전망도 내놨다. 그는 가격이 크게 떨어질 가능성이 낮은 것은 주택 신규 및 대체 수요층인 30 40대가 인구구조상 두터운 허리층을 형성하고 있어 가격이 떨어지면 대기매수세가 형성될 가능성이 있기 때문 이라고 말했다. 하지만 각종 지역개발 호재로 인해 국지적 상승가능성은 상존해 있다고 설명했다. 뉴타운이나 재개발 도로 등 각종 사회기반시설 건설 등이 호재로 작용할 수 있다는 것. 내년 재건축시장은 대선변수로 재건축 아파트값이 민감한 반응을 보일 것으로 예상했다. 일부 규제완화 가능성이 있지만 미세조정에 그칠 것이며 불안정세를 보일 경우 다시 규제강화로 회귀할 가능성도 있다는 설명이다. 재개발 및 뉴타운시장은 현재의 재개발 뉴타운 활성화 기조를 차기 정부도 유지할 것으로 내다봤다. 단 분양가상한제로 사업성이 약화할 수 있고 매수세도 활성화되기는 어려울 것으로 전망했다. 특히 일반분양이 많은 재개발의 경우 수익성이 악화될 수도 있다는 것이다. 토지시장의 경우는 대부분 기업 및 경기활성화 여부가 좌우할 것이라고 분석했다. 충청 등 개발호재지역에서의 추가 상승세는 미미할 것이라고 예상했다. 상가시장은 쇼핑몰과 테마상가에서 본격적인 구조조정이 일어날 것이라고 지적했다. 택지지구 등 인기지역의 분양가는 상승할 수 있지만 건물과 토지의 통합과세가 악재로 작용하고 금리가 상승하면 상가수익률은 저하할 가능성을배제할 수 없다는 것. 고급 타운하우스는 틈새 상품으로 판교 일산 등 신도시 및 택지지구에 인기가 한정될 것으로 전망했다. 또 전원주택 수요는 감소하고 예술가를 위주로 한 특정계층의 한정수요 정도나 가능할 것으로 내다봤다. 1가구2주택 양도세 중과나 종부세 도입 등이 악재로 작용할 수밖에 없어 전원주택 수요가 콘도로 이동할 가능성이 높을 것이라는 설명이다. 아울러 전원형 실버타운은 쇠퇴하지만 도심근처의 실버타운은 인기를 지속되고 핵가족화 고령인구 증가에 따라 수요도 증가할 것으로 전망했다. 내년 분양물량은 올해보다 감소하고 수도권 유망단지로 인해 분양시장도 양극화가 심화할 것으로 예측했다. 게다가 지방의 경우 공급과잉과 수요예측 실패로 중대형 분양은 침체의 길을 걷고 규제를 완화하는 정책도 지방에서는 큰 영향을 주지 못할 것이라고 예상했다. 정책변수가 가장 큰 영향 박원갑 소장은 내년 부동산시장의 가장 큰 변수로 단연 정책변수를 꼽았다. 그는 내년 주택시장은 차기 정권의 정책기조에 따라 변동률이 달라질 가능성이 크다 며 정책변수는 단기적으로 70 80%의 영향력를 차지할 정도로 막강한 위력을 보인다 고 설명했다. 박 소장은 그러나 누가 집권하든 규제를 획기적으로 완화하기는 어렵지만 지금보다 완화할 가능성 큰데 이는 지금의 규제가 반시장적이고 과도하다는 공감대가 형성돼 있기 때문 이라고 강조했다. 규제완화는 폭과 정도의 차이가 있을 뿐 종부세 양도세 재건축 등 미세조정은 가능하다는 얘기다. 또 규제완화의 정도도 결국 시장 여건에 달려있다는 것이다. 한나라당이 집권하게 되면 참여정부의 부동산정책 기조를 유지하면서 부분적으로 손질을 가할 것으로 내다봤다. 전반적인 규제완화보다는 초기의 미세조정 가능성에 무게를 실었다. 재건축의 경우 소형의무비율이나 전매제한 정도만 부분 조정을 하고 개발이익환수 및 분양가상한제 후분양제는 유지할 것으로 추측했다. 다만 종부세는 유보하면서 세대별 합산이 6억원인 현재의 기준을 개인별 합산 9억원으로 조정할 가능성이 있다고 예상했다. 또 양도세도 1가구1주택 장기보유자에 대해 완화하고 미분양에 대한 양도세 특례 가능성도 제시했다. 범여권이 재집권하게 되면 수요 억누르기 정책은 유지하면서 극히 미세적으로 조정할 것 이라는 전망을 내놨다. 재건축 억제책은 유지하고 종부세는 고령자 중심 장기보유자에게 소폭 혜택을 주는 미세조정을 할 것으로 보인다는 것. 양도세는 1가구1주택 장기보유자에 대해 선별감면할 수 있을 것으로 예상했다. 박 소장은 규제완화의 정도는 한나라당보다는 낮을 것 이라며 설사 규제완화를 하더라도 입법과정에서 논란은 불가피할 것 이라고 지적했다. 그는 이어 지방과 수도권이 전혀 다른 시장 양상을 보이고 있다 며 따라서 내년에는 지방의 경우 종부세 양도세 대출규제 등에서 탄력적으로 조정할 가능성도 있다 고 덧붙였다. 침체기에는 메인상품 찾아야 올해에 이어 내년에도 부동산 시장이 큰 활황을 맞지는 않을 것으로 예상된다. 이런 보합시기 내지는 침체기에는 틈새상품을 찾지 말고 메인상품 을 찾아야 한다고 박 소장은 강조했다. 박 소장은 불황기일수록 환금성이 좋은 물건을 찾아야 한다 며 아파텔 전원주택 타운하우스 등 틈새상품은 결국 상승기에만 유리하다 고 설명했다. 그는 또 매입가격을 낮춰야 가격이 떨어져도 손해를 덜 본다 며 급매물이나 경매 분양가상한제 아파트 등을 노리는 것도 매입가격을 낮추는 방법 이라고 소개했다. 올해는 고정관념 깨진 해 박 연구소장은 올해는 과거 투자소외지역의 집값이 많이 올랐다 며 의정부가 14%나 오를 지 예전엔 누가 알았겠냐 며 그동안의 고정관념이 산산이 깨진 것 이라고 말했다. 이어 그는 결과적으로는 강남이 상대적으로 과거에 비해 값이 떨어진 셈 이라며 올 연말에 집 갈아타기를 위해 투자하려면 강남지역 집도 괜찮으며 버블세븐과 붙어볼 만 하다 고 덧붙였다. 박원갑 소장이 추천하는 투자방법은 우선 유망투자지역을 고른 후 투자시에는 매입가격을 낮추는 것이다. 유망투자지역을 고를 때에는 블루칩과 잡주를 구분하는 것도 중요하지만 수익률은 별개라는 점을 감안해야 한다. 특히 올해 강북의 집값 상승 수준이 강남을 추월한 것이 그 실례다. 일단 투자지역을 골랐으면 매입가격을 최대한 낮춰 투자해야 한다. 이를 위해 박 소장은 그물을 치라 고 조언한다. 박 소장은 후보지를 골랐으면 그물을 쳐서 맘에 드는 싼 곳을 골라 투자해야 한다 며 발품을 얼마나 파느냐가 성패를 좌우할 것 이라고 강조했다.,https://news.naver.com/main/read.nhn?mode=LSD&mid=shm&sid1=260&oid=008&aid=0000855161,98
70664,2007.11.22. 오후 12:32,부동산,이데일리,재테크광고알짜토지 5필지 한정매각,이데일리 주식이 연일 하락하는 시점에서 곧 있으면 10만원 짜리 고액 화폐권이 나올 예정이다. 언제나 그랬듯이 화폐 개혁이 이루어 지고 나면 물가 상승은 수반 되는 것이었다. 특히 땅값에 대한 상승은 물 보듯 뻔한 사실로 지금까지 여겨져 왔다. 이 시점에서 눈 여겨 볼 만한 땅이 이목을 집중시킨다. 주 충주호 전원개발은 충청북도 제천시 수산면 일대에 1차 2차 대분할 필지를 100%분양 마감했고 현재 고객분들의 성원에 힘입어 최종 마감으로 5필지를 한정매각한다. 주 충주호 전원개발 관계자에 의하면 현 투자 고객중 90%이상이 주식에서 토지 투자로 전향 한 것으로 나타났다 현 추세로 미루어 토지투자가 더욱 가속화 될 것으로 보이며. 그 가운데 가장 눈에 띄는 곳은 제천시로써 과거 낙후했던 지역 경제를 살리기 위해 수산면 일대 온천 레져단지 50만평 제천 리조트 단지 봉양 리조트 단지 제천 바이오 밸리 백운 특호단지 장평유통단지 영어 마을 온천단지 등 약 700만평이 계획 실행 중으로 투자처로 주목받고 있다. 자체 개발부지는 기초 공사 후 3.3㎡당 50 55만원으로 책정되어 있으며 내년 봄에 분양할 것으로 밝혔고 금일 매각분은 순수 토지금액으로 3.3㎡당 55 000원 119 000원으로 형성되어있어 향후 다양한 목적으로 사용함과 동시에 저렴한 비용으로 매입이 가능하며 토지거래허가 제외지역으로 투자가치가 주목된다. 제천시가 추진하는 관광개발사업과 지역특화사업이 완료 된다면 향후 제천시 토지 시세의 지각 변동은 예외 없는 사실로 투자자의 선견지명이 필요하다 교통망은 제천IC와 남제천 IC가 있고 동서 고속도로 서울에서 제천을 잇는 중앙선 복선전철 행정 도시와 연결 되는 청원 충주간 도로가 개통될 예정이다 분양절차 신청금 100만원 신한은행 110 222 037890 예금주 조현묵 법무사 필지 배정 현장 방문 계약 소유권이전등기 및 자금 관리는 조현묵 법무사에서 책임 관리 하며 회사보유분 필지로 즉시 소유권이전이 가능하다.,https://news.naver.com/main/read.nhn?mode=LSD&mid=shm&sid1=260&oid=018&aid=0000539187,98
