,date,cat,co,headline,text,url,week
80655,2008.03.04. 오전 5:12,부동산,파이낸셜뉴스,참여정부 땅보상금 103兆,참여정부 5년 동안 신도시 등 택지개발사업과 행정중심복합도시를 비롯한 지역균형발전 사업 등 각종 공공사업 추진에 투입된 보상금이 100조원을 넘는 것으로 나타났다. 지난해에도 당초 예상보다 4조원가량 많은 29조6000억원의 토지보상금이 풀린 것으로 추산됐다. 3일 국토해양부가 국회 건설교통위원회에 제출한 자료에 따르면 지난해 지급된 토지보상금은 29조6182억원으로 추산됐다. 보상금은 택지개발 도로건설 공업·산업단지 건설 댐 건설 등을 하면서 토지보상금·지장물보상금·영업보상금·이주대책비 등의 형태로 지급된다. 이에 따라 참여정부 5년간 풀린 보상금 총액은 103조184억원에 달한다. 이는 정부가 대규모 택지개발사업을 추진하면서 보상금을 대거 지급했기 때문으로 분석된다. 하지만 부동산투기방지대책의 일환으로 도입된 채권보상 대토보상 등은 효과가 미미한 것으로 나타났다. 채권보상은 1991년 도입돼 토지소유자가 원할 경우 보상금을 채권으로 지급하는 방식으로 참여정부 들어 실효성을 높이기 위해 보완했지만 지금까지 소유자가 채권보상을 희망한 경우는 단 한 건도 없었다. 지난해 11월부터 시행한 대토보상 역시 실적이 작은 것으로 나타났다. 현재까지 대토보상은 경기 양주 옥정지구 400억원에 대해서만 이루어졌다. 이는 애초 사업시행자인 한국토지공사가 대토보상 공급규모를 4000억원으로 책정했던 것에 비하면 10% 수준에 불과하고 보상금 총액 1조6000억원 에 비해서는 2.5% 정도다.,https://news.naver.com/main/read.nhn?mode=LSD&mid=shm&sid1=260&oid=014&aid=0001949008,113
80656,2008.03.05. 오후 9:43,부동산,아시아경제,뚝섬 한숲 e편한세상 2순위서 2명 청약,대림산업이 분양하는 뚝섬 주상복합아파트 한숲 e 편한세상 의 2순위 청약 접수에 2명이 신청했다. 5일 금융결제원에 따르면 이날 진행된 서울 성동구 뚝섬 3구역 한숲 e 편한세상 총 196가구 2순위 청약 접수에서 2명이 추가 신청하는데 그쳤다.,https://news.naver.com/main/read.nhn?mode=LSD&mid=shm&sid1=260&oid=277&aid=0001952889,113
80657,2008.03.05. 오후 9:16,부동산,한겨레,‘강남 보란 듯’ 강북 소형 집값 ‘뜀뛰기’,한겨레 수도권 일대 소형 아파트값 상승세가 심상치 않다. 새해 들어 서울 강북지역에서 소형 아파트와 연립 다세대 집값이 오름세를 보이더니 최근에는 수도권 일대로 상승세가 확산되는 분위기다. 10 20평대 소형의 매맷값이 지난해 연말에 견줘 1천만 2천만원 이상 오른 곳이 수두룩할 정도다. 연초부터 물가가 오르고 집값도 뛰어오르면서 무주택 서민들의 시름이 깊어지고 있다. 어디가 오르나 서울 강북에서는 노원구의 집값 상승세가 거침없다. 국민은행 조사 결과 노원구 집값은 새해 두달간 4.3% 올라 서울시내에서 상승률이 가장 높았다. 노원구 집값 상승세의 진원지는 상계동 일대다. 지난 두 달 동안 20평대 매맷값이 3천만 4천만원 정도 올라 85㎡ 25평 이하 소형이 처음으로 3.3㎡당 1천만원대를 넘어섰다. 주공7단지 79㎡ 23평 형의 경우 최고 호가가 2억9천만원까지 치솟았고 59㎡ 17평 은 1억8천만원에 거래되고 있다. 상계동 서울공인중개사사무소 유선화 사장은 “운전면허시험장과 창동 차량기지국이 옮겨가고 개발된다는 소식에 7단지와 10단지 물건이 동나더니 주변 지역으로 오름세가 파급됐다”면서 “실수요자뿐만 아니라 임대사업자도 물건이 나오는대로 매수하고 있다”고 말했다. 지난달부터는 서울 출퇴근이 가능한 수도권 일대 소형 아파트 밀집지역 집값도 오르고 있다. 고양시 화정동 화정역 주변 달빛마을 70㎡ 21평 은 지난해 말까지 1억3천만원선에 거래됐으나 최근 1억5천만원으로 2천만원 정도 올랐다. 광명시 하안동 주공아파트 56㎡ 16평 은 1억6500만원으로 한달새 1천만원 이상 올랐다. 일선 중개업소 관계자들은 “집값이 오르자 집주인들이 좀더 기다려보자며 매물을 거둬들이고 있다”며 “전셋집을 구하려던 신혼부부가 대출을 받아서라도 사겠다고 나서는 경우도 많다”고 전했다. 소형 집값 껑충 왜 강북과 수도권 일대 소형 평수 집값이 오르는 데 대해 부동산업계에서는 몇 가지 요인이 복합적으로 작용한 것으로 진단한다. 서울 강북의 경우 경전철 사업과 곳곳에서 진행되는 재개발로 전셋집 품귀 현상이 발생하면서 집값까지 밀어올린 것으로 풀이된다. 전세금이 오르자 불안해진 실수요자들이 소형 주택을 매입하는 쪽으로 돌아섰다는 것이다. 임대주택 사업자들이 늘어나고 있는 것도 한 원인이다. 소형 주택을 매입해 임대사업을 하면 금리를 웃도는 임대수익과 함께 시세차익도 노릴 수 있기 때문이다. 박상언 유앤알컨설팅 대표는 “전용 85㎡ 이하 다섯채를 임대하다 매각해 세금을 감면받을 수 있는 주택 임대사업에 관심을 갖는 사람들이 부쩍 늘어났다”며 “임대사업용으로는 매맷값에 비해 전세금이 높은 역세권의 소형 평수 아파트 다세대주택이 선호된다”고 말했다. 이와 함께 신규 주택 분양시장에서 소형 평수 공급이 부족해진 것도 소형주택 집값 상승의 원인으로 꼽힌다. 고양시 식사지구나 덕이지구 등 최근 대규모 아파트 공급이 이뤄진 민간 택지지구는 미분양이 수두룩한데도 20평대가 한 채도 없는 곳이 많다. 건설업체들이 수익성이 높은 30평대 이상 중대형 위주로 지으면서 소형주택 분양을 외면하고 있는 탓이다. 전문가들은 이사철을 앞두고 계약이 마무리된 이달 이후에는 소형 아파트값 상승세가 한풀 꺾일 것으로 예상하고 있다. 그러나 불씨는 계속 남아있을 것이라고 우려한다. 김규정 부동산114 차장은 “당분간 수급 불균형으로 인한 ‘중대형 약세 소형 강세’ 현상은 지속될 것”이라며 “특히 하반기로 예정된 새 정부의 규제완화 정책과 맞물릴 경우 중소형 집값이 또다시 요동칠 수 있다”고 말했다. 최종훈 송창석 기자 cjhoon hani.co.kr ⓒ 한겨레 hp www.hani.co.kr 무단전재 및 재배포 금지 신뢰도 1위 믿을 수 있는 언론 한겨레 구독신청 하기 한겨레는 한국온라인신문협회 www.kona.or.kr 의 디지털뉴스이용규칙에 따른 저작권을 행사합니다.,https://news.naver.com/main/read.nhn?mode=LSD&mid=shm&sid1=260&oid=028&aid=0001942459,113
80658,2008.03.05. 오후 9:11,부동산,매일경제,행정도시 주변 단독주택 규제 완화,충남 연기ㆍ공주지역에 건설 중인 행정도시 주변 지역에 대한 단독주택신ㆍ증축 규제가 완화된다. 행정중심복합도시건설청은 최근 임시국회에서 이 같은 내용을 담은 행정도시건설특별법개정법률안 이 통과됨에 따라 지난달 29일부터 시행한다고 4일 밝혔다. 개정안에 따르면 우선 공부상 지목이 대 인 토지나 기존 노후주택을 철거한 용지에서는 연면적 합계가 200㎡ 미만에서 단독주택 신축이 가능해진다. 또 기존 단독주택을 증축할 때에도 연면적 합계 기준으로 기존 주택 면적을 포함해 기존 100㎡ 이하에서 200㎡ 미만 규모로 증축 허용 면적이 확대된다. 다만 건설청은 지난달 29일 이후부터는 하나의 대지 를 여러 필지로 분할할 때 이를 하나의 대지 로 판단하고 기존 대지를 여러 필지로 분할해 다수의 주택을 신축하는 투기적인 행위를 사전에 방지했다. 이번 개정안은 행정도시 주변지역 내 개발제한구역과 상수원보호구역을 제외한 지역에서 신ㆍ증축이 허용된다고 건설청은 설명했다.,https://news.naver.com/main/read.nhn?mode=LSD&mid=shm&sid1=260&oid=009&aid=0001949255,113
80659,2008.03.05. 오후 9:05,부동산,이데일리,한숲 e편한세상 2순위 2명 추가청약,이데일리 윤도진기자 대림산업이 서울 뚝섬에서 분양 중인 한숲e 편한세상 2순위 청약에 2명이 추가로 신청했다. 5일 금융결제원에 따르면 이날 진행된 서울 성동구 성수동 뚝섬3구역 한숲 e 편한세상 196가구에 대한 2순위 모집에는 331㎡A형과 331㎡B형에 각 1명씩의 청약신청이 추가됐다. 지난 3일 특별공급을 시작으로 사흘째까지 청약접수자는 1순위 1명을 포함해 총 3명이다. 오는 6일에는 3순위 청약이 이어진다. 이 아파트는 331㎡ 단일평형 196가구가 들어서며 3.3㎡당 분양가는 3856만 4594만원이다.,https://news.naver.com/main/read.nhn?mode=LSD&mid=shm&sid1=260&oid=018&aid=0001950565,113
80660,2008.03.05. 오후 8:37,부동산,머니투데이,뚝섬 한숲 e편한세상 2순위서 2명 청약,머니투데이 정진우 기자 1·2순위 합계 3명 청약...청약률 1.5% 기록 ↑ 뚝섬 한숲 e 편한세상 조감도 서울 성동구 뚝섬 상업용지 주상복합아파트 한숲 e 편한세상 2순위 청약 접수에서 2명이 신청 5일 오후 8시30분 현재 193가구가 미달된 것으로 집계됐다. 5일 금융결제원에 따르면 이날 오전 9시부터 오후6시까지 실시된 서울 성동구 뚝섬 3구역 한숲 e 편한세상 2순위 청약 접수 196가구 모집 에서 331A㎡형에 1명 331B㎡형에 1명 등 2명만 신청했다. 지난 3일 무주택자를 대상으로 실시한 특별공급에서는 단 한명도 청약하지 않았고 4일 1순위 청약에서는 331A㎡형에 1명만 청약했다. 대림산업은 6일 3순위 청약을 실시할 예정이다. 이후 미분양 물량은 순위별 청약자들의 계약이 끝나는 3월 중순이후 이른바 4순위족에 재분양된다. 한숲 e 편한세상 은 지하7층 지상51층 높이의 초고층 아파트 2개동과 33층짜리 오피스 1개동 지상5층 높이의 아트센터 1개동으로 구성된다. 아파트 196가구는 모두 331㎡ 단일 주택형으로 이뤄진다. 3.3㎡당 분양가는 3856만 4594만원이다. 한숲 e 편한세상 은 오는 2011년 6월에 완공될 예정이다.,https://news.naver.com/main/read.nhn?mode=LSD&mid=shm&sid1=260&oid=008&aid=0001954149,113
80661,2008.03.05. 오후 7:54,부동산,뉴시스,대체‘울산 문수로 2차 아이파크’ 1.2순위 청약 0.59대1,서울 뉴시스 현대산업개발이 울산 남구 신정동에서 분양중인 ‘울산 문수로 2차 아이파크’의 1·2순위 청약접수률이 0.59대1을 기록했다. 5일 금융결제원에 따르면 지난 3일과 4일 실시한 울산 문수로 2차 아이파크 의 1·2순위 청약접수에서 880가구 모집에 526명이 청약에 나서 0.597대1의 높은 청약률을 기록했다. 반면 1단지 132.95B㎡와 2단지 264.342㎡의 경우 각각 51가구와 3가구를 모집했으나 2순위까지 신청자가 한명도 없었다. 이외에도 1단지 150.571㎡의 경우 157가구 모집에 39명만이 신청해 118가구가 주인을 찾지 못했다. 또 1단지 150.006㎡ 2단지 150.392㎡ 2단지 133.299B㎡의 경우 각각 124가구 112가구 48가구를 모집하고 있으나 신청자는 9명 6명 1명에 그쳤다. 현대산업개발 관계자는 “분양이 아직 끝난 게 아니기 때문에 속단하기는 이르다”며 “3순위 접수 결과가 나와야 정확한 전체 청약률이 집계될 것이다”고 말했다. 한편 울산 문수로2차 아이파크는 5일 3순위 청약을 마감했으며 오는 11일 당첨자가 발표된다.,https://news.naver.com/main/read.nhn?mode=LSD&mid=shm&sid1=260&oid=003&aid=0001990776,113
80662,2008.03.05. 오후 6:32,부동산,한국경제,노원구 첫 재건축단지 나온다,1980년대 말께 대규모 아파트촌으로 개발된 서울 노원구 일대에 최초의 재건축 아파트가 탄생한다. 노원구는 5일 공릉동 태릉 현대아파트에 대해 서울시 건축심의를 거쳐 내달 중 재건축 사업시행 인가를 내줄 방침이라고 밝혔다. 이에 따라 현재 태릉 현대아파트가 들어선 공릉동 230 일대 4만8992㎡ 부지에는 214%의 용적률을 적용해 지하 3층 지상 25층짜리 9개동 935가구 임대 136가구 포함 의 아파트가 새로 지어진다.주택 유형별 가구 수는 59㎡형 213가구 84㎡형 381가구 120㎡형 218가구 142㎡형 81가구 151㎡형 42가구 등이다. 이르면 5월께 공사에 들어가 2010년까지 준공해 입주가 이뤄질 전망이다.새로 지어질 아파트는 외관과 단지 형태를 탑상형 별모양 삼각형 사각형 등 네 가지로 다양화해 기존 단지들과 완전히 차별화했다는 게 구청 측 설명이다.스카이라인도 도로변은 14 18층으로 낮추는 대신 중심부는 24 25층으로 높여 완만한 곡선 형상으로 구성됐다. 또 중앙광장에는 계단형 벽천분수 공연장 휴게시설 등 다양한 생활문화시설을 설치해 입주자 편의성을 높였다. 조망권 확보를 위해 광장을 중심으로 방사선 구조로 건물을 배치했다.주차장을 모두 지하에 배치해 지상공간 전체를 녹지로 만드는 등 단지의 쾌적성 향상에 많은 신경을 썼다.노원구 관계자는 이번 현대아파트 재건축을 계기로 월계동 인덕마을 등 5개 구역 2279가구의 재건축 사업도 탄력을 받을 것 이라고 말했다.,https://news.naver.com/main/read.nhn?mode=LSD&mid=shm&sid1=260&oid=015&aid=0001948292,113
80663,2008.03.05. 오후 6:32,부동산,한국경제,연립 · 다세대 경매 식지않는 인기,법원 경매시장에서 서울.수도권 연립.다세대주택의 인기가 작년에 이어 1년 이상 지속되고 있다.투자자들이 몰리면서 경매 낙찰가가 법원 감정가를 웃도는 상태가 속출하고 있다. 5일 법원경매정보업체 디지털태인에 따르면 지난달 서울.수도권 연립.다세대주택의 낙찰가율 감정가 대비 낙찰가 은 104.34%로 1월의 103.21%보다 높아졌다. 연립.다세대 낙찰가율은 지난해 3월 108.79%를 나타낸 이후 지난달까지 1년간 103 112% 사이를 오르내리며 한 번도 100% 이하로 떨어지지 않았다. 낙찰가율이 100%를 넘었다는 것은 경매물건이 법원 감정가보다 높은 값에 팔렸다는 의미다. 지난 1년간 입찰 경쟁률도 7.5 9 대 1로 서울.수도권 경매 평균 경쟁률인 4.7 5.8 대 1을 훨씬 웃돈다. 다만 서울.수도권의 연립.다세대주택 경매물건은 줄어드는 추세다.작년 4월 1580건으로 고점을 찍은 뒤 줄곧 감소세를 보여 지난달에는 692개로 줄었다. 연립.다세대주택의 인기가 지속되고 있는 것은 아파트보다 가격이 낮아 소액투자가 가능한 데다 재건축과 뉴타운 지정 등 각종 개발계획이 발표되면서 가격상승 기대감도 높아졌기 때문이다. 이영진 디지털태인 이사는 아파트나 토지 등의 투자는 규제가 많아 쉽지 않은 반면 법원경매는 별도 규제가 없어 접근이 쉬운 데다 최근 서울.수도권에서는 재개발.재건축사업이 활기를 띠고 있어 다세대.연립주택 경매가 주목을 받고 있다 고 말했다.,https://news.naver.com/main/read.nhn?mode=LSD&mid=shm&sid1=260&oid=015&aid=0001948291,113
80664,2008.03.05. 오후 6:31,부동산,매일경제,파주 신안실크밸리 2차분 공급,image0 신안건설산업 대표이사 우경선 은 경기 파주시 아동동에 신안실크밸리 2차분을 분양한다. 지하 2층 지상 15층 9개동 438가구 규모다. 113 187㎡로 구성된다. 지난해 분양을 마친 1차 539가구를 포함하면 977가구 향후 분양할 3차까지 포함하면 모두 1300여 가구 대단지로 조성된다. 가변형 벽체를 설치해 거실을 넓게 쓸 수 있다. 단지 내에 눈썰매장 미니암벽등반장 바비큐 파티시설 물놀이시설 골프퍼팅시설 산책코스 등이 마련된다. 금촌역과 도보 4분 거리에 있고 서울 및 수도권 직행 버스노선도 12개로 교통이 편리하다. 올 연말 경의선 복선 전철화 사업이 완료되면 서울 생활권 프리미엄도 누릴 수 있을 것으로 기대된다.,https://news.naver.com/main/read.nhn?mode=LSD&mid=shm&sid1=260&oid=009&aid=0001949164,113
80665,2008.03.05. 오후 6:31,부동산,매일경제,타운하우스 분양 꽃 핀다,image0 전원주택과 아파트의 장점을 결합한 타운하우스가 주목을 끌면서 분양시장에서도 인기 상품으로 부상하고 있다. 이에 따라 최근 분양 물량도 큰 폭으로 늘고 있다. 5일 부동산정보업체인 내집마련정보사에 따르면 올해 분양할 타운하우스는 총 23곳 1271가구인 것으로 조사됐다. 특히 용인 동백과 보라 흥덕지구 등 12곳에서는 전체 중 절반이 넘는 704가구가 공급된다. 파주시에는 3곳 230가구 동탄에서는 4곳 196가구가 분양될 예정이다. 시기별로는 3월에 집중돼 총 8곳에서 601가구에 달한다. 동원시스템즈는 용인시 동백지구와 보라지구 언남동 3곳에서 타운하우스를 이달 분양한다. 동백지구 E2블록에는 198 297㎡ 26가구 보라지구 1 1블록 214 264㎡ 36가구 언남동 165㎡ 48가구로 총 110가구다. 서울에서도 타운하우스가 등장한다. 쌍용건설은 종로구 평창동에 19가구를 분양할 계획이다. 롯데건설은 동탄 반송동에서 다음달쯤 타운하우스를 공급한다. 235 324㎡ 36가구며 단독주택형으로 건립한다. 또 흥덕지구 280블록에 500 507㎡ 17가구를 분양한다. 우남건설도 흥덕지구 278블록에 426㎡ 19가구를 5월에 선보인다. LIG건영은 과천시 문원동에 231 449㎡ 46가구 중흥건설은 고양시 행신2지구 D 4블록에 106㎡ 단일 면적으로 102가구를 4 5월께 분양할 계획이다. 극동건설은 죽전지구 3곳에서 올해 총 115가구를 공급한다. 13 11블록에서 263 294㎡ 36가구 13 7과 15블록에서는 189 282㎡ 60가구 죽전동 1267 일대에는 231 262㎡ 19가구를 분양한다. 내집마련정보사 양지영 팀장은 타운하우스를 매입하기 전에 편의시설과 교통 등 불편이 뒤따를 수 있기 때문에 입지 여건을 꼼꼼히 따져봐야 한다 고 말했다.,https://news.naver.com/main/read.nhn?mode=LSD&mid=shm&sid1=260&oid=009&aid=0001949160,113
80666,2008.03.05. 오후 6:31,부동산,매일경제,성원산업개발 키르기스스탄 SOC사업 참여,성원건설 계열 성원산업개발이 187㏊ 규모 신도시 건설 등 키르기스스탄 SOC사업에 참여한다. 성원산업개발은 5일 키르기스스탄 3대 SOC사업 중 신도시 건설과 쓰레기 분류사업 등 2개 프로젝트 주관사로 선정됐다고 밝혔다. 이 사업은 우리은행을 주관사로 성원산업개발 등이 참여하는 한국컨소시엄이 주도하는 프로젝트. 성원산업개발은 SOC사업 주관사로 선정됨에 따라 키르기스스탄 측과 공동 TF를 구성해 사업을 단계적으로 추진할 계획이다.,https://news.naver.com/main/read.nhn?mode=LSD&mid=shm&sid1=260&oid=009&aid=0001949158,113
80667,2008.03.05. 오후 6:31,부동산,매일경제,부동산금융 전문가 과정 수강생 모집,한국생산성본부에서는 부동산금융전문가 과정을 개설하고 수강생을 모집한다. 주요 내용은 부동산 금융의 핵심인 주택금융 분석 수익용 부동산의 감정평가 및 투자 분석 등이다. 강의는 19일부터 21일까지 생산성본부 강의실에서 한다. 교육비는 42만원 선착순 60명을 모집한다. 한편 부동산강제집행 경매 실무 주간 과정은 17 19일이며 교육비는 42만원이다.,https://news.naver.com/main/read.nhn?mode=LSD&mid=shm&sid1=260&oid=009&aid=0001949157,113
80668,2008.03.05. 오후 6:31,부동산,매일경제,부산 사직 쌍용예가 330가구 일반분양,image0 쌍용건설은 7일부터 부산시 동래구 사직동 600 8 일대에서 사직2차 쌍용예가 625가구 중 조합원분을 제외한 330가구를 분양한다. 면적은 107.99 198.32㎡이며 3.3㎡당 분양가는 760만 990만원대. 지상 25층 8개동 규모로 2010년 입주를 시작하며 모든 가구에 중도금의 60%까지 이자후불제가 적용된다.,https://news.naver.com/main/read.nhn?mode=LSD&mid=shm&sid1=260&oid=009&aid=0001949155,113
80669,2008.03.05. 오후 6:15,부동산,경향신문,한화 명품 아파트 시장 도전장…뚝섬 ‘갤러리아 포레’ 분양,한화건설이 ‘갤러리아 포레 Galleria Foret ’를 통해 명품 주거 브랜드 시장에 도전장을 내민다. 갤러리아 포레는 서울숲 주상복합아파트에 적용되는 이름으로 최상급 주거 문화를 상징하기 위해 한화건설이 도입한 브랜드다. ‘갤러리아 Galleria ’는 한화그룹의 백화점 브랜드인 갤러리아의 고품격 이미지와 상류층 생활 스타일의 커뮤니티를 상징한다. 프랑스어로 숲을 의미하는 ‘포레 Foret ’는 서울 최대 규모의 녹지공간인 서울숲 안에 자리잡은 친환경 주거 프리미엄을 의미한다. 한화건설은 뚝섬 1구역 주상복합아파트 ‘갤러리아 포레’ 233 377㎡ 총 230가구·조감도 에 대해 7일 특별공급을 시작으로 10일부터 1순위 청약접수를 받는다. 당첨자 발표는 18일 계약일은 25 27일이다. 전가구 남향으로 지어지는 갤러리아 포레는 거실 3면 어디에서든 서울숲과 한강이 한 눈에 보이도록 설계되며 저층부 6 12층 는 각 가구별 개별 테라스 도입으로 서울숲을 개인 정원처럼 소유하는 느낌을 받을 수 있게 된다. 한화건설은 이곳에 ‘갤러리아’의 의미를 강조하기 위해 ‘디자인’ 수준을 높였다. 프랑스의 대표적인 현대건축가 장 누벨 Jean Nouvel 이 내부 인테리어를 직접 디자인했다. 빛의 건축가로 유명한 장 누벨은 프랑스 아랍문화원 스페인 아그바타워 한국의 리움미술관 등을 설계했다. 숲 속에 자리잡은 유럽의 고성 古城 을 연상시키는 조명 디자인도 독특하다. 이와 함께 한화건설은 주거 조경 분야의 세계적 권위자로 손꼽히는 마시모 Massimo Venturi Frriolo 교수와 함께 서울숲을 최대한 활용한 친환경 조경 공간도 선보일 예정이다. 〈 박재현기자 〉 대한민국 희망언론 경향신문 내손안의 모바일 경향 “상상” 1223 NATE ⓒ 경향신문 경향닷컴 www.khan.co.kr 무단전재 및 재배포 금지 〈경향닷컴은 한국온라인신문협회 www.kona.or.kr 의 디지털뉴스이용규칙에 따른 저작권을 행사합니다.,https://news.naver.com/main/read.nhn?mode=LSD&mid=shm&sid1=260&oid=032&aid=0001943977,113
80670,2008.03.05. 오후 6:12,부동산,파이낸셜뉴스,부동산개발협회 출범,한국부동산개발협회는 5일 서울 강남구 논현동 건설회관에서 100여명의 발기인과 각계 인사들이 참석한 가운데 창립총회를 갖고 부동산 개발업 분야의 조사 및 연구 전문인력 양성 등 본격 업무에 들어갔다. 이날 총회에서 협회 초대 회장에 정춘보 신영 대표이사가 명예회장에는 백종헌 ㈜프라임개발 회장이 각각 추대 형식으로 선임됐다.,https://news.naver.com/main/read.nhn?mode=LSD&mid=shm&sid1=260&oid=014&aid=0001949994,113
80671,2008.03.05. 오후 6:09,부동산,파이낸셜뉴스,분양정보 뚝섬 ‘갤러리아 포레’ 230가구 7일 청약,한화건설이 서울 성동구 뚝섬 상업용지 1구역에 짓는 고급 주상복합아파트 ‘갤러리아 포레’ 230가구 조감도 가 7일부터 청약에 들어간다. 갤러리아포레는 지하 7층 지상 45층짜리 2개 동에 233∼377㎡ 230가구로 구성되며 부대시설로 극장과 공연시설 등이 들어선다. 이 아파트는 전 가구가 남향으로 배치돼 한강과 서울숲 조망이 가능하다. 특히 거실에서는 3면이 내려다보여 마치 자연속에 있는 듯한 느낌을 준다. 4층에 조성되는 옥상정원을 비롯한 주민커뮤니티시설에서도 외부 조망이 가능하도록 설계돼 새로운 명소로 떠오를 전망이다. 지하철 2호선 뚝섬역이 가깝고 신분당선 신성수역이 2010년 완공되면 압구정동 갤러리아 백화점과 지하철 5개 노선의 환승이 가능한 왕십리 민자역사와도 곧바로 연결된다. 업무시설이 집중되어 있는 테헤란로까지는 10분대에 진입할 수 있는 등 사통팔달의 교통여건을 갖추고 있다. 분양일정은 7일 특별공급을 시작으로 10일부터 1순위 청약접수를 시작한다. 당첨자 발표는 3월18일 계약은 25∼27일이다.,https://news.naver.com/main/read.nhn?mode=LSD&mid=shm&sid1=260&oid=014&aid=0001949989,113
