,date,cat,co,headline,text,url,week
89480,2008.05.28. 오후 4:44,부동산,뉴시스,오세훈 시장 뉴타운 수정 필요  발언 의미는,오세훈 시장 외대 미네르바포럼 특강 서울 뉴시스 이명박 대통령이 서울시장 재임시절 중점 추진했던 뉴타운사업에 대해 오세훈 서울시장이 28일 수정이 불가피하다 는 취지의 발언을 내놓으면서 그 의미에 관심이 쏠리고 있다. 오세훈 시장은 28일 오전 중구 조선호텔에서 열린 외대 미네르바포럼에 참석 전임 시장이 해놓은 것을 바꾸는 것이 불경스럽긴 하지만 뉴타운 사업을 수정해야 한다 고 말했다. 오 시장은 특히 뉴타운 사업을 180도 바꾸기는 어렵겠지만 수정을 해야 한다 며 29일 첫 회의를 갖는 뉴타운정책자문단을 의식한 듯 현재 검토 작업을 진행 중 이라고 설명했다. 뉴타운정책자문단이라고 불리는 서울시의 주거환경개선 정책 자문단 은 뉴타운사업과 재개발·재건축 등 기존 주거환경 개선정책에 대한 평가를 통해 개선방안을 마련하기 위해 꾸려졌다. 오 시장은 앞서 21일 CBS 라디오 김현정의 뉴스쇼 에 출연해 6개월 정도 시한을 두고 뉴타운에 대한 찬성·반대론자 등과 함께 대안을 만들어 보안점을 반영하겠다 고 밝힌 바 있다. 이같은 오 시장의 발언에 대해 서울시 고위 관계자는 모든 정책은 여건과 환경의 변화에 따라 개선돼 나가야 한다는 취지 라며 진화하는 뉴타운의 필요성을 밝힌 것 이라고 설명했다. 그는 이어 오 시장은 기존 아파트 일변도의 사업은 적절하지 않다고 생각하고 있다 며 다양한 주거형태를 도입하는 등 현 뉴타운이 갖고 있는 문제점을 개선해 나가겠다는 취지 라고 강조했다. 서울시가 난개발 등의 문제를 해소하겠다는 취지 아래 2002년 시작한 뉴타운사업은 간단히 말하면 여러 개발 사업을 하나로 묶어 추진하는 주거환경개선사업 이다.,https://news.naver.com/main/read.nhn?mode=LSD&mid=shm&sid1=260&oid=003&aid=0002113238,125
89481,2008.05.28. 오후 4:39,부동산,파이낸셜뉴스,1분기 수송실적 소폭 감소,계절적 증감 요인을 제외할 경우 지난 1분기 수송실적이 전분기에 비해 소폭 줄었다. 한국교통연구원은 올 1분기 국내 여객 분야 교통산업서비스지수 TSI 가 전분기 107.2 에 비해 소폭 하락한 106.6을 기록했다고 28일 밝혔다. TSI는 계절적 증감 요인을 제거한 상태에서 철도 항공 해운 등 수송실적을 수치화한 것이다. 따라서 지수가 하락했다는 것은 조건이 동일할 경우 전 분기에 비해 수송실적이 줄었다는 것을 의미한다. 분야별로는 항공이 82.0으로 전분기보다 1.2 포인트 올랐고 지하철과 철도는 각각 127.6 100.0으로 전분기보다 1.1 포인트 1.7 포인트 낮아졌다. 반면 국제 여객분야는 해외 여행객 증가로 인해 지난해 4분기 166.0에서 173.4로 4.5% 상승했다.,https://news.naver.com/main/read.nhn?mode=LSD&mid=shm&sid1=260&oid=014&aid=0001980878,125
89482,2008.05.28. 오후 4:37,부동산,아시아경제,오세훈시장 MB식 뉴타운 수정하겠다,오세훈 서울시장은 28일 이명박 대통령이 서울시장 재직시절 지정해 현재 추진 중인 1∼3차 뉴타운을 수정해야한다고 밝혔다.오 시장은 이날 서울 소공동 웨스틴조선호텔에서 열린 제8회 세계외대 미네르바 포럼 오세훈 서울시장 초청 강연회 에서 이 같이 밝히고 전임 시장 이명박 대통령 이 해놓은 것을 바꾸는 것이 조금 불경스럽고 기존 서울시 뉴타운 사업을 180도 완전히 바꾸기는 어렵겠지만 수정을 해야한다 고 거듭 강조했다.,https://news.naver.com/main/read.nhn?mode=LSD&mid=shm&sid1=260&oid=277&aid=0001985055,125
89483,2008.05.28. 오후 3:59,부동산,이데일리,토공노조 통합반대광고..주공 발끈,토공노조 사람만 남은 주공과의 통합은 의미 없다 토공 주공 통합은 부실화 ..주공 악의적 광고 반발 이데일리 윤진섭기자 한국토지공사와 대한주택공사가 통합 문제를 놓고 신경전을 벌이고 있다. 토공 노동조합이 일간신문에 통합에 반대한다는 광고를 게재한 게 발단이다. 토공 노동조합은 28일 일간신문에 토공·주공 통합은 너무나 위험한 발상입니다 라는 제목의 광고를 실었다. 주공이 발끈한 데는 토공 노조가 광고를 통해 주공을 부실 공기업처럼 표현한 대목. 노조는 광고를 통해 사람만 남은 주공과의 통합은 실용도 효율도 아닙니다 라며 주택공사...사람 밖에 없는 기업을 누가 사겠느냐.. 라는 청와대 수석의 인터뷰 내용을 같이 실었다. 또 노조는 토공·주공 통합은 동반 부실을 가져와.. 라고 밝혀 주공이 재무적으로 부실하다는 점을 강조했다. 아울러 노조는 토공과 주공이 통합 될 경우 통합비용과 택지조성원가 등이 아파트 분양가에 전가돼 아파트 가격 폭등을 초래할 것이라고 밝혔다. 이 같은 광고를 게재한 것에 대해 노조 관계자는 각 부문별로 전문화되는 상황에서 통합은 시대 흐름을 역행하는 것 이라며 법 근거에 따라 주택공급 주공 과 택지개발 토공 업무는 분업화돼야 한다 고 말했다 또 그는 주택공사가 부실하다는 것은 이미 알려진 사실이다. 양 공기업이 통합될 경우 동반 부실화되는 것은 불을 보듯 뻔하다 라며 주공이 통합에 찬성하는 만큼 주공과의 전면전은 불가피하다 고 전했다. 이 광고에 대해 주공은 자기만 살기 위해 남을 깎아내리는 악의적인 의도가 있다 며 반발하고 나섰다. 주공 관계자는 내부적으로 토공 노조의 광고에 대해 적극 대응해야 한다는 의견이 높다. 하지만 맞대응할 경우 밥 그릇 싸움으로 비춰질 것이 뻔해 대응을 자제하고 있다 고 말했다. 다만 그는 토공 노조가 이런 식의 악의적인 여론몰이를 계속할 경우 주공 역시 맞대응할 수밖에 없다 고 덧붙였다. 또 다른 주공 관계자도 정부 정책이 통합이라면 주공은 정부 정책에 따라가야 한다는 게 기본 입장 이라며 정부 정책이 공식화되지 않은 상태에서 토공 노조의 이 같은 행위는 도의가 아니다 고 불만을 표출했다. 한편 토공의 주요 업무인 택지개발사업에 민간참여를 유도하겠다는 정부 방침에 대해서도 노조는 정부가 투기를 조장하는 것 택지개발이익이 민간업체 주머니에 들어가게 될 것 이라며 강한 어조로 반대의 뜻을 내비쳤다.,https://news.naver.com/main/read.nhn?mode=LSD&mid=shm&sid1=260&oid=018&aid=0001981378,125
89484,2008.05.28. 오후 3:55,부동산,이데일리,6월 중소건설사 분양도 급감,10개사 총 5007가구 계획..작년 절반 이데일리 윤도진기자 중소건설사의 6월 주택 공급수가 작년 동월에 비해 현격하게 줄어들 전망이다. 대한주택건설협회는 오는 6월 분양에 나서는 회원업체는 모두 10개사로 총 5007가구가 분양될 계획이라고 28일 밝혔다. 이는 작년 6월 분양계획이 9846가구였던 것과 비교해 4839가구 49.1% 가 줄어든 물량이다. 지역별로 수도권에서는 총 3102가구가 공급되며 지방 광역시 및 기타도시 공급물량은 1905가구로 집계됐다. 수도권 공급물량은 경기도가 1938가구로 절반 이상을 차지했다.,https://news.naver.com/main/read.nhn?mode=LSD&mid=shm&sid1=260&oid=018&aid=0001981372,125
89485,2008.05.28. 오후 3:53,부동산,아시아경제,대우엔지니어링 신임 사장에 윤형근씨 선임,대우엔지니어링은 대표이사 사장에 윤형근 58 화공.해양사업 담당 부사장을 선임했다고 28일 밝혔다. 신임 윤 사장은 한양대학교 화학공학과를 졸업하고 전엔지니어링을 거쳐 1984년 대우엔지니어링에 입사해 화공.해양사업 부문 전무와 부사장을 역임했다.,https://news.naver.com/main/read.nhn?mode=LSD&mid=shm&sid1=260&oid=277&aid=0001985040,125
89486,2008.05.28. 오후 3:49,부동산,머니투데이,대우엔지니어링 윤형근 대표이사 선임,머니투데이 송복규 기자 한일우 전무는 부사장 승진 대우엔지니어링은 윤형근 58.사진 화공.해양사업 담당 부사장을 대표이사 사장으로 선임했다고 28일 밝혔다. 윤 사장은 한양대학교 화학공학과를 졸업했으며 1984년 대우엔지니어링에 입사했다. 입사 후에는 화공.해양사업 업무를 전담해 왔다. 대우엔지니어링은 또 한일우 전무를 부사장 에너지화공사업본부 총괄 으로 한기수 상무보를 화공사업그룹 국내담당 상무로 각각 선임했다.,https://news.naver.com/main/read.nhn?mode=LSD&mid=shm&sid1=260&oid=008&aid=0001989621,125
89487,2008.05.28. 오후 3:48,부동산,한국경제TV,포스코건설 베트남 국제항만터미널 착공,포스코건설은 오늘 28일 현지시각으로 오전 9시 베트남 붕따우에서 쩐 민 사인’ 바리아 붕따우 인민위원장 등 베트남 고위 관계자와 ‘브이 펀 쯩’ 씨엠아이티 CMIT 회장 김익희 포스코건설 부사장 삼환기업 허종 사장 등이 참석한 가운데 ‘카이멥 국제항만터미널’ 착공식을 가졌습니다. 베트남 카이멥 국제항만터미널 Cai Mep International Terminal 은 오는 2011년 완공을 목표로 연간 115만 TEU를 처리할 수 있는 규모로 건설되며 공사 수주금액은 1억1200만 달러로 포스코건설이 삼환기업과 조인트벤처 Joint Venture 형태로 참여합니다. 김익희 포스코건설 부사장은 카이멥 국제항만터미널은 국제무역이 증가하는 베트남에서 글로벌 허브항만 역할을 충실히 수행할 것으로 기대된다 고 말했습니다. 한편 카이멥 국제항만터미널이 들어서는 붕따우 지역에는 향후 배후 산업단지가 추가 조성될 예정입니다.,https://news.naver.com/main/read.nhn?mode=LSD&mid=shm&sid1=260&oid=004&aid=0001947388,125
89488,2008.05.28. 오후 3:44,부동산,한국경제TV,다음달 전국적으로 주택 3만가구 공급,국토부는 다음달중 전국적으로 3만521가구의 주택이 공급된다고 밝혔습니다. 지역별로는 수도권 1만7552가구 지방은 1만 2969가구며 유형별로는 분양주택 2만 1212가구 임대주택 4979가구 재건축·재개발 등 조합주택 4 330가구 등입니다.,https://news.naver.com/main/read.nhn?mode=LSD&mid=shm&sid1=260&oid=004&aid=0001947387,125
89489,2008.05.28. 오후 3:44,부동산,한국경제TV,판교IC 수지·분당 진출로 폐쇄,다음달 4일부터 경부고속도로 판교IC 서울방향 분당진출로와 부산방향 수지진출로가 폐쇄됩니다. 이에 따라 경부고속도로 상행선에서 분당방향으로 진출하는 차량과 서울외곽순환고속도로를 통해 수지방향으로 진출하는 차량은 현재의 판교 진출로를 이용해야 합니다. 한국도로공사는 28일 판교 신도시 개발로 국지도 23호선이 현재보다 분당쪽으로 350m 가량 이설되면서 기존 국지도 23호선이 폐쇄되기 때문 이라고 설명했습니다.,https://news.naver.com/main/read.nhn?mode=LSD&mid=shm&sid1=260&oid=004&aid=0001947386,125
89490,2008.05.28. 오후 3:44,부동산,한국경제TV,서울시 세계 전자정부 포럼 개최,서울시가 오는 7월 세계 전자정부 시장 포럼을 개최합니다. 서울시가 주최하고 유엔경제사회국과 유엔전자정부센터가 후원하는 이번 행사는 세계 전자정부 현재와 미래 세계 도시 전자정부 협력 모델 구축을 주제로 오는 7월 7일부터 7월9일까지 소공동 롯데호텔에서 열립니다. 이번 포럼은 오세훈 서울시장 주재의 환영만찬을 시작으로 도시의 지속가능한 발전을 위한 디지털 전략 등 4개 분야에 대한 주제발표와 토론으로 진행됩니다.,https://news.naver.com/main/read.nhn?mode=LSD&mid=shm&sid1=260&oid=004&aid=0001947385,125
89491,2008.05.28. 오후 3:44,부동산,한국경제TV,동부건설 용산 도시환경정비사업 계약,동부건설이 28일 용산구 동자동 제4구역 도시환경정비사업 계약을 체결했다 고 밝혔습니다. 계약금액은 3천억원 규모로 동부건설의 최근 매출액 대비 18.9%에 해당합니다. 계약기간은 착공 예정일인 오는 10월부터 3년 7개월입니다. 동부건설 관계자는 대표 재개발지역인 용산에서 사업하게 돼 의미가 크다 며 동부이촌동과 대치동에 이어 서울에서 동부건설의 명품 이미지를 이어가게 됐다 고 말했습니다. 또 이번 사업을 통해 오피스텔을 포함 총 350여 가구를 분양할 계획 이라고 설명했습니다.,https://news.naver.com/main/read.nhn?mode=LSD&mid=shm&sid1=260&oid=004&aid=0001947384,125
89492,2008.05.28. 오후 3:36,부동산,뉴시스,오세훈 시장  뉴타운사업 수정해야,오세훈 시장 미네르바포럼 초청 특강 서울 뉴시스 오세훈 서울시장은 28일 전임 시장 이명박 대통령 이 해놓은 것을 바꾸는 것이 불경스럽긴 하지만 뉴타운 사업을 수정해야 한다 고 밝혔다. 오 시장은 이날 오전 서울 중구 조선호텔에서 열린 세계외대 미네르바포럼에 참석 서울을 디자인하라 는 주제의 강연에서 이같이 말했다. 오 시장은 기존 서울시 뉴타운 사업을 180도 완전히 바꾸기는 어렵겠지만 수정을 해야 한다 며 현재 검토작업을 진행 중 이라고 설명했다. 서울시는 이와 관련 학계와 시민단체 전문가 등 18명으로 구성된 주거환경개선 정책 자문단 을 꾸렸으며 29일 첫 회의를 가질 예정이다. 이는 오세훈 시장이 뉴타운 추가지정 문제와 관련 주거환경개선사업 전반의 성과를 평가하고 발전방안을 마련하겠다 고 밝힌데 따른 조치다. 자문단은 앞으로 뉴타운 사업과 재개발·재건축 등 기존 주거환경 개선정책의 성과 평가 보완 방향과 구체적 실행 방안 등을 점검하게 된다.,https://news.naver.com/main/read.nhn?mode=LSD&mid=shm&sid1=260&oid=003&aid=0002113090,125
89493,2008.05.28. 오후 3:15,부동산,파이낸셜뉴스,신한 리비아서 공사잔액 530억 수령,㈜신한 회장 김춘환 은 최근 리비아의 주택공공설비공사시행청 H.I.B 으로부터 트리폴리 5000가구 공사에 대한 선수금 잔액 530억을 수령하였다고 28일 밝혔다. 지난 2008년 3월 3일 선수금 중 93억원을 수령한 바 있는 신한은 이번에 트리폴리 5000가구 공사에 대한 선수금 전액 계약금액의 12.5% 을 수금하게 됐다. 또한 지난해 같은 발주처로부터 수주한 질리튼 콤스 도시기반시설공사 현장 및 리비아행정개발관리청 O.D.A.C 으로부터 수주한 자이야 5000가구 주택 및 도시기반시설 공사 현장에 대한 미수 선수금 730억원에 대해서도 발주처별로 선수금 지급 심사가 진행 중에 있다고 신한측은 밝혔다. 이번 미수금을 받게 되면 당장 트리폴리 5000가구 공사에 대한 잔액과 함께 총 1260억원에 달하는 현금성 자산을 확보할 수 있게 된다. 김춘환 회장은 “다음달 8일은 신한 창립 40주년이기 때문에 리비아 발주처 관계자 국내 귀빈 국내외 임직원 및 가족들을 모시고 비젼 선포식과 더불어 창립 40주년 기념행사를 가질 예정”이라고 말했다.,https://news.naver.com/main/read.nhn?mode=LSD&mid=shm&sid1=260&oid=014&aid=0001980778,125
89494,2008.05.28. 오후 3:09,부동산,파이낸셜뉴스,포스코건설 베트남 국제항만터미널 착공식,포스코건설은 28일 오전 9시 현지시각 발주처인 베트남 씨엠아이티 CMIT 와 함께 ‘카이멥 국제항만터미널’ 조감도 착공식을 가졌다. 이날 착공식에는 ‘ d 민 사인’ 바리아 붕따우 인민위원장 ‘ d 요아잉 토’교통운송부 부장관 등의 베트남 고위 관계자와 ‘브이 펀 쯩’ 씨엠아이티 CMIT 회장 김익희 포스코건설 부사장 삼환기업 허종 사장 등 내외귀빈 30여명을 포함해 총 150여명이 행사에 참석했다. 베트남 붕따우에 위치한 카이멥 국제항만터미널 Cai Mep International Terminal 은 연간 115만 TEU를 처리할 수 있는 규모로 배후부지 48만㎡에 안벽 길이는 600m로 건설될 계획이다. 수주금액은 1억 1200만 달러이다. 공사기간은 36개월이며 2011년 상반기 준공될 예정이다. 이날 착공식에 참석한 김익희 포스코건설 부사장은 축사에서 “카이멥 국제항만터미널은 국제무역이 증가하는 베트남에서 글로벌 허브항만 역할을 충실히 수행할 것으로 기대된다”고 말했다.,https://news.naver.com/main/read.nhn?mode=LSD&mid=shm&sid1=260&oid=014&aid=0001980773,125
89495,2008.05.28. 오후 3:09,부동산,파이낸셜뉴스,5월 주택분양 절반 급감,분양가 상한제를 피하기 위한 밀어내기식 분양이 끝나면서 5월 들어 아파트 공급량이 감소했다. 국토해양부는 지난 5월 전국에서 분양한 주택을 집계한 결과 2만806가구에 그쳐 전년동기 4만154가구 대비 48% 줄었다고 28일 밝혔다. 이같이 5월 분양 물량이 급감한 것은 분양가 상한제를 피하기 위한 분양 몰이가 진정된 때문인 것으로 풀이된다. 또 지난해 9월부터 시행된 분양가 상한제 및 청약가점제를 피하기 위해 지난해 5월에 분양물량이 집중됐던 것도 국토부는 원인으로 분석했다. 지역별로 보면 수도권 1만3734가구 전년동기 대비 22% 감소 보다 지방 7072가구 69%감소 의 감소폭이 컸다. 이로써 올 1월부터 5월까지 분양된 주택은 모두 11만5625가구가 분양돼 지난해 같은 기간 분양실적 8만9421가구 에 비해 29% 늘었다. 한편 오는 6월 분양예정인 주택은 수도권 1만7552가구 지방 1만2969가구를 합해 모두 3만521가구로 집계됐다.,https://news.naver.com/main/read.nhn?mode=LSD&mid=shm&sid1=260&oid=014&aid=0001980769,125
89496,2008.05.28. 오후 3:09,부동산,파이낸셜뉴스,주택 공공신고 거부 500만원 과태료,이르면 오는 9월부터 주택을 거래한 당사자가 공동신고를 거부하면 500만원의 과태료를 부과받는다. 28일 국토해양부에 따르면 정부는 이같은 내용을 담은 ‘공인중개사의 업무 및 부동산거래신고에 관한 법률’ 개정안을 다음달 초 공포하고 하위법령을 정비해 9월부터 시행할 예정이다. 이에 따라 9월부터는 개인끼리 주택을 거래했을 때 공동신고를 거부한 당사자는 500만원의 과태료가 부과된다. 지금은 공동신고를 거부해도 처벌하지 않았다. 다만 중개업소를 통해 주택을 거래하면 지금과 같이 중개업자가 거래내역을 신고해야 한다. 또 주택거래신고 지역에서 중개업소를 통해 전용면적 60㎡가 넘는 주택을 거래했을 때에는 중개업자가 거래사실을 신고해야 한다. 지금은 거래신고 지역에서는 중개업소를 통해 주택을 거래했어도 거래 당사자가 함께 거래내역을 신고해야 했다. 아울러 부동산거래대금의 지급증명서를 요구할 수 있는 시장 군수 구청장의 권한이 보다 명확해진다. 개정안은 부동산 거래내역이 이상할 경우 시장 군수 구청장이 거래 당사자에게 요구할 수 있는 자료를 ‘계약서 등 관련자료’에서 ‘계약서 부동산거래대금의 지급을 증명할 수 있는 서면 등’으로 구체화했다.,https://news.naver.com/main/read.nhn?mode=LSD&mid=shm&sid1=260&oid=014&aid=0001980768,125
89497,2008.05.28. 오후 3:08,부동산,아시아경제,평택고덕신도시에 美 미주리 대학교 유치,평택 고덕신도시에 미주리 주립대학교가 들어설 전망이다. 김문수 경기지사는 “미국 미주리 주립대학교를 유치하고 스티븜스 SIT공과대학됴 유치할 계획”이라고 밝혔다.,https://news.naver.com/main/read.nhn?mode=LSD&mid=shm&sid1=260&oid=277&aid=0001985009,125
89498,2008.05.28. 오후 2:59,부동산,머니투데이,잠실5단지 112층 제2롯데월드에도 시큰둥,머니투데이 정진우 기자 국방부 112층 제2롯데월드 허용검토 잠실5단지 과거와 달리 호재에도 가격하락 각종 규제와 세금문제로 매수줄고 매도늘어 ↑ 서울 잠실5단지내 사진. 국방부가 112층 제2롯데월드 건립 허용을 검토하고 있다고 했지만 잠실5단지 아파트값은 오히려 떨어지고 있어요 서울 송파구 잠실5단지 상가내 J부동산 관계자의 말이다. 그동안 제2롯데월드 와 관련 긍정적인 뉴스가 나오면 아파트값이 크게 올랐지만 요즘은 사정이 다르다는 것. 그는 이제 잠실5단지 가격에 영향을 미치는 것은 제2롯데월드 가 아니라 종부세 등 부동산 세금인 것 같다 고 설명했다. 서울 잠실5단지 아파트값이 112층 제2 롯데월드 건립과 관련된 호재에도 불구하고 하락하고 있다. 28일 업계에 따르면 지난 19일 국방부가 112층 제2롯데월드 허용 방안을 다각적으로 검토하고 있다고 발표했지만 인근 잠실5단지의 주택형별 가격은 최근 2000만 5000만원 가량 떨어졌다. 현재 잠실5단지 112㎡형은 11억6000만원선에 시세가 형성돼 있다. 지난 4월말 가격인 11억8000만원보다 2000만원 하락한 수준이다. 115㎡형 역시 현재 12억2000만 12억5000만원선으로 한달전보다 3000만 4000만원 가량 떨어졌다. 거래는 없고 간혹 문의만 이뤄지고 있다. ↑ 서울 잠실5단지 주택형별 가격추이. 그동안 제2롯데월드 건립 관련 호재가 나올때마다 주택형별로 한달새 수천만원씩 오르던 양상과 큰 차이를 보이고 있는 것. 지난해 대선에서 이명박 대통령이 당선되자 잠실5단지 가격은 한달새 1000만 4000만원 가량 상승했다. 서울시장 재직 시절 제2롯데월드 높이를 555m까지 완화해 준 이명박 대통령이 당선됐다는 이유로 거래가 늘면서 아파트값이 급등한 것. 잠실5단지 인근 Y공인중개업소 관계자는 112층 제2롯데월드 건립을 허가한 전 시장이 대통령에 당선된 것보다 더 큰 호재가 어디겠느나 며 지난해 말부터 가격이 꾸준히 올랐다 고 말했다. 지난해 5월에도 제2롯데월드 건축 허가가 임박했다는 소식이 전해지면서 잠실5단지는 주택형별로 5000만 1억원 가량 올랐다. 하지만 이달에는 국방부의 건립 허용 검토 라는 호재에도 불구 아파트 값은 오히려 떨어지고 있다. 이는 강남 재건축 아파트 하락세의 영향을 받은 것으로 분석된다. 잠실5단지 상가내 A부동산 대표는 종부세 양도세 등 부담이 커 이 곳 아파트를 사려고 하는 사람들이 크게 줄었다 고 말했다. 닥터아파트 이진영 팀장은 그동안 잠실5단지는 제2롯데월드 건립과 관련해 가격이 민감하게 움직였지만 요즘은 각종 규제나 세금 부담으로 수요가 줄면서 가격이 하락하고 있다 며 현재 강남권 재건축 아파트의 가격하락 현상과 비슷한 상황이라고 보면 된다 고 설명했다.,https://news.naver.com/main/read.nhn?mode=LSD&mid=shm&sid1=260&oid=008&aid=0001989569,125
