,date,cat,co,headline,text,url,week
68012,2007.10.30. 오후 6:21,부동산,파이낸셜뉴스,“뚝섬 초고가 아파트 연내 분양”,역대 최고 분양가 아파트가 될 서울 성동구 서울숲의 뚝섬 초고층 아파트가 이르면 올해 안에 분양될 것으로 보인다. 사상 최고가 부지 낙찰로 관심을 끌고 있는 뚝섬 상업용지 중 2개 구역에 지어질 초고층 주상복합아파트와 일반아파트의 건축허가가 최근 통과됐기 때문이다. 이에 따라 이들 두 아파트 사업자는 오는 11월 말까지 분양승인을 신청하면 분양가 상한제도 피할 수 있다. 이르면 연내 분양도 가능할 전망이다. 서울시는 관계부처 협의를 거쳐 한화건설과 대림산업이 뚝섬상업용지 1구역과 3구역에 각각 짓는 초고층 주상복합아파트 건축허가를 지난주 승인했다고 30일 밝혔다. 1구역에는 한화건설이 부지 1만7491㎡ 5291평 에 용적률 400%를 적용해 지하 7층 지상 45층 아파트 230가구와 서울 최대 규모 멀티플렉스 극장 쇼핑센터 스포츠시설 등을 갖춘 문화복합센터 2개동을 짓는다. 아파트 최고 높이는 160m가 될 전망이다. 아파트는 213㎡ 70평형 77가구 267㎡ 81평형 38가구 297㎡ 90평형 75가구 330㎡ 100평형 36가구 376㎡ 114평형 4가구 등으로 구성된다. 또 3구역에는 대림산업이 1만8314㎡의 부지에 용적률 600%를 적용해 51층짜리 일반아파트 2개동과 33층 오피스 빌딩 1개 동을 짓는다. 아파트 2개동은 206m 높이로 지어질 예정이다. 일반 오피스 빌딩에는 업무시설과 공연장 등 문화시설 판매시설이 들어온다. 아파트는 330㎡ 100평형 단일 크기로 196가구를 공급한다. 대림산업 관계자는 “세계 2위 실적기준 건축설계회사인 NBBJ사와 국내의 정림건축 건원건축이 함께 초고층 아파트에서는 처음으로 건물 외관을 ‘유선형’으로 디자인했다”면서 “한강 물길의 흐름과 유기적인 조화를 이루도록 디자인한 랜드마크 아파트가 될 것”이라고 말했다. 두 회사는 이미 교통영형평가 환경영향평가 등 관련 인허가 절차를 모두 마쳐 곧바로 착공신고를 내고 다음 달 중순께 분양승인을 신청할 방침이다. 분양 시기는 이르면 12월 안에도 가능하지만 비수기인 점을 감안해 내년 초로 넘어갈 가능성이 높다. 사업시행자인 피데스개발 관계자는 “서두르면 12월 말까지 분양할 수 있지만 통상 그맘 때는 비수기여서 분양률을 높이기 위해 내년 1월로 연기할 가능성이 있다”고 말했다. 분양가는 주상복합아파트가 들어서는 1구역과 일반아파트가 지어지는 3구역 모두 3.3㎡ 1평 당 4000만원 안팎에서 결정될 전망이다. 대림산업이 공급하는 330㎡ 아파트의 경우 대략 40억원 안팎이 될 전망이다. 대림산업 관계자는 “330㎡대 대형 주택의 주요 고객층의 성향을 파악해 최고급 아파트를 만들 예정”이라면서 “분양가 수준은 1구역과 비슷한 수준을 염두에 두고 마감재 등을 결정할 예정”이라고 말했다. 전문가들은 분양 전망을 대체로 긍정적으로 본다. 3.3㎡당 3280만원으로 역대 최고 분양가였던 성수동 현대 힐스테이트가 지난해 성공적으로 분양했던 것처럼 이번에도 초고소득층 VVIP 마케팅을 어떻게 펼치느냐에 따라 성패가 갈릴 것이라고 지적했다. 부동산써브 함영진 실장은 “서울숲이라는 최고 입지와 인근 지역이 재정비 촉진지구로 지정돼 개발 호재가 많다”면서 “강남은 물론 강북에도 시세 기준 3.3㎡당 4000만원이 넘는 아파트가 많기 때문에 최고 분양가지만 고소득층에겐 관심이 높을 것”이라고 전망했다. 유앤알 박상언 사장은 “뚝섬 서울숲에 들어설 아파트는 최소 30억원대 이상이어서 역대 최고 분양가 아파트가 될 전망”이라면서 “고소득층을 상대로 한 마케팅을 얼마나 적극적으로 벌이느냐에 따라 성공여부가 결판날 것”이라고 예상했다.,https://news.naver.com/main/read.nhn?mode=LSD&mid=shm&sid1=260&oid=014&aid=0000354468,95
68013,2007.10.30. 오후 6:09,부동산,경향신문,서울시  뚝섬에 ‘3.3㎡당 4천만원’아파트 건축 허가,서울시가 서울숲 인근 뚝섬 상업용지 중 2개 구역에 건설될 주상복합 아파트에 대해 건축 허가를 승인해 이의 분양 성공 여부에 관심이 모아지고 있다. 서울시는 30일 최근 관계부처 협의를 거쳐 한화건설과 대림산업이 시공하는 뚝섬 상업용지 1구역과 3구역의 건축허가를 승인했다고 밝혔다. 1구역에는 한화건설이 부지 1만7491㎡ 5천291평 에 용적률 399%를 적용해 지하 7층 지상 45층 아파트 230가구와 공연·전시장 쇼핑시설 스포츠시설 등을 짓는다. 이 중 아파트는 213㎡ 70평형 77가구 267㎡ 81평형 38가구 297㎡ 90평형 75가구 330㎡ 100평형 36가구 376㎡ 114평형 4가구 등이다. 대림산업은 3구역 1만8천314㎡ 부지에 용적률 600%를 적용해 51층짜리 아파트 2개동과 35층 오피스 빌딩 1개 동을 짓는다. 아파트는 330㎡ 100평형 단일 크기로 196가구를 건설하고 일반 오피스 빌딩에는 업무시설과 공연장 등 문화시설 판매시설이 들어올 예정이다. 두 회사는 이미 교통영형평가 환경영향평가 등 관련 인허가 절차를 모두 마쳐 곧 착공신고를 내고 다음달 중순께 분양승인을 신청 할 것으로 전해졌다. 이들 아파트는 땅을 고가로 서울시에서 사들인 데다가 공사 착공이 1년이상 늦춰진 데 따른 금융비담 증가로 최소한 3.3㎡ 1평 당 4000만원을 넘을 것으로 알려지면서 관심을 끌었다. 〈경향닷컴〉 대한민국 희망언론 경향신문 구독신청 hp smile.khan.co.kr ⓒ 경향신문 경향닷컴 www.khan.co.kr 무단전재 및 재배포 금지 〈경향닷컴은 한국온라인신문협회 www.kona.or.kr 의 디지털뉴스이용규칙에 따른 저작권을 행사합니다.,https://news.naver.com/main/read.nhn?mode=LSD&mid=shm&sid1=260&oid=032&aid=0000250772,95
68014,2007.10.30. 오후 6:08,부동산,매일경제,김포 양촌ㆍ송파신도시 임대주택 줄고 분양 늘어난다,image0 김포 양촌신도시와 송파신도시에서 임대주택을 다소 줄이고 분양주택을 늘리는 방안이 추진되고 있다. 이들 신도시 인근에 임대주택들이 많이 들어설 예정이어서 임대주택을 무리하게 늘릴 필요가 없기 때문이다. 분양주택이 늘어나면 김포ㆍ송파신도시에서 아파트를 분양받으려는 수요자들에게는 분양 기회가 종전보다 더 늘어날 것으로 보인다. 30일 건설교통부ㆍ토지공사 등에 따르면 최근 실시계획이 승인된 김포 양촌신도시에는 총 5만2812가구가 공급된다. 아파트와 연립주택 등 공동주택 물량은 4만9087가구다. 이 밖에 단독주택이 1665가구 주상복합이 2060가구 공급될 예정이다. 이 같은 공급물량은 지난해 12월 수립된 개발계획 총 5만3890가구 공급분 중 공동주택 4만6850가구 에 비해 총 주택수는 1078가구 줄어든 것. 단독주택과 주상복합이 각각 685가구 2630가구 줄어 각각 1665가구 2060가구로 확정됐기 때문이다. 반면 아파트ㆍ연립주택 등 공동주택은 2237가구나 증가했다. 특히 공동주택 가운데서도 분양분이 대폭 늘어났다. 분양주택은 당초 2만5540가구였지만 실시계획 승인과정에서 3만3920가구로 8380가구나 늘어났다. 반대로 임대주택은 2만1310가구에서 1만5167가구로 6143가구나 감소했다. image1 공동주택에서 분양주택이 차지하는 비율도 54.5%에서 69.1%로 14.6%포인트나 올라가고 임대주택 비율은 45.5%에서 30.9%로 낮아졌다. 임대주택 비율이 낮아지고 분양주택 비율이 높아진 것은 신도시 인근에 임대주택단지 건설이 추진되는 등 임대 수요를 충분히 흡수할 수 있을 것이라는 지방자치단체 요구가 받아들여졌기 때문이다. 아직 분양주택 규모를 최종 확정하지 않은 송파신도시에서도 분양주택 비율은 늘리고 임대주택을 줄이는 방안이 추진되는 것으로 전해졌다. 송파신도시는 군부대를 이전하고 그린벨트 개발제한구역 를 풀어서 신도시를 건설하는 만큼 임대주택 비율이 50% 이상 돼야 하는 상황. 정부는 이 규정을 지키면서도 분양주택수를 최대한으로 늘리는 방안을 강구할 계획이다. 임대주택이 지나치게 많아지면 신도시 기능이 계획했던 것 만큼 잘 작동하지 않을 수도 있다는 지적 때문이다. 정부에서 2005년 12월 송파신도시에 4만6000가구를 건설하겠다는 계획을 발표했을 때는 분양주택 비율은 전체주택의 48%인 2만2100가구였고 임대주택은 52%인 2만3900가구였다. 이 비율이 다소 조정돼 분양주택과 임대주택 비율이 50대50에 근접하게 바뀔 가능성이 높다는 얘기다. 지난해 11ㆍ15대책에서 송파신도시 총 주택수가 4만6000여 가구에서 4만9000여 가구로 늘어난 만큼 분양주택과 임대주택 비율을 50대50으로 잡을 경우 각각 2만4500가구가 된다. 이렇게 되면 분양주택은 계획했던 것보다 2400가구 임대주택은 600가구가량 늘어나는 셈이다.,https://news.naver.com/main/read.nhn?mode=LSD&mid=shm&sid1=260&oid=009&aid=0000635330,95
68015,2007.10.30. 오후 6:03,부동산,서울경제,수도권 분양시장 연말大戰 4순위청약을 아시나요,청약 미달 아파트 선착순으로 분양 통장 사용 안해도 돼 알짜 미분양 물량…경쟁률 5대1 기록도 청약가점제가 시행되고 미분양 아파트가 쌓이면서 ‘4순위’ 청약이 눈길을 모으고 있다. 4순위는 정식 명칭이 아니다. 통상 아파트를 분양할 때 특별분양 청약 1 3순위를 대상으로 분양한 다음 미분양이 발생했을 때엔 선착순으로 접수를 받는데 이를 두고 ‘4순위’로 부른다. 순위 내 청약에서 미달된 아파트를 대상으로 한 임의 분양인 셈이다. 특히 최근 지방뿐 아니라 서울 및 수도권에서도 미분양 아파트가 속속 나타나고 있어 4순위 청약자들의 비중도 점차 늘어날 것으로 보인다. ◇4순위 청약 이래서 좋다 4순위 청약의 가장 큰 장점은 청약통장을 사용하지 않아도 된다는 것이다. 청약통장은 가입 후 2년이 지나야 1순위 자격을 얻게 되기 때문에 2년의 시간을 버는 셈이다. 특히 지난 9월부터 재당첨 금지 조항이 부활되면서 수도권의 경우 청약에 당첨되면 길게는 10년간 재당첨이 금지될 뿐만 아니라 분양가상한제 아파트는 최고 10년간 전매가 금지되기 때문에 청약통장의 가치가 이전과 비교할 수 없을 정도로 높아졌다. 4순위로 청약할 경우 재당첨 금지 조항의 적용을 받지 않는다. 따라서 최근 주택 시장 침체로 일부 인기 지역을 제외하곤 미분양 물량이 많이 쏟아지면서 많은 주택 수요자들이 4순위 청약에 오히려 더 신경을 쓰는 분위기다. ◇4순위 마케팅 눈에 띄네 수요자들이 청약통장 사용하기를 꺼리고 미분양 아파트에 관심을 가지면서 건설사들도 4순위 청약자를 대상으로 한 마케팅을 강화하고 있다. 이달 초 서울 강남에서 무더기 미분양을 기록했던 서초동의 롯데캐슬 메디치. 업체 측은 애초부터 일반인을 대상으로 한 홍보활동을 대대적으로 하지 않았다. 분양 업체의 한 관계자는 “고가 아파트는 수요층이 한정돼 있기 때문에 굳이 청약통장 가입자를 대상으로 한 마케팅은 별 효과가 없다”며 “대신 소수 계층에 맞춤형으로 알리는 데 주력하고 있다”고 했다. 당시 50가구 중 1 3순위에서 청약한 건수는 2건에 불과했지만 선착순으로 접수를 받기 시작한 뒤로 현재 절반 이상이 팔린 상태다. 또 순위 내 청약에서 대규모 미분양을 기록했던 남양주 진접지구 아파트는 선착순 계약에서 최고 5대1의 경쟁률을 보이기도 했다. 특히 4순위 청약자는 계약률도 높기 때문에 각 건설사들은 분양 전 사전 예약자를 받거나 1대1 마케팅을 강화하고 있다. ◇알짜 미분양 어디가 좋을까 지방 등 수도권은 물론 서울에서도 알짜 미분양 단지가 있다. 서울 영등포구 당산동 ‘반도 유보라 팰리스’는 108 251㎡형 중 부적격 당첨자 물량 일부를 분양 중이다. 청계천이 내려다 보이는 중구 황학동의 ‘아크로타워’는 141㎡형에서 일부 물량과 중구 회현동의 ‘리더스뷰 남산’ 253㎡형 중 몇 가구가 미분양으로 남아 있다. 서대문구 북가좌동 아이파크는 86 143㎡형에서 골고루 물량이 있고 서초동에서 GS건설이 분양한 ‘서초 아트자이’도 서두르면 미분양분을 잡을 수 있다. ◇미분양 잘못 고르면 낭패 4순위 청약자들이 관심을 갖는 미분양 물량은 잘 고르면 내 집 마련의 좋은 기회가 될 수 있지만 반대의 경우엔 낭패를 볼 수도 있다. 우선 미분양 단지를 둘러볼 때 미분양이 될 만한 이유가 없는지를 살펴봐야 한다. 주변에 혐오시설은 없는지 방향이나 면적은 괜찮은지 발품을 팔아서 직접 확인해야 한다. 또 로열층을 선점하기 위해선 사전 예약제를 활용할 필요가 있으며 중도금 무이자 이자 후불제 발코니 무료 확장 등의 혜택이 있는지도 알아두면 자금조달계획을 세우는 데 도움이 된다.,https://news.naver.com/main/read.nhn?mode=LSD&mid=shm&sid1=260&oid=011&aid=0000204995,95
68016,2007.10.30. 오후 6:03,부동산,서울경제,수도권 분양시장 연말大戰 미니 신도시급 단지도 시선집중,‘미니 신도시를 노려라.’ 분양가상한제를 앞두고 청라지구ㆍ파주신도시 등 메이저급 택지지구 분양이 잇따를 예정인 가운데 신도시 못지않은 기반시설을 갖춘 단지들도 청약자들의 시선을 사로잡고 있다. 바로 고양ㆍ김포 등에서 도시개발사업 등을 통해 공급되는 아파트들이다. 민간사업이긴 하지만 단지 규모가 큰 것은 물론 일반 민간택지와는 달리 단지 내에 초ㆍ중ㆍ고등학교는 물론 공원과 대규모 커뮤니티 시설을 갖추고 있다. 이 단지들이 ‘미니 신도시’급으로 불리는 것도 이 때문이다. 고양 식사지구 12월 7 000가구 공급… 제2자유로 건설 수혜 ◇고양 식사지구 GS건설과 벽산건설은 오는 12월 중 일산 식사지구에 7 000여가구를 분양할 예정이다. 전체 공급 물량은 8 953가구로 이번 1차 공급물량 중 GS건설이 주상복합 176가구 을 포함해 4 328가구를 벽산건설은 2 350가구를 분양할 예정이다. 전체 부지면적이 100만 ㎡ 로 지구 내에는 초등학교 3개 와 중학교 2개 고등학교 근린공원 3개 어린이공원 6개 등을 갖춘데다 동사무소까지 들어서게 돼 웬만한 기반시설은 다 갖추고 있다. 경의선 백마역과 풍산역 신설예정 3호선 정발산역과도 가까워 서울 접근이 수월하다는 평가를 받고 있다. 특히 제2자유로 건설 2009년 개통 예정 과 경의선 복선 전철 개통 2009년 에 따른 수혜지로도 거론되는 지역이기도 하다. GS건설의 자이타운은 112 300㎡형 벽산 블루밍은 132 310㎡형으로 구성된다. GS건설이 들어서는 1ㆍ2ㆍ4블록에는 총 100개의 정원이 조성되는 친환경 단지로 설계된다. 각 정원에는 물 30개 숲 40개 들 30개 등의 테마로 조성돼 명품 조경이 기대되고 있다. 벽산 블루밍은 골프연습장과 피트니스클럽ㆍ에어로빅ㆍ사우나 등의 동적 커뮤니티 시설은 물론 독서실과 주민자치센터 등의 커뮤니티도 적절히 배치한 점이 특징이다. 여기에 맞춤 설계 콘셉트를 적용 가변형 벽체 선택에서부터 인테리어 컬러 선택 온돌마루 컬러 선택 등 다양한 선택이 가능하다. 고양 덕이지구 내달 4 599가구 분양… 최대 48% 녹지 확보 ◇고양 덕이지구 동문건설 1 556가구 과 신동아건설 3 316가구 이 11월 중 총 4 559가구를 분양할 계획이다. 65만9 000㎡의 부지에 조성되는 덕이지구 내에는 초등학교 2개 와 중ㆍ고등학교가 단지 내에 들어설 예정이다. 경의선 탄현역이 인근에 있는데다 자유로 이산포IC를 이용할 수 있고 인근에 덕이동 로데오거리와 고양종합전시장 등의 편의시설이 몰려 있다. 동문건설은 덕이지구 내 A1블록에서 693가구 A5블록에서 863가구의 아파트를 각각 분양한다. 회사 측은 “아파트 외관을 V자형 타워로 설계하고 47 48%의 녹지를 확보해 쾌적한 환경을 제공할 것”이라며 “테마파크와 피트니스센터ㆍ보육시설 등 다양한 부대시설을 마련해 단지 내에서 모든 생활이 이뤄질 수 있도록 했다”고 설명했다. 신동아건설도 덕이지구 내에서 30층짜리 타워형 아파트를 선보인다. 단지 내에 25m 길이의 6레인 규모 고급 수영장과 영어교육원 등의 시설이 들어서는 것이 특징. 조경은 생태연못과 숲속쉼터 등을 조성하고 첨단 조명을 설치할 예정이다. 김포 걸포지구 10만8 000㎡부지에 중대형 아파트로만 구성 ◇김포 걸포지구 김포 걸포지구는 동양건설산업과 성우건설이 1 636가구의 오스타ㆍ파라곤 아파트 분양을 준비 중이다. 10만8 000㎡의 부지에 중대형 아파트로만 구성할 예정이다. 걸포지구의 가장 큰 메리트는 인근 검단ㆍ김포신도시 일산신도시의 중심에 위치해 후광 효과가 기대된다는 점이다. 김포신도시 외곽도로와 내년 초 개통 예정인 일산대교 진입이 용이하고 2012년 서울 지하철 9호선과 연계되는 경전철이 놓일 예정이어서 역세권 프리미엄까지 가능할 것으로 보인다. 단지를 둘러싸고 있는 11만5 000㎡ 규모의 걸포근린중앙공원과 북변공원ㆍ신향공원 등 녹지 공간도 풍부하다. 오스타ㆍ파라곤은 총 3개 단지 28개동으로 구성되며 112 238㎡형으로 설계될 예정이다. 최상층은 복층 구조의 펜트하우스로 꾸며지는 것이 눈길을 모은다. 단지 내에는 수영장과 골프연습장ㆍ피트니스센터 등 다양한 커뮤니티시설이 들어선다.,https://news.naver.com/main/read.nhn?mode=LSD&mid=shm&sid1=260&oid=011&aid=0000204994,95
68017,2007.10.30. 오후 5:57,부동산,서울경제,아파트 거래 감소세 지속,9월 2만9 612건 그쳐 8월보다 9.1% 줄어 전국의 아파트 거래가 감소 추세를 이어가고 있다. 30일 건설교통부가 공개한 ‘9월 아파트 실거래가 자료’에 따르면 지난 9월에 신고된 전국의 아파트 거래량은 2만9 612건으로 나타났다. 이는 8월 3만2 584건 보다 2 972건 9.1%가 줄어든 수치다. 전국의 아파트 거래건수는 지난해 11월 8만9 458건을 기록한 후 올 들어 매달 3만여건을 유지하다 9월 2만가구대로 떨어졌다. 수도권 전체의 9월 거래량은 전월보다 소폭 줄었지만 인천 지역은 개발호재로 93건이 증가했다. 서울의 강남ㆍ서초ㆍ송파구 등 강남3구는 445건만 신고돼 7월 649건 8월 499건 에 이어 감소세를 이어갔다. 아파트 개별 단지별 가격은 서울 강남 대치동 은마아파트 77㎡ 전용면적 2층이 9억6 000만원에 거래돼 10억원 이하로 떨어졌으며 잠실 주공5단지 77㎡ 6층은 8월 11억7 900만원에 거래됐으나 9월 11억5 500만원에 매매돼 2 400만원 하락했다. 그러나 경기도 분당 정자마을 주공4단지 36㎡ 14층은 8월 1억6 300만원에서 9원 1억8 000만원과 1억6 500만원으로 가격이 소폭 상승했다.,https://news.naver.com/main/read.nhn?mode=LSD&mid=shm&sid1=260&oid=011&aid=0000204990,95
68018,2007.10.30. 오후 5:57,부동산,서울경제,용산국제지구 사업권 2파전 압축,삼성물산·국민연금 프라임·현대 컨소시엄 제안서 제출 20조원 규모의 서울 용산국제업무지구 개발사업권을 획득하기 위한 싸움이 2파전으로 압축됐다. 코레일 사장 이철 은 30일 용산국제업무지구 개발사업 사업제안서 공모접수를 마감한 결과 삼성물산ㆍ국민연금 컨소시엄과 프라임ㆍ현대 컨소시엄 등 2개 컨소시엄이 사업제안서를 제출했다고 밝혔다. 코레일은 사업자 평가위원회 심의를 거쳐 오는 11월2일께 우선협상대상자를 선정ㆍ발표할 계획이며 우선협상대상자와 사업협약을 체결한 뒤 11월 말까지 특수목적법인 SPC 을 설립한다. 오는 2017 2018년 완공될 용산 국제업무지구 개발사업은 코레일이 보유한 이 일대 철도창과 서부이촌동 등 56만6 800㎡의 부지에 주상복합 아파트와 호텔ㆍ백화점 등 복합단지를 건설하는 사업이다. 특히 이 곳에는 150층 620m 규모의 랜드마크타워가 건립돼 상암동 DMC 랜드마크타워 640m 와 함께 서울의 대표적인 상징물로 자리잡게 된다.,https://news.naver.com/main/read.nhn?mode=LSD&mid=shm&sid1=260&oid=011&aid=0000204989,95
68019,2007.10.30. 오후 5:56,부동산,매일경제,마포 성산시장에 130가구 주상복합,image0 서울 마포구 성산시장이 지상 13층 130가구가 들어서는 주상복합 건물로 변신한다. 마포구는 최근 성산시장 정비사업 시행 인가를 위해 계획안 공람공고를 시작했다고 30일 밝혔다. 정비안에 따르면 마포구 망원2동 480 1 소재 6402.7㎡ 규모 성산시장을 3개동 지하 2층 지상 10ㆍ13층 주상복합으로 신축한다. 용적률은 383.44%. 지상 2층 이상에는 주택이 들어선다. 모두 130가구로 일부 조합원분을 제외하면 대부분 일반분양될 계획이다. 올해 말까지 관리처분을 거쳐 착공에 들어가 2010년 하반기에 입주할 예정이다.,https://news.naver.com/main/read.nhn?mode=LSD&mid=shm&sid1=260&oid=009&aid=0000635322,95
68020,2007.10.30. 오후 5:56,부동산,매일경제,규제완화로 다세대ㆍ다가구 건설 크게 늘어,건설교통부는 지난달 수도권에서 3만3615가구가 건설 인ㆍ허가를 받아 지난해 같은 달보다 267% 증가했다고 30일 밝혔다. 지난달에는 공공택지에서 지난해 같은 달보다 184% 증가한 1만68가구가 민간택지에서 320% 늘어난 2만3547가구가 각각 건설 인ㆍ허가를 받았다. 지난달 수도권 주택 건설 물량은 올해 들어 월간 단위로 최대 물량이다. 이에 따라 올 들어 9월까지 주택 건설 인ㆍ허가 누계는 13만4291가구로 지난해 동기 대비 41% 증가한 가운데 공공택지에서는 23% 증가한 3만9356가구가 민간택지에서는 50% 증가한 9만4935가구가 각각 인ㆍ허가를 받았다. 민간택지 건설 물량은 지난해 전체 물량 8만759가구 을 이미 넘어섰다. 건교부는 민간택지 주택 건설 활성화는 다세대ㆍ다가구 건축 규제 완화에 따른 것 이라고 분석했다. 실제로 다세대ㆍ다가구 주택은 9월에만 2520가구가 건설돼 지난해 동기보다 207% 늘어났으며 1 9월 누계 1만6385가구 로도 지난해 동기보다 65% 늘어났다. 건교부는 6월부터 공공택지에서 주택 건설이 본격화하고 민간택지에서도 예년보다 큰 폭으로 늘고 있어 올해 수도권에서 30만가구를 공급하겠다는 목표를 무난히 달성할 것 이라고 내다봤다. 또 수도권 주택 건설 인ㆍ허가 물량은 인천 송도ㆍ청라 파주 운정 성남 도촌 서대문 가재울뉴타운 마포 아현 등 인기 지역에 많아 미분양 염려는 크지 않다고 밝혔다.,https://news.naver.com/main/read.nhn?mode=LSD&mid=shm&sid1=260&oid=009&aid=0000635320,95
