,date,cat,co,headline,text,url,week
80290,2008.03.02. 오후 11:38,부동산,경향신문,이명박정부 때 대박 기대…‘부동산 테크’ 열풍,SUB TITLE START ㆍ투자 설명·땅 답사 급증 “투기 심리 조장 우려” SUB TITLE END 지난달 29일 오전 서울의 한 백화점 문화센터. 39세에 ‘100억원대 부동산 부자’가 된 것으로 알려진 이모씨 40 의 부동산 특강을 듣기 위해 아침 일찍부터 청중으로 좁은 강의실은 빼곡히 들어찼다. 이씨는 “‘디벨로퍼 개발론자 ’ 출신의 대통령이 나온 것을 환영한다”는 말로 강의를 시작했다. 이씨는 “부동산 투자를 무조건 ‘투기’로 몰아가서는 안된다”며 “어린 자녀들에게 ‘공부하라’고 가르치지만 말고 땅을 사줄 것”을 강조하기까지 했다. 이명박 정부 출범과 함께 부동산 투자 설명회가 쏟아지고 있다. 관광버스를 빌려 30만 50만원을 받고 진행하는 ‘부동산 투자 현지 답사’도 급증하는 추세다. 부동산 전문가들의 ‘몸값’도 덩달아 치솟고 있다. 대운하 건설 등 각종 개발 호재와 함께 부동산 규제가 대폭 완화될 것이라는 기대감 때문이다. 강사 이씨는 “수백명의 사람들이 강연회를 찾는 건 이명박 정부 출범으로 부동산 투자에 대한 관심이 높아졌음을 보여주는 것”이라고 말했다. 앞서 지난 1월초 한 경매 전문업체가 개최한 ‘2008 부동산경매 신 新 투자전략’에는 1000여명이 몰렸다. 1월29일 서울 논현동의 건설회관에서 열린 ‘이명박 정부의 신부동산 투자전략’ 특강 역시 ‘대박’을 터뜨렸다. 그동안 주식 투자 요령 등을 가르치던 재테크 전문 학원들도 최근 부동산으로 방향을 틀었다. 1회당 100분 남짓 하는 강연에 2만 3만원 정도의 참가비를 받지만 예약하지 않으면 참석이 힘들 정도다. 오는 7일에는 ‘왕비 재테크’ 저자로 알려진 권모씨의 ‘이명박 정부 부동산 투자전략 세미나’ 등이 예정돼 있다. 인터넷을 이용한 부동산 강의와 투자 설명회도 활발해지고 있다. 이같은 투자 설명회는 대부분 ‘어디에 투자하라’는 족집게식 결론으로 마무리된다. 지난 1월말 ㄷ금융센터에서 열린 부동산 투자전략 강연회에서는 “이명박 시대는 서울·부도심·강북이 대세다. 유행도 재개발과 재건축이지 타운 하우스는 아니다”라고 단정적인 결론을 내렸다. 강사로 나온 한 부동산 전문가는 ‘강북의 모 놀이공원 인근 낡은 다세대 주택을 구입하라’ ‘이명박 유턴 프로젝트에 맞춰 마포·청량리·창동에 투자하라’고 특정지역을 정해주기도 했다. 투자 설명회에 참석하는 청중도 다양해졌다. 부동산 관련업자나 ‘복부인’ 노인 등이 주축을 이루던 예전과 달리 대학 신입생까지 계층·남녀노소의 구분이 없다. 대학생 김민호씨 22 는 “이제 월급을 모아 저축을 하는 것만으로는 잘 살기 힘든 시대 아니냐”며 “일찍 부동산 투자 노하우에 눈뜨는 것도 경쟁력으로 생각한다”고 말했다. 부동산 설명회의 과열 현상을 우려하는 목소리도 높다. 부동산 투기를 은연 중에 조장하고 있기 때문이다. 투자 설명회에서 나온 정보가 사실이 아닌 경우도 많다. 참여연대 박원석 협동사무처장은 “이명박 정부가 인수위 시절부터 ‘규제를 완화하겠다’는 요지의 발언을 많이 했기 때문”이라며 “서민들에게도 가만히 있으면 안 될 것 같다는 느낌을 갖게 해 사회 전반의 비정상적인 투기 심리로 이어질 가능성이 있다”고 말했다. 〈 유희진·박수정기자 〉 대한민국 희망언론 경향신문 내손안의 모바일 경향 “상상” 1223 NATE ⓒ 경향신문 경향닷컴 www.khan.co.kr 무단전재 및 재배포 금지 〈경향닷컴은 한국온라인신문협회 www.kona.or.kr 의 디지털뉴스이용규칙에 따른 저작권을 행사합니다.,https://news.naver.com/main/read.nhn?mode=LSD&mid=shm&sid1=260&oid=032&aid=0001943428,113
80291,2008.03.02. 오후 7:48,부동산,국민일보,부동산시장 변화… 미분양 줄이기 안간힘―소형주택 경매서 인기,부동산 시장에 차별화 현상이 뚜렷해지고 있다. 봄철 이사수요 증가 등으로 전세난이 심화되면서 소형주택 경매시장은 과열 양상을 보이고 있다. 또 수도권 신규단지에도 미분양 단지에서나 볼 수 있었던 무이자 대출이 적용되고 있다. ◇수도권 신규분양에 무이자 대출 수도권을 중심으로 계약금 최소화 중도금 무이자 대출 발코니 무료 확장 등을 ‘당근’으로 내세우는 단지들이 늘고 있다. 신창건설은 4일부터 청약을 받는 경기도 수원시 망포동 ‘신창 비바패밀리’ 378가구 에 대해 발코니 확장 및 새시 무료 시공 중도금 40% 무이자 대출 조건을 내걸었다. 5일부터 인천 용현동에 최고 51층 높이의 주상복합 ‘용현 엑슬루타워’ 820가구 를 분양하는 풍림산업은 수요자들의 초기 자금부담을 줄여주기 위해 10%인 계약금을 5%씩 분납할 수 있도록 했다. 중도금 이자후불제도 적용된다. KCC건설은 경기도 안성시 공도읍 ‘안성 공도 KCC 스위첸’ 1101가구 에 대해 발코니 확장과 새시 공사를 무료로 해준다. 또한 신도산업개발은 경기도 남양주시 화도읍 묵현리 ‘마석역 신도브래뉴 3차’ 476가구 에 계약금 5% 중도금 최대 60% 무이자 대출 조건을 적용한다. 신도산업개발 관계자는 “지난해 분양시장 침체 속에서도 인근 마석역 1·2차 분양에 성공한 만큼 단지의 투자가치를 더 높이기 위한 것”이라고 말했다. ◇소형주택 경매 후끈 서울에서는 전세난 심화로 다세대·연립 소형아파트 등 소형주택 경매시장이 달아오르고 있다. 봄철 이사 및 재개발에 따른 이주 수요가 늘면서 전세금이 오르자 임차인들도 실거주 목적으로 소형주택 매입에 나서고 있는 것이다. 국민은행 조사에 따르면 지난주 서울 전세금은 전주에 비해 평균 0.1% 올랐다. 경매정보업체 디지털태인은 “올 들어 지난달까지 서울 다세대·연립 낙찰가율 감정가 대비 낙찰가 비율 은 102%로 아파트 낙찰가율 87% 에 비해 훨씬 높았다”고 밝혔다. 지난달 26일 서울중앙지법에서 경매된 양재동 46㎡ 13평형·감정가 1억5000만원 다세대주택에는 54명이 몰려 2억400만원에 낙찰됐다. 강북에서는 소형아파트 낙찰가도 급등하고 있다. 지난달 4일 북부지법에 나온 전농동 59㎡ 18평형·감정가 1억5500만원 우성아파트에는 42명이 입찰해 2억1850만원에 낙찰됐다. 태인씨디씨 김광수 대표는 “소형 다세대·연립의 경우 그동안 투자용 매입이 많았지만 이제는 실거주 목적으로 매입하는 사람들이 늘고 있다”며 “이 같은 추세는 소형아파트로 확산되는 모습”이라고 말했다.,https://news.naver.com/main/read.nhn?mode=LSD&mid=shm&sid1=260&oid=005&aid=0000306001,113
80292,2008.03.02. 오후 6:51,부동산,서울경제,전국 아파트 주간 시세 동향 서울 노원·도봉 상승세 두드러져,서울 지역 아파트 시장은 노원구와 성북구ㆍ도봉구 등의 상승세가 두드러진 가운데 한 주를 마감했다. 또 저렴한 매물을 찾는 매수세가 서울에서 수도권으로 이동하는 모습이 두드러졌다. 이에 따라 남양주와 양주ㆍ광명 등의 경기도 지역 시세도 동반 상승했다. 2일 부동산 114에 따르면 서울 지역은 노원구 0.38% 와 성북 0.3% ㆍ도봉 0.3% ㆍ금천 0.17% 등이 일제히 오르며 상승률 상위 지역을 휩쓸었다. 가격이 거침없이 오르면서 거래는 성사되지 않지만 공급이 부족해 매도자 우위의 시세가 형성되는 상황이라는 게 인근 공인중개사들의 설명이다. 노원 중계동 중계무지개 71㎡형의 경우 750만원 상계동 주공 12단지 56㎡형은 500만원 가량 상승했다. 도봉구 역시 창동 일대 아파트들이 대거 강세를 보였다. 이는 창동 차량기지 이전과 민자역사개발 등의 굵직한 호재로 인해 매수세 유입은 늘어나는 반면 매도자들은 매물을 오히려 거둬들인 데 따른 것으로 보인다. 이 처럼 서울 외곽 지역 아파트 들이 개별 호재를 바탕으로 상승세를 보이는 가운데 매수세들이 인근 경기도 지역으로 발걸음을 옮겨가면서 경기도 지역 아파트 가격 상승을 부채질하고 있는 흐름을 보였다. 양주시의 경우 인근 노원구와 강북구 등의 아파트 가격 상승으로 저렴한 가격을 겨냥한 매수세로 인해 0.19%의 상승률을 기록했다. 이 밖에 ▦광명은 0.18% ▦평택은 0.16% ▦인천 01.6% ▦의정부도 0.11% 상승했다. 특히 이들 경기도 지역은 소형보다 중대평 위주의 가격 상승이 이뤄지고 있는 양상이다. 서울 지역에서 소형매수세가 시세가 저렴한 인근 경기도로 옮아가면서 면적도 함께 늘여나가고 있기 때문이다. 전세 역시 하남 0.21% 과 남양주 0.18% ㆍ파주 0.17% ㆍ군포 0.14% 등이 상승 대열에 합류했다. 그러나 경기지역내에서도 군포 0.29% 와 수원 0.04% ㆍ용인 0.04% ㆍ하남 0.01% 등의 매매가격은 하락세를 면치 못했다. 특히 올 들어 입주물량이 대폭 늘어날 것으로 예상되는 수원시의 경우 물량 부담으로 가격이 약세를 보인 것으로 분석된다.,https://news.naver.com/main/read.nhn?mode=LSD&mid=shm&sid1=260&oid=011&aid=0001942478,113
80293,2008.03.02. 오후 6:48,부동산,서울경제,선순위 임차인 있다고 무조건 입찰 포기 말고,地地玉選 대출은행서 위장임차 여부부터 확인을 경매물건 중 주거용 부동산의 경우 말소기준권리 보다 먼저 전입 신고된 임차인이 있으면 입찰자 입장에서는 여간 신경 쓰이는 게 아니다. 이 경우 말소기준권리 보다 먼저 전입신고한 선순위 임차인의 경우 확정일자를 갖추고 법원에 배당요구를 하면 낙찰대금에서 전세보증금을 배당 받기 때문에 낙찰자에게 별 영향이 없다. 문제는 선순위 임차인이 법원에 배당요구 자체를 하지 않았거나 배당요구를 하더라도 배당순위에서 밀려 전세보증금을 전액 회수하지 못할 때이다. 경매에서는 낙찰자가 인수해야 할 임차보증금이 있으면 인수부담금액만큼 가격이 떨어진 후에야 응찰자가 생겨난다. 하지만 경매물건 중에서는 선순위 전입자가 위장임차인인 경우도 많아 이를 밝혀내서 고수익을 창출 하는 사례도 있다. 위장임차인의 대부분은 확정일자를 받지 않는다는 특징이 있는데 확정일자를 받지 않았다는 것은 그 당시에 전입신고는 되어 있지만 진정한 임차관계에 맺지 않았다는 것을 반증하는 것이기도 하다. 일반적으로 금융권에서는 근저당설정을 하기 전에 해당 부동산의 임대차관계를 확인하게 되는데 이때 채무자 및 그 세대원 이외의 전입자가 있다면 이들에게 임대차관계 등의 확인서를 받고 대출을 실행한다. 금융권에서 받는 확인서는 근저당권자가 부동산의 담보가치를 조사할 당시 대항력을 갖춘 임차인이 유상임대차를 부인하고 임차보증금에 대한 권리 주장을 하지 않겠다는 확인서를 작성해 준 경우에 한해 특별한 사정이 없다면 임차인의 배당요구를 허용할 수 없다는 것이 대법원 판례의 입장이기도 하다. 한 사례로 지난 2002년 8월 인천 부개동의 감정가 9 000만원의 다세대 주택에 응찰한 김모씨는 두 차례 유찰돼 최저가 4 400백만원이었던 상태에서 김모씨 단독으로 5 700만원에 입찰하게 됐다. 하지만 감정가보다 저렴한 물건을 단독 입찰하게 된 데 의구심을 품은 김모씨는 이후에 입찰 문건에 대해 대항력이 있는 세입자 하모씨가 보증금 6 000만원을 주장하고 있다는 사실을 알게 됐다. 다행이 김모씨의 경우 무상임차인 확인서가 발견돼 위장 임차인임이 명백해 졌고 감정가보다 저렴한 물건을 별도로 부담할 임대보증금 없이 낙찰받아 오히려 더 큰 수익을 남기게 돼 경매에 성공한 케이스이다. 따라서 임차인이 있는 물건의 경우 지레 입찰을 포기하기 보다는 대출은행을 통해 위장임차인을 꼼꼼히 가리는 등 조금만 더 주의를 기울이면 알짜 물건을 저렴하게 낙찰 받을 수 있다.,https://news.naver.com/main/read.nhn?mode=LSD&mid=shm&sid1=260&oid=011&aid=0001942477,113
80294,2008.03.02. 오후 6:48,부동산,서울경제,부동산 써브 추천 알짜물건 3월3일,광진구 건대입구역세권 8층 건물 52억원 서울 광진구 대로변 역세권 코너 8층 건물이 52억원. 대지 406㎡ 연면적 1 983㎡. 1998 년 준공. 지하철 2호선 건대입구역 역세관이며 급매로 나온 물건이라 주변 시세보다 많이 저 렴하며 전철역 바로 앞 이고 주변에 업무용 빌딩 건국대 세종대 등이 위치해 365일 공실 걱정없는 특급 수익성 건물이다. 현재 보증금 5억에 월 2 800만원의 월세수입 발생한다. ㈜키퍼즈에셋 빌딩자산관리 02 567 4602 강남구 압구정역세권 5층건물 40억원 서울시 강남구 신사동 5층 건물이 40억원. 대지 191㎡ 연면적 578㎡. 1996년 준공. 지하철 3호선 압구정역이 도보로 5분거리에 위치한 이면상권 코너건물. 현재 음식점 학원 등 입점 성업 중 인근에 CGV압구정 압구정성당 광림교회 등이 위치해 있다.,https://news.naver.com/main/read.nhn?mode=LSD&mid=shm&sid1=260&oid=011&aid=0001942476,113
80295,2008.03.02. 오후 6:46,부동산,매일경제,MK추천매물 삼성동 수익용 빌딩 500억원,◇서울 군자동 대로변 빌딩＝전철역에서 3분 거리 대지 571㎡ 연면적 1983㎡인 6층 코너 빌딩이 63억원이다. 보증금 8억원 월 2600만원이다. 20대 주차시설을 갖췄다. 02 515 8939 ◇수원시 영통동 상가＝대단지 아파트와 관공서에 인접한 1층 427㎡인 대형마트가 12억원이다. 감정가는 14억5000만원이다. 융자 8억9000만원 보증금 1억5000만원 월 781만원이다. 031 266 0682 ◇충남 천안시 연수원 용지＝대지 4만6752㎡ 연면적 9922㎡인 연수원 과 물류창고가 138억원이다. 건물 2개동이 있으며 즉시 사용이 가능하다. 02 3445 6696 ◇서울 역삼동 역세권 빌딩＝대지 343㎡ 연면적 1999㎡인 9층 빌딩이 95억원이다. 융자 48억원 보증금 3억원 월 6000만원이다. 수익용ㆍ사옥용으로 적합하다. 02 558 0690 ◇서울 역삼동 상업지 빌딩＝테헤란로 이면 대지 400㎡ 연면적 1215㎡인 5층 빌딩이 85억원이다. 보증금 3억원 월 4000만원이다. 용적률 800%를 적용 받는다. 수익용에 적합하다. 02 501 1811 image0 ◇서울 양재동 사옥 빌딩＝대지 694㎡ 연면적 4628㎡인 11층 건물이 180억원이다. 강남대로변에 위치하며 사옥이나 병원 용도로 적합하다. 02 577 6692 ◇충북 제천시 청풍면 전원주택지＝양평리 대지 1395㎡가 8500만원에 급매로 나왔다. 청풍호반 호수가 보이며 조망이 수려하다. 별장지로도 적합하다. 즉시 건축 가능하다. 031 666 2156 ◇서울 삼성동 수익용 빌딩＝대지 1870㎡ 연면적 9950㎡인 11층 대로변 빌딩이 500억원이다. 융자 50억원 보증금 20억원 월 1억5000만원이다. 오피스 임대수요가 풍부하다. 02 552 9011 image1 ◇서울 역삼동 대로변 빌딩＝강남역에서 5분 거리인 대지 550㎡ 연면적 2050㎡ 8층 빌딩이 75억원이다. 보증금 8억5000만원 월 3500만원이 나온다. 사옥용으로도 적합하다. 02 512 8850 ◇서울 도곡동 신축 용지＝양재역 인근 강남대로변 대지 1300㎡가 130억원이다. 연면적 5000㎡ 규모로 신축이 가능하다. 사옥 전시장 임대용 건물 신축에 적합하다. 02 501 8767 ◇경기 광주시 태전동 단지 내 상가＝아파트 1200가구 신규 단지 내 1층 40㎡인 코너 점포가 6억3000만원이다. 보증금 1억원 월세 320만원에 슈퍼마켓으로 독점 영업 중이다. 031 693 7800 ◇서울 서초동 수익용 빌딩＝교대역세권 대지 284㎡ 연면적 752㎡인 6층 신축 건물이 35억원이다. 융자 15억원 보증금 1억5000만원 월 1400만원이다. 사옥용에 적합하다. 02 598 4952 ◇서울 논현동 신축 빌딩＝학동역에서 3분 거리인 대지 420㎡ 연면적 1300㎡ 7층 건물이 55억원에 급매로 나왔다. 보증금 3억1000만원 월 2630만원이 나온다. 시세보다 저렴하다. 02 597 7877 ◇서울 대현동 수익용 빌딩＝2호선 신촌역에서 3분 거리 대학가 중심상권에 위치한 대지 628㎡ 연면적 3239㎡인 상가빌딩이 123억원이다. 보증금 10억원 월 6200만원이다. 02 547 1196 ◇서울 논현동 수익용 빌딩＝교보타워 사거리에 위치한 대지 315㎡ 연면적 1200㎡인 건물이 46억원이다. 보증금 6억원 월 2950만원이다. 사옥 임대수익용에 적합하다. 9호선 예정지다. 02 518 6338 ◇수원시 장안동 수익용 빌딩＝대지 880㎡ 연면적 6200㎡인 8층 4차선 대로변 신축 건물이 110억원이다. 융자 55억원 보증금 19억원 월 5200만원이다. 주차 40대 가능하다. 031 898 1954 ◇서울 사당동 상업지 빌딩＝사당역 인근 대지 290㎡ 연면적 999㎡인 7층 일반상업지역 빌딩이 44억원이다. 보증금 3억6000만원 월 1800만원에 임대 중이다. 수익용에 적합하다. 02 585 8113 ◇서울 신사동 대로변 빌딩＝대지 660㎡ 연면적 1900㎡인 6층 코너 빌딩이 136억원이다. 갤러리 또는 임대수익용 사옥용 등으로 적합하다.,https://news.naver.com/main/read.nhn?mode=LSD&mid=shm&sid1=260&oid=009&aid=0001947970,113
80296,2008.03.02. 오후 6:42,부동산,서울경제,외국인 임대주택 사업 Tip,계약 맺은 해 소득세에 합산 과세 ▦외국인 근로자 임대주택의 소득세 외국인 임대주택 사업의 경우에도 임대수익에 대해 임대소득세가 부과된다. 보통 2 3년 단위로 계약을 체결하고 계약시 임대료를 한꺼번에 지급하는 게 보통이라 임대인은 계약 체결 당해년도에 임대소득세가 임대인의 소득세에 누적돼 합산 과세된다. 우선 1가구 1주택자와 1가구 2주택자라도 두 채 모두 전용85㎡ 국민주택 이하일 경우 제외되며 2채 중 1채라도 전용85㎡를 초과한다면 부과대상이 된다. 1가구 3주택은 주택형과 관계없이 1가구 1주택자라도 공시지가가 6억원 초과 주택일 경우 부과대상이 된다. 월세×100×0.5%가 기준 ▦부동산 수수료 외국인 부동산 수수료는 월세에 100을 곱한 후 0.2 0.8% 사이에서 책정되며 일반적으로는 0.5%가 기준이다. 간혹 0.8%나 월세x계약기간 월 x3%의 수수료를 적용하는 경우도 있으며 일반적으로 AS나 중도해지수수료 반환조항이 없을 경우는 국내부동산과 동일한 수준. 국내부동산과 다른 것은 계약기간동안 외국인과 주택에 관련된 의사소통과 하자보수를 대행하는 경우가 대부분이며 계약연장시 수수료를 다시 청구하고 중도해지시에는 되돌려주는 경우가 있다. 원화·달러 모두 계약 가능 ▦임대계약금은 원화 달러 외국인 임대 계약기간은 보통 2 3년이며 계약기간동안의 월세를 한꺼번에 지급하는 게 보통. 이때는 원화와 달러 모두 계약이 가능하며 이때 많게는 20만원까지 환율차이가 발생할 수 있다. 외국인 전문 부동산의 경우 임대인에게 유리한 조건으로 조언하는 게 일반적이다. 가구·가전등 평균 비용 350만원선 ▦외국인 임대주택에 필요한 생활 용품 미군을 상대로 한 임대의 경우 구비 가구로는 7자 장롱ㆍ1 3인용 소파와 탁자ㆍ4인용식탁ㆍ책상ㆍ침대와 협탁ㆍ1 500mm TV받침대ㆍ5단서랍장ㆍ전신거울 등이며 구비 가전으로는 미군임대시 구비가전은 세탁건조기 10kg ㆍ냉장고 540L이상 ㆍ오븐레인지 등이다. 평균 소요 비용은 350만원 선. 보통 3.3㎡당 1만원 임대인이 부담 ▦관리비 관리비는 일체 임대인이 부담하게 된다. 보통 3.3㎡당 1만원으로 책정되며 이와는 별도로 인터넷ㆍ케이블ㆍ생수 비용 약 5만 7만원 선이 추가로 들어가는 비용이다.,https://news.naver.com/main/read.nhn?mode=LSD&mid=shm&sid1=260&oid=011&aid=0001942475,113
